video_id,country,fetched_at,published_at,title,localized_title,channel_title,channel_id,category_id,category_name,tags,tag_count,thumbnail,default_language,audio_language,is_live,duration,duration_raw,definition,caption_available,licensed_content,embeddable,made_for_kids,views,likes,comments
av-TsgWWfqw,NG,2026-06-19T05:34:13.642536+00:00,2026-06-10T16:00:10Z,Poco Lee & Seyi Vibez - OPERA MINI (Official Video),Poco Lee & Seyi Vibez - OPERA MINI (Official Video),PocoLee,UCy39YOESI61DBxUuXJCAZ-Q,24,Entertainment,,0,https://i.ytimg.com/vi/av-TsgWWfqw/hqdefault.jpg,en,und,False,165,PT2M45S,hd,False,False,False,False,884106,17116,1072
62bIsvRcPv0,NG,2026-06-19T05:34:13.642581+00:00,2026-06-17T18:58:31Z,SPIDER-MAN: BRAND NEW DAY – New Trailer (4K),SPIDER-MAN: BRAND NEW DAY – New Trailer (4K),Sony Pictures Entertainment,UCz97F7dMxBNOfGYu3rx8aCw,24,Entertainment,,0,https://i.ytimg.com/vi/62bIsvRcPv0/hqdefault.jpg,en,en,False,162,PT2M42S,hd,True,True,False,False,13404091,484224,21070
LqDso41wwss,NG,2026-06-19T05:34:13.642593+00:00,2026-06-17T21:17:17Z,SHARKBITE FUN CHALLENGE!,SHARKBITE FUN CHALLENGE!,BaconVrx,UCWNcQx-N9nFa9sSv_teNkNw,20,Gaming,,0,https://i.ytimg.com/vi/LqDso41wwss/hqdefault.jpg,en,en,False,5,PT5S,hd,False,True,False,False,1176337,8306,0
mQFlJAd2kRw,NG,2026-06-19T05:34:13.642602+00:00,2026-06-10T00:00:27Z,Ripper's Fate,Ripper's Fate,6uff - Topic,UCBk1TwaWeWUKrc86eDNap5w,10,Music,"6uff, Tuff King, Ripper's Fate",3,https://i.ytimg.com/vi/mQFlJAd2kRw/hqdefault.jpg,en,,False,150,PT2M30S,hd,False,True,False,False,229984,4547,254
2VAc4FvNOmc,NG,2026-06-19T05:34:13.642611+00:00,2026-06-13T18:31:45Z,ABATTOIR VI Trailer,ABATTOIR VI Trailer,Damilola Mike-Bamiloye,UCGyPHwlkRV_Ai7aLRXpXJow,24,Entertainment,,0,https://i.ytimg.com/vi/2VAc4FvNOmc/hqdefault.jpg,en,en-GB,False,92,PT1M32S,hd,False,False,False,False,49616,4236,430
EiQEBYDox_k,NG,2026-06-19T05:34:13.642619+00:00,2026-06-18T13:03:29Z,Grand Theft Auto VI: Official Cover Art Reveal,Grand Theft Auto VI: Official Cover Art Reveal,Rockstar Games,UC6VcWc1rAoWdBCM0JxrRQ3A,20,Gaming,"GTA 6, Grand Theft Auto VI, Grand Theft Auto 6, GTAVI, GTA VI, Pre-Order, Pre-Orders",7,https://i.ytimg.com/vi/EiQEBYDox_k/hqdefault.jpg,en,en,False,33,PT33S,hd,False,True,False,False,5856508,743597,56278
Enfs3UE6jFQ,NG,2026-06-19T05:34:13.642627+00:00,2026-06-11T10:02:52Z,Tornado,Tornado,Ayra Starr - Topic,UCO4TFKYiSDo7vOQC04mr7Fg,10,Music,"Ayra Starr, Tornado",2,https://i.ytimg.com/vi/Enfs3UE6jFQ/hqdefault.jpg,en,,False,175,PT2M55S,hd,False,True,False,False,314458,9502,713
7SCeHCDgqs8,NG,2026-06-19T05:34:13.642635+00:00,2026-06-11T19:00:07Z,BADIYYA OFFICIAL TRAILER ,BADIYYA OFFICIAL TRAILER ,ABNUR ENTERTAINMENT,UC6CxpgmZUkTH0NnksC0o_fg,1,Film & Animation,,0,https://i.ytimg.com/vi/7SCeHCDgqs8/hqdefault.jpg,ha,ha,False,275,PT4M35S,hd,False,True,False,False,131791,5439,294
PDGWaqGC3NA,NG,2026-06-19T05:34:13.642643+00:00,2026-06-17T16:35:46Z,I Signed a World Cup Wonderkid…,I Signed a World Cup Wonderkid…,MoreS2G,UCw9rjdrpHa7mzNrWVJoaPgw,20,Gaming,,0,https://i.ytimg.com/vi/PDGWaqGC3NA/hqdefault.jpg,en,en-GB,False,1313,PT21M53S,hd,False,True,False,False,315708,16601,1456
EuBB0nzlBks,NG,2026-06-19T05:34:13.642650+00:00,2026-06-12T23:00:37Z,David Jones David - EZE YOYO (Official Video),David Jones David - EZE YOYO (Official Video),DAVID JONES DAVID,UCWszW2YlUE-xe3ADnKR1kdQ,24,Entertainment,,0,https://i.ytimg.com/vi/EuBB0nzlBks/hqdefault.jpg,en,en-US,False,182,PT3M2S,hd,False,True,False,False,614478,26160,1509
dddZcUzclz8,NG,2026-06-19T05:34:13.642657+00:00,2026-06-13T17:00:06Z,"Unfollow Me, Mom! (Official Trailer)","Unfollow Me, Mom! (Official Trailer)",Neptune3 Studios,UCCl71WmqkG8BjVuySOSCh_Q,1,Film & Animation,"Unfollow Me Mom, Unfollow Me Mom trailer, Unfollow Me Mom movie, Neptune3 Studios, Neptune3, Jeiel Damina, Kelvin Kenzy Ezike, Nigerian teen movie, Nigerian romantic comedy, teen romance, first love, high school romance, high school crush, coming of age, teen comedy, mother daughter relationship, school romance, Nigerian YouTube movies, Nollywood romance, Nollywood teen movie, Nollywood comedy, feel good movie, Gen Z movie, romantic comedy, romcom, official trailer, kenzy",27,https://i.ytimg.com/vi/dddZcUzclz8/hqdefault.jpg,en,en,False,102,PT1M42S,hd,False,True,False,False,108242,5442,264
tEpUqhBfdc8,NG,2026-06-19T05:34:13.642665+00:00,2026-06-14T09:30:30Z,Golden Family VS Violet Family: RUMI Gets The Sun Leopard Racing Championship - KPop Demon Hunters,Golden Family VS Violet Family: RUMI Gets The Sun Leopard Racing Championship - KPop Demon Hunters,Velvet Vows & Vengeance,UCyoBOW0WaucKM7-Qc2bossA,22,People & Blogs,"Golden Family VS Silver Family, KPop Demon Hunters, Golden Family VS Diamond Family, netflix animations, netflix, KPop Demon Hunters Animation, HUNTRIX, RUMI, JINU, MIRA, kpop racing championship, racing championship, Golden Family VS Ruby Family, Diamond Family VS Ruby Family, Golden Family VS Emerald Family",15,https://i.ytimg.com/vi/tEpUqhBfdc8/hqdefault.jpg,en,,False,1309,PT21M49S,hd,False,True,False,False,212172,926,29
T-PfjeY9g9w,NG,2026-06-19T05:34:13.642673+00:00,2026-06-11T10:00:40Z,Ijoba,Ijoba,Naira Marley - Topic,UCLmx929V5XB__omAboRPkPA,10,Music,"Naira Marley, Kizz Daniel, Ijoba",3,https://i.ytimg.com/vi/T-PfjeY9g9w/hqdefault.jpg,en,,False,140,PT2M20S,hd,False,True,False,False,138843,3144,185
F03g3NoKka8,NG,2026-06-19T05:34:13.642680+00:00,2026-06-14T17:00:33Z,Akanji Ole 2 Yoruba Movie 2026 Official Trailer Showing Tomorrow On Yorubaplus,Akanji Ole 2 Yoruba Movie 2026 Official Trailer Showing Tomorrow On Yorubaplus,Yorubaplus,UCeAH89bVuCLxp7MPOBZFZNQ,24,Entertainment,"yoruba movies, yorubahood, free movies, ibakatv, latest yoruba movies today, yoruba movies 2025 new release today, trailers 2025 movies official, best yoruba movies 2024 new release, latest yoruba comedy movies, yoruba new release this week, trailers 2024 movies official",11,https://i.ytimg.com/vi/F03g3NoKka8/hqdefault.jpg,en,yo,False,65,PT1M5S,hd,False,True,False,False,21629,249,13
Kgm3v7xj09I,NG,2026-06-19T05:34:13.642688+00:00,2026-06-18T14:41:40Z,Prof BOF Goes For MESSI & MBAPPE😱In The SHOW TIME WORLD CUP Pack Opening,Prof BOF Goes For MESSI & MBAPPE😱In The SHOW TIME WORLD CUP Pack Opening,Bof games,UCozhavMC5oIn1JxjLuP6D8Q,20,Gaming,,0,https://i.ytimg.com/vi/Kgm3v7xj09I/hqdefault.jpg,en,en,False,489,PT8M9S,hd,False,True,False,False,38073,2105,180
ruN_BqxHdtg,NG,2026-06-19T05:34:13.642695+00:00,2026-06-05T15:00:06Z,Mr P - I Can't Look Away (Official Video),Mr P - I Can't Look Away (Official Video),Mr. P ,UC9FSKODyeY4TiSgnmg9bFTQ,10,Music,"Mr P, Mr .P, Stonebwoy, STONEBWOY, Odo Remix, ODO Remix, Mr P Odo Remix, Afrobeats, Afropop, New Video, I Can't Look Away, New Mr P, MR P, New Music, Official Video, I Can't Look Away Official Video",16,https://i.ytimg.com/vi/ruN_BqxHdtg/hqdefault.jpg,en,en,False,188,PT3M8S,hd,False,True,False,False,1218871,46422,7310
9xmHzcMzpfQ,NG,2026-06-19T05:34:13.642702+00:00,2026-06-13T19:12:56Z,Abattoir Season 6 Trailer || STARTING SUNDAY || MOUNT ZION FILMS ,Abattoir Season 6 Trailer || STARTING SUNDAY || MOUNT ZION FILMS ,God's Own TV,UC3YWhyiJzFQqxkU26R3zFEA,22,People & Blogs,"Abattoir Season 6, Abattoir Season 6 Episode 1, Abattoir Season 6 Damilola Mike Bamiloye, Mount Zion Films, Latest mount zion movies, abattoir season 6 trailer",6,https://i.ytimg.com/vi/9xmHzcMzpfQ/hqdefault.jpg,en,en-GB,False,147,PT2M27S,hd,False,True,False,False,13707,484,66
aX8nHMkxErU,NG,2026-06-19T05:34:13.642710+00:00,2026-06-18T18:05:18Z,MESSI SHOCKED ME! 😱 FULL INTERNATIONAL CUP VOL.1 REVIEW 🔥 eFootball 2026,MESSI SHOCKED ME! 😱 FULL INTERNATIONAL CUP VOL.1 REVIEW 🔥 eFootball 2026,Mednasah,UCGtV2qzfDCaOlZqLwVNsErA,20,Gaming,"efootball, efootball 2026, international cup vol 1, messi, messi review, lionel messi, new messi, blitz curler messi, blitz curler, efootball messi, messi build, messi additional skills, messi booster crafting, mbappe, mbappe review, kylian mbappe, nmecha, felix nmecha, efootball review, efootball pack review, efootball gameplay, efootball meta, efootball best players, efootball guide, efootball tips, efootball mobile, efootball console, efootball pc, mednasah",29,https://i.ytimg.com/vi/aX8nHMkxErU/hqdefault.jpg,en,en,False,1408,PT23M28S,hd,False,True,False,False,43699,2903,263
NYL7_G-whHw,NG,2026-06-19T05:34:13.642718+00:00,2026-06-02T10:05:26Z,FRE$H,FRE$H,Victony - Topic,UCh-VZa381UUDND3OtMKLudg,10,Music,"Victony, Anthony Ebuka Victor, Igbinoba Osazee Festus, FRE$H",4,https://i.ytimg.com/vi/NYL7_G-whHw/hqdefault.jpg,en,,False,138,PT2M18S,hd,False,True,False,False,529332,10290,333
C4ihbMVEoAg,NG,2026-06-19T05:34:13.642725+00:00,2026-06-10T12:00:29Z,"FRUIT COVENANT - Official Trailer (2026) | Toyin Abraham, Jumoke George, Olarotimi Fakunle","FRUIT COVENANT - Official Trailer (2026) | Toyin Abraham, Jumoke George, Olarotimi Fakunle",Toyin Abraham TV,UCoSnFVOBlcdgjSUETGd65kA,24,Entertainment,,0,https://i.ytimg.com/vi/C4ihbMVEoAg/hqdefault.jpg,en,,False,108,PT1M48S,hd,False,True,False,False,72784,1500,134
KxfDKXR4tvo,NG,2026-06-19T05:34:13.642732+00:00,2026-06-13T19:30:35Z,THE SIDEMEN AMONG US WORLD CUP,THE SIDEMEN AMONG US WORLD CUP,MoreSidemen,UCh5mLn90vUaB1PbRRx_AiaA,24,Entertainment,"sidemen, moresidemen, miniminter, zerkaa, behzinga, tbjzl, vikkstar, wroetoshaw",8,https://i.ytimg.com/vi/KxfDKXR4tvo/hqdefault.jpg,en,en-GB,False,3164,PT52M44S,hd,False,True,False,False,3502876,111511,3714
VluEQcsMohU,NG,2026-06-19T05:34:13.642740+00:00,2026-06-12T17:00:23Z,"LeoStayTrill, Shoday - Till The Wheels Fall Off (Official Video)","LeoStayTrill, Shoday - Till The Wheels Fall Off (Official Video)",LeoStayTrillVEVO,UCZwHorgLtmpBNooUo_kDGug,10,Music,"LeoStayTrill, LeoStayTrill Till The Wheels Fall Off, Till The Wheels Fall Off, Till The Wheels Fall Off LeoStayTrill, LeoStayTrill Shoday, Shoday LeoStayTrill, LeoStayTrill new music, LeoStayTrill 2026, LeoStayTrill afroswing, LeoStayTrill afro rap, LeoStayTrill UK artist, Shoday, Shoday new music, Shoday 2026, UK rap, UK Afrobeat, Nigerian artist, Till The Wheels Fall Off lyrics, Till The Wheels Fall Off visualizer",19,https://i.ytimg.com/vi/VluEQcsMohU/hqdefault.jpg,en,en,False,174,PT2M54S,hd,False,True,False,False,241590,10319,278
xg2tN3dI_Yg,NG,2026-06-19T05:34:13.642747+00:00,2026-06-18T15:00:00Z,Outer Banks: Season 5 | Official Teaser | Netflix,Outer Banks: Season 5 | Official Teaser | Netflix,Netflix,UCWOA1ZGywLbqmigxE4Qlvuw,24,Entertainment,"Adventure, Austin North, Carlacia Grant, Carolina, Charleston, Chase Stokes, Cleo, Drama, Drew Starkey, Fiona Palomo, Gold Hunt, JJ Maybank, John B, Jonathan Daviss, Kiara, Kie, Kooks, Madelyn Cline, Madison Bailey, Netflix, Netflix Series, OBX, Outer Banks, Outer Banks Final Season, Outer Banks Season 5, Outer Banks Teaser, Poguelandia, Pogues, Pope, Rafe, Rudy Pankow, Sarah Cameron, Treasure Hunt",33,https://i.ytimg.com/vi/xg2tN3dI_Yg/hqdefault.jpg,en,en-US,False,73,PT1M13S,hd,True,True,False,False,377000,21273,1306
CnggmoGDXcI,NG,2026-06-19T05:34:13.642754+00:00,2026-06-16T14:32:01Z,New BAGGIO + ROMARIO + MATHEUS 🔥 NATIONAL STARTS 1994 | efootball 26 mobile,New BAGGIO + ROMARIO + MATHEUS 🔥 NATIONAL STARTS 1994 | efootball 26 mobile,9AL Games,UCvzTJH6G9bH5nCQ1Hfb8nGg,20,Gaming,"romario efootball, * romario efootball, matthaus efootball, baggio efootball, * matthaus efootball, * baggio efootball, efootball, * efootball, efootball mobile, efootball arabic, efootball 26, efootball عرب, efootball™, efootball 2026, وحوش efootball, * efootball ps5, build efootball, تحديث efootball, efootball 2026 mobile, efootball 2026 update, efootball 2026 mbappe, efootball 2026 national pack, مهارات efootball, نصائح efootball, efootball gameplay, romario, matheus",27,https://i.ytimg.com/vi/CnggmoGDXcI/hqdefault.jpg,en,en,False,1102,PT18M22S,hd,False,True,False,False,161339,11354,829
J7zenTAWW84,NG,2026-06-19T05:34:13.642763+00:00,2026-06-06T00:19:24Z,Chukwu Ne Eme Nma,Chukwu Ne Eme Nma,Release - Topic,UCIh9tlY8bpRGEugHe3vUmNQ,10,Music,"Mc Omekannaya1, Chukwu Ne Eme Nma",2,https://i.ytimg.com/vi/J7zenTAWW84/hqdefault.jpg,en,,False,241,PT4M1S,hd,False,True,False,False,47889,839,0
1NHS5OP73Sc,NG,2026-06-19T05:34:13.642791+00:00,2026-06-18T04:11:10Z,SPIDER-MAN BRAND NEW DAY TRAILER BREAKDOWN! Easter Eggs & Details You Missed!,SPIDER-MAN BRAND NEW DAY TRAILER BREAKDOWN! Easter Eggs & Details You Missed!,New Rockstars,UC7yRILFFJ2QZCykymr8LPwA,24,Entertainment,"new rockstars, new rockstars youtube, youtube new rockstars",3,https://i.ytimg.com/vi/1NHS5OP73Sc/hqdefault.jpg,en,en,False,2126,PT35M26S,hd,False,True,False,False,1021204,31510,1594
EsU3BaSj7CY,NG,2026-06-19T05:34:13.642799+00:00,2026-06-15T18:44:27Z,I Replayed the Career of Neymar Jr...,I Replayed the Career of Neymar Jr...,S2G,UChR1Yn7YpVrnP-SbsWtjuBA,20,Gaming,,0,https://i.ytimg.com/vi/EsU3BaSj7CY/hqdefault.jpg,en-GB,en,False,1562,PT26M2S,hd,False,True,False,False,599485,23046,732
z22zRnTlgMg,NG,2026-06-19T05:34:13.642806+00:00,2026-05-26T14:00:31Z,Asake - Gratitude (Official Video),Asake - Gratitude (Official Video),ASAKE,UCU9R50wyBPKpdbcIScAyZig,10,Music,,0,https://i.ytimg.com/vi/z22zRnTlgMg/hqdefault.jpg,en,,False,189,PT3M9S,hd,False,False,False,False,4069315,47236,2467
Swiz1XyfhcI,NG,2026-06-19T05:34:13.642813+00:00,2026-06-16T15:00:03Z,Shrek 5 | Official Teaser Trailer,Shrek 5 | Official Teaser Trailer,Universal Pictures,UCq0OueAsdxH6b8nyAspwViw,24,Entertainment,,0,https://i.ytimg.com/vi/Swiz1XyfhcI/hqdefault.jpg,en-US,en-US,False,82,PT1M22S,hd,True,True,False,False,2182262,62241,0
iXjJQEZ-_6M,NG,2026-06-19T05:34:13.642820+00:00,2026-06-17T21:39:49Z,Portugal .vs. DR Congo | World Cup 2026 | eFootball PES21 Video game Simulation,Portugal .vs. DR Congo | World Cup 2026 | eFootball PES21 Video game Simulation,RMO,UCDw7iWgxsOgQGPBRFt5Mifw,20,Gaming,,0,https://i.ytimg.com/vi/iXjJQEZ-_6M/hqdefault.jpg,en,en,False,13761,PT3H49M21S,hd,False,True,False,False,550928,1924,3
GtwDdt6zQHM,NG,2026-06-19T05:34:13.642827+00:00,2026-05-28T10:04:19Z,Elumelu,Elumelu,Young Jonn - Topic,UCEkPI0iVCjgcRHl3jjTRLXA,10,Music,"Young Jonn, Elumelu",2,https://i.ytimg.com/vi/GtwDdt6zQHM/hqdefault.jpg,en,,False,134,PT2M14S,hd,False,True,False,False,521829,8160,186
mtC4sjABZNw,NG,2026-06-19T05:34:13.642834+00:00,2026-06-16T16:01:06Z,Hexed | Teaser Trailer,Hexed | Teaser Trailer,Walt Disney Animation Studios,UC_976xMxPgzIa290Hqtk-9g,1,Film & Animation,"Disney, Walt Disney Animation Studios, Disney Animation, Walt Disney, Animation",5,https://i.ytimg.com/vi/mtC4sjABZNw/hqdefault.jpg,en,en,False,138,PT2M18S,hd,True,True,False,False,2040511,38727,6373
5F5MKI_jXJw,NG,2026-06-19T05:34:13.642842+00:00,2026-06-06T16:00:01Z,I Survived 100 Days In Realistic Minecraft,I Survived 100 Days In Realistic Minecraft,MrBeast Gaming,UCIPPMRA040LQr5QPyJEbmXA,20,Gaming,,0,https://i.ytimg.com/vi/5F5MKI_jXJw/hqdefault.jpg,en,en,False,1609,PT26M49S,hd,True,True,False,False,47318216,830937,23940
Imwm1xPK5pQ,NG,2026-06-19T05:34:13.642849+00:00,2026-05-30T00:16:34Z,she goes by.,she goes by.,where.t.at - Topic,UCHXO3XALh_9LAtXpgsuvrxQ,10,Music,"where.t.at, she goes by.",2,https://i.ytimg.com/vi/Imwm1xPK5pQ/hqdefault.jpg,en,en,False,178,PT2M58S,hd,False,True,False,False,640461,18383,0
bMQ67De5ljU,NG,2026-06-19T05:34:13.642857+00:00,2026-06-17T19:04:25Z,AMINATU! OFFICIAL TRAILER  | AMINATU 2026 ,AMINATU! OFFICIAL TRAILER  | AMINATU 2026 ,Arewa Medium,UCPHZYxZFOSBdT0C-R-RWg9g,24,Entertainment,,0,https://i.ytimg.com/vi/bMQ67De5ljU/hqdefault.jpg,en,und,False,164,PT2M44S,hd,False,True,False,False,14455,626,48
hsPy5Rph9jU,NG,2026-06-19T05:34:13.642864+00:00,2026-06-03T22:13:27Z,"One Room today, mansion tomorrow ❤️🥰💕","One Room today, mansion tomorrow ❤️🥰💕",Asaremma-Tv,UCi6FvbRQ6qgHeEX7RI8uCrA,22,People & Blogs,,0,https://i.ytimg.com/vi/hsPy5Rph9jU/hqdefault.jpg,en,en,False,277,PT4M37S,hd,False,True,False,False,1160728,2593,105
AyvNaEQDn1M,NG,2026-06-19T05:34:13.642871+00:00,2026-06-12T05:00:06Z,Kaestrings - Fear of God | Live (Official Video),Kaestrings - Fear of God | Live (Official Video),Kaestrings,UCRcFzNorSvQQ9wckhicB5cg,10,Music,"Kaestrings, Apostle Joshua Selman, Hill song, Bethel Music, Dunamis Hub, Koinonia, Lawrence Oyor, Worship Leader, gospel Artist, God is good, praise and worship, Singers Songwriter, Spotify, blessed, prayer, Christ Hip hop, gospel rap, gospel radio, new single, singers, New, Latest, Trending",23,https://i.ytimg.com/vi/AyvNaEQDn1M/hqdefault.jpg,en,en,False,596,PT9M56S,hd,False,True,False,False,198756,13298,732
o66pHV4a5vA,NG,2026-06-19T05:34:13.642884+00:00,2026-06-17T17:33:17Z,BLACK MARRIAGE. Trailer,BLACK MARRIAGE. Trailer,RATATA Films ,UCX-99a5iRPK-ieVXL3iY_AQ,22,People & Blogs,,0,https://i.ytimg.com/vi/o66pHV4a5vA/hqdefault.jpg,en,en,False,346,PT5M46S,hd,False,True,False,False,5905,502,65
WPgRj4bh2Jw,NG,2026-06-19T05:34:13.642891+00:00,2026-06-16T22:12:07Z,Skiddzie Industries Swords in Minecraft,Skiddzie Industries Swords in Minecraft,Skiddzie,UCWUxsoGia86OYIbxhjg68WQ,20,Gaming,"minecraft, minecraft custom swords, skiddzie industries",3,https://i.ytimg.com/vi/WPgRj4bh2Jw/hqdefault.jpg,en,en,False,1342,PT22M22S,hd,False,True,False,False,279051,7786,556
0NzDMzdGdtY,NG,2026-06-19T05:34:13.642899+00:00,2026-05-29T16:18:51Z,Stay For The Night,Stay For The Night,Vybz Kartel - Topic,UCJuQbfQ7SEJdMmVqPT7rXZw,10,Music,"Vybz Kartel, WizKid, God and Time, Stay For The Night",4,https://i.ytimg.com/vi/0NzDMzdGdtY/hqdefault.jpg,en,,False,153,PT2M33S,hd,False,True,False,False,216961,6214,360
HLMX2w3cwuE,NG,2026-06-19T05:34:13.642906+00:00,2026-06-02T22:15:01Z,God of War Laufey - Gameplay Reveal Trailer | PS5 Games,God of War Laufey - Gameplay Reveal Trailer | PS5 Games,PlayStation,UC-2Y8dQb0S6DtpxNgAKoJKA,20,Gaming,"PlayStation, PS5, video games, next gen, Sony, state of play, god of war, God of War Laufey, Official Gameplay Reveal",9,https://i.ytimg.com/vi/HLMX2w3cwuE/hqdefault.jpg,en,en-US,False,1425,PT23M45S,hd,True,True,False,False,7896319,443073,32014
yeAiy_QFmtA,NG,2026-06-19T05:34:13.642914+00:00,2026-06-17T21:12:02Z,🔴Portugal Vs DR Congo I World Cup 2026 - Gameplay I Video Game EA Sports FC 26,🔴Portugal Vs DR Congo I World Cup 2026 - Gameplay I Video Game EA Sports FC 26,BOT IS LIVE,UCCWF5CY5kd3LYNrOHDB4UHw,20,Gaming,"bot is live, FIFA World Cup 2026, Live Football, World Cup Live, FIFA World Cup, fifa live, Portugal Vs DR Congo, Portugal Vs DR Congo Live, DR Congo Live, Portugal Live, DR Congo Vs Portugal, DR Congo Vs Portugal Live, DR Congo Vs Portugal Live Football Match, Portugal Vs DR Congo Live Football Match, Portugal Vs DR Congo Live Match, DR Congo Vs Portugal Live Match, Live Football Match DR Congo Vs Portugal, Live Football Match Portugal Vs DR Congo, Portugal, DR Congo, live",21,https://i.ytimg.com/vi/yeAiy_QFmtA/hqdefault.jpg,en,bn,False,1227,PT20M27S,hd,False,True,False,False,2054773,17280,2
27C4pfRsf9g,NG,2026-06-19T05:34:13.642922+00:00,2026-06-10T14:58:06Z,LE SSERAFIM (르세라핌) x ILLIT (아일릿) x KATSEYE (캣츠아이) 'ICONIC BY MISTAKE' Official MV,LE SSERAFIM (르세라핌) x ILLIT (아일릿) x KATSEYE (캣츠아이) 'ICONIC BY MISTAKE' Official MV,HYBE LABELS,UC3IZKseVpdzPSBaWxBxundA,10,Music,"HYBE, HYBE LABELS, 하이브, 하이브레이블즈",4,https://i.ytimg.com/vi/27C4pfRsf9g/hqdefault.jpg,ko,ko,False,200,PT3M20S,hd,True,True,False,False,32256424,1556764,107146
rN9viJlnir4,NG,2026-06-19T05:34:13.642929+00:00,2026-06-08T19:13:48Z,Streamer University 2026 | Official Enrollment Trailer,Streamer University 2026 | Official Enrollment Trailer,Kai Cenat Live,UCvCfpQXRXdJdL07pzTIA6Cw,24,Entertainment,"Kai Cenat, Kai Cenat Live, Kai Cenat Livestream, Kai Live, Kai Cenat Funny",5,https://i.ytimg.com/vi/rN9viJlnir4/hqdefault.jpg,en,en-US,False,158,PT2M38S,hd,False,True,False,False,2203534,132099,14172
8Ehr_OPDXi0,NG,2026-06-19T05:34:13.642936+00:00,2026-06-18T00:34:00Z,🔴LIVE : ENGLAND vs CROATIA | FIFA World Cup 2026 | Match Stream | PES Game Simulation,🔴LIVE : ENGLAND vs CROATIA | FIFA World Cup 2026 | Match Stream | PES Game Simulation,Football TV,UCvWuQfTMrRny57Cl3qtEmmg,17,Sports,,0,https://i.ytimg.com/vi/8Ehr_OPDXi0/hqdefault.jpg,en,en,False,11338,PT3H8M58S,hd,False,False,False,False,324772,820,9
46q88q1t4mc,NG,2026-06-19T05:34:13.642943+00:00,2026-05-29T12:16:23Z,Hardest Truth,Hardest Truth,Jubet - Topic,UCsA1cN89XMyHI0Tn3JTx6Pw,10,Music,"Jubet, Hardest Truth",2,https://i.ytimg.com/vi/46q88q1t4mc/hqdefault.jpg,en,,False,187,PT3M7S,hd,False,True,False,False,312132,7350,157
JFQcDFhNh4o,NG,2026-06-19T05:34:13.642950+00:00,2026-06-11T13:00:12Z,"Heart of the Beast | Official Trailer (2026 Movie) - Brad Pitt, J.K. Simmons, Anna Lambe","Heart of the Beast | Official Trailer (2026 Movie) - Brad Pitt, J.K. Simmons, Anna Lambe",Paramount Pictures,UCF9imwPMSGz4Vq1NiTWCC7g,1,Film & Animation,"Heart of the beast, HOTB, Brad Pitt",3,https://i.ytimg.com/vi/JFQcDFhNh4o/hqdefault.jpg,en,en-US,False,146,PT2M26S,hd,True,True,False,False,15060425,98187,4061
zMDjis-ZpZ0,NG,2026-06-19T05:34:13.642957+00:00,2026-06-18T18:08:44Z,World Cup Kits Decide My Team...,World Cup Kits Decide My Team...,EvenMoreS2G,UC5IFLyNeALC8ShbQMe39Q_Q,20,Gaming,,0,https://i.ytimg.com/vi/zMDjis-ZpZ0/hqdefault.jpg,en,en,False,1041,PT17M21S,hd,False,True,False,False,68803,3721,213
HRfb4NVD8LE,NG,2026-06-19T05:34:13.642965+00:00,2026-05-21T20:00:06Z,Blaqbonez - Chanel (feat. Asake) [Official Music Video],Blaqbonez - Chanel (feat. Asake) [Official Music Video],Blaqbonez,UC0iZ_gqCk22K0jWscf75lhg,10,Music,"Blaqbonez, Blaqbones, Blaqbonez chanel, chanel, asake, blaqbonez ft asake, blaqbonez ft, asake ft, asake ft blaqbonez, nigerian music, african music, asake new song, asake new snippet, asake chanel, blaqbonez and asake, blaqbonez ft asake chanel",16,https://i.ytimg.com/vi/HRfb4NVD8LE/hqdefault.jpg,en,en,False,171,PT2M51S,hd,False,True,False,False,3517976,53810,2193
Lyy9Ev-d9Lk,NG,2026-06-19T05:34:13.642972+00:00,2026-06-18T00:00:00Z,The East Palace | Official Teaser | Netflix [ENG SUB],The East Palace | Official Teaser | Netflix [ENG SUB],Netflix K-Content,UCpiCK8c6PBktcxq7Az_t4RQ,24,Entertainment,"Cho Seung-woo, July new release, Nam Joo-hyuk, Netflix, Roh Yoon-seo, TheEastPalace, a Netflix drama, a Netflix series, action, fantasy, mystery, period drama, 동궁",13,https://i.ytimg.com/vi/Lyy9Ev-d9Lk/hqdefault.jpg,en,en-US,False,101,PT1M41S,hd,True,False,False,False,203722,7482,315
