video_id,country,fetched_at,published_at,title,localized_title,channel_title,channel_id,category_id,category_name,tags,tag_count,thumbnail,default_language,audio_language,is_live,duration,duration_raw,definition,caption_available,licensed_content,embeddable,made_for_kids,views,likes,comments
Zil4RlXJkrc,AE,2026-03-16T03:42:48.905958+00:00,2026-03-12T09:57:26Z,Bhooth Bangla Teaser Review | Yogi Bolta Hai,Bhooth Bangla Teaser Review | Yogi Bolta Hai,YOGI BOLTA HAI,UCIihexFQucy1Sm7V7yvL_mA,24,Entertainment,"Bhooth Bangla, Bhooth Bangla Movie, Bhooth Bangla Teaser, Bhooth Bangla Teaser Review, Bhooth Bangla Hindi Movie, Akshay Kumar, Paresh Rawal, Rajpal Yadav, Tabu, Wamiqa Gabbi, Jisshu Sengupta, Manoj Joshi, Mithila Palkar, Asrani Ji, Rajesh Sharma, Priyadarshan, Shobha Kapoor, Ektaa Kapoor, Balaji Motion Pictures, Comedy Film, Horror Comedy, New Release, Latest Movie, Hindi Language Movie, Akshay Kumar Movie, Movie, Teaser Review, Trailer, Teaser, Review, Yogi Bolta Hai",31,https://i.ytimg.com/vi/Zil4RlXJkrc/hqdefault.jpg,en,zxx,False,182,PT3M2S,hd,False,True,False,False,518915,22442,1050
6Ct0b3PT3AQ,AE,2026-03-16T03:42:48.905968+00:00,2026-03-14T13:09:39Z,Mikey POOR vs JJ RICH POLICE STATION Build Battle in Minecraft,Mikey POOR vs JJ RICH POLICE STATION Build Battle in Minecraft,Maizen,UCJHBJ7F-nAIlMGolm0Hu4vg,20,Gaming,"Minecraft, Maizen",2,https://i.ytimg.com/vi/6Ct0b3PT3AQ/hqdefault.jpg,en,en,False,2875,PT47M55S,hd,False,True,False,False,1087006,9921,815
qa9VNwTkEI4,AE,2026-03-16T03:42:48.905976+00:00,2026-03-14T13:43:41Z,Alex Nigus - Alemye | አለምዬ - New Ethiopian Music 2026 (Lyrics Video),Alex Nigus - Alemye | አለምዬ - New Ethiopian Music 2026 (Lyrics Video),Alex Nigus,UC26uLlnda4AfT_sh0tyjK6Q,24,Entertainment,"Maya Media, Lij Mic, New Ethiopian Music, Ethiopian Music, Ethiopian Music 2026, New Ethiopian Music 2026, Teddy afro, Veronica Adane, Leul Sisay, Dawit Tsige, ELLA RECORDS, Hope Music Ethiopia, New Amharic Music 2026, Alex Nigus, Alex, Kuku Sebsibe, Seifu ON EBS, New Album, New Album 2026, Yared Negu, Yohana, Nahom Records, Weynye, Wekbti, Shefenfen, Lehuletu, Yedro Arada, Teddy Yo, Bayer Berari, Kua Kua, Zemaye, Apex Entertainment, Diss Track, Addis Arada",34,https://i.ytimg.com/vi/qa9VNwTkEI4/hqdefault.jpg,en,und,False,181,PT3M1S,hd,False,True,False,False,123407,6648,1453
RCmyr_d3Hi0,AE,2026-03-16T03:42:48.905983+00:00,2026-03-11T07:15:08Z,Ek Din | Official Trailer | Sai Pallavi | Junaid Khan | Aamir Khan Productions | 01st May 2026,Ek Din | Official Trailer | Sai Pallavi | Junaid Khan | Aamir Khan Productions | 01st May 2026,Aamir Khan Talkies,UCqjQu9qgL_eDXPwRnq45ZDQ,22,People & Blogs,"ek din trailer, ek din, saipallavi, sai pallavi movie trailer, sai pallavi movie scenes, sai pallavi scenes, junaid khan, aamir khan, junaid khan movie, junaid khan scenes, aamir khan movie scenes, amir khan scene",12,https://i.ytimg.com/vi/RCmyr_d3Hi0/hqdefault.jpg,en,en,False,133,PT2M13S,hd,True,True,False,False,16136123,53707,3604
lLSUYtJ4g4M,AE,2026-03-16T03:42:48.905991+00:00,2026-03-15T21:38:32Z,PER CHICKEN 5000 CHALLENGE | 50 CHICKEN STREAK? | BGMI LIVE @LoLzZzGaming,PER CHICKEN 5000 CHALLENGE | 50 CHICKEN STREAK? | BGMI LIVE @LoLzZzGaming,LoLzZz Gaming,UCI1vyXBgX3bruwvChLMNxjQ,20,Gaming,BGMI,1,https://i.ytimg.com/vi/lLSUYtJ4g4M/hqdefault.jpg,en-GB,hi,False,21464,PT5H57M44S,hd,False,True,False,False,373941,23742,35
3wpggooK0AI,AE,2026-03-16T03:42:48.905998+00:00,2026-03-13T10:45:00Z,Tour Song | Hanan Shah| Derby | Adam Sabiq | Ameen | Hari | Rish NK | Anu | Jasnya | Gopi Sundar,Tour Song | Hanan Shah| Derby | Adam Sabiq | Ameen | Hari | Rish NK | Anu | Jasnya | Gopi Sundar,Millennium Audios,UCvANYBOSmq2IasMM-djF-cQ,24,Entertainment,"Tour Song, derby movie tour song, Rang Thelinthavalalle, Derby, Adam Sabiq, Ameen, Hari, Jasnya, Anu, Rish NK, Gopi Sundar, Derby Malayalam Movie Song, oppana song, derby movie oppana song, berby malayalam movie, ameen malayalam movie, derby action comedy movie, gopisundar, gopi sundar, gopi sundar musical movie, gopi sundar latest song, gopi",22,https://i.ytimg.com/vi/3wpggooK0AI/hqdefault.jpg,en,ml,False,133,PT2M13S,hd,False,True,False,False,331195,26308,794
m-c_3degE60,AE,2026-03-16T03:42:48.906006+00:00,2026-03-12T13:01:33Z,Fortnite Chapter 7 Season 2: Showdown | Cinematic Trailer,Fortnite Chapter 7 Season 2: Showdown | Cinematic Trailer,Fortnite,UClG8odDC8TS6Zpqk9CGVQiQ,20,Gaming,yt:cc=on,1,https://i.ytimg.com/vi/m-c_3degE60/hqdefault.jpg,en,en,False,77,PT1M17S,hd,False,True,False,False,702670,34794,2661
r6k6vwIxhfc,AE,2026-03-16T03:42:48.906014+00:00,2026-03-03T00:42:50Z,"BAN vs PAK Odi live today match, today live match today live score update BD live","BAN vs PAK Odi live today match, today live match today live score update BD live",Cube Sutra,UCV_ZSRMIYPM_snDKnnnHMmQ,17,Sports,,0,https://i.ytimg.com/vi/r6k6vwIxhfc/hqdefault_live.jpg,en,bn,False,11530,PT3H12M10S,sd,False,False,False,False,113749,2514,0
in-VYGclxQw,AE,2026-03-16T03:42:48.906021+00:00,2026-03-12T11:30:19Z,Collar Ey Etthara - Lyric Video | Ustaad Bhagat Singh | Pawan Kalyan |Harish Shankar|Devi Sri Prasad,Collar Ey Etthara - Lyric Video | Ustaad Bhagat Singh | Pawan Kalyan |Harish Shankar|Devi Sri Prasad,Sony Music South,UCn4rEMqKtwBQ6-oEwbd4PcA,10,Music,"Sony Music South, Sony Music, Latest Song, Tamil song, Tamil Latest Song, Latest songs in Tamil4, Songs in Tamil, Latest Tamil Movies, Tamil Movie Songs, Latest Video Songs Tamil, latest Tamil Love Songs, Latest Tamil Hit Songs, Songs in Telugu4, Telugu Movie Songs, Video Songs Telugu, new Telugu Songs",16,https://i.ytimg.com/vi/in-VYGclxQw/hqdefault.jpg,en-GB,ta,False,261,PT4M21S,hd,False,True,False,False,7377567,307253,3584
X83zWEDRbCU,AE,2026-03-16T03:42:48.906028+00:00,2026-03-10T15:59:39Z,Youth  - 4K Trailer | யூத் | Ken Karunaas | Suraj Venjaramoodu | GV Prakash Kumar | Ayngaran,Youth  - 4K Trailer | யூத் | Ken Karunaas | Suraj Venjaramoodu | GV Prakash Kumar | Ayngaran,Ayngaran,UCGjn3ZbkkNcQaj00qwJ0DYQ,10,Music,"Tamil FIlm, Full Tamil Film, tamil songs, tamil movies, Latest Tamil video songs, video songs, Ajith, Vijay, Rajni, Kamal, A R Rahman, Yuvan Shankar Raja, Tamil superhit movies",13,https://i.ytimg.com/vi/X83zWEDRbCU/hqdefault.jpg,en,ta,False,131,PT2M11S,hd,False,True,False,False,132068,1364,57
VwoRBS8OVKw,AE,2026-03-16T03:42:48.906036+00:00,2026-03-15T21:10:36Z,PRX vs. NS - GRAND FINALS - VCT Masters Santiago Watchparty,PRX vs. NS - GRAND FINALS - VCT Masters Santiago Watchparty,TenZ,UCckPYr9b_iVucz8ID1Q67sw,20,Gaming,"valorant, tenz, valorant fragmovie, sentinels, sen",5,https://i.ytimg.com/vi/VwoRBS8OVKw/hqdefault.jpg,en,en-US,False,15117,PT4H11M57S,hd,False,True,False,False,292166,5996,50
XumvQZN-GgY,AE,2026-03-16T03:42:48.906044+00:00,2026-03-13T12:00:06Z,BINI | 'Unang Kilig' Dance Practice,BINI | 'Unang Kilig' Dance Practice,BINI Official,UCtOcDBKgyr-f50SgbMErFkQ,22,People & Blogs,"BINI PH, BINI TV, BINI, BINIPH, bini, modern filipinas, Gwen, Mikha, Maloi, Sheena, Stacey, Jhoanna, Aiah, Colet, Star Hunt Academy Girls, Star Hunt Academy, Star Hunt, SHA Girls, SHA Trainee Girls",19,https://i.ytimg.com/vi/XumvQZN-GgY/hqdefault.jpg,en,en-US,False,218,PT3M38S,hd,False,False,False,False,155775,15732,1090
0mWgD_DYJiY,AE,2026-03-16T03:42:48.906052+00:00,2026-03-11T12:06:24Z,Maamla Legal Hai Season 2 | Official Trailer | Ravi Kishan | Netflix India,Maamla Legal Hai Season 2 | Official Trailer | Ravi Kishan | Netflix India,Netflix India,UCZSNzBgFub_WWil6TOTYwAg,24,Entertainment,"Anant Joshi, Dinesh Lal Yadav, Maamla Legal Hai Season 2, Maamla Legal Hai Season 2 announcement, Maamla Legal Hai announcement, Naila Grewal, Next on Netflix, Nidhi Bisht, bassi, comedy, courtroom, courtroom drama, funny, kusha kapila, legal, maamla legal hai 2 teaser, maamla legal hai 2 trailer, maamla legal hai series, netflix recommendation, netflix series, new series, official teaser, ravi kishan, what to watch",24,https://i.ytimg.com/vi/0mWgD_DYJiY/hqdefault.jpg,en,en-US,False,153,PT2M33S,hd,True,True,False,False,16644624,24575,1311
