video_id,country,fetched_at,published_at,title,localized_title,channel_title,channel_id,category_id,category_name,tags,tag_count,thumbnail,default_language,audio_language,is_live,duration,duration_raw,definition,caption_available,licensed_content,embeddable,made_for_kids,views,likes,comments
55KzMQB6b18,AE,2026-03-16T03:42:48.905363+00:00,2026-03-14T14:30:06Z,Aadu 3 Video Song | Sulthaan | Shaan Rahman | Midhun Manuel Thomas |Vijay Babu & Venu Kunnappilly,Aadu 3 Video Song | Sulthaan | Shaan Rahman | Midhun Manuel Thomas |Vijay Babu & Venu Kunnappilly,Friday Music Company,UCPe9lMwPO86En1jDMdbZaCA,10,Music,"aadu 3, vedhika, jayasurya, shaan rahman dance song, vedhika dance song, vinayakan, dance song, aadu 3 item song, aadu 3 songs, item song, aadu jeevitham song, aadu 2 song, aadu 2 new song, changathi song aadu 2, aadu 2 video song, aadu 2 movie songs, aadu 2 video songs, aadu 3 launching, aadu 3 interview, changaathi nannaayaal song aadu 2, aadu 3 teaser, aadu 3 location, aadu 3 bgm, aadu 3 latest news, aadu 3 cast, aadu 3 scens",26,https://i.ytimg.com/vi/55KzMQB6b18/hqdefault.jpg,en,ml,False,274,PT4M34S,hd,False,True,False,False,1713146,67655,3493
MLU5ZEp9YDo,AE,2026-03-16T03:42:48.905641+00:00,2026-03-14T13:00:20Z,Ustaad Bhagat Singh Trailer | Pawan Kalyan | Harish Shankar | Sreeleela | Raashii Khanna,Ustaad Bhagat Singh Trailer | Pawan Kalyan | Harish Shankar | Sreeleela | Raashii Khanna,Mythri Movie Makers,UCKZSn5C-RzrLjuWJF8wWiDw,24,Entertainment,"Ustaad Bhagat Singh Trailer, Ustaad Bhagat Singh, Pawan Kalyan, Sreeleela, Harish Shankar, DSP, Devi Sri Prasad, Raashii Khanna, Thaman S, Mythri Movie Makers, Ustaad Bhagat Singh Movie Showreel, Ustaad Bhagat Singh Telugu Movie Showreel, Pawan Kalyan Ustaad Bhagat Singh, Ustaad Bhagat Singh Teaser, Pawan Kalyan Latest Movies, Latest Telugu Movies 2026, 2026 Latest Telugu Movies, Naveen Yerneni, Dekhlenge Saala, UBS Trailer, Ustaad Trailer",21,https://i.ytimg.com/vi/MLU5ZEp9YDo/hqdefault.jpg,en-GB,te,False,134,PT2M14S,hd,True,True,False,False,13176292,487741,11563
qkXpSSmDKXw,AE,2026-03-16T03:42:48.905656+00:00,2026-03-15T13:07:02Z,Minecraft Pro VS 1000 Player Civilization,Minecraft Pro VS 1000 Player Civilization,Wemmbu,UCkzzNLnuM-VsATWC53ehwOQ,20,Gaming,"minecraft civilisation, minecraft civilization, wemmbu, wemmbu 1000 players, wemmbu unstable smp, wemmbu music, 1000 player minecraft civilization, 1000 players, unstable smp, flamefrags, spokeishere, parrotx2, unstable universe, eggchan",14,https://i.ytimg.com/vi/qkXpSSmDKXw/hqdefault.jpg,en-US,en-US,False,2697,PT44M57S,hd,False,True,False,False,2110780,123657,18302
aqOuZdlbGC4,AE,2026-03-16T03:42:48.905667+00:00,2026-03-15T11:30:07Z,Rijusaba | Hanan Shaah | Jubair Muhammed | Jasir Muhammad | Gallery Vision,Rijusaba | Hanan Shaah | Jubair Muhammed | Jasir Muhammad | Gallery Vision,Gallery Vision,UCmHAE3x25-nQX74G7zoVOfw,10,Music,"Gallery Vision, latest album songs, malayalam album song, jubair muhammed, mappila song, mappila paattu, jubair muhammed songs, rijusaba, rijusaba video, rijusaba song, rijusaba hanan shaah, hanan shaah video, hanan shaah new video, hanan shaah vlog, hanan shaah new song, hanan shaah vlog new, hanan shaah rijusaba, jasir muhammad, jasir muhammad songs, jubair muhammed musical, rijusaba jubair muhammed, Peer Muhammed, rijusaba lyrical video, rijusaba jasir muhammad",24,https://i.ytimg.com/vi/aqOuZdlbGC4/hqdefault.jpg,en,ml,False,221,PT3M41S,hd,False,True,False,False,77014,8515,673
gictwC-KlTk,AE,2026-03-16T03:42:48.905677+00:00,2026-03-15T17:00:55Z,NEVER FIGHT ALONE // Miks Agent Trailer - VALORANT,NEVER FIGHT ALONE // Miks Agent Trailer - VALORANT,VALORANT,UC8CX0LD98EDXl4UYX1MDCXg,20,Gaming,"Miks, Miks Agent, Croatia, Croatian, Controller, VALORANT trailer, S26, Season 2026, VALORANT, VALORANT game, valorant act 2, VALORANT act II, fps, shooters, tactical FPS, launch, VALORANT agent, AGENT, agent, Reyna, Sage, Gekko, Wingman, Bunt, bunt., Bunt., Clarity, Zedd Clarity, Zedd, Clarity Remix",30,https://i.ytimg.com/vi/gictwC-KlTk/hqdefault.jpg,en,en-US,False,180,PT3M,hd,True,True,False,False,551210,42491,2025
W_bbXASKQrM,AE,2026-03-16T03:42:48.905686+00:00,2026-03-15T04:39:00Z,ROBLOX DRAW WHEELS TO ESCAPE..,ROBLOX DRAW WHEELS TO ESCAPE..,Foltyn,UCRkuUgtDAL4XSU5jB40J_wA,20,Gaming,"foltyn, foltyn roblox, roblox, roblox foltyn, foltyn family, funny, no swearing, foltyn family roblox, roblox foltyn family, blade ball, roblox blade ball, foltyn blade ball, roblox draw wheels to escape, foltyn and caylus playing roblox, foltyn and caylus, roblox draw wheels, roblox wheel drawing obby, foltyn and caylus playing steal a brainrot, foltyn and caylus playing roblox steal a brainrot",19,https://i.ytimg.com/vi/W_bbXASKQrM/hqdefault.jpg,en,en-US,False,1177,PT19M37S,hd,False,True,False,False,875747,10785,2748
QKY9jEIXfVQ,AE,2026-03-16T03:42:48.905695+00:00,2026-03-13T12:30:06Z,Lil Rome Praba x Smokio - කචල් කාසි (Kachal Kasi) OFFICIAL MUSIC VIDEO,Lil Rome Praba x Smokio - කචල් කාසි (Kachal Kasi) OFFICIAL MUSIC VIDEO,Lil Rome,UCpqdK1XXfPH-oJ_c96ZTRNQ,10,Music,"Lil Rome Praba, Praba, Smokio, Lil Rome, Kachal Kasi, Praba x Smokio, Lil Rome Praba x Smokio, Praba Kachal Kasi, Smokio Kachal Kasi, A Filmmakers Diary",10,https://i.ytimg.com/vi/QKY9jEIXfVQ/hqdefault.jpg,en,und,False,291,PT4M51S,hd,False,True,False,False,641255,61720,7634
t5pkwVCNfnE,AE,2026-03-16T03:42:48.905703+00:00,2026-03-14T12:30:06Z,Bhishmar Official Trailer | East Coast Vijayan | Dhyan Sreenivasan| Vishnu Unnikrishnan|Divya Pillai,Bhishmar Official Trailer | East Coast Vijayan | Dhyan Sreenivasan| Vishnu Unnikrishnan|Divya Pillai,East Coast,UC7wr_pLs8KVXkkXWZxHLR0A,10,Music,"bhishmar, eastcoastvijayan, dhyansreenivsan, vishnuunnikrishnan, malayalamfilm, Trailer, malayalam movie, new movie trailer, new malayalam movie, latest malayalam movie, divyapillai, shajusreedhar, unnilalu, malayalam movie trailer, movie trailer, movie malayalam, new movie malayalam, malayalam new trailer, bhishmar trailer, bheeshmar malayalam, bheeshmar malayalam trailer, bhishmar malayalam movie trailer, new malayalam movie trailer, bheeshmar",24,https://i.ytimg.com/vi/t5pkwVCNfnE/hqdefault.jpg,en,ml,False,118,PT1M58S,hd,True,True,False,False,995501,13623,1214
yi4qH9uhhV8,AE,2026-03-16T03:42:48.905712+00:00,2026-03-15T11:01:29Z,فطور رمضاني في المدرسة🤩🌙مع المعلمة زينب والمتنمرات، ولكن صارت أشياء مستحيل تتوقعوها 😨❗️| roblox,فطور رمضاني في المدرسة🤩🌙مع المعلمة زينب والمتنمرات، ولكن صارت أشياء مستحيل تتوقعوها 😨❗️| roblox,لانا و رورو,UCV5ZVvsnqXniOnI4yydz8pQ,22,People & Blogs,,0,https://i.ytimg.com/vi/yi4qH9uhhV8/hqdefault.jpg,ar,ar,False,1102,PT18M22S,hd,False,True,False,False,646595,17402,4232
bXrKNYNA5RQ,AE,2026-03-16T03:42:48.905720+00:00,2026-03-13T16:30:06Z,Aaghosha Paattu (Music Video) Eechuu | Hanan Shaah | Muthu | Jimmy Godrick | Gallery Vision Indie,Aaghosha Paattu (Music Video) Eechuu | Hanan Shaah | Muthu | Jimmy Godrick | Gallery Vision Indie,Gallery Vision Indie,UCemV1WEA33S_jopsJzRenPg,10,Music,"Gallery Vision Indie, Aaghosha Paattu, hanan shah, hanan shaah songs, aaghosha paattu video, aaghosha paattu song, aaghosha paattu music video, aaghosha pattu, perunnal song, perunnal song 2026, eid song, hanan shaah new song, eechu song, eechu perunnal song, aaghosha paattu 2026, new music video, perunnal vibes, jimmy godrick, muthu, muthu song, hanan shaah vlog, hanan shaah viral song, aaghosha paattu hanan shaah, aaghosha paattu eechuu video, aghosham malayalam song",25,https://i.ytimg.com/vi/bXrKNYNA5RQ/hqdefault.jpg,ml,ml,False,173,PT2M53S,hd,True,True,False,False,250216,18866,1187
D6sCbIv4N7Y,AE,2026-03-16T03:42:48.905728+00:00,2026-03-12T05:41:02Z,"Bhooth Bangla -Official Teaser | Akshay Kumar, Tabu, Paresh, Wamiqa, Priyadarshan |In Cinemas 10 Apr","Bhooth Bangla -Official Teaser | Akshay Kumar, Tabu, Paresh, Wamiqa, Priyadarshan |In Cinemas 10 Apr",Balaji Motion Pictures,UCSHLoG-bXj1aVA2T5y8t84A,1,Film & Animation,"Bhooth Bangla, bhooth bangla, bhooth bangla trailer, bhoot bangla trailer, bhooth bangla teaser, bhoot bangla teaser, bhooth bangla song, bhooth bangla movie trailer, bhooth bangla movie teaser, bhoot bangla teaser official, bhoot bangla akshay kumar, akshay kumar, tabu, paresh rawal, wamiqa gabbi, akshay kumar new movie, priyadarshan movie, akshay kumar comedy",18,https://i.ytimg.com/vi/D6sCbIv4N7Y/hqdefault.jpg,en-IN,hi,False,84,PT1M24S,hd,True,True,False,False,19966766,283353,13210
kqAsKWeBMtE,AE,2026-03-16T03:42:48.905736+00:00,2026-03-15T15:18:11Z,[Hindi] BGIS 2026 | SEMI FINALS | Day 4 #BGMILIVE #BGIS,[Hindi] BGIS 2026 | SEMI FINALS | Day 4 #BGMILIVE #BGIS,KRAFTON INDIA ESPORTS,UCugG6-k5QGbq_iDEPAnG4NQ,20,Gaming,"BGMI, BGIS 2026, BGMI gameplay, Krafton BGMI, BGIS QF, BGIS Road to Finals, BGIS 2026 Live, BGMILIVE, BGMI Esports, BGMI Matches, BGMI Pro Gameplay, KIE, BGIS 2026 Update, BGIS SEMI FINALS, BGIS 2026 SEMI FINALS, BGIS Semi Finals Live, BGIS Tournament, BGIS Esports, BGMI LIVE, BGMI Tournament, BGMI Competitive, BGMI India, BGMI Esports India, BGMI Live Stream, Krafton India Esports, BGIS 2026 Live Stream",26,https://i.ytimg.com/vi/kqAsKWeBMtE/hqdefault.jpg,en,hi,False,22515,PT6H15M15S,hd,False,False,False,False,3649935,104325,306
XgcIBtO4bQQ,AE,2026-03-16T03:42:48.905746+00:00,2026-03-13T10:50:07Z,Macarena Video Song | Prabhudeva | A R Rahman | Moonwalk 2026,Macarena Video Song | Prabhudeva | A R Rahman | Moonwalk 2026,Lahari Music,UCnSqxrSfo1sK4WZ7nBpYW1Q,10,Music,,0,https://i.ytimg.com/vi/XgcIBtO4bQQ/hqdefault.jpg,ta,en-US,False,247,PT4M7S,hd,False,True,False,False,2139618,32732,1042
CD-kNjIw85E,AE,2026-03-16T03:42:48.905754+00:00,2026-03-13T17:51:21Z,RAKKHOSH | কোপ শুরু | OFFICIAL TRAILER | SIAM | SUSMITA | EID UL FITR 2026 | REAL ENERGY PRODUCTION ,RAKKHOSH | কোপ শুরু | OFFICIAL TRAILER | SIAM | SUSMITA | EID UL FITR 2026 | REAL ENERGY PRODUCTION ,Real Energy Production,UCdxv359lpJbTFddBm-iouTg,24,Entertainment,"rakkhosh, rakkhosh trailer, rakkhosh movie, siam ahmed, susmita chatterjee, bangla movie 2026, bangla new movie, eid ul fitr movie 2026, rakkhosh official trailer, bangla film trailer, real energy production, mehedi hassan hridoy, bangla action movie, bangla romantic movie",14,https://i.ytimg.com/vi/CD-kNjIw85E/hqdefault.jpg,en,bn,False,134,PT2M14S,hd,False,True,False,False,851113,27531,6540
F1awawd96H8,AE,2026-03-16T03:42:48.905762+00:00,2026-03-14T20:38:16Z,I Survived 100 Days on a Hardcore Minecraft Server,I Survived 100 Days on a Hardcore Minecraft Server,FlameFrags,UCvYPobTo42NM36X7VC4dLhA,20,Gaming,"minecraft, flamefrags, flame frags, flamefrags minecraft, flame minecraft",5,https://i.ytimg.com/vi/F1awawd96H8/hqdefault.jpg,en-US,en-US,False,4257,PT1H10M57S,hd,False,True,False,False,2334595,107617,16640
dESIGVxSSCE,AE,2026-03-16T03:42:48.905771+00:00,2026-03-12T06:42:17Z,"Dhurandhar The Revenge - AARI AARI | Ranveer Singh | Shashwat Sachdev, Bombay Rockers | Aditya Dhar","Dhurandhar The Revenge - AARI AARI | Ranveer Singh | Shashwat Sachdev, Bombay Rockers | Aditya Dhar",T-Series,UCq-Fj5jknLsUf-MWSy4_brA,10,Music,"tseries, tseries songs, dhurandhar the revenge aari aari, dhurandhar 2 aari aari song, dhurandhar 2 new song, ranveer singh new song, aari aari full song, dhurandhar 2 movie, dhurandhar 2 trailer, aari aari song dhurandhar 2, dhurandhar 2 aditya dhar, dhurandhar song reaction, dhurandhar 2 aari aari full song, dhurandhar 2 trailer song, aari aari ranveer singh, dhurandhar 2 full movie, dhurandhar songs, aari aari bombay rockers, dhurandhar 2 song, aari aari, aari aari lyrics",21,https://i.ytimg.com/vi/dESIGVxSSCE/hqdefault.jpg,en,hi,False,164,PT2M44S,hd,False,True,False,False,20766113,415753,11251
6QhTM9QuP_Y,AE,2026-03-16T03:42:48.905779+00:00,2026-03-13T12:30:09Z,#HotstarSpecials Muthu Engira #Kaattaan streaming from March 27 only on  #Jiohotstar | Trailer,#HotstarSpecials Muthu Engira #Kaattaan streaming from March 27 only on  #Jiohotstar | Trailer,JioHotstar Tamil,UC8lPjTzRiG37n1Q2kpz3Rfg,1,Film & Animation,,0,https://i.ytimg.com/vi/6QhTM9QuP_Y/hqdefault.jpg,ta,en-IN,False,120,PT2M,hd,True,False,False,False,2025298,7627,388
PrISVQoOv6E,AE,2026-03-16T03:42:48.905787+00:00,2026-03-15T21:32:29Z,NS vs. PRX — VALORANT Masters Santiago — Grand Final,NS vs. PRX — VALORANT Masters Santiago — Grand Final,VALORANT Champions Tour,UCA1d3HFGFUmkKr2JIUA5Vlw,20,Gaming,"valorant, vct, valorant champions tour, valorant vod, valorant gameplay, valorant montage, valorant highlights, valorant esports, valorant esports highlights, valorant pro gameplay, yt:cc=on",11,https://i.ytimg.com/vi/PrISVQoOv6E/hqdefault.jpg,en,en,False,16061,PT4H27M41S,hd,False,True,False,False,1246412,18885,106
3N-ShXh6FOI,AE,2026-03-16T03:42:48.905796+00:00,2026-03-09T10:30:02Z,"Sanam Teri Kasam - 8K/4K Music Video | Harshvardhan Rane | Himesh Reshammiya | Ankit Tiwari, Palak M","Sanam Teri Kasam - 8K/4K Music Video | Harshvardhan Rane | Himesh Reshammiya | Ankit Tiwari, Palak M",Sony Music India,UC56gTxNs4f9xZ7Pa2i5xNzg,10,Music,"sanam teri kasam 8k, 8k bollywood songs, sanam teri kasam, sanam teri kasam song, sanam teri kasam lyrics, sanam teri kasam movie, harshvardhan rane, mawra hocane, sanam teri kasam har dua mein, sanam teri kasam song lyrics, sanam teri kasam song status, sanam teri kasam all songs, sanam teri kasam full song, sanam teri kasam video songs, himesh reshammiya, ankit tiwari songs, palak muchhal songs, 8k music video, stk song, sad hindi songs, sanam teri kasam 8k video",21,https://i.ytimg.com/vi/3N-ShXh6FOI/hqdefault.jpg,en,en,False,225,PT3M45S,hd,False,True,False,False,3572477,20513,241
Exukk6JO9i0,AE,2026-03-16T03:42:48.905805+00:00,2026-03-13T02:00:00Z,BTS (방탄소년단) '아리랑 (ARIRANG)' Animation Trailer: What is your love song?,BTS (방탄소년단) '아리랑 (ARIRANG)' Animation Trailer: What is your love song?,BANGTANTV,UCLkAepWjdylmXSltofFvsYQ,10,Music,"방탄소년단, BTS, BANGTAN, 알엠, RM, 슈가, SUGA, 제이홉, jhope, 지민, 정국, k-pop, 방탄, j-hope, Jung Kook, Jimin, BTS V, Jin",18,https://i.ytimg.com/vi/Exukk6JO9i0/hqdefault.jpg,ko,ko,False,64,PT1M4S,hd,False,True,False,False,3653739,723875,40626
wyKNY1_HnTc,AE,2026-03-16T03:42:48.905812+00:00,2026-03-14T16:00:05Z,"Countries Decide Who Wins $25,000","Countries Decide Who Wins $25,000",MrBeast Gaming,UCIPPMRA040LQr5QPyJEbmXA,20,Gaming,,0,https://i.ytimg.com/vi/wyKNY1_HnTc/hqdefault.jpg,en,en,False,1508,PT25M8S,hd,True,True,False,False,7996148,274730,41435
fFSYrrzKDhw,AE,2026-03-16T03:42:48.905823+00:00,2026-03-14T13:39:10Z,DONG - Sapana Pura II ft. Waiba Buddha ( Official Music Video ),DONG - Sapana Pura II ft. Waiba Buddha ( Official Music Video ),DonG ThaGreat,UCOtSwNRLSn2kWqTZPQaLc6g,10,Music,"Dong, Waiba sb, waiba buddha, sapana pura ii, dong new song, dong song, waiba buddha dong, class x, sota, pratibimba 2",10,https://i.ytimg.com/vi/fFSYrrzKDhw/hqdefault.jpg,en,ne,False,252,PT4M12S,hd,False,True,False,False,80282,10247,570
dvQgE-8noLs,AE,2026-03-16T03:42:48.905831+00:00,2026-03-13T07:30:09Z,"Main Vaapas Aaunga | Official Teaser | Imtiaz Ali, A. R. Rahman, Diljit, Vedang, Sharvari, Naseer","Main Vaapas Aaunga | Official Teaser | Imtiaz Ali, A. R. Rahman, Diljit, Vedang, Sharvari, Naseer",Applause Entertainment,UCcO8c5xCPYHQtst3X56ufsQ,24,Entertainment,"movie scenes hindi, Main Vaapas Aaunga teaser, Imtiaz Ali new movie, Diljit Dosanjh new movie, AR Rahman movie music, Bollywood upcoming movie, Bollywood love story, cinema lovers India, movies for cinephiles, Imtiaz Ali upcoming movie, Tamasha Imtiaz Ali, Rockstar Imtiaz Ali, Love Aaj Kal Imtiaz Ali, Chamkila movie, 2026 theater release, Sharvari Bollywood movie, Vedang 2026 movie, Naseeruddin new movie, Diljit & Imtiaz Ali new movie, Cinephile movies, Applause new movie",21,https://i.ytimg.com/vi/dvQgE-8noLs/hqdefault.jpg,en,en,False,74,PT1M14S,hd,True,True,False,False,4822483,19246,795
UDUtHVwL-rc,AE,2026-03-16T03:42:48.905839+00:00,2026-03-15T22:47:23Z,Team Yandex vs. Team Liquid - PGL Wallachia Season 7 - Grand Final,Team Yandex vs. Team Liquid - PGL Wallachia Season 7 - Grand Final,PGL,UC5jpxDZx4yoBo324pMQ91Ww,20,Gaming,"PGL, PGL Esports, PGL Wallachia, PGL Wallachia Season 7, PGL Wallachia 2026, PGL Dota 2, Dota 2, Dota 2 esports, Dota 2 tournament, Dota 2 pro match, Dota 2 highlights, Dota 2 gameplay, esports tournament, Team Spirit, Team Liquid, BetBoom Team, OG, Tundra Esports, Natus Vincere, NAVI, Xtreme Gaming, Team Falcons, HEROIC, Aurora Gaming, MOUZ, PARIVISION, Yellow Submarine, Vici Gaming, Dota 2 pro game, Dota 2 competitive",30,https://i.ytimg.com/vi/UDUtHVwL-rc/hqdefault.jpg,en,en,False,42901,PT11H55M1S,hd,False,True,False,False,504876,2215,11
JLbaSQYtimo,AE,2026-03-16T03:42:48.905847+00:00,2026-03-15T03:40:06Z,Nawaj Ansari - BIG FAN DAI ( Official Music Video ) Directed By. Jungeys World,Nawaj Ansari - BIG FAN DAI ( Official Music Video ) Directed By. Jungeys World,Nawaj Ansari,UCcTQqNP3v_mhO8UW9GAMx9w,10,Music,"Nawaj Ansari, Nawaj Ansari song, Nepali hip hop, Nephop, Nepal hip hop, Nepal rap, Nepali music video, Hip hop Nepal, Nepali rapper, Nepali hiphop song, Nepali music, Nawaj Ansari Nepali song, Nepali hiphop artist, Nepali rap music video, Nepal underground rap, Nepal music video Nawaj Ansari, Dhaka Topi Mailo, Maya, Bola Maya, Jeet, Samrajya, Emotional Rap, Nepali Lyrical Song, Nepali Real Rap, kafal, soi soi, nepali folk song, babal, militarymindset, big fan dai, Big Fan",31,https://i.ytimg.com/vi/JLbaSQYtimo/hqdefault.jpg,en,en-US,False,211,PT3M31S,hd,True,True,False,False,97124,13088,759
vMc_pWm7G7o,AE,2026-03-16T03:42:48.905855+00:00,2026-03-13T15:00:00Z,Something Very Bad Is Going to Happen | Official Trailer | Netflix,Something Very Bad Is Going to Happen | Official Trailer | Netflix,Netflix,UCWOA1ZGywLbqmigxE4Qlvuw,24,Entertainment,"Adam DiMarco, Are You Sure He’s the One, Baby Reindeer, Camila Morrone, Don’t Marry Him, Duffer Brothers, Gus Birney, Haley Z. Boston, Jeff Wilbusch, Jennifer Jason Leigh, Karla Crome, Matt Duffer, Netflix, Ross Duffer, Something Very Bad, Something Very Bad Is Going to Happen, Ted Levine, Upside Down Pictures, Very Bad, Weronika Tofilska, Zlatko Buric",21,https://i.ytimg.com/vi/vMc_pWm7G7o/hqdefault.jpg,en,en-US,False,155,PT2M35S,hd,True,True,False,False,1425242,20033,1091
a2cC3ENLOGY,AE,2026-03-16T03:42:48.905866+00:00,2026-03-15T22:31:39Z,[FIL] Team Yandex vs Team Liquid (BO5) | PGL Wallachia Season 7 - The Finals,[FIL] Team Yandex vs Team Liquid (BO5) | PGL Wallachia Season 7 - The Finals,KuyaNic,UC9SOYUeP6kxIRkHNCq22LkA,24,Entertainment,"luponwxc, lupon, kuyanic, nico nazario, dota 2, PGL Wallachia Season 7, PGL Wallachia Season 7 2026, PGL Wallachia S7 2026, PGL Wallachia 2026, PGL Wallachia Season 7 Main Event 2026, dota 2 PGL Wallachia S7, PGL Wallachia S7 2026 Main Event, PGL Wallachia S7, PGL Wallachia S7 Main Event 2026, dota 2 PGL Wallachia S7 2026, dota PGL Wallachia 2026, PGL Wallachia 2026 dota 2, PGL Wallachia dota 2 2026, PGL Wallachia Main Event S7, PGL Wallachia Main Event Season 7, PGL Wallachia s7",21,https://i.ytimg.com/vi/a2cC3ENLOGY/hqdefault.jpg,en,fil,False,42901,PT11H55M1S,hd,False,True,False,False,154765,372,0
YwtvQ23_-34,AE,2026-03-16T03:42:48.905875+00:00,2026-03-11T03:30:07Z,Diljit Dosanjh : Dealer (Official Music Video) Virk Andaaz : Da Future,Diljit Dosanjh : Dealer (Official Music Video) Virk Andaaz : Da Future,Diljit Dosanjh,UCZRdNleCgW-BGUJf-bbjzQg,10,Music,,0,https://i.ytimg.com/vi/YwtvQ23_-34/hqdefault.jpg,en,en-US,False,181,PT3M1S,hd,False,True,False,False,8663645,195190,6264
T2hNe9z4nH8,AE,2026-03-16T03:42:48.905882+00:00,2026-03-12T06:51:52Z,"PRINCE (প্রিন্স) Pre-Blast | Eid 2026 | Shakib Khan | Dibyendu B, T Farin, Jyotirmoyee C | SK Films","PRINCE (প্রিন্স) Pre-Blast | Eid 2026 | Shakib Khan | Dibyendu B, T Farin, Jyotirmoyee C | SK Films",SK Films,UCD78NhC0NYFn8Ucm9EXY1Pw,24,Entertainment,"Shakib Khan, King Khan, Number one Shakib Khan, Bangladeshi Hero Shakib, sakib khan, Bangla Hero Sakib, Bangladeshi Hero Shakib Khan, শাকিব খান, বাংলা ছবি, Bangla Movie, prince movie, prince movie trailer, prince movie trailer shakib khan, megastar shakib khan, prince movie teaser, prince movie official trailer, Tasnia Farin, SK Films, Eid 2026, Abu Hayat, Official Teaser, প্রিন্স, PRINCE, movie, প্রিন্স মুভি টেইলার, প্রিন্স মুভি টিজার, প্রিন্স মুভি শাকিব খান",27,https://i.ytimg.com/vi/T2hNe9z4nH8/hqdefault.jpg,bn,bn,False,90,PT1M30S,hd,False,True,False,False,904011,38232,8193
QGcAZFhyj0w,AE,2026-03-16T03:42:48.905891+00:00,2026-03-15T18:40:10Z,IM BAACKK,IM BAACKK,Mrz Shameer,UC3uKF_GNFBAotglMrdAT9pA,20,Gaming,,0,https://i.ytimg.com/vi/QGcAZFhyj0w/hqdefault.jpg,en,ml,False,9158,PT2H32M38S,hd,False,False,False,False,92298,7473,342
4i8NASWyuQA,AE,2026-03-16T03:42:48.905901+00:00,2026-03-12T11:30:06Z,Kaattu Thottappol | Patriot Movie | Sushin Shyam | iSai | Kapil Kapilan | Anwar Ali,Kaattu Thottappol | Patriot Movie | Sushin Shyam | iSai | Kapil Kapilan | Anwar Ali,Sushin Shyam,UCR1Q8EoXmAI66C2JgUgq2Jw,10,Music,"KaattuThottappol, SushinShyam, AnwarAli, iSai, KapilKapilan, MaheshNarayanan, Mammootty, Mohanlal, FahadhFaasil, KunchackoBoban, Nayanthara, Revathy, MalayalamSong, NewMalayalamSong, PatriotMalayalamMovie, Patriot",16,https://i.ytimg.com/vi/4i8NASWyuQA/hqdefault.jpg,en,en,False,256,PT4M16S,hd,True,True,False,False,893178,8001,888
2MRMJUTZkbE,AE,2026-03-16T03:42:48.905911+00:00,2026-03-12T14:03:16Z,THE DEVIL WEARS PRADA 2 Official Final Trailer (2026),THE DEVIL WEARS PRADA 2 Official Final Trailer (2026),ONE Media,UCzcRQ3vRNr6fJ1A9rqFn7QA,1,Film & Animation,"movie trailer, new trailer, trailer, official, 2026, The Devil Wears Prada 2, The Devils Wears Prada 2 Trailer, The Devil Wears Prada 2 Trailer, Anne Hathaway, Meryl Streep, Emily Blunt, Stanley Tucci, Final, Final Trailer",14,https://i.ytimg.com/vi/2MRMJUTZkbE/hqdefault.jpg,en,en,False,172,PT2M52S,hd,False,True,False,False,2699788,44296,2660
oGbW-tS5_bg,AE,2026-03-16T03:42:48.905919+00:00,2026-03-15T18:31:11Z,ربلوكس فتحت كل شيء بحدث الفلوس ! Steal A Brainrot,ربلوكس فتحت كل شيء بحدث الفلوس ! Steal A Brainrot,اصحاب مازن,UCayyBWtI1PxJCtieqKUQZnA,20,Gaming,"roblox, روبلوكس, العاب, مشاهير روبلوكس, مازن روبلوكس, عائلة روبلوكس, سعدون روبلوكس, اصحاب مازن, مازن وسعدون, روبلوكس ماب السرقة, مازن ستيل برين روت, ستيل برين روت, Steal A Brainrot",13,https://i.ytimg.com/vi/oGbW-tS5_bg/hqdefault.jpg,ar,ar,False,1336,PT22M16S,hd,False,True,False,False,202865,9783,1752
Ljg68YzlQJo,AE,2026-03-16T03:42:48.905927+00:00,2026-03-12T01:00:18Z,#Video | ओठलाली पs | #Khesari Lal Yadav | Raksha Gupta | Othlali Pa | #Bhojpuri Song 2026,#Video | ओठलाली पs | #Khesari Lal Yadav | Raksha Gupta | Othlali Pa | #Bhojpuri Song 2026,GMJ - Global Music Junction - Bhojpuri,UCU_FozE_MPC8w4YncyShmJQ,10,Music,"khesari lal ka gana, khesari lal new song, khesari lal yadav, khesari lal bhojpuri song, bhojpuri song, khesari lal yadav new song, khesari lal ke gana, naya gana khesari lal, Othlali Pa, ओठलाली पs, Raksha Gupta, khesari lal song, khesari song 2026, khesari lal new song 2026, khesari ke gana, khesari gana, khesari new gaana, khesari lal yadav song, khesari la new song, Bhojpuri Song 2026, bhojpuri gana, new bhojpuri song, khesari lal naya gana, bhojpuri song 2026",24,https://i.ytimg.com/vi/Ljg68YzlQJo/hqdefault.jpg,en,bh,False,204,PT3M24S,hd,False,True,False,False,2004206,80877,5714
_Dei628lVAE,AE,2026-03-16T03:42:48.905935+00:00,2026-03-11T05:30:16Z,KASARGOD EMBASSY | Official Trailer | A Malayalam ZEE5 Original | Premieres on March 20th 2026,KASARGOD EMBASSY | Official Trailer | A Malayalam ZEE5 Original | Premieres on March 20th 2026,ZEE5,UCXOgAl4w-FQero1ERbGHpXQ,24,Entertainment,"KASARGOD EMBASSY, kasargod embassy official trailer, kasargod embassy on zee5, malayalam hit movie, malayalam latest movie, kasargod embassy malayalam movie release date, kasargod embassy malayalam movie story, Abu Salim, Govind Pai, Kabir Duhan singh, Sudheesh, Deepak Parambol, Rony David, zee5 original, zee5 movies, latest on zee5, Kasargod Embassy Review, Kasargod Embassy Songs, Malayalam movies on Zee5, Kasargod Embassy full movie details, Kasargod Embassy explained",21,https://i.ytimg.com/vi/_Dei628lVAE/hqdefault.jpg,en,en-GB,False,128,PT2M8S,hd,False,True,False,False,2660937,4930,332
-wEJr99Ht34,AE,2026-03-16T03:42:48.905943+00:00,2026-03-15T22:51:25Z,ESL Pro League Season 23 - Day 13,ESL Pro League Season 23 - Day 13,ESL Counter-Strike,UCPq2ETz4aAGo2Z-8JisDPIA,20,Gaming,"ESL, Counter-Strike, ESL CS, ESLCS, ESL CSGO, ESL Counter-Strike, IEM, IEM CS, IEM CSGO, CSGO, esportsisawesomesauce",11,https://i.ytimg.com/vi/-wEJr99Ht34/hqdefault.jpg,la,en,False,35563,PT9H52M43S,hd,False,True,False,False,1127983,9966,30
_6NkHzf4zfM,AE,2026-03-16T03:42:48.905951+00:00,2026-03-13T14:39:50Z,Loveah Sollitalea Music Video | Ken Karunaas | GV Prakash | Youth,Loveah Sollitalea Music Video | Ken Karunaas | GV Prakash | Youth,G.V. Prakash Kumar,UCLnKZRT9orZAgttWtS2np2g,10,Music,,0,https://i.ytimg.com/vi/_6NkHzf4zfM/hqdefault.jpg,en,en,False,181,PT3M1S,hd,False,True,False,False,1413352,23197,399
