video_id,country,fetched_at,published_at,title,localized_title,channel_title,channel_id,category_id,category_name,tags,tag_count,thumbnail,default_language,audio_language,is_live,duration,duration_raw,definition,caption_available,licensed_content,embeddable,made_for_kids,views,likes,comments
rFWAoSoVfVg,IN,2026-02-27T03:14:47.791033+00:00,2026-02-25T13:10:42Z,"Rajasthani Songs Juke Box | Bairi, Thari Yaad | Non - Stop Rajasthani Music | Video Jukebox","Rajasthani Songs Juke Box | Bairi, Thari Yaad | Non - Stop Rajasthani Music | Video Jukebox",Hunter Birla,UCsrDsOTnMAfhpV6Kp11Sb-w,10,Music,"bairi, bairi song, bairi song pardeep solanki, heena, miss parul, virat, jhoom rajasthan, new, rajasthani, marwari, song, new rajasthani song 2026, new marwadi song 2026, latest rajasthani song 2026, new rajasthani songs, new rajasthani song, rajasthani songs 2026, rajasthani song 2026, rajasthani songs, rajasthani song, rajasthani dj songs, virat new song, pardeep solanki new song, haryanvi song 2026, haryanvi songs, new haryanvi song 2026, chandni raat mein goli chala gaya",27,https://i.ytimg.com/vi/rFWAoSoVfVg/hqdefault.jpg,en,hi,False,399,PT6M39S,hd,False,False,False,False,130329,1829,44
v1kUoSGACPc,IN,2026-02-27T03:14:47.791041+00:00,2026-02-26T14:13:18Z,Vishwas Diwas 2026 - Official Trailer || Physics Wallah || Alakh Pandey ❤️,Vishwas Diwas 2026 - Official Trailer || Physics Wallah || Alakh Pandey ❤️,Physics Wallah - Alakh Pandey,UCiGyWN6DEbnj2alu7iapuKQ,27,Education,,0,https://i.ytimg.com/vi/v1kUoSGACPc/hqdefault.jpg,en,hi,False,76,PT1M16S,hd,False,True,False,False,106156,7490,663
VduHK8K55qw,IN,2026-02-27T03:14:47.791048+00:00,2026-02-26T15:55:04Z,🛑LIVE- INDIA vs ZIMBABWE🛑T20 WORLD CUP 2026🛑IND vs ZIM🛑CRICKET 26 GAMEPLAY🛑LIVE MATCH STREAMING🏏,🛑LIVE- INDIA vs ZIMBABWE🛑T20 WORLD CUP 2026🛑IND vs ZIM🛑CRICKET 26 GAMEPLAY🛑LIVE MATCH STREAMING🏏,AKELA Gaming,UC4bGNr789Zos4dXyslygRGw,20,Gaming,"AKELAGamingLive, AKELAGAMING, GTA​, GTA5RP, GTARPLIVE, AKELArp, AKELAinGTAV, GTAV, GTAVLive, svrp, htrp, legacy, Pubg mobile, pubg pc, pubg, pubg live, AKELA in pubg, pubg with akela, pubg mobile live, akela is live, live streaming, streaming, gaming, gaming stream, apex legends, cricket 19, cricket, cod, call of duty, call of duty warzone, AKELA, ludo, ludo king, facebook gamer, youtube gamer, imperial city, whitelist rp, valentine, bbl, big bash league, bbl live, ind vs sa, sa vs ind",43,https://i.ytimg.com/vi/VduHK8K55qw/hqdefault.jpg,en,en-IN,False,6268,PT1H44M28S,hd,False,True,False,False,176413,2700,2
iLLpvRt_mxM,IN,2026-02-27T03:14:47.791057+00:00,2026-02-25T02:30:45Z,"Tuition Badmashi Kaa - Hemant Faujdar, Kiran, Masoom Sharma, Manisha Sharma, Ajay Dhankhar, AmanJaji","Tuition Badmashi Kaa - Hemant Faujdar, Kiran, Masoom Sharma, Manisha Sharma, Ajay Dhankhar, AmanJaji",Black Moon Films ,UCXtVZPXN4UD-jMYfDvUrr_w,10,Music,"Tuition Badmashi Kaa, Hemant Faujdar, Kiran, Masoom Sharma, Manisha Sharma, Ajay Dhankhar, AmanJaji, tuitionbadmashikaa, desirecords, TuitionBadmashiKaa, haryanvi, Diet Teri Ka Raaz Bata Kyun Mare Khoon Ubada Re, Tere Yaar Ne Khola Centre Tuition De Badmashi Ka, Hoo Diet Teri Ka Raaz Bata, Na Chalda Tera Business Koi Na Job Ter Sarkari Hai, New Haryanvi Song 2025, Masoom Sharma Song, Latest Haryanvi Song",18,https://i.ytimg.com/vi/iLLpvRt_mxM/hqdefault.jpg,ms,bgc,False,430,PT7M10S,hd,False,True,False,False,231731,1165,32
-4OEnesGOEY,IN,2026-02-27T03:14:47.791064+00:00,2026-02-25T15:43:24Z,Thinlung Hliam 2 Trailer,Thinlung Hliam 2 Trailer,Fadyo Pictures,UC8FRMZ38Z4P3qJeW-tx_XfA,24,Entertainment,,0,https://i.ytimg.com/vi/-4OEnesGOEY/hqdefault.jpg,en,und,False,178,PT2M58S,hd,False,True,False,False,47318,2428,78
uXO7H6hgiAY,IN,2026-02-27T03:14:47.791072+00:00,2026-02-26T16:13:55Z,Incredible Match | INDIA vs ZIMBABWE T20 | Simulation Gameplay,Incredible Match | INDIA vs ZIMBABWE T20 | Simulation Gameplay,CRICPLAY STUDIO ,UCJrRRa4Y9iZLv97PHExrWqg,20,Gaming,"cricket live, cricket highlights, cricket, live cricket, live cricket match, live cricket match today, ind vs zim live, ind vs zim highlights, india vs zimbabwe live, india vs zimbabwe highlights",10,https://i.ytimg.com/vi/uXO7H6hgiAY/hqdefault.jpg,en,,False,517,PT8M37S,hd,False,True,False,False,151791,599,12
3PDS3CpxmDE,IN,2026-02-27T03:14:47.791079+00:00,2026-02-25T07:00:03Z,"Payal Ki Khanak | Hindi New Song | Anil Rawat,Kajal | Mohit,Anshu | New Dj Song 2026","Payal Ki Khanak | Hindi New Song | Anil Rawat,Kajal | Mohit,Anshu | New Dj Song 2026",Chambal Ki Mahak,UCngqpNJKsV11dO6btAYJN8g,22,People & Blogs,"Payal ki khanak official video, Payal Ki Khanak Se Jagege Sajna, पायल की खनक से जगेगे सजना, Anil Rawat new song, Kajal Hathrasi new song, bhaigiri music, Payal ki khanak Anil Rawat song, nind ki goli Anil rawat, anil rawat sad song, new sad song, hindi song, hit song hindi, goli nid ki de aaiyo, so jave sajna, love song, mohit love song, anil rawat new song, mohit love payal ki khanak, tranding love song, anil rawat hit song, Goli need ki anil rawat, Goli need ki de aiyo",22,https://i.ytimg.com/vi/3PDS3CpxmDE/hqdefault.jpg,en,hi,False,467,PT7M47S,hd,False,True,False,False,122881,302,3
A_OQKZGDeRQ,IN,2026-02-27T03:14:47.791087+00:00,2026-02-26T05:00:04Z,Mortal Kombat 2 Tamil Trailer 2 Breakdown (தமிழ்),Mortal Kombat 2 Tamil Trailer 2 Breakdown (தமிழ்),Mokka Commentry,UC3Y7OyuS9jNdZy3ZadrAbWQ,24,Entertainment,"tamil, தமிழ், mokka commentry, mokka, trending, youtube tamil, recommended, tamil creator, Mortal Kombat 2 Tamil Trailer Breakdown, mk2, tamil trailer breakdown, tamil trailer, karl urban johnny cage, trailer mk2",14,https://i.ytimg.com/vi/A_OQKZGDeRQ/hqdefault.jpg,en,en,False,655,PT10M55S,hd,False,True,False,False,32005,2588,84
LC8n4NoA33g,IN,2026-02-27T03:14:47.791094+00:00,2026-02-26T07:35:00Z,Franklin Building A Tree House For The First Time Ever in GTA 5 ! (GTA 5 mods),Franklin Building A Tree House For The First Time Ever in GTA 5 ! (GTA 5 mods),Flight Gamer,UCt3mMVAyGhwQb_ZBGp_p85g,20,Gaming,"gta 5 mods, gta v mods, FLIGHT GAMER, flight gamer gta 5, gta 5, flight, techno gamerz gta 5, gta, gta v, gta 5 techno gamerz, gta 5 secret base, techno gamerz, hulk, flight gamer, Franklin Building A Tree House For The First Time Ever in GTA 5, Flight Gamer, flight game, mods gta 5, franklin showroom, ironman vs thanos, tree house, tree house in gta 5, gta 5 tree house, gta 5 cars, best gta mods, gta v tree house, franklin tree house",27,https://i.ytimg.com/vi/LC8n4NoA33g/hqdefault.jpg,en-US,hi,False,1649,PT27M29S,hd,False,True,False,False,226465,7525,700
TLCxFCie56w,IN,2026-02-27T03:14:47.791102+00:00,2026-02-24T06:42:46Z,Julam Kar Daaryo Sitam Kar Daaryo - Lakhbir Singh Lakkha | Holi Ke Rang Lakkha Ke Sang-Khatu,Julam Kar Daaryo Sitam Kar Daaryo - Lakhbir Singh Lakkha | Holi Ke Rang Lakkha Ke Sang-Khatu,T-Series Haryanvi Bhakti,UC-pCOUhn4BBB4yAz9I2KJ-A,22,People & Blogs,"haryanvi devotional song, haryanvi song, haryanvi song 2023, khatu shyam bhajan new 2023, khatu shyam bhajan new song, khatu shyam ji ke bhajan, khatu shyam song, khatu shyam ke gane, khatu shyam new bhajan 2023, khatu shyam ji ke gaane, khatu shyam songs, shree shyam chalisa lakhbir singh lakha, shree shyam chalisa lyrics, shree shyam chalisa stuti, shree shyam chalisa fast, lakhbir singh lakkha ke bhajan, lakhbir singh lakkha khatu shyam bhajan, lakhbir singh lakkha song",18,https://i.ytimg.com/vi/TLCxFCie56w/hqdefault.jpg,en,hi,False,389,PT6M29S,hd,False,True,False,False,126335,832,13
oq4ngKNJg7w,IN,2026-02-27T03:14:47.791109+00:00,2026-02-21T02:30:48Z,JETHANI KI ARRANGE MARRIAGE DEVRANI KI LOVE MARRIAGE BHOJPURI OFFICIAL TRAILER | SMRITY SINHA,JETHANI KI ARRANGE MARRIAGE DEVRANI KI LOVE MARRIAGE BHOJPURI OFFICIAL TRAILER | SMRITY SINHA,B4U Bhojpuri,UCIobY5Y-ly9Bo458yjy36OQ,1,Film & Animation,"jethani, devrani, devrani jethani, jethani devrani, arrange marriage, love marriage, bhojpuri trailer, new bhojpuri trailer, love marriage devrani arrange marriage jethani, smrity sinha, jethani arrange marriage, devrani love marriage, family stories, bhojpuri movie",14,https://i.ytimg.com/vi/oq4ngKNJg7w/hqdefault.jpg,en,bh,False,294,PT4M54S,hd,False,True,False,False,2269526,11292,101
Ov6nFtH6Tk0,IN,2026-02-27T03:14:47.791116+00:00,2026-02-26T09:30:16Z,We Survive The LUNAR MOON in Minecraft !!,We Survive The LUNAR MOON in Minecraft !!,Flame playz,UCW3Sbu9ZFb2g2thct6mZlXA,20,Gaming,"#minecraft, #gaming, #Flameplayz, minecraft funny video, mc flame, mc flame minecraft, cursed moon in minecraft, Lunar moon, Lunar moon minecraft, lunar moon mcflame, lunar moon flameplayz, scary moon, nalla scientist",13,https://i.ytimg.com/vi/Ov6nFtH6Tk0/hqdefault.jpg,en,hi,False,1547,PT25M47S,hd,False,True,False,False,144561,2645,83
C0NVU0bGix0,IN,2026-02-27T03:14:47.791123+00:00,2026-02-20T01:15:01Z,Mere Shyam Sa Dil Daar Nhi  | Sunil Sharma Dhingadiya | Vijay Rajput | Khatu Shyam Bhajan 2026,Mere Shyam Sa Dil Daar Nhi  | Sunil Sharma Dhingadiya | Vijay Rajput | Khatu Shyam Bhajan 2026,Shyam Ras Dhun,UCwHWMrQmFtsVNZUlQD088SQ,10,Music,"Vijay Rajput Ke Bhajan, NEW BHAJAN, new bhajan, latest bhajan, Vijay Rajput, Sunil Sharma Dhingadiya, Khatu Shyam Bhajan, khatu shyam bhajan, khatu shyam song, Shyam Bhajan, खाटू श्याम जी भजन, श्याम भजन, shree shyam bhajan, saawariya bhajan, khatu ji ke bhajan, khatu song, shyam baba bhajan, Mere Shyam Sa Dil Daar Nhi, मेरे श्याम सा दिल दार नहीं, khatu shyam, radhe shyam, khatu shyam baba, New Shyam Bhajan, Jay Shri Shyam",24,https://i.ytimg.com/vi/C0NVU0bGix0/hqdefault.jpg,en,hi,False,316,PT5M16S,hd,False,True,False,False,8698,128,4
4Jhh3P9UGK0,IN,2026-02-27T03:14:47.791131+00:00,2026-02-26T18:00:06Z,Poppy Playtime Chapter 5 - Accolades Trailer,Poppy Playtime Chapter 5 - Accolades Trailer,Mob Entertainment,UCXqV4yoyC_mmZye6VbKFPeQ,20,Gaming,"poppy playtime, chapter 5, poppy playtime chapter 5, the prototype, huggy wuggy, kissy missy, mommy long legs, catnap, dogday, smiling critters, nightmare critters, chum chompkins, lily lovebraids, giblet, wrongside outimals, doey the doughman",16,https://i.ytimg.com/vi/4Jhh3P9UGK0/hqdefault.jpg,en,en,False,39,PT39S,hd,False,True,False,False,805516,73582,5427
