video_id,country,fetched_at,published_at,title,localized_title,channel_title,channel_id,category_id,category_name,tags,tag_count,thumbnail,default_language,audio_language,is_live,duration,duration_raw,definition,caption_available,licensed_content,embeddable,made_for_kids,views,likes,comments
iAtoZar5W58,IN,2026-02-27T03:14:47.790718+00:00,2026-02-24T14:44:06Z,Aaya Sher - Lyrical | The Paradise | Nani | Anirudh Ravichander | Srikanth Odela,Aaya Sher - Lyrical | The Paradise | Nani | Anirudh Ravichander | Srikanth Odela,Saregama Telugu,UC68nKdrLbLL0Vj7ilVkLmmg,10,Music,"Anirudh Ravichander, The Paradise Theme OST, The Paradise Original Sound Track, The Paradise Theme music, Nani The Paradise theme, Anirudh Ravichander OST, Anirudh BGM, Anirudh theme music, Anirudh Ravichander The Paradise, Nani Anirudh combo, The Paradise background score, Srikanth Odela The Paradise, The Paradise theme score, Anirudh Ravichander original soundtrack, Nani OST",15,https://i.ytimg.com/vi/iAtoZar5W58/hqdefault.jpg,en,te,False,297,PT4M57S,hd,False,True,False,False,22927113,865334,26323
BCQwSlYlEe8,IN,2026-02-27T03:14:47.790758+00:00,2026-02-23T11:30:09Z,Thaai Kizhavi - Official Trailer | Radikaa Sarathkumar | Sivakumar Murugesan | Nivas K Prasanna,Thaai Kizhavi - Official Trailer | Radikaa Sarathkumar | Sivakumar Murugesan | Nivas K Prasanna,Saregama Tamil,UCzee67JnEcuvjErRyWP3GpQ,1,Film & Animation,"Maatikitaan Minorkunju, Maatikitaan Minorkunju song, Thaai Kizhavi, Thaai Kizhavi songs, Sivakarthikeyan, Radikaa Sarathkumar, Nivas K Prasanna, Nivas K Prasanna songs, Arunraja Kamaraj lyrics, Sublahshini, Alex Samuel Jenito, Tamil new songs, latest Tamil songs, Tamil item song, Tamil dance song, Tamil folk song, Tamil kuthu song, Tamil movie songs, Kollywood songs, Tamil video songs, Tamil trending songs, Saregama Tamil, Tamil hits, Tamil film songs",24,https://i.ytimg.com/vi/BCQwSlYlEe8/hqdefault.jpg,en,ta,False,171,PT2M51S,hd,True,True,False,False,2060481,44617,1202
T61XVFTvRgA,IN,2026-02-27T03:14:47.790769+00:00,2026-02-26T14:30:11Z,[Hindi] BGIS 2026 | QUARTER FINALS | Day 1,[Hindi] BGIS 2026 | QUARTER FINALS | Day 1,KRAFTON INDIA ESPORTS,UCugG6-k5QGbq_iDEPAnG4NQ,20,Gaming,"BGMI, BGIS 2026, BGMI esports, BGIS live, Indian esports, BGMI matches, BGMI gameplay, BGMI official, esports India, Krafton BGMI, BGIS Round 4, BGIS Quarterfinals, BGIS 2026 Quarterfinals, BGIS QF, BGIS Quarter Finals 2026, BGMI Esports, BGMI Tournament, BGMI Competitive, BGMI Esports India, Krafton India Esports, BGIS Road to Finals, BGIS Knockout Stage, BGIS 2026 Live, BGIS Semi Final Race, BGIS Championship Path, BGMI High Level Gameplay, BGIS Elimination Stage",27,https://i.ytimg.com/vi/T61XVFTvRgA/hqdefault.jpg,en,hi,False,18646,PT5H10M46S,hd,False,False,False,False,1785374,47008,187
DBC2461TQbQ,IN,2026-02-27T03:14:47.790778+00:00,2026-02-26T00:30:09Z,"#Video - चोली के समान - #Ashish Yadav, Khushi Kakkar का आ गया लगन का सबसे ब्लास्ट - #New Magahi Song","#Video - चोली के समान - #Ashish Yadav, Khushi Kakkar का आ गया लगन का सबसे ब्लास्ट - #New Magahi Song",Aashish Yadav Entertainment,UCjaOWpDTaZKe63ApNJ8BLPg,10,Music,"Ashish Yadav, चोली के समान, Khushi Kakkar, ashish yadav ke gana, ashish yadav new song, ashish yadav ka song, ashish yadav ka new song, ashish yadav ka gana, aashish yadav, aashish yadav new song, aashish yadav ka gana, ashish yadav ka naya gana, aashish yadav maghi song, Choli Ke Saman, khushi kakkar new song, Ashish Yadav Aur Khushi Kakkar Ke Gana, choli ke saman ashish yadav, ashish yadav dj song, ashish yadav",19,https://i.ytimg.com/vi/DBC2461TQbQ/hqdefault.jpg,en,hi,False,175,PT2M55S,hd,False,True,False,False,1080418,78584,8178
2zf8PYcU3g0,IN,2026-02-27T03:14:47.790786+00:00,2026-02-26T10:30:02Z,Spa - Official Trailer | Abrid Shine | Ishaan Chhabra,Spa - Official Trailer | Abrid Shine | Ishaan Chhabra,Saregama Malayalam,UCoRF8GByEjmM_yHwUGIDGyQ,10,Music,"Spa sneak peek, Spa Malayalam movie, Spa Malayalam film, Spa movie sneak peek, Spa teaser Malayalam, Abrid Shine Spa, Vineeth Thattil David Spa, Siddarth Bharathan Spa, Shruthy Menon Spa, Radhika Radhakrishnan Spa, Ishaan Chhabra music, Spa film cast, Spa Malayalam cinema, new Malayalam movie sneak peek, latest Malayalam teaser, Malayalam sneak peek video, upcoming Malayalam film Spa, Spa movie updates, Saregama Malayalam, Malayalam new movie scenes, Spa film promo",21,https://i.ytimg.com/vi/2zf8PYcU3g0/hqdefault.jpg,en,ml,False,100,PT1M40S,hd,False,True,False,False,92803,2192,128
tVDiaaVkfNw,IN,2026-02-27T03:14:47.790795+00:00,2026-02-26T09:01:45Z,"Minecraft, But Every Mob in Chest!","Minecraft, But Every Mob in Chest!",Carry Depie,UClqifC6Nd7v-IfTqce4k62A,20,Gaming,"carry depie, minecraft",2,https://i.ytimg.com/vi/tVDiaaVkfNw/hqdefault.jpg,en,hi,False,1171,PT19M31S,hd,False,True,False,False,807286,12053,510
x0aMsjhFxeE,IN,2026-02-27T03:14:47.790803+00:00,2026-02-26T06:34:02Z,"Ram Ji Aake Bhala Karenge | Bhooth Bangla | Akshay Kumar | Pritam,Armaan Malik,Aarvan,Kumaar,MellowD","Ram Ji Aake Bhala Karenge | Bhooth Bangla | Akshay Kumar | Pritam,Armaan Malik,Aarvan,Kumaar,MellowD",Zee Music Company,UCFFbwnve3yF62-tVXkTyHqg,10,Music,"ram ji aake bhala karenge, ramji aake bhala karenge, ramji aakar bhala karenge, bhooth bangla movie song, akshay kumar bhoot song, bhooth bangla song, akshay kumar song, akshay kumar new song, akshay kumar dance, armaan malik new song, bhoot bangla, new hindi song, new bollywood song, latest bollywood song, latest hindi song, new trending song, pritam new song, akshay kumar new movie, ramji bhala karenge, new dance song, padho chalisa re, new party song, bhooth bangla",23,https://i.ytimg.com/vi/x0aMsjhFxeE/hqdefault.jpg,en,hi,False,248,PT4M8S,hd,False,True,False,False,7811278,130794,16987
qj0TyXhGaLw,IN,2026-02-27T03:14:47.790811+00:00,2026-02-25T09:16:32Z,3000 Crore Plan Dhurandhar 2 Secret Deal | Deeksha Sharma,3000 Crore Plan Dhurandhar 2 Secret Deal | Deeksha Sharma,Filmi Indian,UCeiAKuJGZrIjYvaq0nMwbJg,24,Entertainment,"dhurandhar 2, dhurandhar 2 trailer, dhurandhar, dhurandhar 2 revenge, movie, teaser, trailer, review, reaction, dhurandhar 2 release date, dhurandhar 2 movie, ranveer singh, aditya dhar, toxic, yash, toxic trailer, toxic vs dhurandhar, dhurandhar review, dhurandhar reaction, dhurandhar full movie, dhurandhar 2 toxic, movie review, filmi indian, dhurandhar song, t series",25,https://i.ytimg.com/vi/qj0TyXhGaLw/hqdefault.jpg,en,hi,False,213,PT3M33S,hd,False,True,False,False,257867,12283,1120
YOY_g9CyEco,IN,2026-02-27T03:14:47.790819+00:00,2026-02-26T11:41:22Z,I Trained Like a Parasite For 24 Hours in Minecraft!,I Trained Like a Parasite For 24 Hours in Minecraft!,ProBoiz 95,UCSncGB_s0tuWN-4l-58mmvQ,20,Gaming,"minecraft, parasite in minecraft, minecraft parasite, i trained like a parasite in minecraft, i became a parasite in minecraft, minecraft hindi, minecraft india, india minecraft, proboiz, proboiz 95",10,https://i.ytimg.com/vi/YOY_g9CyEco/hqdefault.jpg,en,en-IN,False,1310,PT21M50S,hd,False,True,False,False,735426,22466,2421
T0EA6U6gs2Q,IN,2026-02-27T03:14:47.790827+00:00,2026-02-25T23:00:41Z,"Sudasha Brata Bahi Gita | ସୁଦଶା ବ୍ରତ ବହିଗୀତ | Namita Agrawal,Gita Dash | Sidharth Bhakti","Sudasha Brata Bahi Gita | ସୁଦଶା ବ୍ରତ ବହିଗୀତ | Namita Agrawal,Gita Dash | Sidharth Bhakti",Sidharth Bhakti,UCTCtBVxD_OSSLuaOk5YpiWA,10,Music,"sidharth bhakti, sidharth bhakti song, siddharth bhakti, best odia bhajan, top odia bhajan, oriya bhajan, odia devotional song, odia bhakti songs, odia bhajan, new bhajan, new odia bhajan, Sidharth bhakti bhajan, all odia bhajan, emotional odia bhajan, odia album bhajan, namita agrawal bhajan",16,https://i.ytimg.com/vi/T0EA6U6gs2Q/hqdefault.jpg,or,or,False,3164,PT52M44S,hd,False,True,False,False,242145,2127,182
AN8hv-JQZIw,IN,2026-02-27T03:14:47.790834+00:00,2026-02-24T13:00:01Z,Band Melam Official Teaser | Harsh Roshan | Sridevi | Kona Venkat | Sathish Javvaji | Vijai Bulganin,Band Melam Official Teaser | Harsh Roshan | Sridevi | Kona Venkat | Sathish Javvaji | Vijai Bulganin,Aditya Music,UCNApqoVYJbYSrni4YsbXzyQ,10,Music,"Band Melam Teaser, Band Melam Teaser Telugu, Band Melam Movie, Band Melam Trailer, Band Melam Movie Songs, Band Melam Songs, Band Melam Release Date, Harsh Roshan Movies, Harsh Roshan New Movie, Harsh Roshan and Sridevi, Sridevi Movie, Sridevi New Movie, Sathish Javvaji Movies, Vijai Bulganin Songs, Telugu Teaser, Telugu Teaser New, Telugu New Movies, Telugu Songs, New Movie Songs Telugu, Latest Songs, Telugu Songs 2026, Trending Telugu Songs, New Song Telugu, AdityaMusic",24,https://i.ytimg.com/vi/AN8hv-JQZIw/hqdefault.jpg,en,te,False,121,PT2M1S,hd,False,True,False,False,420136,10864,160
xlmILyQTmCk,IN,2026-02-27T03:14:47.790841+00:00,2026-02-26T15:44:57Z,🔴 [HI] TEZ FFMIC 2026 Spring | Group Stage - Week 1 | Day 1 | Group A,🔴 [HI] TEZ FFMIC 2026 Spring | Group Stage - Week 1 | Day 1 | Group A,Free Fire MAX Esports India Official,UCuYSf8EuD8cqeEFITmvHXYQ,20,Gaming,,0,https://i.ytimg.com/vi/xlmILyQTmCk/hqdefault.jpg,en,en-IN,False,14175,PT3H56M15S,hd,False,False,False,False,1191903,22431,283
z6gd6y6rKL4,IN,2026-02-27T03:14:47.790849+00:00,2026-02-25T12:27:20Z,घघरी उठा के नाचे नागिन जइसन रे | #Raushan Rohi | Ghaghari Utha Ke Nache Nagin Jaisan Re | Maghi Song,घघरी उठा के नाचे नागिन जइसन रे | #Raushan Rohi | Ghaghari Utha Ke Nache Nagin Jaisan Re | Maghi Song,Sawan Bhojpuri Music,UC_MwgFaEW4hjyA_IbqKJreg,10,Music,"raushan rohi maghi song, raushan rohi new song 2026, नाच नागिन जैसन, raushan rohi, raushan rohi new song, raushan rohi new gana, raushan rohi new maghi song, raushan rohi naya gana, raushan rohi song new, raushan rohi ka gana, nach nagin jaisan, raushan rohi new maghi gana, raushan rohi new video, raushan rohi maghi gana, khushi kakkar new song, khushi kakkar maghi new song, raushan rohi khushi kakkar new song, raushan rohi entertainment, घघरी उठा के नाच नागिन जैसन गे",19,https://i.ytimg.com/vi/z6gd6y6rKL4/hqdefault.jpg,en,zxx,False,165,PT2M45S,hd,False,True,False,False,259314,3537,64
b24oG7qCwp4,IN,2026-02-27T03:14:47.790857+00:00,2026-02-25T18:01:17Z,Mortal Kombat II | Official Trailer II,Mortal Kombat II | Official Trailer II,Warner Bros.,UCjmJDM5pRKbUlVIzDYYWb6g,1,Film & Animation,"2026, Action, Adeline Rudolph, Adventure, Battle, Chin Han, Coming Soon, Damon Herriman, Fantasy, Film, Film Trailer, Film Warner, Game, Hiroyuki Sanada, Jessica McNamee, Joe Taslim, Josh Lawson, Karl Urban, Lewis Tan, Ludi Lin, MMA Fighter, Martial Arts, Mehcad Brooks, Mortal Kombat, Mortal Kombat II, Movie, Official Trailer, Simon McQuoid, Tadanobu Asano, Tati Gabrielle, Trailer, Video Game, WB, Warner, Warner Bros, Warner Brothers, Warner Media",37,https://i.ytimg.com/vi/b24oG7qCwp4/hqdefault.jpg,en,en-US,False,145,PT2M25S,hd,True,False,False,False,6329444,136133,7866
lgirXbUPXPY,IN,2026-02-27T03:14:47.790865+00:00,2026-02-26T10:24:39Z,I Changed My Name & Pranked A GIRL STREAMER,I Changed My Name & Pranked A GIRL STREAMER,SATVIK,UCWRmZvwkp6oNca2wW3uFcFg,20,Gaming,,0,https://i.ytimg.com/vi/lgirXbUPXPY/hqdefault.jpg,en,hi,False,1836,PT30M36S,hd,False,True,False,False,397577,16862,2075
6WIamdR9Z7s,IN,2026-02-27T03:14:47.790872+00:00,2026-02-20T09:41:06Z,Teri Yaadon Ki Chadar Odhe Official Video Dil Ne Tera Naam Liya #bollywood #hindisong #2026,Teri Yaadon Ki Chadar Odhe Official Video Dil Ne Tera Naam Liya #bollywood #hindisong #2026,Khan Brothers ,UCJBAQnpAAY97HqROg56CAEw,10,Music,"Gurjar Wati Gaal, Gurjar Rasiya, Rasiya, New gurjar rasiya, Meena Song, Meena Geet, Meena uchata geet, Rajasthani Song, Marwadi Song, Bhupendra khatana, Bhupendra khatana ke rasiya, Veersingh Banota, Veersingh Banota Ke Gane, Singer lovekush dungri, Shankar Bidhudi Song, Singer love star, कोना बैठो बुलट पे लाओ काली थार",17,https://i.ytimg.com/vi/6WIamdR9Z7s/hqdefault.jpg,hi,hi,False,413,PT6M53S,hd,False,True,False,False,1048738,2243,36
chADVwsL-6w,IN,2026-02-27T03:14:47.790880+00:00,2026-02-25T18:08:15Z,Paradise Trailer | Nani | Srikanth Odela | Anirudh Ravichandran | Mohan Babu | Sonali Kulkarni ,Paradise Trailer | Nani | Srikanth Odela | Anirudh Ravichandran | Mohan Babu | Sonali Kulkarni ,S-Series Studio 3.6M view's 9 hourse ago....      ,UCUm11wjobcQ7qYmbGYLJcqA,24,Entertainment,"Paradise Trailer, nani, mohan babu, anirudh, Srikanth Odela",5,https://i.ytimg.com/vi/chADVwsL-6w/hqdefault.jpg,en,te,False,133,PT2M13S,hd,False,True,False,False,81287,1152,34
g7bd4oRRo-k,IN,2026-02-27T03:14:47.790888+00:00,2026-02-26T10:00:06Z,الرجل العنكبوت انقاذ باتمان Spider-Man Rescue batman vs iron man vs venom funny Game GTA 5 superhero,الرجل العنكبوت انقاذ باتمان Spider-Man Rescue batman vs iron man vs venom funny Game GTA 5 superhero,GTA HYPE,UCj9LqhHxYUOU6_J4Z3x7lKw,10,Music,,0,https://i.ytimg.com/vi/g7bd4oRRo-k/hqdefault.jpg,en,en,False,1302,PT21M42S,hd,False,True,False,False,1342259,80755,6514
RLa_lF0K-vQ,IN,2026-02-27T03:14:47.790896+00:00,2026-02-25T12:37:00Z,Aaja Meri Gadi Mein | Uttar Kumar | Anjali Raghav | Kehar Kharkiya | Shiqaari | New Haryanvi Song,Aaja Meri Gadi Mein | Uttar Kumar | Anjali Raghav | Kehar Kharkiya | Shiqaari | New Haryanvi Song,Heart Music,UCpyEynyShZ3Kb3OG6guzeFA,10,Music,"aaja meri gaadi, aaja meri gaadi mein, aaja meri gaadi mein song, aaja meri gadi me, anjali raghav, anjali raghav new song, anjali raghav song, haryanavi, haryanvi song, haryanvi songs, heart music, hit ragni, kehar kharkiya, kehar kharkiya new song, kehar kharkiya song, meri gadi, new haryanvi song, new song, official music video, official video, ragni, ragni 2026, shiqaari, shiqaari haryanvi song, uttar kumar, uttar kumar new movie, uttar kumar new song, uttar kumar song",28,https://i.ytimg.com/vi/RLa_lF0K-vQ/hqdefault.jpg,en-IN,bgc,False,196,PT3M16S,hd,False,True,False,False,755597,16689,625
yv9Q-O5_lwk,IN,2026-02-27T03:14:47.790904+00:00,2026-02-25T04:41:06Z,The Kerala Story 2 पर क्या चल रहा बवाल? | RJ Raunac,The Kerala Story 2 पर क्या चल रहा बवाल? | RJ Raunac,RJ Raunac,UCKop7_gs7xq5tbrDDYuplhA,24,Entertainment,"Rj raunak, raunac new video, fun tantra, fun ki baat, RJ Raunac, Trending Now, RJ Raunac Official, The Kerala Story 2, Kerala Story controversy, Indian cinema debate, love jihad controversy, Kerala politics, forced conversion cases India, cinema and society, political films India, CBFC certification debate, Vipul Amrutlal Shah statement, Anurag Kashyap reaction, Shashi Tharoor on Kerala Story, Pinarayi Vijayan statement",20,https://i.ytimg.com/vi/yv9Q-O5_lwk/hqdefault.jpg,en,hi,False,484,PT8M4S,hd,False,True,False,False,240130,12178,1785
GJtYMCI43OQ,IN,2026-02-27T03:14:47.790911+00:00,2026-02-25T09:00:00Z,GRANNY TRAPPED MOTU PATLU IN INDIAN BIKE DRIVING 3D,GRANNY TRAPPED MOTU PATLU IN INDIAN BIKE DRIVING 3D,Vamp Plays,UCBeAbD9rRJ_YhMli7bEH9tQ,24,Entertainment,"Indian bike driving 3d, Motu patlu, Motu patlu in indian bike driving 3d, Granny in indian bike driving 3d, Granny house escape, Granny 3, Escape, Horror games, Vamp plays",9,https://i.ytimg.com/vi/GJtYMCI43OQ/hqdefault.jpg,en,hi,False,1519,PT25M19S,hd,False,True,False,False,788448,8076,228
fqTPKENfWCg,IN,2026-02-27T03:14:47.790918+00:00,2026-02-26T01:29:30Z,"Sudasha Brata Bahi Gita | ସୁଦଶା ବ୍ରତ ବହିଗୀତ | Maa Laxmi Puja | Namita Agrawal,Gita Dash","Sudasha Brata Bahi Gita | ସୁଦଶା ବ୍ରତ ବହିଗୀତ | Maa Laxmi Puja | Namita Agrawal,Gita Dash",Odia Bhaktidhara,UCE2TD6Sdkg-KHLz8ndyHFaQ,10,Music,"odia bhaktidhara, odia bhakti, odia bhajan, odia janana, odia bhakti song, odia bhajan audio jukebox, odia purana, odia gahani gita, best odia bhajan, top odia bhajan, sidharth bhakti bhajan, sarthak music bhajan, jagannath bhajan, odia shiva bhajan, best old odia bhajan, odia gahani, namita agrawal, odia bhakti gita, new odia bhajan, sudasha brata bahi gita, sudasa brata namita agrawal",21,https://i.ytimg.com/vi/fqTPKENfWCg/hqdefault.jpg,en,or,False,3190,PT53M10S,hd,False,True,False,False,171543,1414,89
vzu95IcA32g,IN,2026-02-27T03:14:47.790926+00:00,2026-02-25T13:05:18Z,Kadhal Reset Repeat Official Trailer | Director Vijay | Madumkesh | Jiya Shankar | Harris Jayaraj,Kadhal Reset Repeat Official Trailer | Director Vijay | Madumkesh | Jiya Shankar | Harris Jayaraj,T-Series Tamil,UCAEv0ANkT221wXsTnxFnBsQ,10,Music,"Tamil Trailer, Latest Tamil Songs, Tamil Love song, tamil Melody Song, tamil Hits, Tamil New Release, Tamil Latest Songs 2025, Latest songs in Tamil, Songs in Tamil, Tamil Movie Songs, latest Tamil Love Songs, Latest Tamil Hit Songs, Tamil New Release 2025, T-Series Tamil, Kadhal Reset Repeat Official Trailer, Madumkesh, Jiya Shankar, Harris Jayaraj, Kadhal Reset Repeat Tamil Movie, Kadhal Reset Repeat Trailer, Kadhal Reset Repeat New movie, Kadhal Reset Repeat Movie Trailer",22,https://i.ytimg.com/vi/vzu95IcA32g/hqdefault.jpg,en,ta,False,125,PT2M5S,hd,True,True,False,False,180742,3979,418
nR86pzK2kLM,IN,2026-02-27T03:14:47.790934+00:00,2026-02-25T11:32:21Z,Minecraft Speedrunner VS 2 Hunters Revival..,Minecraft Speedrunner VS 2 Hunters Revival..,Karry Kraft,UCW3Ms3ZxVaZUniP-HifWCDg,20,Gaming,"carry depie, minecraft",2,https://i.ytimg.com/vi/nR86pzK2kLM/hqdefault.jpg,en,en-IN,False,638,PT10M38S,hd,False,True,False,False,573955,8623,339
N_n-pj8hXys,IN,2026-02-27T03:14:47.790941+00:00,2026-02-25T11:41:34Z,KH x RK - Reunion - Behind the Scenes | Kamal Haasan | Rajinikanth | Nelson | Anirudh | Red Giant,KH x RK - Reunion - Behind the Scenes | Kamal Haasan | Rajinikanth | Nelson | Anirudh | Red Giant,Red Giant Movies,UCciiOyy3uemzbp6_gSMcSwA,1,Film & Animation,"Redgiantmovies, Redgiant, Redgiant Distribution, Redgiant Release",4,https://i.ytimg.com/vi/N_n-pj8hXys/hqdefault.jpg,en,ta,False,54,PT54S,hd,False,True,False,False,725245,30047,789
wY1V7rEAQ3o,IN,2026-02-27T03:14:47.790948+00:00,2026-02-23T13:48:08Z,"Subedaar - Official Trailer | Anil Kapoor, Radhikka Madan, Aditya Rawal, Mona Singh, Saurabh Shukla","Subedaar - Official Trailer | Anil Kapoor, Radhikka Madan, Aditya Rawal, Mona Singh, Saurabh Shukla",Prime Video India,UC4zWG9LccdWGUlF77LZ8toA,24,Entertainment,"subedaar, subedaar movie trailer, subedaar anil kapoor movie, subedaar movie release date, anil kapoor, anil kapoor movies, anil kapoor new movie, subedaar anil kapoor, subedar, subedaar official trailer, subedaar movie, subedar anil kapoor, subedaar trailer, subedar movie anil kapoor, subedar trailer, subedar movie trailer, latest on prime, amazon prime, prime video, prime video india, new movie, trailer, mona singh, saurabh shukla, aditya rawal, action, drama, thriller",28,https://i.ytimg.com/vi/wY1V7rEAQ3o/hqdefault.jpg,en,en,False,172,PT2M52S,hd,True,True,False,False,9276966,27153,1239
UCwGWPGt3PI,IN,2026-02-27T03:14:47.790956+00:00,2026-02-26T11:40:01Z,🔴[Live Free Fire New Rank Season Rank Push Live !!,🔴[Live Free Fire New Rank Season Rank Push Live !!,VISHNU RAJPUT GAMING,UCh_ilHTu7pYJ11_XKlT_9sA,20,Gaming,,0,https://i.ytimg.com/vi/UCwGWPGt3PI/hqdefault.jpg,en,hi,False,22562,PT6H16M2S,hd,False,True,False,False,458661,8185,6
C6BAwHMSLUI,IN,2026-02-27T03:14:47.790963+00:00,2026-02-25T23:30:06Z,ମା’ ମହାଲକ୍ଷ୍ମୀଙ୍କ ସୁଦଶା ବ୍ରତ ମାହାତ୍ମ୍ୟ | Sudasha Brata Katha | Laxmi Puja | Namita Agrawal,ମା’ ମହାଲକ୍ଷ୍ମୀଙ୍କ ସୁଦଶା ବ୍ରତ ମାହାତ୍ମ୍ୟ | Sudasha Brata Katha | Laxmi Puja | Namita Agrawal,Namita Agrawal 2,UCa59pR8iMNFh5DMDJMPslDA,10,Music,"odia bhajan songs, traditional odia songs, namitaagrawal, Namitaagrawalbhajans, namita agrawal channel, namita agrawal bhajan, namita agrawal new bhajan, namita new bhajan, namita agrawal 2, namita agrawal channel 2, Sudasha Brata Katha, Namita Agrawal Laxmi Bhajan, Complete Sudasha Brata Story, Maa Mahalakshmi Puja Odia, Sudasha Brata 2026, Odia Brata Katha Namita Agrawal, Laxmi Puja Katha Odia, Significance of Sudasha Brata, Best Odia Devotional Songs, Sudasha Brata Mahatmya",20,https://i.ytimg.com/vi/C6BAwHMSLUI/hqdefault.jpg,or,or,False,1366,PT22M46S,hd,False,True,False,False,174145,1625,120
w09RpSumTX8,IN,2026-02-27T03:14:47.790971+00:00,2026-02-25T13:00:03Z,BTS WORLD TOUR 'ARIRANG' LIVE VIEWING IN GOYANG & JAPAN Main Trailer,BTS WORLD TOUR 'ARIRANG' LIVE VIEWING IN GOYANG & JAPAN Main Trailer,BANGTANTV,UCLkAepWjdylmXSltofFvsYQ,10,Music,"방탄소년단, BTS, BANGTAN, 알엠, RM, 슈가, SUGA, 제이홉, jhope, 지민, 정국, k-pop, 방탄, j-hope, Jung Kook, Jimin, BTS V, Jin",18,https://i.ytimg.com/vi/w09RpSumTX8/hqdefault.jpg,ko,ko,False,37,PT37S,hd,False,True,False,False,603077,153408,8735
iJpOO9jcOD0,IN,2026-02-27T03:14:47.790980+00:00,2026-02-26T01:40:01Z,🤣Franklin Playing Holi in Indian Bike Driving 3D Vs GTA 5!,🤣Franklin Playing Holi in Indian Bike Driving 3D Vs GTA 5!,Play With Darsh,UC4SCqflItpQaHGCeBUKcl-w,20,Gaming,"indian bike driving 3d, indian bikes driving 3d, indian bike driving, indian bikes driving, indian bike driving 3d game, indian bike driving 3d video, indian bike driving 3d gameplay, franklin playing holi in indian bike driving 3d vs gta 5, franklin playing holi, franklin celebrate holi, indian bike driving 3d holi, indian bike driving 3d happy holi, holi in gta 5, gta 5, gta 5 holi, holi 2026, harsh tatsuya, raezy bhai, raezy, tiox play, Play With Darsh, play with darsh",22,https://i.ytimg.com/vi/iJpOO9jcOD0/hqdefault.jpg,en-IN,hi,False,911,PT15M11S,hd,False,True,False,False,187970,855,15
bLXlDYLPGiI,IN,2026-02-27T03:14:47.790987+00:00,2026-02-22T15:56:46Z,"Hum Jante Hai Tum Hame Barbad Karoge - HDR Video | Alka Yagnik, Vinod Rathod | Hindi Sad Song 💔🌹","Hum Jante Hai Tum Hame Barbad Karoge - HDR Video | Alka Yagnik, Vinod Rathod | Hindi Sad Song 💔🌹",Udaan Muzik,UC_OJheCZcxdem2zO3R1ARAQ,22,People & Blogs,"Hum Jaante Hai Tum Hame Barbad Karoge, Hum Jante Hai, Dil Phir Bhi Tumhe Dete Hai, Dil Phir Bhi Tumhe Dete Hai Kya Yaad Karoge, 90s Old Song, 90s Evergreen Song, 90s Hindi Song, 90s Sad Song, Udit Narayan Songs, Udit Narayan Old Song, Hum Jante Hai Video Song, Hum Jaante Hai HD Video, Hindi Song, Hindi Sad Song, Alka Yagnik Hindi Song, 90s Jhankar, Jhankar Hindi Song, Jhankar Sad Song, Alka Yagnik Popular Song, Alka Yagnik Sad Song, Alka Yagnik 90s Song",21,https://i.ytimg.com/vi/bLXlDYLPGiI/hqdefault.jpg,en,hi,False,487,PT8M7S,hd,False,True,False,False,776820,1317,13
YFT0E9uP3do,IN,2026-02-27T03:14:47.790995+00:00,2026-02-25T01:30:36Z,Action Trailer | #Khesari Lal Yadav | AganiPariksha | Akanksha Puri | Neelam Giri | New Movie 2026,Action Trailer | #Khesari Lal Yadav | AganiPariksha | Akanksha Puri | Neelam Giri | New Movie 2026,Sur Music ,UCW1BEAegBZdCOq4M7JtDSQw,10,Music,"khesari lal yadav, khesari lal yadav bhojpuri movie, khesari lal yadav film, khesari lal yadav new song, khesari lal yadav bhojpuri movie trailer, neelam giri new video, akanskha puri new video, akanksha puri movie trailer, neelam giri bhojpuri movie, neelam giri bhojpuri movie new, अग्निपरीक्षा, Aganipariksha, sur music, khesari lal yadav bhojpuri film, dinesh lal yadav movie trailer, pawan singh movie trailer, bhojpuri movie, bhojpuri film, Akansha Puri movie",19,https://i.ytimg.com/vi/YFT0E9uP3do/hqdefault.jpg,en,hi,False,79,PT1M19S,hd,False,True,False,False,197075,14554,714
qFtWx4xzfgI,IN,2026-02-27T03:14:47.791003+00:00,2026-02-26T07:30:24Z,Minecraft But There Are Super OP Items !!,Minecraft But There Are Super OP Items !!,Mc flame,UCTyg-vQ70A1m0lB1cLbu38Q,20,Gaming,"mc flame, minecraft, mc flame trolling sister, Minecraft, trolling sister in minecraft, mc flame trolling his sister, troll, kartik troll gauri, minecraft but, minecraft but super op items, super op items in minecraft, Minecraft But There Are Super OP Items !!, Minecraft But There Are Super OP Items in world !!",13,https://i.ytimg.com/vi/qFtWx4xzfgI/hqdefault.jpg,en,hi,False,929,PT15M29S,hd,False,True,False,False,195160,3349,105
lbEtG0ZjyJA,IN,2026-02-27T03:14:47.791011+00:00,2026-02-24T14:31:01Z,"Aaya Sher (From ""The Paradise"") (Telugu)","Aaya Sher (From ""The Paradise"") (Telugu)",Anirudh Ravichander - Topic,UCbRSywya_rl8YS15Lo9ttsA,10,Music,"Anirudh Ravichander, Jangi Reddy, Arjun Chandy, Kasarla Shyam, Aaya Sher (From ""The Paradise"") (Telugu)",5,https://i.ytimg.com/vi/lbEtG0ZjyJA/hqdefault.jpg,en,te,False,287,PT4M47S,hd,False,True,False,False,773467,24070,294
WMJg7qP14kM,IN,2026-02-27T03:14:47.791018+00:00,2026-02-25T13:47:20Z,YAADEIN - Ek Doctor Do Zindagiyaan  | Trailer | Coming Soon | New Show | Sony SAB,YAADEIN - Ek Doctor Do Zindagiyaan  | Trailer | Coming Soon | New Show | Sony SAB,Sony SAB,UC6-F5tO8uklgE9Zy8IvbdFw,24,Entertainment,,0,https://i.ytimg.com/vi/WMJg7qP14kM/hqdefault.jpg,en,hi,False,110,PT1M50S,hd,False,True,False,False,146565,3059,254
rguRpw-xl_U,IN,2026-02-27T03:14:47.791026+00:00,2026-02-24T06:45:04Z,Can I Save Her From THE PROTOTYPE ?  (Poppy Playtime Chapter 5),Can I Save Her From THE PROTOTYPE ?  (Poppy Playtime Chapter 5),Mythpat,UCx6F-rETGiz7xf_vkMmX2yQ,20,Gaming,"poppy playtime chapter 5, mythpat huggy wuggy, poppy mythpat",3,https://i.ytimg.com/vi/rguRpw-xl_U/hqdefault.jpg,en,hi,False,3033,PT50M33S,hd,False,True,False,False,1595062,41472,5056
