video_id,country,fetched_at,published_at,title,localized_title,channel_title,channel_id,category_id,category_name,tags,tag_count,thumbnail,default_language,audio_language,is_live,duration,duration_raw,definition,caption_available,licensed_content,embeddable,made_for_kids,views,likes,comments
DrJ2yPlBTq8,KE,2026-03-01T03:27:56.508566+00:00,2026-02-19T15:06:04Z,TOXIC LYRIKALI - BAD EVERYDAY (Audio).,TOXIC LYRIKALI - BAD EVERYDAY (Audio).,Toxic Lyrikali,UC7q5EQvi2fJTQvwZRi0QJnw,10,Music,,0,https://i.ytimg.com/vi/DrJ2yPlBTq8/hqdefault.jpg,sw,sw,False,172,PT2M52S,hd,False,False,False,False,782184,44391,7126
gZPtK-rE4IE,KE,2026-03-01T03:27:56.508604+00:00,2026-02-23T20:17:58Z,AFRICAN HOME: THE COVENANT | TRAILER,AFRICAN HOME: THE COVENANT | TRAILER,SamSpedy TV,UCEuMxZxgHqrVXzwd5julx8Q,24,Entertainment,,0,https://i.ytimg.com/vi/gZPtK-rE4IE/hqdefault.jpg,en,en,False,96,PT1M36S,hd,False,True,False,False,73180,1837,156
-FId1SVkfMw,KE,2026-03-01T03:27:56.508616+00:00,2026-02-25T20:01:47Z,Franklin's GARAGE UPGRADE in GTA 5!,Franklin's GARAGE UPGRADE in GTA 5!,Nought,UCSh__r5HS4Y1xBkccWnV0TA,20,Gaming,"garage, secret, hidden, car, supercar, gta 5 car, gta 5 supercar, gta 5 garage, gta 5 secret, gta 5 hidden, gta 5 franklin, gta 5 franklins house, house, new, mods, gta 5, gta v, gta 5 mods, gta v mods, gaming, nought gta 5, underground, underground garage, upgrade, garage upgrade, money, gta 5 money, cash, gta 5 cash, vehicles",30,https://i.ytimg.com/vi/-FId1SVkfMw/hqdefault.jpg,en,en,False,1625,PT27M5S,hd,False,True,False,False,201304,10103,158
QoVNXwYZlRM,KE,2026-03-01T03:27:56.508626+00:00,2026-02-22T15:09:58Z,BURUKLYN BOYZ - GENJE SANA (Official Music Video),BURUKLYN BOYZ - GENJE SANA (Official Music Video),BURUKLYN BOYZ,UCoJ0b8z-FS_tuissbov-UUA,10,Music,,0,https://i.ytimg.com/vi/QoVNXwYZlRM/hqdefault.jpg,en,sw,False,250,PT4M10S,hd,False,True,False,False,500943,26362,2433
b24oG7qCwp4,KE,2026-03-01T03:27:56.508634+00:00,2026-02-25T18:01:17Z,Mortal Kombat II | Official Trailer II,Mortal Kombat II | Official Trailer II,Warner Bros.,UCjmJDM5pRKbUlVIzDYYWb6g,1,Film & Animation,"2026, Action, Adeline Rudolph, Adventure, Battle, Chin Han, Coming Soon, Damon Herriman, Fantasy, Film, Film Trailer, Film Warner, Game, Hiroyuki Sanada, Jessica McNamee, Joe Taslim, Josh Lawson, Karl Urban, Lewis Tan, Ludi Lin, MMA Fighter, Martial Arts, Mehcad Brooks, Mortal Kombat, Mortal Kombat II, Movie, Official Trailer, Simon McQuoid, Tadanobu Asano, Tati Gabrielle, Trailer, Video Game, WB, Warner, Warner Bros, Warner Brothers, Warner Media",37,https://i.ytimg.com/vi/b24oG7qCwp4/hqdefault.jpg,en,en-US,False,145,PT2M25S,hd,True,False,False,False,12908221,178609,10064
72Y_Fh6M9fw,KE,2026-03-01T03:27:56.508643+00:00,2026-02-27T12:00:20Z,JJ and Mikey: POOR vs RICH MOUNTAIN HOUSE BATTLE in Minecraft - Maizen,JJ and Mikey: POOR vs RICH MOUNTAIN HOUSE BATTLE in Minecraft - Maizen,Maizen - Minecraft Family,UCWqlr0TNvdFl7sv6zHR8IvA,20,Gaming,"mikey and jj, jj and mikey, zenichi, maizen sisters, Maizen, mikey, jj, maizen minecraft, jj and mikey minecraft, jj vs mikey, maizen family, jj and mikey family, maizen prank, maizen battle, jj and mikey battle, base battle, house battle, poor vs rich, maizen poor vs rich, jj and mikey poor vs rich, minecraft poor vs rich, mountain house, mountain base",23,https://i.ytimg.com/vi/72Y_Fh6M9fw/hqdefault.jpg,en,en,False,962,PT16M2S,hd,False,True,False,False,266935,1355,20
tcEFkqD9cx0,KE,2026-03-01T03:27:56.508651+00:00,2026-02-20T15:00:07Z,"Vybz Kartel, Shenseea - PANIC (Official Music Video)","Vybz Kartel, Shenseea - PANIC (Official Music Video)",VybzKartelVEVO,UCeRe0C1x1w8We6ghjVn4M5w,10,Music,"kartel, worl boss, vybz kartel and shenseea panic, god and time, jamaica dancers, bam bam, murder she wrote, ludi, sheng yeng, chronic law, friday, tj records, vibes, new music, trending, gaza, dancehall party, turn it up, sexy ladies, rude boy, badart, 444, zojak world wide, loodi, drake, skillibeng, skippa, miami, jamaica, teacha, fever",31,https://i.ytimg.com/vi/tcEFkqD9cx0/hqdefault.jpg,en,en,False,132,PT2M12S,hd,False,True,False,False,1921315,80256,5130
S9_Dsvhsa5g,KE,2026-03-01T03:27:56.508659+00:00,2026-02-18T16:51:15Z,BINTI NGUVA _ TRAILER ,BINTI NGUVA _ TRAILER ,ZEBUU FILM,UCdxjNsHNmFlhNg-NuNNYdeA,23,Comedy,,0,https://i.ytimg.com/vi/S9_Dsvhsa5g/hqdefault.jpg,en,en-US,False,179,PT2M59S,hd,False,True,False,False,171554,4318,385
94rHafoeHms,KE,2026-03-01T03:27:56.508667+00:00,2026-02-23T11:00:22Z,"100 Days, But Plane Crash!","100 Days, But Plane Crash!",Maizen,UCJHBJ7F-nAIlMGolm0Hu4vg,20,Gaming,"Minecraft, Maizen",2,https://i.ytimg.com/vi/94rHafoeHms/hqdefault.jpg,en,en,False,3860,PT1H4M20S,hd,False,True,False,False,1629243,13075,1237
PB-kj8IOKnU,KE,2026-03-01T03:27:56.508675+00:00,2026-02-17T06:59:18Z,Prince Indah - Mirima (Official Video) sms SKIZA 9846021 to 811,Prince Indah - Mirima (Official Video) sms SKIZA 9846021 to 811,"Prince Indah, OGW",UCwN-NLEsOx7cCiBeGap9LSA,10,Music,"Kenya, Prince Indah, Emma Jalamo, Ohangla, Luo Rhumba, Luo Music, Kisumu, Prince Indah latest songs, Freddy Mopao Prince Indah, Weche Hera Prince Indah, Weche Singo, Maria Prince Indah, Zena Prince Indah, Opija Father, Zainabu, Sigand Luo Prince Indah, Washington Jakadel, Raila Odinga, Kenyan politics, NASA, ODM, Nyakisumo Part 2, Adeka Engineer Prince Indah, Angeli, Uchumi Prince Indah, Ken Soldier, Cynderella Prince Indah., mirima, prince indah mirima, timeless anthems",30,https://i.ytimg.com/vi/PB-kj8IOKnU/hqdefault.jpg,en,sw,False,366,PT6M6S,hd,False,True,False,False,492907,12647,1301
lcvUGs3xaDM,KE,2026-03-01T03:27:56.508683+00:00,2026-02-19T14:00:01Z,Peaky Blinders: The Immortal Man | Official Trailer | Netflix,Peaky Blinders: The Immortal Man | Official Trailer | Netflix,Netflix,UCWOA1ZGywLbqmigxE4Qlvuw,24,Entertainment,"Barry Keoghan, Cillian Murphy, Conspiracy, Netflix, Netflix 2026, New on Netflix, Packy Lee, Peaky Blinders, Rebecca Ferguson, Sophie Rundle, Stephen Graham, Steven Knight, Tense, The Immortal Man, Tim Roth, Tom Harper, Tommy Shelby, Trailer, drama, film",20,https://i.ytimg.com/vi/lcvUGs3xaDM/hqdefault.jpg,en,en-US,False,160,PT2M40S,hd,True,True,False,False,5726936,166214,5722
qk_CpSojjsU,KE,2026-03-01T03:27:56.508691+00:00,2026-02-27T04:46:38Z,ROBLOX SAIL FOR BRAINROTS..,ROBLOX SAIL FOR BRAINROTS..,Foltyn,UCRkuUgtDAL4XSU5jB40J_wA,20,Gaming,"foltyn, foltyn roblox, roblox, roblox foltyn, foltyn family, funny, no swearing, foltyn family roblox, roblox foltyn family, blade ball, roblox blade ball, foltyn blade ball, roblox sail for brainrots, foltyn and caylus playing roblox, foltyn and caylus playing roblox steal a brainrot, foltyn and caylus playing roblox together, foltyn brainrot, foltyn roblox brainrot",18,https://i.ytimg.com/vi/qk_CpSojjsU/hqdefault.jpg,en,en-US,False,977,PT16M17S,hd,False,True,False,False,862226,20924,2180
VIikJ-Eq-NY,KE,2026-03-01T03:27:56.508698+00:00,2026-02-18T09:00:06Z,ALEX KASAU KATOMBI-RETIRE(OFFICIAL AUDIO),ALEX KASAU KATOMBI-RETIRE(OFFICIAL AUDIO),Alex Kasau Katombi,UCWFv8hpX1Xj03kJFsP9MmRA,10,Music,"alex, kasau, katombi, ngulumende, mwanosu, nguuni, lovers",7,https://i.ytimg.com/vi/VIikJ-Eq-NY/hqdefault.jpg,sw,en-US,False,363,PT6M3S,hd,False,True,False,False,309952,12860,2351
i6w7O1kwuBk,KE,2026-03-01T03:27:56.508706+00:00,2026-02-19T16:00:06Z,House of the Dragon Season 3 | Official Teaser | HBO Max,House of the Dragon Season 3 | Official Teaser | HBO Max,HBO Max,UCx-KWLTKlB83hDI6UKECtJQ,24,Entertainment,"hbo max, hbo, hbo originals, hbo original series, hbo trailer, new on hbo, max, hbo max originals, hbo max trailer, hbo max teaser, hbo max series, hbo max youtube, house of the dragon, house of the dragon season 3, HOTD, house targaryen, rhaenyra targaryen, emma d'arcy, daemon targaryen, matt smith, alicent hightower, olivia cooke, aegon targaryen, tom glynn-carney, aemond targaryen, ewan mitchell, dragons, ser criston cole, fabien frankel, house of the dragon new season",30,https://i.ytimg.com/vi/i6w7O1kwuBk/hqdefault.jpg,en,en,False,94,PT1M34S,hd,True,True,False,False,4494240,135098,7464
g7bd4oRRo-k,KE,2026-03-01T03:27:56.508714+00:00,2026-02-26T10:00:06Z,الرجل العنكبوت انقاذ باتمان Spider-Man Rescue batman vs iron man vs venom funny Game GTA 5 superhero,الرجل العنكبوت انقاذ باتمان Spider-Man Rescue batman vs iron man vs venom funny Game GTA 5 superhero,GTA HYPE,UCj9LqhHxYUOU6_J4Z3x7lKw,10,Music,,0,https://i.ytimg.com/vi/g7bd4oRRo-k/hqdefault.jpg,en,en,False,1302,PT21M42S,hd,False,True,False,False,2213500,82182,6514
Uriu2ai0BYg,KE,2026-03-01T03:27:56.508722+00:00,2026-02-20T07:00:07Z,BAHATI - MATAMU (Official Music Video),BAHATI - MATAMU (Official Music Video),Bahati Kenya,UC2O6vD7gjgZIXKVegD6qOHA,10,Music,"Matamu, First love, first love by bahati, Bahati, Bahati kenya, Bahati new music, trending bahati music, trending, kenya, kenyan music, bahati trending, trending kenyan music, emotional, tanzania, ccm, mama samia, tundu lisu, wasafi, diamond platinumz, jux, tanzanian music, tanzania latest news, love, love letter, dear first love",25,https://i.ytimg.com/vi/Uriu2ai0BYg/hqdefault.jpg,sw,sw,False,193,PT3M13S,hd,False,True,False,False,330701,20069,1658
SWS25mIWTBM,KE,2026-03-01T03:27:56.508730+00:00,2026-02-27T15:00:53Z,I Became a WOLF KING in Minecraft!,I Became a WOLF KING in Minecraft!,Cash,UC0eLBYhxW9HC0P9PXQ73mpQ,24,Entertainment,"Cash, Nico, Nico and Cash, Cash and Nico, Minecraft, Minecraft mod, family friendly, kid friendly, I Became a WOLF KING in Minecraft!",9,https://i.ytimg.com/vi/SWS25mIWTBM/hqdefault.jpg,en,en-US,False,1177,PT19M37S,hd,False,True,False,False,483253,4991,795
CeK2uA-9Ymk,KE,2026-03-01T03:27:56.508737+00:00,2026-02-26T11:02:53Z,EV. JOHN KAY- NAINGANISYA,EV. JOHN KAY- NAINGANISYA,EV. JOHN KAY OFFICIAL,UCwL6cesRr2srp-J0rhpPuSA,10,Music,"Ev John Kay, Kenyan music, Gospel music, Kamba gospel music, Best of John kay music, John Kay, Best of kamba music, Wilberforce musyoka, Stephen kasolo, Purity kateiko",10,https://i.ytimg.com/vi/CeK2uA-9Ymk/hqdefault.jpg,en,sw,False,365,PT6M5S,hd,False,True,False,False,68209,5063,642
ir5k49PKMHo,KE,2026-03-01T03:27:56.508745+00:00,2026-02-25T11:44:28Z,Everton vs Manchester United | English Premier League 2026 | PES 21 Simulation Gameplay,Everton vs Manchester United | English Premier League 2026 | PES 21 Simulation Gameplay,Football Gamer Rony,UCaopyJz-EIXOXYXSMOC6c-g,20,Gaming,"manchester united, manchester united f.c., everton vs man utd, sporty tv live, live football match online today, football live match today, football live, manchester united vs everton, manchester united vs everton live, mu vs everton, man u vs everton, แมนยูล่าสุด, live, liga inggris, live football, man united vs everton, premier league live match today, mu, today football match live, football, sporty tv live stream, football highlights",22,https://i.ytimg.com/vi/ir5k49PKMHo/hqdefault.jpg,en,en,False,913,PT15M13S,hd,False,True,False,False,247598,1098,0
BoMELShy1_o,KE,2026-03-01T03:27:56.508753+00:00,2026-02-12T08:02:46Z,Diamond Platnumz - Natulizana (Official Music Video),Diamond Platnumz - Natulizana (Official Music Video),Diamond Platnumz,UCev-b-xy-p5fHK8x3zJyn1Q,10,Music,"wasafi, diamond, sikomi, niache, mbosso, kwangwaru, rayvanny, lavalava, diamondplatnumz, eneka, waka, hallelujah, nana, kidogo, fire, kamwambie, harmonize, makulusa, baila, pamela, iyena, baikoko, nikuone, sijaona, tetema, kainama, niteke, simba, jeje, gere, kanyaga, sound, wizkid, davido, despacito, inama, foa, trending music, ckay, zuchu, waah, chris brown, drake, burna boy, amapiano, tutorial, nawaza, africa, tanzania, naija, yanga, music, diamond music, trending, top music",55,https://i.ytimg.com/vi/BoMELShy1_o/hqdefault.jpg,en,en,False,282,PT4M42S,hd,False,True,False,False,4308089,76726,6600
VXAEZFWySkg,KE,2026-03-01T03:27:56.508761+00:00,2026-02-27T15:53:22Z,ROBLOX DIVE FOR BRAINROTS..,ROBLOX DIVE FOR BRAINROTS..,FoltynPlays,UC2uQvUg3YYzoOtj1yZLT0Ow,20,Gaming,"Foltyn, foltynplays, roblox, roblox gaming, family friendly, foltyn family, foltyn family roblox, foltyn roblox, roblox foltyn, no cursing, blox fruits, roblox blox fruits, roblox blox fruit, roblox fruits in blox fruits, blox fruit roblox, blox fruit, roblox dive for brainrots, foltyn brainrot, foltyn and caylus playing roblox, foltyn roblox brainrot",20,https://i.ytimg.com/vi/VXAEZFWySkg/hqdefault.jpg,en,en-US,False,719,PT11M59S,hd,False,True,False,False,518350,9336,1020
k07dNNU-adw,KE,2026-03-01T03:27:56.508769+00:00,2026-02-10T11:00:07Z,MEJJA & TOXIC LYRIKALI - MANIFEST [Official Video],MEJJA & TOXIC LYRIKALI - MANIFEST [Official Video],Mejja Genge,UCuRGQqKKdPOSPB0XG5VNk5g,10,Music,"Mejja, Genge, new song, TOXIC LYRIKALI, IYANII, KHALIGRAPH JONES, Watendawili, LOWKEY, MBOSSO, FURTHERMOH, BIEN",11,https://i.ytimg.com/vi/k07dNNU-adw/hqdefault.jpg,en,sw,False,180,PT3M,hd,False,True,False,False,1404108,56006,3033
Pvoil5V5fKg,KE,2026-03-01T03:27:56.508776+00:00,2026-02-27T15:01:00Z,The Roblox Legend Who Faked Her Death...,The Roblox Legend Who Faked Her Death...,CubeINC,UCMt7QccSCUZgp-qrLLYVybA,20,Gaming,"roblox, roblox arg, arg, cubeinc, story, roblox story",6,https://i.ytimg.com/vi/Pvoil5V5fKg/hqdefault.jpg,en,en,False,1465,PT24M25S,hd,False,True,False,False,637262,19497,2488
ItOJzKh2wL0,KE,2026-03-01T03:27:56.508784+00:00,2026-02-26T14:00:06Z,PASINAAI _ SANINGO DIMERO OFFICIAL VIDEO 4K,PASINAAI _ SANINGO DIMERO OFFICIAL VIDEO 4K,Saningo Dimero Official ,UCzUrAKngCfEbR0KGOR2YRDw,10,Music,,0,https://i.ytimg.com/vi/ItOJzKh2wL0/hqdefault.jpg,en,en-GB,False,187,PT3M7S,hd,False,True,False,False,37326,2523,532
ixatpa7oYj4,KE,2026-03-01T03:27:56.508804+00:00,2026-02-27T12:01:24Z,ESCAPING FIELD TRIP Z IN ROBLOX!!,ESCAPING FIELD TRIP Z IN ROBLOX!!,Avocado Playz,UCqA5tXN003u-18CKSICLDdg,20,Gaming,,0,https://i.ytimg.com/vi/ixatpa7oYj4/hqdefault.jpg,en,en,False,961,PT16M1S,hd,False,True,False,False,499940,15371,2043
w6GcBXUU0WU,KE,2026-03-01T03:27:56.508813+00:00,2026-02-12T16:49:59Z,Nameless feat Marioo - Nasinzia II (Clip Officiel),Nameless feat Marioo - Nasinzia II (Clip Officiel),MariooOfficial,UCgZGpR80Z-x5fnUsKuKM2kg,10,Music,"Tanzania, Kenya, Uganda, Marioo, BongoFlava, music, africa, mariooofficial, marioo255, thisismarioo, omaryallymwanga, marioomusic, marioonewmusic, marioosongs, marioohits, Nameless, Nasinzia, Nasinzia remix, Nasinzia II, Trending Music",20,https://i.ytimg.com/vi/w6GcBXUU0WU/hqdefault.jpg,en,sw,False,183,PT3M3S,hd,False,True,False,False,1930647,28627,3205
6MYDmVKcbgM,KE,2026-03-01T03:27:56.508821+00:00,2026-02-27T11:00:20Z,I PLAY Spin The Bottle With E-GIRLS,I PLAY Spin The Bottle With E-GIRLS,Zoomy,UCJnH5Ph5O1EZhKiKiNgH9IA,20,Gaming,"Steal a Brainrot, StealABrainrot, Steal a Brainrot Shorts, Steal a Brainrot Roblox, Steal a Brainrot funny moments, Steal a Brainrot clips, Steal a Brainrot meme, Steal a Brainrot animation, Steal a Brainrot gameplay, Steal a Brainrot story, Steal a Brainrot edit, Steal a Brainrot compilation, Steal a Brainrot scenes, Steal a Brainrot reaction, Roblox Steal a Brainrot, Roblox Shorts, Roblox funny, Roblox meme, Roblox edit, Roblox animation, Roblox gameplay, Roblox short film",22,https://i.ytimg.com/vi/6MYDmVKcbgM/hqdefault.jpg,en,en,False,1202,PT20M2S,hd,False,True,False,False,572895,5505,130
VRWltvaZm_k,KE,2026-03-01T03:27:56.508828+00:00,2026-02-27T13:00:07Z,Ssaru - Mi Amor Feat Trio Mio,Ssaru - Mi Amor Feat Trio Mio,Ssaru,UC7dCFKu_W8-veV354axaPOg,10,Music,"Saru, Tio Mio, Toxic lyrikali, buruklyn boyz, stima, mi amor, khaligraph, fathermoh, mejja, genge, tiktok, trending, newsong, crazy, love, genge love",16,https://i.ytimg.com/vi/VRWltvaZm_k/hqdefault.jpg,en,hi,False,182,PT3M2S,hd,False,True,False,False,64867,4825,423
mreHPL2IqYA,KE,2026-03-01T03:27:56.508836+00:00,2026-02-27T14:01:19Z,I Became A Getaway Driver In A Submarine Car on GTA 5,I Became A Getaway Driver In A Submarine Car on GTA 5,TechyCrew,UCTU3m4rCUS-7qXuHK-j9Uqw,20,Gaming,"Techy, TechyCrew, Among Us, Fortnite, Fortnite Creative, Roblox, Techy Roblox, Among Us Roles",8,https://i.ytimg.com/vi/mreHPL2IqYA/hqdefault.jpg,en,en,False,809,PT13M29S,hd,False,True,False,False,310227,5033,314
pVfJK7UYrng,KE,2026-03-01T03:27:56.508843+00:00,2026-02-13T17:00:06Z,DJ KEZZ FT MSANII MUSIC GROUP - USHUHUDA [ Official Music Video ],DJ KEZZ FT MSANII MUSIC GROUP - USHUHUDA [ Official Music Video ],Dj Kezz ,UCtC78gcqVoLlTq68p1z8x2Q,10,Music,"dj kezz, dj kezz music, msanii music group, msanii records, swahili gospel songs, gospel music, afrobeats",7,https://i.ytimg.com/vi/pVfJK7UYrng/hqdefault.jpg,en,en-US,False,309,PT5M9S,hd,False,True,False,False,474330,8038,778
HR6Vn0UlSq0,KE,2026-03-01T03:27:56.508851+00:00,2026-02-25T16:00:22Z,I Added MARRIAGE In Steal a Brainrot,I Added MARRIAGE In Steal a Brainrot,Techys,UCoRjsuzMh-MqfRjvlqaVLPw,20,Gaming,,0,https://i.ytimg.com/vi/HR6Vn0UlSq0/hqdefault.jpg,en,en,False,859,PT14M19S,hd,False,True,False,False,636305,20125,729
4oQt2NaT0vA,KE,2026-03-01T03:27:56.508859+00:00,2026-02-24T12:07:48Z,JOHN MBAKA - NIMUVEA AMAITHA (OFFICIAL VIDEO),JOHN MBAKA - NIMUVEA AMAITHA (OFFICIAL VIDEO),John Mbaka,UCfYDawG-dYkIpLl8mKmpraQ,10,Music,,0,https://i.ytimg.com/vi/4oQt2NaT0vA/hqdefault.jpg,en,sw,False,348,PT5M48S,hd,False,True,False,False,65211,2812,413
0NT9B8tLKJc,KE,2026-03-01T03:27:56.508866+00:00,2026-02-27T20:00:01Z,"I Spent $6,900,000 on the Biggest Plane in GTA 5…","I Spent $6,900,000 on the Biggest Plane in GTA 5…",Daaash,UCdtoloDKybNstNxtT38YTAg,20,Gaming,"dash, roblox, dash roblox, dash minecraft, minecraft, minecraft mod, I Spent $6900000 on the Biggest Plane in GTA 5…",7,https://i.ytimg.com/vi/0NT9B8tLKJc/hqdefault.jpg,en,en,False,1348,PT22M28S,hd,False,True,False,False,276606,3204,299
eeTs8_fASps,KE,2026-03-01T03:27:56.508873+00:00,2026-02-25T09:15:07Z,Zzero Sufuri & Kapitani - Ni Mbaya  (Official Video),Zzero Sufuri & Kapitani - Ni Mbaya  (Official Video),zzero sufuri,UCrzUaLwpZQ1UkDu5rkz_K1g,10,Music,"zzero sufuri, kenya, kenyan music, Zimenishika, Ngomma",5,https://i.ytimg.com/vi/eeTs8_fASps/hqdefault.jpg,en,en,False,194,PT3M14S,hd,False,True,False,False,57979,3970,399
960ndpcrexs,KE,2026-03-01T03:27:56.508880+00:00,2026-02-25T20:14:32Z,"Spending $9,985,547 in Roblox Spear Training!","Spending $9,985,547 in Roblox Spear Training!",RoBros,UCP7tE6906s2QBlonjrEETnw,20,Gaming,"Roblox, Foltyn, Chex, NateDaGreat, foltyn roblox, foltyn family, roblox foltyn, family friendly, funny, no swearing, foltyn family roblox, roblox foltyn family",12,https://i.ytimg.com/vi/960ndpcrexs/hqdefault.jpg,en,en-US,False,671,PT11M11S,hd,False,True,False,False,293311,3609,322
stWInhgWCKM,KE,2026-03-01T03:27:56.508888+00:00,2026-02-27T13:00:06Z,Silverstone Barz ft. Mr Right – Stick  (Official Video),Silverstone Barz ft. Mr Right – Stick  (Official Video),SilversTone Barz,UCT94Y4xZwt0P5Kzqh5HV-sA,10,Music,,0,https://i.ytimg.com/vi/stWInhgWCKM/hqdefault.jpg,en-US,en-US,False,156,PT2M36S,hd,False,False,False,False,57225,4866,352
G2FKSkgFnnA,KE,2026-03-01T03:27:56.508895+00:00,2026-02-28T11:13:21Z,I Hired an Escape Tsunami PRO To Troll My Friend,I Hired an Escape Tsunami PRO To Troll My Friend,GaraBLOX,UChoPejdaVo_Z-YJaMFvm8kw,20,Gaming,"gara, gara roblox, gara and kylie, garablox, omz, cash, nico, cash and nico, johnny and marty, johnny minecraft, crazy fan girls, roblox crazy fangirls",12,https://i.ytimg.com/vi/G2FKSkgFnnA/hqdefault.jpg,en,en,False,820,PT13M40S,hd,False,True,False,False,148654,2120,170
lVa7BHePg1o,KE,2026-03-01T03:27:56.508902+00:00,2026-02-18T02:15:52Z,OnlyMoh - Osama [Official Music Video]                       ,OnlyMoh - Osama [Official Music Video]                       ,OnlyMoh,UCW-fTudeXEk6ER8fc9WkOTQ,10,Music,,0,https://i.ytimg.com/vi/lVa7BHePg1o/hqdefault.jpg,sw,hi,False,189,PT3M9S,hd,False,True,False,False,158243,6670,501
XrAoDZLZZ1g,KE,2026-03-01T03:27:56.508909+00:00,2026-02-28T17:00:01Z,1 Minute vs 10 Year Build Challenge,1 Minute vs 10 Year Build Challenge,MrBeast Gaming,UCIPPMRA040LQr5QPyJEbmXA,20,Gaming,,0,https://i.ytimg.com/vi/XrAoDZLZZ1g/hqdefault.jpg,en,en,False,864,PT14M24S,hd,True,True,False,False,3872884,129362,6112
n_csDS1ZTIQ,KE,2026-03-01T03:27:56.508916+00:00,2026-02-17T13:42:38Z,Eko Dydda and J-Blessing - Anakushapre (Official Video),Eko Dydda and J-Blessing - Anakushapre (Official Video),Eko Dydda,UCpsWoj5nDEimQCQhDpyOnEg,10,Music,"Eko Dydda, EkoDydda, #EkoDydda",3,https://i.ytimg.com/vi/n_csDS1ZTIQ/hqdefault.jpg,en,en-GB,False,220,PT3M40S,hd,True,False,False,False,210477,10907,1134
WZlmuaxzEfE,KE,2026-03-01T03:27:56.508923+00:00,2026-02-27T18:41:56Z,DAME TU COSITA vs Security House JJ and Mikey in Minecraft Maizen Challenge,DAME TU COSITA vs Security House JJ and Mikey in Minecraft Maizen Challenge,Mikey and JJ +,UCBqJlEMoHyur2fHOUla5jhA,20,Gaming,"jj and mikey minecraft, maizen, minecraft, mikey turtle, mizen, maizen minecraft, mikey jj, jj, mikey, minecraft but, minecraft funny, mikey and jj, maizen mikey jj, jj and mike, mike and jj, jj and mikey monster, jj and mikey maizen, mikey and, jj mikey, minecraft meme, minecraft maizen, maizen new video, jayjay mikey maizen, maizen parody, JJ and Mikey Watch, security house, maizen security house, Kpop Demon Hunters, dame tu cosita",29,https://i.ytimg.com/vi/WZlmuaxzEfE/hqdefault.jpg,en,en-US,False,1995,PT33M15S,hd,False,True,False,False,158221,852,36
2GJfWMYCWY0,KE,2026-03-01T03:27:56.508931+00:00,2026-02-27T05:00:07Z,BLACKPINK - ‘GO’ M/V,BLACKPINK - ‘GO’ M/V,BLACKPINK,UCOmHUn--16B90oW2L6FRR3A,10,Music,"YG Entertainment, YG, 와이지, K-pop, BLACKPINK, 블랙핑크, 블핑, 제니, 로제, 리사, 지수, LISA, JISOO, JENNIE, ROSÉ, BLINK, 블링크, JENNIE You & Me, JENNIE You and ME, You & Me, You and Me, 제니 You & Me, 제니 You and Me, 제니 유앤미, 유앤미, JENNIE 유앤미, 제니 코첼라, JENNIE COACHELLA",28,https://i.ytimg.com/vi/2GJfWMYCWY0/hqdefault.jpg,en,ko,False,202,PT3M22S,hd,True,True,False,False,27350400,2954268,247545
1JA3NQpa4iI,KE,2026-03-01T03:27:56.508939+00:00,2026-02-26T21:15:00Z,We Changed Our Roblox Avatars Forever…,We Changed Our Roblox Avatars Forever…,Techy Plays,UCNDzLI-hyihpAx3zKtwhGZw,20,Gaming,"roblox, brookhaven, funnyroblox, techyblox, techy, crazy fan girls, crazy fan girl, my crazy fan girls",8,https://i.ytimg.com/vi/1JA3NQpa4iI/hqdefault.jpg,en,en,False,624,PT10M24S,hd,False,True,False,False,401620,21907,3490
y1-xUzZZ6Zw,KE,2026-03-01T03:27:56.508950+00:00,2026-02-25T10:51:18Z,Kana Nicko - Tunga Kila Wosie ( Official 4K Audio Visualizer),Kana Nicko - Tunga Kila Wosie ( Official 4K Audio Visualizer),Kana Nicko,UC9SBoTSFGw8okv4z2vQlhFg,10,Music,,0,https://i.ytimg.com/vi/y1-xUzZZ6Zw/hqdefault.jpg,en,kam,False,493,PT8M13S,hd,False,True,False,False,44805,1626,199
gxXvwqrE_KY,KE,2026-03-01T03:27:56.508957+00:00,2026-02-28T15:35:32Z,The Tiniest Speed Boost Hole Race In GTA 5...,The Tiniest Speed Boost Hole Race In GTA 5...,Techy,UCFmIhbx3_RkwlMLPA4Xv8-w,20,Gaming,"roblox, techy, techy plays, brookhaven, techyblox, techycrew, more techy",7,https://i.ytimg.com/vi/gxXvwqrE_KY/hqdefault.jpg,en,en,False,903,PT15M3S,hd,False,True,False,False,130771,3025,298
HsaXkeejbEA,KE,2026-03-01T03:27:56.508964+00:00,2026-02-20T20:00:12Z,"Mavado, Dj Mac, Crashdummy - Bad & Bbc Rich  (Official Music Video) | WYFL Riddim","Mavado, Dj Mac, Crashdummy - Bad & Bbc Rich  (Official Music Video) | WYFL Riddim",mavadoVEVO,UCatJfWW2FlnCIKq4S7Onk-g,10,Music,"Mavado, Dj Mac, Crashdummy, DJ Mac Music Crash Dummy, Dancehall",5,https://i.ytimg.com/vi/HsaXkeejbEA/hqdefault.jpg,en,en,False,139,PT2M19S,hd,False,True,False,False,1747669,58282,5253
godOGryVc8Q,KE,2026-03-01T03:27:56.508972+00:00,2026-02-27T10:05:01Z,JJ and Mikey TRAVEL inside MOON WAKES UP in Minecraft Challenge - Maizen,JJ and Mikey TRAVEL inside MOON WAKES UP in Minecraft Challenge - Maizen,JJ RICH,UC8rRMVruCi0omLOuJMX6gRA,20,Gaming,"minecraft funny, minecraft, zenichi maizen, jj maizen, mikey maizen, jj and mikey, mikey turtle, maizen challenge, maizen, maizen minecraft, mikey and jj, maizen jj and mikey, jj and mikey travel inside moon wakes up, jj travel inside moon wakes up, mikey travel inside moon wakes up, jj travel, jj moon wakes up, jj and mikey travel, mikey travel, moon wakes up, mikey moon wakes up, jj inside moon wakes up, mikey inside moon wakes up, jj and mikey inside moon wakes up",24,https://i.ytimg.com/vi/godOGryVc8Q/hqdefault.jpg,en,en,False,981,PT16M21S,hd,False,True,False,False,248958,1277,23
Aa_EVv0hfLU,KE,2026-03-01T03:27:56.508979+00:00,2026-02-23T08:15:00Z,Alex Warren - Ordinary (Lyrics),Alex Warren - Ordinary (Lyrics),Aura Serenity,UCnjDfkZQJpaB91w3gbgbhOA,10,Music,"auraserenity, emotional, indiepop, ordinary, ordinary lyrics, lyrics ordinary, alex warren, lyrics, alex warren ordinary, ordinary alex warren, alex warren ordinary lyrics, lyrics alex warren ordinary, alex warren lyrics, lyrics alex warren, alex warren lyrics ordinary, lyrics ordinary alex warren, ordinary alex warren lyrics, You're takin' me out of the ordinary, I want you layin' me down 'til we're dead and buried, Somethin' so out of the ordinary, pop, music",22,https://i.ytimg.com/vi/Aa_EVv0hfLU/hqdefault.jpg,en,en-US,False,206,PT3M26S,hd,True,False,False,False,1147533,3218,43
ZVrQRAf5dJg,KE,2026-03-01T03:27:56.508987+00:00,2026-02-27T09:58:49Z,I Became a Minecraft Combat Master,I Became a Minecraft Combat Master,FlameFrags,UCvYPobTo42NM36X7VC4dLhA,20,Gaming,"minecraft, flamefrags, flame frags, flamefrags minecraft, flame minecraft",5,https://i.ytimg.com/vi/ZVrQRAf5dJg/hqdefault.jpg,en-US,en-US,False,4389,PT1H13M9S,hd,False,True,False,False,3106660,139033,20726
HsztlPC8Gss,KE,2026-03-01T03:27:56.508994+00:00,2026-02-25T06:47:52Z,Virusi Mbaya - Itoka Ilitoka,Virusi Mbaya - Itoka Ilitoka,Virusi Mbaya,UCuOGKKBMa5eFIGfRZSC-qcg,10,Music,,0,https://i.ytimg.com/vi/HsztlPC8Gss/hqdefault.jpg,en,sw,False,212,PT3M32S,hd,False,True,False,False,34283,3667,605
