video_id,country,fetched_at,published_at,title,localized_title,channel_title,channel_id,category_id,category_name,tags,tag_count,thumbnail,default_language,audio_language,is_live,duration,duration_raw,definition,caption_available,licensed_content,embeddable,made_for_kids,views,likes,comments
qZu0UngKl3k,FR,2026-02-13T03:28:29.838970+00:00,2026-02-12T23:01:06Z,GIMS (ft. @Maesofficiel) - T'AVAIS RAISON (Official Lyrics Video),GIMS (ft. @Maesofficiel) - T'AVAIS RAISON (Official Lyrics Video),GIMS,UCCB1Byx5yTbLpQaV-rlfmtA,10,Music,"maitre gims, LDVM, gims LDVM, maitre gims 2022, maitre gims 2023, gims 2022, gims 2023, maitre gims album, gims album, Maitre gims LDVM",10,https://i.ytimg.com/vi/qZu0UngKl3k/hqdefault.jpg,fr,fr,False,182,PT3M2S,hd,False,True,False,False,36810,5909,996
D4uGDp_kvp4,FR,2026-02-13T03:28:29.838993+00:00,2026-02-12T16:09:10Z,SPIDER-NOIR Bande Annonce VF (2026) Nicolas Cage,SPIDER-NOIR Bande Annonce VF (2026) Nicolas Cage,FilmsActu,UC_i8X3p8oZNaik8X513Zn1Q,1,Film & Animation,"cinema, filmsactu, bande annonce, film, officiel, français, VF, 2026, Spider-Noir, Spider-Noir Bande Annonce VF, Nicolas Cage, Brendan Gleeson, Spider-Man",13,https://i.ytimg.com/vi/D4uGDp_kvp4/hqdefault.jpg,fr,fr,False,221,PT3M41S,hd,False,True,False,False,102648,5191,505
P0e5YEXtZu0,FR,2026-02-13T03:28:29.839005+00:00,2026-02-12T23:21:55Z,"State of Play | February 12, 2026 [English]","State of Play | February 12, 2026 [English]",PlayStation,UC-2Y8dQb0S6DtpxNgAKoJKA,20,Gaming,"PlayStation, PS5, Sony, Kena Scars of Kosmora, Yotei Legends, DS2 OTB PC, 4 Loop, Pragmata, RE Requiem, Legacy of Kain Defiance Remastered, Brigandine Abyss, DOA6 Last Round, Control Resonant, Crimson Moon, Beast of Reincarnation, Neva Prologue, Yakoh Shinobi Ops, Project Windless, Galactic Racer, 007 First Light, MGS Master Collection Vol. 2, Castlevania Belmont’s Curse, Silent Hill Townfall, Rev Noir, John Wick, Marathon, Saros, Tokon Fighting Souls, God of War Sons of Sparta",29,https://i.ytimg.com/vi/P0e5YEXtZu0/hqdefault.jpg,en,en,False,4351,PT1H12M31S,hd,True,True,False,False,2599473,88926,1760
OMuFKDd7drw,FR,2026-02-13T03:28:29.839015+00:00,2026-02-12T17:00:39Z,Alkpote - Plus loin (feat Vald) - Les Ultimes Marches de l'Empereur #5 (Clip officiel),Alkpote - Plus loin (feat Vald) - Les Ultimes Marches de l'Empereur #5 (Clip officiel),ALKPOTE,UC5eyo1DYNuDKkIExfXKeGIg,10,Music,"alkpote, sadisme et perversion, sep, dj weedim, l'empereur, l'aigle de carthage, serge gainzbeur, jonathan h, alk vald, vald, alkapote, al k pote, al-k-pote, les ultimes marches de l'empereur, skyrock, planete rap, elgrandetoto, roi heenok, zed, lesram, heuss l'enfoiré, quavo, gims, gazo, kaaris, osirus jack, norsacce, saisai, swaggman, sadek, cappuccino, isha limsa d'aulnay, vladimir cauchemar, todiefor, plus haut, plus loin",36,https://i.ytimg.com/vi/OMuFKDd7drw/hqdefault.jpg,fr,fr,False,281,PT4M41S,hd,False,True,False,False,32488,3494,387
EriEensiy0I,FR,2026-02-13T03:28:29.839024+00:00,2026-02-11T18:00:11Z,Poppy Playtime: Chapter 5 - Official Game Trailer,Poppy Playtime: Chapter 5 - Official Game Trailer,Mob Entertainment,UCXqV4yoyC_mmZye6VbKFPeQ,20,Gaming,,0,https://i.ytimg.com/vi/EriEensiy0I/hqdefault.jpg,en,en,False,153,PT2M33S,hd,True,True,False,False,5588667,425643,41581
KlKvVHwREhg,FR,2026-02-13T03:28:29.839032+00:00,2026-02-12T17:00:36Z,Burglin Gnomes - Rediffusion Squeezie du 11/02,Burglin Gnomes - Rediffusion Squeezie du 11/02,Squeezie - Rediffusions,UC7_THngP20pzk5VRHNKDvtg,20,Gaming,"games, twitch",2,https://i.ytimg.com/vi/KlKvVHwREhg/hqdefault.jpg,fr,fr,False,6517,PT1H48M37S,hd,False,True,False,False,66780,3018,92
OqYoYuoIiik,FR,2026-02-13T03:28:29.839040+00:00,2026-02-12T19:00:06Z,CENTRAL CEE - ICEMAN FREESTYLE (MUSIC VIDEO),CENTRAL CEE - ICEMAN FREESTYLE (MUSIC VIDEO),Central Cee,UCV_CsAy5CNBX_uwDQ7RMe1Q,10,Music,"central cee, central cee drake, CENTRALCEE, central cee new song, central cee new video, cant rush greatness, iceman, iceman freestyle, cench, cench new song, cench new video",11,https://i.ytimg.com/vi/OqYoYuoIiik/hqdefault.jpg,en,en,False,186,PT3M6S,hd,False,False,False,False,482169,65546,5027
HgMbkitzhEM,FR,2026-02-13T03:28:29.839048+00:00,2026-02-12T16:00:19Z,“Spider-Noir” – Authentic Black & White Teaser Trailer | Prime Video,“Spider-Noir” – Authentic Black & White Teaser Trailer | Prime Video,Prime Video,UCQJWtTnAHhEG5w4uN0udnUQ,24,Entertainment,"spider noir official teaser, spider noir teaser, spider noir 2026, official teaser, teaser, spider noir prime video, prime video spider noir, spider noir, tv show, prime video, prime, amazon, spider noir teaser trailer, spider noir show, nicholas cage, nicholas cage spider man noir, nicholas cage spider man, spider man, spider man into the spider verse, spider man brand new day, spider man noir, spider man noir teaser, spider man noir show, spider man teaser, black and white",25,https://i.ytimg.com/vi/HgMbkitzhEM/hqdefault.jpg,en,en,False,111,PT1M51S,hd,True,True,False,False,2260819,156250,8559
vmW-l8uTBss,FR,2026-02-13T03:28:29.839055+00:00,2026-02-12T15:10:24Z,J’AI PRANK JEANFILS EN TRICHANT !! (Il s’énerve),J’AI PRANK JEANFILS EN TRICHANT !! (Il s’énerve),Kevko,UCzCzMjtMD4vCWVgbmv4uq0Q,20,Gaming,"Brawl Stars, Brawl star fr, Unchained, Unchained OFF, Unchained Brawl Stars, RomainDotlive BS, Roblox, Vol Un Brainrot, Roblox Kevko, Steal a brainrot, Vol Un brainrot kevko, roblox unchained, roblox toinelag, kevko roblox, kevko vol un brainrot, unchained off, unchained steal a brainrot, brainrot, roblox brainrot, brainrot og, kevko pigeon, graphyx, talcado, yoananas, shadobass, dhm, dhm2.0, jeanfils, chocoh, chocolatandvanillah, youtubeur fr steal a brainrot",31,https://i.ytimg.com/vi/vmW-l8uTBss/hqdefault.jpg,fr,fr,False,1127,PT18M47S,hd,False,True,False,False,142487,3557,280
xb4EwqoQCo0,FR,2026-02-13T03:28:29.839063+00:00,2026-02-11T16:55:34Z,R2 - Mood ft D2 ft Kulturr,R2 - Mood ft D2 ft Kulturr,R2,UCSG2G2DKaZFKFIu0uVwgMjQ,22,People & Blogs,,0,https://i.ytimg.com/vi/xb4EwqoQCo0/hqdefault.jpg,fr,fr,False,153,PT2M33S,hd,False,False,False,False,77182,7058,289
333BgcgXp-Y,FR,2026-02-13T03:28:29.839071+00:00,2026-02-11T15:50:26Z,COMPOSTELLE Bande Annonce (2026) Alexandra Lamy,COMPOSTELLE Bande Annonce (2026) Alexandra Lamy,Allociné | Bandes Annonces,UC5i9ji_nljs6-mp0jz_hOHg,1,Film & Animation,"bande annonce, bande annonce vf, allocine, film, français, 2026, Compostelle, Compostelle Bande Annonce, Alexandra Lamy, Julien Le Berre, Film Français",11,https://i.ytimg.com/vi/333BgcgXp-Y/hqdefault.jpg,fr,fr,False,134,PT2M14S,hd,False,True,False,False,37429,258,38
osT4PiXHIQs,FR,2026-02-13T03:28:29.839079+00:00,2026-02-12T16:01:22Z,Talcado et Anna ont construit une maison à l'intérieur des jambes de Bébé Awariz sur Minecraft !,Talcado et Anna ont construit une maison à l'intérieur des jambes de Bébé Awariz sur Minecraft !,Talcado,UCTqAZGakovPcZLLXi09uodw,20,Gaming,"Ne choisissez pas, Talcado, Minecraft, Minecraft téléphone, minecraft aventure, minecraft aventure talcado, Awariz, talcado minecraft, talcado roblox, talcado rainbow friends, anna minecraft, yoananas, kikoo",13,https://i.ytimg.com/vi/osT4PiXHIQs/hqdefault.jpg,fr,fr-FR,False,1199,PT19M59S,hd,False,True,False,False,72501,1435,77
ILTBk1936OE,FR,2026-02-13T03:28:29.839086+00:00,2026-02-12T20:05:06Z,Sagatala_-_Happy Birthday_-_(Freestyle) 🇬🇳,Sagatala_-_Happy Birthday_-_(Freestyle) 🇬🇳,Sagatala ,UCYHYFCgcf6rYbKJB0ta0knQ,10,Music,"Trending Rap, Rap Music Video, New Rap Video, YouTube Premiere Rap, Viral Music 2026, Music Premiere, Rap Premiere, New Hip Hop 2026, Hip Hop Trending, Independent Artist",10,https://i.ytimg.com/vi/ILTBk1936OE/hqdefault.jpg,fr,fr,False,151,PT2M31S,hd,False,True,False,False,79466,10151,1725
TCLg0NCr54I,FR,2026-02-13T03:28:29.839093+00:00,2026-02-12T16:03:34Z,POPPY PLAYTIME CHAPITRE 5 : LE VISAGE DU PROTOTYPE EST RÉVÉLÉ DANS LE TRAILER ?!,POPPY PLAYTIME CHAPITRE 5 : LE VISAGE DU PROTOTYPE EST RÉVÉLÉ DANS LE TRAILER ?!,Frite 2.0,UCw7NXYiQ1P1SqAsto8VMpnQ,20,Gaming,"frite, frite 2.0",2,https://i.ytimg.com/vi/TCLg0NCr54I/hqdefault.jpg,fr,fr,False,757,PT12M37S,hd,False,True,False,False,18552,1364,194
yXzz4K9urnc,FR,2026-02-13T03:28:29.839100+00:00,2026-02-12T13:31:07Z,ON CLOTURE L'AVENTURE POKERAYOU 2.0 🥹,ON CLOTURE L'AVENTURE POKERAYOU 2.0 🥹,GotagaTV,UCwDeagCMN0rTg5-r3s9AINA,20,Gaming,"gota, gotaga, mygota, the, french, monster, pc, ps4, gameplay, xbox, joueur pro, professional player, france, fr",14,https://i.ytimg.com/vi/yXzz4K9urnc/hqdefault.jpg,fr,fr,False,2280,PT38M,hd,False,True,False,False,46793,2603,33
HuLmNO6RRG8,FR,2026-02-13T03:28:29.839107+00:00,2026-02-12T16:04:43Z,Beendo Z - Monopole feat @LaTtvlm (Clip Officiel),Beendo Z - Monopole feat @LaTtvlm (Clip Officiel),BEENDO Z,UCeawg2VPd52mMhja_6pgq1g,10,Music,,0,https://i.ytimg.com/vi/HuLmNO6RRG8/hqdefault.jpg,fr,fr,False,158,PT2M38S,hd,False,False,False,False,17405,2434,157
gCqpJJeU5Qc,FR,2026-02-13T03:28:29.839114+00:00,2026-02-12T16:21:58Z,SPIDER-MAN NOIR Bande Annonce VF (2026),SPIDER-MAN NOIR Bande Annonce VF (2026),AuCiné,UClz394yrcpOnPEHqO4_Gjpg,1,Film & Animation,"SPIDER-MAN NOIR, bande annonce, vf, 2026, Série, SPIDER-MAN NOIR Bande Annonce VF",6,https://i.ytimg.com/vi/gCqpJJeU5Qc/hqdefault.jpg,fr,fr,False,123,PT2M3S,hd,False,True,False,False,17534,403,41
7ocQaeYtwaw,FR,2026-02-13T03:28:29.839121+00:00,2026-02-12T21:05:07Z,roblox best gameplay,roblox best gameplay,StanRP,UCHYA5HNaS5n4idxmP-at8nA,20,Gaming,"roblox, granny, free fire, live roblox, roblox shorts, shorts feed, 67, six seven, meme reset, singing brainrot song, great meme reset",11,https://i.ytimg.com/vi/7ocQaeYtwaw/hqdefault.jpg,en-US,en,False,21,PT21S,hd,False,True,False,False,1012545,7899,7
mwoHkRVOu7g,FR,2026-02-13T03:28:29.839128+00:00,2026-02-11T15:00:07Z,Yanns - Toké Toké (Clip officiel),Yanns - Toké Toké (Clip officiel),Yanns,UCpbRjfY2hvgKJBJkOsvzuMw,10,Music,"1998, Hip Hop/Rap, Hits francophones, Pop Urbaine, Prodige music, Sortie clip Yanns, TFX, Yanns, bébé yanns, chanson couple, chanson d'amour, chanson tik tok, chanson tiktok, coco choco, coco chocolat, gosch, les traîtres, love song, mon petit gars, nouveau cli, nouveau clip",21,https://i.ytimg.com/vi/mwoHkRVOu7g/hqdefault.jpg,fr,fr,False,140,PT2M20S,hd,False,True,False,False,64274,3519,490
1PF95N3sZHc,FR,2026-02-13T03:28:29.839136+00:00,2026-02-12T18:30:05Z,Le Trailer du CHAPITRE 5 est FOU !,Le Trailer du CHAPITRE 5 est FOU !,L'Agent Théoricien,UCq9vTtJo3e0r8uA7wSid9bw,20,Gaming,"poppy playtime, chapitre 5, trailer poppy playtime, analyse poppy playtime",4,https://i.ytimg.com/vi/1PF95N3sZHc/hqdefault.jpg,fr,fr,False,557,PT9M17S,hd,False,True,False,False,11288,993,59
dHMUCQtwXIE,FR,2026-02-13T03:28:29.839143+00:00,2026-02-12T16:30:30Z,JE TRAVAILLE DANS UN MAGASIN REMPLI DE SKINWALKERS... (Hellmart),JE TRAVAILLE DANS UN MAGASIN REMPLI DE SKINWALKERS... (Hellmart),Byilhan Live,UCyh_wmDlXSKrX1gygqceRhA,20,Gaming,"byilhan spam, byilhan live, byilhann, twitch, byilhan drole, byilhan roblox, byilhan rediff, byilhan rire, rediffusion, illegal, 3008, grec, skinwalker, doppelganger, supermarket simulator, rp, anomalies, simulator",18,https://i.ytimg.com/vi/dHMUCQtwXIE/hqdefault.jpg,fr,fr,False,4656,PT1H17M36S,hd,False,True,False,False,48983,2733,100
EitI0TN_zTw,FR,2026-02-13T03:28:29.839150+00:00,2026-02-05T10:04:36Z,BULLSHIT!,BULLSHIT!,Aruda - Topic,UCRSosyIQul2cur7PjVHR-_w,10,Music,"ARUDA, BULLSHIT!",2,https://i.ytimg.com/vi/EitI0TN_zTw/hqdefault.jpg,en,fr,False,119,PT1M59S,hd,False,True,False,False,17149,1389,0
aVTDG7Vv2to,FR,2026-02-13T03:28:29.839157+00:00,2026-02-11T22:22:26Z,Diablo | Bande-annonce du démoniste,Diablo | Bande-annonce du démoniste,Diablo FR,UCZazROYfSdlhf7zdFbL-xCQ,20,Gaming,"Diablo, Bande-annonce du Démoniste, Reign of the Warlock, Diablo II: Resurrected, Diablo 2, Diablo II, Diablo IV, Diablo 4, Diablo Démoniste, Classe Démoniste Diablo",10,https://i.ytimg.com/vi/aVTDG7Vv2to/hqdefault.jpg,fr,fr,False,152,PT2M32S,hd,True,False,False,False,26415,569,77
JkhHYP-D7EU,FR,2026-02-13T03:28:29.839164+00:00,2026-02-11T16:17:31Z,Quand Minecraft est 0% Logique…,Quand Minecraft est 0% Logique…,Unchained_Off,UCiFyJ_EBmF2XJuR9buWE_3A,20,Gaming,"unchained, unchained_off, unchained fortnite, fortnite, jeu vidéo, squeezie, gameplay, drole, gratuit, unchained gaming, fortnite battle royale, vbucks, mise à jour, maj, fortnite maj, fortnite chapitre, skin gratuit, unchained map, roblox, unchained roblox, robux, secret, roblox brainrot, steal a brainrot, voler brainrot, Brainrot, brainrot secret, brainrot, skin, unchained skin, og, admin abuse, french tacos, brainrot horreur, brainrot chaise, brainrot intérieur, entrez dans Brainrot",37,https://i.ytimg.com/vi/JkhHYP-D7EU/hqdefault.jpg,fr,fr-FR,False,932,PT15M32S,hd,False,True,False,False,426471,29450,1233
DEW8MDMqOXQ,FR,2026-02-13T03:28:29.839172+00:00,2026-02-11T17:00:06Z,ROSALÍA - Sauvignon Blanc (Official Video),ROSALÍA - Sauvignon Blanc (Official Video),RosaliaVEVO,UCy2bCk5KnIfjmWYFHMZcd5w,10,Music,"Rosalía, Sauv Blanc, LUX, Rosalía album, New Rosalía Video, Lux Tour, Rosalía Live, Valentine's Day, Mi luz, la prenderé, con el Rolls-Royce, que quemaré, Sé que mi paz yo me ganaré, cuando no quede na', nada que perder, Ya no quiero perlas ni caviar, tu amor será mi capital, qué más da si te tengo ti, no necesito nada más, tu lado, mi futuro, será dorado, ya no tengo miedo, del pasado, está en el fondo, de mi copa de, mi Dios escucharé, mis Jimmy Choos",28,https://i.ytimg.com/vi/DEW8MDMqOXQ/hqdefault.jpg,es,es,False,169,PT2M49S,hd,False,True,False,False,937151,64558,2837
9hwgV97XtJU,FR,2026-02-13T03:28:29.839180+00:00,2026-02-11T17:00:21Z,ONE PIECE LIVE ACTION - ça va être GRANDIOSE !,ONE PIECE LIVE ACTION - ça va être GRANDIOSE !,SPATULE BROS,UCr85SbHVJydkcsXnt6kX2dg,24,Entertainment,"chef, Chef, otaku, Otaku, chef otaku, Chef otaku, Chef Otaku, spatule, Spatule, bros, Bros, podcast, Podcast, production, Production, jump, Jump, spatule jump, spatule podcast, chef otaku darkows, darkows, Darkows, review, episode, preview, anime, animé, manga, mangas",29,https://i.ytimg.com/vi/9hwgV97XtJU/hqdefault.jpg,fr,fr,False,864,PT14M24S,hd,False,True,False,False,38819,2244,148
9_frZ7FCgoY,FR,2026-02-13T03:28:29.839187+00:00,2026-02-12T17:00:19Z,Finir Minecraft mais si je prend un DÉGAT le CHUNK DISPARAÎT..,Finir Minecraft mais si je prend un DÉGAT le CHUNK DISPARAÎT..,Ninjaxx,UCDB1PaqiausfXbVI2Jjk0iQ,20,Gaming,"minecraft, minecraft ninjaxx, ninjaxx, ninjax",4,https://i.ytimg.com/vi/9_frZ7FCgoY/hqdefault.jpg,fr,fr,False,744,PT12M24S,hd,False,True,False,False,71025,5932,250
jnXBY8niUiI,FR,2026-02-13T03:28:29.839194+00:00,2026-02-12T16:00:30Z,DOSSEH - APPELS MANQUÉS,DOSSEH - APPELS MANQUÉS,Dosseh TV,UC8_g13iYdxf4X3erU5IjxkA,10,Music,,0,https://i.ytimg.com/vi/jnXBY8niUiI/hqdefault.jpg,fr,fr,False,127,PT2M7S,hd,False,False,False,False,14067,1306,77
XpQ0TXUnESQ,FR,2026-02-13T03:28:29.839201+00:00,2026-02-12T04:00:33Z,"Yao Guang Character Trailer: ""All the Best"" | Honkai: Star Rail","Yao Guang Character Trailer: ""All the Best"" | Honkai: Star Rail",Honkai: Star Rail,UC2PeMPA8PAOp-bynLoCeMLA,20,Gaming,,0,https://i.ytimg.com/vi/XpQ0TXUnESQ/hqdefault.jpg,en,en,False,124,PT2M4S,hd,True,False,False,False,280845,28820,1030
BFbG7_Cyhrg,FR,2026-02-13T03:28:29.839207+00:00,2026-02-12T20:03:13Z,TOUT LÂCHER POUR PÊCHER DES POKÉMON - PORKERAYOU #5,TOUT LÂCHER POUR PÊCHER DES POKÉMON - PORKERAYOU #5,Anyme TV,UCGfI2yGzrs45oQjL8FnOhjg,24,Entertainment,"antoine danielle, pokemon, anyme vidéos, anyme chaine secondaire, rayou",5,https://i.ytimg.com/vi/BFbG7_Cyhrg/hqdefault.jpg,fr,fr,False,1494,PT24M54S,hd,False,True,False,False,31077,2186,95
nNZEsxRqCPA,FR,2026-02-13T03:28:29.839214+00:00,2026-02-12T23:00:58Z,Joé Dwèt Filé - Avec toi (LYRICS VIDEO),Joé Dwèt Filé - Avec toi (LYRICS VIDEO),Joé Dwèt Filé,UC7n1N9L_9RKpJQLGhGVWPlg,10,Music,"Joé Dwèt Filé, joedwetfileclips, joe, dwet, file, chaine youtube joe dwet file",6,https://i.ytimg.com/vi/nNZEsxRqCPA/hqdefault.jpg,fr,fr,False,161,PT2M41S,hd,False,False,False,False,12068,2007,0
xCYtyVDK50E,FR,2026-02-13T03:28:29.839221+00:00,2026-02-12T11:01:24Z,"Je veux ce jeu ! Nouveau trailer : personnalisations, gestion d’équipe… des possibilités infinies !","Je veux ce jeu ! Nouveau trailer : personnalisations, gestion d’équipe… des possibilités infinies !",Bugland,UCNymP44F_1VH78Krsd999Ww,20,Gaming,"bugland, Crimson desert, Crimson, desert, trailer 3, housing, quete, annexe, activités, gameplay, gameplay fr, possibilités, infini, coupe, cheveux, personalisation, genstion, équipe, réaction, réact, trailer, nouveau trailer, Crimson desert trailer",23,https://i.ytimg.com/vi/xCYtyVDK50E/hqdefault.jpg,fr,fr,False,759,PT12M39S,hd,False,True,False,False,11812,891,262
aIAXO3IqbEI,FR,2026-02-13T03:28:29.839264+00:00,2026-02-12T16:15:01Z,BRAQUAGE des le PREMIER LR !? DUEL INVOCATION SUPER VEGETTO LR | DB Legends,BRAQUAGE des le PREMIER LR !? DUEL INVOCATION SUPER VEGETTO LR | DB Legends,FitzAdri,UCYdop03CtRIi_0GUXSm2c9w,20,Gaming,"fitzadri, fitz, fitz adri, dragon ball legends, dragon ball legends fr, dragonball legends, dragonball legends fr, dblegends pvp, db legends, db legends fr, db legends tuto, db legends pvp, db legends sparking, db legends news, db legends zenkai, super vegetto, super vegetto db legends, vegetto legend, super vegetto legend, super vegetto legends, super vegetto legend db legends",21,https://i.ytimg.com/vi/aIAXO3IqbEI/hqdefault.jpg,fr,fr,False,1351,PT22M31S,hd,False,True,False,False,22890,1423,127
Eucq5IEBkzc,FR,2026-02-13T03:28:29.839279+00:00,2026-02-12T17:00:45Z,La Fouine & R2 - Kizomba (Clip Officiel),La Fouine & R2 - Kizomba (Clip Officiel),La Fouine,UCZ8lXecIr6UOwAJNyW1XDDg,10,Music,"La Fouine, LaFouine, La Fouine Officiel, lafouineofficiel, La, Fouine, Officiel, Rap, Hip Hop, 78, Banlieue Sale, Banlieue, Sale, Team BS, Swagg, R2 la fouine, kizomba, R2",18,https://i.ytimg.com/vi/Eucq5IEBkzc/hqdefault.jpg,fr,fr,False,188,PT3M8S,hd,False,True,False,False,63780,3405,294
tyw8etDrQ-c,FR,2026-02-13T03:28:29.839287+00:00,2026-02-12T16:32:19Z,Formula 1: Drive To Survive Season 8 Official Trailer | Netflix,Formula 1: Drive To Survive Season 8 Official Trailer | Netflix,FORMULA 1,UCB_qr75-ydFVKSF9Dmo6izg,17,Sports,"F1, Formula One, Formula 1, Sports, Sport, Action, GP, Grand Prix, Auto Racing, Motor Racing, Drive To Survive, Netflix, F1 Netflix, DTS, F1 DTS",15,https://i.ytimg.com/vi/tyw8etDrQ-c/hqdefault.jpg,en,en,False,114,PT1M54S,hd,False,True,False,False,181886,8869,365
KjIwn8wcIXs,FR,2026-02-13T03:28:29.839295+00:00,2026-02-12T16:14:33Z,"😱 C'est du DÉLIRE !!! Duel INVOCATIONS ""LEGEND"" SUPER VEGETTO avec FITZ","😱 C'est du DÉLIRE !!! Duel INVOCATIONS ""LEGEND"" SUPER VEGETTO avec FITZ",Blastz,UCjIXH24_Jv7USMjA-2EaV-A,20,Gaming,"Dragon Ball Legends, Dragon Ball super, Dokkan Battle, Summons, Invocations, Showcase, Goku, Zenkai, Ssj4, Android, Mobile gaming, Legends, Festival, Legends Festival, Ultra, LF, Legends Limited, Tag, Blue, Duel Invocations, Toshi, Reveal, Gogeta, Vegeto, 6 ans, anniversary",26,https://i.ytimg.com/vi/KjIwn8wcIXs/hqdefault.jpg,fr,fr,False,1742,PT29M2S,hd,False,True,False,False,26256,1854,211
shvtXDuBKPw,FR,2026-02-13T03:28:29.839302+00:00,2026-02-12T23:01:10Z,Zaho - Comme Caroline (Lyrics Video) ft. MC Solaar,Zaho - Comme Caroline (Lyrics Video) ft. MC Solaar,ZahoVEVO,UC_3JAf6_yRCwZWX5v2n5jww,10,Music,"Comme Caroline, Zaho feat. MC Solaar",2,https://i.ytimg.com/vi/shvtXDuBKPw/hqdefault.jpg,fr,fr,False,186,PT3M6S,hd,False,True,False,False,4553,1083,148
31e_QFxHS5I,FR,2026-02-13T03:28:29.839309+00:00,2026-02-12T10:59:00Z,Police Flash 80 - Bande-annonce officielle HD,Police Flash 80 - Bande-annonce officielle HD,Pathe,UCGVrjz7s7ui-c4BHZ155Ylg,1,Film & Animation,"Film, cinéma, bande-annonce, vidéo, Pathé, Police Flash 80, comédie, Jean-Baptiste SAUREL, François DAMIENS, Audrey LAMY, Xavier LACAILLE, Brahim BOUHLEL, Thomas NGIJOL, Yan TUAL, François Damiens tatoueur, François Damiens best of, Audrey Lamy spectacle, Audrey Lamy carte joker, Xavier Lacaille interview, Brahim BOUHLEL Pablo Escobar, Brahim BOUHLEL best of, Thomas NGIJOL suspicion, Thomas NGIJOL Mister V",23,https://i.ytimg.com/vi/31e_QFxHS5I/hqdefault.jpg,fr,fr,False,114,PT1M54S,hd,False,True,False,False,17156,54,10
DVTQj1__Vyk,FR,2026-02-13T03:28:29.839317+00:00,2026-02-12T16:30:06Z,CANNA se prend pour SCH  – Karmine Life #3,CANNA se prend pour SCH  – Karmine Life #3,Karmine Corp,UCW5Ma_xnAweFIXCGOAZECAA,24,Entertainment,"karmine corp, kcorp, karmine, kc, content, lol, lec, rocket league, kameto, lfl, vct, vgc",12,https://i.ytimg.com/vi/DVTQj1__Vyk/hqdefault.jpg,fr,fr,False,2603,PT43M23S,hd,True,True,False,False,44921,3871,143
2T-JAowEhvE,FR,2026-02-13T03:28:29.839324+00:00,2026-02-09T16:07:21Z,Tiki Tiki (Slowed),Tiki Tiki (Slowed),QMIIR - Topic,UC2yrgRzRp4dSCUcAXtGsfvw,10,Music,"QMIIR, Tiki Tiki (Slowed)",2,https://i.ytimg.com/vi/2T-JAowEhvE/hqdefault.jpg,en,en,False,122,PT2M2S,hd,False,True,False,False,371104,8063,90
2MtgIoToa7I,FR,2026-02-13T03:28:29.839331+00:00,2026-02-12T22:35:12Z,Star Wars: Galactic Racer™ - Official Gameplay Trailer,Star Wars: Galactic Racer™ - Official Gameplay Trailer,Star Wars,UCZGYJFUizSax-yElQaFDp5Q,24,Entertainment,,0,https://i.ytimg.com/vi/2MtgIoToa7I/hqdefault.jpg,en,en-US,False,91,PT1M31S,hd,True,True,False,False,117589,11779,1180
WDnqLh2HBgA,FR,2026-02-13T03:28:29.839338+00:00,2026-02-12T16:15:30Z,Je relance cette CUP classée en SOLO.. Je fais mon Record de kills en pleine CUP ! (la game de fou),Je relance cette CUP classée en SOLO.. Je fais mon Record de kills en pleine CUP ! (la game de fou),Teeqzy,UCb8A85srkG5a0QUhB6ikVLg,20,Gaming,"teeqzy, FR, gameplay, battle, royale, fortnite, top, world, record, pro, prism, quitte, vitality, jltomy, tomy, mushway, payamzer, payamz, payamkills, solo, vs, squad",22,https://i.ytimg.com/vi/WDnqLh2HBgA/hqdefault.jpg,fr,fr,False,4644,PT1H17M24S,hd,False,True,False,False,34634,2031,131
8cJcmNngDyM,FR,2026-02-13T03:28:29.839346+00:00,2026-02-11T15:00:08Z,Sdeux - BEN ARFA (Clip Officiel),Sdeux - BEN ARFA (Clip Officiel),Sdeux,UCzWdMRLbg0E3dH6-ji2RfVw,10,Music,"sdeux, franc moisin, saint denis, 93, franc moisin saint denis, saint denis 93, rappeur franc moisin, rappeur 93, rappeur saint denis, street, rappeur street, costa rica, costa rica sdeux, nouvelle generation, rappeur à suivre, 11 rappeur à suivre, rap français, rapfr, rap fr, seine saint denis, rappeur Seine saint denis, Seine-Saint-Denis, quartier, mbappe, kylian mbappe, real madrid, psg, paris saint germain, ben arfa",29,https://i.ytimg.com/vi/8cJcmNngDyM/hqdefault.jpg,fr,fr,False,139,PT2M19S,hd,False,False,False,False,21051,1190,42
J-P9K2QqqeE,FR,2026-02-13T03:28:29.839353+00:00,2026-02-10T14:00:03Z,One Piece – Saison 2 | Bande-annonce officielle VF | Netflix France,One Piece – Saison 2 | Bande-annonce officielle VF | Netflix France,Netflix France,UCroNr00O68n25IqSNapMK8w,24,Entertainment,"Chopper, Come Sail Away, Emily Rudd, Grand Line, Iñaki Godoy, Jacob, Laboon, Luffy, Mackenyu, Netflix, Oda, One Piece, One Piece : En route pour Grand Line, Reverse Mountain, Sanji, Styx, Taz, Vogue Merry, adaptation, aventure, bande-annonce, bande-annonce principale, dinosaure, faire voile, géants, hisser les voiles, magie, manga, mers, nouveautés, prendre le large, prise de vues réelles, saison 2, série",34,https://i.ytimg.com/vi/J-P9K2QqqeE/hqdefault.jpg,fr,en-US,False,181,PT3M1S,hd,True,False,False,False,144712,5419,339
FprJL0EECuY,FR,2026-02-13T03:28:29.839361+00:00,2026-02-11T17:00:33Z,Soirée anecdotes - Best-of #88 (LOST feat @EdwardRetroDecouverte),Soirée anecdotes - Best-of #88 (LOST feat @EdwardRetroDecouverte),Best Of du Grenier,UClK4fpmIAz8V1BVafysM2WA,24,Entertainment,"JDG, Joueur du Grenier, Best-of, Twitch, Fred, Anecdotes, Soirée anecdotes, Lost, Edward",9,https://i.ytimg.com/vi/FprJL0EECuY/hqdefault.jpg,fr,fr,False,4335,PT1H12M15S,hd,False,True,False,False,124053,6754,317
lCYbpB8Grcg,FR,2026-02-13T03:28:29.839368+00:00,2026-02-12T16:01:14Z,ZT ELSINKY - FRÈRES DE MISÈRE (CLIP OFFICIEL),ZT ELSINKY - FRÈRES DE MISÈRE (CLIP OFFICIEL),ZT ELSINKY OFFICIEL,UC_0mSV88H-8F6VnMIy_YX5w,10,Music,,0,https://i.ytimg.com/vi/lCYbpB8Grcg/hqdefault.jpg,fr,fr,False,200,PT3M20S,hd,False,False,False,False,15015,713,58
VxnS_5axpmQ,FR,2026-02-13T03:28:29.839374+00:00,2026-02-12T16:30:14Z,KUMA | Bande-annonce 06 ÉP 45 | Sol Yanım (Doublé en Français),KUMA | Bande-annonce 06 ÉP 45 | Sol Yanım (Doublé en Français),KUMA - Série Turque En Français,UCFfH8yBcEGg57loh1b07vGg,24,Entertainment,"kuma, Kuma Doublé en Français
29.8, Des Séries Turques Kuma, DiziDrama Kuma, Novelas TV En FR Kuma, Série Dramatique Turque Kuma, Kuma en français, série turque Kuma, séries turques Kuma, Kuma épisodes, Kuma romance, novelas Kuma, sol yanım français, french Kuma, français Kuma, Kuma soustites francais, séries Kuma, romantique Kuma, série romantique Kuma, série complète Kuma, tous les épisodes Kuma, une série de haute qualité Kuma, stream Kuma, série télévisée Kuma",24,https://i.ytimg.com/vi/VxnS_5axpmQ/hqdefault.jpg,fr,zxx,False,101,PT1M41S,hd,False,True,False,False,6439,231,4
_LhHqFQtzgA,FR,2026-02-13T03:28:29.839382+00:00,2026-02-12T17:24:17Z,On refait un PACK OPENING avec Nadim sur le jeu qui nous a fait percer il y a 6 ans.. Rocket League!,On refait un PACK OPENING avec Nadim sur le jeu qui nous a fait percer il y a 6 ans.. Rocket League!,DemoTV,UCrHy_ba4PNA0Vu3suSd1OrQ,20,Gaming,"demonexion, funny, rocket league, trade up, pack opening rocket league, opening rocket league, rl, octane, fennec, nadim, nadim pack opening",11,https://i.ytimg.com/vi/_LhHqFQtzgA/hqdefault.jpg,fr,,False,1235,PT20M35S,hd,False,True,False,False,47623,2410,304
