video_id,country,fetched_at,published_at,title,localized_title,channel_title,channel_id,category_id,category_name,tags,tag_count,thumbnail,default_language,audio_language,is_live,duration,duration_raw,definition,caption_available,licensed_content,embeddable,made_for_kids,views,likes,comments
_IoZDwFczts,KE,2026-06-28T05:02:49.345314+00:00,2026-06-20T16:30:06Z,"Toxic Lyrikali, Countree Hype - STONE (Official Video)","Toxic Lyrikali, Countree Hype - STONE (Official Video)",Toxic Lyrikali,UC7q5EQvi2fJTQvwZRi0QJnw,10,Music,#ToxicLyrikali #Stone,1,https://i.ytimg.com/vi/_IoZDwFczts/hqdefault.jpg,en,sw,False,167,PT2M47S,hd,True,False,False,False,379517,21353,1436
9-Z_b6aehJE,KE,2026-06-28T05:02:49.345357+00:00,2026-06-21T17:03:54Z,FAMILIA Official Trailer ( COMING SOON 24 / 6 / 2026 ),FAMILIA Official Trailer ( COMING SOON 24 / 6 / 2026 ),BabaJoan,UCBvRF6_a9OvG7Oy-bvZfxNw,23,Comedy,,0,https://i.ytimg.com/vi/9-Z_b6aehJE/hqdefault.jpg,sw,,False,249,PT4M9S,hd,False,True,False,False,181049,7547,846
wZW016nna48,KE,2026-06-28T05:02:49.345381+00:00,2026-06-20T16:00:01Z,"If You Build It, I'll Buy It!","If You Build It, I'll Buy It!",MrBeast Gaming,UCIPPMRA040LQr5QPyJEbmXA,20,Gaming,,0,https://i.ytimg.com/vi/wZW016nna48/hqdefault.jpg,en,en,False,2054,PT34M14S,hd,True,True,False,False,37529498,712780,17986
c0oCG3EQJAA,KE,2026-06-28T05:02:49.345391+00:00,2026-06-18T16:10:52Z,Mbosso - DJ  (Official Music Video),Mbosso - DJ  (Official Music Video),Mbosso,UCuqG1YHwV5wLltChmEvsQPw,10,Music,"mbosso, watakubali, shida, nimekuzoea, alele, nadekezwa, zilipendwa, kwangwaru, wasafi, harmonize, rayvanny, iyena, gundu, sikomi, nipepee, jibebe, konki, nyegezi, hodari, tetema, tamu, kainama, diamond platnumz, lava lava, zima feni, ashua, amaboko, yope remix, haijakaa sawa, tamba, magufuli, ccm",32,https://i.ytimg.com/vi/c0oCG3EQJAA/hqdefault.jpg,en,en,False,178,PT2M58S,hd,False,True,False,False,1551646,41233,2518
62bIsvRcPv0,KE,2026-06-28T05:02:49.345400+00:00,2026-06-17T18:58:31Z,SPIDER-MAN: BRAND NEW DAY – New Trailer (4K),SPIDER-MAN: BRAND NEW DAY – New Trailer (4K),Sony Pictures Entertainment,UCz97F7dMxBNOfGYu3rx8aCw,24,Entertainment,,0,https://i.ytimg.com/vi/62bIsvRcPv0/hqdefault.jpg,en,en,False,162,PT2M42S,hd,True,True,False,False,25742057,609499,23484
VVIQB1grfv0,KE,2026-06-28T05:02:49.345408+00:00,2026-06-20T15:43:00Z,"Every Time I Crash, My Car Evolves in GTA 5","Every Time I Crash, My Car Evolves in GTA 5",SpeirsTheAmazingHD,UCAbdeLiTPdjk1X2TY_ZdLDw,20,Gaming,"speirstheamazinghd, speirs the amazing, gta 5 funny moments, gta 5, gta, in gta 5, gta 5 rp, grand theft auto 5, stealing cars gta 5, fastest car, gta 5 roleplay, roleplay, gta v roleplay, gta5 roleplay, gta 5 roleplay funny, funny roleplay moments, grand theft auto roleplay, grand theft auto 5 roleplay, every time i crash, every time i crash gta 5, car evolves, cars gta 5, car gta 5, upgrading cars, ultimate car gta 5",25,https://i.ytimg.com/vi/VVIQB1grfv0/hqdefault.jpg,en,en,False,2049,PT34M9S,hd,False,True,False,False,1183432,12047,263
NhsIDR0aebc,KE,2026-06-28T05:02:49.345416+00:00,2026-06-12T09:00:06Z,Iyanii - Mikono Juu (Official 4K Video),Iyanii - Mikono Juu (Official 4K Video),Iyanii,UC_NE0izr5RvxIs7VAmw3AKA,10,Music,"Iyanii, Iyanii new music, Mikono Juu, Mbosso, Willy Paul, Otile brown, Ndovu Kuu, Ali kiba, Harmonize, Burna Boy, Shakiri, IshowSpeed, Toxic Lyrikali, Marioo, Fathermoh, Patoranking, Trending Music, Best of Iyanii 2026",18,https://i.ytimg.com/vi/NhsIDR0aebc/hqdefault.jpg,en,sw,False,187,PT3M7S,hd,False,True,False,False,754388,8867,391
MIZWu26ThTM,KE,2026-06-28T05:02:49.345424+00:00,2026-06-01T09:00:00Z,The Polygamist: Season 1 | Jonasi Trailer | AfricaOnNetflix,The Polygamist: Season 1 | Jonasi Trailer | AfricaOnNetflix,AfricaOnNetflix,UCzi3g9ade6lq-nGjShQOJJg,24,Entertainment,"Celeste Ntuli, Family Betrayal, Gomora, Gugu Gumede, Infidelity, Kenneth Nkosi, Kwanele Mthethwa, Marriage Secrets, Netflix South Africa, Polygamy, S'dumo Mtshali, Sandton, Soapie, South African Drama, Soweto, Supernovela, Telenovela, The Queen, The River, The Wife, Uthando Nes'thembu, Zulu Culture",22,https://i.ytimg.com/vi/MIZWu26ThTM/hqdefault.jpg,en,en-US,False,99,PT1M39S,hd,False,False,False,False,421979,2798,213
5Xub75zJ4F8,KE,2026-06-28T05:02:49.345432+00:00,2026-06-24T12:00:30Z,JJ and Mikey found a SECRET RICH VILLAGE in Minecraft!,JJ and Mikey found a SECRET RICH VILLAGE in Minecraft!,Maizen Shorts,UChqkRt5OTFGwbv8bBKqaF8w,20,Gaming,"minecraft, maizen, animation, jj, mikey, マインクラフト, まいぜん, まいぜんシスターズ, ぜんいち, マイッキー, アニメーション, マイクラ, マイクラアニメ, jj and mikey, maizen battle, jj and mikey battle, jj vs mikey, secret base, secret house, rich base, rich house, secret village",22,https://i.ytimg.com/vi/5Xub75zJ4F8/hqdefault.jpg,en,en,False,1338,PT22M18S,hd,False,True,False,False,451553,2727,123
-pvg5EPYRGk,KE,2026-06-28T05:02:49.345440+00:00,2026-06-23T13:40:16Z,Love Per Day Official Audio Visualiser,Love Per Day Official Audio Visualiser,Elisha Toto,UChAAHLUcjJqNsgU23PsCv-A,24,Entertainment,,0,https://i.ytimg.com/vi/-pvg5EPYRGk/hqdefault.jpg,en,en-US,False,352,PT5M52S,hd,False,False,False,False,37898,1620,290
ATvQDja4174,KE,2026-06-28T05:02:49.345447+00:00,2026-06-21T11:02:37Z,QIYAANADA QARSOON | Trailer,QIYAANADA QARSOON | Trailer,ArimaHeena,UCc59py21W-sEhXgXVHnDZ0w,24,Entertainment,,0,https://i.ytimg.com/vi/ATvQDja4174/hqdefault.jpg,en,en,False,83,PT1M23S,hd,False,True,False,False,247873,15220,173
CXrHUpBJElE,KE,2026-06-28T05:02:49.345455+00:00,2026-06-25T18:15:48Z,I Found a NEW Mysterious Foot Print in GTA 5... (Monster),I Found a NEW Mysterious Foot Print in GTA 5... (Monster),Nought,UCSh__r5HS4Y1xBkccWnV0TA,20,Gaming,"gta 5, gta v, foot, footprint, foot print, print, monster, gta 5 monster, godzilla, gta 5 godzilla, meccha, mecha, robot, giant robot, giant, mystery, mysterious, big, big footprint, gta 5 footprint, gta 5 mods, gta v mods, mods, gaming, nought, nought gta 5",26,https://i.ytimg.com/vi/CXrHUpBJElE/hqdefault.jpg,en,en,False,920,PT15M20S,hd,False,True,False,False,256564,7457,200
-sY6p4Yl0tk,KE,2026-06-28T05:02:49.345463+00:00,2026-06-09T07:15:06Z,Willy Paul x Otile Brown - Pm ( Official Music Video ),Willy Paul x Otile Brown - Pm ( Official Music Video ),Willy Paul Thee Pozze,UCgdVgtJQXxebSiSAzlhYczw,10,Music,"willy paul, ngomma, kenya, africa, dance music, inspiring music, hot music, gengetone",8,https://i.ytimg.com/vi/-sY6p4Yl0tk/hqdefault.jpg,en,,False,199,PT3M19S,hd,False,True,False,False,1870616,33500,5289
j9UTvfHlEi4,KE,2026-06-28T05:02:49.345471+00:00,2026-06-18T16:17:17Z,BODYGUARD TRAILER ,BODYGUARD TRAILER ,KIPARA BRAND,UCexh1jWkR3yMQSC2J_vGnyw,22,People & Blogs,,0,https://i.ytimg.com/vi/j9UTvfHlEi4/hqdefault.jpg,en,,False,88,PT1M28S,hd,False,True,False,False,167898,6331,616
lCE4sCtDeeA,KE,2026-06-28T05:02:49.345478+00:00,2026-06-25T22:11:16Z,"Spending $8,592,693 For The BIGGEST NUKE In Roblox..","Spending $8,592,693 For The BIGGEST NUKE In Roblox..",Foltyn,UCRkuUgtDAL4XSU5jB40J_wA,20,Gaming,"foltyn, foltyn roblox, roblox, roblox foltyn, foltyn family, funny, foltyn family roblox, roblox foltyn family, blade ball, roblox blade ball, foltyn blade ball, spending robux for the biggest nuke, big nuke roblox, roblox merge a nuke, foltyn and caylus, foltyn and caylus playing roblox, foltyn and caylus playing together, foltyn and caylus playing roblox together, roblox nuke games",19,https://i.ytimg.com/vi/lCE4sCtDeeA/hqdefault.jpg,en,en-US,False,978,PT16M18S,hd,False,True,False,False,949751,14331,2587
gi33f-GU9NU,KE,2026-06-28T05:02:49.345486+00:00,2026-06-16T14:59:26Z,Wewe ni Baba Mwema Kwangu | Deep Swahili Worship Cover By Minister James,Wewe ni Baba Mwema Kwangu | Deep Swahili Worship Cover By Minister James,Minister James,UCXH4qE1Tfwtz0QwjtqGpLHg,22,People & Blogs,,0,https://i.ytimg.com/vi/gi33f-GU9NU/hqdefault.jpg,en,,False,307,PT5M7S,hd,False,True,False,False,189444,1098,75
MXaSJ2_BxRI,KE,2026-06-28T05:02:49.345495+00:00,2026-06-24T09:45:42Z,eFootball™ New Trailer 「JUST WATCHING？」,eFootball™ New Trailer 「JUST WATCHING？」,eFootball,UCQdSC4folRoUuPC3iiRkfFQ,20,Gaming,,0,https://i.ytimg.com/vi/MXaSJ2_BxRI/hqdefault.jpg,en,en,False,31,PT31S,hd,False,False,False,False,94100,4701,366
yycAimqjdjw,KE,2026-06-28T05:02:49.345503+00:00,2026-06-25T19:30:04Z,Upgrading to the Strongest CHEETAH Ever in GTA 5,Upgrading to the Strongest CHEETAH Ever in GTA 5,iMuffin,UCAPKgmvfUtFKOogWKt56myg,20,Gaming,"gta 5, gta 5 mods, cheetah, cheetah gta 5, upgrade cheetah gta 5, upgrade sonic, gta 5 muffin, muffin, imuffin, video game, grand theft auto mods, gta mods, gta v, sonic mod, gta 5 sonic mod, super sonic gta 5, simply chris, gta 5 mod, simple chris, gta, sonic the hedgehog, gta 5 flash, caylus gta 5, cheetah to the strongest, strongest cheetah, strongest cheetah gta 5, upgrading cheetah to the strongest ever, gaming, gta 5 space, in gta 5, biggest cheetah gta 5",31,https://i.ytimg.com/vi/yycAimqjdjw/hqdefault.jpg,en,en,False,1161,PT19M21S,hd,False,True,False,False,473349,10958,63
JA_qxNwixfY,KE,2026-06-28T05:02:49.345510+00:00,2026-06-17T09:00:06Z,NONGWENDAA - MAXWELL MWALIMU,NONGWENDAA - MAXWELL MWALIMU,MAXWELL MWALIMU Official,UCpSpFE04R-DpQCxUbtnZwrA,22,People & Blogs,,0,https://i.ytimg.com/vi/JA_qxNwixfY/hqdefault.jpg,en,fi,False,238,PT3M58S,hd,False,True,False,False,158086,8975,938
JFQcDFhNh4o,KE,2026-06-28T05:02:49.345517+00:00,2026-06-11T13:00:12Z,"Heart of the Beast | Official Trailer (2026 Movie) - Brad Pitt, J.K. Simmons, Anna Lambe","Heart of the Beast | Official Trailer (2026 Movie) - Brad Pitt, J.K. Simmons, Anna Lambe",Paramount Pictures,UCF9imwPMSGz4Vq1NiTWCC7g,1,Film & Animation,"Heart of the beast, HOTB, Brad Pitt",3,https://i.ytimg.com/vi/JFQcDFhNh4o/hqdefault.jpg,en,en-US,False,146,PT2M26S,hd,True,True,False,False,15659606,105058,4291
UsV-iw1HRAY,KE,2026-06-28T05:02:49.345525+00:00,2026-06-26T10:00:31Z,JJ & Mikey vs Friends: TREASURE TUNNEL BATTLE in Minecraft! Maizen,JJ & Mikey vs Friends: TREASURE TUNNEL BATTLE in Minecraft! Maizen,zenichi_maizen,UCQmhjOWcYVh9nyQbEr-sTGg,20,Gaming,"minecraft funny, minecraft, funny minecraft, minecraft but, funny memes, zenichi maizen, jj maizen, mikey maizen, noob vs pro security house, maizen raft, maizen lava securuty base, maizen nether base, maizen volcano, jj and mikey, mizen, mikey turtle, maizen security house, maizen challenge, minecraft security house, maizen, maizen prank, maizen vs, maizen friends, maizen tunnel, maizen treasure, mikey vs jj treasure, mikey and jj vs friends, mikey vs jj tunnel",28,https://i.ytimg.com/vi/UsV-iw1HRAY/hqdefault.jpg,en,en-US,False,1470,PT24M30S,hd,False,True,False,False,191077,1207,73
4fIoNRyabH4,KE,2026-06-28T05:02:49.345533+00:00,2026-06-23T09:57:55Z,Faith Nzilani - Uka Undetee(Official 4k video),Faith Nzilani - Uka Undetee(Official 4k video),Faith Nzilani,UCYeM-xE5w1MixqDKjRgwTbg,10,Music,"Faith Nzilani, Faith Nzilani kenya, faith nzilani music, faith nzilani gospel",4,https://i.ytimg.com/vi/4fIoNRyabH4/hqdefault.jpg,en,sw,False,361,PT6M1S,hd,False,True,False,False,62977,3295,465
1EwpPkpsSh0,KE,2026-06-28T05:02:49.345540+00:00,2026-06-27T15:00:06Z,SolarBalls – Official Trailer,SolarBalls – Official Trailer,SolarBalls,UCQF0f62JXnfFSxKDmN8SDUg,27,Education,"solarballs, solarball, planetball, planetballs, cosmos, scifi, sci fi, space, galaxy, solar system, animation, fun, comedy, space animation, cartoon, shut up cartoons planets, shut up planet cartoon, spaceball, spaceballs, space balls",20,https://i.ytimg.com/vi/1EwpPkpsSh0/hqdefault.jpg,en,en,False,86,PT1M26S,hd,False,True,False,False,197557,13232,1100
gsGKuU311nA,KE,2026-06-28T05:02:49.345552+00:00,2026-06-27T08:00:08Z,JJ vs Mikey: UNDERGROUND HEAD BASE BATTLE in Minecraft!,JJ vs Mikey: UNDERGROUND HEAD BASE BATTLE in Minecraft!,Funny Maizen,UCNGTAPYmAfsewgnzkAZcgBw,20,Gaming,"minecraft funny, minecraft, funny minecraft, funny memes, zenichi maizen, jj and mikey, mikey turtle, maizen security house, maizen challenge, maizen, roblox, maizen roblox, family friendly, family friendly minecraft, jj vs mikey, maizen battle, jj and mikey battle, statue battle, statue house, statue base, head base, head house",22,https://i.ytimg.com/vi/gsGKuU311nA/hqdefault.jpg,en-US,en-US,False,1326,PT22M6S,hd,False,True,False,False,149361,909,22
jdlCOIaWwTQ,KE,2026-06-28T05:02:49.345561+00:00,2026-06-19T14:00:37Z,Chris Brown - It Depends/Obvious (Official Video),Chris Brown - It Depends/Obvious (Official Video),ChrisBrownVEVO,UCm1dsgJNnhaLkY3uAdqN4mA,10,Music,"chris brown, bryson tiller, it depends, chris brown it depends, rnb, chris brown 11:11, chris brown tour, breezy bowl, chris brown new music, residuals, chris brown bryson tiller, bryson tiller new music, chris brown type beat, it depends lyrics, chris brown it depends lyrics, It Depends/Obvious",16,https://i.ytimg.com/vi/jdlCOIaWwTQ/hqdefault.jpg,en,en,False,335,PT5M35S,hd,False,True,False,False,3140545,133633,5817
1gkQMgxPpDY,KE,2026-06-28T05:02:49.345569+00:00,2026-06-26T11:00:12Z,Only RICH FARMERS Get a DATE In GROW a GARDEN 2!,Only RICH FARMERS Get a DATE In GROW a GARDEN 2!,Zoomy,UCJnH5Ph5O1EZhKiKiNgH9IA,20,Gaming,"Steal a Brainrot, StealABrainrot, Steal a Brainrot Shorts, Steal a Brainrot Roblox, Steal a Brainrot funny moments, Steal a Brainrot clips, Steal a Brainrot meme, Steal a Brainrot animation, Steal a Brainrot gameplay, Steal a Brainrot story, Steal a Brainrot edit, Steal a Brainrot compilation, Steal a Brainrot scenes, Steal a Brainrot reaction, Roblox Steal a Brainrot, Roblox Shorts, Roblox funny, Roblox meme, Roblox edit, Roblox animation, Roblox gameplay, Roblox short film",22,https://i.ytimg.com/vi/1gkQMgxPpDY/hqdefault.jpg,en,en,False,1201,PT20M1S,hd,False,True,False,False,609826,9731,123
aW43aE6UIiI,KE,2026-06-28T05:02:49.345577+00:00,2026-06-22T16:15:23Z,ENKARIYIANO ENKAI - CHARITY X SANINO X RESIAN (Official Video),ENKARIYIANO ENKAI - CHARITY X SANINO X RESIAN (Official Video),CHARITY NASHIPAE,UCLi7VoeJZjYcuRqpDGFXwxw,22,People & Blogs,,0,https://i.ytimg.com/vi/aW43aE6UIiI/hqdefault.jpg,en,sw,False,287,PT4M47S,hd,False,True,False,False,46619,3330,409
AIIssKXIxSA,KE,2026-06-28T05:02:49.345584+00:00,2026-06-25T13:05:25Z,الرجل العنكبوت انقاذ باتمان Spider-Man Rescue batman vs iron man vs venom funny Game GTA 5 superhero,الرجل العنكبوت انقاذ باتمان Spider-Man Rescue batman vs iron man vs venom funny Game GTA 5 superhero,Maro Spidey,UCZBSD46ZjyL3vrkQzlOfhpA,20,Gaming,,0,https://i.ytimg.com/vi/AIIssKXIxSA/hqdefault.jpg,ar,pa,False,1083,PT18M3S,hd,False,True,False,False,1474962,25808,4225
aq258p8TbEA,KE,2026-06-28T05:02:49.345591+00:00,2026-06-26T07:00:17Z,Billnass Ft. Nandy - Hallo (Visualizer),Billnass Ft. Nandy - Hallo (Visualizer),Billnass,UClk71cJCZcXh5h6RxZFeIuQ,10,Music,"Billnass Ft Nandy, Billnass Ft Nandy New song, Billnass Hallo, Billnass New song, Bongo Fleva, Afrobeats, Zilipendwa, Mpya, Trend, Trending songs, Billnass 2026 dongs, Billnass songs, Latest song 2026",13,https://i.ytimg.com/vi/aq258p8TbEA/hqdefault.jpg,en,sw,False,214,PT3M34S,hd,False,True,False,False,242116,7952,400
9AemlQEwL1s,KE,2026-06-28T05:02:49.345600+00:00,2026-06-25T03:00:29Z,TJ Become CYBER NINJA Met SPY GIRL in 2077!? ALL EPISODES NINJA MOVIE! - Maizen Minecraft JJ & Mikey,TJ Become CYBER NINJA Met SPY GIRL in 2077!? ALL EPISODES NINJA MOVIE! - Maizen Minecraft JJ & Mikey,☆ Tim Jostar ☆,UC5SQv1rksmMDSCfS9pcxggw,20,Gaming,"minecraft, maizen, maizen animations, jj and mikey, jj, mikey, tiny minecraft, woman minecraft, woman jj, police, police minecraft, police jj, police maizen, woman mikey, jj and mikey girl, jj and mikey maizen, girl minecraft jj, prison minecraft, jail minecraft",19,https://i.ytimg.com/vi/9AemlQEwL1s/hqdefault.jpg,en,en,False,4059,PT1H7M39S,hd,False,True,False,False,202647,3824,17
INX8G-q4pgk,KE,2026-06-28T05:02:49.345607+00:00,2026-06-19T14:00:06Z,Original Koffee featuring Skillibeng - RAPID FYAH (Official Music Video),Original Koffee featuring Skillibeng - RAPID FYAH (Official Music Video),Original Koffee,UCUUNMri9GAoH2PiXCQJ6aWw,10,Music,,0,https://i.ytimg.com/vi/INX8G-q4pgk/hqdefault.jpg,en,en,False,240,PT4M,hd,False,True,False,False,505651,24927,1327
qZ88qwwdkSI,KE,2026-06-28T05:02:49.345614+00:00,2026-06-25T10:00:20Z,JJ & Mikey & Carrie: TRANSFORMERS GOLEM BATTLE in Minecraft - Maizen,JJ & Mikey & Carrie: TRANSFORMERS GOLEM BATTLE in Minecraft - Maizen,Zentry - JJ & Mikey Minecraft,UCsqemlHjSy5a--jIXy-gvTA,20,Gaming,"Maizen, jj, mikey, Mikey and JJ, Mikey Vs JJ, Villager, Minecraft, SkyBlock, Challenge, POOR VS RICH, Mikey JJ vs Villager, Kpop demon Hunter, 99 nights in the forest, 99 night, brainrot, roblox, Diamond vs Poor, Rumi, Carrie, Pinky, Brainrot Steal, Hacker Vs Pro, Noob Pro Hacker, Minecraft Animation, Monster School, Maizen Sisters, Banana Kid, BananaKid, The moon woke up, the moon wake up, mine, battle, stairs, island, poor vs rich, jj family, mikey family, maizen family, transformers",39,https://i.ytimg.com/vi/qZ88qwwdkSI/hqdefault.jpg,en,en,False,980,PT16M20S,hd,False,True,False,False,202599,1346,40
R69ZOGGKQPE,KE,2026-06-28T05:02:49.345622+00:00,2026-06-23T07:04:36Z,Celly Mwikali - Mundu wa Ngai ft Stephen Kasolo,Celly Mwikali - Mundu wa Ngai ft Stephen Kasolo,CELLY  MWIKALI,UClbbWnESyP6siNM6tveF37A,10,Music,"Mundu Wa Ngai, Celly Mwikali, Stephen Kasolo, Kamba Gospel, Kamba Urban Gospel, Kenyan Gospel, Gospel Music Kenya, Man of God, Job story Bible, Faith in God, Trials and tribulations, Christian encouragement, Spiritual warfare, God protection, Endurance in faith, African gospel music, Worship songs, New gospel song 2026, Latest Kamba song, Kamba worship song, Gospel collaboration, Sean on the beat, Fleek film, Christian motivation, Gospel Kenya, Kamba music",26,https://i.ytimg.com/vi/R69ZOGGKQPE/hqdefault.jpg,en,sw,False,228,PT3M48S,hd,False,True,False,False,66737,4051,534
hrFkOlbH_Wg,KE,2026-06-28T05:02:49.345630+00:00,2026-06-25T16:00:13Z,Exposing Villagers SECRETS in Minecraft…,Exposing Villagers SECRETS in Minecraft…,Cash,UC0eLBYhxW9HC0P9PXQ73mpQ,24,Entertainment,"Cash, Nico, Nico and Cash, Cash and Nico, Minecraft, Minecraft mod, family friendly, kid friendly",8,https://i.ytimg.com/vi/hrFkOlbH_Wg/hqdefault.jpg,en,en-US,False,808,PT13M28S,hd,False,True,False,False,596085,7222,1197
XdB2ZJNlDyY,KE,2026-06-28T05:02:49.345637+00:00,2026-06-18T08:16:29Z,D Voice ft Diamond Platnumz - Iyo (Official Music Video),D Voice ft Diamond Platnumz - Iyo (Official Music Video),D Voice,UCxKoKHs7YwjE_6nL6U36BsQ,10,Music,"music, diamond platnumz, swahili kid, umenifunza, bambam, mpeni taarifa, lolo, chori chori, kama wengine, mungu baba, nimezama, mtamu, turudiane, mbosso, zuchu, lava lava, millard ayo, msanii, singeli, bongo, simba, yanga, wasafi, amapiano, trailer, trending, new music, wimbo mpya, tajiri, sele, shu, wcb, simulizi, dulla makabila, meja kunta",35,https://i.ytimg.com/vi/XdB2ZJNlDyY/hqdefault.jpg,en,en-US,False,211,PT3M31S,hd,False,False,False,False,829821,30016,1504
c_9UFIvHH4g,KE,2026-06-28T05:02:49.345645+00:00,2026-06-25T00:30:03Z,JJ and Mikey: POOR To OP CASTLE In Minecraft - Maizen,JJ and Mikey: POOR To OP CASTLE In Minecraft - Maizen,Blomzy - Mikey & JJ Minecraft,UC40FgiHTmBVgnZVLyweuSxQ,20,Gaming,"Maizen, jj, mikey, Mikey and JJ, Mikey Vs JJ, Villager, Minecraft, SkyBlock, Challenge, POOR VS RICH, Mikey JJ vs Villager, BuildBattle, Kpop, Kpop demon Hunter, 99 nights in the forest, 99 night, brainrot, roblox, MiniGames, Diamond vs Poor, Rumi, Carrie, Pinky, Brainrot Steal, Hacker Vs Pro, Noob Pro Hacker, Minecraft Animation, Monster School, Maizen Sisters",29,https://i.ytimg.com/vi/c_9UFIvHH4g/hqdefault.jpg,en,en-US,False,1392,PT23M12S,hd,False,True,False,False,230792,2637,153
fH6zLiAfy9c,KE,2026-06-28T05:02:49.345653+00:00,2026-06-10T07:48:11Z,Kapitani - SINGLE ( Official Music Video),Kapitani - SINGLE ( Official Music Video),Kapitani,UCiGVvOqjO1rm0BBc5jtjVJA,10,Music,,0,https://i.ytimg.com/vi/fH6zLiAfy9c/hqdefault.jpg,en,en,False,173,PT2M53S,hd,False,True,False,False,321385,10777,815
IyrtVsQtI60,KE,2026-06-28T05:02:49.345660+00:00,2026-06-22T14:00:18Z,I Beat FIFA in 50 Hours,I Beat FIFA in 50 Hours,MoreCrunch,UCrsuEI3mvU5pN2PEbwW9F9w,20,Gaming,,0,https://i.ytimg.com/vi/IyrtVsQtI60/hqdefault.jpg,en,en,False,3393,PT56M33S,hd,False,True,False,False,3332858,30146,688
zrnbinLrdH4,KE,2026-06-28T05:02:49.345666+00:00,2026-06-22T13:50:27Z,Timi Dre x Joeboy x Oxlade - ON YOU (official Video),Timi Dre x Joeboy x Oxlade - ON YOU (official Video),Timi Dre,UCC50WCf5lv9_mv39CrFDWbQ,10,Music,,0,https://i.ytimg.com/vi/zrnbinLrdH4/hqdefault.jpg,en,en-US,False,216,PT3M36S,hd,False,True,False,False,117534,4863,201
2nxBCespd7c,KE,2026-06-28T05:02:49.345673+00:00,2026-06-27T03:00:06Z,JJ IS DEAD : The Movie,JJ IS DEAD : The Movie,Maizen,UCJHBJ7F-nAIlMGolm0Hu4vg,20,Gaming,"Minecraft, Maizen",2,https://i.ytimg.com/vi/2nxBCespd7c/hqdefault.jpg,en,en,False,4704,PT1H18M24S,hd,False,True,False,False,367777,8828,1926
b9c98RiGhlg,KE,2026-06-28T05:02:49.345681+00:00,2026-06-25T10:00:15Z,Nyar Ahero Nyando,Nyar Ahero Nyando,Javan MacAjudo - Topic,UCO6C5mOR5kplFhJEhSrP2uw,10,Music,"Javan MacAjudo, Javan Otieno, Nyar Ahero Nyando",3,https://i.ytimg.com/vi/b9c98RiGhlg/hqdefault.jpg,en,sw,False,602,PT10M2S,hd,False,True,False,False,25886,1512,351
C7ekPoAR3Ic,KE,2026-06-28T05:02:49.345688+00:00,2026-06-26T22:57:47Z,I Found CURSED OWNER Zones In Kick A Lucky Block..,I Found CURSED OWNER Zones In Kick A Lucky Block..,Fuzz,UCk_YaS7EjbnUe6r_1colvlA,20,Gaming,"roblox steal a brainrot, steal a brainrot, roblox, fuzzblox, fuzzblox steal a brainrot, steal a brainrot roblox, steal a brainrot new secret, steal a brainrot new update, steal a brainrot update, I Found CURSED OWNER Zones In Kick A Lucky Block..",10,https://i.ytimg.com/vi/C7ekPoAR3Ic/hqdefault.jpg,en,en,False,962,PT16M2S,hd,False,True,False,False,314742,8470,299
hgPJI3AtKY0,KE,2026-06-28T05:02:49.345695+00:00,2026-06-25T08:21:52Z,NITWAUMIE BY CHRIS NDONYE (OFFICIAL VIDEO 4K),NITWAUMIE BY CHRIS NDONYE (OFFICIAL VIDEO 4K),Chris Ndonye (Kindu kii Kya Yesu Kimuyo),UCwgFXO5H9y2b90dfkAWdWfw,10,Music,,0,https://i.ytimg.com/vi/hgPJI3AtKY0/hqdefault.jpg,en,sw,False,391,PT6M31S,hd,False,True,False,False,25927,1524,233
TPsZ7_ezx2Q,KE,2026-06-28T05:02:49.345702+00:00,2026-06-25T12:46:48Z,New C. RONALDO LOW  SCREAMER 🔥 PACK opening + GAMEPLAY REVIEW ,New C. RONALDO LOW  SCREAMER 🔥 PACK opening + GAMEPLAY REVIEW ,9AL Games,UCvzTJH6G9bH5nCQ1Hfb8nGg,20,Gaming,,0,https://i.ytimg.com/vi/TPsZ7_ezx2Q/hqdefault.jpg,en,en,False,1101,PT18M21S,hd,False,True,False,False,181653,12497,535
8qu0RsigcZI,KE,2026-06-28T05:02:49.345709+00:00,2026-06-26T07:59:35Z,Stephen Kasolo - New Level (Official Lyric video) ,Stephen Kasolo - New Level (Official Lyric video) ,Stephen Kasolo Official,UCcEIuIasgNTRoxjk5lI_t6A,10,Music,,0,https://i.ytimg.com/vi/8qu0RsigcZI/hqdefault.jpg,en,en,False,342,PT5M42S,hd,False,True,False,False,26927,0,487
MqANQd2F9nk,KE,2026-06-28T05:02:49.345716+00:00,2026-06-27T15:00:13Z,You CAN'T Say THIS In Meccha Chameleon...,You CAN'T Say THIS In Meccha Chameleon...,Techys,UCoRjsuzMh-MqfRjvlqaVLPw,20,Gaming,,0,https://i.ytimg.com/vi/MqANQd2F9nk/hqdefault.jpg,en,en,False,622,PT10M22S,hd,False,True,False,False,231139,4205,698
L6oRZS0gEeY,KE,2026-06-28T05:02:49.345723+00:00,2026-06-24T11:04:23Z,Kana Nicko - Nyota Yakwa (Official 4K Audio Visualizer),Kana Nicko - Nyota Yakwa (Official 4K Audio Visualizer),Kana Nicko,UC9SBoTSFGw8okv4z2vQlhFg,10,Music,,0,https://i.ytimg.com/vi/L6oRZS0gEeY/hqdefault.jpg,en,kam,False,352,PT5M52S,hd,False,True,False,False,33603,1687,172
8A7wNOn-e7c,KE,2026-06-28T05:02:49.345730+00:00,2026-06-25T10:30:04Z,"JJ and Mikey: From $1 AIRPLANE to $1,000,000 AIRPLANE in Minecraft! (Maizen)","JJ and Mikey: From $1 AIRPLANE to $1,000,000 AIRPLANE in Minecraft! (Maizen)",Mikey & JJ Verse,UCI4jqHZzPqg5aQEJSC4zn1g,22,People & Blogs,"minecraft funny, minecraft, funny minecraft, funny memes, zenichi maizen, noob vs pro security house, jj and mikey, mikey turtle, maizen security house, maizen challenge, maizen, roblox, maizen roblox, jj and mikey roblox, mikey jj verse, maizen poor vs rich, maizen plane, jj and mikey plane, minecraft plane, poor vs rich, jj and mikey poor vs rich, airplane, airplane minecraft",23,https://i.ytimg.com/vi/8A7wNOn-e7c/hqdefault.jpg,en,en,False,989,PT16M29S,hd,False,True,False,False,221004,3901,78
-HJFYrMf668,KE,2026-06-28T05:02:49.345738+00:00,2026-06-19T09:00:06Z,Young Lunya x Harmonize - Mkuu wa Majeshi (Official Music Video),Young Lunya x Harmonize - Mkuu wa Majeshi (Official Music Video),YoungLunyaVEVO,UCCOcVC7AjYSwiYM-Dm-359g,10,Music,"Trending, Young Lunya, Hip hop, Viral, Harmonize, Tanzania Music, Hip-Hop/Rap, Mkuu wa Majeshi, Young Lunya Harmonize",9,https://i.ytimg.com/vi/-HJFYrMf668/hqdefault.jpg,sw,sw,False,232,PT3M52S,hd,False,True,False,False,435612,18457,1424
-5FSMIYm9tE,KE,2026-06-28T05:02:49.345745+00:00,2026-06-25T11:00:20Z,JJ vs Mikey vs Banana Kid: SIZE HIDE-AND-SEEK in Minecraft...,JJ vs Mikey vs Banana Kid: SIZE HIDE-AND-SEEK in Minecraft...,Maizen Family,UC5SpBTQZpK78PARszVDr8Rw,20,Gaming,"minecraft, maizen, jj and mikey, jj, mikey, maizen video, maizen secret base, jj and mikey secret base, maizen battle, jj and mikey battle, jj vs mikey, mikey vs jj, shapeshift, shapeshift minecraft, hide and seek, maizen hide and seek, jj and mikey hide and seek",17,https://i.ytimg.com/vi/-5FSMIYm9tE/hqdefault.jpg,en-US,en-US,False,1387,PT23M7S,hd,False,True,False,False,183230,976,34
