video_id,country,fetched_at,published_at,title,localized_title,channel_title,channel_id,category_id,category_name,tags,tag_count,thumbnail,default_language,audio_language,is_live,duration,duration_raw,definition,caption_available,licensed_content,embeddable,made_for_kids,views,likes,comments
4otIYfDQsDs,KE,2026-06-08T05:13:14.906357+00:00,2026-05-27T15:00:30Z,Mbosso - Ozalima (Official Music Video),Mbosso - Ozalima (Official Music Video),Mbosso,UCuqG1YHwV5wLltChmEvsQPw,10,Music,"mbosso, watakubali, shida, nimekuzoea, alele, nadekezwa, zilipendwa, kwangwaru, wasafi, harmonize, rayvanny, iyena, gundu, sikomi, nipepee, jibebe, konki, nyegezi, hodari, tetema, tamu, kainama, diamond platnumz, lava lava, zima feni, ashua, amaboko, yope remix, haijakaa sawa, tamba, magufuli, ccm",32,https://i.ytimg.com/vi/4otIYfDQsDs/hqdefault.jpg,en,en,False,186,PT3M6S,hd,False,True,False,False,2153019,33289,1782
XZ6matRSsgA,KE,2026-06-08T05:13:14.906403+00:00,2026-06-01T16:09:53Z,RECAP TRAILER YA VIDEO YA DUNIA  SEASON 02  EP 27,RECAP TRAILER YA VIDEO YA DUNIA  SEASON 02  EP 27,DIRECTOR  KIONDO,UCPHlUapUbETAfuzw4PwGXKw,23,Comedy,,0,https://i.ytimg.com/vi/XZ6matRSsgA/hqdefault.jpg,en,zxx,False,1554,PT25M54S,hd,False,False,False,False,345237,6451,318
9HaP3YDck24,KE,2026-06-08T05:13:14.906418+00:00,2026-06-06T04:54:44Z,ROBLOX BE AN ADMIN!,ROBLOX BE AN ADMIN!,Foltyn,UCRkuUgtDAL4XSU5jB40J_wA,20,Gaming,"foltyn, foltyn roblox, roblox, roblox foltyn, foltyn family, funny, no swearing, foltyn family roblox, roblox foltyn family, blade ball, roblox blade ball, foltyn blade ball, foltyn and caylus, roblox admin foltyn, roblox admin abuse foltyn, foltyn and caylus playing roblox, foltyn and caylus playing together, roblox be an admin, roblox admin, foltyn and caylus playing roblox together",20,https://i.ytimg.com/vi/9HaP3YDck24/hqdefault.jpg,en,en-US,False,1078,PT17M58S,hd,False,True,False,False,1375633,16790,2713
dytel8byILM,KE,2026-06-08T05:13:14.906431+00:00,2026-06-05T09:04:18Z,Alikiba & Harmonize - Utanionea (Clip Officiel),Alikiba & Harmonize - Utanionea (Clip Officiel),Alikiba,UCSlyAXLzVNfsh3geYD9Cc4A,10,Music,"Alikiba, Harmonize, Utanionea, Utanionea Video, Trending Music, trending, Africa Music, African, Afropop, pop, swahili music, Swahili, Bongo Fleva, New Video Bongo, Tanzania Music, Nigeria music, Kenyan, muziki, Kingkiba, Kondeboy",20,https://i.ytimg.com/vi/dytel8byILM/hqdefault.jpg,en,sw,False,202,PT3M22S,hd,False,True,False,False,1005634,52798,6028
HLMX2w3cwuE,KE,2026-06-08T05:13:14.906442+00:00,2026-06-02T22:15:01Z,God of War Laufey - Gameplay Reveal Trailer | PS5 Games,God of War Laufey - Gameplay Reveal Trailer | PS5 Games,PlayStation,UC-2Y8dQb0S6DtpxNgAKoJKA,20,Gaming,"PlayStation, PS5, video games, next gen, Sony, state of play, god of war, God of War Laufey, Official Gameplay Reveal",9,https://i.ytimg.com/vi/HLMX2w3cwuE/hqdefault.jpg,en,en-US,False,1425,PT23M45S,hd,True,True,False,False,6694963,402617,29166
5F5MKI_jXJw,KE,2026-06-08T05:13:14.906451+00:00,2026-06-06T16:00:01Z,I Survived 100 Days In Realistic Minecraft,I Survived 100 Days In Realistic Minecraft,MrBeast Gaming,UCIPPMRA040LQr5QPyJEbmXA,20,Gaming,,0,https://i.ytimg.com/vi/5F5MKI_jXJw/hqdefault.jpg,en,en,False,1609,PT26M49S,hd,True,True,False,False,20721280,509952,17834
n-M9wE-SlkM,KE,2026-06-08T05:13:14.906459+00:00,2026-06-05T10:00:29Z,"Toxic Lyrikali, Countree Hype - STONE","Toxic Lyrikali, Countree Hype - STONE",Toxic Lyrikali,UC7q5EQvi2fJTQvwZRi0QJnw,10,Music,,0,https://i.ytimg.com/vi/n-M9wE-SlkM/hqdefault.jpg,sw,sw,False,167,PT2M47S,hd,False,False,False,False,167470,14017,1351
Rsztt5qDj_A,KE,2026-06-08T05:13:14.906467+00:00,2026-06-04T15:00:06Z,"FALL 2: DEADPOINT (2026) Official Trailer - Harriet Slater, Arsema Thomas","FALL 2: DEADPOINT (2026) Official Trailer - Harriet Slater, Arsema Thomas",Lionsgate Movies,UCJ6nMHaJPZvsJ-HmUmj1SeA,1,Film & Animation,"Fall 2 Deadpoint, Fall 2, Deadpoint, Harriet Slater, Arsema Thomas, Tom Brittney, Virginia Gardner, Grace Caroline Currey, The Spierig Brothers, survival thriller, mountain climbing movie, rock climbing movie, height thriller, survival movie, cliffhanger movie, rockslide scene, adventure thriller, suspense movie, 2026 movie, fall 2 trailer, mount kwan, high altitude survival, dangerous climb, extreme heights, survival drama, action thriller, new thriller movie",27,https://i.ytimg.com/vi/Rsztt5qDj_A/hqdefault.jpg,en,en,False,80,PT1M20S,hd,False,True,False,False,3110397,35372,2389
9ZPbk2Unu8A,KE,2026-06-08T05:13:14.906477+00:00,2026-06-06T03:00:06Z,THE WORLD's HIGHEST SECURITY PRISON: The Movie,THE WORLD's HIGHEST SECURITY PRISON: The Movie,Maizen,UCJHBJ7F-nAIlMGolm0Hu4vg,20,Gaming,"Minecraft, Maizen",2,https://i.ytimg.com/vi/9ZPbk2Unu8A/hqdefault.jpg,en,en,False,5036,PT1H23M56S,hd,False,True,False,False,651921,9174,1850
vrY1THC_NQE,KE,2026-06-08T05:13:14.906486+00:00,2026-06-01T15:00:06Z,IShowSpeed - World Cup (Champions) [Official Music Video],IShowSpeed - World Cup (Champions) [Official Music Video],IShowSpeed,UCWsDFcIhY2DBi3GB5uykGXA,20,Gaming,"ishowspeed, world cup",2,https://i.ytimg.com/vi/vrY1THC_NQE/hqdefault.jpg,en,en,False,299,PT4M59S,hd,False,False,False,False,31739443,2503901,149182
0JlMjgqduVw,KE,2026-06-08T05:13:14.906495+00:00,2026-05-29T13:54:01Z,House of the Dragon Season 3 | Official Final Trailer | HBO Max,House of the Dragon Season 3 | Official Final Trailer | HBO Max,HBO Max,UCx-KWLTKlB83hDI6UKECtJQ,24,Entertainment,"hbo max, hbo, hbo originals, hbo original series, hbo trailer, new on hbo, max, hbo max originals, hbo max trailer, hbo max teaser, hbo max series, hbo max youtube, house of the dragon, HOTD, Rhaenrya Targaryen, Daemon Targaryen, Aegon Targaryen, Alicent Hightower, game of thrones, Aemond Targaryen, Helaena Targaryen, Alys Rivers, Corlys Velaryon, Emma D'Arcy, Matt Smith, Olivia Cooke, Ormund Hightower, James Norton, A Song of Ice and Fire, Criston Cole, Fabien Frankel",31,https://i.ytimg.com/vi/0JlMjgqduVw/hqdefault.jpg,en,en,False,160,PT2M40S,hd,True,True,False,False,18260944,89985,4533
wX5CBSmip08,KE,2026-06-08T05:13:14.906504+00:00,2026-06-06T17:17:00Z,"Every Time I Crash, My Monster Truck JUMPS HIGHER in GTA 5","Every Time I Crash, My Monster Truck JUMPS HIGHER in GTA 5",SpeirsTheAmazingHD,UCAbdeLiTPdjk1X2TY_ZdLDw,20,Gaming,"speirstheamazinghd, gta 5 funny moments, gta 5, gta, gta 5 rp, grand theft auto 5, fastest car gta 5, gta 5 roleplay, roleplay, gta v roleplay, gta5 roleplay, gta 5 roleplay funny, car jumps gta 5, gaming, gaming gta 5, every time i crash, every time i crash gta 5, monster truck jumps, monster truck jumps higher, every time i crash my monster truck jumps higher, monster truck jumps higher gta 5, monster truck, monster trucks, monster trucks gta 5, monster truck gta 5",25,https://i.ytimg.com/vi/wX5CBSmip08/hqdefault.jpg,en,en,False,1854,PT30M54S,hd,False,True,False,False,488873,8392,132
CQ3Zi55OtJM,KE,2026-06-08T05:13:14.906513+00:00,2026-05-28T21:01:49Z,Marioo feat D Voice - Watu (Visualizer),Marioo feat D Voice - Watu (Visualizer),MariooOfficial,UCgZGpR80Z-x5fnUsKuKM2kg,10,Music,"Tanzania, Kenya, Uganda, Marioo, BongoFlava, music, africa, mariooofficial, marioo255, thisismarioo, omaryallymwanga, marioomusic, marioonewmusic, marioosongs, marioohits",15,https://i.ytimg.com/vi/CQ3Zi55OtJM/hqdefault.jpg,en,sw,False,144,PT2M24S,hd,False,True,False,False,1929976,25952,1575
tzlY8XD1CGg,KE,2026-06-08T05:13:14.906522+00:00,2026-06-03T16:06:24Z,Supergirl | Tickets on Sale Now,Supergirl | Tickets on Sale Now,DC,UCiifkYAs_bq1pt_zbNAzYGg,1,Film & Animation,"2026, Coming Soon, Craig Gillespie, DC, DC Comics, DC Studios, DCU, David Krumholtz, Emily Beecham, Eve Ridley, James Gunn, Jason Momoa, Kara Zor-El, Krypto, Matthias Schoenaerts, Milly Alcock, Supergirl, WB, Warner Bros, Warner Bros Pictures, Warner Brothers, official trailer, tickets on sale",23,https://i.ytimg.com/vi/tzlY8XD1CGg/hqdefault.jpg,en,en-US,False,133,PT2M13S,hd,True,False,False,False,758531,37140,2565
nkxRvK2xkek,KE,2026-06-08T05:13:14.906531+00:00,2026-06-06T14:30:18Z,I Revealed Roblox Admins in Real Life,I Revealed Roblox Admins in Real Life,Silver,UCXs61Ndm1-67HwDZR70g8pQ,20,Gaming,"roblox, roblox games, best roblox games, new roblox games, top roblox games, fun roblox games, roblox games you must play, Roblox Game Compilations, Roblox Game Rankings, Ultimate Roblox Game Lists, Roblox Game Catalog, Roblox Game Reviews, Best Roblox Game Collections, Roblox Game Suggestions, Roblox Game Selections, Roblox Game Lineup, Roblox Game Mix, Featured Roblox Games, Roblox Game Encyclopedia, Roblox Game Vault, Roblox Game Library, Weekly Roblox Game Picks",22,https://i.ytimg.com/vi/nkxRvK2xkek/hqdefault.jpg,en,en,False,1286,PT21M26S,hd,False,True,False,False,764558,8897,175
TJrFh_EkYkM,KE,2026-06-08T05:13:14.906539+00:00,2026-05-21T12:50:08Z,COLLOBLUE FT NDOVU KUU - DANCE SAMAWAAH ( Official Music Video),COLLOBLUE FT NDOVU KUU - DANCE SAMAWAAH ( Official Music Video),Colloblue ,UCt_wvuJMNMxkTdR6A8DcgUA,22,People & Blogs,,0,https://i.ytimg.com/vi/TJrFh_EkYkM/hqdefault.jpg,en,sw,False,193,PT3M13S,hd,False,True,False,False,1505820,19542,541
GAbT5qCTXR8,KE,2026-06-08T05:13:14.906548+00:00,2026-06-03T13:59:50Z,Lucky — Official Trailer | Apple TV,Lucky — Official Trailer | Apple TV,Apple TV,UC1Myj674wRVXB9I4c6Hm5zA,24,Entertainment,"lucky, lucky trailer, lucky official trailer, lucky apple tv, lucky apple tv+, lucky series, lucky tv series, lucky teaser, apple tv lucky, anya taylor-joy, anya taylor joy, anya taylor-joy lucky, timothy olyphant, annette bening, drew starkey, aunjanue ellis-taylor, reese witherspoon, crime drama series, thriller series, apple tv series, book adaptation, marissa stapley, jonathan tropper, lucky 2026, apple originals, official teaser, new thriller series",27,https://i.ytimg.com/vi/GAbT5qCTXR8/hqdefault.jpg,en,en,False,133,PT2M13S,hd,True,True,False,False,4195303,20624,824
wFggR039O24,KE,2026-06-08T05:13:14.906556+00:00,2026-06-06T02:00:34Z,I Survived 100 Days as INFECTED SKY in Minecraft,I Survived 100 Days as INFECTED SKY in Minecraft,EYstreem,UC-g_O9HWb5B0rVDG1hLd5Hw,20,Gaming,"Eystreem, eyestream, eystream, minecraft, roleplay, funny, prank, secret, tutorial, minecraft bedrock edition, make waves, jordan, scary, animation, I Survived 100 Days as INFECTED SKY in Minecraft, i survived 100 days in hardcore minecraft, minecraft 100 days, minecraft but im infected sky, infected sky, infected sky in minecraft, eystreem vs firelight, scary minecraft, minecraft but I am OP, minecraft but 100 days infected sky",24,https://i.ytimg.com/vi/wFggR039O24/hqdefault.jpg,en,en,False,1386,PT23M6S,hd,False,True,False,False,1031236,8825,453
fcnDmrtj6Sk,KE,2026-06-08T05:13:14.906566+00:00,2026-05-23T16:14:03Z,"Shakira, Burna Boy - Dai Dai (Official Video)","Shakira, Burna Boy - Dai Dai (Official Video)",shakiraVEVO,UCGnjeahCJW1AF34HBmQTJ-Q,10,Music,"Shakira, Shakira 2026, Shakira letra, Shakira lyrics, Shakira dai dai, dai dai shak, dai dai shakira, shakira letra 2026, Dai dai letra, dai dai lyrics, dai dai, Burna Boy, Burna Boy letra, Burna Boy lyrics, Burna Boy 2026, Burna Boy video, Burna boy dai dai, Afro Pop, Cheerful, Latin Pop",20,https://i.ytimg.com/vi/fcnDmrtj6Sk/hqdefault.jpg,en,en,False,241,PT4M1S,hd,False,True,False,False,97165502,2596554,138197
mObRUsA7dPY,KE,2026-06-08T05:13:14.906575+00:00,2026-06-01T14:00:01Z,I Will Find You | Official Trailer | Netflix,I Will Find You | Official Trailer | Netflix,Netflix,UCWOA1ZGywLbqmigxE4Qlvuw,24,Entertainment,"Britt Lower, Chi McBride, Harlan Coben, I Will Find You, Logan Browning, Madeleine Stowe, Milo Ventimiglia, Mystery Show, Netflix, Netflix Mystery, Netflix Thriller, New Mystery Show, New Thriller Show, Sam Worthington, Thriller Show",15,https://i.ytimg.com/vi/mObRUsA7dPY/hqdefault.jpg,en,en-US,False,117,PT1M57S,hd,True,True,False,False,553691,6400,405
pum6ZicBVhQ,KE,2026-06-08T05:13:14.906584+00:00,2026-06-06T14:00:30Z,Rags to Riches Sonic in GTA 5,Rags to Riches Sonic in GTA 5,Simply Chris,UCuOnYE6km4LnKL_nPcgVa9A,20,Gaming,"gaming, video game, gta 5, super sonic, gta mods, gta 5 mods, gta v, sonic mod, gta 5 sonic mod, super sonic gta 5, simply chris, gta 5 mod, simple chris, gta, gta rp, sonic, sonic the hedgehog, gta 5 super sonic, sonic the hedgehog mod, gta 5 space, super sonic mod, gta 5 but, eggman gta 5, strongest sonic, $1 sonic, $1000000 sonic, rich eggman, poor sonic, rich sonic, poor to rich sonic, rags to riches, rags to riches sonic",32,https://i.ytimg.com/vi/pum6ZicBVhQ/hqdefault.jpg,en,en,False,863,PT14M23S,hd,False,True,False,False,475342,5419,27
krWbvpczrDs,KE,2026-06-08T05:13:14.906593+00:00,2026-06-06T12:00:24Z,Vicky Brilliance~ Amune Siigu Cheap || Official Lyrics,Vicky Brilliance~ Amune Siigu Cheap || Official Lyrics,Vicky Brilliance,UC9gQ-Q5v2djNkag-R_KGyXA,10,Music,,0,https://i.ytimg.com/vi/krWbvpczrDs/hqdefault.jpg,en,en,False,295,PT4M55S,hd,False,True,False,False,59850,3057,606
ORxw68y3lyw,KE,2026-06-08T05:13:14.906600+00:00,2026-06-02T13:00:02Z,How To Rob A Bank | Official Trailer,How To Rob A Bank | Official Trailer,Amazon MGM Studios,UCf5CjDJvsFvtVIhkfmKAwAA,24,Entertainment,"MGM, MGM Studios, Metro-Goldwyn- Mayer, Metro Pictures Corporations, Goldwyn Pictures, Louis B. Mayer Pictures, MGM Pictures, United Artists, Metro MGM/UA, Amazon MGM, Amazon MGM Studios, Amazon, How To Rob A Bank (2026), How To Rob A Bank (2026) Official Trailer, How To Rob A Bank Official Trailer, How To Rob A Bank Trailer, Tati Gabrielle, Nicholas Hoult, Christian Slater, Pete Davidson, Zoë Kravitz, Anna Sawai, John C. Reilly, New Movies 2026",24,https://i.ytimg.com/vi/ORxw68y3lyw/hqdefault.jpg,en,en-US,False,171,PT2M51S,hd,True,True,False,False,9322212,31951,1933
KG2y78MBlss,KE,2026-06-08T05:13:14.906610+00:00,2026-06-06T15:00:04Z,Buried JJ SIREN HEAD is Found by IVY and Mikey - Maizen Minecraft Animation,Buried JJ SIREN HEAD is Found by IVY and Mikey - Maizen Minecraft Animation,MSToons,UCc2RL8jvY1rJPuCnJVsIQWw,20,Gaming,"minecraft, animation, minecraft animation, maizen, jj, mikey, jj and mikey, maizen animation, maizen minecraft animation, jj and mikey minecraft animation, jj and mikey sad story, まいぜんシスターズ, マインクラフト, まいぜん, jj sister, strong jj, strong jj sister, jj sister and jj",18,https://i.ytimg.com/vi/KG2y78MBlss/hqdefault.jpg,en,en,False,692,PT11M32S,hd,False,True,False,False,783714,3152,43
pBZefHZSmaE,KE,2026-06-08T05:13:14.906619+00:00,2026-06-04T07:05:46Z,ZIPPORAH MWANIKI - HAPA NI WAPI? (OFFICIAL VIDEO),ZIPPORAH MWANIKI - HAPA NI WAPI? (OFFICIAL VIDEO),ZIPPORAH MWANIKI,UCh_hMu7Fgo2RJDgRGev4-pw,10,Music,"Zipporah Eric, Kenyan music, Kamba music, Best of Kamba music, 254 music, Wilberforce musyoka, Stephen kasolo, Best of east africa music, Njugush, Tugi, Abel mutua, switch tv, Jalango tv, ngomma vas, ngomma.com, Ngomma, Trending music, Best of Trending music, Trending in kenya, Trending in Tanzania, Trending in East africa, Top trending, Kasolo",23,https://i.ytimg.com/vi/pBZefHZSmaE/hqdefault.jpg,en,sw,False,405,PT6M45S,hd,False,True,False,False,79979,3919,1500
PyKBpn186mU,KE,2026-06-08T05:13:14.906628+00:00,2026-06-06T11:00:11Z,A Noob SAVE The OWNER from TSUNAMI!,A Noob SAVE The OWNER from TSUNAMI!,Zoomy,UCJnH5Ph5O1EZhKiKiNgH9IA,20,Gaming,"Steal a Brainrot, StealABrainrot, Steal a Brainrot Shorts, Steal a Brainrot Roblox, Steal a Brainrot funny moments, Steal a Brainrot clips, Steal a Brainrot meme, Steal a Brainrot animation, Steal a Brainrot gameplay, Steal a Brainrot story, Steal a Brainrot edit, Steal a Brainrot compilation, Steal a Brainrot scenes, Steal a Brainrot reaction, Roblox Steal a Brainrot, Roblox Shorts, Roblox funny, Roblox meme, Roblox edit, Roblox animation, Roblox gameplay, Roblox short film",22,https://i.ytimg.com/vi/PyKBpn186mU/hqdefault.jpg,en,en,False,1278,PT21M18S,hd,False,True,False,False,580698,6496,104
FMFOowX0IIs,KE,2026-06-08T05:13:14.906637+00:00,2026-05-29T14:00:06Z,Patoranking - Shake That Ft. Ruger (Official Video),Patoranking - Shake That Ft. Ruger (Official Video),Patoranking,UC_p3IZfAsQ66RAUxNk7qTqQ,10,Music,"afro beats, afro pop, pato, Patoranking, IkelMarvlus, Ruger",6,https://i.ytimg.com/vi/FMFOowX0IIs/hqdefault.jpg,en,en-GB,False,195,PT3M15S,hd,False,True,False,False,981080,0,1687
qBYXTjzqutw,KE,2026-06-08T05:13:14.906645+00:00,2026-06-06T15:00:20Z,Going into My Friend’s Heads to Find SECRETS!,Going into My Friend’s Heads to Find SECRETS!,Cash,UC0eLBYhxW9HC0P9PXQ73mpQ,24,Entertainment,"Cash, Nico, Nico and Cash, Cash and Nico, Minecraft, Minecraft mod, family friendly, kid friendly",8,https://i.ytimg.com/vi/qBYXTjzqutw/hqdefault.jpg,en,en-US,False,1124,PT18M44S,hd,False,True,False,False,476362,5953,1072
Zhu81mS_9PY,KE,2026-06-08T05:13:14.906654+00:00,2026-05-29T08:00:06Z,Nikita Kering' - Niwache (Official Music Video),Nikita Kering' - Niwache (Official Music Video),Nikita Kering',UCl1txXouaN3YU8zzNPJP_pA,24,Entertainment,,0,https://i.ytimg.com/vi/Zhu81mS_9PY/hqdefault.jpg,en,,False,189,PT3M9S,hd,False,True,False,False,354170,10719,717
ApkVDhj0KjA,KE,2026-06-08T05:13:14.906662+00:00,2026-06-04T20:00:33Z,I Evolved From FAT to MUSCULAR in Minecraft!,I Evolved From FAT to MUSCULAR in Minecraft!,PrestonPlayz,UCJZam2u1G0syq3kyqrCXrNw,20,Gaming,"minecraft, preston, brianna, gaming, funny, ssundee, unspeakable, mrbeast, aphmau, canman, lankybox, cash minecraft, nico mc, stokestwins, gametoons, maizen, eyestreem",17,https://i.ytimg.com/vi/ApkVDhj0KjA/hqdefault.jpg,en,en,False,1274,PT21M14S,hd,False,True,False,False,1085819,12237,506
q_APytLv2nI,KE,2026-06-08T05:13:14.906670+00:00,2026-06-03T13:30:11Z,BON STARKID - NDIUMAEKEA (VISUALIZER),BON STARKID - NDIUMAEKEA (VISUALIZER),Bon Starkid,UCYmZqtshmhC9VqxO9EnGViw,10,Music,,0,https://i.ytimg.com/vi/q_APytLv2nI/hqdefault.jpg,en,en,False,223,PT3M43S,hd,False,True,False,False,48179,2704,465
kdUFUiXhMDU,KE,2026-06-08T05:13:14.906679+00:00,2026-06-05T05:41:49Z,PORTUGAL PACK | C.RONALDO 105 WILL POWER 🔥 GAMEPLAY REVIEW 🔥 eFootball 26 mobile,PORTUGAL PACK | C.RONALDO 105 WILL POWER 🔥 GAMEPLAY REVIEW 🔥 eFootball 26 mobile,9AL Games,UCvzTJH6G9bH5nCQ1Hfb8nGg,20,Gaming,"new pack efootball 26, 101 rated ronaldo efootball 26, rudiger national team pack efootball 26, national team pack review efootball 26, 100 rated rudiger national pack efootball 26, ronaldo efootball 2026, efootball 2026 ronaldo, ronaldo efootball, efootball ronaldo, new legend assemble pack efootball 26, ronaldo efootball 2025, national pack efootball, 105 ronaldo efootball, ronaldo epic efootball, big time ronaldo efootball 2026, portugal pack efootball 2026",16,https://i.ytimg.com/vi/kdUFUiXhMDU/hqdefault.jpg,en,en,False,1020,PT17M,hd,False,True,False,False,265675,18000,1096
uTqjV9FCFIc,KE,2026-06-08T05:13:14.906689+00:00,2026-06-02T11:04:06Z,Chriss Tetu&Pilaz pilonje|SIKINAI AI-(OFFICIAL VIDEO),Chriss Tetu&Pilaz pilonje|SIKINAI AI-(OFFICIAL VIDEO),chriss Tetu,UC2It1_Y1ed5mn_0awH_W5Cw,10,Music,,0,https://i.ytimg.com/vi/uTqjV9FCFIc/hqdefault.jpg,en,,False,231,PT3M51S,hd,False,True,False,False,69031,3358,576
9wpyvdIV0Y0,KE,2026-06-08T05:13:14.906698+00:00,2026-06-03T11:00:06Z,eFootball™ CONNECT (Global) / The Football Festival Campaign,eFootball™ CONNECT (Global) / The Football Festival Campaign,eFootball,UCQdSC4folRoUuPC3iiRkfFQ,20,Gaming,,0,https://i.ytimg.com/vi/9wpyvdIV0Y0/hqdefault.jpg,en,en,False,803,PT13M23S,hd,True,False,False,False,716647,48671,3831
v8cdhClERDY,KE,2026-06-08T05:13:14.906706+00:00,2026-06-05T08:56:40Z,SHANARIHA EVANS FT MAKAMANDA - ANKO MNOKO - DJ Shiti(OFFICIAL VIDEO),SHANARIHA EVANS FT MAKAMANDA - ANKO MNOKO - DJ Shiti(OFFICIAL VIDEO),Shanariha Evans,UCfZMJDd8FBV9htATZicPYIg,10,Music,,0,https://i.ytimg.com/vi/v8cdhClERDY/hqdefault.jpg,en,sw,False,244,PT4M4S,hd,False,False,False,False,48756,3732,319
P3CdVS9tNVw,KE,2026-06-08T05:13:14.906714+00:00,2026-06-06T06:00:39Z,JJ and Mikey Can Turn Into MOBS In Hide-and-Seek...,JJ and Mikey Can Turn Into MOBS In Hide-and-Seek...,Maizen - Minecraft Family,UCWqlr0TNvdFl7sv6zHR8IvA,20,Gaming,"minecraft funny, minecraft, funny minecraft, funny memes, zenichi maizen, noob vs pro security house, jj and mikey, mikey turtle, maizen security house, maizen challenge, maizen, roblox, maizen roblox, jj and mikey roblox, skyblock, shapeshift, maizen shapeshift, jj and mikey shapeshift",18,https://i.ytimg.com/vi/P3CdVS9tNVw/hqdefault.jpg,en,en-US,False,1349,PT22M29S,hd,False,True,False,False,199485,858,19
d8xTFdfw_70,KE,2026-06-08T05:13:14.906724+00:00,2026-06-06T13:00:06Z,"Ajay, BURUKLYN BOYZ - ROHO (Official Music Video)","Ajay, BURUKLYN BOYZ - ROHO (Official Music Video)",BURUKLYN BOYZ,UCoJ0b8z-FS_tuissbov-UUA,10,Music,,0,https://i.ytimg.com/vi/d8xTFdfw_70/hqdefault.jpg,en,sw,False,189,PT3M9S,hd,True,True,False,False,59642,6733,576
SUNzjtksMYI,KE,2026-06-08T05:13:14.906731+00:00,2026-06-05T19:01:35Z,"GTA 5 but EVERY 30 Seconds, it's MORE Realistic!","GTA 5 but EVERY 30 Seconds, it's MORE Realistic!",Nought,UCSh__r5HS4Y1xBkccWnV0TA,20,Gaming,"gta 5, gta v, gta 5 mods, gta v mods, mods, realistic, gta 5 realistic, gta 5 30 seconds, 30 seconds, every 30 seconds, more, increase, most realistic gta 5, gta 5 nought, nought, gaming, gta 5 graphics, gta 5 realistic graphics, money, gta 5 money",20,https://i.ytimg.com/vi/SUNzjtksMYI/hqdefault.jpg,en,en,False,989,PT16M29S,hd,False,True,False,False,157765,5439,143
f3pyydvf3XM,KE,2026-06-08T05:13:14.906739+00:00,2026-06-05T08:15:06Z,Badman Bright & Thirtyfourbrick - Kuna Ngori (Official Music Video),Badman Bright & Thirtyfourbrick - Kuna Ngori (Official Music Video),Badman Bright,UCeRerlk9qv50zKghovQTQtw,10,Music,,0,https://i.ytimg.com/vi/f3pyydvf3XM/hqdefault.jpg,en,sw,False,202,PT3M22S,hd,False,False,False,False,39705,3090,192
ixdzHSSW_po,KE,2026-06-08T05:13:14.906746+00:00,2026-06-06T23:00:28Z,I Secretly Started a War in Minecraft,I Secretly Started a War in Minecraft,Bionic,UCETZ7OiW7-wqwb-6hsz3C4w,20,Gaming,"minecraft, bionic, family friendly, I Started a War In Minecraft, smp, minecraft smp, minecraft war, minecraft army, war in minecraft",9,https://i.ytimg.com/vi/ixdzHSSW_po/hqdefault.jpg,en,en,False,1214,PT20M14S,hd,False,True,False,False,334291,9230,851
YskA97zqFhw,KE,2026-06-08T05:13:14.906754+00:00,2026-05-26T09:00:06Z,ALEX KASAU KATOMBI-KUMILA(OFFICIAL 4K VIDEO),ALEX KASAU KATOMBI-KUMILA(OFFICIAL 4K VIDEO),Alex Kasau Katombi,UCWFv8hpX1Xj03kJFsP9MmRA,10,Music,"alex, kasau, katombi, ngulumende, mwanosu, nguuni, lovers",7,https://i.ytimg.com/vi/YskA97zqFhw/hqdefault.jpg,sw,en-US,False,320,PT5M20S,hd,False,True,False,False,243465,8438,623
S4xSgtRC2II,KE,2026-06-08T05:13:14.906763+00:00,2026-06-05T10:45:06Z,الرجل العنكبوت انقاذ باتمان Spider-Man Rescue batman vs iron man vs venom funny Game GTA 5 superhero,الرجل العنكبوت انقاذ باتمان Spider-Man Rescue batman vs iron man vs venom funny Game GTA 5 superhero,Spider World 🌍,UCVxFAKq91S9pXL0Ezp5v1Kw,10,Music,,0,https://i.ytimg.com/vi/S4xSgtRC2II/hqdefault.jpg,en-US,zxx,False,3844,PT1H4M4S,hd,False,True,False,False,2263136,27660,332
v96Q2e1F4IM,KE,2026-06-08T05:13:14.906770+00:00,2026-06-01T07:00:06Z,ETHIC - TAKI (OFFICIAL VIDEO),ETHIC - TAKI (OFFICIAL VIDEO),Ethic Entertainment,UCOEK9oW_VYDHbX3qwT4JMyQ,10,Music,,0,https://i.ytimg.com/vi/v96Q2e1F4IM/hqdefault.jpg,en,,False,173,PT2M53S,hd,False,False,False,False,101742,8324,657
4i3GHno_CGI,KE,2026-06-08T05:13:14.906778+00:00,2026-06-06T20:42:37Z,WE MADE OUR PARENTS MAD..,WE MADE OUR PARENTS MAD..,Tyler & Snowi,UCzzF1kdBgwv5RB6rbB6kVSA,20,Gaming,"roblox, funny moments, tyler and snowi, tyler, snowi, tyler & snowi, funny, moments, roblox funny moments, roblox horror, roblox horror games, roblox horror story, horror, horror games, roblox parents, roblox kids, roblox kids vs parents, roblox kids and parents, roblox pou, pou roblox, roblox parents and kids, roblox parents roleplay, roblox kids roleplay, roblox parents story, roblox scary parents, roblox parents HORROR, roblox parents horror game, roblox parent horror games",28,https://i.ytimg.com/vi/4i3GHno_CGI/hqdefault.jpg,en,en-US,False,10422,PT2H53M42S,hd,False,True,False,False,908244,50072,942
UDD8ZDm-bbI,KE,2026-06-08T05:13:14.906788+00:00,2026-06-02T08:21:45Z,Stephen Kasolo - Mbai ni Yombana (Kyathi kya Tabitha Shem Kasau (Official 4k video),Stephen Kasolo - Mbai ni Yombana (Kyathi kya Tabitha Shem Kasau (Official 4k video),Stephen Kasolo Official,UCcEIuIasgNTRoxjk5lI_t6A,10,Music,"stephen kasolo, kamba music, kamba, gospel music, kenyan music, kenya, kitole, kelele, hautasumbuka tena, ngai niwukilasya, Ngomma, Ngomma vas, Ngomma.com, trending music, top trending, solo, otile brown, sauti sol, rose muhando",19,https://i.ytimg.com/vi/UDD8ZDm-bbI/hqdefault.jpg,en,en,False,436,PT7M16S,hd,False,True,False,False,74110,0,259
MF00TahP1yY,KE,2026-06-08T05:13:14.906796+00:00,2026-06-06T18:35:12Z,We Replayed the Career of Messi & Ronaldo...🐐,We Replayed the Career of Messi & Ronaldo...🐐,S2G,UChR1Yn7YpVrnP-SbsWtjuBA,20,Gaming,,0,https://i.ytimg.com/vi/MF00TahP1yY/hqdefault.jpg,en-GB,en,False,2455,PT40M55S,hd,False,True,False,False,338965,14110,874
oqCOfq9vqeg,KE,2026-06-08T05:13:14.906804+00:00,2026-06-01T15:50:41Z,EMKAY 64 -  KOROGESHEN {Official Music Video},EMKAY 64 -  KOROGESHEN {Official Music Video},Emkay64,UCBDOAiZMSHf11WciQd3SOEg,10,Music,#64 #mk #hippop #kisauni #mombasdahippop #sanashamba #shamba #tanzania #nairobi #mombasa #trend,1,https://i.ytimg.com/vi/oqCOfq9vqeg/hqdefault.jpg,en,sw,False,214,PT3M34S,hd,False,False,False,False,57755,4447,617
