video_id,country,fetched_at,published_at,title,localized_title,channel_title,channel_id,category_id,category_name,tags,tag_count,thumbnail,default_language,audio_language,is_live,duration,duration_raw,definition,caption_available,licensed_content,embeddable,made_for_kids,views,likes,comments
OV1IeFbSUUs,RU,2026-02-01T03:38:44.219272+00:00,2026-01-31T10:56:53Z,Я ПРОШЕЛ 3 РАНДОМНЫЕ ИГРЫ НА 100% ДОСТИЖЕНИЙ! (ЧИЗ БОССОВ В СЕКИРО),Я ПРОШЕЛ 3 РАНДОМНЫЕ ИГРЫ НА 100% ДОСТИЖЕНИЙ! (ЧИЗ БОССОВ В СЕКИРО),Dankwist,UC-Upyd81gNDs-jzf5iOXTNA,20,Gaming,"dankwist, данквист, 100% достижений, все достижения в игре, все достижения, все трофеи, все ачивки, прохожу игру на 100%, сложные достижения, рандомные игры, ачивка, трофей, достижения, игра на сто процентов, игры на 100 процентов, достижения в стим, секиро, секиро 100%, секиро чиз, секиро достижения, секиро платина, sekiro чиз, sekiro, sekiro платина, sekiro гайд, кинг конг игра, альба, конг, сложные достижения в играх, чиз боссов",30,https://i.ytimg.com/vi/OV1IeFbSUUs/hqdefault.jpg,ru,ru,False,3997,PT1H6M37S,hd,False,True,False,False,57001,3071,138
503lGiHzGZw,RU,2026-02-01T03:38:44.219280+00:00,2026-01-31T12:54:49Z,Я Устроил Охоту на Себя За 100.000 Рублей в CS2,Я Устроил Охоту на Себя За 100.000 Рублей в CS2,Aveo,UCTEEUQ_qo2NABnpiJuV777Q,20,Gaming,"aveo, aveo cs2, cs 2, cs, aveo cs, cs 2 aveo, aveo cs go",7,https://i.ytimg.com/vi/503lGiHzGZw/hqdefault.jpg,ru,ru,False,1607,PT26M47S,hd,False,True,False,False,38717,2040,124
ZcR3ux-BeG4,RU,2026-02-01T03:38:44.219287+00:00,2026-01-31T16:46:30Z,МИРОВОЙ РЕКОРД В МЕТРО РОЯЛЬ PUBG MOBILE,МИРОВОЙ РЕКОРД В МЕТРО РОЯЛЬ PUBG MOBILE,GLAVSTE,UCHomlcCTVq1ghBhoG011Igg,20,Gaming,"метро, метро рояль, metro royale, metro pubg, pubg metro, pubg mobile metro, metro pubg mobile, метро pubg, рекорд выноса метро рояль, золото в метро рояль, стрим метро рояль, стрим главсте, папа главсти",13,https://i.ytimg.com/vi/ZcR3ux-BeG4/hqdefault.jpg,ru,ru,False,10690,PT2H58M10S,hd,False,False,False,False,141255,3503,2
alZ0Zf2TTuc,RU,2026-02-01T03:38:44.219294+00:00,2026-01-31T00:56:31Z,КОНЕЦ ОПТИМИЗАЦИИ ИГР,КОНЕЦ ОПТИМИЗАЦИИ ИГР,TheDRZJ,UC_gKMJFeCf1bKzZr_fICkig,20,Gaming,,0,https://i.ytimg.com/vi/alZ0Zf2TTuc/hqdefault.jpg,ru,ru,False,2284,PT38M4S,hd,False,True,False,False,169394,14897,1401
l1n_itNrrb4,RU,2026-02-01T03:38:44.219301+00:00,2026-01-31T11:01:29Z,СЛОМАЛИ ОГРОМНЫЙ КОРАБЛЬ! СКОЛЬКО МАТЕРИАЛОВ ПОЛУЧИЛИ? Ship Graveyard Simulator 2,СЛОМАЛИ ОГРОМНЫЙ КОРАБЛЬ! СКОЛЬКО МАТЕРИАЛОВ ПОЛУЧИЛИ? Ship Graveyard Simulator 2,SodaEffect,UCa2oFpjziUQIImcpkrflwDw,20,Gaming,"soda effect, сода эффект, sodaeffect, содаэффект, peak прохождение на русском, soda effect peak, прохождение, сода, soda, геймплей, летсплей, letsplay, челендж, квест, кооп, кооператив, загадки, deadem, кооперативный квест, кооперативное прохождение, угар, игры с друзьями, кооперативные игры, кооп прохождение, с друзьями, по сети, игры, MIMESIS, мимесис",29,https://i.ytimg.com/vi/l1n_itNrrb4/hqdefault.jpg,ru,ru,False,4063,PT1H7M43S,hd,False,True,False,False,74641,8395,380
ElLzs_cc3GY,RU,2026-02-01T03:38:44.219309+00:00,2026-01-31T07:35:14Z,😱СБЕГИ от ГУГА ГАГА что бы ВЫЖИТЬ! СПАСЕНИЕ ШОКОЛАДНОЙ ФАБРИКИ,😱СБЕГИ от ГУГА ГАГА что бы ВЫЖИТЬ! СПАСЕНИЕ ШОКОЛАДНОЙ ФАБРИКИ,EroxBlox,UCMDSzea8f4CC53mZC3ViZug,20,Gaming,,0,https://i.ytimg.com/vi/ElLzs_cc3GY/hqdefault.jpg,ru,ru,False,731,PT12M11S,hd,False,True,False,False,282000,5669,1657
f5RpIVYtlwo,RU,2026-02-01T03:38:44.219317+00:00,2026-01-31T15:00:40Z,Я КУПИЛ 250 БОНУСНЫХ НАГРАД В БРАВЛ ПАСС И ВОТ ЧТО ИЗ ЭТОГО ВЫШЛО... (минус 8000 гемов),Я КУПИЛ 250 БОНУСНЫХ НАГРАД В БРАВЛ ПАСС И ВОТ ЧТО ИЗ ЭТОГО ВЫШЛО... (минус 8000 гемов),MaksGo,UCqyETTuBwkIR2mSGGSIxHow,20,Gaming,"maksgo, maks go, максго, макс го",4,https://i.ytimg.com/vi/f5RpIVYtlwo/hqdefault.jpg,ru,ru,False,1015,PT16M55S,hd,False,True,False,False,50792,2135,290
uo6QROukhBU,RU,2026-02-01T03:38:44.219324+00:00,2026-01-31T14:01:27Z,ЗАБАНИЛ ВЫСЕРА за ЗАПРЕЩЕННЫЕ СЛОВА в ГТА 5 РП / MAJESTIC RP,ЗАБАНИЛ ВЫСЕРА за ЗАПРЕЩЕННЫЕ СЛОВА в ГТА 5 РП / MAJESTIC RP,Mad,UCxQbYH2A4zTVdTjIMlbT97g,20,Gaming,"гта 5 рп, гта рп, гта, рп, гта 5, majestic rp, промокод majestic rp, маджестик рп гта 5, majestic rp гта 5, majestic, mad gta 5 rp, gta 5rp, gta 5 рп, gta5rp, гта5рп, gta 5 roleplay, gta rp, gta5, gta 5 rp, gta 5, gta, rp, промокод маджестик рп, majestic gta 5 rp, маджестик рп, majestic rp gta 5, mad, majestic rp gta, majestic рп, маджестик, гта 5 маджестик, гта маджестик, gta v rp, гта рп majestic, ЗАБАНИЛ ВЫСЕРА, ЗАБАНИЛ ВЫСЕРА за ЗАПРЕЩЕННЫЕ СЛОВА, ЗАБАНИЛ ВЫСЕРА за СЛОВА",37,https://i.ytimg.com/vi/uo6QROukhBU/hqdefault.jpg,ru,ru,False,1298,PT21M38S,hd,False,False,False,False,48606,2691,217
NzPAE-hTWtM,RU,2026-02-01T03:38:44.219332+00:00,2026-01-31T08:00:28Z,"100 Дней, Но Ты Можешь ПОКУПАТЬ ЧАНКИ","100 Дней, Но Ты Можешь ПОКУПАТЬ ЧАНКИ",Parradix,UCSBL8ohURyEzTjJvZq2x_AA,20,Gaming,"парадикс, итс парадикс, Parradix, paradix, майн, майнкрафт, парадикс майнкрафт, minecraft parradix, 100 Дней, Но Ты Должен РАЗБЛОКИРОВАТЬ ЧАНКИ!, Но ВСЕ ЧАНКИ ЗАБЛОКИРОВАНЫ в Майнкрафт, 100 дней но ты можешь покупать чанки",12,https://i.ytimg.com/vi/NzPAE-hTWtM/hqdefault.jpg,ru,ru,False,4638,PT1H17M18S,hd,False,True,False,False,101458,3776,447
cwbGWmMGYbw,RU,2026-02-01T03:38:44.219340+00:00,2026-01-30T22:18:18Z,"ГЛЕБ ИГРАЕТ в Scam Line / ЗВОНКИ по ТЕЛЕФОНУ в КОМНАТАХ (Ростик, Витя, Танк, Нарек, Скай) | Sasavot","ГЛЕБ ИГРАЕТ в Scam Line / ЗВОНКИ по ТЕЛЕФОНУ в КОМНАТАХ (Ростик, Витя, Танк, Нарек, Скай) | Sasavot",SASAVOT / НАРЕЗКИ,UCuMuu3C4A-QIkN4Uzi-4XBQ,20,Gaming,"sasavot, сасавот, uglyfacekid, ростик фейс кид, глеб и ростик, сасавот и ростик, сасавот и кеннет, глеб сасавот, spokoynich, кишки, кишки сквад, сквад кишки, kishki, kishki squad, kiwki squad, spokoynich_ нарезки, sasavot нарезки, спокойнич и сасавот, глеб и макс, глеб и спокойнич, сасавот и спокойнич, scam line, звонки, 6 комнат, телефон",25,https://i.ytimg.com/vi/cwbGWmMGYbw/hqdefault.jpg,ru,ru,False,3718,PT1H1M58S,hd,False,True,False,False,108017,3195,97
TP6a4m4bnHs,RU,2026-02-01T03:38:44.219347+00:00,2026-01-31T15:06:42Z,СОНЯ И ПЯТЕРКА КРУТЯТ С АКСОМ! | Коломбина и Инеффа | Genshin Impact 6.3,СОНЯ И ПЯТЕРКА КРУТЯТ С АКСОМ! | Коломбина и Инеффа | Genshin Impact 6.3,AxeSAY,UCxmckxBkGNmFY6hTRWsPf1w,20,Gaming,"Genshin Impact новые баннеры, подписчики открывают молитвы, genshin impact, genshin impact ролл баннеров, genshin impact новые баннеры, новые герои genshin impact, новые баннеры геншин, genshin impact гайд, AxeSay, axesay паша, открытие молитв, геншин, геншин импакт, genshin impact 6.3, акс паша, крутки, акс, axe, акс геншин, акс сэй, крутки геншин, слив, промокоды, гайд, с6, геншин импакт крутки, генши импакт, axesay, рекорд, коломбина, коломбина гайд, пятерка, 5opka, пятеркарка крутки",34,https://i.ytimg.com/vi/TP6a4m4bnHs/hqdefault.jpg,ru,ru,False,1661,PT27M41S,hd,False,True,False,False,37442,5413,471
-S79XKEc96k,RU,2026-02-01T03:38:44.219355+00:00,2026-01-31T16:00:00Z,ПУТЬ ПЕРЕКУПА НА БЛЕК РАША #88 Я ПОТЕРЯЛ ВСЕ ИМУЩЕСТВО? НАКАЗАЛ КИДАЛУ В BLACK RUSSIA!,ПУТЬ ПЕРЕКУПА НА БЛЕК РАША #88 Я ПОТЕРЯЛ ВСЕ ИМУЩЕСТВО? НАКАЗАЛ КИДАЛУ В BLACK RUSSIA!,ENZO,UCI1bdA44MI3IYLO9QspqjgQ,20,Gaming,"блек раша, блэк раша, блекраша, блек раша рп, блек раша екб, блек раша перекуп, блек раша путь перекупа, блек раша перекуп аксов, блек раша перекуп скинов, блек раша путь перекупа энзо, перекуп блек раша, блек раша перекуп бмв, блек раша перекуп высокий класс, блек раша перекуп казино, black russia, black russia rp, black russian, black russia ekb, black russia путь перекупа, black russia перекуп, black russia crmp mobile, black russia bmw, black russia скам, enzo, crmp",25,https://i.ytimg.com/vi/-S79XKEc96k/hqdefault.jpg,ru,ru,False,1840,PT30M40S,hd,True,False,False,False,41877,2510,384
EYc4BFEPs0g,RU,2026-02-01T03:38:44.219363+00:00,2026-01-30T17:13:09Z,"ЧТО ЭТИ МАЖОРЫ СЕБЕ ПОЗВОЛЯЮТ? НОВЫЕ ТАЧКИ, КОНТЕЙНЕРЫ И ALL IN В ГТА 5 РП (ECLIPSE GTA 5 RP)","ЧТО ЭТИ МАЖОРЫ СЕБЕ ПОЗВОЛЯЮТ? НОВЫЕ ТАЧКИ, КОНТЕЙНЕРЫ И ALL IN В ГТА 5 РП (ECLIPSE GTA 5 RP)",Joe Speen,UCLizDDpxiFRoqTLlMyGX7lQ,20,Gaming,"joe speen, джо спин, гта 5, гта 5 онлайн, gta 5 онлайн, gta 5 online, GTA 5 online, гта 5 рп, GTA 5 RP, gta 5, gta 5 rp начало игры, gta 5 rp начало, joe, speen, эклипс гта 5 рп, eclipse gta 5 rp, eclipse, обновление гта 5 рп, как заработать, как заработать деньги, обнова, достижение, обнова в гта 5 рп, зимний пропуск, новый зимний пропуск, новогоднее обновление, подарки для всех, подарки для всех подряд, это безумие",29,https://i.ytimg.com/vi/EYc4BFEPs0g/hqdefault.jpg,ru,ru,False,3104,PT51M44S,hd,False,True,False,False,242685,33872,722
RyJznDLAmAw,RU,2026-02-01T03:38:44.219371+00:00,2026-01-31T15:00:50Z,Старые МАЙНКРАФТ ЮТУБЕРЫ - ЧТО С НИМИ СТАЛО? | Реакция,Старые МАЙНКРАФТ ЮТУБЕРЫ - ЧТО С НИМИ СТАЛО? | Реакция,Майни,UC4HCh2xl_d5MNNbcPe6hrfg,24,Entertainment,,0,https://i.ytimg.com/vi/RyJznDLAmAw/hqdefault.jpg,ru,ru,False,1199,PT19M59S,hd,False,True,False,False,44419,3968,252
