video_id,country,fetched_at,published_at,title,localized_title,channel_title,channel_id,category_id,category_name,tags,tag_count,thumbnail,default_language,audio_language,is_live,duration,duration_raw,definition,caption_available,licensed_content,embeddable,made_for_kids,views,likes,comments
OSUHqAvuSRI,RU,2026-02-01T03:38:44.218948+00:00,2026-01-31T15:00:00Z,"Lee Know ""奏（かなで）(Kanade)"" Cover (원곡 : スキマスイッチ(Sukimaswitch)) | [Stray Kids : SKZ-RECORD]","Lee Know ""奏（かなで）(Kanade)"" Cover (원곡 : スキマスイッチ(Sukimaswitch)) | [Stray Kids : SKZ-RECORD]",Stray Kids,UC9rMiEjNaCSsebs31MRDCRA,10,Music,"Stray Kids, 스트레이 키즈, SKZ, 방찬, BANG CHAN, 리노, 이민호, LEE KNOW, LEEMINHO, 창빈, 서창빈, CHANGBIN, SEOCHANGBIN, 현진, 황현진, HYUNJIN, HWANGHYUNJIN, 한, 한지성, HAN, JISUNG, HANJISUNG, 필릭스, FELIX, 승민, 김승민, SEUNGMIN, KIMSEUNGMIN, 아이엔, I.N, JEONGIN, SKZ RECORD, 스키즈 커버, 스트레이키즈 커버, 슼즈레코드 리노, 리노 슼레, 리노 보컬, lee know vocal, 리노 노래, 스키즈 리노 슼즈레코드, lee know SKZ RECORD, 리노 kanade, lee know kanade, 리노 커버, 리노 Sukimaswitch, Sukimaswitch kanade, lee know Sukimaswitch cover, 리노 Sukimaswitch 커버, 리노 카나데, 리노 카나데 커버, 리노 스키마스위치",51,https://i.ytimg.com/vi/OSUHqAvuSRI/hqdefault.jpg,en,ko,False,254,PT4M14S,hd,False,True,False,False,564863,177631,14702
SwiicXy7H5I,RU,2026-02-01T03:38:44.218986+00:00,2026-01-31T14:32:05Z,10 Новых фильмов 2026 (Трейлеры),10 Новых фильмов 2026 (Трейлеры),HypeFilms,UCuFKgy1b8H0MG-uz47-4GUg,1,Film & Animation,,0,https://i.ytimg.com/vi/SwiicXy7H5I/hqdefault.jpg,ru,ru,False,1017,PT16M57S,hd,False,False,False,False,12989,176,9
-V5RUPp7wK0,RU,2026-02-01T03:38:44.218999+00:00,2026-01-31T08:00:00Z,"😱 Майнкрафт, но Мы Прокачали Супер ГЛАЗА [Полное Прохождение] + Фиксплей","😱 Майнкрафт, но Мы Прокачали Супер ГЛАЗА [Полное Прохождение] + Фиксплей",MrLololoshka (Роман Фильченков),UCAvrIl6ltV8MdJo3mV4Nl4Q,20,Gaming,"Лололошка, Lololoshka, MrLololoshka, Летсплей, Сборка, Скачать, Магия, Моды, Майнкрафт, Minecraft",10,https://i.ytimg.com/vi/-V5RUPp7wK0/hqdefault.jpg,ru,ru,False,1877,PT31M17S,hd,False,True,False,False,601968,41172,2274
Y6ueULEmxEM,RU,2026-02-01T03:38:44.219008+00:00,2026-01-31T20:22:46Z,"Ksenon, JackLooney — #ВПРАЙМЕ (DISS Дипинс, Mafanya, Анар, Хованский, BOOKER, mzlff)","Ksenon, JackLooney — #ВПРАЙМЕ (DISS Дипинс, Mafanya, Анар, Хованский, BOOKER, mzlff)",Ksenon,UC_KgeNSqXSCpoc61py7dQUw,22,People & Blogs,"Ксенон, Ksenon, Ксенон тикток, TikTok, Tik Tok, популярные песни тикток, С какой стати, Бабка, Я хочу беляш, Беляш, Популярная музыка, Подборки TikTok, 2Д, 3Д",14,https://i.ytimg.com/vi/Y6ueULEmxEM/hqdefault.jpg,ru,ru,False,297,PT4M57S,hd,False,True,False,False,7495,1091,147
MW5LpX0Cuis,RU,2026-02-01T03:38:44.219017+00:00,2026-01-31T13:18:30Z,КОНЕЦ КАРЬЕРЫ ЗА 5 СЕКУНД,КОНЕЦ КАРЬЕРЫ ЗА 5 СЕКУНД,DeadP47,UCUzkWdUCkVrkKCcmut9epTQ,20,Gaming,"deadp47, худшие стримеры, deadp47 худшие стримеры, deadp47 разоблачение, Lacari, Lacari Files, файлы лакари, лакари, стример, скандал",10,https://i.ytimg.com/vi/MW5LpX0Cuis/hqdefault.jpg,ru,ru,False,852,PT14M12S,hd,False,True,False,False,282561,19403,1700
yPx_YYskXis,RU,2026-02-01T03:38:44.219026+00:00,2026-01-26T13:00:06Z,Ozzem - Midnight (Original Mix),Ozzem - Midnight (Original Mix),Ozzem Music,UCa-iYYcAijci6hO4VVKo8VQ,22,People & Blogs,"ozzem, ozzemmusic, carmusic, carbassmusic, techno, technohouse, technomusic, deephouse, bestmusic, gangstermusic, hypertechno, bass, housemusic, topmusic, originalmix",15,https://i.ytimg.com/vi/yPx_YYskXis/hqdefault.jpg,ru,ru,False,370,PT6M10S,hd,False,True,False,False,85690,603,56
I7hhnrM1WT8,RU,2026-02-01T03:38:44.219034+00:00,2026-01-31T12:00:29Z,САМЫЙ ГЛАВНЫЙ ПОЛИЦЕЙСКИЙ ► RoboCop: Rogue City #1,САМЫЙ ГЛАВНЫЙ ПОЛИЦЕЙСКИЙ ► RoboCop: Rogue City #1,Kuplinov ► Play,UCdKuE7a2QZeHPhDntXVZ91w,20,Gaming,"RoboCop Rogue City, RoboCop Rogue City game, RoboCop Rogue City игра, RoboCop Rogue City прохождение, RoboCop Rogue City прохождение на русском, RoboCop Rogue City walkthrough, RoboCop Rogue City let's play, RoboCop Rogue City летс плей, RoboCop Rogue City геймплей, RoboCop Rogue City gameplay, Kuplinov Play, Куплинов плей, Куплинов, Kuplinov",14,https://i.ytimg.com/vi/I7hhnrM1WT8/hqdefault.jpg,ru,ru,False,2663,PT44M23S,hd,False,True,False,False,178255,12596,593
m9otTD7hb5k,RU,2026-02-01T03:38:44.219042+00:00,2026-01-31T12:00:08Z,Jigit x Aftok- Магия,Jigit x Aftok- Магия,Aftok,UCs_gF5AKXDx-hNldU4_f8Qw,10,Music,"музыка, лучшие песни, классная музыка, музыка в машину, хиты, зарубежные песни хиты, слушать песни, лучшая музыка, современные песни, русская музыка, новинки музыки 2022, слушать музыку, хиты 2022, самые популярные песни, зарубежные европа плюс, кыргызча ырлар эски, мажит бермет жаны клип, кыялбаймын, кыргызча ырлар 2020, avtoradio, концерт авторадио, мморпгсу, топ шазам музыка, шазам 2020, tiktok, instogram, music, label, хит, хитмари, хитяры, tiktokхит, youtobeхит",33,https://i.ytimg.com/vi/m9otTD7hb5k/hqdefault.jpg,ru,ky,False,181,PT3M1S,hd,False,True,False,False,22651,1142,172
90lzlq8AEX0,RU,2026-02-01T03:38:44.219051+00:00,2026-01-31T17:00:01Z,"Survive 99 Nights, Win $99,000","Survive 99 Nights, Win $99,000",MrBeast Gaming,UCIPPMRA040LQr5QPyJEbmXA,20,Gaming,,0,https://i.ytimg.com/vi/90lzlq8AEX0/hqdefault.jpg,en,en,False,1317,PT21M57S,hd,True,True,False,False,3130620,108640,8093
AHIJpBp25s4,RU,2026-02-01T03:38:44.219059+00:00,2026-01-07T10:02:56Z,Bilmez Idim Dert Verer,Bilmez Idim Dert Verer,Nilam Ninggsi - Topic,UCO1Jju2WGjh70XHuL9n51Yg,10,Music,"Nilam Ninggsi, Bilmez Idim Dert Verer",2,https://i.ytimg.com/vi/AHIJpBp25s4/hqdefault.jpg,tr,th,False,239,PT3M59S,hd,False,True,False,False,150383,1681,0
IHVYiAr-dKc,RU,2026-02-01T03:38:44.219066+00:00,2026-01-31T12:00:27Z,ЕСЛИ ТЫ НАШЁЛ ЭТОТ ДИНАМИТ ТО БЕГИ И ВЫЗЫВАЙ ПОЛИЦИЮ В МАЙНКРАФТ | Компот Minecraft,ЕСЛИ ТЫ НАШЁЛ ЭТОТ ДИНАМИТ ТО БЕГИ И ВЫЗЫВАЙ ПОЛИЦИЮ В МАЙНКРАФТ | Компот Minecraft,Компот,UC0cWWruNMb95iCBEOzPnjRA,20,Gaming,"компот, майнкрафт, compot, minecraft, компот в майнкрафте, игры, роман компот, майн, если ты нашёл этот динамит то беги и вызывай полицию в майнкрафт, если, нашёл, находка, находка в майнкрафт, динамит, динамит в майнкрафт, беги, вызывай полицию в майнкрафт, вызывай полицию, полиция, полиция в майнкрафт, беги в майнкрафт, новый динамит в майнкрафт, красный, красный в майнкрафт, красный динамит в майнкрафт, самый опасный динамит в майнкрафт, беги и вызывай полицию в майнкрафт",27,https://i.ytimg.com/vi/IHVYiAr-dKc/hqdefault.jpg,ru,ru,False,681,PT11M21S,hd,False,True,False,False,253533,11687,1197
T2K86kcpoio,RU,2026-02-01T03:38:44.219074+00:00,2026-01-31T13:00:06Z,Muxlisbek Qurbonov - O'zimdan Ortolmayapman (Hech O’zimdan Ortolmayapman) Official Audio Music 2026,Muxlisbek Qurbonov - O'zimdan Ortolmayapman (Hech O’zimdan Ortolmayapman) Official Audio Music 2026,Muxlisbek Qurbonov,UCxwhTIzr7EjzOnyjmQXaUrQ,10,Music,,0,https://i.ytimg.com/vi/T2K86kcpoio/hqdefault.jpg,uz,und,False,230,PT3M50S,hd,False,True,False,False,17856,784,116
OYKlIKm39a8,RU,2026-02-01T03:38:44.219081+00:00,2026-01-31T22:03:15Z,IEM Krakow 2026 - Day 4 - Stream A,IEM Krakow 2026 - Day 4 - Stream A,ESL Counter-Strike,UCPq2ETz4aAGo2Z-8JisDPIA,20,Gaming,"ESL, Counter-Strike, ESL CS, ESLCS, ESL CSGO, ESL Counter-Strike, IEM, IEM CS, IEM CSGO, CSGO, esportsisawesomesauce",11,https://i.ytimg.com/vi/OYKlIKm39a8/hqdefault.jpg,la,en,False,32785,PT9H6M25S,hd,False,True,False,False,1494931,13182,45
8LeWmeJVJB8,RU,2026-02-01T03:38:44.219089+00:00,2026-01-31T11:00:06Z,Mash Israelyan - Lusnyak Gisherov,Mash Israelyan - Lusnyak Gisherov,Mash Israelyan,UCWQp_08ZfU1CM71Q-SAU86A,10,Music,"Mash, Mash Israelyan, Lusnyak Gisher, gisher, Ernest Ogannesyan",5,https://i.ytimg.com/vi/8LeWmeJVJB8/hqdefault.jpg,en,hy,False,207,PT3M27S,hd,False,True,False,False,42342,1742,66
EL4AUfhdt1o,RU,2026-02-01T03:38:44.219096+00:00,2026-01-31T20:59:11Z,😱НОВЫЕ КЕЙСЫ СО СКИНАМИ + ТУРНИР СНАЙПЕРОВ,😱НОВЫЕ КЕЙСЫ СО СКИНАМИ + ТУРНИР СНАЙПЕРОВ,EdisonPts,UCrpt82vHWIWZSHtNQxncPrg,20,Gaming,"эдисон, эд, едисон, эдисон стрим",4,https://i.ytimg.com/vi/EL4AUfhdt1o/hqdefault.jpg,ru,ru,False,21232,PT5H53M52S,hd,False,True,False,False,213705,9130,49
1zxe8yJhQ4g,RU,2026-02-01T03:38:44.219104+00:00,2026-01-30T11:00:07Z,Клава Кока - Тысячи зим (Клип 2026),Клава Кока - Тысячи зим (Клип 2026),Клава Кока,UCbj1rZy7-qktxZTawl1S_nA,10,Music,"Mood, Депрессаунд, Сорвалась, Трек 2024, байкал, замуж клава кока, зима, караоке, клава кока, клава кока замуж, клава кока интервью, клава кока клип, клава кока краш, клава кока не со мной, клава кока новая песня, клава кока песни, клава кока покинула чат, клава кока пьян",18,https://i.ytimg.com/vi/1zxe8yJhQ4g/hqdefault.jpg,ru,ru,False,165,PT2M45S,hd,False,True,False,False,90212,7494,808
1drgVy2FIwE,RU,2026-02-01T03:38:44.219112+00:00,2026-01-31T14:08:54Z,СПРАЙТ ЗАТОПИЛ ВЕСЬ МИР! 😱 МАЙНКРАФТ,СПРАЙТ ЗАТОПИЛ ВЕСЬ МИР! 😱 МАЙНКРАФТ,ВЛАДУС,UCPG6OP7eL7kLuyFpQMdqYSA,20,Gaming,"Владус, Vladus, майнкрафт, minecraft, фанта майнкрафт, поднимается жидкость майнкрафт, спрайт заливает майнкрафт, спрайт поднимается каждую секунду, мы тонем в майнкрафт, затопление майнкрафт, выживание майнкрафт, лава челлендж майнкрафт, поднимается уровень майнкрафт, майнкрафт испытание, сложное выживание майнкрафт, майнкрафт приколы, смешной майнкрафт, детский майнкрафт, майнкрафт челлендж, владус майнкрафт, леня майнкрафт, владус и леня, майнкрафт катастрофа",23,https://i.ytimg.com/vi/1drgVy2FIwE/hqdefault.jpg,ru,ru,False,984,PT16M24S,hd,False,True,False,False,214676,6233,1029
mUPsToJLYaM,RU,2026-02-01T03:38:44.219120+00:00,2026-01-30T01:04:57Z,Малиновое небо 2026,Малиновое небо 2026,Флит - Topic,UC42qze4dmzxWd5rzDWA55hQ,10,Music,"Флит, Малиновое небо 2026",2,https://i.ytimg.com/vi/mUPsToJLYaM/hqdefault.jpg,ru,ru,False,187,PT3M7S,hd,False,True,False,False,57819,628,0
1RYAFnewhnQ,RU,2026-02-01T03:38:44.219127+00:00,2026-01-31T07:00:01Z,Я СБЕЖАЛ ИЗ САМОЙ ЖЕСТОКОЙ ТЮРЬМЫ В МИРЕ!,Я СБЕЖАЛ ИЗ САМОЙ ЖЕСТОКОЙ ТЮРЬМЫ В МИРЕ!,Бурёночек🛑,UCngdQ02MhqK9Ke8Uon5qOug,20,Gaming,"буренок, 100 дней, хардкор, майнкрафт хардкор, тюрьма, тюрьма дельфин, буреночек побег, буреночек, 100 дней хардкор, майнкрафт 100 дней, буреночек дельфин, дельфин",12,https://i.ytimg.com/vi/1RYAFnewhnQ/hqdefault.jpg,ru,ru,False,1096,PT18M16S,hd,False,True,False,False,178782,9374,610
jGUchGhaUH8,RU,2026-02-01T03:38:44.219135+00:00,2026-01-30T12:24:08Z,"Дима Билан и Sasha Komovich - Границы ( Премьера клипа, 2026) ","Дима Билан и Sasha Komovich - Границы ( Премьера клипа, 2026) ",bilanofficial,UCrnxeDn1Biodm9jO8yAyj3g,10,Music,"Билан, Дима Билан, Снегурочка, Саша Комович, искуственный интеллект, Ии, Премьера, Музыка, Новая музыка, Русская музыка, Генерация",11,https://i.ytimg.com/vi/jGUchGhaUH8/hqdefault.jpg,ru,ru,False,182,PT3M2S,hd,False,False,False,False,52338,2786,405
PrS9Z8ljvho,RU,2026-02-01T03:38:44.219146+00:00,2026-01-31T13:35:00Z,ТАЙМЕР - Страшилки МАЙНКРАФТ,ТАЙМЕР - Страшилки МАЙНКРАФТ,Линч,UC6OBB76NFySo4Wkdgu6gV9A,20,Gaming,"майнкрафт, страшилки майнкрафт, таймер, таймер майнкрафт, страшилка таймер, психологический хоррор, егор линч, линч",8,https://i.ytimg.com/vi/PrS9Z8ljvho/hqdefault.jpg,ru,en-US,False,1454,PT24M14S,hd,False,True,False,False,99974,15431,1535
qoXqzBMlaQs,RU,2026-02-01T03:38:44.219154+00:00,2026-01-30T09:00:04Z,Ани Лорак — Одинокая (Премьера клипа 2026),Ани Лорак — Одинокая (Премьера клипа 2026),Ани Лорак,UCHODSaT4dkvm7NGTGki6dbA,10,Music,"Ани Лорак, Ani Lorak, Лорак, Шоу Diva, уходи по английски, Ани Лорак песни",6,https://i.ytimg.com/vi/qoXqzBMlaQs/hqdefault.jpg,ru,ru,False,220,PT3M40S,hd,False,False,False,False,534214,10271,470
LpyE2dM2NMY,RU,2026-02-01T03:38:44.219162+00:00,2026-01-31T12:10:16Z,Конец ИГР..,Конец ИГР..,PozziBlox,UCYBAP9Z8Rsp1f-6yzVkz11g,20,Gaming,,0,https://i.ytimg.com/vi/LpyE2dM2NMY/hqdefault.jpg,ru,ru,False,1247,PT20M47S,hd,False,True,False,False,145258,8692,561
-J4I-pWuUhw,RU,2026-02-01T03:38:44.219168+00:00,2026-01-27T20:08:16Z,ПОДАРИ МНЕ ЛЮБОВЬ,ПОДАРИ МНЕ ЛЮБОВЬ,Гравитация - Topic,UCh44_c-RazbDNuIWtN0LAfQ,10,Music,"Гравитация, ПОДАРИ МНЕ ЛЮБОВЬ",2,https://i.ytimg.com/vi/-J4I-pWuUhw/hqdefault.jpg,ru,ru,False,185,PT3M5S,hd,False,True,False,False,25972,309,0
G3KZsMtEdqY,RU,2026-02-01T03:38:44.219175+00:00,2026-01-31T11:00:13Z,ХАРДКОД 99 НОЧЕЙ - ОЧЕНЬ СТРАННЫЕ ДЕЛА 💔 Роблокс с подписчиками,ХАРДКОД 99 НОЧЕЙ - ОЧЕНЬ СТРАННЫЕ ДЕЛА 💔 Роблокс с подписчиками,Милс PLAY,UCBIfuwYslGljdRGWSELdaUw,24,Entertainment,"роблокс, roblox, робуксы, 99 ночей, 100 дней, в лесу, челлендж, выжили, выживи, в роблокс, милс кел, милс",12,https://i.ytimg.com/vi/G3KZsMtEdqY/hqdefault.jpg,ru,ru,False,1545,PT25M45S,hd,False,True,False,False,165679,7125,951
Ae2jKP1vcm8,RU,2026-02-01T03:38:44.219183+00:00,2026-01-30T14:00:06Z,DIANA HARUTYUNYAN - AMENALAV HARSANIQE //OFFICIAL MUSIC VIDEO 2026//,DIANA HARUTYUNYAN - AMENALAV HARSANIQE //OFFICIAL MUSIC VIDEO 2026//,Diana Harutyunyan,UCrYILuKSpteokgLvt1Q-PSQ,10,Music,"diana harutyunyan, diana, harsaniq, amenalav harsaniq, harsanekan erg, harsi erg, nor erg, urax erg, shaxov shuxov, diana urax, diana harsaniq, diana hars, amusnanal, mam jan, haykakan, sharan, popuri, urax erger, haykakan erger, hayastan, erevan, dianna, diana urax erg, vay aman, in, vay amsn",26,https://i.ytimg.com/vi/Ae2jKP1vcm8/hqdefault.jpg,hy,hy,False,204,PT3M24S,hd,False,True,False,False,95900,2886,140
IHu7pqPBaf0,RU,2026-02-01T03:38:44.219190+00:00,2026-01-31T11:06:07Z,Бандиты Наехали НЕ НА ТЕХ ОХРАННИКОВ | Майнкрафт триллер,Бандиты Наехали НЕ НА ТЕХ ОХРАННИКОВ | Майнкрафт триллер,Nuckem,UCpeDVZnl7wn-qGix1fe4SNQ,20,Gaming,"Нюкем, Nuckem, Отец, Одиночка, отец-одиночка, усыновил, приёмный, детдом, троллинг, ОтецОДИНОЧКА, питбайк, мотоцикл, байк, майнкрафт, minecraft, поезд, железная дорога, жд",18,https://i.ytimg.com/vi/IHu7pqPBaf0/hqdefault.jpg,ru,ru,False,1589,PT26M29S,hd,False,True,False,False,102142,6217,494
deNiXkABUlk,RU,2026-02-01T03:38:44.219198+00:00,2026-01-31T14:14:17Z,😰 СПАС САМОГО РЕДКОГО БРЕЙНРОТА От ЦУНАМИ в РОБЛОКС! + Фиксплей!,😰 СПАС САМОГО РЕДКОГО БРЕЙНРОТА От ЦУНАМИ в РОБЛОКС! + Фиксплей!, Кабан - Роблокс,UCZs7yB-wT0REBrEtT6nHS1A,20,Gaming,"Кабан, Кабан роблокс, Кабан майнкрафт, роблокс, roblox, roblox fun, роблокс смешные видео, роблокс троллинг, челлендж, челлендж роблокс, фиксплей, fixplay, FixPlay, Фикслпей роблокс, FixPlay роблокс, +Фиксплей, фиксплей роблокс, Фиксплей!, рнг кабан, брейнрот, цунами брейнрот, 😰 СПАС САМОГО РЕДКОГО БРЕЙНРОТА От ЦУНАМИ в РОБЛОКС! +Фиксплей!",22,https://i.ytimg.com/vi/deNiXkABUlk/hqdefault.jpg,ru,zxx,False,2425,PT40M25S,hd,False,True,False,False,69241,2960,468
9MhoxoRC_U4,RU,2026-02-01T03:38:44.219207+00:00,2026-01-31T12:41:53Z,😱 1000 ДНЕЙ СТРОИЛИ КОРЕНЬ ДО НЕБА В 99 НОЧЕЙ В ЛЕСУ В РОБЛОКС!,😱 1000 ДНЕЙ СТРОИЛИ КОРЕНЬ ДО НЕБА В 99 НОЧЕЙ В ЛЕСУ В РОБЛОКС!,GADOSTI,UCS6P_uMrthRW5LYR9yahNnQ,20,Gaming,,0,https://i.ytimg.com/vi/9MhoxoRC_U4/hqdefault.jpg,ru,zxx,False,2495,PT41M35S,hd,False,True,False,False,167871,7727,2632
HiYkCK5KxGU,RU,2026-02-01T03:38:44.219214+00:00,2026-01-31T15:30:54Z,НОНРП ЛИДЕР ЗАДЕРЖАЛ АДМИНА И БЫЛ НАКАЗАН В ГТА 5 РП,НОНРП ЛИДЕР ЗАДЕРЖАЛ АДМИНА И БЫЛ НАКАЗАН В ГТА 5 РП,Olegha77,UCX1zqGrMKyAXrHSCq4-YJug,20,Gaming,"самп, samp, гта, GTA 5 RP, ГТА 5 РП, gta rp, gta 5 mods, gta 5 roleplay, АДМИН БУДНИ, АДМИН БУДНИ В ГТА 5 РП, филант, filant, ЧИТЕРЫ РАЗНОСЯТ, ЧИТЕРЫ В GTA 5 RP, ЧИТЕРЫ В ГТА 5 РП, ЗАБАНИЛ В GTA 5 RP, ЗАБАНИЛ В ГТА 5 РП, СИЛЬНОГО ЧИТЕРА В GTA 5 RP, СИЛЬНОГО ЧИТЕРА В GTA 5 RP ГТА 5 РП, СЕРВЕР В ГТА 5 РП, СЕРВЕР В GTA 5 RP, СЛЕЖУ ЗА СЕРВЕРОМ, АДМИНЮ В GTA 5 RP, аризона самп, аризона рп самп, гта самп, ЗАБАНИЛ ЧЕСТНОГО ИГРОКА, забанил за читы, девушка влюбилась в админа",29,https://i.ytimg.com/vi/HiYkCK5KxGU/hqdefault.jpg,ru,ru,False,1704,PT28M24S,hd,False,False,False,False,50261,3554,462
lpnyVwfz7WM,RU,2026-02-01T03:38:44.219222+00:00,2026-01-31T12:06:07Z,Срочно! Оформляем предзаказы на Resident Evil Requiem,Срочно! Оформляем предзаказы на Resident Evil Requiem,IXBT Games,UC4e_XPBiiIO4fo4_CucxQeg,20,Gaming,"ixbt, ixbt games, иксбити, шчие, ихбт, подкаст, подкаст про игры, Resident Evil 9, Capcom, серия Resident Evil, Resident Evil 5, Resident Evil 6, Operation Raccoon City, Revelations 2, Umbrella Corps, RE 7 Biohazard, Resident Evil 2 Remake, RE Resistance, RE Village, RE Re: Verse, RE 4 Remake, RE Survival Unit, Pragmata, Onimusha: Way of the Sword, Леон, Грейс, игра 2026, во что поиграть, игра года, лучшая игра, resident evil requiem, история Resident evil",32,https://i.ytimg.com/vi/lpnyVwfz7WM/hqdefault.jpg,ru,ru,False,1947,PT32M27S,hd,False,True,False,False,69168,4732,849
fevzFp2ssTA,RU,2026-02-01T03:38:44.219229+00:00,2026-01-31T08:00:51Z,😱СПАСЛИ ГУБКУ БОБА в 99 НОЧЕЙ ВЫЖИВАНИЯ В БИКИНИ БОТТОМ! ХОРРОР СПАНЧ БОБ В РОБЛОКС! ФИНАЛ,😱СПАСЛИ ГУБКУ БОБА в 99 НОЧЕЙ ВЫЖИВАНИЯ В БИКИНИ БОТТОМ! ХОРРОР СПАНЧ БОБ В РОБЛОКС! ФИНАЛ,FixEye - Роблокс,UCwkDYwR6NT9KhQJA0ZQ9jBw,20,Gaming,"фиксай, fixeye, roblox, роблокс, 99 ночей, 99 дней, 99 ночей в бикини боттом, 99 ночей губка боб, 99 ночей спанч боб, 99 ночей спасения губки боба, 99 ночей в роблокс, 99 ночей бикини боттом роблокс, спасли спанч боба",13,https://i.ytimg.com/vi/fevzFp2ssTA/hqdefault.jpg,ru,ru,False,1324,PT22M4S,hd,False,True,False,False,184603,5933,770
zmvKvramSuA,RU,2026-02-01T03:38:44.219237+00:00,2026-01-30T17:33:54Z,Разрушительные прятки ( Teardown ),Разрушительные прятки ( Teardown ),JOHAN,UCuQsXgtPrppIkSE7GWjp7HA,23,Comedy,"JOHAN, johan, джохан, жохан, йохан, джохан и мармок, ехан, ёхан, приколы в играх, фейлы и баги в играх, джохан канал, пабг pubg кс го, cs go, баги, приколы, фейлы, мармок пати, marmok squad, смешные моменты, кс 2, cs 2, Teardown, тирдаун",23,https://i.ytimg.com/vi/zmvKvramSuA/hqdefault.jpg,ru,ru,False,1091,PT18M11S,hd,False,True,False,False,339915,32436,579
Fxwp3c7lfLY,RU,2026-02-01T03:38:44.219248+00:00,2026-01-31T19:14:34Z,Spirit vs Astralis - ЛУЧШИЕ МОМЕНТЫ - IEM Kraków 2026,Spirit vs Astralis - ЛУЧШИЕ МОМЕНТЫ - IEM Kraków 2026,CS2 Highlights by Okko,UCUG-3Ts3ssKVkZAMG1tAWfw,20,Gaming,"Ace, CS Highlights, CS Live, CS Live Stream, CS2, CS2 Live, Clutch, Counter-Strike, Counter-Strike: Global Offensive, Deagle Ace, ESL, Flickshot, Headshot, IEM, IEM Kraków 2026, NiKo, No Scope, Smoke Kill, Stage 2, Wallbang, best moments, competitive, cs, donk, esport, esports, gaming, highlights, iem, m0nesy, pro, s1mple, есл, ием, интел мастерс, киберспорт, кс, кс2, ксго, лучшие моменты, окко, хайлайты",42,https://i.ytimg.com/vi/Fxwp3c7lfLY/hqdefault.jpg,ru,ru,False,2414,PT40M14S,hd,False,False,False,False,34941,471,90
uO5aeUgHEro,RU,2026-02-01T03:38:44.219257+00:00,2026-01-31T14:44:58Z,100 часов боли в My Winter Car,100 часов боли в My Winter Car,Ралекс ,UCWaXzPn5Z134rGMCmngcVpA,20,Gaming,"my winter car, май винтер кар, май самер кар, винтер кар, winter car, зимняя машина, летняя машина, 100 часов в май винтер кар, 100 дней в май винтер кар, my summer car",10,https://i.ytimg.com/vi/uO5aeUgHEro/hqdefault.jpg,ru,ru,False,1802,PT30M2S,hd,False,True,False,False,44722,2409,131
_ZdpZsWujPs,RU,2026-02-01T03:38:44.219264+00:00,2026-01-31T18:47:33Z,Создаю ХОРРОР ИГРУ с МЕМАМИ (#4),Создаю ХОРРОР ИГРУ с МЕМАМИ (#4),maxter,UCmjNGJn0WNPJS_G52UfkH-g,20,Gaming,"разработка игр, хоррор, хоррор игры, девлог, devlog, indie game devlog, геймдев, мудрое дерево, программирование, геймдизайн, memes, gamedev, unity, blender, игры, как создать игру, во что поиграть, своя игра, maxter, макстер, проклятие мудрого дерева, как сделать игру, мемы, создание игры на unity, геймдизайнер, игры на пк, топ игр для слабых пк, the curse of the wise tree, хоррор с мемами, Создаю ХОРРОР ИГРУ с МЕМАМИ, хоррор юнити, бреинрот, 67, мемное королевство, тайна мемного королевства",35,https://i.ytimg.com/vi/_ZdpZsWujPs/hqdefault.jpg,ru,ru,False,805,PT13M25S,hd,False,True,False,False,39598,7533,1038
