video_id,country,fetched_at,published_at,title,localized_title,channel_title,channel_id,category_id,category_name,tags,tag_count,thumbnail,default_language,audio_language,is_live,duration,duration_raw,definition,caption_available,licensed_content,embeddable,made_for_kids,views,likes,comments
yhI01bcbPZU,GH,2026-04-15T03:48:22.497569+00:00,2026-04-06T07:30:06Z,"TRIBUTE TO YAWSARPONG, MAAME TIWAA (ASOMAFO)| Simon Kumangye ft Odehyieba Priscilla (EPISODE 2)","TRIBUTE TO YAWSARPONG, MAAME TIWAA (ASOMAFO)| Simon Kumangye ft Odehyieba Priscilla (EPISODE 2)",Simon Kumangye,UCG52GRFnS2I2g7YUWKR3f2w,10,Music,,0,https://i.ytimg.com/vi/yhI01bcbPZU/hqdefault.jpg,en,ak,False,585,PT9M45S,hd,False,False,False,False,178323,10547,1255
FKSdXH89jbo,GH,2026-04-15T03:48:22.497602+00:00,2026-04-09T15:05:06Z,Mutiny (2026) Official Trailer - Jason Statham,Mutiny (2026) Official Trailer - Jason Statham,Lionsgate Movies,UCJ6nMHaJPZvsJ-HmUmj1SeA,1,Film & Animation,"Jason Statham, action thriller, Lionsgate trailer, 2026 movies, new movie trailer, revenge thriller, conspiracy thriller, intense action scenes, special forces hero, crime action movie, thriller movie trailer, explosive trailer, gritty action film, Annabelle Wallis, Jean-Francois Richet, suspenseful trailer, crime thriller 2026, adrenaline action, undercover secrets, new Statham movie, action fans, cinematic trailer, LG, lionsgate, trailer, official trailer",26,https://i.ytimg.com/vi/FKSdXH89jbo/hqdefault.jpg,en,en,False,136,PT2M16S,hd,True,True,False,False,8039258,53651,5738
r2xsnlagsc4,GH,2026-04-15T03:48:22.497615+00:00,2026-04-14T21:54:56Z,Atletico De Madrid vs Barcelona | Champions League 2026 | PES 21 Simulation Gameplay,Atletico De Madrid vs Barcelona | Champions League 2026 | PES 21 Simulation Gameplay,Football Gamer Rony,UCaopyJz-EIXOXYXSMOC6c-g,20,Gaming,"barca vs atletico madrid, barcelona vs atletico madrid, atletico madrid vs barcelona, barcelona atletico madrid, barcelona vs atletico madrid live, barcelona hoy, barcelona ao vivo, barca atletico madrid, football live, barcelona live match today, bein sport live, barcelona, fc barcelona vs atletico madrid, live football, barca vs atletico madrid live, مباراة برشلونة اليوم بث مباشر الان bein, atletico barcelona, football, bein sport, live barca vs atletico madrid",20,https://i.ytimg.com/vi/r2xsnlagsc4/hqdefault.jpg,en,en,False,908,PT15M8S,hd,False,True,False,False,404486,1469,2
X6gMCdWDw2g,GH,2026-04-15T03:48:22.497625+00:00,2026-04-13T00:17:49Z,Shatta Wale - Genesis 2 Revelation (AI Visualizer),Shatta Wale - Genesis 2 Revelation (AI Visualizer),Shatta Wale,UCb5XPdFG5KC05hy4mv0zi_A,10,Music,"Ghana Music, Dancehall, Reggae, Shatta Wale, afrobeats, hip hop, Bandana, Dancehall King",8,https://i.ytimg.com/vi/X6gMCdWDw2g/hqdefault.jpg,en,en,False,130,PT2M10S,sd,False,True,False,False,35938,5122,717
Uw7Y6MRORh8,GH,2026-04-15T03:48:22.497634+00:00,2026-04-13T21:38:13Z,THE GENERAL ( OFFICIAL MOVIE TRAILER ) YOUTUBE,THE GENERAL ( OFFICIAL MOVIE TRAILER ) YOUTUBE,Wezzy Empire TV,UCoIhlANld_c72G5ofiY14_Q,1,Film & Animation,"Comedy, Lil Win, Kwadwo Nkansah, Akabenezer, Dr. Likee, Gh Comedy, Skits, Funny, Enjoy, Movies, Kumawood, Ghallywood, ghana Movies, Lol, Laugh, Akrobeto, Nollywood",17,https://i.ytimg.com/vi/Uw7Y6MRORh8/hqdefault.jpg,en,en,False,169,PT2M49S,hd,False,True,False,False,3244,209,13
TEV1srjzI7w,GH,2026-04-15T03:48:22.497643+00:00,2026-04-08T12:30:06Z,eFootball™ CONNECT / Version 5.4.0 Update,eFootball™ CONNECT / Version 5.4.0 Update,eFootball,UCQdSC4folRoUuPC3iiRkfFQ,20,Gaming,,0,https://i.ytimg.com/vi/TEV1srjzI7w/hqdefault.jpg,en,en,False,2305,PT38M25S,hd,True,False,False,False,343626,16434,2248
LILbPeYd_MQ,GH,2026-04-15T03:48:22.497651+00:00,2026-03-27T00:07:53Z,Black Sherif - PopStar (Official Visualizer),Black Sherif - PopStar (Official Visualizer),BlackSherifVEVO,UCbQqL_yZhxMs5x14KIt18eQ,10,Music,"Black Sherif, Blacko Management EMPIRE, African",3,https://i.ytimg.com/vi/LILbPeYd_MQ/hqdefault.jpg,en,en,False,162,PT2M42S,hd,False,True,False,False,1226391,34299,2522
oSeqs_xeqv4,GH,2026-04-15T03:48:22.497659+00:00,2026-04-09T16:00:01Z,A Marvel Television Special Presentation: The Punisher: One Last Kill | Official Trailer,A Marvel Television Special Presentation: The Punisher: One Last Kill | Official Trailer,Marvel Entertainment,UCvC4D8onUfXzvjTOM-dBfEA,24,Entertainment,"marvel, comics",2,https://i.ytimg.com/vi/oSeqs_xeqv4/hqdefault.jpg,en,en,False,102,PT1M42S,hd,True,True,False,False,5256763,189300,7534
wLWT0qj2IE0,GH,2026-04-15T03:48:22.497666+00:00,2026-04-14T22:10:58Z,Barcelona vs Atletico Madrid | Champions League 2026 Simulation | eFootball PES 21 Gameplay,Barcelona vs Atletico Madrid | Champions League 2026 Simulation | eFootball PES 21 Gameplay,Astra League,UCoRjKJq5SE-tBRur2YFaUVg,20,Gaming,"Barcelona vs Atletico Madrid, Atletico Madrid vs Barcelona, Champions League, livefootball2025, Champions League highlights, Atletico Madrid goals, Atletico Madrid live, Atletico Madrid 2025, Atletico Madrid match, Atletico Madrid highlights, Barcelona highlights, football watchalong, efootball livestream, football commentary, football simulation, pes 21 live, Barcelona vs Atletico Madrid match video, football match today, Barcelona vs Atletico Madrid gaming",19,https://i.ytimg.com/vi/wLWT0qj2IE0/hqdefault.jpg,en-IN,en-IN,False,9726,PT2H42M6S,hd,False,True,False,False,147021,596,1
eByubA1X4rI,GH,2026-04-15T03:48:22.497674+00:00,2026-04-05T22:03:51Z,RICCH KID - SAFE TO SAY - [ Official Video ],RICCH KID - SAFE TO SAY - [ Official Video ],RICCH KID,UC-wZ4cPMXhMTMUo2XMogdKw,10,Music,,0,https://i.ytimg.com/vi/eByubA1X4rI/hqdefault.jpg,en,en,False,159,PT2M39S,hd,False,False,False,False,43452,1572,225
AjFk1cY265I,GH,2026-04-15T03:48:22.497682+00:00,2026-04-10T16:29:45Z,Digital Circus Ep 9 Finale [TRAILER],Digital Circus Ep 9 Finale [TRAILER],GLITCH,UCn_FAXem2-e3HQvmK-mOH4g,1,Film & Animation,"glitch, glitch productions, digital circus, the amazing digital circus, murder drones, Pomni, Uzi, Jax, Ragatha, Kinger, Gangle, Zooble, Caine, Bubble, 3D, Animation, 3D Animation, Indie Animation, Gummigoo",19,https://i.ytimg.com/vi/AjFk1cY265I/hqdefault.jpg,en,en,False,70,PT1M10S,hd,True,True,False,False,20476108,1465596,106121
QF5YpZI1wnk,GH,2026-04-15T03:48:22.497690+00:00,2026-04-11T16:00:01Z,I Survived 100 Days in Skyblock,I Survived 100 Days in Skyblock,MrBeast Gaming,UCIPPMRA040LQr5QPyJEbmXA,20,Gaming,,0,https://i.ytimg.com/vi/QF5YpZI1wnk/hqdefault.jpg,en,en,False,1362,PT22M42S,hd,True,True,False,False,31410212,577524,17536
wg_ztFKIGdY,GH,2026-04-15T03:48:22.497697+00:00,2026-04-04T15:17:21Z,Samini X Stonebwoy X Master Garzy- Electric Energy [Official Music Video],Samini X Stonebwoy X Master Garzy- Electric Energy [Official Music Video],Samini,UCdzOIVN-V0JP0DTzsTlIoHQ,10,Music,"Ghana Music, Samini, Hiplife Rain God, Dancehall, Raglife Samini Music, Azonto, Afro Pop, High Grade Family, Kofi Kinaata",9,https://i.ytimg.com/vi/wg_ztFKIGdY/hqdefault.jpg,en,ta,False,185,PT3M5S,hd,False,False,False,False,113016,5671,370
s1-pfiVMKAs,GH,2026-04-15T03:48:22.497704+00:00,2026-03-31T16:00:12Z,Supergirl | Official Trailer,Supergirl | Official Trailer,DC,UCiifkYAs_bq1pt_zbNAzYGg,1,Film & Animation,"2026, Coming Soon, Craig Gillespie, DC, DC Comics, DC Studios, DCU, David Krumholtz, Emily Beecham, Eve Ridley, James Gunn, Jason Momoa, Kara Zor-El, Krypto, Matthias Schoenaerts, Milly Alcock, Supergirl, WB, Warner Bros, Warner Bros Pictures, Warner Brothers, official trailer",22,https://i.ytimg.com/vi/s1-pfiVMKAs/hqdefault.jpg,en,en-US,False,177,PT2M57S,hd,True,False,False,False,16177459,280108,16597
WH4Ve6CJaCM,GH,2026-04-15T03:48:22.497712+00:00,2026-04-14T17:10:13Z,I Played the *NEW* Master League…better than FC Career Mode?,I Played the *NEW* Master League…better than FC Career Mode?,S2G,UChR1Yn7YpVrnP-SbsWtjuBA,20,Gaming,,0,https://i.ytimg.com/vi/WH4Ve6CJaCM/hqdefault.jpg,en-GB,en,False,949,PT15M49S,hd,False,True,False,False,122884,6342,394
162i0chqAcA,GH,2026-04-15T03:48:22.497719+00:00,2026-03-28T08:00:01Z,Reggie - Wish I Had a Girlfriend  ft Lasmid x BeezTrap KOTM (Official Visualizer),Reggie - Wish I Had a Girlfriend  ft Lasmid x BeezTrap KOTM (Official Visualizer),Reggie Osei,UCm_-fkq6UtCiGywR3vHLxgA,10,Music,,0,https://i.ytimg.com/vi/162i0chqAcA/hqdefault.jpg,en,en,False,166,PT2M46S,hd,False,False,False,False,152893,4746,195
pg9ZBrxLPBM,GH,2026-04-15T03:48:22.497726+00:00,2026-04-05T19:00:07Z,KADDARA HAUSA SERIES TRAILER ,KADDARA HAUSA SERIES TRAILER ,ABNUR ENTERTAINMENT,UC6CxpgmZUkTH0NnksC0o_fg,1,Film & Animation,,0,https://i.ytimg.com/vi/pg9ZBrxLPBM/hqdefault.jpg,ha,ha,False,305,PT5M5S,hd,False,True,False,False,242597,9744,662
medvbNir1HY,GH,2026-04-15T03:48:22.497733+00:00,2026-04-13T19:42:06Z,I Found the Next Lamine Yamal...,I Found the Next Lamine Yamal...,MoreS2G,UCw9rjdrpHa7mzNrWVJoaPgw,20,Gaming,,0,https://i.ytimg.com/vi/medvbNir1HY/hqdefault.jpg,en,en-GB,False,1700,PT28M20S,hd,False,True,False,False,313314,17738,1679
H9KDjW3MV4U,GH,2026-04-15T03:48:22.497740+00:00,2026-04-10T17:00:07Z,Number One - Dunsin Oyekan ft @JohnWilds #dunsinoyekan #johnwilds,Number One - Dunsin Oyekan ft @JohnWilds #dunsinoyekan #johnwilds,Dunsin Oyekan,UC9unpsMUkOGDIMraqBfZtYg,29,Nonprofits & Activism,,0,https://i.ytimg.com/vi/H9KDjW3MV4U/hqdefault.jpg,en,und,False,1863,PT31M3S,hd,False,True,False,False,176801,13724,1093
CINFIAohu4U,GH,2026-04-15T03:48:22.497748+00:00,2026-04-13T13:00:04Z,The Hunger Games: Sunrise on the Reaping (2026) Official Trailer – Joseph Zada,The Hunger Games: Sunrise on the Reaping (2026) Official Trailer – Joseph Zada,The Hunger Games,UCjvqqA-Eogozfm244OhUESw,1,Film & Animation,"SOTR, sunrise and the reaping, the hunger games, official trailer, trailer, trailer official, hd, the hunger games sunrise on the reaping, the hunger games sunrise on the reaping trailer, SOTR trailer, 2026 trailer, 2026, joseph zada, the hunger games trailer, the hunger games official trailer",15,https://i.ytimg.com/vi/CINFIAohu4U/hqdefault.jpg,en,en,False,145,PT2M25S,hd,True,True,False,False,2491038,116511,5424
SdiqGKcZQKQ,GH,2026-04-15T03:48:22.497755+00:00,2026-04-14T22:14:06Z,BARCELONA vs ATLETICO MADRID | Champions League 2026 Match Simulation | eFootball PES 21 Gameplay,BARCELONA vs ATLETICO MADRID | Champions League 2026 Match Simulation | eFootball PES 21 Gameplay,Astra Football,UCWMS19xlGSNULdXERktZvAw,20,Gaming,,0,https://i.ytimg.com/vi/SdiqGKcZQKQ/hqdefault.jpg,en-IN,en-IN,False,6370,PT1H46M10S,hd,False,True,False,False,81348,349,0
7gKpREE5Z3w,GH,2026-04-15T03:48:22.497763+00:00,2026-04-10T04:00:06Z,"DJ Khaled, Future, Lil Baby - One of Them (Official Music Video)","DJ Khaled, Future, Lil Baby - One of Them (Official Music Video)",DJKhaledVEVO,UCrFB54bqp8sda4udJyNswlA,10,Music,"DJ Khaled, LilBaby, Baby, Future, new music, new anthem, aalam of god, djkhaled new music, new video, hip hop, Khaled, DJ Khaled aalam of god, dj khaled new album, one of them, lil baby one of them, future one of them, DJ Khaled one of them",17,https://i.ytimg.com/vi/7gKpREE5Z3w/hqdefault.jpg,en,en,False,237,PT3M57S,hd,True,True,False,False,1362744,53876,4042
8BJc-L19h0E,GH,2026-04-15T03:48:22.497770+00:00,2026-04-02T14:00:00Z,Ronaldinho: The One and Only | Official Trailer | Netflix,Ronaldinho: The One and Only | Official Trailer | Netflix,Netflix,UCWOA1ZGywLbqmigxE4Qlvuw,24,Entertainment,"Advocative, Career, Celebrities, Crusading, Documentary, Emotional, Football, Inspiring, Limited Series, Netflix, Ronaldinho, Ronaldinho: The One and Only, Rousing, Soccer, Sports",15,https://i.ytimg.com/vi/8BJc-L19h0E/hqdefault.jpg,en,en-US,False,142,PT2M22S,hd,False,True,False,False,2377166,43643,2985
gdpDLRZx2oI,GH,2026-04-15T03:48:22.497778+00:00,2026-04-14T21:30:12Z,🔴[PES 2021 PC] Atlético Madrid vs Barcelona | GAMEPLAY REALISTA NA UCL COM PLACAR EM TEMPO REAL,🔴[PES 2021 PC] Atlético Madrid vs Barcelona | GAMEPLAY REALISTA NA UCL COM PLACAR EM TEMPO REAL,Gamer BR - M1l Grau,UCNWfVQJcNYlKyR1gMkJQK6w,20,Gaming,,0,https://i.ytimg.com/vi/gdpDLRZx2oI/hqdefault.jpg,pt-PT,en,False,8778,PT2H26M18S,hd,False,True,False,False,61891,138,0
WLRLcDCFre8,GH,2026-04-15T03:48:22.497785+00:00,2026-03-22T18:49:38Z,All Over You,All Over You,Deobi - Topic,UCTTZ0b9EJjBWJHdhq0EZopQ,10,Music,"Deobi, obinna okoro, paul ifeanyi olewe, All Over You",4,https://i.ytimg.com/vi/WLRLcDCFre8/hqdefault.jpg,en,en,False,146,PT2M26S,hd,False,True,False,False,457757,8165,0
P3XK9HSa3bs,GH,2026-04-15T03:48:22.497794+00:00,2026-04-11T15:49:59Z,The Devil's Work | Trailer | Drama | Sparrow Station,The Devil's Work | Trailer | Drama | Sparrow Station,Sparrow Station,UCvMkfNeqojxqu8NMWZLgHtA,24,Entertainment,"Sparrow, Productons, Sparrow Station, Sparrow Pictures, Sparrow Productions, Premium African Entertainment, Shirley Frimpong-Manso, Ghanaian Films, Nollywood Films, African Films, Ghana Films, Film Production, Ken Attoh",13,https://i.ytimg.com/vi/P3XK9HSa3bs/hqdefault.jpg,en,en-GB,False,83,PT1M23S,hd,False,True,False,False,1817,113,15
OHOTXUfVneU,GH,2026-04-15T03:48:22.497807+00:00,2026-04-14T22:11:50Z,ATLETICO DE MADRID vs BARCELONA Live | UEFA Champions League 2026 UCL | Simulation PES 2021 Gameplay,ATLETICO DE MADRID vs BARCELONA Live | UEFA Champions League 2026 UCL | Simulation PES 2021 Gameplay,FERA HD,UC65x1bMXmtHI0-oYQkc56Ew,20,Gaming,,0,https://i.ytimg.com/vi/OHOTXUfVneU/hqdefault.jpg,en,en-US,False,11696,PT3H14M56S,hd,False,True,False,False,92877,254,1
7F1ET2XHQfk,GH,2026-04-15T03:48:22.497814+00:00,2026-04-09T15:59:07Z,"KATSEYE (캣츠아이) ""PINKY UP"" Official MV","KATSEYE (캣츠아이) ""PINKY UP"" Official MV",HYBE LABELS,UC3IZKseVpdzPSBaWxBxundA,10,Music,"HYBE, HYBE LABELS, 하이브, 하이브레이블즈",4,https://i.ytimg.com/vi/7F1ET2XHQfk/hqdefault.jpg,ko,ko,False,182,PT3M2S,hd,True,False,False,False,15995437,773328,137639
aBlsrtxuwss,GH,2026-04-15T03:48:22.497822+00:00,2026-03-18T11:17:52Z,Spider-Man: Brand New Day - Official Trailer,Spider-Man: Brand New Day - Official Trailer,PlayStation,UC-2Y8dQb0S6DtpxNgAKoJKA,20,Gaming,"PlayStation, PS5, video games, next gen, Sony",5,https://i.ytimg.com/vi/aBlsrtxuwss/hqdefault.jpg,en,en,False,158,PT2M38S,hd,False,True,False,False,18604915,670390,27604
FqIKEmUo1S4,GH,2026-04-15T03:48:22.497829+00:00,2026-04-10T06:22:32Z,NEW HAZARD 109 🔥 NATIONAL ALL - STARS  PACK OPENING + GAMEPLAY 🔥 eFootball 26 mobile,NEW HAZARD 109 🔥 NATIONAL ALL - STARS  PACK OPENING + GAMEPLAY 🔥 eFootball 26 mobile,9AL Games,UCvzTJH6G9bH5nCQ1Hfb8nGg,20,Gaming,"hazard 109 efootball, edin hazard 109 efootball, review new hazard 109 efootball, review new hazard 109 efootball 2026, edin hazard 109 training efootball, hazard efootball, hazard no efootball, eden hazard efootball, hazard efootball 2026, edin hazard efootball, eden hazard efootball 26, big time hazard efootball, efootball 2026 eden hazard, eden hazard efootball 2026, eden hazard epic efootball, efootball mobile eden hazard, edin hazard big time efootball",17,https://i.ytimg.com/vi/FqIKEmUo1S4/hqdefault.jpg,en,en,False,1044,PT17M24S,hd,False,True,False,False,326428,18263,1173
TnicRhb6n4o,GH,2026-04-15T03:48:22.497842+00:00,2026-04-02T23:00:06Z,Oseikrom Sikanii - Tracking You (Official Video),Oseikrom Sikanii - Tracking You (Official Video),Oseikrom Sikanii,UC1_Gpik1bf9HAFQLKhksVZQ,10,Music,,0,https://i.ytimg.com/vi/TnicRhb6n4o/hqdefault.jpg,en,und,False,187,PT3M7S,hd,False,False,False,False,205782,2126,145
3_9vCamtuPY,GH,2026-04-15T03:48:22.497850+00:00,2026-03-17T16:19:02Z,Dune: Part Three | Official Teaser Trailer,Dune: Part Three | Official Teaser Trailer,Warner Bros.,UCjmJDM5pRKbUlVIzDYYWb6g,1,Film & Animation,"Action, Anya Taylor-Joy, Brian K Vaughan, Charlotte Rampling, Coming Soon, Denis Villeneuve, Dune, Dune Messiah, Dune: Part Three, Florence Pugh, Ida Brooke, Isaach De Bankolé, Jason Momoa, Javier Bardem, Messiah, Nakoa-Wolf Momoa, Rebecca Ferguson, Robert Pattinson, Sci Fi, Timothée Chalamet, Trilogy, Warner Bros, Zendaya",23,https://i.ytimg.com/vi/3_9vCamtuPY/hqdefault.jpg,en,en-US,False,150,PT2M30S,hd,True,False,False,False,29024714,620899,29731
yyX3TjRFDm0,GH,2026-04-15T03:48:22.497857+00:00,2026-04-12T13:01:41Z,Surviving The Biggest TSUNAMI In GTA 5...,Surviving The Biggest TSUNAMI In GTA 5...,TechyCrew,UCTU3m4rCUS-7qXuHK-j9Uqw,20,Gaming,"Techy, TechyCrew, Among Us, Fortnite, Fortnite Creative, Roblox, Techy Roblox, Among Us Roles",8,https://i.ytimg.com/vi/yyX3TjRFDm0/hqdefault.jpg,en,en,False,837,PT13M57S,hd,False,True,False,False,559289,9021,866
QkJH2lK7usw,GH,2026-04-15T03:48:22.497865+00:00,2026-04-03T23:39:00Z,OMAH LAY - I AM (Official Audio),OMAH LAY - I AM (Official Audio),Omah Lay,UCSUVM9Ygr6AI5Eje5BnFhtw,10,Music,,0,https://i.ytimg.com/vi/QkJH2lK7usw/hqdefault.jpg,en,en,False,193,PT3M13S,hd,False,True,False,False,562875,12222,630
X21JsHLHnY8,GH,2026-04-15T03:48:22.497872+00:00,2026-03-31T12:59:59Z,Masters of The Universe – Official Trailer,Masters of The Universe – Official Trailer,Amazon MGM Studios,UCf5CjDJvsFvtVIhkfmKAwAA,24,Entertainment,"MGM, MGM Studios, Metro-Goldwyn- Mayer, Metro Pictures Corporations, Goldwyn Pictures, Louis B. Mayer Pictures, MGM Pictures, United Artists, Metro MGM/UA, Amazon MGM, Amazon MGM Studios, Amazon, Masters Of The Universe, Masters Of The Universe Movie, Masters Of The Universe 2026, Nicholas Galitzine, Morena Baccarin, Idris Elba, Jared Leto, Alison Brie, Kristen Wig, Masters of the Universe Trailer 2, Masters of the Universe Official Trailer, Masters Of the Univer Trailer",24,https://i.ytimg.com/vi/X21JsHLHnY8/hqdefault.jpg,en,en-US,False,165,PT2M45S,hd,True,True,False,False,19302739,79570,8719
PdSXN0yuurA,GH,2026-04-15T03:48:22.497880+00:00,2026-04-11T20:53:14Z,LALIGA FC Pro Finals,LALIGA FC Pro Finals,EA SPORTS FC Pro,UCFA6YGp5lvgayO20lk7_Ung,20,Gaming,"FC Pro, FC Pro esports, FC esports, FC competitive, FC tournament, FC Pro gameplay, EA SPORTS FC, EA SPORTS FC Pro, FC Pro tips, FC Pro tutorial, FC Pro player tips, FC Pro Champ, FC Pro Champion, FC Pro Championship, EA SPORTS, EA SPORTS Pro, FC 26, FC 26 Pro, FC26Pro, FCPro26, FC Pro 26, FC Esports, Live, FC Pro Live, Livestream, fc pro open 26, easports fc26, eafc 26 pro, FC Pro Open, Ultimate Team, Final, laliga, laligafcpro, nicolass99, finals",35,https://i.ytimg.com/vi/PdSXN0yuurA/hqdefault.jpg,en,en,False,31561,PT8H46M1S,hd,False,False,False,False,93142,1259,22
JGw1UAYjFEY,GH,2026-04-15T03:48:22.497888+00:00,2026-03-26T22:00:06Z,Masicka - Boasty (Official Music Video),Masicka - Boasty (Official Music Video),Masicka,UCOSJVk71utzoCmRxzcfhM-A,10,Music,"Masicka, Dancehall, Jamaica, Jamaican, Dancehall King, Dancehall Nation, Dancehall Official, Teejay, Jah Vinci",9,https://i.ytimg.com/vi/JGw1UAYjFEY/hqdefault.jpg,en,en,False,198,PT3M18S,hd,False,False,False,False,2632764,58341,7588
6wjFXhMwRVU,GH,2026-04-15T03:48:22.497895+00:00,2026-03-24T23:45:00Z,KPOP DEMON HUNTERS 2 - Teaser Trailer (2029) 4K,KPOP DEMON HUNTERS 2 - Teaser Trailer (2029) 4K,JoBlo Animated Videos,UC2sxxXRBL5SgY0fI58BrOCA,1,Film & Animation,"KPOP DEMON HUNTERS 2 Trailer, KPOP DEMON HUNTERS 2, DEMON HUNTERS, KPOP, Rumi, Mira, Zoey, secret identities as demon hunters, demon hunters, supernatural danger, rival boy band of demons in disguise, boy band of demons in disguise, boy band of demons, Joblo Animated Videos, 4K, Trailer, KPop Demon Hunters 2",17,https://i.ytimg.com/vi/6wjFXhMwRVU/hqdefault.jpg,en,en-GB,False,51,PT51S,hd,False,True,False,False,5385154,3856,268
ho3qgnX34tg,GH,2026-04-15T03:48:22.497902+00:00,2026-04-09T15:12:09Z,NEW SKILLS TUTORIAL😱Best FEINT COMMAND For Dribbling💯Prof BOF Explains NEW DRIBBLING in eFootball 26,NEW SKILLS TUTORIAL😱Best FEINT COMMAND For Dribbling💯Prof BOF Explains NEW DRIBBLING in eFootball 26,Bof games,UCozhavMC5oIn1JxjLuP6D8Q,20,Gaming,,0,https://i.ytimg.com/vi/ho3qgnX34tg/hqdefault.jpg,en,en,False,443,PT7M23S,hd,False,True,False,False,89399,3893,283
R3Q8IegV1SU,GH,2026-04-15T03:48:22.497910+00:00,2026-04-10T16:00:06Z,Kelvyn Boy & Kojo Blak - Weather for 2 (Official Video),Kelvyn Boy & Kojo Blak - Weather for 2 (Official Video),Kelvyn Boy,UC8DpPYqNnPwi6cIvIzivawg,10,Music,"Kelvyn Boy, Kelvyn Boy Down Flat, Down Flat, AV Confessions, AV Big Thug Boys, 1da Banton, Afrobeats Now, top 100 ghana, naija hotlist, afro r&b, top afropop, afro pop mix, rema, wizkid, sarkodie, oxlade, new afrobeats, afrobeats mix",18,https://i.ytimg.com/vi/R3Q8IegV1SU/hqdefault.jpg,en,en,False,167,PT2M47S,hd,False,True,False,False,18255,1299,113
RIu4sFKGi6E,GH,2026-04-15T03:48:22.497948+00:00,2026-03-25T19:00:01Z,Harry Potter and the Philosopher's Stone | Official Teaser | HBO Max,Harry Potter and the Philosopher's Stone | Official Teaser | HBO Max,Harry Potter,UChPRO1CB_Hvd0TvKRU62iSQ,1,Film & Animation,"Harry Potter, Wizarding World, Warner Bros, Hogwarts, Marauders Map, Draco Malfoy, Ron Weasley, Hermione Granger, Harry Potter Lore, Potter, slytherin, ravenclaw, gryffindor, hufflepuff, hbomax, harrypotterhbo",16,https://i.ytimg.com/vi/RIu4sFKGi6E/hqdefault.jpg,en-GB,en-GB,False,129,PT2M9S,hd,True,True,False,False,10340710,271148,36480
IDh50Zvut0w,GH,2026-04-15T03:48:22.497967+00:00,2026-04-08T18:30:11Z,SIDEMEN AMONG US HARRY POTTER EDITION,SIDEMEN AMONG US HARRY POTTER EDITION,MoreSidemen,UCh5mLn90vUaB1PbRRx_AiaA,22,People & Blogs,"sidemen, moresidemen, miniminter, ksi, zerkaa, behzinga, tbjzl, vikkstar, wroetoshaw",9,https://i.ytimg.com/vi/IDh50Zvut0w/hqdefault.jpg,en,en-GB,False,3544,PT59M4S,hd,False,True,False,False,4569837,147765,5738
RQOg16kmFJM,GH,2026-04-15T03:48:22.497980+00:00,2026-03-19T23:00:39Z,"Asake, DJ Snake - WORSHIP (Official Video)","Asake, DJ Snake - WORSHIP (Official Video)",AsakeVEVO,UCqNsFioLEaG2NQpYGvidLPg,10,Music,"Asake, DJ Snake, GIRAN Republic EMPIRE, Pop",4,https://i.ytimg.com/vi/RQOg16kmFJM/hqdefault.jpg,en,en,False,166,PT2M46S,hd,False,True,False,False,5422410,86165,4519
0HjdiohVOik,GH,2026-04-15T03:48:22.497988+00:00,2026-03-31T15:59:00Z,Backrooms | Official Trailer HD | A24,Backrooms | Official Trailer HD | A24,A24,UCuPivVjnfNo4mb3Oog_frZg,1,Film & Animation,"a24, a24 films, a24 trailers, independent films, trailer, HD, official, movie, film, a24 movies, oscar winner, academy award winner",12,https://i.ytimg.com/vi/0HjdiohVOik/hqdefault.jpg,en,en,False,138,PT2M18S,hd,True,True,False,False,17243015,517439,26910
7BgVFMKrVZY,GH,2026-04-15T03:48:22.497995+00:00,2026-04-11T09:10:14Z,STEAL A BRAINROT GIVEAWAY LIVE | STEAL A BRAINROT FREE SECRETS + FREE BRAINROT GODS,STEAL A BRAINROT GIVEAWAY LIVE | STEAL A BRAINROT FREE SECRETS + FREE BRAINROT GODS,Joxy,UC3DlDcaefUYr-1skxaiLxVw,20,Gaming,"steal a brainrot giveaway, steal a brainrot giveaway live, steal a brainrot secret giveaway, steal a brainrot live giveaway, steal a brainrot brainrot god giveaway, steal a brainrot stream, steal a brainrot live, steal a brainrot 24/7 stream, steal a brainrot, steal a brainrot god, w steal a brainrot, steal a brainrot game, steal a brainrot gifting, steal a brainrot mod, steal a brainrot glitch, steal a brainrot 24/7, roblox steal a brainrot, steal a brainrot roblox",18,https://i.ytimg.com/vi/7BgVFMKrVZY/hqdefault.jpg,en,en,False,2,PT2S,hd,False,True,False,False,362461,14876,72
spH23TTo2kM,GH,2026-04-15T03:48:22.498003+00:00,2026-04-10T08:04:26Z,"Colorado - Johnny Drille, Ayra Starr, Young Jonn","Colorado - Johnny Drille, Ayra Starr, Young Jonn",Johnny Drille,UCr2CrvCc_tu8dkcmik0SLeA,10,Music,,0,https://i.ytimg.com/vi/spH23TTo2kM/hqdefault.jpg,en,en,False,223,PT3M43S,hd,False,False,False,False,864984,19904,1235
m2vMMYjJBYI,GH,2026-04-15T03:48:22.498010+00:00,2026-04-12T17:13:17Z,Every Win = Steal Opponents Player,Every Win = Steal Opponents Player,EvenMoreS2G,UC5IFLyNeALC8ShbQMe39Q_Q,20,Gaming,,0,https://i.ytimg.com/vi/m2vMMYjJBYI/hqdefault.jpg,en,en,False,964,PT16M4S,hd,False,True,False,False,178994,6237,229
HBMy-y2wb4I,GH,2026-04-15T03:48:22.498017+00:00,2026-03-28T10:14:16Z,YE - FATHER (feat. TRAVIS SCOTT),YE - FATHER (feat. TRAVIS SCOTT),Kanye West,UCs6eXM7s8Vl5WcECcRHc2qQ,22,People & Blogs,"ye, YE, Kanye West, Kanye, bully, travis scott, kanye west, ye bully, ye bully album, ye father, ye travis scott, ye travis scott father, travis scott father, ye father music video, father music video, ye travis scott music video, kanye west runaway, kanye west type beat, ye bully highs and lows, ye bully v1, ye bully full album, ye bully type beat, ye bully serotonin, ye bully circles, ye bully v2, kanye west bully, kanye west bully album, ye bully film, kanye west god is",29,https://i.ytimg.com/vi/HBMy-y2wb4I/hqdefault.jpg,en,zh-Hans,False,172,PT2M52S,hd,False,False,False,False,15140393,552796,27772
SkI-JfenaDs,GH,2026-04-15T03:48:22.498025+00:00,2026-04-09T18:43:34Z,NEW eFootball 5.4.0 UPDATE LIVE 🔥 MASTER LEAGUE IS HERE! 🏆,NEW eFootball 5.4.0 UPDATE LIVE 🔥 MASTER LEAGUE IS HERE! 🏆,Mednasah,UCGtV2qzfDCaOlZqLwVNsErA,20,Gaming,"eFootball 5.4.0 update, eFootball Mobile, eFootball Mobile Live, eFootball Live, eFootball 2026, eFootball Connect, Master League eFootball, eFootball update live, eFootball stream, eFootball mobile stream, eFootball gameplay update, eFootball dribbling, eFootball defending, eFootball new update, eFootball new players, eFootball epics, eFootball mobile gameplay, eFootball meta, Mednasah, eFootball News",20,https://i.ytimg.com/vi/SkI-JfenaDs/hqdefault.jpg,en,en,False,42900,PT11H55M,hd,False,True,False,False,216148,5552,47
WqTO4uk1siU,GH,2026-04-15T03:48:22.498033+00:00,2026-03-29T18:00:06Z,CENTRAL CEE - WAGWAN [MUSIC VIDEO],CENTRAL CEE - WAGWAN [MUSIC VIDEO],Central Cee,UCV_CsAy5CNBX_uwDQ7RMe1Q,10,Music,"central cee, centralcee, central cee wagwan, all roads lead home, central cee new song, central cee new video",6,https://i.ytimg.com/vi/WqTO4uk1siU/hqdefault.jpg,en,en,False,184,PT3M4S,hd,False,False,False,False,6058286,235422,7372
