video_id,country,fetched_at,published_at,title,localized_title,channel_title,channel_id,category_id,category_name,tags,tag_count,thumbnail,default_language,audio_language,is_live,duration,duration_raw,definition,caption_available,licensed_content,embeddable,made_for_kids,views,likes,comments
b7zibiYIw4w,ZA,2026-04-03T03:34:40.224878+00:00,2026-03-27T11:15:01Z,Botshelo Ke Eng,Botshelo Ke Eng,Trechyson Molly vx - Topic,UCO0N7NlJQ5NMzvhLONUv6Zw,10,Music,"Trechyson Molly vx, DJ Promatic SA, Dendofela, Botshelo Ke Eng",4,https://i.ytimg.com/vi/b7zibiYIw4w/hqdefault.jpg,id,en,False,190,PT3M10S,hd,False,True,False,False,839446,11621,220
s1-pfiVMKAs,ZA,2026-04-03T03:34:40.224920+00:00,2026-03-31T16:00:12Z,SUPERGIRL | Official Trailer,SUPERGIRL | Official Trailer,DC,UCiifkYAs_bq1pt_zbNAzYGg,1,Film & Animation,"2026, Coming Soon, Craig Gillespie, DC, DC Comics, DC Studios, DCU, David Krumholtz, Emily Beecham, Eve Ridley, James Gunn, Jason Momoa, Kara Zor-El, Krypto, Matthias Schoenaerts, Milly Alcock, Supergirl, WB, Warner Bros, Warner Bros Pictures, Warner Brothers, official trailer",22,https://i.ytimg.com/vi/s1-pfiVMKAs/hqdefault.jpg,en,en-US,False,177,PT2M57S,hd,True,False,False,False,11820036,256078,14711
3v9i7L3nt9U,ZA,2026-04-03T03:34:40.224931+00:00,2026-04-02T18:11:21Z,Skeem Saam Today Full Episode | 02 April 2026 | Episode 200 | Session 14 | Full HD,Skeem Saam Today Full Episode | 02 April 2026 | Episode 200 | Session 14 | Full HD,Hej Euud,UCfozKoZDIk_DAb7CgmV9POw,24,Entertainment,,0,https://i.ytimg.com/vi/3v9i7L3nt9U/hqdefault.jpg,en,und,False,1214,PT20M14S,sd,False,False,False,False,59898,553,73
fBm6z9X-WVk,ZA,2026-04-03T03:34:40.224940+00:00,2026-03-27T10:02:41Z,Kwelemcabango,Kwelemcabango,uMlabalaba - Topic,UC72zZ3MEkq9YVbKTf-2Cv6w,10,Music,"uMlabalaba, Mzukulu, Izethembiso, Kwelemcabango",4,https://i.ytimg.com/vi/fBm6z9X-WVk/hqdefault.jpg,en,hi,False,296,PT4M56S,hd,False,True,False,False,403279,10612,756
0HjdiohVOik,ZA,2026-04-03T03:34:40.224948+00:00,2026-03-31T15:59:00Z,Backrooms | Official Trailer HD | A24,Backrooms | Official Trailer HD | A24,A24,UCuPivVjnfNo4mb3Oog_frZg,1,Film & Animation,"a24, a24 films, a24 trailers, independent films, trailer, HD, official, movie, film, a24 movies, oscar winner, academy award winner",12,https://i.ytimg.com/vi/0HjdiohVOik/hqdefault.jpg,en,en,False,138,PT2M18S,hd,True,True,False,False,9124823,431090,21960
SqO-myKfRjw,ZA,2026-04-03T03:34:40.224956+00:00,2026-03-28T18:17:00Z,"Every Time I Crash, My Car Becomes MORE EXPENSIVE in GTA 5","Every Time I Crash, My Car Becomes MORE EXPENSIVE in GTA 5",SpeirsTheAmazingHD,UCAbdeLiTPdjk1X2TY_ZdLDw,20,Gaming,"speirstheamazinghd, gta 5 funny moments, gta 5, gta, in gta 5, gta 5 rp, grand theft auto 5, stealing cars gta 5, fastest car, fastest car gta 5, gta 5 roleplay, roleplay, gta v roleplay, gta5 roleplay, gta 5 roleplay funny, funny roleplay moments, grand theft auto roleplay, grand theft auto 5 roleplay, car gets more expensive, every time my car becomes more expensive, every time i crash gta 5, my car becomes more expensive gta 5",22,https://i.ytimg.com/vi/SqO-myKfRjw/hqdefault.jpg,en,en,False,1713,PT28M33S,hd,False,True,False,False,730904,8123,197
C9nB4NITiII,ZA,2026-04-03T03:34:40.224965+00:00,2026-03-25T14:00:06Z,"Benzoo, Bukzin Keyz, Tango Supreme - Mopepe (Official Music Video)","Benzoo, Bukzin Keyz, Tango Supreme - Mopepe (Official Music Video)",BukzinKeysVEVO,UCmILsr9SmFc5CuZMPCizWrg,10,Music,"Benzoo, Bukzin Keyz, Tango Supreme, Universal Music (Pty) Ltd., Amapiano",5,https://i.ytimg.com/vi/C9nB4NITiII/hqdefault.jpg,en,und,False,162,PT2M42S,hd,False,True,False,False,949092,10228,244
x9d0C3HaSEM,ZA,2026-04-03T03:34:40.224973+00:00,2026-04-01T14:30:28Z,New Action Horror Zombie Movie | AFTER THE OUTBREAK | Hollywood English Movie | Free English Movies,New Action Horror Zombie Movie | AFTER THE OUTBREAK | Hollywood English Movie | Free English Movies,Hollywood English Collection,UC02hHB8lYb5zyRjxqahtVjg,1,Film & Animation,"hollywood movies in english full sci fi horror hd, hollywood movie 2026, hollywood movie in english, Hollywood Movies In English 2026, new hollywood english movies 2026, new hollywood movies, hollywood movie english mai, movies 2026 full movies, hollywood movie in english 2026, hollywood action horror movies in english, Silent Zone 2026 full movie In english, hollywood movie english, horror movie in english, Zombie Horror Movies In English, Silent Zone, Silent Zone English Movie",16,https://i.ytimg.com/vi/x9d0C3HaSEM/hqdefault.jpg,hi,en,False,6517,PT1H48M37S,hd,False,True,False,False,565387,4556,145
10OJhIc_-vw,ZA,2026-04-03T03:34:40.224982+00:00,2026-03-30T03:52:19Z,Minecraft Speedrunner VS 6 Hunters REMATCH,Minecraft Speedrunner VS 6 Hunters REMATCH,Dream,UCTkXRDQl0luXxVQrRQvWS6w,20,Gaming,"minecraft, dream, dream minecraft",3,https://i.ytimg.com/vi/10OJhIc_-vw/hqdefault.jpg,en,en,False,3129,PT52M9S,hd,False,True,False,False,7372785,344473,24221
I-w0GXj6qZs,ZA,2026-04-03T03:34:40.224990+00:00,2026-03-26T22:04:04Z,Lwetse,Lwetse,Xduppy - Topic,UC6XW825h1QSs3RwlhNdVLHQ,10,Music,"Xduppy, Angekebabuye Mc, DJ Maphorisa, Mluusician, Lwetse",5,https://i.ytimg.com/vi/I-w0GXj6qZs/hqdefault.jpg,en,en,False,374,PT6M14S,hd,False,True,False,False,476502,17927,272
aBlsrtxuwss,ZA,2026-04-03T03:34:40.224997+00:00,2026-03-18T11:17:52Z,Spider-Man: Brand New Day - Official Trailer,Spider-Man: Brand New Day - Official Trailer,PlayStation,UC-2Y8dQb0S6DtpxNgAKoJKA,20,Gaming,"PlayStation, PS5, video games, next gen, Sony",5,https://i.ytimg.com/vi/aBlsrtxuwss/hqdefault.jpg,en,en,False,158,PT2M38S,hd,False,True,False,False,17573756,659504,27275
NnTycJg1MIo,ZA,2026-04-03T03:34:40.225005+00:00,2026-03-30T00:00:00Z,Destroying A World That Doesn't Exist,Destroying A World That Doesn't Exist,Wifies,UCiVJZlfcmWMUiXv5oywnDhQ,20,Gaming,"wifies, mumbo jumbo, dream, wifies arg, at the crossroads dont turn left, the king in yellow",6,https://i.ytimg.com/vi/NnTycJg1MIo/hqdefault.jpg,en,en,False,7355,PT2H2M35S,hd,False,True,False,False,9757725,698089,104556
BXovOxEyDR4,ZA,2026-04-03T03:34:40.225013+00:00,2026-03-26T22:00:00Z,Mzala,Mzala,Shakes & Les - Topic,UC4HLrfooZM3pmK5freo2UUg,10,Music,"Shakes & Les, Zee Nxumalo, Tango Supreme, Mzala",4,https://i.ytimg.com/vi/BXovOxEyDR4/hqdefault.jpg,en,en,False,472,PT7M52S,hd,False,True,False,False,452659,15337,224
kgv8jf_8dm0,ZA,2026-04-03T03:34:40.225020+00:00,2026-03-25T14:00:00Z,Apex | Official Trailer | Netflix,Apex | Official Trailer | Netflix,Netflix,UCWOA1ZGywLbqmigxE4Qlvuw,24,Entertainment,"Action, Adrenaline, Adventure, Apex, April, Baltasar Kormakur, Binge, Charlize Theron, Crime, Dark, Eric Bana, Film, Killer, Movie, Murder, Nature, Netflix, Outdoors, Psychological, Scary, Serial, Spring, Summer, Survival, Taron Egerton, Thriller, Trailer, True, Watch, Wild, Wilderness",31,https://i.ytimg.com/vi/kgv8jf_8dm0/hqdefault.jpg,en,en-US,False,134,PT2M14S,hd,True,True,False,False,5172743,39798,2079
E-C2UBMLEj0,ZA,2026-04-03T03:34:40.225029+00:00,2026-03-16T20:00:09Z,I Gave Zoo Animals My Voice!,I Gave Zoo Animals My Voice!,BriannaPlayz,UCAtWPQw_rUROGGjEPSFboIA,20,Gaming,"minecraft, preston, brianna, gaming, funny, ssundee, unspeakable, mrbeast, aphmau, canman, lankybox, cash minecraft, nico mc, stokestwins, gametoons, maizen, eyestreem",17,https://i.ytimg.com/vi/E-C2UBMLEj0/hqdefault.jpg,en,en-US,False,1872,PT31M12S,hd,False,True,False,False,2640408,6503,836
4M73KvqxwF4,ZA,2026-04-03T03:34:40.225036+00:00,2026-03-26T22:00:04Z,"031Choppa, Al Xapo & Benzoo - Fast Fast (feat. Roscosteazy, Optimist Music ZA & JussGigi) (Audio)","031Choppa, Al Xapo & Benzoo - Fast Fast (feat. Roscosteazy, Optimist Music ZA & JussGigi) (Audio)",Africori,UCChueHq0vtAIDSEgq4GKbSw,10,Music,"Amapiano, amapiano music, House Music, Deep House Music, SA House Music, South African House Music, Official Audio",7,https://i.ytimg.com/vi/4M73KvqxwF4/hqdefault.jpg,en,en,False,240,PT4M,hd,False,True,False,False,400647,3660,89
RIu4sFKGi6E,ZA,2026-04-03T03:34:40.225044+00:00,2026-03-25T19:00:01Z,Harry Potter and the Philosopher's Stone | Official Teaser | HBO Max,Harry Potter and the Philosopher's Stone | Official Teaser | HBO Max,Harry Potter,UChPRO1CB_Hvd0TvKRU62iSQ,1,Film & Animation,"Harry Potter, Wizarding World, Warner Bros, Hogwarts, Marauders Map, Draco Malfoy, Ron Weasley, Hermione Granger, Harry Potter Lore, Potter, slytherin, ravenclaw, gryffindor, hufflepuff, hbomax, harrypotterhbo",16,https://i.ytimg.com/vi/RIu4sFKGi6E/hqdefault.jpg,en-GB,en-GB,False,129,PT2M9S,hd,True,True,False,False,9214725,260612,33799
4mrFHMwzfvs,ZA,2026-04-03T03:34:40.225052+00:00,2026-03-29T18:08:44Z,ROBLOX OBBY BUT YOUR CURSED..,ROBLOX OBBY BUT YOUR CURSED..,Foltyn,UCRkuUgtDAL4XSU5jB40J_wA,20,Gaming,"foltyn, foltyn roblox, roblox, roblox foltyn, foltyn family, funny, no swearing, foltyn family roblox, roblox foltyn family, blade ball, roblox blade ball, foltyn blade ball, Roblox Obby But I'm Cursed, Roblox Obby But I'm Cursed Roblox, i beat the impossible obby.., roblox limited jumps.., finishing crazy roblox troll tower!, i beat every roblox slap tower!, roblox but you can't walk, roblox but you can't jump, finishing craziest roblox slap tower!, roblox don't break obby..",22,https://i.ytimg.com/vi/4mrFHMwzfvs/hqdefault.jpg,en,en-US,False,1080,PT18M,hd,False,True,False,False,2034959,39651,3873
8smqtONr31Q,ZA,2026-04-03T03:34:40.225060+00:00,2026-03-26T04:01:49Z,Sulani Igama Lami (feat. Shenge WaseHlalankosi),Sulani Igama Lami (feat. Shenge WaseHlalankosi),uMhlakazi - Topic,UCRMAat1We38GuHCfYxcukWA,10,Music,"uMhlakazi, Shenge WaseHlalankosi, Mhlakazi, Stshomi, Sulani Igama Lami EP, Sulani Igama Lami (feat. Shenge WaseHlalankosi)",6,https://i.ytimg.com/vi/8smqtONr31Q/hqdefault.jpg,en,und,False,273,PT4M33S,hd,False,True,False,False,124992,2930,0
_L_o2JrcyHg,ZA,2026-04-03T03:34:40.225068+00:00,2026-03-29T12:30:36Z,"Grey Hulk (2026) - Dwayne Johnson, Mark Ruffalo, Amanda Seyfried | Concept Trailer","Grey Hulk (2026) - Dwayne Johnson, Mark Ruffalo, Amanda Seyfried | Concept Trailer",Ultimate Studios,UCc3qOMA8TN5b3PPRlGAFA0Q,24,Entertainment,"Grey Hulk, grey hulk trailer, dwayne johnson, dwayne johnson grey hulk, grey hulk release date update, grey hulk explained, hulk, Grey Hulk First look, Grey Hulk 2026, Grey Hulk Charlize Theron, dwayne johnson hulk, grey hulk concept trailer, trailers, grey hulk rage movie, hulk fan made trailer, grey hulk released, grey hulk morgan freeman, most powerful hulk, grey hulk first trailer, the hulk, grey hulk fan trailer, dwayne johnson movie, grey hulk movie concept",23,https://i.ytimg.com/vi/_L_o2JrcyHg/hqdefault.jpg,en,en,False,133,PT2M13S,hd,False,True,False,False,563926,4701,674
ROq3cjgeNo4,ZA,2026-04-03T03:34:40.225075+00:00,2026-03-28T18:58:38Z,I Built Minecraft's Most Hidden Base!,I Built Minecraft's Most Hidden Base!,Stay Wild Gaming,UCQaHAfz9GqhaKeBvRwnjUQA,20,Gaming,"ben azelart, julien azelart, stay wild, minecraft, gaming, stay wild reacts, stay wild gaming",7,https://i.ytimg.com/vi/ROq3cjgeNo4/hqdefault.jpg,en,en,False,2225,PT37M5S,hd,False,True,False,False,738623,6052,251
_FOAvO8SwuI,ZA,2026-04-03T03:34:40.225083+00:00,2026-03-29T16:00:06Z,Makhadzi Entertainment x Blissbouy - Cancella Lenyalo (Official Music Video),Makhadzi Entertainment x Blissbouy - Cancella Lenyalo (Official Music Video),Makhadzi,UCSyGLZWpjz1hsIUvwAu9gaQ,10,Music,"makhadzi, cancella, Blissbouy, lekompo, south africa, dance, amapiano, music",8,https://i.ytimg.com/vi/_FOAvO8SwuI/hqdefault.jpg,en,und,False,224,PT3M44S,hd,False,True,False,False,270631,6650,400
3_9vCamtuPY,ZA,2026-04-03T03:34:40.225090+00:00,2026-03-17T16:19:02Z,Dune: Part Three | Official Teaser Trailer,Dune: Part Three | Official Teaser Trailer,Warner Bros.,UCjmJDM5pRKbUlVIzDYYWb6g,1,Film & Animation,"Action, Anya Taylor-Joy, Brian K Vaughan, Charlotte Rampling, Coming Soon, Denis Villeneuve, Dune, Dune Messiah, Dune: Part Three, Florence Pugh, Ida Brooke, Isaach De Bankolé, Jason Momoa, Javier Bardem, Messiah, Nakoa-Wolf Momoa, Rebecca Ferguson, Robert Pattinson, Sci Fi, Timothée Chalamet, Trilogy, Warner Bros, Zendaya",23,https://i.ytimg.com/vi/3_9vCamtuPY/hqdefault.jpg,en,en-US,False,150,PT2M30S,hd,True,False,False,False,27732349,609016,29155
5hFlgYrWImQ,ZA,2026-04-03T03:34:40.225098+00:00,2026-04-01T15:00:12Z,Becoming a DOG To Troll My Friends One Block…,Becoming a DOG To Troll My Friends One Block…,Cash,UC0eLBYhxW9HC0P9PXQ73mpQ,24,Entertainment,"Cash, Nico, Nico and Cash, Cash and Nico, Minecraft, Minecraft mod, family friendly, kid friendly",8,https://i.ytimg.com/vi/5hFlgYrWImQ/hqdefault.jpg,en,en-US,False,1278,PT21M18S,hd,False,True,False,False,583942,7096,1187
HBMy-y2wb4I,ZA,2026-04-03T03:34:40.225105+00:00,2026-03-28T10:14:16Z,YE - FATHER (feat. TRAVIS SCOTT),YE - FATHER (feat. TRAVIS SCOTT),Kanye West,UCs6eXM7s8Vl5WcECcRHc2qQ,22,People & Blogs,"ye, YE, Kanye West, Kanye, bully, travis scott, kanye west, ye bully, ye bully album, ye father, ye travis scott, ye travis scott father, travis scott father, ye father music video, father music video, ye travis scott music video, kanye west runaway, kanye west type beat, ye bully highs and lows, ye bully v1, ye bully full album, ye bully type beat, ye bully serotonin, ye bully circles, ye bully v2, kanye west bully, kanye west bully album, ye bully film, kanye west god is",29,https://i.ytimg.com/vi/HBMy-y2wb4I/hqdefault.jpg,en,zh-Hans,False,172,PT2M52S,hd,False,False,False,False,10306341,475097,24561
X21JsHLHnY8,ZA,2026-04-03T03:34:40.225131+00:00,2026-03-31T12:59:59Z,Masters of The Universe – Official Trailer,Masters of The Universe – Official Trailer,Amazon MGM Studios,UCf5CjDJvsFvtVIhkfmKAwAA,24,Entertainment,"MGM, MGM Studios, Metro-Goldwyn- Mayer, Metro Pictures Corporations, Goldwyn Pictures, Louis B. Mayer Pictures, MGM Pictures, United Artists, Metro MGM/UA, Amazon MGM, Amazon MGM Studios, Amazon, Masters Of The Universe, Masters Of The Universe Movie, Masters Of The Universe 2026, Nicholas Galitzine, Morena Baccarin, Idris Elba, Jared Leto, Alison Brie, Kristen Wig, Masters of the Universe Trailer 2, Masters of the Universe Official Trailer, Masters Of the Univer Trailer",24,https://i.ytimg.com/vi/X21JsHLHnY8/hqdefault.jpg,en,en-US,False,165,PT2M45S,hd,True,True,False,False,9640613,68973,7220
nmrU9tSX6oU,ZA,2026-04-03T03:34:40.225141+00:00,2026-03-31T20:01:25Z,The MONEY FACTORY Heist in GTA 5! (Super Rich),The MONEY FACTORY Heist in GTA 5! (Super Rich),Nought,UCSh__r5HS4Y1xBkccWnV0TA,20,Gaming,"money, money factory, unlimited money, cash, rich, richest, richest man, richest ever, mega rich, super rich, gta 5 rich, gta 5 richest man, gta 5 richest, gta 5 super rich, mods, gta 5, gta v, gta 5 mods, gta v mods, heist, gta 5 heist, millionaire, billionaire, trillionaire, gta 5 millionaire, gta 5 billionaire, gta 5 trillionaire, gta 5 franklin, gta 5 trevor, gta 5 michael, onestate",31,https://i.ytimg.com/vi/nmrU9tSX6oU/hqdefault.jpg,en,en,False,1548,PT25M48S,hd,False,True,False,False,151987,7759,162
bxMJ9dNvBi0,ZA,2026-04-03T03:34:40.225149+00:00,2026-03-26T10:00:54Z,"Fast Fast (feat. Roscosteazy, Optimist Music ZA & JussGigi)","Fast Fast (feat. Roscosteazy, Optimist Music ZA & JussGigi)",031CHOPPA - Topic,UC9sfZrcIGcrqxcJ8WeJ-u1Q,10,Music,"031Choppa, Al Xapo, Benzoo, Roscosteazy, Optimist Music ZA, JussGigi, Fast Fast (feat. Roscosteazy, Optimist Music ZA & JussGigi)",7,https://i.ytimg.com/vi/bxMJ9dNvBi0/hqdefault.jpg,en,en,False,240,PT4M,hd,False,True,False,False,284532,12106,105
r3Z4tGN0i2I,ZA,2026-04-03T03:34:40.225156+00:00,2026-03-30T17:00:11Z,Euphoria Season 3 | Trailer 2 | HBO Max,Euphoria Season 3 | Trailer 2 | HBO Max,HBO Max,UCx-KWLTKlB83hDI6UKECtJQ,24,Entertainment,"hbo max, hbo, hbo originals, hbo original series, hbo trailer, new on hbo, hbo max originals, hbo max trailer, hbo max series, hbo max youtube, euphoria, euphoria season 3, euphoria trailer 1, euphoria trailer, zendaya, sydney sweeney, jacob elordi, rue, cassie, nate, alexa demie, maddy, lexi, jules, maude apatow, hunter schafer, zendaya euphoria, euphoria new season, hbo euphoria season 3, sydney sweeney euphoria, sydney sweeney cassie, cassie and nate, cassie and maddy",33,https://i.ytimg.com/vi/r3Z4tGN0i2I/hqdefault.jpg,en,en,False,189,PT3M9S,hd,True,True,False,False,1835964,47987,2416
d3c6FSJsL_4,ZA,2026-04-03T03:34:40.225164+00:00,2026-04-01T14:00:00Z,Hiding Out Of The Map To Cheat In Rivals Hide & Seek!,Hiding Out Of The Map To Cheat In Rivals Hide & Seek!,Techy Plays,UCNDzLI-hyihpAx3zKtwhGZw,20,Gaming,"roblox, brookhaven, funnyroblox, techyblox, techy, crazy fan girls, crazy fan girl, my crazy fan girls",8,https://i.ytimg.com/vi/d3c6FSJsL_4/hqdefault.jpg,en,en,False,902,PT15M2S,hd,False,True,False,False,427732,6592,672
bzrr3XoTK1M,ZA,2026-04-03T03:34:40.225172+00:00,2026-03-26T10:02:58Z,Nam Angeke,Nam Angeke,MaWhoo - Topic,UCCtJLelR6QcNUi5ksz_G9xQ,10,Music,"MaWhoo, Sami'Kay, MSA, Nam Angeke",4,https://i.ytimg.com/vi/bzrr3XoTK1M/hqdefault.jpg,en,en,False,257,PT4M17S,hd,False,True,False,False,248527,7489,117
n7f6hlKsxxo,ZA,2026-04-03T03:34:40.225179+00:00,2026-03-23T16:00:07Z,"Moana | ""Official Trailer"" | In Theaters July 10","Moana | ""Official Trailer"" | In Theaters July 10",Disney,UC_5niPa-d35gg88HaS7RrIw,24,Entertainment,,0,https://i.ytimg.com/vi/n7f6hlKsxxo/hqdefault.jpg,en,en,False,140,PT2M20S,hd,True,True,False,False,4853487,53961,13553
zzgGe6vzDHw,ZA,2026-04-03T03:34:40.225187+00:00,2026-03-31T19:04:27Z,We Got Promoted to the Championship…,We Got Promoted to the Championship…,MoreS2G,UCw9rjdrpHa7mzNrWVJoaPgw,20,Gaming,,0,https://i.ytimg.com/vi/zzgGe6vzDHw/hqdefault.jpg,en,en-GB,False,1490,PT24M50S,hd,False,True,False,False,367987,18987,1950
FZrR9kxf31E,ZA,2026-04-03T03:34:40.225194+00:00,2026-03-20T11:55:03Z,Sekuzolunga Mama,Sekuzolunga Mama,Nkeshemba - Topic,UC1VTtIHbrp27uSDiGM9pTgw,10,Music,"Nkeshemba, Imikhonto, Sekuzolunga Mama",3,https://i.ytimg.com/vi/FZrR9kxf31E/hqdefault.jpg,en,und,False,279,PT4M39S,hd,False,True,False,False,718032,21166,793
aZydib--qw4,ZA,2026-04-03T03:34:40.225202+00:00,2026-04-02T09:00:00Z,The Trials of Winnie Mandela | Official Trailer | Netflix,The Trials of Winnie Mandela | Official Trailer | Netflix,AfricaOnNetflix,UCzi3g9ade6lq-nGjShQOJJg,24,Entertainment,"African History, Documentary, Injustice, Inquistive, Netflix, Netflix 2026, Netflix Trailers, New on Netflix, Nonfiction, Social Justice, South Africa, TV, Uncovering the Truth",13,https://i.ytimg.com/vi/aZydib--qw4/hqdefault.jpg,en,en-US,False,149,PT2M29S,hd,True,True,False,False,20190,681,144
SNvkjZ1awyw,ZA,2026-04-03T03:34:40.225209+00:00,2026-04-01T15:00:36Z,ROBLOX DRAW A SLED...,ROBLOX DRAW A SLED...,Techys,UCoRjsuzMh-MqfRjvlqaVLPw,20,Gaming,,0,https://i.ytimg.com/vi/SNvkjZ1awyw/hqdefault.jpg,en,en,False,807,PT13M27S,hd,False,True,False,False,331007,4817,417
BlsMHH7EasA,ZA,2026-04-03T03:34:40.225216+00:00,2026-03-27T13:00:06Z,"JayJayy , Mordecai - Mgani Wami (Jaydecai) [Official Music Video]","JayJayy , Mordecai - Mgani Wami (Jaydecai) [Official Music Video]",JayJayy,UCus2hteqolkdpS4X77UB8NQ,10,Music,"Official, Music Video, Lyric Video, Official audio, mp3 download, music, South African music, Playlist, Afropop, Amapiano, R&B, Soul, Pop, Dancehall, JayJayy, Samba 8, Gallo Record Company, Brenda Fassie, Yebba, Modercai, Shaun The Stylist, Shakes & Les, Jussgigi, RishBeats, Malemon, 031Choppa, ShakaMan YKTV, Mawhoo, mgan wam, Jaydecai, mordecai, jay jayy, house music, new music, phesheya, lebo mathosa, detour",37,https://i.ytimg.com/vi/BlsMHH7EasA/hqdefault.jpg,en,und,False,286,PT4M46S,hd,False,True,False,False,164651,4148,76
YO5RXaC4hdQ,ZA,2026-04-03T03:34:40.225224+00:00,2026-03-24T15:00:55Z,"Drifter - Official Teaser Trailer (2026) Sung Kang, Tamara Braun, Gregory Cruz","Drifter - Official Teaser Trailer (2026) Sung Kang, Tamara Braun, Gregory Cruz",IGN,UCKy1dAqELo0zrOtPkf0eTMw,24,Entertainment,"Drifter, Drifter movie, Drifter trailer, drifter sung kang, drifter sung kang movie trailer",5,https://i.ytimg.com/vi/YO5RXaC4hdQ/hqdefault.jpg,en,en,False,31,PT31S,hd,False,True,False,False,1207755,41037,1719
12PPZSNZnq8,ZA,2026-04-03T03:34:40.225232+00:00,2026-03-31T13:00:02Z,"$1 VS $1,000,000,000 Waterslide in GTA 5!","$1 VS $1,000,000,000 Waterslide in GTA 5!",TechyCrew,UCTU3m4rCUS-7qXuHK-j9Uqw,20,Gaming,"Techy, TechyCrew, Among Us, Fortnite, Fortnite Creative, Roblox, Techy Roblox, Among Us Roles",8,https://i.ytimg.com/vi/12PPZSNZnq8/hqdefault.jpg,en,en,False,873,PT14M33S,hd,False,True,False,False,445936,11718,794
yFOZ3MSyigA,ZA,2026-04-03T03:34:40.225239+00:00,2026-03-30T22:00:06Z,Straata - Shandesh x Hitboss SA feat Natiey Lepaka (Visualiser),Straata - Shandesh x Hitboss SA feat Natiey Lepaka (Visualiser),Shandesh Music,UCwtksocF1GhFplkTbcITpvA,10,Music,"Official, Music Video, Lyric Video, Official audio, mp3 download, Music, shandesh, shandesh songs, shandesh new songs, lekompo, lekompo songs, lekompo balcony mix, lekompo balcony mix janesh, lekompo mix, lekompo dance",15,https://i.ytimg.com/vi/yFOZ3MSyigA/hqdefault.jpg,en-GB,und,False,248,PT4M8S,hd,False,True,False,False,123430,4511,456
5KZ06X_EzEc,ZA,2026-04-03T03:34:40.225248+00:00,2026-04-01T17:06:58Z,ROBLOX BECOME A BRAINROT..,ROBLOX BECOME A BRAINROT..,FoltynPlays,UC2uQvUg3YYzoOtj1yZLT0Ow,20,Gaming,"Foltyn, foltynplays, roblox, roblox gaming, family friendly, foltyn family, foltyn family roblox, foltyn roblox, roblox foltyn, no cursing, blox fruits, roblox blox fruits, roblox blox fruit, roblox fruits in blox fruits, blox fruit roblox, blox fruit, roblox become a brainrot, become a brainrot, roblox become a lucky block!, foltyn brainrot games, foltyn and caylus, foltyn and caylus playing roblox",22,https://i.ytimg.com/vi/5KZ06X_EzEc/hqdefault.jpg,en,en-US,False,879,PT14M39S,hd,False,True,False,False,1172387,25108,1818
_gyultVTesk,ZA,2026-04-03T03:34:40.225256+00:00,2026-04-01T15:00:01Z,BTS (방탄소년단) '2.0' Official MV,BTS (방탄소년단) '2.0' Official MV,HYBE LABELS,UC3IZKseVpdzPSBaWxBxundA,10,Music,"HYBE, HYBE LABELS, 하이브, 하이브레이블즈",4,https://i.ytimg.com/vi/_gyultVTesk/hqdefault.jpg,ko,ko,False,235,PT3M55S,hd,True,True,False,False,17209133,2823222,196858
LCMhmmyjezs,ZA,2026-04-03T03:34:40.225263+00:00,2026-04-01T17:55:50Z,Sunderland vs Newcastle Takeover Showdown…,Sunderland vs Newcastle Takeover Showdown…,S2G,UChR1Yn7YpVrnP-SbsWtjuBA,20,Gaming,,0,https://i.ytimg.com/vi/LCMhmmyjezs/hqdefault.jpg,en-GB,en,False,1887,PT31M27S,hd,False,True,False,False,319188,13514,529
g7_r7mbBoMc,ZA,2026-04-03T03:34:40.225271+00:00,2026-03-19T04:31:19Z,OVERLOAD,OVERLOAD,Mjabulisi - Topic,UCvNmdD1aVJdmF7eh_yMocnA,10,Music,"Mjabulisi, MNOTHO, DJ FUZEH, XOLASANDE Maphanga, OVERLOAD",5,https://i.ytimg.com/vi/g7_r7mbBoMc/hqdefault.jpg,en,en,False,283,PT4M43S,hd,False,True,False,False,551803,14556,0
WfG6atFX7ew,ZA,2026-04-03T03:34:40.225278+00:00,2026-03-31T23:00:00Z,"Minecraft, But It's On 1 Guns Block","Minecraft, But It's On 1 Guns Block",Bionic,UCETZ7OiW7-wqwb-6hsz3C4w,20,Gaming,"minecraft, bionic, family friendly, minecraft but its on 1 block, minecraft but its on 1 guns block, guns block, 1 guns block, minecraft guns, guns, minecraft on 1 guns block, one block, one block with guns, challenge",13,https://i.ytimg.com/vi/WfG6atFX7ew/hqdefault.jpg,en,en,False,2206,PT36M46S,hd,False,True,False,False,676879,18836,1508
EcAUZ3_kKPI,ZA,2026-04-03T03:34:40.225286+00:00,2026-03-26T22:00:06Z,Cairo Cpt & Anelisa N - Sebenza Mntasekhaya (Official Audio),Cairo Cpt & Anelisa N - Sebenza Mntasekhaya (Official Audio),Cairo Cpt,UCUisEWJ9o0O9pthjBtklm0w,10,Music,,0,https://i.ytimg.com/vi/EcAUZ3_kKPI/hqdefault.jpg,en,en,False,369,PT6M9S,hd,False,False,False,False,113622,2575,161
cwOY9J7ZLb4,ZA,2026-04-03T03:34:40.225293+00:00,2026-04-02T12:01:03Z,I Recreated My Friends IRL CARS in Roblox...,I Recreated My Friends IRL CARS in Roblox...,eXn,UCiP042_Sz7LzFEhecQSFZeg,22,People & Blogs,,0,https://i.ytimg.com/vi/cwOY9J7ZLb4/hqdefault.jpg,en,en,False,826,PT13M46S,hd,False,True,False,False,129204,3466,393
RC2WiTv-Su8,ZA,2026-04-03T03:34:40.225300+00:00,2026-03-22T01:36:53Z,Sound Check,Sound Check,ZWOTHE KEYS - Topic,UC9HscKWm61_fmuN438aGFOg,10,Music,"ZWOTHE KEYS, ZWITHU ZWOTHE TAPES, Sound Check",3,https://i.ytimg.com/vi/RC2WiTv-Su8/hqdefault.jpg,en,es,False,199,PT3M19S,hd,False,True,False,False,147026,4074,99
sYmSL23HL8g,ZA,2026-04-03T03:34:40.225307+00:00,2026-03-30T23:55:10Z,Repairing TRILLIONAIRE SUPERCARS in GTA 5 RP..,Repairing TRILLIONAIRE SUPERCARS in GTA 5 RP..,Caylus  ,UCVAYy7_zddIx6USjXscV9Vg,20,Gaming,"infinite lists, infinite, gta 5, caylus, gta 5 caylus, gta 5 mods, caylusblox, caylus roblox, caylus infinite, caylus horror, caylus vr, caylus gta 5, caylus tomo, repairing supercars, caylus repairing supercars",15,https://i.ytimg.com/vi/sYmSL23HL8g/hqdefault.jpg,en,en,False,1498,PT24M58S,hd,False,True,False,False,259962,6266,531
yoxbN28NcPc,ZA,2026-04-03T03:34:40.225315+00:00,2026-03-26T17:35:13Z,"Waponda Moyo - Hulengende feat Malloti ( Official Video) Remix ,Tsvimbo Mutauro Album ","Waponda Moyo - Hulengende feat Malloti ( Official Video) Remix ,Tsvimbo Mutauro Album ",Hulengende Zw,UC-908rk8ENupyfdny84L5hQ,10,Music,,0,https://i.ytimg.com/vi/yoxbN28NcPc/hqdefault.jpg,en,und,False,215,PT3M35S,hd,False,True,False,False,417724,18812,2457
