video_id,country,fetched_at,published_at,title,localized_title,channel_title,channel_id,category_id,category_name,tags,tag_count,thumbnail,default_language,audio_language,is_live,duration,duration_raw,definition,caption_available,licensed_content,embeddable,made_for_kids,views,likes,comments
6C3JSzCF82Q,PE,2026-03-05T03:14:57.542581+00:00,2026-02-27T14:00:23Z,"Abraham Mateo, Farruko & Christian Daniel - Loco Enamorado (Letra/Lyrics)","Abraham Mateo, Farruko & Christian Daniel - Loco Enamorado (Letra/Lyrics)",Musica Milagrosa,UC7ddFo6Ac8VCzroqvfheIxQ,22,People & Blogs,"Loco Enamorado, Loco Enamorado Letra, Letra Loco Enamorado, Abraham Mateo, Farruko, Christian Daniel, Letra, Abraham Mateo Loco Enamorado, Loco Enamorado Abraham Mateo, Abraham Mateo Loco Enamorado Letra, Farruko Loco Enamorado, Farruko Loco Enamorado Letra, Christian Daniel Loco Enamorado, Christian Daniel Loco Enamorado Letra, Abraham Mateo Farruko Christian Daniel Loco Enamorado, Abraham Mateo Farruko Christian Daniel Loco Enamorado Letra",16,https://i.ytimg.com/vi/6C3JSzCF82Q/hqdefault.jpg,es,es,False,253,PT4M13S,hd,False,True,False,False,49597,169,3
D2fW8IspqI4,PE,2026-03-05T03:14:57.542592+00:00,2026-03-04T21:41:15Z,QUIEN es EL MEJOR IMPOSTOR entre NOSOTROS... 🔪😂 SILVIOGAMER en SCAM LINE,QUIEN es EL MEJOR IMPOSTOR entre NOSOTROS... 🔪😂 SILVIOGAMER en SCAM LINE,Silvio Gamer,UCCrA8ZN1J3S52wuF4vthZFQ,20,Gaming,"SILVIO, SILVIOGAMER, SILVIO GAMER, MINECRAFT, Silvio, silviogamer, silvio, silvio gamer, minecraft silvio, silvio minecraft, silviogamer minecraft, minecraft silviogamer, silviogamer minecraft pero, minecraft pero, scam, scam line, line, impostor, quien, quien es el mejor, mejor impostor, entre nosotros, nosotros, silvio impostor, silviogamer impostor, quien es el, el impostor, impostores, mentirosos, mentiras, pancracio, soydany, permon, telefono",34,https://i.ytimg.com/vi/D2fW8IspqI4/hqdefault.jpg,es,es,False,1759,PT29M19S,hd,False,True,False,False,236106,18454,1060
N4P9-PwtZl0,PE,2026-03-05T03:14:57.542600+00:00,2026-02-28T23:00:22Z,MARISOLA REMIX - CRIS MJ x STANDLY x NICKI NICOLE x DUKI (Letra/Lyrics),MARISOLA REMIX - CRIS MJ x STANDLY x NICKI NICOLE x DUKI (Letra/Lyrics),nostalgia lyrics.,UCaxjS8mdF402rdn1hP6_1_Q,10,Music,,0,https://i.ytimg.com/vi/N4P9-PwtZl0/hqdefault.jpg,es,es,False,234,PT3M54S,hd,False,True,False,False,29656,135,0
WJc7gJZuuGQ,PE,2026-03-05T03:14:57.542608+00:00,2026-03-04T23:38:43Z,roblox best gameplay,roblox best gameplay,StanRP,UCHYA5HNaS5n4idxmP-at8nA,20,Gaming,"roblox, granny, free fire, live roblox, roblox shorts, shorts feed, 67, six seven, meme reset, singing brainrot song, great meme reset",11,https://i.ytimg.com/vi/WJc7gJZuuGQ/hqdefault.jpg,en-US,en,False,20,PT20S,hd,False,True,False,False,140527,1390,1
8_C6lXoGB5Y,PE,2026-03-05T03:14:57.542615+00:00,2026-02-25T23:20:05Z,I Just Might,I Just Might,Bruno Mars - Topic,UCZn4r7heNOPY-C43YIywnVA,10,Music,"Bruno Mars, The Romantic, I Just Might",3,https://i.ytimg.com/vi/8_C6lXoGB5Y/hqdefault.jpg,en,en,False,213,PT3M33S,hd,False,True,False,False,826797,18803,126
vheKG49Vq0A,PE,2026-03-05T03:14:57.542622+00:00,2026-03-04T22:01:02Z,🟢 El RATÓN DONNY me ATRAPO en la PUERTA ROJA!! 😱🧀😈,🟢 El RATÓN DONNY me ATRAPO en la PUERTA ROJA!! 😱🧀😈,Dipssy,UC9oLc0vRyX20e4WeoEuwHfQ,24,Entertainment,"CHUCK, CHUCK e CHEESE, Dipssy CHUCK, Dipssy ratón, CHUCK e CHEESE Dipssy, Dipssy Donny, Roblox CHUCK e CHEESE, 99 noches bosque, Fede payasos, Fede Animatronicos, Fede vigevani, Karla Bustillos, Froby, Novio de Dipssy, Mau mcmahon, Mariano Razo, Ricky limon, Gonzok, Mr beast, Alejo igoa, Terror, 3 am",22,https://i.ytimg.com/vi/vheKG49Vq0A/hqdefault.jpg,es,es-MX,False,1281,PT21M21S,hd,False,True,False,False,181737,4488,691
7ulV1ZLAwsA,PE,2026-03-05T03:14:57.542630+00:00,2026-03-01T14:45:01Z,Kapo - Ohnana (Letra/Lyrics),Kapo - Ohnana (Letra/Lyrics),Flourish,UC6HzRJFdtJxj2rpa78vEbNQ,10,Music,"kapo ohnana, kapo ohnana letra, kapo ohnana lyrics, ohnana kapo, ohnana kapo letra, ohnana kapo lyrics, ohnana letra kapo, ohnana lyrics kapo, kapo, ohnana, ohnana letra, ohnana lyrics, kapo letra ohnana, kapo oh nana, oh nana kapo, oh nanana oh nanana, kapo - ohnana, kapo - ohnana letra, kapo - ohnana lyrics, ohnana - kapo, ohnana - kapo letra, ohnana - kapo lyrics, ohnana tiktok, oh na na tiktok, letra kapo ohnana, letra ohnana kapo, oh na na letra kapo, kapo oh na na",28,https://i.ytimg.com/vi/7ulV1ZLAwsA/hqdefault.jpg,es,en,False,157,PT2M37S,hd,False,True,False,False,36245,54,0
G93z4JLbQG8,PE,2026-03-05T03:14:57.542638+00:00,2026-03-03T19:15:03Z,PUEDO SALVAR A LILY LOVEBRAIDS en POPPY PLAYTIME 5? 😮🤯,PUEDO SALVAR A LILY LOVEBRAIDS en POPPY PLAYTIME 5? 😮🤯,ChuuyMine,UCrPWiqy4AmzFruDvWONex6w,20,Gaming,"SALVE A LILY LOVEBRAIDS en POPPY PLAYTIME 5 😮🤯, SALVE A LILY LOVEBRAIDS en POPPY PLAYTIME 5, SALVE A LILY LOVEBRAIDS, POPPY PLAYTIME 5, POPPY PLAYTIME, POPPY, PLAYTIME, LILY LOVEBRAIDS, SALVE A LILY, chuuymine, chuuymine poppy playtime, poppy playtime chuuymine, chuuymine lily lovebraids, lily lovebraids chuuymine",14,https://i.ytimg.com/vi/G93z4JLbQG8/hqdefault.jpg,es,es,False,1178,PT19M38S,hd,False,True,False,False,476732,5845,996
O7NiW6oIIyI,PE,2026-03-05T03:14:57.542646+00:00,2026-03-01T16:21:17Z,Keane - Somewhere Only We Know,Keane - Somewhere Only We Know,jaded,UC912uVPZQasVhbdmb1ljN8w,10,Music,"Keane, Keane Somewhere Only We Know, Keane Somewhere Only We Know lyrics, Somewhere Only We Know, Somewhere Only We Know lyrics, lyrics, lyrics video, somewhere only we know keane lyrics, somewhere we know keane, somewhere we know, this could be the end of everything, jaded",12,https://i.ytimg.com/vi/O7NiW6oIIyI/hqdefault.jpg,en,en,False,238,PT3M58S,hd,False,True,False,False,51159,99,1
