video_id,country,fetched_at,published_at,title,localized_title,channel_title,channel_id,category_id,category_name,tags,tag_count,thumbnail,default_language,audio_language,is_live,duration,duration_raw,definition,caption_available,licensed_content,embeddable,made_for_kids,views,likes,comments
DKyvZY5zf_U,PE,2026-03-05T03:14:57.542206+00:00,2026-03-05T00:00:12Z,Shakira & Beéle - ALGO TÚ (Official Lyric Video),Shakira & Beéle - ALGO TÚ (Official Lyric Video),Shakira,UCYLNGLIzMhRTi6ZOLjAPSmw,26,Howto & Style,"Shakira, Shakira 2026, Shakira letra, Shakira video, Shakira pop, Beele, Shakira & Beele, beele 2026, beele letra, beele lyrics, shak y beele, shakira y beele video, shakira y beele letra, shakira algo tu, Shakira ALGO TÚ, Shakira ALGO TÚ letra, ALGO TÚ letra, ALGO TÚ lyrics, ALGO TÚ Shakira & Beele, Beele ALGO TU, Beele ALGO TÚ letra",21,https://i.ytimg.com/vi/DKyvZY5zf_U/hqdefault.jpg,es,en,False,214,PT3M34S,hd,False,False,False,False,90237,16363,2185
X6EHtzcmiPw,PE,2026-03-05T03:14:57.542248+00:00,2026-03-05T00:00:00Z,BTS THE COMEBACK LIVE | ARIRANG | Official Trailer | Netflix,BTS THE COMEBACK LIVE | ARIRANG | Official Trailer | Netflix,Netflix,UCWOA1ZGywLbqmigxE4Qlvuw,24,Entertainment,"Arirang, Army, BTS, BTS Army, Band, BigHit, Comeback, Concert, HYBE, Icons, Jimin, Jin, Jung Kook, Live Concert, Music, Netflix, Netflix Live, New Album, Performance, RM, Singing, Suga, j-hope",23,https://i.ytimg.com/vi/X6EHtzcmiPw/hqdefault.jpg,en,en-US,False,92,PT1M32S,hd,True,True,False,False,277028,98392,9751
-dth1x3FPcg,PE,2026-03-05T03:14:57.542260+00:00,2026-03-04T19:21:57Z,"Me Convertí en REY, pero lo ESCONDÍ de mis AMIGOS en Minecraft!","Me Convertí en REY, pero lo ESCONDÍ de mis AMIGOS en Minecraft!",Dagar,UCEs5MQjXJq27-X2vgdwtYDw,20,Gaming,"Minecraft, minecraft mod, dagar y nacho, nacho y dagar, amigos minecraft, dagar minecraft, minecraft dagar",7,https://i.ytimg.com/vi/-dth1x3FPcg/hqdefault.jpg,es,es,False,1412,PT23M32S,hd,False,True,False,False,591298,9268,517
ZYSrNXpYJLA,PE,2026-03-05T03:14:57.542270+00:00,2026-02-25T16:00:06Z,Beéle - quédate (Letra),Beéle - quédate (Letra),Urban Heartbeat,UCAekKGX2VpcHML4XHvPfN1w,22,People & Blogs,"Urban Heartbeat, Lyrics, Letra, Beéle - quédate (Letra), Beéle, quédate, quédate (Letra)",7,https://i.ytimg.com/vi/ZYSrNXpYJLA/hqdefault.jpg,es,es,False,177,PT2M57S,hd,False,True,False,False,53804,121,5
sFLHxOARswg,PE,2026-03-05T03:14:57.542279+00:00,2026-03-04T19:30:42Z,"LINTERNAS Tráiler Español Latino (2026) Linterna Verde, DC","LINTERNAS Tráiler Español Latino (2026) Linterna Verde, DC",ONE Media Español,UCcVNDl7ZJMf9lC9a34CY4RA,1,Film & Animation,"Tráiler, Película, Español, Latino, 2026, Linternas, Linternas Tráiler, DC, Kyle Chandler, Aaron Pierre, Linterna Verde",11,https://i.ytimg.com/vi/sFLHxOARswg/hqdefault.jpg,es,es,False,151,PT2M31S,hd,False,True,False,False,107399,7972,754
S7SA7jVi6oM,PE,2026-03-05T03:14:57.542287+00:00,2026-03-04T18:38:28Z,FAMILIA ELEMENTAL de AGUA vs FUEGO en Brookhaven Roblox,FAMILIA ELEMENTAL de AGUA vs FUEGO en Brookhaven Roblox,Lyna,UC-cnbLlplnXA4oc7rR21qzg,20,Gaming,,0,https://i.ytimg.com/vi/S7SA7jVi6oM/hqdefault.jpg,es-419,es-419,False,1217,PT20M17S,hd,False,True,False,False,322529,6616,561
6zqivy_xRqE,PE,2026-03-05T03:14:57.542296+00:00,2026-02-27T21:00:15Z,Rema - Calm Down (Lyrics),Rema - Calm Down (Lyrics),Moonshine,UCJX7Etv7ISmc-uWMkxpOngA,10,Music,"baby calm down song, calm down, calm down lyrics, lyrics calm down, rema, lyrics, rema calm down, calm down rema, rema calm down lyrics, lyrics rema calm down, rema lyrics, lyric rema, rema lyrics calm down, calm down lyrics rema, lyrics calm down rema, calm down rema lyrics, baby calm down, calm down calm down, girl this your body e put my heart for lockdown, girl you sweet like fanta, sweet like fanta, baby calm down calm down, shawty come give me your love love love, pop",24,https://i.ytimg.com/vi/6zqivy_xRqE/hqdefault.jpg,en,en,False,220,PT3M40S,hd,False,True,False,False,617236,1812,12
Z1jcPlGXnMo,PE,2026-03-05T03:14:57.542305+00:00,2026-03-04T19:01:44Z,Lanterns  | Official Teaser | HBO Max,Lanterns  | Official Teaser | HBO Max,HBO Max,UCx-KWLTKlB83hDI6UKECtJQ,24,Entertainment,"hbo max, hbo, hbo originals, hbo original series, hbo trailer, new on hbo, max, hbo max originals, hbo max trailer, hbo max teaser, hbo max series, hbo max youtube",12,https://i.ytimg.com/vi/Z1jcPlGXnMo/hqdefault.jpg,en,en,False,141,PT2M21S,hd,True,True,False,False,929213,67312,5959
Z6mXLpz3lNc,PE,2026-03-05T03:14:57.542313+00:00,2026-03-04T19:41:56Z,ME ENFRENTO AL PROTOTIPO Y A LILY LOVEBRAIDS Y LOS TROLLEAMOS EN ROBLOX | JONDRES GC,ME ENFRENTO AL PROTOTIPO Y A LILY LOVEBRAIDS Y LOS TROLLEAMOS EN ROBLOX | JONDRES GC,Jondres Gc,UCEtD_nOAZeTzb5dcln-ljOA,24,Entertainment,"JONDRES, JONDRES GC, LILY, LILY LOVEBRAIDS, DESMENTI 30 MITOS SECRETOS DE LILY LOVEBRAIDS, DESMENTI 30 MITOS SECRETOS DE POPPY PLAYTIME, POPPY PLAYTIME CHAPTER 5, SALVO A LILY LOVEBRAIDS EN POPPY PLAYTIME 5, POPPY PLAYTIME 5, SALVO A LILY LOVEBRAIDS Y DESBLOQUEÉ SUS VERSIONES SECRETAS, ROBLOX, ME ENFRENTO AL PROTOTIPO Y A LILY LOVEBRAIDS Y LOS TROLLEAMOS EN ROBLOX, EL PROTOTIPO",13,https://i.ytimg.com/vi/Z6mXLpz3lNc/hqdefault.jpg,es,es-419,False,2169,PT36M9S,hd,False,True,False,False,307300,23643,933
Ex-SPuzEbOI,PE,2026-03-05T03:14:57.542321+00:00,2026-03-03T21:45:00Z,Maná - Mariposa Traicionera (Letra),Maná - Mariposa Traicionera (Letra),Euphoric.,UCHjNB_ZZntUsR-LkhAQUR7A,10,Music,,0,https://i.ytimg.com/vi/Ex-SPuzEbOI/hqdefault.jpg,es,es,False,266,PT4M26S,hd,False,True,False,False,49064,237,2
IRVt9UhWGMY,PE,2026-03-05T03:14:57.542329+00:00,2026-03-04T19:39:38Z,"Podrá ser una GRAN serie, pero esto NO parece GREEN LANTERN 🤦‍♂️ Reacción Teaser LANTERNS","Podrá ser una GRAN serie, pero esto NO parece GREEN LANTERN 🤦‍♂️ Reacción Teaser LANTERNS",La botella de Kandor,UCM8KpBHVy_luxLQV7KoXFtA,1,Film & Animation,"lanterns trailer reaccion, lanterns hbo trailer, lanterns teaser reaccion, lanterns teaser trailer reaccion, lanterns hbo teaser, lanterns trailer analisis, lanterns dc studios, lanterns hbo, lanterns serie, green lantern hbo serie, lanterns hbo max, linternas trailer reaccion, linternas teaser reaccion, linternas trailer analisis, linternas teaser analisis, Hal Jordan lanterns, john Stewart trailer, la botella de kandor reaccion lanterns, reaccion lanterns",19,https://i.ytimg.com/vi/IRVt9UhWGMY/hqdefault.jpg,es,es,False,1164,PT19M24S,hd,False,True,False,False,34430,3425,873
_lynxVQGLCI,PE,2026-03-05T03:14:57.542337+00:00,2026-03-04T19:35:00Z,CUAL DE LOS BROS ROBARA MAS BRAINROTS DIVINOS EN ESCAPA DEL TSUNAMI!🪼,CUAL DE LOS BROS ROBARA MAS BRAINROTS DIVINOS EN ESCAPA DEL TSUNAMI!🪼,ElAbrahaham,UColTsB6zogXWooPbeO67Wgw,20,Gaming,"abrahahamflores, stream, entretenimiento, divertido, risa, gracioso, gamer, videojuegos, elabrahaham, copilacion, videos graciosos, antes vs ahora, mexico vs usa, abrahaham, directos, shorts, tiktoks, streams, twitch, reaccion, reacciones",21,https://i.ytimg.com/vi/_lynxVQGLCI/hqdefault.jpg,es-MX,es-419,False,1106,PT18M26S,hd,False,True,False,False,334000,13918,1963
a2mBKC5Unmg,PE,2026-03-05T03:14:57.542345+00:00,2026-02-28T17:31:34Z,Romeo Santos - Imitadora (Sub. Español + Lyrics),Romeo Santos - Imitadora (Sub. Español + Lyrics),LyricHype,UCkv7SZPuRT6BZu06HFz9cKw,22,People & Blogs,"Imitadora Letra, Imitadora, Romeo Santos Imitadora, Imitadora Romeo Santos, Romeo Santos, imitadora, imitadora letra, imitadora romeo santos, romeo santos imitadora, romeo santos, Sospecho plagio a mi señora mala imitadora, mala imitadora, Mala Imitadora, Esta noche me hago el interrogante, Y le pongo fin a la impostora usurpadora, Exijo contigo una entrevista, Dime, tengo unas preguntas, Número de alojamiento donde yo te hice mujer, ¿Qué me enciende en el sexo?, letra, Letra, latin",23,https://i.ytimg.com/vi/a2mBKC5Unmg/hqdefault.jpg,es,es,False,236,PT3M56S,hd,False,True,False,False,71454,159,8
ZmXJnIGPNh8,PE,2026-03-05T03:14:57.542353+00:00,2026-03-04T16:55:06Z,Invincible - Season 4 Thragg Teaser | Prime Video,Invincible - Season 4 Thragg Teaser | Prime Video,Invincible,UC_-U9awQQm_GMJtR2mBhJPg,1,Film & Animation,"Invincible, Amazon Prime, Thragg, Thragg Teaser, Invincible Season 4, Invincible Thragg, Invincible Season 4 Thragg, Invincible Thragg teaser, Invincible S4 Thragg, Invincible S4 Thragg teaser, invincible season 4 thragg teaser, Prime Video, Invincible Prime, Invincible Prime Video",14,https://i.ytimg.com/vi/ZmXJnIGPNh8/hqdefault.jpg,en,en-US,False,31,PT31S,hd,False,False,False,False,713777,48176,2624
EiJeH7g9S9M,PE,2026-03-05T03:14:57.542361+00:00,2026-03-04T21:15:01Z,ESCAPA DEL MEGA TSUNAMI DE POPPY PLAYTIME COMPLETO (ESCAPE TSUNAMI FOR POPPY PLAYTIME ROBLOX),ESCAPA DEL MEGA TSUNAMI DE POPPY PLAYTIME COMPLETO (ESCAPE TSUNAMI FOR POPPY PLAYTIME ROBLOX),Chuy Mine,UCrppUjIbcQjh2Drz8UyuRVg,20,Gaming,"chuymine, chuy mine, ESCAPA DEL MEGA TSUNAMI DE POPPY PLAYTIME COMPLETO, ESCAPA DEL MEGA TSUNAMI DE POPPY PLAYTIME, ESCAPA DEL MEGA TSUNAMI, MEGA TSUNAMI DE POPPY PLAYTIME, MEGA TSUNAMI DE POPPY PLAYTIME COMPLETO, TSUNAMI DE POPPY PLAYTIME, POPPY PLAYTIME COMPLETO, POPPY PLAYTIME, ESCAPE TSUNAMI FOR POPPY PLAYTIME ROBLOX, ESCAPE TSUNAMI FOR POPPY PLAYTIME, ROBLOX, ESCAPE TSUNAMI, POPPY PLAYTIME ROBLOX",15,https://i.ytimg.com/vi/EiJeH7g9S9M/hqdefault.jpg,es,es,False,1424,PT23M44S,hd,False,True,False,False,169025,2095,170
h_jhlgFGMds,PE,2026-03-05T03:14:57.542368+00:00,2026-02-25T17:18:53Z,Beéle - quédate (Letra),Beéle - quédate (Letra),LatinoPlay,UCsMWT0jvOWkg-4EE55vSIpQ,22,People & Blogs,"Beele - quedate (Letra), beéle quédate, beéle, quédate beéle, letra beéle quédate, quédate, letra quédate, beéle letra, beéle quédate letra, quédate beéle letra, quédate letra beéle, letra quédate beéle, quedate beele letra, quédate letra, beéle quédate letra lyrics, beele quedate letra, beele, quedate beele, letra, beele quedate, beéle - quédate (letra), si mañana me muero letra, borondo beéle letra, la plena beéle, borondo beéle, beéle borondo letra, ven quédate quedate",27,https://i.ytimg.com/vi/h_jhlgFGMds/hqdefault.jpg,es,es,False,177,PT2M57S,hd,False,True,False,False,106083,85,2
9uLXNN17HeI,PE,2026-03-05T03:14:57.542376+00:00,2026-03-04T20:15:59Z,¡VEMOS Y COMENTAMOS EL TRÁILER DE LANTERNS! ,¡VEMOS Y COMENTAMOS EL TRÁILER DE LANTERNS! ,De todo un Paco,UCh4x2sW7hf59JiQKed2GuDw,24,Entertainment,,0,https://i.ytimg.com/vi/9uLXNN17HeI/hqdefault.jpg,es,es,False,564,PT9M24S,hd,False,True,False,False,15939,1842,266
vnwh2WToCL8,PE,2026-03-05T03:14:57.542383+00:00,2026-03-04T18:23:13Z,"GASTAMOS 300,000 ROBUX para conseguir el NUEVO SECRETO en ROBA UN BRAINROT…","GASTAMOS 300,000 ROBUX para conseguir el NUEVO SECRETO en ROBA UN BRAINROT…",Betillo,UC8st6FaRPJcQXCvJk31caQA,20,Gaming,"roblox, roblox español, ROBLOX, mejores brainrots, elabrahaham, el simio mayor, juanpablohollman, betillo, soybetilloelguapillo, soybetillo, tio betillo, 99 noches, los bros, los bros roblox, bros, admin abuse, admin abuse indonesia, admin abuse halloween",18,https://i.ytimg.com/vi/vnwh2WToCL8/hqdefault.jpg,es,es,False,1343,PT22M23S,hd,False,True,False,False,321650,12438,711
0y5yloj44Io,PE,2026-03-05T03:14:57.542391+00:00,2026-03-04T14:43:12Z,Bruno Mars - Risk It All (Sub. Español + Lyrics),Bruno Mars - Risk It All (Sub. Español + Lyrics),jostland.,UC1qMwcumipfgTLd3TA1vVZg,10,Music,"risk it all bruno mars, risk it all bruno mars español, risk it all bruno mars lyrics, risk it all bruno mars reaccion, risk it all bruno mars reaction, risk it all bruno mars karaoke, risk it all bruno mars sub, bruno mars risk it all, bruno mars risk it all subtitulada español, bruno mars risk it all reaction, bruno mars risk it all reaccion, bruno mars risk it all lyrics, bruno mars risk it all subtitulada ingles, bruno mars risk it all traducida, español, sub español, jostland",17,https://i.ytimg.com/vi/0y5yloj44Io/hqdefault.jpg,es,es,False,206,PT3M26S,hd,False,True,False,False,28978,801,19
r0KrNTCEfyk,PE,2026-03-05T03:14:57.542399+00:00,2026-03-04T19:39:30Z,LINTERNAS Tráiler Español Latino (2026) Linterna Verde,LINTERNAS Tráiler Español Latino (2026) Linterna Verde,FilmSelect Español,UCEakdPLL42qApJnoeWCwo2Q,1,Film & Animation,,0,https://i.ytimg.com/vi/r0KrNTCEfyk/hqdefault.jpg,es,es,False,146,PT2M26S,hd,False,True,False,False,15390,763,56
CHeceFNIObE,PE,2026-03-05T03:14:57.542406+00:00,2026-03-04T17:38:57Z,ATRAPANDO BRAINROTS en BARCO en Roblox!,ATRAPANDO BRAINROTS en BARCO en Roblox!,Dagar Roblox,UCmkyN2GfMyR7gsIiKBCR3nw,20,Gaming,"roblox, roblox dagar, roblox nacho, nacho y dagar, dagar y nacho",5,https://i.ytimg.com/vi/CHeceFNIObE/hqdefault.jpg,es,es,False,1230,PT20M30S,hd,False,True,False,False,236258,3238,187
vChbtu-Mlnk,PE,2026-03-05T03:14:57.542413+00:00,2026-03-02T18:00:06Z,Ricardo Arjona - Historia De Taxi (Letra),Ricardo Arjona - Historia De Taxi (Letra),Bold Retro,UCXq83cSvDmYJ2a-MOmjjSSQ,22,People & Blogs,"BOLDRETRO, LETRA, lyrics, RETRO, CLASICOS, 80shits, 90shits, retroclassic, throwbackmusic, oldiesbutgoldies, musicaenespañol, englishclassics, nostalgia80, nostalgia90, Ricardo Arjona, Historia De Taxi, Historia De Taxi (Letra), Ricardo Arjona - Historia De Taxi, Ricardo Arjona - Historia De Taxi (Letra)",19,https://i.ytimg.com/vi/vChbtu-Mlnk/hqdefault.jpg,es,es,False,369,PT6M9S,hd,False,True,False,False,80564,121,2
VgjmzpRkSQ4,PE,2026-03-05T03:14:57.542421+00:00,2026-03-04T17:00:50Z,El polémico trailer de SCARY MOVIE 6,El polémico trailer de SCARY MOVIE 6,RottenMind,UC5Zd7VZ3V4b0ChUjfnBBFVA,1,Film & Animation,"RottenMInd, Rotten, Sinkope, Rotten Mind, Video, Resumen, Resumen película, Resumen Terror, Peliculas de terror, scary movie 6, scary movie 6 reaccion, scary movie 6 reaction, scary movie 6 trailer reaction, reaccion scary movie 6, scary movie 6 trailer, scary movie 6 pelicula, scary movie 6 estreno, scary movie 6 parodia, scary movie saga, scary movie nueva pelicula, scary movie 2026, scary movie parodia terror, scary movie humor terror, scary movie primeras impresiones",24,https://i.ytimg.com/vi/VgjmzpRkSQ4/hqdefault.jpg,es,es,False,656,PT10M56S,hd,False,True,False,False,13119,1786,272
14BEgV9Zj0M,PE,2026-03-05T03:14:57.542428+00:00,2026-03-04T20:15:26Z,Sobrevivi Al Prototipo 1006 En Mi Mundo De Minecraft / Poppy Playtime 5 Minecraft Mod,Sobrevivi Al Prototipo 1006 En Mi Mundo De Minecraft / Poppy Playtime 5 Minecraft Mod,Omenasito,UC0C8Zen__w6b16cN2KecZig,20,Gaming,"minecraft, 100 dias, cave dweller, minecraft terror, the one who watches, mod miedo, mod terror, minecraft miedo, horror, mod, night dweller, fnaf, terror, mods, mundo enigma, omenaso, omenasote, omenasito, the knocker, siren head, mimicer, nuevo mod, scp, scp 096, cartoon dog, cartoon cat, huggy wuggy, poppy playtime, poppy playtime 5, poppy playtime capitulo 5, poppy playtime 5 trailer, poppy 5, prototipo, experimento 1102, lily lovebraids, withered huggy wuggy, el prototipo 1006",37,https://i.ytimg.com/vi/14BEgV9Zj0M/hqdefault.jpg,es,es,False,1741,PT29M1S,hd,False,True,False,False,265685,11053,854
yebWZqPnLCw,PE,2026-03-05T03:14:57.542436+00:00,2026-03-03T16:00:06Z,Reik - Creo En Ti (Letra / Lyrics),Reik - Creo En Ti (Letra / Lyrics),Luis Jams,UCYQhU-86MD7ZWjGyuzyPgvw,10,Music,"sub español, subtitulada al español, traducida al español, traducción, traducido, subtítulos, subtitulado, letra, lyrics, hq, hd, topic, reik, creo en ti, peligro, álbum, 2011",17,https://i.ytimg.com/vi/yebWZqPnLCw/hqdefault.jpg,es,es,False,167,PT2M47S,hd,False,True,False,False,48455,163,10
HMTKiPCKgpw,PE,2026-03-05T03:14:57.542443+00:00,2026-03-02T14:39:21Z,"Scary Movie: Terroríficamente Incorrecta | Tráiler (DOBLADO) | Junio 4, solo en cines","Scary Movie: Terroríficamente Incorrecta | Tráiler (DOBLADO) | Junio 4, solo en cines",PARAMOUNT PICTURES MÉXICO,UCwTKziMccZoy631_wbxk8wg,1,Film & Animation,#paramount #paramountmexico,1,https://i.ytimg.com/vi/HMTKiPCKgpw/hqdefault.jpg,es,es,False,126,PT2M6S,hd,False,True,False,False,2724265,37746,2121
tdxUMotsqd8,PE,2026-03-05T03:14:57.542450+00:00,2026-03-04T18:20:00Z,ADOPTADOS POR UNA FAMILIA MILLONARIA!! 😱😱 (BROOKHAVEN) ,ADOPTADOS POR UNA FAMILIA MILLONARIA!! 😱😱 (BROOKHAVEN) ,Celynnei ,UCYEo6EXGbW4Wwx3qxipk4Xg,20,Gaming,"Celynnei, CelynneiYT, Cely, Roblox, Celiney, mm2, murdermystery2, robloxmomentosdivertidos, momentosdivertidos, robloxcomedia, robloxjuegos, robloxgameplay, robloxgames, celyroblox",14,https://i.ytimg.com/vi/tdxUMotsqd8/hqdefault.jpg,es,,False,780,PT13M,hd,False,True,False,False,123031,6571,570
OXPoAJA9Pho,PE,2026-03-05T03:14:57.542458+00:00,2026-02-26T19:00:32Z,Maluma & Carin Leon - Según Quién (LETRA),Maluma & Carin Leon - Según Quién (LETRA),Pisteo y Compas,UCOR388rvRFC5o6-dAvNcDNA,22,People & Blogs,"Maluma, Carin León, Según Quién, Maluma Según Quién, Carin León Según Quién, Segun Quien lyrics, Maluma Carin Leon, regional mexicano pop, música latina 2026, canciones de despecho, video lyrics español, según quién letra",12,https://i.ytimg.com/vi/OXPoAJA9Pho/hqdefault.jpg,es,es,False,143,PT2M23S,hd,False,True,False,False,183080,114,1
0D6eswBTSa0,PE,2026-03-05T03:14:57.542466+00:00,2026-03-02T14:00:05Z,ONE PIECE: Temporada 2 | Tráiler final | Netflix,ONE PIECE: Temporada 2 | Tráiler final | Netflix,Netflix Latinoamérica,UC5ZiUaIJ2b5dYBYGf5iEUrA,24,Entertainment,"10 de marzo, Action, Chopper, Fantasy, Final, Gran Ruta, Grand Line, Hype, Launch, Live Action, Luffy, March 10th, Netflix, One Piece, Series, Trailer, Trailer 2, Wapol, Zoro, acción, acción con actores reales, anticipación, estreno, fantasia, final, serie, tráiler, tráiler 2",28,https://i.ytimg.com/vi/0D6eswBTSa0/hqdefault.jpg,es,en-US,False,104,PT1M44S,hd,False,False,False,False,348051,8502,322
MdSD_yHHOJI,PE,2026-03-05T03:14:57.542473+00:00,2026-03-04T00:17:10Z,"Tsunami Brainrot pero, tengo SALTO ADMIN?!","Tsunami Brainrot pero, tengo SALTO ADMIN?!",SoySpeedy,UC27AkLQVEsTEUeRUNf6BxiA,20,Gaming,"roblox, roblox brainrot, brainrot, escapa del tsunami, speedy, speedyymilo, soyspeedy, speedyroblox, Tsunami Brainrot pero, tengo SALTO SONIC?!",10,https://i.ytimg.com/vi/MdSD_yHHOJI/hqdefault.jpg,es,es,False,1073,PT17M53S,hd,False,True,False,False,522060,4069,114
eflFaxAzr_8,PE,2026-03-05T03:14:57.542481+00:00,2026-02-26T10:30:32Z,"Romeo Santos, Prince Royce - Dardos (Letra/Lyrics)","Romeo Santos, Prince Royce - Dardos (Letra/Lyrics)",Stringo Music,UCACvr3I_F20MZD2r2IsuxHA,10,Music,"prince royce dardos lyrics, romeo santos dardos, dardos, dardos Letra, Letra dardos, romeo santos, Letra, lyrics, prince royce, dardos romeo santos, romeo santos dardos Letra, romeo santos dardos Lyrics, prince royce dardos, prince royce dardos Letra, romeo santos prince royce dardos, romeo santos prince royce dardos Letra, Por poquito te olvido de verdad, ya había dejado la bebida, La señal que continúa mi mala racha, tus llamadas perdidas, romeo, santos, prince, royce, latin, pop",26,https://i.ytimg.com/vi/eflFaxAzr_8/hqdefault.jpg,en-US,en-US,False,244,PT4M4S,hd,False,True,False,False,26968,38,1
vcat6gGVLD4,PE,2026-03-05T03:14:57.542488+00:00,2026-03-02T18:15:23Z,27 COSAS que NO VISTE en el TRAILER de SCARY MOVIE 6,27 COSAS que NO VISTE en el TRAILER de SCARY MOVIE 6,El Dojo del Geek,UCSDGniOKSQrpWcaS0MK07eQ,1,Film & Animation,"scary movie, scary movie 6, trailer de scary movie 6, scary movie 6 trailer explicado, cosas que no viste en el trailer de scary movie 6, todo lo que no viste en el trailer de scary movie 6, scary movie 6 resumen, todas las peliculas que parodia scary movie 6, parodias de scary movie 6, ghostface scary movie 6, wazaaa, wazaaaa scary movie 6, scary movie 6 trailer en español, el dojo del geek, scary movie 6 el dojo del geek",15,https://i.ytimg.com/vi/vcat6gGVLD4/hqdefault.jpg,es,es,False,676,PT11M16S,hd,False,True,False,False,215884,7132,347
vc8xbA7TeEk,PE,2026-03-05T03:14:57.542496+00:00,2026-03-04T19:30:29Z,Sobreviví SIN SACO en 99 NOCHES en el BOSQUE ROBLOX...,Sobreviví SIN SACO en 99 NOCHES en el BOSQUE ROBLOX...,SoyPato,UCFP33-zlNfJVzWUUbdhSjTQ,20,Gaming,"roblox, roblox español, roblox divertido, roblox fyp, roblox humor, roblox momentos divertidos, roblox roblox, roblox funny, roblox 99 noches en el bosque, 99 noches en el bosque, sobrevive 99 dias en el bosque, 99 noches en el bosque roblox, soypato, soypato 99 noches, creador de 99 noches, rompi 99 noches, 99 noches sin saco, 99 noches sin usar el saco, 99 noches sin usar saco, 99 noches en el bosque sin saco, soypato sin saco, soy pato sin saco, soy pato sin usar saco",23,https://i.ytimg.com/vi/vc8xbA7TeEk/hqdefault.jpg,es,es,False,979,PT16M19S,hd,False,True,False,False,213712,5582,1713
H-NmAQTIJvg,PE,2026-03-05T03:14:57.542503+00:00,2026-03-04T17:53:48Z,LOBO DOMESTICADO ♪  - Orquesta ZAPEROKO La Resistencia Salsera del Callao,LOBO DOMESTICADO ♪  - Orquesta ZAPEROKO La Resistencia Salsera del Callao,Orquesta Zaperoko La Resistencia Salsera del Callao,UCYlcvM8co8a7VLLY2Bl-WTw,10,Music,"Zaperoko, Resistencia salsera del callao, Salsa Callao, Salsa sensual, Mala mujer, la revancha, chalacos, sport boys, barracones, las caras de atahualpa, salsa perucha, Perú, barrio, La Resistencia Salsera del callao, callao, salsa peruana, puerto rico, radiomar, panamericana, la kalle, colombia, zaperoko, mexico, ecuador, barrio castilla, monumental, cuba, barrio de la salsa, bellavista, zaperokito, medellin, mirador la perla, lobo domesticado, tommy olivencia, joan sebastian",35,https://i.ytimg.com/vi/H-NmAQTIJvg/hqdefault.jpg,es,es-419,False,298,PT4M58S,hd,False,False,False,False,4064,255,27
7QIu842Z7Xg,PE,2026-03-05T03:14:57.542511+00:00,2026-03-02T20:36:03Z,TODAS las REFERENCIAS Y SECRETOS en el TRAILER de SCARY MOVIE 6,TODAS las REFERENCIAS Y SECRETOS en el TRAILER de SCARY MOVIE 6,CharlieTales,UCOQ-ru8bJZSj_gqDyO9r1dQ,1,Film & Animation,"scary movie 6, charlietales, charlietales final explicado, scary movie, scary movie 6 trailer, scary movie película, scary movie 2026, scary movie 6 trailer español, scary movie trailer, scary movie 6 español, scary movie película completa, scary movie online, scary movie 6 teaser, scary movie 6 promo, scary movie 6 estreno, scary movie 6 trailer latino, shorty, scary movie nueva película, Scary Movie 6, Scary Movie 6 tráiler filtrado, Ghostface Scary Movie 6, Ray Ghostface",22,https://i.ytimg.com/vi/7QIu842Z7Xg/hqdefault.jpg,es,es,False,549,PT9M9S,hd,False,True,False,False,214024,5461,152
Tc9MauJmiY0,PE,2026-03-05T03:14:57.542518+00:00,2026-03-04T21:15:39Z,LILY LOVEBRAIDS: 50 Cosas que NO SABÍAS en POPPY PLAYTIME CHAPTER 5,LILY LOVEBRAIDS: 50 Cosas que NO SABÍAS en POPPY PLAYTIME CHAPTER 5,WIZZY,UCDCIcjLEmAsjQ60j9xFv-sg,24,Entertainment,,0,https://i.ytimg.com/vi/Tc9MauJmiY0/hqdefault.jpg,es,es,False,1097,PT18M17S,hd,False,True,False,False,150589,7497,267
BM-vtDSnB38,PE,2026-03-05T03:14:57.542525+00:00,2026-03-02T16:00:06Z,Eddie Santiago - Que Locura Enamorarme De Ti (Letra),Eddie Santiago - Que Locura Enamorarme De Ti (Letra),LatinFest,UCVIoVDpyhehbhm76izCTM1w,22,People & Blogs,"Latin, LatinFest, Lyrics, Letra, Eddie Santiago - Que Locura Enamorarme De Ti (Letra), Eddie Santiago - Que Locura Enamorarme De Ti, Que Locura Enamorarme De Ti (Letra), Que Locura Enamorarme De Ti",8,https://i.ytimg.com/vi/BM-vtDSnB38/hqdefault.jpg,es,es,False,307,PT5M7S,hd,False,False,False,False,204639,587,2
Bl2mW9YtazM,PE,2026-03-05T03:14:57.542532+00:00,2026-03-02T14:48:50Z,SCARY MOVIE 6: TERRORÍFICAMENTE INCORRECTA Tráiler Oficial Español Latino (2026),SCARY MOVIE 6: TERRORÍFICAMENTE INCORRECTA Tráiler Oficial Español Latino (2026),Trailers In Spanish,UCkpS96fmTFa8gGVWJx2uVAA,1,Film & Animation,"Película, tráiler, 2026, tráiler de película, tráilers de películas, tráiler de película 2026, tráilers de películas 2026, nueva película, nuevas películas, nuevos tráilers de películas, nuevos tráilers de películas 2026, nuevas películas 2026, mejores películas, mejores películas 2026, mejores próximos estrenos, mejores próximos estrenos 2026, mejores tráilers de películas nuevas, recopilación de tráilers de películas, mejores películas para ver, los mejores próximos estrenos",20,https://i.ytimg.com/vi/Bl2mW9YtazM/hqdefault.jpg,es,es,False,146,PT2M26S,hd,False,True,False,False,75552,3168,298
Neq0o5sryG0,PE,2026-03-05T03:14:57.542540+00:00,2026-03-04T15:00:46Z,PONGO MI VOZ A ESTOS ANIMALES | MyVoiceZoo,PONGO MI VOZ A ESTOS ANIMALES | MyVoiceZoo,Iker Unzu,UCQW8tWGYajwUv6jdQ2kmsRw,20,Gaming,"iker unzu, iker tiktok, iker unzu tiktok, iker, comedia, sketches de comedia, iker comedia, MyVoiceZoo, Zoo, Zoológico, Animales, Cabra",12,https://i.ytimg.com/vi/Neq0o5sryG0/hqdefault.jpg,es,es,False,1902,PT31M42S,hd,False,True,False,False,433470,27516,3456
Ex7VNih4UWQ,PE,2026-03-05T03:14:57.542547+00:00,2026-02-28T12:37:58Z,Romeo Santos - Cancioncitas de Amor (Letra),Romeo Santos - Cancioncitas de Amor (Letra),Alligator Lyrics,UC0Nd9eBGpXJ7Cvz_ncLsvvA,10,Music,,0,https://i.ytimg.com/vi/Ex7VNih4UWQ/hqdefault.jpg,es,es,False,238,PT3M58S,hd,False,True,False,False,63587,93,2
0u3DgJ_9K24,PE,2026-03-05T03:14:57.542554+00:00,2026-03-04T23:00:08Z,Sobreviviendo 99 AÑOS como Un BLOOP en Minecraft!,Sobreviviendo 99 AÑOS como Un BLOOP en Minecraft!,Awita,UC62nFXtc3KNujp9LCPJt-sA,20,Gaming,,0,https://i.ytimg.com/vi/0u3DgJ_9K24/hqdefault.jpg,es,es-419,False,1855,PT30M55S,hd,False,True,False,False,100464,2939,432
