video_id,country,fetched_at,published_at,title,localized_title,channel_title,channel_id,category_id,category_name,tags,tag_count,thumbnail,default_language,audio_language,is_live,duration,duration_raw,definition,caption_available,licensed_content,embeddable,made_for_kids,views,likes,comments
NYT5zzex7yo,PG,2026-06-23T04:42:10.059799+00:00,2026-06-06T17:32:33Z,Lewa,Lewa,Release - Topic,UCfYl5z9Adiebm1dcdVCcEZQ,10,Music,"Jnr Vigi, Liz Vamarasi, Lewa",3,https://i.ytimg.com/vi/NYT5zzex7yo/hqdefault.jpg,en,,False,236,PT3M56S,hd,False,True,False,False,96630,2618,0
xZUavocHU2g,PG,2026-06-23T04:42:10.059843+00:00,2026-06-22T02:13:29Z,House of the Dragon | S3 Weeks Ahead Trailer | HBO Max,House of the Dragon | S3 Weeks Ahead Trailer | HBO Max,GameofThrones,UCQzdMyuz0Lf4zo4uGcEujFw,24,Entertainment,,0,https://i.ytimg.com/vi/xZUavocHU2g/hqdefault.jpg,en,en,False,133,PT2M13S,hd,True,False,False,False,563931,12721,1111
OjOTclvjPw0,PG,2026-06-23T04:42:10.059856+00:00,2026-06-21T17:42:08Z,INFINITE ADDICTION = INFINITE MONEY | Scritchy Scratchy,INFINITE ADDICTION = INFINITE MONEY | Scritchy Scratchy,Markiplier,UC7_YxT-KID8kRbqZo7MyscQ,20,Gaming,"markiplier, scritchy scratchy game, scritchy scratchy ending, tickets, scratch off, satisfying game, clicker game, inifinite clicker, cookie clicker, idle game, lets play, playthrough, walkthrough, gameplay, gaming",15,https://i.ytimg.com/vi/OjOTclvjPw0/hqdefault.jpg,en,en,False,3513,PT58M33S,hd,False,True,False,False,1368231,79766,3151
oY4qlsP2FxY,PG,2026-06-23T04:42:10.059891+00:00,2026-06-15T17:02:31Z,"LOVIXX, STOSLIV - Don't tell your dreams (Tik tok hit)","LOVIXX, STOSLIV - Don't tell your dreams (Tik tok hit)",STOSLIV,UCHDByzNs5ejIa-ZJGHfA5CQ,22,People & Blogs,,0,https://i.ytimg.com/vi/oY4qlsP2FxY/hqdefault.jpg,en,uk,False,142,PT2M22S,hd,False,True,False,False,689268,24553,181
lbr8yc1_ljQ,PG,2026-06-23T04:42:10.059901+00:00,2026-06-21T20:57:44Z,Spider-Man Brand New Day Trailer: New Powers & Abilities Breakdown,Spider-Man Brand New Day Trailer: New Powers & Abilities Breakdown,Emergency Awesome,UCDiFRMQWpcp8_KD4vwIVicw,24,Entertainment,,0,https://i.ytimg.com/vi/lbr8yc1_ljQ/hqdefault.jpg,en,en,False,746,PT12M26S,hd,True,True,False,False,169782,5029,589
XyJ8jGjogic,PG,2026-06-23T04:42:10.059909+00:00,2026-06-21T19:13:27Z,Being a Burglin' Gnome is harder than it looks...,Being a Burglin' Gnome is harder than it looks...,SMii7Yplus,UC-gW4TeZAlKm7UATp24JsWQ,20,Gaming,"smii7y, smii7yplus, smii7y+, smii7y plus, burglin gnomes, burglin gnomes game, burglin gnomes multiplayer, burglin gnomes gameplay, heist game, online co-op game, pc multiplayer game, lethal company like games, weird steam games, funny steam games, burglin gnomes funny moments, burglin gnomes funny, gnome game, burgling gnomes",18,https://i.ytimg.com/vi/XyJ8jGjogic/hqdefault.jpg,en,en,False,2245,PT37M25S,hd,False,True,False,False,1385459,76644,2047
rxyNUVQQOz8,PG,2026-06-23T04:42:10.059917+00:00,2026-06-19T02:00:06Z,"Sean Rii, Wally Pazzi - No Other Love (Official Music Video)","Sean Rii, Wally Pazzi - No Other Love (Official Music Video)",SeanRiiVEVO,UCl2L_-850syeto2fO8fQkzA,10,Music,"Sean Rii, Solomon Islands, reggae music, Pacific reggae, island reggae, roots reggae, reggae 2024, island vibes, tropical music, Pacific music, South Pacific reggae, Solomon Islands music, reggae fusion, chill reggae, island beats, feel-good reggae, reggae playlist, reggae love songs, Polynesian music, Melanesian music, island life, reggae hits, Pacific artists, Pacific grooves, RnB reggae, smooth reggae, best reggae songs, Sean Rii type beat, dj noiz",29,https://i.ytimg.com/vi/rxyNUVQQOz8/hqdefault.jpg,en,,False,163,PT2M43S,hd,False,True,False,False,49494,2668,302
3kMr6JCbppI,PG,2026-06-23T04:42:10.059926+00:00,2026-06-21T13:03:17Z,THROUGH THE CRACKS // Summit Official Map Reveal Trailer - VALORANT,THROUGH THE CRACKS // Summit Official Map Reveal Trailer - VALORANT,VALORANT,UC8CX0LD98EDXl4UYX1MDCXg,20,Gaming,"Summit, Summit Map, New Map, New VALORANT Map, China, Chinese Map, VALORANT trailer, VALORANT, VALORANT game, valorant act IV, Season 2026, S26, VALORANT act 4, fps, shooters, tactical FPS, launch, Sage, Miks, Skye, Reyna, Viper, Iso, Through the Cracks",24,https://i.ytimg.com/vi/3kMr6JCbppI/hqdefault.jpg,en,en-US,False,186,PT3M6S,hd,False,True,False,False,583840,40725,1733
F8SKbLtJhUU,PG,2026-06-23T04:42:10.059935+00:00,2026-06-21T22:00:32Z,We’re Trying New Spots (Meccha Chameleon),We’re Trying New Spots (Meccha Chameleon),CaseOh,UC63anZxfVGHUEmfBAf5w7pw,20,Gaming,"gaming, caseoh, caseohgames, case, funny, streamer, horror, horror gaming, scary, jumpscare",10,https://i.ytimg.com/vi/F8SKbLtJhUU/hqdefault.jpg,en,en,False,6301,PT1H45M1S,hd,False,True,False,False,607857,17995,1224
pDg0xYtPkcs,PG,2026-06-23T04:42:10.059943+00:00,2026-06-16T10:02:59Z,dame's interlude,dame's interlude,Dame Atlas - Topic,UCDUkpN88t3Kfsix2zDRLYXg,10,Music,"Dame Atlas, dame's interlude",2,https://i.ytimg.com/vi/pDg0xYtPkcs/hqdefault.jpg,en,en,False,109,PT1M49S,hd,False,True,False,False,160926,4245,0
YNBdSmGxbvE,PG,2026-06-23T04:42:10.059951+00:00,2026-06-22T02:30:06Z,The Mimic: Rage - Official Game Trailer,The Mimic: Rage - Official Game Trailer,CTStudios,UC2eI5thsS3OfZXsNW-VyXhQ,10,Music,,0,https://i.ytimg.com/vi/YNBdSmGxbvE/hqdefault.jpg,en,en,False,26,PT26S,hd,False,True,False,False,92091,8569,1163
HorICRtODpY,PG,2026-06-23T04:42:10.059958+00:00,2026-06-21T20:43:09Z,MECCHA CHAMELEON CUSTOM MAPS ARE HILARIOUS,MECCHA CHAMELEON CUSTOM MAPS ARE HILARIOUS,Grizzy,UCPbGiUt4Yu8EsaFM-KAmgjg,20,Gaming,"grizzy, grizzytv, moregrizzy, grizzyvods",4,https://i.ytimg.com/vi/HorICRtODpY/hqdefault.jpg,en,en,False,2703,PT45M3S,hd,False,True,False,False,523887,23747,301
txrYKA8Zg4g,PG,2026-06-23T04:42:10.059966+00:00,2026-06-20T22:00:06Z,CG5 - Not Supposed To Love Me [Ode to JAX] (The Amazing Digital Circus Song Animation),CG5 - Not Supposed To Love Me [Ode to JAX] (The Amazing Digital Circus Song Animation),CG5,UCLCdyRg3u5O-EVP5p46QxcQ,10,Music,"cg5, cg5 song, the amazing digital circus song, the amazing digital circus cg5, the amazing digital circus episode 9, the amazing digital circus episode 9 song, digital circus song cg5, digital circus, digital circus episode 9, not supposed to love me cg5, jax song, jax song cg5, jax",13,https://i.ytimg.com/vi/txrYKA8Zg4g/hqdefault.jpg,en,en,False,241,PT4M1S,hd,False,True,False,False,1241492,96369,6614
ny8zeqDaLlI,PG,2026-06-23T04:42:10.059974+00:00,2026-06-22T01:45:21Z,House of the Dragon: S3 | Ep. 2 Promo Trailer | 4K HBO Max,House of the Dragon: S3 | Ep. 2 Promo Trailer | 4K HBO Max,AD_edits,UCsX-zRuq3ovMsgFqEQLw2Bw,24,Entertainment,"house of the dragon, house of the dragon season 3, game of thrones, a knight of the seven kingdoms, game of thrones prequel, hotd season 3 new trailer, house of the dragon new trailer, hotd trailer, hotd season 3, house of the dragon teaser trailer, house of the dragon trailer, house of the dragon season 3 teaser trailer, game of thrones prequel trailer, hotd trailer music, aemond targaryen, hotd new episode trailer, hotd episode 3 new trailer, hotd ep 2 new trailer",18,https://i.ytimg.com/vi/ny8zeqDaLlI/hqdefault.jpg,en,en,False,40,PT40S,hd,False,True,False,False,153388,617,100
KKjOy-LAT-E,PG,2026-06-23T04:42:10.059982+00:00,2026-06-20T13:11:58Z,Que Vuelva,Que Vuelva,Alex Bueno - Topic,UCddbVQUvk4iP5orcI1kk9DQ,10,Music,"Alex Bueno, El Inmortal, Que Vuelva",3,https://i.ytimg.com/vi/KKjOy-LAT-E/hqdefault.jpg,es,es,False,290,PT4M50S,hd,False,True,False,False,726465,5650,70
MzunXwk8t10,PG,2026-06-23T04:42:10.059989+00:00,2026-06-21T15:00:03Z,Let’s Make Sense of JEAN GREY In A Spider-Man Movie | Sneak Peek,Let’s Make Sense of JEAN GREY In A Spider-Man Movie | Sneak Peek,New Rockstars,UC7yRILFFJ2QZCykymr8LPwA,24,Entertainment,"new rockstars, new rockstars youtube, youtube new rockstars, spiderman, spider-man, jean grey, sadie sink, x-men, mutants, spider-man brand new day, brand new day trailer, hulk",12,https://i.ytimg.com/vi/MzunXwk8t10/hqdefault.jpg,en,en,False,3583,PT59M43S,hd,False,True,False,False,98813,3131,710
ueb59rJDF8g,PG,2026-06-23T04:42:10.059997+00:00,2026-06-22T04:45:53Z,GRIEF 97% 🔴 75%+ x31 🔴 STREAM 365,GRIEF 97% 🔴 75%+ x31 🔴 STREAM 365,Doggie,UC3ZhM0fDxU9bqqlwWRMHwuw,20,Gaming,"geometry dash, doggiedasher, doggie, gd, extreme, demon, extreme demon, zdoggie, doggiegd, verification, top 1",11,https://i.ytimg.com/vi/ueb59rJDF8g/hqdefault.jpg,en,en,False,10096,PT2H48M16S,hd,False,True,False,False,771742,26229,518
mTN5DTJEFEs,PG,2026-06-23T04:42:10.060005+00:00,2026-06-05T06:59:57Z,"Jnr Vigi, Liz Vamarasi - Lewa (Official Audio)","Jnr Vigi, Liz Vamarasi - Lewa (Official Audio)",VT1S,UCc4Es_CrsqCK9mHbV_FyS9w,10,Music,"lewa, jnr vigi, liz vamarasi, vt1s",4,https://i.ytimg.com/vi/mTN5DTJEFEs/hqdefault.jpg,en,,False,236,PT3M56S,hd,False,True,False,False,141249,3858,206
cEUhM2uE-Wg,PG,2026-06-23T04:42:10.060013+00:00,2026-06-22T02:24:03Z,FROM season 4 episode 10 trailer,FROM season 4 episode 10 trailer,Teflon Tv,UCz7FuRHvd0CpH8vwKqU9Ruw,24,Entertainment,"game, of, thrones, teflontv, teflon tv, game of thrones, house teflon, tony teflon, game of thrones season 8, who wins the game of thrones, game of thrones season 8 end game theory, huge clue, season 8 episode 4 leaked outline ! | game of thrones season 8 episode 4, game of thrones season 8 leaks, game of thrones season 8 spoilers, game of thrones season 8 plot leak, game of thrones season 8 confirmed theory, sansa stark, gendry and sansa",19,https://i.ytimg.com/vi/cEUhM2uE-Wg/hqdefault.jpg,en,en,False,57,PT57S,hd,False,True,False,False,207871,1808,389
Z8U_0y4ShW0,PG,2026-06-23T04:42:10.060020+00:00,2026-06-20T19:13:29Z,"Meccha Chameleon spots that make you say ""That Pain't Me""","Meccha Chameleon spots that make you say ""That Pain't Me""",SMii7Y,UCzXwjTI6c6mVn6oui_p6oiw,20,Gaming,"smii7y, smii7yplus, smii7y+, smii7y plus, meccha chameleon, meccha chameleon game, meccha chameleon funny moments, meccha chameleon gameplay, camouflage game, chameleon game meme, funny gaming moments, funny hide and seek moments, paint camouflage game, camouflage party game, hide and seek game, prop hunt type game, prop hunt, meccha chameleon best spots, hide and seek, meccha, meccha chameleon hiding spots, meccha chameleon spots",22,https://i.ytimg.com/vi/Z8U_0y4ShW0/hqdefault.jpg,en,en,False,1701,PT28M21S,hd,False,True,False,False,4265983,232503,4172
9uKnzS48Oi0,PG,2026-06-23T04:42:10.060028+00:00,2026-06-21T18:00:27Z,Vicente Fernández - Mi Viejo (LETRA),Vicente Fernández - Mi Viejo (LETRA),RadioReggaeton,UC71_qiSYe3CFuI9Jd4eWW4A,10,Music,"Reggaetón, Música Nueva, Tendencias, Musica, Musica Urbana, Video letra",6,https://i.ytimg.com/vi/9uKnzS48Oi0/hqdefault.jpg,es-419,es-419,False,195,PT3M15S,hd,False,True,False,False,245459,1098,11
JBegEgtY7A4,PG,2026-06-23T04:42:10.060036+00:00,2026-06-21T14:30:35Z,"The Beekeeper 2: BLOOD PROTOCOL – Jason Statham, Anne Hathaway, Mads Mikkelsen | Concept Trailer","The Beekeeper 2: BLOOD PROTOCOL – Jason Statham, Anne Hathaway, Mads Mikkelsen | Concept Trailer",Ultimate Studios,UCc3qOMA8TN5b3PPRlGAFA0Q,24,Entertainment,"The Beekeeper 2, The Beekeeper 2 Trailer, Beekeeper 2 Blood Protocol, Beekeeper 2 Concept Trailer, Beekeeper 2 Fan Made Trailer, Beekeeper 2 2027, Beekeeper Sequel, Jason Statham, Jason Statham New Movie 2027, Jason Statham Beekeeper 2, Jason Statham Action Movie, Anne Hathaway, Anne Hathaway Villain, Anne Hathaway New Movie, Mads Mikkelsen, Mads Mikkelsen Villain, Mads Mikkelsen Action, Amanda Seyfried, Amanda Seyfried New Movie",19,https://i.ytimg.com/vi/JBegEgtY7A4/hqdefault.jpg,en,en,False,126,PT2M6S,hd,False,True,False,False,147230,707,51
ia7OnjPtI7M,PG,2026-06-23T04:42:10.060043+00:00,2026-06-22T04:10:08Z,Roblox INVISIBLE GLITCH makes people MAD,Roblox INVISIBLE GLITCH makes people MAD,Flamingo,UCm-X6o81nRsXQTmqpyArkBQ,20,Gaming,"roblox, flamingo, roblox glitch, invisible",4,https://i.ytimg.com/vi/ia7OnjPtI7M/hqdefault.jpg,en,en,False,684,PT11M24S,hd,False,True,False,False,537483,33590,2892
3j7bhOvW6jw,PG,2026-06-23T04:42:10.060051+00:00,2026-06-21T11:30:06Z,LOW FADE (Music Video) KARAN AUJLA,LOW FADE (Music Video) KARAN AUJLA,Karan Aujla,UC3XBkDeCVXCoCofFgfUZXGw,10,Music,,0,https://i.ytimg.com/vi/3j7bhOvW6jw/hqdefault.jpg,en,pa,False,179,PT2M59S,hd,False,True,False,False,2780113,198392,11044
s8cP1Vt5US8,PG,2026-06-23T04:42:10.060058+00:00,2026-06-19T12:44:08Z,『チェンソーマン 刺客篇』ティザーPV②／Chainsaw Man –  Assassins Arc Official Trailer 2,『チェンソーマン 刺客篇』ティザーPV②／Chainsaw Man –  Assassins Arc Official Trailer 2,MAPPA CHANNEL,UCjfAEJZdfbIjVHdo5yODfyQ,1,Film & Animation,,0,https://i.ytimg.com/vi/s8cP1Vt5US8/hqdefault.jpg,ja,ja,False,91,PT1M31S,hd,False,False,False,False,5328158,369824,12595
wZW016nna48,PG,2026-06-23T04:42:10.060066+00:00,2026-06-20T16:00:01Z,"If You Build It, I'll Buy It!","If You Build It, I'll Buy It!",MrBeast Gaming,UCIPPMRA040LQr5QPyJEbmXA,20,Gaming,,0,https://i.ytimg.com/vi/wZW016nna48/hqdefault.jpg,en,en,False,2054,PT34M14S,hd,True,True,False,False,24144402,535669,14575
kofuSo_dmvs,PG,2026-06-23T04:42:10.060073+00:00,2026-06-19T17:00:06Z,INSANE (Official Music Video) - Black Gryph0n & Baasik,INSANE (Official Music Video) - Black Gryph0n & Baasik,Black Gryph0n,UCvzWGXYFDiiJ338KIJPhbhQ,10,Music,,0,https://i.ytimg.com/vi/kofuSo_dmvs/hqdefault.jpg,en,en-US,False,206,PT3M26S,hd,False,False,False,False,3259760,288977,14552
I92cjTGHFJg,PG,2026-06-23T04:42:10.060080+00:00,2026-06-19T19:00:05Z,Toy Story 19 Trailer,Toy Story 19 Trailer,ArbyTV,UCGAxIvybbU3PF_1fhHU6XFA,22,People & Blogs,"disney, animation, cartoons, Pixar, Toy story, Toy story 5, Woody, Buzz lightyear, Gag trailer",9,https://i.ytimg.com/vi/I92cjTGHFJg/hqdefault.jpg,en,en,False,161,PT2M41S,hd,False,False,False,False,1656364,47472,2646
lXWBRLZoyEI,PG,2026-06-23T04:42:10.060087+00:00,2026-06-22T00:39:10Z,roblox best gameplay,roblox best gameplay,StanRP,UCHYA5HNaS5n4idxmP-at8nA,20,Gaming,"roblox, granny, free fire, live roblox, roblox shorts, shorts feed, 67, six seven, meme reset, singing brainrot song, great meme reset",11,https://i.ytimg.com/vi/lXWBRLZoyEI/hqdefault.jpg,en-US,en-US,False,8,PT8S,hd,False,True,False,False,475796,3371,1
imjr894sSjA,PG,2026-06-23T04:42:10.060095+00:00,2026-06-19T16:00:06Z,Bay Swag LAYDERR ft. G Herbo (Official Music Video),Bay Swag LAYDERR ft. G Herbo (Official Music Video),Bay Swag,UC5Oq1qsltWD_m0p0izDHTVQ,10,Music,"bay swag, g herbo, nyc music, new york, chicago music, fisherr, for sure, meek mill, young thug, future, new music, hip hop, rap, nyc hip hop, nyc knicks, layderr, laterr, later, gherbo, bayswag, cash cobain, cashcobain",22,https://i.ytimg.com/vi/imjr894sSjA/hqdefault.jpg,en,en,False,200,PT3M20S,hd,False,False,False,False,124939,4857,193
lPRAJewhQ5I,PG,2026-06-23T04:42:10.060102+00:00,2026-06-22T02:45:06Z,"FROM Season 4 Episode 10 Trailer ""When A Tree Falls In The Forest""","FROM Season 4 Episode 10 Trailer ""When A Tree Falls In The Forest""",Jeremy Ice & Fire 33,UCqw_GlE4PJN-umM5aEmcYHw,24,Entertainment,"From, From season 4, From season 4 episode 10, From season 4 episode 10 trailer, From season 4 finale, From season 4 episode 10 preview, From season 4 final promo, From season 4 trailer, From season 4 ending Explained, From season 4 episode 10 breakdown, From season 4 endgame Theory, From season 4 episode 10 predictions, from on mgm, mgm plus, the boy in white, the man in yellow, faraway tree, bottle tree, talismans",19,https://i.ytimg.com/vi/lPRAJewhQ5I/hqdefault.jpg,en,en,False,94,PT1M34S,hd,False,True,False,False,263398,3226,600
O7j0YjOVXe4,PG,2026-06-23T04:42:10.060110+00:00,2026-06-22T02:29:51Z,ROBLOX SLEEP OR DIE..,ROBLOX SLEEP OR DIE..,Foltyn,UCRkuUgtDAL4XSU5jB40J_wA,20,Gaming,"foltyn, foltyn roblox, roblox, roblox foltyn, foltyn family, funny, foltyn family roblox, roblox foltyn family, blade ball, roblox blade ball, foltyn blade ball, pretend to sleep or die, pretend to sleep roblox, foltyn and caylus, foltyn and caylus playing together, foltyn and caylus roblox, roblox sleep or die",17,https://i.ytimg.com/vi/O7j0YjOVXe4/hqdefault.jpg,en,en-US,False,543,PT9M3S,hd,False,True,False,False,636149,16135,1695
gDCrWQNGH0A,PG,2026-06-23T04:42:10.060117+00:00,2026-06-22T00:01:44Z,The Game - Like Father Like Daughter ft. Cali Dream (Official Music Video),The Game - Like Father Like Daughter ft. Cali Dream (Official Music Video),The Game ,UC3eKKASjWY-WAGRII9iKHsQ,22,People & Blogs,,0,https://i.ytimg.com/vi/gDCrWQNGH0A/hqdefault.jpg,en,en,False,222,PT3M42S,hd,False,False,False,False,151574,12826,976
gY5O_XgwuFY,PG,2026-06-23T04:42:10.060125+00:00,2026-06-21T18:33:21Z,THESE WERE MY BEST HIDING SPOTS YET,THESE WERE MY BEST HIDING SPOTS YET,Pezzy,UCVUsmF97x4kuhGbBjzl1nVg,20,Gaming,"Pezzy, pezzy horror, pezzy horror games, pezzy plays, pezzy vod, couragejd, meccha chameleon, meccha chameleon spots, smii7y, smii7y meccha chameleon, bigpuffer, Grizzy",12,https://i.ytimg.com/vi/gY5O_XgwuFY/hqdefault.jpg,en,en-US,False,1931,PT32M11S,hd,False,True,False,False,399090,21870,282
Cy7W6D0A5QM,PG,2026-06-23T04:42:10.060133+00:00,2026-06-15T04:09:52Z,"Chris Brown - Deuces (Lyrics) Ft. Tyga, Kevin McCall","Chris Brown - Deuces (Lyrics) Ft. Tyga, Kevin McCall",S&R,UCDhKMez849J7ErTAP-z2bSA,22,People & Blogs,"Chris Brown, Deuces, Chris Brown Deuces, Deuces Chris Brown, Chris Brown Deuces lyrics, Chris Brown Deuces TikTok remix lyrics, Deuces lyrics, Chris Brown Deuces remix, Deuces lyrics Chris Brown, Chris Brown Deuces lyrics ft Tyga, Kevin McCall, Tyga Deuces lyrics, Chris Brown Deuces Lyrics Ft. Tyga Kevin McCall, chris brown deuces lyric video, lyrics deuces, deuces lyric video, tiktok, chris brown tyga deuces, say bye-bye to her, chris brown deuces remix, Chris Brown Songs",21,https://i.ytimg.com/vi/Cy7W6D0A5QM/hqdefault.jpg,en,,False,277,PT4M37S,hd,False,True,False,False,143079,409,5
HQTl2VhEw4U,PG,2026-06-23T04:42:10.060141+00:00,2026-06-21T22:00:25Z,The World Series Starts NOW! Wheel Of MLB Ep. #7,The World Series Starts NOW! Wheel Of MLB Ep. #7,MMG,UCaYxyR9mzVlTrOOyZD0XAmA,17,Sports,mmg,1,https://i.ytimg.com/vi/HQTl2VhEw4U/hqdefault.jpg,en,en-US,False,2275,PT37M55S,hd,False,True,False,False,208416,7459,388
ltRoBfchQXI,PG,2026-06-23T04:42:10.060149+00:00,2026-06-17T17:00:26Z,Hell Nawl,Hell Nawl,M5K - Topic,UC989yG_HhVC8vhXEUOJTwrg,10,Music,"M5K, Larry Williams, Hell Nawl",3,https://i.ytimg.com/vi/ltRoBfchQXI/hqdefault.jpg,en,,False,279,PT4M39S,hd,False,True,False,False,86905,4373,0
v9c6C_dcxro,PG,2026-06-23T04:42:10.060156+00:00,2026-06-21T15:53:00Z,BECOMING A LITERAL SPY [007 Part 1/3],BECOMING A LITERAL SPY [007 Part 1/3],Joe Bart Games,UCeBPTBz1oRnsWsUBnKNNKNw,20,Gaming,joebartolozzi,1,https://i.ytimg.com/vi/v9c6C_dcxro/hqdefault.jpg,en,en-US,False,12036,PT3H20M36S,hd,False,True,False,False,198157,4853,310
lXTU664qsyo,PG,2026-06-23T04:42:10.060163+00:00,2026-06-20T04:07:34Z,OK (feat. Don Toliver),OK (feat. Don Toliver),Kanye West - Topic,UCRY5dYsbIN5TylSbd7gVnZg,10,Music,"Kanye West, Ye, Don Toliver, BULLY - DELUXE, OK (feat. Don Toliver)",5,https://i.ytimg.com/vi/lXTU664qsyo/hqdefault.jpg,en,,False,159,PT2M39S,hd,False,True,False,False,1031623,56420,1746
8lV2f8-w_3U,PG,2026-06-23T04:42:10.060171+00:00,2026-06-21T22:30:08Z,Meccha Chameleon is a Hilarious Game,Meccha Chameleon is a Hilarious Game,TheDooo,UCPKgIhTC3BdkAwMw6s-GEug,20,Gaming,"meccha chameleon, meccha chameleon game, meccha chameleon funny moments, meccha chameleon gameplay, camouflage game, chameleon game meme, funny gaming moments, funny hide and seek moments, paint camouflage game, camouflage party game, hide and seek game, prop hunt type game, prop hunt, thedooo, doo, goons, thedoo",17,https://i.ytimg.com/vi/8lV2f8-w_3U/hqdefault.jpg,en,en,False,2323,PT38M43S,hd,False,True,False,False,278631,12248,204
jdlCOIaWwTQ,PG,2026-06-23T04:42:10.060179+00:00,2026-06-19T14:00:37Z,Chris Brown - It Depends/Obvious (Official Video),Chris Brown - It Depends/Obvious (Official Video),ChrisBrownVEVO,UCm1dsgJNnhaLkY3uAdqN4mA,10,Music,"chris brown, bryson tiller, it depends, chris brown it depends, rnb, chris brown 11:11, chris brown tour, breezy bowl, chris brown new music, residuals, chris brown bryson tiller, bryson tiller new music, chris brown type beat, it depends lyrics, chris brown it depends lyrics, It Depends/Obvious",16,https://i.ytimg.com/vi/jdlCOIaWwTQ/hqdefault.jpg,en,en,False,335,PT5M35S,hd,False,True,False,False,1713965,106999,5202
gLmRUEKHaMY,PG,2026-06-23T04:42:10.060187+00:00,2026-06-21T20:00:26Z,ROBLOX MUKBANG,ROBLOX MUKBANG,ItsFunneh,UCUk7VggtJdo9XYTy3Z5QVAw,20,Gaming,"itsfunneh, funneh, funny moments, funny, krew, krew plays, gaming, games, roblox, itsfunneh roblox, youtube itsfunneh, itsfunneh minecraft, itsfunneh krew, itsfunneh videos, no swearing, no cursing, roblox funny moments, roblox roleplay, roblox krew, roblox obby, roblox parkour, roblox escape, roblox funny, roblox funny games, funny roblox, funny moments roblox, roblox itsfunneh, roblox funneh, roblox mukbang, mukbang",30,https://i.ytimg.com/vi/gLmRUEKHaMY/hqdefault.jpg,en,en-US,False,1731,PT28M51S,hd,False,True,False,False,552705,23459,3008
xxFjwI1qYmc,PG,2026-06-23T04:42:10.060194+00:00,2026-06-19T14:00:06Z,Belly Gang Kushington - WTF GOIN (Official Music Video) ft. 21 Savage,Belly Gang Kushington - WTF GOIN (Official Music Video) ft. 21 Savage,Belly Gang Kushington ,UCxw78-TUwaA2xqQkmjVHGLw,10,Music,"belly gang Kushingon, Wafi belly gang, Young thug, YKNiece, Belly gang Kushington YKNiece friend do, remix, Friend do remix, Geeked up looking for an eater, Rap music, Atlanta, Lil baby, 21 savage, Future, Belly gang kush, Bendadonnn, Reggie stream, Viral, TikTok, Belly gang dad, Belly gang Wafi, belly gang pig latin, belly gang kush benadadonn, belly gang kushington bendadonnn, friend do belly gang, OTR Belly Gang, Belly Gang Kush 21 Savage WTF GOIN, WTF GOIN, 21 Savage",28,https://i.ytimg.com/vi/xxFjwI1qYmc/hqdefault.jpg,en,en,False,187,PT3M7S,hd,False,True,False,False,527652,22892,981
EGHfSD1S2TU,PG,2026-06-23T04:42:10.060202+00:00,2026-06-22T00:24:11Z,"THESE HAUNTED HORROR MAPS GOT BRUTAL!!! | Meccha Chameleon (w/ H2O Delirious, Kyle, Squirrel)","THESE HAUNTED HORROR MAPS GOT BRUTAL!!! | Meccha Chameleon (w/ H2O Delirious, Kyle, Squirrel)",CaRtOoNz,UCdQWs2nw6w77Rw0t-37a4OA,20,Gaming,"cart0onz, cartoonz, cartoons, funny moments, let's play, cartoonz face reveal, cartoonz crew, cartoonz crew song, cartoonz crew junior, toonz",10,https://i.ytimg.com/vi/EGHfSD1S2TU/hqdefault.jpg,en,en,False,2930,PT48M50S,hd,False,True,False,False,149451,8448,286
dm2Tn6Pc2AA,PG,2026-06-23T04:42:10.060210+00:00,2026-06-18T10:04:33Z,All In,All In,Cody Ray - Topic,UCgLZlL14zQovPgT1Br7X8uQ,10,Music,"Cody Ray, Damaso Evelio Fuentes, All In",3,https://i.ytimg.com/vi/dm2Tn6Pc2AA/hqdefault.jpg,en,,False,185,PT3M5S,hd,False,True,False,False,32218,862,8
_-An2U8ymHY,PG,2026-06-23T04:42:10.060217+00:00,2026-06-22T00:28:19Z,The *RANDOM* GOLD SPRITE BOSS Challenge!,The *RANDOM* GOLD SPRITE BOSS Challenge!,TG Plays,UCqVCSWnuOSPm26orvNDTuWQ,20,Gaming,,0,https://i.ytimg.com/vi/_-An2U8ymHY/hqdefault.jpg,en,en,False,1469,PT24M29S,hd,False,True,False,False,235653,4199,381
sAS6YerPP-8,PG,2026-06-23T04:42:10.060225+00:00,2026-06-19T15:59:07Z,"Tom MacDonald - ""Remember Who You Are""","Tom MacDonald - ""Remember Who You Are""",Tom MacDonald,UCElGBUWDCa05jRzc2PfmGqQ,10,Music,"tom macdonald, tom macdonald rap, tom macdonald rapper, tom macdonald you missed, tom macdonald american flag, tom macdonald facts, tom macdonald ben shapiro, independent rapper, Tom MacDonald New Song, New Tom MacDonald, tom macdonald trump, trump tom macdonald, maga rapper, conservative rap, devil is a democrat song, all my haters tom macdonald, all my haters lyrics, tom macdonald new song, tom macdonald haters, all my haters rap, protest music, patriot music, patriotic",23,https://i.ytimg.com/vi/sAS6YerPP-8/hqdefault.jpg,en,en,False,182,PT3M2S,hd,False,True,False,False,1638116,90934,10907
DYUm6VqEb7g,PG,2026-06-23T04:42:10.060232+00:00,2026-06-14T19:00:18Z,Vicente Fernández - Hermoso Cariño (En Vivo) (Letra/Lyrics) ❤️,Vicente Fernández - Hermoso Cariño (En Vivo) (Letra/Lyrics) ❤️,Mundo Dembow,UC-K6fa6T9oaOuMVwHDsoPYA,10,Music,"vicente fernandez, hermoso cariño, hermoso cariño letra, hermoso cariño lyrics, vicente fernandez hermoso cariño, rancheras, mariachi, regional mexicano, musica mexicana, canciones romanticas, mariachi mexicano, clasicos mexicanos, musica para dedicar, vicente fernandez exitos, letra completa, lyrics video, canciones de amor, rancheras romanticas, musica tradicional mexicana, mundo dembow",20,https://i.ytimg.com/vi/DYUm6VqEb7g/hqdefault.jpg,es,es,False,155,PT2M35S,hd,True,True,False,False,246695,676,3
