video_id,country,fetched_at,published_at,title,localized_title,channel_title,channel_id,category_id,category_name,tags,tag_count,thumbnail,default_language,audio_language,is_live,duration,duration_raw,definition,caption_available,licensed_content,embeddable,made_for_kids,views,likes,comments
nm2g0_lg2go,PE,2026-05-07T04:12:50.709318+00:00,2026-05-07T00:00:07Z,Armonía 10  de Piura - Cuando Florezca el Chuño (Concierto en vivo),Armonía 10  de Piura - Cuando Florezca el Chuño (Concierto en vivo),Armonia 10,UCdEQ0M5V_8SIkyHDBoNiIZw,10,Music,"armonia, armonia 10, armonia10, piura, peru, cumbia, armonia 10 cumbia, armonia 10 en vivo, armonia 10 orquesta, orquesta armonia 10, cumbia en vivo, mix, cumbia mix, mix cumbia, cumbia peruana, sanjuanera, tropical, hermanos lozada, lozada, mix enganchados, canciones armonia 10, videos armonia 10, lo mejor de armonia 10, tu amor es una trampa, ve y dile, escribeme, el cervecero, la duda",28,https://i.ytimg.com/vi/nm2g0_lg2go/hqdefault.jpg,es-419,es-419,False,218,PT3M38S,hd,False,True,False,False,51821,10636,1065
iuS9JkUjnQY,PE,2026-05-07T04:12:50.709362+00:00,2026-05-05T15:32:03Z,La Odisea | Nuevo Tráiler Oficial (Universal Pictures) - HD,La Odisea | Nuevo Tráiler Oficial (Universal Pictures) - HD,Universal Pictures México,UCuON8B3q1FMIOSE-0sbC_rQ,1,Film & Animation,"Trailer, nuevo trailer, Trailer oficial, película, universal pictures, La Odisea, Matt Damon, Tom Holland, Anne Hathaway, Robert Pattinson, Lupita Nyong’o, Zendaya, Christopher Nolan",13,https://i.ytimg.com/vi/iuS9JkUjnQY/hqdefault.jpg,es,es,False,146,PT2M26S,hd,False,False,False,False,1335495,5788,278
hg27q9SrMpA,PE,2026-05-07T04:12:50.709372+00:00,2026-05-06T20:05:43Z,Entrené en la PRISIÓN para Sorprender a las POLICÍAS en Minecraft,Entrené en la PRISIÓN para Sorprender a las POLICÍAS en Minecraft,Nacho,UC8EkcHOycB94lHDkbAPSnQA,20,Gaming,"minecraft, minecraft nacho, nacho minecraft, dagar y nacho, nacho y dagar, minecraft mod, minecraft mods, lia minecraft, amigos minecraft, dagar y nacho en minecraft, minecraft roleplay, toni minecraft, nacho amigos, prision, prision minecraft, prision subterranea, base segura, base secreta, escapar de prision, salir de la prision, tunel minecraft, entrene, mamado, mamadisimo, policias chicas, policias, policias minecraft, policia minecraft, nacho mamadisimo, nacho y lia",30,https://i.ytimg.com/vi/hg27q9SrMpA/hqdefault.jpg,es,es,False,1350,PT22M30S,hd,False,True,False,False,610327,9390,388
l3QksZ68hYw,PE,2026-05-07T04:12:50.709381+00:00,2026-05-05T11:30:48Z,The Killers - Mr. Brightside (Lyrics),The Killers - Mr. Brightside (Lyrics),Unique Sound,UCh1coBqMQvaFYYqJxSuZtKQ,10,Music,"The Killers, Mr. Brightside, The Killers Mr. Brightside, Mr. Brightside The Killers, Lyrics, Lyrics Mr. Brightside, The Killers Mr. Brightside Lyrics, Mr. Brightside The Killers Lyrics, The Killers Lyrics, Mr. Brightside Lyrics The Killers, Lyrics The Killers Mr. Brightside, Lyrics Mr. Brightside The Killers, Mr. Brightside By The Killers, rock music, rock, Jealousy Turning saints into the sea, Turning saints into the sea, Swimming through sick lullabies, tiktok song, tiktok",20,https://i.ytimg.com/vi/l3QksZ68hYw/hqdefault.jpg,en,en,False,222,PT3M42S,hd,False,True,False,False,735888,2257,16
8kMgIyZ87SQ,PE,2026-05-07T04:12:50.709389+00:00,2026-05-05T16:17:41Z,EVIL DEAD: EN LLAMAS Tráiler Español Latino Subtitulado (2026),EVIL DEAD: EN LLAMAS Tráiler Español Latino Subtitulado (2026),ONE Media Español,UCcVNDl7ZJMf9lC9a34CY4RA,1,Film & Animation,"Tráiler, Película, Español, Latino, 2026, Evil Dead, Evil Dead En Llamas, Evil Dead En Llamas Tráiler, Terror",9,https://i.ytimg.com/vi/8kMgIyZ87SQ/hqdefault.jpg,es,es-419,False,165,PT2M45S,hd,False,False,False,False,77477,2938,264
R6pXNrDSLUE,PE,2026-05-07T04:12:50.709397+00:00,2026-05-06T21:00:23Z,JUGANDO RIVALS EN ROBLOX CAPITULO #1!🔫 ,JUGANDO RIVALS EN ROBLOX CAPITULO #1!🔫 ,ElAbrahaham,UColTsB6zogXWooPbeO67Wgw,20,Gaming,"abrahahamflores, stream, entretenimiento, divertido, risa, gracioso, gamer, videojuegos, elabrahaham, copilacion, videos graciosos, antes vs ahora, mexico vs usa, abrahaham, directos, shorts, tiktoks, streams, twitch, reaccion, reacciones",21,https://i.ytimg.com/vi/R6pXNrDSLUE/hqdefault.jpg,es-MX,es-419,False,1263,PT21M3S,hd,False,True,False,False,404146,22982,3558
WYDC6zW17p4,PE,2026-05-07T04:12:50.709404+00:00,2026-05-04T16:00:06Z,Wisin - Escápate Conmigo ft. Ozuna (Letra),Wisin - Escápate Conmigo ft. Ozuna (Letra),Latin Pop,UCyrNLS9FCXTMeOg_cj8sa-g,22,People & Blogs,"Latin Pop, Letra, lyrics, LatinPop, pop latino, baladas pop, pop romántico, éxitos latinos, pop en español, pop viral, música pop juvenil, himnos pop, LatinFlow, Wisin - Escápate Conmigo ft. Ozuna (Letra), Escápate Conmigo ft. Ozuna (Letra), Wisin, Wisin - Escápate Conmigo ft. Ozuna, Wisin - Escápate Conmigo",18,https://i.ytimg.com/vi/WYDC6zW17p4/hqdefault.jpg,es,es-419,False,228,PT3M48S,hd,False,True,False,False,557079,577,3
r3x51n_unJ8,PE,2026-05-07T04:12:50.709412+00:00,2026-05-05T16:01:29Z,Evil Dead: En Llamas | Tráiler Oficial,Evil Dead: En Llamas | Tráiler Oficial,SonyPicturesMéxico,UC_2POp0ILf48h6T5JqsiMBw,1,Film & Animation,"Evil Dead Burn, Tráiler, película, 2026, Sony Pictures, Sébastien Vaniček, Souheila Yacoub, Tandi Wright, Hunter Doohan, Luciane Buchanan, Errol Shand, Maude Davey, George Pullar, Greta Van Den Brink",14,https://i.ytimg.com/vi/r3x51n_unJ8/hqdefault.jpg,es,en,False,145,PT2M25S,hd,False,True,False,False,91715,5373,404
PxboUQuRcD8,PE,2026-05-07T04:12:50.709420+00:00,2026-05-05T20:03:57Z,Adopté una FAMILIA POKEMON en Minecraft!,Adopté una FAMILIA POKEMON en Minecraft!,Dagar,UCEs5MQjXJq27-X2vgdwtYDw,20,Gaming,"Minecraft, minecraft mod, dagar y nacho, nacho y dagar, amigos minecraft, dagar minecraft, minecraft dagar",7,https://i.ytimg.com/vi/PxboUQuRcD8/hqdefault.jpg,es,es,False,1574,PT26M14S,hd,False,True,False,False,2436650,20798,973
k3DchxGmehk,PE,2026-05-07T04:12:50.709427+00:00,2026-05-06T11:11:45Z,"Rock en español de los 80 y 90 - Duncan Dhu, Caifanes, Enanitos Verdes, Mana, SODa Estereo...","Rock en español de los 80 y 90 - Duncan Dhu, Caifanes, Enanitos Verdes, Mana, SODa Estereo...",Rock Español,UCiY7GnV4t9mxPtWjTMfwF4Q,22,People & Blogs,"rock español, rock latin, rock, mix rock en español, rock en español mix, rock latino, musica del rock, rock en español de los 80 y 90, rock en espanol, rock espanol, lo mejor del rock en español, lo mejor del rock latino, rock 80 y 90 en español, rock music, clasicos del rock, rock music 70s 80s 90s, lo mejor musica, musica romantica, latino rock, rock de los 80 y 90 en español, viejitas pero bonitas, rock español 80 90, mix rock de los 80, rock de los 80 y 90",24,https://i.ytimg.com/vi/k3DchxGmehk/hqdefault.jpg,es,cy,False,4328,PT1H12M8S,hd,False,True,False,False,63602,330,12
EjuuBv8TL9k,PE,2026-05-07T04:12:50.709436+00:00,2026-05-05T22:12:41Z,15 COSAS que NO VISTE en el TRAILER de EVIL DEAD EN LLAMAS,15 COSAS que NO VISTE en el TRAILER de EVIL DEAD EN LLAMAS,El Dojo del Geek,UCSDGniOKSQrpWcaS0MK07eQ,1,Film & Animation,"evil dead burn, cosas que no viste en el trailer de evil dead burn, evil dead en llamas trailer oficial, cosas que no viste en el trailer de evil dead en llamas, el dojo del geek, evil dead en llamas trailer completo, evil dead burn trailer completo, trailer explicado, evil dead burn trailer explicado",9,https://i.ytimg.com/vi/EjuuBv8TL9k/hqdefault.jpg,es,es,False,480,PT8M,hd,False,True,False,False,34034,1653,104
6uLIfrGP2ws,PE,2026-05-07T04:12:50.709443+00:00,2026-05-06T19:57:40Z,LYNA y MANDARINA BEBÉS se PELEAN en Brookhaven Roblox,LYNA y MANDARINA BEBÉS se PELEAN en Brookhaven Roblox,Lyna,UC-cnbLlplnXA4oc7rR21qzg,20,Gaming,,0,https://i.ytimg.com/vi/6uLIfrGP2ws/hqdefault.jpg,es-419,es-419,False,908,PT15M8S,hd,False,True,False,False,269480,4022,480
79jrrs5Mp8I,PE,2026-05-07T04:12:50.709450+00:00,2026-04-30T15:30:07Z,Grupo Niche - Hagamos Lo Que Diga El Corazón (Letra),Grupo Niche - Hagamos Lo Que Diga El Corazón (Letra),Mi Trocona Lyrics,UCaeyBme2QiQzIsgNRG4t7hw,22,People & Blogs,"grupo niche, hagamos lo que diga el corazón, grupo niche hagamos lo que diga el corazón, hagamos lo que diga el corazón grupo niche, grupo niche letra, hagamos lo que diga el corazón letra, grupo niche hagamos lo que diga el corazón letra, hagamos lo que diga el corazón grupo niche letra, que cosas bonitas que con los ojos no vemos, latin, latin music, latino, musica, spanish, columbia, mi trocona lyrics, letra, lyrics",18,https://i.ytimg.com/vi/79jrrs5Mp8I/hqdefault.jpg,es,es,False,303,PT5M3S,hd,False,True,False,False,28369,47,1
OYdHSvHDkcI,PE,2026-05-07T04:12:50.709458+00:00,2026-05-04T16:38:08Z,The Boys Season 5 Episode 6 Trailer,The Boys Season 5 Episode 6 Trailer,Rotten Tomatoes TV,UCz1GPotHecuLngiLuY739QQ,1,Film & Animation,"The Boys, The Boys Trailer, The Boys Season 5 Episode 6 Trailer, The Boys S05 E06 Trailer, The Boys Season 5 episode 6 TV Trailer, The Boys Season 5 Episode 6 Trailer 2026, The Boys Season 5 Episode 6 Official Trailer, Trailer, TV Trailer, 2026 Trailers, 2026 TV Trailers, The Boys Trailer 1, The Boys Season 5 Prime Video, Prime Video, Entertainment, TV Series, Karl Urban, Jack Quaid, Antony Starr",19,https://i.ytimg.com/vi/OYdHSvHDkcI/hqdefault.jpg,en,en,False,35,PT35S,hd,False,True,False,False,1002107,20982,1529
Xkqwv_jtsIY,PE,2026-05-07T04:12:50.709466+00:00,2026-05-06T19:00:00Z,SOMOS CAPERUCITA ROJA Y EL LOBO EN BROOKHAVEN!! 😱😱,SOMOS CAPERUCITA ROJA Y EL LOBO EN BROOKHAVEN!! 😱😱,Celynnei ,UCYEo6EXGbW4Wwx3qxipk4Xg,20,Gaming,"Celynnei, CelynneiYT, Cely, Roblox, Celiney, mm2, murdermystery2, robloxmomentosdivertidos, momentosdivertidos, robloxcomedia, robloxjuegos, robloxgameplay, robloxgames, celyroblox, celycraft, brookhaven, brookhavenrp, roleplay",18,https://i.ytimg.com/vi/Xkqwv_jtsIY/hqdefault.jpg,es,es,False,788,PT13M8S,hd,False,True,False,False,215911,14328,1183
gHVLeKoW9Dc,PE,2026-05-07T04:12:50.709473+00:00,2026-05-02T23:15:02Z,Beéle - Si Te Pillara (Letra/Lyrics),Beéle - Si Te Pillara (Letra/Lyrics),Camaleón Despechado,UCfwrEe-DmgBzHXHybxPKEYQ,10,Music,"Si te pillara bele, bele, belee letras, ba ba baririr, pillara bele",5,https://i.ytimg.com/vi/gHVLeKoW9Dc/hqdefault.jpg,es,es,False,192,PT3M12S,hd,False,True,False,False,97307,75,4
wNW2-4_kPjo,PE,2026-05-07T04:12:50.709481+00:00,2026-05-06T22:19:30Z,Atrapado en Una PIJAMADA YANDERE en Minecraft,Atrapado en Una PIJAMADA YANDERE en Minecraft,Awita,UC62nFXtc3KNujp9LCPJt-sA,20,Gaming,,0,https://i.ytimg.com/vi/wNW2-4_kPjo/hqdefault.jpg,es,es-419,False,1765,PT29M25S,hd,False,True,False,False,232670,6565,843
hReAuaAuJOE,PE,2026-05-07T04:12:50.709488+00:00,2026-05-05T21:38:44Z,Los Enanitos Verdes - Lamento Boliviano,Los Enanitos Verdes - Lamento Boliviano,EnanitosVerdesVEVO,UCEBcc_WHoyvM8_vofYot8aQ,10,Music,"Los Enanitos Verdes, EMI Odeon SAIC, Latin Rock",3,https://i.ytimg.com/vi/hReAuaAuJOE/hqdefault.jpg,es,es,False,225,PT3M45S,hd,False,True,False,False,50434,1109,172
eqUt0ZZV-6M,PE,2026-05-07T04:12:50.709507+00:00,2026-05-06T20:55:06Z,ENCONTRÉ UNA ENTRADA SECRETA A LOS BACKROOMS EN BROOKHAVEN (momentos divertidos) (roblox),ENCONTRÉ UNA ENTRADA SECRETA A LOS BACKROOMS EN BROOKHAVEN (momentos divertidos) (roblox),RoxiCake Gamer,UC3t7_hgqy-7pccSWRVaTQIw,20,Gaming,"Roblox, Roblox español, roblox shorts, roblox de terror, roblox memes, brookhaven, roblox brookhaven 🏡rp",7,https://i.ytimg.com/vi/eqUt0ZZV-6M/hqdefault.jpg,es,es-419,False,750,PT12M30S,hd,False,True,False,False,193479,11087,1574
f6ISWbRJjoM,PE,2026-05-07T04:12:50.709516+00:00,2026-05-05T13:01:21Z,Yandel - Encantadora (Letra/Lyrics),Yandel - Encantadora (Letra/Lyrics),Pulse Latin,UCPuX8g7wUnEWVJ-81rs6i5g,10,Music,"Yandel, Encantadora, Yandel Encantadora, Encantadora Yandel, Letra Encantadora, Yandel Encantadora Letra, Letra Encantadora Yandel, Cerquita de mí tan sola baby, Vamos a pasarla como se debe, En cambio yo aquí pendiente de ti, Buscando una manera pa' que aquí se quede, Sin tocarla me acalora, La veo bailar no la dejo sola sola, Quiero hacerla mi señora, Ella es encantadora y cazadora, Na na naeh, Porque nadie no' está viendo aquí, Estamos solitos aquí, Letra, Musica Latina, Letras",21,https://i.ytimg.com/vi/f6ISWbRJjoM/hqdefault.jpg,es,es,False,241,PT4M1S,hd,False,True,False,False,230064,377,8
0RghUnjlcf8,PE,2026-05-07T04:12:50.709524+00:00,2026-05-06T17:15:00Z,¿CUÁNTOS ERRORES ENCUENTRAS en esta FOTO de MINECRAFT?,¿CUÁNTOS ERRORES ENCUENTRAS en esta FOTO de MINECRAFT?,AQUISI,UC7jtSuXXamDt0eKFfYfGLDQ,20,Gaming,"aquisi, aquino, aquinoby2002, 2026, encuentra, el error, diferencia, errores, en esta, imagen, foto, screenshot, de minecraft, fallo, puedes encontrar, en minecraft, reto, que esta mal?, conterstine, shadoune, soarinng, dinamica mc, encuentra el error",23,https://i.ytimg.com/vi/0RghUnjlcf8/hqdefault.jpg,es,es-419,False,2332,PT38M52S,hd,False,True,False,False,107366,10609,303
WL4oxoOYaDQ,PE,2026-05-07T04:12:50.709532+00:00,2026-05-05T16:00:06Z,Lucky Brown & Jere Klein - BELLA (Letra),Lucky Brown & Jere Klein - BELLA (Letra),Urban Fest,UCS25MMDne281toshu5HEX6A,22,People & Blogs,"Urban Fest, Letra, lyrics, reggaetón, reggaeton, urbano, urban, latin, latino, dembow, Lucky Brown, Jere Klein, BELLA (Letra), BELLA, Lucky Brown & Jere Klein - BELLA, Lucky Brown & Jere Klein - BELLA (Letra)",16,https://i.ytimg.com/vi/WL4oxoOYaDQ/hqdefault.jpg,es,es-419,False,131,PT2M11S,hd,False,True,False,False,114894,215,3
daEJtfj7Ok8,PE,2026-05-07T04:12:50.709539+00:00,2026-05-06T16:01:49Z,Destruí Minecraft con estos Mods,Destruí Minecraft con estos Mods,Rubius Z,UCcjIvuxmWlS5IEQ0JdPV4Ng,20,Gaming,"elrubius, rubius, minecraft, nuevo, 2026, explosion, destruccion, destroying mc, mods, mod, minecraft mod, ProtoManly's Weather, Apocalipsis en minecraft, láser, tornado, tormentas, minecraft mods, minecraft mundo destruido, black hole, agujero negro, minecraft experimento, minecraft caos, ProtoManlys Weather, Destroying MC, MC",25,https://i.ytimg.com/vi/daEJtfj7Ok8/hqdefault.jpg,es,es,False,1401,PT23M21S,hd,False,True,False,False,905595,72464,1650
bfwNyzb8SOI,PE,2026-05-07T04:12:50.709546+00:00,2026-04-30T17:00:46Z,Eros Ramazzotti - Cosas De La Vida (Letra/Lyrics),Eros Ramazzotti - Cosas De La Vida (Letra/Lyrics),Love Trip,UCedwIM6dmZy-f90HTzE1P-g,22,People & Blogs,"LoveTrip, Video Lyric, Video Music, Video Letra, Sub Español, Video Sub Español, Video, Musica, Love, Trip, Amor, Desamor, Lyric, Music, Letra",15,https://i.ytimg.com/vi/bfwNyzb8SOI/hqdefault.jpg,es,es,False,290,PT4M50S,hd,False,True,False,False,97786,268,0
alfty7lfmpc,PE,2026-05-07T04:12:50.709554+00:00,2026-05-06T15:47:39Z,ESCAPÉ para CONSEGUIR NOVIA en Roblox!,ESCAPÉ para CONSEGUIR NOVIA en Roblox!,Dagar Roblox,UCmkyN2GfMyR7gsIiKBCR3nw,20,Gaming,"roblox, roblox dagar, roblox nacho, nacho y dagar, dagar y nacho",5,https://i.ytimg.com/vi/alfty7lfmpc/hqdefault.jpg,es,es,False,1013,PT16M53S,hd,False,True,False,False,327490,4794,228
CapicMxiD_g,PE,2026-05-07T04:12:50.709562+00:00,2026-05-06T13:00:20Z,Yandel - Encantadora,Yandel - Encantadora,Top Squad,UC5iD7k7-75a-ahOA34vg8Hg,10,Music,,0,https://i.ytimg.com/vi/CapicMxiD_g/hqdefault.jpg,pt-PT,es,False,241,PT4M1S,hd,False,True,False,False,23607,68,1
Hh-npOadCcY,PE,2026-05-07T04:12:50.709569+00:00,2026-05-06T20:27:09Z,TENEMOS QUE OPERAR de URGENCIA a LYNA BEBÉ en BROOKHAVEN ROBLOX,TENEMOS QUE OPERAR de URGENCIA a LYNA BEBÉ en BROOKHAVEN ROBLOX,Chocoblox,UC8YLIGeB04-KLPoR2Lmm6xA,20,Gaming,,0,https://i.ytimg.com/vi/Hh-npOadCcY/hqdefault.jpg,es,es,False,927,PT15M27S,hd,False,True,False,False,156087,3132,298
cXxdj0PWh1E,PE,2026-05-07T04:12:50.709576+00:00,2026-05-05T23:25:13Z,La Metralleta (En vivo),La Metralleta (En vivo),Corazón Serrano - Topic,UCsN8kVyKXvK11MID_PB_eCA,10,Music,"Corazón Serrano, Marcos Gayón, La Metralleta",3,https://i.ytimg.com/vi/cXxdj0PWh1E/hqdefault.jpg,es,es,False,193,PT3M13S,hd,False,True,False,False,13790,859,51
uPIbqbZRZrU,PE,2026-05-07T04:12:50.709583+00:00,2026-05-06T17:01:16Z,NABI Y CELYNNEI SE CONOCEN POR PRIMERA VEZ | Tomodachi Life,NABI Y CELYNNEI SE CONOCEN POR PRIMERA VEZ | Tomodachi Life,Nabriel,UCp-MGAju1QmvsCNZOEQikzQ,20,Gaming,"nabi, nabi roblox, soynabi, nabriel, nabi reacciona, nabi directos, nabi y celynnei, celynnei, gaming, juegos, humor, risas, entretenimiento, roblox, minecraft, gameplay, jaja, terror, soy nabi, navi, enano pelon, streamer, divertido, memes, jugando, trend, risa, nabi alto, nabi jugando, nabi juegos, soy navi, nabi tiktok, gracioso, videos divertidos, memes divertidos, xd, memes random, mejores momentos, tomodachi life, tomodachi nabi, tomodachi life nabi y celynnei, nabi juega tomodachi life",42,https://i.ytimg.com/vi/uPIbqbZRZrU/hqdefault.jpg,es,es,False,1203,PT20M3S,hd,False,True,False,False,217769,8596,596
MQwrWxc_UT0,PE,2026-05-07T04:12:50.709592+00:00,2026-05-04T13:00:43Z,Daryl Hall & John Oates - Maneater (Lyrics),Daryl Hall & John Oates - Maneater (Lyrics),Aura Country,UCqEiG9kuebr4b2UacElAQig,10,Music,"country music, auracountry, maneater song, maneater daryl hall & john oates lyrics, maneater lyrics, daryl hall & john oates, hall & oates, daryl hall and john oates, pop music",9,https://i.ytimg.com/vi/MQwrWxc_UT0/hqdefault.jpg,en,en-US,False,291,PT4M51S,hd,True,True,False,False,8388,27,0
Ytb6o7o3UzQ,PE,2026-05-07T04:12:50.709599+00:00,2026-05-06T21:45:01Z,Trolleé a Mis Amigos con El HOMBRE Del SOL Maldito en MINECRAFT,Trolleé a Mis Amigos con El HOMBRE Del SOL Maldito en MINECRAFT,DanoMC,UCayC0ZYU9iq5PyuDG18BVsA,20,Gaming,"minecraft pero, minecraft 100 dias, El HOMBRE Del SOL, MINECRAFT, danomc, dano, mc, minecraft, danomc minecraft, minecraft bedrock, Trolleé a Mis Amigos con El HOMBRE Del SOL, trollee a mi amigo en minecraft, trollee a mis amigos en minecraft, trolleo a mis amigos en minecraft danomc, danomc terror, suntown, sun man minecraft, sunman, sunman doctor nowhere, minecraft horror, minecraft de terror, danomc minecraft miedo, danomc trolea a arsel, danomc sobrevivi, minecraft troll, keciyo",26,https://i.ytimg.com/vi/Ytb6o7o3UzQ/hqdefault.jpg,es-ES,es-ES,False,1404,PT23M24S,hd,False,True,False,False,110987,3436,170
J9-vnds90wQ,PE,2026-05-07T04:12:50.709607+00:00,2026-05-04T19:00:14Z,Alphaville - Forever Young (Sub. Español + Lyrics),Alphaville - Forever Young (Sub. Español + Lyrics),nostalgia lyrics.,UCaxjS8mdF402rdn1hP6_1_Q,10,Music,,0,https://i.ytimg.com/vi/J9-vnds90wQ/hqdefault.jpg,es,es,False,227,PT3M47S,hd,False,True,False,False,631886,3447,15
b5CUn3Aqv9s,PE,2026-05-07T04:12:50.709614+00:00,2026-05-07T00:00:06Z,ASÍ ES COMO SANTANA JUEGA FREE FIRE !! ¿USA HACKS? - TheDonato,ASÍ ES COMO SANTANA JUEGA FREE FIRE !! ¿USA HACKS? - TheDonato,TheDonato,UCaHEdZtk6k7SVP-umnzifmQ,20,Gaming,,0,https://i.ytimg.com/vi/b5CUn3Aqv9s/hqdefault.jpg,es,es,False,1832,PT30M32S,hd,False,True,False,False,177611,10976,357
fRgPtctQm1o,PE,2026-05-07T04:12:50.709621+00:00,2026-05-04T13:04:50Z,Grupo Niche - Gotas de Lluvia (Letra),Grupo Niche - Gotas de Lluvia (Letra),DopeMusic,UCgE4xXqtDwfmlpcQ5dFF5Fg,10,Music,"gotas de lluvia, grupo niche gotas de lluvia, gotas de lluvia grupo niche, grupo niche, gotas de lluvia letra, Gotas de Lluvia, Gotas de Lluvia Letra, Letra Gotas de Lluvia, Grupo Niche, Grupo Niche Gotas de Lluvia, Gotas de Lluvia Grupo Niche, Grupo Niche Gotas de Lluvia Letra, Letra Grupo Niche Gotas de Lluvia, Grupo Niche Letra, Grupo Niche Letra Gotas de Lluvia, Gotas de Lluvia Letra Grupo Niche, Gotas de Lluvia Grupo Niche Letra, salsa, salsa clásica, grupo niche gotas",20,https://i.ytimg.com/vi/fRgPtctQm1o/hqdefault.jpg,es,es,False,354,PT5M54S,hd,False,True,False,False,108298,104,3
4W9SDkYv1Nk,PE,2026-05-07T04:12:50.709628+00:00,2026-05-06T18:15:01Z,el MEJOR JUEGO de PELEA de ANIME en ROBLOX,el MEJOR JUEGO de PELEA de ANIME en ROBLOX,AQUISI blox,UCMRY4UxN5qiRWsAZrDqoDGg,20,Gaming,"aquino, aquisi, roblox, aquinoby2002, juega roblox, con amigos, aquisiblox, aquinoblox, bobux, 2026, el mejor, juego, de pelea, anime, en roblox, combate, versus, efectos, pvp, duxo, natalan, hero, soarinng, golpes, explosiones, anime pelea",26,https://i.ytimg.com/vi/4W9SDkYv1Nk/hqdefault.jpg,es,es-419,False,1377,PT22M57S,hd,False,True,False,False,111668,9614,311
ILVvje-GLco,PE,2026-05-07T04:12:50.709636+00:00,2026-05-04T23:00:16Z,Reik - Me duele amarte (Letra/Lyrics),Reik - Me duele amarte (Letra/Lyrics),ROSES,UC3OcsnHmfLzw0jSOr5ZYO3A,10,Music,"latin music, lyrics, letra, roses, music, rosas, musica, letras, Reik, Me duele amarte, Me duele amarte letra, Me duele amarte lyrics, Reik letra, Pop, Letras de canciones, Reik exitos, oficial, Musica para el alma, Melancolia, Letra Me duele amarte, Exitos inolvidables, Mexico, Letra completa, Balada pop, Romanticas, Triste realidad",26,https://i.ytimg.com/vi/ILVvje-GLco/hqdefault.jpg,es,es,False,194,PT3M14S,hd,False,True,False,False,21010,55,2
f_5C_oBILSs,PE,2026-05-07T04:12:50.709643+00:00,2026-05-06T21:15:02Z,El FINAL SECRETO que NADIE VIÓ en SUPER BEAR ADVENTURE !!,El FINAL SECRETO que NADIE VIÓ en SUPER BEAR ADVENTURE !!,DeGoBooM,UCj9rK3jt8qmih4mZX0UL67g,20,Gaming,"degoboom, dego, dg, bumi, sba, super bear adventure",6,https://i.ytimg.com/vi/f_5C_oBILSs/hqdefault.jpg,es-419,es-419,False,1108,PT18M28S,hd,False,True,False,False,130704,2416,110
3L11vQlvFyI,PE,2026-05-07T04:12:50.709650+00:00,2026-05-02T23:00:03Z,KAROL G - Amargura (Letra),KAROL G - Amargura (Letra),Sonalux,UC4t5Ht7gCo89-2r47qhdfzg,10,Music,,0,https://i.ytimg.com/vi/3L11vQlvFyI/hqdefault.jpg,es,es,False,171,PT2M51S,hd,False,True,False,False,90766,130,4
jhLU7coNNjc,PE,2026-05-07T04:12:50.709657+00:00,2026-05-06T20:23:08Z,FUIMOS PADRES TURBIOS EN BROOKHAVEN 😳🔥,FUIMOS PADRES TURBIOS EN BROOKHAVEN 😳🔥,Zuu,UCAPRvefW8bocWIZm2_M7N2Q,22,People & Blogs,,0,https://i.ytimg.com/vi/jhLU7coNNjc/hqdefault.jpg,es,es-419,False,530,PT8M50S,hd,False,True,False,False,71756,5153,589
5ToX0PUY5_4,PE,2026-05-07T04:12:50.709664+00:00,2026-04-30T20:07:44Z,Whitney Houston - I Have Nothing (Lyrics),Whitney Houston - I Have Nothing (Lyrics),Invited Kingdom,UCFWHWqcDEfkngrRFKUOxDlg,22,People & Blogs,"Whitney Houston - I Have Nothing (Lyrics), Whitney Houston - I Have Nothing, I Have Nothing, Whitney Houston, Lyrics, lyrics",6,https://i.ytimg.com/vi/5ToX0PUY5_4/hqdefault.jpg,en,en,False,288,PT4M48S,hd,False,True,False,False,335902,546,16
lTtTu0pO96w,PE,2026-05-07T04:12:50.709671+00:00,2026-05-06T18:21:59Z,Sobrevivimos 100 DIAS ESCAPANDO del ZOO en Roblox...,Sobrevivimos 100 DIAS ESCAPANDO del ZOO en Roblox...,AwitaDos,UCJ5v9VGVca67dg0nLrohopQ,20,Gaming,,0,https://i.ytimg.com/vi/lTtTu0pO96w/hqdefault.jpg,es,es,False,1064,PT17M44S,hd,False,True,False,False,97596,2226,98
PYwT85hwXi0,PE,2026-05-07T04:12:50.709678+00:00,2026-05-01T16:00:43Z,La 5a Estación - El Sol No Regresa (Letra),La 5a Estación - El Sol No Regresa (Letra),Another Art.,UCi9F3ZhHck3kK2-tkakHKfQ,10,Music,,0,https://i.ytimg.com/vi/PYwT85hwXi0/hqdefault.jpg,es,en,False,229,PT3M49S,hd,False,True,False,False,141348,96,1
0_vYC_7uBs8,PE,2026-05-07T04:12:50.709685+00:00,2026-05-06T20:05:53Z,Sobreviví SIN COMER CARNE en 99 NOCHES en el BOSQUE ROBLOX...,Sobreviví SIN COMER CARNE en 99 NOCHES en el BOSQUE ROBLOX...,SoyPato,UCFP33-zlNfJVzWUUbdhSjTQ,20,Gaming,"roblox, roblox español, roblox divertido, roblox fyp, roblox humor, roblox momentos divertidos, roblox roblox, roblox funny, roblox 99 noches en el bosque, 99 noches en el bosque, sobrevive 99 dias en el bosque, 99 noches en el bosque roblox, soypato, soypato 99 noches, rompi 99 noches, 99 noches solo verduras, 99 noches sin carne, 99 noches en el bosque sin carne, 99 noches en el bosque sin comer carne, soypato sin carne, soy pato solo verduras, 99 noches sin comer carne",22,https://i.ytimg.com/vi/0_vYC_7uBs8/hqdefault.jpg,es,es,False,648,PT10M48S,hd,False,True,False,False,114544,4133,1113
Jc4eMs09ucY,PE,2026-05-07T04:12:50.709693+00:00,2026-05-02T00:00:17Z,"Sebastian Yatra, Reik - Un Año (Letra)","Sebastian Yatra, Reik - Un Año (Letra)",Secondverse,UC7VlFZzLxACJ3yexHMNyK5Q,22,People & Blogs,,0,https://i.ytimg.com/vi/Jc4eMs09ucY/hqdefault.jpg,es,es,False,164,PT2M44S,hd,False,False,False,False,28329,135,3
J_1qZ9OQ8v8,PE,2026-05-07T04:12:50.709700+00:00,2026-05-06T19:49:41Z,Me Convertí en DRAGON para TROLLEAR a MIS AMIGOS en Minecraft!,Me Convertí en DRAGON para TROLLEAR a MIS AMIGOS en Minecraft!,Jardred,UCyDUULOp3b3JsehZKIIVzrg,20,Gaming,,0,https://i.ytimg.com/vi/J_1qZ9OQ8v8/hqdefault.jpg,es,es,False,1133,PT18M53S,hd,False,True,False,False,97311,4266,234
p746MsnmCfU,PE,2026-05-07T04:12:50.709707+00:00,2026-05-02T15:52:33Z,Prince Royce - Rechazame ‪(Letra),Prince Royce - Rechazame ‪(Letra),HeitMusic,UCzVFOCcRtwo0Ih2vEbZWdug,10,Music,"heitmusic, Official Audio, Prince Royce Rechazame, Rechazame Prince Royce, Prince Royce Official Audio, Rechazame Official Audio, Prince Royce audio, Rechazame audio, Rechazame lyrics, Prince Royce, Rechazame",11,https://i.ytimg.com/vi/p746MsnmCfU/hqdefault.jpg,es,zxx,False,223,PT3M43S,hd,False,True,False,False,31150,60,2
3DDMlTC0v4Y,PE,2026-05-07T04:12:50.709713+00:00,2026-05-06T23:41:33Z,Me transformé en PERRO y me Columpié Por BRAINROTS en Roblox...,Me transformé en PERRO y me Columpié Por BRAINROTS en Roblox...,Speed Amigos,UC_zprl2quhwa19m1BROkAdw,20,Gaming,"roblox, dagar, xturbo, sonic y amy roblox, amy y sonic, turboblox, dagar roblox, videos sonic, amigos roblox, sonic, roblox roleplay, roblox juegos, dagar y nacho, nacho roblox, sonic roblox, sonic .exe, xturbo roblox, amy, roblox dagar, nacho y dagar, noob, obby, speed amigos, Me transformé en PERRO y me Columpié Por BRAINROTS en Roblox...",24,https://i.ytimg.com/vi/3DDMlTC0v4Y/hqdefault.jpg,es,es,False,774,PT12M54S,hd,False,True,False,False,53082,540,19
