video_id,country,fetched_at,published_at,title,localized_title,channel_title,channel_id,category_id,category_name,tags,tag_count,thumbnail,default_language,audio_language,is_live,duration,duration_raw,definition,caption_available,licensed_content,embeddable,made_for_kids,views,likes,comments
_pjycIhNCBU,PA,2026-03-22T03:26:00.176769+00:00,2026-03-21T01:00:06Z,"Andiex - CHARLYZA FT. KBChappo, Don Pablo Mures","Andiex - CHARLYZA FT. KBChappo, Don Pablo Mures",Andiex,UCInNyiaeiHwUZNloG9Idkng,10,Music,"Andiex, andiex, dancehall, trap, hip hop, rap, andiex album, andiex gangsta, money and future, constancy music, ANDIEX, reggaeton, andiex money and future, andiex money, andiex traqueteando, money and future andiex, dancehall panama, dancehall panameño, plenas, plenas panameñas, andiex panama",21,https://i.ytimg.com/vi/_pjycIhNCBU/hqdefault.jpg,es,es-419,False,206,PT3M26S,hd,False,False,False,False,40318,3112,195
dZJ9_sgGXKg,PA,2026-03-22T03:26:00.176809+00:00,2026-03-18T11:10:20Z,SPIDER-MAN: UN NUEVO DÍA Tráiler Español Latino (2026),SPIDER-MAN: UN NUEVO DÍA Tráiler Español Latino (2026),ONE Media Español,UCcVNDl7ZJMf9lC9a34CY4RA,1,Film & Animation,"Tráiler, Película, Español, Latino, 2026, Spider-Man, Spiderman, Spider-Man Un Nuevo Día, Spider-Man Un Nuevo Día Tráiler, Tom Holland, Zendaya, Sadie Sink, Jon Bernthal, Marvel, Spider-Man Brand New Day, Superheroé, MCU",17,https://i.ytimg.com/vi/dZJ9_sgGXKg/hqdefault.jpg,es,es-419,False,173,PT2M53S,hd,False,True,False,False,2966805,103368,5658
nLVxZ4jZe6E,PA,2026-03-22T03:26:00.176822+00:00,2026-03-21T23:30:06Z,Encontramos a Los Arabes Para Desmantelar A Mi Enemiga,Encontramos a Los Arabes Para Desmantelar A Mi Enemiga,RDjavi,UCzjF2EUojZ1hVd_JVKhbCJA,20,Gaming,"rdjavi, gta, carros potentes, los mejores carros de gta, El cojo, cojoaventuras, creativos rp, danirep, vegeta777, mexico, roleplay, rp, ibai carreras gta, auron carreras, colombia, panama, venezuela, argentina, gaming españa, rolplay, rdjavi live, Rdjavi, nos fugamos, honda, honda turbo, rescate, traidores, agentes, RB26, r34, Usamos un R34 Alterado Para fugarnos, nos fugamos de prision, rb26 alterado, fuga de la carcel, como fugarse de prision, corredor, awd, contrarios, ex enemigo, brujo, habibi",41,https://i.ytimg.com/vi/nLVxZ4jZe6E/hqdefault.jpg,es,es,False,1498,PT24M58S,hd,False,True,False,False,365060,40433,2528
b4iVv91Z6lY,PA,2026-03-22T03:26:00.176833+00:00,2026-03-20T03:58:06Z,BTS (방탄소년단) ‘SWIM’ Official MV,BTS (방탄소년단) ‘SWIM’ Official MV,HYBE LABELS,UC3IZKseVpdzPSBaWxBxundA,10,Music,"HYBE, HYBE LABELS, 하이브, 하이브레이블즈",4,https://i.ytimg.com/vi/b4iVv91Z6lY/hqdefault.jpg,ko,ko,False,245,PT4M5S,hd,True,True,False,False,45563297,5175858,811645
Pw1X-57Ms-8,PA,2026-03-22T03:26:00.176841+00:00,2026-03-18T11:05:00Z,Spider-Man Un Nuevo Día | Tráiler Oficial (Doblado),Spider-Man Un Nuevo Día | Tráiler Oficial (Doblado),SonyPicturesMéxico,UC_2POp0ILf48h6T5JqsiMBw,1,Film & Animation,"Movie, Film, Sony Pictures, Spider-Man, Destin Daniel Cretton, Tom Holland, Zendaya, Sadie Sink, Jacob Batalon, Jon Bernthal, Tramell Tillman, Michael Mando, Mark Ruffalo",13,https://i.ytimg.com/vi/Pw1X-57Ms-8/hqdefault.jpg,es,es-MX,False,153,PT2M33S,hd,True,True,False,False,2684162,150265,6205
1A2slvmzwx8,PA,2026-03-22T03:26:00.176849+00:00,2026-03-21T21:22:18Z,Evolución de AVIÓN de POBRE a AVIÓN de MILLONARIO en Minecraft,Evolución de AVIÓN de POBRE a AVIÓN de MILLONARIO en Minecraft,Nacho,UC8EkcHOycB94lHDkbAPSnQA,20,Gaming,"nacho, dagar, nacho minecraft, dagar y nacho, nacho y dagar, minecraft, minecraft mod, amigos, amigos minecraft, dinero, dinero minecraft, millonario minecraft, rico minecraft, pobre minecraft, de pobre a rico, chico pobre, chico rico, chico millonario, de rico a pobre, millonario, casa millonario, lia minecraft, de casa pobre a casa millonario, avion minecraft, avion rico, avion pobre, avion de diamante, avion de tierra minecraft, avion millonario, jet privado minecraft, avion",31,https://i.ytimg.com/vi/1A2slvmzwx8/hqdefault.jpg,es,es,False,1234,PT20M34S,hd,False,True,False,False,390408,6485,258
IAMBPsFPK0I,PA,2026-03-22T03:26:00.176858+00:00,2026-03-21T14:00:33Z,"ARIA VEGA, Ryan Castro - CHÉVERE (Letra/Lyrics)","ARIA VEGA, Ryan Castro - CHÉVERE (Letra/Lyrics)",7clouds,UCNqFDjYTexJDET3rPDrmJKg,10,Music,"chevere, chevere letra, letra chevere, chevere lyrics, lyrics chevere, aria vega, ryan castro, letra, lyrics, aria vega chevere, aria vega chevere letra, aria vega chevere lyrics, ryan castro chevere, ryan castro chevere lyrics, ryan castro chevere letra, aria vega ryan castro chevere, aria vega ryan castro chevere letra, chevere premium remix, chevere premium remix letra, aria vega ryan castro chevere premium remix, aria vega ryan castro chevere premium remix letra, latin, pop",23,https://i.ytimg.com/vi/IAMBPsFPK0I/hqdefault.jpg,es,en,False,221,PT3M41S,hd,False,True,False,False,89678,734,36
sY4JTS6gKTs,PA,2026-03-22T03:26:00.176867+00:00,2026-03-18T15:50:49Z,"TRAILER Spider-Man Brand New Day confirmó mutación ARAÑA, Jean Grey, Scorpion, Punisher, explicado","TRAILER Spider-Man Brand New Day confirmó mutación ARAÑA, Jean Grey, Scorpion, Punisher, explicado",Pelicomic,UCsMzBY3X_RS6GhGBiHXW19A,24,Entertainment,,0,https://i.ytimg.com/vi/sY4JTS6gKTs/hqdefault.jpg,es-419,es-419,False,1563,PT26M3S,hd,False,True,False,False,796601,44142,2388
x5JXbfCS-lo,PA,2026-03-22T03:26:00.176876+00:00,2026-03-21T17:16:32Z,"LA ULTIMA AVENTURA (Minecraft Pokemon, Episodio 25)","LA ULTIMA AVENTURA (Minecraft Pokemon, Episodio 25)",Rubius Z,UCcjIvuxmWlS5IEQ0JdPV4Ng,20,Gaming,"elrubius, rubius, minecraft, pokemon, serie, minecraft pokemon, pokemon mod minecraft, mod, Rubius pokemon, cobbleverse, Cobbleverse rubius, minecraft survival, minecraft con pokemons, gameplay, mods, pikachu, Eevee, rubius pokemon mod, Pokémon, shiny, 2026, nuevo, nueva, nueva serie, capitulo, meme, memes, epic, mewtwo, end, legendario, ep 25, capitulo final, final, azul, gary, final serie, chepamon final, final pokecraft, tnt, nuke, karen, mento, bruno, koga, lance, final liga pokemon, liga pokemon, basculin",49,https://i.ytimg.com/vi/x5JXbfCS-lo/hqdefault.jpg,es,es,False,4028,PT1H7M8S,hd,False,True,False,False,665558,56505,2834
RBaSiVjtKR4,PA,2026-03-22T03:26:00.176886+00:00,2026-03-20T04:00:34Z,Body to Body,Body to Body,BTS - Topic,UC9vrvNSL3xcWGSkV86REBSg,10,Music,"BTS, 방탄소년단, ARIRANG, Body to Body",4,https://i.ytimg.com/vi/RBaSiVjtKR4/hqdefault.jpg,en,ko,False,190,PT3M10S,hd,False,True,False,False,9502377,910975,45266
UyWVdeFvrgY,PA,2026-03-22T03:26:00.176894+00:00,2026-03-18T14:07:28Z,LLEGA TRAILER: Spider Man Brand New Day - The Top Comics,LLEGA TRAILER: Spider Man Brand New Day - The Top Comics,The Top Comics,UCiBwOVBljEjcsLUjwI274Xw,1,Film & Animation,,0,https://i.ytimg.com/vi/UyWVdeFvrgY/hqdefault.jpg,es-419,es-419,False,786,PT13M6S,hd,False,True,False,False,713911,39907,1370
37xSttiP5J8,PA,2026-03-22T03:26:00.176902+00:00,2026-03-21T21:50:12Z,"✅ [RESUMEN] 👉CUEVAS de AZUFRE, SULFUR CUBE - Chaos Cubed Update","✅ [RESUMEN] 👉CUEVAS de AZUFRE, SULFUR CUBE - Chaos Cubed Update",Bobicraft,UCMQOumrt3C7fFRT8oBc436Q,20,Gaming,"minecraft animation, minecraft, Minecraft, MINECRAFT, bobicraft, Bobicraft, bobycraft, Bobycraft, minecraft curiosidades, secreto, truco, snapshot, minecraft construcciones, building, noticias, minecraft bedrock edition, MC PE, resumen, Fue Bobi, minecraft but, minecraft survival, noob vs pro, minecraft mods, #minecraft, que pasaria si, minecraft mania, bobby, SULFUR CAVES, CINNABAR BLOCKS, sulfur caves, azufre, sulfur block, slime azufre, minecraft world, live, moonlight, dungeons 2",37,https://i.ytimg.com/vi/37xSttiP5J8/hqdefault.jpg,es,es,False,655,PT10M55S,hd,False,True,False,False,272295,25199,2052
l3XjHJB1G3U,PA,2026-03-22T03:26:00.176910+00:00,2026-02-26T14:28:57Z,Ey Saba,Ey Saba,El Yeyo PP - Topic,UCfeLEgDmhYiL00n76-0OKqQ,10,Music,"El Yeyo PP, Italian Somali, Ey Saba",3,https://i.ytimg.com/vi/l3XjHJB1G3U/hqdefault.jpg,ca,es,False,219,PT3M39S,hd,False,True,False,False,47729,603,8
3_9vCamtuPY,PA,2026-03-22T03:26:00.176918+00:00,2026-03-17T16:19:02Z,Dune: Part Three | Official Teaser Trailer,Dune: Part Three | Official Teaser Trailer,Warner Bros.,UCjmJDM5pRKbUlVIzDYYWb6g,1,Film & Animation,"Action, Anya Taylor-Joy, Brian K Vaughan, Charlotte Rampling, Coming Soon, Denis Villeneuve, Dune, Dune Messiah, Dune: Part Three, Florence Pugh, Ida Brooke, Isaach De Bankolé, Jason Momoa, Javier Bardem, Messiah, Nakoa-Wolf Momoa, Rebecca Ferguson, Robert Pattinson, Sci Fi, Timothée Chalamet, Trilogy, Warner Bros, Zendaya",23,https://i.ytimg.com/vi/3_9vCamtuPY/hqdefault.jpg,en,en-US,False,150,PT2M30S,hd,True,False,False,False,19756350,560599,26988
1us5cjIshGM,PA,2026-03-22T03:26:00.176926+00:00,2026-03-20T19:34:05Z,Atrapados en ISLAS de TRANSFORMERS en Minecraft!,Atrapados en ISLAS de TRANSFORMERS en Minecraft!,Dagar,UCEs5MQjXJq27-X2vgdwtYDw,20,Gaming,"Minecraft, minecraft mod, dagar y nacho, nacho y dagar, amigos minecraft, dagar minecraft, minecraft dagar",7,https://i.ytimg.com/vi/1us5cjIshGM/hqdefault.jpg,es,es,False,1375,PT22M55S,hd,False,True,False,False,1004103,11061,502
NgRnbfWQmvw,PA,2026-03-22T03:26:00.176934+00:00,2026-03-19T07:00:00Z,Beéle - quédate (Letra/Lyrics),Beéle - quédate (Letra/Lyrics),SoundKream,UCvWhPqiJBsdsZmM9cEzQorg,10,Music,"quedate beele letra, beele quedate letra, beele - quedate letra, beele quedate lyrics, quedate letra beele, beele quedate letra lyrics, letra beele quedate, letra quedate beele, beele - quedate, quedate beele, beele quedate, quedate beele lyrics, beele letra quedate, beele - quedate (letra), letra video for quedate by beele, quedate by beele, quedate lyrics, quedate acustico beele, quedate letra, Beéle, quédate letra, quédate karaoke, letra, quédate, lyrics, karaoke",26,https://i.ytimg.com/vi/NgRnbfWQmvw/hqdefault.jpg,es,es,False,177,PT2M57S,hd,False,True,False,False,1665189,1891,14
esb1CBW2WK8,PA,2026-03-22T03:26:00.176949+00:00,2026-03-17T17:01:04Z,White Fox: The Kumiho Strikes Back | Character Reveal Trailer | Marvel Rivals,White Fox: The Kumiho Strikes Back | Character Reveal Trailer | Marvel Rivals,Marvel Rivals,UCWzmOSSiSPbVnVu3ZAyDx2w,20,Gaming,"Marvel Rivals, Marvel games, Marvel, White Fox",4,https://i.ytimg.com/vi/esb1CBW2WK8/hqdefault.jpg,en,en,False,79,PT1M19S,hd,False,False,False,False,5025053,48922,3293
wAtZN4G8zPQ,PA,2026-03-22T03:26:00.176957+00:00,2026-03-22T00:00:06Z,LE QUITE LOS DIAMANTES NEGATIVOS A LA CUENTA de UN SEGUIDOR en FREE FIRE !! - TheDonato,LE QUITE LOS DIAMANTES NEGATIVOS A LA CUENTA de UN SEGUIDOR en FREE FIRE !! - TheDonato,TheDonato,UCaHEdZtk6k7SVP-umnzifmQ,20,Gaming,,0,https://i.ytimg.com/vi/wAtZN4G8zPQ/hqdefault.jpg,es,es,False,958,PT15M58S,hd,False,True,False,False,176633,14042,559
FKEW-aWTtiQ,PA,2026-03-22T03:26:00.176964+00:00,2026-03-20T01:23:54Z,Monda - Italian Somali ft Yemil,Monda - Italian Somali ft Yemil,Italian Somali,UCiBZoJdjkLfE-tA4fzM-e0g,10,Music,,0,https://i.ytimg.com/vi/FKEW-aWTtiQ/hqdefault.jpg,en,es,False,205,PT3M25S,hd,False,True,False,False,22650,563,33
09ngS5cjJ1k,PA,2026-03-22T03:26:00.176972+00:00,2026-03-16T22:23:59Z,Encontre Todos Los Trailers De Poppy Playtime Chapter 6 / Teaser Trailer Misterios y Secretos,Encontre Todos Los Trailers De Poppy Playtime Chapter 6 / Teaser Trailer Misterios y Secretos,Omenasito,UC0C8Zen__w6b16cN2KecZig,20,Gaming,"gameplay español latino, poppy playtime, poppy, omenaso, jugando como, jugando poppy playtime, garten of banban, juego completo, gameplay gracioso, todos los finales, poppy playtime juego completo, memes, poppy playtime 5, Poppy playtime chapter 5, poppy playtime capitulo 5, poppy 5, prototipo, experimento 1102, trailer poppy playtime 5, lily lovebraids, huggy wuggy, el prototipo 1006, final, trailer poppy playtime 6, poppy playtime teaser, poppy playtime trailer, poppy 6",27,https://i.ytimg.com/vi/09ngS5cjJ1k/hqdefault.jpg,es,es,False,1088,PT18M8S,hd,False,True,False,False,671811,21981,2128
cleE1uw2CpA,PA,2026-03-22T03:26:00.176980+00:00,2026-03-21T23:50:14Z,Adoptado por el GATO en Minecraft!,Adoptado por el GATO en Minecraft!,Awita,UC62nFXtc3KNujp9LCPJt-sA,20,Gaming,,0,https://i.ytimg.com/vi/cleE1uw2CpA/hqdefault.jpg,es,es-419,False,1624,PT27M4S,hd,False,True,False,False,117310,3855,541
X0P-6w4WkM4,PA,2026-03-22T03:26:00.176987+00:00,2026-03-14T21:45:00Z,Gilberto Santa Rosa - Que Alguien Me Diga (Letra),Gilberto Santa Rosa - Que Alguien Me Diga (Letra),SabroSón,UCz-jVF7_acwSvt30vGJRTOw,10,Music,"letra, Que Alguien Me Diga lyrics, Letra Que Alguien Me Diga, Lyrics Que Alguien Me Diga, salsa romantica, salsa clasica, salsa vieja escuela, clasicos de la salsa, musica latina, canciones de desamor, salsa para dedicar, balada salsera, hit salsero, amor y despecho, video con letra, lyric video, letra oficial",17,https://i.ytimg.com/vi/X0P-6w4WkM4/hqdefault.jpg,es,es,False,293,PT4M53S,hd,False,True,False,False,764518,1301,6
g5_uIA-TPB4,PA,2026-03-22T03:26:00.176995+00:00,2026-03-09T21:33:46Z,SUPER MARIO GALAXY LA PELÍCULA Tráiler Final Español Latino (2026),SUPER MARIO GALAXY LA PELÍCULA Tráiler Final Español Latino (2026),Boxoffice Tráilers Español,UCdW_XfqcobQ79Oj4ur6-Ylg,1,Film & Animation,"tráiler, tráiler espanol, tráiler latino, latino, The Super Mario Galaxy, The Super Mario Galaxy Tráiler, Mario, Luigi, Yoshi, 2026, Tráiler 2",11,https://i.ytimg.com/vi/g5_uIA-TPB4/hqdefault.jpg,es,es,False,159,PT2M39S,hd,False,True,False,False,1069078,24508,1145
KINA-t6uEUY,PA,2026-03-22T03:26:00.177002+00:00,2026-03-21T23:27:47Z,😈ADMIN😈ABUSE😈NUEVO😈SETAP😈NOSE😈QUE😈HACER😈,😈ADMIN😈ABUSE😈NUEVO😈SETAP😈NOSE😈QUE😈HACER😈,ElAbrahaham,UColTsB6zogXWooPbeO67Wgw,24,Entertainment,,0,https://i.ytimg.com/vi/KINA-t6uEUY/hqdefault.jpg,es-MX,es-419,False,17620,PT4H53M40S,hd,False,True,False,False,976319,35082,311
WajjSyL9ZKQ,PA,2026-03-22T03:26:00.177009+00:00,2026-03-19T01:00:06Z,ROCKSTAR - El Zeta x @donpablomures x Yemil x @jeyson_  ( VIDEO OFICIAL ),ROCKSTAR - El Zeta x @donpablomures x Yemil x @jeyson_  ( VIDEO OFICIAL ),El Zeta,UCGyGOvw14o6EHqwqAFc4IUQ,10,Music,,0,https://i.ytimg.com/vi/WajjSyL9ZKQ/hqdefault.jpg,es,es,False,215,PT3M35S,hd,False,False,False,False,20567,745,42
4lFnIlH06Sw,PA,2026-03-22T03:26:00.177016+00:00,2026-03-06T20:00:07Z,Digital Circus Ep 8 Trailer.,Digital Circus Ep 8 Trailer.,GLITCH,UCn_FAXem2-e3HQvmK-mOH4g,1,Film & Animation,"glitch, glitch productions, digital circus, the amazing digital circus, murder drones, Pomni, Uzi, Jax, Ragatha, Kinger, Gangle, Zooble, Caine, Bubble, 3D, Animation, 3D Animation, Indie Animation, Gummigoo",19,https://i.ytimg.com/vi/4lFnIlH06Sw/hqdefault.jpg,en,en,False,67,PT1M7S,hd,True,True,False,False,17661560,881081,53226
Is5IswM87EQ,PA,2026-03-22T03:26:00.177023+00:00,2026-03-21T17:45:23Z,Minecraft LIVE - March 2026,Minecraft LIVE - March 2026,Minecraft,UC1sELGmy5jp5fQUugmuYlXQ,20,Gaming,"Minecraft, MCL, Minecraft Live, 2025, September, MinecraftLive, Vanilla, deepdig, deep dig, after show, pre show, preshow, Mojang, Xbox, Microsoft, Game Pass, Xbox Game Pass, Minecraft News, Minecraft Update",19,https://i.ytimg.com/vi/Is5IswM87EQ/hqdefault.jpg,en,en,False,1282,PT21M22S,hd,True,False,False,False,2455676,142822,6391
cBoelVFyBEE,PA,2026-03-22T03:26:00.177031+00:00,2026-03-21T00:00:00Z,"MIDNVGHT, ROA, MORA, ELADIO CARRIÓN, CLARENT - Falsas Promesas (Remix)","MIDNVGHT, ROA, MORA, ELADIO CARRIÓN, CLARENT - Falsas Promesas (Remix)",Midnvght,UC8tis2WkNnjR08-5-ZhWKRw,10,Music,,0,https://i.ytimg.com/vi/cBoelVFyBEE/hqdefault.jpg,es,es-419,False,421,PT7M1S,hd,False,True,False,False,124978,13657,315
XNQbH1SDPRk,PA,2026-03-22T03:26:00.177038+00:00,2026-03-05T17:00:58Z,The Boys – Final Season Trailer | Prime Video,The Boys – Final Season Trailer | Prime Video,Prime Video,UCQJWtTnAHhEG5w4uN0udnUQ,24,Entertainment,"the boys, the boys season 5, the boys s5, the boys season 5 trailer, the boys season 5 teaser, the boys s5 trailer, the boys s5 teaser, the boys final season, the boys final season trailer, butcher vs soldier boy, butcher vs soldier boy rematch, homelander vs butcher, butcher vs homelander, soldier boy vs butcher, homelander and ryan, butcher vs hughie, hughie vs butcher, the boys final season trailer breakdown, the boys season 5 trailer breakdown, the boys season 5 theories",20,https://i.ytimg.com/vi/XNQbH1SDPRk/hqdefault.jpg,en,en,False,162,PT2M42S,hd,True,True,False,False,6623165,308377,13003
oMV7bGZwSwg,PA,2026-03-22T03:26:00.177046+00:00,2026-03-21T01:37:08Z,CONSTRUI EL ORFANATO EN MINECRAFT,CONSTRUI EL ORFANATO EN MINECRAFT,El Guarura,UC-iurY3-ofzt00BH_sjSU8w,24,Entertainment,"el guarura, vecinos de fede, fede vigevani, vecibanda, federico vigevani, carlitoz, fede, somos nosotros, galletita, piculin, soy galletita, soy piculin, galletita y piculin, jerry castler, quico, piculincito, yankee, soy piculincito, el yankee, yankee 32, teamtrax, antrax, eddy, eddy skabeche, bryan, bryan skabeche, skuad, team leyenda, arenovitz, soy guarura, guarura, YOLO, yolo aventuras, yo soy plex, plex, argentina, mexico, luli, duffy, deep web, alfa, beta, payasos, miedo, terror, horror, misterio",47,https://i.ytimg.com/vi/oMV7bGZwSwg/hqdefault.jpg,es,es-MX,False,2185,PT36M25S,hd,False,True,False,False,1175515,33630,2548
qnYKcPDeMUc,PA,2026-03-22T03:26:00.177053+00:00,2026-03-19T23:34:49Z,Sube la marea (Remix 2026),Sube la marea (Remix 2026),Gaitanes,UCTVZTqzNKeszE3xnCJmgOkg,10,Music,,0,https://i.ytimg.com/vi/qnYKcPDeMUc/hqdefault.jpg,es,es-419,False,267,PT4M27S,sd,False,False,False,False,7103,526,0
X6EHtzcmiPw,PA,2026-03-22T03:26:00.177060+00:00,2026-03-05T00:00:00Z,BTS THE COMEBACK LIVE | ARIRANG | Official Trailer | Netflix,BTS THE COMEBACK LIVE | ARIRANG | Official Trailer | Netflix,Netflix,UCWOA1ZGywLbqmigxE4Qlvuw,24,Entertainment,"Arirang, Army, BTS, BTS Army, Band, BigHit, Comeback, Concert, HYBE, Icons, Jimin, Jin, Jung Kook, Live Concert, Music, Netflix, Netflix Live, New Album, Performance, RM, Singing, Suga, j-hope",23,https://i.ytimg.com/vi/X6EHtzcmiPw/hqdefault.jpg,en,en-US,False,92,PT1M32S,hd,True,True,False,False,3844854,463072,28995
4u_7Xt9wBOA,PA,2026-03-22T03:26:00.177068+00:00,2026-03-21T16:56:52Z,VIAJÉ CON MIS AMIGOS en BROOKHAVEN,VIAJÉ CON MIS AMIGOS en BROOKHAVEN,SoyWelix Brookhaven,UCObgc5yL3AkW0Oj1uik2IcQ,22,People & Blogs,,0,https://i.ytimg.com/vi/4u_7Xt9wBOA/hqdefault.jpg,es,es,False,741,PT12M21S,hd,False,True,False,False,187803,2910,161
EcABH9j566k,PA,2026-03-22T03:26:00.177075+00:00,2026-03-20T23:00:06Z,MR. SAIK X ISACU - LA ROJA VA A BRILLAR (VIDEO OFICIAL),MR. SAIK X ISACU - LA ROJA VA A BRILLAR (VIDEO OFICIAL),Mr. Saik,UCCiM2yrThEfHBCzsvLTtpiw,10,Music,"Mr. Saik Official, isacu, panama, mundial estados unidos, mundial 2026, messi, lamine yamal, mbappe, real madrid, musica del mundial, himno del mundial 2026, musica de futbol, edits de futbol, isacu mr saik, canciones virales panama, reggae, ryan castro, j balvin, shakira, beele, ozuna, bad bunny, puerto rico",23,https://i.ytimg.com/vi/EcABH9j566k/hqdefault.jpg,es,es-419,False,120,PT2M,hd,False,False,False,False,21661,413,80
rj6S0uwHv9U,PA,2026-03-22T03:26:00.177082+00:00,2026-03-21T16:13:52Z,EL PARQUE ACUÁTICO MÁS GRANDE !! | Waterpark Simulator - Parte 4,EL PARQUE ACUÁTICO MÁS GRANDE !! | Waterpark Simulator - Parte 4,Iker Unzu,UCQW8tWGYajwUv6jdQ2kmsRw,20,Gaming,"iker unzu, iker tiktok, iker unzu tiktok, iker, comedia, sketches de comedia, iker comedia, Waterpark Simulator, Parque Acuático, Patitoland",10,https://i.ytimg.com/vi/rj6S0uwHv9U/hqdefault.jpg,es,es,False,3245,PT54M5S,hd,False,True,False,False,388349,21241,3930
iKYWYoaonkA,PA,2026-03-22T03:26:00.177090+00:00,2026-03-20T01:38:59Z,"Greeicy, Cultura Profética - Mantis (Official Video)","Greeicy, Cultura Profética - Mantis (Official Video)",GreeicyVEVO,UCf-Szc6YLd8rMnMXGThznFg,10,Music,"Greeicy, Cultura Profética, Universal Music Latino, Latin Pop",4,https://i.ytimg.com/vi/iKYWYoaonkA/hqdefault.jpg,es,es,False,299,PT4M59S,hd,True,True,False,False,331437,14537,556
w0NRXGmAru8,PA,2026-03-22T03:26:00.177097+00:00,2026-03-20T18:01:07Z,SOBREVIVIENDO EN UN SOLO BLOQUE 📦,SOBREVIVIENDO EN UN SOLO BLOQUE 📦,Auron,UCFR2oaNj02WnXkOgLH0iqOA,20,Gaming,"Auron, AuronPlay",2,https://i.ytimg.com/vi/w0NRXGmAru8/hqdefault.jpg,es-ES,es,False,3225,PT53M45S,hd,False,True,False,False,649129,28792,614
K8ZPTHGg3-M,PA,2026-03-22T03:26:00.177105+00:00,2026-03-21T01:00:17Z,Caserio - @el10_x ft traze - @trazemusica1197,Caserio - @el10_x ft traze - @trazemusica1197,El10,UCNrWAoPurg1H7yDFosJYO6A,10,Music,,0,https://i.ytimg.com/vi/K8ZPTHGg3-M/hqdefault.jpg,es,es,False,123,PT2M3S,hd,False,True,False,False,2792,288,34
WZA38zd1xuE,PA,2026-03-22T03:26:00.177112+00:00,2026-03-20T19:45:06Z,BUSCANDO TOCINOS en LA TORRE TROLL MOMENTOS DIVERTIDOS (ROBLOX),BUSCANDO TOCINOS en LA TORRE TROLL MOMENTOS DIVERTIDOS (ROBLOX),RoxiCake Gamer,UC3t7_hgqy-7pccSWRVaTQIw,20,Gaming,"Roblox, Roblox español",2,https://i.ytimg.com/vi/WZA38zd1xuE/hqdefault.jpg,es,es-419,False,667,PT11M7S,hd,False,True,False,False,810109,31830,2088
TwDN5EaVPDA,PA,2026-03-22T03:26:00.177119+00:00,2026-03-18T17:00:47Z,Romeo Santos - Amigo (Letra/Lyrics),Romeo Santos - Amigo (Letra/Lyrics),Último Bailongo,UCHEGWZgPa-WxXfWLUTZca8w,22,People & Blogs,"Romeo Santos Amigo, Amigo letra, Amigo lyrics, Romeo Santos Amigo letra, Romeo Santos Amigo lyrics, Romeo Santos, Romeo Santos letra, Romeo Santos lyrics, bachata, bachata romantica, musica latina, exitos latinos, musica bailable, musica para bailar, hits latinos, canciones para bailar, lo mejor de bachata, mejores canciones de bachata, musica bachata para bailar, Ultimo Bailongo, Último Bailongo",21,https://i.ytimg.com/vi/TwDN5EaVPDA/hqdefault.jpg,es,es,False,232,PT3M52S,hd,False,True,False,False,607483,578,6
FJnu6fmj8rs,PA,2026-03-22T03:26:00.177126+00:00,2026-03-20T15:15:01Z,MODO CARRERA HUMILDE - Episodio.8 (EA SPORTS FC 26),MODO CARRERA HUMILDE - Episodio.8 (EA SPORTS FC 26),ROBERT PG,UC1StC0C68OdfjB9qyJPUF8A,20,Gaming,"EA SPORTS FC, FC MODO CARRERA, MODO CARRERA HUMILDE",3,https://i.ytimg.com/vi/FJnu6fmj8rs/hqdefault.jpg,es,es,False,2850,PT47M30S,hd,False,True,False,False,628891,34845,2084
e-XAUCdY7eQ,PA,2026-03-22T03:26:00.177134+00:00,2026-03-20T18:00:06Z,LIL NAAY - RELACIONADO CON LO REAL (VIDEO OFICIAL),LIL NAAY - RELACIONADO CON LO REAL (VIDEO OFICIAL),Lil Naay,UCYeamd07qoXU1JePbBtFBfA,10,Music,,0,https://i.ytimg.com/vi/e-XAUCdY7eQ/hqdefault.jpg,es,es,False,247,PT4M7S,hd,False,False,False,False,241137,21739,1041
7-NkdWwi0Xs,PA,2026-03-22T03:26:00.177141+00:00,2026-03-21T23:15:00Z,ENTRÉ a los BACKROOMS de BEACH BUGGY RACING !! (Creepypasta),ENTRÉ a los BACKROOMS de BEACH BUGGY RACING !! (Creepypasta),DeGoBooM,UCj9rK3jt8qmih4mZX0UL67g,20,Gaming,"degoboom, dego, dg, bumi, beach buggy racing",5,https://i.ytimg.com/vi/7-NkdWwi0Xs/hqdefault.jpg,es-419,es-419,False,971,PT16M11S,hd,False,True,False,False,104124,2298,192
n8yvRmNUlt0,PA,2026-03-22T03:26:00.177149+00:00,2026-03-16T17:02:49Z,Prince Royce - La Carretera (Letra),Prince Royce - La Carretera (Letra),jostland.,UC1qMwcumipfgTLd3TA1vVZg,10,Music,"la carretera prince royce, la carretera prince royce letra, la carretera prince royce karaoke, la carretera prince royce slowed, la carretera prince royce video oficial, la carretera prince royce remix, la carretera prince royce en vivo, la carretera prince royce guitarra, la carretera prince royce acustico, prince royce la carretera, prince royce la carretera letra, prince royce la carretera karaoke, prince royce la carretera en vivo, letra, lyrics, audio, karaoke, hd, hq, jostland",20,https://i.ytimg.com/vi/n8yvRmNUlt0/hqdefault.jpg,es,es,False,239,PT3M59S,hd,False,True,False,False,1163493,1500,18
lh1clmfaIUk,PA,2026-03-22T03:26:00.177156+00:00,2026-03-21T18:39:55Z,PREMIUM vs VIP! En Brookhaven RP Roblox ,PREMIUM vs VIP! En Brookhaven RP Roblox ,Bere Roblox,UC7llV6PgcR3-4PxntePs9eg,20,Gaming,,0,https://i.ytimg.com/vi/lh1clmfaIUk/hqdefault.jpg,es,es-MX,False,950,PT15M50S,hd,False,True,False,False,199946,4659,1005
LeAFZwzAx-0,PA,2026-03-22T03:26:00.177163+00:00,2026-03-18T00:00:01Z,Eladio Carrión - De Chamaquito (Video Oficial),Eladio Carrión - De Chamaquito (Video Oficial),Eladio Carrion,UC0_95MpNlRz9x7JmsXBClZA,10,Music,"eladio carrion, eladio carrion album, eladio sauce, videos eladio sauce boyz, sauce, boyz, album eladio carrion, album eladio, sauce boyz eladio carrion video, 3MEN2 KRBN, eladio carrion sol maria, sol maria eladio carrion, eladio carrion tqmqa, Eladio Carrio porque puedo, por que puedo eladio carrion, eladio carrion heavyweight, de chamaquito",17,https://i.ytimg.com/vi/LeAFZwzAx-0/hqdefault.jpg,es,es,False,171,PT2M51S,hd,False,True,False,False,928537,66326,3910
P1HtvaAcYKI,PA,2026-03-22T03:26:00.177171+00:00,2026-03-21T18:16:13Z,CELYNNEI TIENE UN CRUSH SECRETO,CELYNNEI TIENE UN CRUSH SECRETO,Soy Nabi,UCSZeDjj0xQd7XTa7OoklqVA,20,Gaming,"nabi, nabi roblox, soynabi, soy nabi, soy nabi y santi, nabi y santi, nabi y celynnei, nabi juegos roblox, historias de roblox, ships de roblox, historias de amor roblox, brookhaven historias roblox, roblox historias ships, historias de amor de roblox, historias de terror de roblox, roblox, humor, entretenimiento, risas, family friendly, niños, videos para niños, brookhaven, jaja, xd, roblox catalogo avatar, terror, brookhaven historias, celynnei crush, celynnei quien es su crush",30,https://i.ytimg.com/vi/P1HtvaAcYKI/hqdefault.jpg,es,zxx,False,870,PT14M30S,hd,False,True,False,False,264224,22293,1852
