video_id,country,fetched_at,published_at,title,localized_title,channel_title,channel_id,category_id,category_name,tags,tag_count,thumbnail,default_language,audio_language,is_live,duration,duration_raw,definition,caption_available,licensed_content,embeddable,made_for_kids,views,likes,comments
24q8t_yisyU,ZA,2026-05-05T03:56:41.055158+00:00,2026-05-01T09:36:38Z,Ngzomthatha,Ngzomthatha,JIKIJIKI - Topic,UCMbP_VFNdSnwmZ4GQU4lYuQ,10,Music,"JIKIJIKI, Stshomi, Jikijiki, Game On, Ngzomthatha",5,https://i.ytimg.com/vi/24q8t_yisyU/hqdefault.jpg,en,und,False,229,PT3M49S,hd,False,True,False,False,193094,8281,269
JRG244IfrRE,ZA,2026-05-05T03:56:41.055196+00:00,2026-04-29T15:00:06Z,One Night Only | Official Trailer,One Night Only | Official Trailer,Universal Pictures,UCq0OueAsdxH6b8nyAspwViw,24,Entertainment,,0,https://i.ytimg.com/vi/JRG244IfrRE/hqdefault.jpg,en-US,en-US,False,145,PT2M25S,hd,True,True,False,False,13260452,45873,1074
BnR5gG7njBc,ZA,2026-05-05T03:56:41.055208+00:00,2026-05-02T04:23:02Z,JJ Can Shapeshift Into ANIMALS To PRANK Mikey in Minecraft,JJ Can Shapeshift Into ANIMALS To PRANK Mikey in Minecraft,Maizen,UCJHBJ7F-nAIlMGolm0Hu4vg,20,Gaming,"Minecraft, Maizen",2,https://i.ytimg.com/vi/BnR5gG7njBc/hqdefault.jpg,en,en,False,1730,PT28M50S,hd,False,True,False,False,1996471,14086,895
4eyU67wF_q8,ZA,2026-05-05T03:56:41.055218+00:00,2026-04-22T10:01:38Z,NGEKE (feat. Scotts Maphuma),NGEKE (feat. Scotts Maphuma),N T S A K O XVI - Topic,UCzKjhfh5ga9mBv_U0rPpYLA,10,Music,"N T S A K O XVI, Shaun 101, Uncool MC, Ch'cco, Scotts Maphuma, NGEKE (feat. Scotts Maphuma), NGEKE",7,https://i.ytimg.com/vi/4eyU67wF_q8/hqdefault.jpg,en,en,False,430,PT7M10S,hd,False,True,False,False,1027022,21737,0
5X1dMFuHZhc,ZA,2026-05-05T03:56:41.055227+00:00,2026-04-27T14:30:04Z,House of the Dragon Season 3 | Official Teaser Trailer | HBO Max,House of the Dragon Season 3 | Official Teaser Trailer | HBO Max,HBO Max,UCx-KWLTKlB83hDI6UKECtJQ,24,Entertainment,"hbo max, hbo, hbo originals, hbo original series, hbo trailer, new on hbo, max, hbo max originals, hbo max trailer, hbo max teaser, hbo max series, hbo max youtube, house of the dragon, house of the dragon season 3, HOTD, house targaryen, rhaenyra targaryen, emma d'arcy, daemon targaryen, matt smith, alicent hightower, olivia cooke, aegon targaryen, tom glynn-carney, aemond targaryen, ewan mitchell, dragons, ser criston cole, fabien frankel, house of the dragon new season",30,https://i.ytimg.com/vi/5X1dMFuHZhc/hqdefault.jpg,en,en,False,115,PT1M55S,hd,True,True,False,False,3491198,99588,4218
_QlWT19BJHc,ZA,2026-05-05T03:56:41.055236+00:00,2026-05-02T19:16:48Z,Does Crime Pay ? : Life In The Hood Ep 12,Does Crime Pay ? : Life In The Hood Ep 12,Manando Live,UCAcBhQLoLN0_zG_zElRH9kg,20,Gaming,"manando gaming, gift manando, beamng drive, stance",4,https://i.ytimg.com/vi/_QlWT19BJHc/hqdefault.jpg,en,en,False,2965,PT49M25S,hd,False,True,False,False,45031,2398,165
F_V0pKMIUMA,ZA,2026-05-05T03:56:41.055244+00:00,2026-04-23T10:04:45Z,Dipelo,Dipelo,Wendy M - Topic,UCghMh8dpmBY1QkcpxSYtDFA,10,Music,"Wendy M, Natiey Lepaka, Dj Tsp, Dipelo",4,https://i.ytimg.com/vi/F_V0pKMIUMA/hqdefault.jpg,en,und,False,254,PT4M14S,hd,False,True,False,False,677917,17209,0
SJPu1spHqfk,ZA,2026-05-05T03:56:41.055252+00:00,2026-04-30T12:59:32Z,RESIDENT EVIL – Official Teaser Trailer (4K),RESIDENT EVIL – Official Teaser Trailer (4K),Sony Pictures Entertainment,UCz97F7dMxBNOfGYu3rx8aCw,24,Entertainment,,0,https://i.ytimg.com/vi/SJPu1spHqfk/hqdefault.jpg,en,en,False,114,PT1M54S,hd,True,True,False,False,3651451,161949,17711
f5C938v70gI,ZA,2026-05-05T03:56:41.055259+00:00,2026-05-02T18:15:04Z,Getting MARRIED To My REALISTIC BOYFRIEND in LIFETOGETHER RP! 😱💍,Getting MARRIED To My REALISTIC BOYFRIEND in LIFETOGETHER RP! 😱💍,Myamberr,UCu7d9DIn_MITN8_PjvVfWDw,20,Gaming,"Roblox, myamberr, roblox roleplay, Roblox boyfriend, roblox boyfriend and girlfriend, myamberr roblox, roblox boyfriend, my amber, brookhaven 🏡rp, ayeyahzee, roblox snapchat, roblox baddie, life together rp, life together rp roblox, roblox real life, roblox realistic, roblox realistic family, life together codes, life together mesh, life together realistic family, life together rp family, life together, roblox youtuber, Life together rp wedding, realistic avatar roblox",25,https://i.ytimg.com/vi/f5C938v70gI/hqdefault.jpg,en,en,False,2192,PT36M32S,hd,False,True,False,False,207059,5980,2126
WnmgItmroVo,ZA,2026-05-05T03:56:41.055268+00:00,2026-05-01T04:00:40Z,"JAZZWRLD, Thatohatsi & Thukuthela - Ningikhonzele (Official Audio)","JAZZWRLD, Thatohatsi & Thukuthela - Ningikhonzele (Official Audio)",JAZZWRLD  ,UCbK_Kq2NAyBCblzWWGc6hmw,22,People & Blogs,,0,https://i.ytimg.com/vi/WnmgItmroVo/hqdefault.jpg,en,en,False,227,PT3M47S,hd,False,False,False,False,208269,7812,468
6IxPD-jNdwM,ZA,2026-05-05T03:56:41.055276+00:00,2026-04-22T19:01:13Z,Clayface | Official Teaser,Clayface | Official Teaser,DC,UCiifkYAs_bq1pt_zbNAzYGg,1,Film & Animation,"2026, Clayface, Coming Soon, DC, DC Comics, David Dencik, Eddie Marsan, Gotham City, Horror, James Watkins, Joshua James, Max Minghella, Movie Trailer, Nancy Carroll, Naomi Ackie, Teaser Trailer, Thriller, Tom Rhys Harries, Warner Bros, Warner Bros Pictures",20,https://i.ytimg.com/vi/6IxPD-jNdwM/hqdefault.jpg,en,en-US,False,64,PT1M4S,hd,True,False,False,False,10683768,188268,10420
pSpiob9D_7I,ZA,2026-05-05T03:56:41.055284+00:00,2026-04-25T19:30:15Z,SIDEMEN AMONG US PROXIMITY CHAT BUT THE IMPOSTOR DOESN'T KNOW WHO THE OTHER IMPOSTOR IS,SIDEMEN AMONG US PROXIMITY CHAT BUT THE IMPOSTOR DOESN'T KNOW WHO THE OTHER IMPOSTOR IS,MoreSidemen,UCh5mLn90vUaB1PbRRx_AiaA,22,People & Blogs,"sidemen, moresidemen, miniminter, ksi, zerkaa, behzinga, tbjzl, vikkstar, wroetoshaw",9,https://i.ytimg.com/vi/pSpiob9D_7I/hqdefault.jpg,en,en-GB,False,4315,PT1H11M55S,hd,False,True,False,False,4903587,131205,3821
Qyqu53LNmJM,ZA,2026-05-05T03:56:41.055292+00:00,2026-04-30T10:00:00Z,Botshelo Ke Eng 2.0,Botshelo Ke Eng 2.0,Trechyson Molly vx - Topic,UCO0N7NlJQ5NMzvhLONUv6Zw,10,Music,"Trechyson Molly vx, Jinger Stone, MaWhoo, Botshelo Ke Eng 2.0",4,https://i.ytimg.com/vi/Qyqu53LNmJM/hqdefault.jpg,id,en,False,357,PT5M57S,hd,False,True,False,False,149637,3337,127
u48_JpUloGY,ZA,2026-05-05T03:56:41.055301+00:00,2026-04-30T23:46:09Z,Spider-Noir | Official Trailer (True-Hue Full Color),Spider-Noir | Official Trailer (True-Hue Full Color),Sony Pictures Television,UCeDnHAtv092zrrVIai87N4Q,24,Entertainment,"Sony, Sony Pictures Television, Spider Noir, Spider-Noir trailer, Marvel Spider Noir, Spider Noir official trailer, Spider Noir 2026, noir Spider-Man, Spider-Verse noir, Marvel trailer, superhero noir, dark superhero trailer, Spider Man Noir, Spider Noir teaser, comic adaptation, Marvel noir universe",16,https://i.ytimg.com/vi/u48_JpUloGY/hqdefault.jpg,en,en,False,160,PT2M40S,hd,False,True,False,False,2636572,74084,2987
re9K6NIWEco,ZA,2026-05-05T03:56:41.055308+00:00,2026-05-01T18:01:28Z,I Replayed the Career of Michael Olise…,I Replayed the Career of Michael Olise…,S2G,UChR1Yn7YpVrnP-SbsWtjuBA,20,Gaming,,0,https://i.ytimg.com/vi/re9K6NIWEco/hqdefault.jpg,en-GB,en,False,1691,PT28M11S,hd,False,True,False,False,750061,25249,924
UH-ueilqSc8,ZA,2026-05-05T03:56:41.055316+00:00,2026-04-30T10:04:39Z,Ningikhonzele,Ningikhonzele,JAZZWRLD - Topic,UCg9m64wzmvi6LiZ5b4BUyCw,10,Music,"JAZZWRLD, Thatohatsi, Thukuthela, Ningikhonzele",4,https://i.ytimg.com/vi/UH-ueilqSc8/hqdefault.jpg,en,hi,False,226,PT3M46S,hd,False,True,False,False,160074,7697,0
Zw_HE1mQ7rA,ZA,2026-05-05T03:56:41.055323+00:00,2026-05-02T13:00:54Z,I Got Hunted by the World's Deadliest Assassin,I Got Hunted by the World's Deadliest Assassin,Wemmbu,UCkzzNLnuM-VsATWC53ehwOQ,20,Gaming,"wemmbu, wembu, wenbu, wemmbu unstable smp, wemmbu the sequel, eggchan, wemmbu eggchan, wemmbu hunted, wemmbu invisible player, unstable smp, unstable universe, parrotx2, minecraft, unstable smp in order, minecraft smp, unstable smp in order wemmbu, unstable smp latest video, unstable smp new video",18,https://i.ytimg.com/vi/Zw_HE1mQ7rA/hqdefault.jpg,en,en,False,3437,PT57M17S,hd,False,True,False,False,3245577,189185,36249
0_2YoySUoCw,ZA,2026-05-05T03:56:41.055331+00:00,2026-04-28T19:12:13Z,Ikhekhe,Ikhekhe,Smeza - Topic,UC99F96c0GQ7OCVHGWytMzEQ,10,Music,"Smeza, Ikhekhe",2,https://i.ytimg.com/vi/0_2YoySUoCw/hqdefault.jpg,en,en,False,375,PT6M15S,hd,False,True,False,False,176669,5131,0
B6GSMNFiMXo,ZA,2026-05-05T03:56:41.055338+00:00,2026-05-02T16:00:16Z,Trapped with a CRAZY FANGIRL!,Trapped with a CRAZY FANGIRL!,Cash,UC0eLBYhxW9HC0P9PXQ73mpQ,24,Entertainment,"Cash, Nico, Nico and Cash, Cash and Nico, Minecraft, Minecraft mod, family friendly, kid friendly",8,https://i.ytimg.com/vi/B6GSMNFiMXo/hqdefault.jpg,en,en-US,False,1244,PT20M44S,hd,False,True,False,False,649304,10033,1700
iSNenHPoYhw,ZA,2026-05-05T03:56:41.055345+00:00,2026-04-29T22:10:31Z,REAL BULLY,REAL BULLY,Usimamane,UCYJJmnqutZjqUu9civjcH_w,22,People & Blogs,,0,https://i.ytimg.com/vi/iSNenHPoYhw/hqdefault.jpg,en,en,False,127,PT2M7S,hd,False,False,False,False,193764,15097,2168
J5s9hpu3QBw,ZA,2026-05-05T03:56:41.055352+00:00,2026-05-03T13:30:15Z,JUGGERNAUT vs 5 STARS in GTA 5...,JUGGERNAUT vs 5 STARS in GTA 5...,TechyCrew,UCTU3m4rCUS-7qXuHK-j9Uqw,20,Gaming,"Techy, TechyCrew, Among Us, Fortnite, Fortnite Creative, Roblox, Techy Roblox, Among Us Roles",8,https://i.ytimg.com/vi/J5s9hpu3QBw/hqdefault.jpg,en,en,False,825,PT13M45S,hd,False,True,False,False,340119,8012,4753
FN2Bz8S5nyc,ZA,2026-05-05T03:56:41.055360+00:00,2026-04-29T17:00:06Z,Chocolate Gaga - Kaycherlow NLL x Cliff Kayden,Chocolate Gaga - Kaycherlow NLL x Cliff Kayden,KayCherlow NLL,UC7aPs7veYbgvIqU7SDss8vQ,10,Music,"Kaycherlow, kaycherlow songs, kaycherlow songs 2025, kaycherlow new songs, kaycherlow ft shebeshxt, kaycherlow nll, kaycherlow dikhotho, Official, Music Video, Lyric Video, Official audio, mp3 download, music, african music, playlist",15,https://i.ytimg.com/vi/FN2Bz8S5nyc/hqdefault.jpg,en,en,False,284,PT4M44S,hd,False,True,False,False,153003,4760,541
012g-P4IqG8,ZA,2026-05-05T03:56:41.055367+00:00,2026-05-04T14:00:00Z,Trolling My Friends With REAL LIFE PAIN In Rivals...,Trolling My Friends With REAL LIFE PAIN In Rivals...,Techy Plays,UCNDzLI-hyihpAx3zKtwhGZw,20,Gaming,"roblox, brookhaven, funnyroblox, techyblox, techy, crazy fan girls, crazy fan girl, my crazy fan girls",8,https://i.ytimg.com/vi/012g-P4IqG8/hqdefault.jpg,en,en,False,895,PT14M55S,hd,False,True,False,False,335291,7545,1091
-CepAYN0WyM,ZA,2026-05-05T03:56:41.055374+00:00,2026-05-01T16:00:00Z,Chris Brown - Fallin' (Official Video) ft. Leon Thomas,Chris Brown - Fallin' (Official Video) ft. Leon Thomas,ChrisBrownVEVO,UCm1dsgJNnhaLkY3uAdqN4mA,10,Music,"chris brown, bryson tiller, it depends, chris brown it depends, rnb, chris brown 11:11, chris brown tour, breezy bowl, chris brown new music, residuals, chris brown bryson tiller, bryson tiller new music, chris brown type beat, it depends lyrics, chris brown it depends lyrics, Usher, Chris Brown feat. Bryson Tiller USHER, It Depends (The Remix), Leon Thomas, Chris Brown feat. Leon Thomas, Fallin'",21,https://i.ytimg.com/vi/-CepAYN0WyM/hqdefault.jpg,en,en,False,508,PT8M28S,hd,False,True,False,False,4089298,248809,18277
UpTyRYKWi0I,ZA,2026-05-05T03:56:41.055382+00:00,2026-05-04T00:37:59Z,ROBLOX SHOOT A LUCKY BLOCK..,ROBLOX SHOOT A LUCKY BLOCK..,Foltyn,UCRkuUgtDAL4XSU5jB40J_wA,20,Gaming,"foltyn, foltyn roblox, roblox, roblox foltyn, foltyn family, funny, no swearing, foltyn family roblox, roblox foltyn family, blade ball, roblox blade ball, foltyn blade ball, shoot a lucky block, roblox shoot a lucky block, foltyn and caylus, foltyn and caylus playing roblox together, foltyn and caylus playing roblox, roblox kick a lucky block, foltyn kick a lucky block, foltyn brainrot games",20,https://i.ytimg.com/vi/UpTyRYKWi0I/hqdefault.jpg,en,en-US,False,1246,PT20M46S,hd,False,True,False,False,1198168,14159,1851
fdz7vKnheeA,ZA,2026-05-05T03:56:41.055390+00:00,2026-04-30T10:01:12Z,Unyaka,Unyaka,Big Zulu - Topic,UC1UKE5h0nO-iAOwb0AWj36g,10,Music,"Big Zulu, Umkhulu, Unyaka",3,https://i.ytimg.com/vi/fdz7vKnheeA/hqdefault.jpg,en,en,False,261,PT4M21S,hd,False,True,False,False,99025,2996,141
Vo6QTBMdUfU,ZA,2026-05-05T03:56:41.055398+00:00,2026-04-25T16:00:01Z,"1 Day vs 50,000 Day Build Challenge","1 Day vs 50,000 Day Build Challenge",MrBeast Gaming,UCIPPMRA040LQr5QPyJEbmXA,20,Gaming,,0,https://i.ytimg.com/vi/Vo6QTBMdUfU/hqdefault.jpg,en,en,False,1186,PT19M46S,hd,True,True,False,False,26224186,430565,14044
O9vBGyzZ5PM,ZA,2026-05-05T03:56:41.055406+00:00,2026-05-01T03:28:36Z,Ingilosi,Ingilosi,uNgena - Topic,UCrsLCLrfsg-X6iwnbW1zGnA,10,Music,"uNgena, Ngena Music Production, Ngena Thwala, Mdumiseni Ngena Thwala, Mdumiseni Thwala, Seniyazenzela, Ingilosi",7,https://i.ytimg.com/vi/O9vBGyzZ5PM/hqdefault.jpg,en,hi,False,180,PT3M,hd,False,True,False,False,88973,3945,159
_33y4itum-E,ZA,2026-05-05T03:56:41.055413+00:00,2026-04-30T22:00:46Z,PLG Chanty & King Master - Stofi Stofoza (Official Lyric Video),PLG Chanty & King Master - Stofi Stofoza (Official Lyric Video),PLG Chanty,UC1CeUe0qx3s9TykkHgk5XSA,10,Music,,0,https://i.ytimg.com/vi/_33y4itum-E/hqdefault.jpg,en,en,False,271,PT4M31S,hd,False,True,False,False,83150,2270,148
BKbeYQL0rYw,ZA,2026-05-05T03:56:41.055421+00:00,2026-05-02T18:49:00Z,"Every Time I Crash, My Bike Gets MORE EXPENSIVE in GTA 5","Every Time I Crash, My Bike Gets MORE EXPENSIVE in GTA 5",SpeirsTheAmazingHD,UCAbdeLiTPdjk1X2TY_ZdLDw,20,Gaming,"speirstheamazinghd, gta 5 funny moments, gta 5, gta, in gta 5, gta 5 rp, stealing cars, grand theft auto 5, stealing gta 5, stealing cars gta 5, fastest car, fastest car gta 5, gta 5 roleplay, trolling, roleplay, trolling cops, roleplay server trolling, gta v roleplay, gta v rp trolling, gta5 roleplay, gta 5 trolling, gta 5 roleplay funny, funny roleplay moments, grand theft auto roleplay, grand theft auto 5 roleplay, every time i crash, bike gets more expensive",27,https://i.ytimg.com/vi/BKbeYQL0rYw/hqdefault.jpg,en,en,False,1664,PT27M44S,hd,False,True,False,False,328685,4265,191
OpoNgr_WyaQ,ZA,2026-05-05T03:56:41.055429+00:00,2026-04-26T10:03:36Z,Seteng Sediba,Seteng Sediba,Saint Pitso - Topic,UCrStujhdF6rMrqwyngwbr4Q,10,Music,"Saint Pitso, Side Effects, Seteng Sediba",3,https://i.ytimg.com/vi/OpoNgr_WyaQ/hqdefault.jpg,en,en,False,230,PT3M50S,hd,False,True,False,False,155344,2276,135
rO80i2YjCIw,ZA,2026-05-05T03:56:41.055436+00:00,2026-05-02T23:00:49Z,I Secretly Used GUNS in Hide & Seek,I Secretly Used GUNS in Hide & Seek,Bionic,UCETZ7OiW7-wqwb-6hsz3C4w,20,Gaming,"minecraft, bionic, family friendly, hide and seek, minecraft hide and seek, i used guns in hide and seek, i secretly used guns in hide and seek, minecraft hide and seek with guns, minecraft guns, i secretly used guns",10,https://i.ytimg.com/vi/rO80i2YjCIw/hqdefault.jpg,en,en,False,1269,PT21M9S,hd,False,True,False,False,630376,14269,974
MEYP4uyiAyU,ZA,2026-05-05T03:56:41.055444+00:00,2026-04-30T17:00:06Z,Ba Lwele - Shandesh x Hitboss SA feat Master Chuza,Ba Lwele - Shandesh x Hitboss SA feat Master Chuza,Shandesh Music,UCwtksocF1GhFplkTbcITpvA,10,Music,"Official, Music Video, Lyric Video, Official audio, mp3 download, Music, shandesh, shandesh songs, shandesh new songs, lekompo, lekompo songs, lekompo balcony mix, lekompo balcony mix janesh, lekompo mix, lekompo dance",15,https://i.ytimg.com/vi/MEYP4uyiAyU/hqdefault.jpg,en-GB,und,False,255,PT4M15S,hd,False,True,False,False,108111,4034,608
YlG2fevRTyo,ZA,2026-05-05T03:56:41.055451+00:00,2026-05-03T18:01:17Z,Manchester United vs Liverpool | Premier League 2026 | Epl Live | PES 21 Simulation Gameplay,Manchester United vs Liverpool | Premier League 2026 | Epl Live | PES 21 Simulation Gameplay,Football Gamer Rony,UCaopyJz-EIXOXYXSMOC6c-g,20,Gaming,"แมนยูล่าสุด, မန်ယူ live now, liverpool vs manchester united, mu vs liverpool, manchester united vs liverpool, ลิเวอร์พูลล่าสุด, football live, man u vs liverpool, บอลสดวันนี้, ดูบอลสด, live mu vs liverpool malam ini, ดูบอลสด liveวันนี้, manchester united vs liverpool live, live football match online today, မန်ယူ vs လီဗာပူး live now, manchester united f.c., ไลฟ์สดบอลวันนี้, แมนยู ลิเวอร์พูล, man united vs liverpool, บอลสด, manu vs liverpool, manchester united f.c. vs liverpool",22,https://i.ytimg.com/vi/YlG2fevRTyo/hqdefault.jpg,en,en,False,916,PT15M16S,hd,False,True,False,False,956560,4464,9
BEQ_VVwu7PA,ZA,2026-05-05T03:56:41.055460+00:00,2026-04-30T10:00:17Z,Umaqondana,Umaqondana,Mduduzi Ncube - Topic,UCVyiQOqKGK1mHPZe00Ya0xQ,10,Music,"Mduduzi Ncube, Mthandeni SK, Umaqondana",3,https://i.ytimg.com/vi/BEQ_VVwu7PA/hqdefault.jpg,en,und,False,229,PT3M49S,hd,False,True,False,False,112066,6754,0
CM3oAbFG48k,ZA,2026-05-05T03:56:41.055467+00:00,2026-04-30T13:00:20Z,1 VS 1000 Player Minecraft War,1 VS 1000 Player Minecraft War,FlameFrags,UCvYPobTo42NM36X7VC4dLhA,20,Gaming,"minecraft, flamefrags, flame frags, flamefrags minecraft, flame minecraft",5,https://i.ytimg.com/vi/CM3oAbFG48k/hqdefault.jpg,en-US,en-US,False,3851,PT1H4M11S,hd,False,True,False,False,2922532,134805,27521
kNDxOPsrlzs,ZA,2026-05-05T03:56:41.055475+00:00,2026-04-19T13:00:06Z,Danya Devs ft. Mawelele - Ola Sbali (Official Music Video),Danya Devs ft. Mawelele - Ola Sbali (Official Music Video),Danya Devs,UCfzBgum3gxYScXfEBs2OXww,10,Music,"danya devs, ola sbali, ola sbali music video, danya devs ola sbali, south african music, amapiano, afropop, hip hop south africa, bayede album, danya devs music video, sa music video, african music video, cpc stars, peanuts, bruce, mzansi music, joburg music, trending sa music, african storytelling, cinematic music video, youth culture sa, dolphin fc, independent artists sa, new music 2026, viral sa music, mawelele, mawelele music, mawelele south africa, danya devs mawelele",29,https://i.ytimg.com/vi/kNDxOPsrlzs/hqdefault.jpg,en,und,False,193,PT3M13S,hd,False,True,False,False,928707,32009,1229
Q_kEz_3KnWQ,ZA,2026-05-05T03:56:41.055483+00:00,2026-05-02T14:15:07Z,"I FOOLED Villagers With 1,000,000 HEARTS In Minecraft!","I FOOLED Villagers With 1,000,000 HEARTS In Minecraft!",PrestonPlayz,UCJZam2u1G0syq3kyqrCXrNw,20,Gaming,"minecraft, preston, brianna, gaming, funny, ssundee, unspeakable, mrbeast, aphmau, canman, lankybox, cash minecraft, nico mc, stokestwins, gametoons, maizen, eyestreem",17,https://i.ytimg.com/vi/Q_kEz_3KnWQ/hqdefault.jpg,en,en,False,1367,PT22M47S,hd,False,True,False,False,913683,19336,841
HgrR6XtP5IE,ZA,2026-05-05T03:56:41.055491+00:00,2026-04-09T10:02:31Z,Ama Baffalo Nama Elephant,Ama Baffalo Nama Elephant,LIMIT NALA - Topic,UCAC8nCMS1RlLtMOSQXXL-cw,10,Music,"LIMIT NALA, Cwayimbane, Khaya Mkhize, Stshomi, Number 10, Ama Baffalo Nama Elephant",6,https://i.ytimg.com/vi/HgrR6XtP5IE/hqdefault.jpg,ms,und,False,300,PT5M,hd,False,True,False,False,3867749,61147,0
4zpO5SBLBGc,ZA,2026-05-05T03:56:41.055498+00:00,2026-05-02T15:00:13Z,I Fused Techy & Emma Base Into One...,I Fused Techy & Emma Base Into One...,Techys,UCoRjsuzMh-MqfRjvlqaVLPw,20,Gaming,,0,https://i.ytimg.com/vi/4zpO5SBLBGc/hqdefault.jpg,en,en,False,509,PT8M29S,hd,False,True,False,False,347722,17257,1751
cWRB4TjptW8,ZA,2026-05-05T03:56:41.055505+00:00,2026-04-30T22:44:53Z,"Big Zulu (Ft. Maraza , Maseven & Zakwe) - Bars [Official Audio]","Big Zulu (Ft. Maraza , Maseven & Zakwe) - Bars [Official Audio]",Inkabi Records,UCqQFGn61VFpAODl5ZLiCGKA,10,Music,"Inkabi Records, Inkabi record label, Inkabi Music, Inkabi songs, Inkabi Records artists, official video, South African Music, South African songs, African Music, African songs",10,https://i.ytimg.com/vi/cWRB4TjptW8/hqdefault.jpg,en,und,False,331,PT5M31S,hd,False,True,False,False,104121,6342,1078
k3-xXD8o0wo,ZA,2026-05-05T03:56:41.055513+00:00,2026-05-04T17:55:30Z,We Got Promoted to the Premier League…,We Got Promoted to the Premier League…,MoreS2G,UCw9rjdrpHa7mzNrWVJoaPgw,20,Gaming,,0,https://i.ytimg.com/vi/k3-xXD8o0wo/hqdefault.jpg,en,en-GB,False,1494,PT24M54S,hd,False,True,False,False,142943,11571,1847
SJO78wFyirA,ZA,2026-05-05T03:56:41.055520+00:00,2026-05-01T15:24:53Z,Mpumalanga Freestyle ,Mpumalanga Freestyle ,Sastii ,UCSiaJ2Gav0UnP1GhnICT7JQ,22,People & Blogs,,0,https://i.ytimg.com/vi/SJO78wFyirA/hqdefault.jpg,en,und,False,117,PT1M57S,hd,False,True,False,False,40335,3457,1074
EgjtePMK7SE,ZA,2026-05-05T03:56:41.055527+00:00,2026-04-30T17:04:13Z,Building the ULTIMATE SECRET GARAGE Under Franklin's House! (GTA 5),Building the ULTIMATE SECRET GARAGE Under Franklin's House! (GTA 5),Nought,UCSh__r5HS4Y1xBkccWnV0TA,20,Gaming,"garage, secret, underground, under, build, building, built, I built, gta 5 garage, gta 5 secret, underground garage, house, upgrade, secret garage, cars, supercars, gta 5 cars, gta 5 supercars, gta 5 upgrade, gta 5 house, gta 5 franklin, mods, gta 5 mods, gta v mods, gaming, nought, nought gta 5, gta 5 Franklin garage, gta 5 secret garage, gta 5 supercar, rare car, rare",32,https://i.ytimg.com/vi/EgjtePMK7SE/hqdefault.jpg,en,en,False,1316,PT21M56S,hd,False,True,False,False,144851,6879,164
22rnWr4Z4g4,ZA,2026-05-05T03:56:41.055535+00:00,2026-04-29T03:23:12Z,10k fast fast (remix),10k fast fast (remix),Boujee man rsa - Topic,UCUjY-I0vmLPXxin8wqynHBg,10,Music,"Boujee man rsa, Boujee man, 10k fast fast (remix)",3,https://i.ytimg.com/vi/22rnWr4Z4g4/hqdefault.jpg,en,en,False,128,PT2M8S,hd,False,True,False,False,75099,2230,0
TVMPKzKvl1c,ZA,2026-05-05T03:56:41.055542+00:00,2026-05-03T19:13:01Z,DO NOT Dig A Hole With Your Friends,DO NOT Dig A Hole With Your Friends,SMii7Y,UCzXwjTI6c6mVn6oui_p6oiw,20,Gaming,"smii7y, smii7yplus, smii7y+, smii7y plus, pratfall, pratfall gameplay, pratfall demo, pratfall game, pratfall reaction, pratfall online, pratfall effect psycholoy, pratfall game ending, pratfall funny moments, pratfall funny, pratfall ending, pratfall multiplayer, a digging game, digging simulator, digging a hole, hole game",20,https://i.ytimg.com/vi/TVMPKzKvl1c/hqdefault.jpg,en,en,False,2479,PT41M19S,hd,False,True,False,False,1528412,67797,1984
rGDiPYXtqMY,ZA,2026-05-05T03:56:41.055550+00:00,2026-04-27T05:18:05Z,Natiey Lepaka - Dipelo (feat. Wendy M & Dj Tsp),Natiey Lepaka - Dipelo (feat. Wendy M & Dj Tsp),Lekompo Music - Topic,UCDBZMAAv7Z7XaGCXC0RyqjQ,10,Music,"Lekompo Music, Wendy M, Dj Tsp, Natiey Lepaka, Wendy Moon, Natiey Lepaka - Dipelo (feat. Wendy M & Dj Tsp)",6,https://i.ytimg.com/vi/rGDiPYXtqMY/hqdefault.jpg,en,und,False,250,PT4M10S,hd,False,True,False,False,111683,1893,0
OUY4htGiZQ8,ZA,2026-05-05T03:56:41.055557+00:00,2026-05-03T12:52:52Z,1 Sniper VS 1000 CARS In GTA 5...,1 Sniper VS 1000 CARS In GTA 5...,Techy,UCFmIhbx3_RkwlMLPA4Xv8-w,20,Gaming,"roblox, techy, techy plays, brookhaven, techyblox, techycrew, more techy",7,https://i.ytimg.com/vi/OUY4htGiZQ8/hqdefault.jpg,en,en,False,996,PT16M36S,hd,False,True,False,False,142256,3367,359
YnteCCTHymQ,ZA,2026-05-05T03:56:41.055564+00:00,2026-04-30T23:25:28Z,I'm sorry 45,I'm sorry 45,Dhem scott - Topic,UCN6onps_NFIMzG_Jzcy7BLg,10,Music,"Dhem scott, Petrus malatji, Dhem scott 45 ep, I'm sorry 45",4,https://i.ytimg.com/vi/YnteCCTHymQ/hqdefault.jpg,en,en,False,307,PT5M7S,hd,False,True,False,False,57917,1663,0
