video_id,country,fetched_at,published_at,title,localized_title,channel_title,channel_id,category_id,category_name,tags,tag_count,thumbnail,default_language,audio_language,is_live,duration,duration_raw,definition,caption_available,licensed_content,embeddable,made_for_kids,views,likes,comments
gp_qj4asw-k,SN,2026-05-02T04:00:39.661665+00:00,2026-04-30T18:00:06Z,Saifond Feat Rayvanny I Love You (clip Officiel By Mintigui Prod,Saifond Feat Rayvanny I Love You (clip Officiel By Mintigui Prod,SAIFOND,UCL3ltgLhi_JcFeFzzsOQ9pg,10,Music,Saifond Rayvanny,1,https://i.ytimg.com/vi/gp_qj4asw-k/hqdefault.jpg,en,fr,False,213,PT3M33S,hd,False,True,False,False,626568,50453,4227
OjlcCHg6KvE,SN,2026-05-02T04:00:39.661701+00:00,2026-04-18T18:00:06Z,Sèrie - Lalaké (SAISON II) Bande annonce,Sèrie - Lalaké (SAISON II) Bande annonce,KHASS Prod,UChJoORHf8ZtVApkhoC2_IhQ,24,Entertainment,"LALAKÉ, LALAKÉ saison 1 épisode 2, série sénégalaise, série africaine, série drama, VOSTFR, série en français sous-titrée, LALAKÉ épisode 2, cinéma sénégalais, drame africain, intrigue sénégalaise, culture sénégalaise, série VOSTFR, Sénégal, drama séries Afrique, série à voir, série noire, série sociale",18,https://i.ytimg.com/vi/OjlcCHg6KvE/hqdefault.jpg,fr,wo,False,259,PT4M19S,hd,True,True,False,False,1439219,54342,1235
D3VaUFl9wPA,SN,2026-05-02T04:00:39.661713+00:00,2026-04-30T12:39:45Z,Tout savoir sur les nouveautés: Pack Naruto Bale 108 Marcelo 105 Aubameyang 106 ,Tout savoir sur les nouveautés: Pack Naruto Bale 108 Marcelo 105 Aubameyang 106 ,IBZOGAMING,UC74nI5LDGVtBUeZiEeWj1Iw,20,Gaming,"efootball, efootball mobile, ibzogaming efootball, efootball ibzogaming, pack opening Marcelo Aubameyang Bale efootball mobile",5,https://i.ytimg.com/vi/D3VaUFl9wPA/hqdefault.jpg,fr-FR,fr,False,216,PT3M36S,hd,False,True,False,False,26014,4453,215
5pFGDmVcT1M,SN,2026-05-02T04:00:39.661722+00:00,2026-04-11T18:00:27Z,VJ - Sai Sai (Clip Officiel),VJ - Sai Sai (Clip Officiel),VJ,UCNiTCM_vGvvr8iJ8EsmtRaw,10,Music,"814, VJ, african music, afrobeat 2026, afrolove, akhlou, amadeus, amour, amour senega, astar, bete, caf, chidid, clip, clip senegal, dakar, dip, dm, event, eventprod, guisse, hiphop, hoside, iss, jahman, jeeba, kaay, love, love song, love song africa, mane, marodi, maroditv, mbalax, mia, mouhamedvj, musique, ndour, ngaka, official music video, omg, playlist, prod, rap, rnb, sadio, sai, seck, selection, senegal, serie, sonko, trending africa, tv, vibes senega, viral africa, viviane, vj, waay, waly, youssou",61,https://i.ytimg.com/vi/5pFGDmVcT1M/hqdefault.jpg,af,af,False,297,PT4M57S,hd,False,True,False,False,2575923,44761,1192
2vwofNpBj3s,SN,2026-05-02T04:00:39.661731+00:00,2026-04-23T20:59:02Z,Bande Annonce Paa Allemand Partie 12,Bande Annonce Paa Allemand Partie 12,Beuss Bouton,UCiwZHU_1mUchj7nwIDIgglw,23,Comedy,"Bande, Annonce, Paa Allemand, Partie 12, Humour, Divertissement, Comédie, Dessins animés, Nouveautés, Série, Cinéma, Diomaye, Actualités",13,https://i.ytimg.com/vi/2vwofNpBj3s/hqdefault.jpg,fr,fr-FR,False,80,PT1M20S,hd,False,True,False,False,204074,12609,100
MiULCd5110Y,SN,2026-05-02T04:00:39.661739+00:00,2026-05-01T16:24:32Z,J’AI TOUT PERDU…,J’AI TOUT PERDU…,Kevko,UCzCzMjtMD4vCWVgbmv4uq0Q,20,Gaming,"Brawl Stars, Brawl star fr, Unchained, Unchained OFF, Unchained Brawl Stars, RomainDotlive BS, Roblox, Vol Un Brainrot, Roblox Kevko, Steal a brainrot, Vol Un brainrot kevko, roblox unchained, roblox toinelag, kevko roblox, kevko vol un brainrot, unchained off, unchained steal a brainrot, brainrot, roblox brainrot, brainrot og, kevko pigeon, graphyx, talcado, yoananas, shadobass, dhm, dhm2.0, jeanfils, chocoh, chocolatandvanillah, youtubeur fr steal a brainrot",31,https://i.ytimg.com/vi/MiULCd5110Y/hqdefault.jpg,fr,fr,False,1988,PT33M8S,hd,False,True,False,False,195582,5967,681
PLP9t_rj7oc,SN,2026-05-02T04:00:39.661748+00:00,2026-04-07T17:00:06Z,"Mia Guisse, VJ - Sama Xool (Clip Officiel)","Mia Guisse, VJ - Sama Xool (Clip Officiel)",Mia Guisse,UC-F37PsWVJVCzmsK9H48Csw,10,Music,"mia guisse vj sama xool clip officiel, mia guissé, vj, mia guisse sama xool, vj sama xool, mia guissé nouveau clip, sama xool nouveau clip, clip officiel, mia guissé vj clip, mia guisse vj sama xool, akatche, kruh mandiou mauri, optique studios, amadeus, jahman, viviane chidid, ndakhté lo, djelykaba bintou, axel merryl, bass thioung, sidy diop, soubatel music, bete bete, timis, takkema, musique, mbalax, afro mbalax, dakar, senegal, ashs the best, obree daman, mia vj, vj sai sai",34,https://i.ytimg.com/vi/PLP9t_rj7oc/hqdefault.jpg,fr,wo,False,191,PT3M11S,hd,False,True,False,False,5794487,63753,1690
4PGipTJ5_K4,SN,2026-05-02T04:00:39.661756+00:00,2026-04-27T13:46:00Z,Série - Le Piège - Bande Annonce,Série - Le Piège - Bande Annonce,Marodi TV Sénégal,UCqe0sSESmaQbLFdTExctQLA,24,Entertainment,"Séries, Série, télévisions, sénégal, séries sénégalaises, marodi tv, Marodi, séries africaines, mbarodi, vidéos sénégal, karma, maitresse, pod et marichou, decheance, virginie, emprises, credule, baabel, kay&za",19,https://i.ytimg.com/vi/4PGipTJ5_K4/hqdefault.jpg,fr,fr,False,171,PT2M51S,hd,False,True,False,False,149429,6589,182
6E-M6ga1Kps,SN,2026-05-02T04:00:39.661764+00:00,2026-04-29T14:51:21Z,SAMMY a Triché pour VOLER mon MEOWL Divin !,SAMMY a Triché pour VOLER mon MEOWL Divin !,Unchained_Off,UCiFyJ_EBmF2XJuR9buWE_3A,20,Gaming,"unchained, unchained_off, unchained fortnite, fortnite, jeu vidéo, gameplay, drole, gratuit, unchained gaming, fortnite battle royale, vbucks, mise à jour, maj, fortnite maj, fortnite chapitre, unchained map, roblox, unchained roblox, robux, secret, roblox brainrot, steal a brainrot, voler brainrot, Brainrot, brainrot secret, unchained skin, og, admin, steal a brainrot classement, french tacos, Event, Admin abuse, Meowl, anniversaire, Sammy, steal, OG, unchained anniversaire, sammy voler",39,https://i.ytimg.com/vi/6E-M6ga1Kps/hqdefault.jpg,fr,fr-FR,False,931,PT15M31S,hd,False,True,False,False,629578,16296,2001
hvTEXcl7BrM,SN,2026-05-02T04:00:39.661772+00:00,2026-04-18T18:29:57Z,Bilou XIV - Sagou (Clip officiel),Bilou XIV - Sagou (Clip officiel),Bilou XIV,UC3Oczh2VKy_Q3mwkWg6YPvQ,10,Music,"bilou, sagou, afro mbalax, mbalax, sénégal, hit, bilou xiv, mbalakh",8,https://i.ytimg.com/vi/hvTEXcl7BrM/hqdefault.jpg,fr,und,False,165,PT2M45S,hd,False,True,False,False,350560,10605,329
6QMGdEjgJ8k,SN,2026-05-02T04:00:39.661780+00:00,2026-04-29T19:08:11Z,TIMIS - L’Or Noir - Épisode 21 - Bande annonce ,TIMIS - L’Or Noir - Épisode 21 - Bande annonce ,Séné Vibe,UCzygfBbr4MSo_yflMJyiTig,22,People & Blogs,,0,https://i.ytimg.com/vi/6QMGdEjgJ8k/hqdefault.jpg,fr,fr,False,94,PT1M34S,hd,False,False,False,False,150961,2825,30
8Ukho_vxLTM,SN,2026-05-02T04:00:39.661787+00:00,2026-04-25T11:00:11Z,Je Deviens Un Joueur De L’Académie Du PSG…,Je Deviens Un Joueur De L’Académie Du PSG…,Star Freestyle,UCwwgI0AzG5Y2lU-C8LiKP2A,24,Entertainment,,0,https://i.ytimg.com/vi/8Ukho_vxLTM/hqdefault.jpg,fr,fr,False,1044,PT17M24S,hd,False,True,False,False,287833,5857,203
U-YHrLebB0I,SN,2026-05-02T04:00:39.661794+00:00,2026-04-24T19:00:06Z,Jeeba  - Teste Ko (Clip Officiel),Jeeba  - Teste Ko (Clip Officiel),Jeeba Abdn,UCyiLncW7jXOX9HsqEZBiNAA,10,Music,"Musique sénégalaise, Musique nouveauté, Musique afro, Sénégal, Dakar, Gambie, west africa music, african vibes, official music video, african hit, youtube music africa, afrobeats trending, global african sound, Mia guisse Vj sama xol, Vj sai sai, Jahman ya nob bandit bi",16,https://i.ytimg.com/vi/U-YHrLebB0I/hqdefault.jpg,fr,fr,False,158,PT2M38S,hd,False,True,False,False,114997,6828,187
rRJbXMigUE4,SN,2026-05-02T04:00:39.661801+00:00,2026-04-28T11:22:51Z,BÉTÉ BÉTÉ - Saison 3 - Episode 47 : Bande-annonce **Decortique** ,BÉTÉ BÉTÉ - Saison 3 - Episode 47 : Bande-annonce **Decortique** ,Pamas officiel ,UCBGh-ApJVWnarOKwsv-uNlA,22,People & Blogs,,0,https://i.ytimg.com/vi/rRJbXMigUE4/hqdefault.jpg,fr,fr,False,376,PT6M16S,hd,False,True,False,False,74997,333,23
pGdKBgSk_V4,SN,2026-05-02T04:00:39.661808+00:00,2026-04-30T10:55:30Z,    🤯 INCROYABLE : EFOOTBALL X Naruto AVEC DES CADEAUX GRATUITS,    🤯 INCROYABLE : EFOOTBALL X Naruto AVEC DES CADEAUX GRATUITS,LUNOGAMING,UCENgQeNNA6_pOl6XI1D679w,20,Gaming,"eFootball, eFootball 2026, eFootball mobile, eFootball Naruto, Naruto eFootball, collaboration eFootball, eFootball anime, Naruto Shippuden, Konami, eFootball événement, joueurs gratuits eFootball, récompenses eFootball, cadeaux eFootball, eFootball update, eFootball news, eFootball France, football mobile, jeu de foot mobile, eFootball bonus, eFootball collab",20,https://i.ytimg.com/vi/pGdKBgSk_V4/hqdefault.jpg,fr,en,False,690,PT11M30S,hd,False,True,False,False,5350,616,25
wZvyaSYmfWk,SN,2026-05-02T04:00:39.661816+00:00,2026-04-14T18:15:06Z,Viviane CHIDID Feat Bakhaw - C'EST DIEU QUI DECIDE,Viviane CHIDID Feat Bakhaw - C'EST DIEU QUI DECIDE,Viviane Chidid Officiel,UCYsdOXVmOjhT-LB2r9U35Mg,10,Music,"Viviane Chidid, Djoloff Bande, Senegal, Africa, Youssou Ndour, TFM, RFM, Dj Boubs, RTS, 2STV, SNF, zeyna, philip, philipndour, zeynandour, surprise, vq, viviane, Boubacarndour, boubandour, foreveryoung, parforce",22,https://i.ytimg.com/vi/wZvyaSYmfWk/hqdefault.jpg,fr,wo,False,139,PT2M19S,hd,False,True,False,False,473499,16263,717
BtKCEjs7ENU,SN,2026-05-02T04:00:39.661823+00:00,2026-04-29T20:00:32Z,Série - LEILA -bande annonce - Episode 22- Saison 1,Série - LEILA -bande annonce - Episode 22- Saison 1,HOODERE PULAAGU MEDIA ,UCqbGpPdPSI3RWayxEa7gaSA,1,Film & Animation,"pulagu, hoodere pulagu, yewende, mette dewgal, bete bete, déchéance, event pro, mbarodi, peul, djame et fatoumata, guidelam, fouta vision, promesse, poular, baaba maal, mauritanie, fouta, senegal, koodda sall, abou diouba, adviser, demba guisse, waly seck, bilkhiss, oumar ba, marel, diarry sall, tfm, ardo et dieylla, yorro sow, amadou poulo, series, serie, televisions, lomotif yacine sy, l epouse du chiekh, video, partage, telephone-apareil photo, visiophone, gratuit, envoi, yt:cc=on",43,https://i.ytimg.com/vi/BtKCEjs7ENU/hqdefault.jpg,fr,fr,False,110,PT1M50S,hd,False,True,False,False,24075,1733,41
0z0jUkoJn2M,SN,2026-05-02T04:00:39.661831+00:00,2026-05-01T11:59:30Z,EFOOTBALL feat NARUTOO 🔥 NEW MARCELO + BALE + AUBAMAYANG 🔥,EFOOTBALL feat NARUTOO 🔥 NEW MARCELO + BALE + AUBAMAYANG 🔥,9AL Games,UCvzTJH6G9bH5nCQ1Hfb8nGg,20,Gaming,"efootball naruto, naruto efootball, efootball x naruto, naruto x efootball, efootball naruto pack, naruto en efootball, naruto no efootball, efootball naruto event, efootball neymar naruto, efootball naruto collab, efootball naruto update, collab efootball naruto, efootball 2026 naruto, naruto efootball 2026, efootball naruto trailer, marcelo efootball naruto, naruto efootball new cards, naruto efootball new epics, efootball naruto campaign, parceria efootball naruto",20,https://i.ytimg.com/vi/0z0jUkoJn2M/hqdefault.jpg,en,en,False,1153,PT19M13S,hd,False,True,False,False,161473,13601,917
U5AbDGQwE6E,SN,2026-05-02T04:00:39.661839+00:00,2026-05-01T18:00:06Z,MDD LE FAMEUX - GHETTO YOUTH - Prod by TIKI PROD ( Clip Video),MDD LE FAMEUX - GHETTO YOUTH - Prod by TIKI PROD ( Clip Video),Mdd le fameux,UCaPe6YkB2uAQQqEhHo4vVLQ,10,Music,"saifond, ghetto youth, african music, urban africa, mdd le fameux, guinée, paris, tiki prod, musique guinéenne, lil fresh, viodeo clip 2026",11,https://i.ytimg.com/vi/U5AbDGQwE6E/hqdefault.jpg,fr,fr,False,200,PT3M20S,hd,False,False,False,False,60820,8317,501
pjRrI51Z6Vs,SN,2026-05-02T04:00:39.661846+00:00,2026-05-01T13:02:23Z,BÉTÉ BÉTÉ - Saison 3 - Episode 28 bande annonce ,BÉTÉ BÉTÉ - Saison 3 - Episode 28 bande annonce ,SAMA SERIE TV,UCus9XBqs8n4bAVhc5dExwow,22,People & Blogs,,0,https://i.ytimg.com/vi/pjRrI51Z6Vs/hqdefault.jpg,fr,en,False,120,PT2M,hd,False,True,False,False,31131,187,26
YZialTQ1gCI,SN,2026-05-02T04:00:39.661853+00:00,2026-04-30T09:17:46Z,"NARUTO x eFootball 😱🔥 MAJ v5.4.1 : 230 PIÈCES GRATUITES + BALE, MARCELO & AUBAMEYANG 🤯","NARUTO x eFootball 😱🔥 MAJ v5.4.1 : 230 PIÈCES GRATUITES + BALE, MARCELO & AUBAMEYANG 🤯",YNGAMING,UC5o9wp8rwtnGwWNQXB-pyjA,20,Gaming,"efootball 2026, efootball mobile, efootball update 5.4.1, naruto efootball, efootball naruto collab, 230 pieces gratuites efootball, efootball free coins, gareth bale efootball, marcelo efootball, aubameyang efootball, efootball gameplay, efootball insider, efootball new update, efootball review, efootball pack opening",15,https://i.ytimg.com/vi/YZialTQ1gCI/hqdefault.jpg,fr,fr,False,454,PT7M34S,hd,True,True,False,False,3477,335,25
TgUKkyhug-c,SN,2026-05-02T04:00:39.661860+00:00,2026-04-24T18:00:06Z,DJULDE - PELETE (Officiel MUSIC VIDÉO) 2026.,DJULDE - PELETE (Officiel MUSIC VIDÉO) 2026.,Djulde,UCgS2sfDCHvgxaUDBQsT4igA,22,People & Blogs,,0,https://i.ytimg.com/vi/TgUKkyhug-c/hqdefault.jpg,fr,fr,False,204,PT3M24S,hd,False,False,False,False,158037,6769,333
QvlEiwa4Z60,SN,2026-05-02T04:00:39.661868+00:00,2026-05-01T21:16:45Z,WHO | Official trailer. A Wil Aime Film,WHO | Official trailer. A Wil Aime Film,CHAQUE DETAIL,UC6zVJG_Jik-fkKr-Mc9hDGw,24,Entertainment,,0,https://i.ytimg.com/vi/QvlEiwa4Z60/hqdefault.jpg,fr,fr,False,93,PT1M33S,hd,False,False,False,False,81579,10150,851
mxIeD6oi1BQ,SN,2026-05-02T04:00:39.661875+00:00,2026-05-01T14:45:12Z,24H COMME L'HOMME LE PLUS RECHERCHÉ DE GTA 5 !,24H COMME L'HOMME LE PLUS RECHERCHÉ DE GTA 5 !,GREG EN GAME !,UCCUztwI_fi_7yuR002Eiwuw,20,Gaming,"Grand Theft Auto, Grand Theft Auto V, Grand Theft Auto 5, GTA, GTAV, GTA5, Grand Theft Auto Online, Grand Theft Auto V Online, Grand Theft Auto 5 Online, GTA Online, GTAV Online, GTA5 Online, Online, En ligne, Jeu vidéo, Jeu de tir à la première personne, PS3, PS4, PS5, Xbox 360, Xbox One, Xbox Series, Windows, PC, GREG, GREG EN GAME, Gameplay, FR, France, Français, Lasalle, Unwin, Aiden, Tuto, Concept, GTAVI, GTAVl, GTA6, Argent, Facile, GTA5 Mods, gta 5, gta 5 franklin",43,https://i.ytimg.com/vi/mxIeD6oi1BQ/hqdefault.jpg,fr-FR,fr-FR,False,1207,PT20M7S,hd,False,True,False,False,25449,2191,77
h8ijEVQdvkA,SN,2026-05-02T04:00:39.661883+00:00,2026-04-30T18:00:06Z,M’BOMA KO HONTO WONDHA ( Clip Audio ) 2k26,M’BOMA KO HONTO WONDHA ( Clip Audio ) 2k26,M'BOMA,UCbz2jd7FSbuVAmDg6S3Fl8g,10,Music,,0,https://i.ytimg.com/vi/h8ijEVQdvkA/hqdefault.jpg,fr,und,False,186,PT3M6S,hd,False,True,False,False,42418,2901,137
hkL2NfXD1xA,SN,2026-05-02T04:00:39.661894+00:00,2026-05-01T20:39:46Z,Wadial Tabaski Ak Serigne Ngagne - Bande Annonce,Wadial Tabaski Ak Serigne Ngagne - Bande Annonce,Serigne Ngagne Tv,UCUxl_s1VFz2H2_dpkB4BJgw,23,Comedy,"wally seck, série capitale, ramadan de ngagne, nianku, keur ngagn ak koor gui, ramadan, marodi, bété bété evenprod, marodi tv, baabel marodi tv, ramadan de serigne ngagne, surface_de_reparation, serie_senegalaise, comedie_senegalaise, foot_senegal, humour_senegal, diouf_technique, youtube_senegal, west_africa_sn_production, serie_youtube_sn, made_in_senegal, sonko, discour 8 septemtre, ousmane sonko, JEUX OLYMPIQUE 2026, xalisso, mARIE ET MOMO, tabaski",28,https://i.ytimg.com/vi/hkL2NfXD1xA/hqdefault.jpg,fr,fr-FR,False,84,PT1M24S,hd,False,True,False,False,1608,205,6
BEPaybBSC9g,SN,2026-05-02T04:00:39.661907+00:00,2026-04-23T18:45:52Z,I Takeover Real Madrid for 10 Seasons…,I Takeover Real Madrid for 10 Seasons…,S2G,UChR1Yn7YpVrnP-SbsWtjuBA,20,Gaming,,0,https://i.ytimg.com/vi/BEPaybBSC9g/hqdefault.jpg,en-GB,en,False,1763,PT29M23S,hd,False,True,False,False,1073284,36661,1163
j8QPKxH_Qa8,SN,2026-05-02T04:00:39.661914+00:00,2026-04-23T10:58:04Z,Mar-Aby 2026,Mar-Aby 2026,Sidy Diop - Topic,UC3fx04O1tZLzbXqyKhLf5iA,10,Music,"Sidy Diop, Mar-Aby 2026",2,https://i.ytimg.com/vi/j8QPKxH_Qa8/hqdefault.jpg,en,und,False,295,PT4M55S,hd,False,True,False,False,41352,535,18
YkrQir-VjRk,SN,2026-05-02T04:00:39.661921+00:00,2026-04-20T20:45:20Z,Lalaké - Bande-annonce Saison 2 Épisode 01 Analyse,Lalaké - Bande-annonce Saison 2 Épisode 01 Analyse,Bijoux Analyse ,UCJBVEbHiah5zlwAFtut6b3w,22,People & Blogs,,0,https://i.ytimg.com/vi/YkrQir-VjRk/hqdefault.jpg,wo,fr,False,227,PT3M47S,hd,False,False,False,False,97587,0,501
ItK2_S-8k5Y,SN,2026-05-02T04:00:39.661928+00:00,2026-04-29T12:53:19Z,Mise à jour eFootball 2026 & Nouvelle campagne 🤩 : Ce qui arrive demain sur eFootball 2026 Mobile,Mise à jour eFootball 2026 & Nouvelle campagne 🤩 : Ce qui arrive demain sur eFootball 2026 Mobile,ALPHA GAMING,UCU-d9kQlycHRFtKMziuA2Tg,20,Gaming,,0,https://i.ytimg.com/vi/ItK2_S-8k5Y/hqdefault.jpg,fr,fr,False,482,PT8M2S,hd,False,True,False,False,8343,1166,132
WHQq1tSXjO0,SN,2026-05-02T04:00:39.661936+00:00,2026-05-01T19:53:42Z,ALLEZ - ALLEZ |  ÉPISODE 2 – TERANGA LIVE,ALLEZ - ALLEZ |  ÉPISODE 2 – TERANGA LIVE,AkhlouBrickTV Officiel,UCxkuK0gCqbrJfCCPwVM7Dpw,10,Music,,0,https://i.ytimg.com/vi/WHQq1tSXjO0/hqdefault.jpg,fr,en,False,331,PT5M31S,hd,False,True,False,False,13913,2519,301
AjFk1cY265I,SN,2026-05-02T04:00:39.661943+00:00,2026-04-10T16:29:45Z,Digital Circus Ep 9 Finale [TRAILER],Digital Circus Ep 9 Finale [TRAILER],GLITCH,UCn_FAXem2-e3HQvmK-mOH4g,1,Film & Animation,"glitch, glitch productions, digital circus, the amazing digital circus, murder drones, Pomni, Uzi, Jax, Ragatha, Kinger, Gangle, Zooble, Caine, Bubble, 3D, Animation, 3D Animation, Indie Animation, Gummigoo",19,https://i.ytimg.com/vi/AjFk1cY265I/hqdefault.jpg,en,en,False,70,PT1M10S,hd,True,True,False,False,26943092,1600701,113335
ELEFDRH7TuA,SN,2026-05-02T04:00:39.661951+00:00,2026-04-30T10:00:22Z,NOUVELLE MISE À JOUR eFootball 2026 ! CAMPAGNE + PIÈCES GRATUITES + GUIRASSY 103 GRATUIT 😱🔥,NOUVELLE MISE À JOUR eFootball 2026 ! CAMPAGNE + PIÈCES GRATUITES + GUIRASSY 103 GRATUIT 😱🔥,Tamimi221,UC25GiYg4ko8jR7qwJh6_0RA,20,Gaming,,0,https://i.ytimg.com/vi/ELEFDRH7TuA/hqdefault.jpg,fr,fr-FR,False,244,PT4M4S,hd,False,True,False,False,3758,349,38
iGCC1znveZ8,SN,2026-05-02T04:00:39.661958+00:00,2026-05-01T19:24:34Z,Wally B. Seck - Nakupenda (LYRICS),Wally B. Seck - Nakupenda (LYRICS),Wally B. Seck,UCn35kQ-UglSExf-q1nrvqRw,10,Music,"#live #liveperformance #senegal #onit #wallylive #live2026, live, live performance, senegal, on it, live wally, live wally 2026, nakupenda lyrics, nakupenda paroles",9,https://i.ytimg.com/vi/iGCC1znveZ8/hqdefault.jpg,fr,fr,False,194,PT3M14S,hd,False,True,False,False,17876,2314,167
z7K-49zOlJY,SN,2026-05-02T04:00:39.661965+00:00,2026-05-01T20:00:39Z,LIVE FC MOBILE ⭐ PACK OPENING RONALDO TOTS 😱,LIVE FC MOBILE ⭐ PACK OPENING RONALDO TOTS 😱,MomoGaming,UChal7oZlzc1cRd9pxFC3ggA,20,Gaming,"gaming, fifa mobile, fcmobile, MOMOGAMING, LIVE, FC MOBILE LIVE, FC MOBILE PACK, short, tendance, pack opening, astuce",11,https://i.ytimg.com/vi/z7K-49zOlJY/hqdefault.jpg,ca,fr,False,6113,PT1H41M53S,hd,False,True,False,False,18360,1089,32
-yGJGZ44Otw,SN,2026-05-02T04:00:39.661973+00:00,2026-04-10T14:00:01Z,MAUVAIS DJO - Pilé (Gospel Version),MAUVAIS DJO - Pilé (Gospel Version),Kano Choir,UCdlMyzem19huTuUUzhxY0yA,10,Music,"mauvais djo pilé, pilé mauvais djo, pilé gospel version, mauvais djo gospel cover, kano choir, gospel cover français, gospel chorale, soul gospel, modern gospel, gospel remix, choir gospel, gospel vibes, gospel music, reprise gospel, afro gospel, hit en gospel",16,https://i.ytimg.com/vi/-yGJGZ44Otw/hqdefault.jpg,fr,fr,False,124,PT2M4S,hd,False,True,False,False,1305878,16231,284
gFSueu37E6U,SN,2026-05-02T04:00:39.661981+00:00,2026-04-24T15:01:11Z,J'achète 10 000€ de Brainrots pour les FRENCHTACOS,J'achète 10 000€ de Brainrots pour les FRENCHTACOS,Toinelag Gaming,UCbXIt5MtclbWKts5eHQsmew,20,Gaming,"toinelag, unchained, french tacos, toinelag french tacos, unchained french tacos, toinelag brainrots, unchained brainrots, brainrots, brainrots french tacos, top1, monde, top1 brainrots, top1 monde, top1 monde brainrots, toinelag top1, unchained top1, frenchtacos top1",17,https://i.ytimg.com/vi/gFSueu37E6U/hqdefault.jpg,fr,fr,False,1388,PT23M8S,hd,False,True,False,False,1097238,21295,1074
mfhdsuUe-Z0,SN,2026-05-02T04:00:39.661988+00:00,2026-04-28T16:00:08Z,Joé Dwèt Filé - Rihanna (Clip Officiel),Joé Dwèt Filé - Rihanna (Clip Officiel),Joé Dwèt Filé,UC7n1N9L_9RKpJQLGhGVWPlg,10,Music,"JDF, Joe dwet file, Rihanna",3,https://i.ytimg.com/vi/mfhdsuUe-Z0/hqdefault.jpg,fr,fr,False,222,PT3M42S,hd,False,False,False,False,1003517,23567,1144
0At4KP6hh54,SN,2026-05-02T04:00:39.661995+00:00,2026-05-01T09:26:33Z,jalan - jalan di jalur extrime,jalan - jalan di jalur extrime,FEBY KURNIAWAN,UCesp-Zwwcb3LacLbNYUH9qw,20,Gaming,"ETS2, EURO TRUCK SIMULATOR 2, euro truck simulator, gaming, dangerous road, game simulator, simulation",7,https://i.ytimg.com/vi/0At4KP6hh54/hqdefault.jpg,en,id,False,8988,PT2H29M48S,hd,False,True,False,False,4423773,4921,1
ld0dlCBPj68,SN,2026-05-02T04:00:39.662003+00:00,2026-05-01T19:14:55Z,Ashs The Best - Too Late (Visualizer),Ashs The Best - Too Late (Visualizer),Ashs The Best,UCTuv_0J0M8LBx_DY_XWO0jw,10,Music,"rap, rapgalsen, dip, doundou, guiss, reptyle, music, sénégal, ashsthebest, ashs, the, best, hikhop, thebestfriday, senegal, dakar, afrique, africa, galsen, hip hop, afro, afrobeat, waly seck, maabo, youssou ndour, buzz, people, west africa, hakill, sorano, canabasse, dip doundou guiss, one lyrical, new music, vibe radio, omzo dollar, dkr, to late",38,https://i.ytimg.com/vi/ld0dlCBPj68/hqdefault.jpg,en,fr,False,194,PT3M14S,hd,False,True,False,False,17602,2949,221
04kd8MwqWKg,SN,2026-05-02T04:00:39.662011+00:00,2026-04-30T14:25:32Z,🔴 LIVE | Naruto x eFootball !🥶🔥 Marcelo Aubameyang Bale Pack Opening + Gameplay🔥 eFootball,🔴 LIVE | Naruto x eFootball !🥶🔥 Marcelo Aubameyang Bale Pack Opening + Gameplay🔥 eFootball,Alex Grd TV,UCjhMRJ-PXaoPml_u5aAoP1A,20,Gaming,"efootballnaruto, efootballmobile, efootball2026, efootballps5, efootball26, konami, bale, marcelo, aubameyang",9,https://i.ytimg.com/vi/04kd8MwqWKg/hqdefault.jpg,fr,fr-FR,False,14923,PT4H8M43S,hd,False,True,False,False,12020,580,29
wI2U0Cca7bk,SN,2026-05-02T04:00:39.662019+00:00,2026-04-24T10:04:01Z,Tok fa di lokh,Tok fa di lokh,Cab - Topic,UCzS5FhBK3Kr7mf0-G7fBRYA,10,Music,"cab, Dip doundou guiss, LEPP LUMU LAJJ, Tok fa di lokh",4,https://i.ytimg.com/vi/wI2U0Cca7bk/hqdefault.jpg,en,en,False,151,PT2M31S,hd,False,True,False,False,32325,2272,171
9kImNIz9hTU,SN,2026-05-02T04:00:39.662027+00:00,2026-04-30T12:25:28Z,NARUTO x efootball Collaboration Is Here...efootball 26 What's coming today? | LIVE,NARUTO x efootball Collaboration Is Here...efootball 26 What's coming today? | LIVE,LIARS FC Soccerworld,UC1qjTZAkimFkNSLMAZyIc5Q,20,Gaming,"Liarfootball, Liarsfc, liars, liarsoccer, liarsfcsoccerworld, liars football, efootball update, coop mode, coop efootball, efootball24, efootball new update, efootball24 mobile, efootball 24 ambassador, efootball 24 messi new card, pes 2024, efootball 2024 ps5, efootball 24 livestream, efootball 24 pack openiing, version 8.0.0, 102 kahn, 101 nesta, new epic cards, Andriy Shevchenko, totti epic, 102 sneijder epic, italian league attackers pack opening",26,https://i.ytimg.com/vi/9kImNIz9hTU/hqdefault.jpg,en,en,False,25189,PT6H59M49S,hd,False,True,False,False,239394,7114,10
UHCACi3GtjY,SN,2026-05-02T04:00:39.662035+00:00,2026-04-23T22:00:06Z,Straiker - Barki (Official Music Video),Straiker - Barki (Official Music Video),Straiker,UCvQJ64ZOVrfDSRUZppEyczg,10,Music,"Straiker, Barki, Guinée, Conakry, voiture, Rap poular, Poullosophe",7,https://i.ytimg.com/vi/UHCACi3GtjY/hqdefault.jpg,fr,und,False,190,PT3M10S,hd,False,True,False,False,162830,13072,882
kGVe8psodRY,SN,2026-05-02T04:00:39.662042+00:00,2026-04-28T22:06:48Z,🔴[PES 2021] PSG vs Bayern | MELHOR JOGO DO ANO PARECIA FINAL DA UCL ANTECIPADA RESUMO & GAMEPLAY,🔴[PES 2021] PSG vs Bayern | MELHOR JOGO DO ANO PARECIA FINAL DA UCL ANTECIPADA RESUMO & GAMEPLAY,Gamer BR - M1l Grau,UCNWfVQJcNYlKyR1gMkJQK6w,20,Gaming,,0,https://i.ytimg.com/vi/kGVe8psodRY/hqdefault.jpg,pt-PT,fr,False,284,PT4M44S,hd,False,True,False,False,84201,164,0
iK6Tv666iHg,SN,2026-05-02T04:00:39.662049+00:00,2026-04-19T18:15:06Z,Axel Merryl « Dans toutes les langues » (Clip Officiel) ,Axel Merryl « Dans toutes les langues » (Clip Officiel) ,Axel Merryl,UC-1leIzfjXD0_-DOWCe0s5Q,23,Comedy,,0,https://i.ytimg.com/vi/iK6Tv666iHg/hqdefault.jpg,fr,fr,False,178,PT2M58S,hd,False,False,False,False,2501857,168523,13858
VROrsLyBydg,SN,2026-05-02T04:00:39.662057+00:00,2026-04-30T01:24:05Z,🔴Atletico Madrid vs Arsenal | UEFA Champions League 25/26 |eFootball PES21 Simulation,🔴Atletico Madrid vs Arsenal | UEFA Champions League 25/26 |eFootball PES21 Simulation,Mona Football,UC-TE4CuE7wKfX6LmeESAjZQ,20,Gaming,,0,https://i.ytimg.com/vi/VROrsLyBydg/hqdefault.jpg,en,en,False,10022,PT2H47M2S,hd,False,True,False,False,107400,486,0
pEgnQwMMczA,SN,2026-05-02T04:00:39.662064+00:00,2026-04-22T17:00:22Z,BRIL - MA TAY,BRIL - MA TAY,Bril,UCF0XRFjfSxQ7BXBumWI_NCQ,10,Music,"bril ma tay, bril ma tay clip, bril, ma tay, bril et dieyna, bril nouveau clip, bril fight 4, bril dieyna, dieyna balde, dieynabril 2024, nouveau son 2026, clip, clip officiel, wally seck, amadeus, mia guisse, vj, viviane chidid, dip doundou guiss, king baba, iss 814, jahman, jeeba, evenprod, bete bete, timis, takkema, dakar, senegal, bril class chic, brill, bril fight",32,https://i.ytimg.com/vi/pEgnQwMMczA/hqdefault.jpg,fr,fr,False,182,PT3M2S,hd,False,True,False,False,67694,2272,124
JwcnB5oGhEE,SN,2026-05-02T04:00:39.662071+00:00,2026-04-30T11:31:53Z,🔴 NARUTO X EFOOTBALL : 5.4.1 UPDATE🔥eFootball live with Le_Poulain,🔴 NARUTO X EFOOTBALL : 5.4.1 UPDATE🔥eFootball live with Le_Poulain,Le Poulain,UCNhbyhnwaR1MGujaMD_svIQ,20,Gaming,"pes, pack opening, gameplay, tuto, myclub, football, efootball, Tutorial, mobile, efootball mobile, MFL, Francais, English, Espanol, efootball26, FC26, EAFC26",17,https://i.ytimg.com/vi/JwcnB5oGhEE/hqdefault.jpg,fr,fr-FR,False,20730,PT5H45M30S,hd,False,True,False,False,9774,364,21
