video_id,country,fetched_at,published_at,title,localized_title,channel_title,channel_id,category_id,category_name,tags,tag_count,thumbnail,default_language,audio_language,is_live,duration,duration_raw,definition,caption_available,licensed_content,embeddable,made_for_kids,views,likes,comments
-9fRCfMMy00,BE,2026-04-01T03:50:39.683102+00:00,2026-03-26T19:02:14Z,PROMENADE,PROMENADE,La Rvfleuze - Topic,UCOBSsvA4X0FyWIZLtAe63Sw,10,Music,"La Rvfleuze, Koba LaD, PROMENADE",3,https://i.ytimg.com/vi/-9fRCfMMy00/hqdefault.jpg,en,fr,False,164,PT2M44S,hd,False,True,False,False,758502,18797,474
RIu4sFKGi6E,BE,2026-04-01T03:50:39.683148+00:00,2026-03-25T19:00:01Z,Harry Potter and the Philosopher's Stone | Official Teaser | HBO Max,Harry Potter and the Philosopher's Stone | Official Teaser | HBO Max,Harry Potter,UChPRO1CB_Hvd0TvKRU62iSQ,1,Film & Animation,"Harry Potter, Wizarding World, Warner Bros, Hogwarts, Marauders Map, Draco Malfoy, Ron Weasley, Hermione Granger, Harry Potter Lore, Potter, slytherin, ravenclaw, gryffindor, hufflepuff, hbomax, harrypotterhbo",16,https://i.ytimg.com/vi/RIu4sFKGi6E/hqdefault.jpg,en-GB,en-GB,False,129,PT2M9S,hd,True,True,False,False,8888412,256278,33026
10OJhIc_-vw,BE,2026-04-01T03:50:39.683161+00:00,2026-03-30T03:52:19Z,Minecraft Speedrunner VS 6 Hunters REMATCH,Minecraft Speedrunner VS 6 Hunters REMATCH,Dream,UCTkXRDQl0luXxVQrRQvWS6w,20,Gaming,"minecraft, dream, dream minecraft",3,https://i.ytimg.com/vi/10OJhIc_-vw/hqdefault.jpg,en,en,False,3129,PT52M9S,hd,True,True,False,False,5879094,306169,22403
Mzgx9dp0Jdw,BE,2026-04-01T03:50:39.683171+00:00,2026-03-27T11:00:27Z,RnBoi - ELLE VOULAIT (Clip Officiel),RnBoi - ELLE VOULAIT (Clip Officiel),RnBoiVEVO,UCoqyoL_QEgN6Fm9bGhis8PQ,10,Music,"RnBoi, Because Music, R&B, Soul, Générations, Skyrock, Rema, Aya Nakamura, Omah Lay, Burna Boy, Lojay, Asake, Davido, Genezio, Nono La Grinta, Franglish, Ashvama, L2B, kulturr, Bilouki, Rsko, Naza, Rambo goyard, Guy2Bezbar, La Mano 1.9, Ronisia, Keblack, Ayra Starr, El grande toto, Tiakola, SDM, Niska, Merveille, Gradur, Gims, Theodora, Hamza, Favé, Tems",39,https://i.ytimg.com/vi/Mzgx9dp0Jdw/hqdefault.jpg,fr,fr,False,144,PT2M24S,hd,False,True,False,False,1331898,24901,784
Q4niQwkV1PI,BE,2026-04-01T03:50:39.683180+00:00,2026-03-25T19:45:02Z,HARRY POTTER à l'école des sorciers Bande Annonce (2026),HARRY POTTER à l'école des sorciers Bande Annonce (2026),FilmsActu,UC_i8X3p8oZNaik8X513Zn1Q,1,Film & Animation,"cinema, filmsactu, bande annonce, film, officiel, français, VF, 2026, Harry Potter à l'école des sorciers, Harry Potter à l'école des sorciers Bande Annonce, Harry Potter Série, série Harry Potter, HP, Hermione, Ron",15,https://i.ytimg.com/vi/Q4niQwkV1PI/hqdefault.jpg,fr,fr,False,144,PT2M24S,hd,False,False,False,False,409906,9225,1165
NSSqbWiLFlA,BE,2026-04-01T03:50:39.683189+00:00,2026-03-27T17:57:47Z,"4 NULLOS, 1 BARRE DE VIE (Minecraft Hardcore)","4 NULLOS, 1 BARRE DE VIE (Minecraft Hardcore)",SQUEEZIE GAMING,UCY-_QmcW09PHAImgVnKxU2g,20,Gaming,"squeezie best of, squeezie moments marrants, squeezie compilation",3,https://i.ytimg.com/vi/NSSqbWiLFlA/hqdefault.jpg,fr,fr,False,2718,PT45M18S,hd,False,True,False,False,867610,44032,461
b4iVv91Z6lY,BE,2026-04-01T03:50:39.683197+00:00,2026-03-20T03:58:06Z,BTS (방탄소년단) ‘SWIM’ Official MV,BTS (방탄소년단) ‘SWIM’ Official MV,HYBE LABELS,UC3IZKseVpdzPSBaWxBxundA,10,Music,"HYBE, HYBE LABELS, 하이브, 하이브레이블즈",4,https://i.ytimg.com/vi/b4iVv91Z6lY/hqdefault.jpg,ko,ko,False,245,PT4M5S,hd,True,True,False,False,81688938,6015261,1030848
3_9vCamtuPY,BE,2026-04-01T03:50:39.683206+00:00,2026-03-17T16:19:02Z,Dune: Part Three | Official Teaser Trailer,Dune: Part Three | Official Teaser Trailer,Warner Bros.,UCjmJDM5pRKbUlVIzDYYWb6g,1,Film & Animation,"Action, Anya Taylor-Joy, Brian K Vaughan, Charlotte Rampling, Coming Soon, Denis Villeneuve, Dune, Dune Messiah, Dune: Part Three, Florence Pugh, Ida Brooke, Isaach De Bankolé, Jason Momoa, Javier Bardem, Messiah, Nakoa-Wolf Momoa, Rebecca Ferguson, Robert Pattinson, Sci Fi, Timothée Chalamet, Trilogy, Warner Bros, Zendaya",23,https://i.ytimg.com/vi/3_9vCamtuPY/hqdefault.jpg,en,en-US,False,150,PT2M30S,hd,True,False,False,False,27435506,605894,29010
NnTycJg1MIo,BE,2026-04-01T03:50:39.683214+00:00,2026-03-30T00:00:00Z,Destroying A World That Doesn't Exist,Destroying A World That Doesn't Exist,Wifies,UCiVJZlfcmWMUiXv5oywnDhQ,20,Gaming,"wifies, mumbo jumbo, dream, wifies arg, at the crossroads dont turn left, the king in yellow",6,https://i.ytimg.com/vi/NnTycJg1MIo/hqdefault.jpg,en,en,False,7355,PT2H2M35S,hd,False,True,False,False,7308312,587939,91425
HBMy-y2wb4I,BE,2026-04-01T03:50:39.683222+00:00,2026-03-28T10:14:16Z,YE - FATHER (feat. TRAVIS SCOTT),YE - FATHER (feat. TRAVIS SCOTT),Kanye West,UCs6eXM7s8Vl5WcECcRHc2qQ,22,People & Blogs,"ye, YE, Kanye West, Kanye, bully, travis scott, kanye west, ye bully, ye bully album, ye father, ye travis scott, ye travis scott father, travis scott father, ye father music video, father music video, ye travis scott music video, kanye west runaway, kanye west type beat, ye bully highs and lows, ye bully v1, ye bully full album, ye bully type beat, ye bully serotonin, ye bully circles, ye bully v2, kanye west bully, kanye west bully album, ye bully film, kanye west god is",29,https://i.ytimg.com/vi/HBMy-y2wb4I/hqdefault.jpg,en,zh-Hans,False,172,PT2M52S,hd,False,False,False,False,8625503,439120,22832
0HjdiohVOik,BE,2026-04-01T03:50:39.683231+00:00,2026-03-31T15:59:00Z,Backrooms | Official Trailer HD | A24,Backrooms | Official Trailer HD | A24,A24,UCuPivVjnfNo4mb3Oog_frZg,1,Film & Animation,"a24, a24 films, a24 trailers, independent films, trailer, HD, official, movie, film, a24 movies, oscar winner, academy award winner",12,https://i.ytimg.com/vi/0HjdiohVOik/hqdefault.jpg,en,en,False,138,PT2M18S,hd,True,True,False,False,4503529,323048,17147
66pyhTCXUDw,BE,2026-04-01T03:50:39.683239+00:00,2026-03-29T06:02:49Z,Un Strawberry Éléphant a DISPARU de la Base des French Tacos.. ,Un Strawberry Éléphant a DISPARU de la Base des French Tacos.. ,Unchained_Off,UCiFyJ_EBmF2XJuR9buWE_3A,20,Gaming,"unchained, unchained_off, unchained fortnite, fortnite, jeu vidéo, gameplay, drole, gratuit, unchained gaming, fortnite battle royale, vbucks, mise à jour, maj, fortnite maj, fortnite chapitre, unchained map, roblox, unchained roblox, robux, secret, roblox brainrot, steal a brainrot, voler brainrot, Brainrot, brainrot secret, unchained skin, og, admin, steal a brainrot classement, french tacos, base, steal a brainrot base, Event, Sammy, Admin abuse, Strawberry elephant, Pâques",37,https://i.ytimg.com/vi/66pyhTCXUDw/hqdefault.jpg,fr,fr-FR,False,909,PT15M9S,hd,False,True,False,False,781210,18081,1460
RBaSiVjtKR4,BE,2026-04-01T03:50:39.683248+00:00,2026-03-20T04:00:34Z,Body to Body,Body to Body,BTS - Topic,UC9vrvNSL3xcWGSkV86REBSg,10,Music,"BTS, 방탄소년단, ARIRANG, Body to Body",4,https://i.ytimg.com/vi/RBaSiVjtKR4/hqdefault.jpg,en,ko,False,190,PT3M10S,hd,False,True,False,False,31440976,1386654,62083
s1-pfiVMKAs,BE,2026-04-01T03:50:39.683256+00:00,2026-03-31T16:00:12Z,SUPERGIRL | Official Trailer,SUPERGIRL | Official Trailer,DC,UCiifkYAs_bq1pt_zbNAzYGg,1,Film & Animation,"2026, Coming Soon, Craig Gillespie, DC, DC Comics, DC Studios, DCU, David Krumholtz, Emily Beecham, Eve Ridley, James Gunn, Jason Momoa, Kara Zor-El, Krypto, Matthias Schoenaerts, Milly Alcock, Supergirl, WB, Warner Bros, Warner Bros Pictures, Warner Brothers, official trailer",22,https://i.ytimg.com/vi/s1-pfiVMKAs/hqdefault.jpg,en,en-US,False,177,PT2M57S,hd,True,False,False,False,4763373,199224,11544
6KIturBxgWw,BE,2026-04-01T03:50:39.683264+00:00,2026-03-29T06:00:00Z,Gigantische Voetafdruk Gevonden,Gigantische Voetafdruk Gevonden,Alex Klein,UCpf4pGjVXwl5t8jl6zaTIiA,20,Gaming,"Alex, Klein, Dutch, Nederlands, NL, Nederland, Trending, Trending NL, Kind Vriendelijk, Familie Vriendelijk, Game, Alex Klein, MinionFartGun, Minecraft, Minecraft NL, Minecraft Nederlands, Alex Klein Minecraft, Minecraft Survival, Survival, Minecraft Alex",20,https://i.ytimg.com/vi/6KIturBxgWw/hqdefault.jpg,nl,nl,False,1487,PT24M47S,hd,False,True,False,False,87015,3233,115
HtVcltkn3HI,BE,2026-04-01T03:50:39.683272+00:00,2026-03-20T19:00:06Z,RAYE - 'Click Clack Symphony.' feat. Hans Zimmer (Official Video),RAYE - 'Click Clack Symphony.' feat. Hans Zimmer (Official Video),RAYE,UCw5z_dopYnvEL6Rc8KNKsnw,10,Music,"raye songs, raye lyrics, #raye, raye, Hans Zimmer, Click Clack Symphony, Click Clack, This Music May Contain Hope, RAYE 2026, RAYE Click Clack, Clik Clak, Raye Hans Zimmer",12,https://i.ytimg.com/vi/HtVcltkn3HI/hqdefault.jpg,en,en,False,312,PT5M12S,hd,False,True,False,False,5391418,269883,10466
aBlsrtxuwss,BE,2026-04-01T03:50:39.683279+00:00,2026-03-18T11:17:52Z,Spider-Man: Brand New Day - Official Trailer,Spider-Man: Brand New Day - Official Trailer,PlayStation,UC-2Y8dQb0S6DtpxNgAKoJKA,20,Gaming,"PlayStation, PS5, video games, next gen, Sony",5,https://i.ytimg.com/vi/aBlsrtxuwss/hqdefault.jpg,en,en,False,158,PT2M38S,hd,False,True,False,False,17336664,656383,27171
DUdLr3hsMQg,BE,2026-04-01T03:50:39.683286+00:00,2026-03-30T15:30:33Z,ON S’EST INSULTÉ 576 FOIS (Avec Djilsi et Maxime Biaggi),ON S’EST INSULTÉ 576 FOIS (Avec Djilsi et Maxime Biaggi),Lil Joyca,UCgANFlYnbE47942AoazfNsg,24,Entertainment,"joyca, djilsi, maxime biaggi, live, chained together",5,https://i.ytimg.com/vi/DUdLr3hsMQg/hqdefault.jpg,fr,fr,False,1675,PT27M55S,hd,False,True,False,False,469945,23070,122
4pCVPSchGlA,BE,2026-04-01T03:50:39.683294+00:00,2026-03-30T19:00:03Z,The Cranberries - Zombie (Sub. Español + Lyrics),The Cranberries - Zombie (Sub. Español + Lyrics),nostalgia lyrics.,UCaxjS8mdF402rdn1hP6_1_Q,10,Music,,0,https://i.ytimg.com/vi/4pCVPSchGlA/hqdefault.jpg,es,es,False,309,PT5M9S,hd,False,True,False,False,457610,1821,22
X21JsHLHnY8,BE,2026-04-01T03:50:39.683302+00:00,2026-03-31T12:59:59Z,Masters of The Universe – Official Trailer,Masters of The Universe – Official Trailer,Amazon MGM Studios,UCf5CjDJvsFvtVIhkfmKAwAA,24,Entertainment,"MGM, MGM Studios, Metro-Goldwyn- Mayer, Metro Pictures Corporations, Goldwyn Pictures, Louis B. Mayer Pictures, MGM Pictures, United Artists, Metro MGM/UA, Amazon MGM, Amazon MGM Studios, Amazon, Masters Of The Universe, Masters Of The Universe Movie, Masters Of The Universe 2026, Nicholas Galitzine, Morena Baccarin, Idris Elba, Jared Leto, Alison Brie, Kristen Wig, Masters of the Universe Trailer 2, Masters of the Universe Official Trailer, Masters Of the Univer Trailer",24,https://i.ytimg.com/vi/X21JsHLHnY8/hqdefault.jpg,en,en-US,False,165,PT2M45S,hd,True,True,False,False,4715735,51709,5563
70LOaxzmcg4,BE,2026-04-01T03:50:39.683310+00:00,2026-03-28T16:00:01Z,"Press This Button To Win $250,000","Press This Button To Win $250,000",MrBeast Gaming,UCIPPMRA040LQr5QPyJEbmXA,20,Gaming,,0,https://i.ytimg.com/vi/70LOaxzmcg4/hqdefault.jpg,en,en,False,1230,PT20M30S,hd,True,True,False,False,8779082,255884,15814
BojqVuLqylU,BE,2026-04-01T03:50:39.683317+00:00,2026-03-26T17:00:06Z,Niaks - VMA (Clip officiel),Niaks - VMA (Clip officiel),Niaks,UCgb3sWYoMa05Pzzd7mpwrCw,10,Music,,0,https://i.ytimg.com/vi/BojqVuLqylU/hqdefault.jpg,fr,fr,False,174,PT2M54S,hd,False,True,False,False,323889,8057,339
YnczpEoeaDM,BE,2026-04-01T03:50:39.683325+00:00,2026-03-28T11:00:42Z,"Elbaph Arc Official Trailer | April 5, 2026 | ONE PIECE","Elbaph Arc Official Trailer | April 5, 2026 | ONE PIECE",ONE PIECE Official - ENG,UCwz6BWiifRgjPIVE8QdNEHA,1,Film & Animation,"#ONEPIECE, #Elbaph, #Trailer, #Anime, #Luffy, #Loki, #strawhatcrew, #onepieceanime",8,https://i.ytimg.com/vi/YnczpEoeaDM/hqdefault.jpg,en-US,en,False,39,PT39S,hd,False,True,False,False,1639336,55762,3075
NJI4YpvlFu0,BE,2026-04-01T03:50:39.683333+00:00,2026-03-29T12:00:00Z,"DÉSOLÉ À TOUS LES VILLAGEOIS, ON A PAS FAIT EXPRÈS (Crimson Desert)","DÉSOLÉ À TOUS LES VILLAGEOIS, ON A PAS FAIT EXPRÈS (Crimson Desert)",Wankil Studio - Laink et Terracid,UCYGjxo5ifuhnmvhPvCc3DJQ,20,Gaming,"terracid, laink, wankil, crimson desert",4,https://i.ytimg.com/vi/NJI4YpvlFu0/hqdefault.jpg,fr,fr,False,806,PT13M26S,hd,False,True,False,False,395431,26176,414
uAZpZLtb0t4,BE,2026-04-01T03:50:39.683341+00:00,2026-03-26T15:36:53Z,FLINGO FREESTYLE,FLINGO FREESTYLE,DonDada Télévision,UCD6giw9pPlKqDA9D-JKcCbg,10,Music,,0,https://i.ytimg.com/vi/uAZpZLtb0t4/hqdefault.jpg,fr,fr,False,107,PT1M47S,hd,False,True,False,False,330106,32492,1240
nHE6-XpUd74,BE,2026-04-01T03:50:39.683348+00:00,2026-03-26T02:42:17Z,"Armageddon: Warhammer 40,000 New Edition Cinematic Trailer","Armageddon: Warhammer 40,000 New Edition Cinematic Trailer",Warhammer,UCwdh3MTrFq3sXlB4ct8B-Fg,20,Gaming,"Games Workshop, Citadel Miniatures, Warhammer Age of Sigmar, Warhammer 40000, Forge World, Black Library, 40K, AoS, GW, Astartes, Space marine, Tow, The Old world, Middle earth strategy battle game, lord of the rings, the hobbit, warhammer underworlds, necromunda, the horus heresy, legions imperialis, age of darkness, total war, space marine, space marine 2, Warhammer Fantasy",25,https://i.ytimg.com/vi/nHE6-XpUd74/hqdefault.jpg,en,en-GB,False,151,PT2M31S,hd,True,False,False,False,1291672,59330,2766
aUhR9hUaTg4,BE,2026-04-01T03:50:39.683356+00:00,2026-03-29T17:28:29Z,Ik Kreeg Mega Geluk Uit Deze Nieuwe Doos!,Ik Kreeg Mega Geluk Uit Deze Nieuwe Doos!,HARM2,UC1DiQDNzgMnKuib_66PeBHw,20,Gaming,"brawl, stars, brawl stars, brawlstars, geluk, mega, doos, box, brawl stars doos, brawl stars box, nieuwe doos, nieuw, nieuwe, mega geluk, zeldzaam, nederlands, brawl stars nederlands, brawl stars nieuwe doos, openen, dozen, dozen openen, opening",22,https://i.ytimg.com/vi/aUhR9hUaTg4/hqdefault.jpg,nl,nl,False,708,PT11M48S,hd,False,True,False,False,74568,1752,155
WqTO4uk1siU,BE,2026-04-01T03:50:39.683364+00:00,2026-03-29T18:00:06Z,CENTRAL CEE - WAGWAN [MUSIC VIDEO],CENTRAL CEE - WAGWAN [MUSIC VIDEO],Central Cee,UCV_CsAy5CNBX_uwDQ7RMe1Q,10,Music,"central cee, centralcee, central cee wagwan, all roads lead home, central cee new song, central cee new video",6,https://i.ytimg.com/vi/WqTO4uk1siU/hqdefault.jpg,en,en,False,184,PT3M4S,hd,False,False,False,False,1924651,134774,5575
r3Z4tGN0i2I,BE,2026-04-01T03:50:39.683371+00:00,2026-03-30T17:00:11Z,Euphoria Season 3 | Trailer 2 | HBO Max,Euphoria Season 3 | Trailer 2 | HBO Max,HBO Max,UCx-KWLTKlB83hDI6UKECtJQ,24,Entertainment,"hbo max, hbo, hbo originals, hbo original series, hbo trailer, new on hbo, hbo max originals, hbo max trailer, hbo max series, hbo max youtube, euphoria, euphoria season 3, euphoria trailer 1, euphoria trailer, zendaya, sydney sweeney, jacob elordi, rue, cassie, nate, alexa demie, maddy, lexi, jules, maude apatow, hunter schafer, zendaya euphoria, euphoria new season, hbo euphoria season 3, sydney sweeney euphoria, sydney sweeney cassie, cassie and nate, cassie and maddy",33,https://i.ytimg.com/vi/r3Z4tGN0i2I/hqdefault.jpg,en,en,False,189,PT3M9S,hd,True,True,False,False,1441130,40443,2152
sX67wstIHaM,BE,2026-04-01T03:50:39.683379+00:00,2026-03-27T16:29:56Z,Pokopia - JE DÉTESTE POKEMON.,Pokopia - JE DÉTESTE POKEMON.,Sheshounet,UC4peNo-31r7fhQZgu0_JRIA,20,Gaming,,0,https://i.ytimg.com/vi/sX67wstIHaM/hqdefault.jpg,fr,fr,False,741,PT12M21S,hd,False,True,False,False,499797,34285,721
s-dr_KJvmO4,BE,2026-04-01T03:50:39.683387+00:00,2026-03-27T04:00:47Z,"Miley Cyrus - Younger You (From the ""Hannah Montana 20th Anniversary Special"")","Miley Cyrus - Younger You (From the ""Hannah Montana 20th Anniversary Special"")",MileyCyrusVEVO,UCdI8evszfZvyAl2UVCypkTA,10,Music,"Miley Cyrus, Walt Disney Records, Pop",3,https://i.ytimg.com/vi/s-dr_KJvmO4/hqdefault.jpg,en,en,False,170,PT2M50S,hd,True,True,False,False,4636844,210807,9102
n7f6hlKsxxo,BE,2026-04-01T03:50:39.683394+00:00,2026-03-23T16:00:07Z,"Moana | ""Official Trailer"" | In Theaters July 10","Moana | ""Official Trailer"" | In Theaters July 10",Disney,UC_5niPa-d35gg88HaS7RrIw,24,Entertainment,,0,https://i.ytimg.com/vi/n7f6hlKsxxo/hqdefault.jpg,en,en,False,140,PT2M20S,hd,True,True,False,False,4710942,53254,13428
zSsTR-vu5ZE,BE,2026-04-01T03:50:39.683401+00:00,2026-03-30T21:28:00Z,The Most Frustrating Game We've Played This Year,The Most Frustrating Game We've Played This Year,SMii7Y,UCzXwjTI6c6mVn6oui_p6oiw,20,Gaming,"smii7y, smii7yplus, smii7y+, smii7y plus, friendly steps, friendly steps gameplay, friendly steps game, friendly steps gameplay trailer, friendly steps trailer",9,https://i.ytimg.com/vi/zSsTR-vu5ZE/hqdefault.jpg,en,en,False,2460,PT41M,hd,False,True,False,False,1081486,58338,1629
cahWIOCm5YM,BE,2026-04-01T03:50:39.683409+00:00,2026-03-20T15:00:07Z,Semicenk - Üzülmedim Ki (Prod. by Büken),Semicenk - Üzülmedim Ki (Prod. by Büken),Eva Records,UCcSC5SQ7WeTZbSLEdPcgPAg,10,Music,"türkçe rap, music, hip hop, eva records, yeni şarkılar, spotify, tik tok, yeni çıkan, haberler, trap müzik, spotify 50, viral şarkılar, tik tok şarkıları",13,https://i.ytimg.com/vi/cahWIOCm5YM/hqdefault.jpg,tr,tr,False,154,PT2M34S,hd,False,True,False,False,7020669,61078,4835
sHQukSJLjoc,BE,2026-04-01T03:50:39.683417+00:00,2026-03-25T19:10:50Z,HARRY POTTER AND THE PHILOSOPHER'S STONE Official Teaser Trailer (2026),HARRY POTTER AND THE PHILOSOPHER'S STONE Official Teaser Trailer (2026),KinoCheck.com,UCLRlryMfL8ffxzrtqv0_k_w,24,Entertainment,"2026, Alastair Stout, Arabella Stanton, Dominic McLaughlin, Dumbledore, Fantasy, Harry, Harry Potter, Harry Potter trailer, Hermine Granger, Hogwarts, KinoCheck, Potter, Ron Weasley, School, Series, Severus Snape, Wizard, trailer",19,https://i.ytimg.com/vi/sHQukSJLjoc/hqdefault.jpg,en,en,False,148,PT2M28S,hd,False,True,False,False,640917,6547,3552
NCzEtaYvGGY,BE,2026-04-01T03:50:39.683425+00:00,2026-03-30T15:00:34Z,J’ai Empoisonné mes Habitants en Pompant l’Eau dans les Égouts ! (pour voir ce que ça fait),J’ai Empoisonné mes Habitants en Pompant l’Eau dans les Égouts ! (pour voir ce que ça fait),StundZow Off,UCbUXiv7ro8Pm8NZkQQjXCMA,20,Gaming,"stundzow, stund, cities, cities skyline, jeu de ville, stund ville, ville, experiences, egouts, pires experiences, realiser, tenter, faire, stund cities skyline, experiences cities skyline",15,https://i.ytimg.com/vi/NCzEtaYvGGY/hqdefault.jpg,fr,fr,False,1213,PT20M13S,hd,False,True,False,False,190138,5187,172
KTYp4guSwLg,BE,2026-04-01T03:50:39.683433+00:00,2026-03-27T17:00:07Z,Landy (Ft. Tiakola) - Ronnie Kray (Clip Officiel),Landy (Ft. Tiakola) - Ronnie Kray (Clip Officiel),Landy,UCo--_7Q6EK7thiy8J2BVZVQ,10,Music,"Landy, Tiakola, Clip, Musique, Rap, Ronnie Kray, Feat",7,https://i.ytimg.com/vi/KTYp4guSwLg/hqdefault.jpg,fr,fr,False,226,PT3M46S,hd,False,True,False,False,628911,23561,763
__GPPKA7Uww,BE,2026-04-01T03:50:39.683441+00:00,2026-03-28T09:45:00Z,STEEL BALL RUN JoJo's Bizarre Adventure 2nd STAGE | Official Teaser | Netflix,STEEL BALL RUN JoJo's Bizarre Adventure 2nd STAGE | Official Teaser | Netflix,Netflix Anime,UCBSs9x2KzSLhyyA9IKyt4YA,1,Film & Animation,JoJo_anime,1,https://i.ytimg.com/vi/__GPPKA7Uww/hqdefault.jpg,en,en-US,False,68,PT1M8S,hd,True,False,False,False,628712,34024,7110
WnYlrr-6LI0,BE,2026-04-01T03:50:39.683448+00:00,2026-03-27T15:45:03Z,"Zou Je Eerder, Maar Het Gebeurt Echt! In Roblox","Zou Je Eerder, Maar Het Gebeurt Echt! In Roblox",Dutchtuber,UCzWgtYoa3X7p8zJk5pEr6ww,20,Gaming,"dutchtuber, steal a brainrot dutchtuber, dutchtuber steal a brainrot, dutchtuber speelt roblox, roblox dutchtuber, roblox, steal a brainrot roblox, gaming, grappig",9,https://i.ytimg.com/vi/WnYlrr-6LI0/hqdefault.jpg,nl,nl,False,511,PT8M31S,hd,False,True,False,False,108214,4740,245
7Kouia1rYzg,BE,2026-04-01T03:50:39.683456+00:00,2026-03-12T23:00:09Z,Pocahontas,Pocahontas,PLK - Topic,UCajHQrZkOC6_wJ1r3QRvMtg,10,Music,"PLK, Grand Garçon, Pocahontas",3,https://i.ytimg.com/vi/7Kouia1rYzg/hqdefault.jpg,fr,de,False,169,PT2M49S,hd,False,True,False,False,1537022,23173,192
jqmPl6nd1HA,BE,2026-04-01T03:50:39.683464+00:00,2026-03-26T17:01:00Z,Harry Potter la série - RÉACTION au Teaser,Harry Potter la série - RÉACTION au Teaser,Durendal1,UCcliHNE38fJ4n4gYYB0TCQw,1,Film & Animation,"Cinéma, Durendal, Film, Vlog, Critique, Réaction, Teaser, Trailer, Harry Potter, à l'École des Sorciers, and the Philosopher's Stone, HBO, Série",13,https://i.ytimg.com/vi/jqmPl6nd1HA/hqdefault.jpg,fr,fr,False,789,PT13M9S,hd,False,True,False,False,76696,5766,1185
9zl5StXnXpY,BE,2026-04-01T03:50:39.683471+00:00,2026-03-30T15:01:25Z,J’AI OBTENU MON PROPRE REBIRTH SUR STEAL A BRAINROT !,J’AI OBTENU MON PROPRE REBIRTH SUR STEAL A BRAINROT !,ChocolatAndVanillah,UCaCUq621hbDixsvUDELqMVw,20,Gaming,"brainrot, brainrots, chocoh, chocolatandvanillah, chocolatandvanilla, choco, kevko, og, steal, steal a brainrot, unchained, unchained_off, roblox, toinelag",14,https://i.ytimg.com/vi/9zl5StXnXpY/hqdefault.jpg,fr,fr,False,1148,PT19M8S,hd,False,True,False,False,171997,3876,726
ucKEaDTHTQI,BE,2026-04-01T03:50:39.683480+00:00,2026-03-20T10:00:06Z,Bogdan DLP - Solo | Official Video,Bogdan DLP - Solo | Official Video,Bogdan DLP,UCOSuXx0kB-vHNsVY222B3lQ,10,Music,"bogdan dlp solo, aladam, am fost bagabont, am iubit-o, amandoi, bax banii, bog, bogdan de la ploiesti, bogdan dlp, bogdan dlp 2026, bogdan dlp adrian minune, bogdan dlp aladam, bogdan dlp cristina pucean, bogdan dlp habibi, bogdan dlp inima, bogdan dlp karmen complicat, bogdan dlp rares",17,https://i.ytimg.com/vi/ucKEaDTHTQI/hqdefault.jpg,ro,ro,False,140,PT2M20S,hd,False,True,False,False,3927619,24922,6273
pOfW-qdsvpU,BE,2026-04-01T03:50:39.683487+00:00,2026-03-24T14:13:22Z,Pokémon Champions – Overview Trailer – Nintendo Switch,Pokémon Champions – Overview Trailer – Nintendo Switch,Nintendo of America,UCGIY_O-8vW4rfX98KlMkvRg,20,Gaming,"nintendo, game, gameplay, fun, video game, action, adventure, rpg, play, switch, nintendo switch",11,https://i.ytimg.com/vi/pOfW-qdsvpU/hqdefault.jpg,en,en,False,369,PT6M9S,hd,True,True,False,False,1488432,59031,6580
6LiULulVXsM,BE,2026-04-01T03:50:39.683495+00:00,2026-03-28T20:00:02Z,Hermitcraft 11: Episode 15 - actually doing it,Hermitcraft 11: Episode 15 - actually doing it,Mumbo Jumbo,UChFur_NwVSbUozOcF_F2kMg,20,Gaming,"ideas, creative, build, survival, tutorial, How to, MumboJumbo, ThatMumboJumbo, Minecraft, Building, Mumbo, Redstone, Technical, Piston, 1.9, 1.8, 1.10, 1.11, Gaming, Game, spotlight, showcase, challenge, command, mini-game, gameplay, playthrough, Let's Play, No Swearing, Family Friendly, mc, mcpe, vanilla, Xbox, 360, PS4, PE, pocket edition, mobile",39,https://i.ytimg.com/vi/6LiULulVXsM/hqdefault.jpg,en,en,False,2068,PT34M28S,hd,False,True,False,False,1040320,62480,4042
YeKct6QYsww,BE,2026-04-01T03:50:39.683502+00:00,2026-03-28T17:00:26Z,Booba - Dolce Camara Solo (Clip Officiel),Booba - Dolce Camara Solo (Clip Officiel),B20baOfficiel,UCNtD7oDVld6YeaYV7tCXo1A,10,Music,"Booba, Tallac Records, 92i, B2oba, Kopp, Dolce Camara",6,https://i.ytimg.com/vi/YeKct6QYsww/hqdefault.jpg,fr,fr,False,161,PT2M41S,hd,False,False,False,False,364368,24091,1476
SqpZGOut_7Q,BE,2026-04-01T03:50:39.683510+00:00,2026-03-25T19:27:36Z,Série Harry Potter : Réaction au Teaser du Reboot de HBO !,Série Harry Potter : Réaction au Teaser du Reboot de HBO !,Matteo - La chaîne du geek,UC1UzakjtYjo2m0ILBsU2khQ,24,Entertainment,"geek, actu, news, pop, culture, cinéma, jeux vidéo, movie, film, série, actu jv, actu ciné, actu série, pop culture, annonce, trailer, bande-annonce, avis, review, informations, détails, actualité",22,https://i.ytimg.com/vi/SqpZGOut_7Q/hqdefault.jpg,fr,fr,False,737,PT12M17S,hd,False,False,False,False,35558,1717,360
cVm98BBkQRY,BE,2026-04-01T03:50:39.683518+00:00,2026-03-25T21:49:32Z,Searching for 100 Players Who Went Missing,Searching for 100 Players Who Went Missing,Spoke,UCk2uxbWi5py_iJXaEsh2YRA,20,Gaming,"spoke, spokeishere, lifesteal, minecraft, survival, wormhole, unstable, unstable universe, wemmbu, parrotx2",10,https://i.ytimg.com/vi/cVm98BBkQRY/hqdefault.jpg,en,en-US,False,4701,PT1H18M21S,hd,False,True,False,False,2652074,94000,14442
PYlar41MkvM,BE,2026-04-01T03:50:39.683525+00:00,2026-03-26T10:01:17Z,Tattoo,Tattoo,Loreen - Topic,UCpYX3GkOcmXISdUqjD0qksA,10,Music,"Loreen, WILDFIRE, Tattoo",3,https://i.ytimg.com/vi/PYlar41MkvM/hqdefault.jpg,en,en,False,184,PT3M4S,hd,False,True,False,False,852951,10124,41
ztO4Bk0ALGI,BE,2026-04-01T03:50:39.683532+00:00,2026-03-23T22:01:10Z,JUJUTSU KAISEN Sendai Colony | Official Trailer | Crunchyroll,JUJUTSU KAISEN Sendai Colony | Official Trailer | Crunchyroll,Crunchyroll,UC6pGDc4bFGD1_36IKv3FnYg,1,Film & Animation,"jujutsu kaisen, jujutsu kaisen anime, jjk, jjk anime, jujutsu kaisen season 3, jujutsu kaisen s3, jjk s3, jujutsu kaisen sendai colony, jjk sendai colony, crunchyroll, anime, anime pv, anime trailer, sendai colony, sendai colony trailer, sendai colony teaser, sendai colony trailer reaction, sendai colony jjk, sendai colony jjk trailer, sendai colony animation",20,https://i.ytimg.com/vi/ztO4Bk0ALGI/hqdefault.jpg,en,ja,False,56,PT56S,hd,True,True,False,False,2799598,97704,3392
