video_id,country,fetched_at,published_at,title,localized_title,channel_title,channel_id,category_id,category_name,tags,tag_count,thumbnail,default_language,audio_language,is_live,duration,duration_raw,definition,caption_available,licensed_content,embeddable,made_for_kids,views,likes,comments
7fyufPkXLbs,NO,2026-03-11T03:11:29.312806+00:00,2026-03-01T00:40:00Z,ROSALÍA - Berghain (Live at The BRIT Awards 2026) ft. Björk,ROSALÍA - Berghain (Live at The BRIT Awards 2026) ft. Björk,RosaliaVEVO,UCy2bCk5KnIfjmWYFHMZcd5w,10,Music,"Rosalia, Rosalía, Spanish, Catalan, Rosalia live, Lux, Lux Tour, Brit Awards, Rosalia and Bjork, Rosalia performance, Rosalia Brit Awards, German, Lux Live, Berghain Lyrics, Berghain Techno, Techno Opera, Rosalia Opera, Berghain Remix, Bjork, Björk, Yves Tumor, Bjork pajaro, Manchester, Brit Awards Manchester, Rosalia Red Carpet, Techno, Berghain, Live, Björk Yves Tumor, World Music",30,https://i.ytimg.com/vi/7fyufPkXLbs/hqdefault.jpg,en,en,False,246,PT4M6S,hd,False,True,False,False,8570701,315708,13461
4lFnIlH06Sw,NO,2026-03-11T03:11:29.312848+00:00,2026-03-06T20:00:07Z,Digital Circus Ep 8 Trailer.,Digital Circus Ep 8 Trailer.,GLITCH,UCn_FAXem2-e3HQvmK-mOH4g,1,Film & Animation,"glitch, glitch productions, digital circus, the amazing digital circus, murder drones, Pomni, Uzi, Jax, Ragatha, Kinger, Gangle, Zooble, Caine, Bubble, 3D, Animation, 3D Animation, Indie Animation, Gummigoo",19,https://i.ytimg.com/vi/4lFnIlH06Sw/hqdefault.jpg,en,en,False,67,PT1M7S,hd,True,True,False,False,8182696,745995,44329
pvAJ6NnPdMA,NO,2026-03-11T03:11:29.312860+00:00,2026-03-08T18:53:02Z,Minecraft Speedrunner VS 6 Hunters,Minecraft Speedrunner VS 6 Hunters,Dream,UCTkXRDQl0luXxVQrRQvWS6w,20,Gaming,"minecraft, dream, dream minecraft",3,https://i.ytimg.com/vi/pvAJ6NnPdMA/hqdefault.jpg,en,en,False,4145,PT1H9M5S,hd,True,True,False,False,9450972,515935,30530
2GJfWMYCWY0,NO,2026-03-11T03:11:29.312870+00:00,2026-02-27T05:00:07Z,BLACKPINK - ‘GO’ M/V,BLACKPINK - ‘GO’ M/V,BLACKPINK,UCOmHUn--16B90oW2L6FRR3A,10,Music,"YG Entertainment, YG, 와이지, K-pop, BLACKPINK, 블랙핑크, 블핑, 제니, 로제, 리사, 지수, LISA, JISOO, JENNIE, ROSÉ, BLINK, 블링크, JENNIE You & Me, JENNIE You and ME, You & Me, You and Me, 제니 You & Me, 제니 You and Me, 제니 유앤미, 유앤미, JENNIE 유앤미, 제니 코첼라, JENNIE COACHELLA",28,https://i.ytimg.com/vi/2GJfWMYCWY0/hqdefault.jpg,en,ko,False,202,PT3M22S,hd,True,True,False,False,47024603,3377419,282180
XNQbH1SDPRk,NO,2026-03-11T03:11:29.312879+00:00,2026-03-05T17:00:58Z,The Boys – Final Season Trailer | Prime Video,The Boys – Final Season Trailer | Prime Video,Prime Video,UCQJWtTnAHhEG5w4uN0udnUQ,24,Entertainment,"the boys, the boys season 5, the boys s5, the boys season 5 trailer, the boys season 5 teaser, the boys s5 trailer, the boys s5 teaser, the boys final season, the boys final season trailer, butcher vs soldier boy, butcher vs soldier boy rematch, homelander vs butcher, butcher vs homelander, soldier boy vs butcher, homelander and ryan, butcher vs hughie, hughie vs butcher, the boys final season trailer breakdown, the boys season 5 trailer breakdown, the boys season 5 theories",20,https://i.ytimg.com/vi/XNQbH1SDPRk/hqdefault.jpg,en,en,False,162,PT2M42S,hd,True,True,False,False,5988445,296512,12488
0PXrrkuI_0Y,NO,2026-03-11T03:11:29.312887+00:00,2026-03-07T19:52:44Z,How we Built the first Naval stronghold in Vanilla Rust...,How we Built the first Naval stronghold in Vanilla Rust...,Willjum,UCzOfLNkiScJp3U_h_QlvHHg,20,Gaming,"Willjum, Rust, Rust Solo Survival, Rust Movie, Twitch highlights, Rust Chilled, Willyum, Rust Solo Story, Solo, Rust Solo Base, Spoonkid, BritYT, BritRust",13,https://i.ytimg.com/vi/0PXrrkuI_0Y/hqdefault.jpg,en-GB,en-US,False,4031,PT1H7M11S,hd,False,True,False,False,701733,26455,1460
o6jQo3-iCao,NO,2026-03-11T03:11:29.312895+00:00,2026-03-06T17:00:06Z,Harry Styles - American Girls (Official Video),Harry Styles - American Girls (Official Video),HarryStylesVEVO,UCbOCbp5gXL8jigIBZLqMPrw,10,Music,"Harry styles, aperture, american girls official video, american girls, i’ve known you for ages, american girls all over the world, my friends are in love with american girls, ive seen it in stages all over the world, right at home with perfect timing, face that knows perfect lighting, harry styles live, harry styles music video, harry styles we belong together, together together, harry styles together together, harry styles lyrics, harry styles new music video",17,https://i.ytimg.com/vi/o6jQo3-iCao/hqdefault.jpg,en,en,False,228,PT3M48S,hd,False,True,False,False,6752594,257449,8438
LX9kXRRJlPw,NO,2026-03-11T03:11:29.312904+00:00,2026-03-09T21:10:21Z,The Super Mario Galaxy Movie – Final Trailer,The Super Mario Galaxy Movie – Final Trailer,Nintendo of America,UCGIY_O-8vW4rfX98KlMkvRg,1,Film & Animation,"nintendo, game, gameplay, fun, video game, action, adventure, rpg, play, switch, nintendo switch",11,https://i.ytimg.com/vi/LX9kXRRJlPw/hqdefault.jpg,en,en,False,144,PT2M24S,hd,False,True,False,False,1705272,84040,5524
ZE6KmHeoabY,NO,2026-03-11T03:11:29.312911+00:00,2026-03-09T21:58:09Z,Foltyn Gave Me ADMIN COMMANDS in His Game!,Foltyn Gave Me ADMIN COMMANDS in His Game!,CaylusBlox,UCsPMNatXCwqyUuJilBT73jg,20,Gaming,"caylusblox, caylus roblox, caylus, caylus gaming, caylus infinite, infinite lists, calus, callus, calis, roblox, caylus horror, caylus scary, caylus scariest, caylus scary myths, caylus creepy, caylus roblox horror, caylus roblox scary, caylus steal a brainrot, caylus aura, caylus stream, caylus brainrot, caylus foltyn",22,https://i.ytimg.com/vi/ZE6KmHeoabY/hqdefault.jpg,en-US,en-US,False,1445,PT24M5S,hd,False,True,False,False,892432,13648,1329
ucRulNQsuYQ,NO,2026-03-11T03:11:29.312919+00:00,2026-02-27T16:00:07Z,"Gorillaz - The Mountain, The Moon Cave and The Sad God","Gorillaz - The Mountain, The Moon Cave and The Sad God",Gorillaz,UCfIXdjDQH9Fau7y99_Orpjw,10,Music,,0,https://i.ytimg.com/vi/ucRulNQsuYQ/hqdefault.jpg,en,en,False,524,PT8M44S,hd,False,True,False,False,8939919,569068,20405
NHk7scrb_9I,NO,2026-03-11T03:11:29.312926+00:00,2026-03-07T05:31:00Z,Dhurandhar The Revenge Official Hindi Trailer | Ranveer S | Aditya D | In Cinemas 19 March 2026,Dhurandhar The Revenge Official Hindi Trailer | Ranveer S | Aditya D | In Cinemas 19 March 2026,JioStudios,UCcXQd6kHKm0b41x8zMVMmMg,24,Entertainment,"Jio Studios, Jio Cinema, Jio Saavn, Jio TV, Dhurandhar, Aditya Dhar, Ranveer Singh, Sanjay Dutt, Akshaye Khanna, R. Madhavan, Arjun Rampal, Sara Arjun, Shashwat Sachdev, Revenge, Hindi Film Trailer, Hindi Film Teaser, Blockbuster Hindi Film, Dhurandhar 2 Teaser, Dhurandhar 2, Bollywood Film, T-Series, Dhurandhar The Revenge, March 19, Dhurandhar Trailer, Dhurandhar 2 Trailer, Dhurandhar The Revenge Trailer, Bollywood Trailer, Movie Trailer, Popular Movie Trailer",29,https://i.ytimg.com/vi/NHk7scrb_9I/hqdefault.jpg,en,en,False,206,PT3M26S,hd,True,False,False,False,47202804,1054868,54519
qv9BD1AnojQ,NO,2026-03-11T03:11:29.312934+00:00,2026-03-10T17:45:04Z,SIDEMEN REACTS BUT ONE OF US IS AN IMPOSTOR,SIDEMEN REACTS BUT ONE OF US IS AN IMPOSTOR,SidemenReacts,UCjRkTl_HP4zOh3UFaThgRZw,24,Entertainment,"Sidemen, Sidemen Reacts, SidemenReacts, ksi, jj olatunji, miniminter, w2s, tobi, vikkstar123, ethan, zerkaa, reacts, imposter, impostor, IMPOSTER, IMPOSTOR, Among Us, AMONG US",18,https://i.ytimg.com/vi/qv9BD1AnojQ/hqdefault.jpg,en,en,False,1874,PT31M14S,hd,False,True,False,False,371338,26540,734
lY5V4hSLWY8,NO,2026-03-11T03:11:29.312942+00:00,2026-02-27T05:00:08Z,Bruno Mars - Risk It All [Official Music Video],Bruno Mars - Risk It All [Official Music Video],Bruno Mars,UCoUM-UJ7rirJYP8CQ0EIaHA,10,Music,"bruno mars, bruno, atlantic records, official video, pop music, R&B, funk, soul, the romantic bruno mars, bruno mars the romantic, the romantic, bruno mars new music, bruno mars new album, bruno mars album, bruno mars new release, bruno mars the romantic album, Bruno Mars - Risk It All [Official Music Video], bruno mars risk it all, risk it all bruno mars, risk it all",20,https://i.ytimg.com/vi/lY5V4hSLWY8/hqdefault.jpg,en,en,False,211,PT3M31S,hd,False,True,False,False,30311238,809111,34014
vPMcEabBQEU,NO,2026-03-11T03:11:29.312949+00:00,2026-03-09T15:30:00Z,"XO, Kitty: Season 3 | Official Trailer | Netflix","XO, Kitty: Season 3 | Official Trailer | Netflix",Netflix,UCWOA1ZGywLbqmigxE4Qlvuw,24,Entertainment,"Anna Cathcart, Being Abroad, Comedy, Coming of Age, Cute, Dating, Drama, First Love, High School, Humorous, Netflix, Quirky, Romance, Romantic, Season 3, Self-Discovery, Teen, Teen Angst, XO Kitty, XO Kitty Season 3",20,https://i.ytimg.com/vi/vPMcEabBQEU/hqdefault.jpg,en,en-US,False,131,PT2M11S,hd,True,True,False,False,2400155,103303,3998
Kw-7bIDCRbY,NO,2026-03-11T03:11:29.312956+00:00,2026-03-09T21:28:00Z,Rats Make Me Crazy...,Rats Make Me Crazy...,SMii7Y,UCzXwjTI6c6mVn6oui_p6oiw,20,Gaming,"smii7y, smii7yplus, smii7y+, smii7y plus, wise guys, wise guys game, wise guys gameplay, social deduction game, among us type game, among us like, weird steam games",11,https://i.ytimg.com/vi/Kw-7bIDCRbY/hqdefault.jpg,en,en,False,2130,PT35M30S,hd,False,True,False,False,1127360,51561,2301
kgLLE6dYr7s,NO,2026-03-11T03:11:29.312963+00:00,2026-02-28T09:00:12Z,Miyagi & Эндшпиль - ANABIOS (Official Album Teaser),Miyagi & Эндшпиль - ANABIOS (Official Album Teaser),Hajime,UCApdP81v1rMFGiFUq-A7vBQ,10,Music,,0,https://i.ytimg.com/vi/kgLLE6dYr7s/hqdefault.jpg,en,ru,False,844,PT14M4S,hd,False,True,False,False,1835286,122309,9617
_t1eVpIFE1A,NO,2026-03-11T03:11:29.312970+00:00,2026-03-09T15:09:41Z,"IN THE GREY Official Trailer (2026) Jake Gyllenhaal, Henry Cavill, Guy Ritchie","IN THE GREY Official Trailer (2026) Jake Gyllenhaal, Henry Cavill, Guy Ritchie",ONE Media,UCzcRQ3vRNr6fJ1A9rqFn7QA,1,Film & Animation,"movie trailer, new trailer, trailer, official, 2026, In the Grey, In the Grey Trailer, Jake Gyllenhaal, Henry Cavill, Eiza González, Rosamund Pike, Guy Ritchie",12,https://i.ytimg.com/vi/_t1eVpIFE1A/hqdefault.jpg,en,en,False,147,PT2M27S,hd,False,True,False,False,948852,13591,846
l8SBNoZPRnE,NO,2026-03-11T03:11:29.312978+00:00,2026-03-06T18:00:54Z,Hermitcraft 11: Episode 12 - TERRAIN TIME!,Hermitcraft 11: Episode 12 - TERRAIN TIME!,Grian,UCR9Gcq0CMm6YgTzsDxAxjOQ,20,Gaming,"Minecraft, Grian, building, grian, mincraft, tutorial, yt:quality=high, minecraft, ideas, creative, build",11,https://i.ytimg.com/vi/l8SBNoZPRnE/hqdefault.jpg,en,en-GB,False,1265,PT21M5S,hd,True,True,False,False,1075126,72742,1849
YvYii6dluM8,NO,2026-03-11T03:11:29.312985+00:00,2026-02-28T13:00:06Z,【Ado】ビバリウム (Vivarium),【Ado】ビバリウム (Vivarium),Ado,UCln9P4Qm3-EAY4aiEPmRwEA,10,Music,,0,https://i.ytimg.com/vi/YvYii6dluM8/hqdefault.jpg,ja,ja,False,272,PT4M32S,hd,True,False,False,False,8586314,445939,19642
3ntfjZGgm04,NO,2026-03-11T03:11:29.312992+00:00,2026-03-10T15:00:13Z,Minecraft LIVE Official Trailer – March 2026,Minecraft LIVE Official Trailer – March 2026,Minecraft,UC1sELGmy5jp5fQUugmuYlXQ,20,Gaming,"Minecraft, Minecraft live, Minecraft live 2026",3,https://i.ytimg.com/vi/3ntfjZGgm04/hqdefault.jpg,en,en,False,62,PT1M2S,hd,False,False,False,False,415415,35676,2743
L9NZUbeaS2I,NO,2026-03-11T03:11:29.312998+00:00,2026-03-08T21:36:20Z,ESL Pro League Season 23 - Day 8 - Stream A,ESL Pro League Season 23 - Day 8 - Stream A,ESL Counter-Strike,UCPq2ETz4aAGo2Z-8JisDPIA,20,Gaming,"ESL, Counter-Strike, ESL CS, ESLCS, ESL CSGO, ESL Counter-Strike, IEM, IEM CS, IEM CSGO, CSGO, esportsisawesomesauce",11,https://i.ytimg.com/vi/L9NZUbeaS2I/hqdefault.jpg,en,en,False,40412,PT11H13M32S,hd,False,True,False,False,857663,5929,14
k2_bhC5E0mc,NO,2026-03-11T03:11:29.313006+00:00,2026-02-27T00:00:07Z,Yeat & EsDeeKid - Made It On Our Own (Official Music Video),Yeat & EsDeeKid - Made It On Our Own (Official Music Video),Yeat,UCV4UK9LNNLViFP4qZA_Wmfw,10,Music,"yeat, esdeekid, adl",3,https://i.ytimg.com/vi/k2_bhC5E0mc/hqdefault.jpg,en,en-US,False,177,PT2M57S,hd,False,False,False,False,1689191,78083,5965
AoBy5YGYhaM,NO,2026-03-11T03:11:29.313013+00:00,2026-03-10T14:00:16Z,"From: Season 4 Exclusive Trailer (2026) Harold Perrineau, Catalina Sandino Moreno","From: Season 4 Exclusive Trailer (2026) Harold Perrineau, Catalina Sandino Moreno",IGN,UCKy1dAqELo0zrOtPkf0eTMw,24,Entertainment,"From, Horror, MGM Plus, Sci-Fi, TV, from: season 4, from season 4 trailer, from season 4, from season 4 teaser, from season 4 announcement, from season 4 release date, from tv show, from season 4 news, from cast season 4, from season 4 plot, from tv series season 4, from season 4 tariler",17,https://i.ytimg.com/vi/AoBy5YGYhaM/hqdefault.jpg,en,,False,132,PT2M12S,hd,False,True,False,False,316998,11536,968
TphfLyzVbqQ,NO,2026-03-11T03:11:29.313020+00:00,2026-03-01T03:50:03Z,100 Days as King of the Unstable SMP,100 Days as King of the Unstable SMP,Parrot,UCPLMPHT-d8GZOqL_AHJFdQQ,20,Gaming,"Minecraft, Minecraft SMP, SMP, Minecraft Server, LifeSteal SMP, School Minecraft Server, School SMP, School Parrot, Parrot, ParrotX2, Dream SMP, TommyInnit, LifeSteal, parrot lifesteal smp, Spoke, minecraft survival, minecraft hardcore, minecraft challenge, minecraft server, HermitCraft, MumboJumbo, Grian, why i broke 100+ bedrock, Here's Why I Made 12240 Minecraft Cakes, Minecraft Hunt, LifeSteal Season 3, 1 Heart Minecraft, LifeSteal Season 4, Why I Removed the World",29,https://i.ytimg.com/vi/TphfLyzVbqQ/hqdefault.jpg,en,en,False,4310,PT1H11M50S,hd,False,True,False,False,4764944,186884,31099
1FVF-9KQiPo,NO,2026-03-11T03:11:29.313027+00:00,2026-02-08T13:00:02Z,Taylor Swift - Opalite (Official Music Video),Taylor Swift - Opalite (Official Music Video),Taylor Swift,UCqECaJ8Gagnn7YCbPEzWH6g,10,Music,"Taylor swift, taylor, swift, taylor swift TLOAS, TS12, Showgirl, The Life of a Showgirl, new taylor swift, taylor swift album",9,https://i.ytimg.com/vi/1FVF-9KQiPo/hqdefault.jpg,en,en-US,False,360,PT6M,hd,False,False,False,False,15967192,595679,27609
Z1jcPlGXnMo,NO,2026-03-11T03:11:29.313034+00:00,2026-03-04T19:01:44Z,Lanterns  | Official Teaser | HBO Max,Lanterns  | Official Teaser | HBO Max,HBO Max,UCx-KWLTKlB83hDI6UKECtJQ,24,Entertainment,"hbo max, hbo, hbo originals, hbo original series, hbo trailer, new on hbo, max, hbo max originals, hbo max trailer, hbo max teaser, hbo max series, hbo max youtube",12,https://i.ytimg.com/vi/Z1jcPlGXnMo/hqdefault.jpg,en,en,False,141,PT2M21S,hd,True,True,False,False,2365908,111676,11507
Wv_VSET2h-U,NO,2026-03-11T03:11:29.313042+00:00,2026-03-09T06:29:37Z,I Spent 100 Days Speedrunning Minecraft. Here's what happened,I Spent 100 Days Speedrunning Minecraft. Here's what happened,Ludwig,UCrPseYLGpNygVi34QpGNqpA,20,Gaming,"ludwig, ludwigahgren, ahgren, gaming, chat, stream, decides, lud",8,https://i.ytimg.com/vi/Wv_VSET2h-U/hqdefault.jpg,en,en,False,1847,PT30M47S,hd,False,True,False,False,520551,22098,674
1Lmy7qwmSMc,NO,2026-03-11T03:11:29.313049+00:00,2026-02-23T09:00:12Z,IVE 아이브 'BLACKHOLE' MV,IVE 아이브 'BLACKHOLE' MV,STARSHIP,UCYDmx2Sfpnaxg488yBpZIGg,10,Music,,0,https://i.ytimg.com/vi/1Lmy7qwmSMc/hqdefault.jpg,ko,ko,False,204,PT3M24S,hd,True,False,False,False,10456017,309447,19712
ZmXJnIGPNh8,NO,2026-03-11T03:11:29.313056+00:00,2026-03-04T16:55:06Z,Invincible - Season 4 Thragg Teaser | Prime Video,Invincible - Season 4 Thragg Teaser | Prime Video,Invincible,UC_-U9awQQm_GMJtR2mBhJPg,1,Film & Animation,"Invincible, Amazon Prime, Thragg, Thragg Teaser, Invincible Season 4, Invincible Thragg, Invincible Season 4 Thragg, Invincible Thragg teaser, Invincible S4 Thragg, Invincible S4 Thragg teaser, invincible season 4 thragg teaser, Prime Video, Invincible Prime, Invincible Prime Video",14,https://i.ytimg.com/vi/ZmXJnIGPNh8/hqdefault.jpg,en,en-US,False,31,PT31S,hd,False,False,False,False,1718564,78202,4032
XrAoDZLZZ1g,NO,2026-03-11T03:11:29.313063+00:00,2026-02-28T17:00:01Z,1 Minute vs 10 Year Build Challenge,1 Minute vs 10 Year Build Challenge,MrBeast Gaming,UCIPPMRA040LQr5QPyJEbmXA,20,Gaming,,0,https://i.ytimg.com/vi/XrAoDZLZZ1g/hqdefault.jpg,en,en,False,864,PT14M24S,hd,True,True,False,False,24370804,443905,13396
m0BFZkPsoWY,NO,2026-03-11T03:11:29.313069+00:00,2026-02-17T23:02:14Z,Twenty One Pilots - Drag Path (Official Video),Twenty One Pilots - Drag Path (Official Video),twenty one pilots,UCBQZwaNPFfJ1gZ1fLZpAEGw,10,Music,"twenty one pilots, twenty one pilots official, drag path, digital remains, drag path official video, drag path leak, twenty one pilots you found me, breach album, drag path edit, you found me, dragpath, drag path tiktok, twenty one pilots 2026, new twenty one pilots, breach digital remains, drag path lyrics, drag path reaction",17,https://i.ytimg.com/vi/m0BFZkPsoWY/hqdefault.jpg,en,en,False,266,PT4M26S,hd,False,True,False,False,5699000,290816,12073
b24oG7qCwp4,NO,2026-03-11T03:11:29.313077+00:00,2026-02-25T18:01:17Z,Mortal Kombat II | Official Trailer II,Mortal Kombat II | Official Trailer II,Warner Bros.,UCjmJDM5pRKbUlVIzDYYWb6g,1,Film & Animation,"2026, Action, Adeline Rudolph, Adventure, Battle, Chin Han, Coming Soon, Damon Herriman, Fantasy, Film, Film Trailer, Film Warner, Game, Hiroyuki Sanada, Jessica McNamee, Joe Taslim, Josh Lawson, Karl Urban, Lewis Tan, Ludi Lin, MMA Fighter, Martial Arts, Mehcad Brooks, Mortal Kombat, Mortal Kombat II, Movie, Official Trailer, Simon McQuoid, Tadanobu Asano, Tati Gabrielle, Trailer, Video Game, WB, Warner, Warner Bros, Warner Brothers, Warner Media",37,https://i.ytimg.com/vi/b24oG7qCwp4/hqdefault.jpg,en,en-US,False,145,PT2M25S,hd,True,False,False,False,15351493,201491,11157
6WuroBHg7So,NO,2026-03-11T03:11:29.313084+00:00,2026-03-10T20:00:05Z,Hermitcraft 11: Episode 13 - Expansion,Hermitcraft 11: Episode 13 - Expansion,Mumbo Jumbo,UChFur_NwVSbUozOcF_F2kMg,20,Gaming,"ideas, creative, build, survival, tutorial, How to, MumboJumbo, ThatMumboJumbo, Minecraft, Building, Mumbo, Redstone, Technical, Piston, 1.9, 1.8, 1.10, 1.11, Gaming, Game, spotlight, showcase, challenge, command, mini-game, gameplay, playthrough, Let's Play, No Swearing, Family Friendly, mc, mcpe, vanilla, Xbox, 360, PS4, PE, pocket edition, mobile",39,https://i.ytimg.com/vi/6WuroBHg7So/hqdefault.jpg,en,en,False,1201,PT20M1S,hd,False,True,False,False,330277,32774,1943
Cdvu4rNEOqc,NO,2026-03-11T03:11:29.313091+00:00,2026-02-14T16:45:06Z,MORGENSHTERN - Live from the Dead Sea (Солевой Лайв 2026),MORGENSHTERN - Live from the Dead Sea (Солевой Лайв 2026),MORGENSHTERN,UCWnqnojAgMdN0fQpr_xByJw,10,Music,,0,https://i.ytimg.com/vi/Cdvu4rNEOqc/hqdefault.jpg,ru,ru,False,1668,PT27M48S,hd,True,True,False,False,2732532,231218,17893
eUKyT515H7s,NO,2026-03-11T03:11:29.313098+00:00,2026-03-03T18:00:47Z,Honest Trailers | A Knight of the Seven Kingdoms,Honest Trailers | A Knight of the Seven Kingdoms,Screen Junkies,UCOpcACMWblDls9Z6GERVi1A,1,Film & Animation,,0,https://i.ytimg.com/vi/eUKyT515H7s/hqdefault.jpg,en,en,False,450,PT7M30S,hd,False,True,False,False,674541,23512,1262
jIL5RO3TwhQ,NO,2026-03-11T03:11:29.313105+00:00,2026-03-10T17:25:00Z,SIDEMEN SPEND A NIGHT IN AN ABANDONED STORAGE UNIT,SIDEMEN SPEND A NIGHT IN AN ABANDONED STORAGE UNIT,MoreSidemen,UCh5mLn90vUaB1PbRRx_AiaA,22,People & Blogs,"sidemen, moresidemen, miniminter, ksi, zerkaa, behzinga, tbjzl, vikkstar, wroetoshaw",9,https://i.ytimg.com/vi/jIL5RO3TwhQ/hqdefault.jpg,en,en-GB,False,1913,PT31M53S,hd,False,True,False,False,472893,20238,765
vqkfEUqjl6Y,NO,2026-03-11T03:11:29.313112+00:00,2026-02-06T05:00:01Z,ATEEZ(에이티즈) - 'Adrenaline' Official MV,ATEEZ(에이티즈) - 'Adrenaline' Official MV,KQ ENTERTAINMENT,UCQdq-lqPEq_yZ_wP_kuVB9Q,10,Music,"KQ, 케이큐, ATEEZ, 에이티즈, 홍중, HONGJOONG, 성화, SEONGHWA, 윤호, YUNHO, 여상, YEOSANG, 산, SAN, 민기, MINGI, 우영, WOOYOUNG, 종호, JONGHO, KPOP, 남돌, IDOL, 케이팝, GOLDENHOUR, 골든아워, GOLDENHOURPART4, GHPT4, 골든아워파트포, 컴백스포일러, MV, 뮤직비디오, 아드레날린, 아드레날린뮤비, 아드레날린뮤직비디오, 아드레날린MV",36,https://i.ytimg.com/vi/vqkfEUqjl6Y/hqdefault.jpg,en,ko,False,261,PT4M21S,hd,True,False,False,False,31970999,480394,46083
c51ND9Hdbw0,NO,2026-03-11T03:11:29.313147+00:00,2026-02-19T17:00:14Z,Toy Story 5 | Official Trailer | In Theaters June 19,Toy Story 5 | Official Trailer | In Theaters June 19,Pixar,UC_IRYSp4auq7hKLvziWVH6w,1,Film & Animation,"Pixar, Disney, Disney Pixar, Pixar Movie, Animation",5,https://i.ytimg.com/vi/c51ND9Hdbw0/hqdefault.jpg,en,en,False,145,PT2M25S,hd,True,True,False,False,10605156,238102,19178
52uWEOX4gGU,NO,2026-03-11T03:11:29.313166+00:00,2026-03-07T23:32:07Z,"I Got Every ""Impossible"" Death Message","I Got Every ""Impossible"" Death Message",Beppo,UC9OABighzB6Qr5OAOm5RLdA,20,Gaming,"minceraft, hardcor, hradcore, minecarft",4,https://i.ytimg.com/vi/52uWEOX4gGU/hqdefault.jpg,en,en,False,1070,PT17M50S,hd,False,True,False,False,1700481,49012,2107
-cgTFSrmrwQ,NO,2026-03-11T03:11:29.313183+00:00,2026-02-13T19:00:06Z,CENTRAL CEE - SLAUGHTER (FEAT. J HUS) (MUSIC VIDEO),CENTRAL CEE - SLAUGHTER (FEAT. J HUS) (MUSIC VIDEO),Central Cee,UCV_CsAy5CNBX_uwDQ7RMe1Q,10,Music,"CENTRAL CEE, CENTRALCEE, CENTRAL CEE NEW SONG, CENTRAL CEE NEW VIDEO, JHUS, J HUS, JHUS NEW SONG, JHUS NEW VIDEO, J HUS NEW SONG, J HUS NEW VIDEO",10,https://i.ytimg.com/vi/-cgTFSrmrwQ/hqdefault.jpg,en,en,False,163,PT2M43S,hd,False,False,False,False,2925654,112274,4991
P0XN3-n-2Lo,NO,2026-03-11T03:11:29.313191+00:00,2026-02-08T20:00:04Z,Project Hail Mary | Final Trailer,Project Hail Mary | Final Trailer,Amazon MGM Studios,UCf5CjDJvsFvtVIhkfmKAwAA,24,Entertainment,"MGM, MGM Studios, Metro-Goldwyn- Mayer, Metro Pictures Corporations, Goldwyn Pictures, Louis B. Mayer Pictures, MGM Pictures, United Artists, Metro MGM/UA, Amazon MGM, Amazon MGM Studios, Amazon, Project Hail Mary, Phil Lord, Christopher Miller, Project Hail Mary 2026, Project Hail Mary Trailer, Trailer, Official Trailer, Ryan Gosling, Milana Vayntrub, Liz Kingsman, Sandra Huller, James Ortiz, James Wright, New Movies 2026, Project Hail Mary Final Trailer, Final Trailer",28,https://i.ytimg.com/vi/P0XN3-n-2Lo/hqdefault.jpg,en,en-US,False,164,PT2M44S,hd,True,True,False,False,13773505,79255,5834
KhhSWx4kk_I,NO,2026-03-11T03:11:29.313199+00:00,2026-03-09T14:15:02Z,The Sinking City Remastered Review,The Sinking City Remastered Review,MandaloreGaming,UClOGLGPOqlAiLmOvXW5lKbw,20,Gaming,"the sinking city, the sinking city remastered, the sinking city remastered review, the sinking city review, sinking city, sinking city remastered, sinking city review, the sinking city remastered gameplay, lovecraft, lovecraft game, lovecraft game steam, call of cthulhu, call of cthulhu game, dark corners of the earth, mandalore, mandaloregaming, mandalore gaming, cthulhu game, the sinking city 2, the sinking city remaster, cthulhu, dagon, the sinking city remastered gameplay pc",23,https://i.ytimg.com/vi/KhhSWx4kk_I/hqdefault.jpg,en,en,False,3806,PT1H3M26S,hd,True,True,False,False,538452,25063,2111
fV8bKLHKLYI,NO,2026-03-11T03:11:29.313207+00:00,2026-02-09T17:00:07Z,Joji - Last of a Dying Breed / Dior (Official Video),Joji - Last of a Dying Breed / Dior (Official Video),Joji,UCFl7yKfcRcFmIUbKeCA-SJQ,10,Music,"Joji, Nectar, BALLADS 1, In Tongues, Chloe Burbank, SLOW DANCING IN THE DARK, 88rising, glimpse of us, smithereens, joji tour, joji die for you, joji head in the clouds, joji music video, joji official video, joji visualizer, joji lyrics, piss in the wind, pixelated kisses, past won't leave my bed, love you less, joji live, BRTHR, last of a dying breed, dior, music video",25,https://i.ytimg.com/vi/fV8bKLHKLYI/hqdefault.jpg,en,en,False,318,PT5M18S,hd,False,True,False,False,1914661,91871,3714
8wSTyyJXBAw,NO,2026-03-11T03:11:29.313214+00:00,2026-03-09T07:11:20Z,ROBLOX SWING FOR BRAINROTS..,ROBLOX SWING FOR BRAINROTS..,FoltynPlays,UC2uQvUg3YYzoOtj1yZLT0Ow,20,Gaming,"Foltyn, foltynplays, roblox, roblox gaming, family friendly, foltyn family, foltyn family roblox, foltyn roblox, roblox foltyn, no cursing, blox fruits, roblox blox fruits, roblox blox fruit, roblox fruits in blox fruits, blox fruit roblox, blox fruit, roblox swing for brainrots, swing for brainrots, roblox survive heat for brainrots.., roblox fish for brainrots, foltyn brainrot, foltyn and caylus playing roblox, foltyn and caylus playing together",23,https://i.ytimg.com/vi/8wSTyyJXBAw/hqdefault.jpg,en,en-US,False,737,PT12M17S,hd,False,True,False,False,898540,15340,1705
HXbKkYJsBuI,NO,2026-03-11T03:11:29.313221+00:00,2026-02-03T13:59:00Z,"EKIPA - ONE CHCĄ MIŁOŚCI (Mortal, Marta, Julita, Pola)","EKIPA - ONE CHCĄ MIŁOŚCI (Mortal, Marta, Julita, Pola)",EKIPA,UCoA9rnQmxPQWPVoDv9pPFoA,24,Entertainment,"ekipa, friz, ekipa friza, FRIZOLUSZEK, wersow, dom ekipy, genzie, t5m, twoje 5 minut, ekipowicze",10,https://i.ytimg.com/vi/HXbKkYJsBuI/hqdefault.jpg,pl,pl,False,123,PT2M3S,hd,False,False,False,False,4639344,91527,3369
4ILwsNOgeO0,NO,2026-03-11T03:11:29.313228+00:00,2026-03-10T13:00:14Z,I Became King on My Brother's Minecraft SMP,I Became King on My Brother's Minecraft SMP,Pentar,UCaGrF7A12g5socGd9kWhA2g,20,Gaming,"Minecraft, Minecraft SMP, SMP, Minecraft Server, LifeSteal SMP, School Minecraft Server, School SMP, LifeSteal, Spoke, minecraft survival, minecraft hardcore, minecraft challenge, minecraft server, HermitCraft, MumboJumbo, Grian, Minecraft Hunt, LifeSteal Season 3, 1 Heart Minecraft, Pentar, Peentar, LifeSteal Season 6, Parrot, wemmbu, I Created A Secret Minecraft Civilization, I Used /kill in Survival Minecraft, How I RULED My Brother's Minecraft SMP, Brother SMP, Brother Minecraft SMP",29,https://i.ytimg.com/vi/4ILwsNOgeO0/hqdefault.jpg,en,en,False,1600,PT26M40S,hd,False,True,False,False,328873,11872,1259
