video_id,country,fetched_at,published_at,title,localized_title,channel_title,channel_id,category_id,category_name,tags,tag_count,thumbnail,default_language,audio_language,is_live,duration,duration_raw,definition,caption_available,licensed_content,embeddable,made_for_kids,views,likes,comments
GxeNYJoygLA,NL,2026-01-15T02:33:07.976770+00:00,2026-01-13T16:07:51Z,"Amjad Jomaa ft. Noel Kharman - Khawa | أغنية ""خاوة"" أمجد جمعة مع نويل خرمان","Amjad Jomaa ft. Noel Kharman - Khawa | أغنية ""خاوة"" أمجد جمعة مع نويل خرمان",Amjad Jomaa,UCBs5cNvb-SHOLPNYHqVxAiw,10,Music,"أغنية ""خاوة"" أمجد جمعة مع نويل خرمان, Khorma, Amjad Jomaa ft. Noel Kharman, amjad jomaa, noel kharman, noel amjad khawa, خاوة, KHAWA, amjad jomaa noel kharman, amjad noel, amjad x noel, billboard arabia amjad jomaa, billboard arabia noel kharman, noel amjad billboard song, أنا أنا أنا إلو وهو إلي خاوة, فيه القلب بيتداوى, حبّك فيني شو ساوى؟ شو ساوى, هو إلي خاوة, Amjad Jomaa, أمجد جمعة, بعلمي هو ناسي واحبابي, امجد جمعة طائر الفينيق, أمجد جمعة السبع, أغنية أمجد جمعة, Chabaka",25,https://i.ytimg.com/vi/GxeNYJoygLA/hqdefault.jpg,ar,ar,False,185,PT3M5S,hd,False,True,False,False,1046745,17907,1709
fCoJtCD1fc8,NL,2026-01-15T02:33:07.976780+00:00,2026-01-13T17:06:43Z,Avengers: Doomsday - Official 'Black Panther and The Fantastic Four' Teaser Trailer (2026),Avengers: Doomsday - Official 'Black Panther and The Fantastic Four' Teaser Trailer (2026),IGN,UCKy1dAqELo0zrOtPkf0eTMw,24,Entertainment,"Avengers, Avengers: Doomsday, MCU - Marvel Connected Universe, Marvel, Marvel Studios, Superhero, Theater, Walt Disney Studios Motion Pictures, Black Panther, Fantastic Four",10,https://i.ytimg.com/vi/fCoJtCD1fc8/hqdefault.jpg,en,en,False,65,PT1M5S,hd,False,True,False,False,472265,6935,669
KNzHjxIXlSM,NL,2026-01-15T02:33:07.976793+00:00,2026-01-11T15:01:11Z,Job Speelt Als Maker Van 99 Nachten In Het Bos Tijdens Update... In Roblox!,Job Speelt Als Maker Van 99 Nachten In Het Bos Tijdens Update... In Roblox!,DutchtuberGaming,UCBS1vxH489OL-oN7P3HUsPw,20,Gaming,"brookhaven, roblox brookhaven, dutchtuber brookhaven, dutchtuber roblox, roblox dutchtuber, brookhaven job, roblox brookhaven dutchtuber, brookhaven dutchtuber roblox, dutchtuber2, dutchtubergaming, dutchtuber job brookhaven, brookhaven rp, brookhaven verhaal, brookhaven geheimen, brookhaven geheim, leuk, grappig, entertainment, amusement, gaming, roblox",21,https://i.ytimg.com/vi/KNzHjxIXlSM/hqdefault.jpg,nl,nl,False,534,PT8M54S,hd,False,True,False,False,47730,2504,373
uiHkKfz6A9I,NL,2026-01-15T02:33:07.976800+00:00,2026-01-08T23:04:21Z,NO DAYS OFF,NO DAYS OFF,KM - Topic,UCBPEopJwbPEeAv6-vLC9Icw,10,Music,"KM, Kevin, ケビン, NO DAYS OFF",4,https://i.ytimg.com/vi/uiHkKfz6A9I/hqdefault.jpg,en,en,False,187,PT3M7S,hd,False,True,False,False,27815,438,0
w_YG2zqDt0k,NL,2026-01-15T02:33:07.976807+00:00,2026-01-09T19:59:46Z,Pesters terugpakken in SLAP TOWER,Pesters terugpakken in SLAP TOWER,OhMarinus,UC5EtY1WhMolkkddyIDvSIBA,20,Gaming,"roblox, roblox brookhaven, roblox doors, roblox story, #roblox, roblox roleplay, roblox doors memes, roblox funny, doors roblox, roblox funny moments, roblox brookhaven 🏡rp, brookhaven roblox, job roblox, roblox job, roblox spel, roblox obby, roblox game, roblox spelen, roblox tiktok, roblox shorts, roblox tiktoks, roblox bedwars, roblox español, roblox robux, roblox doors game, roblox doors meme, roblox doors seek, roblox doors rush, roblox game movie, robux",30,https://i.ytimg.com/vi/w_YG2zqDt0k/hqdefault.jpg,en,en,False,822,PT13M42S,hd,False,False,False,False,55098,819,45
dST9UmXt-ms,NL,2026-01-15T02:33:07.976815+00:00,2026-01-09T07:00:07Z,Yves Berendse - Droom Jij Over Mij Vannacht (Lyric Video),Yves Berendse - Droom Jij Over Mij Vannacht (Lyric Video),Dino Music,UCw-pBw8xaRQJ9i6ykHGjFtg,10,Music,,0,https://i.ytimg.com/vi/dST9UmXt-ms/hqdefault.jpg,nl,nl,False,196,PT3M16S,hd,False,False,False,False,22950,381,27
EfhMEZbf5Yk,NL,2026-01-15T02:33:07.976822+00:00,2026-01-10T13:30:31Z,"never trust your ""teammate""","never trust your ""teammate""",JudeLow,UC2gufCjSyNihNbOEZE50bwQ,20,Gaming,,0,https://i.ytimg.com/vi/EfhMEZbf5Yk/hqdefault.jpg,en,en,False,1413,PT23M33S,hd,False,True,False,False,2094797,101816,5525
jhthvYMFrkY,NL,2026-01-15T02:33:07.976829+00:00,2026-01-14T10:00:05Z,ЛСП — Шиншиллы,ЛСП — Шиншиллы,ЛСП,UCr19_2h5_vUv6T4Gbo4PU7w,10,Music,,0,https://i.ytimg.com/vi/jhthvYMFrkY/hqdefault.jpg,ru,en-GB,False,158,PT2M38S,hd,False,True,False,False,52779,9101,353
