video_id,country,fetched_at,published_at,title,localized_title,channel_title,channel_id,category_id,category_name,tags,tag_count,thumbnail,default_language,audio_language,is_live,duration,duration_raw,definition,caption_available,licensed_content,embeddable,made_for_kids,views,likes,comments
gMxAUI35O-g,HK,2026-05-23T04:25:56.803341+00:00,2026-05-19T10:00:48Z,glass,glass,Gareth.T - Topic,UCBC0FqlDon03ZnVH2w2Qvdw,10,Music,"Gareth.T, glass",2,https://i.ytimg.com/vi/gMxAUI35O-g/hqdefault.jpg,en,ta,False,186,PT3M6S,hd,False,True,False,False,663924,18179,306
2RydunKJrBU,HK,2026-05-23T04:25:56.803384+00:00,2026-05-22T14:00:28Z,Vought Rising - First Look | Prime Video,Vought Rising - First Look | Prime Video,Prime Video,UCQJWtTnAHhEG5w4uN0udnUQ,24,Entertainment,"vought rising, vought rising prime video, prime video vought rising, vought rising video, vought rising videos, prime, eric kripke, aya cash, elizabeth posey, mason dye, jensen ackles, will hochman, kiki layne, jorden myrie, ricky staffieri, garth ennis, darick robertson, the boys prequel series, superhero television series, black comedy, the boys, aya cash stormfront, clara vought, jensen ackles vought rising, jensen ackles soldier boy, soldier boy, soldier boy prequel",27,https://i.ytimg.com/vi/2RydunKJrBU/hqdefault.jpg,en,en,False,97,PT1M37S,hd,False,True,False,False,599484,37113,3492
E95aDmhil-4,HK,2026-05-23T04:25:56.803398+00:00,2026-05-20T14:02:11Z,[中文] T1 vs KRX | NS vs KT | 2026 LCK,[中文] T1 vs KRX | NS vs KT | 2026 LCK,LCK-Carry,UC5Fms2Bl_HM6DPYgyL5DOyg,20,Gaming,"LCK, LOL, esports, game, lck, lck中文",6,https://i.ytimg.com/vi/E95aDmhil-4/hqdefault.jpg,zh-Hant,zh-TW,False,22203,PT6H10M3S,hd,False,False,False,False,511552,1737,17
x2fAnFXDj9Q,HK,2026-05-23T04:25:56.803409+00:00,2026-05-22T13:00:06Z,Edan 呂爵安 X Ryan 蔡俊彥《1206》 Official Music Video,Edan 呂爵安 X Ryan 蔡俊彥《1206》 Official Music Video,MIRROR,UCEuQ-0x3uMk1KghGiO1kTHg,10,Music,"MIRROR, MIRRORweare",2,https://i.ytimg.com/vi/x2fAnFXDj9Q/hqdefault.jpg,zh-Hant,zh-HK,False,362,PT6M2S,hd,True,True,False,False,64663,5863,486
HI1dhd2ATdM,HK,2026-05-23T04:25:56.803417+00:00,2026-05-21T04:00:09Z,【太空超人】終極版預告 - 6月3日（週三）宇宙同行,【太空超人】終極版預告 - 6月3日（週三）宇宙同行,Sony Pictures 索尼影業,UChqkMH_hpzCHWyGGdcSpFFA,24,Entertainment,,0,https://i.ytimg.com/vi/HI1dhd2ATdM/hqdefault.jpg,zh-Hant,zh-TW,False,118,PT1M58S,hd,False,False,False,False,51747,637,157
FjdSv6Ay1bo,HK,2026-05-23T04:25:56.803426+00:00,2026-05-20T04:00:05Z,[JFFLIVE打機精華]鄰居大戰 JFFT四子齊心對外征戰｜課埋金都唔夠打？｜米爺又25？| 多人線上桌遊精華 @JFFTHK @JFFLiveChannel,[JFFLIVE打機精華]鄰居大戰 JFFT四子齊心對外征戰｜課埋金都唔夠打？｜米爺又25？| 多人線上桌遊精華 @JFFTHK @JFFLiveChannel,隆巴仔,UCEEd51olr-XAXGJaJCicbBw,24,Entertainment,,0,https://i.ytimg.com/vi/FjdSv6Ay1bo/hqdefault.jpg,zh-Hant,zh-HK,False,1285,PT21M25S,hd,False,True,False,False,61610,1006,31
V1Lr-_AxeR8,HK,2026-05-23T04:25:56.803435+00:00,2026-05-22T03:58:06Z,LE SSERAFIM (르세라핌) 'BOOMPALA' OFFICIAL MV,LE SSERAFIM (르세라핌) 'BOOMPALA' OFFICIAL MV,HYBE LABELS,UC3IZKseVpdzPSBaWxBxundA,10,Music,"HYBE, HYBE LABELS, 하이브, 하이브레이블즈",4,https://i.ytimg.com/vi/V1Lr-_AxeR8/hqdefault.jpg,ko,ko,False,209,PT3M29S,hd,True,True,False,False,3405123,273280,17353
-IPy0qiyh-4,HK,2026-05-23T04:25:56.803444+00:00,2026-05-12T23:00:00Z,《氣體人第一號》| 正式前導預告 | Netflix,《氣體人第一號》| 正式前導預告 | Netflix,Netflix Taiwan,UCeH360abfAGTyTpi3nmVwXw,24,Entertainment,"Human Vapor, Netflix, 內田雅樂, 劇情影集, 哥吉拉, 小栗旬, 廣瀨鈴, 延尚昊, 戲劇, 本多豬四郎, 東寶, 林遣都, 柳勇在, 氣體人第一號, 片山慎三, 特攝, 竹野內豐, 蒼井優",18,https://i.ytimg.com/vi/-IPy0qiyh-4/hqdefault.jpg,zh-Hant,en-US,False,85,PT1M25S,hd,False,False,False,False,260745,1901,263
_6ucSC1-7ZI,HK,2026-05-23T04:25:56.803452+00:00,2026-05-21T14:02:52Z,1000 Players Simulate UNDERGROUND Civilization in Minecraft,1000 Players Simulate UNDERGROUND Civilization in Minecraft,Wemmbu,UCkzzNLnuM-VsATWC53ehwOQ,20,Gaming,"wemmbu, wembu, wenbu, wemmbu unstable smp, wemmbu the sequel, eggchan, wemmbu eggchan, wemmbu hunted, wemmbu invisible player, unstable smp, unstable universe, parrotx2, minecraft, unstable smp in order, minecraft smp, unstable smp in order wemmbu, unstable smp latest video, unstable smp new video, wemmbu assassin, wemmbu invis player, unstable blue invis player, eggchan missing, flamefrags, egchan, 100 days",25,https://i.ytimg.com/vi/_6ucSC1-7ZI/hqdefault.jpg,en-US,en-US,False,7134,PT1H58M54S,hd,False,True,False,False,3919014,196720,27986
qoBCq8AJQjg,HK,2026-05-23T04:25:56.803461+00:00,2026-05-16T10:00:15Z,dark side of the moon,dark side of the moon,moon tang - Topic,UCC-lDFlDnEr7ijLOnQLnXJg,10,Music,"moon tang, dark side of the moon",2,https://i.ytimg.com/vi/qoBCq8AJQjg/hqdefault.jpg,en,,False,231,PT3M51S,hd,False,True,False,False,85264,979,16
IE61SWNSo-U,HK,2026-05-23T04:25:56.803469+00:00,2026-05-16T13:57:36Z,【全新預告】全智賢 X 池昌旭 X 具教煥 領軍打喪屍《屍殺禁區》Colony 5月28日 殺破屍城,【全新預告】全智賢 X 池昌旭 X 具教煥 領軍打喪屍《屍殺禁區》Colony 5月28日 殺破屍城,安樂影片 Edko Films Ltd.,UCxOXYny2PDQYrS3QGSzFosg,1,Film & Animation,,0,https://i.ytimg.com/vi/IE61SWNSo-U/hqdefault.jpg,zh-Hant,,False,68,PT1M8S,hd,False,False,False,False,83039,535,49
FHHRP18l_sM,HK,2026-05-23T04:25:56.803477+00:00,2026-05-20T10:56:25Z,該來的總會來！皇馬報價Enzo，我標價1.2億！最後的結果是去或留？FC26車路士經理模式第3集,該來的總會來！皇馬報價Enzo，我標價1.2億！最後的結果是去或留？FC26車路士經理模式第3集,Junior杰青,UCvLnfq4ASBhi28X1PNPo69A,20,Gaming,"FC26, 切尔西, 粤语, 恩佐·费尔南德斯, 皇马, 姆巴佩, AC米兰, 欧罗巴联赛, 阿森纳, 阿尔特塔, 曼城, 瓜迪奥拉, 联赛杯, 曼联, 利物浦, 热刺, 英超, 欧冠, 生涯模式, 经理模式, Career Mode, 安素·費南迪斯, 麥巴比, 阿仙奴, 阿迪達, 瓜迪奧拿",26,https://i.ytimg.com/vi/FHHRP18l_sM/hqdefault.jpg,zh-Hant,yue-HK,False,1122,PT18M42S,hd,False,True,False,False,27391,855,33
MMF5jliWvaw,HK,2026-05-23T04:25:56.803485+00:00,2026-05-20T12:00:06Z,古淖文 - On The Rocks Official Music Video 4K,古淖文 - On The Rocks Official Music Video 4K,TVB Music Group,UCNPKstTCsULpoFdBea4SLtw,10,Music,,0,https://i.ytimg.com/vi/MMF5jliWvaw/hqdefault.jpg,zh-Hant,zh-HK,False,283,PT4M43S,hd,False,True,False,False,69100,2094,771
tL2nzLFIcXg,HK,2026-05-23T04:25:56.803493+00:00,2026-05-20T15:00:06Z,F1 25: 2026 Season Pack Reveal Trailer,F1 25: 2026 Season Pack Reveal Trailer,EA SPORTS F1,UCU5PZpCWQgak5w4ztWo9u6w,20,Gaming,"F1 25, f1 25 game, f1 2025 game, f1 25 track and driver updates, f1 25 trailer, f1 25 gameplay, EA SPORTS F1, EA SPORTS F1 25, F1 game, F1 videogame, F1 25 Career, F1 Codemasters, New F1 game, F1 25 trailer, F1 25 Xbox, F1 25 DLC, F1 26, F1 26 DLC, F1 2026 game, F1 26 Game, F1 25 Season Pack, F1 26 Season Pack, New F1 26, game, F1 26 trailer, F1 26 reveal trailer, F1 26 official trailer, f1 26 dlc, f1 2026 game, F1 26 dlc, F1 26 game, F1 2026",32,https://i.ytimg.com/vi/tL2nzLFIcXg/hqdefault.jpg,en,en,False,86,PT1M26S,hd,True,False,False,False,426632,18779,1221
4iKnoV_pQgU,HK,2026-05-23T04:25:56.803502+00:00,2026-05-22T11:30:30Z,【有感筆電】Roblox版的貓咪大戰爭！放可愛的noob菜鳥士兵去打城堡！ 我花多少R幣，可以抽到超稀有的角色??【戰鬥磚塊 The Battle Bricks】,【有感筆電】Roblox版的貓咪大戰爭！放可愛的noob菜鳥士兵去打城堡！ 我花多少R幣，可以抽到超稀有的角色??【戰鬥磚塊 The Battle Bricks】,有感筆電 Daptoper,UCU-swpBLny7YEqNJB4hI1Kg,20,Gaming,"roblox, 迷因, 梗圖, 迷因梗圖, 有感筆電, daptoper, game, 遊戲, 機械方塊, 罗布乐思, meme, funny, 機器磚塊, 以下單純試圖找到YouTube流量密碼, 生存遊戲, 恐怖遊戲, 搞笑遊戲, 進化, Minecraft, 冒險, 生存, 死亡, 熱門, 好看, 有趣, 奇怪, 小遊戲, 小品遊戲, 網頁遊戲, 等級1, 等級99, 神級, 成長遊戲, 養成遊戲, 奇怪地圖, 惡搞地圖, 整人地圖, 逃離, 怪人, 成長, 脫逃成功, 逃脫地圖, 殺人, 逃脫, 逃出, 跑酷, 嚇人, 整人遊戲, 糞GAME, 怪物, 奇怪遊戲, 奇怪的遊戲, 怪誕, 養成型遊戲, 爆笑, 搞笑, 搞笑地圖, 恐怖地圖, 爆笑遊戲, 生存地圖, 可怕的頭, 挑戰系列, ROBLOX 有感筆電, Roblox Daptoper, 死亡遊戲, roblox roleplay, roblox funny moments, roblox doors, OP, 最強武器, blox fruits, 娛樂, 手遊, 恐怖, 手機遊戲, 新遊戲, 精華, 遊戲推薦, 電玩, 免費, 實況, 怪談, 台灣, 閲覧注意",84,https://i.ytimg.com/vi/4iKnoV_pQgU/hqdefault.jpg,zh-TW,zh-TW,False,1207,PT20M7S,hd,False,True,False,False,163291,6556,750
iTJSbJtS8MU,HK,2026-05-23T04:25:56.803512+00:00,2026-05-11T09:00:56Z,aespa 에스파 'WDA (Whole Different Animal) (Feat. G-DRAGON)' MV,aespa 에스파 'WDA (Whole Different Animal) (Feat. G-DRAGON)' MV,SMTOWN,UCEf_Bc-KVd7onSeifS3py9g,10,Music,"aespa, 에스파, INTRO, KARINA, GISELLE, WINTER, NINGNING, 카리나, 지젤, 윈터, 닝닝, 리치 맨, MV, 뮤직비디오, 뮤비, WDA, Whole Different Animal, 홀 디프런트 애니멀, 레모네이드, LEMONADE, 정규 2집, LEMONADE - The 2nd Album",22,https://i.ytimg.com/vi/iTJSbJtS8MU/hqdefault.jpg,en,ko,False,189,PT3M9S,hd,True,True,False,False,15400980,512021,32864
XmcIjxwLJcY,HK,2026-05-23T04:25:56.803520+00:00,2026-05-18T15:00:27Z,Lanterns | Official Teaser 2 | HBO Max,Lanterns | Official Teaser 2 | HBO Max,HBO Max,UCx-KWLTKlB83hDI6UKECtJQ,24,Entertainment,"hbo max, hbo, hbo originals, hbo original series, hbo trailer, new on hbo, max, hbo max originals, hbo max trailer, hbo max teaser, hbo max series, hbo max youtube",12,https://i.ytimg.com/vi/XmcIjxwLJcY/hqdefault.jpg,en,en,False,118,PT1M58S,hd,False,True,False,False,2359616,93026,5898
-NamMT5ZWEI,HK,2026-05-23T04:25:56.803528+00:00,2026-05-20T05:26:03Z,"達哥 Directive 8020 #1[聊] 太空黑相集版! 異型引發神機錯亂, 安全帶是保命關鍵","達哥 Directive 8020 #1[聊] 太空黑相集版! 異型引發神機錯亂, 安全帶是保命關鍵",undergroundDV 達哥,UC010GdkqQuzdQPs5oHCcFmw,20,Gaming,,0,https://i.ytimg.com/vi/-NamMT5ZWEI/hqdefault.jpg,zh-Hant,und,False,8515,PT2H21M55S,hd,False,True,False,False,15891,274,21
1jKnI_ib8c8,HK,2026-05-23T04:25:56.803535+00:00,2026-05-18T09:00:00Z,ITZY “Motto” M/V,ITZY “Motto” M/V,JYP Entertainment,UCaO6TYtlC8U5ttz62hTrZgg,10,Music,"JYP Entertainment, JYP",2,https://i.ytimg.com/vi/1jKnI_ib8c8/hqdefault.jpg,en,ko,False,199,PT3M19S,hd,True,True,False,False,7564878,285545,27765
Ks_VD4xy8ow,HK,2026-05-23T04:25:56.803543+00:00,2026-05-17T17:32:48Z,The Boys Season 5 Episode 8 Series Finale Trailer,The Boys Season 5 Episode 8 Series Finale Trailer,Rotten Tomatoes TV,UCz1GPotHecuLngiLuY739QQ,1,Film & Animation,"The Boys, The Boys Trailer, The Boys Season 5 Episode 8 Trailer, The Boys S05 E08 Trailer, The Boys Season 5 episode 8 TV Trailer, The Boys Season 5 Episode 8 Trailer 2026, The Boys Season 5 Episode 8 Official Trailer, Trailer, TV Trailer, 2026 Trailers, 2026 TV Trailers, The Boys Series Finale, The Boys Season 5 Prime Video, Prime Video, Entertainment, TV Series, Karl Urban, Jack Quaid, Antony Starr",19,https://i.ytimg.com/vi/Ks_VD4xy8ow/hqdefault.jpg,en,en,False,46,PT46S,hd,False,True,False,False,2016666,44771,5000
GVS25Nr3fSU,HK,2026-05-23T04:25:56.803550+00:00,2026-05-21T12:00:00Z,3000匹馬力😱500km/h🏎️7000萬身價💰10部最痴_線的神車｜Forza Horizon 6 極限競速 地平線6｜Uwants遊戲講,3000匹馬力😱500km/h🏎️7000萬身價💰10部最痴_線的神車｜Forza Horizon 6 極限競速 地平線6｜Uwants遊戲講,Uwants 遊戲講 ,UC-eoXVXWKQ3T7UeUbSPHRvg,20,Gaming,"電玩, 遊戲, 玩具, 日本, acg, anime, 台灣, switch, ps5, 任天堂, 香港, 原創, 周邊, nintendo, 日語, 日本語, Esports, uwants, gaming, 粵語",20,https://i.ytimg.com/vi/GVS25Nr3fSU/hqdefault.jpg,zh-Hant,zh-Hant,False,424,PT7M4S,hd,True,True,False,False,31543,744,31
s9zzsVyfanI,HK,2026-05-23T04:25:56.803558+00:00,2026-05-20T06:30:16Z,Denis Kwok 193 - 呆等 (Waiting Around) Official Music Video,Denis Kwok 193 - 呆等 (Waiting Around) Official Music Video,ERROR,UCxuIEqky_1Y1jvkEPZ4j94g,10,Music,ERROR,1,https://i.ytimg.com/vi/s9zzsVyfanI/hqdefault.jpg,zh-Hant,zh-HK,False,237,PT3M57S,hd,True,True,False,False,102305,13725,433
Vt7860xZFXk,HK,2026-05-23T04:25:56.803566+00:00,2026-05-18T01:00:31Z,HOPE - Official Teaser - In Theaters Fall 2026,HOPE - Official Teaser - In Theaters Fall 2026,NEON,UCpy5dRhZd-JbZP4NsrnLt1w,1,Film & Animation,,0,https://i.ytimg.com/vi/Vt7860xZFXk/hqdefault.jpg,en,en,False,99,PT1M39S,hd,False,False,False,False,2830753,76862,3218
VpFjFoTUaT4,HK,2026-05-23T04:25:56.803573+00:00,2026-05-19T10:00:06Z,Minecraft 1萬格範圍，無法溝通『共享血量和背包』想辦法全員集合【方塊boy】,Minecraft 1萬格範圍，無法溝通『共享血量和背包』想辦法全員集合【方塊boy】,方塊boy,UCTBpOBUL97VahWYQNexio6Q,20,Gaming,"阿斯, asu, 偏頭, Fauzh, 紅月, Redmoon, 味噌, Miso, Minecraft, 遊戲實況, 字幕, 多人實況",12,https://i.ytimg.com/vi/VpFjFoTUaT4/hqdefault.jpg,zh-TW,zh-TW,False,2663,PT44M23S,hd,True,True,False,False,200372,8594,360
Jxgbfc89hNI,HK,2026-05-23T04:25:56.803581+00:00,2026-05-19T09:00:32Z,아이오아이 (I.O.I) - 갑자기 (Suddenly) MV,아이오아이 (I.O.I) - 갑자기 (Suddenly) MV,Stone Music Entertainment,UC_pwIXKXNm5KGhdEVzmY60A,10,Music,"K-CULTURE, korean Music, MV, Music Video, K-Pop, Kpop, 뮤비, 뮤직비디오, Stone Music Entertainment, 아이오아이 (I.O.I), 갑자기 (Suddenly)",11,https://i.ytimg.com/vi/Jxgbfc89hNI/hqdefault.jpg,ko,ko,False,210,PT3M30S,hd,False,True,False,False,2569494,185749,8977
9rPBmHoxQX4,HK,2026-05-23T04:25:56.803589+00:00,2026-05-17T09:00:22Z,[Official Trailer] Ticket to Heaven เด็กชายไม่ไปสวรรค์ #TicketToHeaven,[Official Trailer] Ticket to Heaven เด็กชายไม่ไปสวรรค์ #TicketToHeaven,GMMTV OFFICIAL​​,UC8BzJM6_VbZTdiNLD4R1jxQ,24,Entertainment,"GMMTV, Ticket to Heaven, เด็กชายไม่ไปสวรรค์, gemini fourth, เจมีไนน์ โฟร์ท, gemini_ti, tawattannn, ลูกคุณหนู, LOOK KHUNNOO",9,https://i.ytimg.com/vi/9rPBmHoxQX4/hqdefault.jpg,th,en,False,225,PT3M45S,hd,True,True,False,False,961652,116040,7050
n8GposKb0dE,HK,2026-05-23T04:25:56.803597+00:00,2026-05-22T08:13:01Z,Origin Story - How Stella Became Starr Nova! (Music: “polaris” by Aooo),Origin Story - How Stella Became Starr Nova! (Music: “polaris” by Aooo),Brawl Stars,UCooVYzDxdwTtGYAkcPmOgOw,20,Gaming,"brawl stars, mobile game, mobile strategy game, mobile rpg, mobile battle royale, battle royale, supercell game",7,https://i.ytimg.com/vi/n8GposKb0dE/hqdefault.jpg,en,en,False,131,PT2M11S,hd,True,False,False,False,3140028,144287,5499
ZAsxW7bkK-A,HK,2026-05-23T04:25:56.803605+00:00,2026-05-11T09:00:46Z,WDA (Whole Different Animal) (feat. G-DRAGON),WDA (Whole Different Animal) (feat. G-DRAGON),aespa - Topic,UCEdZAdnnKqbaHOlv8nM6OtA,10,Music,"aespa, G-DRAGON, WDA (Whole Different Animal) (feat. G-DRAGON)",3,https://i.ytimg.com/vi/ZAsxW7bkK-A/hqdefault.jpg,en,en,False,174,PT2M54S,hd,False,True,False,False,6047090,64125,1545
_Ea7plnfdnM,HK,2026-05-23T04:25:56.803612+00:00,2026-05-20T04:00:06Z,PS 方向大改！棄PC 移植 遊戲 回歸獨佔制！- Gamehub 遊戲 八卦 花生 新聞 (cc.中文字幕),PS 方向大改！棄PC 移植 遊戲 回歸獨佔制！- Gamehub 遊戲 八卦 花生 新聞 (cc.中文字幕),希治閣【遊戲情報科】,UCk25FUc8pLiP3A6Zniknxbg,20,Gaming,"遊戲, 遊戲新聞, 新game, 情報科, 希治閣, PS5, XS, XSX, XSS, XBOX, Switch, 新GAME, 介紹, 廣東話, 中文字幕, 遊戲三世書, 遊戲情報科, gamehub, 歷史, 恐怖遊戲, 獨立遊戲, 單機遊戲, ps5, xsx, 刺客, war thunder, 隻狼, 八卦",28,https://i.ytimg.com/vi/_Ea7plnfdnM/hqdefault.jpg,zh-Hant,zh-HK,False,592,PT9M52S,hd,True,True,False,False,47246,1965,167
1kwHaVvFAaU,HK,2026-05-23T04:25:56.803620+00:00,2026-05-08T13:00:06Z,炎明熹 Gigi Yim - Colors in the Air 原色 | Official Music Video,炎明熹 Gigi Yim - Colors in the Air 原色 | Official Music Video,GigiYimVEVO,UCXSeQVirkz0JGAoCSva5Dqw,10,Music,"炎明熹, gigi yim, colors in the air 原色, colors in the air, james wu, psyche ng, edward chan, pazu chan, 王佳恩, yim ming hay, yiminghay, 火星女神, 聲夢傳奇, gi炎粉, 然后工作室, nq studio, natural quality, voyage…, kokia, 一束光高錕的記憶, 風之旅, my voyage goes on, sony music hk, sony music greater china, sony music, 廣東歌, 香港樂壇, 香港音樂, cantopop, hong kong, 流行曲, 2026",32,https://i.ytimg.com/vi/1kwHaVvFAaU/hqdefault.jpg,zh-Hant,,False,198,PT3M18S,hd,True,True,False,False,905273,8329,11807
MtgIW4Gqg9M,HK,2026-05-23T04:25:56.803629+00:00,2026-05-16T13:46:14Z,GEN vs T1 - BFX vs NS | 2026 LCK,GEN vs T1 - BFX vs NS | 2026 LCK,LCK Global,UCKVlixycWmapnGQ_wht4cHQ,20,Gaming,"LCK, LoL, League of Legends, LoL Champs, LCK global, lolesports, riotgames, league of legends, PogState, the pogstate, esports podcast, LCK podcast, LoL podcast, Atlus, Wolf, Maurits, Chronicler, DK, Damwon, T1, GEN, DRX, KDF, HLE, Hanwha Life, BRO, Brion, Nongshim, NS, Liiv SANDBOX, LSB, KT, kt Rolster, lck summer, lck spring, Mad movie, Faker, Chovy, Bdd, lck highlight, LCK VOD, LCK Summer, LCK Spring, BEST Moment, ShowMaker, Dplus Kia",46,https://i.ytimg.com/vi/MtgIW4Gqg9M/hqdefault.jpg,en,en,False,22803,PT6H20M3S,hd,False,True,False,False,1500193,9430,203
hGqYdubpcCM,HK,2026-05-23T04:25:56.803637+00:00,2026-04-23T05:58:50Z,Heavy Serenade,Heavy Serenade,NMIXX - Topic,UC_Cx288SDUD9liYn7CiJLAA,10,Music,"NMIXX, Heavy Serenade",2,https://i.ytimg.com/vi/hGqYdubpcCM/hqdefault.jpg,en,en,False,180,PT3M,hd,False,True,False,False,5423415,51685,780
3_6HQSzfjM0,HK,2026-05-23T04:25:56.803644+00:00,2026-05-21T09:48:31Z,【Forza Horizon 6】最快的士大賽🚗💨誰是最強的士佬？🤣玩到變碰碰車🚛貨車之王 ➡️ Minions大亂鬥：爆笑精華(極限競速 地平線6),【Forza Horizon 6】最快的士大賽🚗💨誰是最強的士佬？🤣玩到變碰碰車🚛貨車之王 ➡️ Minions大亂鬥：爆笑精華(極限競速 地平線6),笑波子,UCDpK1rg5I9Zc3ToY13vbR3w,20,Gaming,"笑波子, 波子, hk, vlog, 熱門, boris, smilingboris",7,https://i.ytimg.com/vi/3_6HQSzfjM0/hqdefault.jpg,zh-Hant,zh-Hant,False,715,PT11M55S,hd,False,True,False,False,21540,489,46
XjrgISh9Qv0,HK,2026-05-23T04:25:56.803652+00:00,2026-05-18T10:00:22Z,想見你想見你想見你 (Miss You 3000) Covered by IVE LEESEO,想見你想見你想見你 (Miss You 3000) Covered by IVE LEESEO,IVE,UC-Fnix71vRP64WXeo0ikd0Q,24,Entertainment,"Kpop, girl group, Starshiptv, starship, 뮤비, MV, Teaser, 신곡, new, song, 한류, idol, hallyu, ロエン, ミュージック, ミュージックビデオ, アイドル, 韓流, 韓国, 아이돌, 아이브, IVE, アイヴ, 유진, 원영, 가을, 레이, 리즈, 이서, GAEUL, REI, LIZ, LEESEO, ユジン, ガウル, レイ, ウォニョン, リズ, イソ, 일레븐, eleven, dive, 다이브, behind, 아이브온, IVE ON, 비하인드, 러브다이브, LOVE DIVE, After LIKE, 애프터라이크, Kitsch, 키치, I AM, 안유진, 장원영, ANYUJIN, JANGWONYOUNG, 아이엠, Either Way, 이더웨이, Off The Record, 오프더레코드, Baddie, 배디, All Night, 해야, HEYA, 아센디오, Accendio, IVE SWITCH",71,https://i.ytimg.com/vi/XjrgISh9Qv0/hqdefault.jpg,zh-Hant,ko,False,244,PT4M4S,hd,False,True,False,False,351907,35213,2044
fKmt6rG_ESI,HK,2026-05-23T04:25:56.803661+00:00,2026-05-21T03:23:52Z,公子玩Resident Evil 9,公子玩Resident Evil 9,Loui5Ng,UCCti0hcPDVuhPGQpUXnhCQg,20,Gaming,,0,https://i.ytimg.com/vi/fKmt6rG_ESI/hqdefault.jpg,zh-Hant,zh-HK,False,694,PT11M34S,hd,False,True,False,False,14222,1255,55
FhYiPyrgRyM,HK,2026-05-23T04:25:56.803669+00:00,2026-05-20T15:00:06Z,表妹 Mona - 晴天預報 (Official Music Video),表妹 Mona - 晴天預報 (Official Music Video),表妹 Mona,UCd5H-DuIDR8AYf62C6DGLYA,10,Music,,0,https://i.ytimg.com/vi/FhYiPyrgRyM/hqdefault.jpg,zh-Hant,yue-HK,False,231,PT3M51S,hd,False,True,False,False,45162,2498,176
sfNRYCWnbJk,HK,2026-05-23T04:25:56.803676+00:00,2026-05-17T15:42:45Z,Team Spirit vs. Team Falcons - PGL Astana 2026 - Playoffs: Grand Final,Team Spirit vs. Team Falcons - PGL Astana 2026 - Playoffs: Grand Final,PGL,UC5jpxDZx4yoBo324pMQ91Ww,20,Gaming,"PGL Bucharest 2026, CS2 tournament, Counter Strike 2, CS2 esports, CS2 matches, CS2 highlights, CS2 pro matches, CS2 live, PGL esports, CS2 competitive, CS2 full match, CS2 VOD, CS2 gameplay, CS2 Bo3, CS2 Bo5, Group Stage CS2, CS2 Playoffs, CS2 Quarterfinal, CS2 Semifinal, CS2 Grand Final, FaZe CS2, Astralis CS2, The MongolZ CS2, PARIVISION CS2, NRG CS2, MIBR CS2, B8 CS2, 3DMAX CS2, esports 2026, cs2 pro scene, cs2 best plays",31,https://i.ytimg.com/vi/sfNRYCWnbJk/hqdefault.jpg,en,en,False,26511,PT7H21M51S,hd,False,True,False,False,1581397,17356,236
7ud7dGyM3fM,HK,2026-05-23T04:25:56.803684+00:00,2026-05-22T05:00:10Z,1206,1206,Edan 呂爵安 - Topic,UCt8SzDnLf-XwMXxsyLCN78g,10,Music,"Edan 呂爵安, 蔡俊彥 Ryan Choi, 1206",3,https://i.ytimg.com/vi/7ud7dGyM3fM/hqdefault.jpg,zh-Hant,und,False,242,PT4M2S,hd,False,True,False,False,16841,1012,104
Iakgwzxrz30,HK,2026-05-23T04:25:56.803691+00:00,2026-05-14T13:11:29Z,《Forza Horizon 6》率先試玩!!「秋名山」+「箱根七曲」遊覽秋葉原等地標,《Forza Horizon 6》率先試玩!!「秋名山」+「箱根七曲」遊覽秋葉原等地標,GamePlayHK短片攻略,UCLUA5xPUeBairwsxsbGWw5A,20,Gaming,,0,https://i.ytimg.com/vi/Iakgwzxrz30/hqdefault.jpg,zh-Hant,zh-HK,False,1070,PT17M50S,hd,False,True,False,False,66001,1429,121
R5By6ms2a3Y,HK,2026-05-23T04:25:56.803698+00:00,2026-05-19T09:00:25Z,Suddenly,Suddenly,I.O.I - Topic,UCXYVQ1uTq-KQbPk6IQlXHnA,10,Music,"I.O.I, 아이오아이 (I.O.I), I.O.I 3rd MINI ALBUM [I.O.I : LOOP], Suddenly",4,https://i.ytimg.com/vi/R5By6ms2a3Y/hqdefault.jpg,en,,False,195,PT3M15S,hd,False,True,False,False,1086559,15441,0
zygbYzix0t8,HK,2026-05-23T04:25:56.803705+00:00,2026-05-11T12:31:30Z,[JFFLIVE精華]  J台達台聯合直播打機 床哥瘋狂破防！,[JFFLIVE精華]  J台達台聯合直播打機 床哥瘋狂破防！,#LBLM Wayne,UCXlrVZhyl0W6vTNoi4pNaVg,24,Entertainment,,0,https://i.ytimg.com/vi/zygbYzix0t8/hqdefault.jpg,zh-Hant,zh-HK,False,894,PT14M54S,hd,False,True,False,False,68999,1644,95
B402rKl4bUg,HK,2026-05-23T04:25:56.803713+00:00,2026-05-22T04:00:06Z,Olivia Rodrigo - the cure (Official Music Video),Olivia Rodrigo - the cure (Official Music Video),OliviaRodrigoVEVO,UCxE5jEls-T0QtlTHT8lI1lw,10,Music,"Olivia Rodrigo, Olivia Rodrigo PS, Pop, Olivia Rodrigo the cure, the cure official music video, Olivia Rodrigo official video, Olivia Rodrigo music video, Olivia Rodrigo new song, Olivia Rodrigo lyrics, the cure, pop rock, alternative pop, rock, Olivia Rodrigo vocals, Olivia Rodrigo performance, Olivia Rodrigo new music, Olivia Rodrigo 2026, pop music, alternative music, official music video, vevo, singer songwriter, breakup song, emotional pop, indie pop",25,https://i.ytimg.com/vi/B402rKl4bUg/hqdefault.jpg,en,en,False,315,PT5M15S,hd,True,True,False,False,3855959,423417,20080
pVYdlPgkcAo,HK,2026-05-23T04:25:56.803720+00:00,2026-05-19T12:00:06Z,"Forza Horizon 6開箱試玩！一Game玩遍大黑PA+涉谷+首都高+秋名山！1,000匹V8「小露寶」的士不是夢！| Flat Out Game #FlatOut打機 #地板油","Forza Horizon 6開箱試玩！一Game玩遍大黑PA+涉谷+首都高+秋名山！1,000匹V8「小露寶」的士不是夢！| Flat Out Game #FlatOut打機 #地板油",Flat Out 地板油,UC_ogl0qjBdXrTiZZJ6ltsQQ,2,Autos & Vehicles,"Flat Out, 地板油, 雙Toby, Toby Leung, Toby Chan, 果籽, Apple Daily, CarMan, Flat Out 地板油",9,https://i.ytimg.com/vi/pVYdlPgkcAo/hqdefault.jpg,zh-HK,zh-HK,False,1282,PT21M22S,hd,False,True,False,False,30505,668,21
x3eqqoZPV_E,HK,2026-05-23T04:25:56.803728+00:00,2026-05-04T09:21:33Z,BABYMONSTER - '춤 (CHOOM)' M/V,BABYMONSTER - '춤 (CHOOM)' M/V,BABYMONSTER,UCqwUnggBBct-AY2lAdI88jQ,10,Music,"BABYMONSTER, 베이비몬스터, 베몬, BABYMON, BAEMON, 하람, 아현, 루카, 치키타, 파리타, 로라, 아사, HARAM, AHYEON, RUKA, CHIQUITA, PHARITA, RORA, ASA",19,https://i.ytimg.com/vi/x3eqqoZPV_E/hqdefault.jpg,ko,ko,False,205,PT3M25S,hd,True,True,False,False,93619712,1223006,91522
yD3PKbhI19U,HK,2026-05-23T04:25:56.803735+00:00,2026-05-22T08:00:07Z,三冠打野也能落选亚运！韩国选拔数据为王，GEN带飞Canyon，他们为啥还不满意？【联盟那些事儿】,三冠打野也能落选亚运！韩国选拔数据为王，GEN带飞Canyon，他们为啥还不满意？【联盟那些事儿】,LOL丶诺诺,UCvRq0Vk1wNJVCVD8NYMXEWQ,20,Gaming,"英雄联盟, T1, Canyon, Oner, GEN, HLE, Zeka, Zeus, Gumayusi",9,https://i.ytimg.com/vi/yD3PKbhI19U/hqdefault.jpg,zh,,False,788,PT13M8S,hd,False,True,False,False,57632,519,297
AefjWPaq3C4,HK,2026-05-23T04:25:56.803743+00:00,2026-05-04T10:21:19Z,GRASSHOPPER THREE IN LOVE 草蜢演唱會2026 尾場嘉賓｜郭富城 - 失戀／唱這歌,GRASSHOPPER THREE IN LOVE 草蜢演唱會2026 尾場嘉賓｜郭富城 - 失戀／唱這歌,寰亞音樂 Media Asia Music Official Channel,UC-0unh5x9WSd6aj0OGxrgaA,10,Music,,0,https://i.ytimg.com/vi/AefjWPaq3C4/hqdefault.jpg,zh-Hant,yue-HK,False,966,PT16M6S,hd,False,True,False,False,847982,10737,575
