video_id,country,fetched_at,published_at,title,localized_title,channel_title,channel_id,category_id,category_name,tags,tag_count,thumbnail,default_language,audio_language,is_live,duration,duration_raw,definition,caption_available,licensed_content,embeddable,made_for_kids,views,likes,comments
PuGvRDzqQEM,GH,2026-03-01T03:27:52.966588+00:00,2026-02-25T23:53:36Z,Shatta Wale - Are you sure (Audio Slide),Shatta Wale - Are you sure (Audio Slide),Shatta Wale,UCb5XPdFG5KC05hy4mv0zi_A,10,Music,"Ghana Music, Dancehall, Reggae, Shatta Wale, afrobeats, hip hop, Bandana, Dancehall King",8,https://i.ytimg.com/vi/PuGvRDzqQEM/hqdefault.jpg,en,und,False,133,PT2M13S,hd,False,True,False,False,49384,6238,1004
b24oG7qCwp4,GH,2026-03-01T03:27:52.966629+00:00,2026-02-25T18:01:17Z,Mortal Kombat II | Official Trailer II,Mortal Kombat II | Official Trailer II,Warner Bros.,UCjmJDM5pRKbUlVIzDYYWb6g,1,Film & Animation,"2026, Action, Adeline Rudolph, Adventure, Battle, Chin Han, Coming Soon, Damon Herriman, Fantasy, Film, Film Trailer, Film Warner, Game, Hiroyuki Sanada, Jessica McNamee, Joe Taslim, Josh Lawson, Karl Urban, Lewis Tan, Ludi Lin, MMA Fighter, Martial Arts, Mehcad Brooks, Mortal Kombat, Mortal Kombat II, Movie, Official Trailer, Simon McQuoid, Tadanobu Asano, Tati Gabrielle, Trailer, Video Game, WB, Warner, Warner Bros, Warner Brothers, Warner Media",37,https://i.ytimg.com/vi/b24oG7qCwp4/hqdefault.jpg,en,en-US,False,145,PT2M25S,hd,True,False,False,False,12908221,178609,10064
iWFY6NdGfDw,GH,2026-03-01T03:27:52.966642+00:00,2026-02-28T17:06:39Z,A New Star is Born…,A New Star is Born…,MoreS2G,UCw9rjdrpHa7mzNrWVJoaPgw,20,Gaming,,0,https://i.ytimg.com/vi/iWFY6NdGfDw/hqdefault.jpg,en,en-GB,False,1514,PT25M14S,hd,False,True,False,False,194444,12652,2107
LV4KCZs2_5g,GH,2026-03-01T03:27:52.966651+00:00,2026-02-26T06:00:28Z,KiDi - Babylon (Official Visualiser),KiDi - Babylon (Official Visualiser),KiDi,UCh3Kj3ckrz1VtSGWXue9t7g,10,Music,"KiDi, KiDi Music, Afrobeats, EMPIRe, lynx, Nigeria, Lagos, Kiddie, Kidi, EMPIRE, Bay Area, San Francisco, Lynx, Entertainment, Official Music Video, Likor, Stonebwoy, BHIM, 1Gad, Bhim Nation, Dancehall, Kidi music, KiDi babylon, Kidi Gymnastic, Kojo Blak, Joe Boy, GHana, KiDi Ghana, afrobeats",29,https://i.ytimg.com/vi/LV4KCZs2_5g/hqdefault.jpg,en,en,False,161,PT2M41S,hd,False,True,False,False,169505,5175,258
lcvUGs3xaDM,GH,2026-03-01T03:27:52.966660+00:00,2026-02-19T14:00:01Z,Peaky Blinders: The Immortal Man | Official Trailer | Netflix,Peaky Blinders: The Immortal Man | Official Trailer | Netflix,Netflix,UCWOA1ZGywLbqmigxE4Qlvuw,24,Entertainment,"Barry Keoghan, Cillian Murphy, Conspiracy, Netflix, Netflix 2026, New on Netflix, Packy Lee, Peaky Blinders, Rebecca Ferguson, Sophie Rundle, Stephen Graham, Steven Knight, Tense, The Immortal Man, Tim Roth, Tom Harper, Tommy Shelby, Trailer, drama, film",20,https://i.ytimg.com/vi/lcvUGs3xaDM/hqdefault.jpg,en,en-US,False,160,PT2M40S,hd,True,True,False,False,5726936,166214,5722
XrAoDZLZZ1g,GH,2026-03-01T03:27:52.966669+00:00,2026-02-28T17:00:01Z,1 Minute vs 10 Year Build Challenge,1 Minute vs 10 Year Build Challenge,MrBeast Gaming,UCIPPMRA040LQr5QPyJEbmXA,20,Gaming,,0,https://i.ytimg.com/vi/XrAoDZLZZ1g/hqdefault.jpg,en,en,False,864,PT14M24S,hd,True,True,False,False,3872884,129362,6112
tJy681VBMgY,GH,2026-03-01T03:27:52.966677+00:00,2026-02-19T10:01:43Z,Darkest Style,Darkest Style,Release - Topic,UCyRjA_4l1inBbizxdRaSOmw,10,Music,"D Global, Lasmid, Darkest Style",3,https://i.ytimg.com/vi/tJy681VBMgY/hqdefault.jpg,en,ta,False,139,PT2M19S,hd,False,True,False,False,69727,1354,0
i6w7O1kwuBk,GH,2026-03-01T03:27:52.966686+00:00,2026-02-19T16:00:06Z,House of the Dragon Season 3 | Official Teaser | HBO Max,House of the Dragon Season 3 | Official Teaser | HBO Max,HBO Max,UCx-KWLTKlB83hDI6UKECtJQ,24,Entertainment,"hbo max, hbo, hbo originals, hbo original series, hbo trailer, new on hbo, max, hbo max originals, hbo max trailer, hbo max teaser, hbo max series, hbo max youtube, house of the dragon, house of the dragon season 3, HOTD, house targaryen, rhaenyra targaryen, emma d'arcy, daemon targaryen, matt smith, alicent hightower, olivia cooke, aegon targaryen, tom glynn-carney, aemond targaryen, ewan mitchell, dragons, ser criston cole, fabien frankel, house of the dragon new season",30,https://i.ytimg.com/vi/i6w7O1kwuBk/hqdefault.jpg,en,en,False,94,PT1M34S,hd,True,True,False,False,4494240,135098,7464
1CKpqDmaV9c,GH,2026-03-01T03:27:52.966694+00:00,2026-02-28T21:51:04Z,ePremier League: Group Stages - Day 1,ePremier League: Group Stages - Day 1,EA SPORTS FC Pro,UCFA6YGp5lvgayO20lk7_Ung,20,Gaming,"FC Pro, FC Pro esports, FC esports, FC competitive, FC tournament, FC Pro gameplay, EA SPORTS FC, EA SPORTS FC Pro, FC Pro tips, FC Pro tutorial, FC Pro player tips, FC Pro Champ, FC Pro Champion, FC Pro Championship, EA SPORTS, EA SPORTS Pro, FC 26, FC 26 Pro, FC26Pro, FCPro26, FC Pro 26, FC Esports, Live, FC Pro Live, Livestream, fc pro open 26, fc pro live, easports fc26, eafc 26 pro, FC Pro Open, epremierleague, epl",32,https://i.ytimg.com/vi/1CKpqDmaV9c/hqdefault.jpg,en,en,False,20471,PT5H41M11S,hd,False,False,False,False,47707,1007,4
o_efMWgvEnU,GH,2026-03-01T03:27:52.966702+00:00,2026-02-13T05:57:06Z,Black Sherif - Top of the Morning (Official Video),Black Sherif - Top of the Morning (Official Video),BlackSherifVEVO,UCbQqL_yZhxMs5x14KIt18eQ,10,Music,"Black Sherif, Blacko Management EMPIRE, Rap/Hip-Hop",3,https://i.ytimg.com/vi/o_efMWgvEnU/hqdefault.jpg,en,en,False,229,PT3M49S,hd,False,True,False,False,1571249,30047,1462
zhsX9naK3tw,GH,2026-03-01T03:27:52.966710+00:00,2026-02-24T16:01:24Z,THE ORPHANAGE -THE MOVIE (OFFICIAL TRAILER),THE ORPHANAGE -THE MOVIE (OFFICIAL TRAILER),Wezzy Empire TV,UCoIhlANld_c72G5ofiY14_Q,23,Comedy,"Comedy, Lil Win, Kwadwo Nkansah, Akabenezer, Dr. Likee, Likee, Gh Comedy, Skits, Funny, Enjoy, Movies, Kumawood, Ghallywood, ghana Movies, Lol, Laugh",16,https://i.ytimg.com/vi/zhsX9naK3tw/hqdefault.jpg,en,en,False,134,PT2M14S,hd,False,True,False,False,5970,353,24
UfGnQ98OzZ4,GH,2026-03-01T03:27:52.966717+00:00,2026-02-27T15:17:57Z,I Destroyed Inter Milan to Save Them…,I Destroyed Inter Milan to Save Them…,S2G,UChR1Yn7YpVrnP-SbsWtjuBA,20,Gaming,,0,https://i.ytimg.com/vi/UfGnQ98OzZ4/hqdefault.jpg,en-GB,en,False,1502,PT25M2S,hd,False,True,False,False,320408,13328,458
_FGc6HabA50,GH,2026-03-01T03:27:52.966725+00:00,2026-02-27T16:51:58Z,King Paluta - EWOR ME - Dance Video / Visualizer,King Paluta - EWOR ME - Dance Video / Visualizer,King Paluta,UCP2a-JAUTtTNfMY3KRBlKeQ,10,Music,"King Paluta, Ghana Music, Music, Videos, Music Videos, Afrobeats, Afropop, Ghana, Songs, AFRICA, New Music, Afro sounds, Album, Give Time Some Time, COMBOS MAN, DWP ACADEMY, DWP, DANCE, ICE CREAM MAN",19,https://i.ytimg.com/vi/_FGc6HabA50/hqdefault.jpg,en,und,False,221,PT3M41S,hd,False,True,False,False,30225,1310,78
c4QnAOLeI2o,GH,2026-03-01T03:27:52.966732+00:00,2026-02-28T08:00:44Z,[Official Trailer] รักครูเท่าโลกเลย Love you teacher #LoveYouTeacherSeries,[Official Trailer] รักครูเท่าโลกเลย Love you teacher #LoveYouTeacherSeries,GMMTV OFFICIAL​​,UC8BzJM6_VbZTdiNLD4R1jxQ,24,Entertainment,"GMMTV, รักครูเท่าโลกเลย, LOVE YOU TEACHER, Perth Santa, เพิร์ธ แซนต้า, perthppe, santapp, โดเมียร์, domiia",9,https://i.ytimg.com/vi/c4QnAOLeI2o/hqdefault.jpg,th,en,False,176,PT2M56S,hd,True,True,False,False,411787,54090,4224
Bktn1qHI7yA,GH,2026-03-01T03:27:52.966740+00:00,2026-02-28T07:11:37Z,I Beat Poppy Playtime Chapter 5!,I Beat Poppy Playtime Chapter 5!,Foltyn,UCRkuUgtDAL4XSU5jB40J_wA,20,Gaming,"foltyn, foltyn roblox, roblox, roblox foltyn, foltyn family, funny, no swearing, foltyn family roblox, roblox foltyn family, blade ball, roblox blade ball, foltyn blade ball, poppy playtime chapter 5, caylus poppy playtime chapter 5, foltyn and caylus, foltyn poppy playtime, foltyn plays poppy playtime",17,https://i.ytimg.com/vi/Bktn1qHI7yA/hqdefault.jpg,en,en-US,False,11051,PT3H4M11S,hd,False,True,False,False,1110656,33462,8311
HsaXkeejbEA,GH,2026-03-01T03:27:52.966748+00:00,2026-02-20T20:00:12Z,"Mavado, Dj Mac, Crashdummy - Bad & Bbc Rich  (Official Music Video) | WYFL Riddim","Mavado, Dj Mac, Crashdummy - Bad & Bbc Rich  (Official Music Video) | WYFL Riddim",mavadoVEVO,UCatJfWW2FlnCIKq4S7Onk-g,10,Music,"Mavado, Dj Mac, Crashdummy, DJ Mac Music Crash Dummy, Dancehall",5,https://i.ytimg.com/vi/HsaXkeejbEA/hqdefault.jpg,en,en,False,139,PT2M19S,hd,False,True,False,False,1747669,58282,5253
ztT-Gi_tXkk,GH,2026-03-01T03:27:52.966755+00:00,2026-02-21T14:51:29Z,"DRUMS OF THE MASQUERADE(EKWEDIKE)(Official Trailer)~ FREDERICK LEONARD, LIZZY GOLD  Nigerian movies","DRUMS OF THE MASQUERADE(EKWEDIKE)(Official Trailer)~ FREDERICK LEONARD, LIZZY GOLD  Nigerian movies",SUNYRICHY NOLLYTV,UC0xz56kbzXxH_pZTzrqpVtw,24,Entertainment,"sunyrichy nollytv 2026, nollywood, nigerian movies, nollywood movies, new nigerian movies, new nigerian movies 2026 latest full movies, 2025 nigerian movies, nollywood movies 2025 latest full movies, new movies 2025, new movies, new movies 2025 full, new movies 2025 full movie, new movies 2025 full movies english, naijamovies, naijafilms, latestnollywoodmovie2025, frederick leonard movies, lizzy gold movies, DRUMS OF THE MASQUERADE(EKWEDIKE) OFFICIAL TRAILER",19,https://i.ytimg.com/vi/ztT-Gi_tXkk/hqdefault.jpg,en-GB,en-GB,False,116,PT1M56S,hd,False,True,False,False,147572,1895,238
nF_uX8lP8yU,GH,2026-03-01T03:27:52.966763+00:00,2026-02-28T14:01:17Z,Our Plane CRASHED in GTA 5...,Our Plane CRASHED in GTA 5...,TechyCrew,UCTU3m4rCUS-7qXuHK-j9Uqw,20,Gaming,"Techy, TechyCrew, Among Us, Fortnite, Fortnite Creative, Roblox, Techy Roblox, Among Us Roles",8,https://i.ytimg.com/vi/nF_uX8lP8yU/hqdefault.jpg,en,en,False,757,PT12M37S,hd,False,True,False,False,204663,4696,429
ZjcTIOp0J6I,GH,2026-03-01T03:27:52.966770+00:00,2026-02-25T10:01:38Z,The Fire,The Fire,Hammer of The Last Two - Topic,UCb3Z3WYPmNmJzqBa-7HR7sw,10,Music,"Hammer of The Last Two, Sarkodie, E.L, Benjies, The Fire",5,https://i.ytimg.com/vi/ZjcTIOp0J6I/hqdefault.jpg,en,en,False,276,PT4M36S,hd,False,True,False,False,26367,1492,253
VTgvt8i4er8,GH,2026-03-01T03:27:52.966778+00:00,2026-02-20T12:00:54Z,[Official Trailer] The Sun From Another Star อาทิตย์ดาวตก | STUDIO WABI SABI,[Official Trailer] The Sun From Another Star อาทิตย์ดาวตก | STUDIO WABI SABI,Studio Wabi Sabi,UCPXE51seODgcGxLQF_X5jzQ,1,Film & Animation,"#ซีรีส์วาย, #หนังวาย, #Studiowabisabi, Wabi, Sabi, #วาบิซาบิ, #วาบิ, #ซาบิ, UWMAseries, ด้ายแดง, บังเอิญรัก, lovebychance, 7project, #องศาสูญ, AbsoluteZero, FoureveryouProject, เพราะรักนำทาง",17,https://i.ytimg.com/vi/VTgvt8i4er8/hqdefault.jpg,th,th,False,199,PT3M19S,hd,True,True,False,False,544238,36738,1804
OfUFOn_hN1w,GH,2026-03-01T03:27:52.966786+00:00,2026-02-26T11:00:43Z,RESIDENT EVIL REQUIEM Walkthrough Gameplay Part 1 - INTRO (FULL GAME),RESIDENT EVIL REQUIEM Walkthrough Gameplay Part 1 - INTRO (FULL GAME),theRadBrad,UCpqXJOEqGS-TCnazcHCo0rA,20,Gaming,"Resident Evil Requiem, Resident Evil Requiem Gameplay, Resident Evil Requiem Walkthrough, Resident Evil Requiem Full Game, Resident Evil Requiem Full Gameplay, Resident Evil Requiem Part 1, Resident Evil Requiem Playthrough, Resident Evil Requiem Leon Gameplay, Resident Evil Requiem Ending, Resident Evil, Resident Evil 9, Resident Evil 9 Gameplay, RE9, RE9 Gameplay, Resident Evil Requiem PS5, Resident Evil Requiem PC, Resident Evil Requiem Review, Resident Evil Requiem Reaction",18,https://i.ytimg.com/vi/OfUFOn_hN1w/hqdefault.jpg,en,en,False,5419,PT1H30M19S,hd,False,True,False,False,1204860,65539,4785
AwnfjcDCCmE,GH,2026-03-01T03:27:52.966807+00:00,2026-02-26T19:38:25Z,Dave - The Boy Who Played the Harp,Dave - The Boy Who Played the Harp,Santan Dave,UC5-cg5RahETrjGu-r8zjYCQ,10,Music,"dave, santandave, santan dave, dave lyrics, dave rapper, new dave, new dave album, dave the boy who played the harp, the boy who played the harp, boy who played the harp, dave the boy who played the harp album, dave new music 2025, dave the boy who played the harp 2025, dave harp album, the boy who played the harp lyrics, dave album 2025, dave new music leak, dave james blake, boy who played the harp dave, dave boy who played the harp, dave harp, harp dave",22,https://i.ytimg.com/vi/AwnfjcDCCmE/hqdefault.jpg,en,en,False,297,PT4M57S,hd,False,False,False,False,664756,75028,3963
c51ND9Hdbw0,GH,2026-03-01T03:27:52.966817+00:00,2026-02-19T17:00:14Z,Toy Story 5 | Official Trailer | In Theaters June 19,Toy Story 5 | Official Trailer | In Theaters June 19,Pixar,UC_IRYSp4auq7hKLvziWVH6w,1,Film & Animation,"Pixar, Disney, Disney Pixar, Pixar Movie, Animation",5,https://i.ytimg.com/vi/c51ND9Hdbw0/hqdefault.jpg,en,en,False,145,PT2M25S,hd,True,True,False,False,9697766,232400,18557
AtUow1ZiwKE,GH,2026-03-01T03:27:52.966824+00:00,2026-02-28T16:00:25Z,Steal a Brainrot but You See Their FIRST Ever Versions…,Steal a Brainrot but You See Their FIRST Ever Versions…,Techys,UCoRjsuzMh-MqfRjvlqaVLPw,20,Gaming,,0,https://i.ytimg.com/vi/AtUow1ZiwKE/hqdefault.jpg,en,en,False,757,PT12M37S,hd,False,True,False,False,239266,6697,788
ITgd-EE7HEU,GH,2026-03-01T03:27:52.966831+00:00,2026-02-20T20:11:23Z,S bio X Chinto Nin Neiriba Episode 7,S bio X Chinto Nin Neiriba Episode 7,S Bio,UCbnjgmCvxiEmwr-29V_ytSA,23,Comedy,#sbio #determination #chinto,1,https://i.ytimg.com/vi/ITgd-EE7HEU/hqdefault.jpg,en,pt-PT,False,459,PT7M39S,hd,False,True,False,False,27161,1748,62
DcPZdjSKD9Q,GH,2026-03-01T03:27:52.966838+00:00,2026-02-19T15:00:00Z,Tyler Perry’s Beauty in Black: Season 2 | Part 2 Official Trailer | Netflix,Tyler Perry’s Beauty in Black: Season 2 | Part 2 Official Trailer | Netflix,AfricaOnNetflix,UCzi3g9ade6lq-nGjShQOJJg,24,Entertainment,"Angel, BIB, BIB S2, BIB Season 2, Beauty in Black, Beauty in Black Netflix, Beauty in Black Season 2, Charles, Horace, Kimmie, Mallory, Netflix, TPS, Tyler Perry",14,https://i.ytimg.com/vi/DcPZdjSKD9Q/hqdefault.jpg,en,en-US,False,112,PT1M52S,hd,False,False,False,False,393917,9545,506
uHfWjPSuw_0,GH,2026-03-01T03:27:52.966845+00:00,2026-02-28T18:38:45Z,ROBLOX SURVIVE HEAT FOR BRAINROTS...,ROBLOX SURVIVE HEAT FOR BRAINROTS...,More Techy,UCzlUw75H5ILJ2l_ackxyI6A,20,Gaming,"roblox, funnyroblox, techyblox, techy, crazy fan girls, crazy fan girl, my crazy fan girls, girlfriend, roblox girlfriend",9,https://i.ytimg.com/vi/uHfWjPSuw_0/hqdefault.jpg,en,en,False,815,PT13M35S,hd,False,True,False,False,151992,2543,218
2GJfWMYCWY0,GH,2026-03-01T03:27:52.966852+00:00,2026-02-27T05:00:07Z,BLACKPINK - ‘GO’ M/V,BLACKPINK - ‘GO’ M/V,BLACKPINK,UCOmHUn--16B90oW2L6FRR3A,10,Music,"YG Entertainment, YG, 와이지, K-pop, BLACKPINK, 블랙핑크, 블핑, 제니, 로제, 리사, 지수, LISA, JISOO, JENNIE, ROSÉ, BLINK, 블링크, JENNIE You & Me, JENNIE You and ME, You & Me, You and Me, 제니 You & Me, 제니 You and Me, 제니 유앤미, 유앤미, JENNIE 유앤미, 제니 코첼라, JENNIE COACHELLA",28,https://i.ytimg.com/vi/2GJfWMYCWY0/hqdefault.jpg,en,ko,False,202,PT3M22S,hd,True,True,False,False,27350400,2954268,247545
HgMbkitzhEM,GH,2026-03-01T03:27:52.966861+00:00,2026-02-12T16:00:19Z,“Spider-Noir” – Authentic Black & White Teaser Trailer | Prime Video,“Spider-Noir” – Authentic Black & White Teaser Trailer | Prime Video,Prime Video,UCQJWtTnAHhEG5w4uN0udnUQ,24,Entertainment,"spider noir official teaser, spider noir teaser, spider noir 2026, official teaser, teaser, spider noir prime video, prime video spider noir, spider noir, tv show, prime video, prime, amazon, spider noir teaser trailer, spider noir show, nicholas cage, nicholas cage spider man noir, nicholas cage spider man, spider man, spider man into the spider verse, spider man brand new day, spider man noir, spider man noir teaser, spider man noir show, spider man teaser, black and white",25,https://i.ytimg.com/vi/HgMbkitzhEM/hqdefault.jpg,en,en,False,111,PT1M51S,hd,True,True,False,False,18146511,250054,11001
5tQtcw4nLbY,GH,2026-03-01T03:27:52.966868+00:00,2026-02-28T20:56:13Z,New OG Brainrot + Admin Abuse!,New OG Brainrot + Admin Abuse!,CaylusBlox,UCsPMNatXCwqyUuJilBT73jg,20,Gaming,"caylusblox, caylus roblox, caylus, roblox, Steal a brainrot update, ADMIN ABUSE In Steal a Brainrot!, admin abuse, caylus admin abuse, caylus steak, caylus stream, caylus steal a brainrot, christmas eve admin abuse, survive lava for brainrots, caylus brainrots, lava game, caylus lava, survive lava for brainrots update, survive lava for brainrots godly, I Added a new GODLY Into My Roblox Game.., caylus survive lava for brainrots, TACO TUESDAY ADMIN ABUSE, caylus game",22,https://i.ytimg.com/vi/5tQtcw4nLbY/hqdefault.jpg,en-US,en-US,False,3586,PT59M46S,hd,False,True,False,False,1391695,20087,401
a0K3ClKrBlE,GH,2026-03-01T03:27:52.966876+00:00,2026-02-27T14:00:07Z,Masicka - Life of Sin (Official Music Video),Masicka - Life of Sin (Official Music Video),Masicka,UCOSJVk71utzoCmRxzcfhM-A,10,Music,"Masicka, Dancehall, Jamaica, Jamaican, Dancehall King, Dancehall Nation, Dancehall Official, Teejay, Jah Vinci",9,https://i.ytimg.com/vi/a0K3ClKrBlE/hqdefault.jpg,en,en,False,200,PT3M20S,hd,False,True,False,False,216885,17499,2417
e9HXmMnUEdE,GH,2026-03-01T03:27:52.966883+00:00,2026-02-02T00:59:56Z,The Devil Wears Prada 2 | Official Trailer,The Devil Wears Prada 2 | Official Trailer,20th Century Studios,UC2-BeLxzUBSs0uSrmzWhJuQ,1,Film & Animation,Trailer,1,https://i.ytimg.com/vi/e9HXmMnUEdE/hqdefault.jpg,en,en,False,100,PT1M40S,hd,True,True,False,False,10712562,171856,6748
gxXvwqrE_KY,GH,2026-03-01T03:27:52.966890+00:00,2026-02-28T15:35:32Z,The Tiniest Speed Boost Hole Race In GTA 5...,The Tiniest Speed Boost Hole Race In GTA 5...,Techy,UCFmIhbx3_RkwlMLPA4Xv8-w,20,Gaming,"roblox, techy, techy plays, brookhaven, techyblox, techycrew, more techy",7,https://i.ytimg.com/vi/gxXvwqrE_KY/hqdefault.jpg,en,en,False,903,PT15M3S,hd,False,True,False,False,130771,3025,298
lY5V4hSLWY8,GH,2026-03-01T03:27:52.966898+00:00,2026-02-27T05:00:08Z,Bruno Mars - Risk It All [Official Music Video],Bruno Mars - Risk It All [Official Music Video],Bruno Mars,UCoUM-UJ7rirJYP8CQ0EIaHA,10,Music,"bruno mars, bruno, atlantic records, official video, pop music, R&B, funk, soul, the romantic bruno mars, bruno mars the romantic, the romantic, bruno mars new music, bruno mars new album, bruno mars album, bruno mars new release, bruno mars the romantic album, Bruno Mars - Risk It All [Official Music Video], bruno mars risk it all, risk it all bruno mars, risk it all",20,https://i.ytimg.com/vi/lY5V4hSLWY8/hqdefault.jpg,en,en,False,211,PT3M31S,hd,False,True,False,False,8605442,474316,24534
mbtgEE6rkxw,GH,2026-03-01T03:27:52.966906+00:00,2026-02-02T13:58:03Z,Michael (2026) Official Trailer - Jaafar Jackson,Michael (2026) Official Trailer - Jaafar Jackson,Lionsgate Movies,UCJ6nMHaJPZvsJ-HmUmj1SeA,1,Film & Animation,"Michael, Michael 2026, Michael Jackson, Antoine Fuqua, John Logan, Jaafar Jackson, Colman Domingo, Nia Long, Miles Teller, Laura Harrier, Kat Graham, Larenz Tate, biopic, musical drama, King of Pop, music biopic, pop music, dance, performance, rhythm, groove, melody, songwriting, singing, record industry, chart-topping, legacy, icon, Billie Jean, Beat It, Smooth Criminal, Man in the Mirror, Black or White, Rock With You, Heal the World, Moonwalk, Motown, 80s music, pop legend",39,https://i.ytimg.com/vi/mbtgEE6rkxw/hqdefault.jpg,en,en,False,138,PT2M18S,hd,True,True,False,False,11280269,192551,12950
IUXs-nM0xQM,GH,2026-03-01T03:27:52.966913+00:00,2026-02-23T13:38:55Z,Barcelona vs Levante | La Liga 2026 | Full Match Streaming | PES 21 Simulation Gameplay,Barcelona vs Levante | La Liga 2026 | Full Match Streaming | PES 21 Simulation Gameplay,Football Gamer Rony,UCaopyJz-EIXOXYXSMOC6c-g,20,Gaming,"efootball, efootball pes 21, pes 21 gameplay, football game, pes 21, pes21, efootball pes 21 gameplay, live football, football live, football, football gamer rony",11,https://i.ytimg.com/vi/IUXs-nM0xQM/hqdefault.jpg,en,en,False,988,PT16M28S,hd,False,True,False,False,117793,418,1
hnkss3pKMJg,GH,2026-03-01T03:27:52.966921+00:00,2026-02-28T18:00:06Z,"ESSUMANN, MEDIKAL, LALID - BIG BRICKS REMIX","ESSUMANN, MEDIKAL, LALID - BIG BRICKS REMIX",ESSUMANN,UCF63vzBSgOV3lO9KesHBc7g,10,Music,,0,https://i.ytimg.com/vi/hnkss3pKMJg/hqdefault.jpg,en,en,False,219,PT3M39S,hd,False,True,False,False,5274,680,98
ixatpa7oYj4,GH,2026-03-01T03:27:52.966928+00:00,2026-02-27T12:01:24Z,ESCAPING FIELD TRIP Z IN ROBLOX!!,ESCAPING FIELD TRIP Z IN ROBLOX!!,Avocado Playz,UCqA5tXN003u-18CKSICLDdg,20,Gaming,,0,https://i.ytimg.com/vi/ixatpa7oYj4/hqdefault.jpg,en,en,False,961,PT16M1S,hd,False,True,False,False,499940,15371,2043
5lX62h-x-v4,GH,2026-03-01T03:27:52.966935+00:00,2026-02-17T16:00:07Z,L'Oiseau Rare feat @Shattawalegh - MILLIONS ( Official Video ),L'Oiseau Rare feat @Shattawalegh - MILLIONS ( Official Video ),L’Oiseau Rare 8G+,UCk3mXn2zjEPh8tv9-QYwLzg,10,Music,,0,https://i.ytimg.com/vi/5lX62h-x-v4/hqdefault.jpg,fr,fr,False,222,PT3M42S,hd,False,False,False,False,1385748,54153,4857
Pjaj-dZ-8gU,GH,2026-03-01T03:27:52.966942+00:00,2026-02-28T15:00:48Z,10 Seconds vs 1 Hour COCA COLA House Challenge!,10 Seconds vs 1 Hour COCA COLA House Challenge!,Cash,UC0eLBYhxW9HC0P9PXQ73mpQ,24,Entertainment,"Cash, Nico, Nico and Cash, Cash and Nico, Minecraft, Minecraft mod, family friendly, kid friendly, 10 Seconds vs 1 Hour COCA COLA House Challenge!",9,https://i.ytimg.com/vi/Pjaj-dZ-8gU/hqdefault.jpg,en,en-US,False,929,PT15M29S,hd,False,True,False,False,229854,3677,982
m8dV-KHBpEs,GH,2026-03-01T03:27:52.966950+00:00,2026-02-19T23:00:06Z,"Sssoundgawd, Mavo - Aura Salad","Sssoundgawd, Mavo - Aura Salad",Mavo,UCiR-EDBpE0T6HfU2OM5zuEQ,10,Music,,0,https://i.ytimg.com/vi/m8dV-KHBpEs/hqdefault.jpg,en,en,False,177,PT2M57S,hd,False,True,False,False,361739,8391,361
z3K7qiN4zkM,GH,2026-03-01T03:27:52.966957+00:00,2026-02-28T17:01:23Z,We Changed Our Roblox Avatars Forever…,We Changed Our Roblox Avatars Forever…,Dash Roblox,UCOfyvsftRqM5yyqpT392b4A,20,Gaming,"dash, roblox, dash roblox, dash minecraft, minecraft, minecraft challenge, minecraft mods, minecraft funny, We Changed Our Roblox Avatars Forever…",9,https://i.ytimg.com/vi/z3K7qiN4zkM/hqdefault.jpg,en,en,False,1004,PT16M44S,hd,False,True,False,False,186400,3268,760
RFn82FbGkLQ,GH,2026-03-01T03:27:52.966965+00:00,2026-02-27T16:00:06Z,KOJO BLAK - SAILOR (with Oxlade) [Official Music Video],KOJO BLAK - SAILOR (with Oxlade) [Official Music Video],KOJOBLAK,UCFifpZudYUgMHWdTlAf4zLQ,10,Music,"kojo blak, kojo blak inside, kojo blac, kojo blac inside, kojo black, kojo black inside, kojo black music, ghana, kojo blaq, kojo blaq inside, kojo blaq ghana, afrobeats, afromusic, afro, ghana pop, ghana music, afropop, ko jo blak, inside kojo blak, kojoblak calendar, abena live performance, wizkid kese, olivetheboy, king promise, kiss daniel, nigeria, rema, joe boy, kojo blak - excellent remix, kelvyn boy, kojo remix, Lasmid, Kojo Blak Balance",33,https://i.ytimg.com/vi/RFn82FbGkLQ/hqdefault.jpg,en-GB,en-GB,False,193,PT3M13S,hd,False,True,False,False,35440,2019,172
S2He9OfxzXg,GH,2026-03-01T03:27:52.966973+00:00,2026-02-24T00:16:37Z,EVERTON 0 vs 1 MANCHESTER UNITED 🔴 | PREMIER LEAGUE 25-26 | e-Football Simulation/Recreation,EVERTON 0 vs 1 MANCHESTER UNITED 🔴 | PREMIER LEAGUE 25-26 | e-Football Simulation/Recreation,十Loork Football,UCfFNw7MaO7QmWkswaGFGEvA,20,Gaming,"Everton vs, Manchester United, Everton vs Manchester United, Everton vs Manchester United 2025-2026, Manchester United vs Everton 2025-2026, PREMIERLEAGUE 2025-2026, Manchester United vs Everton PREMIERLEAGUE 2025-2026, Everton vs Manchester United PREMIERLEAGUE 2025-2026, Everton, Premier League, Manchester United F.C., Everton F.C., PremierLeague, ENGLISH PREMIER LEAGUE",14,https://i.ytimg.com/vi/S2He9OfxzXg/hqdefault.jpg,en,en,False,174,PT2M54S,hd,False,True,False,False,132576,871,2
oU0DQfuMsYE,GH,2026-03-01T03:27:52.966980+00:00,2026-02-20T10:01:13Z,Strongman - Makoma ft King Paluta [Official Video],Strongman - Makoma ft King Paluta [Official Video],Strongman Burner,UCi9Q7BqojVxhBwKieP1pZww,10,Music,,0,https://i.ytimg.com/vi/oU0DQfuMsYE/hqdefault.jpg,en,en-GB,False,185,PT3M5S,hd,False,False,False,False,49715,2671,292
i3KWr_humoQ,GH,2026-03-01T03:27:52.966987+00:00,2026-02-21T12:01:19Z,"Minecraft, But Every Drop is OP!","Minecraft, But Every Drop is OP!",Bionic,UCETZ7OiW7-wqwb-6hsz3C4w,20,Gaming,"minecraft, bionic, family friendly, Minecraft But Every Drop is OP, minecraft but its OP, minecraft OP, op drops minecraft, minecraft but every drop is random, every drop is random, random drops, challenge",11,https://i.ytimg.com/vi/i3KWr_humoQ/hqdefault.jpg,en,en,False,1991,PT33M11S,hd,False,True,False,False,1143491,25071,2446
HX2cgqnbk1A,GH,2026-03-01T03:27:52.966994+00:00,2026-02-17T18:00:31Z,Gunna - forever be mine (feat. Wizkid) [Official Video],Gunna - forever be mine (feat. Wizkid) [Official Video],Gunna,UCAkIMkEaa9sZmjcy7mfd5lQ,10,Music,"Gunna, YSL, YSL Gunna, Rap Music, Atlanta, Hip Hop, Drip Season, Drip, Fashion, Atlanta Rap, Atlanta Music, Atlanta Rap Music, Worldstarhiphop, The Fader, Wunna, Gunna - forever be mine (feat. Wizkid) [Official Visualizer], the last wun, The Last Wun, gunna the last wun, the last wun gunna, gunna new album, gunna album, gunna forever be mine ft wizkid, wizkid gunna forever be mine, gunna forever be mine, forever be mine gunna, forever be mine, gunna wizkid, wizkid, gunna ft wizkid",30,https://i.ytimg.com/vi/HX2cgqnbk1A/hqdefault.jpg,en,en,False,195,PT3M15S,hd,False,True,False,False,1880219,69665,4830
