video_id,country,fetched_at,published_at,title,localized_title,channel_title,channel_id,category_id,category_name,tags,tag_count,thumbnail,default_language,audio_language,is_live,duration,duration_raw,definition,caption_available,licensed_content,embeddable,made_for_kids,views,likes,comments
1a7AdTjlVgk,LV,2026-06-12T05:14:52.919760+00:00,2026-06-05T12:00:30Z,"ВЫВОЖУ людей из ""СЕЙВ ЗОНЫ""! Ловушка ""ОШИБКА НОВИЧКА""! CheZee. Rust | Раст","ВЫВОЖУ людей из ""СЕЙВ ЗОНЫ""! Ловушка ""ОШИБКА НОВИЧКА""! CheZee. Rust | Раст",CheZee,UCOyKtXwAm6ALJ1-r3nugR5Q,20,Gaming,"Соло раст, раст соло, Кгые, rust, раст, hfcn, Ловушка ошибка новичка, ошибка новичка, Вывожу людей из сейв зоны, сейв зона, ловушка коптер, коптер ловушка, самая смешная ловушка, угарная ловушка, Чизи, chezee, сруяуу, чиз, папачиз, chez, выживание в расте, раст в соло, раст угар, ловушка раст, новая ловушка, раст юмор, троллинг раст, делаю всякое, вывожу и делаю всякое, раст ловушка, раст коптер, ошибка ловушка, раст имба, читы раст, раст макросы",35,https://i.ytimg.com/vi/1a7AdTjlVgk/hqdefault.jpg,ru,ru,False,6786,PT1H53M6S,hd,False,True,False,False,856827,32219,2349
NT2Is90lFoI,LV,2026-06-12T05:14:52.919769+00:00,2026-06-03T13:00:35Z,Unstable SMP: Civil War FINALE,Unstable SMP: Civil War FINALE,Parrot,UCPLMPHT-d8GZOqL_AHJFdQQ,20,Gaming,"Minecraft, Minecraft SMP, SMP, Minecraft Server, LifeSteal SMP, School Minecraft Server, School SMP, School Parrot, Parrot, ParrotX2, Dream SMP, TommyInnit, LifeSteal, parrot lifesteal smp, Spoke, minecraft survival, minecraft hardcore, minecraft challenge, minecraft server, HermitCraft, MumboJumbo, Grian, why i broke 100+ bedrock, Here's Why I Made 12240 Minecraft Cakes, Minecraft Hunt, LifeSteal Season 3, 1 Heart Minecraft, LifeSteal Season 4, Why I Removed the World",29,https://i.ytimg.com/vi/NT2Is90lFoI/hqdefault.jpg,en,en,False,4675,PT1H17M55S,hd,False,True,False,False,4224895,185796,34157
RinXA_k9f4s,LV,2026-06-12T05:14:52.919777+00:00,2026-06-07T18:51:04Z,[4K] XBOX Games Showcase 2026 | Gears of War: E-Day Direct,[4K] XBOX Games Showcase 2026 | Gears of War: E-Day Direct,XBOX,UCjBp_7RuDBUYbd1LegWEJ8g,20,Gaming,"Showcase, Show case, The Coalition, Gears of War, Xbox25, 25th, anniversary, Gear, Gears, GoW, E-day, first party, third party, 1st, 3rd, 3P, 1P, Direct, Special, E3, Los Angeles, LA",22,https://i.ytimg.com/vi/RinXA_k9f4s/hqdefault.jpg,en,en,False,6104,PT1H41M44S,hd,True,False,False,False,2578024,103151,1711
-oquhXUfckE,LV,2026-06-12T05:14:52.919785+00:00,2026-06-11T11:00:33Z,Рождение Атомного монстра! Армии Левиафана конец!,Рождение Атомного монстра! Армии Левиафана конец!,• Gerand •,UCSYOvRiB12CnApfSC_GeFXg,20,Gaming,"мультики про танки, cartoon, animation, танки анимация, танки, мир танков, мульт про танки, мультики танки, мультфильмы, tank, танкомульт, мультик, tanks, gerand, геранд, создание монстра, рождение монстра, возрождение монстра, ремонт монстра, американский монстр",20,https://i.ytimg.com/vi/-oquhXUfckE/hqdefault.jpg,ru,ru,False,320,PT5M20S,hd,True,True,False,False,315055,19816,1046
wG3TG2nRMZE,LV,2026-06-12T05:14:52.919815+00:00,2026-06-11T06:37:42Z,roblox best gameplay,roblox best gameplay,StanRP,UCHYA5HNaS5n4idxmP-at8nA,20,Gaming,"roblox, granny, free fire, live roblox, roblox shorts, shorts feed, 67, six seven, meme reset, singing brainrot song, great meme reset",11,https://i.ytimg.com/vi/wG3TG2nRMZE/hqdefault.jpg,en-US,en-US,False,12,PT12S,hd,False,True,False,False,325156,2661,0
MKA5dX2iurQ,LV,2026-06-12T05:14:52.919825+00:00,2026-06-03T13:56:02Z,МЫ РАСКРЫЛИ СТРАШНЫЙ СЕКРЕТ 67 😱 МАЙНКРАФТ,МЫ РАСКРЫЛИ СТРАШНЫЙ СЕКРЕТ 67 😱 МАЙНКРАФТ,ВЛАДУС,UCPG6OP7eL7kLuyFpQMdqYSA,20,Gaming,"Владус, Vladus, майнкрафт, minecraft, майнкрафт история, майнкрафт сюжет, необычный майнкрафт, майнкрафт приключения, майнкрафт испытание, владус майнкрафт, леня майнкрафт, владус и леня, владус и лёня",13,https://i.ytimg.com/vi/MKA5dX2iurQ/hqdefault.jpg,ru,ru,False,829,PT13M49S,hd,True,True,False,False,939863,29118,1216
pAGTm1r3rMk,LV,2026-06-12T05:14:52.919833+00:00,2026-06-11T08:27:20Z,ROBLOX SNEAK OUT OF GRANDMAS..,ROBLOX SNEAK OUT OF GRANDMAS..,Foltyn,UCRkuUgtDAL4XSU5jB40J_wA,20,Gaming,"foltyn, foltyn roblox, roblox, roblox foltyn, foltyn family, funny, foltyn family roblox, roblox foltyn family, blade ball, roblox blade ball, foltyn blade ball, roblox sneak out of grandmas, roblox sneak out, roblox escape prison, foltyn and caylus, foltyn and caylus playing roblox, foltyn and caylus playing together",17,https://i.ytimg.com/vi/pAGTm1r3rMk/hqdefault.jpg,en,en-US,False,1028,PT17M8S,hd,False,True,False,False,742263,13424,1925
0GGnd5Qra3o,LV,2026-06-12T05:14:52.919841+00:00,2026-06-07T08:35:31Z,ДОНК ПРОТИВ ПАПИКОВ! МАЖОР НАЧАЛСЯ,ДОНК ПРОТИВ ПАПИКОВ! МАЖОР НАЧАЛСЯ,РАЙЗ,UCLKB9g1374gcxezJINOLtag,20,Gaming,,0,https://i.ytimg.com/vi/0GGnd5Qra3o/hqdefault.jpg,ru,ru,False,1000,PT16M40S,hd,False,True,False,False,396726,22321,444
k91pJ4qx-kQ,LV,2026-06-12T05:14:52.919848+00:00,2026-06-09T15:00:54Z,МОЙ КОЛЛЕГА ИНВЕСТИРОВАЛ В ОЧЕНЬ ДОРОГОЙ КОНТЕЙНЕР! ГТА 5 РП (ECLIPSE GTA 5 RP),МОЙ КОЛЛЕГА ИНВЕСТИРОВАЛ В ОЧЕНЬ ДОРОГОЙ КОНТЕЙНЕР! ГТА 5 РП (ECLIPSE GTA 5 RP),Joe Speen,UCLizDDpxiFRoqTLlMyGX7lQ,20,Gaming,"joe speen, джо спин, гта 5, гта 5 онлайн, gta 5 онлайн, gta 5 online, GTA 5 online, гта 5 рп, GTA 5 RP, gta 5, gta 5 rp начало игры, gta 5 rp начало, joe, speen, эклипс гта 5 рп, eclipse gta 5 rp, eclipse, обновление гта 5 рп, как заработать, как заработать деньги, обнова, достижение, обнова в гта 5 рп, скилл тест, спуск, дальнобой гта 5 рп, удачник, купить бизнес, летний пропуск гта 5 рп, летний пропуск, летний пропуск 2026",31,https://i.ytimg.com/vi/k91pJ4qx-kQ/hqdefault.jpg,ru,ru,False,2391,PT39M51S,hd,False,True,False,False,311280,33258,532
Y5I6zvOPB2Q,LV,2026-06-12T05:14:52.919856+00:00,2026-05-29T11:36:54Z,Майнкрафт но когда я ломаю блок Я ЛОМАЮ ВСЕ,Майнкрафт но когда я ломаю блок Я ЛОМАЮ ВСЕ,Carvs На Русском,UCWqputisUWigNFReyJurxaQ,20,Gaming,,0,https://i.ytimg.com/vi/Y5I6zvOPB2Q/hqdefault.jpg,ru,ru,False,1651,PT27M31S,hd,False,True,False,False,2074651,60540,4124
eJC9CjnhT-k,LV,2026-06-12T05:14:52.919863+00:00,2026-06-11T10:48:49Z,"ПАПА, ЗАБЕЙ БОЛТ НА БАН😱 ПЕРВЫЙ 3Й ПРАЙМ НА ПРОЕКТЕ ПУШ ДАНЬКИ","ПАПА, ЗАБЕЙ БОЛТ НА БАН😱 ПЕРВЫЙ 3Й ПРАЙМ НА ПРОЕКТЕ ПУШ ДАНЬКИ",Holdik,UCM6hH7Xa0oanOQeh5RxeRAQ,20,Gaming,"холдик, holdik",2,https://i.ytimg.com/vi/eJC9CjnhT-k/hqdefault.jpg,ru,ru,False,1633,PT27M13S,hd,False,True,False,False,128679,12710,1152
nkyzqcdJmRg,LV,2026-06-12T05:14:52.919871+00:00,2026-06-11T13:45:35Z,Joining a YouTuber Anarchy Server (80+ youtubers),Joining a YouTuber Anarchy Server (80+ youtubers),rekrap2,UCvt0HYxX34vUvqu66HLXeUw,20,Gaming,Minecraft,1,https://i.ytimg.com/vi/nkyzqcdJmRg/hqdefault.jpg,en,en,False,1917,PT31M57S,hd,False,True,False,False,462074,31559,2165
