video_id,country,fetched_at,published_at,title,localized_title,channel_title,channel_id,category_id,category_name,tags,tag_count,thumbnail,default_language,audio_language,is_live,duration,duration_raw,definition,caption_available,licensed_content,embeddable,made_for_kids,views,likes,comments
qwYm1-3k5wA,LV,2026-06-12T05:14:52.919396+00:00,2026-06-02T05:12:12Z,MUSIQQ X TIKASHA SAKAMA - Tu zini mani no galvas,MUSIQQ X TIKASHA SAKAMA - Tu zini mani no galvas,MUSIQQ,UCp8yJVG9ROKv5IZZslQtuZQ,10,Music,,0,https://i.ytimg.com/vi/qwYm1-3k5wA/hqdefault.jpg,lv,en-US,False,179,PT2M59S,hd,False,True,False,False,410863,9206,289
jLbst85USN8,LV,2026-06-12T05:14:52.919436+00:00,2026-05-28T14:53:06Z,Call of Duty: Modern Warfare 4 | Reveal Trailer,Call of Duty: Modern Warfare 4 | Reveal Trailer,Call of Duty,UC9YydG57epLqxA9cTzZXSeQ,20,Gaming,"call of duty, cod, activision, call of duty: modern warfare 4, modern warfare 4, mw4",6,https://i.ytimg.com/vi/jLbst85USN8/hqdefault.jpg,en,en,False,170,PT2M50S,hd,False,True,False,False,31561470,227134,22664
_BE6aVJgM98,LV,2026-06-12T05:14:52.919448+00:00,2026-06-08T15:00:07Z,FORMULA BRAWL RACE #1 #FormulaBrawl,FORMULA BRAWL RACE #1 #FormulaBrawl,Brawl Stars,UCooVYzDxdwTtGYAkcPmOgOw,20,Gaming,"brawl stars, mobile game, mobile strategy game, mobile rpg, mobile battle royale, battle royale, supercell game, marble, formula brawl, brawl race, brawl racing, bolt, 8-bit, max, spike",15,https://i.ytimg.com/vi/_BE6aVJgM98/hqdefault.jpg,en,en,False,179,PT2M59S,hd,False,True,False,False,8682595,162331,21567
kkrGcf7wkO8,LV,2026-06-12T05:14:52.919457+00:00,2026-06-01T05:15:06Z,"Prāta Vētra, MESA -  Kur ir tā jūra? (official video)","Prāta Vētra, MESA -  Kur ir tā jūra? (official video)",Prāta Vētra / BrainStorm,UC279-kT9fs0iMcKvbvGP07g,10,Music,"prata vetra, prāta vētra, brainstorm, brainstorm (Music Group), brain storm, renārs kaupers, jānis jubalts, māris mihelsons, kaspars roga, gundars maukševics, ingars viļums, mūzika, music, song, rock, roks, pops, pop, latvia, latvija, riga, jelgava, prāta vētras skaņu ierakstu kompānija, brainstorm records company, official, брейнсторм, ренарс кауперс, на заре, выходные, скользкие улицы, ветер, контакты, MESA, Gacho",34,https://i.ytimg.com/vi/kkrGcf7wkO8/hqdefault.jpg,lv,lv,False,256,PT4M16S,hd,True,True,False,False,138782,4318,184
5F5MKI_jXJw,LV,2026-06-12T05:14:52.919467+00:00,2026-06-06T16:00:01Z,I Survived 100 Days In Realistic Minecraft,I Survived 100 Days In Realistic Minecraft,MrBeast Gaming,UCIPPMRA040LQr5QPyJEbmXA,20,Gaming,,0,https://i.ytimg.com/vi/5F5MKI_jXJw/hqdefault.jpg,en,en,False,1609,PT26M49S,hd,True,True,False,False,40051892,752517,22310
27C4pfRsf9g,LV,2026-06-12T05:14:52.919475+00:00,2026-06-10T14:58:06Z,LE SSERAFIM (르세라핌) x ILLIT (아일릿) x KATSEYE (캣츠아이) 'ICONIC BY MISTAKE' Official MV,LE SSERAFIM (르세라핌) x ILLIT (아일릿) x KATSEYE (캣츠아이) 'ICONIC BY MISTAKE' Official MV,HYBE LABELS,UC3IZKseVpdzPSBaWxBxundA,10,Music,"HYBE, HYBE LABELS, 하이브, 하이브레이블즈",4,https://i.ytimg.com/vi/27C4pfRsf9g/hqdefault.jpg,ko,ko,False,200,PT3M20S,hd,True,True,False,False,11606230,1060050,88517
XaIPf-LpCI0,LV,2026-06-12T05:14:52.919484+00:00,2026-06-11T21:24:08Z,IEM Cologne Major 2026 - Day 9 - Stream A - FULL SHOW,IEM Cologne Major 2026 - Day 9 - Stream A - FULL SHOW,ESL Counter-Strike,UCPq2ETz4aAGo2Z-8JisDPIA,20,Gaming,"ESL, Counter-Strike, ESL CS, ESLCS, ESL CSGO, ESL Counter-Strike, IEM, IEM CS, IEM CSGO, CSGO, esportsisawesomesauce",11,https://i.ytimg.com/vi/XaIPf-LpCI0/hqdefault.jpg,en,en,False,42899,PT11H54M59S,hd,False,True,False,False,2750179,22817,54
04x3RshrpG8,LV,2026-06-12T05:14:52.919493+00:00,2026-05-14T21:01:41Z,ЭКСПОНАТ,ЭКСПОНАТ,MIA BOYKA - Topic,UCpPjM4LS7K-JYoDPvwWqpUg,10,Music,"MIA BOYKA, Соловьев Иван Григорьевич, ЭКСПОНАТ",3,https://i.ytimg.com/vi/04x3RshrpG8/hqdefault.jpg,ru,,False,99,PT1M39S,hd,False,True,False,False,7659344,92424,1592
LIrAaErFTSE,LV,2026-06-12T05:14:52.919501+00:00,2026-06-11T12:58:17Z,"ДОМ ""РАСТЯЖКО""! Выживание на ГЛУБИНЕ МОРЯ в РАСТ RUST","ДОМ ""РАСТЯЖКО""! Выживание на ГЛУБИНЕ МОРЯ в РАСТ RUST",ДЕРЖИ ДВЕРЬ,UC8QOXu4R4qkbn-YkdaL520A,20,Gaming,"rust, раст, кгые, hfcn, держи дверь, кава, раст рейд, rust raid, кланы, рейд, раст rust, rust выживание, выживание в rust, выживание, rust рейд, видео по rust, раст выживание, антирейд, rust антирейд, rust начало, rust pvp, rust survival, растяжка, ловушка, дом на глубине, нефтевышка, дом растяжко",27,https://i.ytimg.com/vi/LIrAaErFTSE/hqdefault.jpg,ru,ru,False,7966,PT2H12M46S,hd,False,True,False,False,625792,32873,2630
xeaG05nNRH4,LV,2026-06-12T05:14:52.919510+00:00,2026-05-27T22:26:09Z,Sudrabu Sirds - liekas problēmas,Sudrabu Sirds - liekas problēmas,Sudrabu Sirds Official ,UCduyGoIcdtqV-K00Vygp7sQ,10,Music,"Velvienreiz, Kādēļ mīlestība pastāv, sinepes un medus, mēs neesam uz Tu, ROCKENROLLA, balss, pateicīgs, ozols, Deniss, PIF un pow, lidojam tik augstu, atpakaļ pie saknēm, ko Tu gaidi, karuseli, i know, sudrabs",16,https://i.ytimg.com/vi/xeaG05nNRH4/hqdefault.jpg,lv,lv,False,228,PT3M48S,hd,False,False,False,False,55146,1446,63
WlvhB-30tOE,LV,2026-06-12T05:14:52.919518+00:00,2026-06-11T22:15:04Z,Day 1 | IEM Cologne Major 2026 Stage 3 | 🎙КРИВОЙ ЭФИР,Day 1 | IEM Cologne Major 2026 Stage 3 | 🎙КРИВОЙ ЭФИР,SL4M & Counter-Strike ,UCd3C0cHsp7xSj44UYetK1Nw,20,Gaming,"sl4m, IEM, IEMCOLOGNE2026, слэм стрим, слэм ютуб, iem на русском, ием на русском, #SL4M, ESL, Counter, Strike, ESLCS, CS, Pro CS, ESL Pro CS, ESL Tournament, ESL Pro Tournaments, ESL Highlights, Counter Strike best plays, ESL Pro League, Professional Counter Strike, cs2, CS2Highlights, Counter Strike, Spirit, Falcons, donk, VP, VirtusPro, FURIA, MAJORС2, мажор на руссокм, кривой эфир, cs2 live, cs2 gameplay",35,https://i.ytimg.com/vi/WlvhB-30tOE/hqdefault.jpg,ru,ru,False,42739,PT11H52M19S,hd,False,True,False,False,767404,21361,6
qoyWfmOwnzk,LV,2026-06-12T05:14:52.919533+00:00,2026-05-07T21:00:11Z,"By Индия, Xcho, МОТ - Шадэ","By Индия, Xcho, МОТ - Шадэ",By Индия,UC0gKrme3OQmuVrvD-YCVE5w,10,Music,"она танцует под шадэ, шадэ, by индия, ву индия, бай индия, мот, xcho, она танцует под шаде, она танцует под шаде танцы прямо на мне, танцы прямо на мне, танцует под шаде, by india, под шаде, танцы прямо во тьме, by индия она танцует под шадэ, танцует прямо на мне, под шадэ, ona tancuet pod shade, ву индия она танцует, танцует под шадэ, ву индия она танцует под шаде, танцы на мне, ву индия она танцует под шадэ, она танцует под шаде by индия, by индия она танцует под шаде, шаде",26,https://i.ytimg.com/vi/qoyWfmOwnzk/hqdefault.jpg,ru,,False,169,PT2M49S,hd,False,True,False,False,11502193,81941,1065
DAxTUf_s020,LV,2026-06-12T05:14:52.919543+00:00,2026-06-11T12:52:10Z,"Майнкрафт, но за Каждый КИЛЛ я получаю ДОНАТ Предмет!","Майнкрафт, но за Каждый КИЛЛ я получаю ДОНАТ Предмет!",Domer Grief,UCb5oqCZ4AfmfXbgHsfei0tQ,20,Gaming,"Майнкрафт, Minecraft, в Майнкрафт, рили ворлд, really world, развитие с нуля, майнкрафт но, рилик, троллинг, троллинг в майнкрафте, Майн, домер, домер гриф, Domer, Domer Grief, донат, Майнкрафт но за каждый килл, выживание с нуля, от нуля до бога, сервер, гриф с нуля, гриф, Грифер шоу, Грифер шоу майнкрафт, огород домера, домер выживание, домер выживание с нуля, майнкрафт но за каждый килл я получаю донат предмет, домер без доната, майнкрафт анархия, домер огород, грифер шоу",32,https://i.ytimg.com/vi/DAxTUf_s020/hqdefault.jpg,ru,ru,False,1422,PT23M42S,hd,False,True,False,False,474797,48613,4632
vrY1THC_NQE,LV,2026-06-12T05:14:52.919551+00:00,2026-06-01T15:00:06Z,IShowSpeed - World Cup (Champions) [Official Music Video],IShowSpeed - World Cup (Champions) [Official Music Video],IShowSpeed,UCWsDFcIhY2DBi3GB5uykGXA,20,Gaming,"ishowspeed, world cup",2,https://i.ytimg.com/vi/vrY1THC_NQE/hqdefault.jpg,en,en,False,299,PT4M59S,hd,False,False,False,False,43643094,2907001,167870
kxTS0cxsv90,LV,2026-06-12T05:14:52.919558+00:00,2026-06-10T12:00:14Z,ЭПИЧНОЕ ОГРАБЛЕНИЕ ЖИТЕЛЯ В МАЙНКРАФТ | Компот Minecraft,ЭПИЧНОЕ ОГРАБЛЕНИЕ ЖИТЕЛЯ В МАЙНКРАФТ | Компот Minecraft,Компот,UC0cWWruNMb95iCBEOzPnjRA,20,Gaming,"компот, майнкрафт, compot, minecraft, компот в майнкрафте, игры, роман компот, майн, эпичное ограбление жителя в майнкрафт, эпик, эпик в майнкрафт, эпичное ограбление в майнкрафт, эпичное ограбление, ограбление в майнкрафт, ограбление, я ограбил жителя, ограбление жителя, житель, житель в майнкрафт, окно, окно в майнкрафт, ограбление через окно в майнкрафт, компьютер в майнкрафт, компьютер, комп, ограбление жителя в майнкрафт, небоскрёб, эпично, эпично ограбил жителя, пробрался, забрал",31,https://i.ytimg.com/vi/kxTS0cxsv90/hqdefault.jpg,ru,ru,False,808,PT13M28S,hd,False,True,False,False,582167,28992,2194
naoGk-Zjc1s,LV,2026-06-12T05:14:52.919566+00:00,2026-06-07T15:00:06Z,BABYMONSTER - 'SUGAR HONEY ICE TEA' M/V,BABYMONSTER - 'SUGAR HONEY ICE TEA' M/V,BABYMONSTER,UCqwUnggBBct-AY2lAdI88jQ,10,Music,"BABYMONSTER, 베이비몬스터, 베몬, BABYMON, BAEMON, 하람, 아현, 루카, 치키타, 파리타, 로라, 아사, HARAM, AHYEON, RUKA, CHIQUITA, PHARITA, RORA, ASA",19,https://i.ytimg.com/vi/naoGk-Zjc1s/hqdefault.jpg,en,ko,False,187,PT3M7S,hd,True,True,False,False,32153552,890662,78767
4v_jk0w7wR0,LV,2026-06-12T05:14:52.919574+00:00,2026-06-06T23:10:50Z,1000 Players Simulate THE PURGE in Minecraft,1000 Players Simulate THE PURGE in Minecraft,Wemmbu,UCkzzNLnuM-VsATWC53ehwOQ,20,Gaming,"wemmbu, wembu, wenbu, wemmbu unstable smp, eggchan, unstable smp, unstable universe, parrotx2, minecraft, unstable smp in order, minecraft smp, unstable smp in order wemmbu, unstable smp latest video, unstable smp new video, wemmbu assassin, wemmbu invis player, unstable blue invis player, eggchan missing, flamefrags, egchan, 100 days, wemmbu eggchan, minecraft purge, purge, minecraft simulation",25,https://i.ytimg.com/vi/4v_jk0w7wR0/hqdefault.jpg,en-US,en-US,False,7061,PT1H57M41S,hd,False,True,False,False,5133077,221942,32634
gYCG_wfv9sw,LV,2026-06-12T05:14:52.919582+00:00,2026-05-23T07:30:06Z,NE SVYATOY — Танцуй пока молодая (Премьера трека 2026),NE SVYATOY — Танцуй пока молодая (Премьера трека 2026),NE SVYATOY,UCtOCznmeJ3lCzCF1PEtz8IQ,10,Music,"танцуй пока молодая, ne svyatoy, не святой, alexander shegay, александр шегай, новая песня, русские песни, хит 2026, музыка, dance, club music, tiktok song, viral music, russian music, pop music, музыка в машину, песни для души, премьера трека, летний хит, молодежная песня",20,https://i.ytimg.com/vi/gYCG_wfv9sw/hqdefault.jpg,ru,ru,False,326,PT5M26S,hd,False,False,False,False,1865417,5058,116
WPu9M8yETLI,LV,2026-06-12T05:14:52.919591+00:00,2026-06-11T12:00:34Z,Lp. Мастерская [47] • #69 ЭЛИТНОЕ ВООРУЖЕНИЕ [Снайперская Винтовка] • Майнкрафт,Lp. Мастерская [47] • #69 ЭЛИТНОЕ ВООРУЖЕНИЕ [Снайперская Винтовка] • Майнкрафт,MrLololoshka (Роман Фильченков),UCAvrIl6ltV8MdJo3mV4Nl4Q,20,Gaming,"Лололошка, Lololoshka, MrLololoshka, Летсплей, Сборка, Скачать, Магия, Моды, Майнкрафт, Minecraft",10,https://i.ytimg.com/vi/WPu9M8yETLI/hqdefault.jpg,ru,ru,False,2809,PT46M49S,hd,False,True,False,False,439170,46072,3634
82-jTNka3uc,LV,2026-06-12T05:14:52.919598+00:00,2026-06-01T15:00:06Z,Ariana Grande - hate that i made you love me (official music video),Ariana Grande - hate that i made you love me (official music video),ArianaGrandeVevo,UC0VOyT2OCBKdQhF3BAbZ-1g,10,Music,"Ariana Grande, Ariana Grande LP6, Pop",3,https://i.ytimg.com/vi/82-jTNka3uc/hqdefault.jpg,en,en,False,301,PT5M1S,hd,True,True,False,False,18493333,960774,42249
QdNmVWXuYec,LV,2026-06-12T05:14:52.919606+00:00,2026-06-06T00:27:34Z,"SUMMER GAME FEST 2026: Official 4K60FPS Livestream, (Resident Evil Veronica, FINAL FANTASY VII)","SUMMER GAME FEST 2026: Official 4K60FPS Livestream, (Resident Evil Veronica, FINAL FANTASY VII)",thegameawards,UCqDS7KWjAPKv-7ZSlro9OiQ,20,Gaming,"game awards, the game awards, gameplay, world premiere, video game awards, xbox, playstation, nintendo, summer game fest, sgf, tga, geoff keighley, game of the year, lucy games",14,https://i.ytimg.com/vi/QdNmVWXuYec/hqdefault.jpg,en,en,False,11124,PT3H5M24S,hd,True,True,False,False,12156288,153829,638
gzSgYrTexLo,LV,2026-06-12T05:14:52.919613+00:00,2026-05-07T22:35:22Z,"By Индия, Xcho, МОТ - Шадэ (Official)","By Индия, Xcho, МОТ - Шадэ (Official)",Glass Cage,UCH6-5Aow-AORGY6GO-PPkgA,10,Music,,0,https://i.ytimg.com/vi/gzSgYrTexLo/hqdefault.jpg,ru,,False,168,PT2M48S,hd,False,False,False,False,3301851,25290,371
Ym2wmd19S_c,LV,2026-06-12T05:14:52.919621+00:00,2026-06-09T10:11:46Z,I Became the Strongest on the Unstable SMP,I Became the Strongest on the Unstable SMP,FlameFrags,UCvYPobTo42NM36X7VC4dLhA,20,Gaming,"minecraft, flamefrags, flame frags, flamefrags minecraft, flame minecraft",5,https://i.ytimg.com/vi/Ym2wmd19S_c/hqdefault.jpg,en-US,en-US,False,3176,PT52M56S,hd,False,True,False,False,2815278,138619,22955
fcnDmrtj6Sk,LV,2026-06-12T05:14:52.919630+00:00,2026-05-23T16:14:03Z,"Shakira, Burna Boy - Dai Dai (Official Video)","Shakira, Burna Boy - Dai Dai (Official Video)",shakiraVEVO,UCGnjeahCJW1AF34HBmQTJ-Q,10,Music,"Shakira, Shakira 2026, Shakira letra, Shakira lyrics, Shakira dai dai, dai dai shak, dai dai shakira, shakira letra 2026, Dai dai letra, dai dai lyrics, dai dai, Burna Boy, Burna Boy letra, Burna Boy lyrics, Burna Boy 2026, Burna Boy video, Burna boy dai dai, Afro Pop, Cheerful, Latin Pop",20,https://i.ytimg.com/vi/fcnDmrtj6Sk/hqdefault.jpg,en,en,False,241,PT4M1S,hd,False,True,False,False,126106767,2981147,157116
HjrwXv-3hws,LV,2026-06-12T05:14:52.919637+00:00,2026-06-11T11:25:10Z,Прощай..,Прощай..,Поззи,UCuZeiI5pdpgqDojXZujoYgg,20,Gaming,,0,https://i.ytimg.com/vi/HjrwXv-3hws/hqdefault.jpg,ru,ru,False,534,PT8M54S,hd,False,True,False,False,409815,30265,6334
2IcpfrLqkwE,LV,2026-06-12T05:14:52.919644+00:00,2026-05-07T11:18:13Z,Noize MC — Спящая красавица,Noize MC — Спящая красавица,Noize MC,UCgzshmpXAc1T30PHQ3Yw2lw,10,Music,,0,https://i.ytimg.com/vi/2IcpfrLqkwE/hqdefault.jpg,ru,,False,231,PT3M51S,hd,False,True,False,False,2802757,134992,15987
i3byhJzTcyQ,LV,2026-06-12T05:14:52.919659+00:00,2026-06-11T13:00:32Z,"Эти скандалы настолько дебильные, что я ОТУПЕЛ","Эти скандалы настолько дебильные, что я ОТУПЕЛ",БУЛДЖАТь,UCOxQWb-OuyCSZadzWqrKTCQ,24,Entertainment,,0,https://i.ytimg.com/vi/i3byhJzTcyQ/hqdefault.jpg,ru,ru,False,961,PT16M1S,hd,False,True,False,False,407191,40126,2332
B402rKl4bUg,LV,2026-06-12T05:14:52.919671+00:00,2026-05-22T04:00:06Z,Olivia Rodrigo - the cure (Official Music Video),Olivia Rodrigo - the cure (Official Music Video),OliviaRodrigoVEVO,UCxE5jEls-T0QtlTHT8lI1lw,10,Music,"Olivia Rodrigo, Olivia Rodrigo PS, Pop, Olivia Rodrigo the cure, the cure official music video, Olivia Rodrigo official video, Olivia Rodrigo music video, Olivia Rodrigo new song, Olivia Rodrigo lyrics, the cure, pop rock, alternative pop, rock, Olivia Rodrigo vocals, Olivia Rodrigo performance, Olivia Rodrigo new music, Olivia Rodrigo 2026, pop music, alternative music, official music video, vevo, singer songwriter, breakup song, emotional pop, indie pop",25,https://i.ytimg.com/vi/B402rKl4bUg/hqdefault.jpg,en,en,False,315,PT5M15S,hd,True,True,False,False,14374552,673041,27154
B6MOmSRkTm8,LV,2026-06-12T05:14:52.919679+00:00,2026-06-10T12:15:25Z,МОЙ ДРУГ СТАЛ ОХОТНИКОМ НА ПРИЗРАКОВ!😱 И ВСЁ ИСПОРТИЛ! РОБЛОКС,МОЙ ДРУГ СТАЛ ОХОТНИКОМ НА ПРИЗРАКОВ!😱 И ВСЁ ИСПОРТИЛ! РОБЛОКС,ВЛАДУС ИГРАЕТ,UCUzkpCMREk2AGgZwT55JizA,20,Gaming,"роблокс, roblox, роблокс мини игры, челлендж роблокс, владус роблокс, леня роблокс, владус и леня",7,https://i.ytimg.com/vi/B6MOmSRkTm8/hqdefault.jpg,ru,ru,False,806,PT13M26S,hd,True,True,False,False,491907,10093,801
F0UIsSnotlA,LV,2026-06-12T05:14:52.919686+00:00,2026-05-08T15:00:02Z,"HAN ""back to life"" | [Stray Kids : SKZ-PLAYER]","HAN ""back to life"" | [Stray Kids : SKZ-PLAYER]",Stray Kids,UC9rMiEjNaCSsebs31MRDCRA,10,Music,"Stray Kids, 스트레이 키즈, SKZ, 방찬, BANG CHAN, 리노, 이민호, LEE KNOW, LEEMINHO, 창빈, 서창빈, CHANGBIN, SEOCHANGBIN, 현진, 황현진, HYUNJIN, HWANGHYUNJIN, 한, 지성, 한지성, HAN, JISUNG, HANJISUNG, 필릭스, FELIX, 승민, 김승민, SEUNGMIN, KIMSEUNGMIN, 아이엔, 양정인, 정인, I.N, JEONGIN, SKZ PLAYER, 슼즈 플레이어, 슼즈 플레이어 한, han skz player, 한 back to life, han back to life, 한 작사, 한 작곡, 스키즈 한 슼즈 플레이어, stray kids skz-player, skz han back to life, stray kids han back to life, back to life skz-player, back to life, 스키즈 한 작사, 스키즈 한 작곡, 스트레이 키즈 한 back to life",51,https://i.ytimg.com/vi/F0UIsSnotlA/hqdefault.jpg,en,ko,False,260,PT4M20S,hd,True,True,False,False,6375859,570096,42784
7l9T0_FOxvM,LV,2026-06-12T05:14:52.919696+00:00,2026-06-10T19:57:12Z,Opening 100 LUCKY BLOCKS in Real Life!,Opening 100 LUCKY BLOCKS in Real Life!,CaylusBlox,UCsPMNatXCwqyUuJilBT73jg,20,Gaming,"caylusblox, caylus roblox, caylus, caylus gaming, caylus infinite, infinite lists, calus, callus, calis, roblox, caylus horror, caylus scary, caylus scariest, caylus scary myths, caylus creepy, caylus roblox horror, caylus roblox scary, caylus steal a brainrot, caylus aura, caylus stream, caylus brainrot, caylus foltyn",22,https://i.ytimg.com/vi/7l9T0_FOxvM/hqdefault.jpg,en-US,en-US,False,1796,PT29M56S,hd,False,True,False,False,1388911,54339,3162
TKj9bRcysd8,LV,2026-06-12T05:14:52.919703+00:00,2026-06-10T14:00:13Z,TEAM SPIRIT: IEM COLOGNE MAJOR 2026. VLOG 1,TEAM SPIRIT: IEM COLOGNE MAJOR 2026. VLOG 1,Team Spirit CS,UCCo2nH5KDA1OE4m2VZAEbLg,20,Gaming,"team spirit, тим спирит, team spirit cs, тим спирит кс, team spirit cs 2, spirit, ts, спирит, кс, кс го, cs, csgo, cs2, кс 2, кс2, teamspirit, donk, chopper, донк, team spirit vlog, тим спирит влог, cs 2, donk cs, counter strike 2, cs go 2, спириты, спирит влог, spirit vlog, донк кс, donk cs2, shiro, sh1ro, zweih, zweih cs2, звейх, tn1r, тнир, tn1r cs2, magixx, zontix, зонтикс, маджикс кс, маджикс, cologne major cs, кельн мажор, мажор кс, iem cologne major 2026",47,https://i.ytimg.com/vi/TKj9bRcysd8/hqdefault.jpg,ru,ru,False,2387,PT39M47S,hd,True,True,False,False,274004,15652,1266
HPkHHgp3ePA,LV,2026-06-12T05:14:52.919712+00:00,2026-06-11T09:22:29Z,😱Я ПОЛУЧИЛ x9999 СКОРОСТЬ И СТАЛ ТОП 1 ИГРОКОМ В +1 Keyboard Escape в РОБЛОКС,😱Я ПОЛУЧИЛ x9999 СКОРОСТЬ И СТАЛ ТОП 1 ИГРОКОМ В +1 Keyboard Escape в РОБЛОКС,EroxBlox,UCMDSzea8f4CC53mZC3ViZug,20,Gaming,,0,https://i.ytimg.com/vi/HPkHHgp3ePA/hqdefault.jpg,ru,ru,False,934,PT15M34S,hd,False,True,False,False,312758,7340,1130
22OXhIgoDko,LV,2026-06-12T05:14:52.919719+00:00,2026-06-09T04:51:54Z,😭МЕНЯ И ХОЛДИКА НАВСЕГДА ЗАБАНИЛИ ЗА ЧИТЫ В БРАВЛ СТАРС... ЗА ЧТО?!,😭МЕНЯ И ХОЛДИКА НАВСЕГДА ЗАБАНИЛИ ЗА ЧИТЫ В БРАВЛ СТАРС... ЗА ЧТО?!,BEZSMERTNY BS ,UCcOYr_9bA5_uPJ-6uFOrxZw,20,Gaming,"бравл старс, brawl stars, бравл, brawl, МЕНЯ ЗАБАНИЛИ В БРАВЛ СТАРС, МЕНЯ И ХОЛДИКА ЗАБАНИЛИ В БРАВЛ СТАРС, ПОЛУЧИЛ БАН НАВСЕГДА В БРАВЛ СТАРС, ЗАБАНИЛИ ЗА ЧИТЫ В БРАВЛ СТАРС, ПОЛУЧИЛ БАН В БРАВЛ СТАРС, ХОЛДИКА ЗАБАНИЛИ, ПОЗЗИ ЗАБАНИЛИ, бессмертный, bezsmertny, холдик, holdik, холдик бравл старс, пуш 200к, пуш 300к кубков, ТОП 1 МИРА В БРАВЛ СТАРС, ЭЛОКС ЗАБАНИЛ, БАН В BRAWL STARS, КАК РАЗБАНИТЬ АККАУНТ В БРАВЛ СТАРС, бессмертного забанили, МОЙ АККАУНТ ЗАБАНИЛИ В БС, ростислав бан",25,https://i.ytimg.com/vi/22OXhIgoDko/hqdefault.jpg,ru,ru,False,988,PT16M28S,hd,False,True,False,False,453748,20260,4395
Kq9i01OrqbU,LV,2026-06-12T05:14:52.919727+00:00,2026-06-11T05:00:36Z,"Обзор Steam Controller (2026) — если он так хорош, то как велик Steam Machine?","Обзор Steam Controller (2026) — если он так хорош, то как велик Steam Machine?",Rozetked,UCDF_NIAEkcAUvzxe1DUzaQA,28,Science & Technology,"steam controller, steam controller review, steam controller обзор, обзор steam controller, steam controller vs xbox, steam controller vs dualsense, steam controller vs elite, steam controller vs dual sense edge, steam controller vs edge, steam controller игры, steam controller распаковка, steam controller unboxing, steam machine, steam machine обзор, стим контроллер, стим контроллер обзор, обзор стим контроллер, стим машин, стим машин обзор, обзор стим машин",20,https://i.ytimg.com/vi/Kq9i01OrqbU/hqdefault.jpg,ru,ru,False,1092,PT18M12S,hd,False,True,False,False,183475,9028,867
PvUPDSDZg1k,LV,2026-06-12T05:14:52.919736+00:00,2026-06-09T16:49:11Z,Nintendo Direct 6.9.2026 + Nintendo Treehouse: Live | June 2026,Nintendo Direct 6.9.2026 + Nintendo Treehouse: Live | June 2026,Nintendo of America,UCGIY_O-8vW4rfX98KlMkvRg,20,Gaming,"nintendo, game, gameplay, fun, video game, action, adventure, rpg, play, switch, nintendo switch",11,https://i.ytimg.com/vi/PvUPDSDZg1k/hqdefault.jpg,en,en,False,9215,PT2H33M35S,hd,False,True,False,False,4678153,132759,3470
ar-nwWXx9uY,LV,2026-06-12T05:14:52.919743+00:00,2026-06-08T13:08:43Z,БИШКА ЧУТЬ НЕ УМЕР ПОКА МЫ ОТДЫХАЛИ НА ПЛОТУ В МАЙНКРАФТ!,БИШКА ЧУТЬ НЕ УМЕР ПОКА МЫ ОТДЫХАЛИ НА ПЛОТУ В МАЙНКРАФТ!,EdisonPts,UCrpt82vHWIWZSHtNQxncPrg,20,Gaming,"эдисон, едісон, edisonpts, эдисон перец, едисон, эд, майнкрафт, minecraft, один блок в океане",9,https://i.ytimg.com/vi/ar-nwWXx9uY/hqdefault.jpg,ru,ru,False,1311,PT21M51S,hd,False,True,False,False,430851,24442,1471
dj-INFIOJcI,LV,2026-06-12T05:14:52.919752+00:00,2026-06-10T16:00:04Z,SIDEMEN REACTS BUT ONE OF US IS AN IMPOSTOR: GAMING EDITION,SIDEMEN REACTS BUT ONE OF US IS AN IMPOSTOR: GAMING EDITION,SidemenReacts,UCjRkTl_HP4zOh3UFaThgRZw,24,Entertainment,"Sidemen, Sidemen Reacts, SidemenReacts, miniminter, w2s, tobi, vikkstar123, ethan, zerkaa, reacts, among us, impostor, imposter, imposter reacts, imposter game, impostor game, impostor reacts, among, us, among us reacts, gaming",21,https://i.ytimg.com/vi/dj-INFIOJcI/hqdefault.jpg,en,en,False,1733,PT28M53S,hd,False,True,False,False,868350,37405,990
