video_id,country,fetched_at,published_at,title,localized_title,channel_title,channel_id,category_id,category_name,tags,tag_count,thumbnail,default_language,audio_language,is_live,duration,duration_raw,definition,caption_available,licensed_content,embeddable,made_for_kids,views,likes,comments
Y8TcF-r7TaE,FI,2026-05-07T04:12:55.680868+00:00,2026-05-01T14:00:06Z,KAJ – Economy PLUS,KAJ – Economy PLUS,KAJ,UCES2WzhPIl9BkvA2nnCRGlw,10,Music,"KAJ, Flygplan, Kevin Holmström, Axel Åhman, Jakob Norrgård, Eurovision, Bara bada bastu, Melodifestivalen, Melodifestivalen 2025, Eurovision 2025, Economy Plus, Luxury, Music video, musikvideo, comedy, parodi, flyg, flygskam",18,https://i.ytimg.com/vi/Y8TcF-r7TaE/hqdefault.jpg,sv,sv,False,228,PT3M48S,hd,True,False,False,False,254298,9024,683
f_bKjZeJBBI,FI,2026-05-07T04:12:55.680912+00:00,2026-05-05T04:10:02Z,The Odyssey | Official New Trailer,The Odyssey | Official New Trailer,Universal Pictures,UCq0OueAsdxH6b8nyAspwViw,24,Entertainment,,0,https://i.ytimg.com/vi/f_bKjZeJBBI/hqdefault.jpg,en-US,en-US,False,152,PT2M32S,hd,True,True,False,False,9513126,271279,17218
m_5dzAALINE,FI,2026-05-07T04:12:55.680922+00:00,2026-05-03T15:20:46Z,Pelataan Dress to impress X Katseye!,Pelataan Dress to impress X Katseye!,Helmi Kantola,UCaVB00ufcK8MBjGZgnIImJg,22,People & Blogs,"helmi kantola, helmi ja santtu, ella & helmi, dress to impress, roblox, katseye, kpop",7,https://i.ytimg.com/vi/m_5dzAALINE/hqdefault.jpg,fi,fi,False,1287,PT21M27S,hd,False,True,False,False,63168,2686,189
72c-0jrdX18,FI,2026-05-07T04:12:55.680931+00:00,2026-05-06T07:01:01Z,Vain elämää Freestyle,Vain elämää Freestyle,Ares,UCjS3WckdofQwxGNToTS6XPg,10,Music,"ares, vain elämää, freestyle",3,https://i.ytimg.com/vi/72c-0jrdX18/hqdefault.jpg,fi,fi,False,137,PT2M17S,hd,False,True,False,False,16503,1382,88
JU6VRukdFVI,FI,2026-05-07T04:12:55.680939+00:00,2026-04-27T07:24:16Z,LAPIN SOTA | Virallinen traileri | Draamaelokuva | Peter Franzén | 2026,LAPIN SOTA | Virallinen traileri | Draamaelokuva | Peter Franzén | 2026,NordiskFilmFinland,UCk84zesPLqtj3TNrImpZG6Q,1,Film & Animation,"elokuva, leffa, traileri, trailer, katso, nordisk, film, elokuvateattereissa, elokuvateatteri, finnkino, haastattelu, movie, interview, kirja, matka, draama, komedia, musikaali, juoni, näyttelijät, imdb, arvostelu, review, ikäraja, Sisu, Myrskyluodon Maija, Levoton tuhkimo, Mielensäpahoittaja, Ei koskaan yksin, Vares, täydelliset vieraat, kaunis rietas onnellinen, kaija koo, selma vilhunen, Oona Airola, Jari Virman, Ville Tiihonen, Peter Franzén, Sannah Nedergård, Volker Bruch, Aku Louhimies, Lapin Sota",42,https://i.ytimg.com/vi/JU6VRukdFVI/hqdefault.jpg,fi,fi,False,92,PT1M32S,hd,False,True,False,False,104590,2870,212
eM0EMpcwy60,FI,2026-05-07T04:12:55.680948+00:00,2026-05-03T08:49:19Z,Tie Vostokista Kauhupeleihin (Hauskimmat hetket huhtikuu 2026),Tie Vostokista Kauhupeleihin (Hauskimmat hetket huhtikuu 2026),LaeppaVika,UCBJ4RpQPQutOnWcqiooL9eQ,20,Gaming,"laeppavika, läppävika, rauski, let's play, finnish, raumoogle, gaming, laeppa, stream, live, twitch, hauskat hetket, pelivideo, road to vostok, minecraft, i am bread, suomi, finland, perkele, rk-62, windrose, don't play this, cryo, marathon, kirjolohi",25,https://i.ytimg.com/vi/eM0EMpcwy60/hqdefault.jpg,fi,fi,False,1815,PT30M15S,hd,False,True,False,False,58705,2986,107
007mv5XZvB0,FI,2026-05-07T04:12:55.680956+00:00,2026-04-23T21:00:00Z,Arttu Wiskari - Suomi Finland perkele (Audiovideo),Arttu Wiskari - Suomi Finland perkele (Audiovideo),ArttuWiskari,UCS3nTfXXy5i_YKhq7FQytrA,10,Music,,0,https://i.ytimg.com/vi/007mv5XZvB0/hqdefault.jpg,fi,fi,False,182,PT3M2S,hd,False,True,False,False,87764,1747,97
8EZhCzFaQuw,FI,2026-05-07T04:12:55.680963+00:00,2026-04-30T14:58:06Z,Subnautica 2 Early Access Cinematic Trailer,Subnautica 2 Early Access Cinematic Trailer,Subnautica,UCx2StD8gHd_-nRo5z1qcJ8g,20,Gaming,"Subnautica 2, Subnautica, Video Games, Survival Game, Open World Game, Crafting Game",6,https://i.ytimg.com/vi/8EZhCzFaQuw/hqdefault.jpg,en,en-US,False,125,PT2M5S,hd,False,False,False,False,3709598,166048,9740
kra2PE2Qlps,FI,2026-05-07T04:12:55.680971+00:00,2026-05-05T12:01:24Z,TUNNISTA OIKEA APPLEZZI.. (Minecraft Piilosta),TUNNISTA OIKEA APPLEZZI.. (Minecraft Piilosta),Kakkuh,UCfALRpCqMgkLYYrcJhKR1Sw,20,Gaming,"Kakkuh, suomi, Minecraft, Minecraft Suomi, Suomi Minecraft, Kakkuh Minecraft mutta, Minecraft Mutta, Minecraft mutta suomi, Minecraft läpi, Minecraft läpi mutta, Kakkuh Minecraft MUTTA, Kakkuh Minecraft OP, Kakkuh Minecraft, Kakkuh Survival, kakkuh op, kakkuh super, kakkuh maailma, kakkuh haaste, minecraft op, hauska, kakkuh piilosta, piilosta minecraftissa, piilosta eläiminä, tunnista, oikea, kuka on oikea, applezzi piilosta, piilosta suomi, Jyksedi, Kakkuh applezzi, mrrockis, mo",32,https://i.ytimg.com/vi/kra2PE2Qlps/hqdefault.jpg,fi,fi,False,1352,PT22M32S,hd,False,True,False,False,25578,1162,69
UzTNNzRPwI8,FI,2026-05-07T04:12:55.680979+00:00,2026-04-23T21:00:36Z,Käärijä x Basshunter - Ja Eller Nej (Audiovideo),Käärijä x Basshunter - Ja Eller Nej (Audiovideo),Käärijä,UC6azl83h9L7uqy0ChHk9VaQ,22,People & Blogs,,0,https://i.ytimg.com/vi/UzTNNzRPwI8/hqdefault.jpg,sv,fi,False,153,PT2M33S,hd,False,True,False,False,142541,4877,312
SJPu1spHqfk,FI,2026-05-07T04:12:55.680987+00:00,2026-04-30T12:59:32Z,RESIDENT EVIL – Official Teaser Trailer (4K),RESIDENT EVIL – Official Teaser Trailer (4K),Sony Pictures Entertainment,UCz97F7dMxBNOfGYu3rx8aCw,24,Entertainment,,0,https://i.ytimg.com/vi/SJPu1spHqfk/hqdefault.jpg,en,en,False,114,PT1M54S,hd,True,True,False,False,3803537,165236,18077
dOif_-So97I,FI,2026-05-07T04:12:55.680994+00:00,2026-05-05T14:22:51Z,Paettiin PEURAA Autiolla Saarella & Kuvaaja IHASTU MUHUN!,Paettiin PEURAA Autiolla Saarella & Kuvaaja IHASTU MUHUN!,Paqpa,UCDVeHl7-fRTO7vH9bFc3emg,20,Gaming,"Hello Neighbour, paqpa, mine, mine suomi, paqpa mine, pelataan mine, minecraft, minecraft suomi, paqpa minecraft, pelataan minecraft, tiktok, tiktok suomi, paqpa tiktok, tiktok life hack, paqpa tiktok life hacks, roblox, roblox suomi, paqpa roblox, pelataan roblox, tomodachi life, tomodachi, bubs, bubs suomi, paqpa bubs, labubu, labubu suomi, paqpa labubu, 99 nights, 99 nights in the forest, paqpa 99 nights, roblox 99 nights, tomodachi life 2, brookhaven, brookhaven roblox",34,https://i.ytimg.com/vi/dOif_-So97I/hqdefault.jpg,fi,fi,False,4443,PT1H14M3S,hd,False,True,False,False,25757,2033,635
x3eqqoZPV_E,FI,2026-05-07T04:12:55.681002+00:00,2026-05-04T09:21:33Z,BABYMONSTER - '춤 (CHOOM)' M/V,BABYMONSTER - '춤 (CHOOM)' M/V,BABYMONSTER,UCqwUnggBBct-AY2lAdI88jQ,10,Music,"BABYMONSTER, 베이비몬스터, 베몬, BABYMON, BAEMON, 하람, 아현, 루카, 치키타, 파리타, 로라, 아사, HARAM, AHYEON, RUKA, CHIQUITA, PHARITA, RORA, ASA",19,https://i.ytimg.com/vi/x3eqqoZPV_E/hqdefault.jpg,ko,ko,False,205,PT3M25S,hd,True,True,False,False,27880600,927366,65888
5X1dMFuHZhc,FI,2026-05-07T04:12:55.681010+00:00,2026-04-27T14:30:04Z,House of the Dragon Season 3 | Official Teaser Trailer | HBO Max,House of the Dragon Season 3 | Official Teaser Trailer | HBO Max,HBO Max,UCx-KWLTKlB83hDI6UKECtJQ,24,Entertainment,"hbo max, hbo, hbo originals, hbo original series, hbo trailer, new on hbo, max, hbo max originals, hbo max trailer, hbo max teaser, hbo max series, hbo max youtube, house of the dragon, house of the dragon season 3, HOTD, house targaryen, rhaenyra targaryen, emma d'arcy, daemon targaryen, matt smith, alicent hightower, olivia cooke, aegon targaryen, tom glynn-carney, aemond targaryen, ewan mitchell, dragons, ser criston cole, fabien frankel, house of the dragon new season",30,https://i.ytimg.com/vi/5X1dMFuHZhc/hqdefault.jpg,en,en,False,115,PT1M55S,hd,True,True,False,False,3588344,101049,4256
Fl1VVJVbpMg,FI,2026-05-07T04:12:55.681018+00:00,2026-05-04T13:00:24Z,Kohtasin SIREN HEADIN Metsässä,Kohtasin SIREN HEADIN Metsässä,Jyksedi,UCFclIIEf3lBIWiePtEf8v-w,20,Gaming,"jyksedi, minecraft suomi, suomi minecraft, jyksedi minecraft, jyksedi hardcore, jyksedi survival, minecraft jyksedi, minecraft sarja, mine, pelikanava, peli, haaste, jyksed, shorts, jyksedi shorts, siren head, siren head resurrection, älä koskaan, mene, tähän, metsään, älä, kohtasin, siren headin, siren head jyksedi, jyksedi siren head, jyksedi kauhu, kauhu, kauhupeli, jyksedi metsä, eksyin",31,https://i.ytimg.com/vi/Fl1VVJVbpMg/hqdefault.jpg,fi,fi,False,2785,PT46M25S,hd,False,True,False,False,34710,1667,99
-cWxlRf4qcg,FI,2026-05-07T04:12:55.681026+00:00,2026-04-23T21:00:01Z,Benjamin - Badabim (My Kind Of Terapiaa) [Virallinen musiikkivideo],Benjamin - Badabim (My Kind Of Terapiaa) [Virallinen musiikkivideo],BenjaminOfficial,UC8qAOyPgCtqb_ESbhFGxv9w,10,Music,,0,https://i.ytimg.com/vi/-cWxlRf4qcg/hqdefault.jpg,fi,fi,False,156,PT2M36S,hd,False,True,False,False,57344,1284,115
T2MP_T2e-aU,FI,2026-05-07T04:12:55.681033+00:00,2026-05-05T14:55:06Z,UFC 6 Official Reveal Trailer,UFC 6 Official Reveal Trailer,EA SPORTS UFC,UC86X0tzvfk12eAG9JYMp99w,20,Gaming,"UFC 6, UFC game, UFC 6 reveal, UFC 6 trailer, EA SPORTS UFC, Max Holloway, Alex Pereira, UFC trailer, MMA game, fighting game, UFC reveal trailer, EA SPORTS UFC 6, UFC, new UFC game, UFC game 2026, UFC 6 reveal trailer, UFC 6 official reveal, UFC 6 official reveal trailer, EA UFC 6, UFC 6 game, UFC 6 gameplay, UFC gameplay, UFC 6 official",23,https://i.ytimg.com/vi/T2MP_T2e-aU/hqdefault.jpg,en,en,False,141,PT2M21S,hd,False,False,False,False,488200,25815,5064
h5nCyDKhUC0,FI,2026-05-07T04:12:55.681041+00:00,2026-04-23T15:39:33Z,Minecraftia HERBAN kanssa! (OSA 2),Minecraftia HERBAN kanssa! (OSA 2),Lakko,UC1BIOZPjE3lYa2s3ZT1kYaA,20,Gaming,"lakko, minecraft, 900k, spessu, special, 900k spessu, 1h, 1 tunti, minecraftia, tsipadidau landia, lets play, pelivideo, sarja, tilaajaa, kohti miljoonaa, suomi, finnish, hauskat hetket, parhaat palat, new, mob, riisipelto, ette usko, mitä tein, minecraftissa, kaikkein, minecraft jakso, ghastling, happy ghast, herba, minecraftia herban kanssa, uus biisi, päätä päätä päätä, pilvien päällä, 2026, nautilus, spear, warden",38,https://i.ytimg.com/vi/h5nCyDKhUC0/hqdefault.jpg,fi,fi,False,1507,PT25M7S,hd,False,True,False,False,197214,12954,700
XXIX2WnfbpE,FI,2026-05-07T04:12:55.681049+00:00,2026-04-27T19:00:23Z,"Lady Gaga, Doechii - RUNWAY (Official Music Video)","Lady Gaga, Doechii - RUNWAY (Official Music Video)",LadyGagaVEVO,UC07Kxew-cMIaykMOkzqHtBQ,10,Music,"Lady Gaga, Doechii, Lil Monsters, LLC Top Dawg Entertainment, LLC under exclusive license to Interscope Records and Capitol Records, Pop",6,https://i.ytimg.com/vi/XXIX2WnfbpE/hqdefault.jpg,en,en,False,179,PT2M59S,hd,True,True,False,False,10672106,538724,25571
OYdHSvHDkcI,FI,2026-05-07T04:12:55.681056+00:00,2026-05-04T16:38:08Z,The Boys Season 5 Episode 6 Trailer,The Boys Season 5 Episode 6 Trailer,Rotten Tomatoes TV,UCz1GPotHecuLngiLuY739QQ,1,Film & Animation,"The Boys, The Boys Trailer, The Boys Season 5 Episode 6 Trailer, The Boys S05 E06 Trailer, The Boys Season 5 episode 6 TV Trailer, The Boys Season 5 Episode 6 Trailer 2026, The Boys Season 5 Episode 6 Official Trailer, Trailer, TV Trailer, 2026 Trailers, 2026 TV Trailers, The Boys Trailer 1, The Boys Season 5 Prime Video, Prime Video, Entertainment, TV Series, Karl Urban, Jack Quaid, Antony Starr",19,https://i.ytimg.com/vi/OYdHSvHDkcI/hqdefault.jpg,en,en,False,35,PT35S,hd,False,True,False,False,1002107,20982,1529
HDDxxeh3r-E,FI,2026-05-07T04:12:55.681064+00:00,2026-05-04T16:41:01Z,I Created the World's Largest Minecraft Army,I Created the World's Largest Minecraft Army,Parrot,UCPLMPHT-d8GZOqL_AHJFdQQ,20,Gaming,"Minecraft, Minecraft SMP, SMP, Minecraft Server, LifeSteal SMP, School Minecraft Server, School SMP, School Parrot, Parrot, ParrotX2, Dream SMP, TommyInnit, LifeSteal, parrot lifesteal smp, Spoke, minecraft survival, minecraft hardcore, minecraft challenge, minecraft server, HermitCraft, MumboJumbo, Grian, why i broke 100+ bedrock, Here's Why I Made 12240 Minecraft Cakes, Minecraft Hunt, LifeSteal Season 3, 1 Heart Minecraft, LifeSteal Season 4, Why I Removed the World",29,https://i.ytimg.com/vi/HDDxxeh3r-E/hqdefault.jpg,en,en,False,2944,PT49M4S,hd,False,True,False,False,3144501,154962,28538
Z8v1u54T39o,FI,2026-05-07T04:12:55.681071+00:00,2026-04-29T03:30:00Z,Kalevauva.fi - Norppa on kivellä (Musiikkivideo),Kalevauva.fi - Norppa on kivellä (Musiikkivideo),Kalevauva FI,UCWrLk0qdlgsSculJ5Uyoyrg,10,Music,"kalevauva.fi, norppaonkivellä, norppa, norppalive, saimaannorppa, wwf, wwfsuomi, luonto, suomenluonto, eläimet, livestream, luontolive, saimaa, seal, ringedseal, saimaaseal, animalvideo, naturevideo, finlandnature, protectnature, conservation, wwfvideo, viralnature, cuteanimals, finnishmusic, musiikkivideo, parodysong, ajankohtainen, trendingfinland, youtubeSuomi, mies syö lapsen vanukkaat, aapo niininen, kimmo numminen, pullervo, siiri, nuppu, sohvakäärme, vantaa, tosi tv, temptation island, luonnonsuojelu, kalevauva",42,https://i.ytimg.com/vi/Z8v1u54T39o/hqdefault.jpg,fi,fi,False,175,PT2M55S,hd,False,False,False,False,23118,1045,35
sNwzFhGwA94,FI,2026-05-07T04:12:55.681079+00:00,2026-04-27T13:00:02Z,jackass: best and last | Official Trailer (2026 Movie),jackass: best and last | Official Trailer (2026 Movie),Paramount Pictures,UCF9imwPMSGz4Vq1NiTWCC7g,1,Film & Animation,,0,https://i.ytimg.com/vi/sNwzFhGwA94/hqdefault.jpg,en,en-US,False,140,PT2M20S,hd,True,True,False,False,6282680,112009,5983
52mSG05s_TY,FI,2026-05-07T04:12:55.681086+00:00,2026-05-05T15:32:43Z,"Geometry Dash, mutta Jokainen Portaali on Random","Geometry Dash, mutta Jokainen Portaali on Random",SatuBlox,UCOBo8hrAh_HL1qpAWeaLJDQ,22,People & Blogs,,0,https://i.ytimg.com/vi/52mSG05s_TY/hqdefault.jpg,fi,fi,False,1125,PT18M45S,hd,False,True,False,False,13773,409,23
SzcynhTLBdg,FI,2026-05-07T04:12:55.681094+00:00,2026-04-16T10:03:38Z,Kuka hitto sen päättää,Kuka hitto sen päättää,Lauri Haav - Topic,UC5nbpNQRoVNN8xqlAiAbShA,10,Music,"Lauri Haav, No Haav No Love, Kuka hitto sen päättää",3,https://i.ytimg.com/vi/SzcynhTLBdg/hqdefault.jpg,fi,fi,False,178,PT2M58S,hd,False,True,False,False,68546,650,14
qb00PDb7eqM,FI,2026-05-07T04:12:55.681101+00:00,2026-04-28T15:00:06Z,Apex Legends: Overclocked Anthem Trailer,Apex Legends: Overclocked Anthem Trailer,Apex Legends,UC0ZV6M2THA81QT9hrVWJG3A,20,Gaming,"apex legends, apex legends season 29, apex legends overclocked, apex legends s29, apex s29, axle apex legends, new legend axle, axle gameplay, apex legends axle, apex legends trailer, apex legends skins, battle royale, apex legends ps5, apex legends ps4, apex legends xbox, apex legends switch, apex legends pc, respawn entertainment, electronic arts",19,https://i.ytimg.com/vi/qb00PDb7eqM/hqdefault.jpg,en,en,False,118,PT1M58S,hd,True,True,False,False,1216890,34259,2684
G90ZaWZEBJM,FI,2026-05-07T04:12:55.681109+00:00,2026-05-05T17:55:25Z,✨✨ AVATAAN CASEJA ✨✨ REAGOIDAAN ✨✨PELATAAN ✨✨ HUUMORIA ✨✨,✨✨ AVATAAN CASEJA ✨✨ REAGOIDAAN ✨✨PELATAAN ✨✨ HUUMORIA ✨✨,Lewa,UCGCPPzqP3ExUYo1sIAg7bzw,20,Gaming,"Lewa668, lewa, gameplay, suomeksi, fortnite, battle, royale, battleroyale, tips, tricks, uusi, new, gamemode, kill, record, suomen, ennätys, tappo, fortnitebr, haaste, hunting, rifle, fortnite battle royale, gun, ase, päivitys, suomi, lewa live, lewa fortnite, lewa summercar, lewa granny, lewa kauhu, kauhu, lewa phasmophobia, lewa phasmo, phasmo suomi, lewa og fortnite, lewa chapter 2, finnish cottage simulator, mökki simulaattori, OG FORTNITE, LEWA OG",42,https://i.ytimg.com/vi/G90ZaWZEBJM/hqdefault.jpg,fi,fi,False,11772,PT3H16M12S,hd,False,True,False,False,14949,537,16
bMhDJ0S0OBA,FI,2026-05-07T04:12:55.681117+00:00,2026-04-30T08:58:06Z,ILLIT (아일릿) ‘It’s Me’ Official MV,ILLIT (아일릿) ‘It’s Me’ Official MV,HYBE LABELS,UC3IZKseVpdzPSBaWxBxundA,10,Music,"HYBE, HYBE LABELS, 하이브, 하이브레이블즈",4,https://i.ytimg.com/vi/bMhDJ0S0OBA/hqdefault.jpg,ko,ko,False,147,PT2M27S,hd,True,True,False,False,13907697,414775,24738
6IxPD-jNdwM,FI,2026-05-07T04:12:55.681124+00:00,2026-04-22T19:01:13Z,Clayface | Official Teaser,Clayface | Official Teaser,DC,UCiifkYAs_bq1pt_zbNAzYGg,1,Film & Animation,"2026, Clayface, Coming Soon, DC, DC Comics, David Dencik, Eddie Marsan, Gotham City, Horror, James Watkins, Joshua James, Max Minghella, Movie Trailer, Nancy Carroll, Naomi Ackie, Teaser Trailer, Thriller, Tom Rhys Harries, Warner Bros, Warner Bros Pictures",20,https://i.ytimg.com/vi/6IxPD-jNdwM/hqdefault.jpg,en,en-US,False,64,PT1M4S,hd,True,False,False,False,10832575,190952,10532
Zw_HE1mQ7rA,FI,2026-05-07T04:12:55.681132+00:00,2026-05-02T13:00:54Z,I Got Hunted by the World's Deadliest Assassin,I Got Hunted by the World's Deadliest Assassin,Wemmbu,UCkzzNLnuM-VsATWC53ehwOQ,20,Gaming,"wemmbu, wembu, wenbu, wemmbu unstable smp, wemmbu the sequel, eggchan, wemmbu eggchan, wemmbu hunted, wemmbu invisible player, unstable smp, unstable universe, parrotx2, minecraft, unstable smp in order, minecraft smp, unstable smp in order wemmbu, unstable smp latest video, unstable smp new video",18,https://i.ytimg.com/vi/Zw_HE1mQ7rA/hqdefault.jpg,en,en,False,3437,PT57M17S,hd,False,True,False,False,3767731,201810,37790
j_igALZGeaw,FI,2026-05-07T04:12:55.681140+00:00,2026-04-25T06:00:38Z,Pasi ja Anssi - Kun eletään ei pelätä feat. Kake Randelin (virallinen musiikkivideo),Pasi ja Anssi - Kun eletään ei pelätä feat. Kake Randelin (virallinen musiikkivideo),Pasi ja Anssi Music,UCpcFXMkImqQsjVu1M8lQETg,10,Music,"pasijaanssi, kakerandelin, kuneletääneipelätä, ralli, tuning, drifting, musiikkivideo, suomi",8,https://i.ytimg.com/vi/j_igALZGeaw/hqdefault.jpg,fi,fi,False,182,PT3M2S,hd,False,False,False,False,50546,628,24
W3e2Gt9qowg,FI,2026-05-07T04:12:55.681148+00:00,2026-05-05T17:47:02Z,Battlefield 6 Season 3 Gameplay Reveal and Details...,Battlefield 6 Season 3 Gameplay Reveal and Details...,jackfrags,UCw7FkXsC00lH2v2yB5LQoYA,20,Gaming,,0,https://i.ytimg.com/vi/W3e2Gt9qowg/hqdefault.jpg,en,en-GB,False,357,PT5M57S,hd,False,True,False,False,226840,8713,701
anBn6SYemsk,FI,2026-05-07T04:12:55.681154+00:00,2026-05-04T12:06:25Z,Ostin DAMIANIN 20€... (YLIVOIMAINEN),Ostin DAMIANIN 20€... (YLIVOIMAINEN),AitoRasse,UCBZjS6iQN8kx8oyR4OzC7eA,20,Gaming,"brawl stars, colette, damian, uus brawler, 20€, brawl stars suomi",6,https://i.ytimg.com/vi/anBn6SYemsk/hqdefault.jpg,fi,fi,False,855,PT14M15S,hd,False,True,False,False,20443,717,85
0PVLyBYNFj4,FI,2026-05-07T04:12:55.681162+00:00,2026-04-28T11:58:21Z,EUROPE - One on One (Official Video),EUROPE - One on One (Official Video),Europe,UCcVWnNUkJcqn2-7QUIk_wIQ,10,Music,"Europe (Musical Group), Joey Tempest (Musical Artist), John Norum (Musical Artist), Ian Haugland, Mic Michaeli, John Leven, europe, europe one on one, europe new, europe new song, europe new album, europe come this madness, peter stormare, europe final countdown, europe the final countdown, europe band, europe rock band, europe carrie, europe songs, europe rock the night, europe superstitious, europe cherokee, europe album, classic rock, rock music",25,https://i.ytimg.com/vi/0PVLyBYNFj4/hqdefault.jpg,en,en,False,256,PT4M16S,hd,False,False,False,False,544775,25720,2481
LFJJA8Qeqz4,FI,2026-05-07T04:12:55.681170+00:00,2026-04-27T12:09:37Z,KAGURABACHI｜Official Teaser Trailer,KAGURABACHI｜Official Teaser Trailer,SHOCHIKU animeチャンネル【公式】,UC6VPE3kztGEtFVcJI0oIiUg,1,Film & Animation,,0,https://i.ytimg.com/vi/LFJJA8Qeqz4/hqdefault.jpg,en,en,False,46,PT46S,hd,True,True,False,False,1799205,112186,546
GQiRqmHDq_U,FI,2026-05-07T04:12:55.681177+00:00,2026-05-03T21:39:14Z,"BLAST Rivals Fort Worth 2026, GRAND FINAL - NAVI vs Vitality","BLAST Rivals Fort Worth 2026, GRAND FINAL - NAVI vs Vitality",BLAST Premier,UC9k--dE_UE0Faxzgb_DDkYQ,20,Gaming,"world, final, 2024, season, finale, navi, natus vincere, astralis, faze, clan, mouz, team, liquid, vitality, spirit, g2, esports, live, asia, singapore, arena, event, champions, best, livestream, cs2 gameplay, cs2, cs 2, csgo, blast pro series, gaming, competitive gaming, blast premier, blast, cs2 pros, cs2 players, esports pros, esports players, cs2 content, BLAST 2024, BLASTPremier, cs2 2024, counter strike, cs2 live, BLAST Bounty, Bounty, counter strike 2, BLAST Rivals, BLAST Open, blast major",50,https://i.ytimg.com/vi/GQiRqmHDq_U/hqdefault.jpg,en,en,False,17653,PT4H54M13S,hd,False,True,False,False,1655520,20491,255
7y4MUCCHFGY,FI,2026-05-07T04:12:55.681185+00:00,2026-05-06T18:00:06Z,Inpatient (Ren x Chris Webby) - Neurodivergent,Inpatient (Ren x Chris Webby) - Neurodivergent,Ren,UCqq3VcwPGseErHUa0-xLInQ,10,Music,"ren, renmakesmusic, Ren Music, Ren New Music, Ren Hi Ren, Ren Reaction, Ren Reactions, Ren Animal Flow, Ren Sick Boi, Ren Murderer, Ren Chalk Outlines, Ren Chinchilla, Ren Jenny's Tale, Ren Violet's Tale, Ren For Joe, Ren Reaction Video, Ren Makes Music, Money Game, Ren Money Game, Sick Boi, hi ren, hi ren song, hi ren reaction, ren reaction, ren reactions, ren new music, ren UK",27,https://i.ytimg.com/vi/7y4MUCCHFGY/hqdefault.jpg,en,en,False,250,PT4M10S,hd,True,True,False,False,112193,17363,2104
ML4L1XSZnKM,FI,2026-05-07T04:12:55.681193+00:00,2026-04-28T17:00:26Z,Honest Trailers | The Departed,Honest Trailers | The Departed,Screen Junkies,UCOpcACMWblDls9Z6GERVi1A,1,Film & Animation,,0,https://i.ytimg.com/vi/ML4L1XSZnKM/hqdefault.jpg,en,en,False,375,PT6M15S,hd,False,True,False,False,502057,15511,1080
iBIPfShBJCs,FI,2026-05-07T04:12:55.681200+00:00,2026-05-06T11:15:07Z,Mut pakotettiin pelaamaan tätä💥| Brawl Stars Suomi,Mut pakotettiin pelaamaan tätä💥| Brawl Stars Suomi,EskoLivePlus,UCA5f-e7d_4gIJ9d5164cQrg,20,Gaming,,0,https://i.ytimg.com/vi/iBIPfShBJCs/hqdefault.jpg,fi,fi,False,717,PT11M57S,hd,False,True,False,False,14585,1437,180
rdi4R6uRG5Q,FI,2026-05-07T04:12:55.681208+00:00,2026-04-30T10:01:28Z,Tule tyttö kyytiin,Tule tyttö kyytiin,Poju - Topic,UCcmbPkw9FRVRe1e4wYURjCA,10,Music,"Poju, Mikko Alatalo, Kassu Halonen, Tule tyttö kyytiin",4,https://i.ytimg.com/vi/rdi4R6uRG5Q/hqdefault.jpg,fi,fi,False,201,PT3M21S,hd,False,True,False,False,15339,340,0
cemBjJ3Zx9Q,FI,2026-05-07T04:12:55.681215+00:00,2026-05-01T17:00:48Z,Zach Cregger's Resident Evil - Trailer Reaction,Zach Cregger's Resident Evil - Trailer Reaction,The Critical Drinker,UCSJPFQdZwrOutnmSFYtbstA,24,Entertainment,"critical drinker, review, funny, best movie review, jill valentine, capcom",6,https://i.ytimg.com/vi/cemBjJ3Zx9Q/hqdefault.jpg,en,en,False,291,PT4M51S,hd,False,True,False,False,545474,28736,3987
kFmH5xZ5-vo,FI,2026-05-07T04:12:55.681222+00:00,2026-05-03T12:49:37Z,"""СКАЛА БОГА""! 1000 дней на АЗИИ в РАСТ RUST","""СКАЛА БОГА""! 1000 дней на АЗИИ в РАСТ RUST",ДЕРЖИ ДВЕРЬ,UC8QOXu4R4qkbn-YkdaL520A,20,Gaming,"rust, раст, кгые, hfcn, держи дверь, кава, раст рейд, rust raid, кланы, рейд, раст rust, rust выживание, выживание в rust, выживание, rust рейд, видео по rust, раст выживание, антирейд, rust антирейд, rust начало, rust pvp, rust survival, rust movie, скалабога, азия, скала, китайцы, скала бога, скала раст",29,https://i.ytimg.com/vi/kFmH5xZ5-vo/hqdefault.jpg,ru,ru,False,10909,PT3H1M49S,hd,False,True,False,False,1954308,70227,7270
RvOQHcFFT_8,FI,2026-05-07T04:12:55.681230+00:00,2026-05-01T06:00:31Z,Arppa & Jiri-serkku - Asemalla (video),Arppa & Jiri-serkku - Asemalla (video),Arppa,UCTj-xfgHkaP66zl64OQQXkA,10,Music,,0,https://i.ytimg.com/vi/RvOQHcFFT_8/hqdefault.jpg,fi,fi,False,229,PT3M49S,hd,False,True,False,False,8963,277,5
uwild1rw7Aw,FI,2026-05-07T04:12:55.681237+00:00,2026-04-16T22:11:44Z,Star Wars: The Mandalorian and Grogu | Final Trailer | In Theaters May 22,Star Wars: The Mandalorian and Grogu | Final Trailer | In Theaters May 22,Star Wars,UCZGYJFUizSax-yElQaFDp5Q,24,Entertainment,,0,https://i.ytimg.com/vi/uwild1rw7Aw/hqdefault.jpg,en,en-US,False,133,PT2M13S,hd,True,True,False,False,3781135,79736,5204
im8fbEE3wCE,FI,2026-05-07T04:12:55.681244+00:00,2026-05-03T17:27:50Z,Muumitalo saa uusia vieraita! - Muumipeikko: Talven taika #2,Muumitalo saa uusia vieraita! - Muumipeikko: Talven taika #2,eeddplays,UCvx1h5K7wZzOFJiPzSvpq4w,20,Gaming,"eeddplays, eeddspeaks, let's, play, suomalaista, pelaamista, pelataan, peli, pelivideo, pelivideoita, suomeksi, suomen kielellä, fin, muumipeikko: talven taika, talven taika, muumi, muumipeli",17,https://i.ytimg.com/vi/im8fbEE3wCE/hqdefault.jpg,fi,fi,False,2908,PT48M28S,hd,False,True,False,False,10286,463,97
sw1YLrdaUnA,FI,2026-05-07T04:12:55.681251+00:00,2026-05-01T14:59:57Z,"Seungmin ""급류(Into The Current)"" | [Stray Kids : SKZ-RECORD]","Seungmin ""급류(Into The Current)"" | [Stray Kids : SKZ-RECORD]",Stray Kids,UC9rMiEjNaCSsebs31MRDCRA,10,Music,"Stray Kids, 스트레이 키즈, SKZ, 방찬, BANG CHAN, 리노, 이민호, LEE KNOW, LEEMINHO, 창빈, 서창빈, CHANGBIN, SEOCHANGBIN, 현진, 황현진, HYUNJIN, HWANGHYUNJIN, 한, 지성, 한지성, HAN, JISUNG, HANJISUNG, 필릭스, FELIX, 승민, 김승민, SEUNGMIN, KIMSEUNGMIN, 아이엔, 양정인, 정인, I.N, JEONGIN, SKZ RECORD, 스키즈 자작곡, 스트레이키즈 자작곡, 슼즈레코드 승민, 승민 슼레, 승민 보컬, seungmin vocal, 승민 노래, 스키즈 승민 슼즈레코드, seungmin SKZ RECORD, seungmin song, 스키즈 한 작사, 스키즈 한 작곡, 한지성 작사, 한지성 작곡, 한 슼레, 승민 급류, seungmin Into The Current, 스키즈 승민 급류, 스트레이 키즈 승민 슼레, skz seungmin into the current",55,https://i.ytimg.com/vi/sw1YLrdaUnA/hqdefault.jpg,en,ko,False,280,PT4M40S,hd,True,True,False,False,928856,183172,12015
