video_id,country,fetched_at,published_at,title,localized_title,channel_title,channel_id,category_id,category_name,tags,tag_count,thumbnail,default_language,audio_language,is_live,duration,duration_raw,definition,caption_available,licensed_content,embeddable,made_for_kids,views,likes,comments
Zoju7G8eHtE,DK,2026-07-03T04:25:57.846806+00:00,2026-06-26T00:01:12Z,Annika - Desperado,Annika - Desperado,YoungmammmiVEVO,UCzM4Uqy1fbaSL65TR9JLXPQ,10,Music,"Annika, Island Nordic, Pop",3,https://i.ytimg.com/vi/Zoju7G8eHtE/hqdefault.jpg,en,en,False,194,PT3M14S,hd,False,True,False,False,30766,717,62
cmjpadVj-Vk,DK,2026-07-03T04:25:57.846845+00:00,2026-06-29T12:00:12Z,WERWULF - Official Trailer [HD] - Only In Theaters Christmas,WERWULF - Official Trailer [HD] - Only In Theaters Christmas,Focus Features,UCU4SM3j_9TNWaSu8KdGV50g,1,Film & Animation,"Focus Features, Robert Eggers, Sjón, Chris Columbus, Eleanor Columbus, Eric Fellner, Tim Bevan, Garrett Bird, Aaron Taylor-Johnson, Willem Dafoe, Lily-Rose Depp, Ralph Ineson, Nosferatu, Werwulf Film, Werwulf, Werwulf Movie, Bodhi Rae Breathnach, Vidal Arzoni",18,https://i.ytimg.com/vi/cmjpadVj-Vk/hqdefault.jpg,en,en-US,False,135,PT2M15S,hd,True,True,False,False,9936181,130461,9064
Fv9aCXhs3XY,DK,2026-07-03T04:25:57.846854+00:00,2026-06-29T12:52:25Z,Vi Prøvede Det SJOVESTE Spil (Bombanana),Vi Prøvede Det SJOVESTE Spil (Bombanana),SondergaardLIVE,UCYMBefwPHdhMAn8dXZ8xqHA,22,People & Blogs,,0,https://i.ytimg.com/vi/Fv9aCXhs3XY/hqdefault.jpg,da,da,False,2995,PT49M55S,hd,False,True,False,False,40602,682,19
Q7IFjVUUb_E,DK,2026-07-03T04:25:57.846862+00:00,2026-06-24T04:00:01Z,"Stray Kids ""RUN IT"" M/V","Stray Kids ""RUN IT"" M/V",JYP Entertainment,UCaO6TYtlC8U5ttz62hTrZgg,10,Music,"JYP Entertainment, JYP, Stray Kids, 스트레이 키즈, SKZ, 스키즈, 방찬, BANG CHAN, 리노, LEE KNOW, 창빈, CHANGBIN, 현진, 황현진, HYUNJIN, 한, 한지성, HAN, 필릭스, FELIX, 용복, 승민, 김승민, SEUNGMIN, 아이엔, I.N, stray kids comeback, 스트레이 키즈 컴백, 스키즈 컴백, skz comeback, skz, SKZ Teaser, 스키즈 티저, 스트레이 키즈 티저, skz teaser, Stray Kids teaser, stray kids mv teaser, skz mv teaser, Stray Kids RUN IT, RUN IT teaser, SKZ RUN IT, SKZ comeback teaser, 스키즈 런잇, SKZ This & That, This & That, 런잇, 디스앤댓, 스키즈 디스앤댓, stray kids this & that",49,https://i.ytimg.com/vi/Q7IFjVUUb_E/hqdefault.jpg,en,ko,False,229,PT3M49S,hd,True,True,False,False,26554996,1292093,124214
62bIsvRcPv0,DK,2026-07-03T04:25:57.846871+00:00,2026-06-17T18:58:31Z,SPIDER-MAN: BRAND NEW DAY – New Trailer (4K),SPIDER-MAN: BRAND NEW DAY – New Trailer (4K),Sony Pictures Entertainment,UCz97F7dMxBNOfGYu3rx8aCw,24,Entertainment,,0,https://i.ytimg.com/vi/62bIsvRcPv0/hqdefault.jpg,en,en,False,162,PT2M42S,hd,True,True,False,False,27118541,625222,23971
FTJvHPVxCPc,DK,2026-07-03T04:25:57.846878+00:00,2026-07-02T13:00:13Z,ENDELIG SAMLET med Trioen!,ENDELIG SAMLET med Trioen!,Johnni Gade Gaming,UCs0Cbo9JCNnVKtoywjWt3UA,20,Gaming,"johnni, johnni g, johnni gade, gaming, spil, lets play, humor, komedie, sjov",9,https://i.ytimg.com/vi/FTJvHPVxCPc/hqdefault.jpg,da,da,False,2481,PT41M21S,hd,False,True,False,False,29743,1315,81
6MXrpA-7_1Q,DK,2026-07-03T04:25:57.846884+00:00,2026-06-18T22:02:56Z,Hold Mit Tempo,Hold Mit Tempo,Lamin - Topic,UCArypypMeG7KDYZkFjZLuBA,10,Music,"Lamin, Annika, WAVY, Hold Mit Tempo",4,https://i.ytimg.com/vi/6MXrpA-7_1Q/hqdefault.jpg,en,en,False,164,PT2M44S,hd,False,True,False,False,35888,306,13
AyIZ9tiiN8I,DK,2026-07-03T04:25:57.846890+00:00,2026-07-01T12:30:05Z,The Odyssey | Official Countdown Trailer,The Odyssey | Official Countdown Trailer,Universal Pictures,UCq0OueAsdxH6b8nyAspwViw,24,Entertainment,,0,https://i.ytimg.com/vi/AyIZ9tiiN8I/hqdefault.jpg,en-US,en-US,False,151,PT2M31S,hd,True,True,False,False,3525911,47341,11666
aBV80RTgSNQ,DK,2026-07-03T04:25:57.846896+00:00,2026-06-30T19:13:25Z,The Dumbest Spots in Meccha Chameleon That Somehow Work,The Dumbest Spots in Meccha Chameleon That Somehow Work,SMii7Y,UCzXwjTI6c6mVn6oui_p6oiw,20,Gaming,"smii7y, smii7yplus, smii7y+, smii7y plus, meccha chameleon, meccha chameleon game, meccha chameleon funny moments, meccha chameleon gameplay, camouflage game, chameleon game meme, funny gaming moments, funny hide and seek moments, paint camouflage game, camouflage party game, hide and seek game, prop hunt type game, prop hunt, meccha chameleon best spots, hide and seek, meccha, meccha chameleon hiding spots, meccha chameleon spots",22,https://i.ytimg.com/vi/aBV80RTgSNQ/hqdefault.jpg,en,en,False,2333,PT38M53S,hd,False,True,False,False,3486159,160697,3129
-q_S27LbNKU,DK,2026-07-03T04:25:57.846902+00:00,2026-06-26T04:00:00Z,ATEEZ(에이티즈) - 'BAD' Official MV,ATEEZ(에이티즈) - 'BAD' Official MV,KQ ENTERTAINMENT,UCQdq-lqPEq_yZ_wP_kuVB9Q,10,Music,"KQ, 케이큐, ATEEZ, 에이티즈, 홍중, HONGJOONG, 성화, SEONGHWA, 윤호, YUNHO, 여상, YEOSANG, 산, SAN, 민기, MINGI, 우영, WOOYOUNG, 종호, JONGHO, KPOP, 남돌, IDOL, 케이팝, GOLDENHOUR, 골든아워, MV, 뮤직비디오, 골든아워파트5, GHPT5, GOLDENHOURPART5, BADMV, 배드MV, 에이티즈배드, 에이티즈BAD, 에이티즈 배드, 에이티즈 BAD, 베드, 에이티즈베드, 에이티즈 베드, 에이티즈 뮤비, ATEEZBAD, ATEEZ BAD, ATEEZ MV, ATEEZ 뮤직비디오, musicvideo, 에이티즈 mv",47,https://i.ytimg.com/vi/-q_S27LbNKU/hqdefault.jpg,ko,ko,False,225,PT3M45S,hd,True,False,False,False,14734153,416892,27124
mV7451mcw-E,DK,2026-07-03T04:25:57.846909+00:00,2026-06-29T15:30:07Z,Cyberpunk: Edgerunners 2 | Official Teaser 2,Cyberpunk: Edgerunners 2 | Official Teaser 2,Cyberpunk 2077,UC4zyoIAzmdsgpDZQfO1-lSA,20,Gaming,,0,https://i.ytimg.com/vi/mV7451mcw-E/hqdefault.jpg,en,en,False,91,PT1M31S,hd,False,True,False,False,4085024,371681,16234
iWkM5kEH9PM,DK,2026-07-03T04:25:57.846915+00:00,2026-06-29T04:49:58Z,I Forced Artists to Play Meccha Chameleon,I Forced Artists to Play Meccha Chameleon,Ludwig,UCrPseYLGpNygVi34QpGNqpA,20,Gaming,"ludwig, ludwigahgren, ahgren, gaming, chat, stream, decides, lud",8,https://i.ytimg.com/vi/iWkM5kEH9PM/hqdefault.jpg,en,en,False,1445,PT24M5S,hd,False,True,False,False,2398871,64397,1056
e3-xsBaDjmc,DK,2026-07-03T04:25:57.846921+00:00,2026-06-15T14:00:17Z,KANYE WEST - SILVER NIGHT  | СЕДАЯ НОЧЬ (GANG REMIX),KANYE WEST - SILVER NIGHT  | СЕДАЯ НОЧЬ (GANG REMIX),Davuiside,UC09TqdjM4ld0BxL4zZArabA,10,Music,"Davuiside, Gangster City, Car Music, G House, Night Music, Deep House, Music 2024, Bass Boosted, Bass Music, Slap House, Phonk, Brazilian Phonk, Girls, Models Car, Tik Tok Music, Tik Tok Songs, Tik Tok Trends, Vava Media, Vava Music, Gangster Music, Gangster Deep, Krush Funk, Afro House, Tik Tok, Tik Tok Video, Video Viral, Video Edits, Edits, Viral, Tik Tok Viral, Tik Tok Edits, KANYE WEST, SILVER NIGHT, СЕДАЯ НОЧЬ, SILVER NIGHT | СЕДАЯ НОЧЬ, KANYE WEST - SILVER NIGHT",36,https://i.ytimg.com/vi/e3-xsBaDjmc/hqdefault.jpg,en,en-US,False,203,PT3M23S,hd,False,False,False,False,8928663,45814,415
y2Zcmcbrm9s,DK,2026-07-03T04:25:57.846928+00:00,2026-06-26T04:00:08Z,"Transcendence Trailer - ""Sudden Snow"" | Genshin Impact #GenshinImpact #GenshinSnezhnaya","Transcendence Trailer - ""Sudden Snow"" | Genshin Impact #GenshinImpact #GenshinSnezhnaya",Genshin Impact,UCiS882YPwZt1NfaM0gR0D9Q,20,Gaming,,0,https://i.ytimg.com/vi/y2Zcmcbrm9s/hqdefault.jpg,en,en-US,False,315,PT5M15S,hd,True,False,False,False,3375896,284023,20068
shlFrEGeGwI,DK,2026-07-03T04:25:57.846934+00:00,2026-06-26T21:58:39Z,They Couldn't Find Me AT ALL,They Couldn't Find Me AT ALL,SMii7Yplus,UC-gW4TeZAlKm7UATp24JsWQ,20,Gaming,"smii7y, smii7yplus, smii7y+, smii7y plus, meccha chameleon, meccha chameleon game, meccha chameleon funny moments, meccha chameleon gameplay, camouflage game, chameleon game meme, funny gaming moments, paint camouflage game, camouflage party game, hide and seek game, prop hunt type game, prop hunt, meccha chameleon best spots, hide and seek, meccha, meccha chameleon hiding spots, meccha chameleon spots, best meccha chameleon spots",22,https://i.ytimg.com/vi/shlFrEGeGwI/hqdefault.jpg,en,en,False,3777,PT1H2M57S,hd,False,True,False,False,4449282,187468,3083
27C4pfRsf9g,DK,2026-07-03T04:25:57.846940+00:00,2026-06-10T14:58:06Z,LE SSERAFIM (르세라핌) x ILLIT (아일릿) x KATSEYE (캣츠아이) 'ICONIC BY MISTAKE' Official MV,LE SSERAFIM (르세라핌) x ILLIT (아일릿) x KATSEYE (캣츠아이) 'ICONIC BY MISTAKE' Official MV,HYBE LABELS,UC3IZKseVpdzPSBaWxBxundA,10,Music,"HYBE, HYBE LABELS, 하이브, 하이브레이블즈",4,https://i.ytimg.com/vi/27C4pfRsf9g/hqdefault.jpg,ko,ko,False,200,PT3M20S,hd,True,True,False,False,61176004,1863388,116877
3Gmo0EXHyKg,DK,2026-07-03T04:25:57.846946+00:00,2026-06-24T13:00:00Z,THE ONE PIECE | Official Teaser | Netflix,THE ONE PIECE | Official Teaser | Netflix,Netflix,UCWOA1ZGywLbqmigxE4Qlvuw,24,Entertainment,"ONE PIECE, THE ONE PIECE, WIT Studio, anime",4,https://i.ytimg.com/vi/3Gmo0EXHyKg/hqdefault.jpg,en,en-US,False,65,PT1M5S,hd,True,True,False,False,3066788,115684,8626
A6g3ozZQQQ0,DK,2026-07-03T04:25:57.846952+00:00,2026-07-02T08:02:26Z,Kenji & Kaze Lost Everything! (Brawl Stars Animation),Kenji & Kaze Lost Everything! (Brawl Stars Animation),Brawl Stars,UCooVYzDxdwTtGYAkcPmOgOw,20,Gaming,"brawl stars, mobile game, mobile strategy game, mobile rpg, mobile battle royale, battle royale, supercell game, nanonoodles, ramen, new season, ramen rebellion",11,https://i.ytimg.com/vi/A6g3ozZQQQ0/hqdefault.jpg,en,en,False,70,PT1M10S,hd,True,True,False,False,2619872,86212,3778
0pg0raFMNIU,DK,2026-07-03T04:25:57.846957+00:00,2026-07-02T21:00:06Z,manifest - Toz Pembe | Official Music Video,manifest - Toz Pembe | Official Music Video,manifest,UC3aqBnkDAfMh5eUmiYi_tfQ,10,Music,"manifest, big5 türkiye, big5 manifest, official music video, manifest video, manifest music video, manifest girlband, official music video türkçe, manifest esin, manifest hilal, manifest mina, manifest zoktay, zeynep oktay, manifest lidya, manifest sueda, manifest yeni şarkı, manifest şarkıları, manifest klip, sueda uluca, toz pembe, manifest toz pembe, manifest toz pembe şarkısı, toz pembe dinle, manifest toz pembe dinle",24,https://i.ytimg.com/vi/0pg0raFMNIU/hqdefault.jpg,tr,tr,False,193,PT3M13S,hd,True,True,False,False,1418814,150051,48549
gSgBTb3wmMI,DK,2026-07-03T04:25:57.846965+00:00,2026-06-30T17:00:06Z,Honest Trailers | Idiocracy,Honest Trailers | Idiocracy,Screen Junkies,UCOpcACMWblDls9Z6GERVi1A,1,Film & Animation,,0,https://i.ytimg.com/vi/gSgBTb3wmMI/hqdefault.jpg,en,en,False,400,PT6M40S,hd,False,True,False,False,602015,30242,3434
ftAZdG67UA4,DK,2026-07-03T04:25:57.846971+00:00,2026-07-02T13:00:39Z,Jeg kan umuligt finde dem i Meccha Chameleon,Jeg kan umuligt finde dem i Meccha Chameleon,CapGaming,UCu0dJnwyuhRacHA1lQ5d3hQ,20,Gaming,"spørg casper, casper harding, cap og lejbe, spillejan, spille jan, morten gaming, gaming, dansk, danmark, denmark, danish, lets play, chameleon meccha dansk, gemmeleg",14,https://i.ytimg.com/vi/ftAZdG67UA4/hqdefault.jpg,da,da,False,2465,PT41M5S,hd,False,True,False,False,9538,349,21
7meWEiJEHeI,DK,2026-07-03T04:25:57.846977+00:00,2026-07-01T18:00:06Z,Inpatient (Ren x Chris Webby) - Madhouse,Inpatient (Ren x Chris Webby) - Madhouse,Ren,UCqq3VcwPGseErHUa0-xLInQ,10,Music,"ren, renmakesmusic, Ren Music, Ren New Music, Ren Hi Ren, Ren Reaction, Ren Reactions, Ren Animal Flow, Ren Sick Boi, Ren Murderer, Ren Chalk Outlines, Ren Chinchilla, Ren Jenny's Tale, Ren Violet's Tale, Ren For Joe, Ren Reaction Video, Ren Makes Music, Money Game, Ren Money Game, Sick Boi, hi ren, hi ren song, hi ren reaction, ren reaction, ren reactions, ren new music, ren UK",27,https://i.ytimg.com/vi/7meWEiJEHeI/hqdefault.jpg,en,en,False,216,PT3M36S,hd,True,True,False,False,137032,15851,2045
D3jsoWfUyMo,DK,2026-07-03T04:25:57.846983+00:00,2026-06-29T15:00:14Z,Assassin's Creed Black Flag Resynced - PS5 Pro Immersion Trailer | PS5 Games,Assassin's Creed Black Flag Resynced - PS5 Pro Immersion Trailer | PS5 Games,PlayStation,UC-2Y8dQb0S6DtpxNgAKoJKA,20,Gaming,"PlayStation, PS5, video games, next gen, Sony, Assasssin's Creed Black Flag Resynced, trailer, Black Flag, Black Flag Resynced, PS5 Pro, Playstation 5, PlayStation 5 Pro, remake, Edward Kenway, Assassin, Pirate, Assassins, PSSR, PSSR 2, RTGI, Raytracing, tech, 60 FPS, 2026 games, Ubisoft.PlayStation, Naval, Stealth, Action, Combat, Adventure.",30,https://i.ytimg.com/vi/D3jsoWfUyMo/hqdefault.jpg,en,en-US,False,61,PT1M1S,hd,True,True,False,False,338039,10314,840
NhzNTxttxCI,DK,2026-07-03T04:25:57.846989+00:00,2026-06-29T14:13:57Z,Jeg gemmer mig som en ko i Meccha Chameleon,Jeg gemmer mig som en ko i Meccha Chameleon,Morten Gaming,UCz3Tub6cJbgAlf1YPHtC1zg,20,Gaming,"dansk gaming, gaming, spil, computer, mikrofon, udstyr, teknologi, eventyr, farver, gameplay",10,https://i.ytimg.com/vi/NhzNTxttxCI/hqdefault.jpg,da,da,False,1075,PT17M55S,hd,False,True,False,False,23663,538,29
vrY1THC_NQE,DK,2026-07-03T04:25:57.846996+00:00,2026-06-01T15:00:06Z,IShowSpeed - World Cup (Champions) [Official Music Video],IShowSpeed - World Cup (Champions) [Official Music Video],IShowSpeed,UCWsDFcIhY2DBi3GB5uykGXA,20,Gaming,"ishowspeed, world cup",2,https://i.ytimg.com/vi/vrY1THC_NQE/hqdefault.jpg,en,en,False,299,PT4M59S,hd,False,False,False,False,77470674,3554098,197552
s8cP1Vt5US8,DK,2026-07-03T04:25:57.847001+00:00,2026-06-19T12:44:08Z,『チェンソーマン 刺客篇』ティザーPV②／Chainsaw Man –  Assassins Arc Official Trailer 2,『チェンソーマン 刺客篇』ティザーPV②／Chainsaw Man –  Assassins Arc Official Trailer 2,MAPPA CHANNEL,UCjfAEJZdfbIjVHdo5yODfyQ,1,Film & Animation,,0,https://i.ytimg.com/vi/s8cP1Vt5US8/hqdefault.jpg,ja,ja,False,91,PT1M31S,hd,False,False,False,False,6635959,405633,13498
wZW016nna48,DK,2026-07-03T04:25:57.847007+00:00,2026-06-20T16:00:01Z,"If You Build It, I'll Buy It!","If You Build It, I'll Buy It!",MrBeast Gaming,UCIPPMRA040LQr5QPyJEbmXA,20,Gaming,,0,https://i.ytimg.com/vi/wZW016nna48/hqdefault.jpg,en,en,False,2010,PT33M30S,hd,True,True,False,False,42591929,785470,19607
tB93gfKocK4,DK,2026-07-03T04:25:57.847013+00:00,2026-06-29T15:00:07Z,Al Shami - Ana Baadak [Official Music Video] (2026) / الشامي - انا بعدك,Al Shami - Ana Baadak [Official Music Video] (2026) / الشامي - انا بعدك,Al Shami - الشامي,UCO-OdMztI8WPVoz_Dq9n48Q,10,Music,"al chami, el shami, el chami, الشامي, شامي, al shami music, al shami 2025, أغاني عربية, 2025 أغاني عربية, أغاني راب عربية, أغاني راب عربية 2025, إنتاج بلال دركي, shami, chami, new music, al shami, al chamy, el chamy, al shamy, el shamy, ana baadak, ana ba3dak, al shami ana baadak, al shami ana ba3dak, الشامي انا بعدك, al shamy ana baadak, al shamy ana ba3dak, ana baadak music, al shami baadak, al shami ba3dak, انا بعدك",31,https://i.ytimg.com/vi/tB93gfKocK4/hqdefault.jpg,ar,ar,False,316,PT5M16S,hd,True,True,False,False,3512603,140766,36558
vo0N_i326as,DK,2026-07-03T04:25:57.847019+00:00,2026-06-27T20:11:51Z,The Love Hypothesis - Official Teaser Trailer | Prime Video,The Love Hypothesis - Official Teaser Trailer | Prime Video,Prime Video,UCQJWtTnAHhEG5w4uN0udnUQ,24,Entertainment,"the love hypothesis official teaser, the love hypothesis teaser, the love hypothesis 2026, official teaser, teaser, teaser 2026, new amazon teaser, the love hypothesis prime video, prime video the love hypothesis, the love hypothesis, prime video, amazon prime video, amazon prime, prime, amazon, the love hypothesis movie, tom bateman, arty froushan, lili reinhart, rachel marsh, claire scanlon, ali hazelwood adaptation, sarah rothschild, book to movie adaptation, aadi maaj",25,https://i.ytimg.com/vi/vo0N_i326as/hqdefault.jpg,en,en,False,68,PT1M8S,hd,False,True,False,False,764568,23038,582
Kn6SQ6w41Jc,DK,2026-07-03T04:25:57.847026+00:00,2026-07-02T13:00:08Z,Spiller Meccha Chameleon med CAP og JOHNNI!,Spiller Meccha Chameleon med CAP og JOHNNI!,SpilleJan,UC4-UisEBTjohJqFRjQI2rZg,20,Gaming,,0,https://i.ytimg.com/vi/Kn6SQ6w41Jc/hqdefault.jpg,da,da,False,1746,PT29M6S,hd,False,True,False,False,6628,271,16
9_P8BpY02tk,DK,2026-07-03T04:25:57.847031+00:00,2026-05-29T11:52:43Z,Christopher - Ringer Om Natten (Lyrik Video),Christopher - Ringer Om Natten (Lyrik Video),CHRISTOPHER,UCWAZJoAnXf9B3xTPbZgGy0g,10,Music,"told you so, tulips, real life, i won't let you down, heartbeat, bad, monogamy, irony, my heart, first like, colours, nothing in common, CPH girls, Copenhagen girls, take me back, christopher, bad boy, ghost, fall so hard, leap of faith, if it weren't for you, naked",22,https://i.ytimg.com/vi/9_P8BpY02tk/hqdefault.jpg,da,da,False,176,PT2M56S,hd,False,False,False,False,142190,1373,70
pSev1SOSZA0,DK,2026-07-03T04:25:57.847037+00:00,2026-07-01T11:57:51Z,"SPIDER-MAN: BRAND NEW DAY - ""Threat"" - TV Spot Concept","SPIDER-MAN: BRAND NEW DAY - ""Threat"" - TV Spot Concept",BTrailer,UC_AfpQ6tL90TUaERq-5eH6g,24,Entertainment,"spiderman, brandnewday, trailer, marvel, fanmade, trailerstyle, edit",7,https://i.ytimg.com/vi/pSev1SOSZA0/hqdefault.jpg,en,en,False,65,PT1M5S,hd,False,False,False,False,357577,7913,238
MMoteNXoelw,DK,2026-07-03T04:25:57.847043+00:00,2026-06-29T07:45:29Z,Hay Day is expanding the Beach Area!,Hay Day is expanding the Beach Area!,Hay Day,UCBrMq7wkdPWb3PxR-GUR61A,20,Gaming,"Hay Day, HayDay, Supercell, Suprcell, Farming, Farm life, mobile, tablet, mobile game, game, yt:cc=on, ios, android, amazon, series, farmer, pig, horse, cow, sheep, goat, puppy, dog, kitten, cat, fishing, sanctuary, elephant, zebra, giraffe, hippo",31,https://i.ytimg.com/vi/MMoteNXoelw/hqdefault.jpg,en,en,False,172,PT2M52S,hd,True,False,False,False,2077936,38709,2052
ilqeDbu4E8Y,DK,2026-07-03T04:25:57.847049+00:00,2026-06-25T16:00:06Z,Bring Me The Horizon - Dehumanized (Official Video),Bring Me The Horizon - Dehumanized (Official Video),BMTHOfficialVEVO,UCUmC7gXciukRv73CQRQ5QGQ,10,Music,"Bring Me The Horizon, Dehumanized",2,https://i.ytimg.com/vi/ilqeDbu4E8Y/hqdefault.jpg,en,en,False,279,PT4M39S,hd,False,True,False,False,1718126,160750,17172
Q-_puwOPeD4,DK,2026-07-03T04:25:57.847055+00:00,2026-07-01T15:21:52Z,Ustoppelig SUPERSTJERNE i årets højest rated draft! - DRAFT TIL GLORY #38,Ustoppelig SUPERSTJERNE i årets højest rated draft! - DRAFT TIL GLORY #38,JKFIFA,UCp4Xer5gEK8yc-loStaAqyg,20,Gaming,"jkfifa, eafc, fc24, eafc24",4,https://i.ytimg.com/vi/Q-_puwOPeD4/hqdefault.jpg,da,da,False,930,PT15M30S,hd,False,True,False,False,6448,199,5
Rt9tW3cMLhI,DK,2026-07-03T04:25:57.847061+00:00,2026-06-12T04:00:06Z,Olivia Rodrigo - stupid song (Official Music Video),Olivia Rodrigo - stupid song (Official Music Video),OliviaRodrigoVEVO,UCxE5jEls-T0QtlTHT8lI1lw,10,Music,"Olivia Rodrigo, Olivia Rodrigo stupid song, stupid song official music video, Olivia Rodrigo official video, Olivia Rodrigo music video, Olivia Rodrigo new song, Olivia Rodrigo lyrics, stupid song, pop rock, alternative pop, pop, rock, Olivia Rodrigo vocals, Olivia Rodrigo new music, Olivia Rodrigo 2026, pop music, alternative music, official music video, vevo, singer songwriter, you seem pretty sad for girl so in love, emotional pop, indie pop, female pop artist",24,https://i.ytimg.com/vi/Rt9tW3cMLhI/hqdefault.jpg,en,en,False,217,PT3M37S,hd,True,True,False,False,13624943,494498,16919
v5IBfDJ1QOs,DK,2026-07-03T04:25:57.847067+00:00,2026-06-27T19:40:29Z,The Untold Journey of a Solo Builder - Rust (Movie),The Untold Journey of a Solo Builder - Rust (Movie),Willjum,UCzOfLNkiScJp3U_h_QlvHHg,20,Gaming,"Willjum, Rust, Rust Solo Survival, Rust Movie, Twitch highlights, Rust Chilled, Willyum, Rust Solo Story, Solo, Rust Solo Base, Spoonkid, BritYT, BritRust",13,https://i.ytimg.com/vi/v5IBfDJ1QOs/hqdefault.jpg,en-GB,en-US,False,7142,PT1H59M2S,hd,False,True,False,False,891980,47523,2802
82-jTNka3uc,DK,2026-07-03T04:25:57.847074+00:00,2026-06-01T15:00:06Z,Ariana Grande - hate that i made you love me (official music video),Ariana Grande - hate that i made you love me (official music video),ArianaGrandeVevo,UC0VOyT2OCBKdQhF3BAbZ-1g,10,Music,"Ariana Grande, Ariana Grande LP6, Pop",3,https://i.ytimg.com/vi/82-jTNka3uc/hqdefault.jpg,en,en,False,301,PT5M1S,hd,True,True,False,False,37423289,1235143,47738
GrIjmWmLeSg,DK,2026-07-03T04:25:57.847080+00:00,2026-06-30T16:00:15Z,Hermitcraft 11: Episode 20 - EXTERIOR DONE!,Hermitcraft 11: Episode 20 - EXTERIOR DONE!,Grian,UCR9Gcq0CMm6YgTzsDxAxjOQ,20,Gaming,"Minecraft, Grian, building, grian, mincraft, tutorial, yt:quality=high, minecraft, ideas, creative, build",11,https://i.ytimg.com/vi/GrIjmWmLeSg/hqdefault.jpg,en,en-GB,False,1640,PT27M20S,hd,True,True,False,False,797642,53781,2146
yJtckcMHM2g,DK,2026-07-03T04:25:57.847086+00:00,2026-06-08T15:00:06Z,"Madonna - ""Confessions II - The Film""","Madonna - ""Confessions II - The Film""",Madonna,UC81VD6eeuLLSfyY_D-N8sVw,10,Music,"madonna, madonna music videos, madonna videos, madonna songs, madonna playlist, madonna greatest hits, madonna live, confessions II film, confessions film, madonna film",10,https://i.ytimg.com/vi/yJtckcMHM2g/hqdefault.jpg,en,en,False,835,PT13M55S,hd,False,True,False,False,4501473,190859,22500
4vh0YMfuvw8,DK,2026-07-03T04:25:57.847092+00:00,2026-07-01T12:10:52Z,LAST CHANCE TO GO MAIN STAGE - T1 VS TLAW - MSI 2026,LAST CHANCE TO GO MAIN STAGE - T1 VS TLAW - MSI 2026,Caedrel,UCOFiUtKui6-x4T-J7_DgCag,20,Gaming,"caedrel, league of legends, lec, streamer, mid, jungle, rumours, offseason, roster, lol, lolesports, lol moments, lol clips, lol streamers, lol shorts, league shorts, twitch clips, vod review, pro play, caedrel stream, caedrel highlights, caedrel clips, caedrel twitch, caedrel reacts, lcs, lck, lpl, gaming, british, pedro, funny moments, accent, caster, lol caster, analyst, pro player, worlds, msi, eulcs, videogames, variety streamer, riot games, twitch, cancelled it, fnatic, fnc, g2, t1, damwon, geng, ig",51,https://i.ytimg.com/vi/4vh0YMfuvw8/hqdefault.jpg,en,en-GB,False,7119,PT1H58M39S,hd,False,True,False,False,439895,8508,746
naoGk-Zjc1s,DK,2026-07-03T04:25:57.847099+00:00,2026-06-07T15:00:06Z,BABYMONSTER - 'SUGAR HONEY ICE TEA' M/V,BABYMONSTER - 'SUGAR HONEY ICE TEA' M/V,BABYMONSTER,UCqwUnggBBct-AY2lAdI88jQ,10,Music,"BABYMONSTER, 베이비몬스터, 베몬, BABYMON, BAEMON, 하람, 아현, 루카, 치키타, 파리타, 로라, 아사, HARAM, AHYEON, RUKA, CHIQUITA, PHARITA, RORA, ASA",19,https://i.ytimg.com/vi/naoGk-Zjc1s/hqdefault.jpg,en,ko,False,187,PT3M7S,hd,True,True,False,False,78021692,1042198,87995
8_Au10osdEo,DK,2026-07-03T04:25:57.847105+00:00,2026-06-23T18:54:02Z,Unstable SMP: Purgatory,Unstable SMP: Purgatory,Spoke,UCk2uxbWi5py_iJXaEsh2YRA,20,Gaming,"spoke, spokeishere, lifesteal, minecraft, survival, wormhole, unstable, unstable universe, wemmbu, parrotx2",10,https://i.ytimg.com/vi/8_Au10osdEo/hqdefault.jpg,en,en-US,False,8944,PT2H29M4S,hd,False,True,False,False,4184691,152252,36015
MEoxtFRfPoc,DK,2026-07-03T04:25:57.847113+00:00,2026-06-12T04:00:02Z,BTS (방탄소년단) 'Come Over' Lyric Video,BTS (방탄소년단) 'Come Over' Lyric Video,BANGTANTV,UCLkAepWjdylmXSltofFvsYQ,10,Music,"방탄소년단, BTS, BANGTAN, 알엠, RM, 슈가, SUGA, 제이홉, jhope, 지민, 정국, k-pop, 방탄, j-hope, Jung Kook, Jimin, BTS V, Jin",18,https://i.ytimg.com/vi/MEoxtFRfPoc/hqdefault.jpg,ko,ko,False,180,PT3M,hd,False,True,False,False,9574656,1014083,67974
TZzaEN4lx6Y,DK,2026-07-03T04:25:57.847121+00:00,2026-06-30T04:32:37Z,"The 1,000 Hour Kraken | Sailing Locked (#14)","The 1,000 Hour Kraken | Sailing Locked (#14)",Settled,UCs-w7E2HZWwXmjt9RTvBB_A,20,Gaming,"Mory, Morytania, Area, Maxing, Max, OSRS, UIM, End, Game, Ultimate, Ironman, Old, School, Runescape, RS3, Settled, Settledrs, Progress, Video, Tricks, Tips, Bossing, Skilling, 2007, 2007Scape, Dream, Gear, Items, Boss, Episode, Settled UIM, UIM Settled, OSRS Settled, Morytania UIM, Morytania Ironman, Mory Ironman, Maxed UIM, UIM Maxing",38,https://i.ytimg.com/vi/TZzaEN4lx6Y/hqdefault.jpg,en,en,False,1228,PT20M28S,hd,False,True,False,False,417133,17413,997
SzJXikN_4wA,DK,2026-07-03T04:25:57.847127+00:00,2026-06-05T04:00:37Z,"I Knew It, I Knew You (From ""Toy Story 5"")","I Knew It, I Knew You (From ""Toy Story 5"")",Taylor Swift - Topic,UCPC0L1d253x-KuMNwa05TpA,10,Music,"Taylor Swift, テイラースウィフト, テイラー・スウィフト, I Knew It, I Knew You",4,https://i.ytimg.com/vi/SzJXikN_4wA/hqdefault.jpg,en,,False,179,PT2M59S,hd,False,True,False,False,8551081,211087,9017
Yy5g1levGyI,DK,2026-07-03T04:25:57.847133+00:00,2026-06-29T05:00:39Z,Jeg Løb På Et ADMIN Løbebånd I Keyboard Escape!,Jeg Løb På Et ADMIN Løbebånd I Keyboard Escape!,SpyplantGaming,UCX3QIFOnEQ_4c5P4Ws4bgGA,20,Gaming,"Dansk, Roblox, MrSpyplant, Spyplant, SpyplantGaming, roblox, dansk, simulator, sjov, danmark",10,https://i.ytimg.com/vi/Yy5g1levGyI/hqdefault.jpg,da,da,False,1157,PT19M17S,hd,False,True,False,False,14660,297,20
UUGGRIaVfds,DK,2026-07-03T04:25:57.847139+00:00,2026-06-05T16:00:06Z,Electric Callboy feat. The Offspring - LET THE GOOD TIMES ROLL (OFFICIAL VIDEO),Electric Callboy feat. The Offspring - LET THE GOOD TIMES ROLL (OFFICIAL VIDEO),Electric Callboy,UCAR30oDTNbJE-Zd2NDg1mTQ,10,Music,"Eskimo Callboy, We Got The Moves, Hypa Hypa, Metal, Metalcore, Germany, Rammstein, Rock, Scooter, Synth, Synthwave, 80s, David Friedrich, New Song, New Album, Castrop-Rauxel, Ruhrpott, Music Video, Musicvideo, Musikvideo, Party, Abriss, Eskimo Cowboy, Skimo, Callboy, Escimo, Nico Sallach, Kevin Ratajczak, Hair, Hair cut, HandOfBlood, Pump It, Moustache, Electric Callboy, New Name, Electric, New Bandname, Electric Cowboy, Tekkno, Spaceman, Tanzneid, Sum41, Frank Zummo, Babymetal, Ratatata",45,https://i.ytimg.com/vi/UUGGRIaVfds/hqdefault.jpg,en,en,False,218,PT3M38S,hd,False,False,False,False,1954809,83260,3326
