video_id,published_at,title,channel_title,category_name,tags,duration,definition,caption_available,licensed_content,views,likes,comments
udFsogly8Us,2025-12-04 22:50:53+00:00,JLEXIS X MICHAEL FLORES X SHADOW BLOW X ALOFOKE MUSIC - ME TOCO VERTE BRILLAR,AlofokeMusicSounds,Music,"Bad Bunny, Dembow, Reggaeton, Karol G, Anuel AA, Trap, Rap, Salsa, Merengue, Feid, Santiago Matias, W Sound, Rochy RD, Yailin La Mas Viral, El Alfa, Bulin 47, Romeo Santos, Anthony Santos",184,hd,False,True,3443062,277449,22562
VI6XO8EijT4,2025-12-05 20:00:28+00:00,DIGITAL CIRCUS EP 7 TRAILER!!,GLITCH,Film & Animation,"glitch, glitch productions, digital circus, the amazing digital circus, murder drones, Pomni, Uzi, Jax, Ragatha, Kinger, Gangle, Zooble, Caine, Bubble, 3D, Animation, 3D Animation, Indie Animation, Gummigoo",58,hd,True,True,5285578,485242,27791
esPT8WCk_AQ,2025-12-05 17:16:52+00:00,Me Volví LOCO por un Charizard de 2.900€,Rubius Z,Entertainment,"elrubius, rubius, nuevo, 2025, card, tcg, pokemon, charizard, inferno x, hit, full art, ex, new, opening, cartas, phantasmal flames, mega charizard x, mega, carta, cara, caro, meowth, 2026, dinero, cajas, caja, unboxing, sorpresa, mistery, box, meme, memes, gracioso, divertido",1343,hd,False,True,1259157,95402,1764
-76svVX5Cd8,2025-12-04 22:59:00+00:00,"Natos y Waor, Recycled J - MOLTISANTI (Videoclip oficial) [Hijos de la Ruina Vol. 4]",Natos y Waor,Music,,233,hd,False,True,144246,9094,497
XRRnP91SSrQ,2025-12-05 16:00:21+00:00,Welcome Home | Poppy Playtime Chapter 5 Cinematic Trailer,Mob Entertainment,Gaming,,58,hd,True,True,2230963,179694,13129
n09iOx6NwP0,2025-12-06 01:05:28+00:00,DEBATE DEL MUNDIAL CON LA COBRA Y LATINOS ! DjMaRiiO,DjMaRiiO,Gaming,"djmariio, djmario, djmarrio, djmarioo, dj, mario, mariio, fut, fifa, futdraft, draft, plantilla, discard, challenge, pack, opening, handicap, pc, español, trucos, spain, spanish, el camino, MODO HISTORIA, PS5, PS4, ea sports fc, kings league, kings league oficial, ultimate mostoles, fc 25 modo carrera, fifa 25 modo carrera, fc 25 ultimate team, fc 25 gratis, fc 25 nintento switch, fut 25, fifa 25, 25, ea sports fc 25, fifa 25 ps4, fc 25 ps4, fc 25 djmariio, fc 26, ea sports fc 26, la cobra, debates",20286,hd,False,True,355497,5036,51
85ETxUOFnfM,2025-12-04 18:00:06+00:00,Danny Ocean - Me Rehúso (Letra),Caribeo,People & Blogs,,206,hd,False,True,769849,925,6
oWkee4nu1Lg,2025-12-04 21:06:49+00:00,El Caballero de los Siete Reinos | Tráiler | HBO Max,HBO Max España,People & Blogs,,124,hd,False,False,74612,1063,83
oKSU-xSjZsg,2025-12-06 19:15:08+00:00,Dirijo al CLUB que NADIE quiere ENTRENAR (Modo Carrera),ROBERT PG,Gaming,"MODO CARRERA, FC 26, EL CLUB IMPOSIBLE DE ENTRENAR, EA SPORTS FC 26",2115,hd,False,True,241042,17609,411
6FT7hEbU9qo,2025-12-04 22:59:06+00:00,"Obed Hernández, Josue Rarujo - Noche En Vela (Vídeo Oficial)",OBED HERNANDEZ Oficial,Music,"josuerarujo, obed, los yakys, te querio, elrarujo, josue, obedyakys, Obed Hernandez, Obed Hernandez Mentio, Obed Fermandez Mentío, Obed Hernandez x Josue Rarujo Mentío, Obed Hernandez x Josue Rarujo Mentio, mentío, mentio, josue rarujo, josue rarujo quiera dios, josue rarujo 2024, josue rarujo el corazón mío te llora, josue rarujo nos dejó, josue rarujo traiciones, josue rarujo tu amor es mio, josue rarujo miedo al amor, rarujo el corazón, rarujo el corazon, mentío obed x rarujo",239,hd,False,False,61897,1514,36
Fv0leN8TmR8,2025-12-07 00:00:04+00:00,The Boys - Final Season Teaser Trailer | Prime Video,Prime Video,Entertainment,"the boys, the boys season 5, the boys s5, the boys season 5 trailer, the boys season 5 teaser, the boys s5 trailer, the boys s5 teaser, the boys soldier boy, the boys homelander, the boys butcher, homelander, butcher, soldier boy, starlight, hughie, homelander vs butcher, butcher vs homelander, homelander vs soldier boy, the boys final season, the boys final season trailer, antony starr, karl urban, jensen ackles, erin moriarty, jack quaid, karen fukuhara, chace crawford",121,hd,True,True,2086452,145988,8730
kMuHG70RMbQ,2025-12-06 15:33:32+00:00,gg,AlphaSniper97,Entertainment,"call of duty, activision, cod, alphasniper, alphasniper97, alphasniper polemica, alphasniper97 polemica, polemica alphasniper, polemica alphasniper97",2901,hd,False,True,92362,7540,1454
SixTbTc6YCg,2025-12-05 17:00:06+00:00,"Ice Spice, Tokischa - Thootie",IceSpiceVEVO,Music,"Ice Spice, Tokischa, 10K Projects/Capitol Records, Hip Hop",153,hd,True,True,867612,66736,3237
pROx0N1gHwE,2025-12-04 02:31:23+00:00,La Reina del Flow 3 | Tráiler Oficial - Muy Pronto,Caracol Televisión,Entertainment,"Caracol Tv, Caracol Televisión, Caracol en vivo, Programas Caracol, caracol televisión, caracol tv, la reina del flow 3 trailer, la reina del flow 3 trailer oficial, LRDF 3 trailer, la reina de l flow 3 avance, la reina del flow 3 nueva temporada, la reina del flow nueva temporada, la reina del flow 3 temporada",201,hd,False,True,334336,11189,502
q_JuxAy4v8g,2025-12-05 16:57:08+00:00,DESMENTÍ 77 MITOS DEL CAPITULO 7 DE FORTNITE,Hiper,Gaming,"fortnite, fortnite og, fornait, fornite, epic, epic games, hyper, hiper, skin, top 10, skins, estereotipos, esteriotipos, eseriotipos, mitos, mito, problemas, isla, resumen, mítica, mapa, creativo, minijuegos, meme, evento, event, marvel, retos, logros, mitos hiper, simpsons, homero, homer, capitulo 7, zero hour, kill, bill, capitulo 7 hiper, pacific break, regreso al futuro, back to the future, volver al future, mcfly, doc, brown, los siete, the seven, lore, TLR, lisa, 7.1, godzilla, kong, the rock, la roca",1563,hd,False,True,443781,10126,195
LEz_eHbD15w,2025-12-02 23:00:31+00:00,Beéle - si te pillara (LETRA),FlowVerso,Music,,184,hd,False,True,309145,223,3
fxZAU2fHwZ8,2025-12-04 21:58:19+00:00,El Caballero de los Siete Reinos | Tráiler Oficial | HBO Max,HBO Max Latinoamérica,People & Blogs,"HBOMAX, hbo max, max, delcineatucasa, hbo, hbo originals, hbo max originals, particual crowd, peliculas, series, movie, serie, trailer, teaser, episodios",141,hd,False,False,93443,3566,248
hCssW9N0vRo,2025-12-06 16:01:12+00:00,APRENDI A JUGAR EL CABALLERO HEROE🤑,BENIJU,Gaming,"Clash Royale, Clash Royale Español, BENIJU, beniju, subir copas, guia de mazos, mejores mazos, beniyu, bniju, benju, TV ROYALE, TV ROYALE EN ESPAÑOL, JEFA BANDIDA, VERDUGO EVO, NUEVA EVO, NUEVA ACTU, CLASH ACTU, ken, tv royale, tv royale en español, nueva carta, nueva evo, modo ranked",1168,hd,False,True,303650,17035,530
oFgRyq6ZRLg,2025-12-04 12:00:06+00:00,"HAZE - BLANCA NAVIDAD ft. BUBY, BELÉN PEÑA [Prod. by RAÚL NADAL]",HAZE,Music,"HAZE, RAP, FLAMENCO, URBANO, SEVILLA, haze, blanca navidad, navidad, blanca navidad haze, haze blanca navidad, buby, belen peña, raul nadal, buby navidad, belen peña navidad, prod raul nadal, raul nadal navidad, feliz navidad, ophion",198,hd,False,True,84054,4605,449
avtunpP2a9M,2025-12-04 00:00:01+00:00,El Gran Diluvio | Tráiler oficial | Netflix,Netflix Latinoamérica,Entertainment,"Corea del Sur, El Gran Diluvio, Kim Da-mi, Netflix, Park Hae-soo, SF, The Great Flood, acción, blockbuster, catástrofe, ciencia ficción, desastre, diciembre, director Kim Byung-woo, estreno, nuevo lanzamiento, películas coreanas, sci-fi, taquillazo, una película de Netflix",124,hd,False,False,553863,5231,175
IPo2_ktgK_k,2025-12-07 00:05:30+00:00,AHORA! 🎄 ACTUALIZACIÓN NAVIDAD🎅🏼😰 +15 NUEVOS BRAINROTS🎄 | EN VIVO🔴,Jugando Con Nachito,Gaming,,16395,hd,False,True,1266105,16180,38
dDwoyrVcbEo,2025-12-05 06:00:06+00:00,Alex Torres X Luis R Conriquez X Anuel AA - Por Si Se Les Olvidaba (REMIX) [Video Oficial],Alex Torres,Music,"alex torres, alex torres oficial, alex torres musica, alex torres videos, regional mexicano, sierreño, música mexicana, luis r conriquez, anuel aa, por si se les olvidaba, por si se les olvidaba remix, alex torres por si se les olvidaba remix, alex torres por si se les olvidaba remix video, alex torres por si se les olvidaba remix video oficial, alex torres por si se les olvidana remix oficial, luis r conriquez oficial, luis r conriquez musica, luis r conriquez canciones",179,hd,False,False,828551,46988,2196
IS5sF_m-Ghk,2025-12-06 16:36:48+00:00,Série : DEBBO - Épisode 17 - Bande annonce,Marodi TV Sénégal,Entertainment,"Séries, Série, télévisions, sénégal, séries sénégalaises, marodi tv, Marodi, séries africaines, mbarodi, vidéos sénégal, karma, maitresse, pod et marichou, decheance, virginie, emprises, credule, baabel, kay&za",73,hd,False,True,40465,2671,19
BlfNwNc4_4k,2025-12-05 18:57:34+00:00,👁 MI PRIMERA VEZ JUGANDO EL CAPÍTULO 7 DE FORTNITE (junto a la ratita 🐀),Auron,Gaming,"Auron, AuronPlay",2966,hd,False,True,286830,12966,329
tX1HXolYQ5o,2025-12-03 19:58:07+00:00,Cyril Kamer - Annabelle (Video Oficial),Cyril Kamer,Music,"Jul, Afro, Trap, Cyril, Kamer, CyrilKamer, Omar, Montes, OmarMontes, RVFV, JC REYES, SAIKO, MORAD, BENYJR, MDLR, 22 LOS REBELDES, Cinderella, Zendaya, Thalia, lOCO, QUEVEDO, MORA, FEID, DEIV, HADES66, AFRO ESPAÑA, KG970, PATRON970, KIDDKEO, JUL, VEGEDREAM, NISKA, GAZO, AIMANJR, clarent, sch, bad gyal, quevedo, yapi, alu",162,hd,False,True,122450,8332,314
e1aPolJj3jI,2025-12-06 21:35:10+00:00,"Increíble nueva escena de Capitán América y post créditos Endgame antes de Doomsday, Netflix Warner",Pelicomic,Entertainment,,974,hd,False,True,120537,7792,704
gIiR8S0veu4,2025-12-05 17:30:28+00:00,¿Cuánto sabes de Minecraft? Mikecrack y ElRichMC,ElRichMC - Minecraft & Gaming a otro nivel,Gaming,"ElRichMC, ElRich, Rich, MC, Minecraft, videogame, gameplay, comentado, español, spanish, mikecrack, mike y rich, mikecrack y elrichmc",5360,hd,False,True,164354,19267,1147
ZbLY8C1xw14,2025-12-04 23:00:07+00:00,Estopa - VILLA & ZIKO (Video Oficial),EstopaVEVO,Music,"Cheerful, Estopa, Happy, Latin Christmas, Navidad, Single, Upbeat, VILLA ZIKO, Villancicos, Wild",171,hd,False,True,87780,5149,213
IaEtA56pd_w,2025-12-05 20:48:18+00:00,Iron Lung: Final Trailer,Markiplier,Gaming,"markiplier, iron lung, iron lung movie, official trailer, movie trailer, iron lung trailer 3, final trailer, iron lung release date, iron lung markiplier, Caroline Kaplan, troy baker",105,hd,False,False,2670923,379148,18476
6EK5VaKsAoQ,2025-12-06 16:45:13+00:00,ATRAPADOS EN UNA PIZZERIA MALDITA | Roblox *con Rafa*,Iker Unzu,Gaming,"iker unzu, iker tiktok, iker unzu tiktok, iker, comedia, sketches de comedia, iker comedia, Roblox, FNAF, Chuck E Cheese, Pizzeria, Rafa Lambarri",1222,hd,False,True,211902,10741,1318
OfpaUiaSNoc,2025-12-05 00:00:06+00:00,"Carla Morrison, Pablo Alborán - Si Te Quedas (Official Video)",CarlaMorrisonVEVO,Music,"carla morrison, pablo alboran, carla morrison pablo alboran, si te quedas carla morrison, si te quedas letra carla morrison pablo alboran, carla morrison 2025, pop latino 2025, pablo alboran 2025, Carla Morrison Pablo Alborán, Latin Pop, Loving, Si Te Quedas",177,hd,False,True,339173,22344,822
b-yiTAKbCKc,2025-12-04 22:00:47+00:00,"Warhammer 40,000: Dawn of War IV Story Trailer | Warhammer",Warhammer,Gaming,"Games Workshop, Citadel Miniatures, Warhammer Age of Sigmar, Warhammer 40000, Forge World, Black Library, 40K, AoS, GW, Astartes, Space marine, Tow, The Old world, Middle earth strategy battle game, lord of the rings, the hobbit, warhammer underworlds, necromunda, the horus heresy, legions imperialis, age of darkness, total war, space marine, space marine 2, Warhammer Fantasy",144,hd,True,False,792680,45238,3452
rWLzPZ5bxBk,2025-12-06 22:15:23+00:00,👽ADMIN👽ABUSE👽VOLVEMOS👽NORMALIDAD👽VIDEO👽MRBEAST👽,ElAbrahaham,Entertainment,,13079,hd,False,True,1277297,52414,419
AJafSQWPnnA,2025-12-04 23:00:06+00:00,"JUSEPH, SAIKO | FELINASS (Video Oficial) | LOS DEL GLAMOÜR",Juseph,Music,"juseph, juseph 2024, juseph videoclip, saiko, felinas, felinass, felinasss, saiko felinas, juseph felinas, los del glamour, glamour, juseph saiko, saiko juseph, lpdgc",194,hd,False,True,49686,3615,136
qFKhUJTnC-E,2025-12-04 16:44:01+00:00,Total War: MEDIEVAL III - Announce Trailer,Total War,Gaming,"Total War, warhammer, total war warhammer, rome total war, warhammer 2 total war, total war rome 2, medieval total war, medieval total war 2, three kingdoms total war, total war gameplay, shogun 2 total war, total war saga, total war warhammer gameplay, 3 kingdoms, new, gameplay, trailer, warhammer 3, total war warhammer 3, Total War PHARAOH, pharaoh, total war deep dive, deep dive, gameplay showcase, total war gameplay showcase",94,hd,True,False,541521,36012,5579
kC965pAuWAE,2025-12-06 21:45:02+00:00,No le vendas NADA a los DOPPELNGANGERS❗️,Miguelillo_RL,Gaming,"RANDOMLIFE, RANDOM LIFE, randomlaif, randomlive, random life, miguelillo, miguelillo directo, cencia, miguelillorl, ramon life, ramonlife",1979,hd,False,True,53096,4243,256
2yGZPCjtGJ8,2025-12-05 00:00:08+00:00,Paulo Londra - 1% (feat. Eladio Carrión) [Official Video],Paulo Londra,Music,"Paulo Londra, Eladio Carrión, Eladio Carrion, Boxeo, Laveladadelaño, Paulo Londra nuevo video, Eladio Carrión nuevo tema, Paulo Londra videoclip oficial, latin trap, trap latino, urban latin, hip hop latino, rap latino, reggaeton trap, música urbana, Bad Bunny, Anuel AA, Myke Towers, Feid, Duki, Nicki Nicole, Trueno, Bizarrap, YSY A, Neo Pistea, Tiago PZK, Cazzu, Rauw Alejandro, J Balvin, Karol G, Mora, Quevedo, Nicky Jam, Ñengo Flow, Arcángel, Young Miko, milo j",244,hd,False,True,841696,96948,4865
8cnxm6_G8D0,2025-12-07 00:10:49+00:00,THE BOYS Temporada 5 Tráiler Español Latino (2026),ONE Media Español,Film & Animation,"Tráiler, Película, Español, Latino, 2026, The Boys, The Boys temporada 5, The Boys temporada 5 Tráiler, Homelander, Butcher, Final",130,hd,False,True,141672,10559,908
_L5NTP2hviE,2025-12-05 22:46:51+00:00,Usé SUERTE INFINITA en 2 FILAS de COMIDA VS BEBIDA en Steal a Brainrot,SoyNeto,Gaming,"roblox, steal a brainrot, brainrot, roba un brainrot, brainrot roblox, brainrot secreto, base brainrot, soyneto, nueva base, flex roblox, 2 FILAS ADMIN, SERVER ADMIN STEAL A BRAINROT, 2 PASARELAS STEAL A BRAINROT, HACKS STEAL A BRAINROT, TRUCOS STEAL A BRAINROT",1953,hd,False,True,895013,7791,709
jps8cu_z2x4,2025-12-02 18:11:00+00:00,Marc Anthony - Vivir Mi Vida (Letra),Kintsugi Sonar,Music,"Marc Anthony Vivir Mi Vida Letra, Marc Anthony Vivir Mi Vida, Marc Anthony Vivir Mi Vida Lyrics, Vivir Mi Vida, Vivir mi vida letra, letra vivir mi vida, vivir mi vida lyrics, lyrics vivir mi vida, letra marc anthony vivir mi vida, lyrics marc anthony vivir mi vida, vivir mi vida letra marc anthony, marc anthony letra, letra marc anthony, marc anthony letra video, latin letra, latin lyrics, latin songs, musica latina, latin music, latin hits, viral, viral hits, viral songs",253,hd,False,True,57541,74,3
EOMVXqH9DSg,2025-12-06 16:00:33+00:00,Frieren: Beyond Journey's End Season 2 | Official Trailer 2 | Crunchyroll,Crunchyroll,Film & Animation,"frieren, frieren anime, beyond journey's end, fantasy anime, elf anime, frieren season 2, frieren s2, frieren 2nd season, crunchyroll, anime, anime preview, anime trailer, anime pv",111,hd,False,True,188998,16907,697
popKvtrgDBc,2025-12-05 19:43:34+00:00,Volví a competir en Fortnite después de AÑOS,Peereira7,Gaming,"heretics peereira, fortnite arena, peereira, peereira7, peereira fortnite, peereira7 fortnite, pepe fortnite, peereira7 fncs, pereira7 fncs, fortnite, reaccionando, pereira, pepe, heretics, peereira reacciona",899,hd,False,True,65960,2337,27
iTTBqm6rVRs,2025-12-02 01:48:24+00:00,Labios Compartidos - Maná (Letra/Lyrics),Rock Soul,Entertainment,"Labios Compartidos, Maná, Labios Compartidos Maná, Labios Compartidos letra, Labios Compartidos lyrics, Maná letra, Maná lyrics, rock latino, rock en español, pop rock, Maná hits, música romántica, canción icónica, Maná oficial, canción para dedicar, música en español, Musicana, rock mexicano, balada rock, música legendaria, rock clásico latino, canción nostálgica, éxitos de Maná, himnos del rock, música para enamorados, baladas poderosas, Maná en vivo",316,hd,False,False,592349,758,5
rSGr5yiHegk,2025-12-06 22:35:14+00:00,🎄 HOY ES EL GRAN DIA!!! 🎄 ADMIN ABUSE CON NUEVA MAQUINA DE NAVIDAD!!! SERÁ LA MEJOR?? 🔴 DIRECRTO 🔴,SAMU Juega,Gaming,,17231,hd,False,True,195898,1662,26
nrHvV1DD5yw,2025-12-03 22:24:01+00:00,"ZETAK – ""Aralarko Dama"" (La Revuelta – 2025) HD",RTVE Música,Music,"RTVE, Musica, RTVE Musica, canal, actuacion, directo, videos",203,hd,False,True,114826,2517,338
Gpz_oWbfhLc,2025-12-05 16:00:28+00:00,Mi Primer Tren - Ingeniero Descubre Create Mod Dia 12,Rubik,Gaming,"Minecraft, Redstone, Rubik",1423,hd,False,True,114522,10576,228
n6Dl684PiIE,2025-12-04 23:00:06+00:00,”ESTRELLES” – MAX NAVARRO,Operación Triunfo Oficial,Entertainment,"estrelles, single, jmax navarro, single max, single max navarro, ot2025, operación triunfo, ot, ot 2025, ot25, prime video",200,hd,False,True,47092,4541,405
m9kxfDPadJY,2025-12-05 19:53:11+00:00,JUGAMOS una TORRE TROLL de NAVIDAD en Roblox con Mandarina,Lyna,Gaming,,875,hd,False,True,613278,7265,616
X48WUb1c29Q,2025-12-05 00:00:05+00:00,"Juanka, Myke Towers - Santa Diabla REMIX",Juanka El Problematik,Music,,211,hd,False,True,492898,32873,654
V7wdMRFNaCk,2025-12-03 20:10:30+00:00,AAAAAAAAAAA,TheGrefg,Gaming,"mi primera victoria, capítulo 7, fortnite, mi skin, que se parece a, thegrefg, grefg",1451,hd,False,True,1046605,45515,1033
