video_id,country,fetched_at,published_at,title,localized_title,channel_title,channel_id,category_id,category_name,tags,tag_count,thumbnail,default_language,audio_language,is_live,duration,duration_raw,definition,caption_available,licensed_content,embeddable,made_for_kids,views,likes,comments
rd5K1zIhIt0,NP,2026-03-05T03:15:16.472588+00:00,2026-02-25T11:36:42Z,Sia - Cheap Thrills (Lyrics) ft. Sean Paul,Sia - Cheap Thrills (Lyrics) ft. Sean Paul,Aura Hype,UCHaspmMwQe-IFFYBdDvUHKA,10,Music,"hiphop, aurahype, cheap thrills, sia cheap thrills, cheap thrills sia, sia cheap thrills lyrics, cheap thrills sia lyrics, cheap thrills lyrics, lyrics cheap thrills, cheap thrills lyrics sia, sia lyrics cheap thrills, lyrics cheap thrills sia, lyrics sia cheap thrills, sean paul cheap thrills lyrics, sia - cheap thrills (lyrics) ft. sean paul, cheap thrills sean paul, sean paul cheap thrills, sia cheap thrills ft sean paul, sia cheap thrills ft sean paul lyrics",19,https://i.ytimg.com/vi/rd5K1zIhIt0/hqdefault.jpg,en,en-US,False,244,PT4M4S,hd,True,True,False,False,2760283,6616,42
0BPkVRdP-TU,NP,2026-03-05T03:15:16.472596+00:00,2026-03-03T07:04:09Z,EXTREME WOULD U RATHER CHALLENGE IN ROBLOX !!,EXTREME WOULD U RATHER CHALLENGE IN ROBLOX !!,Mini Reborn,UCsERfEVPXbtouwK8GLRtT5Q,20,Gaming,"eat a bodybuilder, bodybuilder, roblox, shivang mini, roblox hindi, gaming with shivang 2.0, roblox gaming, Shivang mini, eat your friend, roblox shivang mini, funny game roblox, roblox simulator, roblox online game, roblox games, mini reborn, tung tung tung sahur, WHATS INSIDE ESCAPE THE TSUNAMI FOR BRAINROT WATER IN ROBLOX !!, escape tsunami for brainrots, ESCAPE SCARY OWNER SAMMY FOR BRAINROTS IN ROBLOX !!, EXTREME WOULD U RATHER CHALLENGE IN ROBLOX !!",20,https://i.ytimg.com/vi/0BPkVRdP-TU/hqdefault.jpg,en,hi,False,850,PT14M10S,hd,False,True,False,False,277772,8306,4663
kYKbMJHvo2M,NP,2026-03-05T03:15:16.472604+00:00,2026-02-26T14:47:13Z,Baiguni,Baiguni,Kehar Sing Limbu - Topic,UCrnPzR3pd0Y7HiMBRqd6VHA,10,Music,"Kehar Sing Limbu, Baiguni",2,https://i.ytimg.com/vi/kYKbMJHvo2M/hqdefault.jpg,en,ne,False,313,PT5M13S,hd,False,True,False,False,33943,320,3
SYmL9O0sDjo,NP,2026-03-05T03:15:16.472611+00:00,2026-03-03T10:32:11Z,We Built a SECRET BASE Inside a VILLAGER'S LEGS!,We Built a SECRET BASE Inside a VILLAGER'S LEGS!,Flame playz,UCW3Sbu9ZFb2g2thct6mZlXA,20,Gaming,"#minecraft, #gaming, #Flameplayz, minecraft funny video, mc flame, mc flame minecraft, Minecraft But You Can Go Inside VILLAGER'S LEG !, house inside villager's leg, villager leg house, house inside villager, minecraft villager, kartik and gauri house inside leg, kartik and gauri inside villager, kartik and gauri inside villagers leg, mcflame inside villagers leg, flameplayz inside villagers leg",16,https://i.ytimg.com/vi/SYmL9O0sDjo/hqdefault.jpg,en,hi,False,955,PT15M55S,hd,False,True,False,False,380623,3550,160
l1pHRTFkKKs,NP,2026-03-05T03:15:16.472618+00:00,2026-02-20T06:30:06Z,Navjot Ahuja - Khat (Lyrics),Navjot Ahuja - Khat (Lyrics),Indie India,UC2VdyYW39rxCLA8jr8hEzkg,22,People & Blogs,"Khat, Khat Lyrics, Khat Song, Navjot Ahuja Khat, Khat Navjot Ahuja, Tere liye mandir jaaun, Tere naam ka dia jalaaun, Hasta rahe tu chaahe jo ho, Tеri hasi ko nazar na lage, Navjot Ahuja Khat Lyrics, Khat Navjot Ahuja Lyrics, Navjot Ahuja Lyrics Khat, Khat Lyrics Navjot Ahuja, navjot ahuja - khat, khat, khat lyrics, khat song, navjot ahuja khat, khat navjot ahuja, navjot ahuja khat lyrics, khat navjot ahuja lyrics, navjot ahuja lyrics khat, khat lyrics navjot ahuja, Indieindia",24,https://i.ytimg.com/vi/l1pHRTFkKKs/hqdefault.jpg,id,hi,False,297,PT4M57S,hd,False,False,False,False,856028,9449,124
_fgaf5otNwY,NP,2026-03-05T03:15:16.472626+00:00,2026-02-26T11:56:56Z,4 Idiots Survive Horror One Block!,4 Idiots Survive Horror One Block!,MrJadoo,UCThBL2wId-gef5Gjfrlw4vQ,20,Gaming,"Minecraft, 4 Idiots Survive Horror One Block, scary, trolling, minecraft horror, funny, mimicer, mrjadoo, imtiyano, yug plays, rodieeno, We Played ONE BLOCK With Every Horror Mod in Minecraft",12,https://i.ytimg.com/vi/_fgaf5otNwY/hqdefault.jpg,en-IN,hi,False,1304,PT21M44S,hd,False,True,False,False,903801,36786,799
x0aMsjhFxeE,NP,2026-03-05T03:15:16.472633+00:00,2026-02-26T06:34:02Z,"Ram Ji Aake Bhala Karenge | Bhooth Bangla | Akshay Kumar | Pritam,Armaan Malik,Aarvan,Kumaar,MellowD","Ram Ji Aake Bhala Karenge | Bhooth Bangla | Akshay Kumar | Pritam,Armaan Malik,Aarvan,Kumaar,MellowD",Zee Music Company,UCFFbwnve3yF62-tVXkTyHqg,10,Music,"ram ji aake bhala karenge, ramji aake bhala karenge, ramji aakar bhala karenge, bhooth bangla movie song, akshay kumar bhoot song, bhooth bangla song, akshay kumar song, akshay kumar new song, akshay kumar dance, armaan malik new song, bhoot bangla, new hindi song, new bollywood song, latest bollywood song, latest hindi song, new trending song, pritam new song, akshay kumar new movie, ramji bhala karenge, new dance song, padho chalisa re, new party song, bhooth bangla",23,https://i.ytimg.com/vi/x0aMsjhFxeE/hqdefault.jpg,en,hi,False,248,PT4M8S,hd,False,True,False,False,29901598,360865,42986
GJtYMCI43OQ,NP,2026-03-05T03:15:16.472640+00:00,2026-02-25T09:00:00Z,GRANNY TRAPPED MOTU PATLU IN INDIAN BIKE DRIVING 3D,GRANNY TRAPPED MOTU PATLU IN INDIAN BIKE DRIVING 3D,Vamp Plays,UCBeAbD9rRJ_YhMli7bEH9tQ,24,Entertainment,"Indian bike driving 3d, Motu patlu, Motu patlu in indian bike driving 3d, Granny in indian bike driving 3d, Granny house escape, Granny 3, Escape, Horror games, Vamp plays",9,https://i.ytimg.com/vi/GJtYMCI43OQ/hqdefault.jpg,en,hi,False,1519,PT25M19S,hd,False,True,False,False,1853706,14418,321
TCiBcWeCG9A,NP,2026-03-05T03:15:16.472647+00:00,2026-02-15T03:15:07Z,VTEN - TIMI NAI HAU (OFFICIAL VIDEO),VTEN - TIMI NAI HAU (OFFICIAL VIDEO),VTEN MUSIC,UCwG0lJH9Uusnb1BfEbYbdcQ,10,Music,,0,https://i.ytimg.com/vi/TCiBcWeCG9A/hqdefault.jpg,en,en-US,False,396,PT6M36S,hd,False,False,False,False,815079,63528,2649
zCv9e8_edsc,NP,2026-03-05T03:15:16.472654+00:00,2026-03-04T21:41:24Z,"13 minutes ago, a Russian Su-57 pilot destroyed a US aircraft carrier carrying 100 fighter jets.","13 minutes ago, a Russian Su-57 pilot destroyed a US aircraft carrier carrying 100 fighter jets.",USMC CUNGUR,UCIZxu8WBqOgOubFrEf-30Zw,20,Gaming,"#Milsim jav, Arma 3 gameplay, millitary simulation, fighter jet shot down, missile, milsim, mil sim, bayraktar tb2, tank, missile system, anti-air, stinger missile, drone, artillery, russian army, ukraine army, anti-tank, Arma 4, Arma 3, Arma reforger, us army, convoy, Arma 3 ukraine, Arma 3 russian, cram, Tank Elit, javelin, AFFU WARRIOR, USMC, LRR, RAV, UWC",32,https://i.ytimg.com/vi/zCv9e8_edsc/hqdefault.jpg,en,en,False,42896,PT11H54M56S,hd,False,True,False,False,2954982,15869,20
8BeX2hxweQw,NP,2026-03-05T03:15:16.472662+00:00,2026-02-25T22:04:31Z,मंदिर के सीढ़ी चढ़ चढ़ मांगू 🙏— Mandir Ki Sidhi Chad Mangu Full Song 💖|  Ek Mulakat Jaruri Hai Sajan,मंदिर के सीढ़ी चढ़ चढ़ मांगू 🙏— Mandir Ki Sidhi Chad Mangu Full Song 💖|  Ek Mulakat Jaruri Hai Sajan,Records Tune,UCGLsVkbb7PCmN8R8WfRmPag,10,Music,"mandir ke sidhi chadh chadh mangu, ek mulakat jaruri hai sajan, ek mulakat jaruri hai sanam lyrics, मंदिर के सीढ़ी चढ़ चढ़ मांगू, ek mulakat jaruri hai sanam new version, मंदिर के सीढ़ी चढ़ चढ़ मांगू ek mulakat jaruri hai, ek mulakat jaruri hai instagram songs, mandir ki sidi chad chad mangu ringtone, mandir ke sidhi chadh chadh mangu playlists, mandir ke sidhi song playlists, mandir ke sidhi full song, mandir ke sidhi",12,https://i.ytimg.com/vi/8BeX2hxweQw/hqdefault.jpg,en-IN,hi,False,1258,PT20M58S,hd,False,True,False,False,231514,3040,94
