video_id,country,fetched_at,published_at,title,localized_title,channel_title,channel_id,category_id,category_name,tags,tag_count,thumbnail,default_language,audio_language,is_live,duration,duration_raw,definition,caption_available,licensed_content,embeddable,made_for_kids,views,likes,comments
2GJfWMYCWY0,NP,2026-03-05T03:15:16.472234+00:00,2026-02-27T05:00:07Z,BLACKPINK - ‘GO’ M/V,BLACKPINK - ‘GO’ M/V,BLACKPINK,UCOmHUn--16B90oW2L6FRR3A,10,Music,"YG Entertainment, YG, 와이지, K-pop, BLACKPINK, 블랙핑크, 블핑, 제니, 로제, 리사, 지수, LISA, JISOO, JENNIE, ROSÉ, BLINK, 블링크, JENNIE You & Me, JENNIE You and ME, You & Me, You and Me, 제니 You & Me, 제니 You and Me, 제니 유앤미, 유앤미, JENNIE 유앤미, 제니 코첼라, JENNIE COACHELLA",28,https://i.ytimg.com/vi/2GJfWMYCWY0/hqdefault.jpg,en,ko,False,202,PT3M22S,hd,True,True,False,False,38723433,3247782,270330
cXymbHU5i-U,NP,2026-03-05T03:15:16.472275+00:00,2026-02-20T04:05:00Z,Toxic Official Hindi Teaser | Rocking Star Yash | Geetu Mohandas | KVN | Monster Mind Creations,Toxic Official Hindi Teaser | Rocking Star Yash | Geetu Mohandas | KVN | Monster Mind Creations,KVN PRODUCTIONS,UC3DOgauBYLQQXdH1siGjfpw,1,Film & Animation,"Toxic, Toxic Movie, Toxic Teaser, Toxic Official Teaser, Toxic Yash, Yash Toxic, Rocking Star Yash, Yash New Movie, KVN Productions, Monster Mind Creations, Geetu Mohandas, Ravi Basrur, Ravi Basrur Music, Kiara Advani, Nayanthara, Huma Qureshi, Tara Sutaria, Rukmini Vasanth, Rocky Bhai, KGF, Yash Movie, Toxic Update, KGF 2, KGF 3, Raya from Toxic, Toxic A Fairy Tale, Daddy's Home, Toxic Dialogue, Daddy is Home, KVN, KFI, Introducting Raya, Toxic Hindi, Toxic hindi Teaser",34,https://i.ytimg.com/vi/cXymbHU5i-U/hqdefault.jpg,en,hi,False,116,PT1M56S,hd,True,True,False,False,21057091,483857,23445
dtUHmLQoehc,NP,2026-03-05T03:15:16.472287+00:00,2026-03-02T09:35:50Z,Minecraft but We Gain 1 BILLION Hearts..!,Minecraft but We Gain 1 BILLION Hearts..!,Carry Depie,UClqifC6Nd7v-IfTqce4k62A,20,Gaming,"carry depie, minecraft",2,https://i.ytimg.com/vi/dtUHmLQoehc/hqdefault.jpg,en,hi,False,1092,PT18M12S,hd,False,True,False,False,1640226,17504,803
OW0zhR5xtlE,NP,2026-03-05T03:15:16.472296+00:00,2026-02-28T11:30:13Z,"Balam Pichkari 8K Full Video | Yeh Jawaani Hai Deewani | Pritam | Ranbir,Deepika |Non Stop Holi Song","Balam Pichkari 8K Full Video | Yeh Jawaani Hai Deewani | Pritam | Ranbir,Deepika |Non Stop Holi Song",T-Series,UCq-Fj5jknLsUf-MWSy4_brA,10,Music,"hindi songs 2026, hindi songs new, bollywood songs 2026, bollywood movies 2026, tseries, tseries songs, hindi songs, balam pichkari song, holi songs, balam pichkari dance jo tune mujhe mari, yeh jawani hai deewani songs, holi balam pichkari, balam pichkari full song, holi ke gana, balam pichkari full video song, holi ke gane, balam pichkari dance, ranbir kapoor balam pichkari, balam pichkari song dance, holi songs hindi, non stop holi song, balam pichkari song dj, holi song",23,https://i.ytimg.com/vi/OW0zhR5xtlE/hqdefault.jpg,ms,hi,False,260,PT4M20S,hd,False,True,False,False,2800048,18158,620
oq4ngKNJg7w,NP,2026-03-05T03:15:16.472305+00:00,2026-02-21T02:30:48Z,JETHANI KI ARRANGE MARRIAGE DEVRANI KI LOVE MARRIAGE BHOJPURI OFFICIAL TRAILER | SMRITY SINHA,JETHANI KI ARRANGE MARRIAGE DEVRANI KI LOVE MARRIAGE BHOJPURI OFFICIAL TRAILER | SMRITY SINHA,B4U Bhojpuri,UCIobY5Y-ly9Bo458yjy36OQ,1,Film & Animation,"jethani, devrani, devrani jethani, jethani devrani, arrange marriage, love marriage, bhojpuri trailer, new bhojpuri trailer, love marriage devrani arrange marriage jethani, smrity sinha, jethani arrange marriage, devrani love marriage, family stories, bhojpuri movie",14,https://i.ytimg.com/vi/oq4ngKNJg7w/hqdefault.jpg,en,bh,False,294,PT4M54S,hd,False,True,False,False,2763299,12425,106
FifX7V6y-Nc,NP,2026-03-05T03:15:16.472313+00:00,2026-03-02T13:55:17Z,Shinchan Birth To Death 😰,Shinchan Birth To Death 😰,Tyro Gaming,UCIpN4Y3Pt00Q9KoQMWI77_Q,20,Gaming,"Shinchan Birth To Death 😰, junkeyy, Shivang mini, Shinchan game, Doraemon Game, Nobita Game, Shinchan in hindi, Shinchan Gaming, Frostbite Gaming, VeryNuclear, Rock Indian Gamer, Amaan-T, Flight Gamer, Carry Depie, Proboiz, Tyro Gaming, Proboii, Taro gaming, Funny Game Roblox, Doraemon New Episode, Shinchan New Episode, Shinchan Age 1 to 100, Roblox Birth To Death",23,https://i.ytimg.com/vi/FifX7V6y-Nc/hqdefault.jpg,en,hi,False,681,PT11M21S,hd,False,True,False,False,1170839,8114,426
dmRSdYSalmU,NP,2026-03-05T03:15:16.472322+00:00,2026-02-21T22:10:41Z,Lamjunge Dadaima Hawa Sarara (Blues),Lamjunge Dadaima Hawa Sarara (Blues),AI CORE MUSIC - Topic,UCeVnUhbX_N_hbxhZpnXHO4A,10,Music,"Ai core music, Lamjunge Dadaima Hawa Sarara (Blues)",2,https://i.ytimg.com/vi/dmRSdYSalmU/hqdefault.jpg,su,ne,False,318,PT5M18S,hd,False,True,False,False,155080,776,12
DXSacpfPgec,NP,2026-03-05T03:15:16.472329+00:00,2026-02-27T10:15:02Z,"LAALIMAA || Movie Trailer || Roshni Karki, Usha Rajak, Sushma, Jiban Bhattarai, Shishir Wangdel","LAALIMAA || Movie Trailer || Roshni Karki, Usha Rajak, Sushma, Jiban Bhattarai, Shishir Wangdel",OSR Digital,UCxCoea3ulOukfXiYAm87ZIA,1,Film & Animation,"OSR Digital, Nepali Movie, new movie teaser, nepali movie teaser, new nepali movie teaser 2026, nepali movie promo, laalimaa movie teaser, laalimaa nepali movie, laalimaa teaser 2026, nepali movie 2026, nepali film trailer, nepali cinema 2026, upcoming nepali movie, nepali movie official trailer, roshni karki movie, usha rajak movie, sushma niraula movie, krishna bhakta maharjan movie, laalimaa official trailer, laalimaa trailer, laalima movie trailer",21,https://i.ytimg.com/vi/DXSacpfPgec/hqdefault.jpg,en,en,False,167,PT2M47S,hd,False,True,False,False,159423,1746,48
TCd1ZpzohyU,NP,2026-03-05T03:15:16.472337+00:00,2026-03-02T11:53:07Z,Poor vs Rich Village Mayor Battle in Minecraft..,Poor vs Rich Village Mayor Battle in Minecraft..,Karry Kraft,UCW3Ms3ZxVaZUniP-HifWCDg,20,Gaming,"carry depie, minecraft",2,https://i.ytimg.com/vi/TCd1ZpzohyU/hqdefault.jpg,en,en-IN,False,548,PT9M8S,hd,False,True,False,False,898565,14825,464
nWKGsmnLOgs,NP,2026-03-05T03:15:16.472344+00:00,2026-02-25T10:15:05Z,Thodi Der -Full Video | Half Girlfriend | Arjun Kapoor & Shraddha Kapoor | Farhan S & Shreya Ghoshal,Thodi Der -Full Video | Half Girlfriend | Arjun Kapoor & Shraddha Kapoor | Farhan S & Shreya Ghoshal,Soulful Shreya Ghoshal Songs,UCfeUn1eolEyTVawjzEhx96Q,10,Music,"Bollywood Songs, Bollywood Hindi Songs, Romantic Bollywood Songs, Hindi Romantic Songs, Shreya Ghoshal Songs, Soulful Shreya Ghoshal Songs, Shreya Ghoshal Romantic Songs, Shreya Ghoshal Music Video, Shreya Ghoshal, Shreya Ghoshal Bollywood Songs, Romantic Sad Songs, Sad Romantic Songs, Hindi Songs, Bollywood Hit Songs, Hit Songs, Farhan Saeed, Thodi Der Song, Thodi Der Full Video, Half Girlfriend Movie Songs, Arjun Kapoor Songs, Shraddha Kapoor Songs",21,https://i.ytimg.com/vi/nWKGsmnLOgs/hqdefault.jpg,en,hi,False,305,PT5M5S,hd,False,True,False,False,243165,784,4
hswVKUkbnNI,NP,2026-03-05T03:15:16.472352+00:00,2026-03-04T00:00:00Z,Bloodhounds 2 | Official Teaser | Netflix [ENG SUB],Bloodhounds 2 | Official Teaser | Netflix [ENG SUB],Netflix K-Content,UCpiCK8c6PBktcxq7Az_t4RQ,24,Entertainment,"April new release, BloodhoundsSeason2, Jung Ji-hoon, Lee Sang-yi, Netflix, Woo Do‑hwan, a Netflix drama, a Netflix series, action, boxing, crime, thriller, webtoon original, 넷플릭스, 사냥개들시즌2",15,https://i.ytimg.com/vi/hswVKUkbnNI/hqdefault.jpg,en,en-US,False,84,PT1M24S,hd,True,False,False,False,382790,21923,1187
c1UHHjmCHZQ,NP,2026-03-05T03:15:16.472360+00:00,2026-03-02T10:58:12Z,I TROLLED NOOBS USING CUSTOM ADMIN OWNER POWERS IN ESCAPE TSUNAMI FOR BRAINROTS !!,I TROLLED NOOBS USING CUSTOM ADMIN OWNER POWERS IN ESCAPE TSUNAMI FOR BRAINROTS !!,Shivang Mini,UCUgA8t4DaUt50fvL79oF5wA,20,Gaming,"roblox, shivang mini, roblox hindi, gaming with shivang 2.0, roblox gaming, Shivang mini, eat your friend, roblox shivang mini, roblox gym simulator, tung tung tung sahur, I CHEATED WITH REAL OWNER IN AN ESCAPE TSUNAMI FOR BRAINROT FLEX BATTLE !!, ESCAPE TSUNAMI FOR BRAINROTS BUT U CAN BUY BRAINROT SPEED !!, ESCAPING OWNER LAVE ICE TSUNAMI WAVE IN ESCAPE A TSUNAMI ROBLOX !!, I TROLLED NOOBS USING CUSTOM ADMIN OWNER POWERS IN ESCAPE TSUNAMI FOR BRAINROTS !!",14,https://i.ytimg.com/vi/c1UHHjmCHZQ/hqdefault.jpg,en,hi,False,930,PT15M30S,hd,False,True,False,False,534958,12708,22194
67DxZN6mg9g,NP,2026-03-05T03:15:16.472368+00:00,2026-02-13T20:37:57Z,Ek Mulakat Jaruri hai,Ek Mulakat Jaruri hai,Naga Navtra - Topic,UCil_HGhSVqX-zCZYLynTQFw,10,Music,"Naga Navtra, Paru Rabari, Ek Mulakat Jaruri hai",3,https://i.ytimg.com/vi/67DxZN6mg9g/hqdefault.jpg,ms,hi,False,370,PT6M10S,hd,False,True,False,False,3146922,17368,0
-sKjdYceH04,NP,2026-03-05T03:15:16.472375+00:00,2026-03-02T14:00:00Z,ONE PIECE: Season 2 | Final Trailer | Netflix,ONE PIECE: Season 2 | Final Trailer | Netflix,Netflix,UCWOA1ZGywLbqmigxE4Qlvuw,24,Entertainment,"Action, Chopper, Fantasy, Final, Grand Line, Hype, Launch, Live Action, Luffy, March 10th, Netflix, One Piece, Series, Trailer, Trailer 2, Wapol, Zoro",17,https://i.ytimg.com/vi/-sKjdYceH04/hqdefault.jpg,en,en-US,False,104,PT1M44S,hd,True,True,False,False,4611486,64153,3149
YOY_g9CyEco,NP,2026-03-05T03:15:16.472384+00:00,2026-02-26T11:41:22Z,I Trained Like a Parasite For 24 Hours in Minecraft!,I Trained Like a Parasite For 24 Hours in Minecraft!,ProBoiz 95,UCSncGB_s0tuWN-4l-58mmvQ,20,Gaming,"minecraft, parasite in minecraft, minecraft parasite, i trained like a parasite in minecraft, i became a parasite in minecraft, minecraft hindi, minecraft india, india minecraft, proboiz, proboiz 95",10,https://i.ytimg.com/vi/YOY_g9CyEco/hqdefault.jpg,en,en-IN,False,1310,PT21M50S,hd,False,True,False,False,2757503,45546,3946
iL6emjk4YCs,NP,2026-03-05T03:15:16.472391+00:00,2026-02-28T02:26:21Z,Nawaj Ansari - SUSTARI ft Dmriti (Official Music Video) Prod. BY Kila Music,Nawaj Ansari - SUSTARI ft Dmriti (Official Music Video) Prod. BY Kila Music,Nawaj Ansari,UCcTQqNP3v_mhO8UW9GAMx9w,10,Music,"Nawaj Ansari, Nawaj Ansari song, Nepali hip hop, Nephop, Nepal hip hop, Nepal rap, Nepali music video, Hip hop Nepal, Nepali rapper, Nepali hiphop song, Nepali music, Nawaj Ansari Nepali song, Nepali hiphop artist, Nepali rap music video, Nepal underground rap, Nepal music video Nawaj Ansari, Dhaka Topi Mailo, Maya, Bola Maya, Jeet, Samrajya, Emotional Rap, Nepali Lyrical Song, Nepali Real Rap, almoda, kafal, junkiri, soi soi, soy dhole, nepali folk song, babal, Dmriti, Sustari",33,https://i.ytimg.com/vi/iL6emjk4YCs/hqdefault.jpg,en,en-US,False,231,PT3M51S,hd,False,True,False,False,151611,11984,788
vT03DTvhMzY,NP,2026-03-05T03:15:16.472399+00:00,2026-03-03T07:21:23Z,Finally I Reach Grandmaster in Free Fire 😎 Tonde Gamer,Finally I Reach Grandmaster in Free Fire 😎 Tonde Gamer,Tonde Gamer,UCD5EC8IWhOFalXtePCkhJTA,20,Gaming,"free fire, garena free fire, tonde gamer, tonde new video, tonde, gaitonde, tgr gaitonde, solo vs squad, tonde solo vs squad, 1 vs 4, best gameplay, free fire hindi, ff hindi, free fire king, free fire gameplay, ajjubhai, total gaming, desi gamers, high level, highest kills, top 1, grandmaster, pro lobby, gold to grandmaster, tonde grandmaster, ff rank push, ff gameplay, free fire max, free fire india, rank push, region top 1, grandmaster top 1",32,https://i.ytimg.com/vi/vT03DTvhMzY/hqdefault.jpg,en-IN,hi,False,2080,PT34M40S,hd,False,True,False,False,449807,25414,1292
7PPQW-oUR3g,NP,2026-03-05T03:15:16.472407+00:00,2026-02-25T11:15:06Z,New Holi Song|| सरकार कैको नेपालमा(Sarkar Kaiko Nepalma)||JR Bhatta||Nagarjun Dinesh||Prakash Birahi,New Holi Song|| सरकार कैको नेपालमा(Sarkar Kaiko Nepalma)||JR Bhatta||Nagarjun Dinesh||Prakash Birahi,JR Bhatta,UCwftV2-X7HKs_5lcq-b8XhA,10,Music,"#jrbhatt, jrbhatta, #trending, jrbhattaofficial, chutti meri hunnach, jr bhatta new song, jr bhatta deuda battle, jr bhatta deuda, new deuda song 2081, bhetta aae mayalu syaulya bazar, chutti meri, chutti meri hunnacha, shanibar song, bhanubhakta joshi, Gauri Bhatta, gari bhatta new deuda song, Paisa, New Tiktok song, Viral Song, hori song, new holi song jr bhatta, nepal sarkar kaiko, sarkar kaiko nepalma, holi song deuda, holi song 2082, New Holi Song Nepali",26,https://i.ytimg.com/vi/7PPQW-oUR3g/hqdefault.jpg,en,ne,False,512,PT8M32S,hd,False,True,False,False,194405,4970,263
ZeUDCJSt9Ik,NP,2026-03-05T03:15:16.472415+00:00,2026-02-28T13:15:09Z,12 YouTubers in Same Lobby for the First Time! 🤯 25M+ Subs Overall💥,12 YouTubers in Same Lobby for the First Time! 🤯 25M+ Subs Overall💥,Zerox FF,UCk-EsqBq32A1pNpvz48vmqA,20,Gaming,"worldrecord, zerox, ugaayush, mobilesensitivities, sudipsarkar, tgrnrz, smooth444, nonstopgaming, ng, raistarnewvideo, awmgod, white444, trendinggaming, desigamers, ajjubhai, tgrgtk, gtk111, challengeking, daddycalling, aura, panel users, binzaid, controversy raistar",23,https://i.ytimg.com/vi/ZeUDCJSt9Ik/hqdefault.jpg,en,en,False,1019,PT16M59S,hd,False,True,False,False,346524,22172,885
L1Ya1permX8,NP,2026-03-05T03:15:16.472423+00:00,2026-03-03T12:30:07Z,Aaj Braj Mai Holi Re Rasiya | Hansraj Raghuwanshi | Holi Special Song 2026 | Radha Krishna Holi Song,Aaj Braj Mai Holi Re Rasiya | Hansraj Raghuwanshi | Holi Special Song 2026 | Radha Krishna Holi Song,Hansraj Raghuwanshi,UCigV1clokmoz4LZrGL9fRNw,10,Music,"aaj braj mai holi re rasiya, aaj braj mein holi re rasiya, hansraj raghuwanshi holi song, hansraj raghuwanshi new song, hansraj raghuwanshi bhajan, hansraj raghuwanshi songs, holi song, holi special song, new holi song 2026, latest holi song, holi ke gane, braj holi song, krishna holi bhajan, radhe krishna song, vrindavan holi, trending holi song, holi 2026 song, hansraj raghuwanshi shiv bhajan, hansraj raghuwanshi latest song, radha krishna bhajan, braj ki holi",21,https://i.ytimg.com/vi/L1Ya1permX8/hqdefault.jpg,en,hi,False,159,PT2M39S,hd,False,True,False,False,4974769,37014,1118
lgirXbUPXPY,NP,2026-03-05T03:15:16.472430+00:00,2026-02-26T10:24:39Z,I Changed My Name & Pranked A GIRL STREAMER,I Changed My Name & Pranked A GIRL STREAMER,SATVIK,UCWRmZvwkp6oNca2wW3uFcFg,20,Gaming,,0,https://i.ytimg.com/vi/lgirXbUPXPY/hqdefault.jpg,en,hi,False,1836,PT30M36S,hd,False,True,False,False,1396119,34552,3866
ETcRA2FaWS0,NP,2026-03-05T03:15:16.472438+00:00,2026-02-28T13:48:31Z,VEK X @swar5729 - SWAR | Prod by Pozod,VEK X @swar5729 - SWAR | Prod by Pozod,VEK,UCmJuOuIdn7XtQp3H_1DCy4g,10,Music,,0,https://i.ytimg.com/vi/ETcRA2FaWS0/hqdefault.jpg,en,ne,False,245,PT4M5S,hd,False,True,False,False,162176,13732,598
SwxPj7d61-o,NP,2026-03-05T03:15:16.472445+00:00,2026-03-01T07:31:01Z,Why I Became a SERIAL KILLER in This Minecraft SMP,Why I Became a SERIAL KILLER in This Minecraft SMP,SenpaiExtras,UCUkSBEJC33xb-WU-pRimdkg,20,Gaming,"senpaispider, senpaispider new video, senpaispider pvp, senpaispider edit, senpaispider minecraft, smartypie senpaispider, senpaispider face revel, senpaispider smarty pie, senpaispider wither storm, niz vs senpaispider, senpaispider lapatasmp, serial killer minecraft, apple mc, senpaispider smp, senpaispider token smp, senpaispider loyal smp, himlands, senpaispider himlands",18,https://i.ytimg.com/vi/SwxPj7d61-o/hqdefault.jpg,en,hi,False,3109,PT51M49S,hd,False,True,False,False,1505265,77192,5356
RsNNU1_wZzY,NP,2026-03-05T03:15:16.472453+00:00,2026-03-01T11:30:20Z,"HOLI MASHUP 2026 💥Ultra Viral Remix | Dilip Suthar ft. Mika s, Vikram M, Abhinav S, Abhi D |MK BLIVE","HOLI MASHUP 2026 💥Ultra Viral Remix | Dilip Suthar ft. Mika s, Vikram M, Abhinav S, Abhi D |MK BLIVE",BLive Music,UCZI9-cG-C-mAL5WkpqMh9og,10,Music,"Holi Mein Rangeele, Holi Party Songs 2026, Holi Pe Chale Goli, Non Stop Holi Songs 2026, Best Holi Songs Mix, Varun Sharma Holi Song, Akshara Singh Holi Song, New Holi Song 2026, Holi Mashup 2026, Holi Dance Hits, Bollywood Holi Songs, Trending Holi Songs 2026, Holi DJ Remix 2026, Holi Mein Rangeele DJ Shadow, blive music, blive music holi jukebox, holi special songs, holi party songs, holi ke gaane, Holi Songs Mashup, Mika Singh, Abhinav Shekhar, Abhi dutt, dilip suthar",24,https://i.ytimg.com/vi/RsNNU1_wZzY/hqdefault.jpg,en,hi,False,222,PT3M42S,hd,False,True,False,False,1765217,9232,141
rLyX-g54ag8,NP,2026-03-05T03:15:16.472460+00:00,2026-03-02T07:55:19Z,I Explored The Underworld Society in Himlands SMP in Minecraft,I Explored The Underworld Society in Himlands SMP in Minecraft,YesSmartyPie,UCZ9lCUhUOUrwqVJmfBkN92A,20,Gaming,"YesSmartyPie, Yes smarty pie, SmartyPie, Smarty pie, YesSmartyPie Skyblock, YesSmartyPie Minecraft, Minecraft YesSmartyPie, yessmartypie himlands, himlands, yessmartypie himlands new video, smartypie himland, himland world, minecraft world himland, HIMLANDS ENTITIES BIGGEST SECRET REVEALED, THE RISE OF A NEW ENTITY, himlands ep 37, himlands s7 ep 3, himlands season 7, I Explored The Underworld Society in Himlands SMP, himlands s7ep5",20,https://i.ytimg.com/vi/rLyX-g54ag8/hqdefault.jpg,en,hi,False,3949,PT1H5M49S,hd,False,True,False,False,1099974,91356,5658
ju029fe_Hlg,NP,2026-03-05T03:15:16.472468+00:00,2026-02-28T01:18:06Z,मंदिर के सीढ़ी चढ़ चढ़ मांगू💖Playlists — Mandir Ki Sidhi Full Song 🙏|  Ek Mulakat Jaruri Hai Sajan,मंदिर के सीढ़ी चढ़ चढ़ मांगू💖Playlists — Mandir Ki Sidhi Full Song 🙏|  Ek Mulakat Jaruri Hai Sajan,90s — Tune,UCVW5aAYZh_qiJ9sihPp1VUA,10,Music,"मंदिर के सीढ़ी चढ़ चढ़ मांगू, Mandir Ki Sidhi Playlists, mandir ki cd, mashup mandir ke sidi, सीढ़ी चढ़ चढ़ मांगू, bhakti geet hindi, 90s song mandir ki sidhi, playlist mandir ki sidhi song, ek mulakat zaruri hai sanam, mandir ki sidhi ka gana, mandir ki sidhi nonstop, mandir ki sidhi jukebox, alka yagnik songs, ek mulakat nonstop song, #oldsongremake",15,https://i.ytimg.com/vi/ju029fe_Hlg/hqdefault.jpg,en-IN,hi,False,3112,PT51M52S,hd,False,True,False,False,186051,2204,70
db-fpyGiZLA,NP,2026-03-05T03:15:16.472476+00:00,2026-02-21T03:30:24Z,MICHAEL GOT KIDNAPPED BY TOMMY VERCETTI | GTA 5 GAMEPLAY #165,MICHAEL GOT KIDNAPPED BY TOMMY VERCETTI | GTA 5 GAMEPLAY #165,Techno Gamerz,UCX8pnu3DYUnx8qy8V_c6oHg,20,Gaming,"GTA, GTA 5, GTA ONLINE, PC, gta 5 gameplay, gta v hindi gameplay, gta 5 funny moments, gta 5 wins, gta 5 lamborghini, gta 5 stealing supercar, gta 5 stunts, gta 5 thug life, grand theft auto v, gta v online, gta 5, gta 5 epic moments, gta v funny moments, awesome gta 5 stunts, best moments, techno gamerz, ujjwal",21,https://i.ytimg.com/vi/db-fpyGiZLA/hqdefault.jpg,en,en-IN,False,2839,PT47M19S,hd,False,True,False,False,14312331,995816,283402
8rzOeHj_GnI,NP,2026-03-05T03:15:16.472484+00:00,2026-02-28T03:30:57Z,Kavi G X Jamesy | Birsisake | Official Music Video | Prod.@ruthlexxNp,Kavi G X Jamesy | Birsisake | Official Music Video | Prod.@ruthlexxNp,KAVI G,UCtAOXPlMavkUAxiiLvbTN0Q,10,Music,"kavi g, jamsey, collab, birsisake, dg records, dotfot entertainment, kadak nepali, official, music video, nephop, rap, hiphop, song, latest, release, nachana, amsterdam ma, sushant kc, yabi the goat, 5:55, laure, vten, dong, birse, jiuna, poetry, storytelling, beef, diss, ruthlessbeatz, viral, cheater, reels, tiktok",34,https://i.ytimg.com/vi/8rzOeHj_GnI/hqdefault.jpg,en,ne,False,250,PT4M10S,hd,False,True,False,False,137374,8064,265
0uLerogRf5o,NP,2026-03-05T03:15:16.472492+00:00,2026-02-28T10:16:24Z,AVARITIA TOUCH BLOCK BATTLE IN MINECRAFT!!,AVARITIA TOUCH BLOCK BATTLE IN MINECRAFT!!,Dash Empire,UCtNxjL-8WeFZ6LbfrOYgNoQ,20,Gaming,,0,https://i.ytimg.com/vi/0uLerogRf5o/hqdefault.jpg,en,zxx,False,1115,PT18M35S,hd,False,True,False,False,503143,4964,203
vNmAOuLEoSI,NP,2026-03-05T03:15:16.472499+00:00,2026-02-21T12:28:55Z,#रंगदारी_गाना | #बिगहा के बिगहा तहरा नामे कS देहब | #Aditya Samrat & Khushi Kakar | #Rangdaari Song,#रंगदारी_गाना | #बिगहा के बिगहा तहरा नामे कS देहब | #Aditya Samrat & Khushi Kakar | #Rangdaari Song,Aditya Samrat Official,UChkyj-k8MxwNvFHCY8jMjTw,10,Music,"#रंगदारी_गाना | #बिगहा के बिगहा तहरा नामे क देहब | #Aditya Samrat & Khushi Kakar | #Rangdaari Song, Aditya Samrat, Bigha Ke Bigha Tahra Name Ka Dehab, Khushi Kakar, Rangdaari Song, adtiya samrtat ka gana, new bhojpuri rangdaari song, aditya samrat rangdari song, aditya samrat song, aditya samrat ka song, aditya samrat new song, aditya samarat ahiran song, khushi kakkar, khushi kakkar song, khushi kakkar ke gana, khushi kakkar new song, khushi kakkar bhojpuri",17,https://i.ytimg.com/vi/vNmAOuLEoSI/hqdefault.jpg,hi,bh,False,154,PT2M34S,hd,False,True,False,False,2693416,50094,1545
rguRpw-xl_U,NP,2026-03-05T03:15:16.472507+00:00,2026-02-24T06:45:04Z,Can I Save Her From THE PROTOTYPE ?  (Poppy Playtime Chapter 5),Can I Save Her From THE PROTOTYPE ?  (Poppy Playtime Chapter 5),Mythpat,UCx6F-rETGiz7xf_vkMmX2yQ,20,Gaming,"poppy playtime chapter 5, mythpat huggy wuggy, poppy mythpat",3,https://i.ytimg.com/vi/rguRpw-xl_U/hqdefault.jpg,en,hi,False,3033,PT50M33S,hd,False,True,False,False,3156763,59241,6760
sse42u6x2wM,NP,2026-03-05T03:15:16.472514+00:00,2026-02-12T15:15:06Z,Ko Cha Ra (Official Music Video),Ko Cha Ra (Official Music Video),John Rai,UCz-K1mZId0h67tQzDTlUgPw,10,Music,"maroon 5, Ed Sherran, Zayn, Justin bieber, Nepal, us, India, uk, korea, Canada, Spain, nepal, nepal music, nepali music, John Chamling rai, John and the locals, YouTube music, trending nepali, routine of nepal banda, John rai, viral, nepali tiktok, visit nepal, everest, love song, music video, travel nepal",27,https://i.ytimg.com/vi/sse42u6x2wM/hqdefault.jpg,en,en,False,414,PT6M54S,hd,False,True,False,False,1694683,93582,3246
XrAoDZLZZ1g,NP,2026-03-05T03:15:16.472521+00:00,2026-02-28T17:00:01Z,1 Minute vs 10 Year Build Challenge,1 Minute vs 10 Year Build Challenge,MrBeast Gaming,UCIPPMRA040LQr5QPyJEbmXA,20,Gaming,,0,https://i.ytimg.com/vi/XrAoDZLZZ1g/hqdefault.jpg,en,en,False,864,PT14M24S,hd,True,True,False,False,19479278,382060,11987
_MM3yuBca-Y,NP,2026-03-05T03:15:16.472528+00:00,2026-02-28T11:15:06Z,SACAR aka Lil Buddha | NUDE Khatra Barz,SACAR aka Lil Buddha | NUDE Khatra Barz,Khatra Lifestyle,UCzfgIQzMS1CzJn8SmFEy-Bg,10,Music,,0,https://i.ytimg.com/vi/_MM3yuBca-Y/hqdefault.jpg,en,ne,False,219,PT3M39S,hd,False,True,False,False,124406,10190,432
k0Y0aRR3iAc,NP,2026-03-05T03:15:16.472535+00:00,2026-02-25T02:45:05Z,Sk Sabir Boss Prank on Anshbond😱 He Got Shocked - Garena freefire,Sk Sabir Boss Prank on Anshbond😱 He Got Shocked - Garena freefire,Laka Gaming,UCU0Kv4-V7TuMaGA6F3HkPYQ,20,Gaming,,0,https://i.ytimg.com/vi/k0Y0aRR3iAc/hqdefault.jpg,en,hi,False,869,PT14M29S,hd,False,True,False,False,499761,24733,749
nwGxkAndeMk,NP,2026-03-05T03:15:16.472542+00:00,2026-03-03T00:30:47Z,"#Video | Non Stop होली स्पेशल गीत | #Khesari Lal Yadav, #Arvind Akela Kallu | New Holi Song 2026","#Video | Non Stop होली स्पेशल गीत | #Khesari Lal Yadav, #Arvind Akela Kallu | New Holi Song 2026",Annapurna Films,UCY26pVlcGOQADWohxAqlQow,10,Music,"khesari lal yadav new song, khesari lal yadav ka new hit holi song, khesari lal ke gana, arvind akela holi song, arvind akela kallu, arvind akela kallu holi song, khesari lal new song, khesari lal yadav, khesari lal, new holi song, new holi song 2026, new holi song bhojpuri, shilpi raj new song, shilpi raj new holi song 2026, shilpi raj new holi song, arvind akela song, khesari lal new holi, khesari lal yadav ka holi gana, shilpi raj khesari lal, holi song, holi geet",21,https://i.ytimg.com/vi/nwGxkAndeMk/hqdefault.jpg,en,hi,False,3331,PT55M31S,hd,False,True,False,False,2198521,7975,179
0-vPy0tNjkY,NP,2026-03-05T03:15:16.472551+00:00,2026-03-02T12:37:21Z,Huggy Wuggy is BACK in POPPY PLAYTIME CHAPTER 5!,Huggy Wuggy is BACK in POPPY PLAYTIME CHAPTER 5!,ProBoii,UCz2e8E8lREYtYXFzZtvQ3HA,20,Gaming,"poppy playtime, poppy playtime chapter 5, huggy wuggy, huggy wuggy is back, huggy wuggy poppy playtime, huggy wuggy game, poppy playtime game, poppy playtime chapter 5 gameplay, poppy playtime chapter 5 in hindi, proboiz, proboii",11,https://i.ytimg.com/vi/0-vPy0tNjkY/hqdefault.jpg,en-US,en-IN,False,3065,PT51M5S,hd,False,True,False,False,909319,23914,3271
v9THuU-L5DM,NP,2026-03-05T03:15:16.472558+00:00,2026-02-26T12:30:06Z,Ujan Shakya - Mann Ki Pari  (Official Music Video),Ujan Shakya - Mann Ki Pari  (Official Music Video),Ujan Shakya,UCs7LSsL1aT3JX0vZBpA--_g,10,Music,"UJAN SHAKYA, ujan shakya, ujen shakya, uzan shakya, uzen shakya, baby, kumari, baby baby re, chihan ki pari, bhamara, maicha, rajamati, rajamati cha, rajmati, rajmati cha",15,https://i.ytimg.com/vi/v9THuU-L5DM/hqdefault.jpg,en,ne,False,348,PT5M48S,hd,False,True,False,False,111302,4153,175
yKJ7P9NEwgo,NP,2026-03-05T03:15:16.472580+00:00,2026-03-01T11:22:02Z,"$1 to $1,000,000,000 Lamborghini Ramp Car in GTA 5!","$1 to $1,000,000,000 Lamborghini Ramp Car in GTA 5!",Jeet OP,UCm6njOPvrErwVtcY7YXojCg,20,Gaming,"Jeet OP, techno gamerz, gta 5 mods, GTA, GTA 5, gta 5 lamborghini, gta 5, grand theft auto 5, gta v, gta5, gta 5 rp, gta 5 gameplay, gta 5 funny moments, gta, in gta 5, stealing cars gta 5, fastest car, upgrading cars gta 5, slowest to fastest, $1 gta 5, $1000000 gta 5, $1 car gta 5, $1000000 car gta 5, upgrading ramp car, $1 lamborghini ramp car, $1000000000 lamborghini ramp car, perry goes wild, live insaan, jeet op gta5, ramp car, lamborghini ramp car gta5, gta6",32,https://i.ytimg.com/vi/yKJ7P9NEwgo/hqdefault.jpg,en,hi,False,1456,PT24M16S,hd,False,True,False,False,574557,4746,89
