video_id,country,fetched_at,published_at,title,localized_title,channel_title,channel_id,category_id,category_name,tags,tag_count,thumbnail,default_language,audio_language,is_live,duration,duration_raw,definition,caption_available,licensed_content,embeddable,made_for_kids,views,likes,comments
x3eqqoZPV_E,MY,2026-05-06T04:13:55.254939+00:00,2026-05-04T09:21:33Z,BABYMONSTER - '춤 (CHOOM)' M/V,BABYMONSTER - '춤 (CHOOM)' M/V,BABYMONSTER,UCqwUnggBBct-AY2lAdI88jQ,10,Music,"BABYMONSTER, 베이비몬스터, 베몬, BABYMON, BAEMON, 하람, 아현, 루카, 치키타, 파리타, 로라, 아사, HARAM, AHYEON, RUKA, CHIQUITA, PHARITA, RORA, ASA",19,https://i.ytimg.com/vi/x3eqqoZPV_E/hqdefault.jpg,ko,ko,False,205,PT3M25S,hd,True,True,False,False,18973396,864670,62255
f_bKjZeJBBI,MY,2026-05-06T04:13:55.254979+00:00,2026-05-05T04:10:02Z,The Odyssey | Official New Trailer,The Odyssey | Official New Trailer,Universal Pictures,UCq0OueAsdxH6b8nyAspwViw,24,Entertainment,,0,https://i.ytimg.com/vi/f_bKjZeJBBI/hqdefault.jpg,en-US,en-US,False,152,PT2M32S,hd,True,True,False,False,6496355,235668,15092
oCtbGCgyncA,MY,2026-05-06T04:13:55.254989+00:00,2026-05-03T11:31:30Z,LIVE | [BM] MPL MY Season 17 Minggu 5 Hari 3,LIVE | [BM] MPL MY Season 17 Minggu 5 Hari 3,MPL Malaysia,UCoRKiOsQ7Rfo8UuU44nl7Iw,20,Gaming,,0,https://i.ytimg.com/vi/oCtbGCgyncA/hqdefault.jpg,ms,ms,False,18495,PT5H8M15S,hd,False,False,False,False,759692,4934,95
kRpaqR5sbf0,MY,2026-05-06T04:13:55.254996+00:00,2026-05-04T08:58:06Z,CORTIS (코르티스) 'TNT' Official MV,CORTIS (코르티스) 'TNT' Official MV,HYBE LABELS,UC3IZKseVpdzPSBaWxBxundA,10,Music,"HYBE, HYBE LABELS, 하이브, 하이브레이블즈",4,https://i.ytimg.com/vi/kRpaqR5sbf0/hqdefault.jpg,ko,ko,False,184,PT3M4S,hd,True,True,False,False,2834612,427343,24846
SJPu1spHqfk,MY,2026-05-06T04:13:55.255003+00:00,2026-04-30T12:59:32Z,RESIDENT EVIL – Official Teaser Trailer (4K),RESIDENT EVIL – Official Teaser Trailer (4K),Sony Pictures Entertainment,UCz97F7dMxBNOfGYu3rx8aCw,24,Entertainment,,0,https://i.ytimg.com/vi/SJPu1spHqfk/hqdefault.jpg,en,en,False,114,PT1M54S,hd,True,True,False,False,3737987,163891,17938
KrVpw7MV9RY,MY,2026-05-06T04:13:55.255008+00:00,2026-05-03T11:34:56Z,🔴LIVE - NOBAR MPLMY S17 ! #mplmy #mplmys17,🔴LIVE - NOBAR MPLMY S17 ! #mplmy #mplmys17,Feekz ,UCQM6iYUQVKg2vrdw--DOaGQ,20,Gaming,,0,https://i.ytimg.com/vi/KrVpw7MV9RY/hqdefault.jpg,en,en-US,False,17370,PT4H49M30S,hd,False,False,False,False,237573,4401,38
8XvF7WRbb3A,MY,2026-05-06T04:13:55.255014+00:00,2026-04-30T23:00:00Z,Lagu Slow Rock Malaysia Terbaik - Lagu Jiwang 80/90an - Lagu Malaysia Lama Terbaik,Lagu Slow Rock Malaysia Terbaik - Lagu Jiwang 80/90an - Lagu Malaysia Lama Terbaik,Vinyl Records,UC95SI6gdYLdUiLf822R5ysg,22,People & Blogs,"slow rock malaysia 90an, lagu slow rock, lagu jiwang, lagu jiwang 90an, slow rock malaysia, rock kapak malaysia, rock kapak lama, lagu slow rock malaysia, lagu slow rock terbaik, lagu slow rock malaysia terbaik, ratu rock malaysia, slow rock malaysia 80-90an, ratu rock, lagu lama malaysia 90an, exist, slam, xpdc, axl, spin, ukays, lagu jiwang malaysia terbaik, rock kapak malaysia 90an, rock kapak, lagu lama malaysia populer 90an, lagu rock kapak 90an, mega, iklim, rock, slow rock",29,https://i.ytimg.com/vi/8XvF7WRbb3A/hqdefault.jpg,ms,ms,False,12190,PT3H23M10S,hd,False,True,False,False,124433,461,17
u48_JpUloGY,MY,2026-05-06T04:13:55.255021+00:00,2026-04-30T23:46:09Z,Spider-Noir | Official Trailer (True-Hue Full Color),Spider-Noir | Official Trailer (True-Hue Full Color),Sony Pictures Television,UCeDnHAtv092zrrVIai87N4Q,24,Entertainment,"Sony, Sony Pictures Television, Spider Noir, Spider-Noir trailer, Marvel Spider Noir, Spider Noir official trailer, Spider Noir 2026, noir Spider-Man, Spider-Verse noir, Marvel trailer, superhero noir, dark superhero trailer, Spider Man Noir, Spider Noir teaser, comic adaptation, Marvel noir universe",16,https://i.ytimg.com/vi/u48_JpUloGY/hqdefault.jpg,en,en,False,160,PT2M40S,hd,False,True,False,False,3034620,83505,3302
TBMNZULacZI,MY,2026-05-06T04:13:55.255027+00:00,2026-05-02T15:42:27Z,🔴 LIVE | MPL ID S17 | Regular Season Hari 2 Minggu 6 | Bahasa Indonesia,🔴 LIVE | MPL ID S17 | Regular Season Hari 2 Minggu 6 | Bahasa Indonesia,MPL Indonesia,UC1dGHGJTXU_dkiR8tW3qQgg,20,Gaming,"mobile legends: bang bang, MPL Indonesia, MPL, MLBB, Mobile Legends",5,https://i.ytimg.com/vi/TBMNZULacZI/hqdefault.jpg,id,id,False,31181,PT8H39M41S,hd,False,True,False,False,7320625,45081,508
-YnIdxNBz3A,MY,2026-05-06T04:13:55.255033+00:00,2026-04-27T12:57:15Z,EzHaRHaNzE - Bila Nanti Sunyi (Official Audio + Lyric Video),EzHaRHaNzE - Bila Nanti Sunyi (Official Audio + Lyric Video),EzHaRHaNzE,UCUrbkrdf-AIN3-k7cffUTwQ,24,Entertainment,,0,https://i.ytimg.com/vi/-YnIdxNBz3A/hqdefault.jpg,ms,ms,False,151,PT2M31S,hd,False,True,False,False,248690,2445,176
G89A5j55IgI,MY,2026-05-06T04:13:55.255039+00:00,2026-05-01T14:17:17Z,Konspirasi | Official Trailer | Akan Datang Di Pawagam GSC mulai 21 Mei 2026 ,Konspirasi | Official Trailer | Akan Datang Di Pawagam GSC mulai 21 Mei 2026 ,GSCinemas,UCqFDleXHU9GCb_9JvTmjacQ,24,Entertainment,,0,https://i.ytimg.com/vi/G89A5j55IgI/hqdefault.jpg,ms,en-US,False,96,PT1M36S,hd,False,False,False,False,24955,546,64
24m1JG2pwyA,MY,2026-05-06T04:13:55.255044+00:00,2026-05-01T17:13:42Z,*SERAM!!* KISAH KEDAI GUNTING RAMBUT DI INDONESIA! ||🔴 I Fell for Her (Malaysia) #HorrorLivestream,*SERAM!!* KISAH KEDAI GUNTING RAMBUT DI INDONESIA! ||🔴 I Fell for Her (Malaysia) #HorrorLivestream,Pok Ro,UCmPH_YmLJGnC4-oriauftpg,20,Gaming,"Ghost, scary, malaysia, malaysian gamer, gameplay, seram, hantu, lawak, funny, new horror games 2020, horror, horror games, Pemburu hantu, #seram, the beast inside, trending, devour, IFRIT, pok ro, sekpenyu, sekmu",21,https://i.ytimg.com/vi/24m1JG2pwyA/hqdefault.jpg,ms,ms,False,10396,PT2H53M16S,hd,False,True,False,False,150773,8390,81
hVF4vOZw4B0,MY,2026-05-06T04:13:55.255050+00:00,2026-04-30T07:28:06Z,ADY N JAS - Idol Oh Idol (Helikopter Turun Ke Padang) Remix by DISCO HUNTER ,ADY N JAS - Idol Oh Idol (Helikopter Turun Ke Padang) Remix by DISCO HUNTER ,DISCO HUNTER,UCewBI-xxyyCq9ehfoLJ-TUw,10,Music,"discohunter, breaklatin",2,https://i.ytimg.com/vi/hVF4vOZw4B0/hqdefault.jpg,ms,ms,False,409,PT6M49S,hd,False,True,False,False,169044,1870,63
OYdHSvHDkcI,MY,2026-05-06T04:13:55.255056+00:00,2026-05-04T16:38:08Z,The Boys Season 5 Episode 6 Trailer,The Boys Season 5 Episode 6 Trailer,Rotten Tomatoes TV,UCz1GPotHecuLngiLuY739QQ,1,Film & Animation,"The Boys, The Boys Trailer, The Boys Season 5 Episode 6 Trailer, The Boys S05 E06 Trailer, The Boys Season 5 episode 6 TV Trailer, The Boys Season 5 Episode 6 Trailer 2026, The Boys Season 5 Episode 6 Official Trailer, Trailer, TV Trailer, 2026 Trailers, 2026 TV Trailers, The Boys Trailer 1, The Boys Season 5 Prime Video, Prime Video, Entertainment, TV Series, Karl Urban, Jack Quaid, Antony Starr",19,https://i.ytimg.com/vi/OYdHSvHDkcI/hqdefault.jpg,en,en,False,35,PT35S,hd,False,True,False,False,932449,20450,1493
2uG4nU20dKc,MY,2026-05-06T04:13:55.255062+00:00,2026-05-03T23:00:06Z,"Gawai Menidit Dinai - Lucy M, Embat Lala, Toddy, Manang Aping (MTV Official)","Gawai Menidit Dinai - Lucy M, Embat Lala, Toddy, Manang Aping (MTV Official)",Channel PBP,UCZYWqw9sk3UbnlpAJgrWb6g,10,Music,"Badu Kiruh - Hailey (MTV Official), Badu Kiruh - Hailey (Official Muzik Video), Badu kiruh, KMP production, LUH production, Lucy M, Melissa francis, Phoebe chloe, Winnie Albert, Winnie albert, bara api, bisi ganti nuan, channel PBP, embat lala, enggai tundi dek, hailey",16,https://i.ytimg.com/vi/2uG4nU20dKc/hqdefault.jpg,ms,ms,False,269,PT4M29S,hd,False,True,False,False,46139,2131,116
2EN5jtpDxx4,MY,2026-05-06T04:13:55.255069+00:00,2026-05-03T08:11:16Z,24 JAM MASUK RUMAH HANTU HELLO KITTY 😈,24 JAM MASUK RUMAH HANTU HELLO KITTY 😈,Aqil Zulkiflee Gaming,UCgFsd6QZJzE15hQaXU0MNdg,20,Gaming,,0,https://i.ytimg.com/vi/2EN5jtpDxx4/hqdefault.jpg,ms,ms,False,1034,PT17M14S,hd,False,True,False,False,89116,1167,34
SCySL2FKuCc,MY,2026-05-06T04:13:55.255075+00:00,2026-05-04T09:00:40Z,Blue Lips,Blue Lips,CORTIS - Topic,UCraxhuo4vXXMMgXJ6Gil4Eg,10,Music,"CORTIS, 코르티스, GREENGREEN, Blue Lips",4,https://i.ytimg.com/vi/SCySL2FKuCc/hqdefault.jpg,en,en,False,142,PT2M22S,hd,False,True,False,False,1100162,88418,4455
EoU_WKPl3wY,MY,2026-05-06T04:13:55.255080+00:00,2026-05-03T06:00:19Z,KETIKA SOLOZ MABAR VIP BERSAMA 7GL! BUAT PERTAMA KALI JUMPA FULL PARTY PENDUDUK ASAL ROMAWI!,KETIKA SOLOZ MABAR VIP BERSAMA 7GL! BUAT PERTAMA KALI JUMPA FULL PARTY PENDUDUK ASAL ROMAWI!,Soloz,UCC-2ycjovzKIFCDWL667_vw,20,Gaming,"Mobile, legends",2,https://i.ytimg.com/vi/EoU_WKPl3wY/hqdefault.jpg,en,zxx,False,511,PT8M31S,hd,False,True,False,False,72417,2078,52
Zlj4kwulZ9g,MY,2026-05-06T04:13:55.255086+00:00,2026-04-24T12:00:06Z,Jangan Bukan-Bukan - Fiq7 (Official Music Video),Jangan Bukan-Bukan - Fiq7 (Official Music Video),Rhunut Music,UCUZJv6B4goRdAYYL-sVuTyQ,10,Music,"Jangan Bukan-Bukan, Fiq7, MasMera",3,https://i.ytimg.com/vi/Zlj4kwulZ9g/hqdefault.jpg,ms,ms,False,174,PT2M54S,hd,False,True,False,False,294154,11044,967
E0Lj_QylyLo,MY,2026-05-06T04:13:55.255092+00:00,2026-04-30T16:07:28Z,KISAH MENGERIKAN PANGKAS RAMBUT ASGAR DI INDONESIA.... I Fell for Her,KISAH MENGERIKAN PANGKAS RAMBUT ASGAR DI INDONESIA.... I Fell for Her,Windah Basudara,UCoIiiHof6BJ85PLuLkuxuhw,20,Gaming,windah basudara,1,https://i.ytimg.com/vi/E0Lj_QylyLo/hqdefault.jpg,id,id,False,6691,PT1H51M31S,hd,False,True,False,False,1666637,47434,2548
E4Ds0FtOb_I,MY,2026-05-06T04:13:55.255097+00:00,2026-05-01T10:32:36Z,Fadhilah Intan & Daniesh Suffian - Simpul (Official Lyric Video),Fadhilah Intan & Daniesh Suffian - Simpul (Official Lyric Video),Fadhilah Intan,UCvhB7K0o_azSD2mtUN6OEpg,10,Music,,0,https://i.ytimg.com/vi/E4Ds0FtOb_I/hqdefault.jpg,id,id,False,230,PT3M50S,hd,False,False,False,False,106894,2629,151
-AmFOCmvaDo,MY,2026-05-06T04:13:55.255103+00:00,2026-05-03T11:17:49Z,SRG VS IG MATCH 2 REGULAR SEASON MPL MY S17,SRG VS IG MATCH 2 REGULAR SEASON MPL MY S17,Hilman Aufa,UC5lvTGyZDv3eWV6g2FnySaQ,20,Gaming,"MOBILE, LEGENDS, PRO, GAMEPLAY, PLAY, PROFESSIONAL, ICON, TOP, GLOBAL, HERO, LANCELOT, MOSKOV, GUSION, KAGURA, HARLEY, ROGER, FAMOUS, MALAYSIA, LAN, KRISTAL, RAMBUT, PANJANG, GONDRONG, mpl, mpl my, m7",26,https://i.ytimg.com/vi/-AmFOCmvaDo/hqdefault.jpg,en,en,False,1387,PT23M7S,hd,False,True,False,False,31271,390,62
_zr30YhVd0Y,MY,2026-05-06T04:13:55.255109+00:00,2026-04-28T20:12:02Z,The 1975 - About You (Lyrics),The 1975 - About You (Lyrics),Invited Kingdom,UCFWHWqcDEfkngrRFKUOxDlg,22,People & Blogs,"The 1975 - About You (Lyrics), The 1975 - About You, About You, The 1975, Lyrics, lyrics",6,https://i.ytimg.com/vi/_zr30YhVd0Y/hqdefault.jpg,en,en,False,327,PT5M27S,hd,False,True,False,False,786159,759,35
BnR5gG7njBc,MY,2026-05-06T04:13:55.255115+00:00,2026-05-02T04:23:02Z,JJ Can Shapeshift Into ANIMALS To PRANK Mikey in Minecraft,JJ Can Shapeshift Into ANIMALS To PRANK Mikey in Minecraft,Maizen,UCJHBJ7F-nAIlMGolm0Hu4vg,20,Gaming,"Minecraft, Maizen",2,https://i.ytimg.com/vi/BnR5gG7njBc/hqdefault.jpg,en,en,False,1730,PT28M50S,hd,False,True,False,False,2276589,15355,947
hu_qjwqTUmg,MY,2026-05-06T04:13:55.255121+00:00,2026-04-28T15:11:15Z,Karuppa Kooda Va - Lyric Video | Karuppu | Suriya | RJ Balaji | @SaiAbhyankkar | VM Mahalingam,Karuppa Kooda Va - Lyric Video | Karuppu | Suriya | RJ Balaji | @SaiAbhyankkar | VM Mahalingam,Think Music India,UCLbdVvreihwZRL6kwuEUYsA,10,Music,"karuppa kudava, karuppu, suriya, surya, rj balaji, sai abhyankkar, karuppa kudava lyric video, karuppa kudava karuppu movie song, karuppu tamil movie songs, karuppu movie songs tamil, suriya karuppu movie song, karuppu tamil movie, Suriya latest Songs, karuppu movie, sai abhyankkar karuppa kudava song, karuppa kudava karuppu song, raathu raasan tamil song, sai abhyankkar songs, karuppu new movie song, tamil movie songs 2026, tamil movie songs, tamil songs, karuppa koodava",23,https://i.ytimg.com/vi/hu_qjwqTUmg/hqdefault.jpg,en,ta,False,259,PT4M19S,hd,False,True,False,False,6671922,75670,4726
ajjkX8CeUc0,MY,2026-05-06T04:13:55.255128+00:00,2026-05-04T08:06:32Z,"Free Skin. Free Scenery. Free Chests. 👀 Yes, You Read That Right!","Free Skin. Free Scenery. Free Chests. 👀 Yes, You Read That Right!",Clash of Clans,UCD1Em4q90ZUK2R5HKesszJg,20,Gaming,"clash of clans, COC, Clash of Clans Gameplay, Clash of Clans Strategy, Clash of Clans Animation, Clash of Clans Commercial, Clash of Clans Attacks, Clash of Clans Town Hall, Hog Rider, PEKKA, Clan Wars, season challenges, clan war leagues, clash on, clan game, clan games, clash-a-rama, clasharama",18,https://i.ytimg.com/vi/ajjkX8CeUc0/hqdefault.jpg,en,en,False,111,PT1M51S,hd,False,False,False,False,2005452,29153,1455
-SEKt_0pdHM,MY,2026-05-06T04:13:55.255134+00:00,2026-04-28T09:00:01Z,NMIXX(엔믹스) “Crescendo” M/V,NMIXX(엔믹스) “Crescendo” M/V,JYP Entertainment,UCaO6TYtlC8U5ttz62hTrZgg,10,Music,"JYP Entertainment, JYP, NMIXX, 엔믹스, 릴리, LILY, 해원, HAEWON, 오해원, 설윤, SULLYOON, 설윤아, 배이, BAE, 배진솔, 지우, JIWOO, 김지우, 규진, KYUJIN, 장규진, JYPn, kpop, girlgroup, 5th EP, Heavy Serenade",26,https://i.ytimg.com/vi/-SEKt_0pdHM/hqdefault.jpg,en,ko,False,166,PT2M46S,hd,True,True,False,False,2798880,223327,11149
GkxRNT9SmWY,MY,2026-05-06T04:13:55.255141+00:00,2026-05-03T16:04:55Z,[BM] 2026 PMPL MY Spring : Peringkat Akhir | Hari Ketiga,[BM] 2026 PMPL MY Spring : Peringkat Akhir | Hari Ketiga,PUBG MOBILE Malaysia,UCvrebwQujh0ugAHVEXZcDrA,20,Gaming,,0,https://i.ytimg.com/vi/GkxRNT9SmWY/hqdefault.jpg,ms,ms,False,22311,PT6H11M51S,hd,False,False,False,False,96105,698,10
8Uaj7KLCj2I,MY,2026-05-06T04:13:55.255147+00:00,2026-04-20T11:02:11Z,Justin Bieber - Favorite Girl (Lyrics),Justin Bieber - Favorite Girl (Lyrics),British Pop Bangers,UC90XKCg37vA7mmXm3LdwC3A,10,Music,"favorite girl, favorite girl lyrics, lyrics favorite girl, justin bieber, lyrics, justin bieber favorite girl, favorite girl justin bieber, justin bieber favorite girl lyrics, lyrics justin bieber favorite girl, justin bieber lyrics, lyrics justin bieber, justin bieber lyrics favorite girl, favorite girl lyrics justin bieber, lyrics favorite girl justin bieber, favorite girl justin bieber lyrics, favorite girl lyric video, justin bieber - favorite girl, pop, music, hits",20,https://i.ytimg.com/vi/8Uaj7KLCj2I/hqdefault.jpg,en,en,False,258,PT4M18S,hd,False,False,False,False,3305892,5118,150
QSyy1LCB6JI,MY,2026-05-06T04:13:55.255154+00:00,2026-05-03T12:45:08Z,Masuk Asrama Angker - Dark Pals: The 1st Floor Indonesia,Masuk Asrama Angker - Dark Pals: The 1st Floor Indonesia,MiawAug,UC3J4Q1grz46bdJ7NJLd4DGw,20,Gaming,"miawaug, Dark Pals, Dark Pals Game, game, Indonesia, MiawAug, Miaw, Aug, Horror game, Game, MiawAug Horror, horor, gameplay, game baru, baru, new, end, ending, tamat, full gameplay, 2026, all ending, game indonesia, game horror indonesia, ending baru, update, Dark Pals Game Horror, Dark Pals Indonesia, Dark Pals MiawAug, MiawAug Dark Pals, Maskot horror game, Mascot Horror Game, Garten Of Ban Ban, Poppy Playtime, FNAF, Dark Pals: The 1st Floor, 1st Floor, Chapter 1",38,https://i.ytimg.com/vi/QSyy1LCB6JI/hqdefault.jpg,id,id,False,3514,PT58M34S,hd,False,True,False,False,396642,10392,926
neS1MzqOdoA,MY,2026-05-06T04:13:55.255160+00:00,2026-04-23T19:00:02Z,Raim Laode - IQRO' (Lyrics),Raim Laode - IQRO' (Lyrics),Amazing Lyrics,UCZtoHl1p6R6_iLm2yjA9gew,10,Music,"Raim Laode - IQRO' (Lyrics), Raim Laode - IQRO', IQRO', Raim Laode, Lyrics, lyrics",6,https://i.ytimg.com/vi/neS1MzqOdoA/hqdefault.jpg,en,und,False,231,PT3M51S,hd,False,False,False,False,892159,1709,20
6GpiO1l7UUE,MY,2026-05-06T04:13:55.255166+00:00,2026-04-25T07:27:27Z,APA SALAH AKU?...AKU HANYA INGIN BAHAGIA !!! - (Trees Hate You),APA SALAH AKU?...AKU HANYA INGIN BAHAGIA !!! - (Trees Hate You),AlimSangat,UCBoFyZzbkR7XrE9udJuI8Kw,20,Gaming,"gaming malaysia indonesia, gaming indonesia lucu lawak, lawak gaming, lawak gaming malaysia, gamer malaysia, gaming malaysia lawak, funny moment malaysia, funnymoment malaysia gaming, gamer, malaysia lawak, gamer menghiburkan, game hiburan, game seram main, game best, alimsangat, game lawak, moment lucu game, gaming malaysia, game, baby in yellow",20,https://i.ytimg.com/vi/6GpiO1l7UUE/hqdefault.jpg,ms,ms,False,1609,PT26M49S,hd,False,True,False,False,235171,0,365
6KS5QiQY7cs,MY,2026-05-06T04:13:55.255171+00:00,2026-04-21T10:03:07Z,HIDUP BUKAN SENANG,HIDUP BUKAN SENANG,Alva Studio - Topic,UC77acTDXqVK5ot2xCii9r6Q,10,Music,"Alva Studio, HIDUP BUKAN SENANG",2,https://i.ytimg.com/vi/6KS5QiQY7cs/hqdefault.jpg,ms,id,False,304,PT5M4S,hd,False,True,False,False,132356,1045,0
WvRtk9zxWPw,MY,2026-05-06T04:13:55.255178+00:00,2026-05-04T23:00:40Z,"Yuta Mio Panik! CCTV Merekam PASUKAN MONSTER GUGUGAGA, KICAU MANIA Di Kota Sakura😱","Yuta Mio Panik! CCTV Merekam PASUKAN MONSTER GUGUGAGA, KICAU MANIA Di Kota Sakura😱",Dunia Budi,UChirEQ8Q5iGOMEW3TPOo5_Q,20,Gaming,,0,https://i.ytimg.com/vi/WvRtk9zxWPw/hqdefault.jpg,id,id,False,1009,PT16M49S,hd,False,True,False,False,641628,4182,178
Mhzap6wFduI,MY,2026-05-06T04:13:55.255184+00:00,2026-05-01T22:15:00Z,🎸 Lagu Slow Rock Malaysia Terbaik 🎸 Lagu Jiwang 80/90an 🎸 Lagu Malaysia Lama Terbaik,🎸 Lagu Slow Rock Malaysia Terbaik 🎸 Lagu Jiwang 80/90an 🎸 Lagu Malaysia Lama Terbaik,FUNNY MUSIC,UCZIT46cTpG3H5lz61aufryA,22,People & Blogs,"slow rock malaysia, lagu slow rock malaysia, slow rock malaysia 90an, lagu jiwang 90an, lagu jiwang, lagu melayu, lagu jiwang 80-90an, lagu malaysia, jiwang rock 90an, lagu kenangan sepanjang masa, rock kapak 80 an 90 an, slow rock melayu, lagu rock kapak 90an, malaysia full album, jiwang, rock jiwang, rock malaysia, tembang kenangan, lagu lama malaysia 90an, rock kapak, lagu kenangan, lagu lama, lagu nostalgia terbaik, lagu nostalgia, lagu lawas, lagu tahun 90an",26,https://i.ytimg.com/vi/Mhzap6wFduI/hqdefault.jpg,ms,ms,False,6306,PT1H45M6S,hd,False,True,False,False,34034,141,3
ikKIxH6PDhc,MY,2026-05-06T04:13:55.255191+00:00,2026-05-02T22:11:24Z,🔴 (Duo) OOHAMI & UKILLER👩🏻‍🚀 Terperangkap dekat BULAN!🌑 - [ Together: Moon Escape Malaysia ] #full,🔴 (Duo) OOHAMI & UKILLER👩🏻‍🚀 Terperangkap dekat BULAN!🌑 - [ Together: Moon Escape Malaysia ] #full,OOHAMI,UCVzvQl5zP-u0ClI2JNVLPDg,20,Gaming,"OOHAMI, OOHAMICHAN, OOHAMIPLUS, Together: Moon Escape, moon escape, escape room",6,https://i.ytimg.com/vi/ikKIxH6PDhc/hqdefault.jpg,ms,ms,False,28825,PT8H25S,hd,False,True,False,False,60223,2980,45
OojyLAt_F6Q,MY,2026-05-06T04:13:55.255196+00:00,2026-04-28T09:00:26Z,林俊杰 - 她说『等不到天黑 烟火不会太完美；回忆烧成灰 还是等不到结尾』【动态歌词MV/Lyrics】,林俊杰 - 她说『等不到天黑 烟火不会太完美；回忆烧成灰 还是等不到结尾』【动态歌词MV/Lyrics】,Romance Season,UCwNJd11xhlpvaa0pDoSDXJA,22,People & Blogs,"RomanceSeason, music, 音乐, 热歌, 流行, 榜单, 旋律, cpop, 歌词版, bgm, lyrics",11,https://i.ytimg.com/vi/OojyLAt_F6Q/hqdefault.jpg,zh-Hans,zh-Hans,False,321,PT5M21S,hd,False,True,False,False,107442,71,1
oN-47639fTA,MY,2026-05-06T04:13:55.255203+00:00,2026-05-03T12:01:18Z,(100IQ!) OOHAMI vs SYAFIQ AIMAN🔥 is Finally Happening! - [ Among US Malaysia ] ft. DBPJ & TeamKemuts,(100IQ!) OOHAMI vs SYAFIQ AIMAN🔥 is Finally Happening! - [ Among US Malaysia ] ft. DBPJ & TeamKemuts,OOHAMICHAN,UCon6Uq6b8RYomdUF-T_YSMw,20,Gaming,"OOHAMI, oohami, oohamichan, OOHAMICHAN, among us oohami, oohami syafiq aiman",6,https://i.ytimg.com/vi/oN-47639fTA/hqdefault.jpg,ms,ms,False,1525,PT25M25S,hd,False,True,False,False,48376,3040,91
m9QQYNfHWTM,MY,2026-05-06T04:13:55.255209+00:00,2026-04-26T09:46:26Z,Raim Laode - Iqro' Folk (Lirik Video),Raim Laode - Iqro' Folk (Lirik Video),Raim Laode,UC6CRezCe1QhJfNpdTOXx5Sg,10,Music,,0,https://i.ytimg.com/vi/m9QQYNfHWTM/hqdefault.jpg,id,id,False,235,PT3M55S,hd,False,True,False,False,919515,7507,254
eqM_HxeQXAo,MY,2026-05-06T04:13:55.255215+00:00,2026-05-02T02:11:05Z,100 Hari Minecraft Container Horror Squad,100 Hari Minecraft Container Horror Squad,NEFF447,UCRUoCIu-oho_bnMkhCxyrpg,20,Gaming,"minecraft, neff447, indonesia, minecraft survival, 100hari, trending, baww, RemanRhn, ItsSandwich, mrbeast, minecraft hardcore, minecraft speedrun, minecraft 1.20, minecraft memes, minecraft update, minecraft funny, minecraft fun facts, minecraft tutorial, minecraft tiktok, zombie apocalypse, 100 hari zombie, 100 hari zombie apocalypse, perfecnoods, dzake, 100 hari, 100 hari horror, 100 hari bunker, container, 100 hari container, minecraft horror, 100 hari container horror, horror",32,https://i.ytimg.com/vi/eqM_HxeQXAo/hqdefault.jpg,id,id,False,5418,PT1H30M18S,hd,False,True,False,False,526381,9209,938
nAQfKsVb880,MY,2026-05-06T04:13:55.255222+00:00,2026-04-24T08:15:06Z,Adat Bercinta - El Riss & Fana Ibrahim (Official Music Video),Adat Bercinta - El Riss & Fana Ibrahim (Official Music Video),Awal Muzik,UCGLHKvq3D3JibTNb6S5KZ3A,10,Music,,0,https://i.ytimg.com/vi/nAQfKsVb880/hqdefault.jpg,ms,ms,False,279,PT4M39S,hd,False,True,False,False,158479,5400,292
Zw_HE1mQ7rA,MY,2026-05-06T04:13:55.255228+00:00,2026-05-02T13:00:54Z,I Got Hunted by the World's Deadliest Assassin,I Got Hunted by the World's Deadliest Assassin,Wemmbu,UCkzzNLnuM-VsATWC53ehwOQ,20,Gaming,"wemmbu, wembu, wenbu, wemmbu unstable smp, wemmbu the sequel, eggchan, wemmbu eggchan, wemmbu hunted, wemmbu invisible player, unstable smp, unstable universe, parrotx2, minecraft, unstable smp in order, minecraft smp, unstable smp in order wemmbu, unstable smp latest video, unstable smp new video",18,https://i.ytimg.com/vi/Zw_HE1mQ7rA/hqdefault.jpg,en,en,False,3437,PT57M17S,hd,False,True,False,False,3548046,197108,36508
hG2jryolipI,MY,2026-05-06T04:13:55.255234+00:00,2026-05-01T12:10:29Z,DJ KICAU MANIA X BODY PATA PATA SLOW VIRAL TIKTOK FULL SONG MAMAN FVNDY 2026,DJ KICAU MANIA X BODY PATA PATA SLOW VIRAL TIKTOK FULL SONG MAMAN FVNDY 2026,Maman Fvndy Rmx,UCIaLsU0LfScJ4kxgXkV4HqA,10,Music,,0,https://i.ytimg.com/vi/hG2jryolipI/hqdefault.jpg,id,id,False,254,PT4M14S,hd,False,False,False,False,817333,4557,294
Vo6QTBMdUfU,MY,2026-05-06T04:13:55.255240+00:00,2026-04-25T16:00:01Z,"1 Day vs 50,000 Day Build Challenge","1 Day vs 50,000 Day Build Challenge",MrBeast Gaming,UCIPPMRA040LQr5QPyJEbmXA,20,Gaming,,0,https://i.ytimg.com/vi/Vo6QTBMdUfU/hqdefault.jpg,en,en,False,1186,PT19M46S,hd,True,True,False,False,26644309,435099,14166
ApOs_049sQs,MY,2026-05-06T04:13:55.255246+00:00,2026-04-30T11:34:48Z,Izinkan Selamanya Namamu Dihati,Izinkan Selamanya Namamu Dihati,Eye - Topic,UCNmtyu-T1cW_cmyRL-8-yhQ,10,Music,"Eye, Semakin Menjadi Jadi, Izinkan Selamanya Namamu Dihati",3,https://i.ytimg.com/vi/ApOs_049sQs/hqdefault.jpg,ms,id,False,330,PT5M30S,hd,False,True,False,False,59602,215,0
HDDxxeh3r-E,MY,2026-05-06T04:13:55.255252+00:00,2026-05-04T16:41:01Z,I Created the World's Largest Minecraft Army,I Created the World's Largest Minecraft Army,Parrot,UCPLMPHT-d8GZOqL_AHJFdQQ,20,Gaming,"Minecraft, Minecraft SMP, SMP, Minecraft Server, LifeSteal SMP, School Minecraft Server, School SMP, School Parrot, Parrot, ParrotX2, Dream SMP, TommyInnit, LifeSteal, parrot lifesteal smp, Spoke, minecraft survival, minecraft hardcore, minecraft challenge, minecraft server, HermitCraft, MumboJumbo, Grian, why i broke 100+ bedrock, Here's Why I Made 12240 Minecraft Cakes, Minecraft Hunt, LifeSteal Season 3, 1 Heart Minecraft, LifeSteal Season 4, Why I Removed the World",29,https://i.ytimg.com/vi/HDDxxeh3r-E/hqdefault.jpg,en,en,False,2944,PT49M4S,hd,False,True,False,False,2648526,141241,26828
OfSLvak3kag,MY,2026-05-06T04:13:55.255258+00:00,2026-04-23T09:35:38Z,DJ HELIKOPTER TURUN KE PADANG - IDOL IDOL | VIRAL TIKTOK Prengky Gantay Remix | Cipta.Ady N Jas,DJ HELIKOPTER TURUN KE PADANG - IDOL IDOL | VIRAL TIKTOK Prengky Gantay Remix | Cipta.Ady N Jas,Prengky Gantay,UC62NzNV6ZH6mqS7CvyFJTZw,10,Music,"dj helikopter turun ke padang viral tiktok, idol idol = cover.sangbayang.tesiya rjgroup original song in composer.ady & jas, dj campuran fyp viral tiktok 2026 jedag jedug full bass terbaru, dj campuran viral tiktok 2026 jedag jedug full bass terbaru, prengky gantay, dj prengky gantay, remix full bass, dj full bass, dj viral tiktok, viral tiktok, dj viral tiktok 2026, dj remix full bass tiktok, dj helikopter turun ke padang, full bass tiktok, tiktok viral 2026, remix full",16,https://i.ytimg.com/vi/OfSLvak3kag/hqdefault.jpg,id,id,False,391,PT6M31S,hd,False,True,False,False,784394,6067,188
remX310cWpg,MY,2026-05-06T04:13:55.255264+00:00,2026-04-30T22:01:12Z,Poppy Playtime: Chapter 6 - Chum's HOUR of JOY FLASHBACK with PROTOTYPE (Gameplay 19),Poppy Playtime: Chapter 6 - Chum's HOUR of JOY FLASHBACK with PROTOTYPE (Gameplay 19),Buggy Huggy,UCkPjGQlqzXbDD7R-KDZxkUg,20,Gaming,"poppy, poppy playtime, poppy playtime chapter 6 gameplay, poppy playtime chapter 5 all bosses, huggy wuggy, poppy playtime chapter 6, poppy playtime chapter 6 teaser trailer, poppy playtime chapter 6 trailer, poppy playtime 6 teaser trailer, poppy playtime 6, buggy huggy, poppy playtime animation, nightmare critters, pianosaurus, dr sawyer poppy playtime, poppy playtime chapter 5, prototype 1006, chum chompkins, kissy missy, huggy wuggy death, rory redcape",21,https://i.ytimg.com/vi/remX310cWpg/hqdefault.jpg,en,en,False,564,PT9M24S,hd,False,True,False,False,2040051,19650,928
