video_id,country,fetched_at,published_at,title,localized_title,channel_title,channel_id,category_id,category_name,tags,tag_count,thumbnail,default_language,audio_language,is_live,duration,duration_raw,definition,caption_available,licensed_content,embeddable,made_for_kids,views,likes,comments
51dc7-p_ZgM,SV,2026-01-17T02:27:00.137693+00:00,2026-01-07T15:54:31Z,Ven Devorame Otra Vez,Ven Devorame Otra Vez,Lalo Rodríguez - Topic,UCQcfibMEvF-hbPFs0qX2S4Q,10,Music,"Lalo Rodriguez, Ven Devorame Otra Vez",2,https://i.ytimg.com/vi/51dc7-p_ZgM/hqdefault.jpg,es,es,False,308,PT5M8S,hd,False,True,False,False,884157,6711,13
6jpEKYQJsYA,SV,2026-01-17T02:27:00.137701+00:00,2026-01-13T19:01:06Z,APOCALIPSIS HYTALE | Leprechaun Vegetta! #2,APOCALIPSIS HYTALE | Leprechaun Vegetta! #2,Willyrex Minecraft,UCGW7PYbDws_6O6yzhGFKEfg,20,Gaming,"willyrex, willy, willyrex minecraft, willy minecraft, lucky blocks minecraft, serie minecraft",6,https://i.ytimg.com/vi/6jpEKYQJsYA/hqdefault.jpg,es,es,False,2773,PT46M13S,hd,False,True,False,False,937500,105530,1560
carm3z_mMT4,SV,2026-01-17T02:27:00.137708+00:00,2026-01-05T23:01:01Z,Ana Gabriel - Simplemente Amigos (Letra),Ana Gabriel - Simplemente Amigos (Letra),Harmony Lyrics,UCbwdCZRkKqAevyCdMC5686Q,22,People & Blogs,"Ana Gabriel, Simplemente Amigos, Ana Gabriel letra, Letra Ana Gabriel, Simplemente Amigos letra, Letra Simplemente Amigos, Ana Gabriel Simplemente Amigos, Ana Gabriel Simplemente Amigos letra",8,https://i.ytimg.com/vi/carm3z_mMT4/hqdefault.jpg,es,es,False,228,PT3M48S,hd,False,True,False,False,710699,1024,11
Zq3UQgqkY-o,SV,2026-01-17T02:27:00.137715+00:00,2026-01-15T16:19:21Z,"Mi PRIMER PACK OPENING de los TOTY 2026, Pero con DRAFTS ILIMITADOS en FC Mobile","Mi PRIMER PACK OPENING de los TOTY 2026, Pero con DRAFTS ILIMITADOS en FC Mobile",Frank,UC_287_D5uUigR6rGNyawD5A,20,Gaming,"fc mobile, toty 2026, fc mobile toty, pack opening fc mobile, toty pack opening, drafts ilimitados fc mobile, sobres toty, evento toty fc mobile, frank fifa, franklyn jhonson",10,https://i.ytimg.com/vi/Zq3UQgqkY-o/hqdefault.jpg,es,es,False,1122,PT18M42S,hd,False,True,False,False,198412,11453,1313
rSBUf5H26ug,SV,2026-01-17T02:27:00.137722+00:00,2026-01-06T17:01:27Z,Daddy Yankee Feat. Alex Zurdo (Video Oficial),Daddy Yankee Feat. Alex Zurdo (Video Oficial),Daddy Yankee,UC9TO_oo4c_LrOiKNaY6aysA,10,Music,"#Legendaddy, #DaddyYankee, #DY, #thebigboss, #laultimavueltaworld, #thegoat, Reggaeton videos, bonita, Daddy Yankee cristiano, Daddy Yankee 2024, Lamento en Baile, ABCD, Daddy Yankee, Musica Nueva DY, Daddy Yankee cristiana, Alex Zurdo, video nuevo DY, video nuevo daddy yankee, musica nueva urbana, reggaeton 2026, musica para las mañanas, musica para levantar el ánimo",22,https://i.ytimg.com/vi/rSBUf5H26ug/hqdefault.jpg,es-419,es,False,182,PT3M2S,hd,True,False,False,False,7700662,95274,5987
BgN8-Kbm_Qk,SV,2026-01-17T02:27:00.137730+00:00,2026-01-11T21:23:46Z,!LLUVIA DE GOLES¡ BARCELONA 3 - 2 REAL MADRID⚽ SUPERCOPA - PARTIDO SIMULADO - RELATO REY DEPORTIVO,!LLUVIA DE GOLES¡ BARCELONA 3 - 2 REAL MADRID⚽ SUPERCOPA - PARTIDO SIMULADO - RELATO REY DEPORTIVO,REY DEPORTIVO,UC2dIOBUj2eIUOb0GJ4LmNnQ,17,Sports,,0,https://i.ytimg.com/vi/BgN8-Kbm_Qk/hqdefault.jpg,es,es-419,False,7532,PT2H5M32S,hd,False,True,False,False,847759,2434,7
