video_id,country,fetched_at,published_at,title,localized_title,channel_title,channel_id,category_id,category_name,tags,tag_count,thumbnail,default_language,audio_language,is_live,duration,duration_raw,definition,caption_available,licensed_content,embeddable,made_for_kids,views,likes,comments
EochZ-iyrqQ,SV,2026-01-17T02:27:00.137296+00:00,2026-01-09T00:00:07Z,"Ryan Castro, Kapo, Gangsta - LA VILLA (Video Oficial) | HOPI SENDÉ","Ryan Castro, Kapo, Gangsta - LA VILLA (Video Oficial) | HOPI SENDÉ",Ryan Castro,UCU4Zw6BTodIqGYUpvlaLD5A,10,Music,"Ryan Castro, que chimba, sog, broken Minds, ryan castro mix, ryan castro letra, mix ryan castro, musica ryan, videos nuevos, musica nueva, la villa, su mini mini, kapo ryan castro, ryan castro kapo, la villa video, video la villa, la villa video oficial, ryan castro la villa, la villa kapo, kapo la villa, la villa ryan, sanka, donde, a mi me gustan las blonde, kapo ryan, ryan kapo la villa, Gangsta",27,https://i.ytimg.com/vi/EochZ-iyrqQ/hqdefault.jpg,es,es-419,False,202,PT3M22S,hd,False,True,False,False,6627488,70152,1650
-1UJJPAWudQ,SV,2026-01-17T02:27:00.137336+00:00,2026-01-14T16:00:13Z,Euphoria Season 3 | Trailer | HBO Max,Euphoria Season 3 | Trailer | HBO Max,HBO Max,UCx-KWLTKlB83hDI6UKECtJQ,24,Entertainment,"hbo max, hbo, hbo originals, hbo original series, hbo trailer, new on hbo, hbo max originals, hbo max trailer, hbo max series, hbo max youtube, euphoria, euphoria season 3, euphoria trailer 1, euphoria trailer, zendaya, sydney sweeney, jacob elordi, rue, cassie, nate, alexa demie, maddy, lexi, jules, maude apatow, hunter schafer, zendaya euphoria, euphoria new season, hbo euphoria season 3, sydney sweeney euphoria, sydney sweeney cassie, cassie and nate, cassie and maddy",33,https://i.ytimg.com/vi/-1UJJPAWudQ/hqdefault.jpg,en,en,False,145,PT2M25S,hd,True,True,False,False,3550697,91014,6276
m9g8JaTPuis,SV,2026-01-17T02:27:00.137349+00:00,2026-01-11T23:14:53Z,🟢 BARCELONA CAMPEÓN DE LA SUPERCOPA DE ESPAÑA DESPUÉS DE VENCER AL REAL MADRID ,🟢 BARCELONA CAMPEÓN DE LA SUPERCOPA DE ESPAÑA DESPUÉS DE VENCER AL REAL MADRID ,VERDOLAGA TV,UCUhh5pPI5KocjpuwJ1dHx_g,17,Sports,"Real Madrid vs Barcelona hoy, Real Madrid vs Barcelona ver, Real Madrid en vivo, Barcelona en vivo, partido de Barcelona en vivo, Real Madrid, Barcelona vs Real Madrid, Barcelona Real Madrid, Barcelona Real Madrid hoy, ver Real Madrid Barcelona, Partido del Real Madrid, Mbappe, ESPN, DirecTV, Partido de Real Madrid, En vivo Real Madrid, Yamal, noticias del verde, cabala futbolera, futbol digital, supercopa, final, supercopa de españa, final supercopa, partido real madrid barcelona",25,https://i.ytimg.com/vi/m9g8JaTPuis/hqdefault.jpg,es,es-419,False,14176,PT3H56M16S,hd,False,True,False,False,2060031,11175,20
oTnMYPr2PGM,SV,2026-01-17T02:27:00.137358+00:00,2026-01-08T19:00:54Z,Farruko  Ft. Ky-Mani Marley - Chillax(Letra),Farruko  Ft. Ky-Mani Marley - Chillax(Letra),Sonalux,UC4t5Ht7gCo89-2r47qhdfzg,10,Music,,0,https://i.ytimg.com/vi/oTnMYPr2PGM/hqdefault.jpg,es,es,False,199,PT3M19S,hd,False,True,False,False,877508,1393,6
-poSVOan2fw,SV,2026-01-17T02:27:00.137366+00:00,2026-01-10T18:00:01Z,The Prototype | Poppy Playtime Chapter 5 Cinematic Trailer,The Prototype | Poppy Playtime Chapter 5 Cinematic Trailer,Mob Entertainment,UCXqV4yoyC_mmZye6VbKFPeQ,20,Gaming,,0,https://i.ytimg.com/vi/-poSVOan2fw/hqdefault.jpg,en,en,False,106,PT1M46S,hd,False,True,False,False,4434640,297359,21365
kcQPLzQQkYQ,SV,2026-01-17T02:27:00.137374+00:00,2026-01-13T18:15:06Z,Apocalipsis Hytale Mi primera Vez #1,Apocalipsis Hytale Mi primera Vez #1,VEGETTA777,UCam8T03EOFBsNdR0thrFHdQ,20,Gaming,"hytale, vegetta777, vegetta777 hytale, hytale como minecraft vegetta777, hytale nuevo juego, hytale rol, hytale vegetta777, hytale juego de cubos, hytale videojuego, hytale partida, hytale gameplay, hytale 2026, hytale juego como minecraft, hytale historias, hytale partida de minecraft, hytale sandbox vegetta777, hytale juego mundo abierto, hytale juego de rol libre, hytale juego sandbox, hytale riot, hytale hypixel",21,https://i.ytimg.com/vi/kcQPLzQQkYQ/hqdefault.jpg,es,es,False,2735,PT45M35S,hd,False,True,False,False,3258789,363704,8330
frtp1MZF_G0,SV,2026-01-17T02:27:00.137383+00:00,2026-01-11T19:30:08Z,Romeo Santos - Necio (Letra/Lyrics),Romeo Santos - Necio (Letra/Lyrics),Crixara,UCIbksu6tZptEe-sc9jpa6ng,10,Music,"crixara, Romeo Santos, Santana, Necio, Romeo Santos Necio, Necio letra, Necio lyrics, Letra oficial, Lyrics video, Bachata, Carlos Santana, Bachata 2026, Formula Vol 2, The King of Bachata, Guitar Solo, Romeo Santos Santana, Necio karaoke, Letras de bachata, Musica Tropical, Dominican Republic, Latin Music, Necio audio, Romeo Santos letra, Santana guitar, Best Bachata Songs, Necio official lyrics, Necio Romeo Santos Santana letra, Pop Latino, Bachata Classics, letra",30,https://i.ytimg.com/vi/frtp1MZF_G0/hqdefault.jpg,es,es,False,265,PT4M25S,hd,False,True,False,False,1479210,1669,9
9WrCwE9uJRo,SV,2026-01-17T02:27:00.137391+00:00,2026-01-13T18:25:20Z,"FANTÁSTICO trailer final confirma caída 616 en Avengers Doomsday, equipos y trailer CONTEO final","FANTÁSTICO trailer final confirma caída 616 en Avengers Doomsday, equipos y trailer CONTEO final",Pelicomic,UCsMzBY3X_RS6GhGBiHXW19A,24,Entertainment,,0,https://i.ytimg.com/vi/9WrCwE9uJRo/hqdefault.jpg,es-419,es-419,False,940,PT15M40S,hd,False,True,False,False,394966,18279,851
Eb26cacpCHM,SV,2026-01-17T02:27:00.137399+00:00,2026-01-14T18:13:44Z,"EL ZAPDOS LEGENDARIO (Minecraft Pokemon, Episodio 8)","EL ZAPDOS LEGENDARIO (Minecraft Pokemon, Episodio 8)",Rubius Z,UCcjIvuxmWlS5IEQ0JdPV4Ng,20,Gaming,"elrubius, rubius, minecraft, pokemon, serie, minecraft pokemon, pokemon mod minecraft, mod, Rubius pokemon, cobbleverse, Cobbleverse rubius, minecraft survival, minecraft con pokemons, gameplay, mods, pikachu, gyarados, Eevee, rubius pokemon mod, Pokémon, shiny, 2026, nuevo, nueva, nueva serie, capitulo, meme, memes, koga, epic, Dragapult, episodio 8, rubius pokemon 8, cap 8, sabrina, zapdos, legendario",37,https://i.ytimg.com/vi/Eb26cacpCHM/hqdefault.jpg,es,es,False,2886,PT48M6S,hd,False,True,False,False,1791965,120683,6333
-mK2MGuNbeo,SV,2026-01-17T02:27:00.137407+00:00,2026-01-16T00:00:06Z,Kenia Os - Belladona (Video Oficial),Kenia Os - Belladona (Video Oficial),KeniaOSVEVO,UCQ5NyEL2K6VW-lKRru1XmUw,10,Music,"kenia os, belladona, kenia os belladora, de karma, kenia os ka de karma, kenia os nuevo, kenia os 2026, kenia os exitos, kenini, Angry, Dramatic, Electropop, Haunting, Heartbreak, Pop, Pop En Español",16,https://i.ytimg.com/vi/-mK2MGuNbeo/hqdefault.jpg,es,es,False,228,PT3M48S,hd,True,True,False,False,1104490,142741,16519
Ci7bpzdxe1M,SV,2026-01-17T02:27:00.137415+00:00,2026-01-15T17:00:20Z,POPPY PLAYTIME CHAPTER 5: 7 SPOILERS del TRAILER del PROTOTIPO,POPPY PLAYTIME CHAPTER 5: 7 SPOILERS del TRAILER del PROTOTIPO,WIZZY,UCDCIcjLEmAsjQ60j9xFv-sg,24,Entertainment,,0,https://i.ytimg.com/vi/Ci7bpzdxe1M/hqdefault.jpg,es,es,False,726,PT12M6S,hd,False,True,False,False,257319,9831,385
SenyopNyAfI,SV,2026-01-17T02:27:00.137423+00:00,2026-01-15T20:59:48Z,🎉FELIZ🎉CUMPLEAÑOS🎉AMI🎉TSUNAMI🎉BRANROT🎉HYTALE🎉,🎉FELIZ🎉CUMPLEAÑOS🎉AMI🎉TSUNAMI🎉BRANROT🎉HYTALE🎉,ElAbrahaham,UColTsB6zogXWooPbeO67Wgw,24,Entertainment,,0,https://i.ytimg.com/vi/SenyopNyAfI/hqdefault.jpg,es-MX,es-419,False,6662,PT1H51M2S,hd,False,True,False,False,1430551,61059,7926
XbVJeM41nac,SV,2026-01-17T02:27:00.137430+00:00,2026-01-14T06:37:04Z,Al Final del Día,Al Final del Día,Xolo Music - Topic,UCkappmwLJDYoIAfZmADdchg,10,Music,"Xolo Music, Al Final del Día",2,https://i.ytimg.com/vi/XbVJeM41nac/hqdefault.jpg,es,es,False,225,PT3M45S,hd,False,True,False,False,616224,8608,0
U31h34fvbiI,SV,2026-01-17T02:27:00.137438+00:00,2026-01-10T18:28:36Z,15 DETALLES OCULTOS de POPPY PLAYTIME 5 💙 Tráiler 3 (Análisis),15 DETALLES OCULTOS de POPPY PLAYTIME 5 💙 Tráiler 3 (Análisis),Nintendúo,UCassa1LNXUUGx7RZ5bsZYpA,20,Gaming,"nintenduo, nintendo duo, Poppy Playtime Capitulo 5, Poppy Playtime Chapter 5, Poppy Playtime 5 Trailer 3, 15 detalles ocultos Poppy Playtime, secretos que no viste Poppy Playtime 5, análisis trailer poppy playtime 5, Mob Entertainment, El Prototipo 1006, nuevos monstruos poppy playtime, poppy playtime 5 fecha, poppy playtime chapter 5 gameplay, historia poppy playtime explicada, reacción trailer 3, Nintendúo, easter eggs poppy playtime 5, final explicado, teoría poppy playtime 5",19,https://i.ytimg.com/vi/U31h34fvbiI/hqdefault.jpg,es,es,False,598,PT9M58S,hd,False,True,False,False,591300,18123,460
kAoiDm07kBY,SV,2026-01-17T02:27:00.137446+00:00,2026-01-15T21:03:25Z,Construí una CASA SECRETA dentro de mi AMIGO en Minecraft!,Construí una CASA SECRETA dentro de mi AMIGO en Minecraft!,Dagar,UCEs5MQjXJq27-X2vgdwtYDw,20,Gaming,"Minecraft, minecraft mod, dagar y nacho, nacho y dagar, amigos minecraft, dagar minecraft, minecraft dagar",7,https://i.ytimg.com/vi/kAoiDm07kBY/hqdefault.jpg,es,es-ES,False,1365,PT22M45S,hd,False,True,False,False,847384,11904,3534
19o3R_AVats,SV,2026-01-17T02:27:00.137454+00:00,2026-01-09T23:15:06Z,Fuerza Regida - Marlboro Rojo (Letra),Fuerza Regida - Marlboro Rojo (Letra),RIXELUS,UCrkF_lRGv6wuOZVNWCuOCuA,10,Music,"fuerza regida, marlboro rojo, 111xpantia, fuerza regida album, fuerza regida marlboro rojo letra, fuerza regida marlboro rojo karaoke, fuerza regida marlboro rojo lyrics, fuerza regida marlboro rojo audio, fuerza regida marlboro rojo tiktok, latin pop, pop latino, musica latina, karaoke, hd, hq, topic, rixelus",17,https://i.ytimg.com/vi/19o3R_AVats/hqdefault.jpg,es,es,False,185,PT3M5S,hd,False,True,False,False,2384956,6729,45
zhTkMxOmu0Y,SV,2026-01-17T02:27:00.137461+00:00,2026-01-06T18:13:51Z,Último trailer filtrado Avengers Doomsday Y RUMORES - The Top Comics,Último trailer filtrado Avengers Doomsday Y RUMORES - The Top Comics,The Top Comics,UCiBwOVBljEjcsLUjwI274Xw,1,Film & Animation,"marvel studios, cuatro fantásticos, fantastic four, the thing, top comic, MrX, easter egg, tenoch huerta, talokan, robert downey jr, tom holland, tobey maguire",12,https://i.ytimg.com/vi/zhTkMxOmu0Y/hqdefault.jpg,es-419,es-419,False,864,PT14M24S,hd,False,True,False,False,347181,15513,656
EqX1-qkOMpY,SV,2026-01-17T02:27:00.137469+00:00,2026-01-15T18:23:57Z,ATRAPADAS en el MAR con Mandarina en Roblox,ATRAPADAS en el MAR con Mandarina en Roblox,Lyna,UC-cnbLlplnXA4oc7rR21qzg,20,Gaming,,0,https://i.ytimg.com/vi/EqX1-qkOMpY/hqdefault.jpg,es-419,es-419,False,1433,PT23M53S,hd,False,True,False,False,782904,6904,731
gU1dJE3NABU,SV,2026-01-17T02:27:00.137477+00:00,2026-01-13T16:00:06Z,"Tainy, Anuel AA, Ozuna - Adicto (Letra)","Tainy, Anuel AA, Ozuna - Adicto (Letra)",Urban Heartbeat,UCAekKGX2VpcHML4XHvPfN1w,22,People & Blogs,"Tainy, Anuel AA, Ozuna - Adicto (Letra), Ozuna, Adicto (Letra), Adicto, Letra",7,https://i.ytimg.com/vi/gU1dJE3NABU/hqdefault.jpg,es,es,False,268,PT4M28S,hd,False,True,False,False,758333,1096,7
ThCDAkRMWPk,SV,2026-01-17T02:27:00.137484+00:00,2026-01-10T18:00:14Z,1006 ESTA AQUI!!! - Poppy Playtime Capitulo 5 Trailer - Analisis y Reaccion,1006 ESTA AQUI!!! - Poppy Playtime Capitulo 5 Trailer - Analisis y Reaccion,ÑeBoyGamer,UC2dyvfVqMfmXUxgL0oAuXTw,20,Gaming,"poppy playtime capitulo 5, poppy playtime chapter 5, poppy playtime huggy wuggy capitulo 5, poppy playtime 5 trailer, poppy playtime capitulo 5 teoria, poppy palytime 5 teaser trailer, poppy playtime, Poppy Playtime chapter 5, Poppy Playtime 5, Poppy Playtime nuevo enemigo, Poppy Playtime 5 news, poppy playtime 5, poppy playtime 5 teaser, poppy playtime trailer, poppy, Poppy Playtime teaser trailer, Poppy Playtime Lily, Poppy playtime 1006, poppy playtime the prototype, 1006",20,https://i.ytimg.com/vi/ThCDAkRMWPk/hqdefault.jpg,es,es,False,891,PT14M51S,hd,False,True,False,False,159349,9692,1521
5lu0J7PXv18,SV,2026-01-17T02:27:00.137492+00:00,2026-01-15T01:30:06Z,CONSIGO LA SKIN de SATORU GOJO en FREE FIRE x JUJUTSU KAISEN y ME SORPRENDI !! - TheDonato,CONSIGO LA SKIN de SATORU GOJO en FREE FIRE x JUJUTSU KAISEN y ME SORPRENDI !! - TheDonato,TheDonato,UCaHEdZtk6k7SVP-umnzifmQ,20,Gaming,,0,https://i.ytimg.com/vi/5lu0J7PXv18/hqdefault.jpg,es,es,False,2061,PT34M21S,hd,False,True,False,False,895571,34889,2131
6hO0qKNBfLE,SV,2026-01-17T02:27:00.137499+00:00,2026-01-06T19:00:11Z,"Grupo Firme, Luis Alfonso Partida El Yaki - QUE TE QUIERAN BONITO (Letra)","Grupo Firme, Luis Alfonso Partida El Yaki - QUE TE QUIERAN BONITO (Letra)",Melodix,UC39c6lyW91RaT5CJipWY8xQ,10,Music,"Música romántica, Canciones de amor, Baladas románticas, Éxitos románticos, Música para dedicar, Baladas de amor, Canciones románticas en español, Música para parejas, Música de amor, Música tranquila, Canciones de desamor, Baladas clásicas, Romantic music, Love songs, Romantic ballads, Music for lovers, Romantic hits, Music to dedicate, Love ballads, Romantic songs in Spanish, Music for couples, Love music, Songs to fall in love, Relaxing music",24,https://i.ytimg.com/vi/6hO0qKNBfLE/hqdefault.jpg,es,es,False,163,PT2M43S,hd,False,True,False,False,984732,2471,27
WsYsNoNjbaw,SV,2026-01-17T02:27:00.137506+00:00,2026-01-13T04:00:36Z,"Character Trailer - ""Columbina: To Where She Flies"" | Genshin Impact #GenshinImpact #Columbina","Character Trailer - ""Columbina: To Where She Flies"" | Genshin Impact #GenshinImpact #Columbina",Genshin Impact,UCiS882YPwZt1NfaM0gR0D9Q,20,Gaming,,0,https://i.ytimg.com/vi/WsYsNoNjbaw/hqdefault.jpg,en,en-US,False,228,PT3M48S,hd,False,False,False,False,1241430,150804,7511
3N-_PeL-u6w,SV,2026-01-17T02:27:00.137513+00:00,2026-01-16T20:30:56Z,Nuestra primera CITA en la vida real..,Nuestra primera CITA en la vida real..,SoyPato,UCFP33-zlNfJVzWUUbdhSjTQ,20,Gaming,"roblox, roblox español, roblox divertido, roblox fyp, roblox humor, roblox momentos divertidos, roblox roblox, roblox funny, roblox 99 noches en el bosque, 99 noches en el bosque, sobrevive 99 dias en el bosque, 99 noches en el bosque roblox, soypato, soypato 99 noches, ikari y pato, ikari y soy pato, pato ikari, cita pato y ikari, cita pato ikari, cita soypato ikari, ikari y pato se conocen, soypato cita, soy pato cita, soy pato cita con ikari, soypato cita con ikari",25,https://i.ytimg.com/vi/3N-_PeL-u6w/hqdefault.jpg,es,es,False,751,PT12M31S,hd,False,True,False,False,415711,14380,4762
2DdRQ4rWzZ0,SV,2026-01-17T02:27:00.137521+00:00,2026-01-08T20:47:19Z,Rocío Dúrcal - Como Tu Mujer (Letra),Rocío Dúrcal - Como Tu Mujer (Letra),jostland.,UC1qMwcumipfgTLd3TA1vVZg,10,Music,"como tu mujer rocio durcal, como tu mujer rocio durcal letra, como tu mujer rocio durcal karaoke, como tu mujer durcal remix, como tu mujer rocio durcal y marco antonio solis, como tu mujer rocio, como tu mujer rocio durcal reggaeton, como tu mujer rocio durcal en vivo, como tu mujer rocio durcal video oficial, rocio durcal como tu mujer, rocio durcal como tu mujer remix, rocio durcal como tu mujer karaoke, rocio durcal como tu mujer letra, letra, lyrics, karaoke, video oficial, hd, hq",19,https://i.ytimg.com/vi/2DdRQ4rWzZ0/hqdefault.jpg,es,es,False,264,PT4M24S,hd,False,True,False,False,2130074,8220,38
8S0JcaNksmE,SV,2026-01-17T02:27:00.137528+00:00,2026-01-13T08:02:22Z,Everyone can get Finx for FREE! #RandomBS,Everyone can get Finx for FREE! #RandomBS,Brawl Stars,UCooVYzDxdwTtGYAkcPmOgOw,20,Gaming,"brawl stars, mobile game, mobile strategy game, mobile rpg, mobile battle royale, battle royale, supercell game, community event, new event, randombs",10,https://i.ytimg.com/vi/8S0JcaNksmE/hqdefault.jpg,en,en,False,229,PT3M49S,hd,True,True,False,False,5754135,121570,6813
nPYNpra2xcM,SV,2026-01-17T02:27:00.137535+00:00,2026-01-12T19:00:52Z,"Feid, ATL Jacob - LUNA (LETRA)","Feid, ATL Jacob - LUNA (LETRA)",FlowVerso,UCeaIKrEW4gqu8vSLLuEfzfg,10,Music,,0,https://i.ytimg.com/vi/nPYNpra2xcM/hqdefault.jpg,es,es,False,195,PT3M15S,hd,False,True,False,False,821984,793,6
8It_xZ8dFq0,SV,2026-01-17T02:27:00.137542+00:00,2026-01-12T23:31:17Z,ɆⱠ ₵Ⱨ₳VØ ĐɆⱠ Ø₵ⱧØ,ɆⱠ ₵Ⱨ₳VØ ĐɆⱠ Ø₵ⱧØ,JuegaGerman,UCYiGq8XF7YQD00x7wAd62Zg,20,Gaming,"juegagerman, juega, german, holasoygerman, hola soy german, juega german, el chavo del ocho, el chavo del 8, terror, miedo, juego de terror, chaves nightmares, chaves nightmares ios",13,https://i.ytimg.com/vi/8It_xZ8dFq0/hqdefault.jpg,es-419,es-419,False,1749,PT29M9S,hd,False,True,False,False,2426896,102967,3359
F3ZUJRzUVKc,SV,2026-01-17T02:27:00.137549+00:00,2026-01-10T17:32:55Z,Fuerza Regida - TU SANCHO (Letra),Fuerza Regida - TU SANCHO (Letra),GroovLatn,UCK7wSPETZbh2PK4SX33SuqQ,22,People & Blogs,"Fuerza regida tu sancho letra, Fuerza regida, Fuerza regida 111xpantia, Fuerza Regida Tu Sancho, Tu sancho letra, Tu sancho letra fuerza regida, Mi niña alista tu maleta ahorita, tu sancho fuerza regida, fuerza regida tu sancho, Sin pedos te espero, Tu sancho, Tu sancho intro",12,https://i.ytimg.com/vi/F3ZUJRzUVKc/hqdefault.jpg,es,es,False,180,PT3M,hd,False,True,False,False,2042576,1863,14
Mhr8ioQyiWc,SV,2026-01-17T02:27:00.137557+00:00,2026-01-14T21:02:11Z,ESCAPE del SUPER MEGA TSUNAMI por un BRAINROT y NO estaba listo😱,ESCAPE del SUPER MEGA TSUNAMI por un BRAINROT y NO estaba listo😱,Juan Pablo Hollman,UC_jPOlWOeDB65nj419oH_Vw,22,People & Blogs,,0,https://i.ytimg.com/vi/Mhr8ioQyiWc/hqdefault.jpg,es,es,False,1268,PT21M8S,hd,False,True,False,False,732989,17768,670
H9j7GvgSgmI,SV,2026-01-17T02:27:00.137564+00:00,2026-01-08T22:30:06Z,Fuerza Regida - ANSIEDAD (Letra),Fuerza Regida - ANSIEDAD (Letra),Lufenix,UCHiKs3Iq5rGPC-UmQtjIsvQ,10,Music,"latin pop, latin, fuerza regida, 111 x pantia album, ANSIEDAD, fuerza regida ansiedad letra, fuerza regida ansiedad audio",7,https://i.ytimg.com/vi/H9j7GvgSgmI/hqdefault.jpg,es,es,False,152,PT2M32S,hd,False,True,False,False,748806,816,2
yhGkqp5nOGw,SV,2026-01-17T02:27:00.137572+00:00,2026-01-12T21:26:18Z,Minecraft PERO los Bloques dan ARMAS ALEATORIAS,Minecraft PERO los Bloques dan ARMAS ALEATORIAS,Acenix,UCH3h4jRKn3lJo0uORqqESPg,20,Gaming,"acenix, minecraft, minecraft pero, acenix minecraft",4,https://i.ytimg.com/vi/yhGkqp5nOGw/hqdefault.jpg,es,es,False,1956,PT32M36S,hd,False,True,False,False,1386431,17628,721
7rH1JlCz2hg,SV,2026-01-17T02:27:00.137580+00:00,2025-12-29T22:10:11Z,7-3 - Peso Pluma & Tito Double P (Lyric Video),7-3 - Peso Pluma & Tito Double P (Lyric Video),Peso Pluma,UCzrM_068Odho89mTRrrxqbA,10,Music,"tito doble p, la doble p, peso pp, doble p, peso pluma, doblepp, doble pp, pp peso pluma, peso pluma mix, tito double p, peso tito, dinastía, peso pluma dinastia, peso tito dinastia, peso pluma tito double p, música mexicana mix, corridos, dinastía laija, peso pluma letra, tito double p mix, musica peso pluma, disco nuevo peso pluma, música nueva tito doble p, canciones tito, corridos peso, dinastía letra, 7 3, 7-3 tito double p, 7-3 peso pluma, 7-3 peso pluma reaccion",30,https://i.ytimg.com/vi/7rH1JlCz2hg/hqdefault.jpg,es,es,False,190,PT3M10S,hd,False,True,False,False,7761599,53769,456
51qoKbBlJhA,SV,2026-01-17T02:27:00.137589+00:00,2026-01-11T23:31:21Z,REAL MADRID 3-2 BARCELONA | FINAL SUPER COPA DE ESPAÑA 2026 | Resumen simulación de videojuego,REAL MADRID 3-2 BARCELONA | FINAL SUPER COPA DE ESPAÑA 2026 | Resumen simulación de videojuego,十Loork Football,UCfFNw7MaO7QmWkswaGFGEvA,20,Gaming,"Barcelonavs, Real Madrid, Barcelonavs Real Madrid, Barcelonavs Real Madrid 2026, Real Madrid vs Barcelona2026, Spanish Super Cup 2026, Real Madrid vs BarcelonaSpanish Super Cup 2026, Barcelonavs Real Madrid Spanish Super Cup 2026, Barcelona, Super Copa de España, Real Madrid F.C., BarcelonaF.C., Supercopa de España, Spanish Super Cup",14,https://i.ytimg.com/vi/51qoKbBlJhA/hqdefault.jpg,es-419,es-419,False,235,PT3M55S,hd,False,True,False,False,526336,4110,1
k594LAxYYRE,SV,2026-01-17T02:27:00.137616+00:00,2026-01-08T12:01:29Z,Fuerza Regida - ANSIEDAD (Letra/Lyrics),Fuerza Regida - ANSIEDAD (Letra/Lyrics),SoundKream,UCvWhPqiJBsdsZmM9cEzQorg,10,Music,"Fuerza Regida, ANSIEDAD lyrics, Fuerza Regida lyrics, Latin music, Mexican music, regional music, anxiety song, letra ANSIEDAD, music video, Fuerza Regida song, Spanish lyrics, emotional songs, popular Latin songs, music analysis, lyrics breakdown, music reactions, band interviews, music trends, song meanings, Viral, lyrics, letra, ansiedad, fuerza regida, TikTok",25,https://i.ytimg.com/vi/k594LAxYYRE/hqdefault.jpg,es,es,False,152,PT2M32S,hd,False,True,False,False,1256137,2642,13
XSYZv0Mq9Rg,SV,2026-01-17T02:27:00.137625+00:00,2026-01-14T17:01:00Z,Sobreviví a ESCAPA DEL TSUNAMI por BRAINROTS en ROBLOX 🔥,Sobreviví a ESCAPA DEL TSUNAMI por BRAINROTS en ROBLOX 🔥,Betillo,UC8st6FaRPJcQXCvJk31caQA,20,Gaming,"roblox, roblox español, ROBLOX, mejores brainrots, elabrahaham, el simio mayor, juanpablohollman, betillo, soybetilloelguapillo, soybetillo, tio betillo, 99 noches, los bros, los bros roblox, bros, admin abuse, admin abuse indonesia, admin abuse halloween, troll, juego troll",20,https://i.ytimg.com/vi/XSYZv0Mq9Rg/hqdefault.jpg,es,es,False,1274,PT21M14S,hd,False,True,False,False,635806,15421,1155
rB503AM-SRc,SV,2026-01-17T02:27:00.137633+00:00,2026-01-09T17:00:06Z,Juan Gabriel - Así Fue (Letra),Juan Gabriel - Así Fue (Letra),Voces del Alma,UCwR0RlKeSkhvIL6_yYH3oPg,22,People & Blogs,,0,https://i.ytimg.com/vi/rB503AM-SRc/hqdefault.jpg,es,es,False,379,PT6M19S,hd,False,True,False,False,1345566,2100,39
W-kUEgKs6C0,SV,2026-01-17T02:27:00.137640+00:00,2026-01-14T21:48:19Z,Me Convertí en CÁMARA MONSTRUO para Espiar a Mis Amigos en Minecraft,Me Convertí en CÁMARA MONSTRUO para Espiar a Mis Amigos en Minecraft,Nacho,UC8EkcHOycB94lHDkbAPSnQA,20,Gaming,"nacho, dagar, nacho minecraft, dagar y nacho, nacho y dagar, minecraft, minecraft mod, dagar minecraft, camara, camaras minecraft, camara monstruo, troll, trolleo minecraft, espiar en minecraft, espia en minecraft, secreto, secretos minecraft, amigos minecraft, nacho y dagar y abi",19,https://i.ytimg.com/vi/W-kUEgKs6C0/hqdefault.jpg,es,es,False,1224,PT20M24S,hd,False,True,False,False,655514,9059,459
h-EuMZmjpZE,SV,2026-01-17T02:27:00.137648+00:00,2026-01-07T18:00:51Z,Vicente Fernández - La Diferencia (Letra/Lyrics),Vicente Fernández - La Diferencia (Letra/Lyrics),Último Sombrero,UCkjmjTu_bVat5P66I35yYpw,22,People & Blogs,"La Diferencia Vicente Fernández, Vicente Fernández La Diferencia, La Diferencia letra, La Diferencia lyrics, La Diferencia Vicente Fernández letra, Vicente Fernández La Diferencia letra, letra La Diferencia, lyrics La Diferencia, musica regional, musica regional mexicana, exitos regional, Regional Mexicano, Regional Mexican, musica mexicana, ranchera, mariachi, clasicos rancheros, Vicente Fernández, Ultimo Sombrero, Último Sombrero",20,https://i.ytimg.com/vi/h-EuMZmjpZE/hqdefault.jpg,es,es,False,171,PT2M51S,hd,False,True,False,False,1416212,5811,34
tZZRlBREAb8,SV,2026-01-17T02:27:00.137656+00:00,2026-01-12T00:11:30Z,STEAL A BRAINROT GIVEAWAY LIVE | STEAL A BRAINROT FREE SECRETS + FREE BRAINROT GODS,STEAL A BRAINROT GIVEAWAY LIVE | STEAL A BRAINROT FREE SECRETS + FREE BRAINROT GODS,Joxy,UC3DlDcaefUYr-1skxaiLxVw,20,Gaming,"steal a brainrot giveaway, steal a brainrot giveaway live, steal a brainrot secret giveaway, steal a brainrot live giveaway, steal a brainrot brainrot god giveaway, steal a brainrot stream, steal a brainrot live, steal a brainrot 24/7 stream, steal a brainrot, steal a brainrot god, w steal a brainrot, steal a brainrot game, steal a brainrot gifting, steal a brainrot mod, steal a brainrot glitch, steal a brainrot 24/7, roblox steal a brainrot, steal a brainrot roblox",18,https://i.ytimg.com/vi/tZZRlBREAb8/hqdefault.jpg,en,en,False,9,PT9S,hd,False,True,False,False,471911,6686,31
RWOBTnCp6tM,SV,2026-01-17T02:27:00.137664+00:00,2026-01-09T10:00:49Z,Zundada,Zundada,DJ Memo - Topic,UCNjbsTyftB2GMaPlQdKTmtg,10,Music,"Dj Memo, Exitos, Zundada",3,https://i.ytimg.com/vi/RWOBTnCp6tM/hqdefault.jpg,en,bn,False,301,PT5M1S,hd,False,True,False,False,158971,895,4
7-h8ejHvHZU,SV,2026-01-17T02:27:00.137671+00:00,2026-01-15T21:00:17Z,12 FORMAS de ROBAR DIAMANTES a Tus AMIGOS en Minecraft,12 FORMAS de ROBAR DIAMANTES a Tus AMIGOS en Minecraft,DanoMC,UCayC0ZYU9iq5PyuDG18BVsA,20,Gaming,"12 FORMAS de ROBAR DIAMANTES a Tus AMIGOS en Minecraft, FORMAS de ROBAR DIAMANTES, FORMAS de ROBAR DIAMANTES a Tus AMIGOS, FORMAS de ROBAR DIAMANTES a Tus AMIGOS en Minecraft, Minecraft, danomc, dano, mc, diamantes, diamantes minecraft, minecraft diamantes, danomc miedo, minecraft terror, niki, arsel, keciyo, superkeciyo, danomc robar diamantes, danomc diamantes, danomc formas de robar a tus amigos, minecraft but, hice trampas en minecraft, danomc trolleos, trolleos en minecraft",24,https://i.ytimg.com/vi/7-h8ejHvHZU/hqdefault.jpg,es-ES,es-ES,False,1525,PT25M25S,hd,False,True,False,False,428758,5277,352
sOj6nVVlgCA,SV,2026-01-17T02:27:00.137679+00:00,2026-01-08T22:01:12Z,Prince Royce - El Amor Que Perdimos (Letra),Prince Royce - El Amor Que Perdimos (Letra),SabroSón,UCz-jVF7_acwSvt30vGJRTOw,10,Music,"Prince Royce, El Amor Que Perdimos, El Amor Que Perdimos letra, El Amor Que Perdimos lyrics, Prince Royce letra, Bachata, Bachata Romántica, Música Latina, Música Romántica, Bachata Clásica, Canción Viral, Hit Latino, Música 2025, Video con Letra, Lyric Video, Letra Oficial Prince Royce, Prince Royce 2025, Prince Royce El Amor Que Perdimos letra, Prince Royce El Amor Que Perdimos lyric video",19,https://i.ytimg.com/vi/sOj6nVVlgCA/hqdefault.jpg,es,es,False,246,PT4M6S,hd,False,True,False,False,376662,542,4
_Gvh8zCoe_o,SV,2026-01-17T02:27:00.137686+00:00,2026-01-13T18:24:34Z,🚤 DOS PAYASOS ABANDONADOS EN UNA BARCA EN MEDIO DE LA NADA | Raft #1,🚤 DOS PAYASOS ABANDONADOS EN UNA BARCA EN MEDIO DE LA NADA | Raft #1,Auron,UCFR2oaNj02WnXkOgLH0iqOA,20,Gaming,"Auron, AuronPlay",2,https://i.ytimg.com/vi/_Gvh8zCoe_o/hqdefault.jpg,es-ES,es,False,5025,PT1H23M45S,hd,False,True,False,False,786440,30715,522
