video_id,country,fetched_at,published_at,title,localized_title,channel_title,channel_id,category_id,category_name,tags,tag_count,thumbnail,default_language,audio_language,is_live,duration,duration_raw,definition,caption_available,licensed_content,embeddable,made_for_kids,views,likes,comments
tdXt0zk4TWo,LY,2026-03-11T03:10:34.548035+00:00,2026-03-08T18:51:40Z,الجندي الراب - بلا بيك | Aljundi - Bla Beek (Official Music Video),الجندي الراب - بلا بيك | Aljundi - Bla Beek (Official Music Video),الجندي | Aljundi,UCXHXtzISJRN_KrHfZyzuOsg,10,Music,"Aljundi, blidog, ماتلومش, راب ليبي, samara, rap tunis, aghani, rap tunisien, hip hop, blingos, freestyle, arabic, على مولانا, north africa, balti, rap, hiphop, rap libya, redstar, al shami, ala, music, musica, musik, musique, libia rap, rap libia, rap shar3, راب شارع, aljundi, video clip, راب تونسي, official channel, راب, ليبي, magreb, mrocco, الجندي, أغاني, لبيا, موسيقى, ليبيا, اغاني عربيه, راب مغربي, راب مصر, arabic rap, مهرجان, Maly ana, مالي أنا, bla beek, بلا بيك, arabic hip hop, rap tounsi",53,https://i.ytimg.com/vi/tdXt0zk4TWo/hqdefault.jpg,ar,ar,False,158,PT2M38S,hd,False,False,False,False,88301,5953,769
qppXTTPVOPA,LY,2026-03-11T03:10:34.548094+00:00,2026-03-10T21:06:54Z,HARKA HARKA Official Trailer 2026 - MURYAR HAUSA TV #watashida ,HARKA HARKA Official Trailer 2026 - MURYAR HAUSA TV #watashida ,MURYAR HAUSA TV,UCSOmOGLCnGWj36UgWuTYsgw,24,Entertainment,,0,https://i.ytimg.com/vi/qppXTTPVOPA/hqdefault.jpg,ha,ha,False,177,PT2M57S,hd,False,True,False,False,4012,459,17
xswNOo0_ndI,LY,2026-03-11T03:10:34.548114+00:00,2026-03-10T17:30:18Z,وداعاً أبو فلة.. 💀 الوحش البنفسجي مسكني!! 😱🚫Poppy Playtime Chapter 5 (النهاية),وداعاً أبو فلة.. 💀 الوحش البنفسجي مسكني!! 😱🚫Poppy Playtime Chapter 5 (النهاية),AboFlah Gaming,UCRu9mro2nPafhMxVy2CRfXA,20,Gaming,"aboflah, flah, gaming, قيمنق, ابو فلة, abo, فله, ابوفلة, ابوفلاح, فلاح, falah, جيمنق, فورتنايت, روبلكس, رعب, حرامي سيارات, جي تي اي, ببجي, ببجي موبايل, PUBG, iphone, العرب, مصر, السعودية, الامارات, دبي, الكويت, kuwait, riyadh, سكواد, عشوائي, لعبة, تحدي, اصعب, ضحك, امونق اس, ديسكورد, ستريم, شات, ماينكرافت, فورت, وارزون, كود, aboflah gaming, abo flah, ابو فلاح, تختيم, سلسلة, فيفا, تحديات, محاكي, لعبة محاكي, هل ابوفله",53,https://i.ytimg.com/vi/xswNOo0_ndI/hqdefault.jpg,ar,ar,False,2214,PT36M54S,hd,False,True,False,False,535996,49751,4600
RSUr9fMjIqY,LY,2026-03-11T03:10:34.548152+00:00,2026-03-10T17:05:33Z,"Nordo - 7ali (From the Series ""Khateefa"") | نوردو - حالي (من مسلسل “خطيفة”)","Nordo - 7ali (From the Series ""Khateefa"") | نوردو - حالي (من مسلسل “خطيفة”)",MARWEN NORDO,UCIXt6QfV1V6fPmw7VGddWpg,10,Music,"نوردو, حالي, من مسلسل “الخطيفة”, From the Series ""Al Khateefa"", Nordo, 7ali, nordo, nordo 7ali, nordo hali, 7ali nordo, nordo 2026, nordo hali song, nordo hali al khateefa, nordo hali series song, nordo hali soundtrack, nordo hali حالي نوردو, نوردو حالي, اغنية حالي نوردو, اغاني نوردو, نوردو راب تونسي, نوردو جديد, اغنية حالي مسلسل الخطيفة, حالي مسلسل الخطيفة, نوردو الخطيفة, اغاني مسلسل الخطيفة, موسيقى مسلسل الخطيفة, تتر مسلسل الخطيفة al khateefa series song, nordo al khateefa",28,https://i.ytimg.com/vi/RSUr9fMjIqY/hqdefault.jpg,eo,en,False,147,PT2M27S,hd,False,True,False,False,47074,3256,241
4lFnIlH06Sw,LY,2026-03-11T03:10:34.548172+00:00,2026-03-06T20:00:07Z,Digital Circus Ep 8 Trailer.,Digital Circus Ep 8 Trailer.,GLITCH,UCn_FAXem2-e3HQvmK-mOH4g,1,Film & Animation,"glitch, glitch productions, digital circus, the amazing digital circus, murder drones, Pomni, Uzi, Jax, Ragatha, Kinger, Gangle, Zooble, Caine, Bubble, 3D, Animation, 3D Animation, Indie Animation, Gummigoo",19,https://i.ytimg.com/vi/4lFnIlH06Sw/hqdefault.jpg,en,en,False,67,PT1M7S,hd,True,True,False,False,8182696,745985,44329
IQ469ScotKE,LY,2026-03-11T03:10:34.548189+00:00,2026-03-10T12:21:23Z,فلم قراند : زعرور الفقير يصبح قائد اخطر عصابة في المدينة ( كركور خائف ) 🔥😂,فلم قراند : زعرور الفقير يصبح قائد اخطر عصابة في المدينة ( كركور خائف ) 🔥😂,Ahmad GTA Family - عائلة احمد قراند ,UCQkLgXGjPbIrrNtT8ZtHOmg,22,People & Blogs,"مصطفى GAME OVER, Mr GG, كرافتر - Crafter, XTREEM - اكستريم, اوكا - OKA, AboFlah, Mkamel GG, رانيا كيمنك Rania Gaming, BOZEX, هاردلك | hardlk, افلام, ماين كرافت, فلم ماين كرافت, غني وفقير, فايتر Fighter, ابو فله, فايتر, افلام ماين كرافت, الغني و الفقير, كوكب, M4X5, ماين, MineCraft Movie, Suhaib - صهيب, جلمود - GLMooD, تايمو Tymo, هاردلك HARDLK, Ahmad M4 - احمد ام فور, بطل, Ahmad Hero - احمد البطل, احمد هيرو, سمبوسة - Sambosa, جعطوط - JATOOT, خزان, طيران, P4GAM3R, Y9M5 \ يصمخ, قراند",38,https://i.ytimg.com/vi/IQ469ScotKE/hqdefault.jpg,ar,ar,False,1042,PT17M22S,hd,False,True,False,False,211476,2367,97
UJUuxerzHKI,LY,2026-03-11T03:10:34.548207+00:00,2026-03-09T10:53:41Z,سلسلة القافلة التراثية 2026   جدي الريم 6,سلسلة القافلة التراثية 2026   جدي الريم 6,توب ميوزك -Top-Music-SYSTEM,UC7w0F4RGb4atldzm5Rb1fwg,22,People & Blogs,,0,https://i.ytimg.com/vi/UJUuxerzHKI/hqdefault.jpg,ar,ar,False,660,PT11M,hd,False,True,False,False,6644,122,5
XNQbH1SDPRk,LY,2026-03-11T03:10:34.548222+00:00,2026-03-05T17:00:58Z,The Boys – Final Season Trailer | Prime Video,The Boys – Final Season Trailer | Prime Video,Prime Video,UCQJWtTnAHhEG5w4uN0udnUQ,24,Entertainment,"the boys, the boys season 5, the boys s5, the boys season 5 trailer, the boys season 5 teaser, the boys s5 trailer, the boys s5 teaser, the boys final season, the boys final season trailer, butcher vs soldier boy, butcher vs soldier boy rematch, homelander vs butcher, butcher vs homelander, soldier boy vs butcher, homelander and ryan, butcher vs hughie, hughie vs butcher, the boys final season trailer breakdown, the boys season 5 trailer breakdown, the boys season 5 theories",20,https://i.ytimg.com/vi/XNQbH1SDPRk/hqdefault.jpg,en,en,False,162,PT2M42S,hd,True,True,False,False,5988445,296511,12488
WMKwDLM9rR0,LY,2026-03-11T03:10:34.548237+00:00,2026-03-10T17:07:37Z,مستشفى جراني 🏥 هروب الطيارة الجديد,مستشفى جراني 🏥 هروب الطيارة الجديد,El Husamo,UCBFnkaNDi57OD6O8Z4cFPXA,20,Gaming,"gaming, viral, trending, horror, جيمنج, ترند",6,https://i.ytimg.com/vi/WMKwDLM9rR0/hqdefault.jpg,ar,ar,False,1362,PT22M42S,hd,False,True,False,False,58394,4529,504
NzXxghCoxM8,LY,2026-03-11T03:10:34.548252+00:00,2026-03-07T01:59:32Z,بتشبه عليا - Betshbah Alaya,بتشبه عليا - Betshbah Alaya,Versus Music - Topic,UC3E0If0BQjZTbJvZ0sviDwA,10,Music,"Versus Music, Sherine Abdelwahab, Salim Laguili, بتشبه عليا - Betshbah Alaya",4,https://i.ytimg.com/vi/NzXxghCoxM8/hqdefault.jpg,ar,en,False,203,PT3M23S,hd,False,True,False,False,184759,1840,0
X6EHtzcmiPw,LY,2026-03-11T03:10:34.548267+00:00,2026-03-05T00:00:00Z,BTS THE COMEBACK LIVE | ARIRANG | Official Trailer | Netflix,BTS THE COMEBACK LIVE | ARIRANG | Official Trailer | Netflix,Netflix,UCWOA1ZGywLbqmigxE4Qlvuw,24,Entertainment,"Arirang, Army, BTS, BTS Army, Band, BigHit, Comeback, Concert, HYBE, Icons, Jimin, Jin, Jung Kook, Live Concert, Music, Netflix, Netflix Live, New Album, Performance, RM, Singing, Suga, j-hope",23,https://i.ytimg.com/vi/X6EHtzcmiPw/hqdefault.jpg,en,en-US,False,92,PT1M32S,hd,True,True,False,False,3188763,412285,27291
p21ZVqjKOLo,LY,2026-03-11T03:10:34.548282+00:00,2026-03-10T14:01:18Z,اخترقت سيرفرات فيفا وبيس موبايل ولعبت اول لعبه مهكرة ليهم📲🤯,اخترقت سيرفرات فيفا وبيس موبايل ولعبت اول لعبه مهكرة ليهم📲🤯,HikaSIU,UC9de4K00-WJx6pL90iDkOTw,20,Gaming,"hika, فيفا موبايل, fc mobile, اف سي موبايل, تفجير بكدجات فيفا 26, فيفا موبايل 26, fc mobile 26, fc موبايل 26, شحن للمتابعين, hikasiu, هيكا, capped legends, capped legends cruyff, cruyff 122, cruyff 117, كرويف 117, كرويف 122, حدث الأساطير المتوجه, كرويف فيفا موبايل, ديبروين 122, ديبروين 177, فيليب لام 122, مارادونا 122, مارادونا 117, مرادونا 122, capped legends maradona, maradona 122, maradona fc mobile, مارادونا إف سي موبايل, فيفا موبايل مارادونا, كانافارو 122",31,https://i.ytimg.com/vi/p21ZVqjKOLo/hqdefault.jpg,ar,ar,False,1303,PT21M43S,hd,False,True,False,False,145256,20581,732
LCAzfOt5MDY,LY,2026-03-11T03:10:34.548299+00:00,2026-03-06T16:00:06Z,Rahma Mohsen - Youm Gada3 | رحمه محسن - يوم جدع (دوري بيا يا دنيا دوري) | من مسلسل علي كلاي,Rahma Mohsen - Youm Gada3 | رحمه محسن - يوم جدع (دوري بيا يا دنيا دوري) | من مسلسل علي كلاي,Rahma Mohsen - رحمه محسن,UC77bzopvXBh9rHpEF_R3Hdw,10,Music,"Youm Gada3, يوم جدع, رحمة محسن, الشيلة وقعت, من مسلسل على كلاى, على كلاي, احمد العوضي, مسلسل على كلاي, اغاني مسلسل على كلاى, رحمه محسن, رحمه محسن الشيلة وقعت, الشيله وقعت, Rahma mohsen, Rahma, مسلسل علي كلاي, اغنية درويلة, Rahma mohsen 2026, العوضي ورحمة محسن, انا لسه مانتيهتش, اغنية درويلة رحمة محسن, اغنية حفلة تنكرية, جديد رحمة محسن, اغاني مسلسلات, اغاني مسلسلات رمضان ٢٠٢٦, رمضان ٢٠٢٦, مالك ومالى يا دنيا, على كلاى, مسلسل علي كلاى, درويلة, الشيلة وقعت مني",30,https://i.ytimg.com/vi/LCAzfOt5MDY/hqdefault.jpg,ar,ar,False,182,PT3M2S,hd,False,True,False,False,744164,7599,203
jXTtWPgDzBs,LY,2026-03-11T03:10:34.548315+00:00,2026-03-10T17:31:18Z,خرفنـا ماب البيوت أنا ورتك بسكنات بنات!! 😂🔥 (السيرفر انصدم!),خرفنـا ماب البيوت أنا ورتك بسكنات بنات!! 😂🔥 (السيرفر انصدم!),LUF / لوف,UCkSMaBSd4vOTFq3nYU4HvDQ,20,Gaming,"لوف, luf, بلو لوك, blue lock rivals, بلوكس فروت, blox fruits, لوف بلو لوك, luf blue lock, لوف بلو لوك رايفلس, luf blue lock rivals, بلو لوك رايفلس, luf mobile, luf mobil, luffy, luf blox fruits, luf blox, لوف بلوكس, سيرفر لوف ديسكورد, سيرفر لوف, ديسكورد لوف, بلو, لوك, رايفلس, روبلوكس, roblox, steal_a_brain_rot, Steal, brainrot, المزرعة, السرقة, ماب السرقة, Steal a Brainrot, الخليج, جده, الرياض, السعودية, السعوديه, هجولة, روبلوكس السعوديه, تبوك, الدمام, جدة, القصيم, مكة, مكة المكرمة, اطفال, العاب",47,https://i.ytimg.com/vi/jXTtWPgDzBs/hqdefault.jpg,ar,ar,False,740,PT12M20S,hd,False,True,False,False,67652,2775,275
5pa1jUTX4CA,LY,2026-03-11T03:10:34.548332+00:00,2026-03-08T18:42:11Z,Nura M Inuwa| Bahindin Bagudo ,Nura M Inuwa| Bahindin Bagudo ,Nura M Inuwa Official,UChJQuMGiaktTvgqnpibErcw,10,Music,"Hausa Song, NURA M INUWA, NURA M INUWA 2021, NURA M INUWA Album, Adam A Zango, hamisu Breaker, ado gwanja, Awa24, Izzar So, tsakar gida, sarauniya tv, sarauniya, Nura M. Inuwa, Nura, Inuwa, hausa songs, hausa music, arewa, hausa, hausa films, hausa tv, hausa movies, nigeria, films, Nollywood, Ali Nuhu, Adam A zango, bushkiddo, Nafisat Abdullahi, Rahma Sadau, Sani Danja, Latest song, Latest Film",33,https://i.ytimg.com/vi/5pa1jUTX4CA/hqdefault.jpg,en,und,False,772,PT12M52S,sd,False,True,False,False,16320,1020,64
d6fmD-AkFf4,LY,2026-03-11T03:10:34.548347+00:00,2026-03-10T19:02:00Z,ربلوكس متجر الايسكريم المرعب مع اخواني الصغار !,ربلوكس متجر الايسكريم المرعب مع اخواني الصغار !,اصحاب مازن,UCayyBWtI1PxJCtieqKUQZnA,20,Gaming,"roblox, روبلوكس, العاب, مشاهير روبلوكس, مازن روبلوكس, عائلة روبلوكس, سعدون روبلوكس, اصحاب مازن, مازن وسعدون, روبلوكس ماب السرقة, مازن ستيل برين روت, ستيل برين روت, Steal A Brainrot",13,https://i.ytimg.com/vi/d6fmD-AkFf4/hqdefault.jpg,ar,ar,False,1280,PT21M20S,hd,False,True,False,False,113350,4927,736
JSBuJ9z-PhM,LY,2026-03-11T03:10:34.548362+00:00,2026-03-02T11:17:25Z,Habibet Galbi,Habibet Galbi,Marco - Topic,UCKJNILiKIl_w1Mj6sUKt1SQ,10,Music,"Marco, Mr-SKiLLS, Habibet Galbi",3,https://i.ytimg.com/vi/JSBuJ9z-PhM/hqdefault.jpg,en,ar,False,227,PT3M47S,hd,False,True,False,False,9444,137,2
ZLSXAPvPwnQ,LY,2026-03-11T03:10:34.548376+00:00,2026-03-09T23:11:46Z,resident evil revelations 2 كلير ريدفيلد في جزيرة معزولة,resident evil revelations 2 كلير ريدفيلد في جزيرة معزولة,مـلـزلـز MLZLZ,UCneq-pXhApziFpje2tIfofw,20,Gaming,#ملزلز,1,https://i.ytimg.com/vi/ZLSXAPvPwnQ/hqdefault.jpg,ar,ar,False,6065,PT1H41M5S,hd,False,True,False,False,271193,24243,2029
KFWp3PnfiPA,LY,2026-03-11T03:10:34.548392+00:00,2026-02-23T21:15:03Z,قلبي يا قلبي,قلبي يا قلبي,صفاء سعد - Topic,UCySnd2xAAibgr4VsN2ip70Q,10,Music,"صفاء سعد, خالد الزروق, قلبي يا قلبي",3,https://i.ytimg.com/vi/KFWp3PnfiPA/hqdefault.jpg,ar,ar,False,386,PT6M26S,hd,False,True,False,False,16117,142,0
C7D_5mTbwhw,LY,2026-03-11T03:10:34.548407+00:00,2026-03-10T14:00:30Z,هل حصلت بدلة المطافي بحسابي الثاني ؟  #ببجي_موبايل #ببجي,هل حصلت بدلة المطافي بحسابي الثاني ؟  #ببجي_موبايل #ببجي,أترو/Atro,UCjf3ZSi7xMu8O9frZZ8FEGg,20,Gaming,"ببجي, بوبجي, ببجي موبايل, pubg mobile, افضل لاعب في ببجي موبايل, فتح صناديق ببجي, كمين, فتح صناديق, بابجي, اترو, محترف, تحديث, رومات, بث ببجي, ببجي سعودية, ببجي عراق, ببجي عربي, ببجي سوري, ببجي جزائري, الشامي, al shami",21,https://i.ytimg.com/vi/C7D_5mTbwhw/hqdefault.jpg,ar,ar,False,1124,PT18M44S,hd,False,True,False,False,104610,19200,4135
jua2oSBddzc,LY,2026-03-11T03:10:34.548423+00:00,2026-02-25T17:01:21Z,VEE REMIX | ميني مكس - الوقت خلاني,VEE REMIX | ميني مكس - الوقت خلاني,Vee Remix,UCnLpJ0MmYaD66Y7MYuG7wMA,10,Music,"Remix, ريمكس, مبطئ, مسرع, ريمكسات, اغاني عراقيه, اغاني خليجيه, ترند الاغاني, ترند التيكتوك, اغاني تيكتوك, اغاني تيك توك, ترند التيك توك, اغاني ترند, ترند الخليج, ترند السعوديه, ترند الكويت, ترند العراق, ترند الاردن, اكسبلور, اغاني سعوديه, شيلات, اغاني, اغاني 2026, اغاني 2025, songs, iraqi songs, khaleeji songs, اغاني رقص, اغاني حفلات, DJ, مكس اغاني, ريمكس ترند, ريمكس تيك توك, ريمكس 2025, ريمكس 2026, ريمكس عربي, ريمكسات عربية, اغاني مشهورة, اغاني حزينة, اغاني حب, الوقت خلاني",41,https://i.ytimg.com/vi/jua2oSBddzc/hqdefault.jpg,ar,ar,False,365,PT6M5S,hd,False,True,False,False,125226,2095,19
oqI-g5qZCSU,LY,2026-03-11T03:10:34.548440+00:00,2026-03-09T13:01:26Z,لقينا اخي حمودي مريض بالمستشفى 🔥😱 (ماب البيوت #3) !! Roblox,لقينا اخي حمودي مريض بالمستشفى 🔥😱 (ماب البيوت #3) !! Roblox,سبايدر واخوانه - Spider Brothers ,UC3srCgBeyr0TTqf9_LLxfQw,20,Gaming,"roblox, روبلوكس, مابات روبلوكس, ماب ربلوكس, العاب, لعبة, ماب, قلتش روبلوكس, حركة روبلوكس, لعبة روبلوكس, فيديو روبلوكس, اسرار روبلوكس, سبايدر, حمزة, حمودي, سبايدر واخواته, اخوات سبايدر, اخوان سبايدر, سبايدر روبلوكس, روبلكس, فلم روبلوكس, قصة روبلوكس",22,https://i.ytimg.com/vi/oqI-g5qZCSU/hqdefault.jpg,ar,ar,False,780,PT13M,hd,False,True,False,False,341703,10679,252
GMihmMfeazY,LY,2026-03-11T03:10:34.548456+00:00,2026-03-04T20:31:15Z,Esseily & Sabren - We Akhyran (Ramadan 2026) | محمود العسيلي وصابرين - وأخيراً (مسلسل اتنين غيرنا),Esseily & Sabren - We Akhyran (Ramadan 2026) | محمود العسيلي وصابرين - وأخيراً (مسلسل اتنين غيرنا),Craft Media | كرافت ميديا,UCVZQOtm4J3uOY5xSaHo_Ccw,10,Music,"Craft Media, كرافت ميديا, Video Clip, فيديو كليب, Music Video, New song, Egyptian, Egyptian Song, Egyptian Pop, مصري, ramadan 2026, Mahmoud El Esseily, Sabren, محمود العسيلي, صابرين, صابرين النجيلى, صابرين النجيلي, واخيرا, وأخيراً, واخيراً, وأخيرا, w akhyran, w akheran, w akhairan, we akheeran, we akheran, we akhairan, w akheeran, مسلسل رمضان ٢٠٢٦, رمضان ٢٠٢٦, مسلسل اتنين غيرنا, مسلسل إتنين غيرنا, اغاني رمضان ٢٠٢٦, أغاني رمضان ٢٠٢٦, اغنية مسلسل اتنين غيرنا, عسيلي",36,https://i.ytimg.com/vi/GMihmMfeazY/hqdefault.jpg,ar,ar,False,192,PT3M12S,hd,False,False,False,False,596383,8050,127
ne-z4rjh_1o,LY,2026-03-11T03:10:34.548472+00:00,2026-03-10T14:12:54Z,الهروب من التسونامي لاكن اقدر اتحكم ب التسونامي و البرينروت 🤑 Roblox Escape Tsunami For Brainrots,الهروب من التسونامي لاكن اقدر اتحكم ب التسونامي و البرينروت 🤑 Roblox Escape Tsunami For Brainrots,RTQ,UCY5Zs3Y76ILKOdJODtlsiBw,20,Gaming,,0,https://i.ytimg.com/vi/ne-z4rjh_1o/hqdefault.jpg,en,en,False,579,PT9M39S,hd,False,True,False,False,104571,3421,283
u7MxCuYPQT4,LY,2026-03-11T03:10:34.548486+00:00,2026-02-18T15:33:10Z,"Angham - Mesh Habibi Bs | ""أنغام - مش حبيبي بس - تتر مسلسل ""اتنين غيرنا","Angham - Mesh Habibi Bs | ""أنغام - مش حبيبي بس - تتر مسلسل ""اتنين غيرنا",Angham,UC1sr8dwdTQkMAUaKxOnBrWg,10,Music,"angham, hafla, live, concert, 2019, kuwait, eed, eid, elfetr, alftr, ftr, fetr, aktblak, ta3ahod, aktlbk, ta3hod, song, exclusive, album, لايف, الكويت, عيد, الفطر, اكتبلك, تعهد, اغاني, انغام, حصرياً, البوم, حفلات, حفلة, ٢٠١٩",32,https://i.ytimg.com/vi/u7MxCuYPQT4/hqdefault.jpg,ar,ar,False,242,PT4M2S,hd,False,False,False,False,1209660,17630,848
4EqjCDxg6B0,LY,2026-03-11T03:10:34.548502+00:00,2026-03-10T16:16:06Z,فلم ماين كرافت : زعرور الشرطي يطرد كركور و دودو الحرامية من البلوكة الواحدة فوق السماء 🔥😂,فلم ماين كرافت : زعرور الشرطي يطرد كركور و دودو الحرامية من البلوكة الواحدة فوق السماء 🔥😂,Ahmad M4 - احمد ام فور ,UCT68nhrPsNQ7pczSMFtKG1w,22,People & Blogs,"مصطفى GAME OVER, Mr GG, XTREEM - اكستريم, Ameer Slow - أمير سلاو, اوكا - OKA, AboFlah, Mkamel GG, رانيا كيمنك Rania Gaming, M4X5 Gamer, افلام, ماين كرافت, Fo9ma, فلم ماين كرافت الغني و الفقير, ابو فله, Hazar - هازار, افلام ماين كرافت, الغني و الفقير, كوكب, M4X5, ماين, MineCraft Movie, Movie, Suhaib - صهيب, جلمود - GLMooD, تايمو Tymo, هاردلك HARDLK, احمد, SHoNgxBoNg, Ahmad Hero - احمد البطل, PMN Extra, البطل, Nari YT - ناري, عائلة, elLa3eeb لعيب جدا, فايتر Fighter, احمد هيرو, سيد, بط",38,https://i.ytimg.com/vi/4EqjCDxg6B0/hqdefault.jpg,ar,en,False,1216,PT20M16S,hd,False,True,False,False,84201,870,38
tnuAJ6wTGyU,LY,2026-03-11T03:10:34.548519+00:00,2026-03-02T19:00:06Z,عايش وحيد ( لو في بينكو راجل اشتريه ) بازوكا الاردني - توزيع حمدين - حصريأ 2026,عايش وحيد ( لو في بينكو راجل اشتريه ) بازوكا الاردني - توزيع حمدين - حصريأ 2026,Haam Deen Official,UCBurIQqoZM3eKIaCBjjQ7SQ,10,Music,"عايش وحيد, لو في بينكو راجل اشتريه, بازوكا الاردني, حمدين, يا طبيب, اي العلاج ياطبيب, مهرجان يا طبيب, اغنيه اي العلاج يا طبيب, مهرجان اي العلاج يا طبيب, اغاني شعبي, اغاني مهرجانات, مهرجان شعبي, اغاني 2025, شعبي, جودي الليبيه, بازوكا, بازوكا الاردني 2025, بازوكا الاردني 2026, انا غلطان انا غلطان, مخنوق, مخنوق قلبي بيوجعني, وجع الفراق, ازاي يهون قلبي, يا دنيا قاسيه, متصدقوش كل الوشوش",25,https://i.ytimg.com/vi/tnuAJ6wTGyU/hqdefault.jpg,ar,ar,False,219,PT3M39S,hd,False,True,False,False,846571,29732,1089
HHqXmSJw1DA,LY,2026-03-11T03:10:34.548534+00:00,2026-03-10T21:32:26Z,ارك فالكونز 16 | مواجهة وترويض زعماء الواردن! Ark Survival Ascended,ارك فالكونز 16 | مواجهة وترويض زعماء الواردن! Ark Survival Ascended,أحمد - Nemesis,UCihg-Aew0pQYKiAOLnPA8GA,20,Gaming,,0,https://i.ytimg.com/vi/HHqXmSJw1DA/hqdefault.jpg,ar,ar,False,1992,PT33M12S,hd,False,True,False,False,116039,19053,637
CK8q7-VsZuI,LY,2026-03-11T03:10:34.548548+00:00,2026-03-06T14:00:00Z,Shumay Joli - Mamush - ማሙሽ (official video) - new eritrean music 2026,Shumay Joli - Mamush - ማሙሽ (official video) - new eritrean music 2026,Shumay Joli,UC_rrxksSsGpvIon3RBqGxuw,10,Music,"Shumay Official, Shumay Joli, Shumay Gebrihiwet, @ShumayOfficial, new eritrean music, eritrean music, eritrean music 2023, new eritrean music 2023 ethiopian music, new music ethiopian 2022, new music 2023, music 2022, ethiopian old music, ethiopian new music, tigray music, kunama music, yemane barya, eritrean music old, kunama music 2023, eritrean music yemane barya, yemane barya love song, eritrean movie, new eritrean music 2023, yemane barya old songs, #tigrinya, 2026",25,https://i.ytimg.com/vi/CK8q7-VsZuI/hqdefault.jpg,en,ti,False,307,PT5M7S,hd,False,True,False,False,149570,3679,675
34lEUgaLrqA,LY,2026-03-11T03:10:34.548564+00:00,2026-03-10T15:05:12Z,سكاي بلوك ولكن الجزيرة تتغير كل دقيقة!!,سكاي بلوك ولكن الجزيرة تتغير كل دقيقة!!,SeddiQ,UCkT20J0hQn8hhCilJMObKjA,20,Gaming,,0,https://i.ytimg.com/vi/34lEUgaLrqA/hqdefault.jpg,ar,ar,False,801,PT13M21S,hd,False,True,False,False,58676,2222,87
sJcNxMVF3WM,LY,2026-03-11T03:10:34.548578+00:00,2026-03-02T17:38:35Z,عايش وحيد,عايش وحيد,بازوكا الاردني - Topic,UClph4vGI7Xquoc2P3pCBfZw,10,Music,"بازوكا الاردني, حمدين, عمرو حمدين, عايش وحيد",4,https://i.ytimg.com/vi/sJcNxMVF3WM/hqdefault.jpg,ar,ar,False,219,PT3M39S,hd,False,True,False,False,186317,3613,0
TzCvZg-cC-Y,LY,2026-03-11T03:10:34.548593+00:00,2026-03-10T11:15:04Z,عودة السيد لحمة - Mr Meat !! 🥩😲,عودة السيد لحمة - Mr Meat !! 🥩😲,شبكة العاب العرب | Arab Games Network,UCV2JkEBmtfSYGAIlprAhAyQ,20,Gaming,,0,https://i.ytimg.com/vi/TzCvZg-cC-Y/hqdefault.jpg,ar,ar,False,1150,PT19M10S,hd,False,True,False,False,138671,8638,673
aw_AGUiUf8U,LY,2026-03-11T03:10:34.548608+00:00,2026-03-01T20:29:24Z,Amine Matlo x Cheb Faycal - Nsaha Ya Galbi (RAI REMIX 2026) By MEDU,Amine Matlo x Cheb Faycal - Nsaha Ya Galbi (RAI REMIX 2026) By MEDU,MEDU,UCgofnRmqQEBwyu7fEK0lbXQ,10,Music,"amine matlo remix, cheb faycal remix, nsaha ya galbi remix, chab3i mn rayek, rai remix 2026, medu beats, medu remix, omri tzawjat remix, rai mix 2026, dj rai 2026, rai jdid 2026, rai 9dim remix, rai compilation 2026, rai mashup 2026, tiktok rai remix, راي 2026, راي جزائري 2026, اغاني راي 2026, تجميعات راي, مكس راي, ريمكس راي, راي شرقي, اجمل الاغاني, ريمكس راي شرقي, rai mix, rai playlist, rai rap remix, rai mix compilation, music remix, mashup, mashup rai, rai remix",32,https://i.ytimg.com/vi/aw_AGUiUf8U/hqdefault.jpg,ar,ar,False,245,PT4M5S,hd,False,True,False,False,141704,1560,72
oIXSdAlkluY,LY,2026-03-11T03:10:34.548624+00:00,2026-03-10T15:40:26Z,بث ارك تاريخ 20 رمضان,بث ارك تاريخ 20 رمضان,اوبلز خلف الكواليس,UCtfqWS0vPwRnTalTwyLe6eg,20,Gaming,,0,https://i.ytimg.com/vi/oIXSdAlkluY/hqdefault.jpg,ar,ar,False,13328,PT3H42M8S,hd,False,True,False,False,86544,6756,278
