video_id,country,fetched_at,published_at,title,localized_title,channel_title,channel_id,category_id,category_name,tags,tag_count,thumbnail,default_language,audio_language,is_live,duration,duration_raw,definition,caption_available,licensed_content,embeddable,made_for_kids,views,likes,comments
ZiLIblWd3Ak,LY,2026-03-11T03:10:34.548639+00:00,2026-03-04T16:01:29Z,الشيله وقعت من مسلسل على كلاى,الشيله وقعت من مسلسل على كلاى,Rahma Mohsen - Topic,UCGCocFD72xU0PRR0-ERX0lw,10,Music,"Rahma Mohsen, الشيله وقعت من مسلسل على كلاى",2,https://i.ytimg.com/vi/ZiLIblWd3Ak/hqdefault.jpg,ar,ar,False,196,PT3M16S,hd,False,True,False,False,236739,3084,0
lzvsY9rzU30,LY,2026-03-11T03:10:34.548654+00:00,2026-03-10T18:15:00Z,Steal a brainrot 😍💸 $فتحت بيسات عشوائية بقيمة 5000,Steal a brainrot 😍💸 $فتحت بيسات عشوائية بقيمة 5000,AlaaFj Gaming,UC4h4MAcXI3A9_RnMN7e9nRg,20,Gaming,"روبلوكس, مقاطع روبلوكس مضحكة, roblox ألعاب مضحكة, ضحك في روبلوكس, ملك السرقة, سيكرت, ماب السرقة, ماب السرقة في روبلوكس, ماب السرقه سعود, ملك السرقه, فلم روبلوكس, افلام روبلوكس, فيلم روبلكس, روبلكس, قصص روبلوكس, روبكس مجانى, فلم روبلكس, شحن روبلكس, شراء روبلكس, روبلكس العاب, بطاقة روبلكس, بطاقات روبلكس, شحن بطاقة روبلكس, كيفية شحن روبلكس, تحديث جديد روبلكس, شحنت روبلوكس, شحن روبلكس بالتفصيل, العاب روبلوكس, فاكهة البركان, تقييم حسابات, شريت برينروتات من مواقع",31,https://i.ytimg.com/vi/lzvsY9rzU30/hqdefault.jpg,ar,ar,False,835,PT13M55S,hd,False,True,False,False,70452,2851,493
6zqivy_xRqE,LY,2026-03-11T03:10:34.548670+00:00,2026-02-27T21:00:15Z,Rema - Calm Down (Lyrics),Rema - Calm Down (Lyrics),Moonshine,UCJX7Etv7ISmc-uWMkxpOngA,10,Music,"baby calm down song, calm down, calm down lyrics, lyrics calm down, rema, lyrics, rema calm down, calm down rema, rema calm down lyrics, lyrics rema calm down, rema lyrics, lyric rema, rema lyrics calm down, calm down lyrics rema, lyrics calm down rema, calm down rema lyrics, baby calm down, calm down calm down, girl this your body e put my heart for lockdown, girl you sweet like fanta, sweet like fanta, baby calm down calm down, shawty come give me your love love love, pop",24,https://i.ytimg.com/vi/6zqivy_xRqE/hqdefault.jpg,en,en,False,220,PT3M40S,hd,False,False,False,False,3570546,17512,100
96tqj5oAtnk,LY,2026-03-11T03:10:34.548686+00:00,2026-03-09T16:23:51Z,طفل يصبح أقوى سبايدرمان لفل 99999 لإنقاذ صديقه من العملاق 😱🔥  فلم قراند,طفل يصبح أقوى سبايدرمان لفل 99999 لإنقاذ صديقه من العملاق 😱🔥  فلم قراند,007aMMudi - حمودي,UCN8o4BdhlNUMV2_R-GV4kZQ,20,Gaming,"افلام, ماين كرافت, فلم ماين كرافت, فايتر Fighter, فايتر, افلام ماين كرافت, ماين, جلمود - GLMooD, تايمو Tymo, بطل, Ahmad Hero - احمد البطل, احمد هيرو, جعطوط - JATOOT, خزان, طيران, P4GAM3R, قراند, فلم قراند سبايدرمان, سبايدرمان, سوبرمان, ايرون مان, قراند هولك, فيلم قراند, سبايدر مان, فلم قراند سبايدر مان, تياقو, تياغو, تياجو",28,https://i.ytimg.com/vi/96tqj5oAtnk/hqdefault.jpg,ar,ar,False,1773,PT29M33S,hd,False,True,False,False,153700,2111,18
wPniisQ7jdc,LY,2026-03-11T03:10:34.548702+00:00,2026-03-06T13:01:47Z,Kashim Shatima Gari Gari By Adam A. Zango,Kashim Shatima Gari Gari By Adam A. Zango,Adam A. Zango Official,UCkWoGsrakGzBhS6dozcbYhA,10,Music,"AdamAZango, AdamZango, Nigeria PrinceZango, Kannywood, HausaMusic, HausaMusic2023, HausaSongs, HausaSongs2023, MentaMusic",9,https://i.ytimg.com/vi/wPniisQ7jdc/hqdefault.jpg,en,und,False,307,PT5M7S,hd,False,True,False,False,16758,1708,245
LsB97r0p8TU,LY,2026-03-11T03:10:34.548716+00:00,2026-03-09T15:41:08Z,فلم ماين كرافت : زعرور يصنع اسرع سيارة 🔥😱,فلم ماين كرافت : زعرور يصنع اسرع سيارة 🔥😱,Ahmad Hero Family - عائلة احمد البطل ,UCMl78PgENDj2Uf53HTOTx8w,22,People & Blogs,"مصطفى GAME OVER, Mr GG, كرافتر - Crafter, XTREEM - اكستريم, Ameer Slow - أمير سلاو, اوكا - OKA, AboFlah, Mkamel GG, رانيا كيمنك Rania Gaming, افلام, ماين كرافت, Fo9ma, فلم ماين كرافت, غني وفقير, فايتر Fighter, ابو فله, Hazar - هازار, فايتر, افلام ماين كرافت, الغني و الفقير, كوكب, M4X5, ماين, MineCraft Movie, ALKRKY, Suhaib - صهيب, جلمود - GLMooD, تايمو Tymo, هاردلك HARDLK, Ahmad M4 - احمد ام فور, بطل, Ahmad Hero - احمد البطل, احمد هيرو, خلودة, Rano's Home رانو هوم, M4X5Gamer, خالد",37,https://i.ytimg.com/vi/LsB97r0p8TU/hqdefault.jpg,ar,en,False,1365,PT22M45S,hd,False,False,False,False,236764,3009,226
Awe3AJcZXkk,LY,2026-03-11T03:10:34.548733+00:00,2026-02-18T18:30:07Z,Maha Ftouni - Bassa L Odam | 2026 | مهى فتوني - باصه لقدام - من مسلسل الست موناليزا,Maha Ftouni - Bassa L Odam | 2026 | مهى فتوني - باصه لقدام - من مسلسل الست موناليزا,Nj Music Productions,UC0QVO2otcYs0pHm-ytPUEmA,10,Music,"هاني محروس, hany mahrous, nj music, مها فتوني, مها فتوني 2025, أغاني مها فتوني, فتوني, مهى فتوني, مها فتونى, مهي فتونى, maha, ftouni, fotni, على الله, عوضى على الله, مسلسل الست موناليزا, أبطال مسلسل الست موناليزا, الست موناليزا, أحمد مجدي بطل مسلسل الست موناليزا, الست موناليزا 2026, الست موناليزا مي عمر, برومو مسلسل الست موناليزا, اعلان مسلسل الست موناليزا, مسلسل الست موناليزا رمضان 2026, مي عمر, باصه لقدام, باصة لقدام, بصه لقدام, بصة لقدام, bassa, 2odam, qodam",32,https://i.ytimg.com/vi/Awe3AJcZXkk/hqdefault.jpg,ar,ar,False,230,PT3M50S,hd,False,True,False,False,578359,9810,321
cY455W6NaQ4,LY,2026-03-11T03:10:34.548749+00:00,2026-03-10T16:30:14Z,هذا الشخص اعطاني تحدي صعب !!,هذا الشخص اعطاني تحدي صعب !!,SA7RAWI Gaming,UC2qdrMpLKn3GgeCwN65SX_Q,20,Gaming,"الصحراوي, صحراوي فري فاير, sa7rawi, فري فاير, صحراوي, فري فاير الجزائر, تهكير فري فاير, تحدي فري فاير, مقلب النوب, شحنتلهم, شحن فري فاير, ألف جوهرة, تخريب حساب, شحنت للمتابع, تحدي أفوز, FREE FIRE, NOOB PRANK, سكواد جزائري, خدعة اللغم, ساكورا, التحديث الجديد فري فاير, WHITE444, هيدشوت تلقائي, حسونة, دراغونوف, DBL N, الشخصية الجديدة, متجر التخفيضات, السكن, الشوتقن, فري فاير لايت, الكريمنال, الفاير باس الاول, المتابعين, اصعب تحدي, Ali Omar, M16, TRYHARD, DJEXO, قيم بلاي, سكواد بنات",41,https://i.ytimg.com/vi/cY455W6NaQ4/hqdefault.jpg,ar,ar,False,1045,PT17M25S,hd,False,True,False,False,145149,13907,841
Dskg6ZlQ9vc,LY,2026-03-11T03:10:34.548766+00:00,2026-02-26T19:43:51Z,فضي الممر- الحوسين معمر  - محمد الشهيني - سلسلة القافلة التراثية 2026,فضي الممر- الحوسين معمر  - محمد الشهيني - سلسلة القافلة التراثية 2026,طرب ميوزك TOP,UCIve2HSckmeyJOZ0Z-0J-QA,10,Music,,0,https://i.ytimg.com/vi/Dskg6ZlQ9vc/hqdefault.jpg,ar,ar,False,579,PT9M39S,sd,False,True,False,False,28125,308,19
lAAwX6Lsjs4,LY,2026-03-11T03:10:34.548782+00:00,2026-03-09T13:01:19Z,تحولت لجراني وصرنا صاحبات - granny,تحولت لجراني وصرنا صاحبات - granny,HOPE Rima,UCfYI9exf8BUHVgMSiAZWs2A,20,Gaming,"العاب, مقالب, تحديات, games, minecraft, oneblock, روبلكس, tiktok, ردات فعل, ماينكرافت بس, minecraft but, قيمز, rima, hoperima, هوب ريما, ريما, ماين كرافت, ماين كرافت ولكن, 100 يوم, 24 ساعة, funny, take damage, روبلوكس, الجد والجدة جراني, ريما وبيكا, ROBLOX, جراني, granny, doors, roblox, gaming, banban, بان بان, العاب رعب, horror games, بندريتا, بندر, الجدة جراني",38,https://i.ytimg.com/vi/lAAwX6Lsjs4/hqdefault.jpg,ar,ar,False,890,PT14M50S,hd,False,True,False,False,150340,4116,393
2GJfWMYCWY0,LY,2026-03-11T03:10:34.548798+00:00,2026-02-27T05:00:07Z,BLACKPINK - ‘GO’ M/V,BLACKPINK - ‘GO’ M/V,BLACKPINK,UCOmHUn--16B90oW2L6FRR3A,10,Music,"YG Entertainment, YG, 와이지, K-pop, BLACKPINK, 블랙핑크, 블핑, 제니, 로제, 리사, 지수, LISA, JISOO, JENNIE, ROSÉ, BLINK, 블링크, JENNIE You & Me, JENNIE You and ME, You & Me, You and Me, 제니 You & Me, 제니 You and Me, 제니 유앤미, 유앤미, JENNIE 유앤미, 제니 코첼라, JENNIE COACHELLA",28,https://i.ytimg.com/vi/2GJfWMYCWY0/hqdefault.jpg,en,ko,False,202,PT3M22S,hd,True,True,False,False,47020476,3377413,282180
I61ssdxy1sw,LY,2026-03-11T03:10:34.548815+00:00,2026-03-09T16:56:18Z,ذكاء ودهاء كافح المكافح 🔥 ( أذكى خطة 😱),ذكاء ودهاء كافح المكافح 🔥 ( أذكى خطة 😱),#بني_ دربحه,UC5V7CAGEEoUd_0JAmeYcmoA,22,People & Blogs,"#بني_دربحه, دربحه, كافح المكافح, جراند, جراند الحياة الواقعية, دربحه كافح, كافح, سيرفر جراند, ريسبكت, الحاكم, الحاكم دربحه, سلسله كافح المكافح, كافح بث مباشر, دربحه بث مباشر, سيرفر جراند الحياه الواقعية, جراند الحياة الواقعيه, بداية كافح, لعبة جراند, العاب, دربحه الحياة الواقعيه, سيرفر جراند دربحه, بث مباشر جراند, بث مباشر, بث جراند",24,https://i.ytimg.com/vi/I61ssdxy1sw/hqdefault.jpg,ar,ar,False,4616,PT1H16M56S,hd,False,True,False,False,300791,27857,1343
jXIQTete6UQ,LY,2026-03-11T03:10:34.548831+00:00,2026-02-19T10:12:13Z,Khalini,Khalini,Acim Music - Topic,UCBqPg0UNY8cqArSJS21PXiQ,10,Music,"Acim Music, Khalini",2,https://i.ytimg.com/vi/jXIQTete6UQ/hqdefault.jpg,en,ar,False,259,PT4M19S,hd,False,True,False,False,157408,684,0
xcpuJ-R1pig,LY,2026-03-11T03:10:34.548847+00:00,2026-03-10T10:30:48Z,سيرفر حياة واحدة #15 : بنيت قلعة الأكثر حماية في السيرفر !!؟ 😱🔥,سيرفر حياة واحدة #15 : بنيت قلعة الأكثر حماية في السيرفر !!؟ 😱🔥,Ameer Slow - أمير سلاو,UCQTlk74kYjONf13QFnZsYCw,20,Gaming,"ماين كرافت, ماينكرافت, عراق كرافت, فلم ماين كرافت, الغني والفقير, فيلم ماين كرافت, افلام ماين كرافت, فلم, film ماين كرافت, العاب, مقلب, تحميل, تحميل ماين كرافت, minecraft, #فلم_ماين_كرافت, غريب, عجيب, اختفاء, غامض, شركات طيران, طائرة, سفر, رحلة, سياحة, أموال, وقود, بنزين, حقيبة أموال, فلوس, رحلات طيران, أمريكا, مظيفات طيران, مطار, اختطاف, دس تراك, روبلوكس, فلم_روبلوكس, مرحاض, بابا, ماما, شرطة, مصطفى_ماين_كرافت, فلم_ماين_كرافت, تزوجت, هارد لايف, كلب, مصطفى كيم اوفر, لعبة, أمير سلاو, مستر بعرورة, قطة, لايف ستبل",52,https://i.ytimg.com/vi/xcpuJ-R1pig/hqdefault.jpg,ar,ar,False,1496,PT24M56S,hd,False,True,False,False,72060,4327,667
w2Geb1og6pk,LY,2026-03-11T03:10:34.548864+00:00,2026-02-28T10:01:24Z,Ozzem - No Limit (Original Mix),Ozzem - No Limit (Original Mix),Deep Ocean | DJ DEEP,UC9fYg1VAryVZk0__dc0ifyw,10,Music,"GangBass, car music, mix 2021, Car music mix, best gangster music mix, gangster music, g-house, guitar, trap music, bass, bass music, remix 2020, gangster, музыка в машину, bass boosted, car bass mix, emre kabak, car bass, best car music, cars, музыка, pop music, музыка в машину 2021, trap mix, magic music instrumental, magic music mix, trap music remix, крутая музыка 2023, mona muusic, dndm, azimov, enza, azizaqobilova, лучшая музыка, клубная музыка, clubmusic, Dieez, KASIMOFF, tury",39,https://i.ytimg.com/vi/w2Geb1og6pk/hqdefault.jpg,ru,en,False,371,PT6M11S,hd,False,True,False,False,174102,1071,6
ZmlLjqmjri4,LY,2026-03-11T03:10:34.548883+00:00,2026-03-10T20:29:03Z,لعبت رانك ل 100 ساعة بشكل متواصل ! وهذي كانت النتيجة !,لعبت رانك ل 100 ساعة بشكل متواصل ! وهذي كانت النتيجة !,Ninjawe - BrawlStars,UCawzQLFAfsEqZRBn1osTpNg,20,Gaming,"كلمات مفتاحية براول ستارز, براول, ستارز, سكوري براول ستارز, ليون براول, كيف تطلع ليون, كيف تطلع أبطال براول ستارز, تفتيح بكجات براول ستارز, تفتيح بكجات, بكجات براول ستارز, ثغرة تطليع الأبطال, ثغرة تطليع بطل اسطوري, ثغرة براول ستارز, سكوري, رايزر, اغنية رايزر, بكجات سكوري, أمبر, تطليع أمبر, كيف تطلع أمبر, كرو, ننجاوي, كيف تجيب كؤوس براول ستارز, خرو, سرسري, رايزر تفتيح بكجات, رايزر اغنية, سكوري تفتيح بكجات, بكجاات براول ستارز, رايزر بطل اسطوري, بندريتا براول ستارز, بندر براول ستارز",32,https://i.ytimg.com/vi/ZmlLjqmjri4/hqdefault.jpg,ar,ar,False,1837,PT30M37S,hd,False,True,False,False,22596,2319,234
