video_id,country,fetched_at,published_at,title,localized_title,channel_title,channel_id,category_id,category_name,tags,tag_count,thumbnail,default_language,audio_language,is_live,duration,duration_raw,definition,caption_available,licensed_content,embeddable,made_for_kids,views,likes,comments
yi508eGHZKE,LA,2026-05-11T04:44:46.242062+00:00,2026-04-28T13:40:54Z,ผิดนัดที่วัดพู ຜິດນັດທີ່ວັດພູ ບາງອອນນ້ອຍ ສຽງທອງ [Official Music Video],ผิดนัดที่วัดพู ຜິດນັດທີ່ວັດພູ ບາງອອນນ້ອຍ ສຽງທອງ [Official Music Video],LP MUSIC OFFICIAL,UCi6wOGEODqmdJQvZT7QcAag,10,Music,"Laophern, LP, Lao Music, LP MUSIC OFFICIAL, ລາວເພີນ, ลาวเพีน, ເພງມ່ວນໆ, เพลงเพราะๆ, เพลงลาว, ເພງລາວ, เพลงลาวเพราะๆ, เพลงลูกทุ่ง, ເພງລາວມ່ວນໆ, ผิดนัดที่วัดพู, ຜິດນັດທີ່ວັດພູ, ບາງອອນນ້ອຍສຽງທອງ",16,https://i.ytimg.com/vi/yi508eGHZKE/hqdefault.jpg,lo,und,False,351,PT5M51S,hd,False,True,False,False,62578,174,14
qhpoAXx-dso,LA,2026-05-11T04:44:46.242104+00:00,2026-04-20T09:01:08Z,[Official Trailer] WU อู #WUTheSeries,[Official Trailer] WU อู #WUTheSeries,GMMTV OFFICIAL​​,UC8BzJM6_VbZTdiNLD4R1jxQ,24,Entertainment,"GMMTV, WU อู, สกาย วงศ์รวี, นานิ หิรัญกฤษฎิ์, สกาย นานิ, SKY NANI, skywongraveee, Hirunkit_, WUTheSeries",9,https://i.ytimg.com/vi/qhpoAXx-dso/hqdefault.jpg,th,en,False,151,PT2M31S,hd,True,True,False,False,849181,68846,4546
Caxv8tLATnc,LA,2026-05-11T04:44:46.242117+00:00,2026-05-09T16:00:15Z,"Escape 50 Pros, Win $50,000","Escape 50 Pros, Win $50,000",MrBeast Gaming,UCIPPMRA040LQr5QPyJEbmXA,20,Gaming,,0,https://i.ytimg.com/vi/Caxv8tLATnc/hqdefault.jpg,en,en,False,1137,PT18M57S,hd,True,True,False,False,10573766,299777,13718
nbisaRfegA0,LA,2026-05-11T04:44:46.242127+00:00,2026-05-03T01:56:31Z,สมชาย2007(Remix) - จินตหรา พูนลาภ Jintara Poonlarp 【OFFICIAL MV】,สมชาย2007(Remix) - จินตหรา พูนลาภ Jintara Poonlarp 【OFFICIAL MV】,JINTARA CHANNEL OFFICIAL,UCyH9Q1eW11Qi_0RtEVKq1rg,10,Music,"jintara, poonlarp, หาดนางคอย, พื้นที่ทับซ้อน, คุยเล่นๆ, เต่างอย, สาวนักเรียนตำตอ, จ๊วดจ๊าดฟาดบึ้ม, จินตหรา พูนลาภ, Jintara Poonlarp, สะใภ้อนาถา - จินตหราพูนลาภ, สะใภ้อนาถา, Jintara, จ๊วดจ๊าดฟามบึ้ม, ผักกะแยงแทงใจ, สถานะหมอลำ, น้ำตาหล่นบนเขื่อนลำปาว, ยูกิเพ็ญผกา, พิมนาคำไฮ, ลำเต้ยซิ่งเต่างอย, เจ็บบ่มีเสียง, น้ำตาหล่นบนเขื่อนน้ำงึม",22,https://i.ytimg.com/vi/nbisaRfegA0/hqdefault.jpg,th,th,False,216,PT3M36S,hd,False,True,False,False,334162,2614,147
AjFk1cY265I,LA,2026-05-11T04:44:46.242137+00:00,2026-04-10T16:29:45Z,Digital Circus Ep 9 Finale [TRAILER],Digital Circus Ep 9 Finale [TRAILER],GLITCH,UCn_FAXem2-e3HQvmK-mOH4g,1,Film & Animation,"glitch, glitch productions, digital circus, the amazing digital circus, murder drones, Pomni, Uzi, Jax, Ragatha, Kinger, Gangle, Zooble, Caine, Bubble, 3D, Animation, 3D Animation, Indie Animation, Gummigoo",19,https://i.ytimg.com/vi/AjFk1cY265I/hqdefault.jpg,en,en,False,70,PT1M10S,hd,True,True,False,False,28799071,1631457,114803
VxZLTEKY8_0,LA,2026-05-11T04:44:46.242145+00:00,2026-05-10T01:38:00Z,โดนแบนออกจากบ้าน 🏡 Brookhaven RP,โดนแบนออกจากบ้าน 🏡 Brookhaven RP,TOR Torpedo,UCvE7UoDDYsX21WRR0lR3Z5g,20,Gaming,"ต่อตอปิโด, เจ้าหมี, แคสเกม, โรบอก, โรบอค, เกม, พี่ต่อ, roblox, Experience Roblox, Experience, กะดึก, หลังเที่ยงคืน, ตอนตี 3, สุดหลอน, งานกะดึก, horror game roblox, horror game, เกมน่ากลัว, เกมสยอง",19,https://i.ytimg.com/vi/VxZLTEKY8_0/hqdefault.jpg,th,th,False,940,PT15M40S,hd,False,True,False,False,277284,18312,635
SxcLnu0pb5E,LA,2026-05-11T04:44:46.242154+00:00,2026-05-09T22:00:06Z,รวมเพลงเก่าเศร้าใจ ยุค 90's V.9 | โกหกหน้าตาย | วิชามาร | หลอกใช้ | ดูโง่โง่ | Cover music,รวมเพลงเก่าเศร้าใจ ยุค 90's V.9 | โกหกหน้าตาย | วิชามาร | หลอกใช้ | ดูโง่โง่ | Cover music, Summer Music,UC8v3TM7Bh1Bi9nNReGNjn-g,10,Music,"มนต์เพลงยุค90, เพลงยุค90ไทย, เพลง90เพราะๆ, เพลง90ดังๆ, เพลงไทยเก่า, เพลงไทยเพราะๆ, เพลงเก่ายุค90, เพลงเก่าๆฟังสบาย, รวมเพลงยุค90ไทย, เพลงลูกทุ่งยุค90, เพลงลูกกรุงเพราะๆ, เพลงรักยุค90, เพลงฮิตยุค90, เพลงเก่าอมตะ, เพลงดังในอดีต, เพลงโบว์แดงยุคเก่า, เพลงย้อนวันวาน, เพลงไทยสตริง90, เพลงช้าๆเศร้าๆ, เพลงฟังสบายๆ, เพลง90, เพลงไทย90, เพลงอมตะ, เพลงดัง90, รวมเพลงยุค90, เพลงลูกทุ่ง90, เพลงลูกกรุง, เพลงคลาสสิกไทย, เพลงไทยยุคเก่า, เพลงเพราะยุค90, เพลงคิดถึงยุค90, Thai90sMusic, ThaiSongs90, ThaiRetroMusic, ClassicThaiSong, NostalgiaThaiMusic",36,https://i.ytimg.com/vi/SxcLnu0pb5E/hqdefault.jpg,th,en,False,8917,PT2H28M37S,hd,False,True,False,False,96229,607,39
Bqq11wWZ8Tc,LA,2026-05-11T04:44:46.242163+00:00,2026-05-10T15:11:07Z,🔴 MSL TH Season 1 | Regular Season Week 4 Day 3,🔴 MSL TH Season 1 | Regular Season Week 4 Day 3,Official Mobile Legends: Bang Bang Thailand,UC8aSgy03oQ7aQmJ2e5SrzBg,20,Gaming,,0,https://i.ytimg.com/vi/Bqq11wWZ8Tc/hqdefault.jpg,th,th,False,31726,PT8H48M46S,hd,False,False,False,False,158063,1581,10
3H-0cgGQ7Ro,LA,2026-05-11T04:44:46.242171+00:00,2026-05-09T22:00:06Z,รวมเพลงร้านเหล้า เคล้าน้ำตา ยุค90 v.18 | แฟนเก่า ลาบานูน | เลิกแล้วต่อกัน | เกินใจจะทน | cover music,รวมเพลงร้านเหล้า เคล้าน้ำตา ยุค90 v.18 | แฟนเก่า ลาบานูน | เลิกแล้วต่อกัน | เกินใจจะทน | cover music,CHICAGO BLUES,UCIDYXyucGJ8aj16ottBqhdg,10,Music,"เพลงไทยยุค80, เพลงไทยยุค90, รวมเพลงเก่า, เพลงเก่าสุดฮิต, เพลงไทยเก่าเพราะๆ, เพลงรักยุค80, เพลงรักยุค90, เพลงอกหักยุค90, เพลงดราม่ายุค90, เพลงไทยย้อนยุค, เพลงไทยคลาสสิก, เพลงไทยฟังเพลิน, เพลงไทยฟังสบาย, เพลงเก่าใจนักเลง, เพลงไทยคนรักเก่า, เพลงไทยมือที่สาม, เพลงเก่าโคตรเพราะ ยุค 90's, เพลงเพราะยุค 90's, เหลวแหลก, ไม่เคย, เลิกรา, เกินใจจะทน",22,https://i.ytimg.com/vi/3H-0cgGQ7Ro/hqdefault.jpg,en,en,False,7019,PT1H56M59S,hd,False,True,False,False,85491,532,0
LMPQ5cafNUA,LA,2026-05-11T04:44:46.242179+00:00,2026-05-10T02:00:16Z,มาแล้ว ม้าดินน้ำมัน,มาแล้ว ม้าดินน้ำมัน,PojzPlaza,UCzyeq_iKmrFTBQ0kzNSqMtg,20,Gaming,freefire,1,https://i.ytimg.com/vi/LMPQ5cafNUA/hqdefault.jpg,th,th,False,892,PT14M52S,hd,False,True,False,False,180607,6194,470
7o5pJXAZEPM,LA,2026-05-11T04:44:46.242187+00:00,2026-05-02T23:30:03Z,ແຮງເຖົ້າແຮງນົວ ສະແດງສົດ |ດວງດາວນ້ອຍ ແດນສະຫວັນ【LIVE VERSIONแฮงเฒ่าแฮงนัวแสดงสด |ดวงดาวน้อย แดนสะหวัน,ແຮງເຖົ້າແຮງນົວ ສະແດງສົດ |ດວງດາວນ້ອຍ ແດນສະຫວັນ【LIVE VERSIONแฮงเฒ่าแฮงนัวแสดงสด |ดวงดาวน้อย แดนสะหวัน,DDN Channel ດວງດາວນ້ອຍ,UCP-zyi1oKS8lTWOOqdFhrYg,10,Music,"ດວງດາວນ້ອຍ ແດນສະຫວັນ, ດວງດາວນ້ອຍ, ດາວດວງນ້ອຍ, ดวงดาวน้อย, ดาวดวงน้อย, ดวงดาวน้อยแดนสะหวัน",6,https://i.ytimg.com/vi/7o5pJXAZEPM/hqdefault.jpg,th,th,False,395,PT6M35S,hd,False,False,False,False,85593,810,62
JNqK5NHnAuc,LA,2026-05-11T04:44:46.242195+00:00,2026-05-04T08:15:01Z,99วัน อยู่กับคุณยายความจำเสื่อมโรคจิต,99วัน อยู่กับคุณยายความจำเสื่อมโรคจิต,zbing z.,UC5zGJZpxeZPFcds5gFcDE7Q,20,Gaming,"zbingz, แป้ง, แคสเกม, ซีบิ้ง, เกม, พี่แป้ง, พี่แป้งแคสเกม",7,https://i.ytimg.com/vi/JNqK5NHnAuc/hqdefault.jpg,th,en,False,2011,PT33M31S,hd,False,True,False,False,754931,10433,1549
hHgDJnd8-XI,LA,2026-05-11T04:44:46.242202+00:00,2026-05-03T10:01:51Z,ระยะทางทำให้ใจคนเปลี่ยน,ระยะทางทำให้ใจคนเปลี่ยน,Soft Mind - Topic,UCn_CGhrVkX89ipBP7RtPiPQ,10,Music,"Soft Mind, ครูนก, ระยะทางทำให้ใจคนเปลี่ยน",3,https://i.ytimg.com/vi/hHgDJnd8-XI/hqdefault.jpg,th,th,False,363,PT6M3S,hd,False,True,False,False,31084,114,6
ojE-8K5HsHo,LA,2026-05-11T04:44:46.242211+00:00,2026-05-10T05:00:23Z,ผีแอดมิน (แกล้งโปร)😨😭 Minecraft Hardcore,ผีแอดมิน (แกล้งโปร)😨😭 Minecraft Hardcore,สุดหล่อแห่งบ่อนํ้ามัน XD,UCbpDQFEaHxiL-rLJT-ZGnSw,20,Gaming,"Roblox, สุดหล่อแห่งบ่อน้ำมัน XD, โรบล็อค, สุดหล่อแห่งบ่อน้ํามัน hd, สุดหล่อแห่งบ่อน้ำมัน hd, พี่แท้, สุดหล่อเเห่งบ่อน้ำมันxb, มายคราฟท์, มายคราฟ",9,https://i.ytimg.com/vi/ojE-8K5HsHo/hqdefault.jpg,th,th,False,1333,PT22M13S,hd,False,True,False,False,120471,5089,1135
0iXj7Zkb3Ik,LA,2026-05-11T04:44:46.242219+00:00,2026-04-29T09:00:06Z,แคนฮ้างนางฟ้า - กู่แคน Ft. ก้อง ห้วยไร่ [Official Music Video],แคนฮ้างนางฟ้า - กู่แคน Ft. ก้อง ห้วยไร่ [Official Music Video],กู่แคน ไทบ้านผู้สร้างงานศิลป์,UCNhSZo56irmnbFugF-0IWwg,10,Music,"กู่แคน, ก้อง ห้วยไร่, แคนฮ้างนางฟ้า, 13ปีกู่แคน, ก้องห้วยไร่, แคนฮ้างนางฟ้า กู่แคน, กู่แคน ก้อง, กู่แคน ก้องห้วยไร่, ก้อง กู่แคน, ก้อง ห้วยไร่ กู่แคน, แค้นฮ้าง กู่แคน, นางฟ้า กู่แคน, แคนนางฟ้า กู่ แคน, แคนฮางนางฟ้า ก้อง, แคนฮ้างนางฟ้า กู่แคนก้อง, ก้องห้วยไร่ กู่แคน, ก้องห้วยไร กู่แคน, แค้นฮ้างนางฟ้า ก้องห้วยไร่",18,https://i.ytimg.com/vi/0iXj7Zkb3Ik/hqdefault.jpg,th,th,False,281,PT4M41S,hd,False,True,False,False,2835288,32765,2413
x3eqqoZPV_E,LA,2026-05-11T04:44:46.242227+00:00,2026-05-04T09:21:33Z,BABYMONSTER - '춤 (CHOOM)' M/V,BABYMONSTER - '춤 (CHOOM)' M/V,BABYMONSTER,UCqwUnggBBct-AY2lAdI88jQ,10,Music,"BABYMONSTER, 베이비몬스터, 베몬, BABYMON, BAEMON, 하람, 아현, 루카, 치키타, 파리타, 로라, 아사, HARAM, AHYEON, RUKA, CHIQUITA, PHARITA, RORA, ASA",19,https://i.ytimg.com/vi/x3eqqoZPV_E/hqdefault.jpg,ko,ko,False,205,PT3M25S,hd,True,True,False,False,49932326,1063673,74267
bHHLcnics4A,LA,2026-05-11T04:44:46.242235+00:00,2026-05-10T08:00:49Z,มือใหม่ VS มือโปร เกมซ่อนหาด้วยไอเทมสุดโกงใน ไมน์คราฟต์,มือใหม่ VS มือโปร เกมซ่อนหาด้วยไอเทมสุดโกงใน ไมน์คราฟต์,Maizen World,UCS79iNbQdnXIiTAvVNlt7dQ,20,Gaming,"Game, Minecraft, Maizen",3,https://i.ytimg.com/vi/bHHLcnics4A/hqdefault.jpg,th,th,False,734,PT12M14S,hd,False,True,False,False,142846,1509,58
1hwXuDMbbWc,LA,2026-05-11T04:44:46.242243+00:00,2026-04-28T02:00:06Z,อุบัติเหตุหัวใจ - ริน ศรนรินทร์ | OFFICIAL MV,อุบัติเหตุหัวใจ - ริน ศรนรินทร์ | OFFICIAL MV,ประธานฮ่าง Channel,UCOm421Y_TXYSxBx4yqOCFtA,10,Music,"ประธานฮ่าง, หนังสั้น, อุบัติเหตุหัวใจ, ริน ศรนรินทร์, อุบัติเหตุหัวใจ ริน ศรนรินทร์, รินศรนรินทร์, ประธานฮาง, อุบัติเหตหัวไจ, อุบัติเหตุหัวใจ ริน, อุบัติเหตุหัวไจ ริน ศรนริน, รินศรนริน, คันคาย เรคคอร์ด, หนังสั้นอุบัติเหตุหัวใจ, อุบัติเหตุหัวใจ หนังสั้น, หนังสั้น ประธานฮ่าง, หนังสั้นประธานฮ่าง",16,https://i.ytimg.com/vi/1hwXuDMbbWc/hqdefault.jpg,th,th,False,412,PT6M52S,hd,False,True,False,False,677978,20265,1392
DphlYwaX60g,LA,2026-05-11T04:44:46.242251+00:00,2026-05-09T03:32:35Z,roblox best gameplay,roblox best gameplay,StanRP,UCHYA5HNaS5n4idxmP-at8nA,20,Gaming,"roblox, granny, free fire, live roblox, roblox shorts, shorts feed, 67, six seven, meme reset, singing brainrot song, great meme reset",11,https://i.ytimg.com/vi/DphlYwaX60g/hqdefault.jpg,en-US,en-US,False,9,PT9S,hd,False,True,False,False,611747,4699,0
2AGLOar7g5c,LA,2026-05-11T04:44:46.242259+00:00,2026-04-29T12:31:23Z,รักได้ครั้งละคน...,รักได้ครั้งละคน...,TAPS - Topic,UChBIYIEHrVopXns9lbhRFfQ,10,Music,"TAPS, รักได้ครั้งละคน เชื่อใจได้คนละครั้ง - Cover | (ตั๊กแตน ชลดา)",2,https://i.ytimg.com/vi/2AGLOar7g5c/hqdefault.jpg,th,th,False,265,PT4M25S,hd,False,True,False,False,75517,139,0
7WoSSHduGN0,LA,2026-05-11T04:44:46.242267+00:00,2026-05-10T09:38:18Z,พลังเตะสูงสุด 1.5 Billion เตะจนได้ตัวหายากตัวนี้มา Roblox Kick a Lucky Block,พลังเตะสูงสุด 1.5 Billion เตะจนได้ตัวหายากตัวนี้มา Roblox Kick a Lucky Block,Thanks For Watching,UCigsRUvOKCw3SJbnS_XloGw,20,Gaming,,0,https://i.ytimg.com/vi/7WoSSHduGN0/hqdefault.jpg,th,th,False,742,PT12M22S,hd,False,True,False,False,80438,1737,131
htTZsWpz_6A,LA,2026-05-11T04:44:46.242275+00:00,2026-05-02T21:44:40Z,เวลาไม่เคยเปลี่ยนคน,เวลาไม่เคยเปลี่ยนคน,บ่าวโหน่งอุบลฯ - Topic,UCbIZLw6wSVVChCN_5-dv4jg,10,Music,"บ่าวโหน่งอุบลฯ, เวลาไม่เคยเปลี่ยนคน",2,https://i.ytimg.com/vi/htTZsWpz_6A/hqdefault.jpg,th,th,False,374,PT6M14S,hd,False,True,False,False,90721,364,0
COKoozHOqE0,LA,2026-05-11T04:44:46.242283+00:00,2026-05-10T04:00:32Z,ใช้สเปรย์แกล้งเด็กใน MM 2! | Roblox MM2,ใช้สเปรย์แกล้งเด็กใน MM 2! | Roblox MM2,NJChicky,UCX1Zi9BxBY0O-x0Aq_y3ZRg,20,Gaming,"แคสเกม, โรบอก, โรบอค, เกม, roblox, ชิกกี้เอ็นเจ, เอ็นเจชิกกี้, เอ็นเจ, ชิกกี้, NJChicky, ChickyNJ, เจ้าหมี",12,https://i.ytimg.com/vi/COKoozHOqE0/hqdefault.jpg,th,th,False,939,PT15M39S,hd,False,True,False,False,88969,1965,460
0cjPhbnUr1U,LA,2026-05-11T04:44:46.242290+00:00,2026-04-21T11:00:05Z,ฮักพอเป็นพิธี - ต่าย อรทัย【OFFICIAL MV】,ฮักพอเป็นพิธี - ต่าย อรทัย【OFFICIAL MV】,GRAMMY GOLD OFFICIAL,UCFWsjsN53Sqvg2pWhSFmWBQ,10,Music,"เพลงลูกทุ่ง, แกรมมี่ โกลด์, grammy gold, gmmgrammyofficial, ลูกทุ่งแกรมมี่, เพลงลูกทุ่งรัก, เพลงใหม่, เพลงใหม่ล่าสุด, ฮัก, ฮักพอเป็นพิธี, ต่าย, ต่าย อรทัย, เพลงเพราะ, ลูกทุ่งเพลงใหม่, ลูกทุ่งมาแรง, ผู้หญิงหัวใจอีสาน, เพลงอกหัก, พิธีกรรม, เพลงใหม่ต่าย, นิลันดอน",20,https://i.ytimg.com/vi/0cjPhbnUr1U/hqdefault.jpg,th,th,False,416,PT6M56S,hd,False,True,False,False,2823675,21523,960
G1UDImxZwbg,LA,2026-05-11T04:44:46.242323+00:00,2026-05-09T10:30:16Z,กุกูกาก้าเพนกวิน บุกเมืองซากุระ จนกลายเป็นดินแดนน้ำแข็งทั้งเมือง 🧊🐧❄️ SAKURA School Simulator,กุกูกาก้าเพนกวิน บุกเมืองซากุระ จนกลายเป็นดินแดนน้ำแข็งทั้งเมือง 🧊🐧❄️ SAKURA School Simulator,CKKIDGaming,UCaVIV6EWmo8T6BNsq42R5wA,20,Gaming,"iosGaming, เกมมือถือ, เกมส์มือถือ, Android, Gameplay, SAKURASCHOOLSIMULATOR",6,https://i.ytimg.com/vi/G1UDImxZwbg/hqdefault.jpg,th,th,False,998,PT16M38S,hd,False,True,False,False,81882,957,92
MbvrVAwUOTw,LA,2026-05-11T04:44:46.242343+00:00,2026-04-08T10:01:53Z,เก็บความหลายใจไปใช้ที่อื่น,เก็บความหลายใจไปใช้ที่อื่น,ก้องออร่า-Official - Topic,UCQGSb9vQepwPyjrjncDQK1Q,10,Music,"ก้องออร่า-Official, The Best, เก็บความหลายใจไปใช้ที่อื่น",3,https://i.ytimg.com/vi/MbvrVAwUOTw/hqdefault.jpg,th,en,False,272,PT4M32S,hd,False,True,False,False,108806,451,0
QoNAhvb-HFs,LA,2026-05-11T04:44:46.242357+00:00,2026-05-10T05:30:11Z,อำพลเดอะซีรีส์ : ผมจีบคุณหนูได้มั้ยครับ ?,อำพลเดอะซีรีส์ : ผมจีบคุณหนูได้มั้ยครับ ?,PRIMKUNG,UChjKDMnMMG6iZY3twuuS2zg,20,Gaming,,0,https://i.ytimg.com/vi/QoNAhvb-HFs/hqdefault.jpg,th,th,False,3308,PT55M8S,hd,False,True,False,False,129656,5912,364
zK4-EM1FtbE,LA,2026-05-11T04:44:46.242365+00:00,2026-04-22T05:00:06Z,เบิ้ล ปทุมราช x แมน ภิสิทธิ์พงษ์ - คนต้นทาง [ Official MV ],เบิ้ล ปทุมราช x แมน ภิสิทธิ์พงษ์ - คนต้นทาง [ Official MV ],BLE PATUMRACH ,UCffA3uduAMx9YArnog42p2A,10,Music,"คนต้นทาง, คนต้นทางเบิ้ลปทุมราช, เบิ้ล ปทุมราช, ต้นทาง, เพลงคนต้นทาง, เบิ้ลปทุมราช, ปลายฟ้า, ปรายฟ้า, เปิ้ลประชุมราช, คนค้นทาง เบิ้ล, คนต้นทาง แมน, เบิ้ล ปทุมราช ปลายฟ้า, ปลายฟ้า เบิ้ล ปทุมราช, สองคนหนึ่งคำสัญญา, ปลายฟ้าให้เขาพายาง, ปลายฟ้าที่ฝันเอาไว้, ฝันเอาไว้ที่ปลายฟ้า, แมน ภิสิทธิ์พงษ์, อ้ายมีเหตุผล, กอดครั้งสุดท้าย, อ้ายแมน, ชาเน่, นนุ่น, ไปสาเด้อนาง ย่างตามทางให้สุดเส้น",24,https://i.ytimg.com/vi/zK4-EM1FtbE/hqdefault.jpg,th,th,False,263,PT4M23S,hd,False,True,False,False,2046447,17530,1349
uPvMnC5t2-s,LA,2026-05-11T04:44:46.242373+00:00,2026-05-09T03:15:04Z,ปั้นรหัสนนวรโชติ จะได้อะไรมาบ้าง | Free Fire,ปั้นรหัสนนวรโชติ จะได้อะไรมาบ้าง | Free Fire,LUXZY7 Gaming,UCU5QF98uc_ilF5vSczo78lQ,20,Gaming,,0,https://i.ytimg.com/vi/uPvMnC5t2-s/hqdefault.jpg,th,th,False,854,PT14M14S,hd,False,True,False,False,116906,2761,277
WYWILZp6gNY,LA,2026-05-11T04:44:46.242382+00:00,2026-05-01T02:13:18Z,กูโตมากับความลำบาก  – UNHEARD MUSIC 🖤 Official | Live Concert,กูโตมากับความลำบาก  – UNHEARD MUSIC 🖤 Official | Live Concert,UNHEARD MUSIC 🖤,UCUmNFbX-4XGMBYQkMBSS5TQ,10,Music,"เพลงสู้ชีวิต, เพลงคนจน, emo rock ไทย, rap rock ไทย, เพลงแรงบันดาลใจ, เพลงชีวิตจริง, เพลงเศร้าแรงๆ, เพลงอกหักชีวิต, เพลงกำลังใจ, เพลงใต้ดิน, unheard music, เพลงกูโตมากับความลำบาก, กูโตมากับความลำบาก, กูโตมา",14,https://i.ytimg.com/vi/WYWILZp6gNY/hqdefault.jpg,th,th,False,309,PT5M9S,hd,False,False,False,False,225885,1509,78
-GbnnC01RBs,LA,2026-05-11T04:44:46.242390+00:00,2026-05-10T14:48:28Z,LIVE 🔴 [TH] FFWS SEA 2026 Spring Knockout Stage - Day 9,LIVE 🔴 [TH] FFWS SEA 2026 Spring Knockout Stage - Day 9,Garena Free Fire TH,UCe5H8YhDjg_441KjjS5qrAg,20,Gaming,"ดูแข่งฟีฟาย, ฟีฟายไทย, ฟีฟายแข่ง, ดูฟีฟาย, Buriram united esports, all gamers global, avida x kdc, team falcons, twisted minds, twis, ag, avd, flcn, bru, บุรีรัมย์ ยูไนเต็ด, บุรีรัมย์ ยูไนเต็ด อีสปอร์ต, bru esports, AVIDA, FALCONS, falcons, avida, twistedminds, ดูแข่ง ag, AG, ดูแข่ง BRU, แข่งฟีฟาย, แข่งฟีฟายล่าสุด, ดูแข่งฟีฟายล่าสุด, ดูฟีฟาย 2026, ดูแข่งฟีฟาย 2026, FFWS SEA 2026 SPRING, freefire, Free Fire, FREE FIRE, BRU, FLCN, TWIS, AVD, ฟีฟาย, FREEFIRE, FREEFIRE แข่ง, ดูแข่ง freefire, ffws, ffws sea",44,https://i.ytimg.com/vi/-GbnnC01RBs/hqdefault.jpg,th,th,False,13921,PT3H52M1S,hd,False,False,False,False,87928,1378,35
zv-49Q1Whrk,LA,2026-05-11T04:44:46.242400+00:00,2026-04-28T10:03:20Z,อุบัติเหตุหัวใจ,อุบัติเหตุหัวใจ,ริน ศรนรินทร์ - Topic,UCb7Qs-e386wWCN0MRi_gdoA,10,Music,"ริน ศรนรินทร์, อุบัติเหตุหัวใจ",2,https://i.ytimg.com/vi/zv-49Q1Whrk/hqdefault.jpg,th,th,False,337,PT5M37S,hd,False,True,False,False,267278,1679,0
DzRcnrovqL4,LA,2026-05-11T04:44:46.242408+00:00,2026-05-09T14:15:46Z,[TH] 🔴 MSL TH Season 1 | Regular Season Week 4 Day 2,[TH] 🔴 MSL TH Season 1 | Regular Season Week 4 Day 2,MSL TH,UCZx-b4rkYvzK24TtaIYOn1Q,20,Gaming,,0,https://i.ytimg.com/vi/DzRcnrovqL4/hqdefault.jpg,th,th,False,30521,PT8H28M41S,hd,False,False,False,False,86517,859,1
