video_id,country,fetched_at,published_at,title,localized_title,channel_title,channel_id,category_id,category_name,tags,tag_count,thumbnail,default_language,audio_language,is_live,duration,duration_raw,definition,caption_available,licensed_content,embeddable,made_for_kids,views,likes,comments
GC7htigxOIQ,LA,2026-05-11T04:44:46.242415+00:00,2026-04-24T11:34:02Z,ขอบคุณที่เคียงข้าง - เพลงที่มอบให้คนข้างกายที่หวังดี | สองมือทองมิวสิค (Official MV),ขอบคุณที่เคียงข้าง - เพลงที่มอบให้คนข้างกายที่หวังดี | สองมือทองมิวสิค (Official MV),สองมือทอง,UCjmK6UxXuPYlM5x8fEkVyig,10,Music,"เพลงลูกทุ่งอินดี้, เพลงใหม่, thaicountrymusic, เพลงไทย, สองมือทอง, เพลงลูกทุ่ง, ลูกทุ่งอินดี้, เพลงลูกทุ่งใหม่ล่าสุด, เพลงอีสาน, อินดี้อีสาน, เพลงดังใน tiktok, เพลงใหม่ล่าสุด 2026, เพลงเศร้า, เพลงอกหัก, เพลงม่วนๆ, ฟังตอนทำงาน, รวมเพลงลูกทุ่ง, คอร์ดเพลงลูกทุ่ง",18,https://i.ytimg.com/vi/GC7htigxOIQ/hqdefault.jpg,th,th,False,302,PT5M2S,hd,False,True,False,False,162975,772,56
cqglXU9pF_Y,LA,2026-05-11T04:44:46.242423+00:00,2026-05-07T12:01:21Z,"รวมเพลงฮิต ต่ายอรทัย (ดอกหญ้าในป่าปูน,โทรหาแนเด้อ,ขอใจกันหนาว,มาจากดิน,อยู่ในใจเสมอ)","รวมเพลงฮิต ต่ายอรทัย (ดอกหญ้าในป่าปูน,โทรหาแนเด้อ,ขอใจกันหนาว,มาจากดิน,อยู่ในใจเสมอ)",Luk Thung Soul,UC__tcR342PXF7BSCycHjHDw,22,People & Blogs,,0,https://i.ytimg.com/vi/cqglXU9pF_Y/hqdefault.jpg,th,th,False,4906,PT1H21M46S,hd,False,True,False,False,214117,896,19
1OMZrYHIim8,LA,2026-05-11T04:44:46.242431+00:00,2026-04-23T11:00:07Z,PUN - รักให้เธอได้รู้ (Proof.),PUN - รักให้เธอได้รู้ (Proof.),PUN,UCI-tM95d7xGp-NWoIu3M_4w,10,Music,"PUN, While I'm Away, Teaser, New Music, เพลงใหม่, เพลงใหม่ปัน, ปัน, ปันหยาบ, ปันหยาบ เพลง, punyarb, punisalwayshappy, รักให้เธอได้รู้, เพลงรัก, Proof., Universal Music Thailand, Universal Music Thailand PUN",16,https://i.ytimg.com/vi/1OMZrYHIim8/hqdefault.jpg,th,th,False,198,PT3M18S,hd,True,False,False,False,2773002,41418,1290
rDxLBHrJKQg,LA,2026-05-11T04:44:46.242440+00:00,2026-05-09T04:00:04Z,"🔥โคตรโหด!!【""มายคราฟ, แต่ ค่าEnchantจะคูณเพิ่มขึ้นเรื่อยๆ!!""】| (Minecraft Mod)","🔥โคตรโหด!!【""มายคราฟ, แต่ ค่าEnchantจะคูณเพิ่มขึ้นเรื่อยๆ!!""】| (Minecraft Mod)",ParKilleRz Ch.,UCQr-aMB4hwNAL4DClOKUJvA,20,Gaming,"ParKilleRz Ch., พี่ปาร์ค, มายคราฟ, minecraft, mod, มอด, แมพ, แมพกระโดด, datapack, แต่ ค่าEnchantจะคูณเพิ่มขึ้นเรื่อยๆ!!, ปาร์คคิลเลอร์, เจเจ, parkillerz",13,https://i.ytimg.com/vi/rDxLBHrJKQg/hqdefault.jpg,th,th,False,1130,PT18M50S,hd,False,True,False,False,75222,1530,65
hnwGAz5Q4PA,LA,2026-05-11T04:44:46.242448+00:00,2026-05-01T02:59:06Z,4EVE - MY CHAINZ | OFFICIAL MV,4EVE - MY CHAINZ | OFFICIAL MV,4EVE,UC9mrIKAyV8AushabYK8i2ew,24,Entertainment,4eve,1,https://i.ytimg.com/vi/hnwGAz5Q4PA/hqdefault.jpg,en,th,False,202,PT3M22S,hd,True,True,False,False,1142248,29971,2960
ii8QbKnBeak,LA,2026-05-11T04:44:46.242455+00:00,2026-05-08T07:27:24Z,AB tsim แล่นเกน dab hmoob hmong ,AB tsim แล่นเกน dab hmoob hmong ,AB tsim ອະຈີ,UC44GqRk1WJU61jBcFYrfy9A,20,Gaming,,0,https://i.ytimg.com/vi/ii8QbKnBeak/hqdefault.jpg,th,vi,False,877,PT14M37S,hd,False,True,False,False,8034,971,79
AtIGwB-aZtE,LA,2026-05-11T04:44:46.242462+00:00,2026-04-23T13:04:58Z,อย่าท้อกับชีวิต,อย่าท้อกับชีวิต,YaiSorn Music - Topic,UC9bB0ATk2bJAFJas-YgSacw,10,Music,"YaiSorn Music, Phairoj phrannue, จินดารัตน์ ปรีชาสวัสดิ์, อย่าท้อกับชีวิต",4,https://i.ytimg.com/vi/AtIGwB-aZtE/hqdefault.jpg,th,th,False,300,PT5M,hd,False,True,False,False,193983,1390,0
i1vCSImK1io,LA,2026-05-11T04:44:46.242469+00:00,2026-05-09T01:00:45Z,ระเบิดเวลาไส้กรอก | Unicycle Together (Demo),ระเบิดเวลาไส้กรอก | Unicycle Together (Demo),LowGrade,UCycKzia69PXRbk0N0I9n4Aw,20,Gaming,"โลเกรด, โลเกด, พี่วิน, ราชาบัค, แบล็ค, FiveM, มายคราฟ, Minecraft, GTA, เณรแบล็ค, Roblox, LowGrade, เกมช่อนแอบ, Yataliban, icebaber, blackkung, songdohe, LowGrade Roblox, LowGrade MineCraft, เกมใหม่, เกมฮาๆ, เกมเล่นกับเพื่อน, เกมมือถือ, เกมอินดี้, เกมน่าเล่น, เกมมาแรง, เกมฮิต, เกมสร้างบ้าน, เกมเอาชีวิตรอด, เกมผจญภัย, เกมแนะนำ, เกมตลก, เกมแนว Sandbox, เกมออนไลน์, เกมเมอร์ไทย, ยูทูบเบอร์เกม, คอนเทนต์เกม, ตลกเกมเมอร์, เล่นเกมฮาๆ, เล่นเกมฮาแตก, Minecraft Mod, Minecraft ไทย, Minecraft เอาชีวิตรอด, Minecraft สร้างบ้าน",44,https://i.ytimg.com/vi/i1vCSImK1io/hqdefault.jpg,th,th,False,2179,PT36M19S,hd,False,True,False,False,89454,4786,129
e7xgomHoElI,LA,2026-05-11T04:44:46.242478+00:00,2026-04-11T02:01:56Z,ບ່າວເສຶ້ອຂາວ - ສາວເສຶ້ອດຳ / บ่าวเสื่อขาว-สาวเสื่อดำ / แสงดาววี ชุบเปี้2สี - บ๋อม ไมทองคำ,ບ່າວເສຶ້ອຂາວ - ສາວເສຶ້ອດຳ / บ่าวเสื่อขาว-สาวเสื่อดำ / แสงดาววี ชุบเปี้2สี - บ๋อม ไมทองคำ,Sengdaovy Super2sy,UCmV2xVgawcdc0fErTklS0ow,10,Music,#phatalk  #phatalk,1,https://i.ytimg.com/vi/e7xgomHoElI/hqdefault.jpg,th,th,False,311,PT5M11S,hd,False,True,False,False,260062,2517,157
yEWdgPdxIiU,LA,2026-05-11T04:44:46.242486+00:00,2026-05-08T18:47:34Z,LIVE 🔴 [TH] FFWS SEA 2026 Spring Knockout Stage - Day 7,LIVE 🔴 [TH] FFWS SEA 2026 Spring Knockout Stage - Day 7,Free Fire Esports TH,UCypQp4xDjhxlkwUepVGwA0A,20,Gaming,"ดูแข่งฟีฟาย, ฟีฟายไทย, ฟีฟายแข่ง, ดูฟีฟาย, Buriram united esports, all gamers global, avida x kdc, team falcons, twisted minds, twis, ag, avd, flcn, bru, บุรีรัมย์ ยูไนเต็ด, บุรีรัมย์ ยูไนเต็ด อีสปอร์ต, bru esports, AVIDA, FALCONS, falcons, avida, twistedminds, ดูแข่ง ag, AG, ดูแข่ง BRU, แข่งฟีฟาย, แข่งฟีฟายล่าสุด, ดูแข่งฟีฟายล่าสุด, ดูฟีฟาย 2026, ดูแข่งฟีฟาย 2026, FFWS SEA 2026 SPRING, freefire, Free Fire, FREE FIRE, BRU, FLCN, TWIS, AVD, ฟีฟาย, FREEFIRE, FREEFIRE แข่ง, ดูแข่ง freefire, ffws, ffws sea",44,https://i.ytimg.com/vi/yEWdgPdxIiU/hqdefault.jpg,th,th,False,13670,PT3H47M50S,hd,False,False,False,False,163392,2025,18
XtDjJ4p13Mc,LA,2026-05-11T04:44:46.242495+00:00,2026-04-22T16:22:07Z,เพลง ขอให้เจอความรักที่จะไม่ทำให้เสียใจ / ต้นฉบับ  Mv #papaonj #เพลงเศร้า #เพลงรักเจ็บๆ ,เพลง ขอให้เจอความรักที่จะไม่ทำให้เสียใจ / ต้นฉบับ  Mv #papaonj #เพลงเศร้า #เพลงรักเจ็บๆ ,PAPAONJ,UCy9MZjZ8hfYIU2gmQGIZwrw,22,People & Blogs,,0,https://i.ytimg.com/vi/XtDjJ4p13Mc/hqdefault.jpg,th,th,False,298,PT4M58S,hd,False,True,False,False,116460,745,57
EgnNdC3SWwE,LA,2026-05-11T04:44:46.242503+00:00,2026-05-10T10:21:59Z,เปิด Easter Gift ได้ผลไหน = ซื้อถาวร🤑แล้วเอาไปเทรด…จะรวยหรือพัง!?,เปิด Easter Gift ได้ผลไหน = ซื้อถาวร🤑แล้วเอาไปเทรด…จะรวยหรือพัง!?,STROKER,UCeb6Yo3bF9xHgbtqRxUQ6hA,20,Gaming,"เปิด Easter Gift ได้ผลไหน = ซื้อถาวร🤑แล้วเอาไปเทรด…จะรวยหรือพัง!?, Blox Fruits, บล็อกฟุต, ไอแก่, stroker, เปิด Easter Gift, ไข่ Easter, เปิด Easter Gift ได้ผลไหน = ซื้อถาวร, เปิด Easter Gift ได้ผลไหน, สุ่มผลปีศาจ, ผลปีศาจถาวร, สุ่มผลปีศาจถาวร, เทรดผลถาวร, เทรดผลจากไข่, ไอ้แก่, ไอเหลี่ยม",16,https://i.ytimg.com/vi/EgnNdC3SWwE/hqdefault.jpg,th,th,False,1183,PT19M43S,hd,False,True,False,False,22669,915,220
x46UDX42PqA,LA,2026-05-11T04:44:46.242511+00:00,2026-05-01T10:28:29Z,"แพ้เหล้าเสียเจ้า, เมาจนเสียคนฮัก,...","แพ้เหล้าเสียเจ้า, เมาจนเสียคนฮัก,...",เพลงของขวัญ - Topic,UC4uRSRTyQEnOxsiwao1Pbrg,10,Music,"เพลงของขวัญ, กาวี เปรมพุ่ม, แพ้เหล้าเสียเจ้า, เมาจนเสียคนฮัก, เหล้าพาเขามาแทนที่, คนแพ้เหล้าคืออ้าย, ฮักแพ้ขวด",3,https://i.ytimg.com/vi/x46UDX42PqA/hqdefault.jpg,th,th,False,2309,PT38M29S,hd,False,True,False,False,179394,1759,63
SYcBmvAEjZA,LA,2026-05-11T04:44:46.242519+00:00,2026-05-10T10:31:43Z,อัพเดทใหม่! โลก 2 สุดเสียว!🥵แมพเสียง Keyboard สุดฟิน!😍❤️ | Roblox +1 Speed Keyboard Escape,อัพเดทใหม่! โลก 2 สุดเสียว!🥵แมพเสียง Keyboard สุดฟิน!😍❤️ | Roblox +1 Speed Keyboard Escape,iuccc Darkside,UCiob6zydUE_mnxOtoIACFtw,20,Gaming,"Roblox, Roblox iuccc, iucc, iuccc, iuccc Roblox, iuccc roblox, roblox ไทย, roblox thai, Roblox ไทย, ไทย Roblox, Roblox mm2, mm2, mm2 roblox, meme roblox, roblox meme, roblox thailand, โรบอก, โรบอค, โรบัค, Robux, Robux ฟรี, ฟรี Roblox, Roblox Robux, Roblox Robux Free, Roblox Robux free, โรบัคฟรี, ฟรีโรบัค",27,https://i.ytimg.com/vi/SYcBmvAEjZA/hqdefault.jpg,th,th,False,1476,PT24M36S,hd,False,True,False,False,41159,853,143
zFzbrE2ucH0,LA,2026-05-11T04:44:46.242527+00:00,2026-04-23T09:07:40Z,ไม่ลำบากอย่าปากดี,ไม่ลำบากอย่าปากดี,มิสเตอร์ มิวสิค - Topic,UCYpWfHz_Ama7tJCz0aK2POg,10,Music,"มิสเตอร์ มิวสิค, ไม่ลำบากอย่าปากดี",2,https://i.ytimg.com/vi/zFzbrE2ucH0/hqdefault.jpg,th,th,False,305,PT5M5S,hd,False,True,False,False,266830,1719,44
LDzXOB_cgHs,LA,2026-05-11T04:44:46.242534+00:00,2026-05-05T09:45:04Z,กายหงิดโดนแก๊งคอลเซ็นเตอร์หลอก | Scam Line,กายหงิดโดนแก๊งคอลเซ็นเตอร์หลอก | Scam Line,กาย หงิด,UC79u_tfhqjGIi1tgWsJEG7Q,20,Gaming,"กายหงิด, กิตงาย, ROV, AOV, EVOS.Guy, E-Sport, โอหงิด, อาร์งาย, โปรเพลเยอร์, นักกีฬา, อีสปอร์ต, นักกีฬาอีสปอร์ต, ตลก, ฮา, เกรียน, สนุก, หนังตลก, หัวเราะ",18,https://i.ytimg.com/vi/LDzXOB_cgHs/hqdefault.jpg,th,th,False,974,PT16M14S,hd,False,True,False,False,430997,14876,489
