video_id,country,fetched_at,published_at,title,localized_title,channel_title,channel_id,category_id,category_name,tags,tag_count,thumbnail,default_language,audio_language,is_live,duration,duration_raw,definition,caption_available,licensed_content,embeddable,made_for_kids,views,likes,comments
OBDJgW-TJKc,NZ,2026-01-26T03:00:57.803239+00:00,2026-01-12T15:00:01Z,ONE PIECE: Season 2 | Official Teaser | Netflix,ONE PIECE: Season 2 | Official Teaser | Netflix,Netflix,UCWOA1ZGywLbqmigxE4Qlvuw,24,Entertainment,"Anime, Assassins, Blockbuster, Charithra Chandran, Chopper, Drum Island, Eiichiro Oda, Emily Rudd, Fantasy, Grand Line, Hit Show, Inaki Godoy, Into the Grand Line, Jacob, King of the Pirates, Laboon, Legendary, Lera, Live Action, Mackenyu, Manga, Marvel, Miss All Sunday, Miss Wednesday, Mr. 9, Nami, Netflix, ONE PIECE, OP, OP2, Oda-Sensei, Pirates, Reverse Mountain, S2, Season 2, Series, Straw Hats, Taz Skylar, Usopp, Zoro, the Unluckies",41,https://i.ytimg.com/vi/OBDJgW-TJKc/hqdefault.jpg,en,en-US,False,110,PT1M50S,hd,True,True,False,False,4562068,146308,10025
ijqXQVlay9c,NZ,2026-01-26T03:00:57.803247+00:00,2026-01-25T17:42:05Z,supersonic spear trap VS youtuber SMP,supersonic spear trap VS youtuber SMP,JudeLow,UC2gufCjSyNihNbOEZE50bwQ,20,Gaming,"spear judelow, judelow spear, judelow uses sprea, spear trap, spear trap minecraft, miencraft spear trap, minecraft spear, boat spear, spear boat trap, minecraft spear boat, judelow spear traps, spear traps, minecraft spear traping, spear traping, traping minecraft, miencraft trap, minecraft traps, best minecraft traps, trapping people minecraft, carvs christmas SMP, carvs SMP, carvs spear, carvs judelow, carvs server, carvs spear trap, spear minecraf, nubecraft",27,https://i.ytimg.com/vi/ijqXQVlay9c/hqdefault.jpg,en,en,False,917,PT15M17S,hd,False,True,False,False,670203,45260,2025
P8VVnopM610,NZ,2026-01-26T03:00:57.803254+00:00,2026-01-12T09:00:03Z,ALPHA DRIVE ONE 'FREAK ALARM' MV,ALPHA DRIVE ONE 'FREAK ALARM' MV,ALPHA DRIVE ONE,UCC4wzWbk_zdQNZstCwcfFLA,22,People & Blogs,,0,https://i.ytimg.com/vi/P8VVnopM610/hqdefault.jpg,ko,ko,False,194,PT3M14S,hd,True,False,False,False,38093050,236912,39679
htOpBAhwMhk,NZ,2026-01-26T03:00:57.803262+00:00,2026-01-21T15:08:54Z,MASTERS OF THE UNIVERSE Official Teaser Trailer (2026),MASTERS OF THE UNIVERSE Official Teaser Trailer (2026),KinoCheck.com,UCLRlryMfL8ffxzrtqv0_k_w,24,Entertainment,"2026, Camila Mendes, Fantasy, Jared Leto, KinoCheck, Masters, Masters of the Universe, Masters of the Universe trailer, Movie, Nicholas Galitzine, Universe, trailer",12,https://i.ytimg.com/vi/htOpBAhwMhk/hqdefault.jpg,en,en,False,49,PT49S,hd,False,True,False,False,473834,4311,906
65jnkBVYfqA,NZ,2026-01-26T03:00:57.803269+00:00,2026-01-21T14:00:22Z,Breaking Hardcore Minecraft to Get Revenge,Breaking Hardcore Minecraft to Get Revenge,Spoke,UCk2uxbWi5py_iJXaEsh2YRA,20,Gaming,"spoke, spokeishere, lifesteal, minecraft, survival, wormhole, unstable, unstable universe, wemmbu, parrotx2",10,https://i.ytimg.com/vi/65jnkBVYfqA/hqdefault.jpg,en,en-US,False,2327,PT38M47S,hd,False,True,False,False,2235292,82258,7878
HJgdT15UT4k,NZ,2026-01-26T03:00:57.803276+00:00,2026-01-13T08:59:57Z,LNGSHOT - [Moonwalkin'] Official Music Video,LNGSHOT - [Moonwalkin'] Official Music Video,MORE VISION,UCkR_4hIKdUTWz9wMPB-du8Q,24,Entertainment,,0,https://i.ytimg.com/vi/HJgdT15UT4k/hqdefault.jpg,en,ko,False,215,PT3M35S,hd,True,False,False,False,10809786,454087,20899
i1fqbyMXt1Y,NZ,2026-01-26T03:00:57.803283+00:00,2026-01-21T22:58:11Z,Street Fighter 6 - Alex Gameplay Trailer,Street Fighter 6 - Alex Gameplay Trailer,Street Fighter,UCVg9nCmmfIyP4QcGOnZZ9Qg,20,Gaming,"street fighter 6, sf6, capcom, alex, street fighter",5,https://i.ytimg.com/vi/i1fqbyMXt1Y/hqdefault.jpg,en,en,False,179,PT2M59S,hd,False,True,False,False,953870,48436,5444
