video_id,country,fetched_at,published_at,title,localized_title,channel_title,channel_id,category_id,category_name,tags,tag_count,thumbnail,default_language,audio_language,is_live,duration,duration_raw,definition,caption_available,licensed_content,embeddable,made_for_kids,views,likes,comments
7sxVHYZ_PnA,NZ,2026-01-26T03:00:57.802871+00:00,2026-01-23T17:00:07Z,Harry Styles - Aperture (Official Video),Harry Styles - Aperture (Official Video),HarryStylesVEVO,UCbOCbp5gXL8jigIBZLqMPrw,10,Music,"Harry styles, aperture, aperture official video, harry styles music video, aperture official music video, harry styles aperture, let the light in, we belong together, harry styles we belong together, together together, harry styles together together, harry styles lyrics, harry styles new music video, harry styles tour, harry styles music, new harry styles, new harry styles song, kiss all the time disco occasionally, kiss all the time, disco occasionally, hs4",21,https://i.ytimg.com/vi/7sxVHYZ_PnA/hqdefault.jpg,en,en,False,352,PT5M52S,hd,False,True,False,False,8810452,480491,28500
ZmEx7wQI6RY,NZ,2026-01-26T03:00:57.802912+00:00,2026-01-22T14:00:27Z,Masters of The Universe – Official Teaser Trailer,Masters of The Universe – Official Teaser Trailer,Amazon MGM Studios,UCf5CjDJvsFvtVIhkfmKAwAA,24,Entertainment,"MGM, MGM Studios, Metro-Goldwyn- Mayer, Metro Pictures Corporations, Goldwyn Pictures, Louis B. Mayer Pictures, MGM Pictures, United Artists, Metro MGM/UA, Amazon MGM, Amazon MGM Studios, Amazon, Masters Of The Universe, Masters Of The Universe Teaser, Masters Of The Universe Movie, Masters Of The Universe 2026, Masters Of The Universe Preview, Nicholas Galitzine, Morena Baccarin, Idris Elba, Jared Leto, Alison Brie, Kristen Wig",23,https://i.ytimg.com/vi/ZmEx7wQI6RY/hqdefault.jpg,en,en-US,False,145,PT2M25S,hd,True,True,False,False,17496391,83995,15618
Udk48Sm60yE,NZ,2026-01-26T03:00:57.802925+00:00,2026-01-24T14:30:07Z,2 Minecraft Pros VS 1000 Hunters,2 Minecraft Pros VS 1000 Hunters,Parrot,UCPLMPHT-d8GZOqL_AHJFdQQ,20,Gaming,"Minecraft, Minecraft SMP, SMP, Minecraft Server, LifeSteal SMP, School Minecraft Server, School SMP, School Parrot, Parrot, ParrotX2, Dream SMP, TommyInnit, LifeSteal, parrot lifesteal smp, Spoke, minecraft survival, minecraft hardcore, minecraft challenge, minecraft server, HermitCraft, MumboJumbo, Grian, why i broke 100+ bedrock, Here's Why I Made 12240 Minecraft Cakes, Minecraft Hunt, LifeSteal Season 3, 1 Heart Minecraft, LifeSteal Season 4, Why I Removed the World",29,https://i.ytimg.com/vi/Udk48Sm60yE/hqdefault.jpg,en,en,False,4258,PT1H10M58S,hd,False,True,False,False,3802107,203284,36572
mrV8kK5t0V8,NZ,2026-01-26T03:00:57.802935+00:00,2026-01-09T05:01:04Z,Bruno Mars - I Just Might [Official Music Video],Bruno Mars - I Just Might [Official Music Video],Bruno Mars,UCoUM-UJ7rirJYP8CQ0EIaHA,10,Music,"bruno mars, bruno, atlantic records, official video, pop music, R&B, funk, soul, Bruno Mars - I Just Might [Official Music Video], bruno mars i just might, i just might bruno mars, i just might, bruno mars new music, bruno mars new song, mars, bruno mars album, just, might, just might, bruno mars the romantic, the romantic, the romantic bruno mars",22,https://i.ytimg.com/vi/mrV8kK5t0V8/hqdefault.jpg,en,en,False,213,PT3M33S,hd,False,True,False,False,51204034,1247996,55183
oonACDq89BY,NZ,2026-01-26T03:00:57.802943+00:00,2026-01-22T17:00:20Z,Star Wars: Maul - Shadow Lord | Official Teaser Trailer | Streaming April 6 on Disney+,Star Wars: Maul - Shadow Lord | Official Teaser Trailer | Streaming April 6 on Disney+,Star Wars,UCZGYJFUizSax-yElQaFDp5Q,24,Entertainment,,0,https://i.ytimg.com/vi/oonACDq89BY/hqdefault.jpg,en,en-US,False,108,PT1M48S,hd,True,True,False,False,3438891,175264,10583
CU2HOhS9yOo,NZ,2026-01-26T03:00:57.802951+00:00,2026-01-25T14:00:19Z,I Became a Minecraft Killer,I Became a Minecraft Killer,Wemmbu,UCkzzNLnuM-VsATWC53ehwOQ,20,Gaming,"wemmbu, flamefrags, unstable smp, wemmbu vs flamefrags, wemmbu unstable smp, wemmbu farlands, minecraft farlands, wemmbu minecraft, wemmbu orbital cannon, orbital strike cannon, unstable universe, wemmbu unstable universe, weembu, wembu, wemmbu death, 2 Minecraft Pros VS 1000 Players, spoke, parrotx2, wemmbu parrot, wemmbu killer, I Became a Minecraft Killer, Unstable SMP law, wemmbu prison, wemmbu law",24,https://i.ytimg.com/vi/CU2HOhS9yOo/hqdefault.jpg,en-US,en-US,False,4830,PT1H20M30S,hd,False,True,False,False,2148319,162547,24719
SOJpE1KMUbo,NZ,2026-01-26T03:00:57.802959+00:00,2026-01-09T18:27:49Z,Dave - Raindance (ft. Tems),Dave - Raindance (ft. Tems),Santan Dave,UC5-cg5RahETrjGu-r8zjYCQ,10,Music,"dave, santan dave, santandave, tems, dave x tems, tems x dave, dave tems, tems dave, dave raindance, dave rain dance, raindance dave, rain dance dave, dave tems raindance, dave tems rain dance, dave x tems raindance, raindance dave x tems, raindance, rain dance, raindance video, dave raindance video, tems raindance, raindance tems, the boy who played the harp, dave 2026, santan dave raindance, dave ft tems, tems ft dave, radiance, dave radiance, raindance dave ft tems",30,https://i.ytimg.com/vi/SOJpE1KMUbo/hqdefault.jpg,en,en,False,221,PT3M41S,hd,False,False,False,False,18921348,388938,10020
ZnfUeVeMKjY,NZ,2026-01-26T03:00:57.802967+00:00,2026-01-22T17:01:02Z,Invincible Season 4 - Official Trailer | Prime Video,Invincible Season 4 - Official Trailer | Prime Video,Prime Video,UCQJWtTnAHhEG5w4uN0udnUQ,24,Entertainment,"invincible season 4 official trailer, invincible season 4 trailer, invincible season 4 prime video, prime video invincible season 4, invincible, invincible season 4, invincible s4, invincible s4 thragg, invincible s4 trailer, invincible season 4 thragg, thragg vs invincible, thragg invincible, battle beast, invincible battle beast, battle beast vs thragg, thragg vs battle beast, invincible vs conquest, steven yeun, jk simmons, omni man, lee pace, lee pace thragg, trailer",23,https://i.ytimg.com/vi/ZnfUeVeMKjY/hqdefault.jpg,en,en,False,149,PT2M29S,hd,True,True,False,False,2917129,177869,9021
TgX-c8WCRZE,NZ,2026-01-26T03:00:57.802975+00:00,2026-01-21T17:00:50Z,THE SIDEMEN AMONG US MOVIE: PROXIMITY CHAT EDITION,THE SIDEMEN AMONG US MOVIE: PROXIMITY CHAT EDITION,MoreSidemen,UCh5mLn90vUaB1PbRRx_AiaA,22,People & Blogs,"sidemen, moresidemen, miniminter, ksi, zerkaa, behzinga, tbjzl, vikkstar, wroetoshaw",9,https://i.ytimg.com/vi/TgX-c8WCRZE/hqdefault.jpg,en,en-GB,False,27413,PT7H36M53S,hd,False,True,False,False,1206526,29603,1931
x7FidC0YYDQ,NZ,2026-01-26T03:00:57.802983+00:00,2026-01-16T11:30:07Z,GET AT ME (Official Video) PREM DHILLON | The Kidd | Flexsinghh | Director Whiz | Latest Track 2026 ,GET AT ME (Official Video) PREM DHILLON | The Kidd | Flexsinghh | Director Whiz | Latest Track 2026 ,Prem Dhillon,UCGMfRSOhC8SqZ0nnjfDR1Rg,10,Music,"Prem dhillon, getatme prem dhillon, prem dhillon diss, sidhu moosewala, latest Track 2026, prem dhillon disstrack, karan aujla, prem dhillon diss navaaan, jaani, sabi bhinder, low rider",11,https://i.ytimg.com/vi/x7FidC0YYDQ/hqdefault.jpg,en,pa,False,259,PT4M19S,hd,False,True,False,False,2660460,77485,5714
X2FAizaEkls,NZ,2026-01-26T03:00:57.802991+00:00,2026-01-18T06:56:34Z,Heated Wizardry - SNL,Heated Wizardry - SNL,Saturday Night Live,UCqFzWxSCi39LnW1JKFR3efg,23,Comedy,"video, SNL, Saturday Night Live, live, new york, comedy, sketch, funny, hilarious, late night, host, music, guest, laugh, impersonation, actor, improv, musician, season 51, snl51, snl 51, Finn Wolfhard, stranger things, stranger things cast, stranger things actor, Finn Wolfhard interview, Finn Wolfhard on SNL, It, Hell of a Summer, It Chapter Two, Ghostbusters: Afterlife, The Turing, A$AP Rocky, ASAP Rocky, Finn Wolfhard hosts SNL, harry potter, heated rivalry, television series, trailer",39,https://i.ytimg.com/vi/X2FAizaEkls/hqdefault.jpg,en,en,False,196,PT3M16S,hd,True,True,False,False,4389279,199174,7257
2dNuN7vGigg,NZ,2026-01-26T03:00:57.802999+00:00,2026-01-24T20:00:01Z,Hermitcraft 11: Episode 9 - BAD BAD BAD BAD BAD BAD BAD,Hermitcraft 11: Episode 9 - BAD BAD BAD BAD BAD BAD BAD,Mumbo Jumbo,UChFur_NwVSbUozOcF_F2kMg,20,Gaming,"ideas, creative, build, survival, tutorial, How to, MumboJumbo, ThatMumboJumbo, Minecraft, Building, Mumbo, Redstone, Technical, Piston, 1.9, 1.8, 1.10, 1.11, Gaming, Game, spotlight, showcase, challenge, command, mini-game, gameplay, playthrough, Let's Play, No Swearing, Family Friendly, mc, mcpe, vanilla, Xbox, 360, PS4, PE, pocket edition, mobile",39,https://i.ytimg.com/vi/2dNuN7vGigg/hqdefault.jpg,en,en,False,1812,PT30M12S,hd,False,True,False,False,838925,56479,4002
R6e4tBWxIxE,NZ,2026-01-26T03:00:57.803008+00:00,2026-01-16T05:00:00Z,ENHYPEN (엔하이픈) 'Knife' Official MV,ENHYPEN (엔하이픈) 'Knife' Official MV,HYBE LABELS,UC3IZKseVpdzPSBaWxBxundA,10,Music,"HYBE, HYBE LABELS, 하이브, 하이브레이블즈",4,https://i.ytimg.com/vi/R6e4tBWxIxE/hqdefault.jpg,ko,ko,False,164,PT2M44S,hd,True,True,False,False,18285619,740101,94761
pWw-UENvdTw,NZ,2026-01-26T03:00:57.803016+00:00,2026-01-22T18:15:12Z,Forza Horizon 6 - Official Gameplay Teaser Trailer,Forza Horizon 6 - Official Gameplay Teaser Trailer,Forza,UCydtMNspoPAlqBjFSGnigSw,20,Gaming,"ForzaHorizon6, ForzaHorizon, ForzaHorizonJapan, ForzaJapan, ForzaHorizon2026, XboxDeveloperDirect, FH6Gameplay, Horizon6Gameplay",8,https://i.ytimg.com/vi/pWw-UENvdTw/hqdefault.jpg,en,en-US,False,48,PT48S,hd,True,False,False,False,1879488,82866,5974
F0JgyHT9wN8,NZ,2026-01-26T03:00:57.803024+00:00,2026-01-24T23:28:00Z,This Game is Just Mario Party with Beans,This Game is Just Mario Party with Beans,SMii7Y,UCzXwjTI6c6mVn6oui_p6oiw,20,Gaming,"smii7y, smii7yplus, smii7y+, smii7y plus, bean there won that, bean there won that gameplay, gameplay bean there won that, bean there won that funny moments, bean there won that party game, party games, mini games, funny moments",12,https://i.ytimg.com/vi/F0JgyHT9wN8/hqdefault.jpg,en,en,False,2131,PT35M31S,hd,False,True,False,False,1489246,66376,1857
cUfDOS2SINM,NZ,2026-01-26T03:00:57.803032+00:00,2026-01-23T10:00:07Z,XG - HYPNOTIZE (Official Music Video),XG - HYPNOTIZE (Official Music Video),XG,UC12HMtO5MYph9dCZZ7yygng,10,Music,"XG, XGALX, GRL GVNG, SHOOTING STAR, LEFT RIGHT, MASCARA, Tippy Toes, JURIN, JURIA, MAYA, COCONA, CHISA, HARVEY, HINATA, ALPHAZ, X-GENE, TGIF, NEW DANCE, PUPPET SHOW, WINTER WITHOUT YOU, WOKE UP, SOMETHING AIN'T RIGHT, IYKYK, AWE, IS THIS LOVE, IN THE RAIN, MILLION PLACES, GALA",28,https://i.ytimg.com/vi/cUfDOS2SINM/hqdefault.jpg,en,en,False,190,PT3M10S,hd,True,True,False,False,2339503,196455,8465
-1UJJPAWudQ,NZ,2026-01-26T03:00:57.803040+00:00,2026-01-14T16:00:13Z,Euphoria Season 3 | Trailer | HBO Max,Euphoria Season 3 | Trailer | HBO Max,HBO Max,UCx-KWLTKlB83hDI6UKECtJQ,24,Entertainment,"hbo max, hbo, hbo originals, hbo original series, hbo trailer, new on hbo, hbo max originals, hbo max trailer, hbo max series, hbo max youtube, euphoria, euphoria season 3, euphoria trailer 1, euphoria trailer, zendaya, sydney sweeney, jacob elordi, rue, cassie, nate, alexa demie, maddy, lexi, jules, maude apatow, hunter schafer, zendaya euphoria, euphoria new season, hbo euphoria season 3, sydney sweeney euphoria, sydney sweeney cassie, cassie and nate, cassie and maddy",33,https://i.ytimg.com/vi/-1UJJPAWudQ/hqdefault.jpg,en,en,False,145,PT2M25S,hd,True,True,False,False,4918987,111179,7602
dj2PkwfrRP0,NZ,2026-01-26T03:00:57.803047+00:00,2026-01-22T18:44:20Z,Forza Horizon 6 Gameplay Overview | Xbox Developer Direct 2026,Forza Horizon 6 Gameplay Overview | Xbox Developer Direct 2026,IGN,UCKy1dAqELo0zrOtPkf0eTMw,20,Gaming,"Xbox, xbox showcase, xbox developer direct, xbox trailers, xbox trailer, xbox games, new xbox games, upcoming xbox games, xbox series x, xbox series s, game trailer, game trailers, trailer, trailers, gaming, video games, video game trailer, video game trailers, new game trailers, new video game trailers, upcoming video games, new video games 2026, upcoming video games 2026",23,https://i.ytimg.com/vi/dj2PkwfrRP0/hqdefault.jpg,en,en,False,723,PT12M3S,hd,False,True,False,False,2680635,102583,9925
g1-46Nu3HxQ,NZ,2026-01-26T03:00:57.803055+00:00,2026-01-12T17:00:06Z,A$AP Rocky - HELICOPTER (Official Video),A$AP Rocky - HELICOPTER (Official Video),LIVELOVEASAPVEVO,UCHE7rAi1Fw1CBmQXFtvJmrw,10,Music,"A$AP Rocky, HELICOPTER",2,https://i.ytimg.com/vi/g1-46Nu3HxQ/hqdefault.jpg,en,en,False,188,PT3M8S,hd,False,True,False,False,8882171,270053,12745
_4zJJSEm1ag,NZ,2026-01-26T03:00:57.803062+00:00,2026-01-22T18:51:37Z,Fable - Gameplay Teaser | PS5 Games,Fable - Gameplay Teaser | PS5 Games,PlayStation,UC-2Y8dQb0S6DtpxNgAKoJKA,20,Gaming,"PlayStation, PS5, video games, next gen, Sony, Fable, Fable the Game, RPG, British, Adventure",10,https://i.ytimg.com/vi/_4zJJSEm1ag/hqdefault.jpg,en,en,False,40,PT40S,hd,False,True,False,False,999057,26454,2991
D7hmj_cT-Qk,NZ,2026-01-26T03:00:57.803069+00:00,2026-01-20T22:44:14Z,I Got Trained By the World's Best Minecraft Player,I Got Trained By the World's Best Minecraft Player,FlameFrags,UCvYPobTo42NM36X7VC4dLhA,20,Gaming,"minecraft, flamefrags, flame frags, flamefrags minecraft, flame minecraft",5,https://i.ytimg.com/vi/D7hmj_cT-Qk/hqdefault.jpg,en-US,en-US,False,3161,PT52M41S,hd,False,True,False,False,3570964,145183,23776
BWfKkqo1Mk8,NZ,2026-01-26T03:00:57.803076+00:00,2026-01-19T09:00:14Z,EXO 엑소 'Crown' MV,EXO 엑소 'Crown' MV,SMTOWN,UCEf_Bc-KVd7onSeifS3py9g,10,Music,"EXO, 엑소, we are oneEXO, EXO-K, EXO-M, 엑소케이, 엑소엠, SUHO, LAY, CHANYEOL, D.O., KAI, SEHUN, 수호, 레이, 찬열, 디오, 카이, 세훈, REVERXE, 리버스, 8th album, 8집, comeback, 컴백, Crown, 크라운, mv, music video, teaser, 뮤비",31,https://i.ytimg.com/vi/BWfKkqo1Mk8/hqdefault.jpg,en,ko,False,212,PT3M32S,hd,True,True,False,False,30707713,568960,108156
OOmRInABehI,NZ,2026-01-26T03:00:57.803085+00:00,2026-01-25T04:45:04Z,Anime “Dragon Ball Super: Beerus” | SUPER Launch Trailer,Anime “Dragon Ball Super: Beerus” | SUPER Launch Trailer,東映アニメーション公式YouTubeチャンネル,UCLhgIX2L5ZCaWdlaxR_oTAg,1,Film & Animation,,0,https://i.ytimg.com/vi/OOmRInABehI/hqdefault.jpg,en,ja,False,158,PT2M38S,hd,False,True,False,False,2069792,138814,11088
EJgA8NcudYU,NZ,2026-01-26T03:00:57.803092+00:00,2026-01-24T20:28:56Z,I Removed 99% of the Chunks on the Lifesteal SMP,I Removed 99% of the Chunks on the Lifesteal SMP,SB737,UCFrVj6wBM42y3XuKCAj8n5A,20,Gaming,"minecraft, gaming, sb737, sb minecraft, sb, let's play, Lifesteal, smp, minecraft smp, lifesteal smp, rekrap, Chunks, 99% chunks",13,https://i.ytimg.com/vi/EJgA8NcudYU/hqdefault.jpg,en-GB,en,False,2329,PT38M49S,hd,False,True,False,False,583780,23703,1356
NtpR7-z4ZNA,NZ,2026-01-26T03:00:57.803099+00:00,2026-01-10T12:02:29Z,Bloodline (Official MV) Harf Cheema - Gulab Sidhu - Sukh Lotey,Bloodline (Official MV) Harf Cheema - Gulab Sidhu - Sukh Lotey,Harf Cheema,UCZiDjs6qM-Ip3Xkv-m3tD7Q,10,Music,"harf cheema, punjab song, harf cheema songs, new songs punjabi, punjabi songs, punjabi new songs, new songs, bloodline harf cheema, harf cheema gulab sidhu, gulab sidhu new song, harf cheema new song, latest punjabi song 2026, new songs 2026, punjabi folk song, bloodline song, majuke horse, horse song, punjabi horse song, gulab sidhu, majuke line horse, hit punjabi songs, new song, ghode, majuke ghoda, majuke bloodline",25,https://i.ytimg.com/vi/NtpR7-z4ZNA/hqdefault.jpg,pa,en,False,152,PT2M32S,hd,False,True,False,False,6062348,62814,1668
V2Gx9icNQiA,NZ,2026-01-26T03:00:57.803107+00:00,2026-01-23T20:00:34Z,GAMEOVERSE [TRAILER],GAMEOVERSE [TRAILER],GLITCH,UCn_FAXem2-e3HQvmK-mOH4g,1,Film & Animation,"glitch, glitch productions, digital circus, the amazing digital circus, murder drones, Pomni, Uzi, Jax, Ragatha, Kinger, Gangle, Zooble, Caine, Bubble, 3D, Animation, 3D Animation, Indie Animation, Gummigoo",19,https://i.ytimg.com/vi/V2Gx9icNQiA/hqdefault.jpg,en,en,False,128,PT2M8S,hd,True,True,False,False,2669865,337744,23200
sJ_VD7Lz2rU,NZ,2026-01-26T03:00:57.803114+00:00,2026-01-23T18:05:01Z,Quarantine Zone  - Part 2,Quarantine Zone  - Part 2,jacksepticeye,UCYzPXprvl5Y-Sf0g4vX-m6g,20,Gaming,jacksepticeye,1,https://i.ytimg.com/vi/sJ_VD7Lz2rU/hqdefault.jpg,en,en,False,5552,PT1H32M32S,hd,False,True,False,False,769146,42184,2105
85UJ8Rvfj9g,NZ,2026-01-26T03:00:57.803121+00:00,2026-01-23T05:00:14Z,Joji - Last of a Dying Breed (Visualizer),Joji - Last of a Dying Breed (Visualizer),Joji,UCFl7yKfcRcFmIUbKeCA-SJQ,10,Music,"Joji, Nectar, BALLADS 1, In Tongues, Chloe Burbank, Gimme Love, Run, SLOW DANCING IN THE DARK, 88rising, glimpse of us, smithereens, joji smithereens, joji tour, die for you, joji head in the clouds, joji music video, joji official video, joji visualizer, joji lyrics, joji yeah right, joji sanctuary, last of a dying breed, piss in the wind, pixelated kisses, love you less, past won't leave my bed",26,https://i.ytimg.com/vi/85UJ8Rvfj9g/hqdefault.jpg,en,en,False,150,PT2M30S,hd,False,True,False,False,928503,103603,4733
h5CtjDLvUVk,NZ,2026-01-26T03:00:57.803129+00:00,2026-01-20T18:00:49Z,Honest Trailers | The Lord of the Rings: The Two Towers,Honest Trailers | The Lord of the Rings: The Two Towers,Screen Junkies,UCOpcACMWblDls9Z6GERVi1A,1,Film & Animation,,0,https://i.ytimg.com/vi/h5CtjDLvUVk/hqdefault.jpg,en,en,False,563,PT9M23S,hd,False,True,False,False,508815,25284,1678
rQiqP4dY-ms,NZ,2026-01-26T03:00:57.803136+00:00,2026-01-23T18:31:46Z,I GOT #1 Leadboard in Escape Tsunami For Brainrots..,I GOT #1 Leadboard in Escape Tsunami For Brainrots..,CaylusBlox,UCsPMNatXCwqyUuJilBT73jg,20,Gaming,"caylusblox, caylus roblox, caylus, caylus gaming, caylus infinite, infinite lists, calus, callus, calis, roblox, caylus horror, caylus scary, caylus scariest, caylus scary myths, caylus creepy, caylus roblox horror, caylus roblox scary, caylus steal a brainrot, caylus aura, caylus stream, caylus brainrot, caylus foltyn",22,https://i.ytimg.com/vi/rQiqP4dY-ms/hqdefault.jpg,en-US,en-US,False,1090,PT18M10S,hd,False,True,False,False,1832910,31180,2723
q2GkAf_GQes,NZ,2026-01-26T03:00:57.803143+00:00,2026-01-20T05:32:32Z,Old Money : Tarsem Jassar (Official Video) | Deep Jandu | New Punjabi Song 2026,Old Money : Tarsem Jassar (Official Video) | Deep Jandu | New Punjabi Song 2026,Speed Records,UCOsyDsO5tIt-VZ1iwjdQmew,10,Music,"Old Money, Tarsem Jassar, tarsem jassar new song, tarsem jassar all songs, tarsem jassar old money, punjabi song, new punjabi song, trending song, punjabi new song, punjabi song dance, punjabi music, new song, punjabi party song, punjabi dj song, punjabi hit song, trending punjabi songs, trending new song, punjabi gane, punjabi song new, punjabi song 2026, punjabi party songs, punjabi songs, party all night song, punjabi hits, punjabi new song 2026, World Is Yours",26,https://i.ytimg.com/vi/q2GkAf_GQes/hqdefault.jpg,en,pa,False,223,PT3M43S,hd,False,True,False,False,2553373,15525,576
Et4clt5xdI4,NZ,2026-01-26T03:00:57.803151+00:00,2026-01-23T17:30:05Z,Supergirl | Blast Off :30,Supergirl | Blast Off :30,DC,UCiifkYAs_bq1pt_zbNAzYGg,1,Film & Animation,"2026, Coming Soon, Craig Gillespie, DC, DC Comics, DC Studios, DCU, Eve Ridley, James Gunn, Jason Momoa, Kara Zor-El, Krypto, Matthias Schoenaerts, Milly Alcock, Supergirl, WB, Warner Bros, Warner Bros Pictures, Warner Brothers",19,https://i.ytimg.com/vi/Et4clt5xdI4/hqdefault.jpg,en,en-US,False,33,PT33S,hd,True,False,False,False,693299,31879,1309
yP5RGz_CRFM,NZ,2026-01-26T03:00:57.803158+00:00,2026-01-25T14:10:01Z,The Super Mario Galaxy Movie – Yoshi First Look,The Super Mario Galaxy Movie – Yoshi First Look,Nintendo of America,UCGIY_O-8vW4rfX98KlMkvRg,20,Gaming,"nintendo, game, gameplay, fun, video game, action, adventure, rpg, play, switch, nintendo switch",11,https://i.ytimg.com/vi/yP5RGz_CRFM/hqdefault.jpg,en,en,False,125,PT2M5S,hd,False,False,False,False,1413254,86191,7286
Xu8Xm4gpDP8,NZ,2026-01-26T03:00:57.803165+00:00,2026-01-15T19:00:07Z,Ren - Vincent's Tale - The Bedroom,Ren - Vincent's Tale - The Bedroom,Ren,UCqq3VcwPGseErHUa0-xLInQ,10,Music,"ren, renmakesmusic, Ren Music, Ren New Music, Ren Hi Ren, Ren Reaction, Ren Reactions, Ren Animal Flow, Ren Sick Boi, Ren Murderer, Ren Chalk Outlines, Ren Chinchilla, Ren Jenny's Tale, Ren Violet's Tale, Ren For Joe, Ren Reaction Video, Ren Makes Music, Money Game, Ren Money Game, Sick Boi, hi ren, hi ren song, hi ren reaction, ren reaction, ren reactions, ren new music, ren UK",27,https://i.ytimg.com/vi/Xu8Xm4gpDP8/hqdefault.jpg,en,en,False,625,PT10M25S,hd,True,True,False,False,1204099,53374,5855
AZGfCK1yTTI,NZ,2026-01-26T03:00:57.803173+00:00,2026-01-15T12:28:05Z,"BORDER 2 (Trailer) | Sunny Deol, Varun, Diljit, Ahan | Anurag S | JP Dutta, Bhushan K | 23-Jan-2026","BORDER 2 (Trailer) | Sunny Deol, Varun, Diljit, Ahan | Anurag S | JP Dutta, Bhushan K | 23-Jan-2026",T-Series,UCq-Fj5jknLsUf-MWSy4_brA,10,Music,"bollywood movies 2025, tseries, tseries songs, border 2 trailer, sunny deol border 2 trailer, border 2 full trailer, sunny deol scene border 2, border 2 sunny deol, varun dhawan border 2, sunny deol dialogue border 2, border 2 movie, sunny deol new movie, new hindi movie, border 2 full movie, sunny deol border scene, border 2 varun dhawan scene, diljit dosanjh border 2 scene, ahan shetty border 2, border 2 movie trailer, sunny deol movies, border 2 review, border 2",22,https://i.ytimg.com/vi/AZGfCK1yTTI/hqdefault.jpg,en,hi,False,215,PT3M35S,hd,True,True,False,False,25518634,603429,25401
AUWH7uHPgOY,NZ,2026-01-26T03:00:57.803181+00:00,2026-01-20T23:53:00Z,We Played The Most Hilarious Game of 2026,We Played The Most Hilarious Game of 2026,SMii7Yplus,UC-gW4TeZAlKm7UATp24JsWQ,20,Gaming,"smii7y, smii7yplus, smii7y+, smii7y plus, burglin gnomes, burglin gnomes game, burglin gnomes multiplayer, burglin gnomes gameplay, heist game, online co-op game, pc multiplayer game, lethal company like games, weird steam games, funny steam games",14,https://i.ytimg.com/vi/AUWH7uHPgOY/hqdefault.jpg,en,en,False,2008,PT33M28S,hd,False,True,False,False,2661805,123286,2022
07SeT_QSJ08,NZ,2026-01-26T03:00:57.803188+00:00,2026-01-16T05:00:06Z,Madison Beer - bad enough (Official Music Video),Madison Beer - bad enough (Official Music Video),MadisonBeerMusicVEVO,UCniqtXw3nZho_0HEO5IBqvg,10,Music,"sing it loud, dangerous, madison beer dangerous, hurts like hell, home with you, say it to myself, selfish, selfish video, dangerous video, life support, selfish alan walker, have never felt more alive, baby, pop up, madison beer pop up, pop up video, baby jonas blue, jonas blue remix, baby remix, showed me, madison beer showed me, madison beer, showed me official music video, madison beer official music video, home to another one, 15 minutes, fifteen minutes",27,https://i.ytimg.com/vi/07SeT_QSJ08/hqdefault.jpg,en,en,False,268,PT4M28S,hd,False,True,False,False,2034839,102631,3964
CyXfSKHo7_8,NZ,2026-01-26T03:00:57.803195+00:00,2026-01-20T14:30:18Z,Exclusive Trailer - Corriedale: The Aftermath | Coronation Street,Exclusive Trailer - Corriedale: The Aftermath | Coronation Street,Coronation Street,UCh6WBwaLrYGQMOsu4_ixVCg,24,Entertainment,"Coronation Street, corrie, Drama - Topic, Soaps - Topic, Soap Operas - Topic, Soap Opera - Topic, soap, CORRIEDALE",8,https://i.ytimg.com/vi/CyXfSKHo7_8/hqdefault.jpg,en,en-GB,False,79,PT1M19S,hd,False,True,False,False,96105,788,0
PyHICSK4Z24,NZ,2026-01-26T03:00:57.803202+00:00,2026-01-24T17:58:55Z,Everything New in Terraria 1.4.5,Everything New in Terraria 1.4.5,ChippyGaming,UCdImtrRS4UewEbPdnF8R4qw,20,Gaming,,0,https://i.ytimg.com/vi/PyHICSK4Z24/hqdefault.jpg,en,en-GB,False,687,PT11M27S,hd,False,True,False,False,778566,41340,2215
o_rtfAazE5s,NZ,2026-01-26T03:00:57.803210+00:00,2026-01-09T05:38:42Z,BHAGAN WALIYE (Official Video) | Ranjit Bawa | Pari Pandher | Black Virus | Guri Sangali |Sudh singh,BHAGAN WALIYE (Official Video) | Ranjit Bawa | Pari Pandher | Black Virus | Guri Sangali |Sudh singh,Ranjit Bawa Music,UCr7A63cwz2vy7cwIXs_4VFA,10,Music,"ranjit bawa, ranjit bawa songs, ranjit bawa all songs, new song ranjit bawa, ranjit bawa new songs, ranjit bawa live show, latest song ranjit bawa, ranjit bawa video song, ranjit, bawa, ranjit bawa hits",11,https://i.ytimg.com/vi/o_rtfAazE5s/hqdefault.jpg,en,pa,False,282,PT4M42S,hd,False,True,False,False,2416167,43843,1919
2M4hKmuBzUU,NZ,2026-01-26T03:00:57.803217+00:00,2026-01-21T08:27:38Z,O'Romeo Official Trailer | Sajid N | Vishal B | Shahid K | Triptii D | Nana P | Avinash T | 13th Feb,O'Romeo Official Trailer | Sajid N | Vishal B | Shahid K | Triptii D | Nana P | Avinash T | 13th Feb,NadiadwalaGrandson,UC7bd9i-yWpUOhvC72fATxrQ,24,Entertainment,,0,https://i.ytimg.com/vi/2M4hKmuBzUU/hqdefault.jpg,en,hi,False,189,PT3M9S,hd,True,False,False,False,17087826,216798,9326
-_DaUyAB_DE,NZ,2026-01-26T03:00:57.803224+00:00,2026-01-26T00:30:11Z,Minecraft Speedrunner VS 5 Hunters REVIVAL,Minecraft Speedrunner VS 5 Hunters REVIVAL,Dream,UCTkXRDQl0luXxVQrRQvWS6w,20,Gaming,"minecraft, dream, dream minecraft",3,https://i.ytimg.com/vi/-_DaUyAB_DE/hqdefault.jpg,en,en,False,3160,PT52M40S,hd,False,True,False,False,448654,53246,6548
8JGa20KI51s,NZ,2026-01-26T03:00:57.803231+00:00,2026-01-15T03:59:53Z,Saanvle (Official Video) Diljit Dosanjh Ft Raj Ranjodh Mic & Me,Saanvle (Official Video) Diljit Dosanjh Ft Raj Ranjodh Mic & Me,Mic and me ,UCXbti47ob9lSNan3iIuJUfA,10,Music,"diljit dosanjh, Diljit Dosanjh new song, Diljit Dosanjh latest song, Diljit Dosanjh Punjabi song, Diljit Dosanjh video, Diljit Dosanjh music, Diljit Dosanjh hits, Saanvle Diljit Dosanjh, Saanvle, Saanvle Punjabi song, Punjabi song, New Punjabi song, saanwale, savale, sawle, saanvale diljit, saanvle diljit dosanjh, mic me, mic and me, mic and me diljit, mic and me raj, diljit raj ranjodh, diljit new song, diljit dosanjh raj ranjodhg",24,https://i.ytimg.com/vi/8JGa20KI51s/hqdefault.jpg,en,hi,False,217,PT3M37S,hd,False,False,False,False,2930031,0,3712
