video_id,country,fetched_at,published_at,title,localized_title,channel_title,channel_id,category_id,category_name,tags,tag_count,thumbnail,default_language,audio_language,is_live,duration,duration_raw,definition,caption_available,licensed_content,embeddable,made_for_kids,views,likes,comments
HsRMPUJrtXA,NZ,2026-01-06T02:32:03.212444+00:00,2026-01-03T19:03:00Z,THE GREAT ESCAPE - Gielinor Games 5 (#6),THE GREAT ESCAPE - Gielinor Games 5 (#6),SoupRS,UCnJutVTtn3ZXyapoGUmuRTA,20,Gaming,"Oldschool Runescape, old school runescape, OSRS, runescape, gielinor games, gielinor games season 2, b0aty, settled, framed, torvesta, c engineer, kempq, skill specs, solomission, 9rain, gunschilli, j1mmy, poisonedpotion, ditterbitter, verf, evscape, flutten, tanzoo, virtoso, skiddler, survivor, osrs survivor, osrs game show, osrs challenges, osrs money making, gold rush, osrs MILLIOns, osrs billions, osrs gp, westham, dino, faux, mr mammal, mmorpgrs, roidie, zoepancakes, zecookies",42,https://i.ytimg.com/vi/HsRMPUJrtXA/hqdefault.jpg,en,en,False,3917,PT1H5M17S,hd,False,True,False,False,304709,16824,1975
mQ-NA_sQ5f8,NZ,2026-01-06T02:32:03.212452+00:00,2025-12-06T02:30:03Z,Nijjar - God Did (Official Music Video) Latest Punjabi Songs 2025,Nijjar - God Did (Official Music Video) Latest Punjabi Songs 2025,NIJJAR,UCbSXM2lLwEtQavLgX7IPbbw,10,Music,"God Did, Nijjar, Deep Jandu, God Did song, God Did official video, Nijjar new song, Deep Jandu new song, Nijjar God Did, Punjabi song 2025, New Punjabi song 2025, Latest Punjabi song, Punjabi music, Trending Punjabi songs, Nijjar music 2025, Deep Jandu 2025, God Did official video Punjabi, punjabi song, God Did new punjabi song, nijjar, nav dhiman video, baba kri jawe mehar kmm hoi jande ne, baba kri jawe mehar nijjar, mehar song nijjar, latest punjabi song this week 2025",24,https://i.ytimg.com/vi/mQ-NA_sQ5f8/hqdefault.jpg,en-IN,pa,False,185,PT3M5S,hd,False,True,False,False,13792076,296265,6920
oaA6rIbogIg,NZ,2026-01-06T02:32:03.212459+00:00,2026-01-05T01:15:10Z,Vanoss Gaming's Best of 2025!,Vanoss Gaming's Best of 2025!,VanossGaming,UCKqH_9mk1waLgBiL2vT5b9g,20,Gaming,"Funny Moments, Montage video games, gaming, Vanoss, VanossGaming, Gameplay, Secret, Puncake, Parody, Comedy, Remix, Epic, Trolling, Xbox One, MultiplayerPS4, Funtage",16,https://i.ytimg.com/vi/oaA6rIbogIg/hqdefault.jpg,en,en,False,3178,PT52M58S,hd,False,True,False,False,414748,25510,751
1f_cpXJtlQk,NZ,2026-01-06T02:32:03.212467+00:00,2025-12-25T20:18:31Z,SAG HARBOR,SAG HARBOR,"Tyler, The Creator",UCsQBsZJltmLzlsJNG7HevBg,2,Autos & Vehicles,,0,https://i.ytimg.com/vi/1f_cpXJtlQk/hqdefault.jpg,en,en-US,False,221,PT3M41S,hd,False,False,False,False,2473488,231809,10269
4QZ88CvznLI,NZ,2026-01-06T02:32:03.212474+00:00,2026-01-02T22:47:02Z,Gamers Caught Cheating *JYNXZI REACTS*,Gamers Caught Cheating *JYNXZI REACTS*,Jynxzi Live,UCyNzZ1wgkOWkzYE0zbs7zhA,20,Gaming,"jynxzi, Gamers Caught Cheating *JYNXZI REACTS*, gaming cheating, cheaters, cheaters caught, jynxzi cheaters caught streaming",6,https://i.ytimg.com/vi/4QZ88CvznLI/hqdefault.jpg,en,en,False,2349,PT39M9S,hd,False,True,False,False,701932,17107,1038
BVgNoVwsb6Y,NZ,2026-01-06T02:32:03.212481+00:00,2025-12-23T05:30:04Z,"Vellarathaaram | Sarvam Maya | Nivin Pauly, Aju Varghese | Justin, Vineeth Sreenivasan | Akhil","Vellarathaaram | Sarvam Maya | Nivin Pauly, Aju Varghese | Justin, Vineeth Sreenivasan | Akhil",FireFly Films & Arts,UChzbnUthlnY4KyZMreYOMgw,22,People & Blogs,,0,https://i.ytimg.com/vi/BVgNoVwsb6Y/hqdefault.jpg,en,ml,False,198,PT3M18S,hd,False,False,False,False,2362320,31094,1635
