video_id,country,fetched_at,published_at,title,localized_title,channel_title,channel_id,category_id,category_name,tags,tag_count,thumbnail,default_language,audio_language,is_live,duration,duration_raw,definition,caption_available,licensed_content,embeddable,made_for_kids,views,likes,comments
lOHVMmZ6n3o,NZ,2026-01-06T02:32:03.212047+00:00,2026-01-02T14:00:06Z,"BORDER 2: Ghar Kab Aaoge | Sunny Deol | Anu,Mithoon, Sonu, Roop, Arijit, Vishal, Diljit, Javed,Manoj","BORDER 2: Ghar Kab Aaoge | Sunny Deol | Anu,Mithoon, Sonu, Roop, Arijit, Vishal, Diljit, Javed,Manoj",T-Series,UCq-Fj5jknLsUf-MWSy4_brA,10,Music,"tseries, tseries songs, ghar kab aaoge border 2, sandese aate hai song, ghar kab aaoge border 2 song, border 2 song, ghar kab aaoge arijit singh, ghar kab aaoge full song, sandeshe aate hain song, border 2 sunny deol song, ghar kab aaoge sonu nigam, sandese aate hain full song, border 2 movie song, ghar kab aaoge song full, vishal mishra ghar kab aaoge, arijit singh ghar kab aaoge, border 2 songs, Sandeshe aate hai, Sandese aate h old song, Deshbhakti song, sandeshe aate hain",21,https://i.ytimg.com/vi/lOHVMmZ6n3o/hqdefault.jpg,en,hi,False,191,PT3M11S,hd,False,True,False,False,26118774,966092,45340
fJaAYcERf3Y,NZ,2026-01-06T02:32:03.212089+00:00,2026-01-03T13:15:05Z,Jana Nayagan - Official Trailer | Thalapathy Vijay | Pooja Hegde | H Vinoth | Anirudh | KVN,Jana Nayagan - Official Trailer | Thalapathy Vijay | Pooja Hegde | H Vinoth | Anirudh | KVN,KVN PRODUCTIONS,UC3DOgauBYLQQXdH1siGjfpw,1,Film & Animation,"KVN Production, KVN, Jana Nayagan, VIjay, thalapathy vijay, vijay birthday video, Jananayagan, Vijay movie, Vijay new movie, Jana Nayagan teaser, Jana Nayagan trailer, Jana Nayagan Update, Jana Nayagan Trailer, I am Coming, I am waiting, Jana Nayagan Official Trailer, Thalapathy Kacheri, Thalapathy Movie Trailer, Jana Nayagan Movie Trailer, Trending Trailer, Vijay last movie, Vijay Last movie trailer, One last dance, Pooja Hedge, Anirudh, Bobby Deol, Mamitha Baiju, TVK",28,https://i.ytimg.com/vi/fJaAYcERf3Y/hqdefault.jpg,en,ta,False,172,PT2M52S,hd,True,True,False,False,28568704,1291502,89020
YF10fXjsLkY,NZ,2026-01-06T02:32:03.212102+00:00,2026-01-04T18:25:24Z,Rust - A Duo's Journey: The Rise,Rust - A Duo's Journey: The Rise,Willjum,UCzOfLNkiScJp3U_h_QlvHHg,20,Gaming,"Willjum, Rust, Rust Solo Survival, Rust Movie, Twitch highlights, Rust Chilled, Willyum, Rust Solo Story, Solo, Rust Solo Base, Spoonkid, blooprint, rust raids, rust huge loot, rust jackpot, rust treasures, rust solo infiltration, rust best start ever, rust plays, rust 10000 hours, Rust Gameplay, Rust Funny Moments, Gaming funny moments, #youtubegaming, #gaming, tiktok, rust survival, survival games, rust admin, #explorepage, #youtube, #youtubevideo, Rust movie, Blooprint, Frost, hackers",36,https://i.ytimg.com/vi/YF10fXjsLkY/hqdefault.jpg,en-GB,en-US,False,5686,PT1H34M46S,hd,False,True,False,False,450862,21505,1406
_Z48Day4EGE,NZ,2026-01-06T02:32:03.212113+00:00,2025-12-25T05:28:32Z,Michael Mamaia - AUA LE FE'EI (Official Music Video) ft Tupu Se'evae Tosotoso,Michael Mamaia - AUA LE FE'EI (Official Music Video) ft Tupu Se'evae Tosotoso,Michael Mamaia,UCuRwPtnzCfUjbVy8ZjMAfgQ,10,Music,,0,https://i.ytimg.com/vi/_Z48Day4EGE/hqdefault.jpg,en,en,False,292,PT4M52S,hd,False,True,False,False,236433,2916,138
AfQ13jsLDms,NZ,2026-01-06T02:32:03.212123+00:00,2025-12-30T14:00:05Z,Stranger Things 5 | Finale Trailer | Netflix,Stranger Things 5 | Finale Trailer | Netflix,Netflix,UCWOA1ZGywLbqmigxE4Qlvuw,24,Entertainment,"Caleb McLaughlin, Charlie Heaton, Chief Hopper, David Harbour, Dustin, Eleven, Finn Wolfhard, Gaten Matarazzo, Jamie Campbell Bower, Joe Keery, Jonathan Byers, Joyce Byers, Lucas, Max, Maya Hawke, Mike Wheeler, Millie Bobby Brown, Nancy Wheeler, Natalia Dyer, Netflix, Noah Schnapp, Robin Buckley, Sadie Sink, Steve Harrington, Stranger Things 5, Will Byers, Winona Ryder",27,https://i.ytimg.com/vi/AfQ13jsLDms/hqdefault.jpg,en,en-US,False,97,PT1M37S,hd,True,True,False,False,13944939,311363,24885
zPbrkmdcTfo,NZ,2026-01-06T02:32:03.212132+00:00,2025-12-27T17:00:04Z,1000 Players Simulate Civilization: Boys vs Girls,1000 Players Simulate Civilization: Boys vs Girls,MrBeast Gaming,UCIPPMRA040LQr5QPyJEbmXA,20,Gaming,,0,https://i.ytimg.com/vi/zPbrkmdcTfo/hqdefault.jpg,en,en,False,3156,PT52M36S,hd,True,True,False,False,22608948,641144,39589
lCp0BmcFPQ8,NZ,2026-01-06T02:32:03.212141+00:00,2026-01-05T20:00:06Z,A$AP Rocky - Punk Rocky (Official Video),A$AP Rocky - Punk Rocky (Official Video),ASAPROCKYUPTOWN,UC0KAFLxIiaR_FFNYDL3utGw,10,Music,"highjack, asap rocky fashion week, awge ss25 debut collection, american sabotage, i smoked away my brain, im god x demons mashup, riot, rowdy pipe’n, d.m.b, asap rocky rihanna, long live asap, peso, asap mob, cozy tapes, new asap rocky, sundress, asap rocky tiktok trend, testing, praise the lord, da shine, tyler the creator, pretty flacko, fashion killa, asap yams, tailor swif, rihanna, imogen heap, winona ryder, asap nast, thundercat, tommy revenge, dont be dumb",32,https://i.ytimg.com/vi/lCp0BmcFPQ8/hqdefault.jpg,en,en,False,297,PT4M57S,hd,False,True,False,False,524571,84448,5507
Mzw2ttJD2qQ,NZ,2026-01-06T02:32:03.212151+00:00,2025-12-22T14:00:04Z,The Odyssey | Official Trailer,The Odyssey | Official Trailer,Universal Pictures,UCq0OueAsdxH6b8nyAspwViw,24,Entertainment,,0,https://i.ytimg.com/vi/Mzw2ttJD2qQ/hqdefault.jpg,en-US,en-US,False,114,PT1M54S,hd,True,True,False,False,30010664,523499,26700
x3wGB7HK7Vs,NZ,2026-01-06T02:32:03.212159+00:00,2026-01-04T21:26:51Z,Minecraft Horror Films Are Actually Scary...,Minecraft Horror Films Are Actually Scary...,Joe Bart Games,UCeBPTBz1oRnsWsUBnKNNKNw,20,Gaming,joebartolozzi,1,https://i.ytimg.com/vi/x3wGB7HK7Vs/hqdefault.jpg,en,en-US,False,3230,PT53M50S,hd,False,True,False,False,767502,34375,1998
2PEbA4sx-bU,NZ,2026-01-06T02:32:03.212166+00:00,2025-12-23T11:45:00Z,Top Christmas Songs of All Time Playlist 🎄 Best Christmas Music 2026 🎅 Christmas Songs Playlist,Top Christmas Songs of All Time Playlist 🎄 Best Christmas Music 2026 🎅 Christmas Songs Playlist,Christmas Songs and Carols - Love to Sing,UCn0JHLJWiO3_Y5xfNPcF_Ug,10,Music,"top christmas song, christmas songs, top christmas songs of all time, top 100 christmas songs of all time, best christmas songs of all time, best christmas songs, top christmas songs, top 100 christmas songs, classic christmas songs, christmas songs playlist, best christmas music, christmas songs medley, top 100 christmas songs and carols, top 100 christmas songs and carols playlist",14,https://i.ytimg.com/vi/2PEbA4sx-bU/hqdefault.jpg,en,en,False,9362,PT2H36M2S,hd,False,True,False,False,4063732,10042,1101
wHuWmjXsReU,NZ,2026-01-06T02:32:03.212174+00:00,2026-01-01T17:00:08Z,Marvel Television’s Wonder Man | Official Trailer,Marvel Television’s Wonder Man | Official Trailer,Marvel Entertainment,UCvC4D8onUfXzvjTOM-dBfEA,24,Entertainment,"marvel, comics",2,https://i.ytimg.com/vi/wHuWmjXsReU/hqdefault.jpg,en,en,False,130,PT2M10S,hd,True,True,False,False,7631114,145729,6154
ym7LF3o__cs,NZ,2026-01-06T02:32:03.212182+00:00,2026-01-02T17:01:51Z,Hermitcraft 11: Episode 7 - BIG BASE PROGRESS!,Hermitcraft 11: Episode 7 - BIG BASE PROGRESS!,Grian,UCR9Gcq0CMm6YgTzsDxAxjOQ,20,Gaming,"Minecraft, Grian, building, grian, mincraft, tutorial, yt:quality=high, minecraft, ideas, creative, build",11,https://i.ytimg.com/vi/ym7LF3o__cs/hqdefault.jpg,en,en-GB,False,1915,PT31M55S,hd,True,True,False,False,1458023,92996,4398
5PJ5nfmmggk,NZ,2026-01-06T02:32:03.212190+00:00,2025-12-05T17:47:42Z,E le'i faia so'u aiga,E le'i faia so'u aiga,Damaiti Music - Topic,UCuz0pSGjEHej9AOMqfB_nhQ,10,Music,"Damaiti Music, Damaiti Lepa Music, E le'i faia so'u aiga",3,https://i.ytimg.com/vi/5PJ5nfmmggk/hqdefault.jpg,oc,en,False,246,PT4M6S,hd,False,True,False,False,159803,1422,29
HZjKLQ5ZUOs,NZ,2026-01-06T02:32:03.212197+00:00,2025-12-29T17:14:07Z,Malcolm in the Middle: Life's Still Unfair - Official Teaser Trailer (2026) Bryan Cranston,Malcolm in the Middle: Life's Still Unfair - Official Teaser Trailer (2026) Bryan Cranston,IGN,UCKy1dAqELo0zrOtPkf0eTMw,24,Entertainment,"malcolm in the middle: life's still unfair, malcolm in the middle, frankie muniz, bryan cranston, malcolm in the middle: life's still unfair trailer, malcolm in the middle life’s still unfair trailer, malcolm in the middle life's still unfair trailer, malcolm in the middle: life's still unfair official trailer, malcolm in the middle reboot",9,https://i.ytimg.com/vi/HZjKLQ5ZUOs/hqdefault.jpg,en,en,False,31,PT31S,hd,False,True,False,False,1791603,33858,3028
ErnWUbjOKoU,NZ,2026-01-06T02:32:03.212205+00:00,2025-12-23T19:20:00Z,SIDEMEN AMONG US CHRISTMAS SPECIAL: SANTA ROLE,SIDEMEN AMONG US CHRISTMAS SPECIAL: SANTA ROLE,MoreSidemen,UCh5mLn90vUaB1PbRRx_AiaA,22,People & Blogs,"sidemen, moresidemen, miniminter, ksi, zerkaa, behzinga, tbjzl, vikkstar, wroetoshaw",9,https://i.ytimg.com/vi/ErnWUbjOKoU/hqdefault.jpg,en,en-GB,False,3193,PT53M13S,hd,False,True,False,False,4404885,141278,4436
5q9EjSUovc4,NZ,2026-01-06T02:32:03.212213+00:00,2026-01-02T05:00:07Z,“Internet Girl” Visualizer | KATSEYE,“Internet Girl” Visualizer | KATSEYE,KATSEYE,UCA61H4fWOMHikLcUFKyQUog,10,Music,,0,https://i.ytimg.com/vi/5q9EjSUovc4/hqdefault.jpg,en,en,False,166,PT2M46S,hd,False,False,False,False,4039896,282537,39723
63VTRloLLH4,NZ,2026-01-06T02:32:03.212221+00:00,2025-12-29T14:59:48Z,Malcolm in the Middle: Life's Still Unfair | Official Teaser | Hulu,Malcolm in the Middle: Life's Still Unfair | Official Teaser | Hulu,Hulu,UCE5mQnNl8Q4H2qcv4ikaXeA,24,Entertainment,"hulu, disney, hulu movies, hulu shows, hulu tv, hulu tv shows, disney streaming, disney hulu, tv on hulu, movies on hulu, shows on hulu, hulu youtube, Malcolm in the Middle, Frankie Muniz, Bryan Cranston, Jane Kaczmarek, Hal and Lois, Hulu, Hulu on Disney Plus, sitcom revival, TV special event, four part event, anniversary party, family comedy, classic sitcom, Malcolm reunion, Life's Still Unfair, Disney Plus Hulu, streaming April 10, comedy series, television reunion",31,https://i.ytimg.com/vi/63VTRloLLH4/hqdefault.jpg,en,en,False,41,PT41S,hd,False,True,False,False,1846912,51536,3523
s0UdN6baK2c,NZ,2026-01-06T02:32:03.212229+00:00,2025-12-28T14:01:32Z,Unstable SMP: The Battle for The Great Sea,Unstable SMP: The Battle for The Great Sea,Wemmbu,UCkzzNLnuM-VsATWC53ehwOQ,20,Gaming,,0,https://i.ytimg.com/vi/s0UdN6baK2c/hqdefault.jpg,en-US,en-US,False,4149,PT1H9M9S,hd,False,True,False,False,4498293,195720,23054
ENoi24taV2E,NZ,2026-01-06T02:32:03.212237+00:00,2025-12-24T06:04:25Z,Merry Christmas 2026🎄🎅The 50 Most Beautiful Christmas Songs ❄️ Top Christmas Music,Merry Christmas 2026🎄🎅The 50 Most Beautiful Christmas Songs ❄️ Top Christmas Music,Jingle Bell Tunes,UC2edV1sW2gCOk-K1vlsKkvQ,10,Music,"christmas songs, christmas music, merry christmas, best christmas songs of all time, top christmas songs of all time, top 100 christmas songs, top 100 christmas songs of all time, christmas songs playlist, best christmas songs, christmas playlist, classic christmas songs, christmas songs medley, top christmas songs, noel songs, xmas songs, love to sing, top christmas songs playlist",17,https://i.ytimg.com/vi/ENoi24taV2E/hqdefault.jpg,en,en,False,5233,PT1H27M13S,hd,False,True,False,False,3053345,8206,473
YqdAEdkHrwo,NZ,2026-01-06T02:32:03.212245+00:00,2025-12-11T16:59:07Z,Supergirl | Official Teaser Trailer,Supergirl | Official Teaser Trailer,DC,UCiifkYAs_bq1pt_zbNAzYGg,24,Entertainment,"DC, DC Comics, DC Universe, DCU, Superman, James Gunn, super heroes, movie, Supergirl, superman 2025, dcu timeline, superman scene, superman krypto, krypto the superdog, lex luthor, krypto, superman 2025 scene, supergirl woman of tomorrow, supergirl scene superman 2025, supergirl cameo superman, supergirl in superman 2025, milly alcock, supergirl, supergirl movie, supergirl 2026, supergirl trailer, supergirl trailer reaction, supergirl trailer breakdown, supergirl milly alcock",29,https://i.ytimg.com/vi/YqdAEdkHrwo/hqdefault.jpg,en,en,False,123,PT2M3S,hd,False,True,False,False,16677193,386421,21752
h4lTgIHnoX0,NZ,2026-01-06T02:32:03.212253+00:00,2026-01-04T17:26:04Z,REAL MADRID 5 - 1 REAL BETIS | RESUMEN LALIGA EA SPORTS,REAL MADRID 5 - 1 REAL BETIS | RESUMEN LALIGA EA SPORTS,LALIGA EA SPORTS,UCTv-XvfzLX3i4IGWAm4sbmA,17,Sports,"Real Madrid, Real Betis, Betis, Madrid, Real Madrid Real Betis, Real Madrid vs Real Betis, LaLiga, jornada 18 laliga ea sports, laliga ea sports, highlights Real Madrid Betis, resumen Real Madrid Betis, goles Real Madrid, goles Betis, Gonzalo, hat trick Gonzalo, Raúl Asencio, Cucho Hernández, Fran García, Santiago Bernabéu, goleada Real Madrid, mejores momentos fútbol, partido LaLiga, liga española, highlights fútbol, resumen fútbol, Hattrick Gonzalo, Goles Gonzalo, Rodrygo",28,https://i.ytimg.com/vi/h4lTgIHnoX0/hqdefault.jpg,es,es,False,195,PT3M15S,hd,False,True,False,False,2984285,65647,1890
fbTODovGRKU,NZ,2026-01-06T02:32:03.212261+00:00,2025-12-17T09:01:07Z,"Boney M. - Mary's Boy Child / Oh My Lord (Christmas Snowtime Special, 22.12.1979)","Boney M. - Mary's Boy Child / Oh My Lord (Christmas Snowtime Special, 22.12.1979)",BoneyMVEVO,UCHFPpw9jReIhssGTUNUZBoA,10,Music,"Boney M., Mary's Boy Child, Oh My Lord, Christmas Snowtime Special, 1979, BBC, Dance, Christmas, Disco",9,https://i.ytimg.com/vi/fbTODovGRKU/hqdefault.jpg,en,en,False,346,PT5M46S,hd,False,True,False,False,2089734,20841,1068
NYh6pxxAJ94,NZ,2026-01-06T02:32:03.212269+00:00,2025-12-28T20:55:39Z,Avengers Doomsday Teaser Trailer: X-Men Breakdown,Avengers Doomsday Teaser Trailer: X-Men Breakdown,Emergency Awesome,UCDiFRMQWpcp8_KD4vwIVicw,24,Entertainment,,0,https://i.ytimg.com/vi/NYh6pxxAJ94/hqdefault.jpg,en,en,False,1037,PT17M17S,hd,True,True,False,False,945451,15994,1450
ru_KvT0x1xU,NZ,2026-01-06T02:32:03.212277+00:00,2026-01-03T17:05:38Z,I Became Minecraft's Spear Master,I Became Minecraft's Spear Master,ManePear,UCu-bJoeEhX72x1R3ADEV-eg,20,Gaming,"manepear, lifesteal, lifesteal smp",3,https://i.ytimg.com/vi/ru_KvT0x1xU/hqdefault.jpg,en,en-US,False,2237,PT37M17S,hd,False,True,False,False,1354456,49213,4131
aVlUG--9_mo,NZ,2026-01-06T02:32:03.212284+00:00,2025-12-18T08:45:06Z,Te Wehi & Hori Shaw - Catch A Wave (Official Music Video),Te Wehi & Hori Shaw - Catch A Wave (Official Music Video),Te Wehi,UCV3bT6UGisPPdiLbgxPcbRw,10,Music,"TeWehi, te wehi songs, unaware, maori, nz songs, nz music, island music, te wehi, masterly man, maori music, kiwi music, island reggae, catch a wave, catch a wave te wehi, catch a wave hori shaw, catch a wave te wehi and hori shaw, te wehi catch a wave, hori shaw catch a wave, reggae, reggae song, reggae music, hori shaw, new te wehi and hori shaw song, new te wehi song, new hori shaw song, new music te wehi",26,https://i.ytimg.com/vi/aVlUG--9_mo/hqdefault.jpg,en,en,False,174,PT2M54S,hd,False,True,False,False,58368,1534,96
k5sze6PK3JI,NZ,2026-01-06T02:32:03.212297+00:00,2025-12-29T22:54:16Z,AVENGERS DOOMSDAY X-MEN TRAILER BREAKDOWN (X-Men Teaser Description),AVENGERS DOOMSDAY X-MEN TRAILER BREAKDOWN (X-Men Teaser Description),New Rockstars,UC7yRILFFJ2QZCykymr8LPwA,24,Entertainment,"new rockstars, new rockstars youtube, youtube new rockstars, avengers doomsday, avengers doomsday teaser, avengers doomsday trailer, avengers doomsday trailer breakdown, avengers doomsday teaser breakdown, x-men, doomsday x-men, avengers x-men, x-men teaser, doctor doom, endgame, avengers, cyclops, scott summers, magneto, charles xavier, x-mansion",20,https://i.ytimg.com/vi/k5sze6PK3JI/hqdefault.jpg,en,en,False,728,PT12M8S,hd,False,True,False,False,881416,20336,1106
hLnPciB8cGs,NZ,2026-01-06T02:32:03.212305+00:00,2026-01-04T08:00:02Z,Playing Decade-Old Games at Photorealistic Quality,Playing Decade-Old Games at Photorealistic Quality,Linus Tech Tips,UCXuqSBlHAE6Xw-yeJA0Tunw,28,Science & Technology,"4K Gaming, LTT, Gaming, 4K, Ultrawide, Modding, Mods, Game Mods, Game Modding, Cyberpunk, Skyrim, GTA V, GTA VI, Crysis, ASUS, ROG",16,https://i.ytimg.com/vi/hLnPciB8cGs/hqdefault.jpg,en,en,False,1781,PT29M41S,hd,False,True,False,False,1468048,48617,3681
YyepU5ztLf4,NZ,2026-01-06T02:32:03.212313+00:00,2025-12-09T09:33:03Z,"Shararat | Dhurandhar | Ranveer, Aditya Dhar, Shashwat, Jasmine, Madhubanti, Ayesha, Krystle","Shararat | Dhurandhar | Ranveer, Aditya Dhar, Shashwat, Jasmine, Madhubanti, Ayesha, Krystle",Saregama Music,UC_A7K2dXFsTMAciGmnNxy-Q,10,Music,"dhurandhar song, dhurandhar song balochi, dhurandhar song balochi dance, dhurandhar songs all, tenu shararat sikhwa, Shararat, Shararat Dhurandhar, dhurandhar songs all video song, dhurandhar song shararat, dhurandhar song shararat video, dhurandhar song ayesha khan, dhurandhar song akshay khanna, Ranveer Singh, Madhubanti Bagchi, Jasmine Sandlas, Aaj ki raat, Shashwat Sachdev, shararat dhurandhar, shararat dhurandhar video song, Party songs, Dance songs, Sharaarat",22,https://i.ytimg.com/vi/YyepU5ztLf4/hqdefault.jpg,en,hi,False,229,PT3M49S,hd,False,True,False,False,102571554,615041,13525
E08GZ3pFlnk,NZ,2026-01-06T02:32:03.212321+00:00,2025-12-29T09:30:25Z,The RajaSaab Trailer 2.0 (Telugu) | Prabhas | Maruthi | Thaman S | TG Vishwa Prasad | Jan 9 2026,The RajaSaab Trailer 2.0 (Telugu) | Prabhas | Maruthi | Thaman S | TG Vishwa Prasad | Jan 9 2026,People Media Factory,UCrzx3ZPXEZpzEGLF1gIuORQ,24,Entertainment,"People Media Factory, Raja Saab, Raja Saab Trailer, Raja Saab Telugu Trailer, Raja Saab Trailer Telugu, The Raja Saab Trailer, Prabhas, Maruthi, MalavikaMohanan, NidhhiAgerwal, Nidhhi Agerwal, malavika mohan, rebal star prabhas, prabhas, rebelstar, rajasaabfirstsingle, rebelsaab, rajasaabfirstsong, Thaman S, thaman, TG Vishwa Prasad, vishwaprasad, sahana sahana, sahanasong, sahanasahanasong, sahana sahana song, love song, romantic song, tfi, telugusongs",30,https://i.ytimg.com/vi/E08GZ3pFlnk/hqdefault.jpg,en,te,False,192,PT3M12S,hd,True,True,False,False,17574056,413914,11473
J41oDT8XD5E,NZ,2026-01-06T02:32:03.212329+00:00,2025-12-31T16:00:27Z,Hermitcraft 11: Episode 7 - ALL the Farms,Hermitcraft 11: Episode 7 - ALL the Farms,Mumbo Jumbo,UChFur_NwVSbUozOcF_F2kMg,20,Gaming,"ideas, creative, build, survival, tutorial, How to, MumboJumbo, ThatMumboJumbo, Minecraft, Building, Mumbo, Redstone, Technical, Piston, 1.9, 1.8, 1.10, 1.11, Gaming, Game, spotlight, showcase, challenge, command, mini-game, gameplay, playthrough, Let's Play, No Swearing, Family Friendly, mc, mcpe, vanilla, Xbox, 360, PS4, PE, pocket edition, mobile",39,https://i.ytimg.com/vi/J41oDT8XD5E/hqdefault.jpg,en,en,False,2086,PT34M46S,hd,False,True,False,False,1522354,80828,2995
ta4KAXDxsx0,NZ,2026-01-06T02:32:03.212338+00:00,2025-12-18T10:07:11Z,Wham! - Last Christmas (Japanese Lyrics),Wham! - Last Christmas (Japanese Lyrics),WhamVEVO,UCm1QnxCbcLB8fQwoTDk39iQ,10,Music,"Empowered, Festive, Happy, Last Christmas, Nostalgic, Pop, Single, Throwback, Wham!",9,https://i.ytimg.com/vi/ta4KAXDxsx0/hqdefault.jpg,ja,en,False,279,PT4M39S,hd,False,True,False,False,2555061,8245,335
9VPSFxU-Jq8,NZ,2026-01-06T02:32:03.212346+00:00,2025-12-21T14:53:33Z,Speed does Africa 🌍 (Official Trailer),Speed does Africa 🌍 (Official Trailer),IShowSpeed,UCWsDFcIhY2DBi3GB5uykGXA,20,Gaming,ishowspeed,1,https://i.ytimg.com/vi/9VPSFxU-Jq8/hqdefault.jpg,en,en,False,77,PT1M17S,hd,False,True,False,False,2039475,115170,17418
z1Rjp7eIXGc,NZ,2026-01-06T02:32:03.212353+00:00,2026-01-01T14:31:00Z,Regenerating Lifesteal's Final End Portal,Regenerating Lifesteal's Final End Portal,rekrap2,UCvt0HYxX34vUvqu66HLXeUw,20,Gaming,Minecraft,1,https://i.ytimg.com/vi/z1Rjp7eIXGc/hqdefault.jpg,en,en,False,2216,PT36M56S,hd,False,True,False,False,1562097,72992,3320
iNfEf6a1zuo,NZ,2026-01-06T02:32:03.212361+00:00,2025-12-17T11:27:21Z,Fairytale of New York (Feat. Kirsty MacColl) (HD Visualiser),Fairytale of New York (Feat. Kirsty MacColl) (HD Visualiser),ThePoguesOfficial,UCvfcW8XVa2Kj802P4l302Yw,10,Music,"The Pogues, Fairytale of New York, Irish Folk, kirsty maccoll, Irish Rover, Whiskey in the jar, Irish Music, Music Video, 30:30, Ceili, Trad Music, Folk Songs, Punk, Christmas Song",14,https://i.ytimg.com/vi/iNfEf6a1zuo/hqdefault.jpg,en,en,False,274,PT4M34S,hd,False,True,False,False,636196,5329,383
Fv0leN8TmR8,NZ,2026-01-06T02:32:03.212369+00:00,2025-12-07T00:00:04Z,The Boys - Final Season Teaser Trailer | Prime Video,The Boys - Final Season Teaser Trailer | Prime Video,Prime Video,UCQJWtTnAHhEG5w4uN0udnUQ,24,Entertainment,"the boys, the boys season 5, the boys s5, the boys season 5 trailer, the boys season 5 teaser, the boys s5 trailer, the boys s5 teaser, the boys soldier boy, the boys homelander, the boys butcher, homelander, butcher, soldier boy, starlight, hughie, homelander vs butcher, butcher vs homelander, homelander vs soldier boy, the boys final season, the boys final season trailer, antony starr, karl urban, jensen ackles, erin moriarty, jack quaid, chace crawford, jared padalecki",27,https://i.ytimg.com/vi/Fv0leN8TmR8/hqdefault.jpg,en,en,False,121,PT2M1S,hd,True,True,False,False,9399826,347546,18288
M3YBZSkdN20,NZ,2026-01-06T02:32:03.212377+00:00,2026-01-05T18:59:47Z,I Beat Minecraft From ONLY BEDROCK,I Beat Minecraft From ONLY BEDROCK,Beppo,UC9OABighzB6Qr5OAOm5RLdA,20,Gaming,"minceraft, hardcor, hradcore, minecarft",4,https://i.ytimg.com/vi/M3YBZSkdN20/hqdefault.jpg,en,en,False,1330,PT22M10S,hd,False,True,False,False,249149,14122,1171
w1GEwBkAqlo,NZ,2026-01-06T02:32:03.212384+00:00,2025-12-29T12:00:15Z,Best Happy New Year Songs 2026 🎉 Best Happy New Year Music 🎉 Beautiful New Year's Eve Ambience,Best Happy New Year Songs 2026 🎉 Best Happy New Year Music 🎉 Beautiful New Year's Eve Ambience,Heavenly Christmas,UCZgFClzcBfd9sRZ-Fl3-Exg,10,Music,"Best Happy New Year Songs 2026, Best Happy New Year Music, Beautiful New Year's Eve, New Year Music, New Year Songs, New Year Playlist, New Years Eve Music",7,https://i.ytimg.com/vi/w1GEwBkAqlo/hqdefault.jpg,en,en,False,5922,PT1H38M42S,hd,False,True,False,False,863672,5712,184
MQqOEpzePqg,NZ,2026-01-06T02:32:03.212392+00:00,2025-12-10T14:48:52Z,BHA BHA BA TRAILER | Dilieep | Mohanlal | Gokulam Gopalan | Vineeth | Dhyan | Dhananjay Shankar,BHA BHA BA TRAILER | Dilieep | Mohanlal | Gokulam Gopalan | Vineeth | Dhyan | Dhananjay Shankar,Sree Gokulam Movies,UC7rP8B90HTEXxQ6ApRVDyVg,1,Film & Animation,"Gokulam Movies, Gokulam Gopalan, dileep, bha bha ba movie, vineeth sreenivasan, dhyan sreenivasan, mohanlal, sree gokulam movies, dileep movie, bhayam bakhthi bahumanam, Bha bha ba character poster, BHA BHA BA Teaser, Bha bha ba lalettan, dileep action, vineeth sreenivasan movie, Dhyan sreenivasan movie, dileep comedy, comedy malayalam movie, malayalam movies, Malayalam teaser, lalettan cameo, Dhananjay shankar, sandy master, lalettan, bha bha ba trailer",25,https://i.ytimg.com/vi/MQqOEpzePqg/hqdefault.jpg,en,ml,False,110,PT1M50S,hd,True,True,False,False,5321954,185983,18485
eUBEAPNorME,NZ,2026-01-06T02:32:03.212400+00:00,2026-01-01T21:18:45Z,never invite a trapper to a manhunt video,never invite a trapper to a manhunt video,JudeLow,UC2gufCjSyNihNbOEZE50bwQ,20,Gaming,,0,https://i.ytimg.com/vi/eUBEAPNorME/hqdefault.jpg,en,en,False,740,PT12M20S,hd,False,True,False,False,2499876,110656,3858
N4L7mrWZgv0,NZ,2026-01-06T02:32:03.212408+00:00,2025-12-11T22:14:04Z,Sosopo o'u lagona (AI Version) - Tamaiti Vaitele (Samoan AI songs),Sosopo o'u lagona (AI Version) - Tamaiti Vaitele (Samoan AI songs),Samoan Music (Samoan AI music),UC3CwwsVRCWCLIyrC19QLW_Q,10,Music,"Samoan Music, New Samoan Music, Samoa Music, New Samoa Music",4,https://i.ytimg.com/vi/N4L7mrWZgv0/hqdefault.jpg,en,sm,False,311,PT5M11S,hd,False,True,False,False,175456,691,11
XVEjtloKlpM,NZ,2026-01-06T02:32:03.212415+00:00,2025-12-16T12:08:47Z,I Am legend - Alternate ending - Warner Bros. UK & Ireland,I Am legend - Alternate ending - Warner Bros. UK & Ireland,Warner Bros. UK & Ireland,UCbxjDfYwfF8RjYBp5htJ38Q,1,Film & Animation,"Warner Bros, Warner Bros UK, trailers official, movie, WB Movies, New Movie Trailers, Upcoming Movies, Movies Coming Soon",8,https://i.ytimg.com/vi/XVEjtloKlpM/hqdefault.jpg,en,en,False,403,PT6M43S,hd,True,True,False,False,7486654,89050,5316
AnGdzz-XWcE,NZ,2026-01-06T02:32:03.212423+00:00,2026-01-05T15:00:31Z,Welcome to my world…,Welcome to my world…,VALORANT,UC8CX0LD98EDXl4UYX1MDCXg,20,Gaming,"VALORANT trailer, VALORANT, VALORANT Cinematic, VALORANT game, valorant act I, VALORANT act 1, fps, shooters, tactical FPS, launch, act 1, V26, 2026, Why We Fight, Why We Fight Back, Sage, Viper, Reyna, Brimstone, Raze, Chamber, Yoru, Sova, Alpha, Omega, V26 Conflict, Season 2026, S26",28,https://i.ytimg.com/vi/AnGdzz-XWcE/hqdefault.jpg,en,en-US,False,210,PT3M30S,hd,True,True,False,False,1485262,160216,6864
Faz9JxpdHp4,NZ,2026-01-06T02:32:03.212430+00:00,2025-12-15T12:30:06Z,P Pop Culture (MUSIC VIDEO) KARAN AUJLA | Ikky | Latest Punjabi Songs 2025,P Pop Culture (MUSIC VIDEO) KARAN AUJLA | Ikky | Latest Punjabi Songs 2025,Karan Aujla,UC3XBkDeCVXCoCofFgfUZXGw,10,Music,,0,https://i.ytimg.com/vi/Faz9JxpdHp4/hqdefault.jpg,en,pa,False,212,PT3M32S,hd,False,False,False,False,6377539,240281,12838
YEv0zokK140,NZ,2026-01-06T02:32:03.212437+00:00,2025-12-19T05:31:09Z,Happy Patel Khatarnak Jasoos | Official Trailer | Vir Das | Aamir Khan | 16th January 2026,Happy Patel Khatarnak Jasoos | Official Trailer | Vir Das | Aamir Khan | 16th January 2026,Aamir Khan Talkies,UCqjQu9qgL_eDXPwRnq45ZDQ,22,People & Blogs,"happy patel trailer, aamir khan, vir das, happy patel khatarnak jasoos, happy patel, imran khan, new movie aamir khan, mona singh, sharib hashmi, mithila palkar, srushti tawade, aamir khan new movie, vir das new movie, official trailer, happy patel official trailer",15,https://i.ytimg.com/vi/YEv0zokK140/hqdefault.jpg,en,en,False,159,PT2M39S,hd,True,True,False,False,19720879,69373,3429
