video_id,country,fetched_at,published_at,title,localized_title,channel_title,channel_id,category_id,category_name,tags,tag_count,thumbnail,default_language,audio_language,is_live,duration,duration_raw,definition,caption_available,licensed_content,embeddable,made_for_kids,views,likes,comments
kf4Pux3IAI4,TW,2025-12-17 02:24:22.233170+00:00,2025-12-15 14:00:12+00:00,【羅傑】終於換成正常打野了 跟咖哥雙排各種神人操作！被質疑真的上過鑽石? 阿傑聽到就開始陰陽怪氣 #karsa ｜《英雄聯盟League Of Legend》｜BY-功德,【羅傑】終於換成正常打野了 跟咖哥雙排各種神人操作！被質疑真的上過鑽石? 阿傑聽到就開始陰陽怪氣 #karsa ｜《英雄聯盟League Of Legend》｜BY-功德,羅傑 Roger,UCiEm9noegBIb-AzjqpxKffA,20,Gaming,"羅傑, Roger, 爐石戰記, Heartstone, 二之國, 卡包, 聖騎士, 法師, 盜賊, 薩滿, 德魯伊, 惡魔獵人, 戰士, 牧師, 術士, 爐石戰場, 海盜, 元素, 魚人, 野豬人, 機械, 惡魔, 野獸, 龍類, 幻獸, 抽卡, 獵人, 薛喜, 阿發, 禿頭博士, UZRA, TOM60229, 英雄聯盟, 聯盟戰棋, 瓦羅蘭, valorant, League of Legend, LOL, TFT, 龜狗, 捷提, 凱咒, 統神, 桶神, TOYZ, 史丹利, 丁特, DINTER, 國棟, 冠賢, 阿森, 窺皮, 鬼東, NL, 熊汶銨, 雄問安, 阿能, 雄班長",58,https://i.ytimg.com/vi/kf4Pux3IAI4/hqdefault.jpg,zh-TW,zh-TW,False,735,PT12M15S,hd,false,True,,,42541,569,49
mqU4krG-Rac,TW,2025-12-17 02:24:22.233178+00:00,2025-12-08 02:31:15+00:00,陈小春 - 街角的晚风『缠绵的晚风 吹熄爱的梦，留下我在记忆里沉重。』『动态歌词MV』#翻唱 #必听热门歌曲,陈小春 - 街角的晚风『缠绵的晚风 吹熄爱的梦，留下我在记忆里沉重。』『动态歌词MV』#翻唱 #必听热门歌曲,雲夢music,UCpXfbJbkLelafwR0Rx2mnuA,10,Music,"好聽音樂歌曲, 華語, 情歌, 抖音, 快手, 美拍, 無雜音, 高清, 高音質, 完整版, tiktok, 全民K歌, cover, 改編, 傷感, 網易云, MV, chinese clow songs, most viewed chinese song, best chinese music of all time, top chinese songs, best chinese love songs of all time, chinese motivational song, chinese song lyrics",24,https://i.ytimg.com/vi/mqU4krG-Rac/hqdefault.jpg,zh,zh,False,241,PT4M1S,hd,false,True,,,100244,1294,17
x-S9DEwu4LI,TW,2025-12-17 02:24:22.233186+00:00,2025-12-16 10:01:34+00:00,傳說有三寶｜從溫泉到對方主堡只要七秒！超級冷門BUG，愛麗絲攻速流到底是什麼東西？【Gary 蓋瑞】,傳說有三寶｜從溫泉到對方主堡只要七秒！超級冷門BUG，愛麗絲攻速流到底是什麼東西？【Gary 蓋瑞】,Gary蓋瑞,UCJ0zRk1F6a090G0Aaiby4Rg,20,Gaming,"傳說對決, 蓋瑞, Gary蓋瑞, 傳說對決Gary蓋瑞, 傳說對決 蓋瑞, 傳說對決 Gary蓋瑞, gary蓋瑞, 傳說對決 Gary, 傳說對決 觀念, 傳說對決 教學, 傳說對決 奧義, 傳說對決 魔紋, 傳說 蓋瑞, 傳說 Gary, 傳說 Gary蓋瑞, 傳說 教學, 傳說 角色, 傳說 魔紋, 傳說 奧義, 傳說對決蓋瑞, 瑞瑞超人, 蓋瑞 傳說, 蓋瑞 傳說對決, 蓋瑞傳說, 蓋瑞傳說對決, 蓋瑞 影片, 傳說對決直播蓋瑞, 傳說 gary, gary 傳說, 傳說對決 gary, 蓋瑞叔叔, 傳說有三寶, 傳說路人王, 傳說 三寶, 傳說對決 三寶, 傳說對決 傳說有三寶, 傳說 傳說有三寶, 蓋瑞 傳說有三寶, 傳說有三寶 蓋瑞, 蓋瑞 三寶, 傳說 屁孩, 傳說對決 屁孩, 傳說 開圖, 傳說對決 開圖, 傳說對決 搞笑, 蓋瑞 傳說新企劃, 傳說 隊友太爛, 傳說 好笑, 傳說對決 好笑, 傳說 季倫, 傳說對決 季倫, 傳說 搞笑, 2025 蓋瑞, 蓋瑞 2025, Gary蓋瑞 2025",55,https://i.ytimg.com/vi/x-S9DEwu4LI/hqdefault.jpg,zh-Hant,zh,False,898,PT14M58S,hd,true,True,,,24607,584,42
R856GYdEcPg,TW,2025-12-17 02:24:22.233194+00:00,2025-12-15 09:00:20+00:00,"DAY6(데이식스) ""Lovin' the Christmas"" M/V","DAY6(데이식스) ""Lovin' the Christmas"" M/V",JYP Entertainment,UCaO6TYtlC8U5ttz62hTrZgg,10,Music,"JYP Entertainment, JYP",2,https://i.ytimg.com/vi/R856GYdEcPg/hqdefault.jpg,en,ko,False,217,PT3M37S,hd,true,True,,,774488,25755,1339
qDFEeeLy6ws,TW,2025-12-17 02:24:22.233200+00:00,2025-12-16 00:47:51+00:00,Hollow Knight: Silksong - Sea of Sorrow Teaser,Hollow Knight: Silksong - Sea of Sorrow Teaser,Team Cherry,UCZS2K8ZsUmujTuj3cNMyBSA,20,Gaming,"Hollow Knight, Sea of Sorrows, Silksong, Video Game, Metroidvania, Adventure",6,https://i.ytimg.com/vi/qDFEeeLy6ws/hqdefault.jpg,en,zxx,False,42,PT42S,hd,false,False,,,2747863,308515,20217
9nOrPNxjvck,TW,2025-12-17 02:24:22.233207+00:00,2025-12-08 09:00:07+00:00,ALLDAY PROJECT - ‘LOOK AT ME’ M/V,ALLDAY PROJECT - ‘LOOK AT ME’ M/V,THEBLACKLABEL,UCg8ZzloDPTrOiGztK0C9txQ,10,Music,,0,https://i.ytimg.com/vi/9nOrPNxjvck/hqdefault.jpg,ko,en,False,168,PT2M48S,hd,true,True,,,10906292,0,9633
CyALS1aJEu8,TW,2025-12-17 02:24:22.233214+00:00,2025-12-16 10:00:11+00:00,Watch this！看我的小刀顆秒！頂級飛刀造型？【 Rivals 競爭者】,Watch this！看我的小刀顆秒！頂級飛刀造型？【 Rivals 競爭者】,RD 阿東,UCGJZtmwsWRcoSM3rjb1ziyA,20,Gaming,"roblox, 機械方塊, RD, RD阿東, 競爭者, rivals, 競爭者更新, 競爭者造型, 競爭者Key, 競爭者匕首Key, 競爭者飛刀Key",11,https://i.ytimg.com/vi/CyALS1aJEu8/hqdefault.jpg,zh-Hant,zh-TW,False,545,PT9M5S,hd,false,True,,,55635,1774,421
Fp1H8kF0TmQ,TW,2025-12-17 02:24:22.233221+00:00,2025-12-09 10:02:16+00:00,無名氏 ((Netflix影集《如果我不曾見過太陽》插曲)),無名氏 ((Netflix影集《如果我不曾見過太陽》插曲)),KAXA - Topic,UCTdBdLX5u4tqbKQWGY18qzw,10,Music,"KAXA, 無名氏 (Netflix影集《如果我不曾見過太陽》插曲), 無名氏, Nameless",4,https://i.ytimg.com/vi/Fp1H8kF0TmQ/hqdefault.jpg,zh-Hant,zh,False,221,PT3M41S,hd,false,True,,,28377,299,0
CeqNCksRapo,TW,2025-12-17 02:24:22.233228+00:00,2025-12-15 03:11:51+00:00,如何评价T1队史首个K杯冠军？LCK各队新阵容首秀表现全解析！,如何评价T1队史首个K杯冠军？LCK各队新阵容首秀表现全解析！,分析师蓝宝石,UCZ87qQYN7eu-XZFI1tdXQLg,20,Gaming,"游戏赛事, 电子竞技, 英雄联盟, 游戏, 分析, EDG, RNG, BLG, JDG, LPL, LCK, FAKER, UZI, TheShy, WBG, TES, 滔搏, knight, Chovy, GEN, T1, KT, HLE, DK, Showmaker",25,https://i.ytimg.com/vi/CeqNCksRapo/hqdefault.jpg,zh,zh,False,691,PT11M31S,hd,false,True,,,69234,535,108
Eqn7ot9voIk,TW,2025-12-17 02:24:22.233236+00:00,2025-12-12 04:30:17+00:00,莫宰羊 - 網戀 * LYRICS VIDEO,莫宰羊 - 網戀 * LYRICS VIDEO,莫宰羊 Goater,UC2s5e7PX5VnFL0xUG_id9UA,10,Music,,0,https://i.ytimg.com/vi/Eqn7ot9voIk/hqdefault.jpg,zh-Hant,zh-TW,False,183,PT3M3S,hd,false,True,,,38194,1814,102
LLG6H9oZP1s,TW,2025-12-17 02:24:22.233243+00:00,2025-12-16 07:20:46+00:00,【聯盟戰棋】空城黛安娜，30場上鑽！看完這部片等於現賺2萬塊！老八局靠這手奇蹟翻盤？一定要會的紀元巴德用法｜S16 英雄棋譚 云頂之弈 TFT,【聯盟戰棋】空城黛安娜，30場上鑽！看完這部片等於現賺2萬塊！老八局靠這手奇蹟翻盤？一定要會的紀元巴德用法｜S16 英雄棋譚 云頂之弈 TFT,啵緹Boty,UC5AdfeJkjzRZhjK037UgY-A,20,Gaming,"菁英, 鑽石, 宗師, 新手教學, 遊戲主播, 電競, Dota, 實況, 直播, 吃雞, 自走棋, 吉茵珂絲, PBE, 大師, 抽獎, META, 手遊, NYE, 林小北Lindo, GoDlike_神超, 賭狗陣, 妮可, 戰棋攻略, 絕世拿鐵, 綠茶, 花輪, 天晴, 蠻勇門士, 拉克絲, DISHSOAP, TITLE, 斯溫, 卡特蓮娜, 波比, 圖奇, 希格斯, 阿卡莉, 羅傑, NL, 柯布柯, 煞蜜拉, 雷歐娜, 蓋倫, 蠻勇鬥士, 冠軍, 厄薩斯, 克黎思妲, 路西恩, 剛普朗克, 凱莎, 趙信, 犽宿, 姍娜, 凱特琳, 達瑞斯, 弗力貝爾, 艾希, 悠咪, 雷茲, 嘉文四世, 賽特, 布郎姆, k1m, 犽凝, 逆命, 瑟菈紛, 冥血族, 闇影島, 伊克斯塔爾, 佐恩, 不滅冥聖, 碎鏈者, 蘇瑞瑪, 飛昇者, 虛空, 諾克薩斯, 比爾吉沃特, 神射手, 皮爾托福, 狙擊高手, 約德爾, 皇帝, 蒂瑪西亞, 愛歐尼亞, 弗雷爾卓德, 守護者, 巴龍納什, 布洛克, 薩亨, 賽勒斯, 翱銳龍獸, 機械暴龍, 齊勒斯, 鏡爪, 瑟雷西, 極靈, 鄂爾, 費德提克, 貪啃奇, 梅爾, 泰貝爾, 阿祈爾, 希瓦娜, 安妮, 加里歐, 尤娜拉, 史加納, 好運姐, 安比薩, 沃維克, 貝爾薇斯, 辛吉德, 奈德麗, 飛斯, 悟空, 納瑟斯, 塔里克, 雷尼克頓, 預示者, 維迦, 黛安娜, 麗珊卓, 泰達米爾",123,https://i.ytimg.com/vi/LLG6H9oZP1s/hqdefault.jpg,zh-Hant,zh-TW,False,1444,PT24M4S,hd,false,True,,,26429,265,91
