video_id,country,fetched_at,published_at,title,localized_title,channel_title,channel_id,category_id,category_name,tags,tag_count,thumbnail,default_language,audio_language,is_live,duration,duration_raw,definition,caption_available,licensed_content,embeddable,made_for_kids,views,likes,comments
04GSqsX0S50,TW,2025-12-17 02:24:22.232851+00:00,2025-12-14 13:00:01+00:00,"[COVER] DK X SEUNGKWAN - Die With A Smile (Original Song : Lady Gaga, Bruno Mars)","[COVER] DK X SEUNGKWAN - Die With A Smile (Original Song : Lady Gaga, Bruno Mars)",SEVENTEEN,UCfkXDY7vwkcJ8ddFGz8KusA,10,Music,"에스쿱스, 정한, 조슈아, 호시, 원우, 우지, 디에잇, 민규, 도겸, 승관, 버논, 디노, SCOUPS, JEONGHAN, JOSHUA, JUN, HOSHI, WONWOO, WOOZI, THE 8, MINGYU, DK, SEUNGKWAN, VERNON, DINO, 세븐틴, SEVENTEEN, セブチ",28,https://i.ytimg.com/vi/04GSqsX0S50/hqdefault.jpg,en,en,False,253,PT4M13S,hd,false,True,,,1704559,252925,15877
7AI_vwV4h9w,TW,2025-12-17 02:24:22.232874+00:00,2025-12-16 04:00:11+00:00,2026.2.13春節上映｜電影《功夫》官方前導預告｜Kung Fu Official Teaser Trailer,2026.2.13春節上映｜電影《功夫》官方前導預告｜Kung Fu Official Teaser Trailer,功夫,UCwCd-LZgKnWH3Egnt0r7Yyg,22,People & Blogs,"功夫, 九把刀, 柯震東, 戴立忍, 王淨, 朱軒洋, 劉冠廷, 電影功夫",8,https://i.ytimg.com/vi/7AI_vwV4h9w/hqdefault.jpg,zh-Hant,,False,70,PT1M10S,hd,false,False,,,55267,693,342
z1h2VCO32SQ,TW,2025-12-17 02:24:22.232886+00:00,2025-12-14 13:39:41+00:00,HLE vs T1 하이라이트 | Grand Finals | 2025 LoL KeSPA CUP,HLE vs T1 하이라이트 | Grand Finals | 2025 LoL KeSPA CUP,한국e스포츠협회,UC6YqXiwCBfPvPTs3wXgWElQ,20,Gaming,"LoL, 리그오브레전드, LCK, e스포츠, eSports, BNK, BNK 피어엑스, BNK FEARX, 비엔케이, 비엔케이 피어엑스, DK, Dplus Kia, DWG KIA, DAMWON KIA, 담원, 담원 기아, 디플러스, 디플러스 기아, DNF, DN FREECS, 디엔 프릭스, DRX, 디알엑스, GEN, Gen.G, 젠지, HLE, Hanwha Life Esports, 한화생명, 한화생명e스포츠, KT, kt Rolster, kt 롤스터, 케이티, 케이티 롤스터, BRO, 브리온, OK저축은행 브리온, OKSavingsBank BRION, NS, NONGSHIM, NS RedForce, 농심, 농심 레드포스, T1, 티원, Cloud 9, 클라우드나인, C9, 팀리퀴드, TL, Team Liquid, 베트남, Vietnam, 일본, Japan, 디즈니, 디즈니 플러스, Disney Plus",59,https://i.ytimg.com/vi/z1h2VCO32SQ/hqdefault.jpg,ko,ko,False,3133,PT52M13S,hd,false,True,,,2390884,25892,10365
Vs5NViM8TSY,TW,2025-12-17 02:24:22.232896+00:00,2025-12-15 09:00:46+00:00,ヨルシカ - 八月、某、月明かり（OFFICIAL VIDEO）,ヨルシカ - 八月、某、月明かり（OFFICIAL VIDEO）,ヨルシカ / n-buna Official,UCRIgIJQWuBJ0Cv_VlU3USNA,10,Music,,0,https://i.ytimg.com/vi/Vs5NViM8TSY/hqdefault.jpg,ja,ja,False,283,PT4M43S,hd,false,False,,,814881,80032,4216
Ro5fUjFq9NY,TW,2025-12-17 02:24:22.232904+00:00,2025-12-16 03:00:00+00:00,《角頭: 鬥陣欸》| 正式預告 | Netflix,《角頭: 鬥陣欸》| 正式預告 | Netflix,Netflix Taiwan,UCeH360abfAGTyTpi3nmVwXw,24,Entertainment,"Gatao, Gatao:BigBrothers, netflix, netflixtaiwan, 角頭: 鬥陣欸",5,https://i.ytimg.com/vi/Ro5fUjFq9NY/hqdefault.jpg,zh-Hant,en-US,False,139,PT2M19S,hd,false,True,,,25081,198,25
mjtYzJ1FgjM,TW,2025-12-17 02:24:22.232912+00:00,2025-12-12 10:01:24+00:00,ROBLOX 跑酷，但每過20秒就有一個新詛咒！最後同時4個詛咒，你還可以全破?!【Obby But You're Cursed - 有感筆電】,ROBLOX 跑酷，但每過20秒就有一個新詛咒！最後同時4個詛咒，你還可以全破?!【Obby But You're Cursed - 有感筆電】,有感筆電 Daptoper,UCU-swpBLny7YEqNJB4hI1Kg,20,Gaming,"roblox, 迷因, 梗圖, 迷因梗圖, 有感筆電, daptoper, game, 遊戲, 機械方塊, 罗布乐思, meme, funny, 機器磚塊, 以下單純試圖找到YouTube流量密碼, 生存遊戲, 恐怖遊戲, 搞笑遊戲, 進化, Minecraft, 冒險, 生存, 死亡, 熱門, 好看, 有趣, 奇怪, 小遊戲, 小品遊戲, 網頁遊戲, 等級1, 等級99, 神級, 成長遊戲, 養成遊戲, 奇怪地圖, 惡搞地圖, 整人地圖, 逃離, 怪人, 成長, 脫逃成功, 逃脫地圖, 殺人, 逃脫, 逃出, 跑酷, 嚇人, 整人遊戲, 糞GAME, 怪物, 奇怪遊戲, 奇怪的遊戲, 怪誕, 養成型遊戲, 爆笑, 搞笑, 搞笑地圖, 恐怖地圖, 爆笑遊戲, 生存地圖, 可怕的頭, 挑戰系列, ROBLOX 有感筆電, Roblox Daptoper, 死亡遊戲, roblox roleplay, roblox funny moments, roblox doors, OP, 最強武器, blox fruits, 娛樂, 手遊, 恐怖, 手機遊戲, 新遊戲, 精華, 遊戲推薦, 電玩, 免費, 實況, 怪談, 台灣, 閲覧注意",84,https://i.ytimg.com/vi/mjtYzJ1FgjM/hqdefault.jpg,zh-TW,zh-TW,False,1044,PT17M24S,hd,false,True,,,335677,9612,751
0VcsvIlsOnE,TW,2025-12-17 02:24:22.232921+00:00,2025-12-11 12:00:06+00:00,icyball 冰球樂團 - 不在乎 (Official Video),icyball 冰球樂團 - 不在乎 (Official Video),icyball 冰球樂團,UC1s_oAbcNSiTOMuWdjTCJXA,10,Music,,0,https://i.ytimg.com/vi/0VcsvIlsOnE/hqdefault.jpg,zh-Hant,zh-TW,False,245,PT4M5S,hd,true,False,,,210320,5282,240
UDfjsSqCQ44,TW,2025-12-17 02:24:22.232928+00:00,2025-12-15 17:00:49+00:00,"Avengers: Doomsday - First Trailer (2026) Chris Evans, Robert Downey Jr | Marvel Studios","Avengers: Doomsday - First Trailer (2026) Chris Evans, Robert Downey Jr | Marvel Studios",Teaser Universe,UCa2MXjBtWn91WPHWRBCLI6Q,1,Film & Animation,"avengers doomsday, doomsday trailer, tobey maguire doomsday trailer, doomsday trailer leak, avengers doomsday trailer chris evans, avengers doomsday official trailer, avengers doomsday trailer official, robert downey jr dr doom trailer, avengers doomsday tobey maguire, avengers doomsday robert downey jr, avengers doomsday leaks, avengers doomsday trailer, avengers doomsday 2026 trailer, avengers doomsday new trailer, avengers doomsday cast, avengers doomsday cast reveal, trailers",17,https://i.ytimg.com/vi/UDfjsSqCQ44/hqdefault.jpg,en,en,False,70,PT1M10S,hd,false,True,,,2448297,20784,619
nO_rdotZCiY,TW,2025-12-17 02:24:22.232937+00:00,2025-12-14 09:01:26+00:00,【DinTer】跟大陸女主播雙排EP.5｜給妹子見識真正的超硬打野石頭人Malphite JG！滿滿情緒價值被誇到特心大悅！兩人終於都露出真面目開使鬼吼？一直幫別路讓女主播吃醋了！,【DinTer】跟大陸女主播雙排EP.5｜給妹子見識真正的超硬打野石頭人Malphite JG！滿滿情緒價值被誇到特心大悅！兩人終於都露出真面目開使鬼吼？一直幫別路讓女主播吃醋了！,Dinter,UC0SkNQXPJ60hKEFubOz0fDA,20,Gaming,"Dinter, 丁特, lol, 英雄聯盟, 特哥, 打野, jungle, 石頭人, 墨菲特, 燼, 索拉卡, 奶媽, 賽勒斯, 魔甘娜, 剎雅, 蠻王, 泰達米爾, 星朵拉, 威寇茲",19,https://i.ytimg.com/vi/nO_rdotZCiY/hqdefault.jpg,zh-Hant,zh-TW,False,1000,PT16M40S,hd,false,True,,,152334,2182,548
LbnyAQY4q1Q,TW,2025-12-17 02:24:22.232949+00:00,2025-12-15 13:00:34+00:00,林俊傑 JJ Lin /  Cyndi Wang - 《當你》Whenever - JJ20 FINAL LAP 北京現場版 Live in Beijing,林俊傑 JJ Lin /  Cyndi Wang - 《當你》Whenever - JJ20 FINAL LAP 北京現場版 Live in Beijing,JJ Lin林俊傑,UCd91HSXKhsIv8PIjNrDByHQ,10,Music,"jj, lin;, 林俊傑;, 金曲歌王",4,https://i.ytimg.com/vi/LbnyAQY4q1Q/hqdefault.jpg,zh-Hant,zh-TW,False,252,PT4M12S,hd,false,False,,,110099,2610,159
wGlEP3zAXyQ,TW,2025-12-17 02:24:22.232957+00:00,2025-12-16 03:45:09+00:00,年度武俠大作《雨霖鈴》| 首支預告 | Disney+ 敬請期待,年度武俠大作《雨霖鈴》| 首支預告 | Disney+ 敬請期待,Disney Plus TW,UCF4_1o9KChgXSVend_jdbdg,1,Film & Animation,,0,https://i.ytimg.com/vi/wGlEP3zAXyQ/hqdefault.jpg,zh-Hant,zh-TW,False,107,PT1M47S,hd,false,True,,,21040,339,67
hQ98_ieE3Mg,TW,2025-12-17 02:24:22.232964+00:00,2025-12-16 06:00:42+00:00,【魚丸視聽】KeSPA 總決賽 T1 vs HLE｜打滿五局 Disney+ 狂喜！工商局選歐羅拉與阿璃？Faker 犽宿玩嗨了不開大！Zeka 在等 16、隊友在等 15！ #KeSPA2025,【魚丸視聽】KeSPA 總決賽 T1 vs HLE｜打滿五局 Disney+ 狂喜！工商局選歐羅拉與阿璃？Faker 犽宿玩嗨了不開大！Zeka 在等 16、隊友在等 15！ #KeSPA2025,魚丸Yuwan,UCaCs6O_nQKhxv7KskzfYrFQ,20,Gaming,"LOL, 英雄聯盟, League of Legends, 魚丸, 魚丸XD, yuwanxd, 台服菁英, 菁英上路, challenge, challenger, leagueoflegends, 分析, 復盤, 解析, 菁英, 職業戰隊, BP, 分析師, 教練, T1, LCK, LCP, LPL, LTA, LEC",25,https://i.ytimg.com/vi/hQ98_ieE3Mg/hqdefault.jpg,zh-TW,zh-TW,False,2661,PT44M21S,hd,false,True,,,88048,808,201
1RAJ3SvyBus,TW,2025-12-17 02:24:22.232972+00:00,2025-12-12 04:00:06+00:00,八三夭【沒有翅膀的人 Nobody Can Fly】Official Music Video,八三夭【沒有翅膀的人 Nobody Can Fly】Official Music Video,八三夭 831,UCaPW6qDNWLlhDdSmfW7MTPw,22,People & Blogs,,0,https://i.ytimg.com/vi/1RAJ3SvyBus/hqdefault.jpg,zh-Hant,en,False,258,PT4M18S,hd,true,False,,,312339,3406,259
DqP-u7_d2t4,TW,2025-12-17 02:24:22.232979+00:00,2025-12-12 02:11:47+00:00,Resident Evil Requiem - 3rd Trailer（繁中）,Resident Evil Requiem - 3rd Trailer（繁中）,capcomasia,UCiZwoCzO419_V2SbYGFQKdg,20,Gaming,"#ResidentEvilRequiem, #ResidentEvil, #RE9",3,https://i.ytimg.com/vi/DqP-u7_d2t4/hqdefault.jpg,zh-Hant,zh-HK,False,202,PT3M22S,hd,false,True,,,92618,2863,551
RcnSDwxbHeI,TW,2025-12-17 02:24:22.232986+00:00,2025-12-16 09:30:17+00:00,【Stanley】劍魔打野直接肆虐峽谷！電流漩渦劍三刀秒人OP到離譜！刷巢蟲速度快得像開外掛…這真的不準備砍嗎？E技能穿梭野區完全無視地形！到底還有哪個打野能做到這種事？,【Stanley】劍魔打野直接肆虐峽谷！電流漩渦劍三刀秒人OP到離譜！刷巢蟲速度快得像開外掛…這真的不準備砍嗎？E技能穿梭野區完全無視地形！到底還有哪個打野能做到這種事？,Stanley 史丹利,UCXOBLGJdYA1mfhOrDwQESTg,20,Gaming,"史丹利, Stanley, 史丹利上路, 英雄聯盟, lol, top, 上路, 韓服, S10, 世界冠軍, BD, S2, TPA",13,https://i.ytimg.com/vi/RcnSDwxbHeI/hqdefault.jpg,zh-Hant,zh-TW,False,645,PT10M45S,hd,false,True,,,84449,1464,47
Gy-MZjiFv2M,TW,2025-12-17 02:24:22.232993+00:00,2025-12-15 04:00:03+00:00,ดอกกระเจียวบาน - ก้อง ห้วยไร่ |Official MV|,ดอกกระเจียวบาน - ก้อง ห้วยไร่ |Official MV|,GeneLab,UCiJcM95iuhvQoGkmz30eV1w,10,Music,"ก้องห้วยไร่, ก้อง ห้วยไร่, เบลล่า, เข้ม หัสวีร์, ลูกทุ่ง, ดอกกระเจียว, กระเจียว, ดอกกระเจียวบาน, ต้องเต, ไทบ้าน",10,https://i.ytimg.com/vi/Gy-MZjiFv2M/hqdefault.jpg,th,th,False,255,PT4M15S,hd,true,True,,,2581738,89917,5016
kOSHDsNfsFc,TW,2025-12-17 02:24:22.233000+00:00,2025-12-11 17:01:26+00:00,【超少女】前導預告，2026年6月暑假大銀幕鉅獻,【超少女】前導預告，2026年6月暑假大銀幕鉅獻,華納兄弟台灣,UC8XIx0eSj0onoJXa2iG0Rmw,1,Film & Animation,"2026, DC, DCU, DC工作室, DC漫畫, WB, 伊芙瑞德利, 傑森摩莫亞, 克雷格格里斯佩, 卡拉佐艾爾, 大銀幕鉅獻, 氪普托, 米莉愛考克, 華納, 華納兄弟, 華納兄弟影業, 詹姆斯岡恩, 超少女, 馬提亞斯修奈爾",19,https://i.ytimg.com/vi/kOSHDsNfsFc/hqdefault.jpg,zh-Hant,en-US,False,121,PT2M1S,hd,false,False,,,327340,1817,369
Z2eOdungVug,TW,2025-12-17 02:24:22.233008+00:00,2025-12-13 18:41:45+00:00,【LNG】2025DEC 幾點幾分開始看可以跟LNG一起跨年 洋溢片,【LNG】2025DEC 幾點幾分開始看可以跟LNG一起跨年 洋溢片,LNG 實況存檔,UCKngQgSGHd3Hp3nkPs15YSA,23,Comedy,,0,https://i.ytimg.com/vi/Z2eOdungVug/hqdefault.jpg,zh-Hant,zh-TW,False,12235,PT3H23M55S,hd,false,False,,,72876,1181,170
r21MG0WKxac,TW,2025-12-17 02:24:22.233015+00:00,2025-12-12 12:00:06+00:00,KAXA【無名氏 Nameless】Netflix影集《如果我不曾見過太陽》插曲 Official Music Video @kaxa_official @NetflixTaiwan,KAXA【無名氏 Nameless】Netflix影集《如果我不曾見過太陽》插曲 Official Music Video @kaxa_official @NetflixTaiwan,滾石唱片 ROCK RECORDS,UCPcF3KTqhD67ADkukx_OeDg,10,Music,"KAXA, Netflix, 插曲, Kaį, Lexa, Dance With You, 如果我不曾見過太陽, 曾敬驊, 李沐, 江齊, 程予希, 馬志翔, 姚淳耀, 麻怡婷, 簡奇峯, 林欣慧, 想見你, 柯佳嬿, 彭柏邑, Boiii P, 邱逸安, 邱翊柏, YB Chiu, 吳迪, Woody",25,https://i.ytimg.com/vi/r21MG0WKxac/hqdefault.jpg,zh-Hant,zh-TW,False,221,PT3M41S,hd,true,True,,,57324,1367,67
bjGhUX3vaeY,TW,2025-12-17 02:24:22.233022+00:00,2025-12-16 16:14:37+00:00,【揭密日】 官方前導HD預告-06.12.26,【揭密日】 官方前導HD預告-06.12.26,環球影片 官方頻道,UC0w338Zlnrm8rUXC1GB-FGQ,1,Film & Animation,"環球影片, 電影, 影片, 史蒂芬史匹柏, 2026, 前導預告, 預告",7,https://i.ytimg.com/vi/bjGhUX3vaeY/hqdefault.jpg,zh-Hant,zh-TW,False,126,PT2M6S,hd,false,False,,,19879,393,42
fFjSnl_6YR4,TW,2025-12-17 02:24:22.233030+00:00,2025-12-14 12:57:33+00:00,【DE JuN】閱覽注意！這才是真正的抄家。,【DE JuN】閱覽注意！這才是真正的抄家。,DE JuN,UC4Aclpo5YyXbKPeiZNO_uiw,20,Gaming,,0,https://i.ytimg.com/vi/fFjSnl_6YR4/hqdefault.jpg,zh-Hant,zh-TW,False,832,PT13M52S,hd,false,True,,,132267,4631,478
7hTbNeHqGD8,TW,2025-12-17 02:24:22.233037+00:00,2025-12-13 15:00:12+00:00,EXO 엑소 'I'm Home' MV,EXO 엑소 'I'm Home' MV,SMTOWN,UCEf_Bc-KVd7onSeifS3py9g,10,Music,"EXO, 엑소, we are oneEXO, EXO-K, EXO-M, 엑소케이, 엑소엠, SUHO, LAY, CHANYEOL, D.O., KAI, SEHUN, 수호, 레이, 찬열, 디오, 카이, 세훈, REVERXE, 리버스, 8th album, 8집, comeback, 컴백, music video, mv, 뮤직비디오, 뮤비",29,https://i.ytimg.com/vi/7hTbNeHqGD8/hqdefault.jpg,en,ko,False,219,PT3M39S,hd,true,True,,,4635936,294067,36337
bouHy4dwclM,TW,2025-12-17 02:24:22.233045+00:00,2025-12-10 02:05:50+00:00,《尋秦記》最新預告曝光12月31日原班人馬重現大銀幕,《尋秦記》最新預告曝光12月31日原班人馬重現大銀幕,One Cool Film,UCwwlkw15zKcqPeUHvgdteNw,1,Film & Animation,"尋秦記, BackToThePast, 古天樂, 林峯, 宣萱, 郭羨妮, 滕麗名, 白百何, 苗僑偉, 張繼聰, 朱鑑然, 吳樾, 洪天明, ChrisCollins, 歐瑞偉, 黃文標, 陳國邦, 廖啟智, 鄧一君, 徐偉棟, 洪天照, 吳炫輝, 黎震龍, 天下一電影, OneCoolFilm",25,https://i.ytimg.com/vi/bouHy4dwclM/hqdefault.jpg,zh-Hant,en,False,100,PT1M40S,hd,false,False,,,695152,11219,1399
ghGF5y01zoA,TW,2025-12-17 02:24:22.233052+00:00,2025-12-14 11:41:09+00:00,【偷走腦腐】開箱全新聖誕方塊！購買官方玩偶成為大盤子！【Steal a Brainrot】【Roblox】【機械方塊】,【偷走腦腐】開箱全新聖誕方塊！購買官方玩偶成為大盤子！【Steal a Brainrot】【Roblox】【機械方塊】,R子_第2頻道,UCc_rfbF4TDYobcEFx05G4GA,20,Gaming,"R子, Steal a brainrot, 偷走一顆大腦紅, 偷走一顆腦腐, 偷走腦腐, 草莓大象, OG草莓大象, 腦腐神, 秘密, 黃金基地, 鑽石基地, 秘密腦腐, 馬桶縫合怪, 隱藏儀式, 儀式腦腐",15,https://i.ytimg.com/vi/ghGF5y01zoA/hqdefault.jpg,zh-Hant,zh,False,1100,PT18M20S,hd,true,True,,,130530,2425,320
LrabOJbMLy8,TW,2025-12-17 02:24:22.233059+00:00,2025-12-05 14:18:29+00:00,[ 恆星不忘 ✦ Forever Forever ]  周杰倫Jay ╳ 言承旭Jerry ╳ 吳建豪VanNess ╳ 周渝民Vic  ╳ 五月天阿信 Ashin｜Music Video,[ 恆星不忘 ✦ Forever Forever ]  周杰倫Jay ╳ 言承旭Jerry ╳ 吳建豪VanNess ╳ 周渝民Vic  ╳ 五月天阿信 Ashin｜Music Video,相信音樂BinMusic,UC7ovu6a8ydIbDy0fAKmoZ9A,10,Music,,0,https://i.ytimg.com/vi/LrabOJbMLy8/hqdefault.jpg,zh-Hant,zh,False,300,PT5M,hd,true,True,,,18086766,58399,10648
-xZqCWIAxEY,TW,2025-12-17 02:24:22.233066+00:00,2025-12-12 04:39:38+00:00,《暗黑破壞神 IV》 | 憎恨之王 | 官方上市日期預告片,《暗黑破壞神 IV》 | 憎恨之王 | 官方上市日期預告片,暗黑破壞神,UCRfXA8mX101VaAxT3CL-m-g,20,Gaming,,0,https://i.ytimg.com/vi/-xZqCWIAxEY/hqdefault.jpg,zh-Hant,zh-TW,False,127,PT2M7S,hd,true,True,,,37843,700,219
wLi_CpKGS5I,TW,2025-12-17 02:24:22.233073+00:00,2025-12-13 11:47:00+00:00,森林求生10000 天!?💥我打造最強大又舒適巨型堡壘😎但伺服器瘋狂BUG😱【森林中99夜】【至尊星】,森林求生10000 天!?💥我打造最強大又舒適巨型堡壘😎但伺服器瘋狂BUG😱【森林中99夜】【至尊星】,至尊星 Supremestar,UCu-Z5_JU2bJlTclRrCjBJBQ,20,Gaming,"Roblox, 機器磚塊, 恐怖劇情冒險, 至尊星, 星, 實況, Supremestar, 遊戲, 迷因梗圖, MEME, 機械方塊, 機器方塊, 羅布樂思, 罗布乐思, 搞笑, 爆笑, 好笑, 冒險, 森林中的99個夜晚, 99 Nights in the Forest",20,https://i.ytimg.com/vi/wLi_CpKGS5I/hqdefault.jpg,zh-TW,zh-TW,False,1492,PT24M52S,hd,false,True,,,171887,8429,545
A3grs51hCPg,TW,2025-12-17 02:24:22.233081+00:00,2025-12-09 04:00:09+00:00,JOLIN 蔡依林《Fish Love》Official Music Video,JOLIN 蔡依林《Fish Love》Official Music Video,JOLIN 蔡依林,UCZxdOVXIBEnJUQkhZgeOTTg,10,Music,"蔡依林, Jolin Tsai, Jolin, MV, jolin, jolin tsai, ugly beauty, World Tour, pleasure",9,https://i.ytimg.com/vi/A3grs51hCPg/hqdefault.jpg,zh-Hant,zh-Hant,False,235,PT3M55S,hd,true,False,,,2414387,14764,1233
nFsdOuj0FPo,TW,2025-12-17 02:24:22.233088+00:00,2025-12-16 08:00:49+00:00,予告『銀河特急 ミルキー☆サブウェイ 各駅停車劇場行き』│2026年2月6日(金)公開決定！,予告『銀河特急 ミルキー☆サブウェイ 各駅停車劇場行き』│2026年2月6日(金)公開決定！,アニメ『銀河特急 ミルキー☆サブウェイ』公式,UCC-14oOlJqtME7UywftsSpQ,1,Film & Animation,"ミルキーサブウェイ, MILKYSUBWAY, ミルキー☆サブウェイ, 亀山陽平, KAMEYAMAYOHEI, YOHEIKAMEYAMA, 寺澤百花, 永瀬アンナ, ミルキーハイウェイ, MILKYHIGHWAY, ミルキー☆ハイウェイ, 銀河特急, アニメ, アニメーション, animation, キャンディーズ, 銀河系まで飛んで行け！, 小松未可子, 金元寿子, 小市眞琴, 内山昂輝, 山谷祥生, newcartoon, shortanimation, cartoon, anime, animatedseries, kidsanimation, 3Danime, 3Danimation, milkyway, subway, train, underground, citylife, travel, commute, fantasy, adventure, Sci-fi, SF, Space, Robot, aliens, Holograms, AI, sciencefiction, cosmic, spacestation, spaceship, mecha, multiverse, cyberpunk, cyborgs, 小野賢章, ロバート・ウォーターマン, 映画, movie",58,https://i.ytimg.com/vi/nFsdOuj0FPo/hqdefault.jpg,en,ja,False,61,PT1M1S,hd,false,True,,,403835,41288,886
IUJstTDtjbU,TW,2025-12-17 02:24:22.233097+00:00,2025-12-16 16:57:42+00:00,(FW NaiLiu)  12/16 睡了六個小時再戰!,(FW NaiLiu)  12/16 睡了六個小時再戰!,FW NaiLiu,UCMw833vkWb5adIuhtgCzPjw,20,Gaming,,0,https://i.ytimg.com/vi/IUJstTDtjbU/hqdefault.jpg,zh-Hant,zh,False,23292,PT6H28M12S,hd,false,True,,,134678,1426,1
KUTFcgs3_M0,TW,2025-12-17 02:24:22.233104+00:00,2025-12-12 14:06:23+00:00,Nyxx. - 雨是神的煙花『 雨是神明的煙花我爲誰在等啊等到滿身溼透吧』【完整版】,Nyxx. - 雨是神的煙花『 雨是神明的煙花我爲誰在等啊等到滿身溼透吧』【完整版】,Lin Music ,UCP3nYUU7NRjWFqPzKCCMTaw,10,Music,"Lin Music Channel, 抖音, 動態歌詞, 熱門歌曲, LyricsVideo, 完整版",6,https://i.ytimg.com/vi/KUTFcgs3_M0/hqdefault.jpg,zh-Hant,zh-Hant,False,198,PT3M18S,hd,true,True,,,33474,1289,13
utB7oO_KdN4,TW,2025-12-17 02:24:22.233111+00:00,2025-12-14 01:45:07+00:00,我能通關這款詭異的遊戲嗎！？【PIZZY'S PARLOR 】,我能通關這款詭異的遊戲嗎！？【PIZZY'S PARLOR 】,Yuan2020,UCGQMbfDGFFInMzFDUA_9fww,20,Gaming,"搞笑遊戲, Minecraft, yuan2020, yuan, 源, 元, 原, 冒險, 生存, 死亡, 熱門, 好看, 有趣, 遊戲, 奇怪, yuan2200, yuan20, yuna2020, yaun2020, 小遊戲, 小品遊戲, 網頁遊戲, 神, 等級1, 等級99, 等級999, 神級, 成長遊戲, 可怕巨臉, 奇怪地圖, 整人地圖, 逃離, 成長, 脫逃成功, 逃脫地圖, 逃脫, 被關, 逃出, 跑酷, 跑庫, 結果, 整人, 鬼, 嚇人, 整人遊戲, 糞GAME, GAME, 耍人, 恐怖故事, 奇怪遊戲, 超爆笑, 爆笑, 搞笑, 搞笑地圖, 恐怖地圖, 爆笑遊戲, 爆笑地圖, 生存地圖, 挑戰系列, ROBLOX YUAN, 機械方塊, garten of banban, 模擬器, 模擬遊戲, R幣, Robux, 肌肉, TUNG TUNG TUNG SAHUR, 腦腐, 迷因, 大腦腐蝕, TROLL跑酷, 整人跑酷, TROLL TOWER, Morph Tower, 變形塔, Hamood Habibi Tower, Scary Troll Slap Tower, 哈穆德哈比比, 恐怖巨魔巴掌塔, ROBLOX, roblox, PIZZY'S PARLOR, PIZZY的披薩店",84,https://i.ytimg.com/vi/utB7oO_KdN4/hqdefault.jpg,zh-Hant,zh-TW,False,822,PT13M42S,hd,false,True,,,159585,4114,87
NNf9QhWjG58,TW,2025-12-17 02:24:22.233120+00:00,2025-12-16 09:00:06+00:00,'사랑한 마음엔 죄가 없다' with 은호 (PLAVE),'사랑한 마음엔 죄가 없다' with 은호 (PLAVE),소란 / SORAN,UCik5vfvdgiicyXJ9O1PYnmQ,10,Music,"소란, SORAN, 콘서트, 라이브, 고보컬, 고영배, 서면호, 이태욱, 보컬, 기타, 베이스, 드럼, vocal, guitar, bass, drum, 밴드, band, kpop, 케이팝, 인디, indie, 인디노래, indie music, k-indie, music, INSTRUMENT, guitarist, 기타리스트, bassist, 베이시스트, 드러머, drummer, 런닝맨, 소란 런닝맨, running man, sbs running man, soran running man, 소란 콘서트, soran concert, 소란 라이브, soran live, 해피로봇 레코드, Happy Robot Records, 퍼펙트데이, 소란여름콘, 여름콘, 소란 퍼데, 섶콘, 소란여름콘서트, 소란겨울콘서트, 소란 영상, 이제나와라고백, 가을목이, 소란 페스티벌, 소란 가을목이",56,https://i.ytimg.com/vi/NNf9QhWjG58/hqdefault.jpg,ko,ko,False,192,PT3M12S,hd,false,False,,,191089,27858,6538
OCuGZAJ1pio,TW,2025-12-17 02:24:22.233128+00:00,2025-12-16 20:43:57+00:00,【Sirenia海牛 】跟永恆第一雙排到8點鬼轉巔峰...太榮幸了,【Sirenia海牛 】跟永恆第一雙排到8點鬼轉巔峰...太榮幸了,Sirenia海牛,UCX65vg9q8k-IuWqoViBL5vw,20,Gaming,"傳說對決, 海牛, Sirenia海牛, 海牛 直播, 洪海牛, 海牛 洪偉嘉, Txo Sirenia, Sirenia, Smg Sirenia, 傳說凱薩路, garena 傳說對決, 傳說對決 凱薩路, 傳說, 傳說對決 四週年改版, 傳說對決 海牛 直播, 海牛 傳說, 海牛 txo, txo 海牛, txo sirenia, 傳說渣男, 传说对决, 传说对决 海牛直播, 传说 海牛, 海牛txo",24,https://i.ytimg.com/vi/OCuGZAJ1pio/hqdefault.jpg,zh-Hant,zh,False,35181,PT9H46M21S,hd,false,True,,,50093,398,1
IOuOs9lVhnQ,TW,2025-12-17 02:24:22.233136+00:00,2025-12-13 06:36:27+00:00,左转灯 (1000 Times +1),左转灯 (1000 Times +1),汪苏泷 - Topic,UCUM52sROiqskqjUSNyWsDiA,10,Music,"汪苏泷, 左转灯 (1000 Times +1)",2,https://i.ytimg.com/vi/IOuOs9lVhnQ/hqdefault.jpg,zh,zh,False,195,PT3M15S,hd,false,True,,,22758,285,0
5bduK9jj9Vg,TW,2025-12-17 02:24:22.233143+00:00,2025-12-13 16:13:00+00:00,"🔥 七週年大更新！大量角色技能重製..吊飾增益系統上線！法蘭克吊飾狂敲猛敲，莫提斯配件會把自己變成蝙蝠飛過去！兩隻新角色""皮爾斯""&""格魯伯特""！【荒野亂鬥】","🔥 七週年大更新！大量角色技能重製..吊飾增益系統上線！法蘭克吊飾狂敲猛敲，莫提斯配件會把自己變成蝙蝠飛過去！兩隻新角色""皮爾斯""&""格魯伯特""！【荒野亂鬥】",盛主播,UCqOZXR9XcHB4jOEDYuCgvLw,20,Gaming,,0,https://i.ytimg.com/vi/5bduK9jj9Vg/hqdefault.jpg,zh-Hant,zh-TW,False,1008,PT16M48S,hd,false,True,,,125871,2619,507
toG53zueDi8,TW,2025-12-17 02:24:22.233150+00:00,2025-12-09 20:58:54+00:00,Sia - Unstoppable (Lyrics),Sia - Unstoppable (Lyrics),lemonni,UC7fnqQfk8glMBRq6IMlFnOw,10,Music,,0,https://i.ytimg.com/vi/toG53zueDi8/hqdefault.jpg,en,en,False,218,PT3M38S,hd,false,True,,,1753133,3485,28
0gdJRvFLbAA,TW,2025-12-17 02:24:22.233157+00:00,2025-12-16 09:11:11+00:00,尼克星-傳說對決! 只督你一人! 出家門口就被宰! 五VS五 遭觀眾打爆!｜傳說對決｜尼克星直播精華｜,尼克星-傳說對決! 只督你一人! 出家門口就被宰! 五VS五 遭觀眾打爆!｜傳說對決｜尼克星直播精華｜,寶寶W尼克星,UCkQDeS5LbR5njbJo6aGhUtQ,20,Gaming,,0,https://i.ytimg.com/vi/0gdJRvFLbAA/hqdefault.jpg,zh-Hant,zh-TW,False,587,PT9M47S,hd,false,True,,,37469,457,191
UwmwAECBkwg,TW,2025-12-17 02:24:22.233163+00:00,2025-12-12 10:01:02+00:00,『외톨이야 (I'm a loner)』ジョン・ヨンファ(CNBLUE) × 優里 ｜ 정용화 × 유우리,『외톨이야 (I'm a loner)』ジョン・ヨンファ(CNBLUE) × 優里 ｜ 정용화 × 유우리,優里ちゃんねる【公式】,UC7MvTslTWkE1HKNYkXiGv1Q,22,People & Blogs,,0,https://i.ytimg.com/vi/UwmwAECBkwg/hqdefault.jpg,ja,ja,False,229,PT3M49S,hd,false,True,,,439626,25757,1669
