video_id,country,fetched_at,published_at,title,localized_title,channel_title,channel_id,category_id,category_name,tags,tag_count,thumbnail,default_language,audio_language,is_live,duration,duration_raw,definition,caption_available,licensed_content,embeddable,made_for_kids,views,likes,comments
ta2NDfXlEkc,VE,2026-04-22T03:47:54.848306+00:00,2026-04-21T23:00:06Z,"Jlexis, Almighty, Tutu, Juanka ft. Rome LMN - LA MAREA (Concept Video)","Jlexis, Almighty, Tutu, Juanka ft. Rome LMN - LA MAREA (Concept Video)",Jlexis,UCLn4PQreWn7Sbbp4HG-VD9Q,10,Music,,0,https://i.ytimg.com/vi/ta2NDfXlEkc/hqdefault.jpg,es,es,False,330,PT5M30S,hd,False,False,False,False,41922,9235,7547
U9pc0T1XagU,VE,2026-04-22T03:47:54.848345+00:00,2026-04-21T14:00:06Z,REACCIONO AL EPISODIO FINAL DEL ASOMBROSO CIRCO DIGITAL (tráiler),REACCIONO AL EPISODIO FINAL DEL ASOMBROSO CIRCO DIGITAL (tráiler),Iker Unzu,UCQW8tWGYajwUv6jdQ2kmsRw,20,Gaming,"iker unzu, iker tiktok, iker unzu tiktok, iker, comedia, sketches de comedia, iker comedia, ASOMBROSO CIRCO DIGITAL, Circo, Jax, Pomni",11,https://i.ytimg.com/vi/U9pc0T1XagU/hqdefault.jpg,es,es,False,395,PT6M35S,hd,False,True,False,False,323906,14323,1442
DD3FukBF0Ms,VE,2026-04-22T03:47:54.848355+00:00,2026-04-21T18:55:31Z,Una CHICA NINJA me SECUESTRÓ en Minecraft!,Una CHICA NINJA me SECUESTRÓ en Minecraft!,Dagar,UCEs5MQjXJq27-X2vgdwtYDw,20,Gaming,"Minecraft, minecraft mod, dagar y nacho, nacho y dagar, amigos minecraft, dagar minecraft, minecraft dagar",7,https://i.ytimg.com/vi/DD3FukBF0Ms/hqdefault.jpg,es,es,False,1499,PT24M59S,hd,False,True,False,False,897494,14376,584
cNOCVui6_Y0,VE,2026-04-22T03:47:54.848362+00:00,2026-04-20T21:15:06Z,Romeo Santos & Prince Royce - Dardos (Letra),Romeo Santos & Prince Royce - Dardos (Letra),RIXELUS,UCrkF_lRGv6wuOZVNWCuOCuA,10,Music,"romeo santos, dardos, better late than never album, romeo santos album, romeo santos dardos letra, romeo santos dardos karaoke, romeo santos dardos lyrics, romeo santos dardos audio, romeo santos dardos tiktok, prince royce dardos letra, prince royce dardos karaoke, prince royce dardos lyrics, prince royce dardos audio, prince royce dardos tiktok, bachata, latin pop, pop latino, musica latina, karaoke, hd, hq, topic, rixelus",23,https://i.ytimg.com/vi/cNOCVui6_Y0/hqdefault.jpg,es,es,False,244,PT4M4S,hd,False,True,False,False,145940,355,7
OM4xBeFuoY8,VE,2026-04-22T03:47:54.848369+00:00,2026-04-21T15:00:01Z,Devil May Cry: Temporada 2 | Tráiler oficial | Netflix,Devil May Cry: Temporada 2 | Tráiler oficial | Netflix,Netflix Latinoamérica,UC5ZiUaIJ2b5dYBYGf5iEUrA,24,Entertainment,"Adi Shankar, Capcom, DMC, Dante, Devil May Cry, Mir, Netflix, Studio Mir, Vergil, animación, anime, avance, casa blanca, duelo, hermanos, infierno, madre, mamá, oficial, pelea, rock, serie, t2, temporada 2, tráiler, tu dolor no es un monstruo contra el que luchar",26,https://i.ytimg.com/vi/OM4xBeFuoY8/hqdefault.jpg,es,en-US,False,105,PT1M45S,hd,False,False,False,False,68762,6016,482
bHXQLWtkgq8,VE,2026-04-22T03:47:54.848376+00:00,2026-04-21T20:30:05Z,ESCAPA DE LA PRISION MAS SEGURA DEL MUNDO CON MI HERMANO PEQUEÑO 😮👮🏻‍♂️🚨,ESCAPA DE LA PRISION MAS SEGURA DEL MUNDO CON MI HERMANO PEQUEÑO 😮👮🏻‍♂️🚨,ChuuyMine,UCrPWiqy4AmzFruDvWONex6w,20,Gaming,"ESCAPA DE LA PRISION MAS SEGURA DEL MUNDO CON MI HERMANO PEQUEÑO 😮👮🏻‍♂️🚨, ESCAPA DE LA PRISION MAS SEGURA DEL MUNDO CON MI HERMANO PEQUEÑO, ESCAPA DE LA PRISION MAS SEGURA DEL MUNDO, PRISION MAS SEGURA DEL MUNDO CON MI HERMANO PEQUEÑO, ESCAPA DE LA PRISION MAS SEGURA, ESCAPA DE LA PRISION, chuuymine, chuuymine escapa de la prision, escapa de la prision chuuymine, chuuymine prision mas segura del mundo, chuuymine hermano pequeño, hermano pequeño chuuymine",12,https://i.ytimg.com/vi/bHXQLWtkgq8/hqdefault.jpg,es,es,False,1090,PT18M10S,hd,False,True,False,False,242095,3226,137
tvi8ZL0FajE,VE,2026-04-22T03:47:54.848383+00:00,2026-04-19T21:00:06Z,"Louis BPM , Hades 66 ,JC Reyes,Junior Caldera,Hanzel La H, Prieto Gang - Esto Es Así (Remix Oficial)","Louis BPM , Hades 66 ,JC Reyes,Junior Caldera,Hanzel La H, Prieto Gang - Esto Es Así (Remix Oficial)",Louis BPM,UCqHMVAE6BJ0WSY1oRJuTrgw,10,Music,,0,https://i.ytimg.com/vi/tvi8ZL0FajE/hqdefault.jpg,es,es,False,310,PT5M10S,hd,False,True,False,False,604039,43017,3851
FU8EGYc1Fys,VE,2026-04-22T03:47:54.848389+00:00,2026-04-21T23:00:06Z,RIVALS Season 3 - Official Trailer,RIVALS Season 3 - Official Trailer,Nosniy,UCUoWjn6yYtdMgI7mDLRTLFQ,22,People & Blogs,,0,https://i.ytimg.com/vi/FU8EGYc1Fys/hqdefault.jpg,en,en,False,61,PT1M1S,hd,False,False,False,False,62584,8089,3482
IpUw00W6UGo,VE,2026-04-22T03:47:54.848395+00:00,2026-04-21T19:11:22Z,Escapamos de la PRISIÓN de GUGU GAGA PENGUIN en Roblox con Mandarina,Escapamos de la PRISIÓN de GUGU GAGA PENGUIN en Roblox con Mandarina,Lyna,UC-cnbLlplnXA4oc7rR21qzg,20,Gaming,,0,https://i.ytimg.com/vi/IpUw00W6UGo/hqdefault.jpg,es-419,es-419,False,923,PT15M23S,hd,False,True,False,False,364702,12667,551
o2fNrCaGzbU,VE,2026-04-22T03:47:54.848401+00:00,2026-04-21T12:06:36Z,Danny Ocean x Ryan Castro - Desahógate (VISUaiLIZER),Danny Ocean x Ryan Castro - Desahógate (VISUaiLIZER),Danny Ocean,UC8OjoQHmGd7fDWluxKlQGdg,10,Music,"Danny Ocean Ryan Castro Desahogate, Desahogate Visualizer Oficial, Danny Ocean 2026, Ryan Castro 2026, Desahogate Letra, Desahogate Lyrics, Reggaeton Romantico 2026, Danny Ocean Musica Nueva, Ryan Castro El Ghetto, Desahogate Audio Oficial, Danny Ocean, Ryan Castro, Danny Ocean Babylon Club, danny ocean, danny ocean 2026, ryan castro, ryan castro 2026, ryan castro danny ocean, danny ocean ryan castro, danny y ryan",20,https://i.ytimg.com/vi/o2fNrCaGzbU/hqdefault.jpg,es,es-419,False,121,PT2M1S,hd,False,True,False,False,58405,2629,128
Jpie-fec5qY,VE,2026-04-22T03:47:54.848407+00:00,2026-04-21T15:00:00Z,Devil May Cry: Season 2 | Official Trailer | Netflix,Devil May Cry: Season 2 | Official Trailer | Netflix,Netflix,UCWOA1ZGywLbqmigxE4Qlvuw,24,Entertainment,"Adi Shankar, Animation, Anime, Brothers, Capcom, DMC, Dante, Devil May Cry, Duel, Fighting, Hell, Mir, Netflix, Official, Pain isn't a monster you can fight or run from, Rock, Season 2, Series, Teaser, Trailer, Vergil, White House, mom",23,https://i.ytimg.com/vi/Jpie-fec5qY/hqdefault.jpg,en,en-US,False,105,PT1M45S,hd,True,True,False,False,290510,26328,1988
olKA_ZJQ5fs,VE,2026-04-22T03:47:54.848413+00:00,2026-04-21T20:40:33Z,ODIO ESTE JUEGO CON TODA MI ALMA!!!,ODIO ESTE JUEGO CON TODA MI ALMA!!!,JuegaGerman,UCYiGq8XF7YQD00x7wAd62Zg,20,Gaming,"juegagerman, juega, german, holasoygerman, hola soy german, juega german, poop killer, juego de terror, 3 juegos en 1, juego miedo, horror, la madriguera",12,https://i.ytimg.com/vi/olKA_ZJQ5fs/hqdefault.jpg,es-419,es-419,False,2345,PT39M5S,hd,False,True,False,False,305766,23580,1421
KTLiMcNvcBY,VE,2026-04-22T03:47:54.848419+00:00,2026-04-19T20:30:03Z,Rocío Dúrcal - Como Tu Mujer (Letra),Rocío Dúrcal - Como Tu Mujer (Letra),Keller MX,UCB8_0QUp1PMLEi6DRiGn_Ng,10,Music,"Como Tú Mujer, Como Tu Mujer, Rocío Dúrcal, Rocio Durcal, Rocío Dúrcal Como Tú Mujer, Como Tú Mujer Letra, Como Tú Mujer Lyrics, Letra Como Tú Mujer, Balada Romantica, Musica Mexicana, Musica Latina, Rocío Dúrcal Exitos, Canciones de Amor, Baladas en Español, Clasicos Latinos, Nostalgia 90s, Canciones del Recuerdo, Musica para Dedicar, Cancion Romantica, Latin Music, Balada Latina, Video con Letra, Letra Oficial, Cancion Clasica, Romanticas, Rocio Durcal Canciones",26,https://i.ytimg.com/vi/KTLiMcNvcBY/hqdefault.jpg,es,es,False,264,PT4M24S,hd,False,True,False,False,876823,1181,5
Zd8xPgLCQkw,VE,2026-04-22T03:47:54.848425+00:00,2026-04-21T16:00:52Z,Blood Hunt | New PvE Mode Trailer | Marvel Rivals,Blood Hunt | New PvE Mode Trailer | Marvel Rivals,Marvel Rivals,UCWzmOSSiSPbVnVu3ZAyDx2w,20,Gaming,"Marvel Rivals, PvE, Marvel, Marvel Games, FPS, Shooter",6,https://i.ytimg.com/vi/Zd8xPgLCQkw/hqdefault.jpg,en,en,False,131,PT2M11S,hd,False,False,False,False,471072,25846,2285
k6crWXg7_Fk,VE,2026-04-22T03:47:54.848430+00:00,2026-04-21T20:53:03Z,¡PROBANDO las TNT MÁS EPICAS en MINECRAFT! (#1),¡PROBANDO las TNT MÁS EPICAS en MINECRAFT! (#1),MrDuarte XD,UCLZefG8N0Si_GUxIAwji6uQ,23,Comedy,,0,https://i.ytimg.com/vi/k6crWXg7_Fk/hqdefault.jpg,es,es,False,648,PT10M48S,hd,False,True,False,False,157506,7611,759
WS__5RPlYZg,VE,2026-04-22T03:47:54.848437+00:00,2026-04-19T16:00:45Z,Milo J - Niño (Letra/Lyrics),Milo J - Niño (Letra/Lyrics),nostalgia lyrics.,UCaxjS8mdF402rdn1hP6_1_Q,10,Music,,0,https://i.ytimg.com/vi/WS__5RPlYZg/hqdefault.jpg,es,es,False,211,PT3M31S,hd,False,True,False,False,91438,416,7
-NekKfJN614,VE,2026-04-22T03:47:54.848442+00:00,2026-04-19T21:00:00Z,Anime “Dragon Ball Super: Beerus” | SUPER GEKITOU Trailer,Anime “Dragon Ball Super: Beerus” | SUPER GEKITOU Trailer,東映アニメーション公式YouTubeチャンネル,UCLhgIX2L5ZCaWdlaxR_oTAg,1,Film & Animation,,0,https://i.ytimg.com/vi/-NekKfJN614/hqdefault.jpg,en,ja,False,66,PT1M6S,hd,False,True,False,False,1173165,73489,4078
FRBkOji8AAY,VE,2026-04-22T03:47:54.848448+00:00,2026-04-21T21:15:04Z,ME CLONAN EN ROBLOX Y ROMPO EL JUEGO CON MI HERMANO PEQUEÑO COMPLETO (CLONE SQUAD ROBLOX),ME CLONAN EN ROBLOX Y ROMPO EL JUEGO CON MI HERMANO PEQUEÑO COMPLETO (CLONE SQUAD ROBLOX),Chuy Mine,UCrppUjIbcQjh2Drz8UyuRVg,20,Gaming,"chuymine, chuy mine, ME CLONAN EN ROBLOX Y ROMPO EL JUEGO CON MI HERMANO PEQUEÑO COMPLETO, ME CLONAN EN ROBLOX Y ROMPO EL JUEGO CON MI HERMANO PEQUEÑO, ME CLONAN EN ROBLOX Y ROMPO EL JUEGO, ME CLONAN EN ROBLOX, ME CLONAN, CLONE SQUAD ROBLOX, CLONE SQUAD, CLONE ROBLOX, ROBLOX",11,https://i.ytimg.com/vi/FRBkOji8AAY/hqdefault.jpg,es,es,False,1334,PT22M14S,hd,False,True,False,False,208471,2224,91
wWvu34x2INc,VE,2026-04-22T03:47:54.848454+00:00,2026-04-21T09:00:01Z,UNCHILD 언차일드 'UNCHILD' MV,UNCHILD 언차일드 'UNCHILD' MV,High Up Ent,UCBEu7Q6arDR7GdfnwBL2AUw,22,People & Blogs,"언차일드, UNCHILD, 박예은, 히키, 티나, 아코, 이본, 나하은, 어썸하은, 나하은걸그룹, 예은, 변서영, 변천언, 사사키아코, 이지민, 하이업걸그룹, 하이업신인, 뮤직비디오, 라도, Rado",20,https://i.ytimg.com/vi/wWvu34x2INc/hqdefault.jpg,ko,ko,False,174,PT2M54S,hd,True,False,False,False,1335824,204501,20679
v_Copbn4ASI,VE,2026-04-22T03:47:54.848460+00:00,2026-04-19T20:43:27Z,DRAGON BALL XENOVERSE 3 - Announcement Trailer,DRAGON BALL XENOVERSE 3 - Announcement Trailer,Bandai Namco Entertainment America,UC_ntXHv-XdKCD7CPynVvnQw,20,Gaming,"Bandai Namco, Bandai Namco Entertainment, video games, namco bandai, PS5, PS4, Xbox Series X, anime games, playstation, xbox, pc games",11,https://i.ytimg.com/vi/v_Copbn4ASI/hqdefault.jpg,en-US,en-US,False,229,PT3M49S,hd,False,True,False,False,1492773,121951,10322
6OPz8R09GSw,VE,2026-04-22T03:47:54.848466+00:00,2026-04-21T19:18:43Z,Mi AMIGA Tiene un ACOSADOR LOCO en Minecraft!,Mi AMIGA Tiene un ACOSADOR LOCO en Minecraft!,Jardred,UCyDUULOp3b3JsehZKIIVzrg,20,Gaming,,0,https://i.ytimg.com/vi/6OPz8R09GSw/hqdefault.jpg,es,es,False,1260,PT21M,hd,False,True,False,False,115690,5810,344
DCytTQ3AkJk,VE,2026-04-22T03:47:54.848471+00:00,2026-04-21T00:04:46Z,Todos nos Shipean,Todos nos Shipean,Fuerza Regida - Topic,UCNyJv6OuH16J9sXEl2mX9UA,10,Music,"Fuerza Regida, Todos nos Shipean",2,https://i.ytimg.com/vi/DCytTQ3AkJk/hqdefault.jpg,es,es,False,137,PT2M17S,hd,False,True,False,False,779963,50642,0
ZRMh8dG9Df8,VE,2026-04-22T03:47:54.848477+00:00,2026-04-20T00:00:28Z,¡6 NUEVOS TRAILERS DRAGON BALL SUPER BEERUS Y FREEZER 2026! XENOVERSE 3 SPARKING ZERO Y FIGHTERS Z,¡6 NUEVOS TRAILERS DRAGON BALL SUPER BEERUS Y FREEZER 2026! XENOVERSE 3 SPARKING ZERO Y FIGHTERS Z,anzu361,UCjHaZoGnsfn_NR70eFuilDA,24,Entertainment,,0,https://i.ytimg.com/vi/ZRMh8dG9Df8/hqdefault.jpg,es-419,es-419,False,1107,PT18M27S,hd,False,True,False,False,44501,3616,340
1dD5u4Qcbzo,VE,2026-04-22T03:47:54.848483+00:00,2026-04-21T19:36:03Z,CRIMINALES vs POLICIAS Batalla de Mineria en Minecraft!,CRIMINALES vs POLICIAS Batalla de Mineria en Minecraft!,Awita,UC62nFXtc3KNujp9LCPJt-sA,20,Gaming,,0,https://i.ytimg.com/vi/1dD5u4Qcbzo/hqdefault.jpg,es,es-419,False,1864,PT31M4S,hd,False,True,False,False,177199,3819,317
XoBYEnmJGCI,VE,2026-04-22T03:47:54.848489+00:00,2026-04-18T19:00:06Z,Paulo Londra - Adan y Eva (Letra),Paulo Londra - Adan y Eva (Letra),MexSun,UCOQnav8WY9RGkL0Iz4U3-Lw,22,People & Blogs,"mexsun, regional mexicano, música regional mexicana, corridos tumbados",4,https://i.ytimg.com/vi/XoBYEnmJGCI/hqdefault.jpg,es,es,False,258,PT4M18S,hd,False,True,False,False,434371,719,9
QHFPFQUp-1Q,VE,2026-04-22T03:47:54.848495+00:00,2026-04-21T22:00:26Z,"ESCONDIDAS EN ROBLOX POR $10,000 ROBUX PERO AHORA ES MAS DIFÍCIL!🫣","ESCONDIDAS EN ROBLOX POR $10,000 ROBUX PERO AHORA ES MAS DIFÍCIL!🫣",ElAbrahaham,UColTsB6zogXWooPbeO67Wgw,20,Gaming,"abrahahamflores, stream, entretenimiento, divertido, risa, gracioso, gamer, videojuegos, elabrahaham, copilacion, videos graciosos, antes vs ahora, mexico vs usa, abrahaham, directos, shorts, tiktoks, streams, twitch, reaccion, reacciones",21,https://i.ytimg.com/vi/QHFPFQUp-1Q/hqdefault.jpg,es-MX,es-419,False,1501,PT25M1S,hd,False,True,False,False,358532,18182,1716
Rqkkeswrh_s,VE,2026-04-22T03:47:54.848501+00:00,2026-04-20T22:00:34Z,"Fuerza Regida, Grupo Frontera - Coqueta (Letra/Lyrics)","Fuerza Regida, Grupo Frontera - Coqueta (Letra/Lyrics)",c r x s ;,UCWuhwpkzJVIdq8C5uPFiYxA,10,Music,"traducida, letra, sub español, español, lyrics, hd, hq, video lyrics, mv, music video, subtitulada, traducción, letra español, traducción música, mix, canciones mix, indie, alternativo, canciones tristes, vibes, musica 2026, pop, rock indie lyrics, canciones playlist, canciones para llorar, canciones tranquilas, canciones con traducción, canciones de rock, canciones pop, crxs lyrics, indie lyric videos, youtube, traducido al español, pop español, urban letra",35,https://i.ytimg.com/vi/Rqkkeswrh_s/hqdefault.jpg,es,es,False,242,PT4M2S,hd,False,True,False,False,115270,443,18
WFf4uo--vbg,VE,2026-04-22T03:47:54.848507+00:00,2026-04-20T20:20:26Z,Evolucioné de Coche FEO a Coche Ultra Realista en Minecraft!,Evolucioné de Coche FEO a Coche Ultra Realista en Minecraft!,Nacho,UC8EkcHOycB94lHDkbAPSnQA,20,Gaming,"nacho, dagar, nacho minecraft, dagar y nacho, nacho y dagar, minecraft, minecraft mod, dagar minecraft, coches, coches minecraft, auto, autos minecraft, carros minecraft, tienda de autos minecraft, abri mi propio concesionario, abri mi propia tienda, coche de nacho, coche de dagar, coche de nacho vs coche de dagar, coche robado, coche abandonado, coche robado minecraft, carro de dagar, coche feo, realista, minecraft realista, coche realista, coche realista minecraft",28,https://i.ytimg.com/vi/WFf4uo--vbg/hqdefault.jpg,es,es,False,1328,PT22M8S,hd,False,True,False,False,767854,9504,461
Az4RxTCg5Dw,VE,2026-04-22T03:47:54.848513+00:00,2026-04-22T00:30:06Z,CARABIN3 ❌ KRIS R | COBRONA ( REMIX) ,CARABIN3 ❌ KRIS R | COBRONA ( REMIX) ,CARABIN3 Oficial,UC6jxpqc-T7Hp_90MESZCwdA,10,Music,"Carabin3, cobrona remix, Cobrona carabin3, Cobrona kris r, Kris r, Cobrona remix, Cobrona carbin3 kris r, Carabine, Kris, Cobrona rmx, Lo nuevo de carabin3, Lo nuevo de kris r",12,https://i.ytimg.com/vi/Az4RxTCg5Dw/hqdefault.jpg,es,es,False,212,PT3M32S,hd,False,False,False,False,18726,5360,272
ydUpfdCwyNA,VE,2026-04-22T03:47:54.848519+00:00,2026-04-21T22:53:43Z,Puedes Saltar TODO EL MAPA en GTA 5?,Puedes Saltar TODO EL MAPA en GTA 5?,TurboJuega,UCgyXv3pqrI-wRDjvkTzLCNQ,20,Gaming,"xturboo, xturbo y sara, turbo juega, xturbo juega, Puedes Saltar TODO EL MAPA en GTA 5?",5,https://i.ytimg.com/vi/ydUpfdCwyNA/hqdefault.jpg,es,es,False,1124,PT18M44S,hd,False,True,False,False,63418,2167,123
iLZEHWLpl3I,VE,2026-04-22T03:47:54.848525+00:00,2026-04-21T23:00:06Z,"C.R.O, OVI - Galáctico (Video Oficial)","C.R.O, OVI - Galáctico (Video Oficial)",C.R.O,UC20cm05g3-UFwiPDc1QaClQ,10,Music,"c.r.o, CRO, C.R.O., Tomas Campos, Trap, Hip Hop, Rap, Reggaeton, Rock, Bardero$, MDB, MDBCrew, Ella es una G, Duki, Bizarrap, urbano, OVI, Galactico",18,https://i.ytimg.com/vi/iLZEHWLpl3I/hqdefault.jpg,es-419,es-419,False,187,PT3M7S,hd,False,True,False,False,35476,10381,661
JYN0yy1U4uo,VE,2026-04-22T03:47:54.848531+00:00,2026-04-21T16:17:53Z,"EL PRIMER AMOR DE LA ISLA (Tomodachi Life, Episodio 2)","EL PRIMER AMOR DE LA ISLA (Tomodachi Life, Episodio 2)",Rubius Z,UCcjIvuxmWlS5IEQ0JdPV4Ng,20,Gaming,"elrubius, rubius, Tomodachi Life, tomodachi, rubius tomodachi, 2026, nuevo, simulación social, Nintendo, 3DS, Nintendo DS, Nintendo 3DS, tomodachi life living the dream, Tomodachi Life: Una vida de ensueño, vida, tomodachi life 3ds, capitulo 2, ep2, omelo, 2b, xokas, ñiku, isla, amor, enamorado, enamorada, homero, romance",28,https://i.ytimg.com/vi/JYN0yy1U4uo/hqdefault.jpg,es,es,False,1838,PT30M38S,hd,False,True,False,False,632383,60730,1330
BzxDV0fxIQw,VE,2026-04-22T03:47:54.848537+00:00,2026-04-21T09:46:01Z,Ayer Hable Con Dios,Ayer Hable Con Dios,Corridos del Rey - Topic,UCdlKyPo2iFJlo-atPL9OtZg,10,Music,"Corridos del Rey, Ayer Hable Con Dios",2,https://i.ytimg.com/vi/BzxDV0fxIQw/hqdefault.jpg,es,es,False,144,PT2M24S,hd,False,True,False,False,103444,1910,18
BN_AlKxwK5w,VE,2026-04-22T03:47:54.848543+00:00,2026-04-21T14:59:03Z,SOBREVIVIMOS A LA INUNDACIÓN de BROOKHAVEN,SOBREVIVIMOS A LA INUNDACIÓN de BROOKHAVEN,SoyWelix Brookhaven,UCObgc5yL3AkW0Oj1uik2IcQ,22,People & Blogs,,0,https://i.ytimg.com/vi/BN_AlKxwK5w/hqdefault.jpg,es,es,False,715,PT11M55S,hd,False,True,False,False,171552,2479,113
6BcJ5YiYh0k,VE,2026-04-22T03:47:54.848549+00:00,2026-04-19T17:49:14Z,Air Supply - Making Love Out Of Nothing At All (Lyrics),Air Supply - Making Love Out Of Nothing At All (Lyrics),GroovLatn,UCK7wSPETZbh2PK4SX33SuqQ,22,People & Blogs,"making love out of nothing at all, making love out of nothing at all lyrics, lyrics making love out of nothing at all, air supply, lyrics, air supply making love out of nothing at all, making love out of nothing at all air supply, air supply making love out of nothing at all lyrics, lyrics air supply making love out of nothing at all, air supply lyrics, air supply lyrics making love out of nothing at all, making love out of nothing at all air supply lyrics",12,https://i.ytimg.com/vi/6BcJ5YiYh0k/hqdefault.jpg,en,en,False,346,PT5M46S,hd,False,True,False,False,310413,743,8
35u7dY3ZEI8,VE,2026-04-22T03:47:54.848554+00:00,2026-04-21T20:00:03Z,Sobreviví a LATINOAMÉRICA en MINECRAFT,Sobreviví a LATINOAMÉRICA en MINECRAFT,DanoMC,UCayC0ZYU9iq5PyuDG18BVsA,20,Gaming,"Sobreviví a LATINOAMÉRICA en MINECRAFT, danomc, dano, mc, minecraft, sobrevivi, latam, minecraft gameplay, sobrevivi en minecraft, minecraft mods, minecraft 1.21, minecraft 1.20, minecraft latam, minecraft latinoamerica, niki, LATINOAMÉRICA en MINECRAFT, latinoamerica, me paso minecraft, minecraft pero, minecraft trolleos, troll, minecraft troll, minecraft rol, phonk, danomc latam, danomc phonk, sobrevivi al phonk, minecraft funny, minecraft terror, danomc terror, danomc sobrevivi",31,https://i.ytimg.com/vi/35u7dY3ZEI8/hqdefault.jpg,es-ES,es-ES,False,1495,PT24M55S,hd,False,True,False,False,115877,3321,520
bUynbqnbdes,VE,2026-04-22T03:47:54.848560+00:00,2026-04-17T16:29:25Z,Romeo Santos - Imitadora (Letra),Romeo Santos - Imitadora (Letra),Groovora,UCtAYiFBKzqc8JjVuAHzgeDg,22,People & Blogs,"Romeo Santos Imitadora, Imitadora Romeo Santos, Esta noche me hago el interrogante, Y le pongo fin a la impostora usurpadora, Exijo contigo una entrevista, Sospecho plagio a mi señora mala imitadora, Dime tengo unas preguntas, Dónde fue bajo la lluvia que te di ese primer beso, Dime también relátame el momento, Número de alojamiento donde yo te hice mujer, Confírmame, Imitadora, imitadora romeo santos, romeo santos imitadora, imitadora, romeo santos, Romeo Santos, Vibe Music, letra",19,https://i.ytimg.com/vi/bUynbqnbdes/hqdefault.jpg,es,es,False,239,PT3M59S,hd,False,True,False,False,45788,0,2
SuY_pXx78uw,VE,2026-04-22T03:47:54.848566+00:00,2026-04-21T17:10:41Z,"Me Hice Millonario con los Cuchillos Más CAROS de Roblox (+$999,999,999)","Me Hice Millonario con los Cuchillos Más CAROS de Roblox (+$999,999,999)",Nacho Roblox,UCXJQ6E8-iAL53qEkDIkyKRA,20,Gaming,"nacho, dagar, nacho y dagar, dagar y nacho, roblox, roblox nacho, robux, dibujar, nacho y lia, roblox dinero, robux roblox, roblox no pulses el boton, dagar roblox, espada roblox, noob roblox, hacker roblox, cuchillo, knife, knife roblox, cajas, cajas sorpresa, caja sorpresa cuchillo roblox, cuchillos roblox",23,https://i.ytimg.com/vi/SuY_pXx78uw/hqdefault.jpg,es,es,False,932,PT15M32S,hd,False,True,False,False,128642,2064,91
bDFK852m4jU,VE,2026-04-22T03:47:54.848572+00:00,2026-04-17T13:01:10Z,Yandel - Nunca Me Olvides (Letra / Lyrics),Yandel - Nunca Me Olvides (Letra / Lyrics),Musica Milagrosa,UC7ddFo6Ac8VCzroqvfheIxQ,22,People & Blogs,"yandel nunca me olvides, nunca me olvides, nunca me olvides yandel, yandel nunca me olvides letra, nunca me olvides letra, nunca me olvides yandel letra, yandel nunca me olvides lyrics, nunca me olvides lyrics, nunca me olvides yandel lyrics, Yandel - Nunca Me Olvides, Yandel, Yandel - Nunca Me Olvides (Letra / Lyrics), yandel letra, yandel lyrics",14,https://i.ytimg.com/vi/bDFK852m4jU/hqdefault.jpg,es,es,False,244,PT4M4S,hd,False,True,False,False,97655,155,3
tUMcRHlEHGY,VE,2026-04-22T03:47:54.848579+00:00,2026-04-21T22:30:06Z,JAMÁS CREES a Masha y el Oso en AVATAR WORLD⚠️ (Oso la APLASTÓ😨) | Ani Cat😻,JAMÁS CREES a Masha y el Oso en AVATAR WORLD⚠️ (Oso la APLASTÓ😨) | Ani Cat😻,Ani Cat,UCubLtNmBvzj41QByPpTlmvg,24,Entertainment,"ani cat, ana vallee, anica, ani videos, ani video, ani cat terror, ani cat aplicaciones, creepypasta, masha y el oso, masha and the bear, historia real de masha y el oso, historia verdadera masha y el oso, masha y el oso cuento, masha y el oso historia, masha y el oso aplicacion, masha y el oso terror, app masha y el oso, no juegues con masha y el oso, masha y el oso en avatar world, avatar world, masha avatar world",21,https://i.ytimg.com/vi/tUMcRHlEHGY/hqdefault.jpg,es,es,False,1198,PT19M58S,hd,False,True,False,False,97831,4247,583
EzTx8VYajok,VE,2026-04-22T03:47:54.848585+00:00,2026-04-19T17:00:06Z,Beéle - quédate (Letra),Beéle - quédate (Letra),Eternal ILY,UCcHy8KcK-O2vepvsLyA8ZyA,22,People & Blogs,,0,https://i.ytimg.com/vi/EzTx8VYajok/hqdefault.jpg,es,es,False,177,PT2M57S,hd,False,True,False,False,108013,124,3
chUEdXGTJ10,VE,2026-04-22T03:47:54.848590+00:00,2026-04-22T01:30:06Z,REVISE EL ID DE LOS HACKERS QUE ME MATARON EN FREE FIRE Y ASI ESTAN EN EL 2026 !! - TheDonato,REVISE EL ID DE LOS HACKERS QUE ME MATARON EN FREE FIRE Y ASI ESTAN EN EL 2026 !! - TheDonato,TheDonato,UCaHEdZtk6k7SVP-umnzifmQ,20,Gaming,,0,https://i.ytimg.com/vi/chUEdXGTJ10/hqdefault.jpg,es,es,False,1493,PT24M53S,hd,False,True,False,False,79979,7778,281
35Cd0YxMP8g,VE,2026-04-22T03:47:54.848596+00:00,2026-04-16T22:00:03Z,Ana Gabriel - Simplemente Amigos (Letra),Ana Gabriel - Simplemente Amigos (Letra),Keller Lyrics,UCFUf4c4_fgXfoNnvbEpcaeg,10,Music,"Simplemente Amigos, Ana Gabriel, Ana Gabriel Simplemente Amigos, Simplemente Amigos Letra, Simplemente Amigos Lyrics, Letra Simplemente Amigos, Balada Romantica, Musica Mexicana, Musica Latina, Ana Gabriel Exitos, Canciones de Amor, Amor Prohibido, Baladas en Español, Clasicos Latinos, Nostalgia 90s, Canciones del Recuerdo, Musica para Dedicar, Cancion Romantica, Latin Music, Pop Latino, Balada Latina, Cancion Clasica, Romanticas, Amor y Desamor, Ana Gabriel Canciones",25,https://i.ytimg.com/vi/35Cd0YxMP8g/hqdefault.jpg,es,es,False,228,PT3M48S,hd,False,True,False,False,108561,336,6
7Mr5JzsP3YE,VE,2026-04-22T03:47:54.848602+00:00,2026-04-21T13:00:25Z,I Put IShowSpeed In The World Cup,I Put IShowSpeed In The World Cup,MoreCrunch,UCrsuEI3mvU5pN2PEbwW9F9w,20,Gaming,,0,https://i.ytimg.com/vi/7Mr5JzsP3YE/hqdefault.jpg,en,en,False,1368,PT22M48S,hd,False,True,False,False,191867,3488,112
RxqrDfd2cW0,VE,2026-04-22T03:47:54.848607+00:00,2026-04-15T14:00:06Z,Becky G & Bad Bunny - Mayores (Letra),Becky G & Bad Bunny - Mayores (Letra),TropikAll,UCqooAVRIdB-bUR_inAKHpwg,10,Music,,0,https://i.ytimg.com/vi/RxqrDfd2cW0/hqdefault.jpg,es,es,False,202,PT3M22S,hd,False,True,False,False,175895,493,6
YvY_tz7T8y8,VE,2026-04-22T03:47:54.848612+00:00,2026-04-21T18:57:00Z,JUGAMOS LA TORRE TROLL DE SALTAR PARA EVOLUCIONAR EN ROBLOX CON MI NOVIO | ADRI SF,JUGAMOS LA TORRE TROLL DE SALTAR PARA EVOLUCIONAR EN ROBLOX CON MI NOVIO | ADRI SF,Adriana Sfeir,UCZofL81zWk3PgpuFHvuK6Rw,22,People & Blogs,"ADRIANA SFEIR, JONDRES GC, ADRI SF, JUGAMOS LA TORRE TROLL DE SALTAR PARA EVOLUCIONAR, JUGAMOS LA TORRE TROLL DE SALTAR, TORRE TROLL DE SALTAR PARA EVOLUCIONAR, JUGAMOS LA TORRE TROLL, TORRE TROLL, TORRE TROLL DE SALTAR, ROBLOX, ROBLOX MOMENTOS DIVERTIDOS, JUGAMOS LA TORRE TROLL DE SALTAR PARA EVOLUCIONAR EN ROBLOX CON MI NOVIO, JUGAMOS LA TORRE TROLL DE SALTAR PARA EVOLUCIONAR EN ROBLOX CON JONDRES GC, JUGAMOS LA TORRE DE SALTOS PARA EVOLUCIONAR EN ROBLOX CON MI NOVIO",14,https://i.ytimg.com/vi/YvY_tz7T8y8/hqdefault.jpg,es,es,False,2267,PT37M47S,hd,False,True,False,False,153768,9499,132
TsSlud96fTY,VE,2026-04-22T03:47:54.848618+00:00,2026-04-17T12:00:56Z,Y Tú Te Vas - Chayanne (Letra) | La canción que nos rompió el corazón 💔🥀,Y Tú Te Vas - Chayanne (Letra) | La canción que nos rompió el corazón 💔🥀,Emoria,UCxiU_sknsMKPgeH_XMcCA-Q,22,People & Blogs,,0,https://i.ytimg.com/vi/TsSlud96fTY/hqdefault.jpg,es,es,False,260,PT4M20S,hd,False,True,False,False,160646,384,10
