video_id,country,fetched_at,published_at,title,localized_title,channel_title,channel_id,category_id,category_name,tags,tag_count,thumbnail,default_language,audio_language,is_live,duration,duration_raw,definition,caption_available,licensed_content,embeddable,made_for_kids,views,likes,comments
M7M0mplHY9g,ZW,2025-12-23 02:29:31.759288+00:00,2025-12-06 09:00:06+00:00,Nashie Zim - KUNGE RHEDHIYO ( visualizer ),Nashie Zim - KUNGE RHEDHIYO ( visualizer ),Nashie Zim,UC768yucVpqV16jPGpUU50Fg,22,People & Blogs,"interracial, interracial couple, interracial marriage, interracial relationship, interracial struggles, Nashie Zim",6,https://i.ytimg.com/vi/M7M0mplHY9g/hqdefault.jpg,sn,und,False,191,PT3M11S,hd,False,False,False,False,516188,8927,1272
Mzw2ttJD2qQ,ZW,2025-12-23 02:29:31.759327+00:00,2025-12-22 14:00:04+00:00,The Odyssey | Official Trailer,The Odyssey | Official Trailer,Universal Pictures,UCq0OueAsdxH6b8nyAspwViw,24,Entertainment,,0,https://i.ytimg.com/vi/Mzw2ttJD2qQ/hqdefault.jpg,en-US,en-US,False,114,PT1M54S,hd,True,True,False,False,8042655,294377,18432
X-HbqUDwuL8,ZW,2025-12-23 02:29:31.759345+00:00,2025-12-21 16:01:00+00:00,EGYPT vs ZIMBABWE - Africa Cup of Nations 2025 AFCON | Full Match All Goals | Simulation PES,EGYPT vs ZIMBABWE - Africa Cup of Nations 2025 AFCON | Full Match All Goals | Simulation PES,Football Live,UCxvz6hylB7hsKKK38FE5vXg,20,Gaming,,0,https://i.ytimg.com/vi/X-HbqUDwuL8/hqdefault.jpg,en,en,False,3711,PT1H1M51S,hd,False,True,False,False,37140,72,13
1b7TNiheUCg,ZW,2025-12-23 02:29:31.759354+00:00,2025-12-02 08:00:07+00:00,Enzo Ishall - Chibatamabvi ft. Oskid,Enzo Ishall - Chibatamabvi ft. Oskid,Enzo Ishall,UCjsGaTISIF5XdU2831mRJCQ,10,Music,,0,https://i.ytimg.com/vi/1b7TNiheUCg/hqdefault.jpg,en,und,False,186,PT3M6S,hd,False,True,False,False,483875,11939,1184
9VPSFxU-Jq8,ZW,2025-12-23 02:29:31.759362+00:00,2025-12-21 14:53:33+00:00,Speed does Africa 🌍 (Official Trailer),Speed does Africa 🌍 (Official Trailer),IShowSpeed,UCWsDFcIhY2DBi3GB5uykGXA,20,Gaming,ishowspeed,1,https://i.ytimg.com/vi/9VPSFxU-Jq8/hqdefault.jpg,en,en,False,77,PT1M17S,hd,False,True,False,False,1257008,87915,14573
Rym_-hjbf4I,ZW,2025-12-23 02:29:31.759370+00:00,2025-12-22 16:11:24+00:00,Mali v Zambia | Match in 3 | Africa Cup of Nations Morocco 2025,Mali v Zambia | Match in 3 | Africa Cup of Nations Morocco 2025,SuperSport,UCZH6G3Z5XINU6r92QN1l5Lw,17,Sports,"Mali, Mali vs. Zambia, Zambia",3,https://i.ytimg.com/vi/Rym_-hjbf4I/hqdefault.jpg,en,en,False,195,PT3M15S,hd,False,True,False,False,120896,1399,92
h6m1VpqLwqk,ZW,2025-12-23 02:29:31.759377+00:00,2025-12-05 08:00:06+00:00,Master H - Wakaluza visualizer ( Petrichor Album ),Master H - Wakaluza visualizer ( Petrichor Album ),Master H,UC5jrU8WxzE16gPTnlqQAqew,10,Music,,0,https://i.ytimg.com/vi/h6m1VpqLwqk/hqdefault.jpg,en,und,False,141,PT2M21S,hd,False,True,False,False,405391,10041,776
e0Eo0D038rQ,ZW,2025-12-23 02:29:31.759384+00:00,2025-12-15 13:40:00+00:00,Stranger Things 5 | Volume 2 Trailer | Netflix,Stranger Things 5 | Volume 2 Trailer | Netflix,Netflix,UCWOA1ZGywLbqmigxE4Qlvuw,24,Entertainment,"Caleb McLaughlin, Charlie Heaton, Chief Hopper, David Harbour, Dustin, Eleven, Finn Wolfhard, Gaten Matarazzo, Jamie Campbell Bower, Joe Keery, Jonathan Byers, Joyce Byers, Lucas, Max, Maya Hawke, Mike Wheeler, Millie Bobby Brown, Nancy Wheeler, Natalia Dyer, Netflix, Noah Schnapp, Robin Buckley, Sadie Sink, Steve Harrington, Stranger Things 5, Will Byers, Winona Ryder",27,https://i.ytimg.com/vi/e0Eo0D038rQ/hqdefault.jpg,en,en-US,False,134,PT2M14S,hd,True,True,False,False,15071532,582071,23716
aNPL5Oe0WRY,ZW,2025-12-23 02:29:31.759392+00:00,2025-12-18 21:59:43+00:00,NAPOLI-MILAN 2-0 | HIGHLIGHTS | Neres and Hojlund Seal Napoli Win | EA SPORTS FC Supercup 2025/26,NAPOLI-MILAN 2-0 | HIGHLIGHTS | Neres and Hojlund Seal Napoli Win | EA SPORTS FC Supercup 2025/26,Serie A,UCBJeMCIeLQos7wacox4hmLQ,17,Sports,"Serie A, Dybala, highlights, Juventus, AC Milan, Inter Milan, Napoli, Roma, goals, full highlights, watch, partita, migliori gol, gol del mese, calcio, Italia, lukaku, Lazio, highlights serie a, highlights inter, highlights juventus, highlights milan, highlights juve, highlights roma, lautaro, lautaro martinez, inter, juventus, juve, liga italiana, liga italia, lega italiana, lega italia, napoli-milan 2-0, napoli-milan highlights, neres, hojlund",37,https://i.ytimg.com/vi/aNPL5Oe0WRY/hqdefault.jpg,it,en,False,140,PT2M20S,hd,False,True,False,False,1458521,22330,663
rXgAqCDb3Us,ZW,2025-12-23 02:29:31.759400+00:00,2025-12-14 18:00:07+00:00,Bako Rangu / Munenge Muneni - (Live at JWMF25) | Minister Michael Mahendere & Direct Worship,Bako Rangu / Munenge Muneni - (Live at JWMF25) | Minister Michael Mahendere & Direct Worship,Minister Michael Mahendere,UCD7jsniqGj08FNBMR0Zl7ig,10,Music,"mahendere, munenge murank, munenge muneni, jah prayzah, zimbabwe gospel, shona gospel, joyfull praise, janet manyowa, everton mlalazi, messiah, christian music, bako rangu",12,https://i.ytimg.com/vi/rXgAqCDb3Us/hqdefault.jpg,en,en,False,453,PT7M33S,hd,False,True,False,False,190677,4244,610
YqdAEdkHrwo,ZW,2025-12-23 02:29:31.759408+00:00,2025-12-11 16:59:07+00:00,Supergirl | Official Teaser Trailer,Supergirl | Official Teaser Trailer,DC,UCiifkYAs_bq1pt_zbNAzYGg,24,Entertainment,"DC, DC Comics, DC Universe, DCU, Superman, James Gunn, super heroes, movie, Supergirl, superman 2025, dcu timeline, superman scene, superman krypto, krypto the superdog, lex luthor, krypto, superman 2025 scene, supergirl woman of tomorrow, supergirl scene superman 2025, supergirl cameo superman, supergirl in superman 2025, milly alcock, supergirl, supergirl movie, supergirl 2026, supergirl trailer, supergirl trailer reaction, supergirl trailer breakdown, supergirl milly alcock",29,https://i.ytimg.com/vi/YqdAEdkHrwo/hqdefault.jpg,en,en,False,123,PT2M3S,hd,False,True,False,False,16092767,378088,21170
X9Zos9Fx_VI,ZW,2025-12-23 02:29:31.759415+00:00,2025-12-17 08:00:44+00:00,Australia v England 2025-26 | Third #Ashes Test | Day One,Australia v England 2025-26 | Third #Ashes Test | Day One,cricket.com.au,UCkBY0aHJP9BwjZLDYxAQrKg,17,Sports,"cricket, cricket australia, cricket highlights, cricketcomau",4,https://i.ytimg.com/vi/X9Zos9Fx_VI/hqdefault.jpg,en,en-AU,False,492,PT8M12S,hd,False,True,False,False,3248231,48954,1023
pA8EAJit4MI,ZW,2025-12-23 02:29:31.759423+00:00,2025-11-19 08:00:06+00:00,Raymer - Kapoto (Official Music Video),Raymer - Kapoto (Official Music Video),Raymer,UCoG7RTHJTxu89ZO-ep4h4ZQ,10,Music,,0,https://i.ytimg.com/vi/pA8EAJit4MI/hqdefault.jpg,en,und,False,131,PT2M11S,hd,False,True,False,False,1535526,14303,1086
Fv0leN8TmR8,ZW,2025-12-23 02:29:31.759430+00:00,2025-12-07 00:00:04+00:00,The Boys - Final Season Teaser Trailer | Prime Video,The Boys - Final Season Teaser Trailer | Prime Video,Prime Video,UCQJWtTnAHhEG5w4uN0udnUQ,24,Entertainment,"the boys, the boys season 5, the boys s5, the boys season 5 trailer, the boys season 5 teaser, the boys s5 trailer, the boys s5 teaser, the boys soldier boy, the boys homelander, the boys butcher, homelander, butcher, soldier boy, starlight, hughie, homelander vs butcher, butcher vs homelander, homelander vs soldier boy, the boys final season, the boys final season trailer, antony starr, karl urban, jensen ackles, erin moriarty, jack quaid, chace crawford, jared padalecki",27,https://i.ytimg.com/vi/Fv0leN8TmR8/hqdefault.jpg,en,en,False,121,PT2M1S,hd,True,True,False,False,8864662,340315,17832
Iv2DQPug2fU,ZW,2025-12-23 02:29:31.759438+00:00,2025-12-22 19:16:22+00:00,🔴SOUTH AFRICA vs ANGOLA LIVE | CAF Africa Cup of Nations 2025/26 - Full Match | Watch Along & Pes 21,🔴SOUTH AFRICA vs ANGOLA LIVE | CAF Africa Cup of Nations 2025/26 - Full Match | Watch Along & Pes 21,Wavear,UC9b_boqg5-zOeOxlPwabEFA,20,Gaming,,0,https://i.ytimg.com/vi/Iv2DQPug2fU/hqdefault.jpg,en,en,False,7488,PT2H4M48S,hd,False,True,False,False,226819,0,2
Rs4sLNv_2Ac,ZW,2025-12-23 02:29:31.759446+00:00,2025-12-12 10:00:07+00:00,Nisha Ts - TITENDE (Official Visualizer),Nisha Ts - TITENDE (Official Visualizer),Nisha Ts,UCxxMTUIH6PF9ihVrcUM25bw,10,Music,,0,https://i.ytimg.com/vi/Rs4sLNv_2Ac/hqdefault.jpg,en,und,False,169,PT2M49S,hd,False,True,False,False,179699,6896,665
MPfZhgLiK6w,ZW,2025-12-23 02:29:31.759454+00:00,2025-12-20 05:00:26+00:00,JUJUTSU KAISEN The Culling Game | Official Trailer | Crunchyroll,JUJUTSU KAISEN The Culling Game | Official Trailer | Crunchyroll,Crunchyroll,UC6pGDc4bFGD1_36IKv3FnYg,1,Film & Animation,"jujutsu kaisen, jujutsu kaisen anime, jjk, jjk anime, jujutsu kaisen season 3, jujutsu kaisen s3, jjk s3, crunchyroll, anime, anime pv, anime trailer, jujutsu kaisen culling game, jujutsu kaisen the culling game, jujutsu kaisen season 3 trailer, jujutsu kaisen trailer",15,https://i.ytimg.com/vi/MPfZhgLiK6w/hqdefault.jpg,en,ja,False,117,PT1M57S,hd,False,True,False,False,4903861,270260,9448
wa2QcnHY0Us,ZW,2025-12-23 02:29:31.759461+00:00,2025-12-22 18:35:06+00:00,Aston Villa vs Manchester United | Premier League 2025/26 | Epl Live | PES 21 Simulation,Aston Villa vs Manchester United | Premier League 2025/26 | Epl Live | PES 21 Simulation,Football Gamer Rony,UCaopyJz-EIXOXYXSMOC6c-g,20,Gaming,"manchester united, manchester united f.c., aston villa vs manchester united, live football match online today, manchester united vs aston villa, football live, mu vs aston villa, premier league, man u vs aston villa, sporty tv live, manchester united live match today, premier league live, mu, premier league highlights, bein sport live, barca vs villarreal, မန်ယူ live now, football live match today, sporty tv live match today, liga inggris, man united vs aston villa",21,https://i.ytimg.com/vi/wa2QcnHY0Us/hqdefault.jpg,en,en,False,903,PT15M3S,hd,False,True,False,False,305078,1252,0
j4J8nir73JU,ZW,2025-12-23 02:29:31.759470+00:00,2025-12-13 07:00:07+00:00,Baba Harare- Mr Available Official Music video featuring @iyasa ,Baba Harare- Mr Available Official Music video featuring @iyasa ,Baba Harare,UC48rZIxPimI-mrHgsH0AD8g,22,People & Blogs,,0,https://i.ytimg.com/vi/j4J8nir73JU/hqdefault.jpg,en,und,False,311,PT5M11S,hd,False,False,False,False,164084,7352,1127
ZNvlOFxNk4U,ZW,2025-12-23 02:29:31.759477+00:00,2025-12-17 11:01:09+00:00,NOOB VS PRO: DEER CULT HOUSE BUILD CHALLENGE in Minecraft 99 Nights in a Forest!,NOOB VS PRO: DEER CULT HOUSE BUILD CHALLENGE in Minecraft 99 Nights in a Forest!,Maizen,UCJHBJ7F-nAIlMGolm0Hu4vg,20,Gaming,"Minecraft, Maizen",2,https://i.ytimg.com/vi/ZNvlOFxNk4U/hqdefault.jpg,en,en,False,1296,PT21M36S,hd,False,True,False,False,2696725,17869,1096
JGAou-IDIKk,ZW,2025-12-23 02:29:31.759485+00:00,2025-12-12 15:00:06+00:00,Chinono Remix - Tamy Moyo ft Jah Prayzah,Chinono Remix - Tamy Moyo ft Jah Prayzah,Tamy Moyo,UCf3Bzc2ueZB53fjge3JFDQg,10,Music,,0,https://i.ytimg.com/vi/JGAou-IDIKk/hqdefault.jpg,en,und,False,171,PT2M51S,hd,False,True,False,False,122513,6259,466
eKVNY9qR8t0,ZW,2025-12-23 02:29:31.759492+00:00,2025-12-22 17:23:10+00:00,STEAL A BRAINROT GIVEAWAY LIVE | STEAL A BRAINROT FREE SECRETS + FREE BRAINROT GODS,STEAL A BRAINROT GIVEAWAY LIVE | STEAL A BRAINROT FREE SECRETS + FREE BRAINROT GODS,Joxy,UC3DlDcaefUYr-1skxaiLxVw,20,Gaming,"steal a brainrot giveaway, steal a brainrot giveaway live, steal a brainrot secret giveaway, steal a brainrot live giveaway, steal a brainrot brainrot god giveaway, steal a brainrot stream, steal a brainrot live, steal a brainrot 24/7 stream, steal a brainrot, steal a brainrot god, w steal a brainrot, steal a brainrot game, steal a brainrot gifting, steal a brainrot mod, steal a brainrot glitch, steal a brainrot 24/7, roblox steal a brainrot, steal a brainrot roblox",18,https://i.ytimg.com/vi/eKVNY9qR8t0/hqdefault.jpg,en,en,False,15,PT15S,hd,False,True,False,False,849949,12675,80
vM7Mkj9U3Js,ZW,2025-12-23 02:29:31.759500+00:00,2025-11-28 08:00:06+00:00,"Shone - TAMBISA REMIX [ft Runna Rulez,Jnr Spragga & Madedido]","Shone - TAMBISA REMIX [ft Runna Rulez,Jnr Spragga & Madedido]",Shone ,UC2ZxSNp6gCbWsYhvIcR5tww,10,Music,,0,https://i.ytimg.com/vi/vM7Mkj9U3Js/hqdefault.jpg,en,en,False,163,PT2M43S,hd,False,False,False,False,288808,7402,1198
vxWuI2qi-js,ZW,2025-12-23 02:29:31.759508+00:00,2025-12-22 19:44:21+00:00,🔴South Africa vs Angola Live I CAF Africa Cup of Nations 2025 Full Match Stream I PES 21 Simulation,🔴South Africa vs Angola Live I CAF Africa Cup of Nations 2025 Full Match Stream I PES 21 Simulation,Goal Post,UChO7kZ5qoYbrmI5Wb0BnwvQ,20,Gaming,"gameplay, live, live game, live gameplay, pes, football, football gameplay, football live, live football, live match, match, south africa, angola, south africa vs angola, angola vs south africa, south africa vs angola live, angola vs south africa live, south africa live, angola live, south, africa, african, caf, caf 2025, africa cup of nation, africa cup of nations, afrcia cup of nations 2025, caf africa cup of nations 2025, caf africa cup of nations",29,https://i.ytimg.com/vi/vxWuI2qi-js/hqdefault.jpg,en,en,False,10307,PT2H51M47S,hd,False,True,False,False,124327,381,0
lPx3g3PuEJE,ZW,2025-12-23 02:29:31.759516+00:00,2025-12-01 07:00:06+00:00,Trymore bande ft Pastor N.Matende and Pride Jimu-Makakurumidza kundiseka Official video 2025,Trymore bande ft Pastor N.Matende and Pride Jimu-Makakurumidza kundiseka Official video 2025,Trymore Bande,UCrd5tINPrEzCRTzW9E4JRAA,10,Music,,0,https://i.ytimg.com/vi/lPx3g3PuEJE/hqdefault.jpg,en,und,False,340,PT5M40S,hd,False,True,False,False,358452,4247,628
zAd6mDrJz-8,ZW,2025-12-23 02:29:31.759524+00:00,2025-12-18 18:01:11+00:00,SIDEMEN AMONG US BUT THE IMPOSTOR IS A PEANUT,SIDEMEN AMONG US BUT THE IMPOSTOR IS A PEANUT,MoreSidemen,UCh5mLn90vUaB1PbRRx_AiaA,22,People & Blogs,"sidemen, moresidemen, miniminter, ksi, zerkaa, behzinga, tbjzl, vikkstar, wroetoshaw",9,https://i.ytimg.com/vi/zAd6mDrJz-8/hqdefault.jpg,en,en-GB,False,3939,PT1H5M39S,hd,False,True,False,False,3762818,128971,6870
wgGa9SgxhJI,ZW,2025-12-23 02:29:31.759532+00:00,2025-12-03 12:59:54+00:00,"Al Xapo, Benzoo & EeQue - SNOKONOKO (Official Visualizer)","Al Xapo, Benzoo & EeQue - SNOKONOKO (Official Visualizer)",Al Xapo,UCrp38ZoYserlB8dlFM9_Oyw,22,People & Blogs,"Al Xapo, Benzoo, Eeque - Snokonoko (Official Lyric Video), South Africa, Al Xapo Nakupenda, TXC, Davido, Zlatan, Shoday, Snokonoko Lyrics, Snokonoko, Africa, New Music, Viral TikTok Challenge, Viral, AfroBeats, Amapiano, 3 Step, Ciza, al xapo tyler icu, al xapo yeyii, al xapo x benzoo x eeque snokonoko, al xapo ft scott maphuma, al xapo groove cartel, al xapo snoko, Producer",26,https://i.ytimg.com/vi/wgGa9SgxhJI/hqdefault.jpg,en,el,False,229,PT3M49S,hd,False,False,False,False,3183194,25319,598
e-LQosvfLxo,ZW,2025-12-23 02:29:31.759540+00:00,2025-12-20 18:52:12+00:00,[LIVE] Newcastle United vs Chelsea Premier League 25/26 Full Match - Video Game Simulation,[LIVE] Newcastle United vs Chelsea Premier League 25/26 Full Match - Video Game Simulation,Kampleng Com,UCdMJwGhTUhAzk1ksH6iHjUw,24,Entertainment,"newcastle united vs chelsea, newcastle united vs chelsea live, newcastle united vs chelsea premier league, premier league live 2025, premier league newcastle united vs chelsea, newcastle united vs chelsea 2025, newcastle united vs chelsea today, newcastle united, chelsea, the derby, london, 2025, premier league live today, live, match, premier league 2025/2026, newcastle united vs chelsea games match",17,https://i.ytimg.com/vi/e-LQosvfLxo/hqdefault.jpg,id,id,False,8511,PT2H21M51S,hd,False,True,False,False,133396,584,4
49GhgLUjzdI,ZW,2025-12-23 02:29:31.759548+00:00,2025-12-11 10:00:06+00:00,"Officixl RSA, Benzoo, Sizwe Alakine - Mabalabala [Feat. Bob Mabena, Mellow & Sleazy, Mid9t]","Officixl RSA, Benzoo, Sizwe Alakine - Mabalabala [Feat. Bob Mabena, Mellow & Sleazy, Mid9t]",Officixl Rsa,UCQw1YZO2UO8PTtOsj1VGyXg,10,Music,"Mabalabala, Yabalabala",2,https://i.ytimg.com/vi/49GhgLUjzdI/hqdefault.jpg,en,en,False,338,PT5M38S,hd,False,True,False,False,1813744,17303,469
Xi8gRSKasY8,ZW,2025-12-23 02:29:31.759556+00:00,2025-12-17 22:43:18+00:00,HIGHLIGHTS: Paris Saint-Germain v CR Flamengo | FIFA Intercontinental Cup 2025 Final,HIGHLIGHTS: Paris Saint-Germain v CR Flamengo | FIFA Intercontinental Cup 2025 Final,FIFA,UCpcTrCXblq78GZrTUTLWeBw,17,Sports,,0,https://i.ytimg.com/vi/Xi8gRSKasY8/hqdefault.jpg,en,en,False,120,PT2M,hd,False,True,False,False,1456536,18466,1156
YKu8FIRSllU,ZW,2025-12-23 02:29:31.759563+00:00,2025-12-19 07:00:06+00:00,Chillmaster - Izvozvo,Chillmaster - Izvozvo,Chillmaster Music,UC2v-7BHuZn84Yo91ttsZDWA,22,People & Blogs,,0,https://i.ytimg.com/vi/YKu8FIRSllU/hqdefault.jpg,en,ru,False,182,PT3M2S,hd,False,True,False,False,64157,3720,439
B0iRHKm1l0c,ZW,2025-12-23 02:29:31.759570+00:00,2025-12-20 20:01:08+00:00,🔴LIVE: TOTTENHAM HOTSPUR VS LIVERPOOL | 2025 MATCH LIVE NOW | SIMULATION GAMEPLAY,🔴LIVE: TOTTENHAM HOTSPUR VS LIVERPOOL | 2025 MATCH LIVE NOW | SIMULATION GAMEPLAY,KickOff TV,UC6eHLMQdDR911429ywEYpfQ,20,Gaming,,0,https://i.ytimg.com/vi/B0iRHKm1l0c/hqdefault.jpg,en,en,False,8857,PT2H27M37S,hd,False,True,False,False,57762,0,5
5iaN7xPvIB8,ZW,2025-12-23 02:29:31.759578+00:00,2025-12-01 15:00:19+00:00,Mambo Dhuterere - Daenda Nemi (Official Visualizer),Mambo Dhuterere - Daenda Nemi (Official Visualizer),MAMBO DHUTERERE,UCIrBf4UuflPNKXtFvcGVY2w,10,Music,"Mambo, Dhuterere, mambo dhuterere, jah prayzah latest, mathias mhere latest, dhuterere, mambo, zimbabwe gospel, vabati vajehovah",9,https://i.ytimg.com/vi/5iaN7xPvIB8/hqdefault.jpg,en,und,False,229,PT3M49S,hd,False,False,False,False,261356,5070,430
29554Mujw90,ZW,2025-12-23 02:29:31.759586+00:00,2025-12-21 23:12:57+00:00,ASTON VILLA 2-1 MANCHESTER UNITED PREMIER LEAGUE 2025-26 Match Highlights Simulation/Recreation,ASTON VILLA 2-1 MANCHESTER UNITED PREMIER LEAGUE 2025-26 Match Highlights Simulation/Recreation,十Loork Football,UCfFNw7MaO7QmWkswaGFGEvA,20,Gaming,,0,https://i.ytimg.com/vi/29554Mujw90/hqdefault.jpg,en,en,False,232,PT3M52S,hd,False,True,False,False,85718,476,0
8JZZvo-gJaU,ZW,2025-12-23 02:29:31.759594+00:00,2025-12-12 16:00:06+00:00,"TxC, Davido, Shoday & Scotts Maphuma - Nakupenda (Official Music Video) feat. Zlatan & Al Xapo","TxC, Davido, Shoday & Scotts Maphuma - Nakupenda (Official Music Video) feat. Zlatan & Al Xapo",TXC,UCu4Uqt9BnKo1OT5h3K5qlrA,10,Music,"TXC Davido Zlatan Nakupenda, Nakupenda Davido Shoday TXC, TxC, Davido & Zlatan - Nakupenda (Official Music Video) feat. Scotts Maphuma, Shoday & Al Xapo, Shoday Nakupenda Davido, TikTok Dance, South Africa, Nigeria, TXC Davido Yebo, Dance Challenge, amapiano, txc, southafrica, africa, tarryntxc, clairisetxc, dj, dj duo, unclewaffles, london, tyla, tems, tyla water, amapianovibes, afrobeats, newmusic, africanow, turnoffthelights, colored, TXC Woza Lana, woza lana txc",32,https://i.ytimg.com/vi/8JZZvo-gJaU/hqdefault.jpg,en,en,False,334,PT5M34S,hd,False,True,False,False,3215002,57556,5434
VJyUO2HT8xU,ZW,2025-12-23 02:29:31.759602+00:00,2025-12-22 19:50:58+00:00,🔴 LIVE: South Africa vs Angola | Africa Cup of Nations 2025/2026 | Full Match Simulation eFootball,🔴 LIVE: South Africa vs Angola | Africa Cup of Nations 2025/2026 | Full Match Simulation eFootball,Torcida Gamers,UCNaJguAvBzQH4y4Av8jQuRw,20,Gaming,"South Africa vs Angola live, South Africa and Angola, South Africa vs Angola live today, goals from the match South Africa vs Angola 22/12/2025, highlights of the match South Africa vs Angola 22/12/2025, match South Africa vs Angola, South Africa vs Angola, Africa Cup of Nations 2025, Africa Cup of Nations, eFootball 2025, South Africa, Angola, match of South Africa live, match of Angola live, gameplay eFootball 2025, Angola vs South Africa",16,https://i.ytimg.com/vi/VJyUO2HT8xU/hqdefault.jpg,en,en,False,8201,PT2H16M41S,hd,False,True,False,False,82997,241,0
OHghyYw_Jb0,ZW,2025-12-23 02:29:31.759615+00:00,2025-12-22 08:00:06+00:00,Atenda Chinx - Makoti (expression video),Atenda Chinx - Makoti (expression video),Atenda Chinx ,UC8ZVGs1QI6Oxq1OWapBs-oQ,22,People & Blogs,,0,https://i.ytimg.com/vi/OHghyYw_Jb0/hqdefault.jpg,en,und,False,159,PT2M39S,hd,False,True,False,False,37527,3350,402
RVVc-Pax0hU,ZW,2025-12-23 02:29:31.759623+00:00,2025-12-22 12:00:52+00:00,"Spending 824,291,391 To Cheat In Roblox Roblox Blind Shot...","Spending 824,291,391 To Cheat In Roblox Roblox Blind Shot...",Techy Plus,UCbhkfMLcRk6ftmQuwnFEIqQ,20,Gaming,"roblox, brookhaven, funnyroblox, techyblox, techy, crazy fan girls, crazy fan girl, my crazy fan girls",8,https://i.ytimg.com/vi/RVVc-Pax0hU/hqdefault.jpg,en,en,False,930,PT15M30S,hd,False,True,False,False,159966,2814,198
v7QDbeZ5sQ0,ZW,2025-12-23 02:29:31.759631+00:00,2025-11-29 08:00:06+00:00,SaintFloew - Ininika ft. Jnr Spragga (Official Audio),SaintFloew - Ininika ft. Jnr Spragga (Official Audio),SaintFloew,UCASJzkiQgCV4hsKAs6QY9Vg,10,Music,"SaintFloew, santa, Zimbabwe, official, official audio, music video, official video, Dancehall, Hip hop, saintfloew songs, saintfloew ndega handigone, saintfloew bipolar, saintfloew new song, zimbabwe music, zimbabwe songs, zimbabwean, zimbabwean music, zimbabwean songs, zimbabwean hip hop, zimbabwean hip hop music, zimbabwean hip hop songs, zimbabwean hip hop artists, hip hop mix, hip hop song, hip hop music, hip hop playlist, dancehall mix, dancehall music",28,https://i.ytimg.com/vi/v7QDbeZ5sQ0/hqdefault.jpg,en,sn,False,134,PT2M14S,hd,False,True,False,False,123752,4510,515
226nSjaeGPc,ZW,2025-12-23 02:29:31.759638+00:00,2025-12-20 19:56:25+00:00,🔴Tottenham Hotspur vs Liverpool LIVE. Premier League 2025/2026 Full Match - Simulation Video Games,🔴Tottenham Hotspur vs Liverpool LIVE. Premier League 2025/2026 Full Match - Simulation Video Games,Guest YT,UC4XlVqDR7MH20nZrTXFobPQ,17,Sports,"live tottenham hotspur vs liverpool, tottenham hotspur vs liverpool premier league, tottenham hotspur vs liverpool, tottenham hotspur vs liverpool 2024, tottenham hotspur vs liverpool epl, tottenham hotspur vs liverpool premier league today, tottenham hotspur, liverpool, premier league tottenham hotspur vs liverpool, 24/25, soccer, broadcast, live, live score, tottenham hotspur vs liverpool big match, tottenham hotspur vs liverpool prediction, tottenham hotspur vs liverpool tips",17,https://i.ytimg.com/vi/226nSjaeGPc/hqdefault.jpg,en,id,False,6931,PT1H55M31S,hd,False,True,False,False,27938,121,0
YbrwIWz4OSc,ZW,2025-12-23 02:29:31.759646+00:00,2025-11-17 08:00:41+00:00,"Moyo Wangu (feat. Atenda Chinx, Shona Prince & Takura)","Moyo Wangu (feat. Atenda Chinx, Shona Prince & Takura)",LearnZimbabweVEVO,UCx5GZ0CqFAfEo7QvsjnDGvw,10,Music,"Learn Zimbabwe, Atenda Chinx, Shona Prince, Takura, Learn Zimbabwe Records, Afrobeat",6,https://i.ytimg.com/vi/YbrwIWz4OSc/hqdefault.jpg,en,ru,False,193,PT3M13S,hd,False,True,False,False,423781,5266,320
31Pek0aIpEI,ZW,2025-12-23 02:29:31.759654+00:00,2025-12-21 02:30:06+00:00,CONTROL REWORK TRAILER + SHOWCASE | Blox Fruits,CONTROL REWORK TRAILER + SHOWCASE | Blox Fruits,Gamer Robot,UC_xlDCBWQPlihORIZLWtpbA,20,Gaming,"blox fruits, admin, zioles, blox fruits admin, admin command, abusive admin, roblox, robux, trolling, troll, gift, indra, blox fruits update, blox fruits update 20, update 20, gamer robot, mygame43, blox fruits update 19, roblox blox fruits, family friendly, no cursing, blox fruit, blox fruits noob to pro, anime, race v4, cdk, soul guitar, leveling guide, blox fruits new code, new code, blox fruits code, pvp, el krazy, undercover admin, leaks, sneak peek, secret ability",37,https://i.ytimg.com/vi/31Pek0aIpEI/hqdefault.jpg,en,en,False,902,PT15M2S,hd,False,True,False,False,4098641,228993,49612
H0LgiudMA2U,ZW,2025-12-23 02:29:31.759661+00:00,2025-11-28 08:00:06+00:00,Vegah Milanoh - Ndipeiwo Ft Bonto Man (Official Music Video),Vegah Milanoh - Ndipeiwo Ft Bonto Man (Official Music Video),Vegah Milanoh za,UC-Iea5IW3ZB5gdnvUSNJS0g,10,Music,"zim music, vegha milanoh",2,https://i.ytimg.com/vi/H0LgiudMA2U/hqdefault.jpg,en,und,False,168,PT2M48S,hd,False,True,False,False,187635,2861,628
vVYtOTPZ1uk,ZW,2025-12-23 02:29:31.759668+00:00,2025-12-21 14:01:35+00:00,We Went To The EDGE OF THE MAP In GTA 5...,We Went To The EDGE OF THE MAP In GTA 5...,TechyCrew,UCTU3m4rCUS-7qXuHK-j9Uqw,20,Gaming,"Techy, TechyCrew, Among Us, Fortnite, Fortnite Creative, Roblox, Techy Roblox, Among Us Roles",8,https://i.ytimg.com/vi/vVYtOTPZ1uk/hqdefault.jpg,en,en,False,987,PT16M27S,hd,False,True,False,False,269111,5270,559
ie94BAHwKls,ZW,2025-12-23 02:29:31.759676+00:00,2025-12-04 17:45:23+00:00,Mwari Aripo,Mwari Aripo,Hlgm - Topic,UCQeEBStGzclwmKmW71LtV5Q,10,Music,"Hlgm, Mwari Aripo",2,https://i.ytimg.com/vi/ie94BAHwKls/hqdefault.jpg,en,und,False,180,PT3M,hd,False,True,False,False,43564,709,46
ODhUyM9dxu8,ZW,2025-12-23 02:29:31.759683+00:00,2025-12-21 17:00:41+00:00,"Extreme Hide & Seek In Rivals, But I Used GLITCHES To Win...","Extreme Hide & Seek In Rivals, But I Used GLITCHES To Win...",More Techy,UCzlUw75H5ILJ2l_ackxyI6A,20,Gaming,"roblox, funnyroblox, techyblox, techy, crazy fan girls, crazy fan girl, my crazy fan girls, girlfriend, roblox girlfriend",9,https://i.ytimg.com/vi/ODhUyM9dxu8/hqdefault.jpg,en,en,False,823,PT13M43S,hd,False,True,False,False,324520,5007,383
hRr2UP8U1PE,ZW,2025-12-23 02:29:31.759690+00:00,2025-12-04 13:00:06+00:00,"Sam Deep, Nia Pearl, Boohle, Mano - Shela (Official Music Video)","Sam Deep, Nia Pearl, Boohle, Mano - Shela (Official Music Video)",SamDeepVEVO,UCqWvMzqf3RpbnKF3YCDoc4w,10,Music,"Sam Deep, Nia Pearl, Boohle, Mano, Universal Music (Pty) Ltd., Amapiano, SamDeep, MaDeepana, KusezoKhanya, Thokoza, Isgubhu, iMpumelelo, BoGogo, KingsOfKwapi, HitFactory, SouthAfricanMusic, AmapianoToTheWorld, DJProducer, WelcomeToTheParty, Genesis, Kwakhanya",21,https://i.ytimg.com/vi/hRr2UP8U1PE/hqdefault.jpg,en,und,False,259,PT4M19S,hd,False,True,False,False,3095332,28428,849
