video_id,country,fetched_at,published_at,title,localized_title,channel_title,channel_id,category_id,category_name,tags,tag_count,thumbnail,default_language,audio_language,is_live,duration,duration_raw,definition,caption_available,licensed_content,embeddable,made_for_kids,views,likes,comments
0XPu7POgZS4,TZ,2026-01-15T02:33:17.655750+00:00,2025-12-27T08:10:48Z,Zuchu feat Diamond Platnumz - Inama (Official Music Video),Zuchu feat Diamond Platnumz - Inama (Official Music Video),Zuchu,UCOn8zDM533kqzhIA8c3NFbQ,10,Music,"diamond platnumz, wana, kwaru, hakuna kulala, raha, nisamehe, bedroom, jeje, gere, bachela, dodo, alikiba, diamond, yope, yope remix, kwangwaru, afro east, wcb, nandy, aslay, mama, corona, lava lava, harmonize, wasafi, the story book, rayvanny, tetema, zuchu, mauzauza, ashua, amaboko, nyumba ndogo, wizkid, burna boy, sukari, davido, mwambieni, highlights, new music, trending, music video, d voice, simba, yanga, love, music, song, inama, simba day, mwananchi, marioo, singeli, diamond zuchu, ccm, oluwa",56,https://i.ytimg.com/vi/0XPu7POgZS4/hqdefault.jpg,en,sw,False,174,PT2M54S,hd,False,True,False,False,4260210,67940,4362
dxpOyudIXuY,TZ,2026-01-15T02:33:17.655792+00:00,2025-12-26T12:23:31Z,"FAST & FURIOUS 11 (2026) - First Trailer | Vin Diesel, Cristiano Ronaldo","FAST & FURIOUS 11 (2026) - First Trailer | Vin Diesel, Cristiano Ronaldo",US Studio,UCehUxf1EphIIDyHmyK6rOGQ,24,Entertainment,,0,https://i.ytimg.com/vi/dxpOyudIXuY/hqdefault.jpg,en,en,False,96,PT1M36S,hd,False,True,False,False,2082152,17831,454
1QcvFboyzHw,TZ,2026-01-15T02:33:17.655804+00:00,2026-01-14T06:00:03Z,NIGERIA vs MOROCCO - Penalty Shootout | SEMI FINAL Africa Cup of Nations 2025 | eFootball PES,NIGERIA vs MOROCCO - Penalty Shootout | SEMI FINAL Africa Cup of Nations 2025 | eFootball PES,Football Live,UCxvz6hylB7hsKKK38FE5vXg,20,Gaming,,0,https://i.ytimg.com/vi/1QcvFboyzHw/hqdefault.jpg,en,en,False,849,PT14M9S,hd,False,True,False,False,303412,870,86
ORKLOxIFRbc,TZ,2026-01-15T02:33:17.655813+00:00,2026-01-09T09:00:06Z,Abigail Chams - Your Loss (Official Music Video),Abigail Chams - Your Loss (Official Music Video),AbigailChamsVEVO,UCb9kw5uQBmoR37P3WwqPNOA,10,Music,"Trending, Bongo Flava, New Music, Viral, #YourLoss, Abigail Chams, African Pop, Your Loss",8,https://i.ytimg.com/vi/ORKLOxIFRbc/hqdefault.jpg,en,sw,False,158,PT2M38S,hd,False,True,False,False,589599,10506,1000
wHuWmjXsReU,TZ,2026-01-15T02:33:17.655821+00:00,2026-01-01T17:00:08Z,Marvel Television’s Wonder Man | Official Trailer,Marvel Television’s Wonder Man | Official Trailer,Marvel Entertainment,UCvC4D8onUfXzvjTOM-dBfEA,24,Entertainment,"marvel, comics",2,https://i.ytimg.com/vi/wHuWmjXsReU/hqdefault.jpg,en,en,False,130,PT2M10S,hd,True,True,False,False,8759598,160470,6663
ceTc_6wpzy4,TZ,2026-01-15T02:33:17.655829+00:00,2026-01-14T19:55:27Z,🔴Senegal vs Egypt Live I CAF Africa Cup of Nations 2026 Full Match Streaming I PES 21 Simulation,🔴Senegal vs Egypt Live I CAF Africa Cup of Nations 2026 Full Match Streaming I PES 21 Simulation,Goal Post,UChO7kZ5qoYbrmI5Wb0BnwvQ,20,Gaming,"gameplay, live, live game, live gameplay, pes, football, football gameplay, football live, live football, live match, match, senegal, egypt, senegal vs egypt, egypt vs senegal, senegal vs egypt live, egypt vs senegal live, senegal live, egypt live, caf, caf 2026, africa cup of nation, africa cup of nations, africa cup of nations 2026, caf africa cup of nations, caf africa cup of nations 2026",26,https://i.ytimg.com/vi/ceTc_6wpzy4/hqdefault.jpg,en,en,False,10754,PT2H59M14S,hd,False,True,False,False,281008,472,0
1fkOhj33R2I,TZ,2026-01-15T02:33:17.655837+00:00,2025-12-25T21:04:15Z,Harmonize & Mbosso - Leo ( Official Visualizer ),Harmonize & Mbosso - Leo ( Official Visualizer ),Harmonize,UCwIKyl0V5Cb5WRTazrhg-2A,10,Music,"harmonize, harmonize new song, harmonize songs, Harmonize 2024 Music, Harmonize All Music, Harmonize Yanga Bingwa, konde boy, Harmonize Latest Songs, Harmonize Furaha, Rudeboy ft Harmonize, Harmonize Ft Rudeboy, Rudeboy - Best Couple, Harmonize - Best Couple, Kidedea, Harmonize Kidedea, S2kizzy Kidedea, Ibraah Friend Zone, Harmonize Friend Zone, Harmonize Ft Ibraah, Friend Zone, Mbosso, Leo, harmonize ft mbosso, Mbosso leo, Harmonize Leo, mbosso ft harmonize",26,https://i.ytimg.com/vi/1fkOhj33R2I/hqdefault.jpg,en,sw,False,226,PT3M46S,hd,False,True,False,False,3285403,66860,6250
fJaAYcERf3Y,TZ,2026-01-15T02:33:17.655845+00:00,2026-01-03T13:15:05Z,Jana Nayagan - Official Trailer | Thalapathy Vijay | Pooja Hegde | H Vinoth | Anirudh | KVN,Jana Nayagan - Official Trailer | Thalapathy Vijay | Pooja Hegde | H Vinoth | Anirudh | KVN,KVN PRODUCTIONS,UC3DOgauBYLQQXdH1siGjfpw,1,Film & Animation,"KVN Production, KVN, Jana Nayagan, VIjay, thalapathy vijay, vijay birthday video, Jananayagan, Vijay movie, Vijay new movie, Jana Nayagan teaser, Jana Nayagan trailer, Jana Nayagan Update, Jana Nayagan Trailer, I am Coming, I am waiting, Jana Nayagan Official Trailer, Thalapathy Kacheri, Thalapathy Movie Trailer, Jana Nayagan Movie Trailer, Trending Trailer, Vijay last movie, Vijay Last movie trailer, One last dance, Pooja Hedge, Anirudh, Bobby Deol, Mamitha Baiju, TVK",28,https://i.ytimg.com/vi/fJaAYcERf3Y/hqdefault.jpg,en,ta,False,172,PT2M52S,hd,True,True,False,False,36147968,1465235,103598
h4lTgIHnoX0,TZ,2026-01-15T02:33:17.655854+00:00,2026-01-04T17:26:04Z,REAL MADRID 5 - 1 REAL BETIS | RESUMEN LALIGA EA SPORTS,REAL MADRID 5 - 1 REAL BETIS | RESUMEN LALIGA EA SPORTS,LALIGA EA SPORTS,UCTv-XvfzLX3i4IGWAm4sbmA,17,Sports,"Real Madrid, Real Betis, Betis, Madrid, Real Madrid Real Betis, Real Madrid vs Real Betis, LaLiga, jornada 18 laliga ea sports, laliga ea sports, highlights Real Madrid Betis, resumen Real Madrid Betis, goles Real Madrid, goles Betis, Gonzalo, hat trick Gonzalo, Raúl Asencio, Cucho Hernández, Fran García, Santiago Bernabéu, goleada Real Madrid, mejores momentos fútbol, partido LaLiga, liga española, highlights fútbol, resumen fútbol, Hattrick Gonzalo, Goles Gonzalo, Rodrygo",28,https://i.ytimg.com/vi/h4lTgIHnoX0/hqdefault.jpg,es,es,False,195,PT3M15S,hd,False,True,False,False,4172301,75018,2100
hC1lSNjADxc,TZ,2026-01-15T02:33:17.655862+00:00,2026-01-01T22:40:07Z,"Bruce Melodie - Pom Pom (Official Video) ft.  Diamond Platnumz , Brown Joel ","Bruce Melodie - Pom Pom (Official Video) ft.  Diamond Platnumz , Brown Joel ",Bruce Melodie,UCbp-tIRMJP4SwLjYlJCrolA,10,Music,,0,https://i.ytimg.com/vi/hC1lSNjADxc/hqdefault.jpg,en,en,False,265,PT4M25S,hd,False,False,False,False,2913154,86674,13603
Mzw2ttJD2qQ,TZ,2026-01-15T02:33:17.655870+00:00,2025-12-22T14:00:04Z,The Odyssey | Official Trailer,The Odyssey | Official Trailer,Universal Pictures,UCq0OueAsdxH6b8nyAspwViw,24,Entertainment,,0,https://i.ytimg.com/vi/Mzw2ttJD2qQ/hqdefault.jpg,en-US,en-US,False,114,PT1M54S,hd,True,True,False,False,31786060,542600,27458
tjJTWZrkdAA,TZ,2026-01-15T02:33:17.655877+00:00,2026-01-12T20:56:57Z,Barcelona vs Real Madrid | THE FINAL | Supercopa 2026 | Full Match | PES 21 Simulation,Barcelona vs Real Madrid | THE FINAL | Supercopa 2026 | Full Match | PES 21 Simulation,Football Gamer Rony,UCaopyJz-EIXOXYXSMOC6c-g,20,Gaming,"real madrid vs barcelona, barcelona vs real madrid, barca vs real madrid, real madrid vs barcelona live, madrid vs barcelona, barcelona hoy, live football match online today, partido de futbol de hoy en vivo, bein sport live, real madrid barcelona, fc barcelona vs real madrid, barcelona, match en direct aujourd-hui, футбол прямой эфир сейчас, barcelona vs real madrid live, real madrid vs barcelona 2026, barcelona real madrid, live real madrid vs barcelona",18,https://i.ytimg.com/vi/tjJTWZrkdAA/hqdefault.jpg,en,en,False,925,PT15M25S,hd,False,True,False,False,1633401,5465,0
SOJpE1KMUbo,TZ,2026-01-15T02:33:17.655885+00:00,2026-01-09T18:27:49Z,Dave - Raindance (ft. Tems),Dave - Raindance (ft. Tems),Santan Dave,UC5-cg5RahETrjGu-r8zjYCQ,10,Music,"dave, santan dave, santandave, tems, dave x tems, tems x dave, dave tems, tems dave, dave raindance, dave rain dance, raindance dave, rain dance dave, dave tems raindance, dave tems rain dance, dave x tems raindance, raindance dave x tems, raindance, rain dance, raindance video, dave raindance video, tems raindance, raindance tems, the boy who played the harp, dave 2026, santan dave raindance, dave ft tems, tems ft dave, radiance, dave radiance, raindance dave ft tems",30,https://i.ytimg.com/vi/SOJpE1KMUbo/hqdefault.jpg,en,en,False,221,PT3M41S,hd,False,False,False,False,6749923,255941,7907
_Dfc89TY-aA,TZ,2026-01-15T02:33:17.655892+00:00,2025-12-24T14:00:00Z,Peaky Blinders: The Immortal Man | Official Teaser | Netflix,Peaky Blinders: The Immortal Man | Official Teaser | Netflix,Netflix,UCWOA1ZGywLbqmigxE4Qlvuw,24,Entertainment,"Barry Keoghan, Cillian Murphy, Conspiracy, Netflix, Netflix 2026, Netflix Teasers, New on Netflix, Packy Lee, Peaky Blinders, Rebecca Ferguson, Sophie Rundle, Stephen Graham, Steven Knight, Tense, The Immortal Man, Tim Roth, Tom Harper, drama, film, teaser",20,https://i.ytimg.com/vi/_Dfc89TY-aA/hqdefault.jpg,en,en-US,False,71,PT1M11S,hd,True,True,False,False,7804375,197673,5875
-LoisCF0hm0,TZ,2026-01-15T02:33:17.655900+00:00,2026-01-11T23:10:47Z,[LIVE] Real Madrid vs Barcelona Supercopa de España Final 25/26 Full Match - Video Game Simulation,[LIVE] Real Madrid vs Barcelona Supercopa de España Final 25/26 Full Match - Video Game Simulation,Kampleng Com,UCdMJwGhTUhAzk1ksH6iHjUw,24,Entertainment,"real madrid vs barcelona, real madrid vs barcelona live, real madrid vs barcelona supercopa de españa, supercopa de españa live 2025, supercopa real madrid vs barcelona, real madrid vs barcelona 2026, real madrid vs barcelona static, real madrid, barcelona, the derby, london, 2026, supercopa de españa live today, live, match, supercopa de españa 2025/2026, real madrid vs barcelona prediction, real madrid vs barcelona games match",18,https://i.ytimg.com/vi/-LoisCF0hm0/hqdefault.jpg,id,id,False,14336,PT3H58M56S,hd,False,True,False,False,1688250,6601,7
6qIC4NY7Suo,TZ,2026-01-15T02:33:17.655907+00:00,2026-01-04T06:43:44Z,Mengi kwa ajili yangu.,Mengi kwa ajili yangu.,Emanuel Nicarios - Topic,UCJGE4RkCC0vVMWEVevK-qyA,10,Music,"Emanuel Nicarios, Emanuel Evarest nicarios, Mengi kwa ajili yangu.",3,https://i.ytimg.com/vi/6qIC4NY7Suo/hqdefault.jpg,sw,sw,False,220,PT3M40S,hd,False,True,False,False,142811,2449,226
9VPSFxU-Jq8,TZ,2026-01-15T02:33:17.655914+00:00,2025-12-21T14:53:33Z,Speed does Africa 🌍 (Official Trailer),Speed does Africa 🌍 (Official Trailer),IShowSpeed,UCWsDFcIhY2DBi3GB5uykGXA,20,Gaming,ishowspeed,1,https://i.ytimg.com/vi/9VPSFxU-Jq8/hqdefault.jpg,en,en,False,77,PT1M17S,hd,False,True,False,False,2287832,123019,17961
YpPO9hMHjMA,TZ,2026-01-15T02:33:17.655921+00:00,2026-01-10T10:47:20Z,"🔴 AZAM FC VS YANGA SC FINAL MAPINDUZI CUP 2026 PREVIEW, PREDICTIONS & HEAD TO HEAD","🔴 AZAM FC VS YANGA SC FINAL MAPINDUZI CUP 2026 PREVIEW, PREDICTIONS & HEAD TO HEAD",FOOTBALL TEAM JB,UCrAzGiFr2-GkBH03paCPHwQ,17,Sports,"Match Preview Azam FC vs Young Africans Mapinduzi Cup 2026, Head To Head Azam FC vs Young Africans Mapinduzi Cup 2026, Live Score Azam FC vs Young Africans Mapinduzi Cup 2026, Highlights Azam FC vs Young Africans Mapinduzi Cup 2026, Mapinduzi Cup 2026 Fixtures, Mapinduzi Cup 2026, Azam FC vs Young Africans, Azam FC vs Yanga SC, Azam Football Club, Young Africans, Azam FC, Yanga SC",12,https://i.ytimg.com/vi/YpPO9hMHjMA/hqdefault.jpg,en,und,False,115,PT1M55S,hd,False,True,False,False,51097,0,2
Oc97GhGcl8I,TZ,2026-01-15T02:33:17.655928+00:00,2025-12-29T15:00:06Z,Chino Kidd Ft Halima - Pembe (Official Music Video),Chino Kidd Ft Halima - Pembe (Official Music Video),Chino Kidd,UCloQBRhpbi7vXY8Jfw2Jh4Q,10,Music,,0,https://i.ytimg.com/vi/Oc97GhGcl8I/hqdefault.jpg,en,lg,False,338,PT5M38S,hd,False,True,False,False,388575,8527,1646
z_39dqaLTxQ,TZ,2026-01-15T02:33:17.655935+00:00,2026-01-10T02:55:45Z,🔴Live : Senegal vs Mali I Quarter Final I Africa Cup of Nations Full Match  I eFootball Pes 21 Game,🔴Live : Senegal vs Mali I Quarter Final I Africa Cup of Nations Full Match  I eFootball Pes 21 Game,Munna,UCxeXR8JqzNAOxAfS_ACtFdQ,20,Gaming,"munna, football, soccer, football gameplay, game, gameplay, pes, epes, soccer league, live, live football, match, football live, live football match, sport, sports, soccer live, live soccer, 2025, mali, senegal, mali vs senegal, senegal vs mali, sadio mane, senegal match, senegal live, senegal football, senegal live match, senegal vs mali live, mali vs senegal live, caf, africa, african, africa cup of nations, afcon, afcon 2025",36,https://i.ytimg.com/vi/z_39dqaLTxQ/hqdefault.jpg,en,zxx,False,594,PT9M54S,hd,False,True,False,False,229358,581,1
EFto2qPRWO4,TZ,2026-01-15T02:33:17.655942+00:00,2026-01-08T14:30:33Z,Barakah The Prince - Mwanetu {Official Video},Barakah The Prince - Mwanetu {Official Video},Barakah The Prince,UCR-QYMY8fSle640c1hi3Mog,10,Music,"BarakahThePrince, AfrikanPrince, AfricanPrince, Barakah, Prince, BongoFlava, Tanzania, Diamond, Platnumz, Wasafi",10,https://i.ytimg.com/vi/EFto2qPRWO4/hqdefault.jpg,en,sw,False,200,PT3M20S,hd,False,True,False,False,93298,3548,671
HospJ8dnN5U,TZ,2026-01-15T02:33:17.655949+00:00,2026-01-11T22:29:35Z,BARCELONA vs REAL MADRID Live | Supercopa de Espana FINAL 2026 | Simulation PES 2021 Gameplay,BARCELONA vs REAL MADRID Live | Supercopa de Espana FINAL 2026 | Simulation PES 2021 Gameplay,FERA HD,UC65x1bMXmtHI0-oYQkc56Ew,20,Gaming,,0,https://i.ytimg.com/vi/HospJ8dnN5U/hqdefault.jpg,en,en-US,False,12558,PT3H29M18S,hd,False,True,False,False,1001482,3036,9
VXc6yFExd0s,TZ,2026-01-15T02:33:17.655956+00:00,2026-01-07T14:00:07Z,Gigy Money - GO (Official Music Video),Gigy Money - GO (Official Music Video),Gigy Money,UCJuiN2xUidhoJ60T0JbM7eA,10,Music,"Gigy Money, Bongo, Tanzania, top female artiste, hot new music, top new music, latest music, GigyMoney",8,https://i.ytimg.com/vi/VXc6yFExd0s/hqdefault.jpg,en,en-US,False,147,PT2M27S,hd,False,True,False,False,97958,4503,544
wzbWP1qLnCk,TZ,2026-01-15T02:33:17.655963+00:00,2026-01-14T19:33:51Z,🔴 LIVE: Senegal vs Egypt 🔴 AFCON 2025/2026 - Semifinal ⚽ Match Today Simulation,🔴 LIVE: Senegal vs Egypt 🔴 AFCON 2025/2026 - Semifinal ⚽ Match Today Simulation,Torcida Gamers,UCNaJguAvBzQH4y4Av8jQuRw,20,Gaming,"Senegal vs Egypt, Senegal vs Egypt live, Egypt vs Senegal, Senegal vs Egypt live streaming, goals of Senegal vs Egypt match 14/01/2026, Senegal vs Egypt live today, Semifinal Africa Cup of Nations 2026 matches, Watch Senegal vs Egypt live, Senegal vs Egypt match, Senegal, Egypt, Watch Senegal live, Watch Egypt live",13,https://i.ytimg.com/vi/wzbWP1qLnCk/hqdefault.jpg,en,en,False,8090,PT2H14M50S,hd,False,True,False,False,98406,237,0
hMUrBwFc10w,TZ,2026-01-15T02:33:17.655971+00:00,2025-12-24T07:00:07Z,B2k Mnyama feat Ibraah -  Ipo siku (Official Music Video),B2k Mnyama feat Ibraah -  Ipo siku (Official Music Video),B2K Mnyama,UC9u7HHIL4D5Y1cjCjxqc-jw,10,Music,"TANZANIA, B2K, BONGO, MAKAMBAKO, WASAFI, STARBEAT, Diamond, Diamond Platnumz, Harmonize, Zuchu, Maandamano, Samia Suluhu, Tundu lisu, Rema, 50 Cent, Diddy, Oluwa, Enjoy, Sumu, jux ft diamond platnumz, alikiba ft marioo, mama samia, nay wamitego, yanga, haji manara, diamond platnumz, harmonize, Warnermusicgroup, Hiphop, diamondplatinum, alikiba, utu, mabantu, zuch, burnaboy, marioo, RoyalTour, simba, wizikid, hajimanara, skudu, Simba Sports Club, tanzania, tupobusy, mandamano, 2025, alibadiri, Trending, MerryChristamas",49,https://i.ytimg.com/vi/hMUrBwFc10w/hqdefault.jpg,en,sw,False,237,PT3M57S,hd,False,True,False,False,791218,17053,1643
3KQvRDaJm8M,TZ,2026-01-15T02:33:17.655978+00:00,2026-01-10T03:50:59Z,🔴EN DIRECT : MALI VS SENEGAL | AFRICA CUP OF NATIONS QUARTER-FINAL | SIMULATION GAMEPLAY,🔴EN DIRECT : MALI VS SENEGAL | AFRICA CUP OF NATIONS QUARTER-FINAL | SIMULATION GAMEPLAY,KickOff TV,UC6eHLMQdDR911429ywEYpfQ,20,Gaming,,0,https://i.ytimg.com/vi/3KQvRDaJm8M/hqdefault.jpg,fr,en,False,11373,PT3H9M33S,hd,False,True,False,False,301899,0,0
DPmeVAGLhuk,TZ,2026-01-15T02:33:17.655985+00:00,2026-01-09T15:04:31Z,Fid Q feat IAMSIXOCLOCK - Ngosha (official video),Fid Q feat IAMSIXOCLOCK - Ngosha (official video),Fid Q,UCfvOKVxSYkXyyfukqxi1NSQ,10,Music,,0,https://i.ytimg.com/vi/DPmeVAGLhuk/hqdefault.jpg,en,sw,False,65,PT1M5S,hd,False,True,False,False,29146,1026,138
YjLYTzz7MXM,TZ,2026-01-15T02:33:17.655992+00:00,2026-01-11T12:01:07Z,Man City SMASH Exeter to progress! 💥 | Manchester City  (10-1) Exeter | Emirates FA Cup 2025-26,Man City SMASH Exeter to progress! 💥 | Manchester City  (10-1) Exeter | Emirates FA Cup 2025-26,The Emirates FA Cup,UCChcWqwYXCEs657MQ00qVWA,17,Sports,"Emirates FA Cup, FA Cup, FA, Cup, Football, Soccer, English football, premier league stars, football highlights, highlights, best moments, goals, drama, fans, Highlights, Manchester City, Man City, Exeter, MCFC",19,https://i.ytimg.com/vi/YjLYTzz7MXM/hqdefault.jpg,en,en,False,360,PT6M,hd,False,True,False,False,493456,5233,189
SgrqZK6n_7Y,TZ,2026-01-15T02:33:17.655999+00:00,2025-12-15T08:33:52Z,Marioo - OLUWA (Official Music Video),Marioo - OLUWA (Official Music Video),MariooOfficial,UCgZGpR80Z-x5fnUsKuKM2kg,10,Music,"Tanzania, Kenya, Uganda, Marioo, BongoFlava, music, africa, mariooofficial, marioomusic, marioonewmusic, marioosongs, marioohits, Trending Music, Trending Africa, Tanzania Music, Marioo trending, Marioo mix, swahili music, swahili, trending music tanzania, Trending Music tz",21,https://i.ytimg.com/vi/SgrqZK6n_7Y/hqdefault.jpg,en,sw,False,167,PT2M47S,hd,False,True,False,False,4639910,45850,7215
NMBR8qRj0Us,TZ,2026-01-15T02:33:17.656007+00:00,2026-01-11T22:50:58Z,BARCELONA 3 vs 2 REAL MADRID | FINAL 2026 SPANISH SUPER CUP  | Highlights  Simulation/Recreation,BARCELONA 3 vs 2 REAL MADRID | FINAL 2026 SPANISH SUPER CUP  | Highlights  Simulation/Recreation,十Loork Football,UCfFNw7MaO7QmWkswaGFGEvA,20,Gaming,"Barcelona vs, Real Madrid, Barcelona vs Real Madrid, Barcelona vs Real Madrid 2025-2026, Real Madrid vs Barcelona 2025-2026, Spanish Super Cup 2025-2026, Real Madrid vs Barcelona Spanish Super Cup 2025-2026, Barcelona vs Real Madrid Spanish Super Cup 2025-2026, Barcelona, Super Copa de España, Real Madrid F.C., Barcelona F.C., Supercopa de España, Spanish Super Cup",14,https://i.ytimg.com/vi/NMBR8qRj0Us/hqdefault.jpg,en,en,False,341,PT5M41S,hd,False,True,False,False,894074,4655,3
rNPbfb4xMOs,TZ,2026-01-15T02:33:17.656014+00:00,2026-01-14T14:01:28Z,Mabantu - Call me(Official Music Video),Mabantu - Call me(Official Music Video),MabantuOfficial,UCWTYYBw7jEtdQ29RnNOVSMg,10,Music,"Mabantu, Mguu pande, Afro Pop, AfroPop, Tanzania",5,https://i.ytimg.com/vi/rNPbfb4xMOs/hqdefault.jpg,en,sw,False,195,PT3M15S,hd,False,True,False,False,14374,1148,128
9-bxPe_HlMs,TZ,2026-01-15T02:33:17.656021+00:00,2026-01-10T19:58:17Z,STEAL A BRAINROT GIVEAWAY LIVE | STEAL A BRAINROT FREE SECRETS + FREE BRAINROT GODS,STEAL A BRAINROT GIVEAWAY LIVE | STEAL A BRAINROT FREE SECRETS + FREE BRAINROT GODS,Joxy,UC3DlDcaefUYr-1skxaiLxVw,20,Gaming,"steal a brainrot giveaway, steal a brainrot giveaway live, steal a brainrot secret giveaway, steal a brainrot live giveaway, steal a brainrot brainrot god giveaway, steal a brainrot stream, steal a brainrot live, steal a brainrot 24/7 stream, steal a brainrot, steal a brainrot god, w steal a brainrot, steal a brainrot game, steal a brainrot gifting, steal a brainrot mod, steal a brainrot glitch, steal a brainrot 24/7, roblox steal a brainrot, steal a brainrot roblox",18,https://i.ytimg.com/vi/9-bxPe_HlMs/hqdefault.jpg,en,en,False,13,PT13S,hd,False,True,False,False,1220134,21171,77
Nr7mWfr-qWc,TZ,2026-01-15T02:33:17.656028+00:00,2025-12-21T21:01:47Z,Usiniache,Usiniache,Licky Tones - Topic,UCw2PnD33osG4KgEbyIdns8g,10,Music,"Licky Tones, Usiniache",2,https://i.ytimg.com/vi/Nr7mWfr-qWc/hqdefault.jpg,en,sw,False,186,PT3M6S,hd,False,True,False,False,533845,5972,0
UByiS59AFmQ,TZ,2026-01-15T02:33:17.656035+00:00,2026-01-11T22:15:31Z,🔴EN DIRECT : Barcelone Contre Real Madrid Finale de la Supercoupe d'Espagne Simulation eFootball PES,🔴EN DIRECT : Barcelone Contre Real Madrid Finale de la Supercoupe d'Espagne Simulation eFootball PES,Peace life change,UCglA012N--MjAWWGB_CQg9A,20,Gaming,,0,https://i.ytimg.com/vi/UByiS59AFmQ/hqdefault.jpg,en-GB,en,False,14419,PT4H19S,hd,False,True,False,False,355430,1421,0
mrV8kK5t0V8,TZ,2026-01-15T02:33:17.656042+00:00,2026-01-09T05:01:04Z,Bruno Mars - I Just Might [Official Music Video],Bruno Mars - I Just Might [Official Music Video],Bruno Mars,UCoUM-UJ7rirJYP8CQ0EIaHA,10,Music,"bruno mars, bruno, atlantic records, official video, pop music, R&B, funk, soul, Bruno Mars - I Just Might [Official Music Video], bruno mars i just might, i just might bruno mars, i just might, bruno mars new music, bruno mars new song, mars, bruno mars album, just, might, just might, bruno mars the romantic, the romantic, the romantic bruno mars",22,https://i.ytimg.com/vi/mrV8kK5t0V8/hqdefault.jpg,en,en,False,213,PT3M33S,hd,False,True,False,False,25647595,999387,46386
V1BD4nCckbo,TZ,2026-01-15T02:33:17.656050+00:00,2026-01-13T17:00:06Z,NIGERIA vs MAROC DEMI-FINALE | Séance de tirs au but CAN 2025 | eFootball PES,NIGERIA vs MAROC DEMI-FINALE | Séance de tirs au but CAN 2025 | eFootball PES,KYRGYZ PUBG,UCmgLrmSvU8lVTrKRd1OgZ7Q,20,Gaming,"Séance de tirs au but Nigeria vs Maroc, Coupe d'Afrique des Nations CAF Nigeria vs Maroc, Coupe d'Afrique des Nations CAF 2025, Nigeria vs Maroc 2025, Gameplay Nigeria vs Maroc, Séance de tirs au but complète Nigeria vs Maroc, PES 2021, eFootball PES 2021",8,https://i.ytimg.com/vi/V1BD4nCckbo/hqdefault.jpg,en,fr,False,346,PT5M46S,hd,False,True,False,False,235557,391,22
-QnHvaRgizk,TZ,2026-01-15T02:33:17.656057+00:00,2026-01-09T09:38:21Z,Neema Gospel Choir - Umenibeba Cover (Live)// WORSHIP IN SPIRIT ,Neema Gospel Choir - Umenibeba Cover (Live)// WORSHIP IN SPIRIT ,Neema Gospel Choir,UCMcoM_5waiFEbTgUsKApPdQ,10,Music,,0,https://i.ytimg.com/vi/-QnHvaRgizk/hqdefault.jpg,sw,sw,False,707,PT11M47S,hd,False,True,False,False,40387,1678,155
F-tUo14MPqI,TZ,2026-01-15T02:33:17.656064+00:00,2026-01-14T19:27:20Z,🔴Live : Senegal vs Egypt | Africa Cup of Nations - Semi-finals | Video Game Simulation,🔴Live : Senegal vs Egypt | Africa Cup of Nations - Semi-finals | Video Game Simulation,GameOn Rohan,UCnrEqCMuJTs4ce_DulEhx4Q,20,Gaming,,0,https://i.ytimg.com/vi/F-tUo14MPqI/hqdefault.jpg,en,en,False,4629,PT1H17M9S,hd,False,True,False,False,27848,36,0
W6aYvziGolA,TZ,2026-01-15T02:33:17.656071+00:00,2026-01-11T12:00:58Z,Jux - See Body (Visualizer),Jux - See Body (Visualizer),JUX,UCFVUvRFGEA-m6tb_I8fZgXA,10,Music,,0,https://i.ytimg.com/vi/W6aYvziGolA/hqdefault.jpg,en,en,False,153,PT2M33S,hd,False,True,False,False,86695,3221,771
m9g8JaTPuis,TZ,2026-01-15T02:33:17.656078+00:00,2026-01-11T23:14:53Z,🟢 BARCELONA CAMPEÓN DE LA SUPERCOPA DE ESPAÑA DESPUÉS DE VENCER AL REAL MADRID ,🟢 BARCELONA CAMPEÓN DE LA SUPERCOPA DE ESPAÑA DESPUÉS DE VENCER AL REAL MADRID ,VERDOLAGA TV,UCUhh5pPI5KocjpuwJ1dHx_g,17,Sports,"Real Madrid vs Barcelona hoy, Real Madrid vs Barcelona ver, Real Madrid en vivo, Barcelona en vivo, partido de Barcelona en vivo, Real Madrid, Barcelona vs Real Madrid, Barcelona Real Madrid, Barcelona Real Madrid hoy, ver Real Madrid Barcelona, Partido del Real Madrid, Mbappe, ESPN, DirecTV, Partido de Real Madrid, En vivo Real Madrid, Yamal, noticias del verde, cabala futbolera, futbol digital, supercopa, final, supercopa de españa, final supercopa, partido real madrid barcelona",25,https://i.ytimg.com/vi/m9g8JaTPuis/hqdefault.jpg,es,es-419,False,14176,PT3H56M16S,hd,False,True,False,False,2058991,11176,20
4IRQWhZfuoE,TZ,2026-01-15T02:33:17.656086+00:00,2026-01-09T05:00:06Z,Mathias Walichupa - Sijali (feat. Obby Alpha) [Official Music Video],Mathias Walichupa - Sijali (feat. Obby Alpha) [Official Music Video],Mathias Walichupa,UCwN1FpBCin6Srh5XlpOAn3g,10,Music,"Gospel Hit, Mathias Walichupa, Sijali, Obby Alpha, Swahili, Bora Kushukuru, Niokoe, Ni Wewe, Amen",9,https://i.ytimg.com/vi/4IRQWhZfuoE/hqdefault.jpg,en,sw,False,265,PT4M25S,hd,False,True,False,False,40161,1573,182
Yo79v4iR1jA,TZ,2026-01-15T02:33:17.656093+00:00,2026-01-14T19:07:54Z,🔴Senegal 1 - 0 Egypt Score ⚽ Africa Cup of Nations Commentary Score Video Simulation Game Pes 2021,🔴Senegal 1 - 0 Egypt Score ⚽ Africa Cup of Nations Commentary Score Video Simulation Game Pes 2021,REY DEPORTIVO,UC2dIOBUj2eIUOb0GJ4LmNnQ,17,Sports,"Senegal vs Egypt live, Senegal vs Egypt live stream, Senegal vs Egypt match, Senegal vs Egypt live game, Senegal vs Egypt with video, Senegal vs Egypt live online, Senegal vs Egypt free online, where to watch Senegal vs Egypt live, Senegal vs Egypt live today, watch live Senegal vs Egypt, watch Senegal vs Egypt free, live Senegal vs Egypt, live match Senegal vs Egypt, Senegal vs Egypt live free, King of Sports, Senegal vs Egypt, Senegal vs, Senegal, Egypt, Egypt live",20,https://i.ytimg.com/vi/Yo79v4iR1jA/hqdefault.jpg,en,es-419,False,7127,PT1H58M47S,hd,False,True,False,False,115992,245,0
H1ZGioVdR8Y,TZ,2026-01-15T02:33:17.656101+00:00,2025-12-24T16:36:37Z,Whozu ft Billnass - Inakuhuu? {Lyrics Video},Whozu ft Billnass - Inakuhuu? {Lyrics Video},Whozu,UCxScsQvbRpMwnCrCVr4WxcQ,10,Music,"Whozu, Inakuhuu, Whozu ft Billnass, Tanzania, #viral, #Shorts2025, #TrendingNow, #makeuptutoria, #learning, #cook, #bongoflavour, Diamond Platnumz, Alikiba, Trending, mbosso, joti, zuchu, lavalava, Jaymelody, Marioo, gigy money, wema sepetu, Nanga, CAF25, Simba, Yanga, Alikamwe, Ahmed ally, Luludiva, feitoto, sasampa, oluwa, mpanzu, UEFA, Simulizi, Crown media, Clouds media, Millard Ayo, Carrymastory, CCM, Chadema, Kimara, Rais Samia, Maandamano, Mangekimambi, Malaya, Matako, Singeli, Christmass, Hollyday, NBC, EPL, Amapiano, sex",54,https://i.ytimg.com/vi/H1ZGioVdR8Y/hqdefault.jpg,en,sw,False,200,PT3M20S,hd,False,True,False,False,241152,4703,1092
