video_id,country,fetched_at,published_at,title,localized_title,channel_title,channel_id,category_id,category_name,tags,tag_count,thumbnail,default_language,audio_language,is_live,duration,duration_raw,definition,caption_available,licensed_content,embeddable,made_for_kids,views,likes,comments
xnkaYIzW-YY,TZ,2026-01-15T02:33:17.656109+00:00,2026-01-09T18:47:13Z,MALI - SENEGAL EN DIRECT🔴/ Coupe d'Afrique des Nations 2026 1/4 DE FINALE / CAN 2025 / SIMULATION,MALI - SENEGAL EN DIRECT🔴/ Coupe d'Afrique des Nations 2026 1/4 DE FINALE / CAN 2025 / SIMULATION,AFIZA FOOTBALL LIVE,UCm8mkMIoJ_-8hI1_93aY7Pw,20,Gaming,"mali vs sénégal en direct, mali contre sénégal live, coupe d'afrique des nations 2025 2026 en direct, can 2025 2026 live, mali sénégal match en direct, regarder mali vs sénégal, football africain en direct, match aujourd’hui afrique, mali équipe nationale, sénégal équipe nationale, can live streaming, afrique football live, mali vs sénégal can, match de football en direct, coupe d'afrique des nations live, demi finale can, grand match afrique, mali sénégal highlights",18,https://i.ytimg.com/vi/xnkaYIzW-YY/hqdefault.jpg,en,en,False,9243,PT2H34M3S,hd,False,True,False,False,89006,236,0
PIzi-UPFaX0,TZ,2026-01-15T02:33:17.656116+00:00,2026-01-08T13:53:13Z,Mbosso - Room Number 3 Acoustic,Mbosso - Room Number 3 Acoustic,Mbosso,UCuqG1YHwV5wLltChmEvsQPw,10,Music,"mbosso, watakubali, shida, nimekuzoea, alele, nadekezwa, zilipendwa, kwangwaru, wasafi, harmonize, rayvanny, iyena, gundu, sikomi, nipepee, jibebe, konki, nyegezi, hodari, tetema, tamu, kainama, diamond platnumz, lava lava, zima feni, ashua, amaboko, yope remix, haijakaa sawa, tamba, magufuli, ccm",32,https://i.ytimg.com/vi/PIzi-UPFaX0/hqdefault.jpg,en,en,False,1100,PT18M20S,hd,False,False,False,False,92912,3671,257
R3yeHZanGPQ,TZ,2026-01-15T02:33:17.656124+00:00,2026-01-09T22:05:48Z,🔴 Mali vs Sénégal EN DIRECT  | Mali vs Senegal live streaming  | eFootball Simulation Gameplay PC,🔴 Mali vs Sénégal EN DIRECT  | Mali vs Senegal live streaming  | eFootball Simulation Gameplay PC,Alhadath-tv الحدث,UC7g9maLTII5auYLYlpc0F5g,22,People & Blogs,"Sénégal vs Mali, Mali vs Senegal, sénégal vs mali, Mali vs Senegal live, mali vs sénégal, مالي ضد السنغال, مباراة المنتخب المالي, ملخص مباراة مالي اليوم, موعد مباراة مالي القادمة, بث مباشر, مالي اليوم, مباراه مالي اليوم, مالي السنغال مباشر, مالي و السنغال, مالي والسنغال, السنغال و مالي, مالي السنغال بث مباشر, mali vs sénégal EN DIRECT",18,https://i.ytimg.com/vi/R3yeHZanGPQ/hqdefault.jpg,ar,ar,False,8423,PT2H20M23S,hd,False,True,False,False,285196,519,0
aVlmhNdr4Fc,TZ,2026-01-15T02:33:17.656132+00:00,2025-12-31T10:49:52Z,Wewe ni Sababu ya Maisha yangu,Wewe ni Sababu ya Maisha yangu,WorshipWithCorry - Topic,UC1HRgrYaOQOQSGK9pofaKYA,10,Music,"WorshipWithCorry, Worship With Corry, Wewe ni Sababu ya Maisha yangu",3,https://i.ytimg.com/vi/aVlmhNdr4Fc/hqdefault.jpg,sw,en,False,210,PT3M30S,hd,False,True,False,False,108154,1217,0
gHmurWhFtiY,TZ,2026-01-15T02:33:17.656139+00:00,2026-01-11T22:46:29Z,🔴Barcelona vs Real Madrid EN VIVO⚽ Final Supercopa 2026 Partido Completo - Videojuegos de Simulación,🔴Barcelona vs Real Madrid EN VIVO⚽ Final Supercopa 2026 Partido Completo - Videojuegos de Simulación,Guest YT,UC4XlVqDR7MH20nZrTXFobPQ,17,Sports,"en vivo barcelona vs real madrid, barcelona vs real madrid supercopa 2025/2026, barcelona vs real madrid, barcelona vs real madrid final, fc barcelona vs real madrid, barcelona vs real madrid en vivo, barcelona, real madrid, barcelona vs real madrid hoy, el clasico, real, supercopa, 24/25, fútbol, transmisión, en vivo, puntuación en vivo",17,https://i.ytimg.com/vi/gHmurWhFtiY/hqdefault.jpg,es,id,False,8526,PT2H22M6S,hd,False,True,False,False,217165,941,1
8JZZvo-gJaU,TZ,2026-01-15T02:33:17.656146+00:00,2025-12-12T16:00:06Z,"TxC, Davido, Shoday & Scotts Maphuma - Nakupenda (Official Music Video) feat. Zlatan & Al Xapo","TxC, Davido, Shoday & Scotts Maphuma - Nakupenda (Official Music Video) feat. Zlatan & Al Xapo",TXC,UCu4Uqt9BnKo1OT5h3K5qlrA,10,Music,"TXC Davido Zlatan Nakupenda, Nakupenda Davido Shoday TXC, TxC, Davido & Zlatan - Nakupenda (Official Music Video) feat. Scotts Maphuma, Shoday & Al Xapo, Shoday Nakupenda Davido, TikTok Dance, South Africa, Nigeria, TXC Davido Yebo, Dance Challenge, amapiano, txc, southafrica, africa, tarryntxc, clairisetxc, dj, dj duo, unclewaffles, london, tyla, tems, tyla water, amapianovibes, afrobeats, newmusic, africanow, turnoffthelights, colored, TXC Woza Lana, woza lana txc",32,https://i.ytimg.com/vi/8JZZvo-gJaU/hqdefault.jpg,en,en,False,334,PT5M34S,hd,False,True,False,False,6058261,78797,6396
9VexZRdmmJI,TZ,2026-01-15T02:33:17.656154+00:00,2026-01-13T19:11:11Z,Sénégal vs Égypte – Coupe d’Afrique des Nations Demi-finale | Simulation PES21 Gameplay,Sénégal vs Égypte – Coupe d’Afrique des Nations Demi-finale | Simulation PES21 Gameplay,Billu Football Club,UCbjm89OBKXvNN3wKKWRNuNQ,20,Gaming,,0,https://i.ytimg.com/vi/9VexZRdmmJI/hqdefault.jpg,en,zxx,False,12325,PT3H25M25S,hd,False,True,False,False,172766,400,4
