video_id,country,fetched_at,published_at,title,localized_title,channel_title,channel_id,category_id,category_name,tags,tag_count,thumbnail,default_language,audio_language,is_live,duration,duration_raw,definition,caption_available,licensed_content,embeddable,made_for_kids,views,likes,comments
-23_sw4Y5F0,JM,2025-12-22 02:34:28.681657+00:00,2025-12-12 04:45:45+00:00,Masicka - Death Row (Official Audio),Masicka - Death Row (Official Audio),Masicka,UCOSJVk71utzoCmRxzcfhM-A,10,Music,"Masicka, Dancehall, Jamaica, Jamaican, Dancehall King, Dancehall Nation, Dancehall Official, Teejay, Jah Vinci",9,https://i.ytimg.com/vi/-23_sw4Y5F0/hqdefault.jpg,en,en,False,181,PT3M1S,hd,False,True,,,1087811,36742,10832
BwdMT-OiARI,JM,2025-12-22 02:34:28.681696+00:00,2025-12-21 06:45:01+00:00,Black Clover Second Season | Official Trailer 2 | Crunchyroll,Black Clover Second Season | Official Trailer 2 | Crunchyroll,Crunchyroll,UC6pGDc4bFGD1_36IKv3FnYg,1,Film & Animation,"black clover, black clover anime, black clover season 2, black clover s2, black clover second season, crunchyroll, anime, anime trailer, anime preview",9,https://i.ytimg.com/vi/BwdMT-OiARI/hqdefault.jpg,en,ja,False,110,PT1M50S,hd,False,True,,,1621968,145782,8399
31Pek0aIpEI,JM,2025-12-22 02:34:28.681708+00:00,2025-12-21 02:30:06+00:00,CONTROL REWORK TRAILER + SHOWCASE | Blox Fruits,CONTROL REWORK TRAILER + SHOWCASE | Blox Fruits,Gamer Robot,UC_xlDCBWQPlihORIZLWtpbA,20,Gaming,"blox fruits, admin, zioles, blox fruits admin, admin command, abusive admin, roblox, robux, trolling, troll, gift, indra, blox fruits update, blox fruits update 20, update 20, gamer robot, mygame43, blox fruits update 19, roblox blox fruits, family friendly, no cursing, blox fruit, blox fruits noob to pro, anime, race v4, cdk, soul guitar, leveling guide, blox fruits new code, new code, blox fruits code, pvp, el krazy, undercover admin, leaks, sneak peek, secret ability",37,https://i.ytimg.com/vi/31Pek0aIpEI/hqdefault.jpg,en,en,False,902,PT15M2S,hd,False,True,,,3265922,205171,44992
-LIbQYd8Mmw,JM,2025-12-22 02:34:28.681718+00:00,2025-12-18 20:09:36+00:00,Tommy Lee Sparta - Outside Brawling | Official Music Video,Tommy Lee Sparta - Outside Brawling | Official Music Video,TommyLeeSpartaVEVO,UCf7WOF7QcF5dWpUUU225JgQ,10,Music,"dancehall, reggae, onerpm, Music, official, audio, video, jamaica, reggae music, dancehall 2025 mix, new music, trop life, dancehall music, reggae 2025, trending, jamaican, caribbean music, trinidad and tobago, trap, best dancehall, trending music, YouTube music, 2025",23,https://i.ytimg.com/vi/-LIbQYd8Mmw/hqdefault.jpg,en,en,False,182,PT3M2S,hd,False,True,,,389705,24804,2761
ASobpXYYoVQ,JM,2025-12-22 02:34:28.681725+00:00,2025-12-21 06:32:36+00:00,Official Teaser Trailer | BLEACH: Thousand-Year Blood War Final Part - The Calamity | VIZ,Official Teaser Trailer | BLEACH: Thousand-Year Blood War Final Part - The Calamity | VIZ,vizmedia,UCV1da9peoqEwqr45bpTJsbQ,1,Film & Animation,"viz media, anime, official, manga, bleach, bleach thousand-year blood war, bleach tybw, bleach final part, bleach tybw part 4, bleach op, bleach ed, bleach ending, bleach final cour, bleach finale, bleach ichigo, ichigo bleach, ichigo final form, final form ichigo, bleach final part teaser, bleach final part trailer, bleach viz final part",21,https://i.ytimg.com/vi/ASobpXYYoVQ/hqdefault.jpg,en,en,False,124,PT2M4S,hd,False,True,,,875719,75241,3011
vVYtOTPZ1uk,JM,2025-12-22 02:34:28.681733+00:00,2025-12-21 14:01:35+00:00,We Went To The EDGE OF THE MAP In GTA 5...,We Went To The EDGE OF THE MAP In GTA 5...,TechyCrew,UCTU3m4rCUS-7qXuHK-j9Uqw,20,Gaming,"Techy, TechyCrew, Among Us, Fortnite, Fortnite Creative, Roblox, Techy Roblox, Among Us Roles",8,https://i.ytimg.com/vi/vVYtOTPZ1uk/hqdefault.jpg,en,en,False,987,PT16M27S,hd,False,True,,,189739,4327,466
TFimCjihfjg,JM,2025-12-22 02:34:28.681741+00:00,2025-12-13 20:00:07+00:00,Jamal - Faada (Official Music Video),Jamal - Faada (Official Music Video),JamalOfficialVEVO,UCoouxJp5xAqlJkfDAdmdU2w,10,Music,"Jamal, Zojak Worldwide, Dancehall",3,https://i.ytimg.com/vi/TFimCjihfjg/hqdefault.jpg,ms,en,False,172,PT2M52S,hd,False,True,,,461585,12429,689
e0Eo0D038rQ,JM,2025-12-22 02:34:28.681749+00:00,2025-12-15 13:40:00+00:00,Stranger Things 5 | Volume 2 Trailer | Netflix,Stranger Things 5 | Volume 2 Trailer | Netflix,Netflix,UCWOA1ZGywLbqmigxE4Qlvuw,24,Entertainment,"Caleb McLaughlin, Charlie Heaton, Chief Hopper, David Harbour, Dustin, Eleven, Finn Wolfhard, Gaten Matarazzo, Jamie Campbell Bower, Joe Keery, Jonathan Byers, Joyce Byers, Lucas, Max, Maya Hawke, Mike Wheeler, Millie Bobby Brown, Nancy Wheeler, Natalia Dyer, Netflix, Noah Schnapp, Robin Buckley, Sadie Sink, Steve Harrington, Stranger Things 5, Will Byers, Winona Ryder",27,https://i.ytimg.com/vi/e0Eo0D038rQ/hqdefault.jpg,en,en-US,False,134,PT2M14S,hd,True,True,,,14776222,577358,23513
ODhUyM9dxu8,JM,2025-12-22 02:34:28.681781+00:00,2025-12-21 17:00:41+00:00,"Extreme Hide & Seek In Rivals, But I Used GLITCHES To Win...","Extreme Hide & Seek In Rivals, But I Used GLITCHES To Win...",More Techy,UCzlUw75H5ILJ2l_ackxyI6A,20,Gaming,"roblox, funnyroblox, techyblox, techy, crazy fan girls, crazy fan girl, my crazy fan girls, girlfriend, roblox girlfriend",9,https://i.ytimg.com/vi/ODhUyM9dxu8/hqdefault.jpg,en,en,False,823,PT13M43S,hd,False,True,,,174550,3543,298
_b98agqsHIA,JM,2025-12-22 02:34:28.681792+00:00,2025-12-17 23:00:00+00:00,"Silk Boss, Dj Mac - Pull Up (Official Music Video) | WYFL RIDDIM","Silk Boss, Dj Mac - Pull Up (Official Music Video) | WYFL RIDDIM",SilkbossVEVO,UC9raRuJRBDkWwv34UgkLutA,10,Music,"Silk Boss, Dj Mac, DJ Mac Music, Dancehall",4,https://i.ytimg.com/vi/_b98agqsHIA/hqdefault.jpg,en,en,False,139,PT2M19S,hd,False,True,,,255993,13488,606
YqdAEdkHrwo,JM,2025-12-22 02:34:28.681800+00:00,2025-12-11 16:59:07+00:00,Supergirl | Official Teaser Trailer,Supergirl | Official Teaser Trailer,DC,UCiifkYAs_bq1pt_zbNAzYGg,24,Entertainment,"DC, DC Comics, DC Universe, DCU, Superman, James Gunn, super heroes, movie, Supergirl, superman 2025, dcu timeline, superman scene, superman krypto, krypto the superdog, lex luthor, krypto, superman 2025 scene, supergirl woman of tomorrow, supergirl scene superman 2025, supergirl cameo superman, supergirl in superman 2025, milly alcock, supergirl, supergirl movie, supergirl 2026, supergirl trailer, supergirl trailer reaction, supergirl trailer breakdown, supergirl milly alcock",29,https://i.ytimg.com/vi/YqdAEdkHrwo/hqdefault.jpg,en,en,False,123,PT2M3S,hd,False,True,,,16040249,377233,21102
2ITzIazwh3Y,JM,2025-12-22 02:34:28.681808+00:00,2025-12-15 19:02:25+00:00,yes. i literally beat the game. in this video. pls watch.,yes. i literally beat the game. in this video. pls watch.,CoryxKenshin,UCiYcA0gJzg855iSKMrX3oHg,20,Gaming,"re4, resident evil, requiem, news, leon, resident evil 4, game, gameplay, walkthrough, playthrough, ashley, hardcore, full game, coryxkenshin, cory, kenshin, funny, hilarious, moments, reaction, yes, literally, beat, the, video",25,https://i.ytimg.com/vi/2ITzIazwh3Y/hqdefault.jpg,en,en-US,False,11640,PT3H14M,hd,False,True,,,4644228,272632,19429
llyL60rMDNk,JM,2025-12-22 02:34:28.681816+00:00,2025-12-08 21:01:04+00:00,"Chronic Law, Dj Mac - Badness Upgrade 2.0  (Official Music Video) | WYFLRIDDIM","Chronic Law, Dj Mac - Badness Upgrade 2.0  (Official Music Video) | WYFLRIDDIM",ChronicLawVEVO,UCXSHOjS30YMaGRgwuuxBfLw,10,Music,"Chronic Law, Dj Mac, DJ Mac Music, Dancehall",4,https://i.ytimg.com/vi/llyL60rMDNk/hqdefault.jpg,en,en,False,139,PT2M19S,hd,False,True,,,1617312,36451,1439
9VPSFxU-Jq8,JM,2025-12-22 02:34:28.681824+00:00,2025-12-21 14:53:33+00:00,Speed does Africa 🌍 (Official Trailer),Speed does Africa 🌍 (Official Trailer),IShowSpeed,UCWsDFcIhY2DBi3GB5uykGXA,20,Gaming,ishowspeed,1,https://i.ytimg.com/vi/9VPSFxU-Jq8/hqdefault.jpg,en,en,False,77,PT1M17S,hd,False,True,,,745915,64535,11232
Ql0qbv-51bc,JM,2025-12-22 02:34:28.681831+00:00,2025-12-21 21:15:03+00:00,The ONE RARITY Challenge In Steal A Brainrot With MY CRAZY FAN GIRLS…,The ONE RARITY Challenge In Steal A Brainrot With MY CRAZY FAN GIRLS…,Techy Plays,UCNDzLI-hyihpAx3zKtwhGZw,20,Gaming,"roblox, brookhaven, funnyroblox, techyblox, techy, crazy fan girls, crazy fan girl, my crazy fan girls",8,https://i.ytimg.com/vi/Ql0qbv-51bc/hqdefault.jpg,en,en,False,784,PT13M4S,hd,False,True,,,73368,1956,281
-NJ4B1_NVLk,JM,2025-12-22 02:34:28.681838+00:00,2025-12-19 22:00:00+00:00,Alkaline - Key Man (Official Music Video),Alkaline - Key Man (Official Music Video),AlkalineVEVO,UChKGMC6dXos_9Bry2e8iSdw,10,Music,"Alkaline, Xclusive Management, Reggae, Dancehall",4,https://i.ytimg.com/vi/-NJ4B1_NVLk/hqdefault.jpg,en,en,False,185,PT3M5S,hd,False,True,,,253126,21705,2786
VI6XO8EijT4,JM,2025-12-22 02:34:28.681846+00:00,2025-12-05 20:00:28+00:00,DIGITAL CIRCUS EP 7 TRAILER!!,DIGITAL CIRCUS EP 7 TRAILER!!,GLITCH,UCn_FAXem2-e3HQvmK-mOH4g,1,Film & Animation,"glitch, glitch productions, digital circus, the amazing digital circus, murder drones, Pomni, Uzi, Jax, Ragatha, Kinger, Gangle, Zooble, Caine, Bubble, 3D, Animation, 3D Animation, Indie Animation, Gummigoo",19,https://i.ytimg.com/vi/VI6XO8EijT4/hqdefault.jpg,en,en,False,58,PT58S,hd,True,True,,,13363800,638494,34785
3BLoozf3MlM,JM,2025-12-22 02:34:28.681853+00:00,2025-12-21 19:20:14+00:00,Minecraft Speedrunner VS 2 Hunters REVIVAL,Minecraft Speedrunner VS 2 Hunters REVIVAL,Dream,UCTkXRDQl0luXxVQrRQvWS6w,20,Gaming,"minecraft, dream, dream minecraft",3,https://i.ytimg.com/vi/3BLoozf3MlM/hqdefault.jpg,en,en,False,1939,PT32M19S,hd,True,True,,,1127378,90614,7309
Rc4ekfm-MIU,JM,2025-12-22 02:34:28.681861+00:00,2025-12-18 22:00:27+00:00,"Adofo, Rich Pree - Check Eh Stats | Official Music Video | Ambient Light Riddim |","Adofo, Rich Pree - Check Eh Stats | Official Music Video | Ambient Light Riddim |",AdofoVEVO,UC_YxV29Z1uruFdiLy4hUL6Q,10,Music,"onerpm, dancehall, dancehall 2025, reggae, reggae 2025, dancehall trending, reggae trending, youtube trending, trending music 2025, 2025",10,https://i.ytimg.com/vi/Rc4ekfm-MIU/hqdefault.jpg,en,en,False,157,PT2M37S,hd,False,True,,,68733,4502,266
Fv0leN8TmR8,JM,2025-12-22 02:34:28.681868+00:00,2025-12-07 00:00:04+00:00,The Boys - Final Season Teaser Trailer | Prime Video,The Boys - Final Season Teaser Trailer | Prime Video,Prime Video,UCQJWtTnAHhEG5w4uN0udnUQ,24,Entertainment,"the boys, the boys season 5, the boys s5, the boys season 5 trailer, the boys season 5 teaser, the boys s5 trailer, the boys s5 teaser, the boys soldier boy, the boys homelander, the boys butcher, homelander, butcher, soldier boy, starlight, hughie, homelander vs butcher, butcher vs homelander, homelander vs soldier boy, the boys final season, the boys final season trailer, antony starr, karl urban, jensen ackles, erin moriarty, jack quaid, chace crawford, jared padalecki",27,https://i.ytimg.com/vi/Fv0leN8TmR8/hqdefault.jpg,en,en,False,121,PT2M1S,hd,True,True,,,8822796,339737,17799
1GiEjt2D5Fc,JM,2025-12-22 02:34:28.681876+00:00,2025-12-20 20:07:41+00:00,How i got Arrested...,How i got Arrested...,Royalty Gaming,UCemhZ2At2lgifTJLClGCz9A,20,Gaming,"royalty gaming, royalty family gaming, ferran gaming, ferran gaming channel, royalty gaming channel, royalty, gaming, video games, royal, ali, ferran, royalty palace, ferran ali, ferran one shot, ali ferran, challenge, the royalty family, royalty family, roblox, ferran roblox, royalty family roblox, jordan matter, dhar maan, rebecca zamolo, girlfriend, fortnite, v bucks, ferran fortnite, i played fortnite, I Played EVERY Fortnite Rip-Off, fortnite ripoff, rip-off",32,https://i.ytimg.com/vi/1GiEjt2D5Fc/hqdefault.jpg,en,en,False,918,PT15M18S,hd,False,True,,,985563,13125,2315
g8LmHolA2DQ,JM,2025-12-22 02:34:28.681883+00:00,2025-12-18 22:12:17+00:00,Malie Donn - Timeout (Official Music Video),Malie Donn - Timeout (Official Music Video),Malie Donn ,UCxIzooNKNMPxZgn3xMDj_Jg,10,Music,,0,https://i.ytimg.com/vi/g8LmHolA2DQ/hqdefault.jpg,en,en,False,148,PT2M28S,hd,False,False,,,263749,19220,412
YCgSikS3qoo,JM,2025-12-22 02:34:28.681890+00:00,2025-12-20 21:02:04+00:00,Steal a Brainrot UPDATE + New BRAINROTS!,Steal a Brainrot UPDATE + New BRAINROTS!,CaylusBlox,UCsPMNatXCwqyUuJilBT73jg,20,Gaming,"caylusblox, caylus roblox, caylus, roblox, Steal a brainrot update, ADMIN ABUSE In Steal a Brainrot!, Steal a Brainrot UPDATE + Admin Abuse, admin abuse, steal a brainrot, caylus admin abuse, steal a brainrot update, tung tung tung sahur, tung tung sahur steal a brainrot, santa fuse machine, caylus fuse machine, caylus steak, caylus steal a brainrot christmas, taco tuesday, caylus stream, radioactive base, north pole, steal a brainrot north pole, caylus steal a brainrot",23,https://i.ytimg.com/vi/YCgSikS3qoo/hqdefault.jpg,en-US,en-US,False,4679,PT1H17M59S,hd,False,True,,,2924776,39239,1299
yj3iiQ1fX4c,JM,2025-12-22 02:34:28.681899+00:00,2025-12-10 05:01:14+00:00,Jahshii - AKtion (Official Video),Jahshii - AKtion (Official Video),JahshiiMusic,UCrLar1K8tHn5Lg-cAm_5Kcw,10,Music,,0,https://i.ytimg.com/vi/yj3iiQ1fX4c/hqdefault.jpg,en,en,False,166,PT2M46S,hd,False,False,,,530268,22573,3943
s6N0TItzpfQ,JM,2025-12-22 02:34:28.681906+00:00,2025-12-18 15:01:37+00:00,I Found Scary Buried BRAINROT in Minecraft!,I Found Scary Buried BRAINROT in Minecraft!,Cash,UC0eLBYhxW9HC0P9PXQ73mpQ,24,Entertainment,"Cash, Nico, Nico and Cash, Cash and Nico, Minecraft, Minecraft mod, family friendly, kid friendly, I Found Scary Buried BRAINROT in Minecraft!",9,https://i.ytimg.com/vi/s6N0TItzpfQ/hqdefault.jpg,en,en-US,False,1109,PT18M29S,hd,False,True,,,692881,5518,837
f0926OsTUP4,JM,2025-12-22 02:34:28.681914+00:00,2025-12-18 20:00:37+00:00,Feloni19 - Check Mi Out ( Official Music Video),Feloni19 - Check Mi Out ( Official Music Video),FelonyOfficialVEVO,UCWWLIGrqINxQYJg79BHOI2g,10,Music,"dancehall, reggae, onerpm, Music, official, audio, video, jamaica, reggae music, dancehall 2025 mix, new music, trop life, dancehall music, reggae 2025, trending, jamaican, caribbean music, trinidad and tobago, trap, best dancehall, trending music, YouTube music, 2025",23,https://i.ytimg.com/vi/f0926OsTUP4/hqdefault.jpg,en,en,False,181,PT3M1S,hd,False,True,,,52131,3542,133
qQp3y37zvok,JM,2025-12-22 02:34:28.681921+00:00,2025-12-19 12:01:46+00:00,I DONT WANNA do my CHORES...,I DONT WANNA do my CHORES...,Techy Plus,UCbhkfMLcRk6ftmQuwnFEIqQ,20,Gaming,"roblox, brookhaven, funnyroblox, techyblox, techy, crazy fan girls, crazy fan girl, my crazy fan girls",8,https://i.ytimg.com/vi/qQp3y37zvok/hqdefault.jpg,en,en,False,1062,PT17M42S,hd,False,True,,,254763,3626,305
hbhAfcua6O4,JM,2025-12-22 02:34:28.681928+00:00,2025-12-20 17:01:13+00:00,Vybz Kartel - Victorious (Official Music Video),Vybz Kartel - Victorious (Official Music Video),VybzKartelVEVO,UCeRe0C1x1w8We6ghjVn4M5w,10,Music,"Vybz Kartel, popcaan, onerpm, dancehall, dancehall 2025, reggae, reggae 2025, dancehall trending, reggae trending, youtube trending, trending music 2025, 2025",12,https://i.ytimg.com/vi/hbhAfcua6O4/hqdefault.jpg,en,pa,False,179,PT2M59S,hd,False,True,,,233535,18454,2122
7KWJhIdqvDI,JM,2025-12-22 02:34:28.681936+00:00,2025-12-21 08:15:38+00:00,Control Rework Update Changed EVERYTHING in Blox Fruits,Control Rework Update Changed EVERYTHING in Blox Fruits,MeEnyu,UCuAeaANgGAzjitp9KCO-qvg,20,Gaming,"roblox, blox fruits, pvp, new fruits, blox fruits live, meenyu, robux, noob, pro, blox fruits troll, trolling, blox fruit gift, blox fruits update, indra, bloxfruits, bloxfruit, noob to pro, max level, event, blox fruit, enyuzee, blox fruits admin, mythical fruit, legendary fruit, kitsune fruit, dream fruit, sword revamp, yoru, tty, admin, anchor, winter update, trex, kitsune, dragon, awakening, awaken, gravity, barrier, falcon, creation, eagle, flame, update 26, zioles, uzoth",46,https://i.ytimg.com/vi/7KWJhIdqvDI/hqdefault.jpg,en,en-US,False,1265,PT21M5S,hd,False,True,,,380330,11145,2668
ZUwJRB6Q-7U,JM,2025-12-22 02:34:28.681943+00:00,2025-12-14 16:00:06+00:00,"Top Banks, Pimpdon -  Life Style  (Official Video)","Top Banks, Pimpdon -  Life Style  (Official Video)",Top banks,UCILLxfSly8QKALJpYrUpAKw,10,Music,,0,https://i.ytimg.com/vi/ZUwJRB6Q-7U/hqdefault.jpg,en,en,False,146,PT2M26S,hd,False,False,,,82542,7592,1301
5Bmn40_XajI,JM,2025-12-22 02:34:28.681950+00:00,2025-12-21 00:00:11+00:00,"Minecraft, But You Can Buy Guns!","Minecraft, But You Can Buy Guns!",Bionic,UCETZ7OiW7-wqwb-6hsz3C4w,20,Gaming,"minecraft, bionic, family friendly, Minecraft But You Can Buy Any Gun, Minecraft but you can buy guns, minecraft with guns, guns in minecraft, challenge, buying guns in minecraft",9,https://i.ytimg.com/vi/5Bmn40_XajI/hqdefault.jpg,en,en,False,1669,PT27M49S,hd,False,True,,,503399,11293,1468
jGhBBi9NCMY,JM,2025-12-22 02:34:28.681957+00:00,2025-12-10 21:01:03+00:00,"Valiant, Dj Mac - OH WHEN (Official Music Video) | WYFLRIDDIM","Valiant, Dj Mac - OH WHEN (Official Music Video) | WYFLRIDDIM",ValiantMusicVEVO,UCY_rCaaNn5XxbDmKB1x-JQg,10,Music,"Valiant, Dj Mac, DJ Mac Music, Dancehall",4,https://i.ytimg.com/vi/jGhBBi9NCMY/hqdefault.jpg,en,en,False,153,PT2M33S,hd,False,True,,,497659,55010,1110
4LEbtHDlf5s,JM,2025-12-22 02:34:28.681964+00:00,2025-12-21 00:33:00+00:00,WHICH SPRUNKI DO I SAVE?,WHICH SPRUNKI DO I SAVE?,Tyler & Snowi,UCzzF1kdBgwv5RB6rbB6kVSA,20,Gaming,"roblox, funny moments, tyler and snowi, tyler, snowi, tyler & snowi, funny, moments, sprunki, incredibox sprunki, sprunki funny moments, sprunki wenda, new, sprunki horror, sprunki crazy, incredibox new mod, incredibox sprunki mod, mod sprunki, castle, sprunki castle games, sprunki castle, heal infected sprunkis, healing infected sprunkis, infected sprunkis, heal the infected sprunkis, heal sprunkis, heal sprunki, heal infected sprunki castle game, heal infected sprunki ending",29,https://i.ytimg.com/vi/4LEbtHDlf5s/hqdefault.jpg,en,en-US,False,1141,PT19M1S,hd,False,True,,,1014343,25297,808
3qz5yaObSv4,JM,2025-12-22 02:34:28.681972+00:00,2025-12-21 20:02:32+00:00,Skippa x Rvssian - Phone Screen | Recovery Riddim (Official Music Video),Skippa x Rvssian - Phone Screen | Recovery Riddim (Official Music Video),Skippa,UCOYDFPQVV7yQJQcXN6rXCvg,10,Music,,0,https://i.ytimg.com/vi/3qz5yaObSv4/hqdefault.jpg,en,en,False,139,PT2M19S,hd,False,True,,,44068,6983,347
zAd6mDrJz-8,JM,2025-12-22 02:34:28.681979+00:00,2025-12-18 18:01:11+00:00,SIDEMEN AMONG US BUT THE IMPOSTOR IS A PEANUT,SIDEMEN AMONG US BUT THE IMPOSTOR IS A PEANUT,MoreSidemen,UCh5mLn90vUaB1PbRRx_AiaA,22,People & Blogs,"sidemen, moresidemen, miniminter, ksi, zerkaa, behzinga, tbjzl, vikkstar, wroetoshaw",9,https://i.ytimg.com/vi/zAd6mDrJz-8/hqdefault.jpg,en,en-GB,False,3939,PT1H5M39S,hd,False,True,,,3512290,124202,6753
3ewijYcyVHU,JM,2025-12-22 02:34:28.681986+00:00,2025-12-19 17:00:07+00:00,Popcaan - One Million Bees (Official Video),Popcaan - One Million Bees (Official Video),PopcaanVEVO,UCYNHmFPVH3ENF_Qdl8OfpXg,10,Music,"popcaan, onerpm, dancehall, dancehall 2025, reggae, reggae 2025, dancehall trending, reggae trending, youtube trending, trending music 2025, 2025",11,https://i.ytimg.com/vi/3ewijYcyVHU/hqdefault.jpg,en,en,False,215,PT3M35S,hd,False,True,,,174349,9733,674
ULoThKd_tpQ,JM,2025-12-22 02:34:28.681994+00:00,2025-12-19 13:01:08+00:00,We Played Jackbox 11 AGAIN...,We Played Jackbox 11 AGAIN...,Techy,UCFmIhbx3_RkwlMLPA4Xv8-w,20,Gaming,"roblox, techy, techy plays, brookhaven, techyblox, techycrew, more techy",7,https://i.ytimg.com/vi/ULoThKd_tpQ/hqdefault.jpg,en,en,False,965,PT16M5S,hd,False,True,,,279677,5539,1456
5AvOR2XFsN0,JM,2025-12-22 02:34:28.682001+00:00,2025-12-20 18:00:07+00:00,Valiant x Rvssian - Passport Princess | Music Video (Recovery Riddim),Valiant x Rvssian - Passport Princess | Music Video (Recovery Riddim),Rvssian,UCgtDkLbESdzKgJT_oB9AVTw,10,Music,"Rvssian, Rvssian Riddim, Head Concussion Records, Russian, Russian Riddim, Reggae (Musical Genre), Konshens (Musical Artist), whine and kotch charly black, wine and kotch charly black, whine & kotch, whine and kotch, Vybz Kartel (Celebrity), russian head concussion, j capri, dancehall 2015, Dancehall (Musical Genre)",16,https://i.ytimg.com/vi/5AvOR2XFsN0/hqdefault.jpg,en,en,False,136,PT2M16S,hd,False,True,,,395730,32443,483
Qz0Mb24XkvI,JM,2025-12-22 02:34:28.682008+00:00,2025-12-19 22:09:36+00:00,BOLOGNA-INTER 4-3 AP | HIGHLIGHTS | Immobile's penalty seals the win | EA SPORTS FC Supercup 2025/26,BOLOGNA-INTER 4-3 AP | HIGHLIGHTS | Immobile's penalty seals the win | EA SPORTS FC Supercup 2025/26,Serie A,UCBJeMCIeLQos7wacox4hmLQ,17,Sports,"Serie A, Dybala, highlights, Juventus, AC Milan, Inter Milan, Napoli, Roma, goals, full highlights, watch, partita, migliori gol, gol del mese, calcio, Italia, lukaku, Lazio, highlights serie a, highlights inter, highlights juventus, highlights milan, highlights juve, highlights roma, lautaro, lautaro martinez, inter, juventus, juve, liga italiana, liga italia, lega italiana, lega italia",33,https://i.ytimg.com/vi/Qz0Mb24XkvI/hqdefault.jpg,it,en,False,190,PT3M10S,hd,False,True,,,1008449,14746,496
16yNt4Rf-Uc,JM,2025-12-22 02:34:28.682015+00:00,2025-12-16 18:14:49+00:00,Tumble Dung,Tumble Dung,Top Banks - Topic,UCoEBv0fFcc5_muM-erGFxfg,10,Music,"Top Banks, DJ MAC, Tumble Dung",3,https://i.ytimg.com/vi/16yNt4Rf-Uc/hqdefault.jpg,en,en,False,119,PT1M59S,hd,False,True,,,34042,1120,0
hT0iogbyY9k,JM,2025-12-22 02:34:28.682022+00:00,2025-12-21 21:55:43+00:00,Can We Survive Inside Daisy's Body?,Can We Survive Inside Daisy's Body?,Johnny Minecraft,UCWVSknuLPIRVGWf-4bFKT4Q,20,Gaming,"Poor vs Rich McDonalds Build Battle!, POOR vs RICH Plane Build Battle!, Never Have I Ever KISSED DAISY!, Playing As KPOP DEMON HUNTER To Troll My Friends on One Block…, family friendly, minecraft mod, cash, no bad words, minecraft, nico and cash, cash and nico, aphmau, cash vs nico, Minecraft, no cussing, here's johnny, heres johnny, johnny, minecraft johnny, johnny minecraft, Using PORTAL MOD to SPY on My CRUSH in Minecraft!, Playing a Stranger Things Lucky Block Race in Minecraft!",22,https://i.ytimg.com/vi/hT0iogbyY9k/hqdefault.jpg,en,en,False,730,PT12M10S,hd,False,True,,,63638,1607,207
EFV0L8gRxZM,JM,2025-12-22 02:34:28.682030+00:00,2025-12-20 23:48:26+00:00,Skillibeng - Titanic (Official Audio),Skillibeng - Titanic (Official Audio),Skillibeng,UCefBhh70GxGOi89otNmji_Q,10,Music,,0,https://i.ytimg.com/vi/EFV0L8gRxZM/hqdefault.jpg,en,und,False,149,PT2M29S,hd,False,False,,,99815,8031,818
n4xdf4zS0XM,JM,2025-12-22 02:34:28.682037+00:00,2025-12-19 12:01:42+00:00,I Upgraded The RAREST BRAINROTS in Steal a Brainrot!,I Upgraded The RAREST BRAINROTS in Steal a Brainrot!,CashBlox,UCY0R0Ck6qK2deVTKkfWJIEA,24,Entertainment,"Cash, Nico, Nico and Cash, Cash and Nico, Minecraft, Minecraft mod, family friendly, kid friendly",8,https://i.ytimg.com/vi/n4xdf4zS0XM/hqdefault.jpg,en,en,False,988,PT16M28S,hd,False,True,,,729909,15259,2116
6i8ed5GT1-0,JM,2025-12-22 02:34:28.682044+00:00,2025-12-17 17:00:18+00:00,"Travis Scott, Tyla, Vybz Kartel - PBT (Official Music Video)","Travis Scott, Tyla, Vybz Kartel - PBT (Official Music Video)",TravisScottVEVO,UClRx3MMyYUyqOxyEqA5F2nQ,10,Music,"jackboys, travis scott, sheck wes, don toliver, cactus jack, cactus jack records, highest in the room, rosalia, lil baby, gang gang, had enough, quavo, offset, what to do?, gatti, pop smoke, out west, out west video, official video, PBT, Tyla Vybz Kartel",21,https://i.ytimg.com/vi/6i8ed5GT1-0/hqdefault.jpg,en,en,False,254,PT4M14S,hd,False,True,,,4223181,224225,6383
DWCl2dN6hpg,JM,2025-12-22 02:34:28.682052+00:00,2025-12-13 17:00:00+00:00,1 Pro vs 500 Hunters,1 Pro vs 500 Hunters,MrBeast Gaming,UCIPPMRA040LQr5QPyJEbmXA,20,Gaming,,0,https://i.ytimg.com/vi/DWCl2dN6hpg/hqdefault.jpg,en,en,False,1069,PT17M49S,hd,True,True,,,14376621,342280,9998
PtnCZfw0iSA,JM,2025-12-22 02:34:28.682058+00:00,2025-12-17 19:00:06+00:00,"Shawn Storm - Mosquito 1, Mosquito 2 (Official Audio)","Shawn Storm - Mosquito 1, Mosquito 2 (Official Audio)",Shawn Storm Official,UCuRYugT7op_l3_DTTHFxLKw,10,Music,,0,https://i.ytimg.com/vi/PtnCZfw0iSA/hqdefault.jpg,en,en,False,121,PT2M1S,hd,False,True,,,78387,5713,997
d6kyE04kTJE,JM,2025-12-22 02:34:28.682065+00:00,2025-12-19 23:00:50+00:00,I Worked at a CURSED Shawarma Kiosk in Roblox...,I Worked at a CURSED Shawarma Kiosk in Roblox...,ItsFunneh,UCUk7VggtJdo9XYTy3Z5QVAw,20,Gaming,"itsfunneh, funneh, funny moments, funny, krew, krew plays, gaming, games, roblox, itsfunneh roblox, youtube itsfunneh, itsfunneh minecraft, itsfunneh krew, itsfunneh videos, no swearing, no cursing, roblox funny moments, roblox roleplay, roblox krew, roblox obby, roblox parkour, roblox escape, roblox funny, roblox funny games, funny roblox, roblox shawarma, roblox shawarma kiosk, shawarma kiosk, itsfunneh shawarma kiosk, midnight shawarma",30,https://i.ytimg.com/vi/d6kyE04kTJE/hqdefault.jpg,en,en-US,False,3200,PT53M20S,hd,False,True,,,667919,19867,2672
Dfk8SHsmEOk,JM,2025-12-22 02:34:28.682072+00:00,2025-12-11 16:58:32+00:00,Likkle Miss,Likkle Miss,Shaneil Muir - Topic,UC2L3Kxh9ByRx4y0jc4Wh97Q,10,Music,"Shaneil Muir, Likkle Miss",2,https://i.ytimg.com/vi/Dfk8SHsmEOk/hqdefault.jpg,en,pa,False,137,PT2M17S,hd,False,True,,,94065,3819,157
SlyLXzkySF8,JM,2025-12-22 02:34:28.682079+00:00,2025-12-20 20:57:06+00:00,🔴LIVE! STEAL A BRAINROT UPDATE!!! (ADMIN ABUSE),🔴LIVE! STEAL A BRAINROT UPDATE!!! (ADMIN ABUSE),KreekCraft,UCxsk7hqE_CwZWGEJEkGanbA,20,Gaming,,0,https://i.ytimg.com/vi/SlyLXzkySF8/hqdefault.jpg,en-US,en-US,False,16640,PT4H37M20S,hd,False,True,,,622310,9813,516
sqsybzne18M,JM,2025-12-22 02:34:28.682086+00:00,2025-12-12 05:01:11+00:00,Armanii - BALCONY ft. Jada Kingdom (Official Audio),Armanii - BALCONY ft. Jada Kingdom (Official Audio),ARMANIIVEVO,UCFGmhnXISF0AYd_D0gv3N2g,10,Music,"Armanii, Armanii under exclusive license to UnitedMasters LLC, Reggae, Dancehall",4,https://i.ytimg.com/vi/sqsybzne18M/hqdefault.jpg,en,en,False,205,PT3M25S,hd,False,True,,,176323,6519,183
