video_id,country,fetched_at,published_at,title,localized_title,channel_title,channel_id,category_id,category_name,tags,tag_count,thumbnail,default_language,audio_language,is_live,duration,duration_raw,definition,caption_available,licensed_content,embeddable,made_for_kids,views,likes,comments
4g3AG2EqDpM,RS,2026-04-27T04:08:07.190992+00:00,2026-04-16T10:00:06Z,Buba Corelli - Topovska,Buba Corelli - Topovska,IMPERIA,UCaWaxupwQ7Pssm94Xcxi8LA,10,Music,,0,https://i.ytimg.com/vi/4g3AG2EqDpM/hqdefault.jpg,hr,bs,False,128,PT2M8S,hd,True,True,False,False,4861512,61652,1738
PhQ3yQjUgAc,RS,2026-04-27T04:08:07.191035+00:00,2026-04-23T16:05:00Z,Assassin's Creed Black Flag Resynced: Official Game Overview Trailer,Assassin's Creed Black Flag Resynced: Official Game Overview Trailer,Assassin's Creed,UC_fwlBSrMIfdb4Br2O_Fzlw,20,Gaming,"assassins creed, assassins creed black flag, assassins creed black flag resynced, black flag resynced, ac black flag, ac black flag resynced, assassins, creed, ubisoft",9,https://i.ytimg.com/vi/PhQ3yQjUgAc/hqdefault.jpg,en-GB,en-GB,False,521,PT8M41S,hd,True,True,False,False,2725332,138797,15175
mM85NnI8gVE,RS,2026-04-27T04:08:07.191048+00:00,2026-04-22T18:00:45Z,BEZ INTERNETA 24 SATA!,BEZ INTERNETA 24 SATA!,Dex Rock,UC9-OsEfAts7_SaTRQOBRgjw,24,Entertainment,DexRock,1,https://i.ytimg.com/vi/mM85NnI8gVE/hqdefault.jpg,sr,sr,False,1047,PT17M27S,hd,False,True,False,False,185757,11042,186
uCOefZeMIdE,RS,2026-04-27T04:08:07.191056+00:00,2026-04-23T10:01:21Z,Seka Aleksić - Samo bivša (Official video),Seka Aleksić - Samo bivša (Official video),Seka Aleksić,UCxEMA4apFhleO3ONQTowMvQ,10,Music,"seka, seka aleksic, samo bivsa",3,https://i.ytimg.com/vi/uCOefZeMIdE/hqdefault.jpg,sr,sr,False,141,PT2M21S,hd,False,True,False,False,347852,6460,1148
AjFk1cY265I,RS,2026-04-27T04:08:07.191064+00:00,2026-04-10T16:29:45Z,Digital Circus Ep 9 Finale [TRAILER],Digital Circus Ep 9 Finale [TRAILER],GLITCH,UCn_FAXem2-e3HQvmK-mOH4g,1,Film & Animation,"glitch, glitch productions, digital circus, the amazing digital circus, murder drones, Pomni, Uzi, Jax, Ragatha, Kinger, Gangle, Zooble, Caine, Bubble, 3D, Animation, 3D Animation, Indie Animation, Gummigoo",19,https://i.ytimg.com/vi/AjFk1cY265I/hqdefault.jpg,en,en,False,70,PT1M10S,hd,True,True,False,False,25787352,1581351,112236
Nq-SE8pCvPA,RS,2026-04-27T04:08:07.191073+00:00,2026-04-24T17:02:07Z,Nas Grad Je POPLAVLJEN u Brookhavenu...,Nas Grad Je POPLAVLJEN u Brookhavenu...,Drugari,UCLnIHL_NAHkbFi7pZ0mKtLg,20,Gaming,"minecraft, lunailuka, lukailuna, luna, luka, luna minecraft, luka minecraft",7,https://i.ytimg.com/vi/Nq-SE8pCvPA/hqdefault.jpg,sr,sr,False,983,PT16M23S,hd,False,True,False,False,81540,2071,138
IaZKywV4jVQ,RS,2026-04-27T04:08:07.191080+00:00,2026-04-16T12:00:06Z,Seksi - Plantaža (Official Video),Seksi - Plantaža (Official Video),Crni Cerak TV,UCtmMJ50FQfi_Ep3nSnnvouQ,10,Music,,0,https://i.ytimg.com/vi/IaZKywV4jVQ/hqdefault.jpg,sr,sr,False,134,PT2M14S,hd,False,True,False,False,677445,12648,300
Xt4X4FvXk2A,RS,2026-04-27T04:08:07.191088+00:00,2026-04-16T13:00:08Z,Street Fighter | Official Trailer (2026 Movie),Street Fighter | Official Trailer (2026 Movie),Paramount Pictures,UCF9imwPMSGz4Vq1NiTWCC7g,1,Film & Animation,,0,https://i.ytimg.com/vi/Xt4X4FvXk2A/hqdefault.jpg,en,en-US,False,173,PT2M53S,hd,True,True,False,False,15361798,283832,23620
eY4WrbiZLqQ,RS,2026-04-27T04:08:07.191096+00:00,2026-04-18T18:00:37Z,MOMCHADIJA igra GTA V Trke,MOMCHADIJA igra GTA V Trke,Momchadija,UC6TF5SR1h1Vc4V0LOAtuW2w,24,Entertainment,momchadija,1,https://i.ytimg.com/vi/eY4WrbiZLqQ/hqdefault.jpg,sr,sr,False,1001,PT16M41S,hd,False,True,False,False,245575,9487,279
POAbIzf-iFQ,RS,2026-04-27T04:08:07.191103+00:00,2026-04-16T10:00:45Z,Topovska,Topovska,Buba Corelli - Topic,UCS0QzK63VuLmYBSMH6IcEUA,10,Music,"Buba Corelli, Topovska",2,https://i.ytimg.com/vi/POAbIzf-iFQ/hqdefault.jpg,en,sr,False,128,PT2M8S,hd,False,True,False,False,851565,6494,0
6IxPD-jNdwM,RS,2026-04-27T04:08:07.191111+00:00,2026-04-22T19:01:13Z,Clayface | Official Teaser,Clayface | Official Teaser,DC,UCiifkYAs_bq1pt_zbNAzYGg,1,Film & Animation,"2026, Clayface, Coming Soon, DC, DC Comics, David Dencik, Eddie Marsan, Gotham City, Horror, James Watkins, Joshua James, Max Minghella, Movie Trailer, Nancy Carroll, Naomi Ackie, Teaser Trailer, Thriller, Tom Rhys Harries, Warner Bros, Warner Bros Pictures",20,https://i.ytimg.com/vi/6IxPD-jNdwM/hqdefault.jpg,en,en-US,False,64,PT1M4S,hd,True,False,False,False,7622536,164634,9222
7B0-WJ5QYsc,RS,2026-04-27T04:08:07.191119+00:00,2026-04-18T15:00:06Z,Brawl Talk: 3 NEW Brawlers!,Brawl Talk: 3 NEW Brawlers!,Brawl Stars,UCooVYzDxdwTtGYAkcPmOgOw,20,Gaming,"brawl stars, mobile game, mobile strategy game, mobile rpg, mobile battle royale, battle royale, supercell game, 3 new brawlers, new brawlers, brawl talk",10,https://i.ytimg.com/vi/7B0-WJ5QYsc/hqdefault.jpg,en,en,False,666,PT11M6S,hd,True,True,False,False,16275849,593901,46151
04K4pFRu93M,RS,2026-04-27T04:08:07.191127+00:00,2026-04-23T16:32:41Z,Maya Berović - Omiljena bivša (Official video 2026),Maya Berović - Omiljena bivša (Official video 2026),Maya Berovic,UCe9zn1GDBwwS9MN-dMuxaug,10,Music,,0,https://i.ytimg.com/vi/04K4pFRu93M/hqdefault.jpg,sr,en-US,False,146,PT2M26S,hd,False,True,False,False,1693859,5687,657
MSdghdelbAw,RS,2026-04-27T04:08:07.191134+00:00,2026-04-16T17:15:02Z,METRO 2039 | Official Reveal Trailer,METRO 2039 | Official Reveal Trailer,metrovideogame,UC6XGqPhLktO4equS99J2ENw,20,Gaming,"METRO 2039, Metro Exodus, Metro Redux, Metro 2033, Metro Last Light, Xbox Series, PlayStation 5, PS5, PC, Steam, Deep Silver, 4A Games, FPS, Artyom, Moscow, Apocalypse, Wasteland, Dmitry Glukhovsky, STALKER, New Metro",20,https://i.ytimg.com/vi/MSdghdelbAw/hqdefault.jpg,en-GB,en,False,372,PT6M12S,hd,True,False,False,False,1240733,111016,9361
1STXztIgLVo,RS,2026-04-27T04:08:07.191142+00:00,2026-04-26T09:00:00Z,Rage i Kovalski: Elementalni TunelI Izazov U Minecraftu...,Rage i Kovalski: Elementalni TunelI Izazov U Minecraftu...,Rage ,UC3tm6KUnDfP7z4h2yrzAPSw,20,Gaming,,0,https://i.ytimg.com/vi/1STXztIgLVo/hqdefault.jpg,en,sr,False,899,PT14M59S,hd,False,True,False,False,30061,897,28
pxuXls1p23M,RS,2026-04-27T04:08:07.191149+00:00,2026-04-24T10:00:05Z,NIKOLIJA X MIMI MERCEDEZ - SRPKINJE (OFFICIAL VISUALIZER),NIKOLIJA X MIMI MERCEDEZ - SRPKINJE (OFFICIAL VISUALIZER),MADE IN BLKN,UCaRs9hr88Sqmt1SBK7JYMVw,10,Music,"relja, relja popovic, idjvideos, made in balkan, made in blkn, nova pesma, takvi kao ja, nikolija, tuga iz porsea, meduza, mi amor, princeza na belom, devito, rasta, genge, offline, o bivsima, high life",18,https://i.ytimg.com/vi/pxuXls1p23M/hqdefault.jpg,sr,sr,False,170,PT2M50S,hd,False,True,False,False,290560,4641,227
CINFIAohu4U,RS,2026-04-27T04:08:07.191157+00:00,2026-04-13T13:00:04Z,The Hunger Games: Sunrise on the Reaping (2026) Official Trailer – Joseph Zada,The Hunger Games: Sunrise on the Reaping (2026) Official Trailer – Joseph Zada,The Hunger Games,UCjvqqA-Eogozfm244OhUESw,1,Film & Animation,"SOTR, sunrise and the reaping, the hunger games, official trailer, trailer, trailer official, hd, the hunger games sunrise on the reaping, the hunger games sunrise on the reaping trailer, SOTR trailer, 2026 trailer, 2026, joseph zada, the hunger games trailer, the hunger games official trailer",15,https://i.ytimg.com/vi/CINFIAohu4U/hqdefault.jpg,en,en,False,145,PT2M25S,hd,True,True,False,False,3601021,139070,6436
1ukLY-RgTgY,RS,2026-04-27T04:08:07.191164+00:00,2026-04-21T15:26:36Z,NEKO MI JE UNIŠTIO KUĆICU NA DRVETU,NEKO MI JE UNIŠTIO KUĆICU NA DRVETU,zZzZOBRA,UCoRySXI-vMRIYBmDllxJQRA,20,Gaming,"zzzzobra, zobra, minecraft",3,https://i.ytimg.com/vi/1ukLY-RgTgY/hqdefault.jpg,sr,sr,False,1259,PT20M59S,hd,False,True,False,False,98923,2826,94
CPoz1omGlZY,RS,2026-04-27T04:08:07.191171+00:00,2026-04-24T04:01:18Z,Coby x Rimski x Corona - Od malena,Coby x Rimski x Corona - Od malena,Bassivity Digital,UCtAE452wbBYJZASZ-3jCNBA,10,Music,,0,https://i.ytimg.com/vi/CPoz1omGlZY/hqdefault.jpg,sr,sr,False,173,PT2M53S,hd,False,True,False,False,162205,6243,186
PMd1at7OwiE,RS,2026-04-27T04:08:07.191178+00:00,2026-04-06T16:00:00Z,The Devil Wears Prada 2 | Final Trailer,The Devil Wears Prada 2 | Final Trailer,20th Century Studios,UC2-BeLxzUBSs0uSrmzWhJuQ,1,Film & Animation,Trailer,1,https://i.ytimg.com/vi/PMd1at7OwiE/hqdefault.jpg,en,en,False,114,PT1M54S,hd,True,True,False,False,7614122,62788,2480
vUKgJqz6I5o,RS,2026-04-27T04:08:07.191186+00:00,2026-04-09T15:10:23Z,99 NOĆI U ŠUMI SA ŽENAMA,99 NOĆI U ŠUMI SA ŽENAMA,Novke,UCURlpFWEyij724FND2MEs0w,23,Comedy,"novke, novisha, novisa, novcic, aleksandar novcic, 24 sata, ymurke, skrivaci, smiga, smigicka, djape, novketova devojka, novketov brat, novke i smigicka, novke i smiga, smuga, nofke, nobke, caki, defko, novke majice, smiga majice, NOVKE ROBLOX, roblox, smigicka roblox, smiga roblox, ema i smiga, aleksandra roblox, ema smiga aleksandra sareza, sareza",30,https://i.ytimg.com/vi/vUKgJqz6I5o/hqdefault.jpg,sr,sh,False,1706,PT28M26S,hd,False,True,False,False,964178,12831,1068
zODiz4B6NlE,RS,2026-04-27T04:08:07.191193+00:00,2026-04-22T13:02:00Z,Jala Brat & Buba Corelli - Toronto (Tekst/Lyric Video),Jala Brat & Buba Corelli - Toronto (Tekst/Lyric Video),Balkan Music,UCwZqRnp7dsrJUX9iEWdBVGg,10,Music,"Jala Brat, Buba Corelli, Toronto, Jala Brat & Buba Corelli - Toronto, Toronto (Tekst/Lyric Video), jala brat buba correli, jala brat, buba corelli, balkan music, balkan songs, balkan, balkan hits",12,https://i.ytimg.com/vi/zODiz4B6NlE/hqdefault.jpg,hr,sr,False,129,PT2M9S,hd,False,True,False,False,109138,82,4
oSeqs_xeqv4,RS,2026-04-27T04:08:07.191201+00:00,2026-04-09T16:00:01Z,A Marvel Television Special Presentation: The Punisher: One Last Kill | Official Trailer,A Marvel Television Special Presentation: The Punisher: One Last Kill | Official Trailer,Marvel Entertainment,UCvC4D8onUfXzvjTOM-dBfEA,24,Entertainment,"marvel, comics",2,https://i.ytimg.com/vi/oSeqs_xeqv4/hqdefault.jpg,en,en,False,102,PT1M42S,hd,True,True,False,False,5851456,199169,7909
9glMIBZCT3A,RS,2026-04-27T04:08:07.191208+00:00,2026-04-19T14:00:24Z,PATULJCI KOJI KRADU ...,PATULJCI KOJI KRADU ...,KingsOfFailsShow,UCvwDNr7ec4Qaa_25VYOMhxg,20,Gaming,"kingsoffailsshow, markokofs, kofs, kings of fails show, minecraft kingoffailsshow, minecraft preživljavanje, Fortnite",7,https://i.ytimg.com/vi/9glMIBZCT3A/hqdefault.jpg,hr,hr,False,1336,PT22M16S,hd,False,True,False,False,185410,4137,183
xrBTnRobiHs,RS,2026-04-27T04:08:07.191216+00:00,2026-04-24T10:00:07Z,SALE TRU FEAT RASTA - BUDI TU (OFFICIAL VIDEO),SALE TRU FEAT RASTA - BUDI TU (OFFICIAL VIDEO),Balkaton Gang,UCNoPO5Oeak2M1fC-BDSjZHw,10,Music,"saletru, sale, tru, budi, tu, rasta, stefan, djuric, gfunk, beograd, balkaton, gang",12,https://i.ytimg.com/vi/xrBTnRobiHs/hqdefault.jpg,sr,sr,False,169,PT2M49S,hd,True,True,False,False,120829,6389,352
C9-_VVX9BvE,RS,2026-04-27T04:08:07.191223+00:00,2026-04-21T13:59:48Z,Silo — Season 3 Official Teaser | Apple TV,Silo — Season 3 Official Teaser | Apple TV,Apple TV,UC1Myj674wRVXB9I4c6Hm5zA,24,Entertainment,"silo, silo season 3, silo season 3 trailer, silo trailer, trailer silo, official trailer, silo official trailer, official trailer silo, wool, rebecca ferguson, chinaza uche, avi nash, common silo, common, steve zahn, hugh howey wool, book, novel, wool novel, wool adaptation, series, show, silo apple tv, apple tv silo, apple tv, apple, tv, apple tv+, apple tv app, apple original, original series, science fiction, sci fi, dystopia, drama, dystopian drama, thriller, silo teaser",38,https://i.ytimg.com/vi/C9-_VVX9BvE/hqdefault.jpg,en,en,False,54,PT54S,hd,True,False,False,False,969430,26487,1595
m5HBs1QNM84,RS,2026-04-27T04:08:07.191231+00:00,2026-04-26T11:20:26Z,POSTALI SMO LOPOVI NA 24 SATA!,POSTALI SMO LOPOVI NA 24 SATA!,MarkoKC,UCYcXicWbPZ-p2zQRStpYrEg,20,Gaming,"brawl stars, pjesma, KC, fortnite, marko kc, sarezza, MarkoKC",7,https://i.ytimg.com/vi/m5HBs1QNM84/hqdefault.jpg,hr,hr,False,858,PT14M18S,hd,False,True,False,False,27773,724,33
EOn57j9g_XE,RS,2026-04-27T04:08:07.191238+00:00,2026-04-22T13:02:00Z,02 PROLEĆE - Smoke Mardeljano ft. Juice,02 PROLEĆE - Smoke Mardeljano ft. Juice,SMOKEMARDELJANOTV,UCihKVilD6YNNtpZTqybq3fA,10,Music,"smoke mardeljano, smokehouse, video, official",4,https://i.ytimg.com/vi/EOn57j9g_XE/hqdefault.jpg,en,sr,False,203,PT3M23S,hd,False,True,False,False,88237,3050,234
0HjdiohVOik,RS,2026-04-27T04:08:07.191245+00:00,2026-03-31T15:59:00Z,Backrooms | Official Trailer HD | A24,Backrooms | Official Trailer HD | A24,A24,UCuPivVjnfNo4mb3Oog_frZg,1,Film & Animation,"a24, a24 films, a24 trailers, independent films, trailer, HD, official, movie, film, a24 movies, oscar winner, academy award winner",12,https://i.ytimg.com/vi/0HjdiohVOik/hqdefault.jpg,en,en,False,138,PT2M18S,hd,True,True,False,False,19768830,539645,28593
k1g9drJvvVc,RS,2026-04-27T04:08:07.191252+00:00,2026-04-24T01:03:57Z,IDEM U SOLO AKCIJU,IDEM U SOLO AKCIJU,Nugato,UCT1xv_rVS0bvk8ZSz7AKqDw,20,Gaming,"Nugato, baba, Balkan, GTA V, CSGO",5,https://i.ytimg.com/vi/k1g9drJvvVc/hqdefault.jpg,sr,en,False,23276,PT6H27M56S,hd,False,True,False,False,104231,5360,20
a2yEiu56-3E,RS,2026-04-27T04:08:07.191259+00:00,2026-04-21T15:00:06Z,Mitar Mirić – Kidaš me živote  (Official Video 2026) 🔥 NOVO,Mitar Mirić – Kidaš me živote  (Official Video 2026) 🔥 NOVO,Mitar Miric,UCkdhJQCv7Gt-c1XGxVBQ-9A,24,Entertainment,"mitar, miric, mirić, mitar miric, mitar mirić, Cigancica, Dobro jutro rekoh zori, Kad se spusti tiho vece, Ljubila je prvi put, Najjaci smo najjaci, Ne moze nam niko nista, Nesto me u nemir tera, Okreni se ljubavi, Poslednja stranica, S djavolom kule gradim, Ulicom glumim srecnika, Voli me danas vise nego juce, Zivela ljubav",18,https://i.ytimg.com/vi/a2yEiu56-3E/hqdefault.jpg,sr,sr,False,185,PT3M5S,hd,False,True,False,False,255714,4142,557
X21JsHLHnY8,RS,2026-04-27T04:08:07.191267+00:00,2026-03-31T12:59:59Z,Masters of The Universe – Official Trailer,Masters of The Universe – Official Trailer,Amazon MGM Studios,UCf5CjDJvsFvtVIhkfmKAwAA,24,Entertainment,"MGM, MGM Studios, Metro-Goldwyn- Mayer, Metro Pictures Corporations, Goldwyn Pictures, Louis B. Mayer Pictures, MGM Pictures, United Artists, Metro MGM/UA, Amazon MGM, Amazon MGM Studios, Amazon, Masters Of The Universe, Masters Of The Universe Movie, Masters Of The Universe 2026, Nicholas Galitzine, Morena Baccarin, Idris Elba, Jared Leto, Alison Brie, Kristen Wig, Masters of the Universe Trailer 2, Masters of the Universe Official Trailer, Masters Of the Univer Trailer",24,https://i.ytimg.com/vi/X21JsHLHnY8/hqdefault.jpg,en,en-US,False,165,PT2M45S,hd,True,True,False,False,19753937,83970,9501
kdSQuJ9UIcU,RS,2026-04-27T04:08:07.191275+00:00,2026-04-21T16:00:32Z,PREZIVLJAVAM 99 NOCI U SUPER MARKETU,PREZIVLJAVAM 99 NOCI U SUPER MARKETU,Masa Plays,UCR1dJbzlmpmPMXInHRnqQzA,23,Comedy,"masa plays, masa plejs, masa play, masa ultras plays, ultras plays, igramo roblox, roblox izazov, roblox 24 sata, 24 sata izazov, prezivljavamo 24 sata, prezivljavamo 100 noci, PREZIVLJAVAM 24 SATA U SUPER MARKETU, super market 24 sata, 24 sata u prodavnici, PREZIVLJAVAM 100 NOCI U SUPER MARKETU, PREZIVLJAVAM 100 NOCI U ROBLOX SUPER MARKETU, 24 SATA PRODAVNICA, 24 SATA MARKET, 24 SATA SUPER MARKET, NOC U PRODAVNICI, NOC U MARKETU, NOC U SUPER MARKETU",22,https://i.ytimg.com/vi/kdSQuJ9UIcU/hqdefault.jpg,sr,sr,False,1142,PT19M2S,hd,False,True,False,False,77426,1567,119
3B3kZSHd8SY,RS,2026-04-27T04:08:07.191283+00:00,2026-04-16T14:00:02Z,"MC STOJAN x ALEKSANDRA MLADENOVIĆ - PARE, PARE (OFFICIAL VIDEO)","MC STOJAN x ALEKSANDRA MLADENOVIĆ - PARE, PARE (OFFICIAL VIDEO)",MC STOJAN,UCAs3JC7j50t8QVsm606yJyw,24,Entertainment,"MC Stojan x Aleksandra Mladenović, MC Stojan x Aleksandra Mladenovic, Pare Pare, MC Stojan Pare Pare, Aleksandra Mladenović Pare Pare, Aleksandra Mladenovic Pare Pare, official video, official song, official music video, nova pesma 2026, Balkan hit, pop folk, duet, MC Stojan 2026, Aleksandra Mladenović 2026, Aleksandra Mladenovic 2026, domaća muzika, domaca muzika, srpska muzika, YouTube premijera, hit 2026, novi spot, letnji hit, viralno, trending, folk hit, 2026, La Miami",28,https://i.ytimg.com/vi/3B3kZSHd8SY/hqdefault.jpg,sr,sr,False,159,PT2M39S,hd,False,True,False,False,1406230,8124,885
EbpP1CcQ6LE,RS,2026-04-27T04:08:07.191292+00:00,2026-04-23T12:00:00Z,"MINECRAFT, ALI SU CHUNKOVI NASUMICNI!","MINECRAFT, ALI SU CHUNKOVI NASUMICNI!",Luna  ,UC3aVGpDQ4G_YwngcKs-UHWw,20,Gaming,"minecraft, lunailuka, lukailuna, luna, luka, luna minecraft, luka minecraft",7,https://i.ytimg.com/vi/EbpP1CcQ6LE/hqdefault.jpg,sr,sr,False,1111,PT18M31S,hd,False,True,False,False,50294,2387,143
i7rEj7aStTo,RS,2026-04-27T04:08:07.191299+00:00,2026-04-10T19:12:36Z,Inas-666,Inas-666,repetitor - Topic,UCucu-Qeljpttc6hFq2cW0CA,10,Music,"repetitor, Benjamin Fazlic, Inas-666",3,https://i.ytimg.com/vi/i7rEj7aStTo/hqdefault.jpg,en,ro,False,159,PT2M39S,hd,False,True,False,False,506817,1542,0
E6Pqh3dQW_M,RS,2026-04-27T04:08:07.191307+00:00,2026-04-21T14:57:58Z,GRADIM ROZU BAZU U 99 NOĆI U ŠUMI,GRADIM ROZU BAZU U 99 NOĆI U ŠUMI,Leptirica,UC5wFYwc0W2Y6U3DXZHw4Ncg,24,Entertainment,"leptirica, roblox, 99 nights in the forest, 99 noći u šumi, 99 DANA, lajv roblox",6,https://i.ytimg.com/vi/E6Pqh3dQW_M/hqdefault.jpg,sh,sh,False,1601,PT26M41S,hd,False,True,False,False,85345,4156,823
_aYRgEOEKho,RS,2026-04-27T04:08:07.191315+00:00,2026-04-10T12:00:01Z,DZEJLA RAMOVIC - 1004 (OFFICIAL VIDEO),DZEJLA RAMOVIC - 1004 (OFFICIAL VIDEO),Dzejla Ramovic Official,UCEKze31AY63EA-ryIt8RDVQ,10,Music,"Džejla Ramović, Ruža, Potraži me",3,https://i.ytimg.com/vi/_aYRgEOEKho/hqdefault.jpg,hr,und,False,181,PT3M1S,hd,False,True,False,False,1513559,16244,1081
Q6HtCD5Bg1Y,RS,2026-04-27T04:08:07.191322+00:00,2026-04-18T16:56:18Z,MENJAMO MOMKE U 99 NOCI U SUMI,MENJAMO MOMKE U 99 NOCI U SUMI,Sarezza,UCXgsOHYsLh6V7wSXh5myYbA,20,Gaming,,0,https://i.ytimg.com/vi/Q6HtCD5Bg1Y/hqdefault.jpg,sr,sr-Latn,False,1352,PT22M32S,hd,False,True,False,False,181331,4934,221
4tFrnA27-r8,RS,2026-04-27T04:08:07.191330+00:00,2026-04-07T14:04:45Z,Magičan Cvet (Remix),Magičan Cvet (Remix),Baka Prase - Topic,UCAONHPfNbNinabBVb6rEUPg,10,Music,"Baka Prase, David Ljubenović, Magičan Cvet (Remix)",3,https://i.ytimg.com/vi/4tFrnA27-r8/hqdefault.jpg,sl,pl,False,131,PT2M11S,hd,False,True,False,False,349996,2428,0
HPEUL8u8ZLo,RS,2026-04-27T04:08:07.191337+00:00,2026-04-25T11:14:00Z,OTIŠLI SMO U DUHOVU TAJNU BAZU! Minecraft Preživljvanje! ep.51,OTIŠLI SMO U DUHOVU TAJNU BAZU! Minecraft Preživljvanje! ep.51,50N3,UCxDB-9Q-iNlkAWhRlqmBN1Q,20,Gaming,"50N3, Šone, Sone, ŠoneYT, Brawl Stars, Minecraft, Roblox, GTA V, Trending",9,https://i.ytimg.com/vi/HPEUL8u8ZLo/hqdefault.jpg,hr,und,False,1972,PT32M52S,hd,False,True,False,False,45876,2983,377
qRTzVjXJLO8,RS,2026-04-27T04:08:07.191345+00:00,2026-04-18T13:58:06Z,29 x SULLY - LOLI 🍭,29 x SULLY - LOLI 🍭,Get Low Music,UCiZNnn7FzyB7hlY3A9tAgdw,10,Music,"vojke, djans, pirana, burj khalifa, bahata, mc stojan, teodora dzehverovic, djexon, rasta, balkaton, idjvideos, idjtunes, vuk mob, mili, jala brat, buba corelli, senidah, loca, kamikaza",19,https://i.ytimg.com/vi/qRTzVjXJLO8/hqdefault.jpg,sr,sr,False,127,PT2M7S,hd,False,True,False,False,55041,1698,320
Vo6QTBMdUfU,RS,2026-04-27T04:08:07.191353+00:00,2026-04-25T16:00:01Z,"1 Day vs 50,000 Day Build Challenge","1 Day vs 50,000 Day Build Challenge",MrBeast Gaming,UCIPPMRA040LQr5QPyJEbmXA,20,Gaming,,0,https://i.ytimg.com/vi/Vo6QTBMdUfU/hqdefault.jpg,en,en,False,1186,PT19M46S,hd,True,True,False,False,14205891,290488,10085
5loOZJG9kTg,RS,2026-04-27T04:08:07.191360+00:00,2026-04-24T10:00:09Z,Srpkinje,Srpkinje,Nikolija - Topic,UCveHuoaIDbtMIsV9FwCpvEw,10,Music,"Nikolija, Mimi Mercedez, Srpkinje",3,https://i.ytimg.com/vi/5loOZJG9kTg/hqdefault.jpg,en,sr,False,162,PT2M42S,hd,False,True,False,False,23887,261,5
RPTkLL00vEg,RS,2026-04-27T04:08:07.191367+00:00,2026-04-25T11:40:47Z,OTVORIO SAM 100x Chaos Star Dropova Na 400 TROFEJA accountu!,OTVORIO SAM 100x Chaos Star Dropova Na 400 TROFEJA accountu!,Markić,UC81q0ZRq5Js88ierdlCGzGQ,20,Gaming,"markokc, novi update, updejt, brawl stars, otvaranje kutija, box star, mega box, mega, box, brutalno, minecraft, preživljavanje 100 dana, preživljavanje, 100 dana, 24h, 24 sata, 24, stumlbe guys, jakovkc, jakov, mladi, mladji, mladi brat, mladji brat, brawl talk, markić, markic",27,https://i.ytimg.com/vi/RPTkLL00vEg/hqdefault.jpg,hr,hr,False,1884,PT31M24S,hd,False,True,False,False,37666,1036,65
vzFxPmpkue0,RS,2026-04-27T04:08:07.191375+00:00,2026-04-20T16:01:28Z,Boris Režak - Poruka za nju (Official video),Boris Režak - Poruka za nju (Official video),Boris Režak,UCpWKjC2roNKUQ-6kfEMPY7w,10,Music,"boris rezak, gospodska ulica, pokora, andjeo, sudbina, marko milosevic, poezija, jelena gavrilovic, nova pesma",9,https://i.ytimg.com/vi/vzFxPmpkue0/hqdefault.jpg,sr,en-US,False,271,PT4M31S,hd,False,True,False,False,117896,2075,190
37irzxUoVpY,RS,2026-04-27T04:08:07.191383+00:00,2026-04-25T14:00:06Z,SELIM SE IZ BROOKHAVENA?! (Brookhaven RP),SELIM SE IZ BROOKHAVENA?! (Brookhaven RP),Larita,UC4kMfd4kpvWQMXl4pyIM15w,20,Gaming,"Larita, ItzLarita, Roblox, Gaming, Balkan, roblox, brookhaven, brookhaven rp, roblox story, brookhaven story, roblox drama, brookhaven drama, roblox srpski, brookhaven srpski, larita, roblox selidba, brookhaven selidba, roblox moving, brookhaven moving, roblox life, brookhaven life, roblox balkans, roblox srbija, brookhaven srbija",24,https://i.ytimg.com/vi/37irzxUoVpY/hqdefault.jpg,sr,sr,False,672,PT11M12S,hd,False,True,False,False,21468,1166,342
t1f163LYBtw,RS,2026-04-27T04:08:07.191390+00:00,2026-04-03T15:15:03Z,Tea Tairović x Dado Polumenta - Šamar (Official Video),Tea Tairović x Dado Polumenta - Šamar (Official Video),Tea Tairovic,UCYo2cFsn4NyVH3BF5PfzDkw,10,Music,"tea, tairovic, hajde, novo, song, video, intervju, svetica, igracica, polako, bliznakinja, tea tairovic, otkad tebe znam, tea balkanija, dado polumenta, tea dado duet, duet tea, tea tairovic dado, dado polumenta tea, samar dado, samar dado spot, pesma, dado polumenta tea tairovic, dado tea, dado samar, tea tairovic samar, tea samar novo, tea tairovic 2026, tea dado 2026, dado tea tairovic 2026, tea dado 2026 spot, spot novo, dado tea 2026 new, samar 2026, samar 2026 dado, dado",36,https://i.ytimg.com/vi/t1f163LYBtw/hqdefault.jpg,sr,sr,False,187,PT3M7S,hd,False,True,False,False,2725082,18153,1063
4Yd-hOSUPnU,RS,2026-04-27T04:08:07.191398+00:00,2026-04-26T13:00:07Z,OTVORILI SMO CRNU KUTIJU OD MISTERIOZNOG! Minecraft Preživljavanje! ep.52,OTVORILI SMO CRNU KUTIJU OD MISTERIOZNOG! Minecraft Preživljavanje! ep.52,Imperator FX,UCnvD039Yr0_zBO7xgItSnMw,20,Gaming,"Impe, ImperatorFX, Imperator FX, Imperator, ImpeFX, Impe FX, minecraft, minecraftprezivljavanje, mc prezivljavanje, impe, mapa, creative, impefortnite, impefortnajt, vodeno prezivljavanje, vodeno, minecraftvodeno, prez, gtapropisi, gta po propisima, gta5, gta5 po pravilima, impe po propisima, minecraft impe, ostrvo, prezivljavanje impe, majnkraft, bazen, kuca, auto, bloxburg, adopt me, porodicne, avanture, roblox, impe roblox, impe bloxburg, imperator roblox, zooba, impe brawl stars, impe zooba",41,https://i.ytimg.com/vi/4Yd-hOSUPnU/hqdefault.jpg,hr,en,False,1534,PT25M34S,hd,False,True,False,False,32763,2924,194
kZIZ7LJL0ew,RS,2026-04-27T04:08:07.191407+00:00,2026-04-23T10:01:13Z,Budi Tu,Budi Tu,Sale Tru - Topic,UChfDjgwEy84uJLEC6EwTFNQ,10,Music,"Sale Tru, Rasta, Budi Tu",3,https://i.ytimg.com/vi/kZIZ7LJL0ew/hqdefault.jpg,sr,sr,False,168,PT2M48S,hd,False,True,False,False,35064,867,32
