video_id,country,fetched_at,published_at,title,localized_title,channel_title,channel_id,category_id,category_name,tags,tag_count,thumbnail,default_language,audio_language,is_live,duration,duration_raw,definition,caption_available,licensed_content,embeddable,made_for_kids,views,likes,comments
9bv2LRC2kzw,LB,2026-05-13T04:29:31.881195+00:00,2026-05-11T11:47:49Z,ساعة مع احلى أغاني هاني شاكر 😍 الرومانسية والطرب الأصيل #هانى_شاكر,ساعة مع احلى أغاني هاني شاكر 😍 الرومانسية والطرب الأصيل #هانى_شاكر,East Mix Music,UClGHjbgRJGfXUA5acNrR_zA,10,Music,"اغاني, أغاني جديدة, البومات, أغنية, مكس الاغاني, songs, arabic songs, اغاني 2025, أغاني 2026, هاني شاكر علي الضحكاية, علي الضحكاية هاني شاكر, هاني شاكر - علي الضحكاية, هاني شاكر علي الضحكايه, علي الضحكاية, اغاني هاني شاكر, هاني شاكر, هاني شاكر بعشق ضحكتك, أغنية هاني شاكر, بتحبية هاني شاكر, هاني شاكر - بعشق ضحكتك, حكاية كل عاشق . علي الضحكاية, مرض هاني شاكر, هاني شاكر قديم, غلطة هاني شاكر, جديد هاني شاكر, وداع هاني شاكر, أغاني هاني شاكر, هاني شاكر يوتيوب",28,https://i.ytimg.com/vi/9bv2LRC2kzw/hqdefault.jpg,ar,ar,False,2752,PT45M52S,hd,False,True,False,False,44638,239,22
AjFk1cY265I,LB,2026-05-13T04:29:31.881219+00:00,2026-04-10T16:29:45Z,Digital Circus Ep 9 Finale [TRAILER],Digital Circus Ep 9 Finale [TRAILER],GLITCH,UCn_FAXem2-e3HQvmK-mOH4g,1,Film & Animation,"glitch, glitch productions, digital circus, the amazing digital circus, murder drones, Pomni, Uzi, Jax, Ragatha, Kinger, Gangle, Zooble, Caine, Bubble, 3D, Animation, 3D Animation, Indie Animation, Gummigoo",19,https://i.ytimg.com/vi/AjFk1cY265I/hqdefault.jpg,en,en,False,70,PT1M10S,hd,True,True,False,False,29101889,1636565,115073
H0qKSAPQTh4,LB,2026-05-13T04:29:31.881232+00:00,2026-05-12T11:51:39Z,فلم قراند : اخر يوم في حياة زعرور و جميع الابطال الخارقين 🔥😂,فلم قراند : اخر يوم في حياة زعرور و جميع الابطال الخارقين 🔥😂,Ahmad GTA Family - عائلة احمد قراند ,UCQkLgXGjPbIrrNtT8ZtHOmg,22,People & Blogs,"مصطفى GAME OVER, Mr GG, XTREEM - اكستريم, اوكا - OKA, AboFlah, Mkamel GG, رانيا كيمنك Rania Gaming, BOZEX, هاردلك | hardlk, افلام, ماين كرافت, فلم ماين كرافت, غني وفقير, فايتر Fighter, ابو فله, فايتر, افلام ماين كرافت, الغني و الفقير, كوكب, ماين, MineCraft Movie, Suhaib - صهيب, جلمود - GLMooD, تايمو Tymo, هاردلك HARDLK, Ahmad M4 - احمد ام فور, بطل, Ahmad Hero - احمد البطل, احمد هيرو, سمبوسة - Sambosa, جعطوط - JATOOT, خزان, طيران, P4GAM3R, قراند, عقارات, اسهم, استثمار, عملات, دولار, شركات",41,https://i.ytimg.com/vi/H0qKSAPQTh4/hqdefault.jpg,ar,ar,False,1101,PT18M21S,hd,False,True,False,False,275377,5039,127
HuXQt07KjYc,LB,2026-05-13T04:29:31.881242+00:00,2026-05-08T17:00:20Z,Tebaa'n Tebaa'n,Tebaa'n Tebaa'n,Sherine - Topic,UCsLsnDUzLX_Pq7ZkVQESnxQ,10,Music,"Sherine, Tebaa'n Tebaa'n, تباعاً تباعاً",3,https://i.ytimg.com/vi/HuXQt07KjYc/hqdefault.jpg,en,ar,False,247,PT4M7S,hd,False,True,False,False,988347,21562,1756
6iUu6v5e1-4,LB,2026-05-13T04:29:31.881250+00:00,2026-05-12T15:26:14Z,فلم ماين كرافت : زعرور يهرب من الابطال الخارقين الاشرار الى اعلى مكان في العالم 🔥😱,فلم ماين كرافت : زعرور يهرب من الابطال الخارقين الاشرار الى اعلى مكان في العالم 🔥😱,Ahmad Hero Family - عائلة احمد البطل ,UCMl78PgENDj2Uf53HTOTx8w,22,People & Blogs,"مصطفى GAME OVER, Mr GG, كرافتر - Crafter, XTREEM - اكستريم, Ameer Slow - أمير سلاو, اوكا - OKA, AboFlah, Mkamel GG, رانيا كيمنك Rania Gaming, افلام, ماين كرافت, Fo9ma, فلم ماين كرافت, غني وفقير, فايتر Fighter, ابو فله, Hazar - هازار, فايتر, افلام ماين كرافت, الغني و الفقير, كوكب, M4X5, ماين, MineCraft Movie, ALKRKY, Suhaib - صهيب, جلمود - GLMooD, تايمو Tymo, هاردلك HARDLK, Ahmad M4 - احمد ام فور, بطل, Ahmad Hero - احمد البطل, احمد هيرو, خلودة, Rano's Home رانو هوم, M4X5Gamer, خالد",37,https://i.ytimg.com/vi/6iUu6v5e1-4/hqdefault.jpg,ar,en,False,1006,PT16M46S,hd,False,False,False,False,105781,2356,70
-0RUAQAMUac,LB,2026-05-13T04:29:31.881258+00:00,2026-05-08T17:00:06Z,Sherine - Tebaa’n Tebaa’n (Official Lyric Video) | شيرين - تباعاً تباعاً (فيديو مع الكلمات),Sherine - Tebaa’n Tebaa’n (Official Lyric Video) | شيرين - تباعاً تباعاً (فيديو مع الكلمات),Sony Music Middle East,UC6jp5ZOgZeMJY0b1wCnWwzQ,10,Music,"Sony, Sony Music, Sony Music Middle East, Middle east, Arabic Music, Songs, Arabic Song, أغاني, أغاني عربية, الشرق الأوسط, سوني, سوني ميوزك, سوني ميوزيك, sony music, سونى, sherine, shireen, shereen, cherine, chereen, chirine, chirene, شيرين, شرين, شيرين عبدالوهاب, شيرين عبد الوهاب, sherine abdelwahab, sherine abd el wahab, الحضن شوك, el hodn shok, el hodn shook, عايزة اشتكي, teba3an teba3an, sherine teba3an teba3an, sheren, تباعا تباعا, تباعن تباعن, شيرين تباعا تباعا, شرين عبدالوهاب",39,https://i.ytimg.com/vi/-0RUAQAMUac/hqdefault.jpg,ar,ar,False,258,PT4M18S,hd,False,True,False,False,3009016,74503,9146
9tIRN5j8NNQ,LB,2026-05-13T04:29:31.881268+00:00,2026-05-12T12:00:23Z,نجوت من تسونامي نهاية العالم في ماين كرافت !!؟,نجوت من تسونامي نهاية العالم في ماين كرافت !!؟,PMN Extra,UCVgZpLI9weAUFk9Y3OOtdyg,20,Gaming,,0,https://i.ytimg.com/vi/9tIRN5j8NNQ/hqdefault.jpg,ar,ar,False,3048,PT50M48S,hd,False,True,False,False,178742,6630,622
4KgAaKa_rzM,LB,2026-05-13T04:29:31.881275+00:00,2026-04-30T17:00:29Z,Alawar - Hammalni (Official Video) | الأعور - هملني,Alawar - Hammalni (Official Video) | الأعور - هملني,Alawar - الاعور ,UC9Xmd1Nr-lcmjx5OeWDu_Pg,10,Music,"Alawar, Hamilinii, الأعور, هملني, al awaar, al awar, alawar hamilini, alawar هملني, الاعور هملني, alawar new song, alawar new, هملني وما حكالي وين, alawar 2026, Minne, الاعور, ZaiZaman, زي زمان, حصل خير, اللقطة, لا, هدندن, الليل حكاية, فيش, البومة, مرت فبالي, دلافين, اللي كان, فاقد, بتشد فبالي, هدنه, موجود, ذهب, يا حبيبة, jordan songs, al a3war, al aawar, zey zaman, el leil 7kaya, marret fbali, thahab, ya habiba, mawjoud, أغاني اردنية, أغاني راب, راب اردني, الأخرس, سيلاوي, دبسة, Chabaka",49,https://i.ytimg.com/vi/4KgAaKa_rzM/hqdefault.jpg,en,ar,False,214,PT3M34S,hd,False,True,False,False,600198,9438,336
9GiOYvpGzW4,LB,2026-05-13T04:29:31.881284+00:00,2026-05-12T13:00:31Z,جراني لبست حجاب صارت مسلمة 😱granny,جراني لبست حجاب صارت مسلمة 😱granny,HOPE Rima,UCfYI9exf8BUHVgMSiAZWs2A,20,Gaming,"العاب, مقالب, تحديات, games, minecraft, oneblock, روبلكس, tiktok, ردات فعل, ماينكرافت بس, minecraft but, قيمز, rima, hoperima, هوب ريما, ريما, ماين كرافت, ماين كرافت ولكن, 100 يوم, 24 ساعة, funny, take damage, روبلوكس, الجد والجدة جراني, ريما وبيكا, ROBLOX, جراني, granny, doors, roblox, gaming, banban, بان بان, العاب رعب, horror games, بندريتا, بندر, الجدة جراني",38,https://i.ytimg.com/vi/9GiOYvpGzW4/hqdefault.jpg,ar,ar,False,919,PT15M19S,hd,False,True,False,False,97799,2977,714
6FoLlcB0L4g,LB,2026-05-13T04:29:31.881293+00:00,2026-05-04T15:00:06Z,Adam - Bedounak (Official Music Video) | آدم - بدونك,Adam - Bedounak (Official Music Video) | آدم - بدونك,Adam | آدم,UC3uOwAgmquYz0bPNcvXILzg,10,Music,"Adam, Bedounak, آدم, بدونك, آدم بدونك, adam bedounak, ADAM BEDOUNAK, ادم بدونك, Adam New Song, adam 2026, اغنية بدونك, آدم بدونك فيديو كليب, اغاني 2026, Adam Bedounak lyrics, Best Arabic love songs, Arabic music 2026, Trending Arabic songs, Adam Bedounak كلمات, العمر ماشي على الفاضي, بدونك القصص كلها منها حلوة, ولا في حب ولا في قلبي بدونك, الدني كلها بلا طعمة, وتفاصيلها مش مهمة, ولا في لون ولا في ضحكة, حبيبي, adam new song, new song adam, Adam New Song 2026, Chabaka",29,https://i.ytimg.com/vi/6FoLlcB0L4g/hqdefault.jpg,ar,ar,False,160,PT2M40S,hd,True,True,False,False,4182673,28979,1166
5uZJyDzEL_g,LB,2026-05-13T04:29:31.881301+00:00,2026-05-12T12:36:05Z,فلم روبلوكس : زعرور يجلس على الكرسي اسرع واحد في العالم 😱🔥,فلم روبلوكس : زعرور يجلس على الكرسي اسرع واحد في العالم 😱🔥,Ahmad Roblox,UCLW9tSrYwln0HyDWT1iU7Hw,22,People & Blogs,"السلطانه / ALSolTana, mmoshaya gaming, شاي كرك بالهيل على الجمر 🍃, Rima, رواف | RAWAF, Solom, EstubeGaming, Myamberr, Aly & Toty Gaming, Saudi Roblox, تايمو Tymo, Rahumi Extra, Ahmad Hero - احمد البطل, Ahmad Hero Family - عائلة احمد البطل, CoxoSparkle, رانيا كيمنك Rania Gaming, Roblox, احمد روبلوكس, احمد البطل روبلوكس, mayrushart, ابو فله, LankyBox, OFZ عمر, Migo9, M's Roro, روبلوكس, CashBlox, SSundee, Flamingo, Julia MineGirl, shfa, shfa gaming, شفا, شبكة العاب العرب | Arab Games Network",34,https://i.ytimg.com/vi/5uZJyDzEL_g/hqdefault.jpg,ar,en,False,1199,PT19M59S,hd,False,True,False,False,62747,756,36
0W-ik8Ux--Y,LB,2026-05-13T04:29:31.881310+00:00,2026-05-04T12:15:03Z,ليفة - لطمية سنية,ليفة - لطمية سنية,Phoenix 4 Media - Topic,UCvfmIyyE3TrJI5U2LZTFRjw,10,Music,"Phoenix 4 Media, Wesam Sharaf, ليفة - لطمية سنية",3,https://i.ytimg.com/vi/0W-ik8Ux--Y/hqdefault.jpg,ar,ar,False,76,PT1M16S,hd,False,True,False,False,70277,719,0
ZIjasmwYGzo,LB,2026-05-13T04:29:31.881317+00:00,2026-05-12T16:15:24Z,من نوبيني الى أوجي جبت دراقون😍 #2,من نوبيني الى أوجي جبت دراقون😍 #2,AlaaFj Gaming,UC4h4MAcXI3A9_RnMN7e9nRg,20,Gaming,"روبلوكس, مقاطع روبلوكس مضحكة, roblox ألعاب مضحكة, ضحك في روبلوكس, ملك السرقة, سيكرت, ماب السرقة, ماب السرقة في روبلوكس, ماب السرقه سعود, ملك السرقه, فلم روبلوكس, افلام روبلوكس, فيلم روبلكس, روبلكس, قصص روبلوكس, روبكس مجانى, فلم روبلكس, شحن روبلكس, شراء روبلكس, روبلكس العاب, بطاقة روبلكس, بطاقات روبلكس, شحن بطاقة روبلكس, كيفية شحن روبلكس, تحديث جديد روبلكس, شحنت روبلوكس, شحن روبلكس بالتفصيل, العاب روبلوكس, فاكهة البركان, تقييم حسابات, شريت برينروتات من مواقع",31,https://i.ytimg.com/vi/ZIjasmwYGzo/hqdefault.jpg,ar,ar,False,980,PT16M20S,hd,False,True,False,False,78622,4894,631
O0CH9VdJ7BA,LB,2026-05-13T04:29:31.881325+00:00,2026-04-30T14:54:46Z,Nassaba Ya Baba (Madi Karimeh Remix) - Siilawy سيلاوي - نصابة ريمكس,Nassaba Ya Baba (Madi Karimeh Remix) - Siilawy سيلاوي - نصابة ريمكس,Madi Karimeh,UCNoj8ldt49GZDquUefCmzgg,10,Music,"nassaba remix, nassaba siilawy, nassaba siilawy remix, siilawy nassaba remix, nassaba ya baba, nassaba ya baba remix, nassaba madi remix, nassaba madi karimeh remix, nassaba madi karimeh, nassaba tiktok, nassaba trend, nassaba madi k remix, siilawy remix 2026, siilawy remix, siilawy madi remix, siilawy madi karimeh remix",16,https://i.ytimg.com/vi/O0CH9VdJ7BA/hqdefault.jpg,en,ar,False,134,PT2M14S,hd,False,True,False,False,285225,1589,27
uuNFQluoK7Y,LB,2026-05-13T04:29:31.881334+00:00,2026-05-12T11:01:19Z,جبنا العيد انا وسامر بحدث الادمن الجديد بماب السرقة💀🔥 !! steal a brainrot,جبنا العيد انا وسامر بحدث الادمن الجديد بماب السرقة💀🔥 !! steal a brainrot,Hamza I حمزة ,UCj8z8d3XHXvat5_2--8-VGw,20,Gaming,"حمزة, حمزة اخو سبايدر, اخو سبايدر, سبايدر اخي, حمزة سبايدر, سبايدر حمزة, فورت نايت, فورتنايت, قلتش, اقوى لاعب, لاعب, عربي, باور, تحديات, تحدي, سر, اسرار, قلتشات, تجربة, سيزون, فورت القديمة, سيزون فورت نايت, سيزون جديد, موسم جديد, سونك, اخ سبايدر",26,https://i.ytimg.com/vi/uuNFQluoK7Y/hqdefault.jpg,ar,ar,False,1016,PT16M56S,hd,False,True,False,False,106580,3998,101
aF0-MldukZQ,LB,2026-05-13T04:29:31.881342+00:00,2026-05-03T15:00:06Z,باقٍ هنا | حسين خير الدين,باقٍ هنا | حسين خير الدين,حسين خير الدين /Hussein kheir dine,UCs6xmC4s08aVqKl3T-OoVoA,10,Music,"حسين خير الدين, الرادود حسين خير الدين, شور, يحيى عفارة, يوسف سعد, هي الحرب, حسن عميص, لطميات, اناشيد حماسية, لا المال لا الحجار لا البيوت, يا هائم المآتم, في درب فاطمة, مولاي الحسين, و رجائي كربلا, حسين ستوده, الجنامي, مجتبى الكعبي, منصورة يا شيعة علي, سيد سلام",19,https://i.ytimg.com/vi/aF0-MldukZQ/hqdefault.jpg,ar,ar,False,206,PT3M26S,hd,False,True,False,False,165532,8727,819
NK4jMN_2cdA,LB,2026-05-13T04:29:31.881350+00:00,2026-05-12T18:06:50Z,فلم ماين كرافت : منزل زعرور الفقير ضد منزل كركور و دودو الفقراء 🔥😂,فلم ماين كرافت : منزل زعرور الفقير ضد منزل كركور و دودو الفقراء 🔥😂,Ahmad M4 - احمد ام فور ,UCT68nhrPsNQ7pczSMFtKG1w,22,People & Blogs,"مصطفى GAME OVER, Mr GG, XTREEM - اكستريم, Ameer Slow - أمير سلاو, اوكا - OKA, AboFlah, Mkamel GG, رانيا كيمنك Rania Gaming, M4X5 Gamer, افلام, ماين كرافت, Fo9ma, فلم ماين كرافت الغني و الفقير, ابو فله, Hazar - هازار, افلام ماين كرافت, الغني و الفقير, كوكب, M4X5, ماين, MineCraft Movie, Movie, Suhaib - صهيب, جلمود - GLMooD, تايمو Tymo, هاردلك HARDLK, احمد, SHoNgxBoNg, Ahmad Hero - احمد البطل, PMN Extra, البطل, Nari YT - ناري, عائلة, elLa3eeb لعيب جدا, فايتر Fighter, احمد هيرو, سيد, بط",38,https://i.ytimg.com/vi/NK4jMN_2cdA/hqdefault.jpg,ar,en,False,1111,PT18M31S,hd,False,True,False,False,28598,629,30
x3eqqoZPV_E,LB,2026-05-13T04:29:31.881358+00:00,2026-05-04T09:21:33Z,BABYMONSTER - '춤 (CHOOM)' M/V,BABYMONSTER - '춤 (CHOOM)' M/V,BABYMONSTER,UCqwUnggBBct-AY2lAdI88jQ,10,Music,"BABYMONSTER, 베이비몬스터, 베몬, BABYMON, BAEMON, 하람, 아현, 루카, 치키타, 파리타, 로라, 아사, HARAM, AHYEON, RUKA, CHIQUITA, PHARITA, RORA, ASA",19,https://i.ytimg.com/vi/x3eqqoZPV_E/hqdefault.jpg,ko,ko,False,205,PT3M25S,hd,True,True,False,False,57456587,1099715,76992
aXbQT3FHMeo,LB,2026-05-13T04:29:31.881366+00:00,2026-05-13T02:37:49Z,IEM Atlanta 2026 - Day 2 - Stream A,IEM Atlanta 2026 - Day 2 - Stream A,ESL Counter-Strike,UCPq2ETz4aAGo2Z-8JisDPIA,20,Gaming,"ESL, Counter-Strike, ESL CS, ESLCS, ESL CSGO, ESL Counter-Strike, IEM, IEM CS, IEM CSGO, CSGO, esportsisawesomesauce",11,https://i.ytimg.com/vi/aXbQT3FHMeo/hqdefault.jpg,la,en,False,39954,PT11H5M54S,hd,False,True,False,False,1183561,8489,3
tVERj-QQMyg,LB,2026-05-13T04:29:31.881374+00:00,2026-05-03T15:01:24Z,Hany Shaker💔Sad Songs🎧 هاني شاكر🖤أمير الغناء العربي🎼أكتر 5 أغاني💔حـزن,Hany Shaker💔Sad Songs🎧 هاني شاكر🖤أمير الغناء العربي🎼أكتر 5 أغاني💔حـزن,iMediaMusicRecords,UCvLCV22s6F1047xVMilHuCw,10,Music,"هاني شاكر, هاني شاكر قديم, هاني شاكر جديد, اغاني هاني شاكر, hany shaker, ليلة الدموع, السعودية, موسم الرياض, شيرين, وائل جسار, ظروف معنداني, احمد سعد, تامر عاشور, وائل جسار طرب, ظروف, ظروف معندانى كلمات, ظروف معندانى وائل جسار, اغانى رومنسية 2023, اغاني وائل جسار, غريبة الناس, وائل جسار غريبة الناس, غريبة الناس وائل جسار, إيهاب توفيق, سحرانى, إيهاب توفيق سحرانى, Ehab Tawfik, اغانى التسعينات, التسعينات اغاني, اغانى التسعينات ايهاب توفيق",29,https://i.ytimg.com/vi/tVERj-QQMyg/hqdefault.jpg,ar,ar,False,2263,PT37M43S,hd,False,True,False,False,164890,1146,166
SOxJWmk9QUs,LB,2026-05-13T04:29:31.881382+00:00,2026-05-11T13:59:57Z,حاولت اكون ام ليوم كامل - mom simulator,حاولت اكون ام ليوم كامل - mom simulator,Peekaa,UCw4YUtV7FCTyOnVlsLbrWPA,20,Gaming,"العاب, فيديوهات منوعه, ترند, مقالب, تحديات, دبي, games, الترفيه, minecraft, سكنات ماين كرافت, oneblock, فورت نايت, روبلكس, tiktok, ردات فعل, ماينكرافت بس, minecraft but, أبو, فله, فله\GAMES, الفلاويه, قيمز, AboFlah, حسن, أكبر صانع محتوى قيمنق, تحدي, شرطي حرامي, minecraft mod, mods, mod, minecraft mods, family friendly, challenge, rima, hoperima, هوب ريما, ريما, peeka, كرافت, ماين, سبيد, speed, ماين كرافت, ماين كرافت ولكن, ماين كرافت 100 يوم, 100 يوم, 24 ساعة",47,https://i.ytimg.com/vi/SOxJWmk9QUs/hqdefault.jpg,ar,en-US,False,895,PT14M55S,hd,False,True,False,False,174539,7531,1272
XPjXYbIh1kY,LB,2026-05-13T04:29:31.881391+00:00,2026-04-23T01:03:18Z,كان عنا طاحون - فلامنكو,كان عنا طاحون - فلامنكو,3z Production - Topic,UCG8Oz_R41V3QG3SxZjCA0IA,10,Music,"3z Production, كان عنا طاحون - فلامنكو",2,https://i.ytimg.com/vi/XPjXYbIh1kY/hqdefault.jpg,ar,en,False,152,PT2M32S,hd,False,True,False,False,1084304,11417,162
PF0xIKwqAyM,LB,2026-05-13T04:29:31.881398+00:00,2026-04-26T13:00:46Z,Akhras Medley (#ABtalks Music) | ميدلي الأخرس,Akhras Medley (#ABtalks Music) | ميدلي الأخرس,akhras - الاخرس,UCkPvRLtdMjRu5t22foUmQQA,10,Music,"Akhras Medley, ميدلي الأخرس, Akhras, الأخرس, Akhras ABtalks, ABtalks Music, Dayman Heik, Ehlef, La Tsin El Seif, دايما هيك, احلف, لا تسن السيف, آخر كاس, Akher Kas, Harb, حرب, Skaba, سكابا, hareb, A5RASS, indie pop 2025, الآخرس, a5rass, الأخرس اخر كاس حالات, الأخرس لما تشوفوها, محمد الاخرس, من اليوم, أنا بريء, لحالي, استنى شوي, اخر خريف, اخر كاس, لساتني بجنبي, الاخرس بعد شو, Lesatni Janbi, وبعد شو, Jordan, الاردن, أغاني اردنية, a5ras, trend, Chabaka",42,https://i.ytimg.com/vi/PF0xIKwqAyM/hqdefault.jpg,en,ar,False,213,PT3M33S,hd,False,True,False,False,883122,14029,594
zS--rzI0_zY,LB,2026-05-13T04:29:31.881406+00:00,2026-05-12T10:30:39Z,ماين كرافت لايف ستيل الحرامية #29 : الشرطة سجنوني ولكن قدرنا نهرب !!؟ 😱🔥,ماين كرافت لايف ستيل الحرامية #29 : الشرطة سجنوني ولكن قدرنا نهرب !!؟ 😱🔥,Ameer Slow - أمير سلاو,UCQTlk74kYjONf13QFnZsYCw,20,Gaming,"ماين كرافت, ماينكرافت, عراق كرافت, فلم ماين كرافت, الغني والفقير, فيلم ماين كرافت, افلام ماين كرافت, فلم, film ماين كرافت, العاب, مقلب, تحميل, تحميل ماين كرافت, minecraft, #فلم_ماين_كرافت, غريب, عجيب, اختفاء, غامض, شركات طيران, طائرة, سفر, رحلة, سياحة, أموال, وقود, بنزين, حقيبة أموال, فلوس, رحلات طيران, أمريكا, مظيفات طيران, مطار, اختطاف, دس تراك, روبلوكس, فلم_روبلوكس, مرحاض, بابا, ماما, شرطة, مصطفى_ماين_كرافت, فلم_ماين_كرافت, تزوجت, هارد لايف, كلب, مصطفى كيم اوفر, لعبة, أمير سلاو, مستر بعرورة, قطة, لايف ستبل",52,https://i.ytimg.com/vi/zS--rzI0_zY/hqdefault.jpg,ar,ar,False,1557,PT25M57S,hd,False,True,False,False,100695,4968,590
AWizIRTnxi0,LB,2026-05-13T04:29:31.881415+00:00,2026-04-29T15:00:06Z,Maha Ftouni - Mamsektesh Feek (Official Lyric Video) | مهى فتوني - مامسكتش فيك,Maha Ftouni - Mamsektesh Feek (Official Lyric Video) | مهى فتوني - مامسكتش فيك,Maha Ftouni,UCBjR6Ju3DaWf7Otlbm99Tdg,10,Music,"Maha Ftouni, El Sabr Gamil, الصبر جميل, مها فتوني, Ma Tealaashi, متقلقش, داين فتدان, طرب مصري, أغاني طرب, Maha Ftoni, صبر جميل, Sabr Gamil, El Saber Gamil, El Saber Jameel, أنا شفت كتير منك, واهو بكرة تشوف, أغاني تيكتوك, ترند تيكتوك, Trend TikTok, وايه يعني هتنساني, وافتكرلك ايه, أغاني مها فتوني, مهى فتوني, El Sabr Gamel, أغاني حزن, أغاني حب, Love Songs, أغاني ترند, مليان جبروت, اغاني 2025, أول حب, album awel hob, سلام, فيها رجوع, مع السلامه, يا واحشني",36,https://i.ytimg.com/vi/AWizIRTnxi0/hqdefault.jpg,ar,en-US,False,223,PT3M43S,hd,False,True,False,False,961428,21195,1234
Pb8kP-zk1sA,LB,2026-05-13T04:29:31.881423+00:00,2026-05-12T16:03:05Z,يوتيوبر 2018 ضد يوتيوبر 2026 !!,يوتيوبر 2018 ضد يوتيوبر 2026 !!,عبود بني ياسين - Abodby,UCoFMRCwlrvNntC9r2Nz8EsQ,20,Gaming,"freefire, #freefire, free fire, free, free fire hack, free fire aze, freefireking, free fire hile, freefirelive, freefiresong, فري فاير, free fire game, فري فاير مهكره, فري فاير المغرب, فري فاير كلاش سكواد, فري فاير الجزائر, تحدي فري فاير, تهكير فري فاير, فري فاير علي عمر, فري فاير التحديث الجديد, فري فاير احتراف, جزائري فري فاير, فري فاير ضحك, تحدي جديد فري فاير, فري فتير توف منك, عبود بني ياسين, اوف منك, عبود فري فاير, ببجي, بوبجي, ببجي موبايل, بوجبي موبايل, هكر ببجي, اللعاب",34,https://i.ytimg.com/vi/Pb8kP-zk1sA/hqdefault.jpg,ar,ar,False,1353,PT22M33S,hd,False,True,False,False,76438,9720,482
VhprU2sJ2yc,LB,2026-05-13T04:29:31.881431+00:00,2026-04-24T09:47:34Z,Wajeh El Goumar,Wajeh El Goumar,Saria Al Sawas - Topic,UCP1_az-A1tXH8a8K_CAYqRg,10,Music,"Saria Al Sawas, Wajeh El Goumar, وجه القمر",3,https://i.ytimg.com/vi/VhprU2sJ2yc/hqdefault.jpg,en,ar,False,217,PT3M37S,hd,False,True,False,False,2096530,10962,282
jQO3JKTd-7Q,LB,2026-05-13T04:29:31.881439+00:00,2026-05-11T13:15:21Z,كل فوز = هسرق لاعب من الخصم,كل فوز = هسرق لاعب من الخصم,Abdo 2xd,UC8H8YKUSFLtLxjt49tlyJwA,20,Gaming,"عبدو, Abdo, Abdo 2xd, FIFA, فيفا, لعبة فيفا, ABDO, فيفا موبايل, fifa, fifa mobile, اف سي موبايل, FC MOBILE, اف سي, fc, fc mobile, لعبة فيفا موبايل, كريستيانو, cr7, ballon d'or, رونالدينهو, FC, رونالدو, رودريجو, زيدان, فريق الموسم, TOTS, كريستانو رونالدو, Ballon d'Or, ايزيبو, ديمبلي, البالون دور, الكرة الذهبية, 123, ovr 123, اوفر 123, TOTY, TEAM OF THE YEAR, تشكيلة السنة, فريق السنة, تيم اوف ذا يير, تحدي, تحدي اف سي موبايل, كل فوز, فوز, الفوز",45,https://i.ytimg.com/vi/jQO3JKTd-7Q/hqdefault.jpg,ar,ar,False,1555,PT25M55S,hd,False,True,False,False,435781,39876,945
8CUbVwBzL_E,LB,2026-05-13T04:29:31.881447+00:00,2026-04-24T15:32:55Z,فرج سليمان - مش ضروري,فرج سليمان - مش ضروري,Faraj Suleiman,UCqTBE8euqd5E7Q7gDHoUexg,10,Music,"فرج سليمان, فرج, سليمان, حيفا, فلسطين, موسيقى, faraj sulieman, faraj, piano, برلين, اسا جاي, مساحة",12,https://i.ytimg.com/vi/8CUbVwBzL_E/hqdefault.jpg,ar,ar,False,203,PT3M23S,hd,False,True,False,False,1094315,22883,1189
