video_id,country,fetched_at,published_at,title,localized_title,channel_title,channel_id,category_id,category_name,tags,tag_count,thumbnail,default_language,audio_language,is_live,duration,duration_raw,definition,caption_available,licensed_content,embeddable,made_for_kids,views,likes,comments
_pUPL3tw9HU,LB,2026-05-13T04:29:31.881454+00:00,2026-05-13T03:55:02Z,بث مباشر ببجي موبايل | نجرب المود الجديد معكم  |  رايدن 🔥,بث مباشر ببجي موبايل | نجرب المود الجديد معكم  |  رايدن 🔥,Raydin Lives - رايدن لايف,UCrqXLMZxSg561SVLXp8QLIQ,20,Gaming,,0,https://i.ytimg.com/vi/_pUPL3tw9HU/hqdefault.jpg,en,en-US,False,24307,PT6H45M7S,hd,False,True,False,False,30034,908,2
AX7CY9j6YhQ,LB,2026-05-13T04:29:31.881462+00:00,2026-04-23T17:03:30Z,Wadih El Cheikh - Fare2 3emle (Official Lyric Video) | وديع الشيخ - فرق عملة,Wadih El Cheikh - Fare2 3emle (Official Lyric Video) | وديع الشيخ - فرق عملة,Wadih El Cheikh,UC8LE3xn_tWC61irLwPmQeOQ,10,Music,"Fare2 3emle, فرق عملة, Wadih El Cheikh, وديع الشيخ, انتي لا شيخة ولا دله, سامحني يا الله, مرت سنين, حبَك إلو بيدمّـرَك, بيفلّو أغلى الناس, ما بينحنيلَك راس, هيدا الشخص إنتَ, كريزة وجع بالضحكة, والغمرة انخلَـط, رح عيد الغَـلَـط, إذا موتي منّو فيك, موتي فرق عملة, بدك قلبي لَ وريدَك, ومالو شهادة وفاة, الحب لعبة, ضلك عطي, حاجي بكفي فرص, دور على غيرو, أنا الرمح, يجنوا يغاروا, الرقم الصعب, زمن العقارب, انا او لا احد, من اول الو, حليتي بعيون الكل, خطر عالكوكب, chabaka",31,https://i.ytimg.com/vi/AX7CY9j6YhQ/hqdefault.jpg,ar,ar,False,209,PT3M29S,hd,False,True,False,False,813608,3394,124
BbGTHaOwxS0,LB,2026-05-13T04:29:31.881470+00:00,2026-05-12T17:30:26Z,SIDEMEN VS GEOGUESSR PRO,SIDEMEN VS GEOGUESSR PRO,MoreSidemen,UCh5mLn90vUaB1PbRRx_AiaA,22,People & Blogs,"sidemen, moresidemen, miniminter, ksi, zerkaa, behzinga, tbjzl, vikkstar, wroetoshaw",9,https://i.ytimg.com/vi/BbGTHaOwxS0/hqdefault.jpg,en,en-GB,False,1966,PT32M46S,hd,False,True,False,False,469360,22451,685
XXIX2WnfbpE,LB,2026-05-13T04:29:31.881477+00:00,2026-04-27T19:00:23Z,"Lady Gaga, Doechii - RUNWAY (Official Music Video)","Lady Gaga, Doechii - RUNWAY (Official Music Video)",LadyGagaVEVO,UC07Kxew-cMIaykMOkzqHtBQ,10,Music,"Lady Gaga, Doechii, Lil Monsters, LLC Top Dawg Entertainment, LLC under exclusive license to Interscope Records and Capitol Records, Pop",6,https://i.ytimg.com/vi/XXIX2WnfbpE/hqdefault.jpg,en,en,False,179,PT2M59S,hd,True,True,False,False,13681364,577798,26560
hI5YJuJoiYw,LB,2026-05-13T04:29:31.881484+00:00,2026-05-10T21:33:59Z,🎮 مباراة ريال مدريد ضد برشلونة | الدوري الاسباني 2026 | محاكاة مباراة اليوم PES2021 ,🎮 مباراة ريال مدريد ضد برشلونة | الدوري الاسباني 2026 | محاكاة مباراة اليوم PES2021 ,BUZZ TUBE,UCCjZ0Lp49PgvimSNEW8s7Ug,20,Gaming,,0,https://i.ytimg.com/vi/hI5YJuJoiYw/hqdefault.jpg,ar,ar,False,201,PT3M21S,hd,False,True,False,False,598958,5942,30
YOTxD9S7rzo,LB,2026-05-13T04:29:31.881491+00:00,2026-04-17T15:02:25Z,Nassaba,Nassaba,siilawy - Topic,UCEEJ2L45mvrGcqiaho6o-Ag,10,Music,"siilawy, Nassaba",2,https://i.ytimg.com/vi/YOTxD9S7rzo/hqdefault.jpg,en,ar,False,186,PT3M6S,hd,False,True,False,False,1365209,15603,482
lMjChmxpYuA,LB,2026-05-13T04:29:31.881498+00:00,2026-05-12T16:01:17Z,Cash DIED for 24 HOURS! (Minecraft),Cash DIED for 24 HOURS! (Minecraft),Cash,UC0eLBYhxW9HC0P9PXQ73mpQ,24,Entertainment,"Cash, Nico, Nico and Cash, Cash and Nico, Minecraft, Minecraft mod, family friendly, kid friendly",8,https://i.ytimg.com/vi/lMjChmxpYuA/hqdefault.jpg,en,en-US,False,949,PT15M49S,hd,False,True,False,False,225402,3853,1484
g4Uf_CTDhS4,LB,2026-05-13T04:29:31.881505+00:00,2026-04-18T14:00:00Z,Mohanad Zaiter - Hazat Khsrha (Official Video) 2026 |  مهند زعيتر - هزت خصرها,Mohanad Zaiter - Hazat Khsrha (Official Video) 2026 |  مهند زعيتر - هزت خصرها,Mohanad Zaiter | مهند زعيتر ,UCMhYSW6x5S-a83KSJ4onD7w,10,Music,"Mohanad Zaiter, Hazat Khsrha, مهند زعيتر, هزت خصرها, حبل الإعدامي, رح إقبل بموتي, يا عمري دخلك نامي, أشعاري والحاني بترخصلك, عندي إدمان, مهند وعيتر وسارة الزكريا, سارة الزكريا, وديع الشيخ, تريند الأول, الرقم الصعب, مهند زعيتر جديد, رورو حرب, قالو خطبتي ياقطة, ‫الله يهدك جبلهم, جربت الكيف, من كتر ما بحبك, قلبي بدو صيانة, فيكي شي, تخانقنا عملتلا بلوك, خلص الوقت, الشب الوفي, اكذب واحد, عدي زاغة, ادهم القاق, لبنان, سوريا, اغاني دبكة, تيك توك, تقبرني تقبرني, Chabaka",34,https://i.ytimg.com/vi/g4Uf_CTDhS4/hqdefault.jpg,en,ar,False,142,PT2M22S,hd,False,True,False,False,608919,5640,156
GlkS4oT8yOg,LB,2026-05-13T04:29:31.881513+00:00,2026-05-12T14:11:57Z,تفتيح عجلة النوادر + حقيبة كلفني 80 الف شدة #ببجي_موبايل #ببجي #pubgmobile,تفتيح عجلة النوادر + حقيبة كلفني 80 الف شدة #ببجي_موبايل #ببجي #pubgmobile,أترو/Atro,UCjf3ZSi7xMu8O9frZZ8FEGg,20,Gaming,"ببجي, بوبجي, ببجي موبايل, pubg mobile, افضل لاعب في ببجي موبايل, فتح صناديق ببجي, كمين, فتح صناديق, بابجي, اترو, محترف, تحديث, رومات, بث ببجي, ببجي سعودية, ببجي عراق, ببجي عربي, ببجي سوري, ببجي جزائري",19,https://i.ytimg.com/vi/GlkS4oT8yOg/hqdefault.jpg,ar,ar,False,975,PT16M15S,hd,False,True,False,False,71682,8735,6245
ADc9JPeLYi4,LB,2026-05-13T04:29:31.881521+00:00,2026-04-16T12:34:06Z,TEDDY AFRO  - ዳስ ጣል (አንሳው)  - Das Tal (Ansaw) | Track 1 (Official Lyrics Video),TEDDY AFRO  - ዳስ ጣል (አንሳው)  - Das Tal (Ansaw) | Track 1 (Official Lyrics Video),Teddy Afro,UCydlocDyvRtFmMffKytKqgQ,10,Music,,0,https://i.ytimg.com/vi/ADc9JPeLYi4/hqdefault.jpg,am,und,False,439,PT7M19S,hd,False,True,False,False,25336184,325159,68057
pW5a0wTPM8w,LB,2026-05-13T04:29:31.881528+00:00,2026-05-12T12:01:18Z,صار عندي او جي!! | Steal a Brainrot,صار عندي او جي!! | Steal a Brainrot,Maz Gaming,UCl9V1Ck41MZfBE38VM4Pa_A,20,Gaming,"#stealabrainrot, #roblox, #bloxfruits, #plantsvsbrainrots, #brainrot, #strawberryelephant, #funny",7,https://i.ytimg.com/vi/pW5a0wTPM8w/hqdefault.jpg,ar,ar,False,1166,PT19M26S,hd,False,True,False,False,66428,3747,728
78wrful9cVU,LB,2026-05-13T04:29:31.881535+00:00,2026-04-17T04:00:06Z,Olivia Rodrigo - drop dead (Official Music Video),Olivia Rodrigo - drop dead (Official Music Video),OliviaRodrigoVEVO,UCxE5jEls-T0QtlTHT8lI1lw,10,Music,"Olivia Rodrigo, Olivia Rodrigo PS, Pop, drop dead, you seem pretty sad for girl so in love, new olivia, 2026, kiss me and might drop dead, オリビア・ロドリゴ, 올리비아 로드리고, 奧莉維亞, 奥莉维娅罗德里戈",12,https://i.ytimg.com/vi/78wrful9cVU/hqdefault.jpg,en,en,False,251,PT4M11S,hd,True,True,False,False,27169570,889672,44385
1N_nqKItya8,LB,2026-05-13T04:29:31.881542+00:00,2026-05-12T13:10:09Z,تحدي اللهجات العربية مع المتابعين !!,تحدي اللهجات العربية مع المتابعين !!,حسونة - Hassone,UC4j8Thj3AUmH4PTM9YLAkSA,20,Gaming,,0,https://i.ytimg.com/vi/1N_nqKItya8/hqdefault.jpg,ar,ar,False,1236,PT20M36S,hd,False,True,False,False,67299,6491,918
8g7VclWsiaM,LB,2026-05-13T04:29:31.881549+00:00,2026-04-14T15:00:01Z,"""PINKY UP"" MV (Choreography Ver.) | KATSEYE","""PINKY UP"" MV (Choreography Ver.) | KATSEYE",KATSEYE,UCA61H4fWOMHikLcUFKyQUog,10,Music,,0,https://i.ytimg.com/vi/8g7VclWsiaM/hqdefault.jpg,en,en,False,142,PT2M22S,hd,False,False,False,False,22782817,399265,23931
cG9m0cfg3e0,LB,2026-05-13T04:29:31.881556+00:00,2026-05-13T00:16:27Z,[A] FURIA vs. Gentle Mates - PGL Astana 2026 - Group Stage: Round 4 High Match (2-1),[A] FURIA vs. Gentle Mates - PGL Astana 2026 - Group Stage: Round 4 High Match (2-1),PGL,UC5jpxDZx4yoBo324pMQ91Ww,20,Gaming,"PGL Bucharest 2026, CS2 tournament, Counter Strike 2, CS2 esports, CS2 matches, CS2 highlights, CS2 pro matches, CS2 live, PGL esports, CS2 competitive, CS2 full match, CS2 VOD, CS2 gameplay, CS2 Bo3, CS2 Bo5, Group Stage CS2, CS2 Playoffs, CS2 Quarterfinal, CS2 Semifinal, CS2 Grand Final, FaZe CS2, Astralis CS2, The MongolZ CS2, PARIVISION CS2, NRG CS2, MIBR CS2, B8 CS2, 3DMAX CS2, esports 2026, cs2 pro scene, cs2 best plays",31,https://i.ytimg.com/vi/cG9m0cfg3e0/hqdefault.jpg,en,en,False,36906,PT10H15M6S,hd,False,True,False,False,1123878,9250,14
yNa8jP4zoJo,LB,2026-05-13T04:29:31.881564+00:00,2026-04-13T14:00:06Z,Laufey - Madwoman (Official Music Video),Laufey - Madwoman (Official Music Video),Laufey,UChpKl3waLmccNeYH9LGYjUQ,10,Music,"laufey, jazz, indie, singer, songwriter, madwoman, mad, woman, new music, matter of time, matter, of, time, final, hour, Hudson Williams, Alysa Liu, Megan Skiendiel, Lola Tung, hudson, williams, alysa, liu, megan, skiendiel, lola, tung, women, new laufey",29,https://i.ytimg.com/vi/yNa8jP4zoJo/hqdefault.jpg,en,en,False,285,PT4M45S,hd,False,True,False,False,14759197,794214,20702
lqzIzdPftl0,LB,2026-05-13T04:29:31.881571+00:00,2026-05-12T10:04:34Z,خدعة سوف تخرب اللعبة !!,خدعة سوف تخرب اللعبة !!,SA7RAWI,UCjHq0FqdRB0JP-1CcokW3-w,20,Gaming,"الصحراوي, صحراوي فري فاير, sa7rawi, فري فاير, صحراوي, فري فاير الجزائر, تهكير فري فاير, تحدي فري فاير, مقلب النوب, شحنتلهم, شحن فري فاير, ألف جوهرة, تخريب حساب, شحنت للمتابع, تحدي أفوز, FREE FIRE, NOOB PRANK, سكواد جزائري, خدعة اللغم, ساكورا, التحديث الجديد فري فاير, WHITE444, هيدشوت تلقائي, حسونة, دراغونوف, DBL N, الشخصية الجديدة, متجر التخفيضات, السكن, الشوتقن, فري فاير لايت, الكريمنال, الفاير باس الاول, المتابعين, اصعب تحدي, Ali Omar, M16, TRYHARD, DJEXO, قيم بلاي, سكواد بنات",41,https://i.ytimg.com/vi/lqzIzdPftl0/hqdefault.jpg,ar,ar,False,823,PT13M43S,hd,False,True,False,False,171693,12946,1099
KCiOqTFtf9s,LB,2026-05-13T04:29:31.881579+00:00,2026-04-08T14:00:06Z,Bilal Derky - اعطيني امان [Official Visualizer] (2026),Bilal Derky - اعطيني امان [Official Visualizer] (2026),Bilal Derky - بلال ديركي,UCwfsdm7seYaI6sJezipH7ZA,10,Music,"bilal derky, bilal derki, bilal darky, بلال دركي, bilal derky music, bilal derky 2026, اغاني بلال دركي, Bilal Derky - اعطيني امان, اعطيني امان, new bilal derky, bilal derky new, bilal derky atini aman, atini aman, 3atini aman, atini aman bilal, 3atini aman bilal, 3atini aman derky, atini aman bilal derky",18,https://i.ytimg.com/vi/KCiOqTFtf9s/hqdefault.jpg,ar,ar,False,169,PT2M49S,hd,False,True,False,False,1834138,14203,701
Gm82hAxNl-k,LB,2026-05-13T04:29:31.881587+00:00,2026-05-12T11:30:17Z,فري فاير لعبة خطيرة !!,فري فاير لعبة خطيرة !!,SA7RAWI Gaming,UC2qdrMpLKn3GgeCwN65SX_Q,20,Gaming,"الصحراوي, صحراوي فري فاير, sa7rawi, فري فاير, صحراوي, فري فاير الجزائر, تهكير فري فاير, تحدي فري فاير, مقلب النوب, شحنتلهم, شحن فري فاير, ألف جوهرة, تخريب حساب, شحنت للمتابع, تحدي أفوز, FREE FIRE, NOOB PRANK, سكواد جزائري, خدعة اللغم, ساكورا, التحديث الجديد فري فاير, WHITE444, هيدشوت تلقائي, حسونة, دراغونوف, DBL N, الشخصية الجديدة, متجر التخفيضات, السكن, الشوتقن, فري فاير لايت, الكريمنال, الفاير باس الاول, المتابعين, اصعب تحدي, Ali Omar, M16, TRYHARD, DJEXO, قيم بلاي, سكواد بنات",41,https://i.ytimg.com/vi/Gm82hAxNl-k/hqdefault.jpg,ar,ar,False,538,PT8M58S,hd,False,True,False,False,210910,15734,1640
7F1ET2XHQfk,LB,2026-05-13T04:29:31.881594+00:00,2026-04-09T15:59:07Z,"KATSEYE (캣츠아이) ""PINKY UP"" Official MV","KATSEYE (캣츠아이) ""PINKY UP"" Official MV",HYBE LABELS,UC3IZKseVpdzPSBaWxBxundA,10,Music,"HYBE, HYBE LABELS, 하이브, 하이브레이블즈",4,https://i.ytimg.com/vi/7F1ET2XHQfk/hqdefault.jpg,ko,ko,False,182,PT3M2S,hd,True,False,False,False,37844316,966530,147450
