video_id,country,fetched_at,published_at,title,localized_title,channel_title,channel_id,category_id,category_name,tags,tag_count,thumbnail,default_language,audio_language,is_live,duration,duration_raw,definition,caption_available,licensed_content,embeddable,made_for_kids,views,likes,comments
Pho5WcuyVks,AZ,2026-03-23T03:28:57.412294+00:00,2026-03-21T13:30:00Z,Lia Minecraft'ta Kaydı Durdurmayı Unuttu...,Lia Minecraft'ta Kaydı Durdurmayı Unuttu...,Lia Minecraft,UCdZLjkrowEWbUQQycBxr1SQ,20,Gaming,"lia, türkçe minecraft, lia minecraft, minecraft, minecraft türkçe, minecraft videoları, minecraft video, bebek, minecraft ama, lia moni, moni, evlat edindik, evlat edinme, minecraft lia, moni minecraft, moni lia, lia ve moni, moni ve lia, minecraft eğlence, lia roblox, minecraft'ta, minecraft evlenme, moni lia evleniyor, moni lia evlenme, minecraft evlilik, liya ve moni, lia video, lia kaydı durdurmayı unuttu, lia ve rico, rico, bebek lia, lia bebek, bebek lia minecraft",33,https://i.ytimg.com/vi/Pho5WcuyVks/hqdefault.jpg,tr,tr,False,1470,PT24M30S,hd,False,True,False,False,130254,2599,542
DKGuEU5SEdg,AZ,2026-03-23T03:28:57.412303+00:00,2026-03-21T16:00:27Z,Çinare Melikzade - Necibe 2026 (Live Konsert),Çinare Melikzade - Necibe 2026 (Live Konsert),Çinare Melikzade ,UCr01o5vQI3YiSImQbpd7jSw,10,Music,"Çinare Melikzade - Necibe, Necibe, Çinare Melikzade, Çinare, cinare melikzade, cinare necibe, cinare melikzade konsert, necibe gul necibe",8,https://i.ytimg.com/vi/DKGuEU5SEdg/hqdefault.jpg,az,tr,False,215,PT3M35S,hd,False,True,False,False,39067,1673,390
soSJsc7lKqc,AZ,2026-03-23T03:28:57.412310+00:00,2026-03-21T15:47:36Z,TR'NİN EN NADİR BRAINROT KOLEKSİYONU! - Steal a Brainrot,TR'NİN EN NADİR BRAINROT KOLEKSİYONU! - Steal a Brainrot,Tetra Bey,UC2-e21klbJfzg8MkOd2f7DA,20,Gaming,"roblox, roblox türkçe, steal a brainrot",3,https://i.ytimg.com/vi/soSJsc7lKqc/hqdefault.jpg,tr,tr,False,1765,PT29M25S,hd,False,True,False,False,55681,1454,738
HOmgNhGrfgM,AZ,2026-03-23T03:28:57.412318+00:00,2026-03-17T13:56:01Z,Zeyneb Heseni - Meni Gözel Xatirla 2026 (Yeni Klip) 4K,Zeyneb Heseni - Meni Gözel Xatirla 2026 (Yeni Klip) 4K,Zeynəb Həsəni,UCrsjpBcXNeBCnEIyY8BEiYg,10,Music,"Zeyneb Heseni - Meni Gözel Xatirla, Meni Gözel Xatirla, Zeyneb Heseni, Zeyneb, zeyneb meni gozel xatirla, Düşürmü yadına mənli günlərin?, Heç ara-bir kövrəlirsənmi?, Hərdən olur darıxırsan sən də, Elə bil ruhum çıxır bədəndən., Hər işdə bir xeyir var, belə deyib atalar..., Bunun xeyiri hardadır, bilmədim ki., Mən səndən başqa bu dünyada əsil sevgi görmədim ki., Bir gün yadına düşsəm, məni sorağla, Unut olanları, ey yar, bir xahişim var:, Gördün çox darıxırsan, Sadəcə sus",21,https://i.ytimg.com/vi/HOmgNhGrfgM/hqdefault.jpg,az,tr,False,265,PT4M25S,hd,False,True,False,False,194974,4265,394
cXGsMQxhmzQ,AZ,2026-03-23T03:28:57.412326+00:00,2026-03-21T14:16:45Z,En Hızlı Poppy Playtime Karakeri Kim?,En Hızlı Poppy Playtime Karakeri Kim?,Kayzer,UCYzuISvgZ22qS31wE3IkpXw,24,Entertainment,,0,https://i.ytimg.com/vi/cXGsMQxhmzQ/hqdefault.jpg,tr,tr,False,998,PT16M38S,hd,False,True,False,False,150735,7791,1127
b-aES479AT8,AZ,2026-03-23T03:28:57.412333+00:00,2026-03-15T07:00:06Z,Metanet İsgenderli -  Mübarek Olsun | Yeni 2026,Metanet İsgenderli -  Mübarek Olsun | Yeni 2026,Mətanət İsgəndərli,UC9b5cpaRvX3-v20AAuEfY-Q,10,Music,"Metanet İsgenderli, Metanet, metanet isgenderli, metanet iskenderli, metanet isgenderli popuri, metanet isgenderli axtarma meni, metanet isgenderli qardas toyda, metanet isgenderli kohne mahnilar, metanet isgenderli qizinin toyu, metanet isgenderli mahnilari, metanet isgenderli toy mahnilari, metanet isgenderli onun sirri, metanet isgenderli oynaq mahnilar, Metanet İsgenderli - Mübarek Olsun |Yeni 2026, mubarek olsun, novruz bayraminiz mubarek olsun, metanet mubarek olsun",17,https://i.ytimg.com/vi/b-aES479AT8/hqdefault.jpg,tr,tr,False,320,PT5M20S,hd,False,True,False,False,71764,344,26
jMCi3_QjDC8,AZ,2026-03-23T03:28:57.412341+00:00,2026-03-21T14:01:08Z,ULTRA EFSANEVİ SİRİUS AÇTIM,ULTRA EFSANEVİ SİRİUS AÇTIM,XO Alperen,UCqma9TfH9s9aBlIv1TOX7PQ,20,Gaming,"xo alperen, xo alperen mobil oyun, xo alperen oyun, mobil oyun, android oyun, oyun videoları, en güzel mobil oyunlar, eğlenceli oyun videoları, brawl stars, brawl, stars, brawlstars, brawl stars görev, brawl stars komik videolar, xo alperen brawl stars, brawl stars gerçek hayat, brawl stars kutu açılımı, brawl stars elmas hilesi, brawl stars efsanevi kutu, brawl stars efsanevi, brawl stars karakter, ban, brawl stars kostüm, brawl stars yeni karakter, brawl stars güncelleme",25,https://i.ytimg.com/vi/jMCi3_QjDC8/hqdefault.jpg,tr,tr,False,863,PT14M23S,hd,False,True,False,False,146216,3768,848
eWYdvZNEqxg,AZ,2026-03-23T03:28:57.412350+00:00,2026-03-08T06:50:05Z,Arzuxanim - Popuri 2026,Arzuxanim - Popuri 2026,ARZUXANIM,UCLPjNGrysdt2nm211uJLjCQ,10,Music,,0,https://i.ytimg.com/vi/eWYdvZNEqxg/hqdefault.jpg,az,az,False,414,PT6M54S,hd,False,True,False,False,555630,26888,94
5Od-XkHcRH8,AZ,2026-03-23T03:28:57.412358+00:00,2026-03-21T10:00:06Z,İNANILMAZ DİJİTAL SİRK 8 *CAİNE'in SONU* (Türkçe Dublaj),İNANILMAZ DİJİTAL SİRK 8 *CAİNE'in SONU* (Türkçe Dublaj),Yuukrp,UCuR4wow42dg65u3Ba090KWw,20,Gaming,"yuukrp, glitch, yuukrp fnaf, yuukrp skibidi, digital circus, digital circus türkçe dublaj, digital circus türkçe, dijital sirk, trend, yeni trend, türkçe, dublaj, İNANILMAZ DİJİTAL SİRK 3 (Türkçe Dublaj), dijital sirk 3, dijital sirk 3 tepki, yuukrp dijital sirk, pomni, ragatha, dijital sirk 4 yuukrp, dijital sirk 5 tepki, yuukrp dijital sirk 5, jax, dijital sirk 8, digital circus 8, dijital sirk 8 yuukrp, yuukrp dijital sirk 8, dijital sirk 9, dijital sirk final, caine",29,https://i.ytimg.com/vi/5Od-XkHcRH8/hqdefault.jpg,tr,tr,False,1968,PT32M48S,hd,False,True,False,False,178711,5597,1400
LilTHpZJ_fM,AZ,2026-03-23T03:28:57.412366+00:00,2026-03-10T16:16:38Z,Ahmed Mustafayev — Ney Səsiyəm (Rəsmi Musiqi Videosu),Ahmed Mustafayev — Ney Səsiyəm (Rəsmi Musiqi Videosu),Ahmed Mustafayev,UCGLA1gey6YItUQuA25mwFfQ,10,Music,"Ahmed, Mustafayev, Azerbaijan, acoustic, guitar, ahmed mustafayev ney sesiyem, ney səsiyəm, əhməd mustafayev ney səsiyə, gülüm ney səsiyəm səsiyəm, gülüm ney sesiyem, gülüm ney səsiyəm, əhməd mustafayev ney səsiyəm, ehmed mustafayev neyin səsiyəm, balam ney səsiyəm, ney səsiyəm səsiyəm",15,https://i.ytimg.com/vi/LilTHpZJ_fM/hqdefault.jpg,az,az,False,173,PT2M53S,hd,True,True,False,False,181620,2148,108
Zo1Rq1nFFhE,AZ,2026-03-23T03:28:57.412374+00:00,2026-03-22T21:01:09Z,Noobiniden Dragona Trade-DuEL,Noobiniden Dragona Trade-DuEL,Eren Dündar,UCUBdmkJQeO_J3fyKIrOS-Fw,20,Gaming,,0,https://i.ytimg.com/vi/Zo1Rq1nFFhE/hqdefault.jpg,tr,en-US,False,11798,PT3H16M38S,hd,False,True,False,False,79611,1255,10
