video_id,country,fetched_at,published_at,title,localized_title,channel_title,channel_id,category_id,category_name,tags,tag_count,thumbnail,default_language,audio_language,is_live,duration,duration_raw,definition,caption_available,licensed_content,embeddable,made_for_kids,views,likes,comments
Zrw-4bMBwAA,AZ,2026-03-23T03:28:57.411906+00:00,2026-03-18T21:00:50Z,Eypio - Ömrüm,Eypio - Ömrüm,Mahzen Fabrick,UCKUwIEjEWOK8MnQ23q8MMNQ,10,Music,"mahzen media, mahzen, türkçe muzik, türkçe müzik, pop müzik, en iyi müzik, turkish pop, turkish, 2023 music, 2023 muzik, yeraltı, dizi, eypio, ömrüm, 2026 music, rap hip hop",16,https://i.ytimg.com/vi/Zrw-4bMBwAA/hqdefault.jpg,tr,tr,False,159,PT2M39S,hd,False,True,False,False,1828304,29166,667
aBlsrtxuwss,AZ,2026-03-23T03:28:57.411955+00:00,2026-03-18T11:17:52Z,Spider-Man: Brand New Day - Official Trailer,Spider-Man: Brand New Day - Official Trailer,PlayStation,UC-2Y8dQb0S6DtpxNgAKoJKA,20,Gaming,"PlayStation, PS5, video games, next gen, Sony",5,https://i.ytimg.com/vi/aBlsrtxuwss/hqdefault.jpg,en,en,False,158,PT2M38S,hd,False,True,False,False,14626173,608780,25736
M4_EStiLxLI,AZ,2026-03-23T03:28:57.411971+00:00,2026-03-21T08:00:17Z,"FAKİR, DEV ÖRÜMCEĞE DÖNÜŞTÜ! 😱 - Minecraft","FAKİR, DEV ÖRÜMCEĞE DÖNÜŞTÜ! 😱 - Minecraft",Minecraft Parodileri,UC2XbMXD6jSrixkpgs7vHFUA,20,Gaming,"minecraft parodileri, minecraft, lanetli köy, minecraft lanetli köy, zengin vs fakir, minecraft parodileri korku, canavar fakir",7,https://i.ytimg.com/vi/M4_EStiLxLI/hqdefault.jpg,tr,tr,False,1166,PT19M26S,hd,False,True,False,False,804099,15945,2436
OvBubVxblj0,AZ,2026-03-23T03:28:57.411983+00:00,2026-03-08T14:00:07Z,Rəqsanə İsmayılova - Bivəfa 2 (Yeni Klip 2026) 4K,Rəqsanə İsmayılova - Bivəfa 2 (Yeni Klip 2026) 4K,Rəqsanə İsmayılova,UCJvnwLndwBSDHposq2CEFMQ,10,Music,"Rəqsanə İsmayılova - Bivəfa, Rəqsanə İsmayılova, Bivəfa, Rəqsanə, reqsane bivefa, bivefa 2, reksane ismayilova, reksane bivefa, reqsane yeni mahni, reqsane ismayilova 2026, yeni mahni, son mahnilar 2026, 2026 yeni mahnilar",13,https://i.ytimg.com/vi/OvBubVxblj0/hqdefault.jpg,az,az,False,168,PT2M48S,hd,False,True,False,False,1290415,11586,765
w0gHHbHyEho,AZ,2026-03-23T03:28:57.411992+00:00,2026-03-16T08:00:00Z,Sonunda Sen | Resmi Fragman | Netflix,Sonunda Sen | Resmi Fragman | Netflix,Netflix Türkiye,UCeZOywU-zg9j3SxYG0FdLtw,24,Entertainment,"2026, Aslı, Atilla Şendil, Devrim Yakut, Doğa Can Anafarta, Eda Ece, Ege, Kaan Yıldırım, Kürşat Demir, Mekin Sezer, Melis Civelek, Netflix 2026, Netflix Filmleri, Netflix Türk filmleri, Netflix Türkiye, Onur Gözeten, Pelin Uluksar, Seren Şirince, Sonunda Sen film, Sonunda Sen fragman, Urla, Yıldırım, Zeynep Gür, drama, romantik, romantik komedi, İzmir",27,https://i.ytimg.com/vi/w0gHHbHyEho/hqdefault.jpg,tr,en-US,False,113,PT1M53S,hd,True,True,False,False,303544,4035,251
HCrsEfSfSbU,AZ,2026-03-23T03:28:57.412003+00:00,2026-03-21T11:39:47Z,NEDEN GECE 3'te BENZİNCİ OLDUK? - Minecraft,NEDEN GECE 3'te BENZİNCİ OLDUK? - Minecraft,Ferited,UCKizsKkBBjuEoY_fgRx-4QQ,20,Gaming,"minecraft, minecraft videoları, minecraft animasyon, minecraft mod, türkçe minecraft, ferited, ferited son bölüm, ferited yeni video, ferited ailesi, maykıraft, ferited vs tarık, minecraft parodileri, feritet, gece 3, neden, benzinci ferited, benzinci tarık, gece 3 benzin, minecraft ama",19,https://i.ytimg.com/vi/HCrsEfSfSbU/hqdefault.jpg,tr,tr,False,1969,PT32M49S,hd,False,True,False,False,694828,10645,2175
2lu_c5hQ7rE,AZ,2026-03-23T03:28:57.412013+00:00,2026-03-12T14:00:06Z,Vusal Bilesuvarli & Naibe Sabirabadli - Sen İsde (Klip 2026),Vusal Bilesuvarli & Naibe Sabirabadli - Sen İsde (Klip 2026),Vusal Bilesuvarli,UCxvbV7kplSbV4EwIgmNDQnA,10,Music,,0,https://i.ytimg.com/vi/2lu_c5hQ7rE/hqdefault.jpg,az,az,False,266,PT4M26S,hd,False,True,False,False,506514,3273,179
ulS2GFmb_8s,AZ,2026-03-23T03:28:57.412021+00:00,2026-03-18T12:02:04Z,Spider-Man Brand New Day ''ŞOK EDİCİ'' Fragman Tepkisi,Spider-Man Brand New Day ''ŞOK EDİCİ'' Fragman Tepkisi,doguqn STUDIOS,UCjKSkUQFZYnhYxXIGDHJxyA,24,Entertainment,"spiderman brand new day fragman, fragman tepkisi, spider-man brand new day inceleme, spider-man brand new day fragman incelemesi, yeni spider-man filmi, spider-man brand new day izle, brand new day fragman tepkisi, yepyeni bir gün spider-man, spider-man brand new day fragman, spiderman brand new day tepki videosu, spider-man vs scorpion, gray hulk, spider-man fragmanı izliyor, spider-man brand new day fragmanı izliyor",14,https://i.ytimg.com/vi/ulS2GFmb_8s/hqdefault.jpg,tr,tr,False,593,PT9M53S,hd,False,True,False,False,77089,3313,313
cF6Zv9l6D9Q,AZ,2026-03-23T03:28:57.412029+00:00,2026-03-20T14:01:06Z,Kaykay Sürerek TÜM KEMİKLERİMİ Kırdım! 🦴 | EmirhanCTN,Kaykay Sürerek TÜM KEMİKLERİMİ Kırdım! 🦴 | EmirhanCTN,EmirhanCTN,UCYkivyuc_4ZG7TiB6ottPKg,20,Gaming,"minecraft, minecraft videoları, minecraft kaçış, minecraft türkçe, minecraft film, minecraft arkadaşlarım beni hapsetti, minecraft arkadaşlarım beni öldürmeye çalışıyor, minecraft intikam, minecraft efsaneleri, minecraft gizem, EmirhanCTN, minecraft intikam hikayesi, minecraft roleplay türkçe, minecraft roleplay, skate, skate oyunu, kaykay oyunu, kaykay sürmek, tüm kemiklerimi kırdım, kemik kırma oyunu",20,https://i.ytimg.com/vi/cF6Zv9l6D9Q/hqdefault.jpg,tr,tr,False,974,PT16M14S,hd,False,True,False,False,325572,5028,1019
i8X55sCrI-o,AZ,2026-03-23T03:28:57.412039+00:00,2026-03-13T06:09:12Z,DJ Romex – Əlvida Dönmə Geriyə (Original Mix 2026) 🎶,DJ Romex – Əlvida Dönmə Geriyə (Original Mix 2026) 🎶,Dj Romex,UCJpwai-h1JtA1Z-Zmn9qVsA,10,Music,"azeri deep house, azeri pop music, azeri trend mahnı, azeri electronic music, azeri house remix, azeri pop remix, azeri original music, azeri hit 2026, azeri new music, azeri bass music, azeri summer hit, azeri club hit, azeri remix 2026, azeri dance track, azeri house track, azerbaijan deep house, azerbaijan pop music, azerbaijan trend music, deep house azeri style, modern azeri music, azeri top music, azeri club vibes, azeri remix channel, azeri music 2026",24,https://i.ytimg.com/vi/i8X55sCrI-o/hqdefault.jpg,az,az,False,305,PT5M5S,hd,False,True,False,False,539486,1309,42
rodaFDuT_Do,AZ,2026-03-23T03:28:57.412047+00:00,2026-03-18T12:09:22Z,Örümcek-Adam: Yepyeni Bir Gün (Spider-Man: Brand New Day) | Altyazılı Fragman - 31 Temmuz'da,Örümcek-Adam: Yepyeni Bir Gün (Spider-Man: Brand New Day) | Altyazılı Fragman - 31 Temmuz'da,Box Office Türkiye,UC-VzHiGl3Be3t3Z94OIwg4w,1,Film & Animation,"fragman, trailer, film, yakında, vizyonda, vizyon, vizyon filmleri, sinemalarda, türkçe, dublaj, altyazılı, yeni filmler, en son fragmanlar, yeni fragmanlar, film fragmanları, film fragmanı, izle, film izle, hd, ilk fragman, türkiye, Örümcek-Adam: Yepyeni Bir Gün, Spider-Man: Brand New Day, Örümcek Adam yeni film, Tom Holland, Zendaya, Peter Parker, Marvel, Marvel Stüdyoları, Örümcek Adam Türkçe altyazılı fragman, süper kahraman filmleri, Spider-Man 4 fragman, Box Office Türkiye",33,https://i.ytimg.com/vi/rodaFDuT_Do/hqdefault.jpg,tr,tr,False,175,PT2M55S,hd,False,True,False,False,294174,6116,517
2eyv80pKMpk,AZ,2026-03-23T03:28:57.412058+00:00,2026-03-21T15:00:22Z,FERİTED İLE GERÇEK HAYATTA MİNECRAFT OYNADIK,FERİTED İLE GERÇEK HAYATTA MİNECRAFT OYNADIK,Bora Kontaş,UCqjp1xj3gTox-T4V_JlMvTQ,24,Entertainment,"boralo, boralo 2, eğlenceli videolar, boralo eğlence videoları, eğlence, komik videolar, komedi, eğlenceli, catalina, türkçe, boralo videoları, boralo yeni bölüm, boralo yeni, boralo gerçek hayat, minecraft, minecraft videoları, minecraft gerçek hayat, minecraft gerçek oluyor, gerçek hayat minecraft, gerçek hayat, minecraft gerçek, bora kontaş, ferited gerçek hayat, ferited gerçekçi minecraft, ferited minecraft, ferited boralo, ferited yüzü, gerçek minecraft",28,https://i.ytimg.com/vi/2eyv80pKMpk/hqdefault.jpg,tr,tr,False,1188,PT19M48S,hd,False,True,False,False,225150,5430,513
Mi-N9O0_IDA,AZ,2026-03-23T03:28:57.412067+00:00,2026-03-09T14:00:01Z,Zaur Quluzade & Babek Nur - Hec Eybi Yox 2026 (Official Music Video),Zaur Quluzade & Babek Nur - Hec Eybi Yox 2026 (Official Music Video),Zaur Quluzade,UC4LA1XyIc5iu92CGtt27x5Q,10,Music,,0,https://i.ytimg.com/vi/Mi-N9O0_IDA/hqdefault.jpg,az,az,False,217,PT3M37S,hd,False,True,False,False,788034,8187,291
F9Mz4Qar8m8,AZ,2026-03-23T03:28:57.412074+00:00,2026-03-22T14:00:00Z,YÜCE USTA VE ENTİTY 303 EFSANELERİ KARDEŞLİĞİ - Minecraft,YÜCE USTA VE ENTİTY 303 EFSANELERİ KARDEŞLİĞİ - Minecraft,BoraLo,UClSRQHOTv8551MUhNrtah2A,20,Gaming,"minecraft, minecraft videoları, minecraft türkçe, boralo yeni video, boralo yeni bölüm, boralo, boralo yeni, boralo son bölüm, boralo videoları, minecraft yeni bölüm, minecraft son bölüm, minecraft video, minecraft roleplay türkçe, minecraft oyunları, minecraft filmi, minecraft efsaneleri, minecraft yeni, minecraft videosu, minecraft yeni videolar, entity 303, entity 303 boralo, minecraft entity 303, boralo köyü, entity 303 minecraft, türkçe minecraft, yüce usta boralo",26,https://i.ytimg.com/vi/F9Mz4Qar8m8/hqdefault.jpg,tr,tr,False,1105,PT18M25S,hd,False,True,False,False,169655,6125,1459
b4iVv91Z6lY,AZ,2026-03-23T03:28:57.412083+00:00,2026-03-20T03:58:06Z,BTS (방탄소년단) ‘SWIM’ Official MV,BTS (방탄소년단) ‘SWIM’ Official MV,HYBE LABELS,UC3IZKseVpdzPSBaWxBxundA,10,Music,"HYBE, HYBE LABELS, 하이브, 하이브레이블즈",4,https://i.ytimg.com/vi/b4iVv91Z6lY/hqdefault.jpg,ko,ko,False,245,PT4M5S,hd,True,True,False,False,53428807,5408169,871597
IFd4ttn-g_U,AZ,2026-03-23T03:28:57.412091+00:00,2026-03-21T12:00:35Z,ROBLOX'TA BRAINROTLARIN KAFASINA GİRDİM!,ROBLOX'TA BRAINROTLARIN KAFASINA GİRDİM!,Lia,UCZFNWv60vxM8dBmGUm7-CIg,20,Gaming,"roblox, lia, liablox, lia roblox, roblox lia, lia gerçek yüzü, liya roblox, lia moni, lia minecraft, roblox brainrot, roblox brainrot çalma, brainrot, roblox steal a brainrot, lia brainrot, lia steal a brainrot, bebek, lia bebek, bebek lia, brainrotları çaldım, lia brainrot çalma, milu, rico, moni lia, moni ve lia, brainrot kafası, brainrot içine girdim, enter brainrot, enter brainrot head, brairnot çaldım, brainrot çalmak, brainrot kurtardım",31,https://i.ytimg.com/vi/IFd4ttn-g_U/hqdefault.jpg,tr,tr,False,1293,PT21M33S,hd,False,True,False,False,131319,2409,476
lZ8-I7rJ8pc,AZ,2026-03-23T03:28:57.412100+00:00,2026-03-18T11:00:06Z,Lord Vertigo & Nilay Sems - Qisqanmiram ( Yeni 2026 ),Lord Vertigo & Nilay Sems - Qisqanmiram ( Yeni 2026 ),Lord Vertigo,UCGiljuBjnr0sTVHFqB4s2gw,22,People & Blogs,"qisqanmiram, nilay sems qisqanmiram, neynirem ki men seni qisqanmiram, calis heyatda alcaq insan olma, nilay şəms, nilay sems yeni mahnisi, en yeni mahnilar 2026, lord vertigo qisqanmiram, lord vertigo yeni mahni, nilay sems mahnilar, sen menim orbitimde firlanirsan, sən mənim orbitimdə fırlanırsan, orbitimde firlanirsan, nilay sems 2026, lord vertigo 2026, lord vertigi nilay sems qisqanmiram, lord vertigo nilay sems, lord vertigo, nilay sems",19,https://i.ytimg.com/vi/lZ8-I7rJ8pc/hqdefault.jpg,az,az,False,239,PT3M59S,hd,False,True,False,False,139838,2017,186
bTepyeXIi9k,AZ,2026-03-23T03:28:57.412108+00:00,2026-03-21T11:01:04Z,FRANKLIN EVINI TOFAŞ EVI YAPTI - GTA 5 MODS,FRANKLIN EVINI TOFAŞ EVI YAPTI - GTA 5 MODS,TÜRKPRO,UCz8lelVfalizvMb2bHQjDvg,20,Gaming,"gta 5, gta 5 roleplay, gta 5 türk, gta 5 rp, Türk oyun kanali, türkiye, türkce, oynanış, gta 5 gerçek hayat, gerçek hayat, yeni bölüm, seri, para, araba, aşk, gta 5 tofaş modu, gta tofaş modifiye, gta 5 araba, tofaş sahin, yeni arabam, yaris yapiyorum, zengin hayat, zenginlik, dollar, gta 5 hikaye, gta 5 mod, gta 5 mods, okul, ekip gta 5, türkpro gta 5, türkpro kanal, ilhan gta 5, türkpro komik, tiktok komik anlar, tiktok gta 5, gta 5 stunts, gta 5 franklin video",37,https://i.ytimg.com/vi/bTepyeXIi9k/hqdefault.jpg,tr,tr,False,1353,PT22M33S,hd,False,True,False,False,245751,4307,345
ofiA0idiCec,AZ,2026-03-23T03:28:57.412117+00:00,2026-03-12T15:40:27Z,Tural Sedali - Allahim 2026 (Yeni Klip),Tural Sedali - Allahim 2026 (Yeni Klip),Tural Sedalı,UCqcqSXE0XrGw_ibClNw4aCg,10,Music,,0,https://i.ytimg.com/vi/ofiA0idiCec/hqdefault.jpg,tr,tr,False,235,PT3M55S,hd,False,False,False,False,336943,2688,184
MFYwHhiu8A4,AZ,2026-03-23T03:28:57.412125+00:00,2026-03-21T06:30:12Z,NƏNƏ MƏNİ BABADAN AYIRMAQ İSTƏYİR ! 😱 | GRANNY : CHAPTER TWO,NƏNƏ MƏNİ BABADAN AYIRMAQ İSTƏYİR ! 😱 | GRANNY : CHAPTER TWO,Nijat Hasanov,UCmC7FtuFNDZwv3x8JaaXvQQ,20,Gaming,,0,https://i.ytimg.com/vi/MFYwHhiu8A4/hqdefault.jpg,az,az,False,1071,PT17M51S,hd,False,True,False,False,28215,3262,376
9D4q0mJs3yQ,AZ,2026-03-23T03:28:57.412132+00:00,2026-03-13T07:58:23Z,Miri Yusif - Üzbəüz (Rəsmi Musiqi Videosu),Miri Yusif - Üzbəüz (Rəsmi Musiqi Videosu),Miri Yusif,UCDSK9u9rUettnE_YO4-8Pbw,10,Music,"miriyusif, miri yusif, мири юсиф, мириюсиф, хит, yeni, Miri Yusif, Köhnələr, unudulmaz, miri yusif unudulmaz, miri yusif unudulmaz mahnisi, unudulmaz ötən o illər, unudulmaz oten o iller, unudulmaz oten anlar, unudulmaz ötən anlar, miri yusif istanbul, miri yusif turkiye, azerbaycan turkiye, hani bes, hanı bəs, miri yusif hani bes, miri yusif hanı bəs, miri yusif min ilden bir, min ilden bir, min il, min ildən bir, miri yusif uzbeuz, uzbeuz, üzbəüz",29,https://i.ytimg.com/vi/9D4q0mJs3yQ/hqdefault.jpg,az,az,False,173,PT2M53S,hd,False,True,False,False,318109,5797,185
9CBMPrwIAco,AZ,2026-03-23T03:28:57.412141+00:00,2026-03-20T06:31:49Z,100.000 UC'LİK ŞAHESER APOLLO ARABA GELDİ!! 😱 (OYUNUN EN İYİSİ) 7 YENİ ARABA EFSANE! | PUBG Mobile,100.000 UC'LİK ŞAHESER APOLLO ARABA GELDİ!! 😱 (OYUNUN EN İYİSİ) 7 YENİ ARABA EFSANE! | PUBG Mobile,Barış G,UCCmDxZyqH2pdVQ7HkHnjD3Q,20,Gaming,"pubg mobile, pubg, mobile pubg, barış can, barış g, barış pubg, eğlence, eğlenceli, barış g pubg mobile, pubg mobile challenge, bilgisayarda pubg mobile, tencent emülatör, pubg mobile türkiye, türkçe pubg, emülatör, erangel, pubg mobile gameplay, one man squad, pubg mobile one man squad, barıs g, barisg, barışcı, 100.000 uc, apollo, apollo araba, pubg mobile apollo, oyunun en iyisi, en iyi, barış g yeni araba, yeni araba, pubg mobile yeni araba",31,https://i.ytimg.com/vi/9CBMPrwIAco/hqdefault.jpg,tr,tr,False,2051,PT34M11S,hd,False,True,False,False,325392,26792,8029
Qq4SYQUtvho,AZ,2026-03-23T03:28:57.412149+00:00,2026-03-04T09:00:06Z,Röya x İsmail Zade — Nankor (Rəsmi Audio),Röya x İsmail Zade — Nankor (Rəsmi Audio),İsmail Zade,UCMZd0kv4vv_pRVu7OhmQs0A,10,Music,"ismail, röya, müzik, şarkı, mahnı, ismail zade, ismail zadə, ismayil zade, ismailzade, ismailzade roya, roya ismail, röya ismayil, ismayil roya, nankor, röya ismailzade nankor, röya nankor, ismail nankor, ismayil röya, ismayıl röya, röya ismaıl, nankör, röya ismayil nankör, ismayıl röya nankör",23,https://i.ytimg.com/vi/Qq4SYQUtvho/hqdefault.jpg,az,az,False,170,PT2M50S,hd,True,False,False,False,1566903,12087,1205
JrCWmc7fyvA,AZ,2026-03-23T03:28:57.412158+00:00,2026-03-21T15:09:01Z,Yerleri Vakumlayarak EN DEĞERLİ Brainrotu Kurtardım! 🪠 | Roblox,Yerleri Vakumlayarak EN DEĞERLİ Brainrotu Kurtardım! 🪠 | Roblox,EmirhanCTN Roblox,UCKyasU_ct-abyrElyMt09tg,20,Gaming,"roblox, roblox evi, roblox izle, roblox eğlence, roblox videoları, roblox türkçe, roblox korku, roblox aksiyon, roblox macera, roblox oyunu, roblox doors, roblox roleplay, roblox brookhaven, roblox oyunları, roblox bedava robux, türkçe roblox, roblox kaçış oyunları, roblox kaçış, roblox bedava saç, roblox parkur, roblox parkur oyunları, roblox robux hilesi, robux, roblox simulator, roblox brainrot, roblox italian brainrot, roblox süpürge, roblox en değerli, roblox obby",29,https://i.ytimg.com/vi/JrCWmc7fyvA/hqdefault.jpg,tr,tr,False,1194,PT19M54S,hd,False,True,False,False,130784,4402,1162
xAWH2VYcpS4,AZ,2026-03-23T03:28:57.412167+00:00,2026-03-12T06:00:00Z,Rashad RC ft. Elnarə Abdullayeva - Tut Əlimdən | REMİX,Rashad RC ft. Elnarə Abdullayeva - Tut Əlimdən | REMİX,Rashad RC Music,UC4sOcFmlpnPx-2EVlv1ML2A,10,Music,"saysiz hisler var, trend mahnilar, meyxana remix, aygun kazimova, masin mahnilari, yep yeni mahnilar, trendde meyxana, vefa serifova, roya, yeni mahnilar, azeri bass music, AY UZLU PERİ, İRAN MAHNİSSİ FARS MAHNİ",13,https://i.ytimg.com/vi/xAWH2VYcpS4/hqdefault.jpg,az,az,False,131,PT2M11S,hd,False,True,False,False,235484,2477,28
iflYmOLjPx8,AZ,2026-03-23T03:28:57.412175+00:00,2026-03-17T15:00:21Z,PELİKANIN SON AKŞAM YEMEĞİ! | GOOSE GOOSE DUCK | BÖLÜM 16,PELİKANIN SON AKŞAM YEMEĞİ! | GOOSE GOOSE DUCK | BÖLÜM 16,Elraenn,UC51-ljNFrvY5ZmV0C_61XcA,20,Gaming,"elraenn kick, goose goose, goose goose duck, ekip, yalanlı oyun, ekip ile goose goose duck oynadık, elraenn ekip ile goose goose duck oynuyor, yalanlı oyunlar, profesyonel yalancılar, eğlence, gameplay, goose goose duck nasıl oynanır, goose goose duck bölüm 16, elraenn ekip ile goose goose duck oynuyor bölüm 16",14,https://i.ytimg.com/vi/iflYmOLjPx8/hqdefault.jpg,tr,tr,False,6308,PT1H45M8S,hd,False,True,False,False,1133445,49906,3771
sI_nWfT0R6Q,AZ,2026-03-23T03:28:57.412184+00:00,2026-03-17T09:01:22Z,"Amina — Popurri: ""Yada Sal Məni"", ""Nə Pis Şeydir Məhəbbət"", ""Извиняюсь"", ""Can Bakı""","Amina — Popurri: ""Yada Sal Məni"", ""Nə Pis Şeydir Məhəbbət"", ""Извиняюсь"", ""Can Bakı""",Amina Şirinqızı,UCKRXR5v6Yjy5qzkjbqQLG9w,10,Music,"amina, əminə, amina şirinqızı, amina şirinqizi, amina popurri, amina şirinqızı popurri, popurri amina, yada sal meni, herden agla herden yada sal meni, hərdən ağla hərdən yada sal məni, nə pis şeydir məhəbbət, gətirdi məni zarə, nə is seydi mehebbet, ne pis şeydi mehebbet",14,https://i.ytimg.com/vi/sI_nWfT0R6Q/hqdefault.jpg,az,az,False,269,PT4M29S,hd,False,True,False,False,136731,1357,104
oPZB1Lperk0,AZ,2026-03-23T03:28:57.412192+00:00,2026-03-21T09:11:00Z,YAPI KAPIŞMASINDA LILY LOVEBRAIDS İLE ARKADAŞIMI TROLLEDİM 😱 Minecraft,YAPI KAPIŞMASINDA LILY LOVEBRAIDS İLE ARKADAŞIMI TROLLEDİM 😱 Minecraft,Enes Arslan,UCOsvKKA3QwPV2Wo05q2m8tg,20,Gaming,"enes arslan, minecraft, minecraft videoları, minecraft izle, minecraft maceraları, türkçe minecraft, minecraft animasyon, minecraft mod, enes arslan ailesi, enes arslan yeni bölüm, bebek sonic, minecraft poppy playtime 5, huggy wuggy, mommy long legs, catnap, prototype, minecraft hile, minecraft troll, yapı kapışması, minecraft roleplay, minecraft hikaye, minecraft yapı kapışması, YAPI KAPIŞMASINDA LILY LOVEBRAIDS İLE ARKADAŞIMI TROLLEDİM, eğlence, minecraft komik",25,https://i.ytimg.com/vi/oPZB1Lperk0/hqdefault.jpg,tr,tr,False,1247,PT20M47S,hd,False,True,False,False,158133,2024,257
ZaYsdQX9RTw,AZ,2026-03-23T03:28:57.412200+00:00,2026-03-18T14:00:06Z,Kemale Gunesli - CEYRANIM / 2026,Kemale Gunesli - CEYRANIM / 2026,Kəmalə Günəşli,UC7jGxjmqnTQoFAYTY6bbWaQ,24,Entertainment,"Kemale Gunesli Ceyranim 2026, Kemale Gunesli Ceyranim, Kəmalə Günəşli Ceyranım, Ceyranım 2026, Cayranim 2026, Kemale Gunesli, Kəmalə Günəşli, Kemale Gunesli 2026, Nigulya, Kəmalə Günəşli Ceyranım 2026, ceyran, ceyranim, ceyranım, Aze Music, Klip 2026, Official Music Video",16,https://i.ytimg.com/vi/ZaYsdQX9RTw/hqdefault.jpg,az,az,False,165,PT2M45S,hd,False,True,False,False,220590,2470,931
g6hzpexVlgQ,AZ,2026-03-23T03:28:57.412208+00:00,2026-03-22T08:00:43Z,ULTRA ZENGİN HESABIN ŞANSLI GÜNÜ! 😮 | Brawl Stars,ULTRA ZENGİN HESABIN ŞANSLI GÜNÜ! 😮 | Brawl Stars,imparator - Brawl Stars,UC0oquIaT5nq4DtLwtoBbZVw,20,Gaming,"brawl star, brawl stars türkçe, brawl stars sıfırdan, brawl stars mega kutu, brawl stars kutu, brawl stars altın, brawl stars gem, brawl stars yeşil taş, brawl stars kupa kasma, brawl stars öğretici, brawl stars oynuyoruz, brawl stars memes, brawl stars oynanış, brawl stars öğreniyoruz, brawl stars 1000 kupa, brawl stars pro, brawl stars türkiye, supercell, brawl stars imparator, bs, imparator yt, imparator brawl stars, kostüm puanlama, edgar, brawl stars, cezalı brawl stars",26,https://i.ytimg.com/vi/g6hzpexVlgQ/hqdefault.jpg,tr,tr,False,4091,PT1H8M11S,hd,False,True,False,False,188735,8951,2502
H65D8Is_MeQ,AZ,2026-03-23T03:28:57.412217+00:00,2026-03-17T15:00:06Z,Kejoo Beats & Reyhan Rəcəbova - Sarı Köynək | TikTok Viral Remix,Kejoo Beats & Reyhan Rəcəbova - Sarı Köynək | TikTok Viral Remix,Kejoo Beats,UC5ZFXViv4NwwyVf66Wut8Hg,10,Music,"sarı köynek, sarı köynək, reyhan recebova, reyhan rəcəbova, kejoo, kejoo remix, kejoo beats, sarı köynek remix, azeri remix, azerbaycan şarkıları, tiktok viral, tiktokta patlayan şarkılar, azerbaycan mahnıları, sarı köynek tiktok, aşıq ələsgər, trap remix, club remix, türkçe remix, yöresel remix, canım sene kurban ay sarı köynek, tiktok trend sesler",21,https://i.ytimg.com/vi/H65D8Is_MeQ/hqdefault.jpg,tr,tr,False,120,PT2M,hd,False,True,False,False,88153,1475,132
V091li8iqHo,AZ,2026-03-23T03:28:57.412230+00:00,2026-03-21T16:00:04Z,ÜNLÜ TDM YAYINCISINA YAYINDA 22-8 ATTIM! DERS OLSUN,ÜNLÜ TDM YAYINCISINA YAYINDA 22-8 ATTIM! DERS OLSUN,Orbion #1,UCXB7toqbQtQgHEpgcLSu9nQ,22,People & Blogs,,0,https://i.ytimg.com/vi/V091li8iqHo/hqdefault.jpg,tr,tr,False,2854,PT47M34S,hd,False,False,False,False,175027,21215,7194
2wVAaY6s_Tc,AZ,2026-03-23T03:28:57.412238+00:00,2026-03-15T14:00:07Z,Vuqar Bileceri ft Resad Dagli - Yerinde (Remix - Ayxan Deniz) Klip,Vuqar Bileceri ft Resad Dagli - Yerinde (Remix - Ayxan Deniz) Klip,Ayxan Deniz,UCJd_ZAiN3iorXY7ZdE3LiQQ,10,Music,"remix ayxan deniz, ayxan deniz, resad dagli vuqar bileceri yerinde remix, yaris yerinde remix, casib deyersen ayxanin xetrine, ayxanin xetrine remix, danis yerinde, ver abarotkasini calis yerinde, yutubdada partdadiram lezzetdi, belede bext yerinde naxis yerinde, resad vuqar yaris yerinde remix, vuqar resad yerinde remix meyxana, vuqar resad ayxanin xetrine remix, resad ayxanin xetrine, vuqar ayxanin xetrine",15,https://i.ytimg.com/vi/2wVAaY6s_Tc/hqdefault.jpg,az,az,False,181,PT3M1S,hd,False,True,False,False,142424,3038,259
HGBwYEZuXY8,AZ,2026-03-23T03:28:57.412246+00:00,2026-03-22T09:00:32Z,ROBLOX'TA GUGU GAGA KULESİNE TIRMANDIM!,ROBLOX'TA GUGU GAGA KULESİNE TIRMANDIM!,Bebek Lia,UCAVhPum_e43T0GPRUVruktw,20,Gaming,"lia, bebek lia, roblox, roblox lia, lia roblox, bebek lia roblox, roblox bebek lia, bebek, roblox bebek, bebek lia kanalı, bebek lia oyun, minecraft bebek, minecraft bebek lia, bebek lia minecraft, lia minecraft, lia filmler, lia ve moni, moni, rico, bebek liya, gugu gaga, goo goo gaga, roblox gugu gaga, roblox goo goo gaga, gugu gaga tower, roblox kule, roblox kule oyunu, kule, gugu gaga oyun",29,https://i.ytimg.com/vi/HGBwYEZuXY8/hqdefault.jpg,tr,tr,False,979,PT16M19S,hd,False,True,False,False,106763,1415,183
nWRsjyj3X6g,AZ,2026-03-23T03:28:57.412255+00:00,2026-03-17T17:08:20Z,Ta Ki Seni Görene Kadar,Ta Ki Seni Görene Kadar,Anadolu Rock Cover - Topic,UC6UtBzxtXc4TXmwosvjf9_A,10,Music,"Anadolu Rock Cover, Ta Ki Seni Görene Kadar",2,https://i.ytimg.com/vi/nWRsjyj3X6g/hqdefault.jpg,tr,tr,False,215,PT3M35S,hd,False,True,False,False,1334163,11523,6
U0q2JTWmqro,AZ,2026-03-23T03:28:57.412262+00:00,2026-03-20T08:03:10Z,Najia knows the way out! | Story by Taika Waititi,Najia knows the way out! | Story by Taika Waititi,Brawl Stars,UCooVYzDxdwTtGYAkcPmOgOw,20,Gaming,"brawl stars, mobile game, mobile strategy game, mobile rpg, mobile battle royale, battle royale, supercell game",7,https://i.ytimg.com/vi/U0q2JTWmqro/hqdefault.jpg,en,en,False,149,PT2M29S,hd,True,True,False,False,7951631,156420,6524
lB02H2NKPZU,AZ,2026-03-23T03:28:57.412270+00:00,2026-03-13T14:00:06Z,Ziba Osmanlı - Bağışla 2026 (Official Music Video),Ziba Osmanlı - Bağışla 2026 (Official Music Video),Ziba Osmanli,UCtE8qwdCAZjEiRHpuu9lCkg,10,Music,"ziba osmanli bagisla, ziba osmanli, ziba osmanlı bağışla, ziba, bagisla, bagisla 2026, biz seninle el ele tutub gezismeliydik, ole bilmedim bagisla, gele bilmedim bagisla, ziba osmanli 2026, ziba bagisla",11,https://i.ytimg.com/vi/lB02H2NKPZU/hqdefault.jpg,az,az,False,204,PT3M24S,hd,False,True,False,False,144017,502,45
zBDkxLXLbRI,AZ,2026-03-23T03:28:57.412278+00:00,2026-03-21T12:48:05Z,ORBİON EVİMİ BASTI! HAKKINI VERDİM - PUBG MOBİLE,ORBİON EVİMİ BASTI! HAKKINI VERDİM - PUBG MOBİLE,Sasuke Pubg Mobile,UC9DRBe6e8vhgYzoiWPFBFyA,20,Gaming,"pubg, pubg mobile, pubg mobile türkiye, sasuke, sasuke pubg, sasuke pubg mobile, pubg mobile sasuke, sasuke vs, sasuke kışkırtma, handcam, pubg mobile handcam, ipad pro, ipad pro handcam",13,https://i.ytimg.com/vi/zBDkxLXLbRI/hqdefault.jpg,tr,tr,False,2281,PT38M1S,hd,False,True,False,False,217683,25147,1998
cahWIOCm5YM,AZ,2026-03-23T03:28:57.412286+00:00,2026-03-20T15:00:07Z,Semicenk - Üzülmedim Ki (Prod. by Büken),Semicenk - Üzülmedim Ki (Prod. by Büken),Eva Records,UCcSC5SQ7WeTZbSLEdPcgPAg,10,Music,"türkçe rap, music, hip hop, eva records, yeni şarkılar, spotify, tik tok, yeni çıkan, haberler, trap müzik, spotify 50, viral şarkılar, tik tok şarkıları",13,https://i.ytimg.com/vi/cahWIOCm5YM/hqdefault.jpg,tr,tr,False,154,PT2M34S,hd,False,True,False,False,1191354,32047,3147
