video_id,country,fetched_at,published_at,title,localized_title,channel_title,channel_id,category_id,category_name,tags,tag_count,thumbnail,default_language,audio_language,is_live,duration,duration_raw,definition,caption_available,licensed_content,embeddable,made_for_kids,views,likes,comments
NCyOpHmh0mA,NG,2026-05-15T04:34:58.661144+00:00,2026-05-09T12:44:56Z,Asake - Forgiveness (Official Video),Asake - Forgiveness (Official Video),ASAKE,UCU9R50wyBPKpdbcIScAyZig,10,Music,,0,https://i.ytimg.com/vi/NCyOpHmh0mA/hqdefault.jpg,en,und,False,168,PT2M48S,hd,False,False,False,False,879775,39043,2497
d-meZJJbabM,NG,2026-05-15T04:34:58.661186+00:00,2026-05-14T11:00:33Z,Koleoso pt 11 ( season 3) Latest Yoruba Movie 2026 Official Trailer. Showing 15th of May by 4pm ,Koleoso pt 11 ( season 3) Latest Yoruba Movie 2026 Official Trailer. Showing 15th of May by 4pm ,Itelediconstudio,UCACI-qnh5ozbLpvgl3ghI9w,1,Film & Animation,,0,https://i.ytimg.com/vi/d-meZJJbabM/hqdefault.jpg,en,und,False,119,PT1M59S,hd,False,True,False,False,200573,9639,745
eDTb3Fj0yb0,NG,2026-05-15T04:34:58.661199+00:00,2026-05-09T18:30:48Z,SIDEMEN AMONG US 15 MAN SPECIAL: ULTRA CHAOS MODE,SIDEMEN AMONG US 15 MAN SPECIAL: ULTRA CHAOS MODE,MoreSidemen,UCh5mLn90vUaB1PbRRx_AiaA,22,People & Blogs,"sidemen, moresidemen, miniminter, ksi, zerkaa, behzinga, tbjzl, vikkstar, wroetoshaw",9,https://i.ytimg.com/vi/eDTb3Fj0yb0/hqdefault.jpg,en,en-GB,False,4903,PT1H21M43S,hd,False,True,False,False,4698742,147676,7166
ylHyosqrtdA,NG,2026-05-15T04:34:58.661210+00:00,2026-05-11T16:01:41Z,Already,Already,BNXN fka Buju - Topic,UCcHJhU4S-CbjEJY-8bCxegA,10,Music,"BNXN, Sarz, The Game Needs Us, Already",4,https://i.ytimg.com/vi/ylHyosqrtdA/hqdefault.jpg,en,en,False,156,PT2M36S,hd,False,True,False,False,123070,1810,81
z2DVKwanO-k,NG,2026-05-15T04:34:58.661220+00:00,2026-05-12T20:00:06Z,SAHEEBA OFFICIAL TRAILER ,SAHEEBA OFFICIAL TRAILER ,Maishadda Global Resources,UCdiI6VrQ4aYI29FW1ChiHsA,24,Entertainment,,0,https://i.ytimg.com/vi/z2DVKwanO-k/hqdefault.jpg,ha,ha,False,339,PT5M39S,hd,False,True,False,False,109409,5365,278
3xZsGiMIpA0,NG,2026-05-15T04:34:58.661229+00:00,2026-05-14T17:06:30Z,Lampard Made Me Sign Him…,Lampard Made Me Sign Him…,MoreS2G,UCw9rjdrpHa7mzNrWVJoaPgw,20,Gaming,,0,https://i.ytimg.com/vi/3xZsGiMIpA0/hqdefault.jpg,en,en-GB,False,1297,PT21M37S,hd,False,True,False,False,182754,13088,879
f7ta0mNDCJM,NG,2026-05-15T04:34:58.661238+00:00,2026-05-07T16:06:08Z,"Muyeez, Zerrydl, Ayo Maff & Famous Pluto - Bank Alert (Official Video)","Muyeez, Zerrydl, Ayo Maff & Famous Pluto - Bank Alert (Official Video)",Muyeez,UCghnYB7gcQCCseYN2o3v-1Q,22,People & Blogs,,0,https://i.ytimg.com/vi/f7ta0mNDCJM/hqdefault.jpg,en,en,False,143,PT2M23S,hd,False,False,False,False,1087041,7178,358
yKOH_Z1mApk,NG,2026-05-15T04:34:58.661246+00:00,2026-05-11T16:05:36Z,GEN Z SCHOOL 2 Official Trailer | Yoruba Movie | Showing 13th May On ApankuforTV,GEN Z SCHOOL 2 Official Trailer | Yoruba Movie | Showing 13th May On ApankuforTV,APANKUFOR TV,UCjzmfHlZxnF90zOx6pe0EnQ,1,Film & Animation,"#Apakunfor, #ApakunforChannel, #YorubaMovies, #LatestYorubaMovies, #NewYorubaMovie2025, #Nollywood, #YorubaFilm, #AfricanCinema, #TrendingYorubaMovies, #BlockbusterMovies, #MustWatch, #NigerianMovies, #YorubaMovieLovers, #BestOfNollywood, #DramaMovies, #ActionMovies, #ComedyMovies, #SubscribeNow, #TurnOnNotifications, #WatchTillTheEnd, #MoviePremiere, #LatestNollywoodMovies, #Entertainment, #NollywoodStars, #YorubaCulture, #MovieLovers",26,https://i.ytimg.com/vi/yKOH_Z1mApk/hqdefault.jpg,en,und,False,158,PT2M38S,hd,False,True,False,False,95700,1804,80
DMhNt4iHKyg,NG,2026-05-15T04:34:58.661254+00:00,2026-05-13T18:46:20Z,I Takeover Man Utd for 10 Seasons…,I Takeover Man Utd for 10 Seasons…,S2G,UChR1Yn7YpVrnP-SbsWtjuBA,20,Gaming,,0,https://i.ytimg.com/vi/DMhNt4iHKyg/hqdefault.jpg,en-GB,en,False,2285,PT38M5S,hd,False,True,False,False,427749,18310,1126
71hoOjpy9tY,NG,2026-05-15T04:34:58.661262+00:00,2026-05-06T17:00:07Z,Flavour - ADA BEKEE (Official Video),Flavour - ADA BEKEE (Official Video),Official Flavour,UCC24v-BVlGf1IeiqMlFx0dQ,10,Music,,0,https://i.ytimg.com/vi/71hoOjpy9tY/hqdefault.jpg,en,en,False,394,PT6M34S,hd,False,True,False,False,822306,35432,2432
QL3Z0yHgZN4,NG,2026-05-15T04:34:58.661270+00:00,2026-05-06T11:57:54Z,ALAKADA GEN Z Part 2 – Trailer | Toyin Abraham | Latest Nigerian Movie 2026,ALAKADA GEN Z Part 2 – Trailer | Toyin Abraham | Latest Nigerian Movie 2026,Toyin Abraham TV,UCoSnFVOBlcdgjSUETGd65kA,24,Entertainment,,0,https://i.ytimg.com/vi/QL3Z0yHgZN4/hqdefault.jpg,en,und,False,130,PT2M10S,hd,False,True,False,False,302259,6424,506
DJAxcudPFeg,NG,2026-05-15T04:34:58.661278+00:00,2026-05-14T14:14:46Z,THE NEW SHADOW HUNT IS THE META?! 😳 CANNAVARO x MALDINI x DE ROSSI 💀 FULL REVIEW,THE NEW SHADOW HUNT IS THE META?! 😳 CANNAVARO x MALDINI x DE ROSSI 💀 FULL REVIEW,Mednasah,UCGtV2qzfDCaOlZqLwVNsErA,20,Gaming,"efootball, efootball 26, efootball 2026, efootball mobile, efootball gameplay, efootball review, efootball shadow hunt, efootball new skill, efootball cannavaro, efootball fabio cannavaro, efootball maldini, efootball paolo maldini, efootball de rossi, efootball daniele de rossi, efootball epic pack, efootball defensive meta, efootball defending, efootball gameplay mobile, efootball division gameplay, efootball meta, efootball best defenders, efootball tips, efootball guide",23,https://i.ytimg.com/vi/DJAxcudPFeg/hqdefault.jpg,en,en,False,1962,PT32M42S,hd,False,True,False,False,39948,2381,280
4x7jAkYT8PU,NG,2026-05-15T04:34:58.661286+00:00,2026-04-30T18:21:39Z,Eze yoyo,Eze yoyo,David Jones David - Topic,UCuMHJmb8zMq7zOALE1sNy-g,10,Music,"David Jones David, Eze yoyo",2,https://i.ytimg.com/vi/4x7jAkYT8PU/hqdefault.jpg,en,en,False,174,PT2M54S,hd,False,True,False,False,373743,7484,263
pjpvEJhatmU,NG,2026-05-15T04:34:58.661294+00:00,2026-05-11T19:00:06Z,NANA OFFICIAL TRAILER (2026) MOVIE ,NANA OFFICIAL TRAILER (2026) MOVIE ,Nazifi Asnanic,UC2_NcNiAYpZL9_07mk3ZDig,1,Film & Animation,,0,https://i.ytimg.com/vi/pjpvEJhatmU/hqdefault.jpg,ha,ha,False,186,PT3M6S,hd,False,True,False,False,45017,2090,77
IavIsAZ4QeA,NG,2026-05-15T04:34:58.661303+00:00,2026-05-14T12:00:35Z,KSI vs Erling Haaland: The Ultimate FC 26 Showdown,KSI vs Erling Haaland: The Ultimate FC 26 Showdown,Erling Haaland,UCOlyWftmF4SxONwrS1KUsxA,17,Sports,"erling haaland, erling, haaland, football, soccer, premier league, champions league, world cup, fifa, erling haaland highlights, earling haaland, erling haaland goals, man city, manchester city, norway, norway national team, erling haaland vlog, erling haaland documentary, erling haaland youtube, FIFA, fc 26, KSI, ksi vs erling haaland, sidemen, ea sports FC 26, haaland FIFA, HAALAND fc26",27,https://i.ytimg.com/vi/IavIsAZ4QeA/hqdefault.jpg,en-GB,en-GB,False,1013,PT16M53S,hd,False,True,False,False,473797,30502,1126
3BoEJKUGA_I,NG,2026-05-15T04:34:58.661311+00:00,2026-05-08T01:21:41Z,Mọ̀ Mọ́ọ̀ré (Reimagined Version),Mọ̀ Mọ́ọ̀ré (Reimagined Version),Adeyinka Alaseyori - Topic,UCM8ztZ5iHN1cw0mfJDMowtA,10,Music,"Adeyinka Alaseyori, Adeyinka Ruth Akinyemi, Mọ̀ Mọ́ọ̀ré (Reimagined Version)",3,https://i.ytimg.com/vi/3BoEJKUGA_I/hqdefault.jpg,yo,en,False,132,PT2M12S,hd,False,True,False,False,107049,1877,0
2eapKnGOgIM,NG,2026-05-15T04:34:58.661319+00:00,2026-05-13T10:59:02Z,KOLEOSO PART 11 Official Trailer (ON FIRE) Latest Yoruba 2026 Drama /Iteledicon/ibrahim chatta…..,KOLEOSO PART 11 Official Trailer (ON FIRE) Latest Yoruba 2026 Drama /Iteledicon/ibrahim chatta…..,Godsent ,UCaComf3UbpBa1Gtdsak8wlg,22,People & Blogs,,0,https://i.ytimg.com/vi/2eapKnGOgIM/hqdefault.jpg,en-GB,en,False,195,PT3M15S,hd,False,True,False,False,22509,371,11
JZslskzmggM,NG,2026-05-15T04:34:58.661328+00:00,2026-05-09T12:00:39Z,"Roman Reigns vs. Oba Femi: Raw, May 9, 2026 - No Disqualification Match","Roman Reigns vs. Oba Femi: Raw, May 9, 2026 - No Disqualification Match",MainEventGames,UC8921WlIEYiZtB5FV7onyBg,20,Gaming,"roman reigns vs oba femi, roman reigns vs oba femi wwe, wwe roman reigns vs oba femi, roman reigns vs oba femi 2026, oba femi vs roman reigns, oba femi vs roman reigns wwe, wwe oba femi vs roman reigns, roman reigns vs oba femi full match, roman reigns vs oba femi highlights, roman reigns vs oba femi wrestlemania, roman reigns oba femi, oba femi vs roman reigns full match, oba femi vs roman reigns highlights, oba femi vs roman reigns wrestlemania, wwe roman reigns vs. oba femi",15,https://i.ytimg.com/vi/JZslskzmggM/hqdefault.jpg,en-US,en,False,600,PT10M,hd,False,True,False,False,62292,356,0
uSJqro6SbLM,NG,2026-05-15T04:34:58.661337+00:00,2026-04-30T13:03:16Z,CHE CHE KULE,CHE CHE KULE,VMRs - Topic,UCHS4Wefne71ZLBRMJaLI3Yg,10,Music,"VMRs, CHE CHE KULE",2,https://i.ytimg.com/vi/uSJqro6SbLM/hqdefault.jpg,en,en,False,123,PT2M3S,hd,False,True,False,False,706189,11832,176
iepsX1tKEM0,NG,2026-05-15T04:34:58.661345+00:00,2026-04-30T22:00:51Z,HIGH SCHOOL WACKO | Official Trailer | This School Is Not Normal - MAY 3,HIGH SCHOOL WACKO | Official Trailer | This School Is Not Normal - MAY 3,KidBaby101 Tv,UCC2AUxp47AreX5goyKgUjyA,23,Comedy,,0,https://i.ytimg.com/vi/iepsX1tKEM0/hqdefault.jpg,en,en-GB,False,113,PT1M53S,hd,False,True,False,False,149729,1808,85
Caxv8tLATnc,NG,2026-05-15T04:34:58.661353+00:00,2026-05-09T16:00:15Z,I Got Hunted By 50 Pros,I Got Hunted By 50 Pros,MrBeast Gaming,UCIPPMRA040LQr5QPyJEbmXA,20,Gaming,,0,https://i.ytimg.com/vi/Caxv8tLATnc/hqdefault.jpg,en,en,False,1137,PT18M57S,hd,True,True,False,False,15340485,387693,16402
THizXD84uuE,NG,2026-05-15T04:34:58.661361+00:00,2026-04-30T17:00:45Z,"BillionBoi, Shoday & Olamide - COME KULOSA (OFFICIAL VIDEO)","BillionBoi, Shoday & Olamide - COME KULOSA (OFFICIAL VIDEO)",Shoday,UCK-8x3596zTbHUyb07R2oOA,10,Music,,0,https://i.ytimg.com/vi/THizXD84uuE/hqdefault.jpg,en,en,False,168,PT2M48S,hd,False,False,False,False,963953,12953,730
QQXHU5jQsh8,NG,2026-05-15T04:34:58.661369+00:00,2026-05-11T16:50:14Z,Marriage Is Not Enough 3 Yoruba Movie 2026 Official Trailer Showing Tomorrow On Yorubaplus,Marriage Is Not Enough 3 Yoruba Movie 2026 Official Trailer Showing Tomorrow On Yorubaplus,Yorubaplus,UCeAH89bVuCLxp7MPOBZFZNQ,24,Entertainment,"yoruba movies, yorubahood, free movies, ibakatv, latest yoruba movies today, yoruba movies 2025 new release today, trailers 2025 movies official, best yoruba movies 2024 new release, latest yoruba comedy movies, yoruba new release this week, trailers 2024 movies official",11,https://i.ytimg.com/vi/QQXHU5jQsh8/hqdefault.jpg,en,yo,False,112,PT1M52S,hd,False,True,False,False,9587,138,9
JCur2dpJdp8,NG,2026-05-15T04:34:58.661377+00:00,2026-05-10T21:51:57Z,Barcelona vs Real Madrid | EL CLÁSICO 2026 | La Liga | PES 21 Simulation Gameplay Video,Barcelona vs Real Madrid | EL CLÁSICO 2026 | La Liga | PES 21 Simulation Gameplay Video,Football Gamer Rony,UCaopyJz-EIXOXYXSMOC6c-g,20,Gaming,"real madrid vs barcelona, el clasico, real madrid, barcelona vs real madrid, football live, el clasico 2026, el clasico 2026 live, barcelona hoy, live football match online today, live, реал мадрид барселона, futbol live, эль класико 2026 прямой эфир, football, real vs barca, real madrid vs barcelona live, barca vs real madrid, football live match today, real madrid cf, madrid vs barcelona, live football, match en direct aujourd-hui",22,https://i.ytimg.com/vi/JCur2dpJdp8/hqdefault.jpg,en,en,False,906,PT15M6S,hd,False,True,False,False,998370,4506,4
YClx4ORl0g4,NG,2026-05-15T04:34:58.661386+00:00,2026-05-06T07:37:34Z,Rock Me Gentle,Rock Me Gentle,Olamide - Topic,UCewvfSec6vlYgRV_cnMjU3g,10,Music,"Olamide, Rock Me Gentle",2,https://i.ytimg.com/vi/YClx4ORl0g4/hqdefault.jpg,en,es,False,187,PT3M7S,hd,False,True,False,False,116681,2758,164
f_bKjZeJBBI,NG,2026-05-15T04:34:58.661394+00:00,2026-05-05T04:10:02Z,The Odyssey | Official New Trailer,The Odyssey | Official New Trailer,Universal Pictures,UCq0OueAsdxH6b8nyAspwViw,24,Entertainment,,0,https://i.ytimg.com/vi/f_bKjZeJBBI/hqdefault.jpg,en-US,en-US,False,152,PT2M32S,hd,True,True,False,False,21599978,308424,21257
GTh6ifCRw_k,NG,2026-05-15T04:34:58.661439+00:00,2026-05-09T23:00:27Z,I Became a God in Minecraft,I Became a God in Minecraft,Bionic,UCETZ7OiW7-wqwb-6hsz3C4w,20,Gaming,"minecraft, bionic, family friendly, i became a god in minecraft, minecraft god, god in minecraft, minecraft but you are a god, challenge",8,https://i.ytimg.com/vi/GTh6ifCRw_k/hqdefault.jpg,en,en,False,1371,PT22M51S,hd,False,True,False,False,926526,21477,1973
w-Bbuvgeb20,NG,2026-05-15T04:34:58.661458+00:00,2026-04-27T18:00:06Z,"Teni, Olamide - Zion (Official video)","Teni, Olamide - Zion (Official video)",Teni ,UCyKL3TXvxx5NTX7_MwiclCA,10,Music,,0,https://i.ytimg.com/vi/w-Bbuvgeb20/hqdefault.jpg,en,en,False,239,PT3M59S,hd,False,False,False,False,2771227,55329,3529
xfKt38Dz3XA,NG,2026-05-15T04:34:58.661472+00:00,2026-05-12T02:39:48Z,SHATU OFFICIAL TRAILER 2026,SHATU OFFICIAL TRAILER 2026,SadiqumarTv,UCIhXpFuGjDlX4fOZjC3b8rg,22,People & Blogs,,0,https://i.ytimg.com/vi/xfKt38Dz3XA/hqdefault.jpg,en,en,False,78,PT1M18S,sd,False,False,False,False,17163,434,5
EL5p6h37zO0,NG,2026-05-15T04:34:58.661480+00:00,2026-05-06T05:45:00Z,FULL MATCH: Roman Reigns vs. Oba Femi - Falls Count Anywhere | WWE Backlash 2026,FULL MATCH: Roman Reigns vs. Oba Femi - Falls Count Anywhere | WWE Backlash 2026,YEET! GAMING,UCGQSZ8dvxm8SE1J4SN0lK0A,24,Entertainment,,0,https://i.ytimg.com/vi/EL5p6h37zO0/hqdefault.jpg,en,en,False,1012,PT16M52S,hd,False,True,False,False,410671,2549,50
vCgsQiQu7Sg,NG,2026-05-15T04:34:58.661488+00:00,2026-05-07T23:02:54Z,Aanu Ni,Aanu Ni,BisiManuel - Topic,UCkygN1DOKOwU72Gg11fjF9g,10,Music,"BisiManuel, Aanu Ni",2,https://i.ytimg.com/vi/vCgsQiQu7Sg/hqdefault.jpg,en,und,False,223,PT3M43S,hd,False,True,False,False,59924,1063,33
x5lVXychHUQ,NG,2026-05-15T04:34:58.661496+00:00,2026-05-10T19:05:30Z,OKO OLOYUN - Latest Yoruba movie | I Official Trailer | Mide Martins | Victoria Adeboye,OKO OLOYUN - Latest Yoruba movie | I Official Trailer | Mide Martins | Victoria Adeboye,OGIDAN TV,UCLyzI6Ha8F_oyKMavcoHcPQ,24,Entertainment,,0,https://i.ytimg.com/vi/x5lVXychHUQ/hqdefault.jpg,en,yo,False,111,PT1M51S,hd,False,True,False,False,24294,517,32
CYCZV49nSK0,NG,2026-05-15T04:34:58.661504+00:00,2026-05-10T20:37:36Z,WEST HAM vs ARSENAL Live | Premier League 2026 | 10 May 2026 | Simulation PES 2021 Gameplay,WEST HAM vs ARSENAL Live | Premier League 2026 | 10 May 2026 | Simulation PES 2021 Gameplay,FERA HD,UC65x1bMXmtHI0-oYQkc56Ew,20,Gaming,,0,https://i.ytimg.com/vi/CYCZV49nSK0/hqdefault.jpg,en,en-US,False,11472,PT3H11M12S,hd,False,True,False,False,173646,745,1
w01EjKHvXPg,NG,2026-05-15T04:34:58.661512+00:00,2026-05-01T06:00:06Z,I HAVE ESCAPED - Lawrence Oyor,I HAVE ESCAPED - Lawrence Oyor,Lawrence Oyor,UCNeLs83EPGjX8Pz7wsiBckw,29,Nonprofits & Activism,"Lawrence Oyor, Pastor lawrence Oyor Songs, Lawrence Oyor SOngs, Bowl of Fire, My Daddy My Daddy, Lawrence Oyor Chants, Chants, Spiritual Songs, Spiritual SOngs and Chants, Prophetic Chants and songs, Apostle Joshua Selman, APostle Arome Osayi, Joshua Selman, Koinonia Messages 2020, Koinonia Messages 2019, Lawrence Oyor Messages 2020",16,https://i.ytimg.com/vi/w01EjKHvXPg/hqdefault.jpg,en,en,False,200,PT3M20S,hd,False,True,False,False,1057690,34739,2008
9kRS-Poescs,NG,2026-05-15T04:34:58.661521+00:00,2026-05-10T18:05:03Z,NOTHING IN ME 2 (OFFICIAL TRAILER) FT - PRINCE REN - LUCIFER - JAGABAN  - ULTIMATE VISUALZ,NOTHING IN ME 2 (OFFICIAL TRAILER) FT - PRINCE REN - LUCIFER - JAGABAN  - ULTIMATE VISUALZ,Ultimate Visualz,UCKpCXHx-zCR_dxZMB5kmBsw,24,Entertainment,"movie, nigeria, producer, director, top, latest, news, markangelcomedy, nollymovie.firstnolly, sex, full movie, emmanulla funny, jokes, music, latest movie, top nollywood movie, Selina Tested, Lightweight Entertainment, Jagaban, Aboy, Chiboy, #Odogwu, Tallest, Selina, #tested, Action, #Trending, #Gun Film, #HGC, Hit, Views, YouTube, caretaker series, Mark Angel, Broda Shaggi, Port Harcourt, Lagos, Abuja, Fans, behind the scene, Lightweight Tv, Davido, Wizkid, episode 20, episode 25, episode 26, episode 24",47,https://i.ytimg.com/vi/9kRS-Poescs/hqdefault.jpg,en,en,False,145,PT2M25S,hd,False,True,False,False,9834,504,39
Ha6QZZNCEbI,NG,2026-05-15T04:34:58.661529+00:00,2026-05-14T14:00:13Z,Prof BOF shows HOW TO GET FREE 9th Anniversary Celebration Contract & The BEST PLAYER TO PICK,Prof BOF shows HOW TO GET FREE 9th Anniversary Celebration Contract & The BEST PLAYER TO PICK,Bof games,UCozhavMC5oIn1JxjLuP6D8Q,20,Gaming,,0,https://i.ytimg.com/vi/Ha6QZZNCEbI/hqdefault.jpg,en,en,False,615,PT10M15S,hd,False,True,False,False,10799,804,123
uBZtioJsZAE,NG,2026-05-15T04:34:58.661536+00:00,2026-05-13T10:03:47Z,Hello,Hello,Tml Vibez - Topic,UCzMH4G_KqiJcgBR_MsIebsw,10,Music,"Tml Vibez, Victony, Hello",3,https://i.ytimg.com/vi/uBZtioJsZAE/hqdefault.jpg,en,en,False,171,PT2M51S,hd,False,True,False,False,15022,615,38
vhtCqsS1fQ0,NG,2026-05-15T04:34:58.661544+00:00,2026-04-14T20:06:50Z,NASCO Crunch Games Trailer! 🥣,NASCO Crunch Games Trailer! 🥣,NASCO CORNFLAKES,UCfDM5GdN2wBZ3DLt7PECwPQ,24,Entertainment,,0,https://i.ytimg.com/vi/vhtCqsS1fQ0/hqdefault.jpg,en,en,False,64,PT1M4S,hd,False,False,False,False,193823,161,16
B4h6xLGxskc,NG,2026-05-15T04:34:58.661551+00:00,2026-05-12T16:09:17Z,I Built Luis Enrique’s Greatest XI,I Built Luis Enrique’s Greatest XI,EvenMoreS2G,UC5IFLyNeALC8ShbQMe39Q_Q,20,Gaming,,0,https://i.ytimg.com/vi/B4h6xLGxskc/hqdefault.jpg,en,en,False,709,PT11M49S,hd,False,True,False,False,166644,7735,580
Plyj08_CMAI,NG,2026-05-15T04:34:58.661558+00:00,2026-05-14T21:00:06Z,"DJ Tunez, Wizkid - STATE OF MIND (Lyric Video)","DJ Tunez, Wizkid - STATE OF MIND (Lyric Video)",DJ Tunez,UCHGS5f4M5Ix1HEEFYB0e7Lg,10,Music,,0,https://i.ytimg.com/vi/Plyj08_CMAI/hqdefault.jpg,en,en,False,192,PT3M12S,hd,False,True,False,False,24149,3108,680
7i8PKBF3plY,NG,2026-05-15T04:34:58.661565+00:00,2026-05-11T17:00:26Z,The Boys Season 5 Episode 7 Trailer | 'The Penultimate Episode',The Boys Season 5 Episode 7 Trailer | 'The Penultimate Episode',Rotten Tomatoes TV,UCz1GPotHecuLngiLuY739QQ,1,Film & Animation,"The Boys, The Boys Trailer, The Boys Season 5 Episode 7 Trailer, The Boys S05 E07 Trailer, The Boys Season 5 episode 7 TV Trailer, The Boys Season 5 Episode 7 Trailer 2026, The Boys Season 5 Episode 7 Official Trailer, Trailer, TV Trailer, 2026 Trailers, 2026 TV Trailers, The Boys Trailer 1, The Boys Season 5 Prime Video, Prime Video, Entertainment, TV Series, Karl Urban, Jack Quaid, Antony Starr",19,https://i.ytimg.com/vi/7i8PKBF3plY/hqdefault.jpg,en,en,False,40,PT40S,hd,False,True,False,False,1448355,28691,3415
1rkJG96iKj8,NG,2026-05-15T04:34:58.661574+00:00,2026-05-11T02:23:57Z,🔴[PES 2021] Barcelona vs Real Madrid | BARÇA VENCE EL CÁSSICO E É CAMPEÃO LA LIGA | RESUMO GAMEPLAY,🔴[PES 2021] Barcelona vs Real Madrid | BARÇA VENCE EL CÁSSICO E É CAMPEÃO LA LIGA | RESUMO GAMEPLAY,Gamer BR - M1l Grau,UCNWfVQJcNYlKyR1gMkJQK6w,20,Gaming,,0,https://i.ytimg.com/vi/1rkJG96iKj8/hqdefault.jpg,pt-PT,pt-PT,False,315,PT5M15S,hd,False,True,False,False,258576,836,0
TKICNQfIRXE,NG,2026-05-15T04:34:58.661581+00:00,2026-05-09T19:39:37Z,Kodak Black - Time To Be Free [Official Music Video],Kodak Black - Time To Be Free [Official Music Video],Kodak Black,UChEYVadfkMCfrKUi6qr3I1Q,10,Music,"kodak, black, kodak black, atlantic records, roll in peace, codeine dreaming, tunnel vision, drowning, transportin, heart break kodak, project baby 2, Kodak Black Bill Israel, Bill Israel, Sniper, Sniper Gang, Hip Hop, Rap, Kodak Black I Knew It, Kodak Bill Israel, Kodak Black Easter in Miami, Easter, Easter in Miami, Kodak Easter, Kodak Black Haitian Boy Kodak, Haitian Boy Kodak, Kodak Black HBK, HBK, Kodak Black Happy Birthday Kodak, Happy Birthday Kodak",29,https://i.ytimg.com/vi/TKICNQfIRXE/hqdefault.jpg,en,en,False,184,PT3M4S,hd,False,False,False,False,500463,29119,2413
YyUE8TAufm4,NG,2026-05-15T04:34:58.661589+00:00,2026-05-11T17:00:07Z,"TORN TIES TRAILER - DANIEL ETIM EFFIONG, NONS_MIRAJ NINI MBONU, ONYEKA MERCY PREMIERING 13TH MAY","TORN TIES TRAILER - DANIEL ETIM EFFIONG, NONS_MIRAJ NINI MBONU, ONYEKA MERCY PREMIERING 13TH MAY",Nons_Miraj,UCSuszavwTcfUboVfnlbL5wQ,24,Entertainment,"Hunt Game Show, Nons Miraj, Nigerian Dating Show, Finding Love, Reality TV Nigeria, Blind Dating, Relationship Games, Love Match, Romantic Challenges, African Game Show, Matchmaking, Social Experiment, First Dates, Nigerian Entertainment, Pop the Balloon or Find Love, Pop the Balloon Dating Game, Blind Dating Challenges, Instant Matchmaking, First Impressions Game, Speed Dating Nigeria, Reality Love Show, Relationship Panel Show, Gen Z Dating Trends, Diaspora Dating",24,https://i.ytimg.com/vi/YyUE8TAufm4/hqdefault.jpg,en,en,False,104,PT1M44S,hd,False,True,False,False,11113,441,48
IB-FUsmGKFk,NG,2026-05-15T04:34:58.661597+00:00,2026-05-13T14:30:32Z,Most Expensive Player From Every Club,Most Expensive Player From Every Club,More Chuff,UC8QylkZmeGTi5Y2VR5bf7VA,20,Gaming,"Most Expensive Player From Every Club, fc26, eafc 26, eafc, ea sports fc 26, ea sports fc26, chuffsters, chuff, morechuff, chuffsters fc26, chuffsters eafc 26, football, soccer, squad builder fc26, fc26 tournament, fc26 gameplay, chuffsters ultimate team, ultimate team, fut, fut 26, ut, ut squad builder, ultimate team squad builder, ea sports fc, fifa ultimate team, fc26 squad builder, eafc 26 squad builder, fut squad builder, fc26 ultimate team, eafc ultimate team",30,https://i.ytimg.com/vi/IB-FUsmGKFk/hqdefault.jpg,en,en-GB,False,867,PT14M27S,hd,False,True,False,False,236470,5523,319
5IcLg2e_k44,NG,2026-05-15T04:34:58.661605+00:00,2026-05-07T10:01:29Z,Only God,Only God,Victor AD - Topic,UCL2v1BMEPw1_e7caoA257tQ,10,Music,"Victor AD, Timaya, Only God",3,https://i.ytimg.com/vi/5IcLg2e_k44/hqdefault.jpg,en,en,False,193,PT3M13S,hd,False,True,False,False,58652,1457,126
4jJwgwXMEmo,NG,2026-05-15T04:34:58.661612+00:00,2026-05-07T02:18:02Z,The Legend of Kitchen Soldier | Official Trailer | CJ ENM,The Legend of Kitchen Soldier | Official Trailer | CJ ENM,CJ ENM Global,UC1gAoHWGA87I2XHN_hdDmNQ,24,Entertainment,,0,https://i.ytimg.com/vi/4jJwgwXMEmo/hqdefault.jpg,en,es,False,47,PT47S,hd,False,True,False,False,71771,1410,47
IDUQFFTR4qQ,NG,2026-05-15T04:34:58.661619+00:00,2026-05-13T16:00:35Z,Can We Get NEMESIS RANK in Rivals?,Can We Get NEMESIS RANK in Rivals?,More Techy,UCzlUw75H5ILJ2l_ackxyI6A,20,Gaming,"roblox, funnyroblox, techyblox, techy, crazy fan girls, crazy fan girl, my crazy fan girls, girlfriend, roblox girlfriend",9,https://i.ytimg.com/vi/IDUQFFTR4qQ/hqdefault.jpg,en,en,False,940,PT15M40S,hd,False,True,False,False,200363,3970,463
60uWfDC5_h8,NG,2026-05-15T04:34:58.661627+00:00,2026-05-14T13:00:35Z,"Wale, Teni, Seyi Vibez - YSF (Official Video)","Wale, Teni, Seyi Vibez - YSF (Official Video)",WaleVEVO,UCVPW6Te5Xtk8n_QMRCKeVPQ,10,Music,"Wale, Teni, Seyi Vibez, Wale Music PS/ Def Jam, Hip Hop",5,https://i.ytimg.com/vi/60uWfDC5_h8/hqdefault.jpg,en,en,False,153,PT2M33S,hd,True,True,False,False,45227,3814,269
6B7K-81A8-A,NG,2026-05-15T04:34:58.661634+00:00,2026-05-14T09:00:20Z,[Official Trailer] หมาเห่าเครื่องบิน A Dog and A Plane,[Official Trailer] หมาเห่าเครื่องบิน A Dog and A Plane,GMMTV OFFICIAL​​,UC8BzJM6_VbZTdiNLD4R1jxQ,24,Entertainment,"GMMTV, จีเอ็มเอ็ม ทีวี, GMM Grammy",3,https://i.ytimg.com/vi/6B7K-81A8-A/hqdefault.jpg,th,en,False,224,PT3M44S,hd,True,True,False,False,246301,27777,1817
