video_id,country,fetched_at,published_at,title,localized_title,channel_title,channel_id,category_id,category_name,tags,tag_count,thumbnail,default_language,audio_language,is_live,duration,duration_raw,definition,caption_available,licensed_content,embeddable,made_for_kids,views,likes,comments
o_efMWgvEnU,GH,2026-02-19T03:22:08.944913+00:00,2026-02-13T05:57:06Z,Black Sherif - Top of the Morning (Official Video),Black Sherif - Top of the Morning (Official Video),BlackSherifVEVO,UCbQqL_yZhxMs5x14KIt18eQ,10,Music,"Black Sherif, Blacko Management EMPIRE, Rap/Hip-Hop",3,https://i.ytimg.com/vi/o_efMWgvEnU/hqdefault.jpg,en,en,False,229,PT3M49S,hd,False,True,False,False,1003884,24700,1306
-O40JQ7aLwg,GH,2026-02-19T03:22:08.944957+00:00,2026-02-18T15:06:33Z,EAST LEGON🤩SOE 4 OFFICIAL TRAILER FT. (KYEKYEKU 39/40 AHUOFE PATRICIA BENSON ELLA BENSON RALPH AMAN),EAST LEGON🤩SOE 4 OFFICIAL TRAILER FT. (KYEKYEKU 39/40 AHUOFE PATRICIA BENSON ELLA BENSON RALPH AMAN),NKB STUDIOS,UC9IGs7t5emnxGRIK8ajmA1w,23,Comedy,"#Akabenezercomedyvideos, #Abrewamafia, #nollywoodmovies, #Ghanaianmovies, #lovemovies, #nkbstudio, #awuramacomedymovies, #Gossip24, #KwadwoNkansahLilwyn, #NanaAmaMcBrown, #KyekyekuAbrewamafia, #VivianGil, #entertainment, #impossible, #comedy, #hilarious, #compilation, #reactions, #jokes, #laughing, #trynottolaugh, trending, #viralvideo, #kumawoodmovies, #borgacupali, #DrLikee, #yolo, #politics, #npp, #ndc, #kodaTv",31,https://i.ytimg.com/vi/-O40JQ7aLwg/hqdefault.jpg,en,fr,False,161,PT2M41S,hd,False,True,False,False,14044,1112,80
3ekNxeY0YA0,GH,2026-02-19T03:22:08.944970+00:00,2026-02-14T01:00:10Z,join stream now!!!,join stream now!!!,IShowSpeed,UCWsDFcIhY2DBi3GB5uykGXA,20,Gaming,,0,https://i.ytimg.com/vi/3ekNxeY0YA0/hqdefault.jpg,en,en,False,12905,PT3H35M5S,hd,False,False,False,False,1669505,48454,1242
vsZtj7AD-Eo,GH,2026-02-19T03:22:08.944980+00:00,2026-02-13T13:35:23Z,Sarkodie x Yaadman (FKA Yung L) - Wins & Losses (Official Music Video),Sarkodie x Yaadman (FKA Yung L) - Wins & Losses (Official Music Video),Sarkodie,UC3lnDRwdK-CD2xjO-16zmmg,10,Music,"Sarkcess, Sarkodie, Azonto, Hiphop, Hiplife, Ghana (Country), MiPROMO, Tema, Rapperholic, U Go Kill Me, Black Love, Alpha, Afrobeats, Adonai, FKA Yung L, Yaadman, Wins & Losses",17,https://i.ytimg.com/vi/vsZtj7AD-Eo/hqdefault.jpg,en,en,False,180,PT3M,hd,False,True,False,False,84588,6232,541
7dugE32yreI,GH,2026-02-19T03:22:08.944989+00:00,2026-02-08T19:30:07Z,Best Friends in the World: The Year Between (New Movie Trailer),Best Friends in the World: The Year Between (New Movie Trailer),Neptune3 Studios,UCCl71WmqkG8BjVuySOSCh_Q,1,Film & Animation,,0,https://i.ytimg.com/vi/7dugE32yreI/hqdefault.jpg,en,en,False,150,PT2M30S,hd,False,True,False,False,279286,18767,1761
w50J1jWfC2o,GH,2026-02-19T03:22:08.944998+00:00,2026-02-16T19:01:02Z,SIDEMEN AMONG US IS BACK,SIDEMEN AMONG US IS BACK,MoreSidemen,UCh5mLn90vUaB1PbRRx_AiaA,22,People & Blogs,"sidemen, moresidemen, miniminter, ksi, zerkaa, behzinga, tbjzl, vikkstar, wroetoshaw",9,https://i.ytimg.com/vi/w50J1jWfC2o/hqdefault.jpg,en,en-GB,False,3810,PT1H3M30S,hd,False,True,False,False,3715348,147590,13582
jRkEjCvn-NA,GH,2026-02-19T03:22:08.945007+00:00,2026-02-14T16:03:54Z,Kofi Kinaata - 10 Over 10 (Prod. By OT Woode),Kofi Kinaata - 10 Over 10 (Prod. By OT Woode),Kofi Kinaata,UCCWbYx5uFpAeI_Angc92mmA,10,Music,"Kofi Kinaata, Oh Azaay, Samini (Award Nominee), Ghana (Country), Episode, Music Video (TV Genre), Ghana Music, MiPROMOMedia, GhanaMusicdotcom, Dansoman (City/Town/Village), Sekondi-Takoradi (City/Town/Village), Dance (Interest), Susuka, Takoradi",14,https://i.ytimg.com/vi/jRkEjCvn-NA/hqdefault.jpg,en,en,False,184,PT3M4S,hd,False,True,False,False,48149,3421,310
kYFpTeL8ofQ,GH,2026-02-19T03:22:08.945016+00:00,2026-02-18T16:26:57Z,OH LILWIN - THE MOVIE (OFFICIAL TRAILER),OH LILWIN - THE MOVIE (OFFICIAL TRAILER),Wezzy Empire TV,UCoIhlANld_c72G5ofiY14_Q,23,Comedy,"Comedy, Lil Win, Kwadwo Nkansah, Akabenezer, Dr. Likee, Likee, Gh Comedy, Skits, Funny, Enjoy, Movies, Kumawood, Ghallywood, ghana Movies, Lol, Laugh",16,https://i.ytimg.com/vi/kYFpTeL8ofQ/hqdefault.jpg,en,en,False,155,PT2M35S,hd,False,True,False,False,2591,250,30
iNnnJjShEcc,GH,2026-02-19T03:22:08.945025+00:00,2026-02-18T08:00:53Z,MAN UNITED - MBEUMO + SESKO 106 🔥 PACK OPENING + GAMEPLAY 🔥,MAN UNITED - MBEUMO + SESKO 106 🔥 PACK OPENING + GAMEPLAY 🔥,9AL Games,UCvzTJH6G9bH5nCQ1Hfb8nGg,20,Gaming,"manchester united pack efootball, efootball 2026 mobile, efootball mobile, efootball mobile 2026, efootball 2025 mobile, bryan mbeumo efootball, efootball mobile review, benjamin sesko efootball, manchester united oack review e football, sesko efootball pack mu, football game mobile, mbeumo efootbal, efootball 26, man united, Sesko 106 bullet header, Sesko efootball, Mbeumo efootball",17,https://i.ytimg.com/vi/iNnnJjShEcc/hqdefault.jpg,en,en,False,1322,PT22M2S,hd,False,True,False,False,132674,13636,649
7JLIK8Fno5o,GH,2026-02-19T03:22:08.945034+00:00,2026-02-01T19:36:54Z,King Paluta - Ewor Me (ft. Kwabena Kwabena) (Official Video) ,King Paluta - Ewor Me (ft. Kwabena Kwabena) (Official Video) ,King Paluta,UCP2a-JAUTtTNfMY3KRBlKeQ,10,Music,"King Paluta, Ghana Music, Music, Videos, Music Videos, Afrobeats, Afropop, Ghana, Songs, AFRICA, New Music, Upon my sins, Afro sounds, Album, King Paluta Album, Ewor Me, Kwabena Kwabena, African Music",18,https://i.ytimg.com/vi/7JLIK8Fno5o/hqdefault.jpg,en,und,False,256,PT4M16S,hd,False,True,False,False,472455,7126,541
AFuE1LRxm80,GH,2026-02-19T03:22:08.945043+00:00,2026-02-04T18:00:00Z,WAR MACHINE | Official Trailer | Netflix,WAR MACHINE | Official Trailer | Netflix,Netflix,UCWOA1ZGywLbqmigxE4Qlvuw,24,Entertainment,"Alan Ritchson, Alan Ritchson War Machine, Armor Wars, Dennis Quaid, Jai Courtney, MCU, Marvel War Machine, Military Thriller, Netflix, New Movie Trailers, Patrick Hughes, Reacher Alan Ritchson, Sci-Fi Action, Sci-Fi Thriller 2026, Trailer, War Machine 2026, War Machine Movie, War Machine Netflix, War Machine Official Trailer, War Machine Trailer",20,https://i.ytimg.com/vi/AFuE1LRxm80/hqdefault.jpg,en,en-US,False,123,PT2M3S,hd,True,True,False,False,12572002,192083,15349
NYIqCGnTu9o,GH,2026-02-19T03:22:08.945052+00:00,2026-02-11T02:00:06Z,FIEND YETI SHOWCASE + Valentine's Event | Blox Fruits,FIEND YETI SHOWCASE + Valentine's Event | Blox Fruits,Gamer Robot,UC_xlDCBWQPlihORIZLWtpbA,20,Gaming,"blox fruits, admin, zioles, blox fruits admin, admin command, abusive admin, roblox, robux, trolling, troll, gift, indra, blox fruits update, blox fruits update 20, update 20, gamer robot, mygame43, blox fruits update 19, roblox blox fruits, family friendly, no cursing, blox fruit, blox fruits noob to pro, anime, race v4, cdk, soul guitar, leveling guide, blox fruits new code, new code, blox fruits code, pvp, el krazy, undercover admin, leaks, sneak peek, secret ability",37,https://i.ytimg.com/vi/NYIqCGnTu9o/hqdefault.jpg,en,en,False,375,PT6M15S,hd,False,True,False,False,2197944,103343,20087
EDMNZca4tqA,GH,2026-02-19T03:22:08.945062+00:00,2026-02-16T09:00:30Z,AratheJay - Talisman ft Stonebwoy(Official Music Video),AratheJay - Talisman ft Stonebwoy(Official Music Video),Arathejay,UC-KyFi1Y7qkbRbhxh3RkQTQ,10,Music,,0,https://i.ytimg.com/vi/EDMNZca4tqA/hqdefault.jpg,en,en,False,211,PT3M31S,hd,False,True,False,False,28123,2306,254
yG4pGxXBme0,GH,2026-02-19T03:22:08.945071+00:00,2026-02-11T13:38:51Z,SPIRITUALS 4 OFFICIAL TRAILER || THE WINLOS || FEBRUARY 15TH,SPIRITUALS 4 OFFICIAL TRAILER || THE WINLOS || FEBRUARY 15TH,The Winlos,UCS3HaOm0opcyM9i5RGeyO2A,24,Entertainment,"Should, Religion (TV Genre), Marry You (Musical Recording), Have, Been, Never, Much, Too, Late, Christmas, God (Deity), marry, Pop Music (Musical Genre)",13,https://i.ytimg.com/vi/yG4pGxXBme0/hqdefault.jpg,en,en,False,75,PT1M15S,hd,False,True,False,False,82870,3626,332
cgfEsTwq4i0,GH,2026-02-19T03:22:08.945080+00:00,2026-02-17T23:30:30Z,⚽ BENFICA 0 vs 1 REAL MADRID HIGHLIGHTS - UEFA Champions League 25/26 🏆 Simulación,⚽ BENFICA 0 vs 1 REAL MADRID HIGHLIGHTS - UEFA Champions League 25/26 🏆 Simulación,十Loork Football,UCfFNw7MaO7QmWkswaGFGEvA,20,Gaming,"benfica vs real madrid, benfica vs real madrid ucl, ucl, real madrid, real madrid en driecto, real madrid vs, benfica, uefa champions league, pelota libre, libre futbol, hes goal, pirlotv, roja directa, real madrid hoy, el chiringuito, la casaca futbol, casaca futbol, futbol digital, a puro futbol, deportes al taco, cabala futbolera",21,https://i.ytimg.com/vi/cgfEsTwq4i0/hqdefault.jpg,es-419,es-419,False,186,PT3M6S,hd,False,True,False,False,107533,553,1
HX2cgqnbk1A,GH,2026-02-19T03:22:08.945088+00:00,2026-02-17T18:00:31Z,Gunna - forever be mine (feat. Wizkid) [Official Video],Gunna - forever be mine (feat. Wizkid) [Official Video],Gunna,UCAkIMkEaa9sZmjcy7mfd5lQ,10,Music,"Gunna, YSL, YSL Gunna, Rap Music, Atlanta, Hip Hop, Drip Season, Drip, Fashion, Atlanta Rap, Atlanta Music, Atlanta Rap Music, Worldstarhiphop, The Fader, Wunna, Gunna - forever be mine (feat. Wizkid) [Official Visualizer], the last wun, The Last Wun, gunna the last wun, the last wun gunna, gunna new album, gunna album, gunna forever be mine ft wizkid, wizkid gunna forever be mine, gunna forever be mine, forever be mine gunna, forever be mine, gunna wizkid, wizkid, gunna ft wizkid",30,https://i.ytimg.com/vi/HX2cgqnbk1A/hqdefault.jpg,en,en,False,195,PT3M15S,hd,False,True,False,False,516251,42763,3949
BLGR4cvdgZQ,GH,2026-02-19T03:22:08.945097+00:00,2026-02-11T16:40:43Z,Gold Coast × Official TRAILER #kumawoodinuk2026 ,Gold Coast × Official TRAILER #kumawoodinuk2026 ,KODA MEDIA FILMS ,UCO0pzdLOJG5jCkLB3JHCI5Q,22,People & Blogs,,0,https://i.ytimg.com/vi/BLGR4cvdgZQ/hqdefault.jpg,en,en,False,120,PT2M,hd,False,True,False,False,14730,646,45
kBI909oqP5I,GH,2026-02-19T03:22:08.945105+00:00,2026-02-18T14:13:39Z,my Final Season with West Ham...,my Final Season with West Ham...,MoreS2G,UCw9rjdrpHa7mzNrWVJoaPgw,20,Gaming,,0,https://i.ytimg.com/vi/kBI909oqP5I/hqdefault.jpg,en,en-GB,False,1718,PT28M38S,hd,False,True,False,False,139664,9241,642
xlsXnNR8_Qk,GH,2026-02-19T03:22:08.945114+00:00,2026-02-06T07:00:04Z,Redemption (Lyric Video),Redemption (Lyric Video),Kwesi Arthur,UC1CwoVYDeQys8_cgIF6XoMQ,24,Entertainment,,0,https://i.ytimg.com/vi/xlsXnNR8_Qk/hqdefault.jpg,en,en,False,125,PT2M5S,hd,False,True,False,False,58552,1767,111
kVhDe9i6RJQ,GH,2026-02-19T03:22:08.945122+00:00,2026-02-18T14:00:09Z,"T.G.B.U (Official Trailer) - Movie Dropping Tomorrow, Thursday, 19th AT 6pm. Only on ESO DIKE TV.","T.G.B.U (Official Trailer) - Movie Dropping Tomorrow, Thursday, 19th AT 6pm. Only on ESO DIKE TV.",Eso Dike TV,UCKwrLHu5h9ypXn0RwIwVHCQ,22,People & Blogs,,0,https://i.ytimg.com/vi/kVhDe9i6RJQ/hqdefault.jpg,en,en,False,90,PT1M30S,hd,False,True,False,False,8046,431,32
NGwUUYERExQ,GH,2026-02-19T03:22:08.945130+00:00,2026-02-12T18:11:59Z,"Reacting To ""The Rise Of Foltyn""","Reacting To ""The Rise Of Foltyn""",Foltyn,UCRkuUgtDAL4XSU5jB40J_wA,20,Gaming,"foltyn, foltyn roblox, roblox, roblox foltyn, foltyn family, funny, no swearing, foltyn family roblox, roblox foltyn family, blade ball, roblox blade ball, foltyn blade ball, the rise of foltyn, the rise of caylus, foltyn and caylus, foltyn and caylus playing roblox, foltyn and caylus playing steal a brainrot",17,https://i.ytimg.com/vi/NGwUUYERExQ/hqdefault.jpg,en,en-US,False,838,PT13M58S,hd,False,True,False,False,3283795,97391,10853
tkJj_ItRSrA,GH,2026-02-19T03:22:08.945139+00:00,2026-02-06T11:00:11Z,King Promise & Mr Eazi - That Way  (OFFICIAL VIDEO),King Promise & Mr Eazi - That Way  (OFFICIAL VIDEO),Mr Eazi,UCSytDzPOmj1YV4_ctQOIdhg,10,Music,"mreazi, wizkid, davido, Eazi, emPawaAfrica, emPawa, Africa, Lagos, Nigeria, Accra, Ghana, joeboy, jderobie, whoisakin, cnatty, killertunes, empawa30, empawa100, Akonuche, Asake, King Promise, Shatta Wale, Wizkid, Omah Lay, Don Jazzy, Chris Brown",26,https://i.ytimg.com/vi/tkJj_ItRSrA/hqdefault.jpg,en,en,False,153,PT2M33S,hd,False,False,False,False,1023907,12794,657
HgMbkitzhEM,GH,2026-02-19T03:22:08.945148+00:00,2026-02-12T16:00:19Z,“Spider-Noir” – Authentic Black & White Teaser Trailer | Prime Video,“Spider-Noir” – Authentic Black & White Teaser Trailer | Prime Video,Prime Video,UCQJWtTnAHhEG5w4uN0udnUQ,24,Entertainment,"spider noir official teaser, spider noir teaser, spider noir 2026, official teaser, teaser, spider noir prime video, prime video spider noir, spider noir, tv show, prime video, prime, amazon, spider noir teaser trailer, spider noir show, nicholas cage, nicholas cage spider man noir, nicholas cage spider man, spider man, spider man into the spider verse, spider man brand new day, spider man noir, spider man noir teaser, spider man noir show, spider man teaser, black and white",25,https://i.ytimg.com/vi/HgMbkitzhEM/hqdefault.jpg,en,en,False,111,PT1M51S,hd,True,True,False,False,14957112,241686,10677
LyeIRtOO8BE,GH,2026-02-19T03:22:08.945158+00:00,2026-02-14T15:42:40Z,Aura Farming in Minecraft...,Aura Farming in Minecraft...,Skiddzie,UCWUxsoGia86OYIbxhjg68WQ,20,Gaming,"minecraft, minecraft aura",2,https://i.ytimg.com/vi/LyeIRtOO8BE/hqdefault.jpg,en,en,False,1822,PT30M22S,hd,False,True,False,False,359202,8039,721
5lX62h-x-v4,GH,2026-02-19T03:22:08.945166+00:00,2026-02-17T16:00:07Z,L'Oiseau Rare feat @Shattawalegh - MILLIONS ( Official Video ),L'Oiseau Rare feat @Shattawalegh - MILLIONS ( Official Video ),L’Oiseau Rare 8G+,UCk3mXn2zjEPh8tv9-QYwLzg,10,Music,,0,https://i.ytimg.com/vi/5lX62h-x-v4/hqdefault.jpg,fr,fr,False,222,PT3M42S,hd,False,False,False,False,302853,25463,3548
TYPTn63KCwQ,GH,2026-02-19T03:22:08.945174+00:00,2026-02-12T15:36:05Z,SILENT BETRAYER 💥 OFFICIAL TRAILER 💥 AARON. PORTIA. JENNY. SHIFO 39/40. BERNICE AND MORE ,SILENT BETRAYER 💥 OFFICIAL TRAILER 💥 AARON. PORTIA. JENNY. SHIFO 39/40. BERNICE AND MORE ,DARLING GH,UCz9uhSF0apVbkpl17zIIxZA,22,People & Blogs,,0,https://i.ytimg.com/vi/TYPTn63KCwQ/hqdefault.jpg,en,en,False,115,PT1M55S,hd,False,True,False,False,4075,262,9
pR7t_cH8B04,GH,2026-02-19T03:22:08.945183+00:00,2026-02-17T20:32:54Z,Girona vs Barcelona | La Liga 2026 | Full Match Streaming | PES 21 Simulation Gameplay,Girona vs Barcelona | La Liga 2026 | Full Match Streaming | PES 21 Simulation Gameplay,Football Gamer Rony,UCaopyJz-EIXOXYXSMOC6c-g,20,Gaming,"efootball, efootball pes 21, pes 21 gameplay, football game, pes 21, pes21, efootball pes 21 gameplay, live football, football live, football, football gamer rony",11,https://i.ytimg.com/vi/pR7t_cH8B04/hqdefault.jpg,en,en,False,875,PT14M35S,hd,False,True,False,False,134695,388,1
aMEh89zIL2g,GH,2026-02-19T03:22:08.945192+00:00,2026-02-11T10:04:41Z,Electric Energy,Electric Energy,Samini - Topic,UCgpxUWj5HBIDDWfz3bOE7Pg,10,Music,"Samini, Stonebwoy, Mix Master Garzy, ORIGIN8A, Electric Energy",5,https://i.ytimg.com/vi/aMEh89zIL2g/hqdefault.jpg,en,en,False,179,PT2M59S,hd,False,True,False,False,30022,845,145
co6PjsH6vgM,GH,2026-02-19T03:22:08.945201+00:00,2026-02-16T16:00:55Z,WITHOUT YOU (SHOWING NOW!!!) - OFFICIAL 2026 MOVIE TRAILER,WITHOUT YOU (SHOWING NOW!!!) - OFFICIAL 2026 MOVIE TRAILER,IBAKATV,UCm6NRZvIcYwpj79CIa1Lj9g,24,Entertainment,"nigerian movie, latest movies, full movie, free movies, Nollywood movies, Free movies, Watch nollywood free movies, Download movies, New movies, Trending Movies, Nigerian actress, Ruthkadiri247, nollywood, nollywood movies 2024, nollywood movies 2024 latest movies, latest nollywood movies 2024, maurice sam, free 2024 nollywood movies, download latest nollywood movies, UcheNancytv, Uchenna Mbunabo Tv, Mercyjohnsonokojie TV, Bambam, Uzor, Without you, Modola, Alex Cross, Your love",28,https://i.ytimg.com/vi/co6PjsH6vgM/hqdefault.jpg,en,en,False,108,PT1M48S,hd,False,True,False,False,104513,1849,190
bU8emuzp2BI,GH,2026-02-19T03:22:08.945210+00:00,2026-02-14T17:00:00Z,4 Pros vs 1000 Players,4 Pros vs 1000 Players,MrBeast Gaming,UCIPPMRA040LQr5QPyJEbmXA,20,Gaming,,0,https://i.ytimg.com/vi/bU8emuzp2BI/hqdefault.jpg,en,en,False,1255,PT20M55S,hd,True,True,False,False,11415178,302468,16166
FLZfDIjq5O4,GH,2026-02-19T03:22:08.945218+00:00,2026-02-13T08:00:00Z,SMALLGOD FT SARKODIE & JOSHUA BARAKA - FIRE,SMALLGOD FT SARKODIE & JOSHUA BARAKA - FIRE,Smallgod,UCFSwb7mkWJMTIdlxj9RHaig,10,Music,,0,https://i.ytimg.com/vi/FLZfDIjq5O4/hqdefault.jpg,en,en,False,173,PT2M53S,hd,False,False,False,False,79699,4447,416
OhHvHrDBru8,GH,2026-02-19T03:22:08.945226+00:00,2026-02-12T22:54:09Z,Untitled John Wick Game - Announce Trailer | PS5 Games,Untitled John Wick Game - Announce Trailer | PS5 Games,PlayStation,UC-2Y8dQb0S6DtpxNgAKoJKA,20,Gaming,"PlayStation, PS5, video games, next gen, Sony, Wick, John Wick, Ballerina, third-person shooter, game, AAA game, action game, shooter, PS5 shooter, PS5 pro shooter, John Wick game, state of play, sop",18,https://i.ytimg.com/vi/OhHvHrDBru8/hqdefault.jpg,en,en,False,122,PT2M2S,hd,True,True,False,False,3887546,219045,7910
83tmHxkYZ04,GH,2026-02-19T03:22:08.945234+00:00,2026-02-13T17:17:35Z,I Fixed the WORST Tottenham Side Ever…,I Fixed the WORST Tottenham Side Ever…,S2G,UChR1Yn7YpVrnP-SbsWtjuBA,20,Gaming,,0,https://i.ytimg.com/vi/83tmHxkYZ04/hqdefault.jpg,en-GB,en,False,1060,PT17M40S,hd,True,True,False,False,550944,22465,684
ZzvS6-a3kHs,GH,2026-02-19T03:22:08.945244+00:00,2026-01-31T05:35:29Z,Shatta Wale - Big Lie Dat - DJ MAC RIDDIM,Shatta Wale - Big Lie Dat - DJ MAC RIDDIM,Shatta Wale,UCb5XPdFG5KC05hy4mv0zi_A,10,Music,"Ghana Music, Dancehall, Reggae, Shatta Wale, afrobeats, hip hop, Bandana, Dancehall King",8,https://i.ytimg.com/vi/ZzvS6-a3kHs/hqdefault.jpg,en,en,False,139,PT2M19S,hd,False,False,False,False,198196,10448,2115
EV10OIiZQ5E,GH,2026-02-19T03:22:08.945252+00:00,2026-02-09T09:00:14Z,[Official Trailer] ONLY FRIENDS : DREAM ON,[Official Trailer] ONLY FRIENDS : DREAM ON,GMMTV OFFICIAL​​,UC8BzJM6_VbZTdiNLD4R1jxQ,24,Entertainment,"GMMTV, จีเอ็มเอ็ม ทีวี, GMM Grammy, ONLY FRIENDS, OnlyFriendsDreamOn, เอิร์ทมิกซ์, เอิร์ท พิรพัฒน์, มิกซ์ สหภาพ, จอสกวิน, จอส เวอาห์, กวิน แคสกี้, อู๋บูม, อู๋ ธนบูรณ์, บูม ธราธร, สุดยอด พัฐสิฏ, นีโอ ตรัย, ฟลุ๊ค ณัฐนนท์, ป๊อด ศุภกร",18,https://i.ytimg.com/vi/EV10OIiZQ5E/hqdefault.jpg,th,en,False,183,PT3M3S,hd,True,True,False,False,949437,70316,5518
PK1KZ9OfTME,GH,2026-02-19T03:22:08.945261+00:00,2026-02-13T20:52:22Z,roblox best gameplay,roblox best gameplay,StanRP,UCHYA5HNaS5n4idxmP-at8nA,20,Gaming,"StanRP, Stan RP, stanrp, stan rp",4,https://i.ytimg.com/vi/PK1KZ9OfTME/hqdefault.jpg,en-US,en,False,19,PT19S,hd,False,True,False,False,1137771,8610,8
W1Ul0eRfkeo,GH,2026-02-19T03:22:08.945270+00:00,2026-02-11T00:02:17Z,Fad Lan - ON MY MAMA (VISUALS),Fad Lan - ON MY MAMA (VISUALS),Fad Lan,UCj0O4MZWd5-75whlR7PsFsQ,10,Music,,0,https://i.ytimg.com/vi/W1Ul0eRfkeo/hqdefault.jpg,en,en-GB,False,155,PT2M35S,hd,False,True,False,False,21444,1204,135
e9HXmMnUEdE,GH,2026-02-19T03:22:08.945278+00:00,2026-02-02T00:59:56Z,The Devil Wears Prada 2 | Official Trailer,The Devil Wears Prada 2 | Official Trailer,20th Century Studios,UC2-BeLxzUBSs0uSrmzWhJuQ,1,Film & Animation,Trailer,1,https://i.ytimg.com/vi/e9HXmMnUEdE/hqdefault.jpg,en,en,False,100,PT1M40S,hd,True,True,False,False,10240871,168264,6600
lKG3ayVNeIM,GH,2026-02-19T03:22:08.945286+00:00,2026-02-16T22:47:48Z,🔴Live- Girona vs Barcelona | Spanish LaLiga 2025/26 Match | PES21 Game Simulation,🔴Live- Girona vs Barcelona | Spanish LaLiga 2025/26 Match | PES21 Game Simulation,Mona Football,UC-TE4CuE7wKfX6LmeESAjZQ,20,Gaming,,0,https://i.ytimg.com/vi/lKG3ayVNeIM/hqdefault.jpg,en,en,False,8840,PT2H27M20S,hd,False,True,False,False,38017,87,2
pfvHOUZ5QpU,GH,2026-02-19T03:22:08.945295+00:00,2026-02-12T08:00:07Z,Piesie Esther & Kweku Teye - Calvary Sunsum,Piesie Esther & Kweku Teye - Calvary Sunsum,Piesie Esther,UCli_QDorO9szrEomXPNko3A,10,Music,"Piesie Esther, Opiesie Esther, Gospel, ghana, way3 me yi3, mo",6,https://i.ytimg.com/vi/pfvHOUZ5QpU/hqdefault.jpg,en,en,False,770,PT12M50S,hd,False,False,False,False,25975,1630,138
mbtgEE6rkxw,GH,2026-02-19T03:22:08.945303+00:00,2026-02-02T13:58:03Z,Michael (2026) Official Trailer - Jaafar Jackson,Michael (2026) Official Trailer - Jaafar Jackson,Lionsgate Movies,UCJ6nMHaJPZvsJ-HmUmj1SeA,1,Film & Animation,"Michael, Michael 2026, Michael Jackson, Antoine Fuqua, John Logan, Jaafar Jackson, Colman Domingo, Nia Long, Miles Teller, Laura Harrier, Kat Graham, Larenz Tate, biopic, musical drama, King of Pop, music biopic, pop music, dance, performance, rhythm, groove, melody, songwriting, singing, record industry, chart-topping, legacy, icon, Billie Jean, Beat It, Smooth Criminal, Man in the Mirror, Black or White, Rock With You, Heal the World, Moonwalk, Motown, 80s music, pop legend",39,https://i.ytimg.com/vi/mbtgEE6rkxw/hqdefault.jpg,en,en,False,138,PT2M18S,hd,True,True,False,False,10883878,183999,12608
3TmloxKy6Jo,GH,2026-02-19T03:22:08.945312+00:00,2026-02-14T17:22:43Z,🔴 BLOX FRUITS VALENTINE UPDATE 29.5 OFFICIAL COUNTDOWN!,🔴 BLOX FRUITS VALENTINE UPDATE 29.5 OFFICIAL COUNTDOWN!,Kitt Gaming,UCOZsMcbEwVbEIKW4nMNTIVA,20,Gaming,"blox fruits, blox fruit, Blox fruit live, kitt gaming, Rip_indra, gamer robot, Mygame43, Axiore, Zioles, blox fruits update 24, blox fruits update 23, blox fruits update 22, blox fruits update 25",13,https://i.ytimg.com/vi/3TmloxKy6Jo/hqdefault.jpg,en-US,en-US,False,7913,PT2H11M53S,hd,False,True,False,False,236784,15378,863
-cgTFSrmrwQ,GH,2026-02-19T03:22:08.945321+00:00,2026-02-13T19:00:06Z,CENTRAL CEE - SLAUGHTER (FEAT. J HUS) (MUSIC VIDEO),CENTRAL CEE - SLAUGHTER (FEAT. J HUS) (MUSIC VIDEO),Central Cee,UCV_CsAy5CNBX_uwDQ7RMe1Q,10,Music,"CENTRAL CEE, CENTRALCEE, CENTRAL CEE NEW SONG, CENTRAL CEE NEW VIDEO, JHUS, J HUS, JHUS NEW SONG, JHUS NEW VIDEO, J HUS NEW SONG, J HUS NEW VIDEO",10,https://i.ytimg.com/vi/-cgTFSrmrwQ/hqdefault.jpg,en,en,False,163,PT2M43S,hd,False,False,False,False,1744193,96962,4742
6zmKcUa4Xxk,GH,2026-02-19T03:22:08.945330+00:00,2026-02-03T14:00:00Z,The Drama | Official Trailer HD | A24,The Drama | Official Trailer HD | A24,A24,UCuPivVjnfNo4mb3Oog_frZg,1,Film & Animation,"a24, a24 films, a24 trailers, independent films, trailer, HD, official, movie, film, a24 movies, oscar winner, academy award winner",12,https://i.ytimg.com/vi/6zmKcUa4Xxk/hqdefault.jpg,en,en,False,137,PT2M17S,hd,True,True,False,False,10936145,102492,3469
O8-T0VL0CWw,GH,2026-02-19T03:22:08.945338+00:00,2026-02-14T16:00:27Z,I Bought Abandoned Bases in Steal a Brainrot...,I Bought Abandoned Bases in Steal a Brainrot...,Techys,UCoRjsuzMh-MqfRjvlqaVLPw,20,Gaming,,0,https://i.ytimg.com/vi/O8-T0VL0CWw/hqdefault.jpg,en,en,False,815,PT13M35S,hd,False,True,False,False,803025,23646,3403
N9UKZMQz_MA,GH,2026-02-19T03:22:08.945347+00:00,2026-02-13T19:00:31Z,Akwaboah X Sarkodie - You Know (Visualizer),Akwaboah X Sarkodie - You Know (Visualizer),Akwaboah,UCuYFI7mEqu6FjqeHKqytPSQ,10,Music,"I Do Love You, Akwaboah, Ghana (Country), Ghana Music, Afro Pop, African Popular Music (Musical Genre), Loretta French, Official, Love (Quotation Subject), Medo, You Love, Mother's Day, Mama, Mother, God Bless U Mama, Matters Of The Heart, Sarkodie, Sarkcess Music",18,https://i.ytimg.com/vi/N9UKZMQz_MA/hqdefault.jpg,en,en,False,153,PT2M33S,hd,False,False,False,False,25809,1215,96
ZmEx7wQI6RY,GH,2026-02-19T03:22:08.945355+00:00,2026-01-22T14:00:27Z,Masters of The Universe – Official Teaser Trailer,Masters of The Universe – Official Teaser Trailer,Amazon MGM Studios,UCf5CjDJvsFvtVIhkfmKAwAA,24,Entertainment,"MGM, MGM Studios, Metro-Goldwyn- Mayer, Metro Pictures Corporations, Goldwyn Pictures, Louis B. Mayer Pictures, MGM Pictures, United Artists, Metro MGM/UA, Amazon MGM, Amazon MGM Studios, Amazon, Masters Of The Universe, Masters Of The Universe Teaser, Masters Of The Universe Movie, Masters Of The Universe 2026, Masters Of The Universe Preview, Nicholas Galitzine, Morena Baccarin, Idris Elba, Jared Leto, Alison Brie, Kristen Wig",23,https://i.ytimg.com/vi/ZmEx7wQI6RY/hqdefault.jpg,en,en-US,False,145,PT2M25S,hd,True,True,False,False,28897314,106413,19594
f_aRA-KcTQs,GH,2026-02-19T03:22:08.945364+00:00,2026-02-14T14:00:18Z,Unstable SMP: The LAW,Unstable SMP: The LAW,Wemmbu,UCkzzNLnuM-VsATWC53ehwOQ,20,Gaming,"wemmbu, flamefrags, unstable smp, wemmbu vs flamefrags, wemmbu unstable smp, wemmbu farlands, minecraft farlands, wemmbu minecraft, wemmbu orbital cannon, orbital strike cannon, unstable universe, wemmbu unstable universe, weembu, wembu, wemmbu dead, wemmbu unstable dead, wemmbu death, wemmbu flamefrags, 2 Minecraft Pros VS 1000 Players, wemmbu vs 1000 players, minutetech, wemmbu minutetech, unstable smp law, I Became King of the Unstable SMP, parrotx2, parrot, parrot unstable smp",27,https://i.ytimg.com/vi/f_aRA-KcTQs/hqdefault.jpg,en-US,en-US,False,7085,PT1H58M5S,hd,False,True,False,False,4836135,221258,29610
RwlT3hESUBA,GH,2026-02-19T03:22:08.945371+00:00,2026-02-17T02:01:10Z,YoungBoy Never Broke Again - HeadTap [Official Video],YoungBoy Never Broke Again - HeadTap [Official Video],YoungBoy Never Broke Again,UClW4jraMKz6Qj69lJf-tODA,10,Music,"YoungBoy Never Broke Again, NBA YoungBoy, YoungBoy Quando Rondo, YoungBoy Leak, Make No Sense YoungBoy, Youngboy Lost Motives, YoungBoy NBA Music Video, YoungBoy Never Broke Again TOP, nba youngboy top, YoungBoy NBA TOP album, 7KTt4_M09Rw, 0C80BSgjb8M, qChxuVxs8FA, dYk-yCsuTUo, 6MCSr65d9Xc, ALimx-H8C6s, YoungBoy Never Broke Again Sincerely Kentrell, Sincerely Kentrell, Youngboy NBA Sincerely Kentrell, Sincerely Kentrell album, YBNBA Sincerely Kentrell, YB Sincerely Kentrell, Kentrell",23,https://i.ytimg.com/vi/RwlT3hESUBA/hqdefault.jpg,en,en,False,133,PT2M13S,hd,False,False,False,False,737607,65778,4923
