video_id,country,fetched_at,published_at,title,localized_title,channel_title,channel_id,category_id,category_name,tags,tag_count,thumbnail,default_language,audio_language,is_live,duration,duration_raw,definition,caption_available,licensed_content,embeddable,made_for_kids,views,likes,comments
03AWrqyioqI,IL,2026-05-20T04:46:29.785938+00:00,2026-05-05T11:30:34Z,יהונתן שתיוי - גיב מי דאט (Prod. by Shchori),יהונתן שתיוי - גיב מי דאט (Prod. by Shchori),יהונתן שתיוי,UCY1-lBig65WyWSb0OV6M1qw,10,Music,"givemethat, גיבמידאט, יהונתןשתיוי, פופ, שירחדש, 2026, שתיוי, יהונתן, תניליאתזה",9,https://i.ytimg.com/vi/03AWrqyioqI/hqdefault.jpg,iw,iw,False,118,PT1M58S,hd,False,False,False,False,248271,2079,499
SJPu1spHqfk,IL,2026-05-20T04:46:29.785946+00:00,2026-04-30T12:59:32Z,RESIDENT EVIL – Official Teaser Trailer (4K),RESIDENT EVIL – Official Teaser Trailer (4K),Sony Pictures Entertainment,UCz97F7dMxBNOfGYu3rx8aCw,24,Entertainment,,0,https://i.ytimg.com/vi/SJPu1spHqfk/hqdefault.jpg,en,en,False,114,PT1M54S,hd,True,True,False,False,4245148,171443,18575
vS2ehZnxGnk,IL,2026-05-20T04:46:29.785953+00:00,2026-05-18T11:16:26Z,فلم قراند : حبيبة زعرور الجميلة الشرطية تحبس زعرور في اصغر سجن في العالم🔥😂,فلم قراند : حبيبة زعرور الجميلة الشرطية تحبس زعرور في اصغر سجن في العالم🔥😂,Ahmad GTA Family - عائلة احمد قراند ,UCQkLgXGjPbIrrNtT8ZtHOmg,22,People & Blogs,"مصطفى GAME OVER, Mr GG, XTREEM - اكستريم, اوكا - OKA, AboFlah, Mkamel GG, رانيا كيمنك Rania Gaming, BOZEX, هاردلك | hardlk, افلام, ماين كرافت, فلم ماين كرافت, غني وفقير, فايتر Fighter, ابو فله, فايتر, افلام ماين كرافت, الغني و الفقير, كوكب, ماين, MineCraft Movie, Suhaib - صهيب, جلمود - GLMooD, تايمو Tymo, هاردلك HARDLK, Ahmad M4 - احمد ام فور, بطل, Ahmad Hero - احمد البطل, احمد هيرو, سمبوسة - Sambosa, جعطوط - JATOOT, خزان, طيران, P4GAM3R, قراند, عقارات, اسهم, استثمار, عملات, دولار, شركات",41,https://i.ytimg.com/vi/vS2ehZnxGnk/hqdefault.jpg,ar,ar,False,1021,PT17M1S,hd,False,True,False,False,456664,5162,197
HuXQt07KjYc,IL,2026-05-20T04:46:29.785962+00:00,2026-05-08T17:00:20Z,Tebaa'n Tebaa'n,Tebaa'n Tebaa'n,Sherine - Topic,UCsLsnDUzLX_Pq7ZkVQESnxQ,10,Music,"Sherine, Tebaa'n Tebaa'n, تباعاً تباعاً",3,https://i.ytimg.com/vi/HuXQt07KjYc/hqdefault.jpg,en,ar,False,247,PT4M7S,hd,False,True,False,False,2511927,35388,2205
m7DoP3f7-7w,IL,2026-05-20T04:46:29.785969+00:00,2026-05-19T19:35:38Z,🔴 לייב קטלני 🔴 משדר גם בקיק?! 🔴 גאוגסר?! 🔴 פורטנייט?! 🔴 משחק אימה?! 🔴 ארפי?!?! 🔴 דייט?!? 🔴,🔴 לייב קטלני 🔴 משדר גם בקיק?! 🔴 גאוגסר?! 🔴 פורטנייט?! 🔴 משחק אימה?! 🔴 ארפי?!?! 🔴 דייט?!? 🔴,דושי,UCO0voeGPFj_NADqwLMThPVA,20,Gaming,"לייב, גיימינג, דושי",3,https://i.ytimg.com/vi/m7DoP3f7-7w/hqdefault.jpg,iw,iw,False,22572,PT6H16M12S,hd,False,True,False,False,12525,779,5
foy3MEZTP50,IL,2026-05-20T04:46:29.785976+00:00,2026-05-05T07:00:05Z,שרית חדד - המזרח הרחוק (Prod. By Matan Dror),שרית חדד - המזרח הרחוק (Prod. By Matan Dror),SaritHadadOfficial,UC0m-czKbg-tL7J61RDdU1rg,10,Music,"שרית חדד, sarit hadad, מזרחית, מוסיקה ישראלית, שרה שרה, חגיגה, הייתי בגן עדן, למה לי, קרוסלה, ישמח חתני, פרחה במרצדס, חיכיתי לו, המזרח הרחוק",13,https://i.ytimg.com/vi/foy3MEZTP50/hqdefault.jpg,iw,iw,False,190,PT3M10S,hd,False,True,False,False,572202,1853,155
wvWDgRyEmZE,IL,2026-05-20T04:46:29.785984+00:00,2026-05-19T11:01:13Z,دخلت ماب التسلق وصدمت اصغر متابعين بلعالم 💀🔥 ( حصلت عنكبوت ) !! Fortnite,دخلت ماب التسلق وصدمت اصغر متابعين بلعالم 💀🔥 ( حصلت عنكبوت ) !! Fortnite,Hamza I حمزة ,UCj8z8d3XHXvat5_2--8-VGw,20,Gaming,"حمزة, حمزة اخو سبايدر, اخو سبايدر, سبايدر اخي, حمزة سبايدر, سبايدر حمزة, فورت نايت, فورتنايت, قلتش, اقوى لاعب, لاعب, عربي, باور, تحديات, تحدي, سر, اسرار, قلتشات, تجربة, سيزون, فورت القديمة, سيزون فورت نايت, سيزون جديد, موسم جديد, سونك, اخ سبايدر",26,https://i.ytimg.com/vi/wvWDgRyEmZE/hqdefault.jpg,ar,ar,False,1077,PT17M57S,hd,False,True,False,False,126502,4239,188
lbVa-fcbfDQ,IL,2026-05-20T04:46:29.785992+00:00,2026-05-19T07:00:25Z,נתנאל ששון - סטלה עבאד,נתנאל ששון - סטלה עבאד,נתנאל ששון הערוץ הרשמי,UCiqUaC3M3E1SPkK98cPXiZg,10,Music,"נתנאל ששון, סטלה עבאד",2,https://i.ytimg.com/vi/lbVa-fcbfDQ/hqdefault.jpg,iw,iw,False,227,PT3M47S,hd,False,False,False,False,11595,649,62
