video_id,country,fetched_at,published_at,title,localized_title,channel_title,channel_id,category_id,category_name,tags,tag_count,thumbnail,default_language,audio_language,is_live,duration,duration_raw,definition,caption_available,licensed_content,embeddable,made_for_kids,views,likes,comments
VFH6mJHFILc,IL,2026-05-20T04:46:29.785535+00:00,2026-05-17T07:00:15Z,אודיה - עשר רמות מעליו (Prod. By Matan Dror),אודיה - עשר רמות מעליו (Prod. By Matan Dror),אודיה - הערוץ הרשמי,UCKTbyJY0d-WRwFrXjBtETQQ,10,Music,"אודיה, עשר רמות מעליו",2,https://i.ytimg.com/vi/VFH6mJHFILc/hqdefault.jpg,iw,iw,False,161,PT2M41S,hd,False,True,False,False,348972,4878,279
Ks_VD4xy8ow,IL,2026-05-20T04:46:29.785602+00:00,2026-05-17T17:32:48Z,The Boys Season 5 Episode 8 Series Finale Trailer,The Boys Season 5 Episode 8 Series Finale Trailer,Rotten Tomatoes TV,UCz1GPotHecuLngiLuY739QQ,1,Film & Animation,"The Boys, The Boys Trailer, The Boys Season 5 Episode 8 Trailer, The Boys S05 E08 Trailer, The Boys Season 5 episode 8 TV Trailer, The Boys Season 5 Episode 8 Trailer 2026, The Boys Season 5 Episode 8 Official Trailer, Trailer, TV Trailer, 2026 Trailers, 2026 TV Trailers, The Boys Series Finale, The Boys Season 5 Prime Video, Prime Video, Entertainment, TV Series, Karl Urban, Jack Quaid, Antony Starr",19,https://i.ytimg.com/vi/Ks_VD4xy8ow/hqdefault.jpg,en,en,False,46,PT46S,hd,False,True,False,False,1894292,44126,4873
u7MbpiyLK9k,IL,2026-05-20T04:46:29.785616+00:00,2026-05-19T11:30:36Z,קרב אגרוף על הלב של שיילי.. (ישראל נגד בןבן!!),קרב אגרוף על הלב של שיילי.. (ישראל נגד בןבן!!),TheCohen,UCLd_HE2306q-Y9ZB805GyBA,20,Gaming,"דה כהן, TheCohen, the cohen, קוהן, כהן, כוהן, דה כוהן, עידן, לייב, רובלוקס, סקאמר, דהקוקי, מאסטר אוהד, סקאם גט סקאם, לייב רובלוקס, דה כהן רובלוקס, סטיל אה בריינרוט, צייד הסקאמרים, ציד הסקאמרים, דה כהן צייד הסקאמרים, רובלוקוס, ROBLOX, STEAL A BRINROT, STEAL A BRIANROT, סמי, דה כהן סמי, SAMMY, דהכהן, סקאם, בלאגן, בראול סטארס, ברול סטרס, דה כהן בראול, בריינרוט, מתחזה, שילי, בןבן, בן בן, שיילי, בית ספר, אוהד, משחק, גיימינג, דה קוקי, מצחיק, מצחיק מאוד, משחקים, ברול סטארס, נסו לא לצחוק, שילי הברזילאית",50,https://i.ytimg.com/vi/u7MbpiyLK9k/hqdefault.jpg,iw,iw,False,584,PT9M44S,hd,False,True,False,False,38358,1734,410
dTC6-lWC_B0,IL,2026-05-20T04:46:29.785629+00:00,2026-05-17T09:00:07Z,אושר כהן - בדיוק ככה,אושר כהן - בדיוק ככה,Osher Cohen Music,UCEvY_JhVK0Z32GAo6uG-_YA,10,Music,"בדיוק ככה, אושר כהן",2,https://i.ytimg.com/vi/dTC6-lWC_B0/hqdefault.jpg,iw,iw,False,240,PT4M,hd,False,True,False,False,147800,2266,84
e5QW457407U,IL,2026-05-20T04:46:29.785637+00:00,2026-05-19T15:01:22Z,"""Spider-Noir"" - True-Hue Full Color Final Trailer | Prime Video","""Spider-Noir"" - True-Hue Full Color Final Trailer | Prime Video",Prime Video,UCQJWtTnAHhEG5w4uN0udnUQ,24,Entertainment,"spider noir teaser trailer, spider noir show, nicholas cage, nicholas cage spider man noir, nicholas cage spider man, spider man, spider man into the spider verse, spider man brand new day, spider man noir, spider man noir teaser, spider man noir show, spider man teaser, black and white, spider noir prime video, nicholas cage spider noir, spider man noir into the spider verse, nicolas cage movies, spider noir trailer, spider noir official trailer, nicolas cage",20,https://i.ytimg.com/vi/e5QW457407U/hqdefault.jpg,en,en,False,150,PT2M30S,hd,True,True,False,False,481817,22505,873
sf50npzcEWQ,IL,2026-05-20T04:46:29.785646+00:00,2026-05-17T11:00:35Z,הדרבי של בילוקס FC!,הדרבי של בילוקס FC!,BluxPlays,UCswRxzPrG06VTY1BwEI_0OA,20,Gaming,"אליאור בילוקס, ELIORBLUX, בילוקס פלייז, בילוקספלייז, אליאור, בילוקס, פיפא, פתיחת חבילות, כדורגל, משחקים, מצחיק, קריירה, פעם מלך תמיד מלך, ֿאולטימייט טים, כדורגל ישראלי, ולוגים, אתגרי אוכל, בילוקסיניו, בילוקס FC, בילוקס אפסי, מונדיאל, גיימינג",22,https://i.ytimg.com/vi/sf50npzcEWQ/hqdefault.jpg,iw,iw,False,1533,PT25M33S,hd,False,True,False,False,46711,2364,230
HCtYCl63tFA,IL,2026-05-20T04:46:29.785655+00:00,2026-05-05T07:58:19Z,ששון איפרם שאולוב - נווה הדרים (Prod. by Matan Dror),ששון איפרם שאולוב - נווה הדרים (Prod. by Matan Dror),ששון איפרם שאולוב,UCehDC9d0itf_4Ylpknlh8iA,10,Music,,0,https://i.ytimg.com/vi/HCtYCl63tFA/hqdefault.jpg,iw,iw,False,189,PT3M9S,hd,False,False,False,False,1164249,6330,320
XmcIjxwLJcY,IL,2026-05-20T04:46:29.785663+00:00,2026-05-18T15:00:27Z,Lanterns | Official Teaser 2 | HBO Max,Lanterns | Official Teaser 2 | HBO Max,HBO Max,UCx-KWLTKlB83hDI6UKECtJQ,24,Entertainment,"hbo max, hbo, hbo originals, hbo original series, hbo trailer, new on hbo, max, hbo max originals, hbo max trailer, hbo max teaser, hbo max series, hbo max youtube",12,https://i.ytimg.com/vi/XmcIjxwLJcY/hqdefault.jpg,en,en,False,118,PT1M58S,hd,False,True,False,False,1855751,83125,5777
efAwt5CLWQM,IL,2026-05-20T04:46:29.785671+00:00,2026-05-17T19:40:37Z,לייב מסרביה פוקוס בגמר הטורניר הכי חשוב שלו !!,לייב מסרביה פוקוס בגמר הטורניר הכי חשוב שלו !!,Cycnic,UCEsLByjuhVYNE8O-EX6MYmA,20,Gaming,"סייקניק, סיקניק, פורטנייט, סיקניק פורטנייט, cycnic fortnite, סייקניק פורטניט, לייב, cyc, CYC קוד, לייב עונה חדשה ומטורפת !! מחלק לכם פרסים, לייב 0 פינג עם פוקוס !! מחלק לכם ציוד מטורף, לייב מחלק לכם פרסים וטורניר של פוקוס על מיליון דולר !!, לייב בודקים מי הכי טוב בישראל ב1על1? (טורניר), לייב עונה חדשה המסע לאנריל מתחיל !! (משדר גם בקיק🟢), לייב מסרביה פוקוס בטורניר על 300, 000 ש''ח!, לייב מסרביה פוקוס בטורניר על 10, 000 דולר!!, לייב מסרביה פוקוס בגמר הטורניר הכי חשוב שלו !!",19,https://i.ytimg.com/vi/efAwt5CLWQM/hqdefault.jpg,iw,iw,False,17222,PT4H47M2S,hd,False,True,False,False,39388,1805,2
eaqW5eQXTdM,IL,2026-05-20T04:46:29.785681+00:00,2026-05-19T07:00:27Z,עדן חסון & אופק אדנק מארחים את אגם בוחבוט - איך שהיא רוקדת (Prod. By Nuri),עדן חסון & אופק אדנק מארחים את אגם בוחבוט - איך שהיא רוקדת (Prod. By Nuri),עדן חסון - Eden Hason,UCFmc1S3LEovsxhK73yi6_gg,10,Music,,0,https://i.ytimg.com/vi/eaqW5eQXTdM/hqdefault.jpg,iw,hi,False,157,PT2M37S,hd,False,True,False,False,89576,2533,246
QurZzARCihA,IL,2026-05-20T04:46:29.785691+00:00,2026-05-19T17:00:16Z,Honest Trailers | Project Hail Mary,Honest Trailers | Project Hail Mary,Screen Junkies,UCOpcACMWblDls9Z6GERVi1A,1,Film & Animation,,0,https://i.ytimg.com/vi/QurZzARCihA/hqdefault.jpg,en,en,False,483,PT8M3S,hd,False,True,False,False,221403,13341,999
O02awfejn9A,IL,2026-05-20T04:46:29.785699+00:00,2026-05-18T13:00:43Z,دخلنا الى اغرب الاماكن السرية في ماب البيوت 🔥🧐 (غرفة تحت الارض) !!,دخلنا الى اغرب الاماكن السرية في ماب البيوت 🔥🧐 (غرفة تحت الارض) !!,سبايدر واخوانه - Spider Brothers ,UC3srCgBeyr0TTqf9_LLxfQw,20,Gaming,"roblox, روبلوكس, مابات روبلوكس, ماب ربلوكس, العاب, لعبة, ماب, قلتش روبلوكس, حركة روبلوكس, لعبة روبلوكس, فيديو روبلوكس, اسرار روبلوكس, سبايدر, حمزة, حمودي, سبايدر واخواته, اخوات سبايدر, اخوان سبايدر, سبايدر روبلوكس, روبلكس, فلم روبلوكس, قصة روبلوكس",22,https://i.ytimg.com/vi/O02awfejn9A/hqdefault.jpg,ar,ar,False,892,PT14M52S,hd,False,True,False,False,483419,18337,698
T6lVd79vH5g,IL,2026-05-20T04:46:29.785706+00:00,2026-05-10T07:00:17Z,נועה קירל - הכי יפה כשטעים לך,נועה קירל - הכי יפה כשטעים לך,Noa Kirel,UC7sHZrh1-mdwyBLq52m1MSw,10,Music,"נועה קירל, הכי יפה כשטעים לך",2,https://i.ytimg.com/vi/T6lVd79vH5g/hqdefault.jpg,iw,iw,False,159,PT2M39S,hd,False,True,False,False,1962987,12208,712
9mi3YVYm3ZU,IL,2026-05-20T04:46:29.785714+00:00,2026-05-19T16:10:00Z,Voicemails for Isabelle | Official Trailer | Netflix,Voicemails for Isabelle | Official Trailer | Netflix,Netflix,UCWOA1ZGywLbqmigxE4Qlvuw,24,Entertainment,"Bittersweet Love Story, Cosmic Love, Fate, Fated Love, Modern Love, Netflix, Netflix Romantic Comedy, Netflix Trailer, Nick Robinson, Nick Robinson Movie, Rom-com, Romance, Romantic Comedy, Romantic Dramedy, Sister Bond, Sister Relationship, Voicemails for Isabelle, Voicemails for Isabelle 2026, Voicemails for Isabelle Netflix, Voicemails for Isabelle Trailer, Zoey Deutch, Zoey Deutch Movie",22,https://i.ytimg.com/vi/9mi3YVYm3ZU/hqdefault.jpg,en,en-US,False,150,PT2M30S,hd,True,True,False,False,258787,9023,232
WtMUqHCm-pk,IL,2026-05-20T04:46:29.785722+00:00,2026-05-15T09:30:15Z,תגן על הפיה פראנק ותזכה ב 1000 יהלומים!,תגן על הפיה פראנק ותזכה ב 1000 יהלומים!,מאפין,UCOynje_62pbbYMCUCYafHkQ,20,Gaming,"מאפין, MUFFIN, צוככןמ, brawl stars, ברול סטארס, בראול סטארס מאפין, יהלומים חינם, בראול סטארס אתגר",8,https://i.ytimg.com/vi/WtMUqHCm-pk/hqdefault.jpg,iw,iw,False,643,PT10M43S,hd,False,True,False,False,49726,1262,48
qd4KGgpUQWI,IL,2026-05-20T04:46:29.785730+00:00,2026-05-19T07:00:22Z,עדן בן זקן X נועה קירל - אני משקרת? (Prod. by Yinon Yahel),עדן בן זקן X נועה קירל - אני משקרת? (Prod. by Yinon Yahel),עדן בן זקן - הערוץ הרשמי,UCt927ZDEsYMJL_8PXqMiVhg,10,Music,"עדן בן זקן, עומר אדם, אייל גולן, שרית חדד, איתי לוי, gsi ci zei, פאר טסי, דודו אהרון, משה פרץ, חיים שלי, נועה קירל, אני משקרת, אני משקרת?, Yinon Yahel",14,https://i.ytimg.com/vi/qd4KGgpUQWI/hqdefault.jpg,iw,iw,False,136,PT2M16S,hd,False,True,False,False,114467,2648,311
Px1xodGZAT0,IL,2026-05-20T04:46:29.785738+00:00,2026-05-19T11:03:00Z,Official Trailer | BLEACH: Thousand-Year Blood War Final Part - The Calamity | VIZ,Official Trailer | BLEACH: Thousand-Year Blood War Final Part - The Calamity | VIZ,vizmedia,UCV1da9peoqEwqr45bpTJsbQ,1,Film & Animation,"viz media, anime, official, manga, bleach, bleach thousand-year blood war, bleach tybw, bleach final part, bleach tybw part 4, bleach op, bleach ed, bleach ending, bleach final cour, bleach finale, bleach ichigo, ichigo bleach, ichigo final form, final form ichigo, bleach final part teaser, bleach final part trailer, bleach viz final part, bleach part 4 the calamity, bleach the calamity, the calamity bleach, bleach official part 4 trailer, bleach cour 4",26,https://i.ytimg.com/vi/Px1xodGZAT0/hqdefault.jpg,en,en,False,61,PT1M1S,hd,False,True,False,False,313850,25429,1584
KMmfUmZKoak,IL,2026-05-20T04:46:29.785746+00:00,2026-05-17T16:50:42Z,Brawl Stars Championship 2026 | Brawl Cup | Day 3,Brawl Stars Championship 2026 | Brawl Cup | Day 3,Brawl Stars Esports,UCjvzNXGGlnC4jcCnhglf8-Q,20,Gaming,"BSC, Brawl Stars, Esports, Brawl Stars Esports, gaming, sports",6,https://i.ytimg.com/vi/KMmfUmZKoak/hqdefault.jpg,en,en,False,21775,PT6H2M55S,hd,False,False,False,False,2082875,24263,417
dU5jWriAGmY,IL,2026-05-20T04:46:29.785754+00:00,2026-05-17T14:00:06Z,אייל לוי & סטפן לגר - חצופה (Prod. By Stav Nahmias),אייל לוי & סטפן לגר - חצופה (Prod. By Stav Nahmias),אייל לוי - הערוץ הרשמי,UCu1GRT31h85Z7ybyVY12R6Q,10,Music,"חצופה, סטפן לגר, אייל לוי, סטפן",4,https://i.ytimg.com/vi/dU5jWriAGmY/hqdefault.jpg,iw,iw,False,160,PT2M40S,hd,False,False,False,False,100368,3208,718
f_bKjZeJBBI,IL,2026-05-20T04:46:29.785761+00:00,2026-05-05T04:10:02Z,The Odyssey | Official New Trailer,The Odyssey | Official New Trailer,Universal Pictures,UCq0OueAsdxH6b8nyAspwViw,24,Entertainment,,0,https://i.ytimg.com/vi/f_bKjZeJBBI/hqdefault.jpg,en-US,en-US,False,152,PT2M32S,hd,True,True,False,False,22784781,316632,26037
OT5d0YhW8Ac,IL,2026-05-20T04:46:29.785768+00:00,2026-05-19T11:00:25Z,מכרתי טלפונים והרווחתי מיליונים ברובלוקס!,מכרתי טלפונים והרווחתי מיליונים ברובלוקס!,ניקו,UC-dl8Au4Gmmv8P7SzH991ww,20,Gaming,"רובלוקס, roblox, ניקו, nico, מצחיק",5,https://i.ytimg.com/vi/OT5d0YhW8Ac/hqdefault.jpg,iw,iw,False,835,PT13M55S,hd,False,True,False,False,19211,832,51
9KqJcEcxCco,IL,2026-05-20T04:46:29.785775+00:00,2026-05-12T09:59:28Z,משה פרץ & אגם בוחבוט - ילדה קטנה | LIVE קיסריה,משה פרץ & אגם בוחבוט - ילדה קטנה | LIVE קיסריה,משה פרץ,UC0ebT4a-IyuY61X8py3nzsg,10,Music,,0,https://i.ytimg.com/vi/9KqJcEcxCco/hqdefault.jpg,iw,iw,False,249,PT4M9S,hd,False,True,False,False,124364,1797,93
1ymnCXU6iyA,IL,2026-05-20T04:46:29.785783+00:00,2026-05-12T17:00:03Z,Devil Dinosaur: Prehistoric Powerhouse | Character Reveal Trailer | Marvel Rivals,Devil Dinosaur: Prehistoric Powerhouse | Character Reveal Trailer | Marvel Rivals,Marvel Rivals,UCWzmOSSiSPbVnVu3ZAyDx2w,20,Gaming,"Marvel, Marvel Rivals, Rivals, Hero Shooter, Devil Dinosaur, Devil Dino, Season 8, Marvel Games",8,https://i.ytimg.com/vi/1ymnCXU6iyA/hqdefault.jpg,en,en,False,82,PT1M22S,hd,False,False,False,False,3939807,67134,5487
DYwy7s0YSF0,IL,2026-05-20T04:46:29.785790+00:00,2026-05-14T11:15:02Z,تحالفت مع العصابة الجديدة في قراند سيتي 🔥😈 (مقر جديد)  !!,تحالفت مع العصابة الجديدة في قراند سيتي 🔥😈 (مقر جديد)  !!,SPIDER GAMER,UC_9GZ-5Wz5rjkWg4HAkWg_g,20,Gaming,"فورت نايت, فورتنايت, العاب, سيت اب, قيمز, سبايدر, سبايدر قيمر, دونويشن, دونيشن, دعم, تويتش, افضل, SPIDER, SPIDER GAMER, اخو, اخ, جلد, ضحك, فورت نايت رقم قياسي, 100 دولار, HMX, SPI, تسريب فورتنايت, فرتنايت, بث سبايدر, فورت نايت التحديث الجديد, تسريبات فورت نايت, فورت نايت السيزون الجديد, باور, 100 زر, تحدي 24 ساعة, تحديات, شابتر 4, الشابتر الرابع, قلتش, قلتشات",36,https://i.ytimg.com/vi/DYwy7s0YSF0/hqdefault.jpg,ar,ar,False,1075,PT17M55S,hd,False,True,False,False,834745,37047,1263
-0RUAQAMUac,IL,2026-05-20T04:46:29.785799+00:00,2026-05-08T17:00:06Z,Sherine - Tebaa’n Tebaa’n (Official Lyric Video) | شيرين - تباعاً تباعاً (فيديو مع الكلمات),Sherine - Tebaa’n Tebaa’n (Official Lyric Video) | شيرين - تباعاً تباعاً (فيديو مع الكلمات),Sony Music Middle East,UC6jp5ZOgZeMJY0b1wCnWwzQ,10,Music,"Sony, Sony Music, Sony Music Middle East, Middle east, Arabic Music, Songs, Arabic Song, أغاني, أغاني عربية, الشرق الأوسط, سوني, سوني ميوزك, سوني ميوزيك, sony music, سونى, sherine, shireen, shereen, cherine, chereen, chirine, chirene, شيرين, شرين, شيرين عبدالوهاب, شيرين عبد الوهاب, sherine abdelwahab, sherine abd el wahab, الحضن شوك, el hodn shok, el hodn shook, عايزة اشتكي, teba3an teba3an, sherine teba3an teba3an, sheren, تباعا تباعا, تباعن تباعن, شيرين تباعا تباعا, شرين عبدالوهاب",39,https://i.ytimg.com/vi/-0RUAQAMUac/hqdefault.jpg,ar,ar,False,258,PT4M18S,hd,False,True,False,False,9626668,121471,11848
0AsfMdywXug,IL,2026-05-20T04:46:29.785808+00:00,2026-05-13T13:00:18Z,Overwatch Answers the Call  ☎️ | Act III Cinematic Trailer,Overwatch Answers the Call  ☎️ | Act III Cinematic Trailer,Fortnite,UClG8odDC8TS6Zpqk9CGVQiQ,20,Gaming,,0,https://i.ytimg.com/vi/0AsfMdywXug/hqdefault.jpg,en,en,False,31,PT31S,hd,True,True,False,False,272980,13359,1070
3lWsM882XiQ,IL,2026-05-20T04:46:29.785815+00:00,2026-05-18T11:30:03Z,פירקו לי את הקלאן? (הם לא ציפו לזה!!!),פירקו לי את הקלאן? (הם לא ציפו לזה!!!),TheCoki_edits,UCB_X-NV-xoT00qfSv9FnQZA,20,Gaming,"דה כהן, דה, כהן, דה קוהן, קוהן, כוהן, דה כוהן, דה בוהן, בוהן, עידן, עידן כהן, עדין, TheCohen, the cohen, cohen, חלוקות, THECOHEN, סקאם, סקאמר גט סקאם, סקאמים, סקאמרים, סקאמר מקבל סקאם, ליב, לייב דה כהן, לייב סייב, לייבים, LIVE, לייב, רובלוקס, ROBLOX, סטיל אה בריינרוט, צייד הסקאמרים, ציד הסקאמרים, סקמר רובוקס, לייב רובלוקס, סקאם גט סקאם, דה כהן בראול, דה כהן רובלוקס, אינדה, סמי, דה כהן סמי, בראול סטארס, ברול סטארס, רבלוקס, דהכהן, דהקוהן, דהכוהן, דהקוקי, דה קוקי, מאסטר אוהד, דה כהן צייד הסקאמרים",51,https://i.ytimg.com/vi/3lWsM882XiQ/hqdefault.jpg,iw,iw,False,1411,PT23M31S,hd,False,True,False,False,27879,680,56
gTW5d9nRAs8,IL,2026-05-20T04:46:29.785824+00:00,2026-05-05T11:30:06Z,מתן חסן - לא מפחד (Prod. By Guy Dan),מתן חסן - לא מפחד (Prod. By Guy Dan),מ,UCc_6an-Rph0HSSf2WH2Kjhw,10,Music,"לא מפחד, מתן חסן, Guy Dan",3,https://i.ytimg.com/vi/gTW5d9nRAs8/hqdefault.jpg,iw,iw,False,191,PT3M11S,hd,False,False,False,False,366428,7919,720
6t2nDHldoSk,IL,2026-05-20T04:46:29.785832+00:00,2026-05-09T15:03:51Z,Subnautica 2 Early Access Gameplay Trailer,Subnautica 2 Early Access Gameplay Trailer,Subnautica,UCx2StD8gHd_-nRo5z1qcJ8g,20,Gaming,,0,https://i.ytimg.com/vi/6t2nDHldoSk/hqdefault.jpg,en,en-US,False,99,PT1M39S,hd,True,False,False,False,3758364,79825,4193
Ooi4Ioo12ng,IL,2026-05-20T04:46:29.785839+00:00,2026-05-17T12:00:30Z,"לא מפסיק לאכול סושי עד שהגיע ל-2,000 גביעים עם קנג'י🍣","לא מפסיק לאכול סושי עד שהגיע ל-2,000 גביעים עם קנג'י🍣",Elbazone,UCllnTXma-p9c-ckaF4FXOng,20,Gaming,,0,https://i.ytimg.com/vi/Ooi4Ioo12ng/hqdefault.jpg,iw,iw,False,678,PT11M18S,hd,False,True,False,False,29024,1308,85
n_S-00oUXzU,IL,2026-05-20T04:46:29.785847+00:00,2026-05-14T09:15:41Z,באלישג - שובו בנים ( Prod by OY ),באלישג - שובו בנים ( Prod by OY ),Balishag,UCpxbBsM3BYr-qnTmZx_Bm8A,10,Music,באלישג,1,https://i.ytimg.com/vi/n_S-00oUXzU/hqdefault.jpg,iw,iw,False,253,PT4M13S,hd,False,True,False,False,41176,1738,183
2z6a6NUFlsU,IL,2026-05-20T04:46:29.785854+00:00,2026-05-13T13:00:00Z,Backrooms | Official Promo | A24,Backrooms | Official Promo | A24,A24,UCuPivVjnfNo4mb3Oog_frZg,1,Film & Animation,"a24, a24 films, a24 trailers, independent films, trailer, HD, official, movie, film, a24 movies, oscar winner, academy award winner",12,https://i.ytimg.com/vi/2z6a6NUFlsU/hqdefault.jpg,en,en,False,67,PT1M7S,hd,False,True,False,False,5608669,92940,5951
bP86n9nFoJY,IL,2026-05-20T04:46:29.785862+00:00,2026-05-16T13:07:44Z,Unstable SMP: Civil War,Unstable SMP: Civil War,Parrot,UCPLMPHT-d8GZOqL_AHJFdQQ,20,Gaming,"Minecraft, Minecraft SMP, SMP, Minecraft Server, LifeSteal SMP, School Minecraft Server, School SMP, School Parrot, Parrot, ParrotX2, Dream SMP, TommyInnit, LifeSteal, parrot lifesteal smp, Spoke, minecraft survival, minecraft hardcore, minecraft challenge, minecraft server, HermitCraft, MumboJumbo, Grian, why i broke 100+ bedrock, Here's Why I Made 12240 Minecraft Cakes, Minecraft Hunt, LifeSteal Season 3, 1 Heart Minecraft, LifeSteal Season 4, Why I Removed the World",29,https://i.ytimg.com/vi/bP86n9nFoJY/hqdefault.jpg,en,en,False,4316,PT1H11M56S,hd,False,True,False,False,4320975,198510,43368
f684z2LKW2A,IL,2026-05-20T04:46:29.785871+00:00,2026-05-04T12:57:34Z,אבי אבורומי - קח אותי לתאילנד (Prod. By Jonno),אבי אבורומי - קח אותי לתאילנד (Prod. By Jonno),Avi Aburomi,UC8LOnmjkFFYKrAh8peh2QTA,10,Music,"מוזיקה ישראלית, ישראלי חדש",2,https://i.ytimg.com/vi/f684z2LKW2A/hqdefault.jpg,iw,iw,False,169,PT2M49S,hd,False,True,False,False,354226,3747,654
oYhaW-Vr4wg,IL,2026-05-20T04:46:29.785879+00:00,2026-05-08T15:00:16Z,Forza Horizon 6 – Official Launch Trailer,Forza Horizon 6 – Official Launch Trailer,Forza,UCydtMNspoPAlqBjFSGnigSw,20,Gaming,"Forza Horizon 6, Forza Horizon, Forza Horizon 6 Launch Trailer, Launch Trailer, FH6, FH6 Launch Trailer, Forza Horizon Japan",7,https://i.ytimg.com/vi/oYhaW-Vr4wg/hqdefault.jpg,en,en-US,False,96,PT1M36S,hd,True,False,False,False,1957156,85625,4599
W_re-VU5SoQ,IL,2026-05-20T04:46:29.785887+00:00,2026-05-19T13:00:46Z,כל בחירה ברובלוקס הופכת למציאות!,כל בחירה ברובלוקס הופכת למציאות!,העולם של ניקו,UCsLLYYDKefkwKT0yTKG3voQ,20,Gaming,,0,https://i.ytimg.com/vi/W_re-VU5SoQ/hqdefault.jpg,iw,iw,False,4060,PT1H7M40S,hd,False,True,False,False,12177,355,13
kWjIot7Vifc,IL,2026-05-20T04:46:29.785894+00:00,2026-05-05T13:01:33Z,יגל אושרי - תגידי לי כן,יגל אושרי - תגידי לי כן,יגל אושרי הערוץ הרשמי,UCVGVeM3hfbTHZhZYhQ9J0Fw,10,Music,"תגידי לי כן, יגל אושרי",2,https://i.ytimg.com/vi/kWjIot7Vifc/hqdefault.jpg,iw,iw,False,196,PT3M16S,hd,False,False,False,False,238933,5854,506
07h9Y1XKBWI,IL,2026-05-20T04:46:29.785901+00:00,2026-05-09T13:29:26Z,Drishyam 3 - Official Trailer | Mohanlal | Jeethu Joseph | Meena | May 21 Worldwide Release,Drishyam 3 - Official Trailer | Mohanlal | Jeethu Joseph | Meena | May 21 Worldwide Release,Aashirvad Cinemas,UC_J44kyEsEB8LPlhfm2Xb4g,1,Film & Animation,"Drishyam 3, Drishyam 3 Movie, Drishyam 3 Malayalam, Drishyam 3 trailer, drishyam 3 official trailer, drishyam 3 Malayalam trailer, drishyam 3 mohanlal, drishyam 3 official trailer malayalam, drishyam, drishyam movie, mohanlal drishyam, Jeethu Joseph, drishyam movie malayalam trailer, mohanlal drishyam trailer, drishyam 3 hindi, drishyam 3 trailer, drishyam 3 trailer malayalam, murali gopy, Meena, drishyam 3 movie malayalam, drishyam 3 movie, Drishyam 3 movie latest",22,https://i.ytimg.com/vi/07h9Y1XKBWI/hqdefault.jpg,en,ml,False,126,PT2M6S,hd,True,True,False,False,5863577,127505,5909
c3bpvMWFKkc,IL,2026-05-20T04:46:29.785909+00:00,2026-05-18T11:00:50Z,باركور لو خيروك😮سكن البنات🩷أو سكن الأولاد🩵 | روبلوكس Roblox ,باركور لو خيروك😮سكن البنات🩷أو سكن الأولاد🩵 | روبلوكس Roblox ,لانا و رورو,UCV5ZVvsnqXniOnI4yydz8pQ,22,People & Blogs,,0,https://i.ytimg.com/vi/c3bpvMWFKkc/hqdefault.jpg,ar,ar,False,797,PT13M17S,hd,False,True,False,False,1066286,22539,7839
rsEaoE_LPZM,IL,2026-05-20T04:46:29.785916+00:00,2026-05-14T10:11:28Z,הפרויקט של רביבו - מחרוזת כוכבי מרום (אקספו לייב),הפרויקט של רביבו - מחרוזת כוכבי מרום (אקספו לייב),הפרויקט של רביבו,UCvqlSAlwZN12ClJknGN78mw,10,Music,"הפרויקט של רביבו, לא חשוב לי לאן, רעיה, זוהר ארגוב, הפרויקט של רביבו שרים זוהר, רביבו וזוהר, רביבו באקספו, הפרויקט הופעה חיה, הפרויקט של רביבוב בהופעה חיה, הפרויקט רעיה, הפרויקט זוהר ארגוב, אלינור את יפה כמו מלאך, זהר, ארגוב, the revivo project, revivo project, הפרוייקט, הפרוייקט של רביבו, zohar argov, עוד יום יבוא, כוכבי מרום, ערב סגריר, ידיים למעלה, אך בלילה, זר בעולם, מענטזת, הפרויקט של רביבו כוכבי מרום",27,https://i.ytimg.com/vi/rsEaoE_LPZM/hqdefault.jpg,iw,iw,False,626,PT10M26S,hd,False,True,False,False,47743,737,42
PxZg4SfIURg,IL,2026-05-20T04:46:29.785923+00:00,2026-04-28T14:04:51Z,Ted Lasso — Season 4 Official Teaser | Apple TV,Ted Lasso — Season 4 Official Teaser | Apple TV,Apple TV,UC1Myj674wRVXB9I4c6Hm5zA,24,Entertainment,"ted lasso, ted, lasso, ted lasso season 4, season 4, trailer, trailers, ted lasso trailer, official trailer, ted lasso official trailer, ted lasso apple tv, apple tv ted lasso, jason sudeikis, hannah waddingham, brett goldstein, brendan hunt, tanya reynolds, juno temple, coach lasso, coach ted lasso, nbc sports, afc richmond, richmond, premier league, soccer, football, apple, tv, apple tv, apple tv plus, apple tv app, apple original, apple tv youtube, comedy, mumford & sons",35,https://i.ytimg.com/vi/PxZg4SfIURg/hqdefault.jpg,en,en,False,69,PT1M9S,hd,True,False,False,False,1901005,41316,1790
iQ1RWvQViFE,IL,2026-05-20T04:46:29.785931+00:00,2026-05-19T19:17:35Z,לייב אומיגל | מוצא חברה לאורי לוי!! 😍,לייב אומיגל | מוצא חברה לאורי לוי!! 😍,MasterOhad,UCLR0sdH9cn9dETLBiEAWgYA,20,Gaming,,0,https://i.ytimg.com/vi/iQ1RWvQViFE/hqdefault.jpg,iw,iw,False,9329,PT2H35M29S,hd,False,True,False,False,16525,718,3
