video_id,country,fetched_at,published_at,title,localized_title,channel_title,channel_id,category_id,category_name,tags,tag_count,thumbnail,default_language,audio_language,is_live,duration,duration_raw,definition,caption_available,licensed_content,embeddable,made_for_kids,views,likes,comments
jclYwoFTGLo,LV,2026-04-07T03:38:28.036720+00:00,2026-04-06T18:39:46Z,ЭЛОКС УЖЕ БОИТСЯ МОЕГО ВОЗВРАЩЕНИЯ,ЭЛОКС УЖЕ БОИТСЯ МОЕГО ВОЗВРАЩЕНИЯ,Rostislav,UCuLGeCWYpPSX8Stj8TDt6fg,20,Gaming,,0,https://i.ytimg.com/vi/jclYwoFTGLo/hqdefault.jpg,ru,ru,False,1467,PT24M27S,hd,False,True,False,False,163172,10352,1204
n6awWQ4hbL0,LV,2026-04-07T03:38:28.036728+00:00,2026-04-06T11:04:19Z,САМЫЙ ОПАСНЫЙ ИГРОК В БРАВЛ СТАРСЕ😱 ELOX БАНИТ ВСЕХ ПОДРЯД,САМЫЙ ОПАСНЫЙ ИГРОК В БРАВЛ СТАРСЕ😱 ELOX БАНИТ ВСЕХ ПОДРЯД,Holdik,UCM6hH7Xa0oanOQeh5RxeRAQ,20,Gaming,"холдик, holdik",2,https://i.ytimg.com/vi/n6awWQ4hbL0/hqdefault.jpg,ru,ru,False,1136,PT18M56S,hd,False,True,False,False,220920,14163,2038
0e8GyHKiVzg,LV,2026-04-07T03:38:28.036735+00:00,2026-03-29T10:00:09Z,СТАЛ ПЕРЕКУПОМ! ОТКРЫВАЮ СВОЙ АВТОСАЛОН! ПЕРВАЯ ПРИБЫЛЬ,СТАЛ ПЕРЕКУПОМ! ОТКРЫВАЮ СВОЙ АВТОСАЛОН! ПЕРВАЯ ПРИБЫЛЬ,ГЛЕНТ,UCBYvr4SqfGQd5fTmOXVQ4Zw,20,Gaming,"СТАЛ ПЕРЕКУПОМ, ОТКРЫВАЮ СВОЙ АВТОСАЛОН, СВОЙ АВТОСАЛОН, АВТОСАЛОН, ПЕРВАЯ ПРИБЫЛЬ, бизнес, перекуп, купить авто, глент, глент канал, глент из а4, а4, a4, глент перекуп, глент авто, глент машина, машина глента, машины глента, глент играет, глент игры, глент 24 часа, симулятор, глент симулятор, симулятор перекупа, симулятор перекупа 100 дней, симулятор перекуп, CAR DEALER SIMULATOR, CAR DEALER, SIMULATOR, влад а4",30,https://i.ytimg.com/vi/0e8GyHKiVzg/hqdefault.jpg,ru,ru,False,2257,PT37M37S,hd,False,True,False,False,848283,33290,3158
jH4yUZkWkXs,LV,2026-04-07T03:38:28.036743+00:00,2026-04-05T05:38:54Z,"🤯Я ПОЛУЧИЛ СЕКРЕТНУЮ ""ПАСХА"" БАЗУ в Steal a Brainrot!","🤯Я ПОЛУЧИЛ СЕКРЕТНУЮ ""ПАСХА"" БАЗУ в Steal a Brainrot!",EroxBlox,UCMDSzea8f4CC53mZC3ViZug,20,Gaming,,0,https://i.ytimg.com/vi/jH4yUZkWkXs/hqdefault.jpg,ru,ru,False,1000,PT16M40S,hd,False,True,False,False,330031,7115,1367
FwCLqXRGvLo,LV,2026-04-07T03:38:28.036750+00:00,2026-04-05T11:35:39Z,ИГРА МЕЧТЫ! - Crimson Desert,ИГРА МЕЧТЫ! - Crimson Desert,Dobryak,UCIQ1PyEVzV2sc4CXHKH2cSg,1,Film & Animation,"добряк, dobryak, анимация, мульт, аниме, cartoon, мультик, мульт обзор, crimson desert, crimson desert обзор, кримсон дезерт, обзор, 100%, crimson desert гайд, Crimson, Desert, Игра мечты, Crimson desert",18,https://i.ytimg.com/vi/FwCLqXRGvLo/hqdefault.jpg,ru,ru,False,730,PT12M10S,hd,False,True,False,False,316744,24735,907
EBdFlscB7Tg,LV,2026-04-07T03:38:28.036758+00:00,2026-04-05T12:00:19Z,ВЫЖИТЬ НЕДЕЛЮ с НЕЧИСТЬЮ в МОЁМ ДОМЕ  — KNOCK KNOCK,ВЫЖИТЬ НЕДЕЛЮ с НЕЧИСТЬЮ в МОЁМ ДОМЕ  — KNOCK KNOCK,Nazzy,UCQ2L7O1KDK7ze75dSe1C-yg,20,Gaming,"minecraft, майнкрафт, нечисть, 7 дней с нечистью, дом с нечистью, хоррор, нейзи, nazzy, игровой режим",9,https://i.ytimg.com/vi/EBdFlscB7Tg/hqdefault.jpg,ru,ru,False,886,PT14M46S,hd,False,True,False,False,296011,31565,1065
blf0LzQOh90,LV,2026-04-07T03:38:28.036766+00:00,2026-04-04T22:50:16Z,Massive EASTER UPDATE in Steal a Brainrot!,Massive EASTER UPDATE in Steal a Brainrot!,CaylusBlox,UCsPMNatXCwqyUuJilBT73jg,20,Gaming,"caylusblox, caylus roblox, caylus, caylus gaming, caylus infinite, infinite lists, calus, callus, calis, roblox, caylus horror, caylus scary, caylus scariest, caylus scary myths, caylus creepy, caylus roblox horror, caylus roblox scary, caylus steal a brainrot, caylus aura, caylus stream, caylus brainrot, caylus foltyn",22,https://i.ytimg.com/vi/blf0LzQOh90/hqdefault.jpg,en-US,en-US,False,3855,PT1H4M15S,hd,False,True,False,False,1248577,15901,311
Nd1Ca8CqxWE,LV,2026-04-07T03:38:28.036774+00:00,2026-04-04T13:00:01Z,НОЧНАЯ РАБОТА в АДСКОМ МАГАЗИНЕ (7 ночей В HellMart) #1,НОЧНАЯ РАБОТА в АДСКОМ МАГАЗИНЕ (7 ночей В HellMart) #1,Милс PLAY,UCBIfuwYslGljdRGWSELdaUw,24,Entertainment,,0,https://i.ytimg.com/vi/Nd1Ca8CqxWE/hqdefault.jpg,ru,ru,False,2349,PT39M9S,hd,False,True,False,False,256606,11747,1203
F6gGq_5ENDo,LV,2026-04-07T03:38:28.036781+00:00,2026-04-04T11:00:21Z,КВ-44 снова в строю! Возвращение героя?,КВ-44 снова в строю! Возвращение героя?,• Gerand •,UCSYOvRiB12CnApfSC_GeFXg,20,Gaming,"мультики про танки, cartoon, animation, танки анимация, танки, мир танков, мульт про танки, мультики танки, мультфильмы, tank, танкомульт, мультик, tanks, gerand, геранд, создание монстра, рождение монстра, возрождение монстра, кв-44, история кв 44, кв 44 против, kv-44 tank",22,https://i.ytimg.com/vi/F6gGq_5ENDo/hqdefault.jpg,ru,ru,False,262,PT4M22S,hd,True,True,False,False,761501,38343,4120
mBYDbwACvwI,LV,2026-04-07T03:38:28.036789+00:00,2026-04-04T15:30:36Z,самый страшный бекрумс - subliminal,самый страшный бекрумс - subliminal,windy31,UCZUrS0zDszsXI_5ir_tI3cg,24,Entertainment,,0,https://i.ytimg.com/vi/mBYDbwACvwI/hqdefault.jpg,ru,ru,False,1695,PT28M15S,hd,False,True,False,False,572206,40632,2696
70LOaxzmcg4,LV,2026-04-07T03:38:28.036797+00:00,2026-03-28T16:00:01Z,"Press This Button To Win $250,000","Press This Button To Win $250,000",MrBeast Gaming,UCIPPMRA040LQr5QPyJEbmXA,20,Gaming,,0,https://i.ytimg.com/vi/70LOaxzmcg4/hqdefault.jpg,en,en,False,1230,PT20M30S,hd,True,True,False,False,12449501,322232,20055
bmBYcPMbtRA,LV,2026-04-07T03:38:28.036804+00:00,2026-04-03T22:40:11Z,never give a trapper creative mode,never give a trapper creative mode,JudeHigh,UC4Uw_YzBBg0LuLSx9EMgSwA,20,Gaming,,0,https://i.ytimg.com/vi/bmBYcPMbtRA/hqdefault.jpg,en,en,False,1459,PT24M19S,hd,False,True,False,False,1639965,56342,2381
Bf5vDiOzNMY,LV,2026-04-07T03:38:28.036811+00:00,2026-04-06T15:00:37Z,КАК Я ВЫБИЛ ОЧЕНЬ ДОРОГИЕ ПЕРЧАТКИ И КЕРАМБИТ В CS2,КАК Я ВЫБИЛ ОЧЕНЬ ДОРОГИЕ ПЕРЧАТКИ И КЕРАМБИТ В CS2,Murzofix,UCtDUJoWBgUaYUeHtMA0LNGg,20,Gaming,"cs2, cs 2, кс2, кс 2, видео кс2, виде по кс2, видео про кс2, кс2 видео, видео cs2, видео по cs2, видео про cs2, cs2 видео, видео кс го, кс го видео, выбил перчатки, новые перчатки, новые перчатки кс2, новые перчатки в кс2, новые терминалы, новые терминалы кс2, новый кейс кс2, выбил нож кс2, выбил дорогой нож, крафт ножей, крафты ножей в кс2, крафты в кс2, крафты ножей кс2, перчатки кс2, кс2 перчатки, кейсы мурз, мурзофикс, мурз, murzofix, murz, ржака, угар, смех",37,https://i.ytimg.com/vi/Bf5vDiOzNMY/hqdefault.jpg,ru,ru,False,1175,PT19M35S,hd,False,True,False,False,174941,10353,357
xPZPdW6mrRA,LV,2026-04-07T03:38:28.036819+00:00,2026-04-06T16:40:09Z,Евреи Crimson Desert / Блокировка Telegram / $3 млрд на GTA 6 / Mass Effect для не-геймеров,Евреи Crimson Desert / Блокировка Telegram / $3 млрд на GTA 6 / Mass Effect для не-геймеров,IXBT Games,UC4e_XPBiiIO4fo4_CucxQeg,20,Gaming,"ixbt, ixbt games, ixbtgames, шчие, шчие пфьуы, подкаст про игры, новости игр, игровые новости, Crimson Desert, Дэвид Яффе, Chernobylite, Stormgate, The First Descendant, PUBG: Blindspot, Deus Ex, Ubisoft, Tom Clancy’s The Division 3, Disney, Epic Games, Dispatch, Playstation 5 Pro, Playstation 6, Saros, Heroes of Might and Magic Olden Era, Sony, GTA 6, Skyblivion, Slay the Spire 2, Blizzard, Nintendo, Nvidia, Minecraft, Stop Killing Games, Starfield, Виталий Казунов, Михаил Шкредов",36,https://i.ytimg.com/vi/xPZPdW6mrRA/hqdefault.jpg,ru,ru,False,5374,PT1H29M34S,hd,False,True,False,False,58852,4256,676
ONYSeUR6Dy0,LV,2026-04-07T03:38:28.036828+00:00,2026-04-03T14:01:52Z,30 ДНЕЙ В САМОЙ МЁРТВОЙ ИГРЕ С ОДНИМИ РОБОТАМИ,30 ДНЕЙ В САМОЙ МЁРТВОЙ ИГРЕ С ОДНИМИ РОБОТАМИ,STRAYF,UC4pOZItoU2luCxT9w32YMnw,22,People & Blogs,"strayf, streyf, стрэйф, стрейф, страйф, страуф, страус, samp, самп, аризона, arizona, самый тупой, троллинг, юмор, приколы, угар, смешные моменты, гта, gta, gta samp, gta san andreas, гта сан андрес, 30 дней, мертвая игра, старая игра, деревня, village, заброшенная игра, роботы, самая мертвая игра, игра с нулевым онлайном, игра где никого нет, самый мертвый сервер",33,https://i.ytimg.com/vi/ONYSeUR6Dy0/hqdefault.jpg,ru,ru,False,1342,PT22M22S,hd,False,True,False,False,328095,17546,1607
