video_id,country,fetched_at,published_at,title,localized_title,channel_title,channel_id,category_id,category_name,tags,tag_count,thumbnail,default_language,audio_language,is_live,duration,duration_raw,definition,caption_available,licensed_content,embeddable,made_for_kids,views,likes,comments
KWoTyfPsqbE,LV,2026-04-07T03:38:28.036397+00:00,2026-04-06T15:00:06Z,Sabrina Carpenter - House Tour (Official Video),Sabrina Carpenter - House Tour (Official Video),SabrinaCarpenterVEVO,UC4mYKePIas5YgGfYZ2J2OxQ,10,Music,"Sabrina Carpenter, Island Records, Pop",3,https://i.ytimg.com/vi/KWoTyfPsqbE/hqdefault.jpg,en,en,False,215,PT3M35S,hd,True,True,False,False,3716128,403797,14970
wek9dIw2uVM,LV,2026-04-07T03:38:28.036438+00:00,2026-03-31T16:20:54Z,Backrooms | Official Trailer HD,Backrooms | Official Trailer HD,Kane Pixels,UC8X4WT5_lUXqMjeN8bGFk9w,1,Film & Animation,,0,https://i.ytimg.com/vi/wek9dIw2uVM/hqdefault.jpg,en,en,False,132,PT2M12S,hd,False,False,False,False,12405264,572988,28551
yySWrtiGyYQ,LV,2026-04-07T03:38:28.036450+00:00,2026-04-05T12:44:01Z,Я тайно Проследил за ХЕЙТЕРШЕЙ и ОХРЕНЕЛ в Майнкрафт...,Я тайно Проследил за ХЕЙТЕРШЕЙ и ОХРЕНЕЛ в Майнкрафт...,Domer Grief,UCb5oqCZ4AfmfXbgHsfei0tQ,20,Gaming,"Я тайно Проследил за ХЕЙТЕРШЕЙ на Сервере Майнкрафт, Майнкрафт, Minecraft, Домер, домер гриф, Domer Grief, майнкрафт троллинг, really world, рили ворлд, анархия, выживание без доната, рилик, майнкрафт выживание, домер без доната, домер выживание, Хейтер, хейтерша, сервер домера, Алина хейтерша, домер анархия, рили ворлд выживание, домер девушка, девочка в Майнкрафт, с игрока до бога, хейтерша домера, троллинг, выживание Джамшута, выживание на сервере, Майн, хардкор, хардкор майнкрафт",31,https://i.ytimg.com/vi/yySWrtiGyYQ/hqdefault.jpg,ru,ru,False,1643,PT27M23S,hd,False,True,False,False,1068840,103467,9854
4iAKa5PSU_8,LV,2026-04-07T03:38:28.036461+00:00,2026-03-31T19:00:06Z,DIDO - Go Away (Original Mix),DIDO - Go Away (Original Mix),DIDO UZ,UCFZyvAqasdOwa-SOzQZU34g,10,Music,"car music, car music mix, best gangster music mix, gangster music, bass, bass music, gangster, музыка в машину, bass boosted, bass mix, car bass mix, best car mix, car bass, best car music, chill, лучшая музыка, electro house, club mix, club music, музыка в машину басс, музыка в машину с басами, крутая музыка басы, крутая музыка в машинуelectro house, music video, magic music, magic music box, magic music mix, arabic remix, dido, dido remix, go away song, go away",32,https://i.ytimg.com/vi/4iAKa5PSU_8/hqdefault.jpg,en,en,False,385,PT6M25S,hd,False,True,False,False,1593520,10771,235
RIu4sFKGi6E,LV,2026-04-07T03:38:28.036471+00:00,2026-03-25T19:00:01Z,Harry Potter and the Philosopher's Stone | Official Teaser | HBO Max,Harry Potter and the Philosopher's Stone | Official Teaser | HBO Max,Harry Potter,UChPRO1CB_Hvd0TvKRU62iSQ,1,Film & Animation,"Harry Potter, Wizarding World, Warner Bros, Hogwarts, Marauders Map, Draco Malfoy, Ron Weasley, Hermione Granger, Harry Potter Lore, Potter, slytherin, ravenclaw, gryffindor, hufflepuff, hbomax, harrypotterhbo",16,https://i.ytimg.com/vi/RIu4sFKGi6E/hqdefault.jpg,en-GB,en-GB,False,129,PT2M9S,hd,True,True,False,False,9773880,265921,33672
oJfJdFy9iX8,LV,2026-04-07T03:38:28.036479+00:00,2026-04-06T12:01:32Z,Lp. Мастерская [47] • #58 ГОВОРЯЩИЙ ФОРМИК [Главная Особенность] • Майнкрафт,Lp. Мастерская [47] • #58 ГОВОРЯЩИЙ ФОРМИК [Главная Особенность] • Майнкрафт,MrLololoshka (Роман Фильченков),UCAvrIl6ltV8MdJo3mV4Nl4Q,20,Gaming,"Лололошка, Lololoshka, MrLololoshka, Летсплей, Сборка, Скачать, Магия, Моды, Майнкрафт, Minecraft",10,https://i.ytimg.com/vi/oJfJdFy9iX8/hqdefault.jpg,ru,ru,False,2089,PT34M49S,hd,False,True,False,False,559502,60693,3868
_gyultVTesk,LV,2026-04-07T03:38:28.036488+00:00,2026-04-01T15:00:01Z,BTS (방탄소년단) '2.0' Official MV,BTS (방탄소년단) '2.0' Official MV,HYBE LABELS,UC3IZKseVpdzPSBaWxBxundA,10,Music,"HYBE, HYBE LABELS, 하이브, 하이브레이블즈",4,https://i.ytimg.com/vi/_gyultVTesk/hqdefault.jpg,ko,ko,False,235,PT3M55S,hd,True,True,False,False,31334617,3380842,221052
s1-pfiVMKAs,LV,2026-04-07T03:38:28.036496+00:00,2026-03-31T16:00:12Z,Supergirl | Official Trailer,Supergirl | Official Trailer,DC,UCiifkYAs_bq1pt_zbNAzYGg,1,Film & Animation,"2026, Coming Soon, Craig Gillespie, DC, DC Comics, DC Studios, DCU, David Krumholtz, Emily Beecham, Eve Ridley, James Gunn, Jason Momoa, Kara Zor-El, Krypto, Matthias Schoenaerts, Milly Alcock, Supergirl, WB, Warner Bros, Warner Bros Pictures, Warner Brothers, official trailer",22,https://i.ytimg.com/vi/s1-pfiVMKAs/hqdefault.jpg,en,en-US,False,177,PT2M57S,hd,True,False,False,False,15690970,272606,16040
9D5__vRuyZc,LV,2026-04-07T03:38:28.036504+00:00,2026-04-06T18:48:53Z,[B] BC.Game vs. Voca - PGL Bucharest 2026 - Group Stage: Round 3 Low Match (0-2),[B] BC.Game vs. Voca - PGL Bucharest 2026 - Group Stage: Round 3 Low Match (0-2),PGL,UC5jpxDZx4yoBo324pMQ91Ww,20,Gaming,"PGL Bucharest 2026, CS2 tournament, Counter Strike 2, CS2 esports, CS2 matches, CS2 highlights, CS2 pro matches, CS2 live, PGL esports, CS2 competitive, CS2 full match, CS2 VOD, CS2 gameplay, CS2 Bo3, CS2 Bo5, Group Stage CS2, CS2 Playoffs, CS2 Quarterfinal, CS2 Semifinal, CS2 Grand Final, FaZe CS2, Astralis CS2, The MongolZ CS2, PARIVISION CS2, NRG CS2, MIBR CS2, B8 CS2, 3DMAX CS2, esports 2026, cs2 pro scene, cs2 best plays",31,https://i.ytimg.com/vi/9D5__vRuyZc/hqdefault.jpg,en,en,False,39981,PT11H6M21S,hd,False,True,False,False,474013,3428,17
MDPXDa5G4Gg,LV,2026-04-07T03:38:28.036512+00:00,2026-03-26T23:20:46Z,Ярослав Леонов — Твори добро (Official Video) | Премьера 2026,Ярослав Леонов — Твори добро (Official Video) | Премьера 2026,Ярослав Леонов,UC20WT22AGOjqghVU0yVTKKg,10,Music,"твори добро, ярослав леонов, твори добро песня, новая музыка 2026, хит 2026, душевные песни, музыка со смыслом, русская музыка 2026, премьера песни, лучшие песни 2026, leonov music, boss leonov, emotional song, sad song, trending music 2026, motivational song",16,https://i.ytimg.com/vi/MDPXDa5G4Gg/hqdefault.jpg,ru,ru,False,193,PT3M13S,hd,False,False,False,False,1659071,26170,1217
3_9vCamtuPY,LV,2026-04-07T03:38:28.036521+00:00,2026-03-17T16:19:02Z,Dune: Part Three | Official Teaser Trailer,Dune: Part Three | Official Teaser Trailer,Warner Bros.,UCjmJDM5pRKbUlVIzDYYWb6g,1,Film & Animation,"Action, Anya Taylor-Joy, Brian K Vaughan, Charlotte Rampling, Coming Soon, Denis Villeneuve, Dune, Dune Messiah, Dune: Part Three, Florence Pugh, Ida Brooke, Isaach De Bankolé, Jason Momoa, Javier Bardem, Messiah, Nakoa-Wolf Momoa, Rebecca Ferguson, Robert Pattinson, Sci Fi, Timothée Chalamet, Trilogy, Warner Bros, Zendaya",23,https://i.ytimg.com/vi/3_9vCamtuPY/hqdefault.jpg,en,en-US,False,150,PT2M30S,hd,True,False,False,False,28269069,614030,29469
4nUhgCHzVVI,LV,2026-04-07T03:38:28.036528+00:00,2026-04-06T08:00:05Z,😱ВЕРНУЛСЯ В БРАВЛ СТАРС СПУСТЯ 1389 ДНЕЙ!,😱ВЕРНУЛСЯ В БРАВЛ СТАРС СПУСТЯ 1389 ДНЕЙ!,FixEye - Роблокс,UCwkDYwR6NT9KhQJA0ZQ9jBw,20,Gaming,"Brawl Stars, бравл старс, фиксай, вернулся в бравл старс, возвращение в бравл старс, зашёл в бравл старс спустя 4 года, вернулся в бравл старс спустя 1389 дней, новый бравл пасс, бравл пасс, обзор на новый бравл пасс, вернулся в бравл старс спустя 4 года, что в brawl stars спустя 4 года, вернулся в brawl stars спустя 4 года, fixeye",14,https://i.ytimg.com/vi/4nUhgCHzVVI/hqdefault.jpg,ru,ru,False,1506,PT25M6S,hd,False,True,False,False,364049,18839,3238
WxrNKj6FFMo,LV,2026-04-07T03:38:28.036536+00:00,2026-03-26T03:00:23Z,DIAZZA – Dream (Original Mix) [2026],DIAZZA – Dream (Original Mix) [2026],DIAZZA,UCu7DJRzeHpIU_KKOAO_996Q,24,Entertainment,"DIAZZA, Dream Original Mix, DIAZZA Dream 2026, Italo Disco 2026, Relaxing Italo Disco, Danekoo1 inspired, KorgStyle Life, Licented Production, Dreamy Electronic Music, Slow Italo Disco, Romantic Disco, Chillwave 2026, Ethereal Vocals, Night Drive Music, Atmospheric Disco, DIAZZA Music, New Italo Disco, 80s Vibe Modern, Relaxing Music for Dreaming, Synthwave Dream, DIAZZA Lyrics, Deep Disco Mix, Emotional Electronic, Korg Style Music, Dream Pop 2026, Ambient Disco.",26,https://i.ytimg.com/vi/WxrNKj6FFMo/hqdefault.jpg,en,en,False,325,PT5M25S,hd,False,True,False,False,3161674,20020,420
aBlsrtxuwss,LV,2026-04-07T03:38:28.036544+00:00,2026-03-18T11:17:52Z,Spider-Man: Brand New Day - Official Trailer,Spider-Man: Brand New Day - Official Trailer,PlayStation,UC-2Y8dQb0S6DtpxNgAKoJKA,20,Gaming,"PlayStation, PS5, video games, next gen, Sony",5,https://i.ytimg.com/vi/aBlsrtxuwss/hqdefault.jpg,en,en,False,158,PT2M38S,hd,False,True,False,False,17985665,663999,27428
DxUM6YMYgOo,LV,2026-04-07T03:38:28.036551+00:00,2026-04-06T12:00:00Z,ПОЧЕМУ ЖИТЕЛИ НЕ ВЫПУСКАЮТ МЕНЯ ИЗ ДЕРЕВНИ В МАЙНКРАФТ | Компот Minecraft,ПОЧЕМУ ЖИТЕЛИ НЕ ВЫПУСКАЮТ МЕНЯ ИЗ ДЕРЕВНИ В МАЙНКРАФТ | Компот Minecraft,Компот,UC0cWWruNMb95iCBEOzPnjRA,20,Gaming,"компот, майнкрафт, compot, minecraft, компот в майнкрафте, игры, роман компот, майн, почему жители не выпускают меня из деревни в майнкрафт, почему, жители в майнкрафт, жители, не выпускают в майнкрафт, не выпускают, не выпускают из деревни, деревня в майнкрафт, деревня, жители заперли меня в деревне в майнкрафт, не дают уехать в майнкрафт, машина в майнкрафт, машина, дорога, дорога в майнкрафт, город жителей, бандиты, бандиты в майнкрафт, жители мешают, жители не выпускают из деревни",28,https://i.ytimg.com/vi/DxUM6YMYgOo/hqdefault.jpg,ru,ru,False,642,PT10M42S,hd,False,True,False,False,295181,16460,1336
jU1TflSPHZ0,LV,2026-04-07T03:38:28.036560+00:00,2026-04-02T21:03:05Z,Как я люблю тебя,Как я люблю тебя,Klava Koka - Topic,UCvrAykRTs5XLxayUDylmLFw,10,Music,"Клава Кока, Как я люблю тебя",2,https://i.ytimg.com/vi/jU1TflSPHZ0/hqdefault.jpg,ru,ru,False,189,PT3M9S,hd,False,True,False,False,482868,22889,925
XKUmKxZYl-w,LV,2026-04-07T03:38:28.036567+00:00,2026-03-17T15:00:06Z,Update 0.38.0 Trailer: Breakout | Standoff 2,Update 0.38.0 Trailer: Breakout | Standoff 2,Standoff 2,UCqTjE54bhQ0tvtxaHHHM-hA,20,Gaming,"Standoff 2, Mobile games, Standoff, Мобильные игры, Стендофф, Стендофф 2, Стандофф, Стандофф 2, Шутер, Стрелялка, Shooter, FPS, Шутер от первого лица, Axlebolt",14,https://i.ytimg.com/vi/XKUmKxZYl-w/hqdefault.jpg,en,ru,False,97,PT1M37S,hd,False,True,False,False,644023,26858,5937
OrNuOJg9x28,LV,2026-04-07T03:38:28.036575+00:00,2026-04-02T08:03:08Z,Lumi Likes Draco!? (Brawl Stars Animation),Lumi Likes Draco!? (Brawl Stars Animation),Brawl Stars,UCooVYzDxdwTtGYAkcPmOgOw,20,Gaming,"brawl stars, mobile game, mobile strategy game, mobile rpg, mobile battle royale, battle royale, supercell game",7,https://i.ytimg.com/vi/OrNuOJg9x28/hqdefault.jpg,en,en,False,87,PT1M27S,hd,True,True,False,False,7625919,131377,4625
HBMy-y2wb4I,LV,2026-04-07T03:38:28.036583+00:00,2026-03-28T10:14:16Z,YE - FATHER (feat. TRAVIS SCOTT),YE - FATHER (feat. TRAVIS SCOTT),Kanye West,UCs6eXM7s8Vl5WcECcRHc2qQ,22,People & Blogs,"ye, YE, Kanye West, Kanye, bully, travis scott, kanye west, ye bully, ye bully album, ye father, ye travis scott, ye travis scott father, travis scott father, ye father music video, father music video, ye travis scott music video, kanye west runaway, kanye west type beat, ye bully highs and lows, ye bully v1, ye bully full album, ye bully type beat, ye bully serotonin, ye bully circles, ye bully v2, kanye west bully, kanye west bully album, ye bully film, kanye west god is",29,https://i.ytimg.com/vi/HBMy-y2wb4I/hqdefault.jpg,en,zh-Hans,False,172,PT2M52S,hd,False,False,False,False,12546826,516601,26416
r5LtT3O3eQ8,LV,2026-04-07T03:38:28.036591+00:00,2026-03-04T16:01:13Z,Atomic Heart: Кровь на Хрустале DLC#4 – Геймплейный трейлер,Atomic Heart: Кровь на Хрустале DLC#4 – Геймплейный трейлер,Mundfish #AtomicHeart,UCjAij4NWCod80d70enm3tRw,20,Gaming,"Atomic Heart, trailer, teaser, gameplay, DLC, DLC 4, Chelomey, videogames, games, robots, P-3, Атомик Харт, Атомное Сердце, видеоигры, игры, трейлер, тизер, превью, анонс, длс, длц, продолжение, Челомей, dolphin, Пугачева mundfish, Atomic Universe, PC PS5 Xbox, first person shooter, trending game, retrofuturism, twins, game trailer, близняшки, атомик хард, шутер, роботы, игры 2025, ретрофутуризм, дополнение, финал, final, twin, blood on crystal, кровь на хрустале",44,https://i.ytimg.com/vi/r5LtT3O3eQ8/hqdefault.jpg,ru,ru,False,96,PT1M36S,hd,True,False,False,False,449227,26776,2342
q8rOLYEvwE4,LV,2026-04-07T03:38:28.036599+00:00,2026-04-06T01:12:38Z,CRIMSON DESERT - DEADP47 и СОНИК НЕ ПРАВЫ,CRIMSON DESERT - DEADP47 и СОНИК НЕ ПРАВЫ,TheDRZJ,UC_gKMJFeCf1bKzZr_fICkig,20,Gaming,,0,https://i.ytimg.com/vi/q8rOLYEvwE4/hqdefault.jpg,ru,ru,False,3263,PT54M23S,hd,False,True,False,False,217669,17998,1455
A1nu9jg6ciY,LV,2026-04-07T03:38:28.036607+00:00,2026-04-06T11:00:00Z,BTS '2.0' Dance Practice,BTS '2.0' Dance Practice,BANGTANTV,UCLkAepWjdylmXSltofFvsYQ,10,Music,"방탄소년단, BTS, BANGTAN, 알엠, RM, 슈가, SUGA, 제이홉, jhope, 지민, 정국, k-pop, 방탄, j-hope, Jung Kook, Jimin, BTS V, Jin",18,https://i.ytimg.com/vi/A1nu9jg6ciY/hqdefault.jpg,ko,ko,False,178,PT2M58S,hd,False,True,False,False,2558615,532896,18857
ghvYGI56OdY,LV,2026-04-07T03:38:28.036615+00:00,2026-04-06T14:04:25Z,😱ПРОКАЧАЛ ПОДПИСЧИЦУ НА ЕЁ ДЕНЬ РОЖДЕНИЯ В БРАВЛ СТАРС! (она заплакала),😱ПРОКАЧАЛ ПОДПИСЧИЦУ НА ЕЁ ДЕНЬ РОЖДЕНИЯ В БРАВЛ СТАРС! (она заплакала),BEZSMERTNY BS ,UCcOYr_9bA5_uPJ-6uFOrxZw,20,Gaming,"бравл старс, brawl stars, ПРОКАЧАЛ ПОДПИСЧИЦУ, ПРОКАЧКА В БРАВЛ СТАРС, ПРОКАЧКА АККАУНТА В БРАВЛ СТАРС, бравл, brawl, ПРОКАЧАЛ ПОДПИСЧИЦУ НА ЕЁ ДЕНЬ РОЖДЕНИЯ, ПРОКАЧАЛ ПОДПИСЧИКА, ЗАДОНАТИЛ ПОДПИСЧИКУ В БРАВЛ СТАРС, ПРОКАЧКА АККАУНТА, ПРОКАЧКА ХОЛДИК, холдик, holdik, холдик ящики, бессмертный, bezsmertny, обнова бравл старс, обнова бс, новый бравлер, ВЫБИЛ НОВОГО БРАВЛЕРА, ВЫБИЛ УЛЬТРА ЛЕГЕНДАРНОГО БРАВЛЕРА, витал шарк, vital shark, пуш 200к, забустил подписчицу, БРАВЛ, БС, ХОЛДИК",29,https://i.ytimg.com/vi/ghvYGI56OdY/hqdefault.jpg,ru,ru,False,2340,PT39M,hd,False,True,False,False,191016,19779,3303
Td22tqM-9Qo,LV,2026-04-07T03:38:28.036623+00:00,2026-03-23T11:00:04Z,"OG Buda, 163ONMYNECK – SST","OG Buda, 163ONMYNECK – SST",OG BUDA,UCFfNY2QtiTDkvkqjiqon4xA,10,Music,"Og buda, POX WAWE, 2023, тренд, токсис, новый альбом, тур, концерты, буда, Random crew, Mayot, rozhok3d, Фломастер, риса за творчество, Егор крид, Мэлон мъюзик, Рандом крю, Скучаю но работаю, Тюмень, Плейлист, Hot Shot, баста, новый клип, реакция, РЗТ реакция, Егор Крит, Крид Токсис, Новый трек, 2025, 2024, Топ 20 Россия, Top 20 Russia, фририо3, бандана, #2025, анар, анар абдулаев, лок дог, 163, 163onmyneck",40,https://i.ytimg.com/vi/Td22tqM-9Qo/hqdefault.jpg,ru,ru,False,127,PT2M7S,hd,False,False,False,False,811851,30613,1529
9a5TUplqjFw,LV,2026-04-07T03:38:28.036632+00:00,2026-04-05T13:21:07Z,ИГРА ИЗ ТОГО САМОГО МЕМА! КОПАЕМ ПОДЗЕМНЫЙ ТОННЕЛЬ В KEEP DIGGING ,ИГРА ИЗ ТОГО САМОГО МЕМА! КОПАЕМ ПОДЗЕМНЫЙ ТОННЕЛЬ В KEEP DIGGING ,Joe Speen,UCLizDDpxiFRoqTLlMyGX7lQ,20,Gaming,"joe_speen, Joe, Speen, джо, Спин, выживание, выживание с другом, финал, симулятор камня прохождение, stone simuulator, симулятор выживания, игра на выживаанние, мультиплеер, симулятор копания, симулятор копания ямы, копаем подземный тоннель, keep digging, keep digging прохождение, keep digging coop",19,https://i.ytimg.com/vi/9a5TUplqjFw/hqdefault.jpg,ru,ru,False,4743,PT1H19M3S,hd,False,True,False,False,369294,25303,1709
ZXFaB3f32OM,LV,2026-04-07T03:38:28.036640+00:00,2026-03-05T21:03:07Z,КУКЛА (feat. VONAMOUR) [Remix 2026],КУКЛА (feat. VONAMOUR) [Remix 2026],Diskoteka Avariya - Topic,UCcps2ZWJs0qZzvTlcQ4dUuA,10,Music,"Дискотека Авария, VONAMOUR, КУКЛА (feat. VONAMOUR) [Remix 2026]",3,https://i.ytimg.com/vi/ZXFaB3f32OM/hqdefault.jpg,ru,ru,False,206,PT3M26S,hd,False,True,False,False,2583739,34745,200
3p4DAkIItJw,LV,2026-04-07T03:38:28.036648+00:00,2026-04-05T13:27:21Z,ПОЗВАЛ БЕССМЕРТНОГО ПУШИТЬ 500К И ЕГО ЗАБАНИЛИ😱 СПИДРАН 500К С БЕЗСМЕРТНЫМ В БРАВЛ СТАРС,ПОЗВАЛ БЕССМЕРТНОГО ПУШИТЬ 500К И ЕГО ЗАБАНИЛИ😱 СПИДРАН 500К С БЕЗСМЕРТНЫМ В БРАВЛ СТАРС,Vital Shark,UCwkevls9pbQ4TnFSbHvSaVA,20,Gaming,"бравл старс, brawl stars, бравл, старс, brawl, stars, бс, витал шарк, vital shark, витал, шарк, vital, shark, БЕССМЕРТНЫЙ, БЕЗСМЕРТНЫЙ, bezsmertny, бессмертный бс, ПОЗВАЛ БЕССМЕРТНОГО В БС, ПОЗВАЛ БЕССМЕРТНОГО ПУШИТЬ, БЕССМЕРТНОГО ЗАБАНИЛИ, БЕЗСМЕРТНОГО ЗАБАНИЛИ, СПИДРАН 500К С БЕЗСМЕРТНЫМ, СПИДРАН 500К, С НУЛЯ ДО 500К, 500К КУБКОВ, 500000 КУБКОВ, ПУШ КУБКОВ С НИКИТОЙ БЕСМЕРТНЫМ, НИКИТА БЕССМЕРТНЫЙ, БЕСМЕРТНЫЙ, БЕСМЕРТНЫЙ БС, БЕСМЕРТНЫЙ ПУШ, 500000 С BEZSMERTNY, 500К С БЕСМЕРТНЫМ, 500К",34,https://i.ytimg.com/vi/3p4DAkIItJw/hqdefault.jpg,ru,ru,False,1304,PT21M44S,hd,False,True,False,False,396151,24371,1239
l8sSQAa1kNM,LV,2026-04-07T03:38:28.036656+00:00,2026-03-19T15:00:08Z,"Hyunjin ""LOVER"" Video","Hyunjin ""LOVER"" Video",Stray Kids,UC9rMiEjNaCSsebs31MRDCRA,10,Music,"JYP Entertainment, JYP, Stray Kids, 스트레이 키즈, SKZ, 스키즈, 방찬, BANG CHAN, 리노, LEE KNOW, 창빈, CHANGBIN, 현진, 황현진, HYUNJIN, 한, 한지성, HAN, 필릭스, FELIX, 용복, 승민, 김승민, SEUNGMIN, 아이엔, I.N, 현진 러버, 러버, LOVER, Hyunjin LOVER, 현진 LOVER, 스트레이 키즈 현진 러버, 스키즈 현진 러버, SKZ Hyunjin LOVER, Stray Kids Hyunjin LOVER, 황현진 러버, 황현진 LOVER, 현진 작사, 현진 작곡, 스키즈 현진 작사, 스키즈 현진 작곡, Hyunjin vocal, 현진 보컬, 현진 노래, 스키즈 자작곡, 스트레이키즈 자작곡, 황현진 작사, 황현진 작곡, 황현진 보컬, 현진 자작곡, 스키즈 현진 자작곡, 스트레이 키즈 현진 자작곡, Hyunjin song",53,https://i.ytimg.com/vi/l8sSQAa1kNM/hqdefault.jpg,en,ko,False,188,PT3M8S,hd,True,True,False,False,7109747,735845,55039
9aprp1zPTt8,LV,2026-04-07T03:38:28.036665+00:00,2026-04-06T07:08:18Z,Day 2 | PGL Bucharest 2026 Group Stage |🎙КРИВОЙ ЭФИР,Day 2 | PGL Bucharest 2026 Group Stage |🎙КРИВОЙ ЭФИР,SL4M & Counter-Strike ,UCd3C0cHsp7xSj44UYetK1Nw,20,Gaming,"sl4m, PGLBUCHAREST, PGL, PGLBUCHAREST2026, слэм стрим, слэм ютуб, pgl на русском, пгл на русском, #SL4M, Counter, Strike, ESLCS, CS, Pro CS, PGL Pro CS, PGL Tournament, PGL Pro Tournaments, PGL Highlights, Counter Strike best plays, Professional Counter Strike, cs2, CS2Highlights, Counter Strike, Spirit, Falcons, donk, VP, VirtusPro, FURIA, s1mple",30,https://i.ytimg.com/vi/9aprp1zPTt8/hqdefault.jpg,ru,ru,False,37733,PT10H28M53S,hd,False,True,False,False,350167,9841,2
o6jQo3-iCao,LV,2026-04-07T03:38:28.036674+00:00,2026-03-06T17:00:06Z,Harry Styles - American Girls (Official Video),Harry Styles - American Girls (Official Video),HarryStylesVEVO,UCbOCbp5gXL8jigIBZLqMPrw,10,Music,"Harry styles, aperture, american girls official video, american girls, i’ve known you for ages, american girls all over the world, my friends are in love with american girls, ive seen it in stages all over the world, right at home with perfect timing, face that knows perfect lighting, harry styles live, harry styles music video, harry styles we belong together, together together, harry styles together together, harry styles lyrics, harry styles new music video",17,https://i.ytimg.com/vi/o6jQo3-iCao/hqdefault.jpg,en,en,False,228,PT3M48S,hd,False,True,False,False,12396212,308199,9619
NnTycJg1MIo,LV,2026-04-07T03:38:28.036682+00:00,2026-03-30T00:00:00Z,Destroying A World That Doesn't Exist,Destroying A World That Doesn't Exist,Wifies,UCiVJZlfcmWMUiXv5oywnDhQ,20,Gaming,"wifies, mumbo jumbo, dream, wifies arg, at the crossroads dont turn left, the king in yellow",6,https://i.ytimg.com/vi/NnTycJg1MIo/hqdefault.jpg,en,en,False,7355,PT2H2M35S,hd,False,True,False,False,12384352,812067,117773
10OJhIc_-vw,LV,2026-04-07T03:38:28.036690+00:00,2026-03-30T03:52:19Z,Minecraft Speedrunner VS 6 Hunters REMATCH,Minecraft Speedrunner VS 6 Hunters REMATCH,Dream,UCTkXRDQl0luXxVQrRQvWS6w,20,Gaming,"minecraft, dream, dream minecraft",3,https://i.ytimg.com/vi/10OJhIc_-vw/hqdefault.jpg,en,en,False,3129,PT52M9S,hd,True,True,False,False,8626388,372342,25544
0e9or85Quzw,LV,2026-04-07T03:38:28.036697+00:00,2026-04-02T12:41:47Z,МЕНЯ ПРЕДАЛ МОЙ КЛАН... Выживание на Сервере 100 Дней в Майнкрафт...,МЕНЯ ПРЕДАЛ МОЙ КЛАН... Выживание на Сервере 100 Дней в Майнкрафт...,Огород Домера,UCXafqFLvFwxLpYNIRRf42IQ,20,Gaming,"Домер, Домер гриф, Domer, Domer Grief, Minecraft, Майнкрафт, рили ворлд, рилик, really world, сервер домера, выживание на сервере, выживание майнкрафт, сервер Майнкрафт, майнкрафт хардкор, Майнкрафт без доната, Алина хейтерша, выживание в Майнкрафт, анархия, тролинг Майнкрафт, отомстил в Майнкрафт, ловушки Майнкрафт, выживание Джамшута, Майн, с игрока до бога, домер выживание, девочка в Майнкрафт, reallyworld, Меня предал мой клан, 100 дней, выживание 100 дней",30,https://i.ytimg.com/vi/0e9or85Quzw/hqdefault.jpg,ru,ru,False,5353,PT1H29M13S,hd,False,True,False,False,774205,41868,5407
Eeos7j39GKE,LV,2026-04-07T03:38:28.036705+00:00,2026-04-06T16:48:02Z,ВСЕ ЗАВИДУЮТ МОЕЙ УДАЧЕ В МОНОПОЛИИ В МАЙНКРАФТ!,ВСЕ ЗАВИДУЮТ МОЕЙ УДАЧЕ В МОНОПОЛИИ В МАЙНКРАФТ!,EdisonPts,UCrpt82vHWIWZSHtNQxncPrg,20,Gaming,"minecraft, майнкрафт, едисон, эдисон, edisonpts, мопонолия",6,https://i.ytimg.com/vi/Eeos7j39GKE/hqdefault.jpg,ru,ru,False,2327,PT38M47S,hd,False,True,False,False,142663,13372,1050
wdt3sj88GOY,LV,2026-04-07T03:38:28.036713+00:00,2026-04-05T12:01:35Z,ОЧЕНЬ ЛЁГКАЯ ДОСТАВКА ► Easy Delivery Co,ОЧЕНЬ ЛЁГКАЯ ДОСТАВКА ► Easy Delivery Co,Kuplinov ► Play,UCdKuE7a2QZeHPhDntXVZ91w,20,Gaming,"Easy Delivery Co, Easy Delivery Co game, Easy Delivery Co игра, Easy Delivery Co let's play, Easy Delivery Co летс плей, Easy Delivery Co геймплей, Easy Delivery Co gameplay, Kuplinov Play, Куплинов плей, Куплинов, Kuplinov",11,https://i.ytimg.com/vi/wdt3sj88GOY/hqdefault.jpg,ru,ru,False,2826,PT47M6S,hd,False,True,False,False,278283,17278,451
