video_id,country,fetched_at,published_at,title,localized_title,channel_title,channel_id,category_id,category_name,tags,tag_count,thumbnail,default_language,audio_language,is_live,duration,duration_raw,definition,caption_available,licensed_content,embeddable,made_for_kids,views,likes,comments
G2JT0YMRXvE,MT,2026-03-28T03:21:56.794344+00:00,2026-03-20T06:00:28Z,The Travellers - Poeżija Mingħajr Tmiem,The Travellers - Poeżija Mingħajr Tmiem,The Travellers,UCSE-AidG5spz8wNu-5tXI-A,10,Music,"muzika muzika, poezija minghajr tmiem, Travellers Malta, Muzika Muzika 2026, Malta music, Travellers songs, the travellers, travellers, travellers malta, hafi paci kuluri, the travellers ersaq fil qrib, maltese songs, semplicita, the travelers, the travellers malta, ersaq fil qrib lyrics, xemx u xita, xemx, travelers malta, maltese song, travellers song, travelers songs, maltese music, diski bil malti, malta music, gozo, hdejja, poezija, imhabba kelma kbira wisq, sbejha, gmiel",31,https://i.ytimg.com/vi/G2JT0YMRXvE/hqdefault.jpg,mt,mt,False,212,PT3M32S,hd,False,False,False,False,28524,463,85
aBlsrtxuwss,MT,2026-03-28T03:21:56.794397+00:00,2026-03-18T11:17:52Z,Spider-Man: Brand New Day - Official Trailer,Spider-Man: Brand New Day - Official Trailer,PlayStation,UC-2Y8dQb0S6DtpxNgAKoJKA,20,Gaming,"PlayStation, PS5, video games, next gen, Sony",5,https://i.ytimg.com/vi/aBlsrtxuwss/hqdefault.jpg,en,en,False,158,PT2M38S,hd,False,True,False,False,16646907,645921,26891
5QscahGVf1Y,MT,2026-03-28T03:21:56.794411+00:00,2026-03-21T20:30:00Z,SIDEMEN AMONG US: THE MOST EXPLOSIVE EPISODE EVER,SIDEMEN AMONG US: THE MOST EXPLOSIVE EPISODE EVER,MoreSidemen,UCh5mLn90vUaB1PbRRx_AiaA,22,People & Blogs,"sidemen, moresidemen, miniminter, ksi, zerkaa, behzinga, tbjzl, vikkstar, wroetoshaw",9,https://i.ytimg.com/vi/5QscahGVf1Y/hqdefault.jpg,en,en-GB,False,2913,PT48M33S,hd,False,True,False,False,4343858,147452,6476
Yse0H0mXEuQ,MT,2026-03-28T03:21:56.794420+00:00,2026-03-26T13:42:19Z,"BALEN - JAY MAHAKAALI (Swapnil, Chronic Beatz, Foeseal)","BALEN - JAY MAHAKAALI (Swapnil, Chronic Beatz, Foeseal)",Balen,UCJgcDT2XI3cQJhGe01AFaHQ,1,Film & Animation,,0,https://i.ytimg.com/vi/Yse0H0mXEuQ/hqdefault.jpg,en,en,False,222,PT3M42S,hd,False,True,False,False,4205294,487893,44603
3_9vCamtuPY,MT,2026-03-28T03:21:56.794429+00:00,2026-03-17T16:19:02Z,Dune: Part Three | Official Teaser Trailer,Dune: Part Three | Official Teaser Trailer,Warner Bros.,UCjmJDM5pRKbUlVIzDYYWb6g,1,Film & Animation,"Action, Anya Taylor-Joy, Brian K Vaughan, Charlotte Rampling, Coming Soon, Denis Villeneuve, Dune, Dune Messiah, Dune: Part Three, Florence Pugh, Ida Brooke, Isaach De Bankolé, Jason Momoa, Javier Bardem, Messiah, Nakoa-Wolf Momoa, Rebecca Ferguson, Robert Pattinson, Sci Fi, Timothée Chalamet, Trilogy, Warner Bros, Zendaya",23,https://i.ytimg.com/vi/3_9vCamtuPY/hqdefault.jpg,en,en-US,False,150,PT2M30S,hd,True,False,False,False,26633440,596847,28566
Is5IswM87EQ,MT,2026-03-28T03:21:56.794438+00:00,2026-03-21T17:45:23Z,Minecraft LIVE - March 2026,Minecraft LIVE - March 2026,Minecraft,UC1sELGmy5jp5fQUugmuYlXQ,20,Gaming,"Minecraft, MCL, Minecraft Live, 2025, September, MinecraftLive, Vanilla, deepdig, deep dig, after show, pre show, preshow, Mojang, Xbox, Microsoft, Game Pass, Xbox Game Pass, Minecraft News, Minecraft Update",19,https://i.ytimg.com/vi/Is5IswM87EQ/hqdefault.jpg,en,en,False,1282,PT21M22S,hd,True,False,False,False,3830640,174209,9305
b4iVv91Z6lY,MT,2026-03-28T03:21:56.794447+00:00,2026-03-20T03:58:06Z,BTS (방탄소년단) ‘SWIM’ Official MV,BTS (방탄소년단) ‘SWIM’ Official MV,HYBE LABELS,UC3IZKseVpdzPSBaWxBxundA,10,Music,"HYBE, HYBE LABELS, 하이브, 하이브레이블즈",4,https://i.ytimg.com/vi/b4iVv91Z6lY/hqdefault.jpg,ko,ko,False,245,PT4M5S,hd,True,True,False,False,73667029,5858378,987417
NHk7scrb_9I,MT,2026-03-28T03:21:56.794455+00:00,2026-03-07T05:31:00Z,Dhurandhar The Revenge Official Hindi Trailer | Ranveer S | Aditya D | In Cinemas 19 March 2026,Dhurandhar The Revenge Official Hindi Trailer | Ranveer S | Aditya D | In Cinemas 19 March 2026,JioStudios,UCcXQd6kHKm0b41x8zMVMmMg,24,Entertainment,"Jio Studios, Jio Cinema, Jio Saavn, Jio TV, Dhurandhar, Aditya Dhar, Ranveer Singh, Sanjay Dutt, Akshaye Khanna, R. Madhavan, Arjun Rampal, Sara Arjun, Shashwat Sachdev, Revenge, Hindi Film Trailer, Hindi Film Teaser, Blockbuster Hindi Film, Dhurandhar 2 Teaser, Dhurandhar 2, Bollywood Film, T-Series, Dhurandhar The Revenge, March 19, Dhurandhar Trailer, Dhurandhar 2 Trailer, Dhurandhar The Revenge Trailer, Bollywood Trailer, Movie Trailer, Popular Movie Trailer",29,https://i.ytimg.com/vi/NHk7scrb_9I/hqdefault.jpg,en,en,False,206,PT3M26S,hd,True,True,False,False,68806019,1272386,64001
-kdb8RQe8Nc,MT,2026-03-28T03:21:56.794463+00:00,2026-03-21T20:06:30Z,Whoever Get's The Best Trade WINS.. w/ Steak,Whoever Get's The Best Trade WINS.. w/ Steak,CaylusBlox,UCsPMNatXCwqyUuJilBT73jg,20,Gaming,"caylusblox, caylus roblox, caylus, caylus gaming, caylus infinite, infinite lists, calus, callus, calis, roblox, caylus horror, caylus scary, caylus scariest, caylus scary myths, caylus creepy, caylus roblox horror, caylus roblox scary, caylus steal a brainrot, caylus aura, caylus stream, caylus brainrot, caylus foltyn, aura farm, caylus aura farm, granny bazooka, granny brainrots, granny bazooka brainrot",27,https://i.ytimg.com/vi/-kdb8RQe8Nc/hqdefault.jpg,en-US,en-US,False,3973,PT1H6M13S,hd,False,True,False,False,2128197,24176,780
4Q4Ga2Pb5MY,MT,2026-03-28T03:21:56.794471+00:00,2026-02-25T00:30:05Z,Sal Da Vinci - Per sempre sì (Official Video - Sanremo 2026),Sal Da Vinci - Per sempre sì (Official Video - Sanremo 2026),Sal Da Vinci,UCq8KLfsQ84CzSFSyaPDsuMQ,10,Music,"Sal da vinci, Salvatore Michael Sorrentino, sal da vinci cantante, napoli, musica neomelodica, musica napoletana, sal da vinci musica, sanremo 2026, sal da vinci rossetto e caffè, sal da vinci sanremo 2026, sal da vinci per sempre sì, per sempre sì sal da vinci, sal da vinci per sempre sì official video, sal da vinci per sempre sì video ufficiale, per sempre sì sal da vinci video, sal da vinci per sempre sì sanremo 2026, sal da vinci canzone sanremo 2026",17,https://i.ytimg.com/vi/4Q4Ga2Pb5MY/hqdefault.jpg,it,it,False,206,PT3M26S,hd,False,False,False,False,15741671,114310,9343
DQfmKXQqVD0,MT,2026-03-28T03:21:56.794479+00:00,2026-03-01T05:39:07Z,Aadu 3 Official Trailer | Jayasurya | Midhun Manuel Thomas |Vijay Babu & Venu Kunnappilly| Vinayakan,Aadu 3 Official Trailer | Jayasurya | Midhun Manuel Thomas |Vijay Babu & Venu Kunnappilly| Vinayakan,Friday Film House,UCv65_DW-OzwBgJw99zWJy3g,10,Music,"trailer, malayalam, new teaser, official, jayasury a, midhu manual, aadu 3, aadu 3 bgm, aadu 3 film, aadu 3 cast, aadu 3 scens, aadu 3 songs, aadu 3 pooja, aadu 3 teaser, aadu 3 review, aadu 3 latest, aadu3, aadu 3 release, aadu, aadu 3 location, aadu 3 full movie, aadu 3 malayalam, jayasurya aadu 3, vinayakan aadu 3, aadu 3 launching, aadu 3 interview, aadu 2, aadu 3 trailer bgm, aadu 3 latest news, aadu2, aadu 3 movie review, aadu 3 - promo teaser",32,https://i.ytimg.com/vi/DQfmKXQqVD0/hqdefault.jpg,en,ml,False,182,PT3M2S,hd,True,True,False,False,5480847,192089,8452
_TiGkyUTQiw,MT,2026-03-28T03:21:56.794486+00:00,2026-03-26T18:57:33Z,Our First Cup Final…,Our First Cup Final…,MoreS2G,UCw9rjdrpHa7mzNrWVJoaPgw,20,Gaming,,0,https://i.ytimg.com/vi/_TiGkyUTQiw/hqdefault.jpg,en,en-GB,False,1645,PT27M25S,hd,False,True,False,False,319167,17149,1295
jRqPKih8ZGw,MT,2026-03-28T03:21:56.794494+00:00,2026-03-20T03:16:32Z,NISTAQSI,NISTAQSI,Jasmine - Topic,UCe9gUaly65wWeHcieX2JZpw,10,Music,"JASMINE, NISTAQSI",2,https://i.ytimg.com/vi/jRqPKih8ZGw/hqdefault.jpg,en,en,False,206,PT3M26S,hd,False,True,False,False,4147,51,0
4lFnIlH06Sw,MT,2026-03-28T03:21:56.794501+00:00,2026-03-06T20:00:07Z,Digital Circus Ep 8 Trailer.,Digital Circus Ep 8 Trailer.,GLITCH,UCn_FAXem2-e3HQvmK-mOH4g,1,Film & Animation,"glitch, glitch productions, digital circus, the amazing digital circus, murder drones, Pomni, Uzi, Jax, Ragatha, Kinger, Gangle, Zooble, Caine, Bubble, 3D, Animation, 3D Animation, Indie Animation, Gummigoo",19,https://i.ytimg.com/vi/4lFnIlH06Sw/hqdefault.jpg,en,en,False,67,PT1M7S,hd,True,True,False,False,18811032,903194,53802
pvAJ6NnPdMA,MT,2026-03-28T03:21:56.794509+00:00,2026-03-08T18:53:02Z,Minecraft Speedrunner VS 6 Hunters,Minecraft Speedrunner VS 6 Hunters,Dream,UCTkXRDQl0luXxVQrRQvWS6w,20,Gaming,"minecraft, dream, dream minecraft",3,https://i.ytimg.com/vi/pvAJ6NnPdMA/hqdefault.jpg,en,en,False,4145,PT1H9M5S,hd,True,True,False,False,16061987,675324,35660
55KzMQB6b18,MT,2026-03-28T03:21:56.794517+00:00,2026-03-14T14:30:06Z,Aadu 3 Video Song | Sulthaan | Shaan Rahman | Midhun Manuel Thomas |Vijay Babu & Venu Kunnappilly,Aadu 3 Video Song | Sulthaan | Shaan Rahman | Midhun Manuel Thomas |Vijay Babu & Venu Kunnappilly,Friday Music Company,UCPe9lMwPO86En1jDMdbZaCA,10,Music,"aadu 3, vedhika, jayasurya, shaan rahman dance song, vedhika dance song, vinayakan, dance song, aadu 3 item song, aadu 3 songs, item song, aadu jeevitham song, aadu 2 song, aadu 2 new song, changathi song aadu 2, aadu 2 video song, aadu 2 movie songs, aadu 2 video songs, aadu 3 launching, aadu 3 interview, changaathi nannaayaal song aadu 2, aadu 3 teaser, aadu 3 location, aadu 3 bgm, aadu 3 latest news, aadu 3 cast, aadu 3 scens",26,https://i.ytimg.com/vi/55KzMQB6b18/hqdefault.jpg,en,ml,False,274,PT4M34S,hd,False,True,False,False,4242706,97170,4493
XNQbH1SDPRk,MT,2026-03-28T03:21:56.794525+00:00,2026-03-05T17:00:58Z,The Boys – Final Season Trailer | Prime Video,The Boys – Final Season Trailer | Prime Video,Prime Video,UCQJWtTnAHhEG5w4uN0udnUQ,24,Entertainment,"the boys, the boys season 5, the boys s5, the boys season 5 trailer, the boys season 5 teaser, the boys s5 trailer, the boys s5 teaser, the boys final season, the boys final season trailer, butcher vs soldier boy, butcher vs soldier boy rematch, homelander vs butcher, butcher vs homelander, soldier boy vs butcher, homelander and ryan, butcher vs hughie, hughie vs butcher, the boys final season trailer breakdown, the boys season 5 trailer breakdown, the boys season 5 theories",20,https://i.ytimg.com/vi/XNQbH1SDPRk/hqdefault.jpg,en,en,False,162,PT2M42S,hd,True,True,False,False,6791204,310778,13122
v9W8IdDj4vo,MT,2026-03-28T03:21:56.794532+00:00,2026-03-22T21:54:03Z,do NOT play ROBLOX SNAPCHAT.. 💀,do NOT play ROBLOX SNAPCHAT.. 💀,steak,UC7c8wbA9yQjzxkj2uyrHrkg,20,Gaming,,0,https://i.ytimg.com/vi/v9W8IdDj4vo/hqdefault.jpg,en,en,False,2313,PT38M33S,hd,False,True,False,False,623041,16975,820
wkRum2nPNxk,MT,2026-03-28T03:21:56.794540+00:00,2026-03-22T15:00:06Z,Sayax - LUCKY LUCIANO [Official video],Sayax - LUCKY LUCIANO [Official video],Sayax,UCZ0o5elzddNSZlnsJ6ijBtg,10,Music,,0,https://i.ytimg.com/vi/wkRum2nPNxk/hqdefault.jpg,en,ar,False,170,PT2M50S,hd,False,True,False,False,216189,9191,578
lcvUGs3xaDM,MT,2026-03-28T03:21:56.794547+00:00,2026-02-19T14:00:01Z,Peaky Blinders: The Immortal Man | Official Trailer | Netflix,Peaky Blinders: The Immortal Man | Official Trailer | Netflix,Netflix,UCWOA1ZGywLbqmigxE4Qlvuw,24,Entertainment,"Barry Keoghan, Cillian Murphy, Conspiracy, Netflix, Netflix 2026, New on Netflix, Packy Lee, Peaky Blinders, Rebecca Ferguson, Sophie Rundle, Stephen Graham, Steven Knight, Tense, The Immortal Man, Tim Roth, Tom Harper, Tommy Shelby, Trailer, drama, film",20,https://i.ytimg.com/vi/lcvUGs3xaDM/hqdefault.jpg,en,en-US,False,160,PT2M40S,hd,True,True,False,False,7761019,186322,6958
n86REnOtF6A,MT,2026-03-28T03:21:56.794554+00:00,2026-03-18T19:42:57Z,"Spending $8,592,732 Building An ISLAND In Roblox..","Spending $8,592,732 Building An ISLAND In Roblox..",Foltyn,UCRkuUgtDAL4XSU5jB40J_wA,20,Gaming,"foltyn, foltyn roblox, roblox, roblox foltyn, foltyn family, funny, no swearing, foltyn family roblox, roblox foltyn family, blade ball, roblox blade ball, foltyn blade ball, caylusblox spending $793240198 Building an ISLAND In Roblox, foltyn and caylusblox, foltyn and caylus playing roblox, foltyn and caylus playing steal a brainrot, foltyn and caylus playing roblox together, foltyn brainrot",18,https://i.ytimg.com/vi/n86REnOtF6A/hqdefault.jpg,en,en-US,False,2304,PT38M24S,hd,False,True,False,False,2828282,67670,5167
o6jQo3-iCao,MT,2026-03-28T03:21:56.794562+00:00,2026-03-06T17:00:06Z,Harry Styles - American Girls (Official Video),Harry Styles - American Girls (Official Video),HarryStylesVEVO,UCbOCbp5gXL8jigIBZLqMPrw,10,Music,"Harry styles, aperture, american girls official video, american girls, i’ve known you for ages, american girls all over the world, my friends are in love with american girls, ive seen it in stages all over the world, right at home with perfect timing, face that knows perfect lighting, harry styles live, harry styles music video, harry styles we belong together, together together, harry styles together together, harry styles lyrics, harry styles new music video",17,https://i.ytimg.com/vi/o6jQo3-iCao/hqdefault.jpg,en,en,False,228,PT3M48S,hd,False,True,False,False,11296530,299370,9332
qkXpSSmDKXw,MT,2026-03-28T03:21:56.794569+00:00,2026-03-15T13:07:02Z,Minecraft Pro VS 1000 Player Civilization,Minecraft Pro VS 1000 Player Civilization,Wemmbu,UCkzzNLnuM-VsATWC53ehwOQ,20,Gaming,"minecraft civilisation, minecraft civilization, wemmbu, wemmbu 1000 players, wemmbu unstable smp, wemmbu music, 1000 player minecraft civilization, 1000 players, unstable smp, flamefrags, spokeishere, parrotx2, unstable universe, eggchan",14,https://i.ytimg.com/vi/qkXpSSmDKXw/hqdefault.jpg,en-US,en-US,False,2697,PT44M57S,hd,False,True,False,False,4783323,175781,22235
2GJfWMYCWY0,MT,2026-03-28T03:21:56.794577+00:00,2026-02-27T05:00:07Z,BLACKPINK - ‘GO’ M/V,BLACKPINK - ‘GO’ M/V,BLACKPINK,UCOmHUn--16B90oW2L6FRR3A,10,Music,"YG Entertainment, YG, 와이지, K-pop, BLACKPINK, 블랙핑크, 블핑, 제니, 로제, 리사, 지수, LISA, JISOO, JENNIE, ROSÉ, BLINK, 블링크, JENNIE You & Me, JENNIE You and ME, You & Me, You and Me, 제니 You & Me, 제니 You and Me, 제니 유앤미, 유앤미, JENNIE 유앤미, 제니 코첼라, JENNIE COACHELLA",28,https://i.ytimg.com/vi/2GJfWMYCWY0/hqdefault.jpg,en,ko,False,202,PT3M22S,hd,True,True,False,False,60966197,3544610,323452
wyKNY1_HnTc,MT,2026-03-28T03:21:56.794585+00:00,2026-03-14T16:00:05Z,"Countries Decide Who Wins $25,000","Countries Decide Who Wins $25,000",MrBeast Gaming,UCIPPMRA040LQr5QPyJEbmXA,20,Gaming,,0,https://i.ytimg.com/vi/wyKNY1_HnTc/hqdefault.jpg,en,en,False,1508,PT25M8S,hd,True,True,False,False,14474018,447317,66192
iAtoZar5W58,MT,2026-03-28T03:21:56.794592+00:00,2026-02-24T14:44:06Z,Aaya Sher - Lyrical | The Paradise | Nani | Anirudh Ravichander | Srikanth Odela,Aaya Sher - Lyrical | The Paradise | Nani | Anirudh Ravichander | Srikanth Odela,Saregama Telugu,UC68nKdrLbLL0Vj7ilVkLmmg,10,Music,"Anirudh Ravichander, The Paradise Theme OST, The Paradise Original Sound Track, The Paradise Theme music, Nani The Paradise theme, Anirudh Ravichander OST, Anirudh BGM, Anirudh theme music, Anirudh Ravichander The Paradise, Nani Anirudh combo, The Paradise background score, Srikanth Odela The Paradise, The Paradise theme score, Anirudh Ravichander original soundtrack, Nani OST",15,https://i.ytimg.com/vi/iAtoZar5W58/hqdefault.jpg,en,te,False,297,PT4M57S,hd,False,True,False,False,70240899,1279392,39507
