video_id,country,fetched_at,published_at,title,localized_title,channel_title,channel_id,category_id,category_name,tags,tag_count,thumbnail,default_language,audio_language,is_live,duration,duration_raw,definition,caption_available,licensed_content,embeddable,made_for_kids,views,likes,comments
5ZlVvIGlQn4,ZW,2026-05-30T04:35:04.638732+00:00,2026-05-29T08:01:41Z,Winky D - Chivanhu (Official Ai Video),Winky D - Chivanhu (Official Ai Video),winkyonline,UC9iqkdRHEbX7hwEu9D6J8wg,10,Music,,0,https://i.ytimg.com/vi/5ZlVvIGlQn4/hqdefault.jpg,en,und,False,201,PT3M21S,hd,False,False,False,False,495742,59432,10928
jLbst85USN8,ZW,2026-05-30T04:35:04.638768+00:00,2026-05-28T14:53:06Z,Call of Duty: Modern Warfare 4 | Reveal Trailer,Call of Duty: Modern Warfare 4 | Reveal Trailer,Call of Duty,UC9YydG57epLqxA9cTzZXSeQ,20,Gaming,"call of duty, cod, activision, call of duty: modern warfare 4, modern warfare 4, mw4",6,https://i.ytimg.com/vi/jLbst85USN8/hqdefault.jpg,en,en,False,170,PT2M50S,hd,False,True,False,False,26866834,174554,18764
9-AznM_q92o,ZW,2026-05-30T04:35:04.638781+00:00,2026-05-26T20:49:37Z,🔴NIGERIA vs ZIMBABWE - International Friendly 2026 | Pes 21 Simulation Gameplay,🔴NIGERIA vs ZIMBABWE - International Friendly 2026 | Pes 21 Simulation Gameplay,Banchik,UCAyQhBjvrEEVhmnWCWHt56w,20,Gaming,"pes 2021, pes 2021 gameplay, soccer, pro evolution soccer 2021, pc gameplay, football pes 2021, sport, football, gameplay video, gameplay, pc, gameplay football, gameplay pes 2021, pes 2021 pc, game, футбол, спорт, игра, геймплей, efootball, pes 2025, soccer game, football game, video, live football, international friendly 2026, friendly match, nigeria, nigeria vs zimbabwe, zimbabwe, pre-world cup 2026",31,https://i.ytimg.com/vi/9-AznM_q92o/hqdefault.jpg,en,ru,False,26847,PT7H27M27S,hd,False,True,False,False,19713,55,0
Jsr9Z65Lwlo,ZW,2026-05-30T04:35:04.638792+00:00,2026-05-16T09:07:36Z,Magic Wacho - Kure Kure (Zim liberation military songs cover),Magic Wacho - Kure Kure (Zim liberation military songs cover),Magic Wacho,UCk7cVGG8ebpM4mr9npJ1iKw,10,Music,"Magic wacho, Kure song, Kure kure song, kure kure kure song by zim military original, Magic wacho kure kure, Kure kure, Mai vanorwara ndiri kure",7,https://i.ytimg.com/vi/Jsr9Z65Lwlo/hqdefault.jpg,en,en,False,192,PT3M12S,hd,False,True,False,False,1244751,25127,1679
mfUtseK27pc,ZW,2026-05-30T04:35:04.638801+00:00,2026-05-27T16:00:01Z,Marvel Animation’s X-Men ‘97 Season 2 | Official Trailer,Marvel Animation’s X-Men ‘97 Season 2 | Official Trailer,Marvel Entertainment,UCvC4D8onUfXzvjTOM-dBfEA,24,Entertainment,"marvel, comics",2,https://i.ytimg.com/vi/mfUtseK27pc/hqdefault.jpg,en,en,False,119,PT1M59S,hd,True,True,False,False,2913512,136012,8371
kXSwwQQsJGk,ZW,2026-05-30T04:35:04.638809+00:00,2026-05-29T16:00:36Z,Living Inside of My Friend’s Backpack Until He Notices..,Living Inside of My Friend’s Backpack Until He Notices..,Cash,UC0eLBYhxW9HC0P9PXQ73mpQ,24,Entertainment,"Cash, Nico, Nico and Cash, Cash and Nico, Minecraft, Minecraft mod, family friendly, kid friendly",8,https://i.ytimg.com/vi/kXSwwQQsJGk/hqdefault.jpg,en,en-US,False,977,PT16M17S,hd,False,True,False,False,383664,5663,1687
ahiAfeU1Wyc,ZW,2026-05-30T04:35:04.638818+00:00,2026-05-11T18:53:41Z,Shinsoman - Munhu Wangu (Always On My Mind) Ft Kae Chaps [Official Music Video],Shinsoman - Munhu Wangu (Always On My Mind) Ft Kae Chaps [Official Music Video],Shinsoman,UC5ceAFN8YFgEGKztFygJbtQ,10,Music,,0,https://i.ytimg.com/vi/ahiAfeU1Wyc/hqdefault.jpg,en,und,False,210,PT3M30S,hd,False,False,False,False,642811,10899,735
XmcIjxwLJcY,ZW,2026-05-30T04:35:04.638825+00:00,2026-05-18T15:00:27Z,Lanterns | Official Teaser 2 | HBO Max,Lanterns | Official Teaser 2 | HBO Max,HBO Max,UCx-KWLTKlB83hDI6UKECtJQ,24,Entertainment,"hbo max, hbo, hbo originals, hbo original series, hbo trailer, new on hbo, max, hbo max originals, hbo max trailer, hbo max teaser, hbo max series, hbo max youtube",12,https://i.ytimg.com/vi/XmcIjxwLJcY/hqdefault.jpg,en,en,False,118,PT1M58S,hd,False,True,False,False,2852480,99225,6203
bXc3vZha-QY,ZW,2026-05-30T04:35:04.638833+00:00,2026-05-25T18:00:00Z,NIGERIA vs ZIMBABWE - International Friendlies Pre-World Cup 2026 | Full Match | Simulation PES,NIGERIA vs ZIMBABWE - International Friendlies Pre-World Cup 2026 | Full Match | Simulation PES,Football Live,UCxvz6hylB7hsKKK38FE5vXg,20,Gaming,,0,https://i.ytimg.com/vi/bXc3vZha-QY/hqdefault.jpg,en,en,False,3864,PT1H4M24S,hd,False,True,False,False,14275,81,8
eh4jV5NRkLI,ZW,2026-05-30T04:35:04.638841+00:00,2026-05-21T08:00:06Z,Mwari  Wazadza - The Unveiled ft Sipho Snowy (Official Live Video),Mwari  Wazadza - The Unveiled ft Sipho Snowy (Official Live Video),The Unveiled,UCNSVb3u4acJmp36nnlVXXUA,10,Music,,0,https://i.ytimg.com/vi/eh4jV5NRkLI/hqdefault.jpg,en,und,False,562,PT9M22S,hd,False,True,False,False,327981,16940,2018
f_bKjZeJBBI,ZW,2026-05-30T04:35:04.638848+00:00,2026-05-05T04:10:02Z,The Odyssey | Official New Trailer,The Odyssey | Official New Trailer,Universal Pictures,UCq0OueAsdxH6b8nyAspwViw,24,Entertainment,,0,https://i.ytimg.com/vi/f_bKjZeJBBI/hqdefault.jpg,en-US,en-US,False,152,PT2M32S,hd,True,True,False,False,23925929,324457,32966
FO9kMeIQI7M,ZW,2026-05-30T04:35:04.638856+00:00,2026-05-23T16:00:13Z,10 YouTubers vs 1 Secret Traitor,10 YouTubers vs 1 Secret Traitor,MrBeast Gaming,UCIPPMRA040LQr5QPyJEbmXA,20,Gaming,,0,https://i.ytimg.com/vi/FO9kMeIQI7M/hqdefault.jpg,en,en,False,1359,PT22M39S,hd,True,True,False,False,28529601,616225,22960
CG5LiL2jg7U,ZW,2026-05-30T04:35:04.638864+00:00,2026-05-22T17:30:06Z,Takura - Handizvione (Official Video),Takura - Handizvione (Official Video),TakuraVEVO,UCPgXwTbcpXDjoR1CN0wFqSQ,10,Music,"Handizvione (Official Video), Takura, Afro-Pop",3,https://i.ytimg.com/vi/CG5LiL2jg7U/hqdefault.jpg,en,en,False,192,PT3M12S,hd,False,True,False,False,206334,8559,588
ADUuLtrFST0,ZW,2026-05-30T04:35:04.638871+00:00,2026-05-24T18:53:27Z,Brighton vs Manchester United | Premier League 2026 | Epl Live | PES 21 Simulation Video -,Brighton vs Manchester United | Premier League 2026 | Epl Live | PES 21 Simulation Video -,Football Gamer Rony,UCaopyJz-EIXOXYXSMOC6c-g,20,Gaming,"sporty tv live, live football match online today, football live, brighton vs manchester united, manchester united, manchester united f.c., football, manchester united vs brighton, မန်ယူ live now, football live match today, sporty tv live stream, mu vs brighton, epl, epl live match today, man u vs brighton, live football, bong da truc tiep hom nay, แมนยูล่าสุด, today football match live, liga inggris, match en direct aujourd-hui, premier league live",22,https://i.ytimg.com/vi/ADUuLtrFST0/hqdefault.jpg,en,en,False,901,PT15M1S,hd,False,True,False,False,244538,1186,12
4DYlWLjJ8ig,ZW,2026-05-30T04:35:04.638880+00:00,2026-05-17T01:22:14Z,Kure kure ndinonzwanani?,Kure kure ndinonzwanani?,Silent Moyo - Topic,UCVOJND7WEH20asJp4iwRMtA,10,Music,"Silent Moyo, S Moyo, Kure kure ndinonzwanani?",3,https://i.ytimg.com/vi/4DYlWLjJ8ig/hqdefault.jpg,en,und,False,168,PT2M48S,hd,False,True,False,False,284405,4242,18
scywbD81O7k,ZW,2026-05-30T04:35:04.638888+00:00,2026-05-24T13:37:15Z,Pep Guardiola Makes a Huge Decision…,Pep Guardiola Makes a Huge Decision…,MoreS2G,UCw9rjdrpHa7mzNrWVJoaPgw,20,Gaming,,0,https://i.ytimg.com/vi/scywbD81O7k/hqdefault.jpg,en,en-GB,False,1273,PT21M13S,hd,False,True,False,False,404030,20204,1460
IfmDh5mnJUs,ZW,2026-05-30T04:35:04.638897+00:00,2026-05-18T22:25:23Z,Chidhindo,Chidhindo,Release - Topic,UCmjKV8Ie08KnkHoJKJt21VQ,10,Music,"Zion Christian church, Chidhindo",2,https://i.ytimg.com/vi/IfmDh5mnJUs/hqdefault.jpg,en,und,False,372,PT6M12S,hd,False,True,False,False,154717,1275,0
x3dral7OjIw,ZW,2026-05-30T04:35:04.638905+00:00,2026-05-20T23:01:04Z,Becoming a TELEPATH to Find My Friend’s SECRETS in Minecraft,Becoming a TELEPATH to Find My Friend’s SECRETS in Minecraft,Milo and Chip,UC_NqVr5AA1vziN0ZLR-QiLw,20,Gaming,"milo, chip, milo and chip, chip and milo, minecraft, minecraft mod, cash, nico, nico and cash, cash and nico, checkpoint, kory, omz, mia, maizen, noob vs pro, minecraft build, Becoming a TELEPATH to Find My Friend’s SECRETS in Minecraft, Reading my friends mind in Minecraft, Using mind reading to find my friends secrets in Minecraft, Milo and chip Minecraft, Chip and Milo Roblox, Milo Minecraft, Minecraft roleplay",24,https://i.ytimg.com/vi/x3dral7OjIw/hqdefault.jpg,en,en-US,False,1391,PT23M11S,hd,False,True,False,False,1606214,1790,203
qnJWnW3VenQ,ZW,2026-05-30T04:35:04.638913+00:00,2026-04-25T07:06:08Z,Bhura Dhanzi - Hulengende feat Madedido ,Bhura Dhanzi - Hulengende feat Madedido ,Hulengende Zw,UC-908rk8ENupyfdny84L5hQ,10,Music,,0,https://i.ytimg.com/vi/qnJWnW3VenQ/hqdefault.jpg,en,und,False,158,PT2M38S,hd,False,True,False,False,2199769,34306,3814
E2BUTEe1GQU,ZW,2026-05-30T04:35:04.638920+00:00,2026-05-24T18:32:13Z,🔴[PES 2021] Liverpool vs Brentford | DESPEDIDA DE SALAH NA PL | RESUMO GAMEPLAY,🔴[PES 2021] Liverpool vs Brentford | DESPEDIDA DE SALAH NA PL | RESUMO GAMEPLAY,Gamer BR - M1l Grau,UCNWfVQJcNYlKyR1gMkJQK6w,20,Gaming,,0,https://i.ytimg.com/vi/E2BUTEe1GQU/hqdefault.jpg,pt-PT,pt-PT,False,209,PT3M29S,hd,False,True,False,False,71913,276,0
p6TXZsSjmZ0,ZW,2026-05-30T04:35:04.638928+00:00,2026-05-11T08:00:06Z,Atenda Chinx - My Man (Official Music Video),Atenda Chinx - My Man (Official Music Video),Atenda Chinx ,UC8ZVGs1QI6Oxq1OWapBs-oQ,10,Music,,0,https://i.ytimg.com/vi/p6TXZsSjmZ0/hqdefault.jpg,en,und,False,187,PT3M7S,hd,False,True,False,False,378602,10260,1245
9xFuYzGUs3c,ZW,2026-05-30T04:35:04.638935+00:00,2026-05-24T18:29:46Z,🔴Manchester City vs Aston Villa Live | Premier League 2026 | Epl Live | eFootball PES21 Simulation,🔴Manchester City vs Aston Villa Live | Premier League 2026 | Epl Live | eFootball PES21 Simulation,RMO,UCDw7iWgxsOgQGPBRFt5Mifw,20,Gaming,,0,https://i.ytimg.com/vi/9xFuYzGUs3c/hqdefault.jpg,en,en,False,10221,PT2H50M21S,hd,False,True,False,False,43963,168,2
5kDCPeSr02k,ZW,2026-05-30T04:35:04.638943+00:00,2026-05-27T07:00:01Z,MTG Hustler - Heartbreak HAINA MONYA (Official Music Video) ft. Voltz JT,MTG Hustler - Heartbreak HAINA MONYA (Official Music Video) ft. Voltz JT,MTGHustlerVEVO,UC4KdTGMVm5QSSHiDnkiNCYg,10,Music,"MTG Hustler, Voltz JT, MTG Hustler Music, Afrobeat",4,https://i.ytimg.com/vi/5kDCPeSr02k/hqdefault.jpg,en,und,False,147,PT2M27S,hd,False,True,False,False,76653,7420,773
hGflQdW9mEg,ZW,2026-05-30T04:35:04.638951+00:00,2026-05-27T20:40:20Z,eChampions League Finals,eChampions League Finals,EA SPORTS FC Pro,UCFA6YGp5lvgayO20lk7_Ung,20,Gaming,"FC Pro, FC Pro esports, FC esports, FC competitive, FC tournament, FC Pro gameplay, EA SPORTS FC, EA SPORTS FC Pro, FC Pro tips, FC Pro tutorial, FC Pro player tips, FC Pro Champ, FC Pro Champion, FC Pro Championship, EA SPORTS, EA SPORTS Pro, FC 26, FC 26 Pro, FC26Pro, FCPro26, FC Pro 26, FC Esports, Live, FC Pro Live, Livestream, easports fc26, FC Pro Open, Ultimate Team, Final, phzin, eChampionsLeague, anders vejrgang, anders fc26, vejrgang, Nicolas99fc, tekkz, eCL, nassada",38,https://i.ytimg.com/vi/hGflQdW9mEg/hqdefault.jpg,en,en,False,14587,PT4H3M7S,hd,False,False,False,False,367705,6758,85
9F4nd57Yc6I,ZW,2026-05-30T04:35:04.638960+00:00,2026-05-24T06:00:06Z,Runna Rulez- MUGOVE (Official Music Video),Runna Rulez- MUGOVE (Official Music Video),Runna Rulez,UC3_gK0DockIqSOBLkxhJYQg,10,Music,,0,https://i.ytimg.com/vi/9F4nd57Yc6I/hqdefault.jpg,en,en,False,193,PT3M13S,hd,False,True,False,False,117311,9650,1270
gu_xiQyFWhs,ZW,2026-05-30T04:35:04.638967+00:00,2026-05-17T03:07:57Z,NOOB vs PRO: SAFEST SUBMARINE HOUSE TO PROTECT FAMILY!!,NOOB vs PRO: SAFEST SUBMARINE HOUSE TO PROTECT FAMILY!!,Maizen,UCJHBJ7F-nAIlMGolm0Hu4vg,20,Gaming,"Minecraft, Maizen",2,https://i.ytimg.com/vi/gu_xiQyFWhs/hqdefault.jpg,en,en,False,2386,PT39M46S,hd,False,True,False,False,2691414,17270,1963
B1Q6qXgmz8I,ZW,2026-05-30T04:35:04.638975+00:00,2026-05-29T17:00:06Z,Holy Ten - German Freestyle ,Holy Ten - German Freestyle ,Holy Ten,UCX56AdFXJoamrXKAL8rL1Zw,10,Music,,0,https://i.ytimg.com/vi/B1Q6qXgmz8I/hqdefault.jpg,en,en,False,149,PT2M29S,hd,False,True,False,False,57532,4851,1741
_6ucSC1-7ZI,ZW,2026-05-30T04:35:04.638982+00:00,2026-05-21T14:02:52Z,1000 Players Simulate UNDERGROUND Civilization in Minecraft,1000 Players Simulate UNDERGROUND Civilization in Minecraft,Wemmbu,UCkzzNLnuM-VsATWC53ehwOQ,20,Gaming,"wemmbu, wembu, wenbu, wemmbu unstable smp, wemmbu the sequel, eggchan, wemmbu eggchan, wemmbu hunted, wemmbu invisible player, unstable smp, unstable universe, parrotx2, minecraft, unstable smp in order, minecraft smp, unstable smp in order wemmbu, unstable smp latest video, unstable smp new video, wemmbu assassin, wemmbu invis player, unstable blue invis player, eggchan missing, flamefrags, egchan, 100 days",25,https://i.ytimg.com/vi/_6ucSC1-7ZI/hqdefault.jpg,en-US,en-US,False,7134,PT1H58M54S,hd,False,True,False,False,5902284,228733,31339
GGcegXXm5fo,ZW,2026-05-30T04:35:04.638990+00:00,2026-05-13T10:28:15Z,Oriyano - Bhebhe (clip officel),Oriyano - Bhebhe (clip officel),Oriyano Official ,UCF812vucrgVxq64SfmjwJzw,10,Music,,0,https://i.ytimg.com/vi/GGcegXXm5fo/hqdefault.jpg,sn,en-GB,False,180,PT3M,hd,False,True,False,False,197317,8003,544
bP86n9nFoJY,ZW,2026-05-30T04:35:04.638998+00:00,2026-05-16T13:07:44Z,Unstable SMP: Civil War,Unstable SMP: Civil War,Parrot,UCPLMPHT-d8GZOqL_AHJFdQQ,20,Gaming,"Minecraft, Minecraft SMP, SMP, Minecraft Server, LifeSteal SMP, School Minecraft Server, School SMP, School Parrot, Parrot, ParrotX2, Dream SMP, TommyInnit, LifeSteal, parrot lifesteal smp, Spoke, minecraft survival, minecraft hardcore, minecraft challenge, minecraft server, HermitCraft, MumboJumbo, Grian, why i broke 100+ bedrock, Here's Why I Made 12240 Minecraft Cakes, Minecraft Hunt, LifeSteal Season 3, 1 Heart Minecraft, LifeSteal Season 4, Why I Removed the World",29,https://i.ytimg.com/vi/bP86n9nFoJY/hqdefault.jpg,en,en,False,4316,PT1H11M56S,hd,False,True,False,False,5725551,217455,45448
fcnDmrtj6Sk,ZW,2026-05-30T04:35:04.639006+00:00,2026-05-23T16:14:03Z,"Shakira, Burna Boy - Dai Dai (Official Video)","Shakira, Burna Boy - Dai Dai (Official Video)",Shakira,UCYLNGLIzMhRTi6ZOLjAPSmw,26,Howto & Style,,0,https://i.ytimg.com/vi/fcnDmrtj6Sk/hqdefault.jpg,en,en,False,241,PT4M1S,hd,False,True,False,False,43821187,1806872,94421
7C2w_iZ5J24,ZW,2026-05-30T04:35:04.639014+00:00,2026-05-26T20:45:01Z,🔴Nigeria vs Zimbabwe - International Friendly 2026 Match | Pes 21 Gameplay Simulation,🔴Nigeria vs Zimbabwe - International Friendly 2026 Match | Pes 21 Gameplay Simulation,Football TV,UCvWuQfTMrRny57Cl3qtEmmg,17,Sports,"pes 2021, pes 2021 gameplay, soccer, pro evolution soccer 2021, pc gameplay, football pes 2021, sport, football, gameplay video, gameplay, pc, gameplay football, gameplay pes 2021, pes 2021 pc, game, футбол, спорт, игра, геймплей, efootball, pes 2025, soccer game, football game, pre-world cup 2026 pes 21, international friendly pes 21, nigeria vs zimbabwe pes 21, nigeria pes 21, zimbabwe pes 21, world friendly pes 21",29,https://i.ytimg.com/vi/7C2w_iZ5J24/hqdefault.jpg,en,en,False,21753,PT6H2M33S,hd,False,True,False,False,8409,27,0
VPJlzsq6x6Q,ZW,2026-05-30T04:35:04.639023+00:00,2026-05-15T12:00:06Z,Kae Chaps - Chemai Nevano Chema (Visualizer),Kae Chaps - Chemai Nevano Chema (Visualizer),KaeChapsVEVO,UCIMNUg407bqc3Ys3xg__Bow,10,Music,"Chemai Nevano Chema (Visualizer), Kae Chaps, Afro-Beat",3,https://i.ytimg.com/vi/VPJlzsq6x6Q/hqdefault.jpg,en,und,False,209,PT3M29S,hd,False,True,False,False,147587,8223,781
aIKdwI6GA7w,ZW,2026-05-30T04:35:04.639031+00:00,2026-05-16T18:54:00Z,"Every Time I Crash, My Lamborghini EVOLVES in GTA 5","Every Time I Crash, My Lamborghini EVOLVES in GTA 5",SpeirsTheAmazingHD,UCAbdeLiTPdjk1X2TY_ZdLDw,20,Gaming,"speirstheamazinghd, speirs the amazing, gta 5 funny moments, gta 5, gta, in gta 5, gta 5 rp, grand theft auto 5, fastest car, gta 5 roleplay, roleplay, gta v roleplay, gta5 roleplay, gta 5 roleplay funny, funny roleplay moments, grand theft auto roleplay, grand theft auto 5 roleplay, every time i crash, every time i crash gta 5, lamborghini evolves, lamborghini gta 5, lamborghini cars, fastest lamborghini, ultimate lamborghini gta 5, lamborghini evolves in gta 5, lamborghini",26,https://i.ytimg.com/vi/aIKdwI6GA7w/hqdefault.jpg,en,en,False,1629,PT27M9S,hd,False,True,False,False,1383107,14309,354
28JZPm-J8X0,ZW,2026-05-30T04:35:04.639039+00:00,2026-05-16T11:55:15Z,Praise Rays - Tamirira Mhinduro Baba ,Praise Rays - Tamirira Mhinduro Baba ,Praise Rays,UCOvJARPKANdCBXpqi2frdGw,10,Music,"Tamirira Mhinduro Baba, praise Rays, gospel music, gospel songs, shona gospel songs, Zimbabwe gospel, trending gospel songs, worship song, praise worship song, grace wave",10,https://i.ytimg.com/vi/28JZPm-J8X0/hqdefault.jpg,en,und,False,307,PT5M7S,hd,False,True,False,False,148819,879,202
wtfH28vJpjI,ZW,2026-05-30T04:35:04.639046+00:00,2026-05-24T18:27:23Z,🔴Manchester City vs Aston Villa | Premier League 25/26 | eFootball PES21 Simulation,🔴Manchester City vs Aston Villa | Premier League 25/26 | eFootball PES21 Simulation,Mona Football,UC-TE4CuE7wKfX6LmeESAjZQ,20,Gaming,,0,https://i.ytimg.com/vi/wtfH28vJpjI/hqdefault.jpg,en,en,False,6626,PT1H50M26S,hd,False,True,False,False,23238,126,2
gR5VEMkVrok,ZW,2026-05-30T04:35:04.639053+00:00,2026-05-22T07:00:35Z,"Tyfah Guni - CHEZIYA ft. Freeman HKD, Nox Guni","Tyfah Guni - CHEZIYA ft. Freeman HKD, Nox Guni",TyfahGuniVEVO,UCovj5pflI9wL-pR3BeBTBoA,10,Music,"Tyfah Guni, Freeman HKD, Nox Guni, Presidential Empire, Afropop",5,https://i.ytimg.com/vi/gR5VEMkVrok/hqdefault.jpg,en,und,False,227,PT3M47S,hd,False,True,False,False,88890,3784,486
gCbQ7k2cjZ0,ZW,2026-05-30T04:35:04.639061+00:00,2026-05-25T13:00:14Z,We Drained The Entire Ocean In GTA 5...,We Drained The Entire Ocean In GTA 5...,TechyCrew,UCTU3m4rCUS-7qXuHK-j9Uqw,20,Gaming,"Techy, TechyCrew, Among Us, Fortnite, Fortnite Creative, Roblox, Techy Roblox, Among Us Roles",8,https://i.ytimg.com/vi/gCbQ7k2cjZ0/hqdefault.jpg,en,en,False,739,PT12M19S,hd,False,True,False,False,349777,5768,570
QmmOjFp-8BA,ZW,2026-05-30T04:35:04.639085+00:00,2026-05-07T15:40:06Z,Anginayo Imali (Official Music Video) - HBK Live Act  x Cardinalx25,Anginayo Imali (Official Music Video) - HBK Live Act  x Cardinalx25,HBK Live Act,UC9PtV3H0GeHPXeyoM8NuGCA,10,Music,,0,https://i.ytimg.com/vi/QmmOjFp-8BA/hqdefault.jpg,en,en,False,290,PT4M50S,hd,False,False,False,False,2070638,11578,453
XQYBIS_KYdc,ZW,2026-05-30T04:35:04.639093+00:00,2026-05-25T16:00:35Z,Roblox +1 Speed Spidey Escape...,Roblox +1 Speed Spidey Escape...,More Techy,UCzlUw75H5ILJ2l_ackxyI6A,20,Gaming,"roblox, funnyroblox, techyblox, techy, crazy fan girls, crazy fan girl, my crazy fan girls, girlfriend, roblox girlfriend",9,https://i.ytimg.com/vi/XQYBIS_KYdc/hqdefault.jpg,en,,False,598,PT9M58S,hd,False,True,False,False,357914,4826,959
zyd_qUwbMm4,ZW,2026-05-30T04:35:04.639101+00:00,2026-05-07T08:00:06Z,Lanko Mutokonyo Muhana (Indica) official video,Lanko Mutokonyo Muhana (Indica) official video,Lanko Mutokonyo,UC26Am-Mr9luLyrgZt1oHM0w,22,People & Blogs,,0,https://i.ytimg.com/vi/zyd_qUwbMm4/hqdefault.jpg,en,und,False,176,PT2M56S,hd,False,False,False,False,192602,5549,420
MRMZbnkOc3g,ZW,2026-05-30T04:35:04.639109+00:00,2026-05-24T20:18:14Z,🎮 Arsenal vs Crystal Palace | Premier League 2026 | Today's match simulation PES2021 ,🎮 Arsenal vs Crystal Palace | Premier League 2026 | Today's match simulation PES2021 ,BUZZ TUBE,UCCjZ0Lp49PgvimSNEW8s7Ug,20,Gaming,,0,https://i.ytimg.com/vi/MRMZbnkOc3g/hqdefault.jpg,en,en,False,246,PT4M6S,hd,False,True,False,False,271584,2518,6
SD4yRDY9mek,ZW,2026-05-30T04:35:04.639116+00:00,2026-05-15T09:07:39Z,Drake - Janice STFU,Drake - Janice STFU,DrakeVEVO,UCQznUf1SjfDqx65hX3zRDiA,10,Music,"Drake, OVO/Republic, Hip Hop",3,https://i.ytimg.com/vi/SD4yRDY9mek/hqdefault.jpg,en,en,False,237,PT3M57S,hd,True,True,False,False,15424248,304463,24304
YAggMpD3pXM,ZW,2026-05-30T04:35:04.639124+00:00,2026-05-24T19:39:12Z,⚽ Brighton 0 vs 3 Manchester United: Match Highlights | Premier League 25-26  Simulation/Recreation,⚽ Brighton 0 vs 3 Manchester United: Match Highlights | Premier League 25-26  Simulation/Recreation,十Loork Football,UCfFNw7MaO7QmWkswaGFGEvA,20,Gaming,"Brighton vs Manchester United live, where to watch Brighton vs Manchester United, watch Brighton vs Manchester United online, Premier League 2025-26, Brighton vs Manchester United live simulation, Brighton, Manchester United, Brighton vs Manchester United, watch live, live online, live today, how to watch live, where to watch live, live match, free live, Look Football, live football, live match simulation",18,https://i.ytimg.com/vi/YAggMpD3pXM/hqdefault.jpg,en,en,False,229,PT3M49S,hd,False,True,False,False,123497,853,1
aGqAWdgmUK0,ZW,2026-05-30T04:35:04.639133+00:00,2026-05-04T16:00:06Z,"Mulest Vankay, Pcee, Scotts Maphuma - Mark Zuckerberg (Official Music Video) ft Slyzza RSA","Mulest Vankay, Pcee, Scotts Maphuma - Mark Zuckerberg (Official Music Video) ft Slyzza RSA",Mulest Vankay,UCfErfKlcy4r7iJXONC1tcfg,10,Music,"Mulest Vankay, Mark Zuckerberg, Pcee, Amapiano, Scotts Maphuma",5,https://i.ytimg.com/vi/aGqAWdgmUK0/hqdefault.jpg,en,en,False,227,PT3M47S,hd,False,False,False,False,2288042,19365,263
nlpSjt6knqE,ZW,2026-05-30T04:35:04.639142+00:00,2026-05-23T14:00:24Z,"I Spent $956,765 On The NEW GUGUGAGA PENGUIN CAR In Driving Empire...","I Spent $956,765 On The NEW GUGUGAGA PENGUIN CAR In Driving Empire...",Techy Plays,UCNDzLI-hyihpAx3zKtwhGZw,20,Gaming,"roblox, brookhaven, funnyroblox, techyblox, techy, crazy fan girls, crazy fan girl, my crazy fan girls",8,https://i.ytimg.com/vi/nlpSjt6knqE/hqdefault.jpg,en,,False,669,PT11M9S,hd,False,True,False,False,352549,5428,406
ONH4FEyNFT8,ZW,2026-05-30T04:35:04.639149+00:00,2026-05-08T08:00:06Z,"Chad Chellart - Over Nobody (Official Video) ft. Holy Ten, Yaya Hande ","Chad Chellart - Over Nobody (Official Video) ft. Holy Ten, Yaya Hande ",Chad Chellart Official,UCx9IbbpdTp6dbEuhDmAIwYw,10,Music,,0,https://i.ytimg.com/vi/ONH4FEyNFT8/hqdefault.jpg,en,sn,False,198,PT3M18S,hd,False,True,False,False,204441,6988,522
FEropZ_Tq7Y,ZW,2026-05-30T04:35:04.639157+00:00,2026-05-25T16:11:08Z,1000 Players Simulate PRISON in Hardcore Minecraft,1000 Players Simulate PRISON in Hardcore Minecraft,Spoke,UCk2uxbWi5py_iJXaEsh2YRA,20,Gaming,"spoke, spokeishere, lifesteal, minecraft, survival, wormhole, unstable, unstable universe, wemmbu, parrotx2",10,https://i.ytimg.com/vi/FEropZ_Tq7Y/hqdefault.jpg,en,en-US,False,10146,PT2H49M6S,hd,False,True,False,False,4003322,136859,28019
0v3WR5eGooE,ZW,2026-05-30T04:35:04.639165+00:00,2026-05-15T17:00:06Z,Mathias Mhere Nyengetera uone (Official Video) The Covenant Album,Mathias Mhere Nyengetera uone (Official Video) The Covenant Album,MathiasMhereMusic,UCQR3Lm4OUjqDZMh_v0f2uiQ,10,Music,,0,https://i.ytimg.com/vi/0v3WR5eGooE/hqdefault.jpg,en,und,False,266,PT4M26S,hd,False,True,False,False,109911,3936,390
h5I-k7WR0vg,ZW,2026-05-30T04:35:04.639172+00:00,2026-05-21T15:00:57Z,JJ vs Monster GIRL Truck - Maizen Minecraft Animation,JJ vs Monster GIRL Truck - Maizen Minecraft Animation,MSToons,UCc2RL8jvY1rJPuCnJVsIQWw,20,Gaming,"minecraft, animation, minecraft animation, maizen, jj, mikey, jj and mikey, maizen animation, maizen minecraft animation, jj and mikey minecraft animation, jj and mikey sad story, まいぜんシスターズ, マインクラフト, まいぜん, jj sister, strong jj, strong jj sister, jj sister and jj",18,https://i.ytimg.com/vi/h5I-k7WR0vg/hqdefault.jpg,en,en,False,724,PT12M4S,hd,False,True,False,False,2486826,9163,98
