video_id,published_at,title,channel_title,category_id,category_name,tags,duration,definition,caption_available,licensed_content,views,likes,comments
St6UOLqRAGY,2025-12-05T12:00:07Z,HANA / NON STOP -Music Video-,HANA official,10,Music,,205,hd,true,True,4352311,182540,15418
nxgSFfKTGBo,2025-12-06T08:31:50Z,『北斗の拳 -FIST OF THE NORTH STAR-』PV第1弾｜1st trailer!,Warner Bros. Japan Anime,1,Film & Animation,"北斗の拳, アニメ『北斗の拳 -FIST OF THE NORTH STAR-』",126,hd,false,True,157102,3865,601
fFgOCeZxDwo,2025-12-06T08:30:50Z,「殺人事件の犯人が住む家」に侵入して撮影するホラーゲーム『 デテイケ - GetOut - 』,キヨ。,20,Gaming,"実況プレイ動画, 実況プレイ, ゲーム実況, 最終兵器俺達, キヨ, ゲーム, 最俺, 実況, イワクツギ, IWAKUTSUGI",5330,hd,false,True,628920,20681,1390
gvWeo1yKoa8,2025-12-05T13:00:07Z,DOMOTO - 愛のかたまり / THE FIRST TAKE,THE FIRST TAKE,10,Music,"the first take, firsttake, ファーストテイク, ふぁーすとていく, 一発撮り, TFT, 音楽, 音楽番組, DOMOTO, 愛のかたまり, AI NO KATAMARI, Kinki Kids, キンキキッズ",316,hd,true,True,1828958,122007,4529
Fv0leN8TmR8,2025-12-07T00:00:04Z,The Boys - Final Season Teaser Trailer | Prime Video,Prime Video,24,Entertainment,"the boys, the boys season 5, the boys s5, the boys season 5 trailer, the boys season 5 teaser, the boys s5 trailer, the boys s5 teaser, the boys soldier boy, the boys homelander, the boys butcher, homelander, butcher, soldier boy, starlight, hughie, homelander vs butcher, butcher vs homelander, homelander vs soldier boy, the boys final season, the boys final season trailer, antony starr, karl urban, jensen ackles, erin moriarty, jack quaid, karen fukuhara, chace crawford",121,hd,true,True,2086452,146055,8731
pMSiTbi2wOE,2025-12-06T07:00:57Z,【3人実況】150万本売れた伝説の脱出ゲーム『THE 密室からの脱出 ～南国のリゾート編～』,レトルト,20,Gaming,"レトルト, retoruto, fun, ゲーム実況, ニコニコ, レトチャンネル, playthrough, 実況プレイ, 攻略, video, game, let's, play",8537,hd,false,True,362330,7263,393
ttEtolANrJk,2025-12-05T13:01:56Z,SixTONES – Amazing!!!!!! [YouTube ver.],SixTONES,10,Music,"SixTONES, ストーンズ, ジェシー, 京本大我, 松村北斗, 髙地優吾, 森本慎太郎, 田中樹, Jesse, Taiga Kyomoto, Hokuto Matsumura, Yugo Kochi, Shintaro Morimoto, Juri Tanaka, ミュージックビデオ",162,hd,false,True,1252937,91380,12633
VI6XO8EijT4,2025-12-05T20:00:28Z,DIGITAL CIRCUS EP 7 TRAILER!!,GLITCH,1,Film & Animation,"glitch, glitch productions, digital circus, the amazing digital circus, murder drones, Pomni, Uzi, Jax, Ragatha, Kinger, Gangle, Zooble, Caine, Bubble, 3D, Animation, 3D Animation, Indie Animation, Gummigoo",58,hd,true,True,5285578,485249,27792
iV4On4mbxGo,2025-12-07T02:29:49Z,新しいクリスマスブレインロットを盗みまくるロブロックス (Roblox),マエスケ,20,Gaming,"ゲーム実況, マエスケ, マエスケ実況, roblox, ロブロックス, ブレインロット, ブレインロットを盗む, クリスマス, クリスマスブレインロット, 超激レア, 秘密, roblox steal a brainrot, 実況, 実況プレイ, 面白い, おもしろ, スマホゲーム, 広告ゲーム, アプリ, 芋, 話題, イタリアンブレインロット, aiモンスター, サンタ",568,hd,false,True,152889,4058,433
r4s09Z80OSI,2025-12-06T08:24:22Z,COUNTDOWN CONCERT 2025-2026 STARTO to MOVE 開催決定！,STARTO ENTERTAINMENT,24,Entertainment,,59,hd,false,True,355181,31150,1218
cHVsdXbhGaQ,2025-12-06T11:03:07Z,【#にじイカ祭り2025】 大会説明＆抽選会【長尾景/倉持めると/にじさんじ】,長尾 景 / Nagao Kei【にじさんじ】,24,Entertainment,"長尾景, ながおけい, nagaokei, にじさんじ, nijisanji, Vtuber, anime, アニメ, japan, 切り抜き, 雑談, game, ゲーム, 実況, 歌ってみた, カバー",7074,hd,false,True,377291,12194,81
VddNY7MPWEo,2025-12-06T10:59:00Z,HOT JAPAN Spectacle Video｜ Handz In My Pocket × KANAZAWA,JO1,10,Music,"PRODUCE101JAPAN, プデュ, 日プ, 川尻蓮, 豆原一成, 川西拓実, 河野純喜, 木全翔也, 金城碧海, 白岩瑠姫, 佐藤景瑚, 鶴房汐恩, 與那城奨, 大平祥生, JO1, じぇいおーわん, ジェイオーワン, 제이오원, KAWASHIRI, REN, MAMEHARA, ISSEI, KAWANISHI, TAKUMI, KONO, JUNKI, KIMATA, SYOYA, KINJO, SKY, SHIROIWA, RUKI, SATO, KEIGO, TSURUBO, SHION, YONASHIRO, SHO, OHIRA, LAPONE, ラポネ, らぽね, Handz, Hands, Handz In My Pocket, Japan, Beautiful Japan, Kanazawa, Ishikawa, 金沢, 石川, 日本",177,hd,true,True,175217,18557,2364
Ma1qcfeAYzw,2025-12-06T22:36:26Z,クリスマスイベントで0.1%当てた - ブレインロットを盗むロブロックス,HikakinGames,20,Gaming,"hikakingames, hikakin, beatbox, game, gameplay, ヒカキン, ヒカキンゲーム, ヒカキンゲームズ, ひかきん, ひかきんげーむず, ビートボックス, ボイパ, ゲーム, ゲーム実況, 実況プレイ, 実況, youtube, youtuber, ユーチューバー, ゆーちゅーぶ, ユーチューブ, スマホ, スマホゲー, PCゲー, PC, roblox, ロブロックス, ROBLOX, ロブロ, ブレインロット, ブレインロットを盗め, ハロウィン, シークレット, コツ, 遊び方, フォートナイト, FORTNITE, ブレインロットを盗む, ブレインロットを盗むロブロックス, クリスマス, ラッキーボックス, lockybox, brainrot, イタリアンブレインロット",12403,hd,false,True,252898,7297,158
BQh7Y6z_r08,2025-12-06T12:00:25Z,EIKI | 二宮和也 - 虹(Cover) [MAZZEL COLOR #まぜいろ],MAZZEL,10,Music,,310,hd,false,True,180777,23198,2274
2LVfpz_9iu4,2025-12-06T09:15:06Z,弓で本気で戦うとこうなります...！,ドズル社,20,Gaming,"ドズル社, マイクラ, まいくら, マインクラフト, とずる社, どする社, ドズル社マイクラ, ドズル, おんりー, おらふくん, ぼんじゅうる, おおはらMEN, PvP, 配布マップ, ハチャメチャ, 射撃",3035,hd,false,True,247087,7428,274
R1aQ4hQDIdY,2025-12-06T10:28:00Z,なにわ男子「Never Romantic」【アーカイブ】㊗️デビュー4周年生配信✨,なにわ男子,10,Music,ミュージックビデオ,172,hd,false,True,145089,16905,680
PKAsDbevQrM,2025-12-06T08:30:22Z,スライムで汚れた村をピカピカにしろ！🧹✨【 マイクラ 】,ちろぴの,20,Gaming,"ゲーム, ちろぴの, マイクラ, マインクラフト, ゲーム実況, まいくら, ぴの, ちろる",2846,hd,false,True,306342,5951,241
CZt8dMKDHsE,2025-12-05T09:00:18Z,Mrs. GREEN APPLE – 私【LIVE from “NOAH no HAKOBUNE”】,Mrs. GREEN APPLE,10,Music,,397,hd,false,False,736781,47560,1967
9lD0aoFAIhU,2025-12-06T14:55:06Z,【#10】EIKOがサイレントヒル f ２周目を生配信！【SILENT HILL f】,狩野英孝【公式チャンネル】EIKO!GO!!,20,Gaming,,9679,hd,false,True,256653,4683,137
O8Tzu18VQU4,2025-12-06T09:00:07Z,ミメイ vs テトリス/戦極MCBATTLE 第40章 Still Fresh MCs (2025.11.28),戦極MCBATTLE,10,Music,"SAM, S-kaine, Meisoa.k.a外人21号, DOTAMA, ミメイ, KOPERU, whimsyboy, CIMA, Kyons, 歩歩, 輪入道, SIMON JAP, 或観樹, 煩悩, ミステリオ, 十六夜, 梵頭, 知葉瑠, ala vivere luce, SATORU, ブッダ, SyAchi, 早雲, よんろく, CORONA, NAIKA MC, NARIMIMI, SILENT KILLA JOINT, ADECK, 写楽, ERONE, MOL53, 漢 a.k.a. GAMI, DJ YANATAKE, peko, MAKA, がーどまん, T-iD, T-TANGG, Donatello, ゆうま, ツチヤチカら 楓, lonelow, Hawk-I, OWG, Sitissy luvit, ZトN, 彩, 佐藤アヴァンギャルドJK, 天涯孤独の民, risano, K-rush, MC☆ニガリa.k.a赤い稲妻【稲妻と破壊王】 ふぁんく, BASE, TERU, バチスタ, 9for, Rin音, クボタカイ, Akusa, ID, GOMESS, ENEMY",244,hd,false,True,78630,2065,413
lmosGWQnap4,2025-12-06T09:01:30Z,最高難易度のLv20へリベンジを挑むらっだぁ運営、一致団結して激アツ展開へ【R.E.P.O.】,らっだぁ,20,Gaming,"マインクラフト, Minecraft, マイクラ, らっだぁ, ゲーム, ゲーム実況, ニコ生",1506,hd,false,True,211493,9420,223
LBamicVzCNI,2025-12-06T09:00:06Z,SEEDA  - ちょっちゅね！！！ Ft. R-指定 (Music Video),SEEDA,10,Music,,182,hd,false,True,125622,5817,353
SqDjW808y8Q,2025-12-07T04:38:54Z,【今年−322万】東京喰種パチンコライブ配信,ノッチ配信者パチンコライブ,24,Entertainment,,8417,hd,false,True,88117,1476,4
HGMcspBKzJA,2025-12-06T10:00:27Z,『隣で』acoustic ver. 優里×吉田右京（マルシィ）,優里ちゃんねる【公式】,22,People & Blogs,,232,hd,false,True,72167,5708,284
MAWVfv-xpgA,2025-12-07T03:00:34Z,転んで意識不明 射撃訓練中のガチ事故 参加勢の死にかけたエピソードがやばすぎた - マインクラフト【KUN】,KUN,20,Gaming,"KUN, くん, クン, マイクラ, 50人クラフト, 建築, 攻城戦, サバイバル, MOD, 工業, ニート部, 人狼, ホラー, BAN, 実況, 日本, 日本語, 面白い, ゲーム, GAME, 実況者, Japan, Japanese, くんマイクラ, くんニート部, くん50人クラフト",1240,hd,false,True,55445,2237,158
6fJ_ZykYleY,2025-12-06T11:00:07Z,Royal Scandal「ファントムペイン」feat. Fuki,Royal Scandal,10,Music,"チェリーハント, クイーンオブハート, ロイスキャ, REVOLVER",228,hd,true,True,68377,6648,323
1vQKFyEdIf8,2025-12-06T20:47:38Z,【ファイナルファンタジー・クリスタルクロニクル/GC版】そろそろ終盤か！？クリアめざすぞ！！【胡桃沢りりか】,胡桃沢りりか,20,Gaming,"新人Vtuber, Vtuber, 天使, メスガキ, ピンク髪, オッドアイ, ゲーム実況, 歌枠, ヤンデレ, 病みかわ, 胡桃沢りりか, 胡桃澤りりか, 女性, Youtuber, 耐久, エンターテイメント, バーチャルyoutuber, ヴァーチャルyoutuber, 雑談, 個人, ゲーム, ロックマン, megaman",21074,hd,false,True,101950,966,1
n_RCQ7yVuk4,2025-12-06T13:01:42Z,現在がとんでもなくエグい事になってるYouTuberの歌 245,ウタエル Utael,24,Entertainment,"UCHvFSU5OP6c7QcJxIr87YtA, ウタエル, うたえる, utael, ユーチューバー, youtuber, YouTube, ユーチューブ, news, ニュース, 時事ネタ",355,hd,false,True,130542,1467,192
-kkpfH_LmrE,2025-12-06T10:30:00Z,また新たな最強の白黒選手が爆誕！！しかも打率.691の猛者と激突！ガチ巨人純正で勝てるのか！？【プロスピA】# 1766,【V.I.P】,20,Gaming,"プロスピ, プロスピa, プロスピA, プロ野球, プロ野球スピリッツ, リアタイ, リアルタイム対戦, ガチャ, 神回, 神引き, プロスピ2019, V.I.P, セレクション, イベント",758,hd,false,True,164257,2853,325
yAXnEHFKKaY,2025-12-05T15:00:06Z,BABYMONSTER - 'PSYCHO' PERFORMANCE VIDEO,BABYMONSTER,10,Music,"BABYMONSTER, 베이비몬스터, 베몬, BABYMON, BAEMON, 하람, 아현, 루카, 치키타, 파리타, 로라, 아사, HARAM, AHYEON, RUKA, CHIQUITA, PHARITA, RORA, ASA",206,hd,false,True,9412289,231766,9017
CJtT09kDWzw,2025-12-07T02:59:10Z,〈PART1〉【ポケカCL2026 愛知 Dec. 2日目】チャンピオンズリーグ2026 愛知 Dec. 生放送【ポケモンカードゲーム】,【公式】ポケモンカードチャンネル,20,Gaming,"ポケモンカードチャンネル, ポケモンカード, ポケカ, ポケモンカードゲーム, pokemon, pokemonTCG, PTCG, pokemon-card, 公式, ライチュ梅川, ななっぷる, ポケカ対戦, ポケモンカードバトル, ポケカチャンネル, スカーレット, バイオレット, ポケモンSV, クチート竹内, よぴふっと, ハイクラスパック, スカーレットex, バイオレットex, スターターセットex, ポケモンex, トリプレットビート, スノーハザード, クレイバースト, ポケモンカード151, exスタートデッキ, 黒炎の支配者, 古代の咆哮, 未来の一閃, レイジングサーフ, シャイニートレジャーex, ワイルドフォース, サイバージャッジ, クリムゾンヘイズ, 変幻の仮面, ナイトワンダラー, ステラミラクル, 楽園ドラゴーナ, 超電ブレイカー, テラスタルフェスex, ポケポケ, Pokémon Trading Card Game Pocket, バトルパートナーズ, 熱風のアリーナ, ロケット団の栄光, ブラックボルト, ホワイトフレア, メガブレイブ, メガシンフォニア, インフェルノX",11870,hd,false,True,120981,699,0
xLVRYZcE7k8,2025-12-04T23:01:25Z,BE:FIRST / Stay Strong - Lyric Video - (映画「WIND BREAKER」主題歌),BE:FIRST Official,10,Music,"SKY-HI, スカイハイ, すかいはい, 日高, ヒダカ, ひだか, 日高光啓, AAA, トリプルエー, すっきり, ｽｯｷﾘ, sukkkiri, THEFIRST, ザファースト, ｻﾞﾌｧｰｽﾄ, ざふぁーすと, BMSG, ビーエムエスジー, ﾋﾞｰｴﾑｴｽｼﾞｰ, びーえむえすじー, ボーイズグループオーディション, ざすと, ザスト, ｻﾞｽﾄ, BEFIRST, ﾋﾞｰｽﾄ, ボーイズグループ, ﾎﾞｰｲｽﾞｸﾞﾙｰﾌﾟ, Boysgroup, BE:FIRST, JUNON, RYUHEI, LEO, SOTA, RYOKI, MANATO, SHUNTO, ジュノン, ｼﾞｭﾉﾝ, リュウヘイ, ﾘｭｳﾍｲ, レオ, ソウタ, ﾚｵ, ｿｳﾀ, リョウキ, ﾘｮｳｷ, マナト, ﾏﾅﾄ, シュント, ｼｭﾝﾄ, BESTY",261,hd,false,True,387666,27131,1130
Wkz24WSb1tk,2025-12-06T09:00:52Z,自動で街中まで金を輸送する装置を完成させました『 Hydroneer 』,ハヤトの野望,20,Gaming,"PC, PC game, PCgame, ゲームプレイ動画, 実況プレイ動画, ゲーム実況動画, インディー, 動画, ハヤトの野望, gameplay, pc game, hydroneer, 金",2389,hd,false,True,171097,3300,315
Fq2mUjjUlyk,2025-12-06T06:00:23Z,福山雅治 - 龍（映画『新解釈・幕末伝』Inspire Movie）,福山雅治 Official,10,Music,"福山雅治, Masaharu Fukuyama, Fukuyama, Masaharu, ふくやま, まさはる, ましゃ, ギター, 龍, 新解釈・幕末伝, 福田雄一, ムロツヨシ, 佐藤二朗, 坂本龍馬, 龍馬伝",263,hd,false,True,40878,2652,90
F-hRFxwKLRw,2025-12-07T00:06:47Z,【ガチ】クリスマス限定のブレインロットを全て盗んでコンプリートするロブロックス..🎄🔔【ROBLOX】,てるとくん,20,Gaming,"ゲーム実況, てるとくん, てるとくん実況, バカゲー, 実況, 実況プレイ, 面白い, おもしろい, スマホゲーム, 広告ゲーム, アプリ, ロブロックス, ROBLOX, 最強, ブレインロット, BRAINLOT, ブレインロットを盗む, Steal a Brainrot, アップデート, シークレット, アプデ, クリスマス, サンタ, サンタヒューズ, 限定, 数量限定",1022,hd,false,True,63312,2201,1351
1YrG2WGeIJo,2025-12-05T09:00:08Z,彗星 / 星街すいせい(official),Suisei Channel,24,Entertainment,"ホロライブ, hololive, ホロライブゲーマーズ, 歌ってみた, ゲーム実況, 実況, バーチャルyoutuber, Vtuber, VTuber, バーチャルYouTuber, VR, 3D, ときのそら, ロボ子さん, 夜空メル, アキ・ローゼンタール, 赤井はあと, 白上フブキ, 夏色まつり, 湊あくあ, 紫咲シオン, 百鬼あやめ, 癒月ちょこ, 大空スバル, 大神ミオ, さくらみこ, 猫又おかゆ, 戌神ころね, 兎田ぺこら, 潤羽るしあ, 不知火フレア, 宝鐘マリン, 白銀ノエル, AZKi, 星街すいせい, 天音かなた, 桐生ココ, 姫森ルーナ, 角巻わため, 常闇トワ, 雪花ラミィ, 桃鈴ねね, 獅白ぼたん, 魔乃アロエ, 尾丸ポルカ",230,hd,true,True,422706,,1415
89kRpwpLnH4,2025-12-06T15:28:18Z,【🔴生放送】角田裕毅ラストラン！F1 2025 最終戦 アブダビGP 予選 実況解説 【リアルタイム分析】【Abu Dhabi Grand Prix】】【レッドブル】,KAKESOBA RACING,17,Sports,,6432,hd,false,True,149834,1332,14
2keRyOTrbhs,2025-12-06T11:00:10Z,Lovers Again / EXILE - Covered by BALLISTIK BOYZ YOSHI × PSYCHIC FEVER KOKORO,BALLISTIK BOYZ from EXILE TRIBE,24,Entertainment,"BALLISTIK BOYZ, EXILE TRIBE, LIVE, PERFOEMANCE, SING, SONGS, MUSIC, DANCE, LDH, LDH JAPAN",172,hd,false,True,24730,2705,272
HEp-iZVig-8,2025-12-07T06:45:10Z,最終幕。　過去最高難易度、負けたら最初からライト彗星かりモンランダム10連戦チャレンジ＋。　　【オレカバトル　アーケード版】,鈴寝,20,Gaming,"オレカバトル, オレカ, KONAMI, コナミ, アプリ版アップデート, コマンド厳選, 育成, 生放送, アーケード版, ロール紙, 筐体, カード排出, 鈴寝, 創造神ロケーシャ, 大魔皇マオタイ, 魔王ムウス, 王子マルドク, アシユラ",16555,hd,false,True,35466,575,5
V1VM1o3uXUQ,2025-12-05T21:00:06Z,"日本のクリスマスソング2025🎅🎄定番＆人気メドレー🎶🎶癒しの冬のBGM☃️ 山下達郎, Back Number, BoA, 槇原敬之",Jpop Songs Vibes,10,Music,"クリスマスソング, クリスマスソング 2025, 洋楽クリスマスソングランキング, クリスマスソングベスト, クリスマス, メリークリスマス, 日本のクリスマスソング, クリスマスメドレー, クリスマスソング定番日本語, クリスマスソング洋楽邦楽冬歌 BGM 定番メドレー, xmasメドレー, christmas songs 2025, merry christmas 2025, クリスマスソングメドレー, クリスマスソングメドレー 2025, ソング2025, bmg, 冬, 冬歌, 邦楽, xmas song 2025, 2025冬最新, クリスマスソング 山下達郎, christmas eve, We Wish You A Merry Christmas, クリスマスソング-Back Number, いつかのメリークリスマス, Jingle Bells, メリクリ-BoA, song 2025, noel, 山下達郎, Back Number, BoA, 槇原敬之, 日本のクリスマスソング2025, christmas, クリスマスソングベスト2025, japanese music, 夜メドレー",9455,hd,false,True,7212,113,0
-mhBY6S1IqI,2025-12-05T08:00:00Z,【マインクラフト】オリジナルアイテムに変身して、かくれんぼをしましょう【日常組】,日常組,20,Gaming,"ゲーム, Game, 実況, 実況プレイ, 実況プレイ動画, 実況動画, ゲーム実況, ゲーム実況動画, ぺいんと, 死神, クロノア, トラゾー, しにがみ, 日常組",2771,hd,false,True,743749,24420,582
Wiz0Ap2ge5U,2025-12-06T09:00:53Z,『星涙哀歌』/ MIMI feat. 初音ミク,MIMI,10,Music,,178,hd,false,True,59646,7750,337
oU0auXb2Qoc,2025-12-06T07:00:48Z,人魚vs人間で逃走中をやってみた！ - マインクラフト【KUN】,KUNの50人クラフト,20,Gaming,"KUN, くん, クン, マイクラ, 50人クラフト, 建築, 攻城戦, サバイバル, MOD, 工業, ニート部, 人狼, ホラー, BAN, 実況, 日本, 日本語, 面白い, ゲーム, GAME, 実況者, Japan, Japanese, くんマイクラ, くんニート部, くん50人クラフト",4017,hd,false,True,154102,3395,262
D4O8Q8Gx6OI,2025-12-06T07:45:10Z,不狂音 / 八十八ヶ所巡礼,20140808ppr,10,Music,,291,hd,false,False,28679,3779,280
j8YgfW3X1xI,2025-12-06T23:29:45Z,クリスマス限定のブレインロットをすべて盗む🎅【ロブロックス/ROBLOX】,れじぇくん,20,Gaming,"ゲーム実況, れじぇくん, レジェクン, rejekun, reyekun, A2_ALEX_REYES, 面白, 爆笑, フォートナイト, Fortnite, マウス, キーボード, 最強, 建築, 初心者, バトロワ, ビクロイ, 攻略, チャレンジ, ミッション, 神回, 無双, スキン, 神業, 神技, 裏技, エイム, AIM, 勝ち方, 大量, 検証, 限定, れいじくん, れじゃくん, れじくん, れじえくん, レジくん, れじぇ, レジェ",846,hd,false,True,91619,1374,160
ObRnNyEvocY,2025-12-06T10:00:50Z,【歌ってみた】IRIS OUT - 米津玄師 covered by 明透,明透 -ᴀsᴜ-,10,Music,"明透, あす, 存流, SINSEKAI, 深脊界, V-Singer, バーチャル, 米山舞, カバー, cover, 歌ってみた, 神椿, KAMITSUBAKI, 花譜, 理芽, 春猿火, ヰ世界情緒, 幸祜, バーチャルシンガー, Vtuber, 歌い手, 琶舞, べま, music, 音楽, Vsinger, IRIS OUT, 米津玄師, チェンソーマン, レゼ, レゼ編",153,hd,false,True,40479,4674,133
jwJCYJiMHgo,2025-12-06T20:54:10Z,2000スロやっぱり初代,桜鷹虎〈さくらたかとら〉,20,Gaming,"桜鷹虎, 実践, 実戦, パチスロ, スロット, スロ, 上乗せ特化, ベトナム, 会員制, 2000, ヴヴヴ, ヴァルヴレイヴ, スマスロ, 新台",1813,hd,false,True,84426,747,43
BmnMhWmfDlo,2025-12-05T11:00:25Z,【Dance Practice】BUZZ LOVE #VOLTACTION,VOLTACTION,10,Music,"にじさんじ, nijisanji, Vtuber, 雑談, anime, アニメ, game, ゲーム, 実況, japan, バーチャルユーチューバー, VOLTACTION, voltaction, ヴォルタクション, ヴォルタ, 風楽奏斗, 渡会雲雀, 四季凪アキラ, セラフ・ダズルガーデン, ふーらいぶ, 渡会部, 四季凪請負中, セラフィルム, ゲーム実況, shorts, ショート",206,hd,true,True,110942,12028,550
LfHgLRlwXkw,2025-12-07T03:00:26Z,ブレインロットの進化にきたフュージョン全てをゲットしたロブロックス２１【 Roblox 】,タコボンド,20,Gaming,"面白, たこぼんど, ゲーム実況, ゲーム, おもしろ, タコボンド, スマホアプリ, スマホゲーム, ロブロックス, Roblox, YouTuber, ユーチューバー, ブレインロット, Brainrot, ブレインロットの進化, Brainrot Evolution, アプデ, イベント",1100,hd,false,True,44495,688,63
UWdpJG4i-W0,2025-12-06T11:01:29Z,一度泊まると「一生チェックアウトできない」と噂のホテルに泊まるホラーゲームが怖すぎる【Till Checkout Do Us Part】,ポッキー,20,Gaming,"pockysweets, ポッキー, 実況プレイ, ゲーム実況, YouTube, Youtuber, pocky, game, 実況, ゆーちゅーぶ, ユーチューブ",2189,hd,false,True,109225,2677,147
