video_id,country,fetched_at,published_at,title,localized_title,channel_title,channel_id,category_id,category_name,tags,tag_count,thumbnail,default_language,audio_language,is_live,duration,duration_raw,definition,caption_available,licensed_content,embeddable,made_for_kids,views,likes,comments
2GJfWMYCWY0,IE,2026-02-28T02:43:21.592769+00:00,2026-02-27T05:00:07Z,BLACKPINK - ‘GO’ M/V,BLACKPINK - ‘GO’ M/V,BLACKPINK,UCOmHUn--16B90oW2L6FRR3A,10,Music,"YG Entertainment, YG, 와이지, K-pop, BLACKPINK, 블랙핑크, 블핑, 제니, 로제, 리사, 지수, LISA, JISOO, JENNIE, ROSÉ, BLINK, 블링크, JENNIE You & Me, JENNIE You and ME, You & Me, You and Me, 제니 You & Me, 제니 You and Me, 제니 유앤미, 유앤미, JENNIE 유앤미, 제니 코첼라, JENNIE COACHELLA",28,https://i.ytimg.com/vi/2GJfWMYCWY0/hqdefault.jpg,en,ko,False,202,PT3M22S,hd,True,True,False,False,20335272,2641573,223902
lcvUGs3xaDM,IE,2026-02-28T02:43:21.592813+00:00,2026-02-19T14:00:01Z,Peaky Blinders: The Immortal Man | Official Trailer | Netflix,Peaky Blinders: The Immortal Man | Official Trailer | Netflix,Netflix,UCWOA1ZGywLbqmigxE4Qlvuw,24,Entertainment,"Barry Keoghan, Cillian Murphy, Conspiracy, Netflix, Netflix 2026, New on Netflix, Packy Lee, Peaky Blinders, Rebecca Ferguson, Sophie Rundle, Stephen Graham, Steven Knight, Tense, The Immortal Man, Tim Roth, Tom Harper, Tommy Shelby, Trailer, drama, film",20,https://i.ytimg.com/vi/lcvUGs3xaDM/hqdefault.jpg,en,en-US,False,160,PT2M40S,hd,True,True,False,False,5629100,164781,5676
FmKEQVXodVo,IE,2026-02-28T02:43:21.592826+00:00,2026-02-26T15:00:24Z,Resident Evil 9 Requiem - Part 1,Resident Evil 9 Requiem - Part 1,jacksepticeye,UCYzPXprvl5Y-Sf0g4vX-m6g,20,Gaming,jacksepticeye,1,https://i.ytimg.com/vi/FmKEQVXodVo/hqdefault.jpg,en,en,False,7623,PT2H7M3S,hd,False,True,False,False,1353785,72401,5237
UbstNV2FUNY,IE,2026-02-28T02:43:21.592835+00:00,2026-02-27T10:00:06Z,Kingfishr - The Blade (Official Video),Kingfishr - The Blade (Official Video),Kingfishr,UC0vPWYMAjGYOdK_24Kj_TOA,10,Music,"Kingfishr, Kingfisher, Kingfishr Shot In The Dark, Kingfishr Caroline, Kingfishr Band, Irish Band, Irish Folk, Kingfishr leave, Kingfishr eyes don't lie, kingfishr flowers fire, Kingfishr anyway, Kingfishr live, King Fishr, King Fisher",14,https://i.ytimg.com/vi/UbstNV2FUNY/hqdefault.jpg,en,en,False,219,PT3M39S,hd,False,True,False,False,28244,1705,90
c51ND9Hdbw0,IE,2026-02-28T02:43:21.592844+00:00,2026-02-19T17:00:14Z,Toy Story 5 | Official Trailer | In Theaters June 19,Toy Story 5 | Official Trailer | In Theaters June 19,Pixar,UC_IRYSp4auq7hKLvziWVH6w,1,Film & Animation,"Pixar, Disney, Disney Pixar, Pixar Movie, Animation",5,https://i.ytimg.com/vi/c51ND9Hdbw0/hqdefault.jpg,en,en,False,145,PT2M25S,hd,True,True,False,False,9575738,231587,18454
Dh2WcRJOVPU,IE,2026-02-28T02:43:21.592853+00:00,2026-02-27T14:01:06Z,Pokémon Presents | 2.27.2026,Pokémon Presents | 2.27.2026,The Official Pokémon YouTube channel,UCFctpiB_Hnlk3ejWfHqSm6Q,20,Gaming,"Pokemon, Pokémon, Pokémon 30th, Pokémon 30 Years, Pokémon FireRed Version, Pokémon LeafGreen Version, Nintendo, Pokémon Game Music Collection, Pokémon XP, Pokémon World Championships 2026, Pokémon Day, Pokémon Go, Pokémon Unite, Pokémon Champions, Pokémon Sleep, Pokémon TGC, Pokémon Trading Card Game, Pokémon Masters EX, Pokémon Café Remix, Pokémon XD Gale of Darkness, Pokémon Home, Pokémon Winds, Pokémon Waves, Pokémon Legends Z-A, Pokémon Pokopia, Browt, Pombon, Gecqua, Switch",29,https://i.ytimg.com/vi/Dh2WcRJOVPU/hqdefault.jpg,en,en-US,False,1485,PT24M45S,hd,False,True,False,False,2434345,105172,11126
3D2WPA9ZN30,IE,2026-02-28T02:43:21.592863+00:00,2026-02-27T00:01:15Z,FEVER DREAM,FEVER DREAM,Alex Warren - Topic,UCXATF3-9RFGyY-it_d2hB6A,10,Music,"Alex Warren, FEVER DREAM",2,https://i.ytimg.com/vi/3D2WPA9ZN30/hqdefault.jpg,en,en,False,154,PT2M34S,hd,False,True,False,False,902985,59607,3734
b24oG7qCwp4,IE,2026-02-28T02:43:21.592871+00:00,2026-02-25T18:01:17Z,Mortal Kombat II | Official Trailer II,Mortal Kombat II | Official Trailer II,Warner Bros.,UCjmJDM5pRKbUlVIzDYYWb6g,1,Film & Animation,"2026, Action, Adeline Rudolph, Adventure, Battle, Chin Han, Coming Soon, Damon Herriman, Fantasy, Film, Film Trailer, Film Warner, Game, Hiroyuki Sanada, Jessica McNamee, Joe Taslim, Josh Lawson, Karl Urban, Lewis Tan, Ludi Lin, MMA Fighter, Martial Arts, Mehcad Brooks, Mortal Kombat, Mortal Kombat II, Movie, Official Trailer, Simon McQuoid, Tadanobu Asano, Tati Gabrielle, Trailer, Video Game, WB, Warner, Warner Bros, Warner Brothers, Warner Media",37,https://i.ytimg.com/vi/b24oG7qCwp4/hqdefault.jpg,en,en-US,False,145,PT2M25S,hd,True,False,False,False,9533682,167501,9429
w50J1jWfC2o,IE,2026-02-28T02:43:21.592879+00:00,2026-02-16T19:01:02Z,SIDEMEN AMONG US IS BACK,SIDEMEN AMONG US IS BACK,MoreSidemen,UCh5mLn90vUaB1PbRRx_AiaA,22,People & Blogs,"sidemen, moresidemen, miniminter, ksi, zerkaa, behzinga, tbjzl, vikkstar, wroetoshaw",9,https://i.ytimg.com/vi/w50J1jWfC2o/hqdefault.jpg,en,en-GB,False,3810,PT1H3M30S,hd,False,True,False,False,5753118,185400,15752
lY5V4hSLWY8,IE,2026-02-28T02:43:21.592887+00:00,2026-02-27T05:00:08Z,Bruno Mars - Risk It All [Official Music Video],Bruno Mars - Risk It All [Official Music Video],Bruno Mars,UCoUM-UJ7rirJYP8CQ0EIaHA,10,Music,"bruno mars, bruno, atlantic records, official video, pop music, R&B, funk, soul, the romantic bruno mars, bruno mars the romantic, the romantic, bruno mars new music, bruno mars new album, bruno mars album, bruno mars new release, bruno mars the romantic album, Bruno Mars - Risk It All [Official Music Video], bruno mars risk it all, risk it all bruno mars, risk it all",20,https://i.ytimg.com/vi/lY5V4hSLWY8/hqdefault.jpg,en,en,False,211,PT3M31S,hd,False,True,False,False,3883407,310204,17596
i6w7O1kwuBk,IE,2026-02-28T02:43:21.592895+00:00,2026-02-19T16:00:06Z,House of the Dragon Season 3 | Official Teaser | HBO Max,House of the Dragon Season 3 | Official Teaser | HBO Max,HBO Max,UCx-KWLTKlB83hDI6UKECtJQ,24,Entertainment,"hbo max, hbo, hbo originals, hbo original series, hbo trailer, new on hbo, max, hbo max originals, hbo max trailer, hbo max teaser, hbo max series, hbo max youtube, house of the dragon, house of the dragon season 3, HOTD, house targaryen, rhaenyra targaryen, emma d'arcy, daemon targaryen, matt smith, alicent hightower, olivia cooke, aegon targaryen, tom glynn-carney, aemond targaryen, ewan mitchell, dragons, ser criston cole, fabien frankel, house of the dragon new season",30,https://i.ytimg.com/vi/i6w7O1kwuBk/hqdefault.jpg,en,en,False,94,PT1M34S,hd,True,True,False,False,4431002,134348,7435
ZVrQRAf5dJg,IE,2026-02-28T02:43:21.592903+00:00,2026-02-27T09:58:49Z,I Became a Minecraft Combat Master,I Became a Minecraft Combat Master,FlameFrags,UCvYPobTo42NM36X7VC4dLhA,20,Gaming,"minecraft, flamefrags, flame frags, flamefrags minecraft, flame minecraft",5,https://i.ytimg.com/vi/ZVrQRAf5dJg/hqdefault.jpg,en-US,en-US,False,4389,PT1H13M9S,hd,False,True,False,False,2058724,119484,18938
iAtoZar5W58,IE,2026-02-28T02:43:21.592911+00:00,2026-02-24T14:44:06Z,Aaya Sher - Lyrical | The Paradise | Nani | Anirudh Ravichander | Srikanth Odela,Aaya Sher - Lyrical | The Paradise | Nani | Anirudh Ravichander | Srikanth Odela,Saregama Telugu,UC68nKdrLbLL0Vj7ilVkLmmg,10,Music,"Anirudh Ravichander, The Paradise Theme OST, The Paradise Original Sound Track, The Paradise Theme music, Nani The Paradise theme, Anirudh Ravichander OST, Anirudh BGM, Anirudh theme music, Anirudh Ravichander The Paradise, Nani Anirudh combo, The Paradise background score, Srikanth Odela The Paradise, The Paradise theme score, Anirudh Ravichander original soundtrack, Nani OST",15,https://i.ytimg.com/vi/iAtoZar5W58/hqdefault.jpg,en,te,False,297,PT4M57S,hd,False,True,False,False,26644233,919683,28155
IHWlvwu8t1w,IE,2026-02-28T02:43:21.592919+00:00,2026-02-17T14:00:19Z,The Mandalorian and Grogu | Official Trailer | In Theaters May 22,The Mandalorian and Grogu | Official Trailer | In Theaters May 22,Star Wars,UCZGYJFUizSax-yElQaFDp5Q,24,Entertainment,,0,https://i.ytimg.com/vi/IHWlvwu8t1w/hqdefault.jpg,en,en-US,False,132,PT2M12S,hd,True,True,False,False,7226194,132436,8988
Fwf7n7vBAC4,IE,2026-02-28T02:43:21.592926+00:00,2026-02-26T18:00:17Z,Hermitcraft 11: Episode 11 - THE BASE BEGINS!,Hermitcraft 11: Episode 11 - THE BASE BEGINS!,Grian,UCR9Gcq0CMm6YgTzsDxAxjOQ,20,Gaming,"Minecraft, Grian, building, grian, mincraft, tutorial, yt:quality=high, minecraft, ideas, creative, build",11,https://i.ytimg.com/vi/Fwf7n7vBAC4/hqdefault.jpg,en,en-GB,False,2089,PT34M49S,hd,True,True,False,False,1053321,71940,2490
ucRulNQsuYQ,IE,2026-02-28T02:43:21.592934+00:00,2026-02-27T16:00:07Z,"Gorillaz - The Mountain, The Moon Cave and The Sad God","Gorillaz - The Mountain, The Moon Cave and The Sad God",Gorillaz,UCfIXdjDQH9Fau7y99_Orpjw,10,Music,,0,https://i.ytimg.com/vi/ucRulNQsuYQ/hqdefault.jpg,en,en,False,524,PT8M44S,hd,False,True,False,False,926108,146041,7707
nDGEWgzcxJ4,IE,2026-02-28T02:43:21.592942+00:00,2026-02-19T16:08:42Z,PRESSURE Official Trailer (2026) Brendan Fraser,PRESSURE Official Trailer (2026) Brendan Fraser,ONE Media,UCzcRQ3vRNr6fJ1A9rqFn7QA,1,Film & Animation,"movie trailer, new trailer, trailer, official, 2026, Pressure, Pressure Trailer, Brendan Fraser, Andrew Scott, Kerry Condon, Damian Lewis",11,https://i.ytimg.com/vi/nDGEWgzcxJ4/hqdefault.jpg,en,en,False,156,PT2M36S,hd,False,True,False,False,3894726,76100,7912
La1zClF8jdY,IE,2026-02-28T02:43:21.592949+00:00,2026-02-21T14:00:28Z,I Explored the World's Largest Minecraft Server,I Explored the World's Largest Minecraft Server,Wemmbu,UCkzzNLnuM-VsATWC53ehwOQ,20,Gaming,"wemmbu, wembu, minecraft, wemmbu minecraft, wemmbu unstable smp, unstable smp, the unstable smp experience, i joined the world's largest minecraft server, i joined unstable smp, I explored the world's largest minecraft server, unstable universe, unstable smp in order, world's largest minecraft server, minecraft smp",14,https://i.ytimg.com/vi/La1zClF8jdY/hqdefault.jpg,en,en,False,2395,PT39M55S,hd,False,True,False,False,4541589,226174,23002
1FVF-9KQiPo,IE,2026-02-28T02:43:21.592957+00:00,2026-02-08T13:00:02Z,Taylor Swift - Opalite (Official Music Video),Taylor Swift - Opalite (Official Music Video),Taylor Swift,UCqECaJ8Gagnn7YCbPEzWH6g,10,Music,"Taylor swift, taylor, swift, taylor swift TLOAS, TS12, Showgirl, The Life of a Showgirl, new taylor swift, taylor swift album",9,https://i.ytimg.com/vi/1FVF-9KQiPo/hqdefault.jpg,en,en-US,False,360,PT6M,hd,False,False,False,False,14040212,578378,26985
HgMbkitzhEM,IE,2026-02-28T02:43:21.592965+00:00,2026-02-12T16:00:19Z,“Spider-Noir” – Authentic Black & White Teaser Trailer | Prime Video,“Spider-Noir” – Authentic Black & White Teaser Trailer | Prime Video,Prime Video,UCQJWtTnAHhEG5w4uN0udnUQ,24,Entertainment,"spider noir official teaser, spider noir teaser, spider noir 2026, official teaser, teaser, spider noir prime video, prime video spider noir, spider noir, tv show, prime video, prime, amazon, spider noir teaser trailer, spider noir show, nicholas cage, nicholas cage spider man noir, nicholas cage spider man, spider man, spider man into the spider verse, spider man brand new day, spider man noir, spider man noir teaser, spider man noir show, spider man teaser, black and white",25,https://i.ytimg.com/vi/HgMbkitzhEM/hqdefault.jpg,en,en,False,111,PT1M51S,hd,True,True,False,False,18130951,249822,11001
QO3sBFiEOpI,IE,2026-02-28T02:43:21.592973+00:00,2026-02-21T02:52:29Z,Poppy Playtime: Chapter 5,Poppy Playtime: Chapter 5,Markiplier,UC7_YxT-KID8kRbqZo7MyscQ,20,Gaming,"markiplier, Poppy Playtime, poppy playtime chapter 5, scary games, horror games, indie horror, mascot horror, secrets, endings, all endings",10,https://i.ytimg.com/vi/QO3sBFiEOpI/hqdefault.jpg,en,en,False,18982,PT5H16M22S,hd,False,True,False,False,5083689,192801,14731
ifQ0fqj0yjw,IE,2026-02-28T02:43:21.592981+00:00,2026-02-23T17:00:06Z,Dani Mocanu - Info de la Napoli | Official Video,Dani Mocanu - Info de la Napoli | Official Video,Dani Mocanu,UCGc991mofGxjO3-haaRENDg,10,Music,"Dani Mocanu, Daniel Mocanu, Manea, Manele, HiT",5,https://i.ytimg.com/vi/ifQ0fqj0yjw/hqdefault.jpg,ro,ro,False,262,PT4M22S,hd,False,False,False,False,2048755,71825,3790
cflGcCLqBzk,IE,2026-02-28T02:43:21.592988+00:00,2026-02-24T18:00:43Z,Honest Trailers | Predator: Badlands,Honest Trailers | Predator: Badlands,Screen Junkies,UCOpcACMWblDls9Z6GERVi1A,1,Film & Animation,,0,https://i.ytimg.com/vi/cflGcCLqBzk/hqdefault.jpg,en,en,False,387,PT6M27S,hd,False,True,False,False,337460,16411,1141
v_IkDW_SbCc,IE,2026-02-28T02:43:21.592995+00:00,2026-02-25T18:01:10Z,I Forced 300 Minecraft Players to Dig A Massive Hole,I Forced 300 Minecraft Players to Dig A Massive Hole,RTGame,UCRC6cNamj9tYAO6h_RXd5xA,20,Gaming,"rtgame, rt, game, rtgames, rtgaming, rt games, rtgamecrowd, rt gaming, rt game, rtgame twitch, minecraft, minecraft server, minecraft hole, minecraft big hole, minecraft funny, minecraft build, minecraft massive hole, minecraft multiplayer, minecraft dig, minecraft bedrock, minecraft underground, minecraft digging, minecraft funny server, minecraft survival, yogscast, yogscast minecraft, minecraft rtgame, rtgame minecraft, rtgame minecraft server, minecraft world",30,https://i.ytimg.com/vi/v_IkDW_SbCc/hqdefault.jpg,en,en-GB,False,2200,PT36M40S,hd,False,True,False,False,935082,56342,2597
Y3ziTSYyook,IE,2026-02-28T02:43:21.593003+00:00,2026-02-18T17:00:54Z,U2 - American Obituary (Lyric Video),U2 - American Obituary (Lyric Video),U2,UC4gPNusMDwx2Xm-YI35AkCA,10,Music,"U2, U2 Video, U2 lyrics, U2 Live, U2 Music, U2 With or without you, U2 I still haven't found what I'm looking for, U2 One, U2 Beautiful Day, U2 Live performance, U2 The Joshua Tree, U2 Achtung Baby, U2 Days Of Ash EP, U2 Days Of Ash, Days Of Ash EP, U2 Album, U2 2026, u2 american obituary, u2 american obituary lyric video, american obituary lyric video, american obituary, u2 american obtiuary lyrics, american obituary lyric videos",23,https://i.ytimg.com/vi/Y3ziTSYyook/hqdefault.jpg,en,ja,False,267,PT4M27S,hd,False,False,False,False,798220,45036,6233
zojwKLlY_H8,IE,2026-02-28T02:43:21.593010+00:00,2026-02-24T14:59:57Z,For All Mankind — Season 5 Official Trailer | Apple TV,For All Mankind — Season 5 Official Trailer | Apple TV,Apple TV,UC1Myj674wRVXB9I4c6Hm5zA,24,Entertainment,"for all mankind, fam, for all mankind season 5, season 5, trailer, for all mankind trailer, for all mankind season 5 trailer, official trailer, for all mankind official trailer, joel kinnaman, toby kebbell, edi gathegi, cynthy wu, coral peña, wrenn schmidt, mireille enos, costa ronin, sean kaufman, ruby cruz, ines asserson, space, space force, nasa, moon, show, series, for all mankind apple tv, apple tv, apple, tv, apple tv+, apple tv app, apple original, apple tv youtube, scifi",35,https://i.ytimg.com/vi/zojwKLlY_H8/hqdefault.jpg,en,en,False,129,PT2M9S,hd,True,False,False,False,375579,10249,1396
Nbu4nicxcl0,IE,2026-02-28T02:43:21.593019+00:00,2026-02-25T18:46:13Z,Getting Every NEW BRAINROT From The Lucky Blocks..,Getting Every NEW BRAINROT From The Lucky Blocks..,CaylusBlox,UCsPMNatXCwqyUuJilBT73jg,20,Gaming,"caylusblox, caylus roblox, caylus, caylus gaming, caylus infinite, infinite lists, calus, callus, calis, roblox, caylus horror, caylus scary, caylus scariest, caylus scary myths, caylus creepy, caylus roblox horror, caylus roblox scary, caylus steal a brainrot, caylus aura, caylus stream, caylus brainrot, caylus foltyn, caylus survive lava for brainrots, caylus lava, caylus sammy, caylus slfb",26,https://i.ytimg.com/vi/Nbu4nicxcl0/hqdefault.jpg,en-US,en-US,False,1112,PT18M32S,hd,False,True,False,False,1387548,21016,1924
Aa_EVv0hfLU,IE,2026-02-28T02:43:21.593027+00:00,2026-02-23T08:15:00Z,Alex Warren - Ordinary (Lyrics),Alex Warren - Ordinary (Lyrics),Aura Serenity,UCnjDfkZQJpaB91w3gbgbhOA,10,Music,"auraserenity, emotional, indiepop, ordinary, ordinary lyrics, lyrics ordinary, alex warren, lyrics, alex warren ordinary, ordinary alex warren, alex warren ordinary lyrics, lyrics alex warren ordinary, alex warren lyrics, lyrics alex warren, alex warren lyrics ordinary, lyrics ordinary alex warren, ordinary alex warren lyrics, You're takin' me out of the ordinary, I want you layin' me down 'til we're dead and buried, Somethin' so out of the ordinary, pop, music",22,https://i.ytimg.com/vi/Aa_EVv0hfLU/hqdefault.jpg,en,en-US,False,206,PT3M26S,hd,True,True,False,False,995793,2859,40
jD0N2Q_OUpg,IE,2026-02-28T02:43:21.593034+00:00,2026-02-17T15:00:06Z,Prathichaya Trailer | Nivin Pauly| Sharaf U Dheen| Balachandra Menon| Unnikrishnan B|Gokulam Gopalan,Prathichaya Trailer | Nivin Pauly| Sharaf U Dheen| Balachandra Menon| Unnikrishnan B|Gokulam Gopalan,Sree Gokulam Movies,UC7rP8B90HTEXxQ6ApRVDyVg,1,Film & Animation,"Gokulam Movies, Gokulam Gopalan, Gokulam Productions, Sree Gokulam Movies",4,https://i.ytimg.com/vi/jD0N2Q_OUpg/hqdefault.jpg,en,ml,False,143,PT2M23S,hd,True,True,False,False,1808386,37643,2511
rV0cm5FXsCQ,IE,2026-02-28T02:43:21.593041+00:00,2026-02-27T13:29:06Z,Pokémon Presents 27.2.2026,Pokémon Presents 27.2.2026,Pokémon Asia ENG,UCR1r4GPUBvdI0EJBpxKYPQQ,1,Film & Animation,,0,https://i.ytimg.com/vi/rV0cm5FXsCQ/hqdefault.jpg,en,en,False,1486,PT24M46S,hd,False,True,False,False,391225,0,1288
AwnfjcDCCmE,IE,2026-02-28T02:43:21.593048+00:00,2026-02-26T19:38:25Z,Dave - The Boy Who Played the Harp,Dave - The Boy Who Played the Harp,Santan Dave,UC5-cg5RahETrjGu-r8zjYCQ,10,Music,"dave, santandave, santan dave, dave lyrics, dave rapper, new dave, new dave album, dave the boy who played the harp, the boy who played the harp, boy who played the harp, dave the boy who played the harp album, dave new music 2025, dave the boy who played the harp 2025, dave harp album, the boy who played the harp lyrics, dave album 2025, dave new music leak, dave james blake, boy who played the harp dave, dave boy who played the harp, dave harp, harp dave",22,https://i.ytimg.com/vi/AwnfjcDCCmE/hqdefault.jpg,en,en,False,297,PT4M57S,hd,False,False,False,False,444213,58107,3291
hrmMWJPDZ0E,IE,2026-02-28T02:43:21.593056+00:00,2026-02-26T18:00:06Z,'Ninth Wave' Update Trailer / War Thunder,'Ninth Wave' Update Trailer / War Thunder,War Thunder. Official channel.,UCPZsNertSS82YCT2qX9-wHA,20,Gaming,"war thunder, wt, war thunder update, war thunder trailer, trailer, update",6,https://i.ytimg.com/vi/hrmMWJPDZ0E/hqdefault.jpg,en,en,False,146,PT2M26S,hd,True,False,False,False,309600,21305,2694
ge7j6ho_jls,IE,2026-02-28T02:43:21.593063+00:00,2026-02-26T22:28:00Z,The Best New Golf Game is Here,The Best New Golf Game is Here,SMii7Y,UCzXwjTI6c6mVn6oui_p6oiw,20,Gaming,"smii7y, smii7yplus, smii7y+, smii7y plus, super battle golf, super battle golf gameplay, super battle golf funny moments, super battle golf game, golf, super battle golf new, super battle golf rage, super battle golf chaos",12,https://i.ytimg.com/vi/ge7j6ho_jls/hqdefault.jpg,en,en,False,1357,PT22M37S,hd,False,True,False,False,1422500,89972,1846
BPlJ_6M74l0,IE,2026-02-28T02:43:21.593071+00:00,2026-02-24T18:30:06Z,KNEECAP - SMUGGLERS & SCHOLARS,KNEECAP - SMUGGLERS & SCHOLARS,KNEECAP,UCR8_tdf_kr2tn01dFmRK6wQ,22,People & Blogs,,0,https://i.ytimg.com/vi/BPlJ_6M74l0/hqdefault.jpg,ga,ga,False,193,PT3M13S,hd,False,False,False,False,46903,4290,267
VLAKfS3RlB0,IE,2026-02-28T02:43:21.593078+00:00,2026-02-19T18:36:56Z,HOUSE OF THE DRAGON SEASON 3 TRAILER Breakdown & WTF Easter Eggs,HOUSE OF THE DRAGON SEASON 3 TRAILER Breakdown & WTF Easter Eggs,Emergency Awesome,UCDiFRMQWpcp8_KD4vwIVicw,24,Entertainment,,0,https://i.ytimg.com/vi/VLAKfS3RlB0/hqdefault.jpg,en,en,False,955,PT15M55S,hd,True,True,False,False,411164,8856,802
geiTg6Z7w3A,IE,2026-02-28T02:43:21.593085+00:00,2026-02-26T19:00:06Z,Stardew Valley 10-year Anniversary Video (Retrospective & New Spouse Reveal),Stardew Valley 10-year Anniversary Video (Retrospective & New Spouse Reveal),ConcernedApe,UClLilfnwQ_8LoGVpjo4SP3g,20,Gaming,,0,https://i.ytimg.com/vi/geiTg6Z7w3A/hqdefault.jpg,en,en,False,1365,PT22M45S,hd,False,False,False,False,1760415,219927,15029
k2_bhC5E0mc,IE,2026-02-28T02:43:21.593092+00:00,2026-02-27T00:00:07Z,Yeat & EsDeeKid - Made It On Our Own (Official Music Video),Yeat & EsDeeKid - Made It On Our Own (Official Music Video),Yeat,UCV4UK9LNNLViFP4qZA_Wmfw,10,Music,"yeat, esdeekid, adl",3,https://i.ytimg.com/vi/k2_bhC5E0mc/hqdefault.jpg,en,en-US,False,177,PT2M57S,hd,False,False,False,False,552868,57422,4918
cXymbHU5i-U,IE,2026-02-28T02:43:21.593100+00:00,2026-02-20T04:05:00Z,Toxic Official Hindi Teaser | Rocking Star Yash | Geetu Mohandas | KVN | Monster Mind Creations,Toxic Official Hindi Teaser | Rocking Star Yash | Geetu Mohandas | KVN | Monster Mind Creations,KVN PRODUCTIONS,UC3DOgauBYLQQXdH1siGjfpw,1,Film & Animation,"Toxic, Toxic Movie, Toxic Teaser, Toxic Official Teaser, Toxic Yash, Yash Toxic, Rocking Star Yash, Yash New Movie, KVN Productions, Monster Mind Creations, Geetu Mohandas, Ravi Basrur, Ravi Basrur Music, Kiara Advani, Nayanthara, Huma Qureshi, Tara Sutaria, Rukmini Vasanth, Rocky Bhai, KGF, Yash Movie, Toxic Update, KGF 2, KGF 3, Raya from Toxic, Toxic A Fairy Tale, Daddy's Home, Toxic Dialogue, Daddy is Home, KVN, KFI, Introducting Raya, Toxic Hindi, Toxic hindi Teaser",34,https://i.ytimg.com/vi/cXymbHU5i-U/hqdefault.jpg,en,hi,False,116,PT1M56S,hd,True,True,False,False,20573792,478681,23101
VWLl18skl7Y,IE,2026-02-28T02:43:21.593107+00:00,2026-02-21T16:00:06Z,100th Brawler Reveal - Brawl Talk,100th Brawler Reveal - Brawl Talk,Brawl Stars,UCooVYzDxdwTtGYAkcPmOgOw,20,Gaming,"brawl stars, mobile game, mobile strategy game, mobile rpg, mobile battle royale, battle royale, supercell game, sirius, 100th, 100, prestige, trophy, brawl talk, marzio, dani, drew, rework, trophies, najia, buffies, loaded, showdown",22,https://i.ytimg.com/vi/VWLl18skl7Y/hqdefault.jpg,en,en,False,843,PT14M3S,hd,True,True,False,False,13865495,375967,39605
m0BFZkPsoWY,IE,2026-02-28T02:43:21.593115+00:00,2026-02-17T23:02:14Z,Twenty One Pilots - Drag Path (Official Video),Twenty One Pilots - Drag Path (Official Video),twenty one pilots,UCBQZwaNPFfJ1gZ1fLZpAEGw,10,Music,"twenty one pilots, twenty one pilots official, drag path, digital remains, drag path official video, drag path leak, twenty one pilots you found me, breach album, drag path edit, you found me, dragpath, drag path tiktok, twenty one pilots 2026, new twenty one pilots, breach digital remains, drag path lyrics, drag path reaction",17,https://i.ytimg.com/vi/m0BFZkPsoWY/hqdefault.jpg,en,en,False,266,PT4M26S,hd,False,True,False,False,3564244,266517,11737
zPHLojHUCvk,IE,2026-02-28T02:43:21.593122+00:00,2026-02-23T22:13:09Z,ENA: Dating Oblivion - Teaser Trailer,ENA: Dating Oblivion - Teaser Trailer,Joel G,UCmo3YHm8GaHk0ZWovjow65A,24,Entertainment,"ena, dream bbq, dating oblivion, joel g, animation, series, moony, human",8,https://i.ytimg.com/vi/zPHLojHUCvk/hqdefault.jpg,en,en-US,False,86,PT1M26S,hd,False,True,False,False,916423,165364,7285
tnKx_Tjv0GU,IE,2026-02-28T02:43:21.593130+00:00,2026-02-23T18:01:00Z,BOV BOYS PLAY MINECRAFT (EPISODE 6),BOV BOYS PLAY MINECRAFT (EPISODE 6),Bov Boys Gaming,UCAEoJW7deTDM9aAzN5-LH-w,22,People & Blogs,,0,https://i.ytimg.com/vi/tnKx_Tjv0GU/hqdefault.jpg,en,en,False,1706,PT28M26S,hd,False,True,False,False,234065,6611,373
8sAVQWKgMjg,IE,2026-02-28T02:43:21.593136+00:00,2026-02-23T20:15:01Z,Baby Keem - Birds & the Bees (Official Video),Baby Keem - Birds & the Bees (Official Video),BabyKeemVEVO,UCqaUJbZFIxkexcqI4J5eJUg,10,Music,"babykeem, casino, hykeem, birdsandthebees, lara, Katseye, lararaj, keem, Baby Keem, Birds the Bees, Rap",11,https://i.ytimg.com/vi/8sAVQWKgMjg/hqdefault.jpg,en,en,False,215,PT3M35S,hd,False,True,False,False,1373894,90203,5284
e9HXmMnUEdE,IE,2026-02-28T02:43:21.593144+00:00,2026-02-02T00:59:56Z,The Devil Wears Prada 2 | Official Trailer,The Devil Wears Prada 2 | Official Trailer,20th Century Studios,UC2-BeLxzUBSs0uSrmzWhJuQ,1,Film & Animation,Trailer,1,https://i.ytimg.com/vi/e9HXmMnUEdE/hqdefault.jpg,en,en,False,100,PT1M40S,hd,True,True,False,False,10666632,171576,6731
m8iJCE-o29A,IE,2026-02-28T02:43:21.593151+00:00,2026-02-24T01:23:21Z,Bernard Picks My Operator in Rainbow Six Siege,Bernard Picks My Operator in Rainbow Six Siege,Jynxzi,UCjiXtODGCCulmhwypZAWSag,20,Gaming,"Jynxzi, JynxziR6, JynxziLive, Jynxzi Stream, Bernard Picks My Operator in Rainbow Six Siege",5,https://i.ytimg.com/vi/m8iJCE-o29A/hqdefault.jpg,en,en,False,4666,PT1H17M46S,hd,False,True,False,False,1264601,31892,1436
S1stZOAIcW4,IE,2026-02-28T02:43:21.593159+00:00,2026-02-18T20:00:06Z,Lana Del Rey - White Feather Hawk Tail Deer Hunter,Lana Del Rey - White Feather Hawk Tail Deer Hunter,Lana Del Rey,UCqk3CdGN_j8IR9z4uBbVPSg,10,Music,,0,https://i.ytimg.com/vi/S1stZOAIcW4/hqdefault.jpg,es,en,False,261,PT4M21S,hd,False,False,False,False,3114279,196402,11919
PW22jwFNxU8,IE,2026-02-28T02:43:21.593166+00:00,2026-02-19T20:05:06Z,Slay the Spire 2 - Early Access Trailer,Slay the Spire 2 - Early Access Trailer,Mega Crit,UCEFMIvLMz1cwKhB9GD_hAWw,20,Gaming,,0,https://i.ytimg.com/vi/PW22jwFNxU8/hqdefault.jpg,en,en-US,False,143,PT2M23S,hd,False,False,False,False,1274283,71919,4507
oi-dwqVWX_o,IE,2026-02-28T02:43:21.593172+00:00,2026-02-27T15:31:41Z,Pokemon Presents: 30th Anniversary Livestream Watch Party & Post Show,Pokemon Presents: 30th Anniversary Livestream Watch Party & Post Show,IGN,UCKy1dAqELo0zrOtPkf0eTMw,20,Gaming,"ign, pokemon, pokemon 30, pokemon direct, nintendo direct, pokemon presents, pokemon news, pokemon day, pokémon, pokemon presents live stream, nintendo switch, new pokemon, nintendo, game trailer, game trailers, trailer, trailers, gaming, video games, video game trailer, video game trailers, new game trailers, new video game trailers, upcoming video games, new video games 2026, upcoming video games 2026",26,https://i.ytimg.com/vi/oi-dwqVWX_o/hqdefault.jpg,en-US,en,False,8285,PT2H18M5S,hd,False,True,False,False,580997,4170,26
