video_id,country,fetched_at,published_at,title,localized_title,channel_title,channel_id,category_id,category_name,tags,tag_count,thumbnail,default_language,audio_language,is_live,duration,duration_raw,definition,caption_available,licensed_content,embeddable,made_for_kids,views,likes,comments
m73aIOhLxag,UG,2026-03-19T03:26:16.043773+00:00,2026-03-06T08:07:39Z,A Pass &  Kaboo - Buwooma (Official Music Video),A Pass &  Kaboo - Buwooma (Official Music Video),A Pass,UCGcayO7lMRcTjXcom48XdjA,10,Music,,0,https://i.ytimg.com/vi/m73aIOhLxag/hqdefault.jpg,en,en-US,False,176,PT2M56S,hd,False,False,False,False,219987,7058,930
3_9vCamtuPY,UG,2026-03-19T03:26:16.043900+00:00,2026-03-17T16:19:02Z,Dune: Part Three | Official Teaser Trailer,Dune: Part Three | Official Teaser Trailer,Warner Bros.,UCjmJDM5pRKbUlVIzDYYWb6g,1,Film & Animation,"Action, Anya Taylor-Joy, Brian K Vaughan, Charlotte Rampling, Coming Soon, Denis Villeneuve, Dune, Dune Messiah, Dune: Part Three, Florence Pugh, Ida Brooke, Isaach De Bankolé, Jason Momoa, Javier Bardem, Messiah, Nakoa-Wolf Momoa, Rebecca Ferguson, Robert Pattinson, Sci Fi, Timothée Chalamet, Trilogy, Warner Bros, Zendaya",23,https://i.ytimg.com/vi/3_9vCamtuPY/hqdefault.jpg,en,en-US,False,150,PT2M30S,hd,True,False,False,False,13530414,481371,24485
3Pcl46wPhok,UG,2026-03-19T03:26:16.043914+00:00,2026-03-18T00:10:46Z,Arsenal vs Bayer Leverkusen | Champions League 2026 | PES 21 Simulation Gameplay,Arsenal vs Bayer Leverkusen | Champions League 2026 | PES 21 Simulation Gameplay,Football Gamer Rony,UCaopyJz-EIXOXYXSMOC6c-g,20,Gaming,"efootball, efootball pes 21, pes 21 gameplay, football game, pes 21, pes21, efootball pes 21 gameplay, live football, football live, football, football gamer rony",11,https://i.ytimg.com/vi/3Pcl46wPhok/hqdefault.jpg,en,en,False,903,PT15M3S,hd,False,True,False,False,153691,662,1
HGC_XLqoy8E,UG,2026-03-19T03:26:16.043924+00:00,2026-02-23T07:00:06Z,Acidic Vokoz Ft. Ava Peace - Tobingamba (Official Music Video),Acidic Vokoz Ft. Ava Peace - Tobingamba (Official Music Video),Acidic Vokoz,UC7Yazer9o-ObTJVWV83F9Pw,10,Music,"Tobingamba, Acidic vokoz ft Ava Peace, acidic vokoz and Ava Peace, akanyama by ava peace and Acidic Vokoz, acidic vokos songs, newly uploaded, now playing, official music video, ava peace songs, ava peace best music video, acidic vokoz mixtapes, ugandan latest music videos, music video, youtube trending chart, ava peace and acidic vokoz, recently uploaded",16,https://i.ytimg.com/vi/HGC_XLqoy8E/hqdefault.jpg,en,en,False,195,PT3M15S,hd,False,True,False,False,438157,5308,1486
aBlsrtxuwss,UG,2026-03-19T03:26:16.043933+00:00,2026-03-18T11:17:52Z,Spider-Man: Brand New Day - Official Trailer,Spider-Man: Brand New Day - Official Trailer,PlayStation,UC-2Y8dQb0S6DtpxNgAKoJKA,20,Gaming,"PlayStation, PS5, video games, next gen, Sony",5,https://i.ytimg.com/vi/aBlsrtxuwss/hqdefault.jpg,en,en,False,158,PT2M38S,hd,False,True,False,False,8860428,484301,21033
hh-APv-FqUk,UG,2026-03-19T03:26:16.043941+00:00,2026-03-14T20:02:49Z,🔴 Arsenal vs Everton - Premier League 2025/2026 LIVE Score & FC26 Simulation,🔴 Arsenal vs Everton - Premier League 2025/2026 LIVE Score & FC26 Simulation,AFIZA FOOTBALL LIVE,UCm8mkMIoJ_-8hI1_93aY7Pw,20,Gaming,"arsenal vs everton, arsenal vs everton live, arsenal vs everton simulation, arsenal everton video game, premier league game simulation, football video game live, soccer game simulation, virtual football match, football gameplay simulation, arsenal gameplay, everton gameplay, fc25 simulation, pes football simulation, football game live stream, virtual premier league, football esports simulation, soccer video game live, football game simulation match, arsenal everton game",19,https://i.ytimg.com/vi/hh-APv-FqUk/hqdefault.jpg,en,en,False,8808,PT2H26M48S,hd,False,True,False,False,48854,193,0
rL8j_uT0JNc,UG,2026-03-19T03:26:16.043949+00:00,2026-03-07T19:42:27Z,P.2,P.2,King Saha - Topic,UC5dN4Vwbdcp_3sO14CKk37A,10,Music,"King Saha, P.2",2,https://i.ytimg.com/vi/rL8j_uT0JNc/hqdefault.jpg,en,pt-PT,False,190,PT3M10S,hd,False,True,False,False,67654,1489,81
0Ug2ESbIs5E,UG,2026-03-19T03:26:16.043958+00:00,2026-03-15T17:30:00Z,"Reptile Man (2026) | Jason Statham, Charlize Theron, Dwayne Johnson | Concept Trailer","Reptile Man (2026) | Jason Statham, Charlize Theron, Dwayne Johnson | Concept Trailer",Ultimate Studios,UCc3qOMA8TN5b3PPRlGAFA0Q,24,Entertainment,"reptile, reptile movie, jason statham reptile, jason statham mutation, reptile hybrid, reptile man movie, jason statham 2026, charlize theron scientist, dwayne johnson army, reptile transformation, monster movie 2026, jason statham monster, creature feature, reptile concept trailer, reptile fan made, human hybrid movie, jason statham action, sci-fi action 2026, charlize theron 2026, reptile thriller, biological mutation, jason statham creature, military vs monster",23,https://i.ytimg.com/vi/0Ug2ESbIs5E/hqdefault.jpg,en,en,False,101,PT1M41S,hd,False,True,False,False,224689,692,107
UYnaEObTayg,UG,2026-03-19T03:26:16.043966+00:00,2026-03-17T19:18:30Z,NO KEY - ROBLOX EXECUTOR • VELOCITY • - Keyless Web Exploit Working 2026 - FREE + Hub Scripts - 100%,NO KEY - ROBLOX EXECUTOR • VELOCITY • - Keyless Web Exploit Working 2026 - FREE + Hub Scripts - 100%,AQSajaa,UCsOK_-UO0qjG50hBkFGGEXQ,22,People & Blogs,"rblxscripts, executor, roblox exploit, roblox hack, roblox cheat, roblox executor pc, roblox pc executor, executor roblox, exploit roblox, script executor, roblox script executor, best roblox executor, roblox byfron bypass, roblox executor no key, roblox executor free, roblox free executor, free roblox executor, keyless executor roblox, roblox executor download, roblox best executor, free roblox exploit, roblox executor 2026",22,https://i.ytimg.com/vi/UYnaEObTayg/hqdefault.jpg,en,en,False,73,PT1M13S,hd,False,False,False,False,4966,124,185
SbG6faIn4Y0,UG,2026-03-19T03:26:16.043973+00:00,2026-03-07T06:03:28Z,ንሕልምኻ ኣብ ሕልመይ~Nhlmka Ab Hlmey~By Zemari Henok Fikadu~New Eritrean Orthodox Tewahdo Mezmur 2026,ንሕልምኻ ኣብ ሕልመይ~Nhlmka Ab Hlmey~By Zemari Henok Fikadu~New Eritrean Orthodox Tewahdo Mezmur 2026,መዝሙር ‘ዩ ህይወተይ Mezmur yu Hiwetey,UCNHzG8zua66tqExyW2Tkoxw,10,Music,"#እሙንዓርኪልበይ, #EmunArkiLbey, #Eritrean, #EritreanTewahdo, #EritreanMusic, #EllaTV, #lOrthodoxTewahdo, #EritreanOrthodoxNewTewahdo, #Mrtneshtlahun, #Ethiopian, #EthiopianTewahdo, #EthiopianMusic, #ZemariHenokFikadu, #HenokFikaduMezmur, #Mariyamey, #ሄኖክፍቃዱ, #መዝሙርአሪትሪያን, #ኦርቶዶክስተዋህዶ, #ዘክረኒ, #ታሪከይቀያሪ, #ዘማሪ, #ዘማሪት, #Admas, #HopeEntertainment, #zemaritedrosyosef, #TeameSegid, #kabAtranos, #AbrehamMehari, #ኣብረሃምመሓሪ",29,https://i.ytimg.com/vi/SbG6faIn4Y0/hqdefault.jpg,am,ti,False,343,PT5M43S,hd,False,True,False,False,384501,8910,1095
NHk7scrb_9I,UG,2026-03-19T03:26:16.043982+00:00,2026-03-07T05:31:00Z,Dhurandhar The Revenge Official Hindi Trailer | Ranveer S | Aditya D | In Cinemas 19 March 2026,Dhurandhar The Revenge Official Hindi Trailer | Ranveer S | Aditya D | In Cinemas 19 March 2026,JioStudios,UCcXQd6kHKm0b41x8zMVMmMg,24,Entertainment,"Jio Studios, Jio Cinema, Jio Saavn, Jio TV, Dhurandhar, Aditya Dhar, Ranveer Singh, Sanjay Dutt, Akshaye Khanna, R. Madhavan, Arjun Rampal, Sara Arjun, Shashwat Sachdev, Revenge, Hindi Film Trailer, Hindi Film Teaser, Blockbuster Hindi Film, Dhurandhar 2 Teaser, Dhurandhar 2, Bollywood Film, T-Series, Dhurandhar The Revenge, March 19, Dhurandhar Trailer, Dhurandhar 2 Trailer, Dhurandhar The Revenge Trailer, Bollywood Trailer, Movie Trailer, Popular Movie Trailer",29,https://i.ytimg.com/vi/NHk7scrb_9I/hqdefault.jpg,en,en,False,206,PT3M26S,hd,True,False,False,False,58546592,1187251,59642
sLiMi_dEnoE,UG,2026-03-19T03:26:16.043990+00:00,2026-03-14T20:13:32Z,🔴ARSENAL vs EVERTON - Premier League 2026 | Pes 21 Gameplay Simulation,🔴ARSENAL vs EVERTON - Premier League 2026 | Pes 21 Gameplay Simulation,Football TV,UCvWuQfTMrRny57Cl3qtEmmg,17,Sports,"premier league pes 21, english league pes 21, premier league 25-26 pes 21, pes 2021, pes 2021 gameplay, soccer, pro evolution soccer 2021, pc gameplay, football pes 2021, sport, football, gameplay video, gameplay, pc, gameplay sport, gameplay football, gameplay pes 2021, pes 2021 pc, game, футбол, спорт, игра, геймплей, efootball, epl, arsenal vs everton pes 21, arsenal pes 21, everton pes 21",28,https://i.ytimg.com/vi/sLiMi_dEnoE/hqdefault.jpg,en,en,False,25780,PT7H9M40S,hd,False,True,False,False,47061,191,1
R73WxrPM1YU,UG,2026-03-19T03:26:16.043999+00:00,2026-03-13T04:00:06Z,"Shenseea, Vybz Kartel & Rvssian - Talk To Me Nuh (Official Video)","Shenseea, Vybz Kartel & Rvssian - Talk To Me Nuh (Official Video)",Shenseea,UChSff_mx1n57Hf-k4zFXIjg,10,Music,"Shenseea, Shenseea Official, SHENYENG, Blessed, Jamaican, Pepsi, Campari, Romeich Entertainment, Dancehall, ShenseeaOfficial, Jamaica, Tyga, Dancehall Queen, Workout Twerkout, Dancehall Official",15,https://i.ytimg.com/vi/R73WxrPM1YU/hqdefault.jpg,en,en,False,134,PT2M14S,hd,False,False,False,False,1802024,67026,3314
vPMcEabBQEU,UG,2026-03-19T03:26:16.044007+00:00,2026-03-09T15:30:00Z,"XO, Kitty: Season 3 | Official Trailer | Netflix","XO, Kitty: Season 3 | Official Trailer | Netflix",Netflix,UCWOA1ZGywLbqmigxE4Qlvuw,24,Entertainment,"Anna Cathcart, Being Abroad, Comedy, Coming of Age, Cute, Dating, Drama, First Love, High School, Humorous, Netflix, Quirky, Romance, Romantic, Season 3, Self-Discovery, Teen, Teen Angst, XO Kitty, XO Kitty Season 3",20,https://i.ytimg.com/vi/vPMcEabBQEU/hqdefault.jpg,en,en-US,False,131,PT2M11S,hd,True,True,False,False,3496965,125361,4679
qEI0rChLPPI,UG,2026-03-19T03:26:16.044014+00:00,2026-03-14T22:48:25Z,Arsenal 2 vs. 0 Everton | Premier League 25/26 | Match Highlights Simulation/Prediction,Arsenal 2 vs. 0 Everton | Premier League 25/26 | Match Highlights Simulation/Prediction,十Loork Football,UCfFNw7MaO7QmWkswaGFGEvA,20,Gaming,"Arsenal, Everton, Premier League 2026, Arsenal Everton 2026, Everton Arsenal Premier League 2025, Premier League 2025-2026, Arsenal - Everton, Arsenal Everton premier league, Arsenal vs Everton - premier league",9,https://i.ytimg.com/vi/qEI0rChLPPI/hqdefault.jpg,en,en,False,221,PT3M41S,hd,False,True,False,False,39063,221,0
1YU_5beDImE,UG,2026-03-19T03:26:16.044022+00:00,2026-03-14T09:59:12Z,KATONDA TAGEYA (Lopela katonda)  -NTAATE,KATONDA TAGEYA (Lopela katonda)  -NTAATE,Ntaate,UCOm_-_BcjaedqryWvMP-JFA,22,People & Blogs,,0,https://i.ytimg.com/vi/1YU_5beDImE/hqdefault.jpg,en,und,False,150,PT2M30S,hd,False,True,False,False,27321,1621,165
XNQbH1SDPRk,UG,2026-03-19T03:26:16.044029+00:00,2026-03-05T17:00:58Z,The Boys – Final Season Trailer | Prime Video,The Boys – Final Season Trailer | Prime Video,Prime Video,UCQJWtTnAHhEG5w4uN0udnUQ,24,Entertainment,"the boys, the boys season 5, the boys s5, the boys season 5 trailer, the boys season 5 teaser, the boys s5 trailer, the boys s5 teaser, the boys final season, the boys final season trailer, butcher vs soldier boy, butcher vs soldier boy rematch, homelander vs butcher, butcher vs homelander, soldier boy vs butcher, homelander and ryan, butcher vs hughie, hughie vs butcher, the boys final season trailer breakdown, the boys season 5 trailer breakdown, the boys season 5 theories",20,https://i.ytimg.com/vi/XNQbH1SDPRk/hqdefault.jpg,en,en,False,162,PT2M42S,hd,True,True,False,False,6505659,306380,12945
SwZ8IAQYuGY,UG,2026-03-19T03:26:16.044037+00:00,2026-03-17T07:00:32Z,Irani Fighter jets & tanks Attack on israeli Military Weapons Supply Convoy - GTA5,Irani Fighter jets & tanks Attack on israeli Military Weapons Supply Convoy - GTA5,World War 3,UCgNijbsQMPcPaP5kZ2cz3jQ,20,Gaming,"gta, gta5, gtav, gtarp, gta5online, racing, racinggames, action, pc, pcgaming, gaming, gameplay, games, gamer, gamingcommunity, grandtheftauto, lossantos, army, military, protocol, protection, usa, iran, Israel, Palestine, Russia, warzone, war, war Games",29,https://i.ytimg.com/vi/SwZ8IAQYuGY/hqdefault.jpg,en,en-GB,False,465,PT7M45S,hd,False,False,False,False,78586,259,15
j_bpgB_Sd1A,UG,2026-03-19T03:26:16.044045+00:00,2026-03-13T08:00:06Z,Gravity Omutujju - Ekitabo (Official Music Video),Gravity Omutujju - Ekitabo (Official Music Video),GRAVITY OMUTUJJU,UCugdDigC_MdbHulqsdmTrDA,10,Music,"GRAVITY OMUTUJJU, sheebah karungi, Swangz Avenue, Rema, Dj Rizzy 256, Ykee Benda, Eddy Kenzo, David Lutalo, Ugxtra Ugandan Music Videos, Bebecool OFFICIAL, Kansiime Anne, RADIÒ ànd WEASEL Goodlyfe, Diamond Platnumz, Rich Mavoko, Harmonize, Rayvanny, WizkidVEVO, Mr Eazi, TeknoMilesVEVO, DMW HQ, Cardi B",21,https://i.ytimg.com/vi/j_bpgB_Sd1A/hqdefault.jpg,en,en,False,189,PT3M9S,hd,False,True,False,False,40699,1134,105
ac4wNdQf3GY,UG,2026-03-19T03:26:16.044053+00:00,2026-03-14T20:20:35Z,🎮 Arsenal vs Everton | Premier League 2026 | Today's Match Simulation PES2021 ,🎮 Arsenal vs Everton | Premier League 2026 | Today's Match Simulation PES2021 ,BUZZ TUBE,UCCjZ0Lp49PgvimSNEW8s7Ug,20,Gaming,,0,https://i.ytimg.com/vi/ac4wNdQf3GY/hqdefault.jpg,en,en,False,228,PT3M48S,hd,False,True,False,False,49434,244,1
TyGAwSyvfyo,UG,2026-03-19T03:26:16.044060+00:00,2026-02-22T18:25:46Z,Champion Gal by Fik Fameica (Official Lyrics Video),Champion Gal by Fik Fameica (Official Lyrics Video),Fik Fameica,UCELuUleawzWkeScOLRiqM-Q,10,Music,"Fik, Fameica, Despacito, See, You, Again, Wiz, Khalifa, Shape, of, Ed, Sheeran, Gangnam, Style, Psy, Masha, and, the, Bear, Mark, Ronson, Bruno, Mars, Justin, Bieber, Maroon, Taylor, Swift, Enrique, Descemer, Bueno, Gente, De, Katy, Perry, Major, Lazer, DJ, #m7Address, Ugandan music, East African music, Afrobeat, Ugandan hip hop, Dancehall Uganda, Ugandan artist, VEVO Uganda, Swangz Avenue, trending Ugandan songs, Spotify Afrobeat, Apple Music Uganda, Boomplay Uganda, 4K music video, Ugandan rapper, top African artist",54,https://i.ytimg.com/vi/TyGAwSyvfyo/hqdefault.jpg,en,en-US,False,180,PT3M,hd,False,True,False,False,163097,1706,142
D_eWxKJcR54,UG,2026-03-19T03:26:16.044068+00:00,2026-03-16T05:49:37Z,"🔴Live : Man United vs Aston Villa I 15 March, 2026 I Pes 21 Video Games Simulation","🔴Live : Man United vs Aston Villa I 15 March, 2026 I Pes 21 Video Games Simulation",Munna,UCxeXR8JqzNAOxAfS_ACtFdQ,20,Gaming,"munna, football, soccer, football gameplay, game, gameplay, pes, epes, soccer league, english, epl, english premier league, premier league, live, live football, match, football live, live football match, sport, sports, soccer live, live soccer, 2026, Man United vs Aston Villa, man united, man united live, man united match, aston villa, aston villa vs man united, aston villa match, manchester united, manchester united vs aston villa, aston villa vs manchester united",33,https://i.ytimg.com/vi/D_eWxKJcR54/hqdefault.jpg,en,zxx,False,1430,PT23M50S,hd,False,False,False,False,91517,413,0
wnepiQ1VBCE,UG,2026-03-19T03:26:16.044076+00:00,2026-02-13T06:00:06Z,Nalokinga - Pawaboy AB (Official Music Video) 4k,Nalokinga - Pawaboy AB (Official Music Video) 4k,Pawaboy AB,UCum07hh4qgDZ4Lp2vKR6amA,10,Music,"nalokinga, nalookinga, power boy, latest ugandan music, top ugandan music, top songs in uganda, best vocalists uganda, new songs 2026 uganda, vyroota, liam voice, an known, vyroota new song, pawaboy new song, valentine songs, best love songs, top 20 songs uganda",16,https://i.ytimg.com/vi/wnepiQ1VBCE/hqdefault.jpg,en,en,False,173,PT2M53S,hd,False,True,False,False,94016,1974,204
6Ct0b3PT3AQ,UG,2026-03-19T03:26:16.044084+00:00,2026-03-14T13:09:39Z,Mikey POOR vs JJ RICH POLICE STATION Build Battle in Minecraft,Mikey POOR vs JJ RICH POLICE STATION Build Battle in Minecraft,Maizen,UCJHBJ7F-nAIlMGolm0Hu4vg,20,Gaming,"Minecraft, Maizen",2,https://i.ytimg.com/vi/6Ct0b3PT3AQ/hqdefault.jpg,en,en,False,2875,PT47M55S,hd,False,True,False,False,2046024,14987,1160
l27bogirYvQ,UG,2026-03-19T03:26:16.044092+00:00,2026-03-03T06:30:06Z,Dax Vibez x Jowylanda – Fantasy (Official Music Video ),Dax Vibez x Jowylanda – Fantasy (Official Music Video ),DAX VIBEZ OFFICIAL,UCdpKgmW8YiNy3ttHZORoW9w,10,Music,"Here are optimized YouTube tags for **Dax Vibez x Jowyland – Fantasy**: Dax Vibez, Jowyland, Fantasy, Dax Vibez Fantasy, Jowyland Fantasy, Dax Vibez x Jowyland, Fantasy Official Audio, Fantasy Official Video, Ugandan music, Afrobeat 2026, New Afrobeat song, East African music, Uganda Afrobeat, Trending Ugandan songs, African love songs, New music 2026, Afro vibes, Dancehall Uganda, African music 2026, Latest Ugandan music, sheebah karungi",21,https://i.ytimg.com/vi/l27bogirYvQ/hqdefault.jpg,en,en-GB,False,169,PT2M49S,hd,False,True,False,False,125133,2035,1376
nU4ZkXC-Ap4,UG,2026-03-19T03:26:16.044100+00:00,2026-03-14T14:30:06Z,🔴 Arsenal vs Everton LIVE 🔴 Premier League 2025/2026 ⚽ Match Today Simulation,🔴 Arsenal vs Everton LIVE 🔴 Premier League 2025/2026 ⚽ Match Today Simulation,Torcida Gamers,UCNaJguAvBzQH4y4Av8jQuRw,17,Sports,"Arsenal vs Everton, Arsenal vs Everton live, Everton vs Arsenal, Arsenal vs Everton live streaming, goals of Arsenal vs Everton match 14/03/2026, Arsenal vs Everton live today, Premier League 2026 matches, Watch Arsenal vs Everton live, Arsenal vs Everton match, Arsenal, Everton, Watch Arsenal live, Watch Everton live",13,https://i.ytimg.com/vi/nU4ZkXC-Ap4/hqdefault.jpg,en,en,False,882,PT14M42S,hd,False,True,False,False,30955,143,2
ANXKGWaGV28,UG,2026-03-19T03:26:16.044108+00:00,2026-02-14T08:11:33Z,Da-Re - Sheebah (Valentine Visualizer),Da-Re - Sheebah (Valentine Visualizer),Sheebah ,UCURlXQyzG15s9i7_nMdRE5Q,10,Music,"Sheebah Kalungi, New Ugandan Music, Music Videos, New, HD, Video",6,https://i.ytimg.com/vi/ANXKGWaGV28/hqdefault.jpg,en,en,False,161,PT2M41S,hd,False,True,False,False,480914,14604,1572
dVRYSEWhg28,UG,2026-03-19T03:26:16.044115+00:00,2026-03-15T17:29:48Z,🔴Manchester United vs Aston Villa - Premier League 2026 - Video Game Simulation,🔴Manchester United vs Aston Villa - Premier League 2026 - Video Game Simulation,Bampi,UCT-obV9iz5FuIwcgemKcnHg,17,Sports,"pes 2021, pes 2021 gameplay, soccer, pro evolution soccer 2021, pc gameplay, football pes 2021, sport, football, gameplay video, gameplay, pc, gameplay football, gameplay pes 2021, pes 2021 pc, game, футбол, спорт, игра, геймплей, efootball, pes 2025, soccer game, football game, premier league, english league, epl, video, live football, premier league 25-26, man united vs aston villa, man united, aston villa, manchester united",33,https://i.ytimg.com/vi/dVRYSEWhg28/hqdefault.jpg,vi,en,False,12026,PT3H20M26S,hd,False,True,False,False,56015,168,1
9760US4oU70,UG,2026-03-19T03:26:16.044124+00:00,2026-03-16T04:00:06Z,Sweet Mutima - Super Chance ft King Saha [Official Video] 4K,Sweet Mutima - Super Chance ft King Saha [Official Video] 4K,Super Chance,UCRzUTiyR61h0T3zXAtW_m2w,22,People & Blogs,,0,https://i.ytimg.com/vi/9760US4oU70/hqdefault.jpg,en,en,False,154,PT2M34S,hd,False,False,False,False,20615,599,77
4f__saZoRMU,UG,2026-03-19T03:26:16.044131+00:00,2026-03-13T10:42:01Z,"Irani Fighter jets, Drones & War Helicopter Destroy Israeli Dome system & weapons convey in GTA 5","Irani Fighter jets, Drones & War Helicopter Destroy Israeli Dome system & weapons convey in GTA 5",Army gamer iran,UCJsIQlewdnbn__T5jZoDfhw,22,People & Blogs,"#action, #gta5, #gtav, #Thegame lovers, #gta lovers, #pc game, #chalidren, #actionfilms, #Trovor, #protocol, #mods, #Gta Pakistan, #gtafive, #Auto, #Thuft, #protection, #escirt, #king, #gaza, #missile, #happy, #joebiden, #warzone, #president, #doom, #fighter",26,https://i.ytimg.com/vi/4f__saZoRMU/hqdefault.jpg,en,en,False,504,PT8M24S,hd,False,False,False,False,494174,1076,13
fZtd7_Yu3k0,UG,2026-03-19T03:26:16.044139+00:00,2026-03-09T08:58:26Z,Ngenda- Sasha Brighton (Official Video 4K),Ngenda- Sasha Brighton (Official Video 4K),Sasha Brighton,UCygjWJKJyHsOn3vPhBOOljQ,10,Music,"#sashabrightonsongs #newugandanmusic2026
Ngenda- Sasha Brighton (Official Video 4K)",1,https://i.ytimg.com/vi/fZtd7_Yu3k0/hqdefault.jpg,en,en,False,195,PT3M15S,hd,False,False,False,False,69251,2196,437
K1lwxEMTG-A,UG,2026-03-19T03:26:16.044146+00:00,2026-03-18T11:31:30Z,🔴Sporting CP vs Bodo Glimt LIVE | Champions League 2026 | eFootball Pes21 Simulation,🔴Sporting CP vs Bodo Glimt LIVE | Champions League 2026 | eFootball Pes21 Simulation,RMO,UCDw7iWgxsOgQGPBRFt5Mifw,20,Gaming,,0,https://i.ytimg.com/vi/K1lwxEMTG-A/hqdefault.jpg,en,en,False,14185,PT3H56M25S,hd,False,True,False,False,94913,182,0
UHeUx4CoKpg,UG,2026-03-19T03:26:16.044153+00:00,2026-02-27T13:16:40Z,Lutty Neika - OYAYA (Lyrics Video),Lutty Neika - OYAYA (Lyrics Video),LUTTY NEIKA 🇺🇬,UCq2n_OSrkKvbGurqWWFtARg,24,Entertainment,,0,https://i.ytimg.com/vi/UHeUx4CoKpg/hqdefault.jpg,en,en,False,167,PT2M47S,hd,False,False,False,False,33141,683,430
JuU9YZ6ndG0,UG,2026-03-19T03:26:16.044160+00:00,2026-03-14T03:51:46Z,"March 13, 2026! 98 US Jets Bombard the Russian Military... But Look What Happens! - ARMA 3","March 13, 2026! 98 US Jets Bombard the Russian Military... But Look What Happens! - ARMA 3",MILSIM BOY,UCrbMOZBumHacN0lfVmsmLkQ,20,Gaming,"Arma 3 gameplay, military simulation, shot down, fighter jet shot down, missile, milsim, mil sim, simulation, javalin, bayraktar tb2, tank, missile system, anti-air, stinger missile, drone, artillery, russian army, ukraine army, anti-tank, Arma 4, Arma 3, Arma reforger, us army, convoy, Arma 3 ukraine, Arma 3 russian, cram, war update, news, news update, ウクライナ, ロシア, ロシア軍, กองทัพรัสเซีย, Quân đội Nga, Russia, Ukraine, Tank Elite, Nasto, LPR",40,https://i.ytimg.com/vi/JuU9YZ6ndG0/hqdefault.jpg,en,en-US,False,42897,PT11H54M57S,hd,False,True,False,False,182243,588,0
eNzD3du-Fis,UG,2026-03-19T03:26:16.044169+00:00,2026-02-13T10:04:10Z,MAYDAY RACHAEL,MAYDAY RACHAEL,Gradine Toto - Topic,UCVc8deI6xrsEZa5tXFUaNMQ,10,Music,"Gradine Toto, MAYDAY RACHAEL",2,https://i.ytimg.com/vi/eNzD3du-Fis/hqdefault.jpg,en,es,False,410,PT6M50S,hd,False,True,False,False,1050055,5703,0
Iirx5AvEiwM,UG,2026-03-19T03:26:16.044176+00:00,2026-03-17T12:55:38Z,JJ Become NINJA Met SPY GIRL in SAMURAI VILLAGE!? Can JJ ESCAPE?  - Maizen Minecraft JJ & Mikey,JJ Become NINJA Met SPY GIRL in SAMURAI VILLAGE!? Can JJ ESCAPE?  - Maizen Minecraft JJ & Mikey,JJ and Mikey Fun!,UC5SQv1rksmMDSCfS9pcxggw,20,Gaming,"minecraft, maizen, maizen animations, jj and mikey, jj, mikey, tiny minecraft, woman minecraft, woman jj, police, police minecraft, police jj, police maizen, woman mikey, jj and mikey girl, jj and mikey maizen, girl minecraft jj, prison minecraft, jail minecraft",19,https://i.ytimg.com/vi/Iirx5AvEiwM/hqdefault.jpg,en,en,False,1117,PT18M37S,hd,False,True,False,False,347186,7162,14
CK8q7-VsZuI,UG,2026-03-19T03:26:16.044183+00:00,2026-03-06T14:00:00Z,Shumay Joli - Mamush - ማሙሽ (official video) - new eritrean music 2026,Shumay Joli - Mamush - ማሙሽ (official video) - new eritrean music 2026,Shumay Joli,UC_rrxksSsGpvIon3RBqGxuw,10,Music,"Shumay Official, Shumay Joli, Shumay Gebrihiwet, @ShumayOfficial, new eritrean music, eritrean music, eritrean music 2023, new eritrean music 2023 ethiopian music, new music ethiopian 2022, new music 2023, music 2022, ethiopian old music, ethiopian new music, tigray music, kunama music, yemane barya, eritrean music old, kunama music 2023, eritrean music yemane barya, yemane barya love song, eritrean movie, new eritrean music 2023, yemane barya old songs, #tigrinya, 2026",25,https://i.ytimg.com/vi/CK8q7-VsZuI/hqdefault.jpg,en,ti,False,307,PT5M7S,hd,False,True,False,False,263049,4708,850
dCowvzEeJ7Q,UG,2026-03-19T03:26:16.044190+00:00,2026-03-08T02:15:03Z,🇺🇸 USA ARMY ATTACKS IRAN TODAY !!! | REALISTIC WAR SIM ARMA 3,🇺🇸 USA ARMY ATTACKS IRAN TODAY !!! | REALISTIC WAR SIM ARMA 3,Milsim News Today 29,UCplV6h7qZsv6O_3ZB-9Ty_w,20,Gaming,"russia ukraine war, arma 3 milsim, arma 3 gameplay, ukraine war, arma 3, arma 3 milsim operation, arma 3 funny moments, arma 3 multiplayer, ukraine russia, russia ukraine news, himars missiles, special forces, russian ship, himars firing, atacms missile, ukraine vs russia, himars in action in ukraine, russian ship sunk, russian ship destroyed, ukraine russia war, c-ram, c ram ukraine, su 57, a 10 warthog, a 10 thunderbolt, ukraine, usmc arma 3, patriot ukraine, missile",29,https://i.ytimg.com/vi/dCowvzEeJ7Q/hqdefault.jpg,en-US,en-US,False,711,PT11M51S,hd,False,True,False,False,928593,4216,272
VV-0q50klZY,UG,2026-03-19T03:26:16.044198+00:00,2026-02-22T21:11:06Z,Beenie Gunter - Wendi ( Official Audio ),Beenie Gunter - Wendi ( Official Audio ),Beenie Gunter Official ,UCvD63g0CdIXb6cFPu-b08sw,10,Music,,0,https://i.ytimg.com/vi/VV-0q50klZY/hqdefault.jpg,en,en-GB,False,162,PT2M42S,hd,False,True,False,False,85953,1545,186
0dBtRFd2skM,UG,2026-03-19T03:26:16.044206+00:00,2026-03-14T04:31:45Z,"Spending $8,582,495 To Build The TALLEST WATER SLIDE In Roblox..","Spending $8,582,495 To Build The TALLEST WATER SLIDE In Roblox..",Foltyn,UCRkuUgtDAL4XSU5jB40J_wA,20,Gaming,"foltyn, foltyn roblox, roblox, roblox foltyn, foltyn family, funny, no swearing, foltyn family roblox, roblox foltyn family, blade ball, roblox blade ball, foltyn blade ball, building the tallest waterslide in roblox, foltyn and caylus, foltyn and caylus roblox, foltyn and caylus playing roblox, spending $895482692 To Build The BIGGEST WATER SLIDE In Roblox.., foltyn water slide, foltyn brainrot, foltyn and caylus playing steal a brainrot",20,https://i.ytimg.com/vi/0dBtRFd2skM/hqdefault.jpg,en,en-US,False,742,PT12M22S,hd,False,True,False,False,1527870,24235,2195
