video_id,country,fetched_at,published_at,title,localized_title,channel_title,channel_id,category_id,category_name,tags,tag_count,thumbnail,default_language,audio_language,is_live,duration,duration_raw,definition,caption_available,licensed_content,embeddable,made_for_kids,views,likes,comments
txqsejK6Fp8,MA,2026-06-12T05:14:01.463386+00:00,2026-06-09T15:00:02Z,Fati Jamali - Zyanet | فاتي جمالي - زيانت,Fati Jamali - Zyanet | فاتي جمالي - زيانت,Fati Jamali Officiel I فاتي جمالي الرسمية,UCa5snJqQENr8LRSW4mEc5Kw,10,Music,"fati jamali, momo, zyanet, casablanca, morocco, magreb, musique, music, maroc",9,https://i.ytimg.com/vi/txqsejK6Fp8/hqdefault.jpg,ar,ar,False,170,PT2M50S,hd,False,False,False,False,241567,7184,242
sFStDkqvHwQ,MA,2026-06-12T05:14:01.463394+00:00,2026-06-12T00:09:24Z,roblox best gameplay,roblox best gameplay,StanRP,UCHYA5HNaS5n4idxmP-at8nA,20,Gaming,"roblox, granny, free fire, live roblox, roblox shorts, shorts feed, 67, six seven, meme reset, singing brainrot song, great meme reset",11,https://i.ytimg.com/vi/sFStDkqvHwQ/hqdefault.jpg,en-US,en-US,False,9,PT9S,hd,False,True,False,False,199555,1810,0
x1D4IGFNRT0,MA,2026-06-12T05:14:01.463401+00:00,2026-06-11T16:00:05Z,Lagui - CAPO (Clip Officiel),Lagui - CAPO (Clip Officiel),Lagui,UC0mwRLbjN4TTL7OpZDQkh7A,10,Music,,0,https://i.ytimg.com/vi/x1D4IGFNRT0/hqdefault.jpg,fr,fr,False,156,PT2M36S,hd,False,True,False,False,134822,8487,1625
ygqCpdO08uI,MA,2026-06-12T05:14:01.463409+00:00,2026-06-11T14:41:22Z,جربت حزمة فرنسا الجديدة 🇫🇷🔥 هل تستحق ولا أكبر مقلب؟! | eFootball 2026,جربت حزمة فرنسا الجديدة 🇫🇷🔥 هل تستحق ولا أكبر مقلب؟! | eFootball 2026,HERO GAMING,UC9ckQV4_B6ZUv_b5seS--bA,20,Gaming,"بيس 2025 موبايل, efootball 2025 mobile, بيس موبايل اليوم, هيرو جيمنج, HERO GAMING, تفجير بكجات بيس, بكج الابطال, eFootball 2025, اي فوتبول, Pes, بيس, efootball, بيس موبايل, بيس 25, pes mobile, تفجير بكجات بيس موبايل, ايفوتبول 2025, عقود الترشيح, تفجير بكج, تفجير بكج نجوم الاسبوع, خطة بيس, من الصفر, تفتيح بكجات, هيرو بيس, هيرو, hero, eFootball 2026, اي فوتبول 2026, تحديث بيس موبايل, بيس 2026 موبايل, بمساوي, تحدي هيرو وبمساوي, تطوير حساب, رونالدو, بوفون, امبابي, ديمبلي, ديشامب",38,https://i.ytimg.com/vi/ygqCpdO08uI/hqdefault.jpg,ar,ar,False,1577,PT26M17S,hd,False,True,False,False,61575,6834,520
ycbVZ9Gn3Rk,MA,2026-06-12T05:14:01.463418+00:00,2026-06-11T16:50:53Z,Mc Artisan - La Hess Ft @Hustle.officiel  (Prod. By Valentino Ignoto) ,Mc Artisan - La Hess Ft @Hustle.officiel  (Prod. By Valentino Ignoto) ,Mc Artisan,UC1nLPHfLNBAOxUO2zQCcsvQ,10,Music,,0,https://i.ytimg.com/vi/ycbVZ9Gn3Rk/hqdefault.jpg,en,ar,False,132,PT2M12S,hd,False,True,False,False,60219,5261,622
nNqGMmHWE7E,MA,2026-06-12T05:14:01.463425+00:00,2026-06-11T11:00:34Z,دخلت حساب رورو وسجلت رقم قياسي في ماب الحروف! 😱,دخلت حساب رورو وسجلت رقم قياسي في ماب الحروف! 😱,شحرور,UCUq55QpjaUIolIIss-6Yg_A,20,Gaming,,0,https://i.ytimg.com/vi/nNqGMmHWE7E/hqdefault.jpg,ar,ar,False,829,PT13M49S,hd,False,True,False,False,135143,5417,324
OEMMmPQP2-A,MA,2026-06-12T05:14:01.463432+00:00,2026-06-08T14:34:22Z,اللي بيني وبينها,اللي بيني وبينها,Audixo MA - Topic,UCF95AMa1uceZi8QGjqackGA,10,Music,"Audixo MA, Audixo, اللي بيني وبينها | Audixo MA, اللي بيني وبينها",4,https://i.ytimg.com/vi/OEMMmPQP2-A/hqdefault.jpg,ar,ar,False,304,PT5M4S,hd,False,True,False,False,22999,77,0
HOGgdcGToOY,MA,2026-06-12T05:14:01.463440+00:00,2026-06-11T16:00:31Z,ربلوكس ختمت عالم الكيبورد ! Speed keyboard escape,ربلوكس ختمت عالم الكيبورد ! Speed keyboard escape,اصحاب مازن,UCayyBWtI1PxJCtieqKUQZnA,20,Gaming,"roblox, روبلوكس, العاب, مشاهير روبلوكس, مازن روبلوكس, عائلة روبلوكس, سعدون روبلوكس, اصحاب مازن, مازن وسعدون, روبلوكس ماب السرقة, مازن ستيل برين روت, ستيل برين روت, Steal A Brainrot",13,https://i.ytimg.com/vi/HOGgdcGToOY/hqdefault.jpg,ar,ar,False,972,PT16M12S,hd,False,True,False,False,242646,7430,703
xKwyTfXwB38,MA,2026-06-12T05:14:01.463448+00:00,2026-06-03T17:30:39Z,Deep Emotional - MON AMOUR \ مونامور ( love song | أغنية مغربية ) by m5tl ,Deep Emotional - MON AMOUR \ مونامور ( love song | أغنية مغربية ) by m5tl ,M5TL,UCgGTzdex0-tg-FtSS41G0wg,10,Music,,0,https://i.ytimg.com/vi/xKwyTfXwB38/hqdefault.jpg,ar,ar,False,161,PT2M41S,hd,False,True,False,False,187650,0,47
YzgwBB-OMJg,MA,2026-06-12T05:14:01.463455+00:00,2026-06-11T12:00:06Z,حولت حساب متابع عادي إلى حساب الأحلام! 🔥,حولت حساب متابع عادي إلى حساب الأحلام! 🔥,BNL TV,UC8CAPepwKneUeRIJAkj0tXg,20,Gaming,,0,https://i.ytimg.com/vi/YzgwBB-OMJg/hqdefault.jpg,ar,en,False,1149,PT19M9S,hd,False,True,False,False,50364,5720,293
salwJjShv2M,MA,2026-06-12T05:14:01.463462+00:00,2026-05-21T13:01:16Z,Shakira & Burna Boy - Dai Dai (Lyrics) World Cup Song 2026,Shakira & Burna Boy - Dai Dai (Lyrics) World Cup Song 2026,7clouds,UCNqFDjYTexJDET3rPDrmJKg,10,Music,"dai dai, dai dai lyrics, lyrics dai dai, shakira, burna boy, world cup song, world cup song 2026, world cup song 2026 lyrics, shakira world cup song, shakira world cup song 2026 lyrics, shakira dai dai, dai dai shakira, shakira dai dai lyrics, dai dai shakira lyrics, shakira dai dai world cup song, shakira dai dai world cup song lyrics, shakira burna boy dai dai, shakira burna boy dai dai lyrics, shakira dai dai letra, shakira world cup song 2026, fifa world cup 2026 song",21,https://i.ytimg.com/vi/salwJjShv2M/hqdefault.jpg,en,en,False,223,PT3M43S,hd,False,True,False,False,1565069,16558,1099
7uQE5WnfX5o,MA,2026-06-12T05:14:01.463470+00:00,2026-06-11T17:12:27Z,هربت من السجن في فري فاير!,هربت من السجن في فري فاير!,حسونة - Hassone,UC4j8Thj3AUmH4PTM9YLAkSA,20,Gaming,,0,https://i.ytimg.com/vi/7uQE5WnfX5o/hqdefault.jpg,ar,ar,False,925,PT15M25S,hd,False,True,False,False,79433,8106,589
Lp5nULiOIjA,MA,2026-06-12T05:14:01.463478+00:00,2026-05-14T10:01:51Z,HBIBI,HBIBI,Aya Mounfaloti - Topic,UCbgXFdSTVFhlHZmv-Ja5QhA,10,Music,"Aya Mounfaloti, MKS, Back2B, HBIBI",4,https://i.ytimg.com/vi/Lp5nULiOIjA/hqdefault.jpg,su,,False,131,PT2M11S,hd,False,True,False,False,63153,1102,19
2Kiu5zGGhHY,MA,2026-06-12T05:14:01.463486+00:00,2026-06-11T19:00:11Z,😭 ما بقيناش متفاهمين نهائياً! | It Takes Two #3,😭 ما بقيناش متفاهمين نهائياً! | It Takes Two #3,aymaneLK Gamer,UCRFEKoGlObu8xQAXInIjpGA,20,Gaming,"gaming, games, aymane elk, aymane elkouarty, It Takes Two",5,https://i.ytimg.com/vi/2Kiu5zGGhHY/hqdefault.jpg,ar,ar,False,2889,PT48M9S,hd,False,True,False,False,12440,1139,86
kefB46VvO3w,MA,2026-06-12T05:14:01.463493+00:00,2026-06-05T22:44:06Z,Soul Too Soul,Soul Too Soul,N Ntailor - Topic,UC5VAkK1CYcn11OMBuQSRHbQ,10,Music,"N Ntailor, Soul Too Soul",2,https://i.ytimg.com/vi/kefB46VvO3w/hqdefault.jpg,en,en,False,318,PT5M18S,hd,False,True,False,False,146181,810,0
ctleW8koY6A,MA,2026-06-12T05:14:01.463501+00:00,2026-06-11T13:41:15Z,رجعت من الاعتزال (للمرة المليون 🤣),رجعت من الاعتزال (للمرة المليون 🤣),Dragunov YT,UCUdxTqjcb4EYs07wSU6RJgQ,20,Gaming,"فري فاير, فري, فاير, free, fire, دراغنوف, dragunov, yt, دراغونوف",9,https://i.ytimg.com/vi/ctleW8koY6A/hqdefault.jpg,ar,ar,False,974,PT16M14S,hd,False,True,False,False,128241,19089,1454
JURxuktUEtM,MA,2026-06-12T05:14:01.463509+00:00,2026-06-03T15:34:37Z,غنيلي شوي شوي,غنيلي شوي شوي,Africa Cassette - Topic,UCmztilIFJ0VGbcAuWnu-XfQ,10,Music,"Africa Cassette, Emir Enzo, غنيلي شوي شوي",3,https://i.ytimg.com/vi/JURxuktUEtM/hqdefault.jpg,sd,,False,323,PT5M23S,hd,False,True,False,False,234056,1324,15
