video_id,country,fetched_at,published_at,title,localized_title,channel_title,channel_id,category_id,category_name,tags,tag_count,thumbnail,default_language,audio_language,is_live,duration,duration_raw,definition,caption_available,licensed_content,embeddable,made_for_kids,views,likes,comments
O7pUMhCed4I,MA,2026-06-12T05:14:01.463058+00:00,2026-06-10T21:42:19Z,Pause - Wr9a Mchrga Mn Dftari (Official Audio),Pause - Wr9a Mchrga Mn Dftari (Official Audio),PAUSE,UCsna17teZBaQNCjd9pOD1vQ,10,Music,"NOSTALGIA III, PAUSE, LYAM, METAMORPHOSE, rap maroc, drop, Cage, Tiki-Taka, Bermuda, Red Pill, ORCA, Ghaybouba, MCHRDOUL, Soukaina Fahsi, ThirdEye, PAUSE NECHROPHILIA, Mol7aQ, Solaris, Megalomania, Fornax A, Aktion T4, Halwasa 4, Halwasa 3, Halwasa 2, Halwasa 1, Krampus, Xanax, Courtage, Pararap, Pere Noel, Lwiza, Le Mandarin, Touchdown, Nirvana, Dowsing, Bonne Nuit, Nihil, Spin, Sadou, Abstrait, Ouroboros, Codex Gigas, rap music moroco 2023, rap francais, pause flow, maroc, pause ft soukaina, Chabaka",48,https://i.ytimg.com/vi/O7pUMhCed4I/hqdefault.jpg,en,fr,False,350,PT5M50S,hd,False,True,False,False,394666,57351,7749
LRb0WL8elb4,MA,2026-06-12T05:14:01.463102+00:00,2026-06-11T01:09:10Z,BOROM KEUR - Saison 2 : Bande Annonce,BOROM KEUR - Saison 2 : Bande Annonce,EvenProd,UCKKbOgsOxOT83r1TdfjMaYg,1,Film & Animation,"borom keur saison 2 bande annonce, borom keur saison 2, borom keur bande annonce, borom keur, bande annonce, queen rila, ibou gueye, wally seck, youssou ndour, mia guisse, evenprod 2026, dakar, senegal, 2026, timis, takkema, borom keur serie, serie, tuumaal, workat, evenprod, creation originale, evenprod nouvelle série",23,https://i.ytimg.com/vi/LRb0WL8elb4/hqdefault.jpg,fr,wo,False,371,PT6M11S,hd,False,True,False,False,483887,31097,1314
R9s_7PjQFuE,MA,2026-06-12T05:14:01.463115+00:00,2026-06-11T09:36:43Z,دخلت الى اقوى حساب في المغرب ؟,دخلت الى اقوى حساب في المغرب ؟,SA7RAWI,UCjHq0FqdRB0JP-1CcokW3-w,20,Gaming,"الصحراوي, صحراوي فري فاير, sa7rawi, فري فاير, صحراوي, فري فاير الجزائر, تهكير فري فاير, تحدي فري فاير, مقلب النوب, شحنتلهم, شحن فري فاير, ألف جوهرة, تخريب حساب, شحنت للمتابع, تحدي أفوز, FREE FIRE, NOOB PRANK, سكواد جزائري, خدعة اللغم, ساكورا, التحديث الجديد فري فاير, WHITE444, هيدشوت تلقائي, حسونة, دراغونوف, DBL N, الشخصية الجديدة, متجر التخفيضات, السكن, الشوتقن, فري فاير لايت, الكريمنال, الفاير باس الاول, المتابعين, اصعب تحدي, Ali Omar, M16, TRYHARD, DJEXO, قيم بلاي, سكواد بنات",41,https://i.ytimg.com/vi/R9s_7PjQFuE/hqdefault.jpg,ar,ar,False,723,PT12M3S,hd,False,True,False,False,242887,21835,3305
27C4pfRsf9g,MA,2026-06-12T05:14:01.463127+00:00,2026-06-10T14:58:06Z,LE SSERAFIM (르세라핌) x ILLIT (아일릿) x KATSEYE (캣츠아이) 'ICONIC BY MISTAKE' Official MV,LE SSERAFIM (르세라핌) x ILLIT (아일릿) x KATSEYE (캣츠아이) 'ICONIC BY MISTAKE' Official MV,HYBE LABELS,UC3IZKseVpdzPSBaWxBxundA,10,Music,"HYBE, HYBE LABELS, 하이브, 하이브레이블즈",4,https://i.ytimg.com/vi/27C4pfRsf9g/hqdefault.jpg,ko,ko,False,200,PT3M20S,hd,True,True,False,False,11587966,1059942,88514
Kf3c53eX7Lg,MA,2026-06-12T05:14:01.463136+00:00,2026-06-09T16:00:09Z,Cyclops: The Fearless Leader | Character Reveal Trailer | Marvel Rivals,Cyclops: The Fearless Leader | Character Reveal Trailer | Marvel Rivals,Marvel Rivals,UCWzmOSSiSPbVnVu3ZAyDx2w,20,Gaming,"Marvel Rivals, Cyclops, Cyclops Reveal Trailer, Marvel, Marvel Games",5,https://i.ytimg.com/vi/Kf3c53eX7Lg/hqdefault.jpg,en,,False,61,PT1M1S,hd,False,False,False,False,3145171,81339,6458
oBhpyR8Nxoc,MA,2026-06-12T05:14:01.463144+00:00,2026-06-11T16:00:31Z,دخلت مع اشخاص بحساب مختفي !!,دخلت مع اشخاص بحساب مختفي !!,SA7RAWI Gaming,UC2qdrMpLKn3GgeCwN65SX_Q,20,Gaming,"الصحراوي, صحراوي فري فاير, sa7rawi, فري فاير, صحراوي, فري فاير الجزائر, تهكير فري فاير, تحدي فري فاير, مقلب النوب, شحنتلهم, شحن فري فاير, ألف جوهرة, تخريب حساب, شحنت للمتابع, تحدي أفوز, FREE FIRE, NOOB PRANK, سكواد جزائري, خدعة اللغم, ساكورا, التحديث الجديد فري فاير, WHITE444, هيدشوت تلقائي, حسونة, دراغونوف, DBL N, الشخصية الجديدة, متجر التخفيضات, السكن, الشوتقن, فري فاير لايت, الكريمنال, الفاير باس الاول, المتابعين, اصعب تحدي, Ali Omar, M16, TRYHARD, DJEXO, قيم بلاي, سكواد بنات",41,https://i.ytimg.com/vi/oBhpyR8Nxoc/hqdefault.jpg,ar,ar,False,758,PT12M38S,hd,False,True,False,False,221237,16665,1236
09RuFm2K2DA,MA,2026-06-12T05:14:01.463155+00:00,2026-06-11T11:00:06Z,Zina Daoudia - L Khayl [Official Video] (2026) / زينة الداودية - الخيل,Zina Daoudia - L Khayl [Official Video] (2026) / زينة الداودية - الخيل,Zina Daoudia | زينة الداودية,UCKrDS9GEtUFcni2frCzNtfg,10,Music,"Zina Daoudia, zina daoudia, zina dawoudia, زينة الداودية, zina daoudya, zina dawoudia 2022, zina daoudia 2026, moroccan rai, zina rai songs, ZinaDaoudia, Daoudia, زينة الداودية 2026, جديد الداودية, zinadaoudia, جديدالداودية, zina el daoudia, Zina Daoudia L Khayl, زينة الخيل, زينة الداودية الخيل",19,https://i.ytimg.com/vi/09RuFm2K2DA/hqdefault.jpg,ar,ar,False,454,PT7M34S,hd,False,True,False,False,41806,1302,137
rN9viJlnir4,MA,2026-06-12T05:14:01.463164+00:00,2026-06-08T19:13:48Z,Streamer University 2026 | Official Enrollment Trailer,Streamer University 2026 | Official Enrollment Trailer,Kai Cenat Live,UCvCfpQXRXdJdL07pzTIA6Cw,24,Entertainment,"Kai Cenat, Kai Cenat Live, Kai Cenat Livestream, Kai Live, Kai Cenat Funny",5,https://i.ytimg.com/vi/rN9viJlnir4/hqdefault.jpg,en,en-US,False,158,PT2M38S,hd,False,True,False,False,1613896,114754,12719
J2aBTUVS3uE,MA,2026-06-12T05:14:01.463173+00:00,2026-06-11T16:23:44Z,فتحت بكج نجوم ايطاليا  في 2006🤯عودة افضل حارس في التاريخ🔥|efootbal 2026,فتحت بكج نجوم ايطاليا  في 2006🤯عودة افضل حارس في التاريخ🔥|efootbal 2026,TONY GAMING,UCtvsfbEiJmj3-54ACJH-Jxw,20,Gaming,"بيس موبايل, بيس موبايل 2022, بيس 2022 موبايل, تحديث بيس 2022 موبايل, موعد نزول بيس 2022 موبايل, موعد تحديث بيس 2022 موبايل, يوم الخميس بيس 2021 موبايل, بيس 2021 موبايل اليوم, تحديث بيس موبايل, موعد تحديث بيس موبايل, موعد بيس 2022 موبايل, اخبار بيس 2022 موبايل, تحميل بيس 2022 موبايل, تحديث بيس 2023, pes 2022, efootball 2024, تفجير بكجات, تحديات, افضل تشكيله, التحديث الجديد, بكج نجوم الاسبوع, شو تايم, دوري ابطال اوروبا, buffon, pirlo, zambrota",26,https://i.ytimg.com/vi/J2aBTUVS3uE/hqdefault.jpg,ar,ar,False,1424,PT23M44S,hd,False,True,False,False,124409,15524,521
kmlkRkQryRM,MA,2026-06-12T05:14:01.463182+00:00,2026-06-09T17:00:19Z,Gruppo Aquile : CAPITOLE (Ultras Eagles 06) ألبوم ميلاد و تحرير,Gruppo Aquile : CAPITOLE (Ultras Eagles 06) ألبوم ميلاد و تحرير,Ultras Eagles 06,UChboFiKVlX01yFVi6av6ZQA,17,Sports,,0,https://i.ytimg.com/vi/kmlkRkQryRM/hqdefault.jpg,fr,en,False,377,PT6M17S,hd,False,True,False,False,72235,6879,603
OdlnuurG-vg,MA,2026-06-12T05:14:01.463190+00:00,2026-06-11T20:14:17Z,الزعيم غاضب 🤬,الزعيم غاضب 🤬,CHEDIID الشديد,UCXnRnNLdC1Vo4sqU3gN3WGQ,20,Gaming,"CHERFA, CHRFA, GAMER MAROC, vasto, chedid, GAMER, ark, DAVOS, chediid, elvasto, el vasto, ark maroc, setup maroc, elvasto r, ark survival, maroc gaming, gaming youtuber, maroc, CHEDID, CHERFA GAMES, temu, setup samurai, setup ninja, temuhaul, #Chediid, TEMU, shoptemu, temureview, temufinds, RUST, RUSTSURVIVAL, RUST CHERFA, RUSTCHERFA, amenti, horror, simulation, simulator, forza, forza5, the ELIMINATOR, forza 5, devour, gta rp maroc, rp maroc, gta maroc, rust maroc, maroc rust, maroc rp, gta 5, gta V",50,https://i.ytimg.com/vi/OdlnuurG-vg/hqdefault.jpg,ar,ar,False,512,PT8M32S,hd,False,True,False,False,33700,4927,674
1e_GG37qt-E,MA,2026-06-12T05:14:01.463199+00:00,2026-06-10T17:03:51Z,J'SAIS PAS feat. Timar (Official Music Video),J'SAIS PAS feat. Timar (Official Music Video),ElGrandeToto,UCVG705xosVltZb52R0hHr_g,10,Music,"Elgrandetoto, HORS SÉRIE, elgrandetoto hors serie, elgrandetoto live, el grande toto, elgrandetoto album, elgrandetoto Pablo, elgrandetoto freestyle, rap 2020, rap maroc 2020, rap francais, rap maroc 2020 jadid, rap maroc 2020 new, elgrandetoto apache, elgrandetoto 7elmetado, راب مغربي, راب مغربي 2020",17,https://i.ytimg.com/vi/1e_GG37qt-E/hqdefault.jpg,fr,ar,False,238,PT3M58S,hd,False,True,False,False,58791,3285,253
P0LB-IV-YkA,MA,2026-06-12T05:14:01.463208+00:00,2026-06-11T15:08:22Z,"الحظ تاااريخي في بكج بوفون بيج تيم , بيرلو و زامبروتا 🔥 ايطاليا 2006 💥🤯! eFootball 26","الحظ تاااريخي في بكج بوفون بيج تيم , بيرلو و زامبروتا 🔥 ايطاليا 2006 💥🤯! eFootball 26",MessiGaming10,UCLKk-PWbcOTB3qyMWsfs8ag,20,Gaming,"ميسي جمينج, تفجير بكجات efootball 2026, eFootball 2026, review new Buffon big time 108 efootball 2026, efootball 2026, شرح المهارات بيس26, تفجير بكج اساطير ايطاليا 2006 الجديد, تجربه بوفون وبيرلو بيج تيم الجديد, افضل تطويره ل بوفون بيج تيم 108 الجديد, eFootball 2026 packs opening, تفجير بكجات eFootball, eFootball 2026 gameplay, messi gaming, efootball, review new Buffon 108, Buffon 108 big time pack opening, review Buffon 108 efootball, Buffon 108 review, بكج اساطير ايطاليا بيس",19,https://i.ytimg.com/vi/P0LB-IV-YkA/hqdefault.jpg,ar,ar,False,1063,PT17M43S,hd,False,True,False,False,114638,15344,1558
L1xP3lFnK6I,MA,2026-06-12T05:14:01.463217+00:00,2026-06-11T18:22:39Z,Mehdi Mozayine - Sir Sir (EXCLUSIVE MUSIC VIDEO) مهدي مزين - سير سير,Mehdi Mozayine - Sir Sir (EXCLUSIVE MUSIC VIDEO) مهدي مزين - سير سير,Mehdi Mozayine,UCwK1c_RczSk8RQTiWcCAFgQ,10,Music,,0,https://i.ytimg.com/vi/L1xP3lFnK6I/hqdefault.jpg,ar,ar,False,202,PT3M22S,hd,False,False,False,False,61303,679,72
JDj_Kr1w36k,MA,2026-06-12T05:14:01.463225+00:00,2026-06-11T18:30:09Z,النجاة في الغابة #1 : دخلت لأخطر جزيرة فالعالم… السكان ديالها كياكلو البشر! ☠️🚨,النجاة في الغابة #1 : دخلت لأخطر جزيرة فالعالم… السكان ديالها كياكلو البشر! ☠️🚨,Meed Gaming,UCLkjNU2Rp_pWuBfrx_ETSlg,20,Gaming,"السفر الطويل, Drive Beyond Horizons, المغرب, the long drive, meed charfi, meed gaming, مضحك, محاكي الحوادث, الهروب من الفيضان, ميد شرفي, جيمينج, ستريم, العاب سيارات, الصحراء المغربية, النجاة في الغابة, سيد الحاج وسط أخطر جزيرة فالعالم, morocco, Sons Of The Forest, ابناء الغابة, بداية المغامرة والنجاة من آكلين لحوم البشر, فيديوهات مضحكة, ranch simulator, محاكي المزرعة",23,https://i.ytimg.com/vi/JDj_Kr1w36k/hqdefault.jpg,ar,ar,False,1804,PT30M4S,hd,False,True,False,False,42683,4023,1107
p7UQojvWTZE,MA,2026-06-12T05:14:01.463233+00:00,2026-06-11T10:04:04Z,Seknet Marseille,Seknet Marseille,Soolking - Topic,UC1oWkNTMwjVinfReZBfktXA,10,Music,"Soolking, Seknet Marseille",2,https://i.ytimg.com/vi/p7UQojvWTZE/hqdefault.jpg,en,fr,False,154,PT2M34S,hd,False,True,False,False,27417,2029,160
zM4aBUnmoU0,MA,2026-06-12T05:14:01.463241+00:00,2026-06-11T11:45:30Z,عودة نيمار بعد سنتين.. والبداية الحقيقية لحدث كأس العالم,عودة نيمار بعد سنتين.. والبداية الحقيقية لحدث كأس العالم,Abdo 2xd,UC8H8YKUSFLtLxjt49tlyJwA,20,Gaming,"عبدو, Abdo, Abdo 2xd, FIFA, فيفا, لعبة فيفا, ABDO, فيفا موبايل, fifa, fifa mobile, اف سي موبايل, FC MOBILE, اف سي, fc, fc mobile, لعبة فيفا موبايل, كريستيانو, كريستيانو رونالدو, cr7, ballon d'or, رونالدينهو, FC, رونالدو, رودريجو, زيدان, فريق الموسم, TOTS, كريستانو رونالدو, Ballon d'Or, ايزيبو, ديمبلي, البالون دور, الكرة الذهبية, tots, برونو, هالاند, بيست, abdo2xd, كريستانو, كريستانو الازرق, ميسي, التميت, نيمار",43,https://i.ytimg.com/vi/zM4aBUnmoU0/hqdefault.jpg,ar,ar,False,1437,PT23M57S,hd,False,True,False,False,362669,42643,3020
x550PVhs9Dc,MA,2026-06-12T05:14:01.463251+00:00,2026-06-08T16:32:05Z,Dollypran X 7liwa - Dama (Official Visualizer),Dollypran X 7liwa - Dama (Official Visualizer),Dollypran,UCDew5DsBBv5eXHsTkrjctSg,10,Music,"Dollypran, 7liwa, Dama, Dama ft. 7liwa, Il3ab Il3ab, La Sirène, Traitement2, traitement album, dollypran traitement, dollypran album traitement, dollypran traitement lyrics, la sirene album traitement, dollypran new, dollypran new album, Dollypran new song, Moroccan rap, أغاني مغربية, راب مغربي, موسيقى عربية, دولي بران, تراب مغربي, moroccan hip hop, trending arabic songs, viral moroccan music, arabic hip hop, dollypran hits, dollypran, rap maroc, dollypran reaction, Chabaka",30,https://i.ytimg.com/vi/x550PVhs9Dc/hqdefault.jpg,en,ar,False,176,PT2M56S,hd,False,True,False,False,190999,5955,325
4CQJ3PUfrKQ,MA,2026-06-12T05:14:01.463260+00:00,2026-06-10T17:46:00Z,النجاة في البحر #3 | صاوبنا الدار و سفينة جديدة 🏠 😱@iamchedid,النجاة في البحر #3 | صاوبنا الدار و سفينة جديدة 🏠 😱@iamchedid,DAVOS,UCapMF8avHA9-fdRjS4aldkg,20,Gaming,"chediid, CHERFA, CHRFA, ark cherfa, maroc gaming, ARK JaHaNaM, GTA 5, gta 5 online, GTA RP, gta rp, gta 5 rp, gta 5 roleplay, gta 5, gta rp cherfa, GTA, Gran theft auto, rockstar, Gaming, Gaming maroc, ark, ark maroc, ARK JaHaNaM #1 - Cherfa, الحياة الواقعية, Christmas, davos, ark jahanam 2, JaHaNaM, davos gaming, davos cherfa, davos rp, setup maroc, rust maroc, rust cherfa, davos gamer, cherfa games, davos ark, chedid, stranded deep, survive, elvasto, العاب سرفايفل, forza",42,https://i.ytimg.com/vi/4CQJ3PUfrKQ/hqdefault.jpg,ar,ar,False,1467,PT24M27S,hd,False,True,False,False,86637,12914,380
4zHM1UI3LeY,MA,2026-06-12T05:14:01.463269+00:00,2026-06-11T15:00:06Z,Maha Ftouni - Fe Hodnak (Official Lyric Video) | مهى فتوني - في حضنك,Maha Ftouni - Fe Hodnak (Official Lyric Video) | مهى فتوني - في حضنك,Maha Ftouni,UCBjR6Ju3DaWf7Otlbm99Tdg,10,Music,"Maha Ftouni, maha ftouni, maha, في حضنك, مهى فتوني في حضنك, Fe Hodnak, مهى في حضنك, مهى فتوني - في حضنك, حضنك, مها, maha ftouni fi hodnak, maha ftouni fe hodnak, fe hodnak, fi hodnak, maha fe hodnak, مها في حضنك, maha في حضنك, maha ftouni 2026, egyptian pop 2026, egyptian vocal, مها فتوني, أغاني طرب, Maha Ftoni, sad songs, أغاني تيكتوك, ترند تيكتوك, أغاني مها فتوني, مهى فتوني, أغاني حزن, أغاني حب, Love Songs, أغاني ترند, اغاني 2026, طرب مصري, Chabaka",35,https://i.ytimg.com/vi/4zHM1UI3LeY/hqdefault.jpg,ar,en-US,False,261,PT4M21S,hd,False,True,False,False,112884,7853,840
W316HYi-48c,MA,2026-06-12T05:14:01.463277+00:00,2026-06-11T10:11:42Z,استعد للقادم واحذر من حزم المنتخبات 🔥🤯 شرح اضافات تحديث بيس ورسالة كونامي 😱|efootball 2026,استعد للقادم واحذر من حزم المنتخبات 🔥🤯 شرح اضافات تحديث بيس ورسالة كونامي 😱|efootball 2026,من بره التمنتاشر,UC8gfuntXFc6fzYLx6Zi5B8Q,26,Howto & Style,"من بره التمنتاشر, efootball 2026, efootball, بيس موبايل, بيس 2026, هدايا كونامي, بيس 26, احداث يوم الخميس بيس, تحديث بيس موبايل, تحديث بيس 2026, efootball mobile, efootball 26, eFootball Updates, كوين بيس, تحميل efootball, تحميل بيس, efootball pes, pes mobile, تحميل لعبة efootball, احداث يوم الخميس, بكج نجوم الاسبوع, اضافات يوم الخميس, بكجات يوم الخميس, احداث يوم الاثنين, efootball2026, كوينز بيس, مهمات بيس, طريقة استلام كوينز, شرح تحديث بيس",29,https://i.ytimg.com/vi/W316HYi-48c/hqdefault.jpg,ar,ar,False,543,PT9M3S,hd,False,True,False,False,152317,13210,972
qDaWxnGLbcI,MA,2026-06-12T05:14:01.463286+00:00,2026-06-11T18:38:44Z,"Didine Canon 16 - M7ayni 2, prod by willy ","Didine Canon 16 - M7ayni 2, prod by willy ",Didine Canon 16 ,UCzbsyyZ05INu78miPEAUDUQ,10,Music,,0,https://i.ytimg.com/vi/qDaWxnGLbcI/hqdefault.jpg,en,fr,False,194,PT3M14S,hd,False,True,False,False,157096,18627,1840
BG6h1NKBbPI,MA,2026-06-12T05:14:01.463294+00:00,2026-06-11T16:36:12Z,تجربة بكج فرنسا 🇫🇷🔥اخيرا عودة ديشامب… أفضل مدرب في اللعبة؟! 🥶,تجربة بكج فرنسا 🇫🇷🔥اخيرا عودة ديشامب… أفضل مدرب في اللعبة؟! 🥶,نينجا جيمنج NINJA Gaming l,UChxL5BBwSFY2wX8OfX_-8UQ,20,Gaming,"ايفوتبول 2026, ايفوتبول 2026 موبايل, ايفوتبول موبايل, ايفوتبول 26, لعبة ايفوتبول موبايل, افضل مدرب في ايفوتبول, افضل تشكيلة ايفوتبول 2026, افضل خطة في ايفوتبول, بيس 2026 موبايل, بيس 26, بيس, نينجا جيمنج, efootball, efootball 2026, efootball 2026 mobile, pes mobile, نينجا جيمنج بيس, تفجير بكجات بيس, بيس موبايل اليوم, بيس نينجا, اي فوتبول 2026, tony gaming, messi gaming, تفتيح بكجات بيس, تجربة بكج فرنسا, تجربة بكج فرنسا الجديد, تجربة ديشامب الجديد, تجربة بكج فرنسا بيس 2026",28,https://i.ytimg.com/vi/BG6h1NKBbPI/hqdefault.jpg,ar,ar,False,1562,PT26M2S,hd,False,True,False,False,67037,8119,416
4OxPvpLRraE,MA,2026-06-12T05:14:01.463302+00:00,2026-06-07T17:00:06Z,Shawn Mendes - Treat You Better (Lyrics),Shawn Mendes - Treat You Better (Lyrics),Latin City,UCMhlipBOCB760EFv2MzGDJg,10,Music,"shawn mendes, treat you better, shawn mendes treat you better, treat you better shawn mendes, treat you better shawn mendes lyrics, shawn mendes treat you better lyrics, i know i can treat you better than he can, treat you better lyrics shawn mendes, treat you better lyric video, lyrics treat you better shawn mendes, shawn mendes lyrics, shawn mendes lyrics treat you better, lyrics, latin city",14,https://i.ytimg.com/vi/4OxPvpLRraE/hqdefault.jpg,en,en,False,189,PT3M9S,hd,False,True,False,False,331302,1301,21
f6pFJf5iq5U,MA,2026-06-12T05:14:01.463311+00:00,2026-06-11T19:12:39Z,صدمة كبيرة قميص رقم 9 مجانا 🤯 سارع للحصول عليه🔥,صدمة كبيرة قميص رقم 9 مجانا 🤯 سارع للحصول عليه🔥,SOKAR YT,UCqZJbp4SkbuZhZTwlX9NMTg,20,Gaming,,0,https://i.ytimg.com/vi/f6pFJf5iq5U/hqdefault.jpg,ar,ar,False,237,PT3M57S,hd,False,True,False,False,47593,6444,787
H8QdLwpIhLA,MA,2026-06-12T05:14:01.463319+00:00,2026-06-09T03:24:19Z,عشقك غير مؤهل,عشقك غير مؤهل,Cheb Hamza 31 - Topic,UCYKwB_n7_m4FUkW7DNBaGQg,10,Music,"Cheb Hamza 31, عشقك غير مؤهل",2,https://i.ytimg.com/vi/H8QdLwpIhLA/hqdefault.jpg,en,ar,False,322,PT5M22S,hd,False,True,False,False,104749,2624,0
d_LAjD_4TvM,MA,2026-06-12T05:14:01.463327+00:00,2026-06-11T14:57:13Z,البحث عن أفضل حارس في تاريخ اللعبة !! 🤯🔥 بوفون 108 ☠️ بكج ابطال العالم 2006 😍 || eFootball 26,البحث عن أفضل حارس في تاريخ اللعبة !! 🤯🔥 بوفون 108 ☠️ بكج ابطال العالم 2006 😍 || eFootball 26,OKATO GO,UCkUEthM6nQe--OdWmxQS66w,20,Gaming,"pes mobile, بيس موبايل, بيس موبايل تفتيح بكجات, تفتيح بكجات, eFootball Mobile, بيس 2023, fifa mobile, fifa ultimate team, okato go, okato, abdalaziz esam, عبدالعزيز اوكاتو, اوكاتو, فيفا موبايل, فيفا 23, تحديث فيفا, تحديث بيس موبايل, تحديث فيفا موبايل, pes 2025, pes25, efootball25, efootball 25, efootball 2025, تفتيح بكجات pes, تفتيح بكجات بيس, اي فوتبول",26,https://i.ytimg.com/vi/d_LAjD_4TvM/hqdefault.jpg,ar,ar,False,1266,PT21M6S,hd,False,True,False,False,55443,5832,234
SsuCimm5BIU,MA,2026-06-12T05:14:01.463335+00:00,2026-06-10T09:00:01Z,BABYMONSTER - 'SUGAR HONEY ICE TEA' PERFORMANCE VIDEO,BABYMONSTER - 'SUGAR HONEY ICE TEA' PERFORMANCE VIDEO,BABYMONSTER,UCqwUnggBBct-AY2lAdI88jQ,10,Music,"BABYMONSTER, 베이비몬스터, 베몬, BABYMON, BAEMON, 하람, 아현, 루카, 치키타, 파리타, 로라, 아사, HARAM, AHYEON, RUKA, CHIQUITA, PHARITA, RORA, ASA",19,https://i.ytimg.com/vi/SsuCimm5BIU/hqdefault.jpg,en,ko,False,191,PT3M11S,hd,False,True,False,False,7688791,248675,12765
0UwV20Lv5R4,MA,2026-06-12T05:14:01.463343+00:00,2026-06-11T18:59:51Z,افشل بائع الليمون في روبلكس😰sell lemon roblox,افشل بائع الليمون في روبلكس😰sell lemon roblox,Hicham Panda,UConNpoTlEic3FtPdwafprag,20,Gaming,"باندا, هشام باندا, HICHAM, HICHAM PANDA, PANDA, تحدي, هشام, game, لعبة, العاب, gaming, gameplay, games, تحديات, roblox, roblox gaming, roblox funny, roblox maroc, roblox arab, gaming video, funny gaming, youtube gaming, roblox roleplay, roblox scary, roblox adventure, roblox obby, roblox trolling, roblox challenge, roblox secrets, roblox viral, roblox trending, viral video, youtube shorts, روبلوكس بالدارجة, جيمر مغربي",35,https://i.ytimg.com/vi/0UwV20Lv5R4/hqdefault.jpg,ar,ar,False,1584,PT26M24S,hd,False,True,False,False,24383,667,94
oqj9uPCrRjE,MA,2026-06-12T05:14:01.463352+00:00,2026-06-11T15:42:23Z,Siham Tilila - Mana Yemma Ghari - Izran 2026 (Clip Comedy Officiel ),Siham Tilila - Mana Yemma Ghari - Izran 2026 (Clip Comedy Officiel ),Siham Tilila,UCDv9TRc9nbxDDJ-DMdZYChQ,10,Music,,0,https://i.ytimg.com/vi/oqj9uPCrRjE/hqdefault.jpg,fr,ar,False,369,PT6M9S,hd,False,True,False,False,5832,302,36
Lk3nas5L3zc,MA,2026-06-12T05:14:01.463360+00:00,2026-06-10T23:47:38Z,🔴 LIVE - (Uncharted 4) #2 | أخطر عملية البحث على الكنز بدات دبا !! 💵🔥,🔴 LIVE - (Uncharted 4) #2 | أخطر عملية البحث على الكنز بدات دبا !! 💵🔥,Meed Live,UCgIeNyrRVkJxqiBtJbuy-1w,20,Gaming,"🔴 LIVE - (Uncharted 4) #2 | أخطر عملية البحث على الكنز بدات دبا !! 💵🔥, ميمكنش, زاف, شنو هادشي, مغربي, مغربية, هروب, مشروعي الجديد, meed charfi, meed gaming, meed charfi الضحك, محاكي الفلاح, محاكي المزرعة, جيمينج, مزرعة, محاكي المزارع #3, لسيد الحاج, اضحك, مضحك, وأخيراً تحقق الحلم, meed, الهروب من أخطر سجن فالعالم, Uncharted 4, Uncharted, The Lost Legacy, أنشارتد, الإرثُ المفقود, العاب, ألعاب, تختيم, أنشارتد 4, سوني 5, بلايستيشن 5, سجن, انسجنت, انفاردي, نلعب, يلعب, ps6, gta 6, game, maroc, charfi",43,https://i.ytimg.com/vi/Lk3nas5L3zc/hqdefault.jpg,ar,ar,False,10879,PT3H1M19S,hd,False,True,False,False,75066,6447,248
VzOEhqsf8rc,MA,2026-06-12T05:14:01.463370+00:00,2026-06-11T08:29:42Z,bader ouabi mohal,bader ouabi mohal,Mhb97 - Topic,UCJko-DT7FQIgKELjUIep4Lg,10,Music,"Mhb97, bader ouabi, mouna, bader ouabi mohal",4,https://i.ytimg.com/vi/VzOEhqsf8rc/hqdefault.jpg,en,ar,False,326,PT5M26S,hd,False,True,False,False,2455,20,0
yniJ5yCAqDc,MA,2026-06-12T05:14:01.463378+00:00,2026-06-11T19:55:02Z,Elige un ÁRBOL de LAVA para Sobrevivir al TSUNAMI en Minecraft...,Elige un ÁRBOL de LAVA para Sobrevivir al TSUNAMI en Minecraft...,Nacho,UC8EkcHOycB94lHDkbAPSnQA,20,Gaming,"nacho, dagar, nacho minecraft, dagar y nacho, nacho y dagar, minecraft, minecraft mod, noob vs pro, base enana, base diminuta, lia minecraft, toni minecraft, acuatico, casa del arbol, arbol minecraft, reto casa del arbol, base secreta, base secreta minecraft, base arbol, arbol pro, arbol hacker, diamante, arbol de diamante, arbol de lava, arbol de magma, abi, abi minecraft, tsunami, tsunami minecraft, tsunami vs lava, tsunami vs arbol",31,https://i.ytimg.com/vi/yniJ5yCAqDc/hqdefault.jpg,es,es,False,1294,PT21M34S,hd,False,True,False,False,587725,8311,340
