video_id,country,fetched_at,published_at,title,localized_title,channel_title,channel_id,category_id,category_name,tags,tag_count,thumbnail,default_language,audio_language,is_live,duration,duration_raw,definition,caption_available,licensed_content,embeddable,made_for_kids,views,likes,comments
xYLonqZBPjU,RS,2026-06-07T05:07:51.410389+00:00,2026-06-02T11:17:04Z,Jovana Pajić - DOĐE MENI (Official Video),Jovana Pajić - DOĐE MENI (Official Video),Jovana Pajic,UCB0JAvBxk4KxM5anJHN9-fQ,10,Music,"jovana, pajic, novo, novi video, spot pesma, new video, new single, new audio, jovana nova pesma, lepo mi stoji 2025 pesma, dodje meni, jovana dodje meni, jovana pajic dodje meni, jovana pajic official video 2026, jovana pajic dodje meni official video, pajke dodje meni, dodje meni pesma, dodje meni 2026, pajke nova pesma, dodje meni spot, dodje meni jovana",21,https://i.ytimg.com/vi/xYLonqZBPjU/hqdefault.jpg,sr,sr,False,218,PT3M38S,hd,False,True,False,False,1214649,14869,750
HLMX2w3cwuE,RS,2026-06-07T05:07:51.410426+00:00,2026-06-02T22:15:01Z,God of War Laufey - Gameplay Reveal Trailer | PS5 Games,God of War Laufey - Gameplay Reveal Trailer | PS5 Games,PlayStation,UC-2Y8dQb0S6DtpxNgAKoJKA,20,Gaming,"PlayStation, PS5, video games, next gen, Sony, state of play, god of war, God of War Laufey, Official Gameplay Reveal",9,https://i.ytimg.com/vi/HLMX2w3cwuE/hqdefault.jpg,en,en-US,False,1425,PT23M45S,hd,True,True,False,False,6369126,390408,28336
Vle0Hc1_8eI,RS,2026-06-07T05:07:51.410438+00:00,2026-05-28T15:36:19Z,POSTALI SMO DETEKTIVI,POSTALI SMO DETEKTIVI,Smigicka,UCekojv1JKhvr5rGag0TCOug,23,Comedy,"smigicka, smiga, smuga, smega, smoga, aleksandrasmigic, sminka, novke i smiga, dress to impress, dti, oblacim se, putovanja, vlog, defko i caki, novke, roblox, detektivi, 24 sata, 24h, postali, postajemo",21,https://i.ytimg.com/vi/Vle0Hc1_8eI/hqdefault.jpg,sr,en,False,1406,PT23M26S,hd,False,True,False,False,626830,11730,557
EdW_7WzXWAw,RS,2026-06-07T05:07:51.410448+00:00,2026-06-02T12:00:06Z,DESINGERICA - CCUCLA (OFFICIAL VIDEO),DESINGERICA - CCUCLA (OFFICIAL VIDEO),Desingerica,UC-8ljtsUg8RVCOq-Gfcp8Rg,22,People & Blogs,"desingerica, pljugica, tuckavacc, kucci kucci, praccka, pistacc, balkanacc",7,https://i.ytimg.com/vi/EdW_7WzXWAw/hqdefault.jpg,en,sr,False,118,PT1M58S,hd,False,True,False,False,461428,14362,844
qSjq0JSbz14,RS,2026-06-07T05:07:51.410489+00:00,2026-06-05T21:23:09Z,Resident Evil Veronica - Official Reveal Trailer,Resident Evil Veronica - Official Reveal Trailer,GameSpot,UCbu2SsF-Or3Rsn3NxqODImw,20,Gaming,,0,https://i.ytimg.com/vi/qSjq0JSbz14/hqdefault.jpg,en,en,False,235,PT3M55S,hd,False,True,False,False,1089037,57167,3887
X_Rirys13vU,RS,2026-06-07T05:07:51.410499+00:00,2026-06-03T18:06:16Z,SVAKI MINUT POSTAJE STRAŠNIJE..,SVAKI MINUT POSTAJE STRAŠNIJE..,Dex Rock,UC9-OsEfAts7_SaTRQOBRgjw,24,Entertainment,DexRock,1,https://i.ytimg.com/vi/X_Rirys13vU/hqdefault.jpg,sr,sr,False,1312,PT21M52S,hd,False,True,False,False,239019,9687,192
ykTUVtPss_A,RS,2026-06-07T05:07:51.410507+00:00,2026-05-22T10:00:04Z,Jala Brat & Buba Corelli - Bass & Rave (GODZILLA),Jala Brat & Buba Corelli - Bass & Rave (GODZILLA),IMPERIA,UCaWaxupwQ7Pssm94Xcxi8LA,10,Music,,0,https://i.ytimg.com/vi/ykTUVtPss_A/hqdefault.jpg,hr,bs,False,131,PT2M11S,hd,True,True,False,False,4665190,36085,627
l0hD3KBwoiA,RS,2026-06-07T05:07:51.410514+00:00,2026-05-31T15:54:36Z,"No Peace Amongst the Stars | Warhammer 40,000 Official Cinematic Trailer","No Peace Amongst the Stars | Warhammer 40,000 Official Cinematic Trailer","Warhammer 40,000",UCm4UYMFMVFKtZBi9uk4HSCg,20,Gaming,"warhammer40000, warhammer40k, 40k, 40klore, warhammer",5,https://i.ytimg.com/vi/l0hD3KBwoiA/hqdefault.jpg,en,en-GB,False,224,PT3M44S,hd,True,False,False,False,3962010,203672,9669
PbwiJCVXimY,RS,2026-06-07T05:07:51.410522+00:00,2026-06-04T17:00:10Z,UHAPŠENI Smo u 3 UJUTRU u Brookhavenu!,UHAPŠENI Smo u 3 UJUTRU u Brookhavenu!,Drugari,UCLnIHL_NAHkbFi7pZ0mKtLg,20,Gaming,"lunailuka, lukailuna, luna, luka, roblox, luna roblox, luka roblox, brookhaven, lunaluka, lukaluna, drugari",11,https://i.ytimg.com/vi/PbwiJCVXimY/hqdefault.jpg,sr,sr,False,1041,PT17M21S,hd,False,True,False,False,65128,1634,79
aZXH3Z8WqnM,RS,2026-06-07T05:07:51.410529+00:00,2026-06-05T10:00:06Z,ALBINO - NEVJESTA (Official Music Video),ALBINO - NEVJESTA (Official Music Video),Albino,UCiBL7J23K3tRc-QsXZNvCZg,10,Music,"Albino, Nevjesta",2,https://i.ytimg.com/vi/aZXH3Z8WqnM/hqdefault.jpg,hr,sr,False,166,PT2M46S,hd,False,True,False,False,259312,10029,603
0JlMjgqduVw,RS,2026-06-07T05:07:51.410537+00:00,2026-05-29T13:54:01Z,House of the Dragon Season 3 | Official Final Trailer | HBO Max,House of the Dragon Season 3 | Official Final Trailer | HBO Max,HBO Max,UCx-KWLTKlB83hDI6UKECtJQ,24,Entertainment,"hbo max, hbo, hbo originals, hbo original series, hbo trailer, new on hbo, max, hbo max originals, hbo max trailer, hbo max teaser, hbo max series, hbo max youtube, house of the dragon, HOTD, Rhaenrya Targaryen, Daemon Targaryen, Aegon Targaryen, Alicent Hightower, game of thrones, Aemond Targaryen, Helaena Targaryen, Alys Rivers, Corlys Velaryon, Emma D'Arcy, Matt Smith, Olivia Cooke, Ormund Hightower, James Norton, A Song of Ice and Fire, Criston Cole, Fabien Frankel",31,https://i.ytimg.com/vi/0JlMjgqduVw/hqdefault.jpg,en,en,False,160,PT2M40S,hd,True,True,False,False,18173647,89018,4491
P3yf1Y_SltE,RS,2026-06-07T05:07:51.410546+00:00,2026-06-04T22:05:33Z,PUTUJEM SA PRIJATELJICOM,PUTUJEM SA PRIJATELJICOM,Cigvan Gaming,UCD8geOrSnzs_DrHIhgsufoA,24,Entertainment,,0,https://i.ytimg.com/vi/P3yf1Y_SltE/hqdefault.jpg,hr,hr,False,842,PT14M2S,hd,False,True,False,False,112842,1869,99
sxOnuYgbCyA,RS,2026-06-07T05:07:51.410557+00:00,2026-05-29T10:00:29Z,2soma - Cockta & Rum,2soma - Cockta & Rum,Bassivity Digital,UCtAE452wbBYJZASZ-3jCNBA,10,Music,,0,https://i.ytimg.com/vi/sxOnuYgbCyA/hqdefault.jpg,sr,sr,False,148,PT2M28S,hd,False,True,False,False,493976,9223,217
jLbst85USN8,RS,2026-06-07T05:07:51.410564+00:00,2026-05-28T14:53:06Z,Call of Duty: Modern Warfare 4 | Reveal Trailer,Call of Duty: Modern Warfare 4 | Reveal Trailer,Call of Duty,UC9YydG57epLqxA9cTzZXSeQ,20,Gaming,"call of duty, cod, activision, call of duty: modern warfare 4, modern warfare 4, mw4",6,https://i.ytimg.com/vi/jLbst85USN8/hqdefault.jpg,en,en,False,170,PT2M50S,hd,False,True,False,False,31246115,220331,22194
oUOMUIcFBQ0,RS,2026-06-07T05:07:51.410572+00:00,2026-06-05T11:00:39Z,UKRAO SAM BRATU NAJBOLJEG DUMPLINGA!!,UKRAO SAM BRATU NAJBOLJEG DUMPLINGA!!,Saurus Gaming,UCORo0ScZwNNH4gNn3rtBCpw,20,Gaming,,0,https://i.ytimg.com/vi/oUOMUIcFBQ0/hqdefault.jpg,hr,hr,False,1139,PT18M59S,hd,False,True,False,False,103797,2397,83
YYp0plMSQ70,RS,2026-06-07T05:07:51.410579+00:00,2026-06-01T14:34:13Z,SJELA BABA U BALON (TECHNO REMIX),SJELA BABA U BALON (TECHNO REMIX),VibesOnly,UCKI8WnM4EvHoKf9r5DVo7uw,10,Music,"sjela baba u balon, sjela baba u balon lyrics, sjela baba u balon reaction, sjela baba u balon song, sjela baba u balon tiktok song, sjela baba u balon tiktok, sjela baba u balon new song, sela baba u balon pesma, sela baba u balon original, sela baba u balon da se vozi u london, sela baba u balon techno, brojalica sjela baba u balon, sela baba u balon techno remix, sela baba u balon remix, sela baba u balon lyrics, sela baba u balon song, sjela baba u balon brojalica",17,https://i.ytimg.com/vi/YYp0plMSQ70/hqdefault.jpg,en,en,False,124,PT2M4S,hd,False,True,False,False,359423,3183,152
6XsEtyeEdag,RS,2026-06-07T05:07:51.410586+00:00,2026-05-29T14:00:02Z,The Knights of God | Trailer | ONE PIECE,The Knights of God | Trailer | ONE PIECE,ONE PIECE Official - ENG,UCwz6BWiifRgjPIVE8QdNEHA,1,Film & Animation,"#ONEPIECE, #KnightsofGod, #Shamrock, #Gunko, #Sommers, #Killingham, Trailer, Anime",8,https://i.ytimg.com/vi/6XsEtyeEdag/hqdefault.jpg,en-US,en,False,31,PT31S,hd,False,True,False,False,716084,16058,1479
gK0j5jAltNo,RS,2026-06-07T05:07:51.410594+00:00,2026-06-03T18:09:06Z,BIRAM ODJEĆU ZA DJEVOJČICE💅🏻🎀,BIRAM ODJEĆU ZA DJEVOJČICE💅🏻🎀,Leptirica,UC5wFYwc0W2Y6U3DXZHw4Ncg,24,Entertainment,"leptirica, ROBLOX BALKAN",2,https://i.ytimg.com/vi/gK0j5jAltNo/hqdefault.jpg,sh,sh,False,484,PT8M4S,hd,False,True,False,False,68732,5225,96
oI_QXa3fsgI,RS,2026-06-07T05:07:51.410601+00:00,2026-06-01T15:52:57Z,"ANDREANA ČEKIĆ - SPAVAJ, SREĆO MOJA (OFFICIAL VIDEO 2026)","ANDREANA ČEKIĆ - SPAVAJ, SREĆO MOJA (OFFICIAL VIDEO 2026)",Andreana Čekić Official Channel,UCd6B7zAL3Jg0XfhWgruJVoQ,24,Entertainment,"andreana, cekic, cipele, neraspolozena, nevreme, intervju, video, emisija, 300 svatova, blago suzama, tudja majica, kraljevi falsa, kraljica u zlatu, zauvek ti pripadam, do mene je, presveto i gresno, opasno me radis, rodjena da placem, ma samo me gledaj",19,https://i.ytimg.com/vi/oI_QXa3fsgI/hqdefault.jpg,sr,sr,False,179,PT2M59S,hd,False,True,False,False,778574,5464,271
mfUtseK27pc,RS,2026-06-07T05:07:51.410609+00:00,2026-05-27T16:00:01Z,Marvel Animation’s X-Men ‘97 Season 2 | Official Trailer,Marvel Animation’s X-Men ‘97 Season 2 | Official Trailer,Marvel Entertainment,UCvC4D8onUfXzvjTOM-dBfEA,24,Entertainment,"marvel, comics",2,https://i.ytimg.com/vi/mfUtseK27pc/hqdefault.jpg,en,en,False,119,PT1M59S,hd,True,True,False,False,3210985,142466,7815
K9T5nSmg-Ww,RS,2026-06-07T05:07:51.410616+00:00,2026-06-04T14:54:36Z,BEBA SLAVI ROĐENDAN U BROOKHAVENU!,BEBA SLAVI ROĐENDAN U BROOKHAVENU!,Larita,UC4kMfd4kpvWQMXl4pyIM15w,20,Gaming,"Larita, ItzLarita, Roblox, Gaming, Balkan, brookhaven, brookhavenrp, roblox, larita, itzlarita, beba, baby, birthday, birthdayparty, brookhavenstory, robloxstory, roleplay, brookhavenroleplay, robloxroleplay, familyroleplay, brookhavenfamily, emotional, cute, friendship, bestfriend, surpriseparty, birthdaysurprise, daycare, vrtic, gaming, robloxgaming, brookhavenkids, robloxkids, viral, trending, fyp, foryou, ytgaming, kidsgaming, srpskiyoutube, brookhavenserbia, roleplaystory, funnymoments, adorable, familyfriendly, robloxvideo",46,https://i.ytimg.com/vi/K9T5nSmg-Ww/hqdefault.jpg,sr,sr,False,661,PT11M1S,hd,False,True,False,False,38108,1358,348
M7bEXzUEoZg,RS,2026-06-07T05:07:51.410623+00:00,2026-05-19T13:03:33Z,Nucci - DVE BARBIKE (Official Video),Nucci - DVE BARBIKE (Official Video),Nucci,UCh2anqsd4zPD5kLwZbhjiSQ,10,Music,"nucci, dve barbike, generacija zed",3,https://i.ytimg.com/vi/M7bEXzUEoZg/hqdefault.jpg,sr,sr,False,169,PT2M49S,hd,True,True,False,False,1546767,10203,194
DKKZ10FsSBM,RS,2026-06-07T05:07:51.410630+00:00,2026-05-29T17:15:28Z,Official Trailer | BLEACH: Thousand-Year Blood War – The Calamity in Theatres June 25 | VIZ,Official Trailer | BLEACH: Thousand-Year Blood War – The Calamity in Theatres June 25 | VIZ,vizmedia,UCV1da9peoqEwqr45bpTJsbQ,1,Film & Animation,"viz media, anime, official, manga, bleach theaters, bleach in theaters, bleach thousand year blood war final part theaters, bleach tybw, bleach anime, anime bleach, bleach thousand year blood war the calamity, bleach final part, bleach subbed, yoruichi bleach, ichigo bleach, bleach japanese subbed, quincies, soul reapers, quincies vs soul reapers, soul reapers vs quincies, yhwach, ichigo vs yhwach, bleach limited theatrical run, bleach tybw part 4, bleach tybw part 4 final part",25,https://i.ytimg.com/vi/DKKZ10FsSBM/hqdefault.jpg,en,en,False,37,PT37S,hd,False,True,False,False,906150,23811,841
mzPemP8gxqQ,RS,2026-06-07T05:07:51.410638+00:00,2026-06-06T08:40:41Z,"OVA IGRA JE EXPLODIRALA , A JA SAM POSTAO NAJBOLJI!","OVA IGRA JE EXPLODIRALA , A JA SAM POSTAO NAJBOLJI!",MarkoKC,UCYcXicWbPZ-p2zQRStpYrEg,20,Gaming,"brawl stars, pjesma, KC, fortnite, marko kc, sarezza, MarkoKC, stronghold crusader, stronghold crusader gameplay, rts, strategy games, balkan",12,https://i.ytimg.com/vi/mzPemP8gxqQ/hqdefault.jpg,hr,hr,False,950,PT15M50S,hd,False,True,False,False,26217,694,73
g7Cs-zPaxuM,RS,2026-06-07T05:07:51.410645+00:00,2026-06-04T10:00:28Z,Tijana Bogicevic x Marcelo - Lek za bol (Official Video 2026),Tijana Bogicevic x Marcelo - Lek za bol (Official Video 2026),Tijana Bogicevic,UC0T5PW0p81fn-yN-aiuQVLg,10,Music,"tijana, bogicevic, marcelo, novo, novi spot, lek za bol, lek za bol 2026, marcelo tijana, bogicevic tijana marcelo, marcelo 2026 feat tijana, lek za bol official video, song, pesma, spot, tijana novi spot, marcelo tijan, marcelo lek za bol, lek za bol tijana, tijana lek za bol, marcelo tijana lek za bol, lek za bol novo, novi single, tijana lek, tijana bogicevic feat marcelo, novo 2026, tijana 2026",26,https://i.ytimg.com/vi/g7Cs-zPaxuM/hqdefault.jpg,en,sr,False,243,PT4M3S,hd,False,True,False,False,117401,3616,181
f_bKjZeJBBI,RS,2026-06-07T05:07:51.410653+00:00,2026-05-05T04:10:02Z,The Odyssey | Official New Trailer,The Odyssey | Official New Trailer,Universal Pictures,UCq0OueAsdxH6b8nyAspwViw,24,Entertainment,,0,https://i.ytimg.com/vi/f_bKjZeJBBI/hqdefault.jpg,en-US,en-US,False,152,PT2M32S,hd,True,True,False,False,24633196,328699,34589
eki7gwe_Pqc,RS,2026-06-07T05:07:51.410660+00:00,2026-06-06T09:00:13Z,Rage i Kovalski: BORBA U TERETANI NA SKYBLOCKU U Minecraftu! 💪🏝️⚔️,Rage i Kovalski: BORBA U TERETANI NA SKYBLOCKU U Minecraftu! 💪🏝️⚔️,Rage ,UC3tm6KUnDfP7z4h2yrzAPSw,20,Gaming,,0,https://i.ytimg.com/vi/eki7gwe_Pqc/hqdefault.jpg,en,sr,False,902,PT15M2S,hd,False,True,False,False,22188,570,90
mXBzBO2XK5g,RS,2026-06-07T05:07:51.410666+00:00,2026-06-06T10:00:13Z,BARBARA BOBAK - GOSPODJETINA (OFFICIAL VIDEO),BARBARA BOBAK - GOSPODJETINA (OFFICIAL VIDEO),Two Louder TV,UC4PH8eYaYobiEYxnciJnuvQ,10,Music,"barbara, bobak, gospodjetina, novo, novi spot, nova pesma, ep, ep 2026, barbara bobak 2026, barbara bobak 2026 novo, novi single, barbara biro bluda gospodjetina, gospodjetina biro bobak, bobak barbara, barbara bobak nove pesme, gospodjetina 2026, gospodjetina 2026 barbara, barbara bobak 2026 gospodja, gospodjetina 2026 bobak, bobak novo, bobak barbara album, bobak 2026, barbara pesme 2026, ep biro bluda",24,https://i.ytimg.com/vi/mXBzBO2XK5g/hqdefault.jpg,sr,sr,False,163,PT2M43S,hd,False,True,False,False,62544,1856,150
QdNmVWXuYec,RS,2026-06-07T05:07:51.410674+00:00,2026-06-06T00:27:34Z,"SUMMER GAME FEST 2026: Official 4K60FPS Livestream, (Resident Evil Veronica, FINAL FANTASY VII)","SUMMER GAME FEST 2026: Official 4K60FPS Livestream, (Resident Evil Veronica, FINAL FANTASY VII)",thegameawards,UCqDS7KWjAPKv-7ZSlro9OiQ,20,Gaming,"game awards, the game awards, gameplay, world premiere, video game awards, xbox, playstation, nintendo, summer game fest, sgf, tga, geoff keighley, game of the year, lucy games",14,https://i.ytimg.com/vi/QdNmVWXuYec/hqdefault.jpg,en,en,False,11259,PT3H7M39S,hd,True,True,False,False,10588632,146878,545
KJ7h-k2DRuA,RS,2026-06-07T05:07:51.410682+00:00,2026-05-29T10:00:06Z,VOYAGE X RASTA - HOTEL SA BALKANA (OFFICIAL VIDEO),VOYAGE X RASTA - HOTEL SA BALKANA (OFFICIAL VIDEO),IDJVideos.TV,UCcF7lkZqxzI2asePTbksVdA,10,Music,"idjvideos, pesme, pjesme",3,https://i.ytimg.com/vi/KJ7h-k2DRuA/hqdefault.jpg,sr,sr,False,133,PT2M13S,hd,False,True,False,False,371842,7709,188
fBrOvf-mSBM,RS,2026-06-07T05:07:51.410690+00:00,2026-06-03T18:30:17Z,Moje ime je BOND.. James Bond | 007: First Light #1,Moje ime je BOND.. James Bond | 007: First Light #1,Mudja,UCZbp-wYt5PiIkGmoEZ6ChmQ,20,Gaming,"Mudja, MudjaPlus",2,https://i.ytimg.com/vi/fBrOvf-mSBM/hqdefault.jpg,sr,sr,False,2422,PT40M22S,hd,False,True,False,False,45055,2682,128
UxBlY8SIA_M,RS,2026-06-07T05:07:51.410697+00:00,2026-05-12T16:00:22Z,Tea Tairović - Bonita (Official Video | Album Dominantna 2026),Tea Tairović - Bonita (Official Video | Album Dominantna 2026),Tea Tairovic,UCYo2cFsn4NyVH3BF5PfzDkw,10,Music,"tea, tairovic, hajde, novo, song, video, intervju, svetica, igracica, polako, bliznakinja, tea tairovic, otkad tebe znam, tea album, tea dominantna, tea tairovic dominantna, tea bonita, novi album, new album, new release, tea bonita album, bonita tea, bonita tea tairovic, tea novi album, tea album dominantna 2026, bonita pesma, nova pesma, milica pavlovic, aleksandra prijovic, ceca, seka aleksic, senidah, new song, tea novo, tea tairovic new, release, folk, tea pesme, tea mix, bonita",40,https://i.ytimg.com/vi/UxBlY8SIA_M/hqdefault.jpg,sr,sr,False,181,PT3M1S,hd,False,True,False,False,8010541,34221,2909
aSCttWd3o40,RS,2026-06-07T05:07:51.410704+00:00,2026-06-02T14:50:08Z,KO ZA 15 MINUTA NAPRAVI BOLJU GRAĐEVINU POBJEĐUJE! (BIH VS FRANCUSKA) *VARAMO*,KO ZA 15 MINUTA NAPRAVI BOLJU GRAĐEVINU POBJEĐUJE! (BIH VS FRANCUSKA) *VARAMO*,50N3,UCxDB-9Q-iNlkAWhRlqmBN1Q,20,Gaming,"50N3, Šone, Sone, ŠoneYT, Brawl Stars, Minecraft, Roblox, GTA V, Trending",9,https://i.ytimg.com/vi/aSCttWd3o40/hqdefault.jpg,hr,,False,1555,PT25M55S,hd,False,True,False,False,67108,2984,489
v-TY9nQDKvo,RS,2026-06-07T05:07:51.410713+00:00,2026-06-01T15:00:03Z,Nikola Rokvić - Svake mi se noći lumpuje,Nikola Rokvić - Svake mi se noći lumpuje,Nikola Rokvic,UCSwUy1Nre7MXS55LHxGTZtg,10,Music,"nikola rokvic, svake mi se noci lumpuje, ja stvarno ne znam sta mi je, enis beslagic, novo, 2026, nove pesme, oprosti mojoj mladosti, ja sam tvoj i kada spavam sa njom, s kim si me nocas varala, med i slatko grozdje, koliko sam usana poljubio, povredi me, al nema nas, zeljo moja, live, sava centar",17,https://i.ytimg.com/vi/v-TY9nQDKvo/hqdefault.jpg,sr,sr,False,233,PT3M53S,hd,False,True,False,False,737686,11840,599
GSSCphQGRJw,RS,2026-06-07T05:07:51.410721+00:00,2026-06-04T17:00:32Z,KO SU PRAVI LUKA I LUNA???,KO SU PRAVI LUKA I LUNA???,Mata,UCtn42_D9vz1jDAhtbPShMtQ,20,Gaming,"Minecraft, minecraft, Mata, mata, SuperMax, supermax, luna, Luna, majnkraft, minecraft mod, luka, Luka, mod, brainrot, 99 noci, drugari, Drugari",17,https://i.ytimg.com/vi/GSSCphQGRJw/hqdefault.jpg,sr,sr,False,1318,PT21M58S,hd,False,True,False,False,34103,823,33
jbydVynEnxM,RS,2026-06-07T05:07:51.410728+00:00,2026-05-22T10:00:06Z,Bass & Rave,Bass & Rave,Jala Brat - Topic,UCiBgpunlajbeuwlpwD0EurQ,10,Music,"Jala Brat, Buba Corelli, Bass & Rave",3,https://i.ytimg.com/vi/jbydVynEnxM/hqdefault.jpg,en,sr,False,130,PT2M10S,hd,False,True,False,False,646120,4093,0
NT2Is90lFoI,RS,2026-06-07T05:07:51.410735+00:00,2026-06-03T13:00:35Z,Unstable SMP: Civil War FINALE,Unstable SMP: Civil War FINALE,Parrot,UCPLMPHT-d8GZOqL_AHJFdQQ,20,Gaming,"Minecraft, Minecraft SMP, SMP, Minecraft Server, LifeSteal SMP, School Minecraft Server, School SMP, School Parrot, Parrot, ParrotX2, Dream SMP, TommyInnit, LifeSteal, parrot lifesteal smp, Spoke, minecraft survival, minecraft hardcore, minecraft challenge, minecraft server, HermitCraft, MumboJumbo, Grian, why i broke 100+ bedrock, Here's Why I Made 12240 Minecraft Cakes, Minecraft Hunt, LifeSteal Season 3, 1 Heart Minecraft, LifeSteal Season 4, Why I Removed the World",29,https://i.ytimg.com/vi/NT2Is90lFoI/hqdefault.jpg,en,en,False,4675,PT1H17M55S,hd,False,True,False,False,3812623,178875,34490
Nx9932BjWcI,RS,2026-06-07T05:07:51.410743+00:00,2026-05-22T15:00:06Z,Senidah - Sve To Sam Ja (Official Video),Senidah - Sve To Sam Ja (Official Video),Senidah,UCoj4v3N2C8wKQTmMkW_kibg,10,Music,"senidah, sladjana, misici, mišići, atlas erotika, cazzafura, belo, bez tebe, jala brat, buba, sve to sam ja, breskvica, raf camora, afro, afrobeats, level, behute, 100posto, 100, buba corelli, devito, nikolija, balkans, balkan, Elena, doja cat, u meni je sunce, sanama",28,https://i.ytimg.com/vi/Nx9932BjWcI/hqdefault.jpg,en,sr,False,264,PT4M24S,hd,False,True,False,False,453099,6074,303
U0r5fUYCPFs,RS,2026-06-07T05:07:51.410751+00:00,2026-06-06T14:00:38Z,"KO ZA 20 MINUTA ZARADI VIŠE PARA U BEOGRADU POBJEĐUJE! *ZARADIO 1 MILION""","KO ZA 20 MINUTA ZARADI VIŠE PARA U BEOGRADU POBJEĐUJE! *ZARADIO 1 MILION""",Imperator FX,UCnvD039Yr0_zBO7xgItSnMw,20,Gaming,"Impe, ImperatorFX, Imperator FX, Imperator, ImpeFX, Impe FX, minecraft, minecraftprezivljavanje, mc prezivljavanje, impe, mapa, creative, impefortnite, impefortnajt, vodeno prezivljavanje, vodeno, minecraftvodeno, prez, gtapropisi, gta po propisima, gta5, gta5 po pravilima, impe po propisima, minecraft impe, ostrvo, prezivljavanje impe, majnkraft, bazen, kuca, auto, bloxburg, adopt me, porodicne, avanture, roblox, impe roblox, impe bloxburg, imperator roblox, zooba, impe brawl stars, impe zooba",41,https://i.ytimg.com/vi/U0r5fUYCPFs/hqdefault.jpg,hr,en,False,1442,PT24M2S,hd,False,True,False,False,16940,1304,111
iijwOgZsQZw,RS,2026-06-07T05:07:51.410759+00:00,2026-05-25T10:00:02Z,ZORANA MIĆANOVIĆ - UDAĆU SE OVE GODINE | OFFICIAL VIDEO 2026,ZORANA MIĆANOVIĆ - UDAĆU SE OVE GODINE | OFFICIAL VIDEO 2026,Zorana Mićanović ,UCKkn25Q4mRlEOhs8EPWvj2Q,10,Music,"Zorana Mićanović, Zorana Micanovic, Udaću se ove godine, Udacu se ove godine, Zorana Mićanović Udaću se ove godine, Zorana Micanovic Udacu se ove godine, official video 2026, Zorana official video, nova pesma 2026, nove pesme 2026, balkan music, folk muzika, narodna muzika, pop folk, balkan hitovi, novi spot, Zorana novi spot, official music video, Udaću se ove godine spot, Zorana premijera, Zorana Micanovic official, Zorana Mićanović spot, udacu se ove godine 2026",23,https://i.ytimg.com/vi/iijwOgZsQZw/hqdefault.jpg,sr,sr,False,185,PT3M5S,hd,False,True,False,False,1167601,5061,258
LibHJzLETV0,RS,2026-06-07T05:07:51.410767+00:00,2026-06-02T15:00:13Z,Od SIROMAŠNIH Do BOGATAŠA u Robloxu!,Od SIROMAŠNIH Do BOGATAŠA u Robloxu!,Luka,UC02CEs1zhwGVoB3W6sj1zEA,20,Gaming,"minecraft, lunailuka, lukailuna, luna, luka, luna minecraft, luka minecraft",7,https://i.ytimg.com/vi/LibHJzLETV0/hqdefault.jpg,sr,sr,False,917,PT15M17S,hd,False,True,False,False,39175,2129,59
dyGXtUhqPTc,RS,2026-06-07T05:07:51.410774+00:00,2026-05-28T10:05:32Z,Cockta & Rum,Cockta & Rum,2soma - Topic,UCn4zrJm5fmHGLqsAnR5gHMA,10,Music,"2soma, Cockta & Rum",2,https://i.ytimg.com/vi/dyGXtUhqPTc/hqdefault.jpg,en,,False,133,PT2M13S,hd,False,True,False,False,139773,2447,0
AP1xJAqlGS4,RS,2026-06-07T05:07:51.410782+00:00,2026-06-06T20:49:34Z,IEM Cologne Major 2026 - Stage 2 - FUT vs TYLOO | G2 vs Monte | BB vs GL | Spirit vs MIBR,IEM Cologne Major 2026 - Stage 2 - FUT vs TYLOO | G2 vs Monte | BB vs GL | Spirit vs MIBR,TV Arena Esport,UC61WNEK07Mjo2SzlJnvFH4Q,20,Gaming,"esl, csgo, live, arena, arenaesport",5,https://i.ytimg.com/vi/AP1xJAqlGS4/hqdefault.jpg,sr,sr,False,36163,PT10H2M43S,hd,False,True,False,False,33354,629,0
G4-HwKvBjJ0,RS,2026-06-07T05:07:51.410789+00:00,2026-06-02T09:59:14Z,MILICA JOKIC - NOC ZA BRODOLOM (OFFICIAL VIDEO 2026),MILICA JOKIC - NOC ZA BRODOLOM (OFFICIAL VIDEO 2026),Milica Jokic,UCzJaqnisSkRYrFiOr9-XiZg,10,Music,,0,https://i.ytimg.com/vi/G4-HwKvBjJ0/hqdefault.jpg,sr,sr,False,207,PT3M27S,hd,False,True,False,False,1075352,1610,131
sxD1QvEGo0s,RS,2026-06-07T05:07:51.410796+00:00,2026-06-06T11:07:35Z,POČEO LOV NA ČITERE KONAČNO | CS2 Overwatch #1,POČEO LOV NA ČITERE KONAČNO | CS2 Overwatch #1,Deni TV,UCFvzsUCd3jJ811hdr5AYNVQ,20,Gaming,"deni, deni tv, csgo, cs2, overwatch, lov na citere, srbija, serbia, balkan, smesno, citeri, cheater, wallhack, aimbot, competitive, premier, faceit, reakcija",18,https://i.ytimg.com/vi/sxD1QvEGo0s/hqdefault.jpg,sr,sr,False,1585,PT26M25S,hd,False,True,False,False,12810,962,74
ZlDVz84xavY,RS,2026-06-07T05:07:51.410803+00:00,2026-06-03T10:00:50Z,Marina Visković - Lesi (Official Video 2026),Marina Visković - Lesi (Official Video 2026),Marina Viskovic Official,UCF4zafZb9eiWBcYJA_L3P9w,10,Music,"alisa u zemlji cuda, pogresan raj, sta ti vredi, ja sam nista, Voli me, Litar krvi, Bez duse, Necu bez tebe, Gde si ti, Gde sam gresila, marina, viskovic, lesi, lesi marina viskovic, lesi marina viskovic 2026, lesi official video, lesi spot, lesi pesma, lesi viskovic marina, marina viskovic lesi 2026, lesi 2026 viskovic marina, marina viskovic spot, marina viskovic pesma, lesi new, video, release, lesi viskovic, tea tairovic, milica pavlovic, prijovic, mladenovic, aleksandra",32,https://i.ytimg.com/vi/ZlDVz84xavY/hqdefault.jpg,sr,sh,False,205,PT3M25S,hd,False,True,False,False,187977,969,67
nBLM9au7m5A,RS,2026-06-07T05:07:51.410811+00:00,2026-06-02T08:15:11Z,ŠPIJUNIRAM POZNATE FUDBALERE U GTA 5...,ŠPIJUNIRAM POZNATE FUDBALERE U GTA 5...,Danči,UC7Y-C7E6wrmlYOPrW7hxxRA,24,Entertainment,"impe pesme, braco i dragan, gta 5 zezanje, danci i tata gta, sini27 minecraft, danci gta, bloodmaster prezivljavanje, smigicka, roblox, brainrot, vuk i aleksandra, blodek, danči golf 2, novke i danci, beograd danči, imperator fx trke, danči bogati roditelji, luna minecraft, zobra minecraft, danci ubica, novke 99 noći, danči špijuniram, larita danči, gta 5, izgubio dedu, kofs nogometaš, impe prvenstvo, danči ronaldo, komšinica, larita beba, novke detektivi, fudbal, balkan",33,https://i.ytimg.com/vi/nBLM9au7m5A/hqdefault.jpg,sr,zxx,False,716,PT11M56S,hd,False,True,False,False,53951,1620,261
vrY1THC_NQE,RS,2026-06-07T05:07:51.410819+00:00,2026-06-01T15:00:06Z,IShowSpeed - World Cup (Champions) [Official Music Video],IShowSpeed - World Cup (Champions) [Official Music Video],IShowSpeed,UCWsDFcIhY2DBi3GB5uykGXA,20,Gaming,"ishowspeed, world cup",2,https://i.ytimg.com/vi/vrY1THC_NQE/hqdefault.jpg,en,en,False,299,PT4M59S,hd,False,False,False,False,28460358,2368812,142565
aMnuZ-hKGsg,RS,2026-06-07T05:07:51.410826+00:00,2026-05-27T13:15:18Z,PRAVIM BEBA ZOO VRT U MINECRAFTU,PRAVIM BEBA ZOO VRT U MINECRAFTU,zZzZOBRA,UCoRySXI-vMRIYBmDllxJQRA,20,Gaming,"zzzzobra, zobra, minecraft, zoo vrt, zivotinje, bebe zivotinje",6,https://i.ytimg.com/vi/aMnuZ-hKGsg/hqdefault.jpg,sr,sr,False,1435,PT23M55S,hd,False,True,False,False,117715,4175,96
0e1ZLGlVW7Y,RS,2026-06-07T05:07:51.410833+00:00,2026-06-06T10:59:44Z,SAJFER X SLOBA RADANOVIC - KRUG (Album Van Kontrole Part 1),SAJFER X SLOBA RADANOVIC - KRUG (Album Van Kontrole Part 1),KODEKS,UCe8X8pwWcFLt7IwgNQjlKxg,24,Entertainment,,0,https://i.ytimg.com/vi/0e1ZLGlVW7Y/hqdefault.jpg,hr,bs,False,132,PT2M12S,hd,False,True,False,False,47813,2078,123
