video_id,country,fetched_at,published_at,title,localized_title,channel_title,channel_id,category_id,category_name,tags,tag_count,thumbnail,default_language,audio_language,is_live,duration,duration_raw,definition,caption_available,licensed_content,embeddable,made_for_kids,views,likes,comments
qdqlhDn29Cc,PY,2025-12-11 02:28:58.407124+00:00,2025-12-01 14:01:34+00:00,Shakira - Soltera (Letra/Lyrics),Shakira - Soltera (Letra/Lyrics),Royal Music,UCrC_ZFYISEAUuCu00y52Evg,10,Music,"soltera, soltera letra, letra soltera, soltera lyrics, lyrics soltera, shakira soltera, soltera shakira, shakira soltera letra, letra shakira soltera, shakira letra, letra shakira, shakira letra soltera, soltera letra shakira, letra soltera shakira, soltera shakira letra, shakira soltera lyrics, se pasa rico soltera, Yo tengo derecho de portarme mal pa' pasarla bien, Estoy suelta y ahora puedo hacer lo que quiera, Se pasa rico soltera, Se pasa rico soltera ah ah ah",21,https://i.ytimg.com/vi/qdqlhDn29Cc/hqdefault.jpg,es,en,False,215,PT3M35S,hd,False,True,,,191993,307,3
CrP1VnsYsZk,PY,2025-12-11 02:28:58.407131+00:00,2025-12-10 17:25:41+00:00,He COMPRADO una MANSIÓN de 20.000.000$ en GTA 5 Online,He COMPRADO una MANSIÓN de 20.000.000$ en GTA 5 Online,DaniRep | +6 Vídeos Diarios De GTA 5 Online!,UCHIwQiZhIn6fm5b_IilqBbQ,20,Gaming,"danirep, gta v, gta 5 online, mega rampa, carrera gta 5 online, carrera troll, todos contra mi, cara a cara",8,https://i.ytimg.com/vi/CrP1VnsYsZk/hqdefault.jpg,es,es-ES,False,2710,PT45M10S,hd,False,True,,,116024,9199,294
2yGZPCjtGJ8,PY,2025-12-11 02:28:58.407138+00:00,2025-12-05 00:00:08+00:00,Paulo Londra - 1% (feat. Eladio Carrión) [Official Video],Paulo Londra - 1% (feat. Eladio Carrión) [Official Video],Paulo Londra,UCzI7wZyqk7jpXWT_MILjepw,10,Music,"Paulo Londra, Eladio Carrión, Eladio Carrion, Boxeo, Laveladadelaño, Paulo Londra nuevo video, Eladio Carrión nuevo tema, Paulo Londra videoclip oficial, latin trap, trap latino, urban latin, hip hop latino, rap latino, reggaeton trap, música urbana, Bad Bunny, Anuel AA, Myke Towers, Feid, Duki, Nicki Nicole, Trueno, Bizarrap, YSY A, Neo Pistea, Tiago PZK, Cazzu, Rauw Alejandro, J Balvin, Karol G, Mora, Quevedo, Nicky Jam, Ñengo Flow, Arcángel, Young Miko, milo j",37,https://i.ytimg.com/vi/2yGZPCjtGJ8/hqdefault.jpg,es,es-419,False,244,PT4M4S,hd,False,True,,,1350969,117456,5296
b6XekIWhqCg,PY,2025-12-11 02:28:58.407146+00:00,2025-12-10 20:00:38+00:00,VENDIENDO LOMITOS A DOPPELGANGERS...,VENDIENDO LOMITOS A DOPPELGANGERS...,Sebaspod,UCidOo3WEbQ5zr5gFC2e5tnw,20,Gaming,Sebaspod,1,https://i.ytimg.com/vi/b6XekIWhqCg/hqdefault.jpg,es,es-419,False,840,PT14M,hd,False,True,,,2891,263,30
Y2PR8UYcabs,PY,2025-12-11 02:28:58.407153+00:00,2025-11-29 20:30:06+00:00,Romeo Santos - Imitadora (Letra/Lyrics),Romeo Santos - Imitadora (Letra/Lyrics),nostalgia lyrics.,UCaxjS8mdF402rdn1hP6_1_Q,10,Music,,0,https://i.ytimg.com/vi/Y2PR8UYcabs/hqdefault.jpg,es,es,False,236,PT3M56S,hd,False,True,,,963152,1369,14
RJE5EGOEWcA,PY,2025-12-11 02:28:58.407160+00:00,2025-12-10 22:16:24+00:00,"Mineraft pero Eres SORDO, MUDO o CIEGO!","Mineraft pero Eres SORDO, MUDO o CIEGO!",xTurbo,UCeOrlSK-mWTZjB66O9ttHpg,20,Gaming,"xturboo, xturbo, xturboo_, turbo minecraft, Minecraft, Mineraft pero Eres SORDO, MUDO o CIEGO! Mineraft pero Eres Sordo, Mudo o Ciego en un Solo Bloque! SORDO, MUDO o CIEGO en Minecraft!",9,https://i.ytimg.com/vi/RJE5EGOEWcA/hqdefault.jpg,es,es,False,1236,PT20M36S,hd,False,True,,,70725,2045,180
udFsogly8Us,PY,2025-12-11 02:28:58.407167+00:00,2025-12-04 22:50:53+00:00,JLEXIS X MICHAEL FLORES X SHADOW BLOW X ALOFOKE MUSIC - ME TOCO VERTE BRILLAR,JLEXIS X MICHAEL FLORES X SHADOW BLOW X ALOFOKE MUSIC - ME TOCO VERTE BRILLAR,AlofokeMusicSounds,UCeDlzhpU8NZAlL1rsXp54zQ,10,Music,"Bad Bunny, Dembow, Reggaeton, Karol G, Anuel AA, Trap, Rap, Salsa, Merengue, Feid, Santiago Matias, W Sound, Rochy RD, Yailin La Mas Viral, El Alfa, Bulin 47, Romeo Santos, Anthony Santos",18,https://i.ytimg.com/vi/udFsogly8Us/hqdefault.jpg,es,es,False,184,PT3M4S,hd,False,True,,,5444562,311666,23533
