video_id,country,fetched_at,published_at,title,localized_title,channel_title,channel_id,category_id,category_name,tags,tag_count,thumbnail,default_language,audio_language,is_live,duration,duration_raw,definition,caption_available,licensed_content,embeddable,made_for_kids,views,likes,comments
rABMrhvtfCY,PY,2025-12-11 02:28:58.406769+00:00,2025-12-04 17:07:48+00:00,Beéle - Quédete (Letra),Beéle - Quédete (Letra),Alligator Lyrics,UC0Nd9eBGpXJ7Cvz_ncLsvvA,10,Music,#Beéle #Letra,1,https://i.ytimg.com/vi/rABMrhvtfCY/hqdefault.jpg,es,es,False,177,PT2M57S,hd,False,True,,,518743,554,2
lwZm7i4Vduw,PY,2025-12-11 02:28:58.406806+00:00,2025-12-09 20:02:06+00:00,REACCIONANDO A TRAILERS FUNABLES DE DISNEY #3 🤡,REACCIONANDO A TRAILERS FUNABLES DE DISNEY #3 🤡,Speak,UCSVEca5R1X6bMjrzV0jIlwg,24,Entertainment,"REACCIONANDO A TRAILERS FUNABLES DE DISNEY 🤡, reaccionando, trailers, funables, de, disney, meme, memes, comedia, entretenimiento, johan speak, johan, speak, reaccionando a trailers, trailers funables de disney, trailers de disney con ia, parte 2, segunda parte, #2, parte 3, #3",21,https://i.ytimg.com/vi/lwZm7i4Vduw/hqdefault.jpg,es,es,False,717,PT11M57S,hd,False,True,,,252517,16858,560
n8hpslgr_ic,PY,2025-12-11 02:28:58.406818+00:00,2025-12-10 19:19:14+00:00,Todos los Bloques dan COCHES REALES en Minecraft!,Todos los Bloques dan COCHES REALES en Minecraft!,Dagar,UCEs5MQjXJq27-X2vgdwtYDw,20,Gaming,"Minecraft, minecraft mod, dagar y nacho, nacho y dagar, amigos minecraft, dagar minecraft, minecraft dagar",7,https://i.ytimg.com/vi/n8hpslgr_ic/hqdefault.jpg,es,es-ES,False,1533,PT25M33S,hd,False,True,,,400441,6397,383
g5YnpWRgCks,PY,2025-12-11 02:28:58.406826+00:00,2025-12-04 17:00:06+00:00,Prince Royce - El Amor Que Perdimos (Letra),Prince Royce - El Amor Que Perdimos (Letra),Scribella,UCsx0hdXoufYIHs73dVtDpog,22,People & Blogs,,0,https://i.ytimg.com/vi/g5YnpWRgCks/hqdefault.jpg,es,es,False,246,PT4M6S,hd,False,True,,,515331,823,3
Fv0leN8TmR8,PY,2025-12-11 02:28:58.406835+00:00,2025-12-07 00:00:04+00:00,The Boys - Final Season Teaser Trailer | Prime Video,The Boys - Final Season Teaser Trailer | Prime Video,Prime Video,UCQJWtTnAHhEG5w4uN0udnUQ,24,Entertainment,"the boys, the boys season 5, the boys s5, the boys season 5 trailer, the boys season 5 teaser, the boys s5 trailer, the boys s5 teaser, the boys soldier boy, the boys homelander, the boys butcher, homelander, butcher, soldier boy, starlight, hughie, homelander vs butcher, butcher vs homelander, homelander vs soldier boy, the boys final season, the boys final season trailer, antony starr, karl urban, jensen ackles, erin moriarty, jack quaid, chace crawford, jared padalecki",27,https://i.ytimg.com/vi/Fv0leN8TmR8/hqdefault.jpg,en,en,False,121,PT2M1S,hd,True,True,,,7764454,320441,16981
Ttn6TzM6Wk4,PY,2025-12-11 02:28:58.406843+00:00,2025-12-10 19:15:04+00:00,NUNCA DESCARGUES ESTAS APLICACIONES PERDIDAS 😱💀,NUNCA DESCARGUES ESTAS APLICACIONES PERDIDAS 😱💀,ChuuyMine,UCrPWiqy4AmzFruDvWONex6w,20,Gaming,"NUNCA DESCARGUES ESTAS APLICACIONES PERDIDAS 😱💀, NUNCA DESCARGUES ESTAS APLICACIONES PERDIDAS, NUNCA DESCARGUES ESTAS APLICACIONES, APLICACIONES PERDIDAS, NUNCA DESCARGUES, chuuymine, nunca descargues estas aplicaciones chuuymine, chuuymine nunca descargues estas aplicaciones, aplicaciones perdidas chuuymine, chuuymine aplicaciones perdidas",10,https://i.ytimg.com/vi/Ttn6TzM6Wk4/hqdefault.jpg,es,es,False,1651,PT27M31S,hd,False,True,,,274920,11227,591
T9Ha6K6SAb0,PY,2025-12-11 02:28:58.406851+00:00,2025-12-07 23:00:38+00:00,"Wisin & Yandel, ROSALÍA - Besos Moja2 (Letra)","Wisin & Yandel, ROSALÍA - Besos Moja2 (Letra)",Chilleando Beats,UCpnegD7S8Iuv_4rh22B4Srg,10,Music,"rosalia besos moja2 letra, besos moja2 rosalia letra, wisin x yandel x rosalia besos moja2 letra, besos moja2 wisin x yandel x rosalia letra, wisin yandel rosalia besos moja2, besos moja2 wisin yandel rosalia, besos mojados letra wisin y yandel rosalia, wisin&yandel rosalia besos moja2 letra, besos moja2 rosalia wisin yandel, wisin yandel besos moja2 letra, wisin y yandel besos moja2 letra, besos moja2 wisin y yandel letra, wisin x yandel x rosalia besos moja2",13,https://i.ytimg.com/vi/T9Ha6K6SAb0/hqdefault.jpg,es,es,False,230,PT3M50S,hd,False,True,,,234311,255,2
8cnxm6_G8D0,PY,2025-12-11 02:28:58.406859+00:00,2025-12-07 00:10:49+00:00,THE BOYS Temporada 5 Tráiler Español Latino (2026),THE BOYS Temporada 5 Tráiler Español Latino (2026),ONE Media Español,UCcVNDl7ZJMf9lC9a34CY4RA,1,Film & Animation,"Tráiler, Película, Español, Latino, 2026, The Boys, The Boys temporada 5, The Boys temporada 5 Tráiler, Homelander, Butcher, Final",11,https://i.ytimg.com/vi/8cnxm6_G8D0/hqdefault.jpg,es,es,False,130,PT2M10S,hd,False,True,,,445644,20379,1466
hCmlC5YTUQk,PY,2025-12-11 02:28:58.406867+00:00,2025-12-10 10:01:14+00:00,الرجل العنكبوت انقاذ باتمان Spider-Man Rescue batman vs iron man vs venom funny Game GTA 5 superhero,الرجل العنكبوت انقاذ باتمان Spider-Man Rescue batman vs iron man vs venom funny Game GTA 5 superhero,RAIZER,UCRaZHgZDqy0pzKnZze1EcIA,20,Gaming,,0,https://i.ytimg.com/vi/hCmlC5YTUQk/hqdefault.jpg,ar,ar,False,1318,PT21M58S,hd,False,True,,,1817928,121117,1065
LenBa0yOAus,PY,2025-12-11 02:28:58.406874+00:00,2025-12-10 22:00:07+00:00,KAROL G - La PremiEre,KAROL G - La PremiEre,KarolGVEVO,UCz9yS18zJGQObwUL_K-ICnw,10,Music,"karol, karolg, bichota, si antes te hubiera conocido, sathc, latina foreva, latina forever, ivonny bonita, la reina presenta, papasito, dile luna, cuando me muera te olvido, cmmto, coleccionando heridas, marco antonio solis, el buki, un gatito me llamo, amiga mia, bandida entrenada, ese hombre es malo, su boca la amo, verano rosa, feid, no puedo vivir sin el, tu perfume, fkn movie, mariah angeliq, se puso linda, viajando por el mundo, manu chao, tropicoqueta",31,https://i.ytimg.com/vi/LenBa0yOAus/hqdefault.jpg,sk,es,False,2908,PT48M28S,hd,False,True,,,91251,15074,1722
VI6XO8EijT4,PY,2025-12-11 02:28:58.406881+00:00,2025-12-05 20:00:28+00:00,DIGITAL CIRCUS EP 7 TRAILER!!,DIGITAL CIRCUS EP 7 TRAILER!!,GLITCH,UCn_FAXem2-e3HQvmK-mOH4g,1,Film & Animation,"glitch, glitch productions, digital circus, the amazing digital circus, murder drones, Pomni, Uzi, Jax, Ragatha, Kinger, Gangle, Zooble, Caine, Bubble, 3D, Animation, 3D Animation, Indie Animation, Gummigoo",19,https://i.ytimg.com/vi/VI6XO8EijT4/hqdefault.jpg,en,en,False,58,PT58S,hd,True,True,,,8181502,591968,32752
EcF_vsxs6QU,PY,2025-12-11 02:28:58.406889+00:00,2025-12-09 23:00:17+00:00,Foxy en Hello Neighbor me ROMPIÓ el JUEGO 🤯,Foxy en Hello Neighbor me ROMPIÓ el JUEGO 🤯,RobleisIUTU,UCG8eSYvOQUpb9HM8zU5d6xg,20,Gaming,"robleis, robleisiutu, risa, funny, top, videos graciosos, recopilacion, clips, reaccion, juego, mejores momentos, record, reaccionando, best moments, nueva skin, nueva arma, actualizacion, como mejorar, como ganar, trucos, tips, consejos, fails, si me rio, gameplay, español, terror, hello neighbor, fredbear, mod, foxy, bonnie, five nights at freddys",33,https://i.ytimg.com/vi/EcF_vsxs6QU/hqdefault.jpg,es,es,False,4025,PT1H7M5S,hd,False,True,,,810958,36152,1276
FgNljD96bIw,PY,2025-12-11 02:28:58.406897+00:00,2025-12-06 19:57:04+00:00,"Escápate Conmigo - Wisin, Ozuna (Letra/Lyrics)","Escápate Conmigo - Wisin, Ozuna (Letra/Lyrics)",imferse - ,UCiDzN_KnO_cQ1ss1Y1gxb5g,10,Music,"ozuna, wisin, escapte conmigo, escápate conmigo, letra escapate conmigo, escapate conmigo letra, wisin y ozuna espate conmigo, yo quiero que conmigo tu te escpaes, escapate conmigo esta noche bebe, escapate conmigo esta noche letra, letra escapate conmigo wisin, ozuna escapate conmigo, escapate conmigo ozuna, ozuna letra escapate conmigo, escpate conmigo ozuna letra, Lyrics escapate conmigo, Escapate conmigo lyrics, escapate conmigo lyrics, escápate conmigo official video",19,https://i.ytimg.com/vi/FgNljD96bIw/hqdefault.jpg,es,es,False,233,PT3M53S,hd,False,True,,,145081,314,3
XRRnP91SSrQ,PY,2025-12-11 02:28:58.406904+00:00,2025-12-05 16:00:21+00:00,Welcome Home | Poppy Playtime Chapter 5 Cinematic Trailer,Welcome Home | Poppy Playtime Chapter 5 Cinematic Trailer,Mob Entertainment,UCXqV4yoyC_mmZye6VbKFPeQ,20,Gaming,,0,https://i.ytimg.com/vi/XRRnP91SSrQ/hqdefault.jpg,en,en,False,58,PT58S,hd,True,True,,,3492660,223714,16357
XiLzau7uz64,PY,2025-12-11 02:28:58.406911+00:00,2025-12-10 18:00:43+00:00,EXAMEN DE ROBA UN BRAINROT CON LOS BROS!🤓,EXAMEN DE ROBA UN BRAINROT CON LOS BROS!🤓,ElAbrahaham,UColTsB6zogXWooPbeO67Wgw,20,Gaming,"abrahahamflores, stream, entretenimiento, divertido, risa, gracioso, gamer, videojuegos, elabrahaham, copilacion, videos graciosos, antes vs ahora, mexico vs usa, abrahaham, directos, shorts, tiktoks, streams, twitch, reaccion, reacciones",21,https://i.ytimg.com/vi/XiLzau7uz64/hqdefault.jpg,es-MX,es-419,False,1786,PT29M46S,hd,False,True,,,362586,15397,1469
4BXIuQWhrZ8,PY,2025-12-11 02:28:58.406918+00:00,2025-12-05 00:00:09+00:00,La T y La M - Soy Favela (Official Audio),La T y La M - Soy Favela (Official Audio),LaTylaMVEVO,UCXcsKdrbTvvmkU318E7ombA,10,Music,"Cumbia Argentina, Emotional, La La, Rebellious, Soy Favela",5,https://i.ytimg.com/vi/4BXIuQWhrZ8/hqdefault.jpg,es,es,False,168,PT2M48S,hd,False,True,,,488779,8473,287
4VEUDDf-uUg,PY,2025-12-11 02:28:58.406925+00:00,2025-12-10 18:44:59+00:00,CELYNNEI ESTÁ ENAMORADA DE MÍ??,CELYNNEI ESTÁ ENAMORADA DE MÍ??,Soy Nabi,UCSZeDjj0xQd7XTa7OoklqVA,20,Gaming,"nabi, nabi roblox, soynabi, soy nabi, soy nabi y santi, nabi y santi, nabi y celynnei, nabi roblox celynnei, nabi y santi juegan, nabi y celynnei juegan, nabi juegos roblox, nabi juega obbys roblox, obby roblox, historias de roblox, ships de roblox, historias de amor roblox, roblox historias, brookhaven historias roblox, roblox historias ships, nabi y santi se concen, nabi y santi se conocen en la vida real, historias de amor de roblox, historias de terror de roblox",23,https://i.ytimg.com/vi/4VEUDDf-uUg/hqdefault.jpg,es,zxx,False,862,PT14M22S,hd,False,True,,,158154,16203,1414
ItkeSSU1VG8,PY,2025-12-11 02:28:58.406932+00:00,2025-12-09 17:03:05+00:00,Zion & Lennox - La Player (Bandolera) (Letra) | si hasta la luz se apaga sola,Zion & Lennox - La Player (Bandolera) (Letra) | si hasta la luz se apaga sola,jostland.,UC1qMwcumipfgTLd3TA1vVZg,10,Music,"la player bandolera, la player bandolera letra, la player bandolera zion y lennox, la player bandolera remix, la player bandolera zion y lennox letra, la player bandolera karaoke, zion y lennox la player, zion y lennox la player letra, zion y lennox la player bandolera, zion y lennox la player audio, si hasta la luz se apaga sola, si hasta la luz se apaga sola letra, si hasta la luz se apaga sola remix, letra, lyrics, audio, tiktok, trend, video oficial, hd, hq, topic, jostland",23,https://i.ytimg.com/vi/ItkeSSU1VG8/hqdefault.jpg,es,es,False,250,PT4M10S,hd,False,True,,,65871,148,4
XjqCNd3h6dI,PY,2025-12-11 02:28:58.406940+00:00,2025-12-10 18:23:28+00:00,EL BEBE AMARILLO REGRESO PEOR QUE NUNCA!!,EL BEBE AMARILLO REGRESO PEOR QUE NUNCA!!,JuegaGerman,UCYiGq8XF7YQD00x7wAd62Zg,20,Gaming,"juegagerman, juega, german, holasoygerman, hola soy german, juega german, baby in yellow, baby in yellow crown childcare, crown childcare, terror, miedo, horror",12,https://i.ytimg.com/vi/XjqCNd3h6dI/hqdefault.jpg,es-419,es-419,False,3684,PT1H1M24S,hd,False,True,,,225465,15202,1098
SKEbq50vknM,PY,2025-12-11 02:28:58.406947+00:00,2025-12-07 03:00:06+00:00,Eros Ramazzotti - Otra Como Tú (Letra),Eros Ramazzotti - Otra Como Tú (Letra),Pulso Latino,UCytFQMZQhb0kfEIARX_fdHw,10,Music,"pulso latino, pulso latino rock, pulso latino letras, soda stereo letras, los fabulosos cadillacs, los autenticos decadentes, gustavo cerati, rock nacional, rock argentino, rock latino, letras de rock nacional, letras de rock en español, rock in spanish, rock argentinian",14,https://i.ytimg.com/vi/SKEbq50vknM/hqdefault.jpg,es,es,False,281,PT4M41S,hd,False,True,,,414768,1029,15
cZNHP3ESAlQ,PY,2025-12-11 02:28:58.406954+00:00,2025-12-10 21:32:27+00:00,Escapa de la PRISIÓN de POCOYO en Roblox con Mandarina,Escapa de la PRISIÓN de POCOYO en Roblox con Mandarina,Lyna,UC-cnbLlplnXA4oc7rR21qzg,20,Gaming,,0,https://i.ytimg.com/vi/cZNHP3ESAlQ/hqdefault.jpg,es-419,es-419,False,838,PT13M58S,hd,False,True,,,136418,2333,305
azzEfyGUfX0,PY,2025-12-11 02:28:58.406961+00:00,2025-12-09 19:00:06+00:00,Ulises | Destripando la Historia,Ulises | Destripando la Historia,Destripando la Historia,UCxIBZ-nQhgZES3UaTm8eDPA,10,Music,"destripando la historia, mitología, afrodita, dioses, pascu y rodri, griegos, nórdicos, egipcios, egipto, grecia, historia, aprender, loki, mythology, greek mythology, unraveling history, pascu and rodri, learn, greece, ulises, la iliada, la odisea, epic the musical, jorge rivera herrans, odiseo, zeus, hades, poseidón, hermes, calipso, penelope, telemaco, aquiles, heroes, paris y helena, troya, circe, canción, dibujos animados",39,https://i.ytimg.com/vi/azzEfyGUfX0/hqdefault.jpg,es,es,False,224,PT3M44S,hd,True,True,,,565039,82457,4331
OSVXSGg27dI,PY,2025-12-11 02:28:58.406969+00:00,2025-12-10 16:55:39+00:00,Construí el MEJOR COCHE en BATALLAS DE COCHES en Roblox!,Construí el MEJOR COCHE en BATALLAS DE COCHES en Roblox!,Dagar Roblox,UCmkyN2GfMyR7gsIiKBCR3nw,20,Gaming,"roblox, roblox dagar, roblox nacho, nacho y dagar, dagar y nacho",5,https://i.ytimg.com/vi/OSVXSGg27dI/hqdefault.jpg,es,es,False,1067,PT17M47S,hd,False,True,,,217355,3804,258
jBHhYkLqFRw,PY,2025-12-11 02:28:58.406976+00:00,2025-12-02 03:01:02+00:00,Eu Sou Lobo Mal,Eu Sou Lobo Mal,Gordinho Bolado - Topic,UCSx6Kd9ekjG0JPpkrwvamMQ,10,Music,"Gordinho Bolado, Boca da Seaway, MT na Voz, Eu Sou Lobo Mal",4,https://i.ytimg.com/vi/jBHhYkLqFRw/hqdefault.jpg,pt-PT,pt-PT,False,182,PT3M2S,hd,False,True,,,114800,2705,13
YezsQD9wHCc,PY,2025-12-11 02:28:58.406983+00:00,2025-12-10 15:00:11+00:00,AMANDA LA AVENTURERA 3 *EL FINAL*,AMANDA LA AVENTURERA 3 *EL FINAL*,Iker Unzu,UCQW8tWGYajwUv6jdQ2kmsRw,20,Gaming,"iker unzu, iker tiktok, iker unzu tiktok, iker, comedia, sketches de comedia, iker comedia, Amanda la aventurera, Wooly, Sam, Amanda, Cintas, VHS, Peli, Pez, Batidora, Final, Cápsulas, Rebecca",19,https://i.ytimg.com/vi/YezsQD9wHCc/hqdefault.jpg,es,es,False,5551,PT1H32M31S,hd,False,True,,,253297,13886,2025
tkWZ0NLk4k0,PY,2025-12-11 02:28:58.406991+00:00,2025-11-29 21:47:59+00:00,Tupasy Ka'akupépe - Mimados de Paraguay,Tupasy Ka'akupépe - Mimados de Paraguay,Mimados de Paraguay,UC5KhC0G3gAoFGlVLhb7rEkA,10,Music,"YouTube Music, nueva música latina, trending música, canción viral, música que toca el alma, música para reflexionar, canción para dedicar, música original, producción, independiente, estreno musical, mimados, kchak, music, caaguazu, paraguay, lo nuevo, top, masescuchados, musica, tupasy, caacupe, virgen, virgencita, virgencita de caacupe, milagro, ever osmar, fredy cardozo, derlis arnaldo, diego cardozo, elio rolando, mimado, los mimados",33,https://i.ytimg.com/vi/tkWZ0NLk4k0/hqdefault.jpg,es,es,False,273,PT4M33S,hd,False,False,,,13054,184,14
xoY0i4u0XnM,PY,2025-12-11 02:28:58.406999+00:00,2025-12-10 16:30:33+00:00,JUEGO CON LOS MAZOS MIS SEGUIDORES MAS FIELES😇,JUEGO CON LOS MAZOS MIS SEGUIDORES MAS FIELES😇,BENIJU,UC3fwcYRn_kq5xs4OP1ZiLkw,20,Gaming,"Clash Royale, Clash Royale Español, BENIJU, beniju, subir copas, guia de mazos, mejores mazos, beniyu, bniju, benju, TV ROYALE, TV ROYALE EN ESPAÑOL, JEFA BANDIDA, VERDUGO EVO, NUEVA EVO, NUEVA ACTU, CLASH ACTU, ken, tv royale, tv royale en español, nueva carta, nueva evo, modo ranked, HEROES, NUEVO HEROE, MINI PEKKA HEROE, MOSQUETERA HEROE, GIGANTE HEROE, CABALLERO HEROE",29,https://i.ytimg.com/vi/xoY0i4u0XnM/hqdefault.jpg,es,es,False,2351,PT39M11S,hd,False,True,,,183362,11573,391
LEz_eHbD15w,PY,2025-12-11 02:28:58.407007+00:00,2025-12-02 23:00:31+00:00,Beéle - si te pillara (LETRA),Beéle - si te pillara (LETRA),FlowVerso,UCeaIKrEW4gqu8vSLLuEfzfg,10,Music,,0,https://i.ytimg.com/vi/LEz_eHbD15w/hqdefault.jpg,es,es,False,184,PT3M4S,hd,False,True,,,1262936,953,6
sPzB-RMlQBM,PY,2025-12-11 02:28:58.407014+00:00,2025-12-09 23:18:35+00:00,Sobreviví a mi PRIMER ADMIN ABUSE de 99 NOCHES 🎉🎈😨🦌 SILVIOGAMER en 99 Noches en el Bosque,Sobreviví a mi PRIMER ADMIN ABUSE de 99 NOCHES 🎉🎈😨🦌 SILVIOGAMER en 99 Noches en el Bosque,Silvio Gamer,UCCrA8ZN1J3S52wuF4vthZFQ,20,Gaming,"SILVIO, SILVIOGAMER, SILVIO GAMER, Silvio, silviogamer, silvio, silvio gamer, roblox, sobrevivi, sobreviví, dias, 99 dias, 99 days, 99 days roblox, 99 dias roblox, 99 noches, 99 noches en el bosque, 99 dias en el bosque, bosque roblox, roblox 99 dias, roblox 99 noches, silviogamer roblox, silvio roblox, silvio gamer roblox, sobrevivimos, admin, admin abuse, abuse, 99 noches admin, admin 99 noches, cracky, viridial, foryxe",33,https://i.ytimg.com/vi/sPzB-RMlQBM/hqdefault.jpg,es-419,es-419,False,1784,PT29M44S,hd,False,True,,,653761,19356,1863
iTTBqm6rVRs,PY,2025-12-11 02:28:58.407022+00:00,2025-12-02 01:48:24+00:00,Labios Compartidos - Maná (Letra/Lyrics),Labios Compartidos - Maná (Letra/Lyrics),Rock Soul,UCO4hidpApriby-siAJdTM1A,24,Entertainment,"Labios Compartidos, Maná, Labios Compartidos Maná, Labios Compartidos letra, Labios Compartidos lyrics, Maná letra, Maná lyrics, rock latino, rock en español, pop rock, Maná hits, música romántica, canción icónica, Maná oficial, canción para dedicar, música en español, Musicana, rock mexicano, balada rock, música legendaria, rock clásico latino, canción nostálgica, éxitos de Maná, himnos del rock, música para enamorados, baladas poderosas, Maná en vivo",27,https://i.ytimg.com/vi/iTTBqm6rVRs/hqdefault.jpg,es,es,False,316,PT5M16S,hd,False,True,,,907348,1150,8
dJmD-p6wlaQ,PY,2025-12-11 02:28:58.407029+00:00,2025-12-10 02:18:38+00:00,BÚNKER SECRETO vs Animatronicos de FIVE NIGHTS AT FREDDYS en Minecraft!,BÚNKER SECRETO vs Animatronicos de FIVE NIGHTS AT FREDDYS en Minecraft!,Awita,UC62nFXtc3KNujp9LCPJt-sA,20,Gaming,,0,https://i.ytimg.com/vi/dJmD-p6wlaQ/hqdefault.jpg,es,es-419,False,2620,PT43M40S,hd,False,True,,,278723,5805,1024
85ETxUOFnfM,PY,2025-12-11 02:28:58.407036+00:00,2025-12-04 18:00:06+00:00,Danny Ocean - Me Rehúso (Letra),Danny Ocean - Me Rehúso (Letra),Caribeo,UCwk7blz5Hqc1QXbUaSc1stw,22,People & Blogs,,0,https://i.ytimg.com/vi/85ETxUOFnfM/hqdefault.jpg,es,es,False,206,PT3M26S,hd,False,True,,,2352842,2650,16
jgM_iv7D6Lg,PY,2025-12-11 02:28:58.407043+00:00,2025-12-10 19:30:16+00:00,Encontré a los TRANSFORMERS en GTA 5,Encontré a los TRANSFORMERS en GTA 5,Vista Gamer,UCMgqXTXjYNCAmyS9ci426Gg,20,Gaming,"gta 5, gta v, grand theft auto 5, grand theft auto v, vista gamer, Encontré a los TRANSFORMERS en GTA 5, CONSTRUÍ un TRANSFORMER en GTA 5, CAPTURO a LOS TRANSFORMERS en GTA 5!, ROBANDO COCHES de TRANSFORMERS en GTA 5!, ME CONVIERTO en TRANSFORMER en GTA 5!, Robando TRANSFORMERS MILLONARIOS en GTA 5",11,https://i.ytimg.com/vi/jgM_iv7D6Lg/hqdefault.jpg,es,es-419,False,1157,PT19M17S,hd,False,True,,,138489,2142,101
j8HNsXXnXu4,PY,2025-12-11 02:28:58.407051+00:00,2025-11-11 22:25:53+00:00,Qmbia Juan - Me juego la cabeza por ti (Letra/Lyrics),Qmbia Juan - Me juego la cabeza por ti (Letra/Lyrics),qmbiajuan,UCG01FVXSBNk6W2rqHg8Js_Q,10,Music,"qmbia, qmbia juan, juan, cumbia, cumbia juan, cumbia juan me juego, cumbia juan me juego la cabeza, cumbia juan me juego la cabeza por ti, cumbia juan me juego la cabeza por ti letra, cumbia juan me juego la cabeza por ti lyrics, me juego, me juego la cabeza, me juego la cabeza por ti, me juego la cabeza por ti letra, me juego la cabeza por ti lyrics, me juego la cabeza por ti cumbia, me juego la cabeza por ti cumbia juan, me juego la cabeza por ti cumbia juan letra",18,https://i.ytimg.com/vi/j8HNsXXnXu4/hqdefault.jpg,es,es,False,167,PT2M47S,hd,False,True,,,49147,280,5
2_edIxZKh64,PY,2025-12-11 02:28:58.407059+00:00,2025-12-10 21:15:18+00:00,CONSIGO LA NUEVA M60 EVOLUTIVA AL MÁXIMO EN FREE FIRE !! - TheDonato,CONSIGO LA NUEVA M60 EVOLUTIVA AL MÁXIMO EN FREE FIRE !! - TheDonato,TheDonato,UCaHEdZtk6k7SVP-umnzifmQ,20,Gaming,"free fire, m60 evolutiva, servidor avanzado free fire, garena free fire, free fire max",5,https://i.ytimg.com/vi/2_edIxZKh64/hqdefault.jpg,es,es,False,944,PT15M44S,hd,False,True,,,86421,6861,288
yZgCjPUOD58,PY,2025-12-11 02:28:58.407066+00:00,2025-12-03 20:06:45+00:00,ES UN SECRETO - Plan B,ES UN SECRETO - Plan B,Boyz Club,UCun4JAhit5LHt3hjGJHhPmw,10,Music,"Plan B, Chencho Corleone, Es un secreto, Plab B es un secreto, Es un secreto Plan B, Es un secreto Letra, Letra Es un Secreto, es un serecreto que tu mirada y la mía, Sin que me hables a entenderte, Yo sé lo que traes en tu mente Plan B, Plab B Yo sé lo que trae en tu mente",11,https://i.ytimg.com/vi/yZgCjPUOD58/hqdefault.jpg,es,es,False,215,PT3M35S,hd,False,True,,,1663104,2679,29
khn-7LXwFQQ,PY,2025-12-11 02:28:58.407073+00:00,2025-12-10 18:01:03+00:00,Sobreviví al Carnicero en Minecraft,Sobreviví al Carnicero en Minecraft,ARSEL,UCdkYpnBPZeGnyS0EvASGMkQ,20,Gaming,"arsel, arsel minecraft, arsel y mario, vmario y arsel, arsel trolleos, hice trampas en minecraft, minecraft, vmario, dano, danomc, arsel y dano, arsel dano y mario, mario dano y arsel, troll, rol, troleo, trolleo, trolee, batalla, mob, mobs, hack, hacks, amigo, Batalla de mobs, batalla de construccion, construccion, hackee, bobicraft, mikecrack, trolleé, transformé, mobs op, minecraft mod, converti, transforme, transformado, minecraft challenge, reto",39,https://i.ytimg.com/vi/khn-7LXwFQQ/hqdefault.jpg,es-ES,es-ES,False,1368,PT22M48S,hd,False,True,,,117370,2225,185
jgN-j-h0HB0,PY,2025-12-11 02:28:58.407081+00:00,2025-11-20 13:43:57+00:00,"FAZER MACETE - AFINHO DO FLUXO, ARTHURZINHO BATEDEIRA, MC CAUAZIM, FININHO RC, MC NICK","FAZER MACETE - AFINHO DO FLUXO, ARTHURZINHO BATEDEIRA, MC CAUAZIM, FININHO RC, MC NICK",FUNK DE BIGODE,UChFSlUTSJNQK3v79abpQP4w,10,Music,"FUNKFLIX, FUNK, MC, FUNK 2024, FUNK CONSCIENTE, FUNK LANÇAMENTO, SET FUNK, PLAYLIST FUNK, LOVE FUNK, GR6 EXPLODE, SET, FUNK 2025, FUNK 2025 LANÇAMENTO, FAZER MACETE - AFINHO DO FLUXO, ARTHURZINHO BATEDEIRA, MC CAUAZIM, FININHO RC, MC NICK, fazer macete, afinho do fluxo, fazer macete mc nick, fazer macete brega funk, fazer macete afinho do fluxo",23,https://i.ytimg.com/vi/jgN-j-h0HB0/hqdefault.jpg,pt-PT,pt-PT,False,183,PT3M3S,hd,False,True,,,227459,1779,7
gSj4I689KpY,PY,2025-12-11 02:28:58.407088+00:00,2025-12-09 21:56:35+00:00,Saque a los NIÑOS de las CUEVAS ¡SIN MATAR ANIMALES! en 99 NOCHES en el BOSQUE ROBLOX,Saque a los NIÑOS de las CUEVAS ¡SIN MATAR ANIMALES! en 99 NOCHES en el BOSQUE ROBLOX,SoyPato,UCFP33-zlNfJVzWUUbdhSjTQ,20,Gaming,"roblox, roblox español, roblox divertido, roblox fyp, roblox humor, roblox momentos divertidos, roblox roblox, roblox funny, roblox 99 noches en el bosque, 99 noches en el bosque, sobrevive 99 dias en el bosque, 99 noches en el bosque roblox, soypato, soypato 99 noches, creador de 99 noches, rompi 99 noches, 99 noches ayudando, 99 noches sin matar animales, 99 noches sin matar, 99 noches niños, 99 noches saque a los niños, 99 noches en el bosque sin comer carne",22,https://i.ytimg.com/vi/gSj4I689KpY/hqdefault.jpg,es,es,False,910,PT15M10S,hd,False,True,,,502330,6139,1655
qJiPyAFRM2k,PY,2025-12-11 02:28:58.407095+00:00,2025-12-06 19:45:07+00:00,FIESTA EN LA PISCINA | Lynita (Video Oficial),FIESTA EN LA PISCINA | Lynita (Video Oficial),Lynita,UCQweOz771McGzsIiEzchSmw,10,Music,"lynita, lyna, fiesta en la piscina, piscina, cancion, canciones, lyna musica, lynita musica, lyna canciones, canciones de lyna, lina, linita, lina canciones, fiesta en la piscina lynita, lyna fiesta en la piscina, canciones de lynita",16,https://i.ytimg.com/vi/qJiPyAFRM2k/hqdefault.jpg,es,es,False,161,PT2M41S,hd,False,False,,,421639,8003,1527
Jotaa70sQ7k,PY,2025-12-11 02:28:58.407102+00:00,2025-12-10 21:15:01+00:00,Nunca PULSES el BOTÓN MALDITO en Minecraft...,Nunca PULSES el BOTÓN MALDITO en Minecraft...,DanoMC,UCayC0ZYU9iq5PyuDG18BVsA,20,Gaming,"no toques el boton, no pulses el boton, Nunca PULSES el BOTÓN MALDITO en Minecraft, dano, mc, danomc, niki, arsel, keciyo, superkeciyo, danomc nunca pulses el boton, danomc y keciyo, minecraft danomc, arsel y dano, arsel minecraft, dano mc, danomc trolleos, BOTÓN MALDITO en Minecraft, BOTÓN MALDITO, danomc minecraft, trollee a mi amigo en minecraft danomc, mis amigos en minecraft, danomc trolea a arsel, danomc y arsel, danomc terror, minecraft pero, minecraft gameplay",27,https://i.ytimg.com/vi/Jotaa70sQ7k/hqdefault.jpg,es-ES,es-ES,False,1247,PT20M47S,hd,False,True,,,83609,1818,186
JSxoickYpQY,PY,2025-12-11 02:28:58.407110+00:00,2025-12-02 17:00:29+00:00,Marc Seguí - Tiroteo Remix ft. Rauw Alejandro y Pol Granch (Letra/Lyrics),Marc Seguí - Tiroteo Remix ft. Rauw Alejandro y Pol Granch (Letra/Lyrics),Love Trip,UCedwIM6dmZy-f90HTzE1P-g,22,People & Blogs,"LoveTrip, Video Lyric, Video Music, Video Letra, Sub Español, Video Sub Español, Video, Musica, Love, Trip, Amor, Desamor, Lyric, Music, Letra",15,https://i.ytimg.com/vi/JSxoickYpQY/hqdefault.jpg,es,es,False,320,PT5M20S,hd,False,True,,,874128,1528,17
aflqxG3mcn8,PY,2025-12-11 02:28:58.407117+00:00,2025-12-10 20:31:45+00:00,NOOBINI REGALINI vs BRAINROTS en Minecraft,NOOBINI REGALINI vs BRAINROTS en Minecraft,Mini Herios,UCWno0sabdVT6pJNWtor90TQ,20,Gaming,"soyHerios, miniherios",2,https://i.ytimg.com/vi/aflqxG3mcn8/hqdefault.jpg,es,es,False,749,PT12M29S,hd,False,True,,,104186,6641,248
