video_id,country,fetched_at,published_at,title,localized_title,channel_title,channel_id,category_id,category_name,tags,tag_count,thumbnail,default_language,audio_language,is_live,duration,duration_raw,definition,caption_available,licensed_content,embeddable,made_for_kids,views,likes,comments
ttkXaHl0o5g,SN,2026-06-19T05:34:35.431025+00:00,2026-05-27T12:00:56Z,Bass Thioung - BAOL (Clip Officiel) Ft. Nafi & Alassane,Bass Thioung - BAOL (Clip Officiel) Ft. Nafi & Alassane,Bass Thioung,UCatnqtjJ19ROJxv1xj3WCiA,10,Music,"bass thioung baol clip officiel, bass thioung, bass thioung nouveau son, bass thioung live, bass thioung 2026, bass thioung ambiance live, ambiance senegal, ambiance, dakar, senegal, tassou, mbalax, zbest, bril, thioung music, thioung, vj, wally seck, sidy diop, ada boy, ibro nadio, jeeba, jahman, ashs the best, dieyla, dip doundou guiss, nafy, alassane, bass thioung fatou ndiaye, fatou ndiaye, fatou ndiaye challenge, fatou ndiaye et mame bousso, mame bousso",33,https://i.ytimg.com/vi/ttkXaHl0o5g/hqdefault.jpg,fr,wo,False,322,PT5M22S,hd,False,True,False,False,2719424,23154,668
g07_9WfFpzI,SN,2026-06-19T05:34:35.431067+00:00,2026-06-17T12:38:38Z,Série - Sama WURUS - Bande Annonce - Épisode 13,Série - Sama WURUS - Bande Annonce - Épisode 13,Marodi TV Sénégal,UCqe0sSESmaQbLFdTExctQLA,24,Entertainment,"Séries, Série, télévisions, sénégal, séries sénégalaises, marodi tv, Marodi, séries africaines, mbarodi, vidéos sénégal, karma, maitresse, pod et marichou, decheance, virginie, emprises, credule, baabel, kay&za",19,https://i.ytimg.com/vi/g07_9WfFpzI/hqdefault.jpg,fr,fr,False,53,PT53S,hd,False,True,False,False,361348,15086,92
pZnbY72A0hQ,SN,2026-06-19T05:34:35.431079+00:00,2026-06-11T12:14:31Z,"Tout savoir sur les nouveautés : Packs, Coach || Efootball mobile ","Tout savoir sur les nouveautés : Packs, Coach || Efootball mobile ",IBZOGAMING,UC74nI5LDGVtBUeZiEeWj1Iw,20,Gaming,"efootball, efootball mobile, efootball mobile 26, tout savoir sur les pack efootball mobile, tout savoir sur les coach efootball mobile, ibzogaming, ibzogaming efootball mobile",7,https://i.ytimg.com/vi/pZnbY72A0hQ/hqdefault.jpg,fr-FR,fr,False,255,PT4M15S,hd,False,True,False,False,37577,5297,200
ELgJXEStSPs,SN,2026-06-19T05:34:35.431088+00:00,2026-06-09T12:00:06Z,Jahman X-press & Selmind X-press - SAMA CAS (Visualizer),Jahman X-press & Selmind X-press - SAMA CAS (Visualizer),Jahman X-Press,UC0JZ_3DU8Pz4p8tM701RRjA,10,Music,,0,https://i.ytimg.com/vi/ELgJXEStSPs/hqdefault.jpg,fr,fr,False,170,PT2M50S,hd,False,True,False,False,284682,12941,300
W2psuzyxt6M,SN,2026-06-19T05:34:35.431096+00:00,2026-06-16T09:00:05Z,BOROM KEUR - Saison 2 - Episode 2 : Bande Annonce,BOROM KEUR - Saison 2 - Episode 2 : Bande Annonce,EvenProd,UCKKbOgsOxOT83r1TdfjMaYg,1,Film & Animation,"borom keur saison 2 bande annonce episode 2, borom keur saison 2, borom keur bande annonce, bande annonce, queen rila, ibou gueye, wally seck, youssou ndour, mia guisse, evenprod 2026, dakar, senegal, 2026, timis, takkema, borom keur serie, serie, tuumaal, workat, evenprod, creation originale, evenprod nouvelle série",22,https://i.ytimg.com/vi/W2psuzyxt6M/hqdefault.jpg,fr,wo,False,106,PT1M46S,hd,False,True,False,False,445613,21155,230
ys1cU2Ps1Xo,SN,2026-06-19T05:34:35.431104+00:00,2026-06-16T13:00:29Z,"FRANCE - SÉNÉGAL | Coupe du Monde de la FIFA 2026, Groupe I | Simulation complète du match PES 2021","FRANCE - SÉNÉGAL | Coupe du Monde de la FIFA 2026, Groupe I | Simulation complète du match PES 2021",KYRGYZ PUBG,UCmgLrmSvU8lVTrKRd1OgZ7Q,20,Gaming,"France contre Sénégal, France contre Sénégal Coupe du Monde FIFA, France contre Sénégal 2026, France contre Sénégal Coupe du Monde 2026, Gameplay France contre Sénégal, Match complet France contre Sénégal, PES 2021, eFootball PES 2021, France Coupe du Monde 2026, Sénégal Coupe du Monde FIFA 2026, Composition de l'équipe de France pour la Coupe du Monde 2026, Composition de l'équipe du Sénégal pour la Coupe du Monde 2026",12,https://i.ytimg.com/vi/ys1cU2Ps1Xo/hqdefault.jpg,en,fr,False,3996,PT1H6M36S,hd,False,True,False,False,47285,343,22
XMBDdTHTIEo,SN,2026-06-19T05:34:35.431112+00:00,2026-06-12T14:54:41Z,Tiakola - Mélo Décalé,Tiakola - Mélo Décalé,TIAKOLA,UC5M-zwNtSM_M2-J-wyRgl4g,10,Music,,0,https://i.ytimg.com/vi/XMBDdTHTIEo/hqdefault.jpg,fr,fr,False,255,PT4M15S,hd,False,True,False,False,1456275,73913,3521
TPR4IcUMFXE,SN,2026-06-19T05:34:35.431119+00:00,2026-06-13T15:04:45Z,"Bande annonce ""Coupe du monde de Souloukhou""","Bande annonce ""Coupe du monde de Souloukhou""",Lagocomedy Sénégal,UCVoFS6VXaYgVoj3vJlvDnpg,24,Entertainment,"comédie sénégalaise, african cartoon comedy, africa comedy, lagocomedy, dessin animé en wolof",5,https://i.ytimg.com/vi/TPR4IcUMFXE/hqdefault.jpg,fr,fr,False,207,PT3M27S,hd,False,True,False,False,29440,554,22
qqMEcmTb_Vs,SN,2026-06-19T05:34:35.431127+00:00,2026-06-17T23:58:20Z,🔴England Vs Croatia I World Cup 2026 - Gameplay I Video Game EA Sports FC 26,🔴England Vs Croatia I World Cup 2026 - Gameplay I Video Game EA Sports FC 26,BOT IS LIVE,UCCWF5CY5kd3LYNrOHDB4UHw,20,Gaming,"BOT IS LIVE, FIFA World Cup 2026 LIVE, World Cup 2026 football LIVE, Tunisia Live Football Match, FIFA, World Cup Live, FIFA World Cup, ​FIFA World Cup 2026, FIFA LIVE, England Vs Croatia, England Vs Croatia LIVE, Croatia LIVE, England LIVE, Croatia Vs England LIVE, Croatia Vs England, Croatia Vs England Live Football Match, England Vs Croatia Live Football Match, Croatia Vs England Live Match, England Vs Croatia Live Match, Live Match Croatia Vs England, Live Match England",21,https://i.ytimg.com/vi/qqMEcmTb_Vs/hqdefault.jpg,en,bn,False,1210,PT20M10S,hd,False,True,False,False,533978,3303,1
qu3T_YGaKNE,SN,2026-06-19T05:34:35.431135+00:00,2026-05-28T16:30:18Z,Willylancien - tempête ,Willylancien - tempête ,Willylancien,UCYvlij4hpfoICpfM2m62wwA,22,People & Blogs,,0,https://i.ytimg.com/vi/qu3T_YGaKNE/hqdefault.jpg,fr,,False,178,PT2M58S,hd,False,False,False,False,4345818,45494,1814
THte1EnuG-M,SN,2026-06-19T05:34:35.431143+00:00,2026-06-17T19:08:46Z,SPIDER-MAN : BRAND NEW DAY Bande Annonce VF (2026) Nouvelle,SPIDER-MAN : BRAND NEW DAY Bande Annonce VF (2026) Nouvelle,FilmsActu,UC_i8X3p8oZNaik8X513Zn1Q,1,Film & Animation,"cinema, filmsactu, bande annonce, film, officiel, français, VF, 2026, Spider-Man, Spider-Man Brand New Day, Spider-Man Brand New Day Bande Annonce VF, Tom Holland, Zendaya, Sadie Sink, Jon Bernthal, Nouveau, Nouvelle",17,https://i.ytimg.com/vi/THte1EnuG-M/hqdefault.jpg,fr,fr,False,175,PT2M55S,hd,False,True,False,False,413483,17222,871
LqDso41wwss,SN,2026-06-19T05:34:35.431150+00:00,2026-06-17T21:17:17Z,SHARKBITE FUN CHALLENGE!,SHARKBITE FUN CHALLENGE!,BaconVrx,UCWNcQx-N9nFa9sSv_teNkNw,20,Gaming,,0,https://i.ytimg.com/vi/LqDso41wwss/hqdefault.jpg,en,en,False,5,PT5S,hd,False,True,False,False,1176337,8306,0
8mqYknYEp3M,SN,2026-06-19T05:34:35.431157+00:00,2026-06-18T18:00:26Z,Djelykaba Bintou - Coup de coeur (Clip Officiel),Djelykaba Bintou - Coup de coeur (Clip Officiel),Djelykaba Bintou,UCQbckj_GH8g80f6L6PnSYfQ,10,Music,,0,https://i.ytimg.com/vi/8mqYknYEp3M/hqdefault.jpg,fr,fr,False,220,PT3M40S,hd,False,True,False,False,189970,20198,3264
pvlHXsJENaY,SN,2026-06-19T05:34:35.431164+00:00,2026-06-18T14:50:31Z,Bloqué sur un Radeau de Naufragé avec Toinelag..,Bloqué sur un Radeau de Naufragé avec Toinelag..,Unchained_Off,UCiFyJ_EBmF2XJuR9buWE_3A,20,Gaming,"unchained, unchained_off, unchained fortnite, fortnite, jeu vidéo, gameplay, drole, gratuit, unchained gaming, fortnite battle royale, vbucks, mise à jour, maj, fortnite maj, fortnite chapitre, unchained map, roblox, unchained roblox, robux, secret, roblox brainrot, steal a brainrot, voler brainrot, Brainrot, brainrot secret, unchained skin, admin, toinelag, naufragé, survie, requin, océan, raft, survival, 100 jours en mer, mer, Kraken",37,https://i.ytimg.com/vi/pvlHXsJENaY/hqdefault.jpg,fr,fr-FR,False,1928,PT32M8S,hd,False,True,False,False,364904,17321,861
HIUofLcKH6Q,SN,2026-06-19T05:34:35.431172+00:00,2026-05-27T22:00:28Z,Dieyla - Waneko (Visualizer),Dieyla - Waneko (Visualizer),Dieyla,UCsxw1UHWPhpTXwkGgclBthA,10,Music,"dieyla waneko visualizer, dieyla nouveau clip, dieyla, dieyla clip, dieyla visualizer, dieyla ndanane, dieyla yaw la, zoom on the beat, kruh mandiou mauri, kruh, mia guissé, ndakhté, viviane, vj, wally seck, amadeus, bass thioung, bass thioung baol, musique, mbalax, tassou, senegal, momo ambiance, timis, takkema",25,https://i.ytimg.com/vi/HIUofLcKH6Q/hqdefault.jpg,fr,,False,198,PT3M18S,hd,False,True,False,False,359409,6352,187
EE-pHv9B4XY,SN,2026-06-19T05:34:35.431180+00:00,2026-06-15T21:00:18Z,FRANCE vs SÉNÉGAL | Coupe du Monde FIFA 2026 | Simulation PES 2021,FRANCE vs SÉNÉGAL | Coupe du Monde FIFA 2026 | Simulation PES 2021,Shai Gameplay,UCCG_xCSUtvBeT23LZa1_XKw,17,Sports,"France vs Senegal, France vs Sénégal, France vs Senegal simulation, France vs Senegal full match, France vs Senegal World Cup, Coupe du Monde FIFA 2026, simulation de football, simulation de football réaliste, simulation de match complète, eFootball PES21, simulation eFootball, simulation France, simulation Sénégal, gameplay football, gameplay réaliste, simulation soccer, match Coupe du Monde 2026, Shai Gameplay",18,https://i.ytimg.com/vi/EE-pHv9B4XY/hqdefault.jpg,fr,fr,False,3755,PT1H2M35S,hd,False,True,False,False,24726,155,10
jgRt3ZPeM28,SN,2026-06-19T05:34:35.431188+00:00,2026-06-14T18:13:11Z,M’BOMA - WOKOMI BANDIT ( Clip Audio ) 2k26,M’BOMA - WOKOMI BANDIT ( Clip Audio ) 2k26,M'BOMA,UCbz2jd7FSbuVAmDg6S3Fl8g,10,Music,,0,https://i.ytimg.com/vi/jgRt3ZPeM28/hqdefault.jpg,fr,,False,241,PT4M1S,hd,False,True,False,False,74299,2786,130
6nZgGzAmOVk,SN,2026-06-19T05:34:35.431195+00:00,2026-06-11T19:21:31Z,COMMENT RÉCUPÉRER LES CARTE POTD SUR EFOOTBALMOBILE 🔥👑#efootball #konami #gaming #visibilité ,COMMENT RÉCUPÉRER LES CARTE POTD SUR EFOOTBALMOBILE 🔥👑#efootball #konami #gaming #visibilité ,ALTOGAMING ,UCm3HM6VnHop3AApqiFbgZhQ,22,People & Blogs,,0,https://i.ytimg.com/vi/6nZgGzAmOVk/hqdefault.jpg,fr,,False,122,PT2M2S,sd,False,False,False,False,17994,1910,32
LVf5bKR19NY,SN,2026-06-19T05:34:35.431202+00:00,2026-06-02T22:26:16Z,ZO TITAN — Xaru Ba Def Ko | Épisode 3 (EP Visualiser) | VOSTFR,ZO TITAN — Xaru Ba Def Ko | Épisode 3 (EP Visualiser) | VOSTFR,Zo titan,UCuOF990JCHfaHvphsi4NdHQ,10,Music,,0,https://i.ytimg.com/vi/LVf5bKR19NY/hqdefault.jpg,fr,wo,False,160,PT2M40S,hd,True,False,False,False,87841,4127,118
UM3rHZeKQdo,SN,2026-06-19T05:34:35.431209+00:00,2026-06-13T17:00:01Z,J’ai testé des Astuces efootball de TikTok !,J’ai testé des Astuces efootball de TikTok !,Tasanko,UCWKtPbELm5M3aodigJdoxaQ,24,Entertainment,,0,https://i.ytimg.com/vi/UM3rHZeKQdo/hqdefault.jpg,fr,,False,888,PT14M48S,hd,False,False,False,False,20903,1203,40
8hAkNcjKBzw,SN,2026-06-19T05:34:35.431216+00:00,2026-06-14T12:00:07Z,Canabasse - From Dk to the USA,Canabasse - From Dk to the USA,Canabasse,UCCdvIgNVHA0Z4ysWj1UZULg,10,Music,"Canabasse, Buzz, lab, Buzzlab, 4thebuzz, the, buzz, 4the, galsen, senegal, hip, hop, rap",13,https://i.ytimg.com/vi/8hAkNcjKBzw/hqdefault.jpg,fr,wo,False,237,PT3M57S,hd,False,False,False,False,20510,2882,204
B2mO_KEmkJY,SN,2026-06-19T05:34:35.431223+00:00,2026-06-16T16:00:06Z,FRANCE vs SÉNÉGAL – Coupe du Monde FIFA 2026 | Simulation PES 2021,FRANCE vs SÉNÉGAL – Coupe du Monde FIFA 2026 | Simulation PES 2021,PES Battle Zone,UCMdvlqO47YHLzx7Sp65AYSA,17,Sports,"France vs Sénégal, Sénégal vs France, France, Sénégal, France vs Senegal, Senegal vs France, Équipe de France, Lions de la Teranga, sélection française, sélection sénégalaise, équipe nationale de France, équipe nationale du Sénégal, Coupe du Monde FIFA 2026, Coupe du Monde 2026, FIFA World Cup 2026, World Cup 2026, Mondial 2026, PES 2021, Simulation PES 2021, football en direct, diffusion en direct, eFootball PES 2021, France PES 2021, Senegal PES 2021, World Cup Simulation",25,https://i.ytimg.com/vi/B2mO_KEmkJY/hqdefault.jpg,fr,fr,False,752,PT12M32S,hd,False,True,False,False,18417,54,2
tHBdQVIuNl4,SN,2026-06-19T05:34:35.431231+00:00,2026-05-25T17:00:07Z,DIP DOUNDOU GUISS - GUDDI YI ÑU TOLLOU,DIP DOUNDOU GUISS - GUDDI YI ÑU TOLLOU,Dip Doundou Guiss TV,UC1vuRyLk0d4G0d9sd-Y2U2g,10,Music,"rap, rapgalsen, dip, doundou, guiss, reptyle, music, Sénégal, sonko, diomaye, freesenegal, senegal, actualités au sénégal, goudi yi nu tollou, premier ministre senegal, premier ministre, ousmane sonko, cheikh bara ndiaye, assemblée nationale, assemblée nationale senegal, al aminou lo, 2029, focus",23,https://i.ytimg.com/vi/tHBdQVIuNl4/hqdefault.jpg,fr,fr,False,212,PT3M32S,hd,True,True,False,False,424562,40375,2551
eoeqj9la6GU,SN,2026-06-19T05:34:35.431238+00:00,2026-06-05T02:19:42Z,FRANCE vs SENEGAL - Group  I | FIFA World Cup 2026 Full Match Gameplay,FRANCE vs SENEGAL - Group  I | FIFA World Cup 2026 Full Match Gameplay,PesMe,UChad7hqW_3hLQUBbEYaCfOA,20,Gaming,"france vs senegal, france vs senegal 2026, france vs senegal 2026 world cup, france 2026 world cup, france 2026 world cup lineup, france vs senegal preview, france vs senegal prediction, france vs senegal highlights, france vs senegal world cup 2026, france vs senegal highlights 2026, fifa world cup 2026 predictions, senegal lineup world cup 2026, france lineup 2026 world cup, france senegal world cup 2026",14,https://i.ytimg.com/vi/eoeqj9la6GU/hqdefault.jpg,en,en,False,567,PT9M27S,hd,False,True,False,False,64553,278,2
sHx-4kgqRdw,SN,2026-06-19T05:34:35.431245+00:00,2026-06-05T20:00:06Z,Iss 814 | SAMA ALAAL (B.O. Takkema) [Visualizer],Iss 814 | SAMA ALAAL (B.O. Takkema) [Visualizer],Iss 814,UCz8KYuq-KGD0vk6WgRetlrw,10,Music,,0,https://i.ytimg.com/vi/sHx-4kgqRdw/hqdefault.jpg,fr,fr,False,151,PT2M31S,hd,False,True,False,False,85207,4511,116
EiQEBYDox_k,SN,2026-06-19T05:34:35.431252+00:00,2026-06-18T13:03:29Z,Grand Theft Auto VI: Official Cover Art Reveal,Grand Theft Auto VI: Official Cover Art Reveal,Rockstar Games,UC6VcWc1rAoWdBCM0JxrRQ3A,20,Gaming,"GTA 6, Grand Theft Auto VI, Grand Theft Auto 6, GTAVI, GTA VI, Pre-Order, Pre-Orders",7,https://i.ytimg.com/vi/EiQEBYDox_k/hqdefault.jpg,en,en,False,33,PT33S,hd,False,True,False,False,5856508,743658,56280
AZhlka7ZfgE,SN,2026-06-19T05:34:35.431259+00:00,2026-06-05T10:16:08Z,Sama Sagnse Samba Diarra MBAYE,Sama Sagnse Samba Diarra MBAYE,Teranga Beats Distribution - Topic,UCHVtTb_sgf7sIgyDGze-Mng,10,Music,"Teranga Beats Distribution, Pikini, Jeff, Sama Sagnse Samba Diarra MBAYE",4,https://i.ytimg.com/vi/AZhlka7ZfgE/hqdefault.jpg,fi,,False,178,PT2M58S,hd,False,True,False,False,44195,390,0
f4aIYBr3bEw,SN,2026-06-19T05:34:35.431266+00:00,2026-06-16T18:55:06Z,FRANCE vs SÉNÉGAL | COUPE DU MONDE FIFA 2026 | Simulation eFootball PES21,FRANCE vs SÉNÉGAL | COUPE DU MONDE FIFA 2026 | Simulation eFootball PES21,UPires Futebol,UCWlTzsEHy8YOCXU89SodvOQ,17,Sports,"coupe du monde de la fifa 2026, france aujourd'hui, sénégal aujourd'hui, france vs sénégal, france vs sénégal buts, résumé france vs sénégal, match de football aujourd'hui, match france, match sénégal, mondial fifa 2026, france vs sénégal 2026, france vs sénégal aujourd'hui, france vs sénégal tv, moments du match, simulation football, simulation pes 2021, eFootball PES21",17,https://i.ytimg.com/vi/f4aIYBr3bEw/hqdefault.jpg,pt-BR,zxx,False,1218,PT20M18S,hd,False,True,False,False,32624,109,4
D0BKnkqmR98,SN,2026-06-19T05:34:35.431274+00:00,2026-05-27T18:00:06Z,Boy Diarra - Hayati (Visualizer),Boy Diarra - Hayati (Visualizer),Boy Diarra,UCLDeYUU76xb_a6MsmRjIinA,10,Music,"Boy Diarra, boy diarra album, boy diarra nhlh, boy diarra 2024, album boy diarra, wally seck, dip doundou guiss, rap poular, amadeus, hip hop poular, nhlh, adviser, rap rim",13,https://i.ytimg.com/vi/D0BKnkqmR98/hqdefault.jpg,fr,und,False,180,PT3M,hd,False,True,False,False,300684,10859,485
5nHM8okleP4,SN,2026-06-19T05:34:35.431281+00:00,2026-06-14T19:00:03Z,✅ France - Sénégal | Coupe du Monde 2026 | Simulation réaliste et prédiction (Gameplay),✅ France - Sénégal | Coupe du Monde 2026 | Simulation réaliste et prédiction (Gameplay),十Loork Football,UCfFNw7MaO7QmWkswaGFGEvA,20,Gaming,"France - Sénégal 2026, Coupe du Monde 2026, Pronostic France - Sénégal, Simulation France - Sénégal, Déroulement du match Coupe du Monde 2026, Équipe de France 2026, Composition France - Sénégal Coupe du Monde 2026, Pronostic Sénégal - France, Simulation Coupe du Monde 2026, Buts France - Sénégal 2026, Matchs Coupe du Monde 2026, Look Football, FIFA 26 France, Pronostic Football 2026",14,https://i.ytimg.com/vi/5nHM8okleP4/hqdefault.jpg,fr,fr,False,7232,PT2H32S,hd,False,True,False,False,98106,1107,16
vrY1THC_NQE,SN,2026-06-19T05:34:35.431289+00:00,2026-06-01T15:00:06Z,IShowSpeed - World Cup (Champions) [Official Music Video],IShowSpeed - World Cup (Champions) [Official Music Video],IShowSpeed,UCWsDFcIhY2DBi3GB5uykGXA,20,Gaming,"ishowspeed, world cup",2,https://i.ytimg.com/vi/vrY1THC_NQE/hqdefault.jpg,en,en,False,299,PT4M59S,hd,False,False,False,False,59301474,3280373,184357
EWeMRIA6kmc,SN,2026-06-19T05:34:35.431296+00:00,2026-06-12T15:10:01Z,🎮 Comment obtenir le POTD (Joueur du Jour) et les cartes Showtime sur eFootball 2026 ?,🎮 Comment obtenir le POTD (Joueur du Jour) et les cartes Showtime sur eFootball 2026 ?,Tamimi221,UC25GiYg4ko8jR7qwJh6_0RA,20,Gaming,,0,https://i.ytimg.com/vi/EWeMRIA6kmc/hqdefault.jpg,fr,fr-FR,False,124,PT2M4S,hd,False,True,False,False,6838,781,31
fcnDmrtj6Sk,SN,2026-06-19T05:34:35.431303+00:00,2026-05-23T16:14:03Z,"Shakira, Burna Boy - Dai Dai (Official Video)","Shakira, Burna Boy - Dai Dai (Official Video)",shakiraVEVO,UCGnjeahCJW1AF34HBmQTJ-Q,10,Music,"Shakira, Shakira 2026, Shakira letra, Shakira lyrics, Shakira dai dai, dai dai shak, dai dai shakira, shakira letra 2026, Dai dai letra, dai dai lyrics, dai dai, Burna Boy, Burna Boy letra, Burna Boy lyrics, Burna Boy 2026, Burna Boy video, Burna boy dai dai, Afro Pop, Cheerful, Latin Pop",20,https://i.ytimg.com/vi/fcnDmrtj6Sk/hqdefault.jpg,en,en,False,241,PT4M1S,hd,False,True,False,False,186277710,3605240,177552
zlw0GMsd2Fk,SN,2026-06-19T05:34:35.431310+00:00,2026-06-16T22:12:43Z,France vs Senegal | World Cup 2026 Simulation | eFootball PES 21 Realistic Gameplay,France vs Senegal | World Cup 2026 Simulation | eFootball PES 21 Realistic Gameplay,Astra League,UCoRjKJq5SE-tBRur2YFaUVg,20,Gaming,"Senegal vs France, France vs Senegal, World Cup, livefootball2025, World Cup highlights, France goals, France live, France 2025, France match, France highlights, Senegal highlights, football watchalong, efootball livestream, football commentary, football simulation, pes 21 live, Senegal vs France match video, football match today, Senegal vs France gaming, efootball highlights",20,https://i.ytimg.com/vi/zlw0GMsd2Fk/hqdefault.jpg,en-IN,en-IN,False,10306,PT2H51M46S,hd,False,True,False,False,109487,348,0
0wGgCgJ29s8,SN,2026-06-19T05:34:35.431318+00:00,2026-06-06T01:47:51Z,Samba junior- Mi Djabata-2026,Samba junior- Mi Djabata-2026,Samba Junior,UCDbiwNQpEY23CN1CS6d_t2Q,22,People & Blogs,,0,https://i.ytimg.com/vi/0wGgCgJ29s8/hqdefault.jpg,es,,False,221,PT3M41S,hd,False,False,False,False,196595,3864,201
lY6Uu8G0HKs,SN,2026-06-19T05:34:35.431325+00:00,2026-06-18T03:22:27Z,🔴 GTA 5 LIVE  #gta #gta5 #gtav #gaming,🔴 GTA 5 LIVE  #gta #gta5 #gtav #gaming,Ryno plays,UCzG5gEHY5VN2JReXTmw6Oxg,20,Gaming,,0,https://i.ytimg.com/vi/lY6Uu8G0HKs/hqdefault.jpg,en,zxx,False,22691,PT6H18M11S,hd,False,True,False,False,400984,1210,0
01Cl7rcQGb8,SN,2026-06-19T05:34:35.431332+00:00,2026-05-31T10:15:23Z,FOFO Francy Sca | 🦁 MONDIAL 2026 : Le Sénégal attaque ! Allez les Lions ! 🇸🇳🔥,FOFO Francy Sca | 🦁 MONDIAL 2026 : Le Sénégal attaque ! Allez les Lions ! 🇸🇳🔥,FOFO Francy Sca,UC5wmWuUUZJ3bmw_9DmAbQzw,25,News & Politics,,0,https://i.ytimg.com/vi/01Cl7rcQGb8/hqdefault.jpg,fr,wo,False,213,PT3M33S,hd,False,False,False,False,18173,495,18
KgDgsv2bdvA,SN,2026-06-19T05:34:35.431340+00:00,2026-06-13T15:23:30Z,‎سبايدر مان يعبر جسر الحصان سبايدر فوق أسماك القرش العنكبوت ؟؟؟ Spider-Man Horse Bridge GTA 5,‎سبايدر مان يعبر جسر الحصان سبايدر فوق أسماك القرش العنكبوت ؟؟؟ Spider-Man Horse Bridge GTA 5,Maro Spidey,UCZBSD46ZjyL3vrkQzlOfhpA,20,Gaming,,0,https://i.ytimg.com/vi/KgDgsv2bdvA/hqdefault.jpg,ar,,False,650,PT10M50S,hd,False,True,False,False,771070,21895,3674
Ses4nRv7IQI,SN,2026-06-19T05:34:35.431347+00:00,2026-06-12T15:00:28Z,Didi B - IGBO (Clip officiel),Didi B - IGBO (Clip officiel),DidiBVEVO,UCxSyU83DOpH3hQKa73eVZAQ,10,Music,"Didi, IGBO",2,https://i.ytimg.com/vi/Ses4nRv7IQI/hqdefault.jpg,su,en,False,139,PT2M19S,hd,False,True,False,False,1753643,80089,8068
EsU3BaSj7CY,SN,2026-06-19T05:34:35.431354+00:00,2026-06-15T18:44:27Z,I Replayed the Career of Neymar Jr...,I Replayed the Career of Neymar Jr...,S2G,UChR1Yn7YpVrnP-SbsWtjuBA,20,Gaming,,0,https://i.ytimg.com/vi/EsU3BaSj7CY/hqdefault.jpg,en-GB,en,False,1562,PT26M2S,hd,False,True,False,False,599485,23045,732
69jxvdnmoOg,SN,2026-06-19T05:34:35.431361+00:00,2026-06-09T12:47:06Z,SENEGAL REKK (REMIX) – Youssou NDour,SENEGAL REKK (REMIX) – Youssou NDour,Youssou Ndour,UCoK48xH4luB0UFOb_Okqw6w,10,Music,"Youssou ndour, ndour, tfm, lobs, ministre, chanteur, dakar, senegal, africa, international, Youssou Ndour, Hello, Boukki YI, Bercy, Xaware youssou ndour, Fiitey, Grand Bal, Senegal Rekk Remix, Coupe d’Afrique des Nations, CAN trophée, Senegal Pérou 2026, Stade de France, Youssou Ndour live, musique sénégalaise, concert Sénégal, Sénégal victoire, Super Étoile, Lions de la Teranga, live concert, Sénégal 2026, Accor Arena, Bercy Paris, Youssou Ndour concert, mbalax live, CAN 2026",35,https://i.ytimg.com/vi/69jxvdnmoOg/hqdefault.jpg,fr,fr,False,173,PT2M53S,hd,False,False,False,False,84533,3347,132
wbjnXPsrumE,SN,2026-06-19T05:34:35.431370+00:00,2026-06-16T21:45:15Z,eFootball Pes 21 France - Sénégal | Coupe du Monde de la FIFA 2026 | Jeu vidéo - Simulation,eFootball Pes 21 France - Sénégal | Coupe du Monde de la FIFA 2026 | Jeu vidéo - Simulation,Sellykona,UCsOeDFRSxxyaYLypCMHDEog,20,Gaming,,0,https://i.ytimg.com/vi/wbjnXPsrumE/hqdefault.jpg,en,fr,False,8435,PT2H20M35S,hd,False,False,False,False,42496,86,0
RHqSzSYAcDQ,SN,2026-06-19T05:34:35.431377+00:00,2026-06-14T16:00:07Z,Kodes Feat. Himra - WAWA (CLIP OFFICIEL),Kodes Feat. Himra - WAWA (CLIP OFFICIEL),Kodes,UCeAZAorMfkdHrkMA6Ys1C_g,10,Music,"kodes himra, wawa, kodes mechant, kodes emeraude, kodes, himra, rap francais, rap 2026, c'est pas wawa, rap, himra ninho, himra number one, clip officiel",13,https://i.ytimg.com/vi/RHqSzSYAcDQ/hqdefault.jpg,fr,fr,False,160,PT2M40S,hd,False,False,False,False,816789,60281,4027
2Mtndiv1Bjg,SN,2026-06-19T05:34:35.431385+00:00,2026-06-14T17:00:01Z,😱 eFootball 2027 arrive ? Ce que Konami cache pour le 26 juillet ! 🚨,😱 eFootball 2027 arrive ? Ce que Konami cache pour le 26 juillet ! 🚨,Borom pess bi officiel ,UCFo_p_n-PqpfwV6fslJ5G1g,20,Gaming,,0,https://i.ytimg.com/vi/2Mtndiv1Bjg/hqdefault.jpg,fr,,False,293,PT4M53S,hd,False,True,False,False,6884,757,17
5nf76ltet_c,SN,2026-06-19T05:34:35.431392+00:00,2026-06-12T18:20:21Z,Mariama Kankalabé - Wadhan doyi | vidéo officielle ,Mariama Kankalabé - Wadhan doyi | vidéo officielle ,Mariama Kankalabé,UCLmXHV7yjZ7EbRJxyIYLrpw,24,Entertainment,,0,https://i.ytimg.com/vi/5nf76ltet_c/hqdefault.jpg,fr,und,False,246,PT4M6S,hd,False,True,False,False,79770,3044,138
3XbEMxQ8D-k,SN,2026-06-19T05:34:35.431399+00:00,2026-06-17T23:40:20Z,"🔴Live : England vs Croatia I Full Game Live Streaming I 18 June, 2026 I Video Game Simulation","🔴Live : England vs Croatia I Full Game Live Streaming I 18 June, 2026 I Video Game Simulation",Munna,UCxeXR8JqzNAOxAfS_ACtFdQ,20,Gaming,"england, croatia, england vs croatia, croatia vs england, video game, gaming simulation, england football",7,https://i.ytimg.com/vi/3XbEMxQ8D-k/hqdefault.jpg,en,zxx,False,1191,PT19M51S,hd,False,True,False,False,435540,1748,3
elv10e2dfFI,SN,2026-06-19T05:34:35.431406+00:00,2026-06-07T16:00:06Z,Mariam Ba LAGARÉ Feat Roseline Layo - Saramanba ( Clip Officiel),Mariam Ba LAGARÉ Feat Roseline Layo - Saramanba ( Clip Officiel),Mariam BA LAGARÉ,UC62lVsmbHVWDQpRjNLwVS_g,10,Music,,0,https://i.ytimg.com/vi/elv10e2dfFI/hqdefault.jpg,fr,bm,False,217,PT3M37S,hd,False,False,False,False,1132487,26340,10948
qLck3Lk19Lg,SN,2026-06-19T05:34:35.431413+00:00,2026-06-17T22:11:55Z,🔴 LIVE | England vs Croatia - FIFA World Cup 2026 | PES 21 Simulation,🔴 LIVE | England vs Croatia - FIFA World Cup 2026 | PES 21 Simulation,SCSS SOCCER,UCSgSGK_njAYNt0zb_xfnGXA,20,Gaming,"live football, football live, football match today, football match now, ajker khela, pes21 gameplay, fifa gameplay, world cup live, fifa world cup live, fifa world cup 2026 live, fifa world cup 2026 live match, world cup 2026 live, england live, croatia live, english live match, croatia live match, england vs croatia, croatia vs england, england vs croatia live, croatia vs england live, england vs croatia live match, croatia vs england live match",22,https://i.ytimg.com/vi/qLck3Lk19Lg/hqdefault.jpg,en-US,en-US,False,7260,PT2H1M,hd,False,True,False,False,103008,264,0
Ysm6dZzcOVQ,SN,2026-06-19T05:34:35.431420+00:00,2026-06-04T16:00:36Z,HIMRA - YOUNG RICH PAPI Feat LETO (Clip Officiel),HIMRA - YOUNG RICH PAPI Feat LETO (Clip Officiel),Himra officiel,UCck5J0M6YKnXCrnuXkCFuvw,10,Music,,0,https://i.ytimg.com/vi/Ysm6dZzcOVQ/hqdefault.jpg,fr,fr,False,183,PT3M3S,hd,False,False,False,False,2740127,143029,12629
