video_id,country,fetched_at,published_at,title,localized_title,channel_title,channel_id,category_id,category_name,tags,tag_count,thumbnail,default_language,audio_language,is_live,duration,duration_raw,definition,caption_available,licensed_content,embeddable,made_for_kids,views,likes,comments
eOUjdoQiZvo,LT,2026-04-17T03:52:12.765510+00:00,2026-04-09T05:32:30Z,Beissoul & Einius - Kaip Kine (Official),Beissoul & Einius - Kaip Kine (Official),Beissoul & Einius,UCj_EMJqM6P_93v2DSWUROGw,10,Music,,0,https://i.ytimg.com/vi/eOUjdoQiZvo/hqdefault.jpg,lt,en,False,240,PT4M,hd,False,False,False,False,57933,1655,62
AjFk1cY265I,LT,2026-04-17T03:52:12.765542+00:00,2026-04-10T16:29:45Z,Digital Circus Ep 9 Finale [TRAILER],Digital Circus Ep 9 Finale [TRAILER],GLITCH,UCn_FAXem2-e3HQvmK-mOH4g,1,Film & Animation,"glitch, glitch productions, digital circus, the amazing digital circus, murder drones, Pomni, Uzi, Jax, Ragatha, Kinger, Gangle, Zooble, Caine, Bubble, 3D, Animation, 3D Animation, Indie Animation, Gummigoo",19,https://i.ytimg.com/vi/AjFk1cY265I/hqdefault.jpg,en,en,False,70,PT1M10S,hd,True,True,False,False,21834340,1501900,107789
1R-mAuw4zSY,LT,2026-04-17T03:52:12.765555+00:00,2026-04-15T11:00:00Z,SAPNŲ FABRIKAS!,SAPNŲ FABRIKAS!,Edvisss,UCgG6-eQtPhAdr3GxYEN0HJw,20,Gaming,"Edvisss, Edvis, zaidzia, Night Errors Demo, night, errors, demo, smagiai, linksmai, lietuviskai, LT, LTU, face, cam, facecam, FC, veidas, sapnu, fabrikas, siaubo, zaidimas, siaubekas",22,https://i.ytimg.com/vi/1R-mAuw4zSY/hqdefault.jpg,lt,lt,False,1070,PT17M50S,hd,False,True,False,False,18470,645,34
ajGBesp4w7c,LT,2026-04-17T03:52:12.765564+00:00,2026-04-09T10:00:03Z,Atgal,Atgal,Silvester Belt - Topic,UCMWAyNe53rrqq8biYxSec4g,10,Music,"Silvester Belt, Jessica Shy, Sprigtas, Atgal",4,https://i.ytimg.com/vi/ajGBesp4w7c/hqdefault.jpg,lt,fr,False,132,PT2M12S,hd,False,True,False,False,43537,1054,0
1OFIJdlyKyY,LT,2026-04-17T03:52:12.765573+00:00,2026-04-16T17:16:56Z,Metro 2039 - Reveal Trailer | PS5 Games,Metro 2039 - Reveal Trailer | PS5 Games,PlayStation,UC-2Y8dQb0S6DtpxNgAKoJKA,20,Gaming,"PlayStation, PS5, video games, next gen, Sony, METRO 2039, Metro Exodus, Metro Redux, Metro 2033, Metro Last Light, Deep Silver, 4A Games, FPS, Artyom, Moscow, Apocalypse, Wasteland, Dmitry Glukhovsky, STALKER, New Metro",20,https://i.ytimg.com/vi/1OFIJdlyKyY/hqdefault.jpg,en,en-US,False,375,PT6M15S,hd,False,True,False,False,803924,72531,3535
XRNeVhqC3Ro,LT,2026-04-17T03:52:12.765580+00:00,2026-04-14T08:06:49Z,KEEP BRAWL ALIVE!,KEEP BRAWL ALIVE!,Brawl Stars,UCooVYzDxdwTtGYAkcPmOgOw,20,Gaming,"brawl stars, mobile game, mobile strategy game, mobile rpg, mobile battle royale, battle royale, supercell game, keep brawl alive, metal heart, damian, community event, dani, marzio, aj, daily wins, chaos drop",16,https://i.ytimg.com/vi/XRNeVhqC3Ro/hqdefault.jpg,en,en,False,171,PT2M51S,hd,True,True,False,False,12904102,888407,550072
hfA0Z2SPPeg,LT,2026-04-17T03:52:12.765588+00:00,2026-04-02T10:01:03Z,Sugrąžinu,Sugrąžinu,Adrina - Topic,UC5rmafIVimYDjRXyED5ZrYQ,10,Music,"Adrina, Sugrąžinu",2,https://i.ytimg.com/vi/hfA0Z2SPPeg/hqdefault.jpg,en,en,False,190,PT3M10S,hd,False,True,False,False,96800,807,10
CINFIAohu4U,LT,2026-04-17T03:52:12.765597+00:00,2026-04-13T13:00:04Z,The Hunger Games: Sunrise on the Reaping (2026) Official Trailer – Joseph Zada,The Hunger Games: Sunrise on the Reaping (2026) Official Trailer – Joseph Zada,The Hunger Games,UCjvqqA-Eogozfm244OhUESw,1,Film & Animation,"SOTR, sunrise and the reaping, the hunger games, official trailer, trailer, trailer official, hd, the hunger games sunrise on the reaping, the hunger games sunrise on the reaping trailer, SOTR trailer, 2026 trailer, 2026, joseph zada, the hunger games trailer, the hunger games official trailer",15,https://i.ytimg.com/vi/CINFIAohu4U/hqdefault.jpg,en,en,False,145,PT2M25S,hd,True,True,False,False,3111093,130468,6177
QF5YpZI1wnk,LT,2026-04-17T03:52:12.765605+00:00,2026-04-11T16:00:01Z,I Survived 100 Days in Skyblock,I Survived 100 Days in Skyblock,MrBeast Gaming,UCIPPMRA040LQr5QPyJEbmXA,20,Gaming,,0,https://i.ytimg.com/vi/QF5YpZI1wnk/hqdefault.jpg,en,en,False,1362,PT22M42S,hd,True,True,False,False,35309089,621201,18429
jNah8HaGL9Y,LT,2026-04-17T03:52:12.765613+00:00,2026-04-10T08:32:16Z,Evgenya Redko - Čempionai (LIVE @ Žalgirio Arena),Evgenya Redko - Čempionai (LIVE @ Žalgirio Arena),Evgenya Redko,UCq_nFvswsXRkfpSZCtDv-Dw,10,Music,"Evgenya, redko, evgenya redko, muzika, vaizdo klipas, populiarimuzika, lietuviskos dainos, pop muzika, lithuanian music, graziosdainos, nauja muzika, jevgenija redko, lietuviska muzika 2026, dainos2026, muzika 2025, vandenyne, imantasboiko, hitas, planeta, undinele, nebeatpazistama, cinematography, asiyehuda, asaf yehuda, travelling, drone, landscape, zalgirio arena, cempionai, gyvai, cempionai live, koncertas, cempionai styginiai, zalgiris, arena",35,https://i.ytimg.com/vi/jNah8HaGL9Y/hqdefault.jpg,lt,lt,False,270,PT4M30S,hd,False,True,False,False,38738,1066,335
oSeqs_xeqv4,LT,2026-04-17T03:52:12.765621+00:00,2026-04-09T16:00:01Z,A Marvel Television Special Presentation: The Punisher: One Last Kill | Official Trailer,A Marvel Television Special Presentation: The Punisher: One Last Kill | Official Trailer,Marvel Entertainment,UCvC4D8onUfXzvjTOM-dBfEA,24,Entertainment,"marvel, comics",2,https://i.ytimg.com/vi/oSeqs_xeqv4/hqdefault.jpg,en,en,False,102,PT1M42S,hd,True,True,False,False,5488929,193365,7703
O-ipuD6qy1Q,LT,2026-04-17T03:52:12.765629+00:00,2026-04-15T02:09:21Z,Searching for a Civilization that Doesn't Exist,Searching for a Civilization that Doesn't Exist,Parrot,UCPLMPHT-d8GZOqL_AHJFdQQ,20,Gaming,"Minecraft, Minecraft SMP, SMP, Minecraft Server, LifeSteal SMP, School Minecraft Server, School SMP, School Parrot, Parrot, ParrotX2, Dream SMP, TommyInnit, LifeSteal, parrot lifesteal smp, Spoke, minecraft survival, minecraft hardcore, minecraft challenge, minecraft server, HermitCraft, MumboJumbo, Grian, why i broke 100+ bedrock, Here's Why I Made 12240 Minecraft Cakes, Minecraft Hunt, LifeSteal Season 3, 1 Heart Minecraft, LifeSteal Season 4, Why I Removed the World",29,https://i.ytimg.com/vi/O-ipuD6qy1Q/hqdefault.jpg,en,en,False,3408,PT56M48S,hd,False,True,False,False,3009736,147986,25420
7F1ET2XHQfk,LT,2026-04-17T03:52:12.765636+00:00,2026-04-09T15:59:07Z,"KATSEYE (캣츠아이) ""PINKY UP"" Official MV","KATSEYE (캣츠아이) ""PINKY UP"" Official MV",HYBE LABELS,UC3IZKseVpdzPSBaWxBxundA,10,Music,"HYBE, HYBE LABELS, 하이브, 하이브레이블즈",4,https://i.ytimg.com/vi/7F1ET2XHQfk/hqdefault.jpg,ko,ko,False,182,PT3M2S,hd,True,False,False,False,18121960,801398,139761
RIu4sFKGi6E,LT,2026-04-17T03:52:12.765643+00:00,2026-03-25T19:00:01Z,Harry Potter and the Philosopher's Stone | Official Teaser | HBO Max,Harry Potter and the Philosopher's Stone | Official Teaser | HBO Max,Harry Potter,UChPRO1CB_Hvd0TvKRU62iSQ,1,Film & Animation,"Harry Potter, Wizarding World, Warner Bros, Hogwarts, Marauders Map, Draco Malfoy, Ron Weasley, Hermione Granger, Harry Potter Lore, Potter, slytherin, ravenclaw, gryffindor, hufflepuff, hbomax, harrypotterhbo",16,https://i.ytimg.com/vi/RIu4sFKGi6E/hqdefault.jpg,en-GB,en-GB,False,129,PT2M9S,hd,True,True,False,False,10428762,271987,36747
FaqYjRs715k,LT,2026-04-17T03:52:12.765651+00:00,2026-04-16T00:08:07Z,IEM Rio 2026 - Day 3 - Stream A,IEM Rio 2026 - Day 3 - Stream A,ESL Counter-Strike,UCPq2ETz4aAGo2Z-8JisDPIA,20,Gaming,"ESL, Counter-Strike, ESL CS, ESLCS, ESL CSGO, ESL Counter-Strike, IEM, IEM CS, IEM CSGO, CSGO, esportsisawesomesauce",11,https://i.ytimg.com/vi/FaqYjRs715k/hqdefault.jpg,en,en,False,40175,PT11H9M35S,hd,False,True,False,False,1380613,12247,81
_FWYlYPncq8,LT,2026-04-17T03:52:12.765659+00:00,2026-04-01T16:00:06Z,PROFLAME - DIENOM IR NAKTIM,PROFLAME - DIENOM IR NAKTIM,Proflame,UCOGHTLkrwzzckcebvaF8njQ,10,Music,,0,https://i.ytimg.com/vi/_FWYlYPncq8/hqdefault.jpg,lt,lt,False,145,PT2M25S,hd,False,True,False,False,62135,1229,48
wek9dIw2uVM,LT,2026-04-17T03:52:12.765667+00:00,2026-03-31T16:20:54Z,Backrooms | Official Trailer HD,Backrooms | Official Trailer HD,Kane Pixels,UC8X4WT5_lUXqMjeN8bGFk9w,1,Film & Animation,,0,https://i.ytimg.com/vi/wek9dIw2uVM/hqdefault.jpg,en,en,False,132,PT2M12S,hd,False,False,False,False,15903371,644420,31012
As22eWJjGMM,LT,2026-04-17T03:52:12.765675+00:00,2026-04-12T11:16:36Z,📍AR GERAI PAŽĮSTI CS2? - Geoguessr Kova su @LTURepublic  🗺️,📍AR GERAI PAŽĮSTI CS2? - Geoguessr Kova su @LTURepublic  🗺️,AISTELO,UCf7SoyqYMdPe_vqXkd8I1lQ,20,Gaming,"CS2, CS, Counter Strike, Geoguessr, Geoguessr CS2, CS2 Challenge, Geoguessr in CS2, CS2 Maps, CS2 Maps Challenge, CS Lietuva, Lietuva, LTU REPUBLIC, AISTELO vs LTU REPUBLIC, AISTELO IR LTU REPUBLIC, LTU REPUBLIC Geoguessr, FYP, AISTELO",17,https://i.ytimg.com/vi/As22eWJjGMM/hqdefault.jpg,lt,lt,False,1788,PT29M48S,hd,False,True,False,False,19725,688,37
4iAKa5PSU_8,LT,2026-04-17T03:52:12.765683+00:00,2026-03-31T19:00:06Z,DIDO - Go Away (Original Mix),DIDO - Go Away (Original Mix),DIDO UZ,UCFZyvAqasdOwa-SOzQZU34g,10,Music,"car music, car music mix, best gangster music mix, gangster music, bass, bass music, gangster, музыка в машину, bass boosted, bass mix, car bass mix, best car mix, car bass, best car music, chill, лучшая музыка, electro house, club mix, club music, музыка в машину басс, музыка в машину с басами, крутая музыка басы, крутая музыка в машинуelectro house, music video, magic music, magic music box, magic music mix, arabic remix, dido, dido remix, go away song, go away",32,https://i.ytimg.com/vi/4iAKa5PSU_8/hqdefault.jpg,en,en,False,385,PT6M25S,hd,False,True,False,False,4172972,25094,592
s1-pfiVMKAs,LT,2026-04-17T03:52:12.765691+00:00,2026-03-31T16:00:12Z,Supergirl | Official Trailer,Supergirl | Official Trailer,DC,UCiifkYAs_bq1pt_zbNAzYGg,1,Film & Animation,"2026, Coming Soon, Craig Gillespie, DC, DC Comics, DC Studios, DCU, David Krumholtz, Emily Beecham, Eve Ridley, James Gunn, Jason Momoa, Kara Zor-El, Krypto, Matthias Schoenaerts, Milly Alcock, Supergirl, WB, Warner Bros, Warner Bros Pictures, Warner Brothers, official trailer",22,https://i.ytimg.com/vi/s1-pfiVMKAs/hqdefault.jpg,en,en-US,False,177,PT2M57S,hd,True,False,False,False,16300167,281812,16675
gGibSDSESL8,LT,2026-04-17T03:52:12.765699+00:00,2026-04-16T13:07:08Z,ОТКРЫЛ СВОЙ ПРОДУКТОВЫЙ МАГАЗИН! ВЗЯЛ КРЕДИТ - МНЕ ЖОП@,ОТКРЫЛ СВОЙ ПРОДУКТОВЫЙ МАГАЗИН! ВЗЯЛ КРЕДИТ - МНЕ ЖОП@,ГЛЕНТ,UCBYvr4SqfGQd5fTmOXVQ4Zw,20,Gaming,"глент, глент канал, глент из а4, а4, a4, глент играет, глент игры, ГЛЕНТ ИГРАЕТ В, ГЛЕНТ НОВОЕ ВИДЕО, ОТКРЫЛ СВОЙ ПРОДУКТОВЫЙ МАГАЗИН! ВЗЯЛ КРЕДИТ, ОТКРЫЛ СВОЙ ПРОДУКТОВЫЙ МАГАЗИН, ГЛЕНТ ОТКРЫЛ СВОЙ МАГАЗИН, ГЛЕНТ ОТКРЫЛ МАГАЗИН, ГЛЕНТ ОТКРЫЛ БИЗНЕС, ГЛЕНТ ВЛАДЕЛЕЦ МАГАЗИНА, ГЛЕНТ СТАЛ ВЛАДЕЛЬЦЕМ МАГАЗИНА, ГЛЕНТ ПРОДУКТОВЫЙ МАГАЗИН, ОТКРЫЛ ПРОДУКТОВЫЙ МАГАЗИН, ГЛЕНТ СТАЛ БИЗНЕСМЕНОМ, ГЛЕНТ СИМУЛЯТОР, МАГАЗИН СИМУЛЯТОР, ГЛЕНТ ИГРАЕТ В СИМУЛЯТОР МАГАЗИНА",22,https://i.ytimg.com/vi/gGibSDSESL8/hqdefault.jpg,ru,ru,False,3666,PT1H1M6S,hd,False,True,False,False,358062,16802,2700
8Dxuo8EyBDI,LT,2026-04-17T03:52:12.765707+00:00,2026-04-09T14:30:07Z,KANYE WEST - SILVER NIGHT (СЕДАЯ НОЧЬ) - Iceboyz Deep House Remix,KANYE WEST - SILVER NIGHT (СЕДАЯ НОЧЬ) - Iceboyz Deep House Remix,itsAirLow,UCKsHD-leOlL7zK9iPWgY9Ug,10,Music,"HOUSE MUSIC, CAR MUSIC, SLAP HOUSE, DEEP HOUSE, REMIX, BEST REMIXES, ITSAIRLOW, GANGSTER MUSIC, TIK TOK, VIRAL MUSIC, TRENDING MUSIC, CAR MUSIC MIX, MUSIC MIX",13,https://i.ytimg.com/vi/8Dxuo8EyBDI/hqdefault.jpg,en,en,False,345,PT5M45S,hd,False,False,False,False,812117,9017,169
3_9vCamtuPY,LT,2026-04-17T03:52:12.765715+00:00,2026-03-17T16:19:02Z,Dune: Part Three | Official Teaser Trailer,Dune: Part Three | Official Teaser Trailer,Warner Bros.,UCjmJDM5pRKbUlVIzDYYWb6g,1,Film & Animation,"Action, Anya Taylor-Joy, Brian K Vaughan, Charlotte Rampling, Coming Soon, Denis Villeneuve, Dune, Dune Messiah, Dune: Part Three, Florence Pugh, Ida Brooke, Isaach De Bankolé, Jason Momoa, Javier Bardem, Messiah, Nakoa-Wolf Momoa, Rebecca Ferguson, Robert Pattinson, Sci Fi, Timothée Chalamet, Trilogy, Warner Bros, Zendaya",23,https://i.ytimg.com/vi/3_9vCamtuPY/hqdefault.jpg,en,en-US,False,150,PT2M30S,hd,True,False,False,False,29195523,622398,29814
7ljjB1xF2nY,LT,2026-04-17T03:52:12.765724+00:00,2026-04-16T15:06:55Z,ONEX.LT l 21 Epizodas - The End?,ONEX.LT l 21 Epizodas - The End?,Popoff INC,UCOPJUvkMMalxkxtT6xiPvfg,20,Gaming,,0,https://i.ytimg.com/vi/7ljjB1xF2nY/hqdefault.jpg,lt,lt,False,2344,PT39M4S,hd,False,False,False,False,3031,454,72
wy7_PFy-ztQ,LT,2026-04-17T03:52:12.765731+00:00,2026-04-13T10:02:59Z,Like a Prayer,Like a Prayer,Josh Fawaz - Topic,UCMyXC4pUKh0Yw0b7G5_i9Tw,10,Music,"Josh Fawaz, Like a Prayer",2,https://i.ytimg.com/vi/wy7_PFy-ztQ/hqdefault.jpg,en,en,False,131,PT2M11S,hd,False,True,False,False,312312,10298,156
3jxsNg9UGuE,LT,2026-04-17T03:52:12.765739+00:00,2026-04-14T11:49:14Z,DISPATCH #01 | NAUJO ŽAIDIMO SERIJOS,DISPATCH #01 | NAUJO ŽAIDIMO SERIJOS,LTU Republic 2,UCeh-LKZdJzMRyTB-iSjvKHw,20,Gaming,"lturepublic 2, lturepublic, gta, gtav, gta5, gta race, gta roleplay, zaidimai, twitch, streamai, streamas, streameris, subatonas, edvisss, Dispatch, resident evil 9, story games, zaidimu serijos, damage planas",19,https://i.ytimg.com/vi/3jxsNg9UGuE/hqdefault.jpg,lt,en-GB,False,3331,PT55M31S,hd,False,True,False,False,7968,506,59
yNa8jP4zoJo,LT,2026-04-17T03:52:12.765746+00:00,2026-04-13T14:00:06Z,Laufey - Madwoman (Official Music Video),Laufey - Madwoman (Official Music Video),Laufey,UChpKl3waLmccNeYH9LGYjUQ,10,Music,"laufey, jazz, indie, singer, songwriter, madwoman, mad, woman, new music, matter of time, matter, of, time, final, hour, Hudson Williams, Alysa Liu, Megan Skiendiel, Lola Tung, hudson, williams, alysa, liu, megan, skiendiel, lola, tung, women, new laufey",29,https://i.ytimg.com/vi/yNa8jP4zoJo/hqdefault.jpg,en,en,False,285,PT4M45S,hd,False,True,False,False,6789005,582402,17024
HFhJebFiMJs,LT,2026-04-17T03:52:12.765754+00:00,2026-04-12T16:24:22Z,KAIP AŠ TAPAU SAVO RENGINIO NUGALĖTOJU? (Lietuvos GeoGuessr Čempionato Užkulsiai),KAIP AŠ TAPAU SAVO RENGINIO NUGALĖTOJU? (Lietuvos GeoGuessr Čempionato Užkulsiai),LTU Republic,UCHYZOrUANsJHRIVnj-4qMAQ,20,Gaming,"LTURepublic, LTU, Republic, Lietuva, Lithuania, lietuviskai, zita, role play, gtav role play, svarbeuse dariti, gtav, gta online, Populiariausi zaidimai, geriausi zaidimai pc, vel tie patys, negyvas eteris, whydotas, demiko, edvisss, Herkus, stt, laisves tv x, antanasj, cestovas, cheska, martas tankevicius, mantas stonkus, mantas katleris, zaidimu balsas, gta, gaming, playstation, jusky, loco, jlcs2, samoshka, aistelo, aurimas valujavicius, geoguessr, ruta asvydyte, damage planas, cempionatas",42,https://i.ytimg.com/vi/HFhJebFiMJs/hqdefault.jpg,lt,lt,False,4518,PT1H15M18S,hd,False,True,False,False,13804,473,39
b6txD66Q8fo,LT,2026-04-17T03:52:12.765762+00:00,2026-04-06T18:08:35Z,Dj DEMON-Cold Breath,Dj DEMON-Cold Breath,Dj DEMON,UChBvcq6e3K9KPno_TLIYLvg,22,People & Blogs,,0,https://i.ytimg.com/vi/b6txD66Q8fo/hqdefault.jpg,en,en,False,479,PT7M59S,hd,False,False,False,False,1530765,10853,283
SGbZYKN9P0U,LT,2026-04-17T03:52:12.765769+00:00,2026-04-15T11:30:21Z,VEIKSMAS KAIP FILME? GTA ROLEPLAY LIETUVIŠKAI (OneX.lt),VEIKSMAS KAIP FILME? GTA ROLEPLAY LIETUVIŠKAI (OneX.lt),Fuxeris,UC2Wz6pfNFWpGcVYdq1QHTGg,20,Gaming,"fuxeris, gta lietuviškai, gta lietuviu kalba, gta roleplay lietuviu kalba, lietuviskai gta, lietuviu roleplay, gta funny moments, gta roleplay linksmi momentai, GTA RP, gta rp lietuviškai, roleplay, aidis, roleplay lietuviskai, roleplay fuxeris, fuxeris gta, fuxeris lietuviškai roleplay, fuxeris lietuviskai roleplay, prankas",18,https://i.ytimg.com/vi/SGbZYKN9P0U/hqdefault.jpg,lt,lt,False,2189,PT36M29S,hd,False,True,False,False,4048,228,9
MDPXDa5G4Gg,LT,2026-04-17T03:52:12.765777+00:00,2026-03-26T23:20:46Z,Ярослав Леонов — Твори добро (Official Video),Ярослав Леонов — Твори добро (Official Video),Ярослав Леонов,UC20WT22AGOjqghVU0yVTKKg,10,Music,"твори добро, ярослав леонов, твори добро песня, музыка со смыслом, душевные песни, мотивационная песня, добро песня, песня про добро, leonov, leonov music, boss leonov",11,https://i.ytimg.com/vi/MDPXDa5G4Gg/hqdefault.jpg,ru,ru,False,193,PT3M13S,hd,False,False,False,False,2380528,31476,1410
5uWqAazS2Ms,LT,2026-04-17T03:52:12.765785+00:00,2026-04-13T12:00:11Z,PABĖGIMAS NUO DANTISTO!,PABĖGIMAS NUO DANTISTO!,EnoxsPC,UCTnFXscfndF6urqswqdgjHg,20,Gaming,"enoxspc, enoxaspc, minecraft, bet, minecraft but, roblox, robloxas, enoxas, viskas, ziureti, tiesiogiai, filmas, ltu republic, prikolai, Enoxas, Lietuviškai, LTU, mentai, Edvisss, zaidzia, mine, craft, iššūkiai, pabėgimas, enoxas pc, enoxas stream, suvalkietiskas minecraft, enoxas minecraft su seniu, minecraft hardcore, pewdiepie, samp, lietuviskai, dabar, demonas, edvisss, mrbegėdis, doors, doors 2, kalmaras, kempiniukas, slenderis, slender, helovinas, siaubas, robloxlt, slepynes, žaidimai, nemokamai, rollton, siaubekas",50,https://i.ytimg.com/vi/5uWqAazS2Ms/hqdefault.jpg,lt,lt,False,929,PT15M29S,hd,False,True,False,False,9709,480,36
zQsUZUM49Wk,LT,2026-04-17T03:52:12.765793+00:00,2026-04-14T07:00:06Z,PIKASO - Po Skirtingom Kaldrom,PIKASO - Po Skirtingom Kaldrom,Pikaso oficialus puslapis,UCrdLb8ylc7Th9Ibl2gawoIQ,24,Entertainment,"pikaso, grupe pikaso, nauja daina, naujausia daina, po skirtingom kaldrom, pikaso po skirtingom kaldrom, lietuviska muzika, lietuviskos dainos, lietuviskos, hitai, hitas, pop muzika, pop dainos, dainos 2026, muzika 2026, naujausia muzika 2026, lietuviska muzika 2026, klipas, naujos dainos, naujausios, daina, dainos, muzika, klausomiausia muzika, naujausia muzika, populiariausios, nauji lietuviski hitai, grazios lietuviskos dainos, pikaso muzika, grazi lietuviska muzika",30,https://i.ytimg.com/vi/zQsUZUM49Wk/hqdefault.jpg,lt,lt,False,141,PT2M21S,hd,False,True,False,False,40213,463,37
mZmSi4m2EqM,LT,2026-04-17T03:52:12.765801+00:00,2026-04-16T13:03:19Z,"I made an ""OnlyPass"" account! - (OP#1)","I made an ""OnlyPass"" account! - (OP#1)",Lex - Brawl Stars,UC4yh9rj_cPT77it63N14HQg,20,Gaming,"lex, brawl stars, lex brawl stars, Lex F2P, Lex P2W, Brawl Stars Brawl Pass, Brawl Stars Pro Pass, brawl stars pay to win, Brawl Stars Ranked",9,https://i.ytimg.com/vi/mZmSi4m2EqM/hqdefault.jpg,en,en,False,2622,PT43M42S,hd,False,True,False,False,179703,8985,1129
YPp8htildH4,LT,2026-04-17T03:52:12.765808+00:00,2026-03-26T08:00:00Z,"Angelou, Silvester Belt - APSIRENGUS VASARA (Remix)","Angelou, Silvester Belt - APSIRENGUS VASARA (Remix)",angelou,UCbE6_pWcMfrdyhtIkvf3nhg,10,Music,"Angelou, Silvester Belt, Apsirengus vasara, remix, angelou apsirengus vasara, silvester belt apsirengus vasara, daina, dainos, lietuviska muzika, naujausia muzika, naujausios dainos, hitas, lietuviski hitai, lietuviskas hitas, dainos 2026, daina 2026, muzika 2026, naujausios dainos 2026, grazios dainos, pop muzika, angelou ir silvester belt, klausomiausia muzika, muzika vasarai 2026, vasara 2026, apsirengus vasara remix",25,https://i.ytimg.com/vi/YPp8htildH4/hqdefault.jpg,lt,lt,False,176,PT2M56S,hd,False,True,False,False,96490,1230,27
_bsy57lFVKw,LT,2026-04-17T03:52:12.765815+00:00,2026-04-15T20:00:34Z,I Put 19 YouTubers on HARDCORE Skyblock,I Put 19 YouTubers on HARDCORE Skyblock,Baablu,UCOxAZ3wFgF6MJpPK1J6RoeA,20,Gaming,"minecraft manhunt, minecraft manhunt but, minecraft, manhunt minecraft, minecraft challenge, minecraft manhunt with a twist, minecraft manhunt dream, minecraft but challenge, minecraft manhunt custom, minecraft speedrunner vs hunter, minecraft but, boosfer, baablu, wemmbu, unstable smp, feinberg, ajthebold, babblu, bablu, babluu, baabluu, saparata, 10 youtubers minecraft, saps, isaacwhy, speedsilver, evbo, drdonut, minecraft skyblock, hardcore skyblock, 100 days skyblock, 10 youtubers skyblock",32,https://i.ytimg.com/vi/_bsy57lFVKw/hqdefault.jpg,en,en,False,2431,PT40M31S,hd,False,True,False,False,750843,43907,2195
bwdfNpx8kLU,LT,2026-04-17T03:52:12.765823+00:00,2026-04-16T01:54:03Z,Sólo Quiero Más (Eurovision Version),Sólo Quiero Más (Eurovision Version),Lion Ceccah - Topic,UCfL5aX2SeWFlzbaox8DJs_w,10,Music,"Lion Ceccah, Tomas Alenčikas, Sólo Quiero Más (Eurovision Version)",3,https://i.ytimg.com/vi/bwdfNpx8kLU/hqdefault.jpg,es,en,False,183,PT3M3S,hd,False,True,False,False,6645,578,0
g5onDCspbs8,LT,2026-04-17T03:52:12.765830+00:00,2026-04-14T22:17:51Z,ROBLOX DING DONG DITCH FOR BRAINROTS..,ROBLOX DING DONG DITCH FOR BRAINROTS..,Foltyn,UCRkuUgtDAL4XSU5jB40J_wA,20,Gaming,"foltyn, foltyn roblox, roblox, roblox foltyn, foltyn family, funny, no swearing, foltyn family roblox, roblox foltyn family, blade ball, roblox blade ball, foltyn blade ball, ding dong ditch brainrots, ding dong ditch brainrots roblox, roblox ding dong ditch for brainrots, foltyn brainrot games, foltyn and caylus, foltyn and caylus playing roblox, foltyn and caylus playing roblox steal a brainrot, foltyn brainrot",20,https://i.ytimg.com/vi/g5onDCspbs8/hqdefault.jpg,en,en-US,False,748,PT12M28S,hd,False,True,False,False,1313812,19344,2178
z55L5kP_67U,LT,2026-04-17T03:52:12.765837+00:00,2026-04-10T07:00:11Z,Katarsis x Lemon joy - Balta meilė (live),Katarsis x Lemon joy - Balta meilė (live),Katarsis,UCaJoIlHBEEmCrix2j-slMJA,10,Music,,0,https://i.ytimg.com/vi/z55L5kP_67U/hqdefault.jpg,lt,lt,False,298,PT4M58S,hd,False,True,False,False,24769,2420,145
Avlj3qFQr1g,LT,2026-04-17T03:52:12.765844+00:00,2026-04-16T22:44:53Z,SUKAM VARKES!!! #102,SUKAM VARKES!!! #102,Makentošas,UCkY-YJyje-SFRZ0DeiJkkzQ,20,Gaming,,0,https://i.ytimg.com/vi/Avlj3qFQr1g/hqdefault.jpg,lt,en-US,False,28182,PT7H49M42S,hd,False,True,False,False,2664,167,0
WxrNKj6FFMo,LT,2026-04-17T03:52:12.765851+00:00,2026-03-26T03:00:23Z,DIAZZA – Dream (Original Mix) [2026],DIAZZA – Dream (Original Mix) [2026],DIAZZA,UCu7DJRzeHpIU_KKOAO_996Q,24,Entertainment,"DIAZZA, Dream Original Mix, DIAZZA Dream 2026, Italo Disco 2026, Relaxing Italo Disco, Danekoo1 inspired, KorgStyle Life, Licented Production, Dreamy Electronic Music, Slow Italo Disco, Romantic Disco, Chillwave 2026, Ethereal Vocals, Night Drive Music, Atmospheric Disco, DIAZZA Music, New Italo Disco, 80s Vibe Modern, Relaxing Music for Dreaming, Synthwave Dream, DIAZZA Lyrics, Deep Disco Mix, Emotional Electronic, Korg Style Music, Dream Pop 2026, Ambient Disco.",26,https://i.ytimg.com/vi/WxrNKj6FFMo/hqdefault.jpg,en,en,False,325,PT5M25S,hd,False,True,False,False,3581828,22699,488
1TI4J0rB83s,LT,2026-04-17T03:52:12.765859+00:00,2026-04-15T11:04:00Z,Day 2 | IEM Rio 2026 Group Stage | 🎙КРИВОЙ ЭФИР,Day 2 | IEM Rio 2026 Group Stage | 🎙КРИВОЙ ЭФИР,SL4M & Counter-Strike ,UCd3C0cHsp7xSj44UYetK1Nw,20,Gaming,"sl4m, IEMRIO2026, IEM, IEMRIO, слэм стрим, слэм ютуб, IEM на русском, ием на русском, #SL4M, Counter, Strike, ESLCS, CS, Pro CS, PGL Pro CS, PGL Tournament, PGL Pro Tournaments, PGL Highlights, Counter Strike best plays, Professional Counter Strike, cs2, CS2Highlights, Counter Strike, Spirit, Falcons, donk, VP, VirtusPro, FURIA, s1mple",30,https://i.ytimg.com/vi/1TI4J0rB83s/hqdefault.jpg,ru,ru,False,39043,PT10H50M43S,hd,False,True,False,False,639437,16941,4
f-_Q9Tty88M,LT,2026-04-17T03:52:12.765867+00:00,2026-04-09T12:16:49Z,Kanye West - Silver Night (Full Performance),Kanye West - Silver Night (Full Performance),Elvin Cena Production🎵,UC2A5ngU6oFXTkZlH1j55pQA,10,Music,,0,https://i.ytimg.com/vi/f-_Q9Tty88M/hqdefault.jpg,fr,en,False,407,PT6M47S,hd,False,False,False,False,842323,19799,559
2GLi240fXzA,LT,2026-04-17T03:52:12.765874+00:00,2026-04-16T17:00:06Z,Xbox First Look: METRO 2039 | 4A Games + Deep Silver,Xbox First Look: METRO 2039 | 4A Games + Deep Silver,Xbox,UCjBp_7RuDBUYbd1LegWEJ8g,20,Gaming,"Xbox, Xbox One, Xbox Series X, Xbox Series S, METRO2039, METRO, FirstLook, 4A, Deep Silver, Deepsilver",10,https://i.ytimg.com/vi/2GLi240fXzA/hqdefault.jpg,en,en,False,900,PT15M,hd,True,False,False,False,507880,48043,3162
7LOwus7Bmec,LT,2026-04-17T03:52:12.765881+00:00,2026-04-10T11:01:11Z,OXXXYMIRON — EXIT (клип 2026),OXXXYMIRON — EXIT (клип 2026),oxxxymironofficial,UCCzp3DWpSc0s5wXYDghjM9A,10,Music,,0,https://i.ytimg.com/vi/7LOwus7Bmec/hqdefault.jpg,ru,ru,False,308,PT5M8S,hd,False,True,False,False,1494667,94968,11243
RbYbi9hncxg,LT,2026-04-17T03:52:12.765905+00:00,2026-04-16T13:00:29Z,Using a streamer as BAIT for my trap,Using a streamer as BAIT for my trap,JudeLow,UC2gufCjSyNihNbOEZE50bwQ,20,Gaming,,0,https://i.ytimg.com/vi/RbYbi9hncxg/hqdefault.jpg,en,en,False,654,PT10M54S,hd,False,True,False,False,549387,31065,1235
Z-N-YJYFZJw,LT,2026-04-17T03:52:12.765913+00:00,2026-04-02T22:02:27Z,done done done,done done done,Ordinary Kid - Topic,UCwdVbooKIHQRC1RIC_Bq_xw,10,Music,"Ordinary Kid, done done done",2,https://i.ytimg.com/vi/Z-N-YJYFZJw/hqdefault.jpg,en,en,False,117,PT1M57S,hd,False,True,False,False,1031413,9538,0
iYdiKMW8R2o,LT,2026-04-17T03:52:12.765920+00:00,2026-04-12T01:54:22Z,ROBLOX MAKEUP UPDATE -_-,ROBLOX MAKEUP UPDATE -_-,Flamingo,UCm-X6o81nRsXQTmqpyArkBQ,20,Gaming,"Family, friendly",2,https://i.ytimg.com/vi/iYdiKMW8R2o/hqdefault.jpg,en,en,False,972,PT16M12S,hd,False,True,False,False,1568852,93064,8790
