video_id,country,fetched_at,published_at,title,localized_title,channel_title,channel_id,category_id,category_name,tags,tag_count,thumbnail,default_language,audio_language,is_live,duration,duration_raw,definition,caption_available,licensed_content,embeddable,made_for_kids,views,likes,comments
zH41Pif9P1s,ES,2025-12-19 02:27:57.181100+00:00,2025-12-16 05:01:15+00:00,Wisin & Yandel - Porqué Me Tratas Así? (Visualizer),Wisin & Yandel - Porqué Me Tratas Así? (Visualizer),WisinYYandelVEVO,UCPypl5EbwJfZzDOT_Ln-_QA,10,Music,"Wisin Yandel, Machete Music, Reggaeton",3,https://i.ytimg.com/vi/zH41Pif9P1s/hqdefault.jpg,es,es,False,244,PT4M4S,hd,False,True,,,436424,2443,61
Xq8x47ky2Tw,ES,2025-12-19 02:27:57.181107+00:00,2025-12-16 16:00:53+00:00,The Pitt Season 2 | Official Trailer | HBO Max,The Pitt Season 2 | Official Trailer | HBO Max,HBO Max,UCx-KWLTKlB83hDI6UKECtJQ,24,Entertainment,"hbo max, hbo, hbo trailer, new on hbo, hbo max originals, hbo max trailer, hbo max teaser, hbo max series, hbo max youtube, the pitt, pitt, noah wyle, pitt hbo, the pitt hbo, the pitt hbo max, the pitt season 2, the pitt trailer, dr robby, the pitt 2026, er, the pit, pit trailer, pitt tv show, the pitt tv show, the pit hbo max, emergency room, katherine lanasa, shawn hatosy, dr langdon, patrick ball, sepideh moafi, isa briones, fiona dourif, taylor dearden",34,https://i.ytimg.com/vi/Xq8x47ky2Tw/hqdefault.jpg,en,en,False,128,PT2M8S,hd,True,True,,,5584144,16503,765
TB7LmUIgWjU,ES,2025-12-19 02:27:57.181114+00:00,2025-12-16 19:00:26+00:00,"🔴 EL TEAM RNG, ¡¿Y SOY SU LIDER?! 😡 DÍA #5 en la POKEMON TWITCH CUP 4 🏆 XOKAS","🔴 EL TEAM RNG, ¡¿Y SOY SU LIDER?! 😡 DÍA #5 en la POKEMON TWITCH CUP 4 🏆 XOKAS",elxokasTV,UCtL_e_TbaHj7TvXI6P_Z3Ow,24,Entertainment,"elxokas, directo, xokas, chokas, chocas, wow, streamer, xocas, elxocas, stream, twitch, capítulo, episodio, vod, video, resubido, secundario, canal, xokas tv, elxokas tv",20,https://i.ytimg.com/vi/TB7LmUIgWjU/hqdefault.jpg,es-ES,es,False,32961,PT9H9M21S,hd,False,True,,,27122,633,51
I1dMl1yCib8,ES,2025-12-19 02:27:57.181122+00:00,2025-12-13 18:45:06+00:00,"Grupo Frontera, Fuerza Regida - COQUETA (Letra)","Grupo Frontera, Fuerza Regida - COQUETA (Letra)",Mix Sabrosura,UCZYpPtT3X566MCx2kIvqmjg,22,People & Blogs,,0,https://i.ytimg.com/vi/I1dMl1yCib8/hqdefault.jpg,es,es,False,242,PT4M2S,hd,False,True,,,580348,968,8
kD0EZHwb9Zo,ES,2025-12-19 02:27:57.181128+00:00,2025-12-16 23:00:08+00:00,Silksong: Sea of Sorrow Teaser Trailer Analysis,Silksong: Sea of Sorrow Teaser Trailer Analysis,mossbag,UCTvH45HvnOzqXvfNJqdc3xg,20,Gaming,"Hollow Knight, Silksong, Team Cherry, Sea of Sorrow",4,https://i.ytimg.com/vi/kD0EZHwb9Zo/hqdefault.jpg,en,en,False,465,PT7M45S,hd,True,True,,,240323,18920,1059
UGNqCXJMHKY,ES,2025-12-19 02:27:57.181135+00:00,2025-12-17 11:01:02+00:00,LE DAMOS CAZA A UNOS SECRETAS DEL BARRIO 🔫 | GTA RP,LE DAMOS CAZA A UNOS SECRETAS DEL BARRIO 🔫 | GTA RP,TomateKing,UCbRUQjHvH3IkHEa4sw6v01w,20,Gaming,"gtaonline, grandtheftauto, rockstargames, online, gtavonline, gtaphotography, playstation, gaming, gamer, rockstareditor, gtafive, rockstar, gtaoutfits, grandtheftautov, lossantos, videogames, games, gtapics, gtaphotographers, photography, gtafiveonline, tomateking, roleplay, fivem, gta5, funnyvideo, funny, #gitanos, #niños, #gta5, #gtavonline, #gtavrp, #gta, rolpley, rp, gipsy, videojuegos, juegos, gameplay, twitch, roleplaying, roleplayinggames, yeray, español, españollatino, stream, banda, gitano, gtarpmoments, destacame, tendencias, modsgta5",52,https://i.ytimg.com/vi/UGNqCXJMHKY/hqdefault.jpg,es-ES,es-ES,False,13957,PT3H52M37S,hd,False,True,,,14395,361,20
gpefDjM8fnk,ES,2025-12-19 02:27:57.181144+00:00,2025-12-11 21:40:36+00:00,Camila - Mientes(Letra),Camila - Mientes(Letra),Scribella,UCsx0hdXoufYIHs73dVtDpog,22,People & Blogs,,0,https://i.ytimg.com/vi/gpefDjM8fnk/hqdefault.jpg,es,es,False,206,PT3M26S,hd,False,True,,,228511,275,5
hbTiYe3_Lu8,ES,2025-12-19 02:27:57.181151+00:00,2025-12-16 20:26:36+00:00,REACCIONANDO A TRAILERS FUNABLES DE DISNEY (ÚLTIMA PARTE) 💀,REACCIONANDO A TRAILERS FUNABLES DE DISNEY (ÚLTIMA PARTE) 💀,Speak,UCSVEca5R1X6bMjrzV0jIlwg,24,Entertainment,"REACCIONANDO A TRAILERS FUNABLES DE DISNEY 🤡, reaccionando, trailers, funables, de, disney, meme, memes, comedia, entretenimiento, johan speak, johan, speak, reaccionando a trailers, trailers funables de disney, trailers de disney con ia, parte 2, segunda parte, #2, parte 3, #3, parte final",22,https://i.ytimg.com/vi/hbTiYe3_Lu8/hqdefault.jpg,es,es,False,587,PT9M47S,hd,False,True,,,278792,14674,460
