video_id,country,fetched_at,published_at,title,localized_title,channel_title,channel_id,category_id,category_name,tags,tag_count,thumbnail,default_language,audio_language,is_live,duration,duration_raw,definition,caption_available,licensed_content,embeddable,made_for_kids,views,likes,comments
GkTWxDB21cA,ES,2025-12-19 02:27:57.180744+00:00,2025-12-15 17:00:06+00:00,ROSALÍA - La Perla (Official Video) ft. Yahritza Y Su Esencia,ROSALÍA - La Perla (Official Video) ft. Yahritza Y Su Esencia,RosaliaVEVO,UCy2bCk5KnIfjmWYFHMZcd5w,10,Music,"ROSALÍA, Columbia, Latin, Alternative, Rosalia, New Rosalia, New Rosalia Album, Rosalia Lyrics, Rosalia Album, Motomami, El Mal Querer, Berghain, LUX, Rosalia Lux, LUX era, Flamenco, Classical, Reggaeton, Rosalia Live, Rosalia Performance, LUX Tour, Rosalia tour, New Rosalia Video, Yahritza Su Esencia, La Perla, Rosalia Stillz, Stillz, Es Una Perla, Nadie Se Fia, La decepcion local, rompecorazones nacional, el mayor destastre mundial",32,https://i.ytimg.com/vi/GkTWxDB21cA/hqdefault.jpg,es,es,False,210,PT3M30S,hd,False,True,,,3750572,170237,7380
R_REjCDRHko,ES,2025-12-19 02:27:57.180784+00:00,2025-12-15 13:40:01+00:00,Stranger Things 5 | Tráiler del volumen 2 | Netflix España,Stranger Things 5 | Tráiler del volumen 2 | Netflix España,Netflix España,UCT2UUebPuLke_BShrDh_YEA,24,Entertainment,"Caleb McLaughlin, Charlie Heaton, David Harbour, Dustin, Finn Wolfhard, Gaten Matarazzo, Jamie Campbell Bower, Jefe Hopper, Joe Keery, Jonathan Byers, Joyce Byers, Lucas, Max, Maya Hawke, Mike Wheeler, Millie Bobby Brown, Nancy Wheeler, Natalia Dyer, Netflix, Noah Schnapp, Once, Robin Buckley, Sadie Sink, Steve Harrington, Stranger Things 5, Will Byers, Winona Ryder",27,https://i.ytimg.com/vi/R_REjCDRHko/hqdefault.jpg,es,en-US,False,136,PT2M16S,hd,False,False,,,229694,6660,261
hsUMK-dFT98,ES,2025-12-19 02:27:57.180796+00:00,2025-12-17 09:30:19+00:00,tenemos NUEVO Pokémon GOD | KNEKRO y @IlloJuan_ | POKÉMON TWITCH CUP 4 #4,tenemos NUEVO Pokémon GOD | KNEKRO y @IlloJuan_ | POKÉMON TWITCH CUP 4 #4,knekroTV,UCsWLy--m0Uc2briImMT7Slw,20,Gaming,"knekro reacciona a knekro, knekro, knekro en directo, knekro resubido, knekro en directo resubido, directos de knekro, knekro directos, knekro videos, knekro pokemon, knekro mejores momentos, knekro reacciona, knekro directos resubidos, knekro oficial, knekro clips, pokemon, pokemon kenekro, twitch cup, illojuan, illojuan twitch cup, knekro juan pokemon, knekro illojuan pokemon, knekro twitch cup 4, primeras medallas, equipo illojuan, sexta medalla, septima medalla, xokas",27,https://i.ytimg.com/vi/hsUMK-dFT98/hqdefault.jpg,es,es-ES,False,29336,PT8H8M56S,hd,False,True,,,52584,1243,39
FLWExLZA5iQ,ES,2025-12-19 02:27:57.180806+00:00,2025-12-14 14:00:07+00:00,Angeliyo El Blanco | Será Mía #Tiktok,Angeliyo El Blanco | Será Mía #Tiktok,ANGELIYO EL BLANCO,UCjM5aVcWUJn0ol6C9CMqb0Q,10,Music,"Angeliyo el Blanco, Será Mía, Angeliyo el Blanco Será, Angeliyo el Blanco Será Mía, angeliyo el blanco soltera, angeliyo el blanco, angeliyo el blanco ft jose rey, angeliyo el blanco canastera, angeliyo el blanco la llama, angeliyo el blanco ft iam carla, angeliyo el blanco jjose rey me enamore, angeliyo el blanco x jose rey me enamore, angeliyo el blanco cuando, bailen angeliyo el blanco, angeliyo el blanco ft c de cama, Angeliyo El Blanco | Será Mía, angeliyo el blanco es mia",17,https://i.ytimg.com/vi/FLWExLZA5iQ/hqdefault.jpg,es-ES,es-ES,False,157,PT2M37S,hd,False,True,,,266868,4592,1824
EGr_N0vu0T0,ES,2025-12-19 02:27:57.180815+00:00,2025-12-16 16:17:21+00:00,EL DÍA DE LA REVELACIÓN - Teaser Tráiler Oficial (Universal Pictures),EL DÍA DE LA REVELACIÓN - Teaser Tráiler Oficial (Universal Pictures),Universal Spain,UC6Raldd8iIExwu5BNS_hzvw,1,Film & Animation,"Universal, cine, película, estreno, Teaser Trailer, trailer, trailer oficial, el dia de la revelacion, alienígenas, extraterrestres, Teaser, thriller, Steven Spielberg, Amblin Entertainment, Emily Blunt, Josh O’Connor, Colin Firth, Eve Hewson, Colman Domingo",19,https://i.ytimg.com/vi/EGr_N0vu0T0/hqdefault.jpg,es,es,False,126,PT2M6S,hd,False,False,,,1009160,4757,503
hXXyDmQZNbQ,ES,2025-12-19 02:27:57.180824+00:00,2025-12-15 17:29:26+00:00,NIETO Y ABUELO A POR LA GLORIA 💦🥰 - Pokémon Twitch Cup 4 ft. Knekro #1,NIETO Y ABUELO A POR LA GLORIA 💦🥰 - Pokémon Twitch Cup 4 ft. Knekro #1,IlloJuan,UCKvoBRFqMNqvuSvFBiNadgw,20,Gaming,"illojuan, mejores momentos illojuan, clips illojuan, illojuan clips, twitch illojuan, illojuan directo, lmdshow, ldmshow, mejores momentos de illojuan",9,https://i.ytimg.com/vi/hXXyDmQZNbQ/hqdefault.jpg,es,es,False,31748,PT8H49M8S,hd,False,True,,,211586,6266,283
PudTcn8y8Hs,ES,2025-12-19 02:27:57.180832+00:00,2025-12-15 22:16:32+00:00,“LA NOIA” - CRISTINA | GALA FINAL | #OT2025,“LA NOIA” - CRISTINA | GALA FINAL | #OT2025,Operación Triunfo Oficial,UCc1sAhdaLjfJi11X1awO-yg,24,Entertainment,"la noia, cristina, angelina mango, ot2025, gala final, operación triunfo, ot, ot 2025, ot25, prime video",10,https://i.ytimg.com/vi/PudTcn8y8Hs/hqdefault.jpg,es-ES,es,False,31,PT31S,hd,False,True,,,73104,903,53
tGLz5M0uhFs,ES,2025-12-19 02:27:57.180839+00:00,2025-12-16 16:30:17+00:00,Avengers: Doomsday - First Trailer (2026) Marvel Studios,Avengers: Doomsday - First Trailer (2026) Marvel Studios,Teaser Universe,UCa2MXjBtWn91WPHWRBCLI6Q,1,Film & Animation,"avengers doomsday, doomsday trailer, avengers doomsday trailer chris evans, avengers doomsday robert downey jr, avengers doomsday leaks, avengers doomsday trailer, avengers doomsday 2026 trailer, tobey maguire doomsday trailer, doomsday trailer leak, avengers doomsday official trailer, avengers doomsday trailer official, robert downey jr dr doom trailer, avengers doomsday tobey maguire, trailers, avengers doomsday new trailer, avengers doomsday cast, avengers doomsday cast reveal",17,https://i.ytimg.com/vi/tGLz5M0uhFs/hqdefault.jpg,en,en,False,70,PT1M10S,hd,False,True,,,2490076,22641,1409
I5Gu9Ukp8X4,ES,2025-12-19 02:27:57.180847+00:00,2025-12-15 19:02:23+00:00,"Epic, necesitamos hablar...","Epic, necesitamos hablar...",Rubius Z,UCcjIvuxmWlS5IEQ0JdPV4Ng,20,Gaming,"elrubius, rubius, nuevo, 2025, fortnite, kim kardashian, kim, trickshot, victory, victory royale, victoria, skin, nueva, kardashian, kardashan, hot, epic, epic games, actualizacion, tienda, meme, memes, tiktok",23,https://i.ytimg.com/vi/I5Gu9Ukp8X4/hqdefault.jpg,es,es,False,1493,PT24M53S,hd,False,True,,,1660597,83050,1561
TqqjV0XIfWg,ES,2025-12-19 02:27:57.180855+00:00,2025-12-17 00:00:22+00:00,"Beéle, Elvis Crespo - la patadita (Video Oficial)","Beéle, Elvis Crespo - la patadita (Video Oficial)",BeeleVEVO,UCYQV_J85c0cjxixuXIoEnzw,10,Music,"la patadita beele elvis crespo, la patadita beele, beéle, beele 2025, la patadita letra beele, la patadita de la buena suerte beele elvis, beele jorge baron, jorge baron, elvis crespo, musica novenas, musica fiestas navidenas, mujeriejo ryan castro, Cheerful, la patadita",14,https://i.ytimg.com/vi/TqqjV0XIfWg/hqdefault.jpg,es,es,False,215,PT3M35S,hd,True,True,,,306958,18071,617
F-e703WbvtE,ES,2025-12-19 02:27:57.180862+00:00,2025-12-16 16:40:00+00:00,"EL DÍA DE LA REVELACIÓN Tráiler Español (2026) Steven Spielberg, Emily Blunt","EL DÍA DE LA REVELACIÓN Tráiler Español (2026) Steven Spielberg, Emily Blunt",Boxoffice Tráilers Español,UCdW_XfqcobQ79Oj4ur6-Ylg,1,Film & Animation,"tráiler, tráiler español, latino, El Día de la Revelación, El Día de la Revelación Tráiler, Emily Blunt, Steven Spielberg, Josh O'Connor, 2026, doblado",10,https://i.ytimg.com/vi/F-e703WbvtE/hqdefault.jpg,es,es-ES,False,141,PT2M21S,hd,False,True,,,70540,1124,164
_WGUh0YOH9A,ES,2025-12-19 02:27:57.180870+00:00,2025-12-16 22:41:57+00:00,"MEJORES MOMENTOS POKEMON TWITCH CUP 4 #10😂🔥| ILLOJUAN, KNEKRO, FOLAGOR, IBAI, XOKAS #mejoresmomentos","MEJORES MOMENTOS POKEMON TWITCH CUP 4 #10😂🔥| ILLOJUAN, KNEKRO, FOLAGOR, IBAI, XOKAS #mejoresmomentos",PeseticasVFX,UC1l8P3NHzohAjQiM6mCaPdA,20,Gaming,"pokemon twitch cup 4, mejores momentos, pokemon, illojuan, illojuan mejores momentos, illojuan clips, elbokeron, knekro, abby, twitch clips, xokas, xokas clips, ibai, ibai clips, folagor, folagor pokemon, baitybait, pereira, pereira clips, papi gavi, illojuan reaccion, cristinini, cristinini clips, guanyar, karchez, skain, clips, xokas reaccion, baitybait reaccion, knekro reaccion, knekro pokemon, papi gavi pokemon, sekiam, sekiam pokemon, frigoadri",35,https://i.ytimg.com/vi/_WGUh0YOH9A/hqdefault.jpg,es,es-ES,False,942,PT15M42S,hd,False,True,,,90080,2116,66
70Gd-mZ8jpE,ES,2025-12-19 02:27:57.180878+00:00,2025-12-16 23:30:04+00:00,Paco Candela - Pa que yo te perdonara (Videoclip Oficial),Paco Candela - Pa que yo te perdonara (Videoclip Oficial),Paco Candela,UCpc1acmU_by80SOHwyXcxUw,10,Music,,0,https://i.ytimg.com/vi/70Gd-mZ8jpE/hqdefault.jpg,es,es,False,295,PT4M55S,hd,False,True,,,22171,678,36
dL7tmO6qbFM,ES,2025-12-19 02:27:57.180885+00:00,2025-12-17 10:01:08+00:00,"Inazuma Eleven: Victory Road – Free Major Update ""Galaxy & LBX DLC"" Trailer","Inazuma Eleven: Victory Road – Free Major Update ""Galaxy & LBX DLC"" Trailer",LEVEL5ch【公式】,UClfhcLqicImW9Se7NKaFADQ,20,Gaming,"InazumaEleven, Victory Road, LEVEL5, LEVEL5ch, HyperdimensionalSoccerGame, CharactercollectionandfootballsimulationRPG, soccer, football, RPG, Game, Video Game, anime game, Nintendo Switch, Switch, Switch2, PS5, PS4, PlayStation5, PlayStation4, Steam, Xbox, 閃電十一人, 闪电十一人",23,https://i.ytimg.com/vi/dL7tmO6qbFM/hqdefault.jpg,en,ja,False,274,PT4M34S,hd,True,True,,,94621,6598,0
DtxXv6BcySI,ES,2025-12-19 02:27:57.180893+00:00,2025-12-16 19:09:43+00:00,NUEVOS FICHAJES en PRIMERA DIVISIÓN 🏆 MODO MANAGER JEQUE cap 5,NUEVOS FICHAJES en PRIMERA DIVISIÓN 🏆 MODO MANAGER JEQUE cap 5,Spursito El Mejor,UCTbi__ayOOaw8YQG-UK9TdQ,20,Gaming,"spursito, la elite, spursito elite, la elite canal, canal secundario spursito, spurs canal secundario, secundario spurs, spursito elite canal, spursito canales, spursito canal, futbol, barça, juan demonio, marbella vice, fifa 25, ea fc 25, fc 25",17,https://i.ytimg.com/vi/DtxXv6BcySI/hqdefault.jpg,es,es,False,2349,PT39M9S,hd,False,True,,,54652,3921,180
VjGSOvILEsU,ES,2025-12-19 02:27:57.180901+00:00,2025-12-13 16:02:58+00:00,JESSE & JOY - DUELES (LETRA),JESSE & JOY - DUELES (LETRA),Amore Lyrics,UCA27Vna8RwUiuZlJbP-5cfw,10,Music,,0,https://i.ytimg.com/vi/VjGSOvILEsU/hqdefault.jpg,es,es-419,False,244,PT4M4S,hd,False,True,,,409000,535,8
AcT0s1jOmwE,ES,2025-12-19 02:27:57.180908+00:00,2025-12-17 03:38:27+00:00,Oficial SE FILTRÓ trailer Spider Man Brand New Day y segundo trailer Thor Avengers Doomsday,Oficial SE FILTRÓ trailer Spider Man Brand New Day y segundo trailer Thor Avengers Doomsday,Pelicomic,UCsMzBY3X_RS6GhGBiHXW19A,24,Entertainment,,0,https://i.ytimg.com/vi/AcT0s1jOmwE/hqdefault.jpg,es,es-419,False,863,PT14M23S,hd,False,True,,,281209,15113,859
LKIngESOSI4,ES,2025-12-19 02:27:57.180916+00:00,2025-12-16 20:30:09+00:00,MI PRIMERA CARRERA con el COCHE MAS AGRESIVO de GTA 5 Online,MI PRIMERA CARRERA con el COCHE MAS AGRESIVO de GTA 5 Online,DaniRep | +6 Vídeos Diarios De GTA 5 Online!,UCHIwQiZhIn6fm5b_IilqBbQ,20,Gaming,"danirep, gta v, gta 5 online, mega rampa, carrera gta 5 online, carrera troll, todos contra mi, cara a cara",8,https://i.ytimg.com/vi/LKIngESOSI4/hqdefault.jpg,es,es-ES,False,1532,PT25M32S,hd,False,True,,,254853,12143,368
TERXQ5ecirc,ES,2025-12-19 02:27:57.180923+00:00,2025-12-14 19:00:33+00:00,Rocío Dúrcal - Hoy Lo Vi Pasar (Letra),Rocío Dúrcal - Hoy Lo Vi Pasar (Letra),magnificent,UCGR1oe259xuhCSaq12h_aQQ,10,Music,"Hoy Lo Vi Pasar, Hoy Lo Vi Pasar Letra, Letra Hoy Lo Vi Pasar, Rocio Durcal, Letra, Rocio Durcal Hoy Lo Vi Pasar, Hoy Lo Vi Pasar Rocio Durcal, Rocio Durcal Hoy Lo Vi Pasar Letra, Letra Rocio Durcal Hoy Lo Vi Pasar, Rocio Durcal Letra, Rocio Durcal Letra Hoy Lo Vi Pasar, Hoy Lo Vi Pasar Letra Rocio Durcal, Letra Hoy Lo Vi Pasar Rocio Durcal, Hoy Lo Vi Pasar Rocio Durcal Letra",14,https://i.ytimg.com/vi/TERXQ5ecirc/hqdefault.jpg,es,en,False,203,PT3M23S,hd,False,True,,,132852,306,1
koVDxSIX18Q,ES,2025-12-19 02:27:57.180930+00:00,2025-12-15 18:29:49+00:00,¡AHHHH! PRIMER TEASER de AVENGERS DOOMSDAY FILTRADO I REACCIÓN,¡AHHHH! PRIMER TEASER de AVENGERS DOOMSDAY FILTRADO I REACCIÓN,"Strip Marvel I Marvel, DC & Superhéroes",UCECLpDchXGkpxX_qXIkZ0PQ,1,Film & Animation,"marvel, comic con, marvel phase 5, marvel phase 6, avengers, secret wars, kang dynasty, captain america new world order, black panther, kang, guardians of the galaxy, she-hulk, wakanda forever, namor, fantastic four, thunderbolts, daredevil, FASE 5, FASE 4 MARVEL, FASE 5 MARVEL, FASE 6 MARVEL, avengers secret wars, avengers kang dynasty, vengadores dinastia de kang, kevin feige, noticias marvel, actualidad marvel, trailer avengers kang dinasty, trailer avengers secret wars",29,https://i.ytimg.com/vi/koVDxSIX18Q/hqdefault.jpg,es,es,False,671,PT11M11S,hd,False,True,,,102390,5267,384
hd3h9jz9j-0,ES,2025-12-19 02:27:57.180938+00:00,2025-12-16 09:58:53+00:00,Brawl Stars: BUFFIES FOREVER!,Brawl Stars: BUFFIES FOREVER!,Brawl Stars,UCooVYzDxdwTtGYAkcPmOgOw,20,Gaming,"brawl stars, mobile game, mobile strategy game, mobile rpg, mobile battle royale, battle royale, supercell game, buffies, new buffies, update, brawl",11,https://i.ytimg.com/vi/hd3h9jz9j-0/hqdefault.jpg,en,en,False,157,PT2M37S,hd,True,True,,,4743963,93776,6288
HFBykme9olc,ES,2025-12-19 02:27:57.180946+00:00,2025-12-15 21:02:39+00:00,la noia,la noia,Cristina Lora - Topic,UCnS1fEIbHGR4zDbvfdtPvcg,10,Music,"Cristina Lora, Angelina Mango, Madame, Dario Faini, la noia",5,https://i.ytimg.com/vi/HFBykme9olc/hqdefault.jpg,it,es,False,201,PT3M21S,hd,False,True,,,46446,893,0
LzcmzP5BToY,ES,2025-12-19 02:27:57.180953+00:00,2025-12-15 17:01:42+00:00,Série : Mère et Mensonges - Teaser - VOSTFR,Série : Mère et Mensonges - Teaser - VOSTFR,Marodi TV Sénégal,UCqe0sSESmaQbLFdTExctQLA,24,Entertainment,"Séries, Série, télévisions, sénégal, séries sénégalaises, marodi tv, Marodi, séries africaines, mbarodi, vidéos sénégal, karma, maitresse, pod et marichou, decheance, virginie, emprises, credule, baabel, kay&za",19,https://i.ytimg.com/vi/LzcmzP5BToY/hqdefault.jpg,fr,fr,False,126,PT2M6S,hd,True,True,,,546048,19746,274
qDFEeeLy6ws,ES,2025-12-19 02:27:57.180961+00:00,2025-12-16 00:47:51+00:00,Hollow Knight: Silksong - Sea of Sorrow Teaser,Hollow Knight: Silksong - Sea of Sorrow Teaser,Team Cherry,UCZS2K8ZsUmujTuj3cNMyBSA,20,Gaming,"Hollow Knight, Sea of Sorrows, Silksong, Video Game, Metroidvania, Adventure",6,https://i.ytimg.com/vi/qDFEeeLy6ws/hqdefault.jpg,en,zxx,False,42,PT42S,hd,False,False,,,3181405,334885,21563
pZh2yh_19J0,ES,2025-12-19 02:27:57.180968+00:00,2025-12-12 19:00:06+00:00,Romeo Santos - Amigo (Letra),Romeo Santos - Amigo (Letra),Tropicalízate,UCgVlte3RIwLsBlXukDv9p1Q,22,People & Blogs,,0,https://i.ytimg.com/vi/pZh2yh_19J0/hqdefault.jpg,es,es,False,232,PT3M52S,hd,False,True,,,172462,254,3
nvmc2ECk8Lo,ES,2025-12-19 02:27:57.180975+00:00,2025-12-16 08:00:07+00:00,"BORDER 2 (Teaser): Sunny Deol, Varun D, Diljit, Ahan | Anurag S | JP Dutta, Bhushan K | 23-Jan-2026","BORDER 2 (Teaser): Sunny Deol, Varun D, Diljit, Ahan | Anurag S | JP Dutta, Bhushan K | 23-Jan-2026",T-Series,UCq-Fj5jknLsUf-MWSy4_brA,10,Music,"tseries, border 2 film, sunny deol border 2, border 2 teaser, sunny deol border 2 movie, varun dhawan border 2, diljit dosanjh border 2, ahan shetty border 2, border 2 trailer, sunny deol movies, varun dhawan border 2 first look, border 2 trailer t series, border 2 movie, diljit dosanjh border 2 movie, sunny deol border movie, border movie, border 2 full movie, border, border 2 tseries, border 2 t series, sunny deol border, new hindi movies, border sunny deol, border 2",24,https://i.ytimg.com/vi/nvmc2ECk8Lo/hqdefault.jpg,en,hi,False,125,PT2M5S,hd,True,True,,,18048813,526242,33199
KnHv8zoZcpI,ES,2025-12-19 02:27:57.180982+00:00,2025-12-15 16:24:48+00:00,RESUMEN DIA 3 | Twitch Cup 4 Knekro e IlloJuan,RESUMEN DIA 3 | Twitch Cup 4 Knekro e IlloJuan,KNekroGamer,UClgbqWyHWNnUQSesyIBmtgA,20,Gaming,"knekro, knekro directos, knekro clips, knekro mejores momentos, knekro susto, knekro mejores clips, knekro en directo, knekro risa, nekro, canekro, LoL, knekro oficial, pokemon, pokemon kenekro, twitch cup, illojuan, illojuan twitch cup, knekro juan pokemon, knekro illojuan pokemon, knekro twitch cup 4, twitch cup jugadores, twitch cup participantes, primeras medallas, shiny, pokemon twitch cup 4, twitch cup 4 knekro, twitch cup 4 illojuan, illojuan knekro pokemon",28,https://i.ytimg.com/vi/KnHv8zoZcpI/hqdefault.jpg,es-ES,es-ES,False,2484,PT41M24S,hd,False,True,,,139498,5320,44
XWAAsQ8vLwg,ES,2025-12-19 02:27:57.180989+00:00,2025-12-11 17:45:16+00:00,Shakira - Loba (Letra),Shakira - Loba (Letra),undershare,UC3Blm67mOPWuisQ_U6wkIhg,22,People & Blogs,,0,https://i.ytimg.com/vi/XWAAsQ8vLwg/hqdefault.jpg,es,es,False,189,PT3M9S,hd,False,True,,,198121,530,3
2GT0LOIxmzE,ES,2025-12-19 02:27:57.180996+00:00,2025-12-16 00:47:30+00:00,25 cosas que NO VISTE en el trailer del volumen 2 de STRANGER THINGS 5,25 cosas que NO VISTE en el trailer del volumen 2 de STRANGER THINGS 5,CharlieTales,UCOQ-ru8bJZSj_gqDyO9r1dQ,1,Film & Animation,"stranger things temporada 5, stranger things temporada final, stranger things 2025, stranger things netflix, netflix, charlietales, stranger things eleven, stranger things final, stranger things will, stranger things steve, once, stranger things online, stranger things temporada 5 online, stranger things trailer temporada 5, stranger things, stranger things 5, stranger things final explicado, stranger things parte 1 final, stranger things 5 final, stranger things 5 curiosidades",20,https://i.ytimg.com/vi/2GT0LOIxmzE/hqdefault.jpg,es,es,False,499,PT8M19S,hd,False,True,,,78433,2462,75
Wj0_6UEC0GY,ES,2025-12-19 02:27:57.181004+00:00,2025-12-16 19:40:00+00:00,"Esto se acabo, el futuro del canal","Esto se acabo, el futuro del canal",Soki,UCk4mCvmZcXB4DqlcVpI2hpg,20,Gaming,"se acabo, esto se acabo, me toca, ahora me toca a mi, toca, final, fin, final soki, soki final, fin soki, soki, guerra, fin guerra, final guerra, polemica, soki alpha, alpha soki, alphasniper soki, soki alphasniper, alpha, alphasniper, guerra soki, soki guerra, polemica soki, soki polemica, video, futuro, futuro del canal, canal, call of duty, cod, soki call of duty, call of duty soki, soki cod, cod soki, warzone, black ops 7, gameplay, mrsoki, latino, latam, español, respuesta, pelea, adios",45,https://i.ytimg.com/vi/Wj0_6UEC0GY/hqdefault.jpg,es,es,False,650,PT10M50S,hd,False,True,,,100453,6362,875
rxuhGHaN4hQ,ES,2025-12-19 02:27:57.181012+00:00,2025-12-11 16:30:06+00:00,"Becky G, NATTI NATASHA - Sin Pijama (Letra)","Becky G, NATTI NATASHA - Sin Pijama (Letra)",HOT CHILI,UCxXDgAgDbfpWAGVQl7KvSAQ,22,People & Blogs,"HOT CHILI, LETRA, MUSIC, CHILI, HOT, lyrics, Becky G, NATTI NATASHA, Sin Pijama, Sin Pijama (Letra), NATTI NATASHA - Sin Pijama (Letra)",11,https://i.ytimg.com/vi/rxuhGHaN4hQ/hqdefault.jpg,es,es-419,False,188,PT3M8S,hd,False,True,,,143872,331,11
F7_y4pUuyJw,ES,2025-12-19 02:27:57.181018+00:00,2025-12-15 21:06:11+00:00,Se FILTRA el teaser tráiler de AVENGERS DOOMSDAY - The Top Comics,Se FILTRA el teaser tráiler de AVENGERS DOOMSDAY - The Top Comics,The Top Comics,UCiBwOVBljEjcsLUjwI274Xw,1,Film & Animation,"Doomsday, Avengers, Dr doom, Robert Downey jr, Steve rogers, Capitán américa, Chris Evans, Tony Stark, Thor, Avengers Doomsday",10,https://i.ytimg.com/vi/F7_y4pUuyJw/hqdefault.jpg,es-419,es-419,False,973,PT16M13S,hd,False,True,,,444477,18530,1189
dIRVydOEMjQ,ES,2025-12-19 02:27:57.181025+00:00,2025-12-16 15:01:17+00:00,ASI es *GLOWBERT* NUEVO BRAWLER QUE ASUSTA a LOS ENEMIGOS | SNEAK PEEK de BRAWL STARS,ASI es *GLOWBERT* NUEVO BRAWLER QUE ASUSTA a LOS ENEMIGOS | SNEAK PEEK de BRAWL STARS,GoDeiK,UCHwH70ZhfYHT9ZM2Z5OEkRg,20,Gaming,"brawl stars, brawl, stars, brawl stars glowbert, glowbert, glowbert brawl stars, nuevo brawler, nuevo, brawler, sneak peek, sneak, peek, sneak peek glowbert, godeik, glowbert sneak peek, brawl talk, brawler nuevo, brawler glowbert, brawl stars sneak peek, sneak peek brawl stars",20,https://i.ytimg.com/vi/dIRVydOEMjQ/hqdefault.jpg,es,es,False,701,PT11M41S,hd,False,True,,,203225,9390,447
9ImfgqmN5VU,ES,2025-12-19 02:27:57.181033+00:00,2025-12-14 19:11:06+00:00,The Police — Every Breath You Take (Sub. Español / Lyrics),The Police — Every Breath You Take (Sub. Español / Lyrics),Richie Lyrics,UC2WgwqSVzg2J4tnMu-c2tjQ,10,Music,"lyrics, lyric video, letra, letra oficial, canciones con letra, music with lyrics, subtitulado, subtitulado al español, video lyrics, musica viral, canciones virales, musica nueva 2025, trending music, top hits 2025, estrenos musicales, canciones del momento, mix",17,https://i.ytimg.com/vi/9ImfgqmN5VU/hqdefault.jpg,es,en,False,245,PT4M5S,hd,False,False,,,897233,2725,23
BK60-1pM33E,ES,2025-12-19 02:27:57.181040+00:00,2025-12-15 20:40:18+00:00,14 COSAS que NO VISTE en el TRAILER del VOLUMEN 2 de STRANGER THINGS 5,14 COSAS que NO VISTE en el TRAILER del VOLUMEN 2 de STRANGER THINGS 5,El Dojo del Geek,UCSDGniOKSQrpWcaS0MK07eQ,24,Entertainment,"stranger things, stranger things 5, stranger things temporada 5, stranger things temporada 5 parte 2, stranger things 5 volumen 2, stranger things 5 parte 2 trailer, stranger things 5 volumen 2 trailer oficial, cosas que no viste en stranger things, el dojo del geek, cosas que no viste en el trailer del volumen 2 de stranger things 5, el dojo del geek stranger things, netflix, vecna, will con poderes",14,https://i.ytimg.com/vi/BK60-1pM33E/hqdefault.jpg,es,es,False,520,PT8M40S,hd,False,True,,,117787,2987,100
09QazJlJw6s,ES,2025-12-19 02:27:57.181048+00:00,2025-12-17 00:01:04+00:00,Pokémon TCUP 4 Ep.9 - LIGA POKÉMON,Pokémon TCUP 4 Ep.9 - LIGA POKÉMON,Folagor03,UCYcdw2wL6W6iGBKZgGK_Hjw,20,Gaming,"fola, folagor, folagor03, pokemon, dedsafio, randomlocke",6,https://i.ytimg.com/vi/09QazJlJw6s/hqdefault.jpg,es,es,False,17374,PT4H49M34S,hd,False,True,,,73882,2872,26
PZVxY-8LrPU,ES,2025-12-19 02:27:57.181055+00:00,2025-12-14 20:15:04+00:00,Kato - Turn The Lights Off ft. Jon (Sub. Español + Lyrics),Kato - Turn The Lights Off ft. Jon (Sub. Español + Lyrics),jostland.,UC1qMwcumipfgTLd3TA1vVZg,10,Music,"turn the lights off, turn the lights off kato sub español, turn the lights off kato, turn the lights off meme, turn the lights off radio edit kato feat. jon, turn the lights off jon hamn, turn the lights off (feat. jon), turn the lights off 1 hour, turn the lights off kato lyrics, turn the lights off kato subtitulada en español, letra, lyrics, sub, español, sub español, traducida al español, letra en español, subtitulada en español, karaoke, hd, hq, topic, jostland",23,https://i.ytimg.com/vi/PZVxY-8LrPU/hqdefault.jpg,es,es,False,180,PT3M,hd,False,True,,,381659,9633,257
dOOXuifrpvY,ES,2025-12-19 02:27:57.181063+00:00,2025-12-15 19:02:41+00:00,Trailer Oficial Avengers Doomsday I Steve Rogers I filtrado Primer Trailer explicado,Trailer Oficial Avengers Doomsday I Steve Rogers I filtrado Primer Trailer explicado,Somos Geeks,UCaTeVotuSxWGGt9Et3zBpiw,1,Film & Animation,"TheGeeks, Marvel, DC",3,https://i.ytimg.com/vi/dOOXuifrpvY/hqdefault.jpg,es,es-419,False,608,PT10M8S,hd,False,True,,,284638,10081,2254
zskVdjK8-so,ES,2025-12-19 02:27:57.181070+00:00,2025-12-16 20:52:40+00:00,⚽️ CONSEGUÍ A UN PRO DESVESICULADO DE ROCKET LEAGUE PARA QUE ME HICIERA EL MEJOR JUGADOR DEL MUNDO,⚽️ CONSEGUÍ A UN PRO DESVESICULADO DE ROCKET LEAGUE PARA QUE ME HICIERA EL MEJOR JUGADOR DEL MUNDO,Auron,UCFR2oaNj02WnXkOgLH0iqOA,20,Gaming,"Auron, AuronPlay",2,https://i.ytimg.com/vi/zskVdjK8-so/hqdefault.jpg,es-ES,es,False,2954,PT49M14S,hd,False,True,,,257596,12759,369
VruA5FeXMYA,ES,2025-12-19 02:27:57.181078+00:00,2025-12-16 00:00:39+00:00,NO CRY - Kapo (Video Oficial),NO CRY - Kapo (Video Oficial),Kapo,UCMuUGNq6D6FJXVss3yayfpQ,10,Music,"Kapo y Feid, kapo danny ocean, kapo aloh aloh, kapo korazong, kapo y danny ocean, Kapo Album, kapo ozuna, kapo imaginate, kapo ryan castro, kapo manuel turizo, X TI, Reggaeton, Urbano, afrobeat, Ryan Castro, Beele, Ohnana, Uwaie, 2025, Aloh ALoh, ILY, Solcito, beele no tiene sentido, beele borondo, feid, feid normal, feid luna, feid sorry 4 that much, feid karol g, feid feliz cumpleaños, feid ferxxo 100, Feid y Karol G, karol g, karol g tropicoqueta, Karol G Album, NO CRY",36,https://i.ytimg.com/vi/VruA5FeXMYA/hqdefault.jpg,es,es-419,False,215,PT3M35S,hd,False,True,,,215943,9615,457
TpqnrDLBcpM,ES,2025-12-19 02:27:57.181086+00:00,2025-12-15 16:32:26+00:00,TRAILER de STRANGER THINGS 5 Vol. 2 | Análisis PLANO a PLANO | Detalles y cosas que no viste!,TRAILER de STRANGER THINGS 5 Vol. 2 | Análisis PLANO a PLANO | Detalles y cosas que no viste!,Cámara en Mano,UCZoeiKBLDv0Hj56pN5d2Ocw,24,Entertainment,"stranger things, stranger things 5, stranger things 5 trailer, stranger things 5 volumen 2, stranger things 5 vol 2 trailer, stranger things 5 trailer explicado",6,https://i.ytimg.com/vi/TpqnrDLBcpM/hqdefault.jpg,es,es,False,486,PT8M6S,hd,False,True,,,86846,7631,201
NewayS6GhWw,ES,2025-12-19 02:27:57.181093+00:00,2025-12-16 17:00:45+00:00,¡Entrené Al Real Madrid... Por 10 Temporadas!,¡Entrené Al Real Madrid... Por 10 Temporadas!,FC Alex,UCLHa6SkXU7UVKxy0dsBsdDA,20,Gaming,"Alex Gutierrez, Alex Gutierrez EA FC, FC Alex, Modo Carrera, EA FC Ultimate Team, Ultimate Team, FC 26, Modo Carrera FC 26, FC 26 Modo Carrera, Reconstruyendo Modo Carrera, Bayern Múnich 10 Temporadas, Bayern Múnich 10 seasons, Real Madrid Modo Carrera, Modo Carrera Real Madrid, Reconstruyendo Real Madrid, I rebuild Real Madrid, Real Madrid 10 Temporadas, Real Madrid 10 seasons, 10 Temporadas Deluxe",19,https://i.ytimg.com/vi/NewayS6GhWw/hqdefault.jpg,es,es-ES,False,1933,PT32M13S,hd,False,True,,,99660,4776,128
