video_id,country,fetched_at,published_at,title,localized_title,channel_title,channel_id,category_id,category_name,tags,tag_count,thumbnail,default_language,audio_language,is_live,duration,duration_raw,definition,caption_available,licensed_content,embeddable,made_for_kids,views,likes,comments
vf5fGN7zsQQ,GT,2026-03-16T03:43:25.889803+00:00,2026-03-11T16:30:06Z,Gianluca Grignani - Mi Historia Entre Tus Dedos (Letra),Gianluca Grignani - Mi Historia Entre Tus Dedos (Letra),Retro Night,UCfwKEF6yBnGt2ogIE26_mYg,22,People & Blogs,"Retro, RetroNight, Lyrics, Letra, Gianluca Grignani - Mi Historia Entre Tus Dedos (Letra), Mi Historia Entre Tus Dedos (Letra), Mi Historia Entre Tus Dedos",7,https://i.ytimg.com/vi/vf5fGN7zsQQ/hqdefault.jpg,es,es,False,311,PT5M11S,hd,False,False,False,False,98448,157,0
Exukk6JO9i0,GT,2026-03-16T03:43:25.889842+00:00,2026-03-13T02:00:00Z,BTS (방탄소년단) '아리랑 (ARIRANG)' Animation Trailer: What is your love song?,BTS (방탄소년단) '아리랑 (ARIRANG)' Animation Trailer: What is your love song?,BANGTANTV,UCLkAepWjdylmXSltofFvsYQ,10,Music,"방탄소년단, BTS, BANGTAN, 알엠, RM, 슈가, SUGA, 제이홉, jhope, 지민, 정국, k-pop, 방탄, j-hope, Jung Kook, Jimin, BTS V, Jin",18,https://i.ytimg.com/vi/Exukk6JO9i0/hqdefault.jpg,ko,ko,False,64,PT1M4S,hd,False,True,False,False,3653739,723883,40627
_N1vFJYZfwE,GT,2026-03-16T03:43:25.889855+00:00,2026-03-15T16:34:31Z,Construí una BASE EN EL CIELO para ESCONDERME de MANDARINA en Brookhaven Roblox,Construí una BASE EN EL CIELO para ESCONDERME de MANDARINA en Brookhaven Roblox,Lyna,UC-cnbLlplnXA4oc7rR21qzg,20,Gaming,,0,https://i.ytimg.com/vi/_N1vFJYZfwE/hqdefault.jpg,es-419,es-419,False,926,PT15M26S,hd,False,True,False,False,477544,7594,721
FBzu9xgVtdQ,GT,2026-03-16T03:43:25.889864+00:00,2026-03-13T16:00:06Z,Wisin & Yandel - Estoy Enamorado (Letra),Wisin & Yandel - Estoy Enamorado (Letra),Urban Fest,UCS25MMDne281toshu5HEX6A,22,People & Blogs,"Urban Fest, Letra, lyrics, reggaetón, reggaeton, urbano, urban, latin, latino, dembow, Wisin & Yandel, Estoy Enamorado (Letra), Estoy Enamorado, Wisin & Yandel - Estoy Enamorado, Wisin & Yandel - Estoy Enamorado (Letra)",15,https://i.ytimg.com/vi/FBzu9xgVtdQ/hqdefault.jpg,es,es-419,False,266,PT4M26S,hd,False,True,False,False,99019,261,3
j2-octxleCk,GT,2026-03-16T03:43:25.889873+00:00,2026-03-12T20:21:28Z,Malcom in the Middle | Tráiler Doblado | Disney+,Malcom in the Middle | Tráiler Doblado | Disney+,Hulu Latinoamérica,UCLv2j33-tarLsnq4TzcBTZA,24,Entertainment,"estrenos series, estrenos fox premium, the walking dead, que ver en fox premium, series fox premium, estrenos noviembre",6,https://i.ytimg.com/vi/j2-octxleCk/hqdefault.jpg,es,es,False,97,PT1M37S,hd,False,True,False,False,658765,21203,1074
C83703XTkK8,GT,2026-03-16T03:43:25.889881+00:00,2026-03-15T20:15:35Z,Casa Secreta de la Montaña NOOB vs PRO en Minecraft,Casa Secreta de la Montaña NOOB vs PRO en Minecraft,Nacho,UC8EkcHOycB94lHDkbAPSnQA,20,Gaming,"nacho, dagar, nacho minecraft, dagar y nacho, nacho y dagar, minecraft, minecraft mod, trucos minecraft, dagar minecraft, amigos minecraft, lia, lia minecraft, nacho y lia, reto de construccion, base, base secreta, base secreta en minecraft, casa en la montaña, montaña minecraft, casa de montaña, rico vs pobre, pobre vs rico minecraft, noob vs pro, noob vs pro minecraft",24,https://i.ytimg.com/vi/C83703XTkK8/hqdefault.jpg,es,es,False,1324,PT22M4S,hd,False,True,False,False,385342,6720,325
mye_kQkYd3o,GT,2026-03-16T03:43:25.889889+00:00,2026-03-12T21:10:51Z,Le pregunte al tiempo,Le pregunte al tiempo,Nacho Castillo - Topic,UCN35eqyhlmyA3jJkpAHVWGg,10,Music,"NACHO CASTILLO, Le pregunte al tiempo",2,https://i.ytimg.com/vi/mye_kQkYd3o/hqdefault.jpg,es,es,False,166,PT2M46S,hd,False,True,False,False,66962,927,0
AcdpY5oh8oA,GT,2026-03-16T03:43:25.889897+00:00,2026-03-12T20:42:14Z,MALCOLM IN THE MIDDLE: La Vida Sigue Siendo Injusta Tráiler Español Latino (2026),MALCOLM IN THE MIDDLE: La Vida Sigue Siendo Injusta Tráiler Español Latino (2026),ONE Media Español,UCcVNDl7ZJMf9lC9a34CY4RA,1,Film & Animation,"Tráiler, Película, Español, Latino, 2026, Malcolm, Malcolm in the Middle Tráiler, Bryan Cranston, Frankie Muniz, La Vida Sigue Siendo Injusta",10,https://i.ytimg.com/vi/AcdpY5oh8oA/hqdefault.jpg,es,es,False,117,PT1M57S,hd,False,True,False,False,1190849,44405,2518
8qXegHyiKDs,GT,2026-03-16T03:43:25.889905+00:00,2026-03-15T16:34:47Z,DIBUJA y SALTA por el TOBOGÁN en Roblox!,DIBUJA y SALTA por el TOBOGÁN en Roblox!,Dagar Roblox,UCmkyN2GfMyR7gsIiKBCR3nw,20,Gaming,"roblox, roblox dagar, roblox nacho, nacho y dagar, dagar y nacho",5,https://i.ytimg.com/vi/8qXegHyiKDs/hqdefault.jpg,es,es,False,1185,PT19M45S,hd,False,True,False,False,289801,4236,201
myU1MVv2MZY,GT,2026-03-16T03:43:25.889912+00:00,2026-03-13T17:00:06Z,Romeo Santos - Imitadora (Letra),Romeo Santos - Imitadora (Letra),Malibu Music,UCgjwKZJN_kdFmaxvW4G0AaA,22,People & Blogs,"MalibuMusic, tropical music, afrobeat, kizomba, dembow, reggae, dancehall latino, zouk, timba, summer vibes, fruta visual, música caribeña, latin urban, chill tropical, visual music, música emergente, playlist tropical, música con letra, afro caribbean, letra, malibu, malibumusic, Romeo Santos, Imitadora, Imitadora (Letra), Romeo Santos - Imitadora, Romeo Santos - Imitadora (Letra)",27,https://i.ytimg.com/vi/myU1MVv2MZY/hqdefault.jpg,es,es,False,204,PT3M24S,hd,False,True,False,False,68947,104,0
G97ocoaQ2sk,GT,2026-03-16T03:43:25.889920+00:00,2026-03-12T03:18:02Z,"Finalmente TRAILER Brand New Day fecha revelada y qué veremos, trama Doomsday oficial y cameos","Finalmente TRAILER Brand New Day fecha revelada y qué veremos, trama Doomsday oficial y cameos",Pelicomic,UCsMzBY3X_RS6GhGBiHXW19A,24,Entertainment,,0,https://i.ytimg.com/vi/G97ocoaQ2sk/hqdefault.jpg,es-419,es-419,False,914,PT15M14S,hd,False,True,False,False,295260,13968,578
Os8lO7CpRzM,GT,2026-03-16T03:43:25.889927+00:00,2026-03-15T19:15:02Z,NUNCA JUEGUES ESTOS JUEGOS DE ROBLOX PROHIBIDOS 2 😱💀,NUNCA JUEGUES ESTOS JUEGOS DE ROBLOX PROHIBIDOS 2 😱💀,ChuuyMine,UCrPWiqy4AmzFruDvWONex6w,20,Gaming,"NUNCA JUEGUES ESTOS JUEGOS DE ROBLOX PROHIBIDOS 2, NUNCA JUEGUES ESTOS JUEGOS DE ROBLOX PROHIBIDOS, JUEGOS DE ROBLOX PROHIBIDOS, JUEGOS DE ROBLOX, ROBLOX, ROBLOX PROHIBIDOS, chuuymine, chuuymine roblox, roblox chuuymine, chuuymine juegos de roblox, juegos de roblox chuuymine, roblox prohibidos chuuymine, chuuymine roblox prohibidos, NUNCA JUEGUES ESTOS JUEGOS DE ROBLOX PROHIBIDOS 2 😱💀",14,https://i.ytimg.com/vi/Os8lO7CpRzM/hqdefault.jpg,es,es,False,1913,PT31M53S,hd,False,True,False,False,230690,3328,418
3lpa75l9Tvk,GT,2026-03-16T03:43:25.889935+00:00,2026-03-10T22:00:08Z,Alejandro Fernández - Me dedique a perderte // Letra,Alejandro Fernández - Me dedique a perderte // Letra,Cherry Lady,UCVgtvKu2_4FZQzTVn-DiIDw,22,People & Blogs,"alejandro fernandez me dedique a perderte letra, alejandro fernandez me dedique a perderte, me dedique a perderte alejandro fernandez",3,https://i.ytimg.com/vi/3lpa75l9Tvk/hqdefault.jpg,es,es,False,234,PT3M54S,hd,False,True,False,False,513852,451,2
ipzEY7c7it8,GT,2026-03-16T03:43:25.889943+00:00,2026-03-09T21:12:54Z,Super Mario Galaxy: La Película | Tráiler Final,Super Mario Galaxy: La Película | Tráiler Final,Universal Pictures México,UCuON8B3q1FMIOSE-0sbC_rQ,1,Film & Animation,"Universal, Illumination Entertainment, Nintendo, Nintendo Co. Ltd., Mario, Super Mario Bros., Super Mario Movie, Teaser Trailer, Official Title, Luigi, Bowser, Toad, Princess Peach, Mushroom Kingdom, Chris Pratt, Anya Taylor-Joy, Charlie Day, Jack Black, Keegan-Michael Key",19,https://i.ytimg.com/vi/ipzEY7c7it8/hqdefault.jpg,es,es,False,144,PT2M24S,hd,False,False,False,False,6533566,21182,0
y9aTsPweuNY,GT,2026-03-16T03:43:25.889950+00:00,2026-03-15T17:05:36Z,HICE EL HOYO MAS GRANDE DE BERRY BURY BERRY,HICE EL HOYO MAS GRANDE DE BERRY BURY BERRY,Rubius Z,UCcjIvuxmWlS5IEQ0JdPV4Ng,20,Gaming,"elrubius, rubius, nuevo, 2026, terror, incremental, Berry Bury Berry, bayas, misterio, agujero, hoyo, Berry Bury, horror, frutas, lanzar, noche dia, dia noche, alimenta el hoyo, creepy, adictivo, parte 2, final, berry bury berry final, secreto",24,https://i.ytimg.com/vi/y9aTsPweuNY/hqdefault.jpg,es,es,False,3854,PT1H4M14S,hd,False,True,False,False,681981,48216,1383
kBt07mOgJo4,GT,2026-03-16T03:43:25.889958+00:00,2026-03-09T17:01:09Z,Los Ángeles Azules – 20 Rosas [Letra],Los Ángeles Azules – 20 Rosas [Letra],Rebel Rock,UCRVcscRzewVOBqfehGBfAuQ,10,Music,"los angeles azules 20 rosas letra, los angeles azules letra 20 rosas, letra los angeles azules 20 rosas, los angeles azules 20 rosas, los angeles azules, los angeles azulesletra, los angeles azules 17 anos, los angeles azules mix, los angeles azules vevo, los angeles azules viejitas, los angeles azules remastered, los angeles azules belinda, los angeles azules ximena sarinana, los angeles azules nicki nicole, los angeles azules y carlos vives, los angeles azules paty cantu",16,https://i.ytimg.com/vi/kBt07mOgJo4/hqdefault.jpg,es,es,False,195,PT3M15S,hd,False,True,False,False,37288,259,2
-22U7izc5n0,GT,2026-03-16T03:43:25.889965+00:00,2026-03-09T15:00:01Z,"XO, Kitty: Temporada 3 | Tráiler oficial | Netflix","XO, Kitty: Temporada 3 | Tráiler oficial | Netflix",Netflix Latinoamérica,UC5ZiUaIJ2b5dYBYGf5iEUrA,24,Entertainment,"Besos Kitty 3, XO Kitty Season 3, Tráiler oficial Besos Kitty 3, Besos Kitty, Temporada 3 Estreno, Kitty y Min Ho, Kitty y Dae, Anna Cathcart, Cuándo se estrena Besos Kitty 3, Besos Kitty 3 reparto, Besos Kitty 3 tráiler subtitulado, Series coreanas en Netflix 2026, Qué pasó con Kitty y Min Ho",13,https://i.ytimg.com/vi/-22U7izc5n0/hqdefault.jpg,es,es,False,131,PT2M11S,hd,False,True,False,False,470340,18250,498
5RRGdmzLaHs,GT,2026-03-16T03:43:25.889973+00:00,2026-03-15T22:18:19Z,Fui ADOPTADO por TRILLONARIOS en Tsunami por Brainrot,Fui ADOPTADO por TRILLONARIOS en Tsunami por Brainrot,SoySpeedy,UC27AkLQVEsTEUeRUNf6BxiA,20,Gaming,"roblox, roblox brainrot, brainrot, escapa del tsunami, speedy, speedyymilo, soyspeedy, speedyroblox, Fui ADOPTADO por TRILLONARIOS en Tsunami por Brainrot, adroptado, trillonarios",11,https://i.ytimg.com/vi/5RRGdmzLaHs/hqdefault.jpg,es,es,False,1100,PT18M20S,hd,False,True,False,False,146922,2109,40
j9PRDVMBFYA,GT,2026-03-16T03:43:25.889980+00:00,2026-03-13T00:03:19Z,IMPOSIBLE,IMPOSIBLE,Grupo Frontera - Topic,UCJa2FF4TUB13Mm0GurZAqog,10,Music,"Grupo Frontera, Silvestre Dangond, Edgar Barrera, Manuel Lorente Freire ""Spread Lof"", Luis Miguel Gomez Castaño ""Casta"", Andres Jael Correa Rios, IMPOSIBLE",7,https://i.ytimg.com/vi/j9PRDVMBFYA/hqdefault.jpg,es,es,False,194,PT3M14S,hd,False,True,False,False,205376,4782,28
O6qcc1EaEWs,GT,2026-03-16T03:43:25.889987+00:00,2026-03-09T21:38:40Z,Tráiler Extra de Super Mario Galaxy La Película: Soy R.O.B. (2026),Tráiler Extra de Super Mario Galaxy La Película: Soy R.O.B. (2026),Nintendúo,UCassa1LNXUUGx7RZ5bsZYpA,1,Film & Animation,"nintendo, nintenduo, nintendo duo, nintendo switch, super mario galaxy, rob, super mario galaxy rob",7,https://i.ytimg.com/vi/O6qcc1EaEWs/hqdefault.jpg,es,es,False,39,PT39S,hd,False,True,False,False,114412,5011,347
Auy0EybFolc,GT,2026-03-16T03:43:25.889994+00:00,2026-03-14T20:32:40Z,Encontré TRANSFORMERS ENTERRADOS en Minecraft!,Encontré TRANSFORMERS ENTERRADOS en Minecraft!,Dagar,UCEs5MQjXJq27-X2vgdwtYDw,20,Gaming,"Minecraft, minecraft mod, dagar y nacho, nacho y dagar, amigos minecraft, dagar minecraft, minecraft dagar",7,https://i.ytimg.com/vi/Auy0EybFolc/hqdefault.jpg,es,es,False,1495,PT24M55S,hd,False,True,False,False,1027603,12217,556
x1ngOPgPogk,GT,2026-03-16T03:43:25.890001+00:00,2026-03-15T12:30:11Z,Junior H - Y LLORO (Letra/Lyrics),Junior H - Y LLORO (Letra/Lyrics),Latino Trap Bangers,UClgC9EILJNdAPZEW_P9U2-g,10,Music,"y lloro, y lloro letra, letra y lloro, junior h, letra, junior h y lloro, y lloro junior h, junior h y lloro letra, letra junior h y lloro, junior h letra, letra junior h, junior h letra y lloro, y lloro letra junior h, letra y lloro junior h, y lloro junior h letra, y lloro video letra, video letra y lloro, y lloro by junior h, junior h - y lloro, latin, music, hits",22,https://i.ytimg.com/vi/x1ngOPgPogk/hqdefault.jpg,es,es,False,180,PT3M,hd,False,True,False,False,24769,105,1
3ntfjZGgm04,GT,2026-03-16T03:43:25.890008+00:00,2026-03-10T15:00:13Z,Minecraft LIVE Official Trailer – March 2026,Minecraft LIVE Official Trailer – March 2026,Minecraft,UC1sELGmy5jp5fQUugmuYlXQ,20,Gaming,"Minecraft, Minecraft live, Minecraft live 2026",3,https://i.ytimg.com/vi/3ntfjZGgm04/hqdefault.jpg,en,en,False,62,PT1M2S,hd,False,False,False,False,1154714,56383,4023
DBNfIjBxjo8,GT,2026-03-16T03:43:25.890015+00:00,2026-03-15T21:15:01Z,JUGAMOS LA TORRE TROLL DE LOS TOCINOS DESAPARECIDOS COMPLETO (ROBLOX),JUGAMOS LA TORRE TROLL DE LOS TOCINOS DESAPARECIDOS COMPLETO (ROBLOX),Chuy Mine,UCrppUjIbcQjh2Drz8UyuRVg,20,Gaming,"chuymine, chuy mine, JUGAMOS LA TORRE TROLL DE LOS TOCINOS DESAPARECIDOS COMPLETO, JUGAMOS LA TORRE TROLL DE LOS TOCINOS DESAPARECIDOS, JUGAMOS LA TORRE TROLL DE LOS TOCINOS, JUGAMOS LA TORRE TROLL, TORRE TROLL, TORRE TROLL DE LOS TOCINOS DESAPARECIDOS, TORRE TROLL DE LOS TOCINOS, TOCINOS DESAPARECIDOS, ROBLOX",11,https://i.ytimg.com/vi/DBNfIjBxjo8/hqdefault.jpg,es,es,False,1178,PT19M38S,hd,False,True,False,False,130602,4100,289
lIPaNCUmmHs,GT,2026-03-16T03:43:25.890022+00:00,2026-03-12T12:11:00Z,maná - EN EL MUELLE DE SAN BLAS (letra),maná - EN EL MUELLE DE SAN BLAS (letra),LA MIXTURA,UCWzTGKE4idra4dwLCXGVtfQ,22,People & Blogs,"LA MIXTURA, musica latina, latin hits 2026, reggaeton, urbano, pop latino, exitos latinos, musica para fiestas, latin sounds, mix latino, estrenos musica latina, mejores canciones 2026, playlist latina, ritmos latinos, musica en español, maná, mana, en el muelle de san blas",18,https://i.ytimg.com/vi/lIPaNCUmmHs/hqdefault.jpg,es,es,False,353,PT5M53S,hd,False,True,False,False,111743,119,3
bOSnXoAWm2s,GT,2026-03-16T03:43:25.890030+00:00,2026-03-09T21:13:06Z,Super Mario Galaxy La Película Direct – 09-03-2026,Super Mario Galaxy La Película Direct – 09-03-2026,Nintendo España,UC7jT5YnTBAOf2JTRrCR0K6g,20,Gaming,,0,https://i.ytimg.com/vi/bOSnXoAWm2s/hqdefault.jpg,es,es,False,2236,PT37M16S,hd,False,True,False,False,119464,5678,0
8k3dUn4DlpQ,GT,2026-03-16T03:43:25.890037+00:00,2026-03-15T19:30:01Z,APOSTE UN DRAGON EN EL NUEVO ADMIN ABUSE CONTRA MONOOAXACO!🍀,APOSTE UN DRAGON EN EL NUEVO ADMIN ABUSE CONTRA MONOOAXACO!🍀,ElAbrahaham,UColTsB6zogXWooPbeO67Wgw,20,Gaming,"abrahahamflores, stream, entretenimiento, divertido, risa, gracioso, gamer, videojuegos, elabrahaham, copilacion, videos graciosos, antes vs ahora, mexico vs usa, abrahaham, directos, shorts, tiktoks, streams, twitch, reaccion, reacciones",21,https://i.ytimg.com/vi/8k3dUn4DlpQ/hqdefault.jpg,es-MX,es-419,False,1074,PT17M54S,hd,False,True,False,False,139302,6299,1452
kgql8CwECFY,GT,2026-03-16T03:43:25.890045+00:00,2026-03-13T16:01:31Z,"Abraham Mateo, Farruko & Christian Daniel - Loco Enamorado (Letra)","Abraham Mateo, Farruko & Christian Daniel - Loco Enamorado (Letra)",Aquarius Reggaeton,UCgU-flq6J8DfYk19A0fOzWw,10,Music,"abraham mateo loco enamorado, farruko & christian daniel loco enamorado, loco enamorado, loco enamorado abraham mateo, abraham mateo loco enamorado letra, farruko & christian daniel loco enamorado letra, loco enamorado letra, loco enamorado abraham mateo letra, abraham mateo loco enamorado lyrics, farruko & christian daniel loco enamorado lyrics, loco enamorado lyrics, loco enamorado abraham mateo lyrics, tiktok, tiktok song, tiktok remix, lyrics on screen",16,https://i.ytimg.com/vi/kgql8CwECFY/hqdefault.jpg,es,es,False,253,PT4M13S,hd,False,True,False,False,106481,295,1
fbaZAQMwEbc,GT,2026-03-16T03:43:25.890052+00:00,2026-03-09T21:11:02Z,The Super Mario Galaxy Movie Direct 3.9.2026,The Super Mario Galaxy Movie Direct 3.9.2026,Nintendo of America,UCGIY_O-8vW4rfX98KlMkvRg,1,Film & Animation,"nintendo, fun, action, adventure",4,https://i.ytimg.com/vi/fbaZAQMwEbc/hqdefault.jpg,en,en,False,476,PT7M56S,hd,True,True,False,False,1399440,56215,3273
dgH7RK7KWMI,GT,2026-03-16T03:43:25.890059+00:00,2026-03-15T19:00:39Z,Usé Armas REALES vs el PROTOTIPO de POPPY PLAYTIME en Minecraft…,Usé Armas REALES vs el PROTOTIPO de POPPY PLAYTIME en Minecraft…,Jardred,UCyDUULOp3b3JsehZKIIVzrg,20,Gaming,,0,https://i.ytimg.com/vi/dgH7RK7KWMI/hqdefault.jpg,es,es,False,876,PT14M36S,hd,False,True,False,False,93487,4561,338
8WieZQHWa7U,GT,2026-03-16T03:43:25.890066+00:00,2026-03-14T13:00:15Z,Gotas De Lluvia - Grupo Niche (Letra),Gotas De Lluvia - Grupo Niche (Letra),La Cueva Fiestera,UChwbWfL_QkzKIWdWcuJBdhg,22,People & Blogs,,0,https://i.ytimg.com/vi/8WieZQHWa7U/hqdefault.jpg,es,es,False,358,PT5M58S,hd,False,True,False,False,70334,93,2
-1jkHZRCOek,GT,2026-03-16T03:43:25.890073+00:00,2026-03-15T20:25:36Z,"REPROBÉ EL EXAMEN DE MATEMÁTICAS Y MI MAMÁ SE ENOJÓ |OOPS, I FAILED MY MATH TEST (ROBLOX)|JONDRES GC","REPROBÉ EL EXAMEN DE MATEMÁTICAS Y MI MAMÁ SE ENOJÓ |OOPS, I FAILED MY MATH TEST (ROBLOX)|JONDRES GC",Jondres Gc,UCEtD_nOAZeTzb5dcln-ljOA,24,Entertainment,"JONDRES GC, ROBLOX, REPROBE MI EXAMEN DE MATEMATICAS COMPLETO (OOPS I FAILED MY MATH TEST ROBLOX), OOPS I FAILED MY MATH TEST ROBLOX, OOPS I FAILED MY MATH TEST, REPROBE MI EXAMEN DE MATEMATICAS COMPLETO, REPROBE MI EXAMEN DE MATEMATICAS, REPROBE MI EXAMEN, EXAMEN DE MATEMATICAS, MI MAMÁ ME PEGA POR REPROBAR EL EXAMEN DE MATEMÁTICAS, REPROBÉ EL EXAMEN DE MATEMÁTICAS Y MI MAMÁ SE ENOJÓ – ROBLOX, OOPS I FAILED MY MATH TEST TODOS LOS FINALES, OOPS I FAILED MY MATH TEST ALL ENDINGS",13,https://i.ytimg.com/vi/-1jkHZRCOek/hqdefault.jpg,es,es-419,False,3083,PT51M23S,hd,False,True,False,False,146163,3695,371
ft2CoNJymig,GT,2026-03-16T03:43:25.890080+00:00,2026-02-25T10:01:49Z,Ayer Hable Con Dios,Ayer Hable Con Dios,Corridos Del Rey - Topic,UCdlKyPo2iFJlo-atPL9OtZg,10,Music,"Corridos del Rey, Adrian Salgado, Ayer Hable Con Dios",3,https://i.ytimg.com/vi/ft2CoNJymig/hqdefault.jpg,es,es,False,144,PT2M24S,hd,False,True,False,False,452275,14505,0
FI7U5GuK49s,GT,2026-03-16T03:43:25.890087+00:00,2026-03-15T17:45:56Z,ROBLOX SOBREVIVE al CALOR para BRAINROTS 🔥,ROBLOX SOBREVIVE al CALOR para BRAINROTS 🔥,Betillo,UC8st6FaRPJcQXCvJk31caQA,20,Gaming,"roblox, roblox español, ROBLOX, mejores brainrots, elabrahaham, el simio mayor, juanpablohollman, betillo, soybetilloelguapillo, soybetillo, tio betillo, 99 noches, los bros, los bros roblox, bros, admin abuse, admin abuse indonesia, admin abuse halloween, troll, juego troll",20,https://i.ytimg.com/vi/FI7U5GuK49s/hqdefault.jpg,es,es,False,1175,PT19M35S,hd,False,True,False,False,184518,9217,1123
vQHqku4lcuI,GT,2026-03-16T03:43:25.890095+00:00,2026-03-13T04:01:06Z,Selena - Como la Flor/Baila Esta Cumbia - Live (Official Visualizer),Selena - Como la Flor/Baila Esta Cumbia - Live (Official Visualizer),SelenaVEVO,UCIZY5N1_e4yCLN7dd_vFJTw,10,Music,"Selena, selena quintanilla, baila esta cumbia, Como la Flor, selena remasterizado, dreaming of you selena, amor prohibido, selena amor prohibido, amor prohibido selena, letra Como la Flor, amor prohibido aniversario 30, letras selena quintanilla, no me queda mas selena, cobarde selena, fotos recuerdo selena, el chico del apartamento 512 selena, bidi bidi bom bom selena, techno cumbia selena, tus desprecios selena, si una vez selena, ya no selena",21,https://i.ytimg.com/vi/vQHqku4lcuI/hqdefault.jpg,es,es,False,585,PT9M45S,hd,False,True,False,False,56616,1433,149
tMbzfHd17jc,GT,2026-03-16T03:43:25.890102+00:00,2026-03-14T23:15:04Z,ME CONVERTÍ en SPIDERMAN en SUPER BEAR ADVENTURE !!,ME CONVERTÍ en SPIDERMAN en SUPER BEAR ADVENTURE !!,DeGoBooM,UCj9rK3jt8qmih4mZX0UL67g,20,Gaming,"degoboom, dego, dg, bumi, sba, super bear adventure",6,https://i.ytimg.com/vi/tMbzfHd17jc/hqdefault.jpg,es-419,es-419,False,1830,PT30M30S,hd,False,True,False,False,361631,3180,184
6ggC6LjmX1k,GT,2026-03-16T03:43:25.890109+00:00,2026-02-16T12:24:49Z,"Julión Álvarez, Banda MS, Grupo Firme, Grupo Frontera, Carin Leon ♫ Bandas Románticas Lo Mas Sonadas","Julión Álvarez, Banda MS, Grupo Firme, Grupo Frontera, Carin Leon ♫ Bandas Románticas Lo Mas Sonadas",Ritmo Banda,UCRrM5FvS-IwOpcO8h0fR3lg,10,Music,"banda mix, banda ms, bandas romanticas, la adictiva, la arrolladora, calibre 50, banda Mexicana, banda musica, mix de bandas, banda el recodo, banda, julión Álvarez, bandas mix, lo mejor banda romanticas, carin leon, bandas, gerardo Ortiz, alfredo olivas, musica de banda, grupo firme, mix banda, banda romantica, christian nodal, banda el limon, lo mas nuevo, grupo frontera, banda romantica mix, mix bandas, musica banda",29,https://i.ytimg.com/vi/6ggC6LjmX1k/hqdefault.jpg,vro,vro,False,4665,PT1H17M45S,hd,False,False,False,False,432080,1155,11
wyKNY1_HnTc,GT,2026-03-16T03:43:25.890117+00:00,2026-03-14T16:00:05Z,"Countries Decide Who Wins $25,000","Countries Decide Who Wins $25,000",MrBeast Gaming,UCIPPMRA040LQr5QPyJEbmXA,20,Gaming,,0,https://i.ytimg.com/vi/wyKNY1_HnTc/hqdefault.jpg,en,en,False,1508,PT25M8S,hd,True,True,False,False,7996148,274752,41437
CPP5dmwoTu4,GT,2026-03-16T03:43:25.890124+00:00,2026-03-13T04:00:19Z,Grupo Mojado - Piensa En Mí,Grupo Mojado - Piensa En Mí,MojadoVEVO,UC2-4oILewzHrDQUbt0lEwrA,10,Music,"Grupo Mojado, FONO, Latin",3,https://i.ytimg.com/vi/CPP5dmwoTu4/hqdefault.jpg,es,es,False,184,PT3M4S,sd,False,True,False,False,203496,1377,9
Po2w7qV6H4M,GT,2026-03-16T03:43:25.890131+00:00,2026-03-14T21:20:06Z,ESCAPA DEL GOO GOO GAGA en BROOKHAVEN MOMENTOS DIVERTIDOS (ROBLOX),ESCAPA DEL GOO GOO GAGA en BROOKHAVEN MOMENTOS DIVERTIDOS (ROBLOX),RoxiCake Gamer,UC3t7_hgqy-7pccSWRVaTQIw,20,Gaming,"Roblox, Roblox español",2,https://i.ytimg.com/vi/Po2w7qV6H4M/hqdefault.jpg,es,es-419,False,1117,PT18M37S,hd,False,True,False,False,657767,35365,1938
erPsT2mBh_E,GT,2026-03-16T03:43:25.890138+00:00,2026-03-07T17:00:06Z,Carin León - Despídase bien (Video + lyrics),Carin León - Despídase bien (Video + lyrics),Sabor a Manzana,UCGL2K4JZRKfnU91z40NsasQ,22,People & Blogs,,0,https://i.ytimg.com/vi/erPsT2mBh_E/hqdefault.jpg,es,es,False,232,PT3M52S,hd,False,True,False,False,87071,169,2
7DI8e7FDf7E,GT,2026-03-16T03:43:25.890145+00:00,2026-03-15T23:53:27Z,Casa del ARBOL NOOB vs Casa del ARBOL PRO En Minecraft…,Casa del ARBOL NOOB vs Casa del ARBOL PRO En Minecraft…,Awita,UC62nFXtc3KNujp9LCPJt-sA,20,Gaming,,0,https://i.ytimg.com/vi/7DI8e7FDf7E/hqdefault.jpg,es,es-419,False,2056,PT34M16S,hd,False,True,False,False,122331,4703,393
3xGyh6mWak8,GT,2026-03-16T03:43:25.890152+00:00,2026-03-11T16:31:59Z,Junior H - Extssy Model (Letra/Lyrics),Junior H - Extssy Model (Letra/Lyrics),SoyLatino,UCc0flm4m-4XCIpPSXIJ84HQ,10,Music,"Junior H - Extssy Model, extssy model, junior h, extssy model letra, letra, junior h extssy model letra, extssy model letra junior h, lyrics, extssy model lyrics",9,https://i.ytimg.com/vi/3xGyh6mWak8/hqdefault.jpg,es,es,False,241,PT4M1S,hd,False,True,False,False,234772,880,4
Ut8ZTxxj_CQ,GT,2026-03-16T03:43:25.890159+00:00,2026-03-15T21:11:45Z,🔴 DIRECTO jugando La NUEVA ACTUALIZACION de Escape de velocidad para Brainrots y mas!!! 🔥🧠,🔴 DIRECTO jugando La NUEVA ACTUALIZACION de Escape de velocidad para Brainrots y mas!!! 🔥🧠,Baironelblox,UCeK8soo0IuVOVBzmxx5q-DA,20,Gaming,"Baironelbox, Lava, Tsunami, Roblox, RobloxGames, Brainrot, Brainrots",7,https://i.ytimg.com/vi/Ut8ZTxxj_CQ/hqdefault.jpg,es,es-419,False,10585,PT2H56M25S,hd,False,True,False,False,738546,7103,5
7C2b1EvvpUY,GT,2026-03-16T03:43:25.890166+00:00,2026-02-26T10:03:10Z,TAKA LA DENTRO,TAKA LA DENTRO,SEKIMANE - Topic,UC4tIAyUXm9M6y82nDFxKTMQ,10,Music,"SEKIMANE, shonci, Mc Gw, TAKA LA DENTRO",4,https://i.ytimg.com/vi/7C2b1EvvpUY/hqdefault.jpg,en,pt-PT,False,90,PT1M30S,hd,False,True,False,False,1364221,35708,0
c8AqLSi64pg,GT,2026-03-16T03:43:25.890173+00:00,2026-03-15T14:30:35Z,LA ESCUELA FUE CERRADA.. Entonces INVESTIGUÉ! (Brookhaven),LA ESCUELA FUE CERRADA.. Entonces INVESTIGUÉ! (Brookhaven),SoyWelix,UCEc6kZNBV0WAKV5GZlLLgwA,22,People & Blogs,,0,https://i.ytimg.com/vi/c8AqLSi64pg/hqdefault.jpg,es,es,False,729,PT12M9S,hd,False,True,False,False,196983,3129,167
4xDz07XRNDs,GT,2026-03-16T03:43:25.890180+00:00,2026-03-09T18:00:06Z,Eros Ramazzotti - Otra Como Tú (Letra),Eros Ramazzotti - Otra Como Tú (Letra),Bold Retro,UCXq83cSvDmYJ2a-MOmjjSSQ,22,People & Blogs,"BOLDRETRO, LETRA, lyrics, RETRO, CLASICOS, 80shits, 90shits, retroclassic, throwbackmusic, oldiesbutgoldies, musicaenespañol, englishclassics, nostalgia80, nostalgia90, Eros Ramazzotti, Otra Como Tú, Otra Como Tú (Letra), Eros Ramazzotti - Otra Como Tú (Letra), Eros Ramazzotti - Otra Como Tú",19,https://i.ytimg.com/vi/4xDz07XRNDs/hqdefault.jpg,es,es,False,282,PT4M42S,hd,False,True,False,False,111103,415,9
ln65Wk9tVU0,GT,2026-03-16T03:43:25.890187+00:00,2026-03-15T00:00:22Z,REACCIONE a ABRAHAHAM JUGANDO FREE FIRE por PRIMERA VEZ !! | TheDonato,REACCIONE a ABRAHAHAM JUGANDO FREE FIRE por PRIMERA VEZ !! | TheDonato,TheDonato,UCaHEdZtk6k7SVP-umnzifmQ,20,Gaming,,0,https://i.ytimg.com/vi/ln65Wk9tVU0/hqdefault.jpg,es,es,False,1707,PT28M27S,hd,False,True,False,False,752735,33854,746
