video_id,country,fetched_at,published_at,title,localized_title,channel_title,channel_id,category_id,category_name,tags,tag_count,thumbnail,default_language,audio_language,is_live,duration,duration_raw,definition,caption_available,licensed_content,embeddable,made_for_kids,views,likes,comments
cYL-Cim-dvg,BE,2026-02-10T03:39:24.461454+00:00,2026-02-06T19:26:51Z,La Rvfleuze - Serrure #667 feat. Freeze Corleone,La Rvfleuze - Serrure #667 feat. Freeze Corleone,La Rvfleuze ,UCtjvAqI4o-aWtGDYFzkGvRw,10,Music,,0,https://i.ytimg.com/vi/cYL-Cim-dvg/hqdefault.jpg,fr,fr,False,153,PT2M33S,hd,False,True,False,False,822842,43809,2091
e9HXmMnUEdE,BE,2026-02-10T03:39:24.461492+00:00,2026-02-02T00:59:56Z,The Devil Wears Prada 2 | Official Trailer,The Devil Wears Prada 2 | Official Trailer,20th Century Studios,UC2-BeLxzUBSs0uSrmzWhJuQ,1,Film & Animation,Trailer,1,https://i.ytimg.com/vi/e9HXmMnUEdE/hqdefault.jpg,en,en,False,100,PT1M40S,hd,True,True,False,False,9464613,160113,6304
CLm57ZHTJvQ,BE,2026-02-10T03:39:24.461503+00:00,2026-02-07T14:00:14Z,Minecraft Pro VS 1000 Players,Minecraft Pro VS 1000 Players,Wemmbu,UCkzzNLnuM-VsATWC53ehwOQ,20,Gaming,"wemmbu, flamefrags, unstable smp, wemmbu vs flamefrags, wemmbu unstable smp, wemmbu farlands, minecraft farlands, wemmbu minecraft, wemmbu orbital cannon, orbital strike cannon, unstable universe, wemmbu unstable universe, weembu, wembu, wemmbu dead, wemmbu unstable dead, wemmbu death, wemmbu flamefrags, 2 Minecraft Pros VS 1000 Players, wemmbu vs 1000 players, minutetech, wemmbu minutetech, unstable smp law",23,https://i.ytimg.com/vi/CLm57ZHTJvQ/hqdefault.jpg,en-US,en-US,False,3675,PT1H1M15S,hd,False,True,False,False,4183024,224428,26393
DPSGMTknY9s,BE,2026-02-10T03:39:24.461512+00:00,2026-02-02T16:00:06Z,Rambo Goyard - B.M.S (by my side) (Clip Officiel),Rambo Goyard - B.M.S (by my side) (Clip Officiel),RAMBO GOYARD,UC56UO1MHFm7XZ9wsbczPf1w,10,Music,"Rambo Goyard, BMS, By My Side, Rambo, Goyard, Side",6,https://i.ytimg.com/vi/DPSGMTknY9s/hqdefault.jpg,fr,fr,False,127,PT2M7S,hd,False,False,False,False,945542,16681,442
y4ZBSzYUTL0,BE,2026-02-10T03:39:24.461520+00:00,2026-02-05T14:00:00Z,The Dinosaurs | Official Trailer | Netflix,The Dinosaurs | Official Trailer | Netflix,Netflix,UCWOA1ZGywLbqmigxE4Qlvuw,24,Entertainment,"Dinosaurs, amblin, dinosaur show, documentary, evolution, extinct animals, family documentary, fossils, jurassic, kids dinosaurs, natural history, nature, nature series, paleontology, prehistoric, steven spielberg, t-rex, tyrannosaurus rex, wildlife",19,https://i.ytimg.com/vi/y4ZBSzYUTL0/hqdefault.jpg,en,en-US,False,121,PT2M1S,hd,True,True,False,False,7805468,217938,11416
XJtn0mkOntM,BE,2026-02-10T03:39:24.461528+00:00,2026-02-08T13:01:01Z,ELLE VEUT PAS NOUS LAISSER TRANQUILLE (Pokérayou),ELLE VEUT PAS NOUS LAISSER TRANQUILLE (Pokérayou),Wankil Studio - Laink et Terracid,UCYGjxo5ifuhnmvhPvCc3DJQ,20,Gaming,"terracid, laink, wankil, pokémon, minecraft, pokérayou, baghera, cacabox",8,https://i.ytimg.com/vi/XJtn0mkOntM/hqdefault.jpg,fr,fr,False,1914,PT31M54S,hd,False,True,False,False,431163,32018,281
1FVF-9KQiPo,BE,2026-02-10T03:39:24.461536+00:00,2026-02-08T13:00:02Z,Taylor Swift - Opalite (Official Music Video),Taylor Swift - Opalite (Official Music Video),Taylor Swift,UCqECaJ8Gagnn7YCbPEzWH6g,10,Music,"Taylor swift, taylor, swift, taylor swift TLOAS, TS12, Showgirl, The Life of a Showgirl, new taylor swift, taylor swift album",9,https://i.ytimg.com/vi/1FVF-9KQiPo/hqdefault.jpg,en,en-US,False,360,PT6M,hd,False,False,False,False,4768602,390773,21358
UHmvNjmGI0E,BE,2026-02-10T03:39:24.461543+00:00,2026-02-02T10:04:58Z,LE DIABLE S'HABILLE EN PRADA 2 Bande Annonce VF (2026) Anne Hathaway,LE DIABLE S'HABILLE EN PRADA 2 Bande Annonce VF (2026) Anne Hathaway,FilmsActu,UC_i8X3p8oZNaik8X513Zn1Q,1,Film & Animation,"cinema, filmsactu, bande annonce, film, officiel, français, VF, 2026, Le Diable s'Habille en Prada 2, Le Diable s'Habille en Prada 2 Bande Annonce, Anne Hathaway, Meryl Streep, Emily Blunt",13,https://i.ytimg.com/vi/UHmvNjmGI0E/hqdefault.jpg,fr,fr,False,119,PT1M59S,hd,False,True,False,False,289746,3761,179
qMPInBnArnw,BE,2026-02-10T03:39:24.461551+00:00,2026-02-08T07:00:44Z,Sammy a BANNI mes Brainrots..,Sammy a BANNI mes Brainrots..,Unchained_Off,UCiFyJ_EBmF2XJuR9buWE_3A,20,Gaming,"unchained, unchained_off, unchained fortnite, fortnite, jeu vidéo, squeezie, gameplay, drole, gratuit, unchained gaming, fortnite battle royale, vbucks, mise à jour, maj, fortnite maj, fortnite chapitre, skin gratuit, unchained map, roblox, unchained roblox, robux, secret, roblox brainrot, steal a brainrot, voler brainrot, Brainrot, brainrot secret, brainrot, skin, unchained skin, og, admin abuse, admin, steal a brainrot classement, french tacos, base, steal a brainrot problème",37,https://i.ytimg.com/vi/qMPInBnArnw/hqdefault.jpg,fr,fr-FR,False,1191,PT19M51S,hd,False,True,False,False,705479,12878,1293
zhgFR2L2reE,BE,2026-02-10T03:39:24.461559+00:00,2026-02-06T18:00:07Z,THEODORA - DES MYTHOS,THEODORA - DES MYTHOS,THEODORA,UCWypM0ZUsWlg4Ey4_9s38-A,10,Music,,0,https://i.ytimg.com/vi/zhgFR2L2reE/hqdefault.jpg,fr,fr,False,191,PT3M11S,hd,False,False,False,False,437713,42334,1293
6zmKcUa4Xxk,BE,2026-02-10T03:39:24.461567+00:00,2026-02-03T14:00:00Z,The Drama | Official Trailer HD | A24,The Drama | Official Trailer HD | A24,A24,UCuPivVjnfNo4mb3Oog_frZg,1,Film & Animation,"a24, a24 films, a24 trailers, independent films, trailer, HD, official, movie, film, a24 movies, oscar winner, academy award winner",12,https://i.ytimg.com/vi/6zmKcUa4Xxk/hqdefault.jpg,en,en,False,137,PT2M17S,hd,True,True,False,False,10051289,94261,3274
_QdOHFH3ZjY,BE,2026-02-10T03:39:24.461574+00:00,2026-01-25T13:29:48Z,Les CONSÉQUENCES de Five Nights At Freddy's - Findings N°111,Les CONSÉQUENCES de Five Nights At Freddy's - Findings N°111,Feldup,UCQVaKQcp4OxSg1eC6SF3NTw,24,Entertainment,"feldup, findings, findings fnaf, fnaf, Five night's at freddy's, fnaf 2, fnaf 3, fnaf 4, sister location, pizzeria simulator, fonkyfouine, lore, théorie, jeu, horreur, jeu d'horreur, creepy, creepypasta, mascot horror, freddy, bonnie, chica, foxy, the puppet",24,https://i.ytimg.com/vi/_QdOHFH3ZjY/hqdefault.jpg,fr,fr,False,14430,PT4H30S,hd,False,True,False,False,4292869,245234,16900
85QRxuh6a5o,BE,2026-02-10T03:39:24.461583+00:00,2026-02-05T23:01:39Z,Seychelles,Seychelles,Booba - Topic,UCM2z1XL2kr4uVQoA2elbCgw,10,Music,"Booba, Seychelles",2,https://i.ytimg.com/vi/85QRxuh6a5o/hqdefault.jpg,en,es,False,159,PT2M39S,hd,False,True,False,False,317500,10316,1364
UC4INGdHwhs,BE,2026-02-10T03:39:24.461590+00:00,2026-02-09T01:44:08Z,ALL SUPER BOWL 2026 (Trailers),ALL SUPER BOWL 2026 (Trailers),TrailerSpot,UCiCSDcAcGDvD_v0TQQ8nxJg,1,Film & Animation,"movie, trailer, trailerspot, new, 2026, New Movie Trailers, New Movie Trailers 2026, Trailer 2026, Trailers 2026, Movies, Minions And Monsters, He Man Masters of the Universe, Scream 7, Supergirl, Project Hail Mary, The Super Mario Galaxy Movie, The Mandalorian And Grogu, Hoppers, Disclosure Day, He Man, Masters of the Universe, Super Mario Galaxy Movie, Super Bowl, Super Bowl 2026, Super Bowl Tv Spot, Super Bowl Trailer, 4k, trailer 4k, 4k trailer, 4k ultra hd, ultra hd",31,https://i.ytimg.com/vi/UC4INGdHwhs/hqdefault.jpg,en,en,False,610,PT10M10S,hd,False,True,False,False,683229,6898,555
_S5SOI58gSY,BE,2026-02-10T03:39:24.461598+00:00,2026-02-07T21:51:08Z,roblox best gameplay,roblox best gameplay,StanRP,UCHYA5HNaS5n4idxmP-at8nA,20,Gaming,"roblox, granny, free fire, live roblox, roblox shorts, shorts feed, 67, six seven, meme reset, singing brainrot song, great meme reset",11,https://i.ytimg.com/vi/_S5SOI58gSY/hqdefault.jpg,en-US,en,False,25,PT25S,hd,False,True,False,False,1160892,10988,17
vqkfEUqjl6Y,BE,2026-02-10T03:39:24.461605+00:00,2026-02-06T05:00:01Z,ATEEZ(에이티즈) - 'Adrenaline' Official MV,ATEEZ(에이티즈) - 'Adrenaline' Official MV,KQ ENTERTAINMENT,UCQdq-lqPEq_yZ_wP_kuVB9Q,10,Music,"KQ, 케이큐, ATEEZ, 에이티즈, 홍중, HONGJOONG, 성화, SEONGHWA, 윤호, YUNHO, 여상, YEOSANG, 산, SAN, 민기, MINGI, 우영, WOOYOUNG, 종호, JONGHO, KPOP, 남돌, IDOL, 케이팝, GOLDENHOUR, 골든아워, GOLDENHOURPART4, GHPT4, 골든아워파트포, 컴백스포일러",30,https://i.ytimg.com/vi/vqkfEUqjl6Y/hqdefault.jpg,en,ko,False,261,PT4M21S,hd,True,False,False,False,17723031,350513,31375
ik0drfECnPo,BE,2026-02-10T03:39:24.461613+00:00,2026-02-09T01:43:08Z,"The Adventures of Cliff Booth | Official Trailer (Brad Pitt, 2026)","The Adventures of Cliff Booth | Official Trailer (Brad Pitt, 2026)",Entertainment Tonight,UCdtXPiqI2cLorKaPrfpKc4g,24,Entertainment,"Netflix, Brad Pitt, Quentin Tarantino, Margot Robbie, Once Upon a Time In Hollywood",5,https://i.ytimg.com/vi/ik0drfECnPo/hqdefault.jpg,en,en,False,64,PT1M4S,hd,False,True,False,False,684774,13137,901
B9kjjJhSAKc,BE,2026-02-10T03:39:24.461621+00:00,2026-02-08T07:22:30Z,J’AI VOLÉ TOUS LES BRAINROTS DE SAINT VALENTIN !! (Incroyable),J’AI VOLÉ TOUS LES BRAINROTS DE SAINT VALENTIN !! (Incroyable),Kevko,UCzCzMjtMD4vCWVgbmv4uq0Q,20,Gaming,"Brawl Stars, Brawl star fr, Unchained, Unchained OFF, Unchained Brawl Stars, RomainDotlive BS, Roblox, Vol Un Brainrot, Roblox Kevko, Steal a brainrot, Vol Un brainrot kevko, roblox unchained, roblox toinelag, kevko roblox, kevko vol un brainrot, unchained off, unchained steal a brainrot, brainrot, roblox brainrot, brainrot og, kevko pigeon, graphyx, talcado, yoananas, shadobass, dhm, dhm2.0, jeanfils, chocoh, chocolatandvanillah, youtubeur fr steal a brainrot",31,https://i.ytimg.com/vi/B9kjjJhSAKc/hqdefault.jpg,fr,fr,False,1464,PT24M24S,hd,False,True,False,False,425372,7087,966
Ct_5ufRlAsw,BE,2026-02-10T03:39:24.461629+00:00,2026-02-05T13:24:04Z,Mozzik - Diss,Mozzik - Diss,MOZZIK,UC8qgvgRbbZuCq9W4VRVe1dA,10,Music,"Mozzik, MOZZIK, mozzik, Mozzik - Diss, Diss, mozzik diss, gimme 5, shqip, albania, kosovo, hiphop, hitet 2026, Hitet e Reja 2026",13,https://i.ytimg.com/vi/Ct_5ufRlAsw/hqdefault.jpg,en,sq,False,372,PT6M12S,hd,False,True,False,False,1641828,32965,2137
P0XN3-n-2Lo,BE,2026-02-10T03:39:24.461637+00:00,2026-02-08T20:00:04Z,Project Hail Mary | Final Trailer,Project Hail Mary | Final Trailer,Amazon MGM Studios,UCf5CjDJvsFvtVIhkfmKAwAA,24,Entertainment,"MGM, MGM Studios, Metro-Goldwyn- Mayer, Metro Pictures Corporations, Goldwyn Pictures, Louis B. Mayer Pictures, MGM Pictures, United Artists, Metro MGM/UA, Amazon MGM, Amazon MGM Studios, Amazon, Project Hail Mary, Phil Lord, Christopher Miller, Project Hail Mary 2026, Project Hail Mary Trailer, Trailer, Official Trailer, Ryan Gosling, Milana Vayntrub, Liz Kingsman, Sandra Huller, James Ortiz, James Wright, New Movies 2026, Project Hail Mary Final Trailer, Final Trailer",28,https://i.ytimg.com/vi/P0XN3-n-2Lo/hqdefault.jpg,en,en-US,False,164,PT2M44S,hd,True,True,False,False,3896108,43069,3255
spXJwMbHZSw,BE,2026-02-10T03:39:24.461645+00:00,2026-02-05T18:27:43Z,Minecraft Trapper VS 1000 Players,Minecraft Trapper VS 1000 Players,Spoke,UCk2uxbWi5py_iJXaEsh2YRA,20,Gaming,"spoke, spokeishere, lifesteal, minecraft, survival, wormhole, unstable, unstable universe, wemmbu, parrotx2",10,https://i.ytimg.com/vi/spXJwMbHZSw/hqdefault.jpg,en,en-US,False,4391,PT1H13M11S,hd,False,True,False,False,2760087,110560,13312
9qkpcLK422o,BE,2026-02-10T03:39:24.461653+00:00,2026-02-09T09:01:11Z,IVE 아이브 'BANG BANG' MV,IVE 아이브 'BANG BANG' MV,STARSHIP,UCYDmx2Sfpnaxg488yBpZIGg,10,Music,,0,https://i.ytimg.com/vi/9qkpcLK422o/hqdefault.jpg,ko,ko,False,185,PT3M5S,hd,True,True,False,False,3860374,231110,16457
EGTZOHqxdBk,BE,2026-02-10T03:39:24.461660+00:00,2026-02-02T14:40:07Z,"MICHAEL Bande Annonce VF (2026) Nouvelle, Michael Jackson","MICHAEL Bande Annonce VF (2026) Nouvelle, Michael Jackson",Allociné | Trailers,UC5PH9Vn37PJiV3pcSQHv7Yg,1,Film & Animation,"bande annonce, bande annonce vf, Michael, Michael Bande Annonce VF, Michael Jackson, Jaafar Jackson, Nouvelle, nouveau, biopic",9,https://i.ytimg.com/vi/EGTZOHqxdBk/hqdefault.jpg,fr,fr,False,150,PT2M30S,hd,False,True,False,False,255308,5768,711
14YT2L0lINg,BE,2026-02-10T03:39:24.461667+00:00,2026-02-08T10:54:21Z,J'ai Obtenu mon PROPRE Brainrot sur Steal a Brainrot !!,J'ai Obtenu mon PROPRE Brainrot sur Steal a Brainrot !!,ChocolatAndVanillah,UCaCUq621hbDixsvUDELqMVw,20,Gaming,"brainrot, brainrots, chocoh, chocolatandvanillah, chocolatandvanilla, choco, kevko, og, steal, steal a brainrot, unchained, unchained_off, roblox, toinelag, J'obtiens mon propre brainrot, sab, stb, j'ai eu, steal a brainrots, brain, rots, rot",22,https://i.ytimg.com/vi/14YT2L0lINg/hqdefault.jpg,fr,fr,False,819,PT13M39S,hd,False,True,False,False,207909,5026,1279
Xrwt9iJ-69w,BE,2026-02-10T03:39:24.461675+00:00,2026-01-29T17:00:07Z,GJESTI - MEMORIES (Official Music Video),GJESTI - MEMORIES (Official Music Video),GJESTI,UCc0-JItbfymx-kY_pzhKzYA,10,Music,"gjesti, memories, gjesti - memories, veshu ndrequ, kenge e re, onima, onima hits, spotify, princeshe, alo, egli tako, big brother vip, youtube, kenga e re e Gjestit, hitet e reja 2026, hite, yll limani, thirrem sot ose neser, vallah, beba, Kujtime, Memories, Gjesti new music video, memorie, butrint imeri, tayna, melinda ademi, melinda, 2ton, dafina zeqiri",30,https://i.ytimg.com/vi/Xrwt9iJ-69w/hqdefault.jpg,en,sq,False,126,PT2M6S,hd,False,True,False,False,5266647,115586,4747
VbjAoYcEaGE,BE,2026-02-10T03:39:24.461683+00:00,2026-02-08T09:00:38Z,LE RETOUR DU SURMENAGE ( Sunset Motel Simulator ),LE RETOUR DU SURMENAGE ( Sunset Motel Simulator ),Sylvain Lyve - Best Of Twitch,UCd26XTdCltsEpyvZmmGW9Aw,2,Autos & Vehicles,"sylvain lyve, sylvainlevy, sylvain levy, vilebrequin, sylvain vilebrequin, sylvain lyve twitch, best of sylvain lyve, sylvain lyve best of, best of twitch, automobile, driver, need for speed, sylvain simulateur, sylvain best of simulator, sylvain hotel, sylvain mynthos, mynthos, sylvain burnout, burnout paradise, sylvain need for speed, sylvain driver san francisco, driver san francisco, sunset motel, motel simulator",24,https://i.ytimg.com/vi/VbjAoYcEaGE/hqdefault.jpg,fr,fr,False,1961,PT32M41S,hd,False,True,False,False,201907,10684,159
GDaPdpwA4Iw,BE,2026-02-10T03:39:24.461713+00:00,2026-01-29T17:19:08Z,Bruce Springsteen - Streets Of Minneapolis (Official Lyric Video),Bruce Springsteen - Streets Of Minneapolis (Official Lyric Video),Bruce Springsteen,UCcu7ANuD9J7hnTQCREqIc4Q,10,Music,,0,https://i.ytimg.com/vi/GDaPdpwA4Iw/hqdefault.jpg,en,en,False,281,PT4M41S,hd,False,False,False,False,6045036,370531,39329
GBWgVZiPZzA,BE,2026-02-10T03:39:24.461726+00:00,2026-02-07T20:35:32Z,I Built the first moving base in official Rust...,I Built the first moving base in official Rust...,Willjum,UCzOfLNkiScJp3U_h_QlvHHg,20,Gaming,"Willjum, Rust, Rust Solo Survival, Rust Movie, Twitch highlights, Rust Chilled, Willyum, Rust Solo Story, Solo, Rust Solo Base, Spoonkid, BritYT, BritRust",13,https://i.ytimg.com/vi/GBWgVZiPZzA/hqdefault.jpg,en-GB,en-US,False,4900,PT1H21M40S,hd,False,True,False,False,1023255,38621,3178
It7FVmC43oE,BE,2026-02-10T03:39:24.461746+00:00,2026-02-05T17:00:13Z,Lagui - STREET PLANT (Clip Officiel),Lagui - STREET PLANT (Clip Officiel),Lagui,UC0mwRLbjN4TTL7OpZDQkh7A,10,Music,,0,https://i.ytimg.com/vi/It7FVmC43oE/hqdefault.jpg,fr,fr,False,203,PT3M23S,hd,False,False,False,False,364876,10027,4098
v5hYvyWxiJU,BE,2026-02-10T03:39:24.461753+00:00,2026-02-06T16:00:01Z,"IK PROBEER ROBLOX ""BOOTJE VAREN"" TE OVERLEVEN! - Bote Ried - || Fan Friday","IK PROBEER ROBLOX ""BOOTJE VAREN"" TE OVERLEVEN! - Bote Ried - || Fan Friday",MeisjeDjamila,UCANa7EO3GwG7fzEMO-fVRWQ,22,People & Blogs,"meisjedjamila, meisje djamila, djamilla, djamila, damila, jamila, djamilia, djamillia, jamilla, jamillia, djammila",11,https://i.ytimg.com/vi/v5hYvyWxiJU/hqdefault.jpg,nl,nl,False,606,PT10M6S,hd,False,True,False,False,71023,4800,303
W6lIvxWfxLI,BE,2026-02-10T03:39:24.461761+00:00,2026-02-04T10:58:26Z,Ed Sheeran - Shape of You (Lyrics),Ed Sheeran - Shape of You (Lyrics),British Pop Bangers,UC90XKCg37vA7mmXm3LdwC3A,10,Music,"shape of you, shape of you lyrics, lyrics shape of you, ed sheeran, lyrics, ed sheeran shape of you, shape of you ed sheeran, ed sheeran shape of you lyrics, lyrics ed sheeran shape of you, ed sheeran lyrics, lyrics ed sheeran, ed sheeran lyrics shape of you, shape of you lyrics ed sheeran, lyrics shape of you ed sheeran, shape of you ed sheeran lyrics, shape of you lyric, shape of you lyric video, lyric video shape of you, ed sheeran - shape of you, pop, music, hits",22,https://i.ytimg.com/vi/W6lIvxWfxLI/hqdefault.jpg,en,en,False,235,PT3M55S,hd,False,False,False,False,1663416,4624,32
iQ_h8fU93No,BE,2026-02-10T03:39:24.461770+00:00,2026-02-08T13:30:54Z,Les meilleurs joueurs du monde (Documentaire CDL Major Dallas 2026),Les meilleurs joueurs du monde (Documentaire CDL Major Dallas 2026),Gentle Mates,UCpihR1Q2f5EQTEn5UfVlRrw,24,Entertainment,"gotaga, brawks, squeeze, Nikof, M8, M8 Squeezie, M8 Gotaga, Gentle Mates, GentleMates, Gentle Mates COD, Call of Duty Gotaga, Call of Duty Gentle Mates, Major COD 1, Major COD 2026, Documentary Major 1 COD, Documentaire Gentle Mates",16,https://i.ytimg.com/vi/iQ_h8fU93No/hqdefault.jpg,fr,fr,False,3938,PT1H5M38S,hd,False,True,False,False,149042,12860,389
lqfMqtcJl6g,BE,2026-02-10T03:39:24.461779+00:00,2026-01-28T09:00:06Z,Helena - Capuche (Clip officiel),Helena - Capuche (Clip officiel),helenabllyVEVO,UCJP0yxL7H05vptIECYThRZw,10,Music,"clipofficiel, hele, hélé, Capuche, Helena",5,https://i.ytimg.com/vi/lqfMqtcJl6g/hqdefault.jpg,nl,fr,False,210,PT3M30S,hd,False,True,False,False,311568,17960,721
knAWvOA_t6I,BE,2026-02-10T03:39:24.461787+00:00,2026-02-08T15:45:03Z,Job Steelt Sammy Zijn Zeldzaamste Brainrot... In Roblox!,Job Steelt Sammy Zijn Zeldzaamste Brainrot... In Roblox!,Dutchtuber,UCzWgtYoa3X7p8zJk5pEr6ww,20,Gaming,"dutchtuber, steal a brainrot dutchtuber, dutchtuber steal a brainrot, dutchtuber speelt roblox, roblox dutchtuber, roblox, steal a brainrot roblox, gaming, grappig",9,https://i.ytimg.com/vi/knAWvOA_t6I/hqdefault.jpg,nl,nl,False,902,PT15M2S,hd,False,True,False,False,54457,2389,332
mQezde_qeXw,BE,2026-02-10T03:39:24.461795+00:00,2026-02-05T23:00:07Z,sombr - Homewrecker (official video),sombr - Homewrecker (official video),sombr,UCXlqFQmZZOb78teSnAqhuwA,10,Music,"sombr, Quenlin Blackwell, Milo Manheim, Homewrecker, Official Music Video, Pop, Rock, Alternative, New sombr 2026, Quen Blackwell, sombr Homewrecker, I don't wanna be a homewrecker, I don't wanna talk down on your lover, I know I could be better, Old Western, Cowboys, Old Western Music Video, You hit like a drunk cigarette",18,https://i.ytimg.com/vi/mQezde_qeXw/hqdefault.jpg,en,en,False,254,PT4M14S,hd,False,True,False,False,2066893,112640,5322
YvObQH046Go,BE,2026-02-10T03:39:24.461803+00:00,2026-02-08T16:45:03Z,Job Speelt Valentijn Update In Steal A Brainrot... In Roblox!,Job Speelt Valentijn Update In Steal A Brainrot... In Roblox!,Dutchtuber - Roblox,UCxAGC6anykMyL9ZiwmkdWfw,20,Gaming,"dutchtuber steal a brainrot, steal a brainrot, dutchtuber steal a brainrot roblox, dutchtuber roblox, roblox dutchtuber, job dutchtuber, job steal a brainrot, update, steal a brainrot update",9,https://i.ytimg.com/vi/YvObQH046Go/hqdefault.jpg,nl,nl,False,707,PT11M47S,hd,False,True,False,False,61577,2959,345
4R5zsoxjARk,BE,2026-02-10T03:39:24.461810+00:00,2026-01-16T13:00:07Z,DYSTINCT - TA3AL (Official Music Video) / ديستانكت - تعال,DYSTINCT - TA3AL (Official Music Video) / ديستانكت - تعال,Avalon Music,UC3G7GLG-fk95DhiTDJX1SHQ,10,Music,"dystinct, yama, dystinct yama, dystinct yama lyrics, ta3al, dystinct ta3al, yama dystinct, dystinct d block europe, dystinct ayouba, ayouba, dystinct young adz, j balvin, dystinct la, dystinct j balvin, dystinct tek tek, dystinct ma3lich, dystinct j balvin como tu, dystinct dvm, j balvin dystinct, j balvin x, dystinct reg deg, dystinct mhd, dystinct spanish, dystinct jul princesa, dystinct morad, dystinct rs6, dystinct spider, dystinct ghazali",28,https://i.ytimg.com/vi/4R5zsoxjARk/hqdefault.jpg,nl,ar,False,178,PT2M58S,hd,False,True,False,False,10412990,111183,1995
XKNTmmcmrps,BE,2026-02-10T03:39:24.461818+00:00,2026-02-08T15:37:00Z,Ik leende een Diamond account om undercover IEDEREEN te PRANKEN..,Ik leende een Diamond account om undercover IEDEREEN te PRANKEN..,Twisty,UCwxrrK3jwoRRlSq6IXZt-RQ,20,Gaming,"Twisty rocket league, twisty, undercover as a bot, rocket league nederlands, de snelste goal wint rocket league, twisty tiktok, thomas rocket league, supersonic legend nederlands, twisty RL, RL twisty, 1v1 tegen een hater, Rocket League 1v1, Twisty Rocket League, Twisty SSL, Supersonic legend, 2v2 Rocket League, Rocket League, Twisty RL, Twisty tiktok, road to ssl 1v1, hoe word je goed in rocket league, tips rocket league, nederlandse rocket league, Twisty Royalistiq",24,https://i.ytimg.com/vi/XKNTmmcmrps/hqdefault.jpg,nl,nl,False,994,PT16M34S,hd,False,True,False,False,48010,1017,128
UcLj3wLcQF4,BE,2026-02-10T03:39:24.461826+00:00,2026-01-16T17:00:04Z,RnBoi & Nono La Grinta - AVEC MOI (Clip Officiel),RnBoi & Nono La Grinta - AVEC MOI (Clip Officiel),RnBoi,UCEvTUVFFOBTRvf6XygM4I9g,10,Music,"RnBoi, AVEC MOI, MON BEBE, BTRD, Aya Nakamura, Nono La Grinta, La grint, LOVE YOU, Paris, mon bébé, bébé, Aya, batard, btrd, tiakola, R2, Tiakola, Monsieur Nov, Rsko, Eva, Ronisia, Genezio, Davy One, Yorssy, Dadju, Tayc, Lisandro Cuxi, Franglish, Joé Dwèt Filé, Warren Saada, Merveille, Vacra, Wejdene, l2b, Hamza, Denden, Booska P, Planète Rap, Skyrock",39,https://i.ytimg.com/vi/UcLj3wLcQF4/hqdefault.jpg,fr,fr,False,177,PT2M57S,hd,False,True,False,False,4021997,63908,1531
mfxQsabba_U,BE,2026-02-10T03:39:24.461834+00:00,2026-02-08T18:32:56Z,STEAL A BRAINROT GIVEAWAY LIVE | STEAL A BRAINROT FREE SECRETS + FREE BRAINROT GODS,STEAL A BRAINROT GIVEAWAY LIVE | STEAL A BRAINROT FREE SECRETS + FREE BRAINROT GODS,Fridonic,UCdqyA7s-WBsgFamaEEu8GZg,20,Gaming,,0,https://i.ytimg.com/vi/mfxQsabba_U/hqdefault.jpg,en,en-US,False,13,PT13S,hd,False,True,False,False,368221,1808,5
7sxVHYZ_PnA,BE,2026-02-10T03:39:24.461842+00:00,2026-01-23T17:00:07Z,Harry Styles - Aperture (Official Video),Harry Styles - Aperture (Official Video),HarryStylesVEVO,UCbOCbp5gXL8jigIBZLqMPrw,10,Music,"Harry styles, aperture, aperture official video, harry styles music video, aperture official music video, harry styles aperture, let the light in, we belong together, harry styles we belong together, together together, harry styles together together, harry styles lyrics, harry styles new music video, harry styles tour, harry styles music, new harry styles, new harry styles song, kiss all the time disco occasionally, kiss all the time, disco occasionally, hs4",21,https://i.ytimg.com/vi/7sxVHYZ_PnA/hqdefault.jpg,en,en,False,352,PT5M52S,hd,False,True,False,False,17019026,593134,33158
A811r1vgki8,BE,2026-02-10T03:39:24.461853+00:00,2026-02-09T14:30:09Z,Zandstorm Overleven In Minecraft !(Survival),Zandstorm Overleven In Minecraft !(Survival),GIEL,UC-M16lOcjto6EmZuLyj-LSQ,24,Entertainment,"Giel, giel reageren, gielekuhh, giel mick, Minecraft, Minecraft survival, minecraft mods, minecraft hack, minecraft troll, minecraft bunker, minecraft, minecraft song, mick gaming, mick, Santino, ProSpeler, Pro, Pro Speler, noob, GIEL 2, kind vriendelijk, familie vriendelijk, minecraft nl, minecraft nederlands, minecraft creative, nederlands",26,https://i.ytimg.com/vi/A811r1vgki8/hqdefault.jpg,nl,nl,False,1092,PT18M12S,hd,False,True,False,False,29472,1215,227
PoHPFLaOPNo,BE,2026-02-10T03:39:24.461861+00:00,2026-02-04T00:05:02Z,Ed Sheeran - Perfect (Lyrics),Ed Sheeran - Perfect (Lyrics),Radio Paradise,UCIQ8gbevU9r1OJqOtCkUmOQ,10,Music,"lyrics, english lyrics, lyric video, music lyrics, song lyrics, letras de canciones en inglés, english songs lyrics, letras traducidas, video con letra, english music lyrics, pop lyrics, rock lyrics, rap lyrics, hip hop lyrics, reggaeton lyrics, r&b lyrics, trap lyrics, romantic lyrics, love song lyrics, billboard lyrics, top hits lyrics, trending lyrics, karaoke lyrics, sing along lyrics, best lyrics, new music lyrics, english hits lyrics, music videos with lyrics",28,https://i.ytimg.com/vi/PoHPFLaOPNo/hqdefault.jpg,en-US,en-US,False,264,PT4M24S,hd,False,False,False,False,1575724,5660,35
u90-jTiVE_U,BE,2026-02-10T03:39:24.461869+00:00,2026-02-08T07:15:02Z,Job Speelt Kist Update In 99 Nachten In Het Bos... In Roblox!,Job Speelt Kist Update In 99 Nachten In Het Bos... In Roblox!,DutchtuberGaming,UCBS1vxH489OL-oN7P3HUsPw,20,Gaming,"brookhaven, roblox brookhaven, dutchtuber brookhaven, dutchtuber roblox, roblox dutchtuber, brookhaven job, roblox brookhaven dutchtuber, brookhaven dutchtuber roblox, dutchtuber2, dutchtubergaming, dutchtuber job brookhaven, brookhaven rp, brookhaven verhaal, brookhaven geheimen, brookhaven geheim, leuk, grappig, entertainment, amusement, gaming, roblox",21,https://i.ytimg.com/vi/u90-jTiVE_U/hqdefault.jpg,nl,nl,False,832,PT13M52S,hd,False,True,False,False,56869,2728,178
GIxsRjALt50,BE,2026-02-10T03:39:24.461877+00:00,2026-01-23T17:00:03Z,Djadja & Dinaz - Les bases [Clip Officiel],Djadja & Dinaz - Les bases [Clip Officiel],Djadja & Dinaz,UChAG8UcTzWs00oWAh0tMguw,10,Music,"Djadja dinaz, Djadja & dinaz, Djadja, Dinaz, Les bases, Telegram, Rap, Hip hop, Cloud rap",9,https://i.ytimg.com/vi/GIxsRjALt50/hqdefault.jpg,fr,fr,False,154,PT2M34S,hd,False,True,False,False,1614534,17093,417
Dk-N_bj2Mc8,BE,2026-02-10T03:39:24.461885+00:00,2026-02-06T14:30:00Z,Ik Open Een Winkel,Ik Open Een Winkel,Alex Klein,UCpf4pGjVXwl5t8jl6zaTIiA,20,Gaming,"Alex, Klein, Dutch, Nederlands, NL, Nederland, Trending, Trending NL, Kind Vriendelijk, Familie Vriendelijk, Game, Alex Klein, MinionFartGun, Minecraft, Minecraft NL, Minecraft Nederlands, Alex Klein Minecraft, Minecraft Survival, Survival, Minecraft Alex, Anko",21,https://i.ytimg.com/vi/Dk-N_bj2Mc8/hqdefault.jpg,nl,nl,False,1082,PT18M2S,hd,False,True,False,False,67920,3258,98
