video_id,country,fetched_at,published_at,title,localized_title,channel_title,channel_id,category_id,category_name,tags,tag_count,thumbnail,default_language,audio_language,is_live,duration,duration_raw,definition,caption_available,licensed_content,embeddable,made_for_kids,views,likes,comments
Vawi8a1PsLQ,BA,2026-02-11T03:35:36.852959+00:00,2026-02-03T11:00:06Z,Jakov Jozinović - Ja volim,Jakov Jozinović - Ja volim,Jakov Jozinovic,UCdkexPTGETXAlFLlPObGb1Q,10,Music,"ja volim, ja volim te, jožinović jakov",3,https://i.ytimg.com/vi/Vawi8a1PsLQ/hqdefault.jpg,hr,zxx,False,201,PT3M21S,hd,False,False,False,False,2553386,46275,1236
e9HXmMnUEdE,BA,2026-02-11T03:35:36.852998+00:00,2026-02-02T00:59:56Z,The Devil Wears Prada 2 | Official Trailer,The Devil Wears Prada 2 | Official Trailer,20th Century Studios,UC2-BeLxzUBSs0uSrmzWhJuQ,1,Film & Animation,Trailer,1,https://i.ytimg.com/vi/e9HXmMnUEdE/hqdefault.jpg,en,en,False,100,PT1M40S,hd,True,True,False,False,9599773,161885,6387
ZewGbJD1M44,BA,2026-02-11T03:35:36.853009+00:00,2026-02-09T17:15:08Z,PRAVIM PRENOĆIŠTE U SELU,PRAVIM PRENOĆIŠTE U SELU,Smigicka,UCekojv1JKhvr5rGag0TCOug,23,Comedy,"smigicka, smiga, smuga, smega, smoga, aleksandrasmigic, sminka, novke i smiga, dress to impress, dti, oblacim se, putovanja, vlog, defko i caki, roblox, pravim, hotel, gradim, smigicka igrice",19,https://i.ytimg.com/vi/ZewGbJD1M44/hqdefault.jpg,sr,en,False,1921,PT32M1S,hd,False,True,False,False,242402,9578,711
aHBG4ZzhId0,BA,2026-02-11T03:35:36.853019+00:00,2026-01-31T13:00:06Z,DESINGERICA - MEDOVACCA (OFFICIAL VIDEO),DESINGERICA - MEDOVACCA (OFFICIAL VIDEO),Desingerica,UC-8ljtsUg8RVCOq-Gfcp8Rg,22,People & Blogs,"desingerica, pljugica, tuckavacc, kucci kucci, praccka, pistacc, balkanacc",7,https://i.ytimg.com/vi/aHBG4ZzhId0/hqdefault.jpg,en,sr,False,131,PT2M11S,hd,False,True,False,False,900795,27562,1123
AFuE1LRxm80,BA,2026-02-11T03:35:36.853027+00:00,2026-02-04T18:00:00Z,WAR MACHINE | Official Trailer | Netflix,WAR MACHINE | Official Trailer | Netflix,Netflix,UCWOA1ZGywLbqmigxE4Qlvuw,24,Entertainment,"Alan Ritchson, Alan Ritchson War Machine, Armor Wars, Dennis Quaid, Jai Courtney, MCU, Marvel War Machine, Military Thriller, Netflix, New Movie Trailers, Patrick Hughes, Reacher Alan Ritchson, Sci-Fi Action, Sci-Fi Thriller 2026, Trailer, War Machine 2026, War Machine Movie, War Machine Netflix, War Machine Official Trailer, War Machine Trailer",20,https://i.ytimg.com/vi/AFuE1LRxm80/hqdefault.jpg,en,en-US,False,123,PT2M3S,hd,True,True,False,False,11866637,183710,14976
BgY_2V8hKWI,BA,2026-02-11T03:35:36.853036+00:00,2026-02-07T16:24:09Z,PRAVIM NAJVEĆI TOBOGAN,PRAVIM NAJVEĆI TOBOGAN,Novke,UCURlpFWEyij724FND2MEs0w,23,Comedy,"novke, novisha, novisa, novcic, aleksandar novcic, 24 sata, ymurke, skrivaci, smiga, smigicka, djape, novketova devojka, novketov brat, novke i smigicka, novke i smiga, smuga, nofke, nobke, caki, defko, novke majice, smiga majice, AKVA PARK, tobogani, najveci tobogan, najopasniji tobogan, novke akva park, novke tobogani, novke i smiga akva park, novke leto, novke gaming, novke igrice, novke roblox, roblox",34,https://i.ytimg.com/vi/BgY_2V8hKWI/hqdefault.jpg,sr,sr,False,1121,PT18M41S,hd,False,True,False,False,280924,10696,465
LhLH-fwNRZg,BA,2026-02-11T03:35:36.853044+00:00,2026-02-02T09:31:52Z,BAKA PRASE X CHODA - BETMEN (OFFICIAL VIDEO),BAKA PRASE X CHODA - BETMEN (OFFICIAL VIDEO),BakaPrase,UCPFkFp9YM3yK7EOhUn0aMDA,22,People & Blogs,,0,https://i.ytimg.com/vi/LhLH-fwNRZg/hqdefault.jpg,sr,sr,False,153,PT2M33S,hd,False,False,False,False,628192,5804,286
-1UJJPAWudQ,BA,2026-02-11T03:35:36.853052+00:00,2026-01-14T16:00:13Z,Euphoria Season 3 | Trailer | HBO Max,Euphoria Season 3 | Trailer | HBO Max,HBO Max,UCx-KWLTKlB83hDI6UKECtJQ,24,Entertainment,"hbo max, hbo, hbo originals, hbo original series, hbo trailer, new on hbo, hbo max originals, hbo max trailer, hbo max series, hbo max youtube, euphoria, euphoria season 3, euphoria trailer 1, euphoria trailer, zendaya, sydney sweeney, jacob elordi, rue, cassie, nate, alexa demie, maddy, lexi, jules, maude apatow, hunter schafer, zendaya euphoria, euphoria new season, hbo euphoria season 3, sydney sweeney euphoria, sydney sweeney cassie, cassie and nate, cassie and maddy",33,https://i.ytimg.com/vi/-1UJJPAWudQ/hqdefault.jpg,en,en,False,145,PT2M25S,hd,True,True,False,False,5642362,117277,7985
UBWKJk3ka7c,BA,2026-02-11T03:35:36.853075+00:00,2026-02-05T05:36:03Z,DANAS MALO JACI STRIMEX,DANAS MALO JACI STRIMEX,Nugato,UCT1xv_rVS0bvk8ZSz7AKqDw,20,Gaming,"Nugato, baba, Balkan, GTA V, CSGO",5,https://i.ytimg.com/vi/UBWKJk3ka7c/hqdefault.jpg,sr,en,False,40329,PT11H12M9S,hd,False,True,False,False,344893,11664,59
5uMiDF9ocCM,BA,2026-02-11T03:35:36.853085+00:00,2026-02-05T17:39:23Z,1001 noć,1001 noć,Colonia - Topic,UCXrX5chFE2bl71gIodct6yA,10,Music,"Colonia, Boris Đurđević, Jača nego ikad, 1001 noć",4,https://i.ytimg.com/vi/5uMiDF9ocCM/hqdefault.jpg,hr,hr,False,261,PT4M21S,hd,False,True,False,False,166179,1054,9
8KTdyMS-rZg,BA,2026-02-11T03:35:36.853093+00:00,2026-02-08T19:00:12Z,NAŠAO SAM NAJREĐE MOBOVE U MINECRAFTU!,NAŠAO SAM NAJREĐE MOBOVE U MINECRAFTU!,Dex Rock,UC9-OsEfAts7_SaTRQOBRgjw,20,Gaming,DexRock,1,https://i.ytimg.com/vi/8KTdyMS-rZg/hqdefault.jpg,sr,sr,False,902,PT15M2S,hd,False,True,False,False,146220,9366,184
KyKv3ePTatE,BA,2026-02-11T03:35:36.853101+00:00,2026-02-08T08:00:18Z,Coby - U daljini,Coby - U daljini,Bassivity Digital,UCtAE452wbBYJZASZ-3jCNBA,10,Music,,0,https://i.ytimg.com/vi/KyKv3ePTatE/hqdefault.jpg,sr,sr,False,188,PT3M8S,hd,False,True,False,False,182145,6430,148
yYTe-MW4zBk,BA,2026-02-11T03:35:36.853109+00:00,2026-02-09T16:00:16Z,MINECRAFT ALI SVAKI CHUNK JE RANDOM,MINECRAFT ALI SVAKI CHUNK JE RANDOM,zZzZOBRA,UCoRySXI-vMRIYBmDllxJQRA,20,Gaming,"zzzzobra, zobra, minecraft, chunk, random, mrbrother",6,https://i.ytimg.com/vi/yYTe-MW4zBk/hqdefault.jpg,sr,sr,False,1124,PT18M44S,hd,False,True,False,False,76141,2932,72
2XTagCCfsMA,BA,2026-02-11T03:35:36.853117+00:00,2026-02-07T17:00:04Z,SERIF KONJEVIC - SITNI SATI (OFFICIAL VIDEO),SERIF KONJEVIC - SITNI SATI (OFFICIAL VIDEO),Serif Konjevic,UCpX8wlAdUsZwS9dAo_kdFLA,10,Music,,0,https://i.ytimg.com/vi/2XTagCCfsMA/hqdefault.jpg,hr,en,False,196,PT3M16S,hd,False,True,False,False,136382,3605,314
3bTspsIcxok,BA,2026-02-11T03:35:36.853124+00:00,2026-02-09T17:04:18Z,SARA ME JE PREVARILA U ESCAPE TSUNAMI! Dečki VS Cure,SARA ME JE PREVARILA U ESCAPE TSUNAMI! Dečki VS Cure,MarkoKC,UCYcXicWbPZ-p2zQRStpYrEg,20,Gaming,"kc_marko, ytmarkokc, šniteri, šniterinajjaci, marko kaže, mark okc, brawl stars, pjesma, KC, fortnite, marko kc, pesma",12,https://i.ytimg.com/vi/3bTspsIcxok/hqdefault.jpg,hr,hr,False,969,PT16M9S,hd,False,True,False,False,59278,1250,101
oS3yKFFt2AA,BA,2026-02-11T03:35:36.853132+00:00,2026-01-30T11:00:07Z,TRILE X TRIO MANDILI - MOJA LELO (OFFICIAL VIDEO),TRILE X TRIO MANDILI - MOJA LELO (OFFICIAL VIDEO),LOCO GANG,UCedjT20IpKyyIauHYyZW2Ig,24,Entertainment,,0,https://i.ytimg.com/vi/oS3yKFFt2AA/hqdefault.jpg,sr,sr-Latn,False,180,PT3M,hd,True,True,False,False,2125176,8813,11408
RafTWYkXa8A,BA,2026-02-11T03:35:36.853139+00:00,2026-02-09T16:00:42Z,OVO SU NAJTEŽE TAJNE KUTIJE U GTA 5 IZAZOV!!!,OVO SU NAJTEŽE TAJNE KUTIJE U GTA 5 IZAZOV!!!,Imperator FX,UCnvD039Yr0_zBO7xgItSnMw,20,Gaming,"Impe, ImperatorFX, Imperator FX, Imperator, ImpeFX, Impe FX, minecraft, minecraftprezivljavanje, mc prezivljavanje, impe, mapa, creative, impefortnite, impefortnajt, vodeno prezivljavanje, vodeno, minecraftvodeno, prez, gtapropisi, gta po propisima, gta5, gta5 po pravilima, impe po propisima, minecraft impe, ostrvo, prezivljavanje impe, majnkraft, bazen, kuca, auto, bloxburg, adopt me, porodicne, avanture, roblox, impe roblox, impe bloxburg, imperator roblox, zooba, impe brawl stars, impe zooba",41,https://i.ytimg.com/vi/RafTWYkXa8A/hqdefault.jpg,hr,en,False,1602,PT26M42S,hd,False,True,False,False,33438,1967,109
qpXroJ16aEs,BA,2026-02-11T03:35:36.853148+00:00,2026-01-20T18:00:07Z,EMIR ĐULOVIĆ - OVA MAČKA DO MENE (OFFICIAL VIDEO),EMIR ĐULOVIĆ - OVA MAČKA DO MENE (OFFICIAL VIDEO),Emir Đulović Official,UC-MHuKAEoHBVopH9cOsGBOQ,10,Music,"#emir, #emirdjulovic, #ovamackadomene, pijevinoovako, #dzej",5,https://i.ytimg.com/vi/qpXroJ16aEs/hqdefault.jpg,sr,bs,False,146,PT2M26S,hd,False,True,False,False,1675628,12709,635
eXhSS0ntX2Q,BA,2026-02-11T03:35:36.853155+00:00,2026-02-10T12:36:13Z,KO ĆE SKUPITI VIŠE BEDŽEVA U 99 NOĆI U ŠUMI,KO ĆE SKUPITI VIŠE BEDŽEVA U 99 NOĆI U ŠUMI,EmiFox,UC7a6v4_3RyIuUu52CYG7x8A,20,Gaming,"ema, emifox, emaizobra, emafox",4,https://i.ytimg.com/vi/eXhSS0ntX2Q/hqdefault.jpg,sr,sr,False,1090,PT18M10S,hd,False,True,False,False,71741,1983,99
USz_xxX9sHk,BA,2026-02-11T03:35:36.853163+00:00,2026-01-28T11:00:04Z,ANDREANA CEKIC X DEJAN KOSTIC - E75 (OFFICIAL VIDEO),ANDREANA CEKIC X DEJAN KOSTIC - E75 (OFFICIAL VIDEO),Dejan Kostic Official,UCYPoYD-yGgvLFQzOp2YD64Q,10,Music,"dejan, kostic, novo, novi spot, nova pesma, andreana, dejan kostic andreana, andreana cekic, cekic kosti, e 75, andreana e 75, andreana kostic dejan, dejan kostic andreana e75, novi single, novi duet, official video dejan, code music, tea tairovic, aleksandra prijovic, barbara bobak, milica pavlovic, nove pesme, novo 2026, dejan 2026, dejan kostic 2026 spot, dejan kostic 2026 novo, e 75 novi single, novi video, darko lazic, dejan kostic 2026, new release, new video",32,https://i.ytimg.com/vi/USz_xxX9sHk/hqdefault.jpg,ro,sr,False,252,PT4M12S,hd,False,True,False,False,1290922,6795,365
PSpW7qPBlSE,BA,2026-02-11T03:35:36.853170+00:00,2026-02-08T09:00:00Z,1 MINUT VS 10 MINUTA VS 1 SAT VULKAN!,1 MINUT VS 10 MINUTA VS 1 SAT VULKAN!,Luna  ,UC3aVGpDQ4G_YwngcKs-UHWw,20,Gaming,"minecraft, lunailuka, lukailuna, luna, luka, luna minecraft, luka minecraft",7,https://i.ytimg.com/vi/PSpW7qPBlSE/hqdefault.jpg,sr,sr,False,1099,PT18M19S,hd,False,True,False,False,72018,3006,859
DMDJYuUwghg,BA,2026-02-11T03:35:36.853177+00:00,2026-02-09T10:59:33Z,Mile Kekin - Hrvatska je raj na zemlji (Official Video),Mile Kekin - Hrvatska je raj na zemlji (Official Video),Mile Kekin,UC6JGIHNina7kNqsQ9F1ifhQ,10,Music,"Andrija lazo, Ilica I marica, Ivana kekin, Mario petrenjak, andrej plenkovic, balkan, dinko šimac, glazba, hajka za odrasle, hit, hladno pivo, hp, hrvatska, hyped, ilica, index, knjiga žalbe, kuca bez krova, mark mrakovcic, mile kekin, mozemo, muzika, new, njezno djonom, novo, re",26,https://i.ytimg.com/vi/DMDJYuUwghg/hqdefault.jpg,hr,hr,False,242,PT4M2S,hd,False,True,False,False,229982,5558,2157
zr3CdDxd2Yw,BA,2026-02-11T03:35:36.853185+00:00,2026-02-09T15:45:06Z,IMPE JE POGODIO PRAVU TAJNU TROLL KUTIJU U GTA 5!!,IMPE JE POGODIO PRAVU TAJNU TROLL KUTIJU U GTA 5!!,50N3,UCxDB-9Q-iNlkAWhRlqmBN1Q,20,Gaming,"50N3, Šone, Sone, ŠoneYT, Brawl Stars, Minecraft, Roblox, GTA V, Trending",9,https://i.ytimg.com/vi/zr3CdDxd2Yw/hqdefault.jpg,hr,und,False,1366,PT22M46S,hd,False,True,False,False,19373,1563,269
PA8Yp03Tgk0,BA,2026-02-11T03:35:36.853193+00:00,2026-02-06T11:00:06Z,Lacku feat. Cunami Flo - GOLF (OFFICIAL VIDEO),Lacku feat. Cunami Flo - GOLF (OFFICIAL VIDEO),Lacku,UCV9cuuK7Lrj7vAbXD-QYMPQ,10,Music,,0,https://i.ytimg.com/vi/PA8Yp03Tgk0/hqdefault.jpg,sr,sr,False,190,PT3M10S,hd,False,True,False,False,122072,4883,173
R901pLctDiA,BA,2026-02-11T03:35:36.853200+00:00,2026-02-09T11:00:52Z,OVO JE UKLETA BOLNICA,OVO JE UKLETA BOLNICA,Saurus Gaming,UCORo0ScZwNNH4gNn3rtBCpw,20,Gaming,,0,https://i.ytimg.com/vi/R901pLctDiA/hqdefault.jpg,hr,und,False,870,PT14M30S,hd,False,True,False,False,82827,5124,97
s-oC94iqpSw,BA,2026-02-11T03:35:36.853207+00:00,2026-02-06T11:01:55Z,GAZDA PAJA x 2SOMA - DJIHA DJIHA,GAZDA PAJA x 2SOMA - DJIHA DJIHA,Gazda Paja,UC_dKRmFqxREZJ41H6UXvOlw,10,Music,,0,https://i.ytimg.com/vi/s-oC94iqpSw/hqdefault.jpg,sr,sr-Latn,False,131,PT2M11S,hd,True,True,False,False,146910,3975,88
P1FVJukhdyE,BA,2026-02-11T03:35:36.853214+00:00,2026-02-08T22:32:28Z,ŠTA MI JE TO U USTIMA?!,ŠTA MI JE TO U USTIMA?!,Cigvan Gaming,UCD8geOrSnzs_DrHIhgsufoA,20,Gaming,,0,https://i.ytimg.com/vi/P1FVJukhdyE/hqdefault.jpg,hr,hr,False,877,PT14M37S,hd,False,True,False,False,57321,984,27
SCvTFKKOtF4,BA,2026-02-11T03:35:36.853222+00:00,2026-01-31T11:00:49Z,NIKOLIJA - U SOBI GREH (OFFICIAL VIDEO),NIKOLIJA - U SOBI GREH (OFFICIAL VIDEO),MADE IN BLKN,UCaRs9hr88Sqmt1SBK7JYMVw,10,Music,"relja, relja popovic, idjvideos, made in balkan, made in blkn, nova pesma, takvi kao ja, nikolija, tuga iz porsea, meduza, mi amor, princeza na belom, devito, rasta, genge, offline, o bivsima, high life",18,https://i.ytimg.com/vi/SCvTFKKOtF4/hqdefault.jpg,sr,sr,False,148,PT2M28S,hd,False,True,False,False,323129,5281,160
dKjEzYNFYnM,BA,2026-02-11T03:35:36.853229+00:00,2026-02-10T10:00:00Z,Rage I Kovalski Beze Od 67 Kidare U Najvecem Vozu U Minecraftu,Rage I Kovalski Beze Od 67 Kidare U Najvecem Vozu U Minecraftu,Rage ,UC3tm6KUnDfP7z4h2yrzAPSw,20,Gaming,,0,https://i.ytimg.com/vi/dKjEzYNFYnM/hqdefault.jpg,sr,sr,False,1229,PT20M29S,hd,False,True,False,False,32011,762,48
cNIuG3f3ac4,BA,2026-02-11T03:35:36.853236+00:00,2026-01-18T13:00:10Z,SLOBA RADANOVIĆ - KO DA NAS NIJE NI BILO (OFFICIAL VIDEO),SLOBA RADANOVIĆ - KO DA NAS NIJE NI BILO (OFFICIAL VIDEO),Sloba Radanovic,UCtHQlg6FypR2SjqPjkkXoog,10,Music,"sloba radanovic, sloba radanović, sloba radanovic novo, sloba radanovic 2026, sloba radanovic uzivo, sloba radanović nova pesma, ko da nas nije ni bilo, sloba radanovic ko da nas nije ni bilo, sloba radanović ko da nas nije ni bilo, sloba ko da nas nije ni bilo, ko da nas nije ni bilo official video, ko da nas nije ni bilo tekst",12,https://i.ytimg.com/vi/cNIuG3f3ac4/hqdefault.jpg,sh,sh,False,168,PT2M48S,hd,False,True,False,False,1888237,11497,1065
5odz7B-Z0fk,BA,2026-02-11T03:35:36.853244+00:00,2026-02-08T16:00:21Z,PRELAZIMO PREPREKE VEZANI LISICAMA,PRELAZIMO PREPREKE VEZANI LISICAMA,VukAleksandra Gaming,UCEL8vuXXa3lNLnESjcXX2Vg,20,Gaming,"vukaleksandra, vukaleksanragaming, gaming, igrice, vuk, aleksandra, roblox",7,https://i.ytimg.com/vi/5odz7B-Z0fk/hqdefault.jpg,sr,sr,False,1402,PT23M22S,hd,False,True,False,False,78532,2695,269
F5dKb-KAFM8,BA,2026-02-11T03:35:36.853251+00:00,2026-01-23T11:00:14Z,INAS X ELENA - PARANOIE,INAS X ELENA - PARANOIE,INAS,UCI0u24WGzxBGO3lmuc_lw8w,22,People & Blogs,,0,https://i.ytimg.com/vi/F5dKb-KAFM8/hqdefault.jpg,sr,sr,False,151,PT2M31S,hd,False,True,False,False,809829,8426,220
hSQ3F_htCUg,BA,2026-02-11T03:35:36.853258+00:00,2026-02-09T04:27:50Z,🔥NEDELJA I SVI STE TU,🔥NEDELJA I SVI STE TU,leksa,UCWqh-Qnhy8-u3olW1bMO_0w,22,People & Blogs,"leksa, leksa live, gaming live, gejming, reakcije, omegle live, variety stream, youtube live srbija, streamer srbija, lexa, horror, amongus, among us",13,https://i.ytimg.com/vi/hSQ3F_htCUg/hqdefault.jpg,sr,sr,False,28766,PT7H59M26S,hd,False,False,False,False,65562,4895,33
cOVFBcbuRfk,BA,2026-02-11T03:35:36.853265+00:00,2026-01-16T15:30:06Z,Valderrama Flow - POLA 5 🕟 (Official video),Valderrama Flow - POLA 5 🕟 (Official video),Valderrama Flow & Variola,UC2aNxma0KFKPo3HX8JOht1Q,10,Music,"pola 5, valderrama flow, balkan, muzika, buba corelli, baka prase, jala brat, cunami, devito, relja, crni cerak",11,https://i.ytimg.com/vi/cOVFBcbuRfk/hqdefault.jpg,hr,und,False,161,PT2M41S,hd,False,True,False,False,348523,4976,249
TxDQt8OI52w,BA,2026-02-11T03:35:36.853273+00:00,2026-02-07T09:00:41Z,USVOJILA ME JE NAJJACA PORODICA U MINECRAFTU!,USVOJILA ME JE NAJJACA PORODICA U MINECRAFTU!,Luka,UC02CEs1zhwGVoB3W6sj1zEA,20,Gaming,"minecraft, lunailuka, lukailuna, luna, luka, luna minecraft, luka minecraft",7,https://i.ytimg.com/vi/TxDQt8OI52w/hqdefault.jpg,sr,sr,False,1422,PT23M42S,hd,False,True,False,False,62097,1682,76
3YOeZc480OE,BA,2026-02-11T03:35:36.853280+00:00,2026-02-07T12:00:04Z,Jala Brat & Buba Corelli - Babylon (Tekst/Lyric Video),Jala Brat & Buba Corelli - Babylon (Tekst/Lyric Video),Balkan Music,UCwZqRnp7dsrJUX9iEWdBVGg,10,Music,"Jala Brat, Buba Corelli, Babylon, Jala Brat & Buba Corelli - Babylon, Babylon (Tekst/Lyric Video), jala brat buba correli, jala brat, buba corelli, balkan music, balkan songs, balkan, balkan hits",12,https://i.ytimg.com/vi/3YOeZc480OE/hqdefault.jpg,hr,sr,False,144,PT2M24S,hd,False,True,False,False,40354,244,4
SzCwWZFV0cQ,BA,2026-02-11T03:35:36.853288+00:00,2026-02-08T18:16:09Z,Spasavamo KOLA JUTJUBERIMA Od Cunamija!,Spasavamo KOLA JUTJUBERIMA Od Cunamija!,Drugari,UCLnIHL_NAHkbFi7pZ0mKtLg,20,Gaming,"minecraft, lunailuka, lukailuna, luna, luka, luna minecraft, luka minecraft",7,https://i.ytimg.com/vi/SzCwWZFV0cQ/hqdefault.jpg,sr,sr,False,1075,PT17M55S,hd,False,True,False,False,58488,1506,361
-OIndke1VAo,BA,2026-02-11T03:35:36.853295+00:00,2026-02-05T14:54:36Z,GOLF,GOLF,Lacku - Topic,UCQXNx9PZM-wcvdd5aIfk0YA,10,Music,"Lacku, Cunami Flo, GOLF",3,https://i.ytimg.com/vi/-OIndke1VAo/hqdefault.jpg,sr,sr,False,170,PT2M50S,hd,False,True,False,False,66132,1440,0
zQ9Mp62FkQU,BA,2026-02-11T03:35:36.853302+00:00,2026-02-05T15:01:48Z,99 NOĆI U NAJTEŽOJ ŠUMI...,99 NOĆI U NAJTEŽOJ ŠUMI...,KingsOfFailsShow,UCvwDNr7ec4Qaa_25VYOMhxg,20,Gaming,"kingsoffailsshow, markokofs, kofs, 99 nights roblox, 99 nights, 99 dana, 99 dana kofs, marko kofs, 99 dana u sumi, novo 99 noci u sumi, 99 noci kofs, 99 noci marko kofs, 99 noci pets, 99 nights ljubimci, 99 noci medvjed, 99 nights necromancer, 99 night six kings, 99 nights halloween, 99 nights vampir, 99 noci vampir, 99 nights witch, 99 nights hurt deer, 99 noci jelen, 99 noci jelen je ozljedjen, 99 nights bat, 99 noci sismis, 99 nights christmas, 99 noci bozic",28,https://i.ytimg.com/vi/zQ9Mp62FkQU/hqdefault.jpg,hr,hr,False,1609,PT26M49S,hd,False,True,False,False,116220,3472,468
5gSnKSlgy7Q,BA,2026-02-11T03:35:36.853309+00:00,2026-01-23T12:00:07Z,VOYAGE - VARNICE (OFFICIAL VIDEO),VOYAGE - VARNICE (OFFICIAL VIDEO),IDJVideos.TV,UCcF7lkZqxzI2asePTbksVdA,10,Music,"idjvideos, pesme, pjesme, vojaz, vojaz varnice, varnice voyage, voyage varnice",7,https://i.ytimg.com/vi/5gSnKSlgy7Q/hqdefault.jpg,sr,sr,False,169,PT2M49S,hd,False,True,False,False,889866,16036,727
kYeFRpO077U,BA,2026-02-11T03:35:36.853316+00:00,2026-02-10T20:51:40Z,roblox best gameplay,roblox best gameplay,StanRP,UCHYA5HNaS5n4idxmP-at8nA,20,Gaming,"roblox, granny, free fire, live roblox, roblox shorts, shorts feed, 67, six seven, meme reset, singing brainrot song, great meme reset",11,https://i.ytimg.com/vi/kYeFRpO077U/hqdefault.jpg,en-US,en,False,19,PT19S,hd,False,True,False,False,760903,6247,6
Db7BSEvt__o,BA,2026-02-11T03:35:36.853324+00:00,2026-02-05T19:28:47Z,Valentino x Ana Kokic - Ne Boli Me To (Official Video) Album 2026,Valentino x Ana Kokic - Ne Boli Me To (Official Video) Album 2026,Valentino,UChNkOa2seSW_LyzbYakctYQ,22,People & Blogs,Valentino,1,https://i.ytimg.com/vi/Db7BSEvt__o/hqdefault.jpg,sr,hr,False,203,PT3M23S,hd,True,True,False,False,276412,2832,67
jPdvm8ngKvI,BA,2026-02-11T03:35:36.853331+00:00,2026-02-09T14:01:39Z,KOPAM TUNEL U ZATVORU😂🥄,KOPAM TUNEL U ZATVORU😂🥄,Leptirica,UC5wFYwc0W2Y6U3DXZHw4Ncg,20,Gaming,"leptirica, roblox, zatvor, igrice, gaming, balkan",6,https://i.ytimg.com/vi/jPdvm8ngKvI/hqdefault.jpg,hr,sh,False,1270,PT21M10S,hd,False,True,False,False,31948,1549,82
E-KvNQWSLQI,BA,2026-02-11T03:35:36.853338+00:00,2026-01-30T14:00:17Z,PEDJA JOVANOVIC - ESPRESSO SA ŠLAGOM (OFFICIAL VIDEO 2026),PEDJA JOVANOVIC - ESPRESSO SA ŠLAGOM (OFFICIAL VIDEO 2026),Pedja Jovanovic,UCB2yA09zrMOyvJbOMDe9CHQ,10,Music,"pedja jovanovic, novo, 2025, nove pesme, nova pesma, blizanac, blizanci, peđa, jovanović, 2026, espreso, espresso, sa slagom",13,https://i.ytimg.com/vi/E-KvNQWSLQI/hqdefault.jpg,sr,sr,False,216,PT3M36S,hd,False,False,False,False,440674,2587,243
2WusTNLmBpE,BA,2026-02-11T03:35:36.853346+00:00,2026-02-10T15:52:31Z,I Became King of the Unstable SMP,I Became King of the Unstable SMP,Parrot,UCPLMPHT-d8GZOqL_AHJFdQQ,20,Gaming,"Minecraft, Minecraft SMP, SMP, Minecraft Server, LifeSteal SMP, School Minecraft Server, School SMP, School Parrot, Parrot, ParrotX2, Dream SMP, TommyInnit, LifeSteal, parrot lifesteal smp, Spoke, minecraft survival, minecraft hardcore, minecraft challenge, minecraft server, HermitCraft, MumboJumbo, Grian, why i broke 100+ bedrock, Here's Why I Made 12240 Minecraft Cakes, Minecraft Hunt, LifeSteal Season 3, 1 Heart Minecraft, LifeSteal Season 4, Why I Removed the World",29,https://i.ytimg.com/vi/2WusTNLmBpE/hqdefault.jpg,en,en,False,5764,PT1H36M4S,hd,False,True,False,False,2073445,187697,45351
eKq69G84HKg,BA,2026-02-11T03:35:36.853354+00:00,2026-02-08T13:00:06Z,RAMAZAN | Ahmed Alili (Official music video 2026),RAMAZAN | Ahmed Alili (Official music video 2026),Ahmed Alili,UCiUNaBRPP-DfVbuzXbsAKMw,10,Music,,0,https://i.ytimg.com/vi/eKq69G84HKg/hqdefault.jpg,hr,bs,False,238,PT3M58S,hd,False,True,False,False,16828,660,47
wxnGbnO_hn4,BA,2026-02-11T03:35:36.853361+00:00,2026-02-08T15:07:00Z,POSTAO SAM PREJAK U Escape Tsunami!,POSTAO SAM PREJAK U Escape Tsunami!,Blox KC,UCnWKRMyAsoUTYS7DD5dvMWg,20,Gaming,"markokc, roblox, kc, brainrots, Tsunami, Escape Tsunami, Escape Tsunami to save Brainrots, blox kc, lucky blocks, Roblox Survival, survival, Roblox Gameplay, Roblox Funny Moments, Kako preziveti tsunami roblox, markokc roblox, blox kc roblox, LUCKY BLOCK, BRAINROTA, farma, kc roblox farma, brainrot, brainrot farma, farm a brainrot, farm a brainrot kc",24,https://i.ytimg.com/vi/wxnGbnO_hn4/hqdefault.jpg,sr,sr,False,1083,PT18M3S,hd,False,True,False,False,48377,979,97
rRrpf5cj-Fk,BA,2026-02-11T03:35:36.853369+00:00,2026-02-02T10:59:20Z,Zejna - Jugoslavija | Pesma za Evroviziju 2026.,Zejna - Jugoslavija | Pesma za Evroviziju 2026.,RTS Pesma Evrovizije - Zvanični kanal,UC38DtsndJajrtKmveBwjnTg,10,Music,"pesma, evrovizija, eurosong, takmicenje, pevac, pevaci, srbija, show, rts, pesma za evroviziju, nastup uživo, uživo, esc, pze, PZE, pze 26, 2026, pze 2026, PZE 2026, LAVINA, Lores, Đurđica, Avgust, Zona, MANIVI, Zejna, Milica Burazer, Aleksandar, Makao, GEMINNI, Kosmos Trip, YANX, Bella, Harem Girls x Ivana, Eegor, LU - KA, MIRNA, Sanja Aleksić, Ana Mašulović, Iva Grujin, Aleksandra Sekulić, Brat Pelin, Jack Lupino, zejna, Jugoslavija, jugoslavija, Zejna Jugoslavija, Jugoslavija Zejna, zejna jugoslavija",49,https://i.ytimg.com/vi/rRrpf5cj-Fk/hqdefault.jpg,sr,sr,False,178,PT2M58S,hd,False,True,False,False,257808,5758,1957
VHqSUCDLgXM,BA,2026-02-11T03:35:36.853377+00:00,2026-02-10T13:08:18Z,DAN 71 IGRANJA NA FREE TO PLAY ACCOUNTU!,DAN 71 IGRANJA NA FREE TO PLAY ACCOUNTU!,Markić,UC81q0ZRq5Js88ierdlCGzGQ,20,Gaming,"markokc, novi update, updejt, brawl stars, otvaranje kutija, box star, mega box, mega, box, brutalno, minecraft, preživljavanje 100 dana, preživljavanje, 100 dana, 24h, 24 sata, 24, stumlbe guys, jakovkc, jakov, mladi, mladji, mladi brat, mladji brat, brawl talk, markić, markic",27,https://i.ytimg.com/vi/VHqSUCDLgXM/hqdefault.jpg,hr,,False,1256,PT20M56S,hd,False,True,False,False,18540,744,57
Jy98FdvPPsw,BA,2026-02-11T03:35:36.853386+00:00,2026-01-13T11:00:04Z,Barbara Bobak - Prelazim na žene | Official Video 2026,Barbara Bobak - Prelazim na žene | Official Video 2026,Barbara Bobak,UCGD6XTBh8bNLlzebcaxmzWA,10,Music,"Balkan pop folk, Barbara Bobak, Barbara Bobak 2026, Barbara Bobak Prelazim na žene, Barbara Bobak YouTube, Barbara Bobak fanovi, Barbara Bobak nove pesme, Barbara Bobak official, Barbara Bobak spot, Prelazim na žene, balkanska muzika 2026, hitovi 2026, music video pr",13,https://i.ytimg.com/vi/Jy98FdvPPsw/hqdefault.jpg,sr,sr,False,177,PT2M57S,hd,False,True,False,False,1257018,5414,340
