video_id,country,fetched_at,published_at,title,localized_title,channel_title,channel_id,category_id,category_name,tags,tag_count,thumbnail,default_language,audio_language,is_live,duration,duration_raw,definition,caption_available,licensed_content,embeddable,made_for_kids,views,likes,comments
YyepU5ztLf4,IN,2025-12-12 02:28:17.317218+00:00,2025-12-09 09:33:03+00:00,"Shararat | Dhurandhar | Ranveer, Aditya Dhar, Shashwat, Jasmine, Madhubanti, Ayesha, Krystle","Shararat | Dhurandhar | Ranveer, Aditya Dhar, Shashwat, Jasmine, Madhubanti, Ayesha, Krystle",Saregama Music,UC_A7K2dXFsTMAciGmnNxy-Q,10,Music,"dhurandhar song, dhurandhar song balochi, dhurandhar song balochi dance, dhurandhar songs all, tenu shararat sikhwa, Shararat, Shararat Dhurandhar, dhurandhar songs all video song, dhurandhar song shararat, dhurandhar song shararat video, dhurandhar song ayesha khan, dhurandhar song akshay khanna, Ranveer Singh, Madhubanti Bagchi, Jasmine Sandlas, Aaj ki raat, Shashwat Sachdev, shararat dhurandhar, shararat dhurandhar video song, Party songs, Dance songs, Sharaarat",22,https://i.ytimg.com/vi/YyepU5ztLf4/hqdefault.jpg,en,hi,False,229,PT3M49S,hd,False,True,False,False,13934209,180872,3964
MQqOEpzePqg,IN,2025-12-12 02:28:17.317257+00:00,2025-12-10 14:48:52+00:00,BHA BHA BA TRAILER | Dilieep | Mohanlal | Gokulam Gopalan | Vineeth | Dhyan | Dhananjay Shankar,BHA BHA BA TRAILER | Dilieep | Mohanlal | Gokulam Gopalan | Vineeth | Dhyan | Dhananjay Shankar,Sree Gokulam Movies,UC7rP8B90HTEXxQ6ApRVDyVg,1,Film & Animation,"Gokulam Movies, Gokulam Gopalan, dileep, bha bha ba movie, vineeth sreenivasan, dhyan sreenivasan, mohanlal, sree gokulam movies, dileep movie, bhayam bakhthi bahumanam, Bha bha ba character poster, BHA BHA BA Teaser, Bha bha ba lalettan, dileep action, vineeth sreenivasan movie, Dhyan sreenivasan movie, dileep comedy, comedy malayalam movie, malayalam movies, Malayalam teaser, lalettan cameo, Dhananjay shankar, sandy master, lalettan, bha bha ba trailer",25,https://i.ytimg.com/vi/MQqOEpzePqg/hqdefault.jpg,en,ml,False,110,PT1M50S,hd,True,True,False,False,3525263,162756,16515
5Oh0EY4LJQA,IN,2025-12-12 02:28:17.317270+00:00,2025-12-11 17:23:19+00:00,4TR Winter Premier League 2025 : Grand Finals Decider Day | Let The Frost Forge The Champion ! #godl,4TR Winter Premier League 2025 : Grand Finals Decider Day | Let The Frost Forge The Champion ! #godl,4TR,UCEwXCqGi2bbuLDIlCKYxNNg,20,Gaming,,0,https://i.ytimg.com/vi/5Oh0EY4LJQA/hqdefault.jpg,en,hi,False,20659,PT5H44M19S,hd,False,False,False,False,501187,12601,91
HV6RakCs2dc,IN,2025-12-12 02:28:17.317280+00:00,2025-12-11 01:11:00+00:00,Rehman Dakait Entry Song - Full Video Song | Fa9la | Dhurandhar | Balochi Song Dhurandhar,Rehman Dakait Entry Song - Full Video Song | Fa9la | Dhurandhar | Balochi Song Dhurandhar,Rapstar AK,UC1aYroU_a0a9W6IOAKkoACw,10,Music,"akshaye khanna, akshaye khanna entry song, fa9la, flipperachi, dhurandhar song, balochi song, dhurandhar, akshaye khanna viral song",8,https://i.ytimg.com/vi/HV6RakCs2dc/hqdefault.jpg,en,hi,False,198,PT3M18S,hd,False,False,False,False,703541,8053,166
JTtY03JTEfo,IN,2025-12-12 02:28:17.317288+00:00,2025-12-11 04:08:01+00:00,BHA BHA BA | TRAILER Reaction | Dilieep | Mohanlal | Malayalam,BHA BHA BA | TRAILER Reaction | Dilieep | Mohanlal | Malayalam,LifeofShazzam,UCNhaliLwhGH9wX3pe9bFTbA,24,Entertainment,,0,https://i.ytimg.com/vi/JTtY03JTEfo/hqdefault.jpg,en,ml,False,399,PT6M39S,hd,False,True,False,False,513226,36865,1456
QAX5hQh9wmA,IN,2025-12-12 02:28:17.317295+00:00,2025-12-11 08:06:00+00:00,Long Slide Game with Cow Elephant Gorilla Hippopotamus Tiger 3d Animal Game Funny 3d Animals,Long Slide Game with Cow Elephant Gorilla Hippopotamus Tiger 3d Animal Game Funny 3d Animals,kuly luly,UCosfsZbv8iv8Tok4UfbqGaQ,1,Film & Animation,,0,https://i.ytimg.com/vi/QAX5hQh9wmA/hqdefault.jpg,en,en,False,474,PT7M54S,hd,False,False,False,False,1483895,116803,3277
-91RyV_IwC8,IN,2025-12-12 02:28:17.317303+00:00,2025-12-11 04:30:01+00:00,#Khesari Lal Yadav | ए राजा धईले रह #Video| Ft. #Neha Raj | Ae Raja Dhaile Raha | VYRL Bhojpuri,#Khesari Lal Yadav | ए राजा धईले रह #Video| Ft. #Neha Raj | Ae Raja Dhaile Raha | VYRL Bhojpuri,VYRL Bhojpuri,UC3cLf6pTB23nDry7awtxSZQ,10,Music,"Khesari Lal Yadav new song, Ae Raja Dhaile Raha song, ए राजा धईले रह भोजपुरी गीत, Neha Raj Bhojpuri song, Khesari Lal Yadav Neha Raj new video, Bhojpuri gaana 2025, Khesari Lal Yadav video song, Ae Raja Dhaile Raha full video, trending Bhojpuri songs, latest Bhojpuri song 2025, Bhojpuri viral song, Bhojpuri hit romantic song, Neha Raj new Bhojpuri track, Khesari Lal Yadav hit songs, Bhojpuri music video 2025, latest Khesari Bhojpuri gaana, Ae Raja Dhaile Raha",17,https://i.ytimg.com/vi/-91RyV_IwC8/hqdefault.jpg,hi,,False,240,PT4M,hd,False,True,False,False,575146,45992,11840
YqdAEdkHrwo,IN,2025-12-12 02:28:17.317311+00:00,2025-12-11 16:59:07+00:00,Supergirl | Official Teaser Trailer,Supergirl | Official Teaser Trailer,DC,UCiifkYAs_bq1pt_zbNAzYGg,24,Entertainment,"DC, DC Comics, DC Universe, DCU, Superman, Batman, Wonder Woman, The Flash, Green Lantern, James Gunn, The Joker, super heroes, super hero, super villain, full episodes, new episodes, movie, watch online, watch free",19,https://i.ytimg.com/vi/YqdAEdkHrwo/hqdefault.jpg,en,en,False,123,PT2M3S,hd,False,True,False,False,4824046,264202,14519
dgrSdn2qOxI,IN,2025-12-12 02:28:17.317319+00:00,2025-12-10 09:17:40+00:00,CARRY is GONE FOREVER in Minecraft!🥲,CARRY is GONE FOREVER in Minecraft!🥲,Carry Depie,UClqifC6Nd7v-IfTqce4k62A,20,Gaming,"carry depie, minecraft",2,https://i.ytimg.com/vi/dgrSdn2qOxI/hqdefault.jpg,en,hi,False,808,PT13M28S,hd,False,True,False,False,1247029,15824,666
hXvGfWpkuqc,IN,2025-12-12 02:28:17.317327+00:00,2025-12-09 12:58:07+00:00,Dekhlenge Saala Song Promo | Ustaad Bhagat Singh | Pawan Kalyan | Harish Shankar | Devi Sri Prasad,Dekhlenge Saala Song Promo | Ustaad Bhagat Singh | Pawan Kalyan | Harish Shankar | Devi Sri Prasad,Sony Music South,UCn4rEMqKtwBQ6-oEwbd4PcA,10,Music,"Sony Music South, Sony Music, Latest Song, Tamil song, Tamil Latest Song, Latest songs in Tamil4, Songs in Tamil, Latest Tamil Movies, Tamil Movie Songs, Latest Video Songs Tamil, latest Tamil Love Songs, Latest Tamil Hit Songs, Songs in Telugu4, Telugu Movie Songs, Video Songs Telugu, new Telugu Songs",16,https://i.ytimg.com/vi/hXvGfWpkuqc/hqdefault.jpg,en-GB,en-IN,False,26,PT26S,hd,False,True,False,False,945947,88546,1994
8U9t5xMElN0,IN,2025-12-12 02:28:17.317334+00:00,2025-12-10 14:56:12+00:00,The Return of Padayappa – Official Trailer | Rajinikanth 75th Birthday Special | K. S. Ravikumar,The Return of Padayappa – Official Trailer | Rajinikanth 75th Birthday Special | K. S. Ravikumar,Thenappan P - Shree Raajalakshmi Films,UCz4QOFDtw6LefH6UbQjJpxg,1,Film & Animation,"Padayappa, Padayappa Re Release, Rajinikanth, Superstar Rajinikanth, Thalaivar 75, Rajinikanth Birthday, 12 Dec 2025, Padayappa Returns, 50 Years of Rajinism, Tamil Cinema, Kollywood, K S Ravikumar, Ramya Krishnan, Neelambari, A R Rahman, Rajinikanth Fans, Thalaivar, Padayappa Trailer, Padayappa Scenes, Padayappa Movie, ramya krishnan, soundarya, senthil, rajinikanth, superstar, super star rajinikanth blockbuster movie, tamil movie, trailer, rerelease trailer, thalaivar, thalaivar fans",31,https://i.ytimg.com/vi/8U9t5xMElN0/hqdefault.jpg,en,en-IN,False,170,PT2M50S,hd,False,True,False,False,768128,28318,1205
yJZ26fAsnnk,IN,2025-12-12 02:28:17.317342+00:00,2025-12-11 12:47:48+00:00,RISING CHAMPIONSHIP SEASON 1 - DECIDER DAY 🏆 @JONATHANGAMINGYT @admino_gaming19 @SouLNakuL,RISING CHAMPIONSHIP SEASON 1 - DECIDER DAY 🏆 @JONATHANGAMINGYT @admino_gaming19 @SouLNakuL,Rising Esports,UChw7cEa_S0xaGwMEsN1vOlg,20,Gaming,,0,https://i.ytimg.com/vi/yJZ26fAsnnk/hqdefault.jpg,en,hi,False,19116,PT5H18M36S,hd,False,True,False,False,801183,19608,92
9fKQJcbd-jY,IN,2025-12-12 02:28:17.317349+00:00,2025-12-11 14:30:06+00:00,Anuv Jain - INAAM (Official Music Video),Anuv Jain - INAAM (Official Music Video),Anuv Jain,UCafUh796DToiY2U3s7X_WTw,10,Music,,0,https://i.ytimg.com/vi/9fKQJcbd-jY/hqdefault.jpg,en,en,False,271,PT4M31S,hd,False,True,False,False,359461,50651,4410
z7-tu8hVrnM,IN,2025-12-12 02:28:17.317356+00:00,2025-12-10 15:43:34+00:00,BHA BHA BA Trailer Opinion | Dilieep | Mohanlal ,BHA BHA BA Trailer Opinion | Dilieep | Mohanlal ,Secret Agent,UCnYvT1git-T2jcn_wT1utjQ,22,People & Blogs,,0,https://i.ytimg.com/vi/z7-tu8hVrnM/hqdefault.jpg,en,ml,False,320,PT5M20S,hd,False,True,False,False,259267,8618,601
YRcVH1W4Jjo,IN,2025-12-12 02:28:17.317363+00:00,2025-12-10 12:36:01+00:00,GOD vs HACKER One Chunk Batlte in Minecraft..,GOD vs HACKER One Chunk Batlte in Minecraft..,Karry Kraft,UCW3Ms3ZxVaZUniP-HifWCDg,20,Gaming,"carry depie, minecraft",2,https://i.ytimg.com/vi/YRcVH1W4Jjo/hqdefault.jpg,en,en-IN,False,610,PT10M10S,hd,False,True,False,False,559188,7148,222
KnAFrgh_2RE,IN,2025-12-12 02:28:17.317370+00:00,2025-12-11 00:30:06+00:00,मार्गशीर्ष गुरुवार | महालक्ष्मी आली माझ्या घराला |श्री महालक्ष्मीदेवी गाणी व आरती | Mahalaxmi Songs,मार्गशीर्ष गुरुवार | महालक्ष्मी आली माझ्या घराला |श्री महालक्ष्मीदेवी गाणी व आरती | Mahalaxmi Songs,Wings Marathi,UCQFblMlxC7UFwq2zqNT7NKA,10,Music,"मार्गशीर्ष गुरुवार, महालक्ष्मी आली माझ्या घराला, श्री महालक्ष्मीदेवी गाणी व आरती, Mahalaxmi Songs, mahalaxmi gani, mahalaxmi bhajan, mahalaxmi aarti, mahalaxmi bhaktigeete, mahalaxmi mantra, Marathi Devotional Songs, marathi bhaktigeete, marathi gani, marathi songs, नॉन स्टॉप महालक्ष्मी गाणी व आरती, Mahalakshmi Songs Aarti, Mahalaxmi Songs Marathi, सुपरहिट महालक्ष्मीची गीते, Devi Songs Marathi, Mahalaxmi Bhaktigeete, Laxmi Devi Songs, Jay Devi Jay Devi Jay Mahalaxmi, Laxmi",22,https://i.ytimg.com/vi/KnAFrgh_2RE/hqdefault.jpg,en,mr,False,1888,PT31M28S,hd,False,True,False,False,103021,359,18
ZnlObs8A5mI,IN,2025-12-12 02:28:17.317378+00:00,2025-12-10 15:50:59+00:00,Bha Bha Ba Trailer Reaction | Dileep Mohanlal Gokulam Vineeth Dhyan Sreenivasan Entertainment Kizhi,Bha Bha Ba Trailer Reaction | Dileep Mohanlal Gokulam Vineeth Dhyan Sreenivasan Entertainment Kizhi,Entertainment Kizhi,UCEBP12AdzxO2_UxFNKCe3ig,22,People & Blogs,,0,https://i.ytimg.com/vi/ZnlObs8A5mI/hqdefault.jpg,en,ml,False,608,PT10M8S,hd,False,True,False,False,158271,9036,1175
4Zqm5pmdvPc,IN,2025-12-12 02:28:17.317385+00:00,2025-12-11 13:00:16+00:00,Freeze Defenses with Frost Flake: Royal Champion’s New Equipment | Clash of Clans Animation,Freeze Defenses with Frost Flake: Royal Champion’s New Equipment | Clash of Clans Animation,Clash of Clans,UCD1Em4q90ZUK2R5HKesszJg,20,Gaming,"clash of clans, COC, Clash of Clans Gameplay, Clash of Clans Strategy, Clash of Clans Animation, Clash of Clans Commercial, Clash of Clans Attacks, Clash of Clans Town Hall, Hog Rider, PEKKA, Clan Wars, season challenges, clan war leagues, clash on, clan game, clan games, clash-a-rama, clasharama, frost flake, rc, royal champion, epic equipment, meltdown mayhem, medal event",24,https://i.ytimg.com/vi/4Zqm5pmdvPc/hqdefault.jpg,en,en,False,45,PT45S,hd,False,False,False,False,1018706,18657,563
Qhwafoo7Pnc,IN,2025-12-12 02:28:17.317392+00:00,2025-12-11 13:00:07+00:00,"Aawaara Angaara (Full Video): Tere Ishk Mein | Dhanush, Kriti | AR Rahman,Faheem|Aanand LR|Bhushan K","Aawaara Angaara (Full Video): Tere Ishk Mein | Dhanush, Kriti | AR Rahman,Faheem|Aanand LR|Bhushan K",T-Series,UCq-Fj5jknLsUf-MWSy4_brA,10,Music,"hindi songs 2025, hindi songs new, bollywood songs 2025, bollywood movies 2025, tseries, tseries songs, hindi songs, romantic hindi songs, aawaara angaara full song, awara angara song, tere ishq mein awara song, faheem abdullah songs, awara angara full song, tere ishq mein song, aawaara angaara full video song, tere ishq mein songs, awara angara faheem abdullah, tere ishk mein song, aawaara angaara faheem abdullah, awara angara full video song, tere ishq mein awara angara",21,https://i.ytimg.com/vi/Qhwafoo7Pnc/hqdefault.jpg,en,hi,False,313,PT5M13S,hd,False,True,False,False,227350,6873,288
jQk4iohgYBY,IN,2025-12-12 02:28:17.317400+00:00,2025-12-10 15:41:13+00:00,BHA BHA BA TRAILER Reaction by @UnniVlogs | Dilieep Mohanlal  Vineeth Dhyan Dhananjay Shankar,BHA BHA BA TRAILER Reaction by @UnniVlogs | Dilieep Mohanlal  Vineeth Dhyan Dhananjay Shankar,SilmaTalks,UCEEAX8zs4Pv_mBHHvW20RUQ,24,Entertainment,"unni vlogs, trailer reaction, unni vlogs trailer reaction, unni vlogs explanation, unni vlogs reaction, Gokulam Movies, Gokulam Gopalan, bha bha ba movie, vineeth sreenivasan, dhyan sreenivasan, mohanlal, dileep movie, bhayam bakhthi bahumanam, BHA BHA BA Teaser, Bha bha ba lalettan, dileep action, lalettan cameo, Dhananjay shankar, sandy master, bha bha ba trailer, bha bha ba trailer reaction, bha bha ba trailer reaction malayalam, bha bha ba trailer reaction unni vlogs",23,https://i.ytimg.com/vi/jQk4iohgYBY/hqdefault.jpg,en,ml,False,503,PT8M23S,hd,False,True,False,False,168910,5822,693
dEmRtlmjpUY,IN,2025-12-12 02:28:17.317407+00:00,2025-12-11 15:42:12+00:00,🔴 [HI] BR Main Event - Day 1 | FFMAI 2025 | Group B & C,🔴 [HI] BR Main Event - Day 1 | FFMAI 2025 | Group B & C,Free Fire MAX Esports India Official,UCuYSf8EuD8cqeEFITmvHXYQ,20,Gaming,,0,https://i.ytimg.com/vi/dEmRtlmjpUY/hqdefault.jpg,en,en-IN,False,13575,PT3H46M15S,hd,False,False,False,False,1204316,17884,471
FHCr2H7zXa8,IN,2025-12-12 02:28:17.317413+00:00,2025-12-10 01:15:01+00:00,#Video_Khesari Lal Yadav | भोजपुरी विडियो गाना | पायल | Payal | Bhojpuri Video Song 2025,#Video_Khesari Lal Yadav | भोजपुरी विडियो गाना | पायल | Payal | Bhojpuri Video Song 2025,Agastya Music World,UCiCnIwiKGj1cXSlnJYaNMbA,22,People & Blogs,"Agastya Music World, Bhojpuri Song 2025, Payal, पायल, Shilpi Raj Ka Gana, Shilpi Raj Ke Gana, Shilpi Raj Song, Shilpi Raj, Bhojpuri Song, Karishma Kakkar, Khesari Lal Yadav, Khesari Lal Yadav ka gana, Khesari Lal Yadav ke gana, Khesari Lal Yadav song, Khesari Lal Yadav Video SOng, Khesari Lal Yadav new Song, Khesari Lal Yadav Ka Video Gana, Khesari Lal Yadav Gana, Karishma Kakkar ka gana, Karishma Kakkar ke gana, Karishma Kakkar song",21,https://i.ytimg.com/vi/FHCr2H7zXa8/hqdefault.jpg,hi,hi,False,1053,PT17M33S,hd,False,True,False,False,163351,951,18
OujknWpXP6k,IN,2025-12-12 02:28:17.317421+00:00,2025-12-11 12:30:44+00:00,Kombuseevi - Official Trailer | Shanmuga Pandiyan | Sarath Kumar | Ponram | Yuvan Shankar Raja,Kombuseevi - Official Trailer | Shanmuga Pandiyan | Sarath Kumar | Ponram | Yuvan Shankar Raja,Saregama Tamil,UCzee67JnEcuvjErRyWP3GpQ,1,Film & Animation,"Kombuseevi, Kombuseevi movie, Kombuseevi trailer, Kombuseevi teaser, Kombuseevi official teaser, Kombuseevi official trailer, Kombuseevi song, Kombuseevi promo, Sarath Kumar, Shanmuga Pandiyan Vijaykant, Tharnika, Yuvan Shankar Raja, Yuvan new song, Yuvan 2025 songs, YSR songs, Super Subbu, Vishnu Priya, Tamil new songs, Tamil movie songs, Tamil hits, Kollywood songs, Ponram, Star Cinemas, Thamizh Aadhavan, trending Tamil songs, Saregama Tamil",26,https://i.ytimg.com/vi/OujknWpXP6k/hqdefault.jpg,en,ta,False,127,PT2M7S,hd,True,True,False,False,2110759,7041,391
dMN7_GBSnio,IN,2025-12-12 02:28:17.317429+00:00,2025-12-09 14:53:08+00:00,I Exposed Minecraft’s Forbidden Myths That Mojang Tried to Hide...,I Exposed Minecraft’s Forbidden Myths That Mojang Tried to Hide...,ProBoiz 95,UCSncGB_s0tuWN-4l-58mmvQ,20,Gaming,"minecraft, minecraft mythbusters, minecraft secret myths, minecraft mojang, proboiz, proboiz 95",6,https://i.ytimg.com/vi/dMN7_GBSnio/hqdefault.jpg,en,en-IN,False,1457,PT24M17S,hd,False,True,False,False,1766133,52277,6337
Dr5CXlLQaPY,IN,2025-12-12 02:28:17.317436+00:00,2025-12-08 12:00:33+00:00,Gori Tera Gaon Bada Pyara | K J Yesudas | Chitchor | Lyrical Video | Old Hindi Song,Gori Tera Gaon Bada Pyara | K J Yesudas | Chitchor | Lyrical Video | Old Hindi Song,Graceful Melodies,UC17IEhHybawZ1s_9HkeD8Jw,10,Music,,0,https://i.ytimg.com/vi/Dr5CXlLQaPY/hqdefault.jpg,en,hi,False,324,PT5M24S,hd,False,True,False,False,95317,124,1
z-VGdaWmpk8,IN,2025-12-12 02:28:17.317443+00:00,2025-12-10 14:15:19+00:00,Akhanda 2 Grand Release Teaser | Nandamuri Balakrishna | Boyapati Srinu | Thaman S,Akhanda 2 Grand Release Teaser | Nandamuri Balakrishna | Boyapati Srinu | Thaman S,Mana Telugu Cult,UCExbnOFWJkh-6169EyIvYnA,22,People & Blogs,"Akhanda 2 Grand Release Teaser | Nandamuri Balakrishna | Boyapati Srinu | Thaman S, Akhanda 2 Grand Release Teaser, Akhanda 2, akhanda 2, nbk akhanda 2, akhanda 2 nbk, akhanda 2 bgm, akhanda 2 news, akhanda 2 roar, akhanda 2 movie, akhanda 2 songs, akhanda 2 music, akhanda 2 update, akhanda 2 teaser, akhanda 2 review, akhanda 2 telugu, akhanda 2 release date, akhanda 2 fdfs, akhanda 2 live, akhanda 2 new release date, akhanda 2 hindi, akhanda 2 release postponed",22,https://i.ytimg.com/vi/z-VGdaWmpk8/hqdefault.jpg,en,te,False,225,PT3M45S,hd,False,True,False,False,854708,12543,293
vLmCoyV88ZU,IN,2025-12-12 02:28:17.317451+00:00,2025-12-11 04:47:59+00:00,Choo Choo Charles 😈 Maine Charles Ka Ghar Dhoond Liya! | Hindi | Kumar Gaming #shortslive #live,Choo Choo Charles 😈 Maine Charles Ka Ghar Dhoond Liya! | Hindi | Kumar Gaming #shortslive #live,Kumar Gaming ,UC3KAE02WDbs_nTVtO0qYIcQ,20,Gaming,"horror game live hindi, choo choo charles story, live scary game, live stream games, epic horror gameplay, kumar gaming2002k, kumargaming, horror hindi games live, train monster game, Choo Choo Charles, Choo Choo Charles live, Choo Choo Charles Hindi, Choo Choo Charles gameplay, Kumar Gaming, horror live stream, Hindi horror game, scary game live, live horror stream, Choo Choo Charles monster, train horror game, Charles ka ghar, Charles horror game",22,https://i.ytimg.com/vi/vLmCoyV88ZU/hqdefault.jpg,en,hi-Latn,False,9123,PT2H32M3S,hd,False,True,False,False,503425,3774,9
_znWu2rGF0k,IN,2025-12-12 02:28:17.317459+00:00,2025-12-09 10:24:58+00:00,Nagan Si Lugai | नागन सी लुगाई | Official Video | Farmani Naaz | Tera Balam Chota | Hema |Naaz Music,Nagan Si Lugai | नागन सी लुगाई | Official Video | Farmani Naaz | Tera Balam Chota | Hema |Naaz Music,Naaz Top 1,UCWfV61ES960Chqw7DqqTmzw,10,Music,"Nagan Si Lugai, Nagan Si Lugai Official Video, Nagan Si Lugai Farmani Naaz, Tera Balam Chota, tu to nagan si lugai, Nagan si Lugai Dj Song, Dj song nagan si lugai, 2024 dj song, Haryanvi new song, Sapna Chaudhary song, Hema Chaudhary nagan si lugai, Dehati Song, Haryanvi song, Tranding song, Hit song haryanvi, Gullak fod ke, Nanhe nanhe ghungroo, Nagan, Official video, Nagan si lugai, Farmani Naaz, Farmani naaz new song, Rahul mulheda",23,https://i.ytimg.com/vi/_znWu2rGF0k/hqdefault.jpg,hi,hi,False,415,PT6M55S,hd,False,True,False,False,257312,593,10
AY9zAobTYBk,IN,2025-12-12 02:28:17.317466+00:00,2025-12-10 15:43:34+00:00,❗️wikkythug about ഭഭബ trailer review❗️,❗️wikkythug about ഭഭബ trailer review❗️,WIKKYTHUG,UCGKdUF6bkacZJz57wWSBNeg,24,Entertainment,,0,https://i.ytimg.com/vi/AY9zAobTYBk/hqdefault.jpg,en,ml,False,200,PT3M20S,hd,False,True,False,False,112348,6612,197
fTqf1-gO3WY,IN,2025-12-12 02:28:17.317472+00:00,2025-12-11 08:00:43+00:00,Long Slide Game With Cow Elephant Gorilla Hippopotamus Tiger - 3d Animal Game - Funny 3d Animals,Long Slide Game With Cow Elephant Gorilla Hippopotamus Tiger - 3d Animal Game - Funny 3d Animals,Animals 3D,UCkEHnffg6wmOSeOWJ3KFW6Q,24,Entertainment,"long slide, long slide game, funny 3d animals, animals 3d",4,https://i.ytimg.com/vi/fTqf1-gO3WY/hqdefault.jpg,en,en,False,334,PT5M34S,hd,False,True,False,False,600741,29339,1466
0mFTUOhvKEE,IN,2025-12-12 02:28:17.317479+00:00,2025-12-10 11:35:47+00:00,"Addham Mundhu | Bhartha Mahasayulaku Wignyapthi | Ravi Teja, Dimple Hayathi | Bheems Ceciroleo","Addham Mundhu | Bhartha Mahasayulaku Wignyapthi | Ravi Teja, Dimple Hayathi | Bheems Ceciroleo",Saregama Telugu,UC68nKdrLbLL0Vj7ilVkLmmg,10,Music,"Addham Mundhu, Addham Mundhu Song lyrical, Bhartha Mahasayulaku Wignyapthi Songs, Ravi Teja Addham Mundhu, Ravi Teja New Movie Songs, Bheems Ceciroleo Songs, Bheems Ceciroleo Addham Mundhu, Addham Mundhu lyrical Song, Telugu lyrical Song, Telugu Movie Songs, Telugu Film Songs, Telugu Audio Songs, Telugu Hits, Latest Telugu Songs, Ravi Teja Songs, Addham Mundhu Ravi Teja, Bhartha Mahasayulaku Wignyapthi lyrical, Telugu Song lyrical",18,https://i.ytimg.com/vi/0mFTUOhvKEE/hqdefault.jpg,en,te,False,236,PT3M56S,hd,False,True,False,False,2066479,16221,589
ZEiFcHGJYzA,IN,2025-12-12 02:28:17.317486+00:00,2025-12-07 06:30:41+00:00,Mark - Official Trailer | Kichcha Sudeepa | Vijay Kartikeyaa | Ajaneesh B Loknath | SJF,Mark - Official Trailer | Kichcha Sudeepa | Vijay Kartikeyaa | Ajaneesh B Loknath | SJF,Saregama Kannada,UCKFnbjBQDzzh002TMJcyuZA,1,Film & Animation,"Mark Kannada, Mark Kannada Trailer, Mark Official Trailer, Kichcha Sudeepa Mark, V Kartikeyaa Mark, Ajaneesh B Loknath Mark, Mark Movie Trailer, Kannada Trailer, Kannada Movie Trailer, Latest Kannada Trailers, Upcoming Kannada Movies, Sudeepa Kannada Movie, Sudeepa New Trailer, V Kartikeyaa Kannada Film, Kannada Action Trailer, Kannada Cinema, Kannada Films, Kannada Movie Updates, Kannada Video, Kannada Official Trailer, mark kicha sudeepa, mark kicha film",22,https://i.ytimg.com/vi/ZEiFcHGJYzA/hqdefault.jpg,en,kn,False,145,PT2M25S,hd,True,True,False,False,10413735,426580,21936
VlMO90EIO8Y,IN,2025-12-12 02:28:17.317494+00:00,2025-12-11 17:44:31+00:00,"🔴 INDIA vs SOUTH AFRICA Live Match Today Scores, 2nd T20I | IND Vs SA Cricket Live Match Today","🔴 INDIA vs SOUTH AFRICA Live Match Today Scores, 2nd T20I | IND Vs SA Cricket Live Match Today",UH Sports,UCsud1PApeldug5rZr_XijhA,17,Sports,,0,https://i.ytimg.com/vi/VlMO90EIO8Y/hqdefault.jpg,en,en-GB,False,13637,PT3H47M17S,hd,False,True,False,False,365718,2204,0
8CL7kkR9ovo,IN,2025-12-12 02:28:17.317501+00:00,2025-12-08 13:45:06+00:00,Dhanda Nyoliwala - Vomit On Paper (Official Music Video),Dhanda Nyoliwala - Vomit On Paper (Official Music Video),Dhanda Nyoliwala,UCdvPL04EnHCT3zaVFb3xydQ,10,Music,"dhanda nyoliwala, vomit on paper, vomit on paper dhanda nyoliwala, dhanda new song, dhanda nyoliwala new song, vomit on paper song, new haryanvi song, vomit on paper dhanda nyoliwala new song, dhanda new song 2025, kohram album new song, vomit on paper kohram album, dhanda nyoliwala vomit on paper, dhanda nyoliwala song on baba, you have to rise your voice bro dhanda song, jameer chhod loga ke iman bike hoye song, dhanda nyoliwala new song 2025, kohram album new track",17,https://i.ytimg.com/vi/8CL7kkR9ovo/hqdefault.jpg,en,en,False,244,PT4M4S,hd,True,False,False,False,1148499,122077,13303
invoV6ORfnQ,IN,2025-12-12 02:28:17.317508+00:00,2025-12-11 02:47:19+00:00,L'ഏട്ടന്റെയും അനിയന്റെയും തൂക്കിപറത്തൽ 😍💥 ! Bha Bha Ba Trailer Reaction Troll | Dileep Mohanlal | Pk,L'ഏട്ടന്റെയും അനിയന്റെയും തൂക്കിപറത്തൽ 😍💥 ! Bha Bha Ba Trailer Reaction Troll | Dileep Mohanlal | Pk,PK Trolls,UCw-har2mizQ8tB4rV7BN3RQ,24,Entertainment,"Bha Bha Ba, Bha Bha Ba Movie, Bha Bha Ba Movie Trailer, Dileep Bha Bha Ba Movie, Bha Bha Ba Movie Mohanlal, Mohanlal Dileep Bha Bha Ba Movie, Bha Bha Ba Movie Trailer Reaction, Bha Bha Ba Malayalam Movie, Bha Bha Ba Movie Dileep, Bha Bha Ba Movie Trailer Reaction Troll, Dileep Mohanlal Bha Bha Ba Movie Story, Ghilli Universe Bha Bha Ba Movie, Bha Bha Ba Movie Story, Bha Bha Ba Mohanlal Scene, Bha Bha Ba Official Trailer, Mohanlal Bha Bha Ba, Bha Bha Ba Malayalam, Mollywood",18,https://i.ytimg.com/vi/invoV6ORfnQ/hqdefault.jpg,ml,ml,False,297,PT4M57S,hd,False,True,False,False,49591,1903,117
YNeN1HQhk2k,IN,2025-12-12 02:28:17.317516+00:00,2025-12-11 04:44:25+00:00,Gaint Red Hulk Vs Franklin - INDIAN BIKES DRIVING 3D,Gaint Red Hulk Vs Franklin - INDIAN BIKES DRIVING 3D,Cript Play,UCtsql5AkLyDLO18gIxbhkKg,20,Gaming,"indian bike driving 3d plugin, indian bike driving haunted story, indian bike game, indian bike driving 3d new update, cript play, indian bike haunted, games, game, Gaint Red Hulk Vs Franklin - INDIAN BIKES DRIVING 3D, red hulk, gaint hulk, green hulk vs red hulk, fight with hulk",13,https://i.ytimg.com/vi/YNeN1HQhk2k/hqdefault.jpg,en,hi,False,579,PT9M39S,hd,False,True,False,False,139012,432,7
5RrfIJm5QOM,IN,2025-12-12 02:28:17.317523+00:00,2025-12-08 09:34:26+00:00,Rehman Dakait Entry Song | REMIX | Dhurandhar | DJ Dalal London | Akshaye Khanna | Gangster Music,Rehman Dakait Entry Song | REMIX | Dhurandhar | DJ Dalal London | Akshaye Khanna | Gangster Music,DJ Dalal London,UCkh0r6oh49c8QgWqX91CwvQ,10,Music,"dj dalal london, rehman dakait entry song, rehman dakait remix, rehman dakait dhurandhar, rehman dakait entry music, rehman dakait dj dalal london, rehman dakait gangster entry, rehman dakait trap remix, dhurandhar rehman dakait song, dhurandhar akshaye khanna, akshaye khanna gangster song, gangster entry music bollywood, bollywood gangster music, bollywood trap remix, car bass music hindi, dark gangster music, akshaye khanna entry remix, dhurandhar entry bgm, slap house, 2026",20,https://i.ytimg.com/vi/5RrfIJm5QOM/hqdefault.jpg,hi,en-GB,False,170,PT2M50S,hd,False,True,False,False,3278155,34249,684
