video_id,country,fetched_at,published_at,title,localized_title,channel_title,channel_id,category_id,category_name,tags,tag_count,thumbnail,default_language,audio_language,is_live,duration,duration_raw,definition,caption_available,licensed_content,embeddable,made_for_kids,views,likes,comments
kdYfmb4KFNQ,IN,2025-12-12 02:28:17.317530+00:00,2025-12-10 18:30:06+00:00,BHA BHA BA TRAILER REACTION 🥵 VISHAYAM TRAILER 😌 KILY POYEE #eaglegaming #dileep #mohanlal ,BHA BHA BA TRAILER REACTION 🥵 VISHAYAM TRAILER 😌 KILY POYEE #eaglegaming #dileep #mohanlal ,RP REALM,UCEqs4i2-oW4FwEzsNyi15Og,22,People & Blogs,,0,https://i.ytimg.com/vi/kdYfmb4KFNQ/hqdefault.jpg,en,ml,False,645,PT10M45S,hd,False,True,False,False,55668,2189,57
uUsHbJV523g,IN,2025-12-12 02:28:17.317537+00:00,2025-12-11 09:30:16+00:00,How I Obtained the GOD SPEAR in this Minecraft SMP,How I Obtained the GOD SPEAR in this Minecraft SMP,PSD2,UCYtE15DhBwiCSIMcrrelKGQ,20,Gaming,"how i got god spear in this minecraft smp, how i got the strongest spear in this minecraft smp, i obtained god scythe in this minecraft smp, how i obtained the strongest spear on this minecraft smp, how i obtained the god weapon spear in lapata smp, how i obtained the spear in minecraft, how i obtained a god spear in minecraft..., how i obtained every god weapon in this minecraft smp..!, how to get spear in this minecraft smp, this spear turned me into god in this minecraft smp",10,https://i.ytimg.com/vi/uUsHbJV523g/hqdefault.jpg,en,en,False,1687,PT28M7S,hd,False,True,False,False,350789,13472,842
DH2EVZPhiIM,IN,2025-12-12 02:28:17.317545+00:00,2025-12-07 05:37:01+00:00,"Sasirekha Lyrical | Mana Shankara Varaprasad Garu | Chiranjeevi, Nayanthara | Bheems | Anil Ravipudi","Sasirekha Lyrical | Mana Shankara Varaprasad Garu | Chiranjeevi, Nayanthara | Bheems | Anil Ravipudi",T-Series Telugu,UCnJjcn5FrgrOEp5_N45ZLEQ,10,Music,"Telugu New song, Telugu Songs, T-Series, Telugu Video Songs, Telugu Hit songs, telugu hit songs, telugu songs, Latest Telugu Songs 2025, sasirekha Lyrical Video, chiranjeevi sasirekha, nayanthara sasirekha, bheems music, anil ravipudi movie, sasirekha Video Song, chiranjeevi new movie Song, nayanthara new film, bheems mass song, chiranjeevi nayanthara, anil ravipudi entertainer, sasirekha Full Lyrical Video, telugu trending Video, mega star chiranjeevi, msg song, msg",24,https://i.ytimg.com/vi/DH2EVZPhiIM/hqdefault.jpg,en,te,False,229,PT3M49S,hd,False,True,False,False,12901598,210905,6008
9oA5SeASXDs,IN,2025-12-12 02:28:17.317552+00:00,2025-12-10 08:44:33+00:00,Stranger Things Season 5 Vol 2 Tamil Trailer Breakdown (தமிழ்),Stranger Things Season 5 Vol 2 Tamil Trailer Breakdown (தமிழ்),Mokka Commentry,UC3Y7OyuS9jNdZy3ZadrAbWQ,24,Entertainment,"tamil, தமிழ், mokka commentry, mokka, trending, youtube tamil, recommended, tamil creator",8,https://i.ytimg.com/vi/9oA5SeASXDs/hqdefault.jpg,en,en,False,701,PT11M41S,hd,False,True,False,False,93534,6274,290
hCmlC5YTUQk,IN,2025-12-12 02:28:17.317560+00:00,2025-12-10 10:01:14+00:00,الرجل العنكبوت انقاذ باتمان Spider-Man Rescue batman vs iron man vs venom funny Game GTA 5 superhero,الرجل العنكبوت انقاذ باتمان Spider-Man Rescue batman vs iron man vs venom funny Game GTA 5 superhero,RAIZER,UCRaZHgZDqy0pzKnZze1EcIA,20,Gaming,,0,https://i.ytimg.com/vi/hCmlC5YTUQk/hqdefault.jpg,ar,ar,False,1318,PT21M58S,hd,False,True,False,False,3932935,125605,1420
P4UnrmPFPA4,IN,2025-12-12 02:28:17.317567+00:00,2025-12-11 12:49:41+00:00,"Naal Nachna (From ""Dhurandhar"")","Naal Nachna (From ""Dhurandhar"")",Shashwat Sachdev - Topic,UCtIiZrzDsXk_rWeynT1ho4g,10,Music,"Shashwat Sachdev, Afsana Khan, Reble, Irshad Kamil, Naal Nachna (From ""Dhurandhar"")",5,https://i.ytimg.com/vi/P4UnrmPFPA4/hqdefault.jpg,en,pa,False,156,PT2M36S,hd,False,True,False,False,112240,3424,152
vOEKgXxVOAk,IN,2025-12-12 02:28:17.317574+00:00,2025-12-10 14:30:13+00:00,3 Roses S2 Trailer | Eesha Rebba | Rashi Singh | Kushitha | Maruthi | SKN |Premieres On Dec 13th Aha,3 Roses S2 Trailer | Eesha Rebba | Rashi Singh | Kushitha | Maruthi | SKN |Premieres On Dec 13th Aha,aha videoIN,UCmO-jDLU-KUcweCzktuDsbg,24,Entertainment,,0,https://i.ytimg.com/vi/vOEKgXxVOAk/hqdefault.jpg,en-IN,te,False,158,PT2M38S,hd,False,True,False,False,957215,2607,35
MmLLvE0P078,IN,2025-12-12 02:28:17.317585+00:00,2025-12-11 04:00:19+00:00,Franklin Trying To Survive an Alien Invasion in Los Santos GTA 5 | SHINCHAN and CHOP,Franklin Trying To Survive an Alien Invasion in Los Santos GTA 5 | SHINCHAN and CHOP,HAMID-T GAMING,UCD2DXey1TK7rev4VGOBvT_g,20,Gaming,"funny games, oggy noob pro hacker, noob pro hacker game, funny gameplay hindi, games in hindi, funny mobile games, shinchan and chop, chop shinchan franklin, shinchan gta 5, shin chan gta 5 in hindi, shinchan in hindi, gta v shinchan, shin chan cartoon gta 5, shinchan roblox, chop roblox, shinchan and franklin, animal revolt battle simulator godzilla, arbs hindi, gta 5 mods, gta 5 hindi, hamid-t gaming, hamid-t gta 5, hamid-t shinchan, hamidt, hamiti, hamid gaming, amaan-t",27,https://i.ytimg.com/vi/MmLLvE0P078/hqdefault.jpg,en,zxx,False,2486,PT41M26S,hd,False,True,False,False,343858,5240,169
jDKYhbZ5VwM,IN,2025-12-12 02:28:17.317593+00:00,2025-12-11 01:30:54+00:00,Rangdariya Pagariya | Samar Singh New Song | Shilpi Raj | New Bhojpuri Song | New Bhojpuri Gana,Rangdariya Pagariya | Samar Singh New Song | Shilpi Raj | New Bhojpuri Song | New Bhojpuri Gana,Saregama Hum Bhojpuri,UC0J8BQahplvTY6LjlnLf_NQ,10,Music,"samar singh, shilpi raj, Rangdariya Pagariya, samar singh new song, samar singh ka gana, samar singh song, samar singh ka bhojpuri gana, samar singh ka gana bhojpuri, samar singh bhojpuri gana, samar new song, samar new song 2025, samar hot romance song, samar singh video, shilpi raj new song, shilpi raj ke gana, shilpi raj new song 2025, bhojpuri songs, new bhojpuri songs, tredning bhojpuri songs, bhojpuri gaane, bhojpuri gana, bhojpuri new song, naya gana bhojpuri",23,https://i.ytimg.com/vi/jDKYhbZ5VwM/hqdefault.jpg,hi,bh,False,242,PT4M2S,hd,False,True,False,False,340925,2998,146
wmN-oqDMnrE,IN,2025-12-12 02:28:17.317599+00:00,2025-12-08 06:56:07+00:00,Landlord the Ruler Teaser | VIjaya Kumar | RAJ B SHETTY | B Ajaneesh Loknath | Jadeshaa K Hampi,Landlord the Ruler Teaser | VIjaya Kumar | RAJ B SHETTY | B Ajaneesh Loknath | Jadeshaa K Hampi,Anand Audio,UCLtCejNl8eAg4PO_9lf2TIg,24,Entertainment,"landlord vijay kumar, landlord kannada movie, rachita ram, landlord, duniya vijay landlord, Rachita Ram Birthday Glimpse, Land Lord Official Teaser, Land Lord Kannada Movie Teaser, teaser, kannada, Landlord, duniya vijay, landlord movie, rachita ram movies, Vijay Kumar land lord, land lord, new teaser kannada, landlord teaser, raj b shetty, Landlord the Ruler Teaser, The ruler, landlord trailer",22,https://i.ytimg.com/vi/wmN-oqDMnrE/hqdefault.jpg,en,kn,False,87,PT1M27S,hd,True,True,False,False,635715,22944,522
LCV6a5RxrMQ,IN,2025-12-12 02:28:17.317607+00:00,2025-12-10 11:32:28+00:00,Minecraft But I Can't Touch Any Color,Minecraft But I Can't Touch Any Color,AdiSpot,UCxm-rmArnUkNc-Lpf5s6X8g,20,Gaming,"Adispot, Adi-Spot, adispot, adispoot, minecrft funny video, minecraft trolling, minecraft brother troll video, minecraft villager video, Minecraft But I Can't Touch Any Color",9,https://i.ytimg.com/vi/LCV6a5RxrMQ/hqdefault.jpg,hi,hi,False,1153,PT19M13S,hd,True,True,False,False,397776,5166,153
5wJzmkr6wWo,IN,2025-12-12 02:28:17.317614+00:00,2025-12-11 02:30:07+00:00,ವೈ ವೈ ವೈಯಲೇನ ಒಮ್ಯಾರ | Vai Vai Vaiyalen Omyar | Sudeep Helavar | New Trendring Janapad Song | ,ವೈ ವೈ ವೈಯಲೇನ ಒಮ್ಯಾರ | Vai Vai Vaiyalen Omyar | Sudeep Helavar | New Trendring Janapad Song | ,Sudeep Helavar Music,UCljUNwSoEQLHZIUyDnevtvQ,10,Music,,0,https://i.ytimg.com/vi/5wJzmkr6wWo/hqdefault.jpg,kn,und,False,217,PT3M37S,hd,False,True,False,False,81641,5329,63
lLWTiFZqqXg,IN,2025-12-12 02:28:17.317621+00:00,2025-12-08 08:34:00+00:00,"One Two Cha Cha Chaa Teaser|Ashutosh, Lalit, Anantvijay, Harsh, Nyrraa, Abhimanyu|In Cinemas 16Jan26","One Two Cha Cha Chaa Teaser|Ashutosh, Lalit, Anantvijay, Harsh, Nyrraa, Abhimanyu|In Cinemas 16Jan26",Divo Music Hindi,UCUom-mQVeYZiaxYq6uWhqZw,10,Music,"divo music, divo music label, divo music hindi, hindi video songs, hindi audio songs, latest hindi video songs, latest hindi audio songs, trending hindi video songs, divo hindi songs, hindi music, hindi songs video jukebox, hindi audio songs jukebox",12,https://i.ytimg.com/vi/lLWTiFZqqXg/hqdefault.jpg,en-IN,hi,False,101,PT1M41S,hd,False,True,False,False,2154897,36632,4312
