video_id,country,fetched_at,published_at,title,localized_title,channel_title,channel_id,category_id,category_name,tags,tag_count,thumbnail,default_language,audio_language,is_live,duration,duration_raw,definition,caption_available,licensed_content,embeddable,made_for_kids,views,likes,comments
5xbG4FluCe8,MA,2026-05-01T04:35:49.111721+00:00,2026-04-30T20:11:53Z,اقوى حض فالعالم 🤯🔥حرقت احداث فري فاير وانا بطائرة ✈️اول واحد في العالم🌏,اقوى حض فالعالم 🤯🔥حرقت احداث فري فاير وانا بطائرة ✈️اول واحد في العالم🌏,Chadidi Gamer,UCympR8sfJY9biYG0TOWwlxw,20,Gaming,"فري فاير, تحدي فري فاير, تهكير فري فاير, هكر فري فاير, بيبو فري فاير, فري فاير مهكره, فري فاير المغرب, فري فاير علي عمر, فري فاير الجزائر, فري فاير التحديث الجديد, لقطات فري فاير, اقوى هيدشوت فري فاير, فري فاير ضحك, فري فاير لايت, عبود فري فاير, ازاي اجيب هيدشوت في فري فاير, صحراوي فري فاير, فري فاير احتراف, جزائري فري فاير, اوف منك فري فاير, تحدي جديد فري فاير, فري فاير كلاش سكواد, فاير, شحن فري فاير, فري, فري فاير 2022, فري فاير 2023, فري فاير ماكس",28,https://i.ytimg.com/vi/5xbG4FluCe8/hqdefault.jpg,ar,ar,False,678,PT11M18S,hd,False,True,False,False,14976,1886,102
8ywHrt--tyU,MA,2026-05-01T04:35:49.111729+00:00,2026-04-23T05:00:17Z,Izithunzi (Shadows) Amapiano,Izithunzi (Shadows) Amapiano,Sound Africa Records,UCs03l56Tic2vH4qNj0DI2ZA,10,Music,"amapiano, let me be, Ngiyeke, Izithunzi (Shadows) Amapiano, Izithunzi, let me be tiktok version, let me be afro version, let me be afro house, trending amapiano songs, let me be amapiano tiktok song, trending amapiano, s.a amapiano, izwi Lasendlini",13,https://i.ytimg.com/vi/8ywHrt--tyU/hqdefault.jpg,en,en,False,219,PT3M39S,hd,False,True,False,False,603747,5954,116
KoEoUpAU_q4,MA,2026-05-01T04:35:49.111736+00:00,2026-04-30T07:00:13Z,البحث عن اعظم من لمس كرة القدم🇵🇹🐐,البحث عن اعظم من لمس كرة القدم🇵🇹🐐,HikaSIU,UC9de4K00-WJx6pL90iDkOTw,20,Gaming,"hika, فيفا موبايل, fc mobile, اف سي موبايل, تفجير بكدجات فيفا 26, فيفا موبايل 26, fc mobile 26, fc موبايل 26, شحن للمتابعين, hikasiu, هيكا, عبدو 2xd, abdo2xd, abdo2xd fc mobile, abo adel tv, أبو عادل فيفا, هيكا فيفا, TOTS FC MOBILE, TOTS 26, توتس فيفا موبايل, TOTS فيفا موبايل, TOTS إف سي موبايل, توتس إف سي موبايل, فريق موسم فيفا موبايل, توتس كريستيانو رونالدو, توتس رونالدو, توتس رونالدو فيفا موبايل, tots ronaldo, tots ronaldo fc mobile, رونالدو 124, توتس رونالدو 124",31,https://i.ytimg.com/vi/KoEoUpAU_q4/hqdefault.jpg,ar,ar,False,1270,PT21M10S,hd,False,True,False,False,166898,23902,929
RIJ8Qt-oVJA,MA,2026-05-01T04:35:49.111745+00:00,2026-04-25T14:45:06Z,Cheba Souad x Hichem Smati - Twahachtek Grave (2026) واك نتا مون بيبي ,Cheba Souad x Hichem Smati - Twahachtek Grave (2026) واك نتا مون بيبي ,Hichem Smati,UCjJ7x93rfGYz7ZA7Ro9bJuw,10,Music,"شابة سعاد, هشام سماتي, Wak nta mon bb, twahachtek grave",4,https://i.ytimg.com/vi/RIJ8Qt-oVJA/hqdefault.jpg,fr,ar,False,207,PT3M27S,hd,False,True,False,False,4227400,51973,3428
vpTH46T1Nng,MA,2026-05-01T04:35:49.111753+00:00,2026-04-30T16:00:14Z,فتاة ستريمر مشهورة تتصل بي للإنتقام 💀🔥,فتاة ستريمر مشهورة تتصل بي للإنتقام 💀🔥,Somenzo,UCo4TnT-UXnlTMNvt9H3Z5JQ,20,Gaming,"صحراوي, الصحراوي, صحراوي فري فاير, somenzo, white, الفتاة هكر, مقلب نوب, فتاة ستريمر مشهورة, انتقام من فتاة, ستريم سنايب على فتاة, ستريم سنايب, مقلب فتاة",12,https://i.ytimg.com/vi/vpTH46T1Nng/hqdefault.jpg,en,en,False,634,PT10M34S,hd,False,True,False,False,18513,2357,246
lr1gApNmFog,MA,2026-05-01T04:35:49.111761+00:00,2026-04-23T10:01:25Z,Billie Jean,Billie Jean,Michael Jackson - Topic,UCoIOOL7QKuBhQHVKL8y7BEQ,10,Music,"Michael Jackson, マイケルジャクソン, 麥可傑克森, Michael: Songs From The Motion Picture, Billie Jean, ビリー・ジーン, ビリージーン",7,https://i.ytimg.com/vi/lr1gApNmFog/hqdefault.jpg,en,en,False,295,PT4M55S,hd,False,True,False,False,3100163,90869,2332
xzXC2vD9nmE,MA,2026-05-01T04:35:49.111769+00:00,2026-04-30T10:45:05Z,جربت حياة البرين روت في ماب السرقة الجديد 🔥😳 (صرت 67) !!,جربت حياة البرين روت في ماب السرقة الجديد 🔥😳 (صرت 67) !!,SPIDER GAMER,UC_9GZ-5Wz5rjkWg4HAkWg_g,20,Gaming,"فورت نايت, فورتنايت, العاب, سيت اب, قيمز, سبايدر, سبايدر قيمر, دونويشن, دونيشن, دعم, تويتش, افضل, SPIDER, SPIDER GAMER, اخو, اخ, جلد, ضحك, فورت نايت رقم قياسي, 100 دولار, HMX, SPI, تسريب فورتنايت, فرتنايت, بث سبايدر, فورت نايت التحديث الجديد, تسريبات فورت نايت, فورت نايت السيزون الجديد, باور, 100 زر, تحدي 24 ساعة, تحديات, شابتر 4, الشابتر الرابع, قلتش, قلتشات",36,https://i.ytimg.com/vi/xzXC2vD9nmE/hqdefault.jpg,ar,ar,False,849,PT14M9S,hd,False,True,False,False,269523,11160,373
-8UyG56VGWc,MA,2026-05-01T04:35:49.111778+00:00,2026-04-30T05:27:04Z,Ana El Melhi | أنا الملهي في ذنوبي (Sahrawi & Latin),Ana El Melhi | أنا الملهي في ذنوبي (Sahrawi & Latin),Mint Tea Mashups - Topic,UCaeA3r3hKq5jnALWZkROFlw,10,Music,"Mint Tea Mashups, Mint Tea Mashups group, Atlas Dehmane, Ana El Melhi | أنا الملهي في ذنوبي (Sahrawi & Latin)",4,https://i.ytimg.com/vi/-8UyG56VGWc/hqdefault.jpg,ca,en,False,271,PT4M31S,hd,False,True,False,False,9874,85,0
ySJKWt-W1io,MA,2026-05-01T04:35:49.111785+00:00,2026-04-30T10:00:00Z,حولت أسيل لِـ عنكبوت !! 😂,حولت أسيل لِـ عنكبوت !! 😂,ماهر المغامر - Maher Roblox,UC5tmp5TQQpI1WicemM2t_IA,20,Gaming,,0,https://i.ytimg.com/vi/ySJKWt-W1io/hqdefault.jpg,ar,ar,False,1561,PT26M1S,hd,False,True,False,False,124741,4784,746
p7h8edK7B5c,MA,2026-05-01T04:35:49.111792+00:00,2026-04-19T17:33:41Z,I DERREG 3LIA ZLAFTO,I DERREG 3LIA ZLAFTO,Black9ett - Topic,UCLl3kPU2dy3ErAq-D46blyQ,10,Music,"Black9ett, Black9ett Black, I DERREG 3LIA ZLAFTO",3,https://i.ytimg.com/vi/p7h8edK7B5c/hqdefault.jpg,en,ar,False,137,PT2M17S,hd,False,True,False,False,62101,1643,43
IKirCZrTME0,MA,2026-05-01T04:35:49.111801+00:00,2026-04-30T14:14:39Z,البحث عن الملك الويلزي🤯 تفجير بكج بيل و مارسيلو و اوباميانج🔥 efootball 2026,البحث عن الملك الويلزي🤯 تفجير بكج بيل و مارسيلو و اوباميانج🔥 efootball 2026,PEMSAWY GAMING,UCMobzZ-EYKlol4WLavkUDDg,20,Gaming,"تحديث الخميس بيس موبايل, تفجير بكجات بيس موبايل, تفجير بكات الخميس, ميسي الارجنتين, باتش بيس موبايل, كيفية تنزيل باتش بيس موبايل, تفجير بكج الاتنين, تطوير كليان امبابي نسخة ريال مدريد, كليان امبابي مدريد, efootball 2026, شرح الدابل بوستر, تحديث بيس 2026, ايفوتبول 2026, شرح تحديث بيس 2026, تحديث ايفوتبول 2026, شرح حملة راس السنه الجديده",16,https://i.ytimg.com/vi/IKirCZrTME0/hqdefault.jpg,ar,ar,False,1637,PT27M17S,hd,False,True,False,False,42402,5219,265
ts-W4HqXyg4,MA,2026-05-01T04:35:49.111809+00:00,2026-04-21T06:51:26Z,Raja Art ♪ Kbert 3liha (Creativity) - دماغ قلب,Raja Art ♪ Kbert 3liha (Creativity) - دماغ قلب,ibra.derb.sultan - Topic,UCRj9InVzXs6DFzLksCsdNyQ,10,Music,"ibra.derb.sultan, Raja Art ♪ Kbert 3liha (Creativity) - دماغ قلب",2,https://i.ytimg.com/vi/ts-W4HqXyg4/hqdefault.jpg,en,ar,False,93,PT1M33S,hd,False,True,False,False,30349,640,36
