video_id,country,fetched_at,published_at,title,localized_title,channel_title,channel_id,category_id,category_name,tags,tag_count,thumbnail,default_language,audio_language,is_live,duration,duration_raw,definition,caption_available,licensed_content,embeddable,made_for_kids,views,likes,comments
B_FzyiJYlAc,MA,2026-05-01T04:35:49.111331+00:00,2026-04-30T16:57:09Z,Mounim Slimani - DOGA DOGA (Official Music Video) | منعم سليماني - دوكا دوكا,Mounim Slimani - DOGA DOGA (Official Music Video) | منعم سليماني - دوكا دوكا,Mounim Slimani,UCkGZFlHUFKToAYp2o9vy78Q,10,Music,"Mounim Slimani, DOGA DOGA, منعم سليماني, دوكا دوكا, doka doka, دوجا دوجا, doga, doga doga mounim slimani, doga doga song, mounim slimani new song, mounim slimani 2026, ضربة ضربة, Darba Darba, mounim badr, mounim, Slimani, tiktok trend, mon3im slimani, morrocan music, maroc, algeria, maghreb, new, trend, Arabic Songs, اغاني, اغاني مغربية, maghrib, marocain, trending, shorts, hit radio, morocco, music of morocco, musique, arabian music, Chabaka, achkidawa, hobino, بدر وعبي, jedi ou jedek",41,https://i.ytimg.com/vi/B_FzyiJYlAc/hqdefault.jpg,en,en,False,162,PT2M42S,hd,False,True,False,False,26547,1847,155
SXt2p5l_tbg,MA,2026-05-01T04:35:49.111374+00:00,2026-04-30T13:00:00Z,Resident Evil - Teaser Trailer | PlayStation,Resident Evil - Teaser Trailer | PlayStation,PlayStation,UC-2Y8dQb0S6DtpxNgAKoJKA,20,Gaming,"PlayStation, PS5, video games, next gen, Sony",5,https://i.ytimg.com/vi/SXt2p5l_tbg/hqdefault.jpg,en,it,False,114,PT1M54S,hd,False,True,False,False,967596,72251,5218
wHBBXJsJ4Js,MA,2026-05-01T04:35:49.111386+00:00,2026-04-30T15:37:30Z,وأخيراا بكج تااريخي بيل 108 بليتز + مارسيلو 💥🤯 الاحتفال يجنن 😱!,وأخيراا بكج تااريخي بيل 108 بليتز + مارسيلو 💥🤯 الاحتفال يجنن 😱!,MessiGaming10,UCLKk-PWbcOTB3qyMWsfs8ag,20,Gaming,"ميسي جمينج, تفجير بكجات efootball 2026, eFootball 2026, review new Bale 108 efootball 2026, efootball 2026, شرح المهارات بيس26, تفجير بكج بيل و مارسيلو الجديد, تجربه بيل 108 بليتز كيرلر الجديد, افضل تطويره ل بيل 108 بليتز الجديد, eFootball 2026 packs opening, تفجير بكجات eFootball, eFootball 2026 gameplay, messi gaming, efootball, review new Bale 108, Bale blitz curler pack opening, review new Bale 108 efootball, Bale efootball 2026, تفجير بكج غاريث بيل و مارسيلو, blitz curler",20,https://i.ytimg.com/vi/wHBBXJsJ4Js/hqdefault.jpg,ar,ar,False,1207,PT20M7S,hd,False,True,False,False,205141,18877,626
gp_qj4asw-k,MA,2026-05-01T04:35:49.111397+00:00,2026-04-30T18:00:06Z,Saifond Feat Rayvanny I Love You (clip Officiel By Mintigui Prod,Saifond Feat Rayvanny I Love You (clip Officiel By Mintigui Prod,SAIFOND,UCL3ltgLhi_JcFeFzzsOQ9pg,10,Music,Saifond Rayvanny,1,https://i.ytimg.com/vi/gp_qj4asw-k/hqdefault.jpg,en,fr,False,213,PT3M33S,hd,False,True,False,False,337204,38530,3416
5X1dMFuHZhc,MA,2026-05-01T04:35:49.111405+00:00,2026-04-27T14:30:04Z,House of the Dragon Season 3 | Official Teaser Trailer | HBO Max,House of the Dragon Season 3 | Official Teaser Trailer | HBO Max,HBO Max,UCx-KWLTKlB83hDI6UKECtJQ,24,Entertainment,"hbo max, hbo, hbo originals, hbo original series, hbo trailer, new on hbo, max, hbo max originals, hbo max trailer, hbo max teaser, hbo max series, hbo max youtube, house of the dragon, house of the dragon season 3, HOTD, house targaryen, rhaenyra targaryen, emma d'arcy, daemon targaryen, matt smith, alicent hightower, olivia cooke, aegon targaryen, tom glynn-carney, aemond targaryen, ewan mitchell, dragons, ser criston cole, fabien frankel, house of the dragon new season",30,https://i.ytimg.com/vi/5X1dMFuHZhc/hqdefault.jpg,en,en,False,115,PT1M55S,hd,True,True,False,False,2973699,92479,3993
7x-WXrj4ZX8,MA,2026-05-01T04:35:49.111414+00:00,2026-04-30T16:00:20Z,فجرت اصدقائي في فري فاير !!,فجرت اصدقائي في فري فاير !!,SA7RAWI Gaming,UC2qdrMpLKn3GgeCwN65SX_Q,20,Gaming,"الصحراوي, صحراوي فري فاير, sa7rawi, فري فاير, صحراوي, فري فاير الجزائر, تهكير فري فاير, تحدي فري فاير, مقلب النوب, شحنتلهم, شحن فري فاير, ألف جوهرة, تخريب حساب, شحنت للمتابع, تحدي أفوز, FREE FIRE, NOOB PRANK, سكواد جزائري, خدعة اللغم, ساكورا, التحديث الجديد فري فاير, WHITE444, هيدشوت تلقائي, حسونة, دراغونوف, DBL N, الشخصية الجديدة, متجر التخفيضات, السكن, الشوتقن, فري فاير لايت, الكريمنال, الفاير باس الاول, المتابعين, اصعب تحدي, Ali Omar, M16, TRYHARD, DJEXO, قيم بلاي, سكواد بنات",41,https://i.ytimg.com/vi/7x-WXrj4ZX8/hqdefault.jpg,ar,ar,False,998,PT16M38S,hd,False,True,False,False,137450,9079,534
Ui1QddZZA1w,MA,2026-05-01T04:35:49.111424+00:00,2026-04-19T11:13:30Z,Ma3andakch - Ma7anti Rouquine محنتي روكين,Ma3andakch - Ma7anti Rouquine محنتي روكين,Cheb Mirou - Topic,UCCPxEMjaTA6xF8X__eZNzeg,10,Music,"Cheb Mirou, Rami Latinos, Ma3andakch - Ma7anti Rouquine محنتي روكين",3,https://i.ytimg.com/vi/Ui1QddZZA1w/hqdefault.jpg,en,ar,False,301,PT5M1S,hd,False,True,False,False,355036,1991,19
pxbEWUjh6E4,MA,2026-05-01T04:35:49.111432+00:00,2026-04-28T19:00:45Z,"My Hero Academia FINAL SEASON ""More"" | Official Trailer | Crunchyroll","My Hero Academia FINAL SEASON ""More"" | Official Trailer | Crunchyroll",Crunchyroll,UC6pGDc4bFGD1_36IKv3FnYg,1,Film & Animation,"my hero academia anime, my hero academia final season, boku no hero academia, mha, bnha, crunchyroll, anime, anime preview, anime pv, anime trailer",10,https://i.ytimg.com/vi/pxbEWUjh6E4/hqdefault.jpg,en,ja,False,56,PT56S,hd,False,True,False,False,966650,40209,1803
DjLzVmrDiQE,MA,2026-05-01T04:35:49.111441+00:00,2026-04-30T07:57:05Z,تحدي أوصل 127 وأجيب كريستيانو رونالدو,تحدي أوصل 127 وأجيب كريستيانو رونالدو,Abdo 2xd,UC8H8YKUSFLtLxjt49tlyJwA,20,Gaming,"عبدو, Abdo, Abdo 2xd, FIFA, فيفا, لعبة فيفا, ABDO, فيفا موبايل, fifa, fifa mobile, اف سي موبايل, FC MOBILE, اف سي, fc, fc mobile, لعبة فيفا موبايل, كريستيانو, كريستيانو رونالدو, cr7, ballon d'or, رونالدينهو, FC, رونالدو, رودريجو, زيدان, فريق الموسم, TOTS, كريستانو رونالدو, Ballon d'Or, ايزيبو, ديمبلي, البالون دور, الكرة الذهبية, tots, برونو, هالاند, بيست, abdo2xd, كريستانو, كريستانو الازرق",40,https://i.ytimg.com/vi/DjLzVmrDiQE/hqdefault.jpg,ar,ar,False,1512,PT25M12S,hd,False,True,False,False,432768,52336,1159
iEhwirY9AHE,MA,2026-05-01T04:35:49.111451+00:00,2026-04-30T14:43:52Z,Said Outajajt (MANI TGHAWALT) ⵙⴰⵄⵉⴷ ⵓⵜⴰⵊⴰⵊⵜ سعيد اوتجاجت,Said Outajajt (MANI TGHAWALT) ⵙⴰⵄⵉⴷ ⵓⵜⴰⵊⴰⵊⵜ سعيد اوتجاجت,Said Outajajt,UCDEl88V1QAjnPQ2DJJ2iNdA,10,Music,,0,https://i.ytimg.com/vi/iEhwirY9AHE/hqdefault.jpg,ar,ar,False,378,PT6M18S,hd,False,True,False,False,14331,1606,391
E-TJyp3TWPU,MA,2026-05-01T04:35:49.111459+00:00,2026-04-27T18:15:00Z,The Boys Season 5 Episode 5 Trailer,The Boys Season 5 Episode 5 Trailer,Rotten Tomatoes TV,UCz1GPotHecuLngiLuY739QQ,1,Film & Animation,"The Boys, The Boys Trailer, The Boys Season 5 Episode 5 Trailer, The Boys S05 E05 Trailer, The Boys Season 5 episode 5 TV Trailer, The Boys Season 5 Episode 5 Trailer 2026, The Boys Season 5 Episode 5 Official Trailer, Trailer, TV Trailer, 2026 Trailers, 2026 TV Trailers, The Boys Trailer 1, The Boys Season 5 Prime Video, Prime Video, Entertainment, TV Series, Karl Urban, Jack Quaid, Antony Starr, Rotten Tomatoes TV",20,https://i.ytimg.com/vi/E-TJyp3TWPU/hqdefault.jpg,en,en,False,32,PT32S,hd,False,True,False,False,1120208,21354,1664
dQ62zujInEI,MA,2026-05-01T04:35:49.111468+00:00,2026-04-30T20:41:46Z,رحلة البحث عن الظهير البرازيلي التاريخي🤯عودة القطار الويلزي🔥|efootbal 2026,رحلة البحث عن الظهير البرازيلي التاريخي🤯عودة القطار الويلزي🔥|efootbal 2026,TONY GAMING,UCtvsfbEiJmj3-54ACJH-Jxw,20,Gaming,"بيس موبايل, بيس موبايل 2022, بيس 2022 موبايل, تحديث بيس 2022 موبايل, موعد نزول بيس 2022 موبايل, موعد تحديث بيس 2022 موبايل, يوم الخميس بيس 2021 موبايل, بيس 2021 موبايل اليوم, تحديث بيس موبايل, موعد تحديث بيس موبايل, موعد بيس 2022 موبايل, اخبار بيس 2022 موبايل, تحميل بيس 2022 موبايل, تحديث بيس 2023, pes 2022, efootball 2024, تفجير بكجات, تحديات, افضل تشكيله, التحديث الجديد, بكج نجوم الاسبوع, شو تايم, aubamyang, bale, marcelo",25,https://i.ytimg.com/vi/dQ62zujInEI/hqdefault.jpg,ar,ar,False,1702,PT28M22S,hd,False,True,False,False,99026,13827,667
bMhDJ0S0OBA,MA,2026-05-01T04:35:49.111477+00:00,2026-04-30T08:58:06Z,ILLIT (아일릿) ‘It’s Me’ Official MV,ILLIT (아일릿) ‘It’s Me’ Official MV,HYBE LABELS,UC3IZKseVpdzPSBaWxBxundA,10,Music,"HYBE, HYBE LABELS, 하이브, 하이브레이블즈",4,https://i.ytimg.com/vi/bMhDJ0S0OBA/hqdefault.jpg,ko,ko,False,147,PT2M27S,hd,True,True,False,False,3403991,241565,16430
LFJJA8Qeqz4,MA,2026-05-01T04:35:49.111485+00:00,2026-04-27T12:09:37Z,KAGURABACHI｜Official Teaser Trailer,KAGURABACHI｜Official Teaser Trailer,SHOCHIKU animeチャンネル【公式】,UC6VPE3kztGEtFVcJI0oIiUg,1,Film & Animation,,0,https://i.ytimg.com/vi/LFJJA8Qeqz4/hqdefault.jpg,en,en,False,46,PT46S,hd,True,True,False,False,1584887,105583,439
m_adzc8BjGU,MA,2026-05-01T04:35:49.111493+00:00,2026-04-30T18:00:46Z,هل هذا أفضل مدرب فـ eFootball ؟! خلاني نربح كلشي 😤🔥,هل هذا أفضل مدرب فـ eFootball ؟! خلاني نربح كلشي 😤🔥,Mehdi Hilm,UCA3O2UzmCh-zcs8oFapB4VA,20,Gaming,"eFootball, efootball mobile",2,https://i.ytimg.com/vi/m_adzc8BjGU/hqdefault.jpg,ar,ar,False,906,PT15M6S,hd,False,True,False,False,25464,2167,155
3JO6JlHeqhQ,MA,2026-05-01T04:35:49.111501+00:00,2026-04-30T15:23:44Z,"DIDINE CANON 16 - M7AYNI , prod by Willy","DIDINE CANON 16 - M7AYNI , prod by Willy",Didine Canon 16 ,UCzbsyyZ05INu78miPEAUDUQ,10,Music,,0,https://i.ytimg.com/vi/3JO6JlHeqhQ/hqdefault.jpg,ar,fr,False,240,PT4M,hd,False,True,False,False,297188,26012,2601
0XY3fuQmVb4,MA,2026-05-01T04:35:49.111509+00:00,2026-04-30T10:00:03Z,يدي مكسورة بسبب فري فاير 💔,يدي مكسورة بسبب فري فاير 💔,SA7RAWI,UCjHq0FqdRB0JP-1CcokW3-w,20,Gaming,"الصحراوي, صحراوي فري فاير, sa7rawi, فري فاير, صحراوي, فري فاير الجزائر, تهكير فري فاير, تحدي فري فاير, مقلب النوب, شحنتلهم, شحن فري فاير, ألف جوهرة, تخريب حساب, شحنت للمتابع, تحدي أفوز, FREE FIRE, NOOB PRANK, سكواد جزائري, خدعة اللغم, ساكورا, التحديث الجديد فري فاير, WHITE444, هيدشوت تلقائي, حسونة, دراغونوف, DBL N, الشخصية الجديدة, متجر التخفيضات, السكن, الشوتقن, فري فاير لايت, الكريمنال, الفاير باس الاول, المتابعين, اصعب تحدي, Ali Omar, M16, TRYHARD, DJEXO, قيم بلاي, سكواد بنات",41,https://i.ytimg.com/vi/0XY3fuQmVb4/hqdefault.jpg,ar,ar,False,734,PT12M14S,hd,False,True,False,False,286218,25487,2067
ljz4ChzZ-4k,MA,2026-05-01T04:35:49.111517+00:00,2026-04-28T17:33:55Z,سكيميات حزينة أروع صوامت الفنان سكيمي,سكيميات حزينة أروع صوامت الفنان سكيمي,Salah Zelfana - Topic,UCJJE54opOMImY6uqxNGeyVA,10,Music,"Salah Zelfana, Suno Ai, cheb salah, سكيميات حزينة أروع صوامت الفنان سكيمي",4,https://i.ytimg.com/vi/ljz4ChzZ-4k/hqdefault.jpg,ar,ar,False,258,PT4M18S,hd,False,True,False,False,33751,418,0
pFr80KeElIM,MA,2026-05-01T04:35:49.111526+00:00,2026-04-29T18:59:43Z,تحدي الهروب من المدرس الكريه🤢حبسني في المدرسة😰| ESCAPE MR STINKY,تحدي الهروب من المدرس الكريه🤢حبسني في المدرسة😰| ESCAPE MR STINKY,Hicham Panda,UConNpoTlEic3FtPdwafprag,20,Gaming,"باندا, هشام باندا, HICHAM, HICHAM PANDA, PANDA, تحدي, هشام, game, لعبة, العاب, gaming, gameplay, games, تحديات, roblox, roblox gaming, roblox funny, roblox maroc, roblox arab, gaming video, funny gaming, youtube gaming, roblox roleplay, roblox scary, roblox adventure, roblox obby, roblox trolling, roblox challenge, roblox secrets, roblox viral, roblox trending, viral video, youtube shorts, روبلوكس بالدارجة, جيمر مغربي",35,https://i.ytimg.com/vi/pFr80KeElIM/hqdefault.jpg,ar,ar,False,1553,PT25M53S,hd,False,True,False,False,78292,1431,100
FvhpOnoPueE,MA,2026-05-01T04:35:49.111535+00:00,2026-04-28T21:30:03Z,SNOR - Storm ft. @itsmemadd6056 [Official Audio] (Album Miracle),SNOR - Storm ft. @itsmemadd6056 [Official Audio] (Album Miracle),SNOR 91,UCmqIH5s7Zfmf4c9nREtgnkw,10,Music,"Mab9ach, Snor, arani, evidement snor, evidemment snor, najm ft snor, najm snor, najm tayer, najm x snor, rap maroc 2026, rap marocain, reaction snor, snoor, snor 2026, snor 91, snor evidement, snor evidemment, snor feat najm, snor ft najm, snor najm, snor x najm, tendance maroc, ÉVIDEMMENT, évidemment snor, راب مغربي, سنور, album miracle, snor album complet, snor album reaction, snor album miracle, madd ft snor storm, snor ft madd storm, storm, madd",34,https://i.ytimg.com/vi/FvhpOnoPueE/hqdefault.jpg,en,en,False,165,PT2M45S,hd,False,True,False,False,52155,1924,145
qn8dB6VhZKk,MA,2026-05-01T04:35:49.111543+00:00,2026-04-30T15:47:43Z,اتجننت وختمت بكج ناروتو الجديد !! 🤯🔥 بيل الـ 109 ☠️ مارسيلو الـ 108 🔥 اوباميانج الـ 106 ⚡,اتجننت وختمت بكج ناروتو الجديد !! 🤯🔥 بيل الـ 109 ☠️ مارسيلو الـ 108 🔥 اوباميانج الـ 106 ⚡,OKATO GO,UCkUEthM6nQe--OdWmxQS66w,20,Gaming,"pes mobile, بيس موبايل, بيس موبايل تفتيح بكجات, تفتيح بكجات, eFootball Mobile, بيس 2023, fifa mobile, fifa ultimate team, okato go, okato, abdalaziz esam, عبدالعزيز اوكاتو, اوكاتو, فيفا موبايل, فيفا 23, تحديث فيفا, تحديث بيس موبايل, تحديث فيفا موبايل, pes 2025, pes25, efootball25, efootball 25, efootball 2025, تفتيح بكجات pes, تفتيح بكجات بيس, اي فوتبول",26,https://i.ytimg.com/vi/qn8dB6VhZKk/hqdefault.jpg,ar,ar,False,1502,PT25M2S,hd,False,True,False,False,65908,6746,233
_GSH6JLv_uQ,MA,2026-05-01T04:35:49.111552+00:00,2026-04-30T22:00:43Z,3robi - Bean (Official Video),3robi - Bean (Official Video),Spow Business,UCyP2zHDtGaTQuwTkCqwdKKg,10,Music,"Music, Maghrabi, spow, dauwag, Spow business, Casablanca, 3robi - maghrabi, 3robi, 3ROBI 2024, djezja, ashafar",11,https://i.ytimg.com/vi/_GSH6JLv_uQ/hqdefault.jpg,en,nl,False,160,PT2M40S,hd,False,True,False,False,7480,1104,96
j_XLonzbi70,MA,2026-05-01T04:35:49.111560+00:00,2026-04-30T09:58:24Z,كوينز كتير ولعيبة مميزة مجانا وحدث جديد 🔥🤯 شرح جميع اضافات تحديث بيس اليوم 😱|efootball 2026,كوينز كتير ولعيبة مميزة مجانا وحدث جديد 🔥🤯 شرح جميع اضافات تحديث بيس اليوم 😱|efootball 2026,من بره التمنتاشر,UC8gfuntXFc6fzYLx6Zi5B8Q,26,Howto & Style,"من بره التمنتاشر, efootball 2025, efootball, بيس موبايل, بيس 2024, هدايا كونامي, بيس 25, احداث يوم الخميس بيس, تحديث بيس موبايل, تحديث بيس 2025, efootball mobile, efootball 25, بيس 2025, eFootball Updates, Gaming Headsets, كوين بيس, تحميل efootball, تحميل بيس, efootball pes, pes mobile, تحميل لعبة efootball, احداث يوم الخميس, بكج نجوم الاسبوع, اضافات يوم الخميس, بكجات يوم الخميس, احداث يوم الاثنين, efootball 2026, بيس 2026, efootball2026, efootball 26, كوينز بيس",31,https://i.ytimg.com/vi/j_XLonzbi70/hqdefault.jpg,ar,ar,False,552,PT9M12S,hd,False,True,False,False,143484,12421,707
bX73Qt7Tvus,MA,2026-05-01T04:35:49.111568+00:00,2026-04-29T16:35:06Z,TAESER 2026 | C’ÉTAIT PRÉVU ,TAESER 2026 | C’ÉTAIT PRÉVU ,Cheb Hichem - Tgv - الشاب هشام,UCSYnccraclZuyv5Szd2ZU7Q,10,Music,,0,https://i.ytimg.com/vi/bX73Qt7Tvus/hqdefault.jpg,fr,ar,False,61,PT1M1S,hd,False,True,False,False,91865,5534,683
oL2xPUAob2U,MA,2026-05-01T04:35:49.111575+00:00,2026-04-30T18:01:28Z,كونت أخطر عصابة وسيطرنا على المدينة!🚨| OneState 🚔,كونت أخطر عصابة وسيطرنا على المدينة!🚨| OneState 🚔,AboFlah Gaming,UCRu9mro2nPafhMxVy2CRfXA,20,Gaming,"aboflah, flah, gaming, قيمنق, ابو فلة, abo, فله, ابوفلة, ابوفلاح, فلاح, falah, جيمنق, رعب, حرامي سيارات, iphone, العرب, مصر, السعودية, الامارات, دبي, الكويت, kuwait, riyadh, عشوائي, لعبة, تحدي, اصعب, ضحك, امونق اس, كود, aboflah gaming, abo flah, ابو فلاح, تختيم, سلسلة, تحديات, محاكي, لعبة محاكي, هل ابوفله, ون ستيت, لعبة ون ستيت, OneState, أقوى تحدي, مواجهة, مواجهة خطيرة, معركة, قتال, هروب, مطاردة, نجاة, شرطة, هروب من الشرطة, مطاردة الشرطة, زعيم عصابة, حرب عصابات, اشتباكات, سطو, سرقة, نجوت بأعجوبة, كارثة",60,https://i.ytimg.com/vi/oL2xPUAob2U/hqdefault.jpg,ar,ar,False,5077,PT1H24M37S,hd,False,True,False,False,241145,27980,3475
7ic3O87B3-w,MA,2026-05-01T04:35:49.111585+00:00,2026-04-30T12:10:49Z,Alif6,Alif6,Inkonnu - Topic,UCIUBQlSRYYU-7ycBJyu1nQA,10,Music,"Inkonnu, Alif6",2,https://i.ytimg.com/vi/7ic3O87B3-w/hqdefault.jpg,en,en,False,270,PT4M30S,hd,False,True,False,False,9258,995,96
tCoJizsQ-4I,MA,2026-05-01T04:35:49.111593+00:00,2026-04-30T19:32:01Z,Minecraft: Aldea POBRE vs Aldea RICA,Minecraft: Aldea POBRE vs Aldea RICA,Nacho,UC8EkcHOycB94lHDkbAPSnQA,20,Gaming,"nacho, dagar, nacho minecraft, dagar y nacho, nacho y dagar, minecraft, minecraft mod, reto de construccion, desafio de construccion, noob vs pro, parque acuatico, diminuto, enano minecraft, casa enana, base enana, base diminuta, casa diminuta, lia minecraft, toni minecraft, aldea, aldea millonaria, aldea rica, aldea de rico minecraft, mejor aldea minecraft, aldea pobre vs rica",25,https://i.ytimg.com/vi/tCoJizsQ-4I/hqdefault.jpg,es,es,False,1390,PT23M10S,hd,False,True,False,False,497155,7908,1370
fIdOcB_R--k,MA,2026-05-01T04:35:49.111628+00:00,2026-04-28T08:18:50Z,Zat Mat Fat (feat. Weld Sahli),Zat Mat Fat (feat. Weld Sahli),Cheikh Krimo - Topic,UCavdYdhfhyzzbhbV7X3M6Kg,10,Music,"cheikh krimo, Weld Sahli, Zat Mat Fat (feat. Weld Sahli)",3,https://i.ytimg.com/vi/fIdOcB_R--k/hqdefault.jpg,ms,ar,False,168,PT2M48S,hd,False,True,False,False,38252,356,0
sfUibX_llko,MA,2026-05-01T04:35:49.111639+00:00,2026-04-29T17:31:21Z,وداعا ... الزومبي حاصروني 😢,وداعا ... الزومبي حاصروني 😢,Tayar | تيار,UCFP-t0OQA_YsjzcoaI11Mxw,20,Gaming,"zombie, plants vs zombies, dancing zombie, zombie song, pvz fusion",5,https://i.ytimg.com/vi/sfUibX_llko/hqdefault.jpg,ar,ar,False,1559,PT25M59S,hd,False,True,False,False,228878,8896,366
pl7QNKsFJiY,MA,2026-05-01T04:35:49.111647+00:00,2026-04-30T23:01:02Z,Lquinze - SODEA & SOGETA (Official Lyric Video),Lquinze - SODEA & SOGETA (Official Lyric Video),Lquinze,UCQAX-5W8qIjCgTgK5vcTMYw,10,Music,"Lquinze, SODEA & SOGETA, lquinze new track, lquinze new, lquinze 2026, lquinze tracks, lquinze sodea & sogeta, SODEA & SOGETA LYRICS, SODEA SOGETA, Perfect Pitch, quinze, lquinze, l'morphine, lmorphiniya 34, dosei trissinti, hamza15-3, trips, ep, fullep, meknes, moroccan rap, b4 ikigai, italian job, picasso, madrigal, og call, diamond, hamza 15-3, arabic, music, rap, hip hop, tunisien, rap tunisien, tunis, north africa, artist, اغاني, اغاني راب, راب, راب تونسي, صاحبي, chabaka",43,https://i.ytimg.com/vi/pl7QNKsFJiY/hqdefault.jpg,en,fr,False,167,PT2M47S,hd,False,True,False,False,1073,315,54
rKBVFr3Skrk,MA,2026-05-01T04:35:49.111657+00:00,2026-04-30T14:01:35Z,أندر سكنات المشاهير داخل اللعبة!🔥(فعالية) ,أندر سكنات المشاهير داخل اللعبة!🔥(فعالية) ,حسونة - Hassone,UC4j8Thj3AUmH4PTM9YLAkSA,20,Gaming,,0,https://i.ytimg.com/vi/rKBVFr3Skrk/hqdefault.jpg,ar,ar,False,882,PT14M42S,hd,False,True,False,False,63302,5260,416
BKzUg2gseig,MA,2026-05-01T04:35:49.111665+00:00,2026-04-24T21:12:49Z,NEXUS : We Are Still Here…,NEXUS : We Are Still Here…,tarik kaim NEXUS - Topic,UCWEeciGBQ-Sc-VGp4VbCofw,10,Music,"tarik kaim NEXUS, kaimlila tarik nexus, NEXUS : We Are Still Here…",3,https://i.ytimg.com/vi/BKzUg2gseig/hqdefault.jpg,en,en,False,208,PT3M28S,hd,False,True,False,False,185516,5628,0
gZjmDXBes7w,MA,2026-05-01T04:35:49.111673+00:00,2026-04-30T12:00:05Z,بيل × ساسكي ومارسيلو × ناروتو 🤯🔥 البكج ده طلع مرعب 🥶 | eFootball 2026,بيل × ساسكي ومارسيلو × ناروتو 🤯🔥 البكج ده طلع مرعب 🥶 | eFootball 2026,JIGGSo_ar,UCclurEPctSvRACWnC4gpmWg,20,Gaming,"eFootball 2026, eFootball, eFootball Mobile, اي فوتبول 2026, اي فوتبول, اي فوتبول موبايل, eFootball pack opening, eFootball نجوم الاسبوع, eFootball 2026 شرح, eFootball Egypt, eFootball Saudi, eFootball gameplay, eFootball review, eFootball player review, eFootball best players, باك اي فوتبول, افضل لاعبين اي فوتبول, فعاليات يوم الخميس, gaming, football game, جيمنج, جيمرز العرب, Jiggso, Jiggso_ar, قناة Jiggso, جيكسو",26,https://i.ytimg.com/vi/gZjmDXBes7w/hqdefault.jpg,ar,ar,False,1875,PT31M15S,hd,False,True,False,False,100031,9155,481
AWizIRTnxi0,MA,2026-05-01T04:35:49.111682+00:00,2026-04-29T15:00:06Z,Maha Ftouni - Mamsektesh Feek (Official Lyric Video) | مهى فتوني - مامسكتش فيك,Maha Ftouni - Mamsektesh Feek (Official Lyric Video) | مهى فتوني - مامسكتش فيك,Maha Ftouni,UCBjR6Ju3DaWf7Otlbm99Tdg,10,Music,"Maha Ftouni, El Sabr Gamil, الصبر جميل, مها فتوني, Ma Tealaashi, متقلقش, داين فتدان, طرب مصري, أغاني طرب, Maha Ftoni, صبر جميل, Sabr Gamil, El Saber Gamil, El Saber Jameel, أنا شفت كتير منك, واهو بكرة تشوف, أغاني تيكتوك, ترند تيكتوك, Trend TikTok, وايه يعني هتنساني, وافتكرلك ايه, أغاني مها فتوني, مهى فتوني, El Sabr Gamel, أغاني حزن, أغاني حب, Love Songs, أغاني ترند, مليان جبروت, اغاني 2025, أول حب, album awel hob, سلام, فيها رجوع, مع السلامه, يا واحشني",36,https://i.ytimg.com/vi/AWizIRTnxi0/hqdefault.jpg,ar,en-US,False,223,PT3M43S,hd,False,True,False,False,262931,11009,946
Hkj20JJokjA,MA,2026-05-01T04:35:49.111691+00:00,2026-04-30T14:34:47Z,اكثر العاب روبلوكس المشهوره اثاره للقلق والرعب 😨,اكثر العاب روبلوكس المشهوره اثاره للقلق والرعب 😨,RTQ,UCY5Zs3Y76ILKOdJODtlsiBw,22,People & Blogs,,0,https://i.ytimg.com/vi/Hkj20JJokjA/hqdefault.jpg,en,en,False,614,PT10M14S,hd,False,True,False,False,110626,3455,427
Y4AOVwozn2I,MA,2026-05-01T04:35:49.111698+00:00,2026-04-28T09:59:17Z,"*GROUPE IMZILNE ALNIF*. ""OLAWN"". (EXCLUSIVE Music Video). جديد مجموعة امزيلن النيف.","*GROUPE IMZILNE ALNIF*. ""OLAWN"". (EXCLUSIVE Music Video). جديد مجموعة امزيلن النيف.",Groupe Imzilne Officiel,UCvR4do8i2VpRGUddsgh-9_Q,27,Education,,0,https://i.ytimg.com/vi/Y4AOVwozn2I/hqdefault.jpg,ar,en,False,343,PT5M43S,hd,False,True,False,False,25249,907,156
RaucFbNq2YA,MA,2026-05-01T04:35:49.111706+00:00,2026-04-30T11:00:45Z,لقيت غرفة سرية في بيت جراني… وداخلها كلب غريب 😨 | Granny,لقيت غرفة سرية في بيت جراني… وداخلها كلب غريب 😨 | Granny,شبكة العاب العرب | Arab Games Network,UCV2JkEBmtfSYGAIlprAhAyQ,20,Gaming,,0,https://i.ytimg.com/vi/RaucFbNq2YA/hqdefault.jpg,ar,ar,False,1854,PT30M54S,hd,False,True,False,False,172891,9158,655
Ie_YvXfjIsM,MA,2026-05-01T04:35:49.111713+00:00,2026-04-27T18:30:06Z,AZAWANBEATS - ASSRKED (Official Release 2026),AZAWANBEATS - ASSRKED (Official Release 2026),Azawanbeats,UC3vQo_plFRxI7rtp82K2iIA,10,Music,,0,https://i.ytimg.com/vi/Ie_YvXfjIsM/hqdefault.jpg,en,ar,False,218,PT3M38S,hd,False,True,False,False,12312,245,23
