video_id,country,fetched_at,published_at,title,localized_title,channel_title,channel_id,category_id,category_name,tags,tag_count,thumbnail,default_language,audio_language,is_live,duration,duration_raw,definition,caption_available,licensed_content,embeddable,made_for_kids,views,likes,comments
sXG7EaCyBRY,CR,2025-12-26 02:28:41.264547+00:00,2025-12-25 21:20:05+00:00,KRIS R - EL TESTIGO 🎄 (RIP PIRLO),KRIS R - EL TESTIGO 🎄 (RIP PIRLO),Kris R.,UCRfKDfw9XjSLHTBd8hokHig,10,Music,"kris r, el testigo, tiradera pirlo, pirlo, tiradera, la k, tiradera kris r, rip reboll, kris r., trap, colombia, latin trap, latin trap 2020, trap latino 2020, anuel, akapellah, acapela, reboll333, esteban rojas, cali cartel, los rogelios, dfzm, mi burrito sabanero, el exorcista, rip pirlo, trap de medallo, Que rico CB",27,https://i.ytimg.com/vi/sXG7EaCyBRY/hqdefault.jpg,es,es-419,False,539,PT8M59S,hd,False,True,,,402598,85183,11006
Mzw2ttJD2qQ,CR,2025-12-26 02:28:41.264617+00:00,2025-12-22 14:00:04+00:00,The Odyssey | Official Trailer,The Odyssey | Official Trailer,Universal Pictures,UCq0OueAsdxH6b8nyAspwViw,24,Entertainment,,0,https://i.ytimg.com/vi/Mzw2ttJD2qQ/hqdefault.jpg,en-US,en-US,False,114,PT1M54S,hd,True,True,,,24725910,461762,24078
iB248-F-P6c,CR,2025-12-26 02:28:41.264629+00:00,2025-12-25 21:21:09+00:00,¡CONSEGUÍ la NUEVA clase de SANTA INGENIERO! 🦌😲🎅🛠️ SILVIOGAMER en 99 NOCHES en el BOSQUE,¡CONSEGUÍ la NUEVA clase de SANTA INGENIERO! 🦌😲🎅🛠️ SILVIOGAMER en 99 NOCHES en el BOSQUE,Silvio Gamer,UCCrA8ZN1J3S52wuF4vthZFQ,20,Gaming,"SILVIO, SILVIOGAMER, SILVIO GAMER, MINECRAFT, Silvio, silviogamer, silvio, silvio gamer, minecraft silvio, silvio minecraft, silviogamer minecraft, minecraft silviogamer, silviogamer minecraft pero, minecraft pero, CONSEGUI, CONSEGUÍ, SANTA, CLASE, NUEVA CLASE, CLASE DE SANTA, 6 ESTRELLAS, 1000, DIAMANTES, INGENIERO, OBTUVE, LA NUEVA, NUEVA, CLASE OP, OP, CLASS, NEW CLASS, NEW OP CLASS, 99 NIGHTS, 99 NIGHTS IN THE FOREST, 99 NOCHES EN EL BOSQUE, 99 NOCHES, 99 NOCHES BOSQUE, BOSQUE, VENADO",39,https://i.ytimg.com/vi/iB248-F-P6c/hqdefault.jpg,es,es,False,2259,PT37M39S,hd,False,True,,,173413,9814,4216
J5r4-t_Bzck,CR,2025-12-26 02:28:41.264640+00:00,2025-12-24 23:55:06+00:00,Rocío Dúrcal - Como Tu Mujer (Letra),Rocío Dúrcal - Como Tu Mujer (Letra),RIXELUS,UCrkF_lRGv6wuOZVNWCuOCuA,10,Music,"rocio durcal, como tu mujer, como tu mujer album, rocio durcal como tu mujer letra, rocio durcal como tu mujer karaoke, rocio durcal como tu mujer lyrics, rocio durcal como tu mujer audio, rocio durcal como tu mujer tiktok, latin pop, pop latino, musica latina, karaoke, hd, hq, topic, rixelus",16,https://i.ytimg.com/vi/J5r4-t_Bzck/hqdefault.jpg,es,es,False,264,PT4M24S,hd,False,True,,,204599,459,7
ZY_vjZ0fHxw,CR,2025-12-26 02:28:41.264649+00:00,2025-12-23 18:10:55+00:00,POR FIN trailer Avengers Doomsday de Capitán América en HD explicado,POR FIN trailer Avengers Doomsday de Capitán América en HD explicado,Pelicomic,UCsMzBY3X_RS6GhGBiHXW19A,24,Entertainment,,0,https://i.ytimg.com/vi/ZY_vjZ0fHxw/hqdefault.jpg,es,es-419,False,876,PT14M36S,hd,False,True,,,280793,15786,970
FoZW_2MUDHk,CR,2025-12-26 02:28:41.264656+00:00,2025-12-25 01:30:21+00:00,Alteramos El GTR De 1400HP Para librarnos De Las Autoridades,Alteramos El GTR De 1400HP Para librarnos De Las Autoridades,RDjavi,UCzjF2EUojZ1hVd_JVKhbCJA,20,Gaming,"rdjavi, gta, carros potentes, los mejores carros de gta, El cojo, cojoaventuras, creativos rp, danirep, vegeta777, mexico, roleplay, rp, ibai carreras gta, auron carreras, colombia, panama, venezuela, argentina, gaming españa, rolplay, rdjavi live, Rdjavi, nos fugamos, honda, honda turbo, rescate, traidores, agentes, RB26, r34, Usamos un R34 Alterado Para fugarnos, nos fugamos de prision, rb26 alterado, fuga de la carcel, como fugarse de prision, corredor, awd, contrarios, ex enemigo, brujo, habibi",41,https://i.ytimg.com/vi/FoZW_2MUDHk/hqdefault.jpg,es,es,False,1522,PT25M22S,hd,False,True,,,888464,55758,3582
GI4_G3V458Q,CR,2025-12-26 02:28:41.264666+00:00,2025-12-24 01:27:58+00:00,Las 50 Mejores Villancicos Navideños 🎄 Música Navideña Clásica 🎅🏻 Feliz Navidad 2025,Las 50 Mejores Villancicos Navideños 🎄 Música Navideña Clásica 🎅🏻 Feliz Navidad 2025,Christmas Music Fireplace,UC29QZcKH_z9oYyNlAeXhSxQ,10,Music,"villancicos navideños, villancicos de navidad, musica de navidad, musica navideña, canciones de navidad, canciones navideñas, villancicos clasicos, musica navideña clasica, feliz navidad, navidad en español, villancicos tradicionales, exitos navideños, playlist navidad, musica para navidad, canciones de navidad en español, villancicos populares, musica de navidad clasica, navidad canciones, nochebuena musica, musica para nochebuena, musica navideña 2025, villancicos 2025",22,https://i.ytimg.com/vi/GI4_G3V458Q/hqdefault.jpg,es,en,False,7656,PT2H7M36S,hd,False,True,,,2248395,5236,179
4h3i9_t4n8E,CR,2025-12-26 02:28:41.264676+00:00,2025-12-23 14:17:05+00:00,AVENGERS: DOOMSDAY Teaser Tráiler (2026),AVENGERS: DOOMSDAY Teaser Tráiler (2026),ONE Media Español,UCcVNDl7ZJMf9lC9a34CY4RA,1,Film & Animation,"Tráiler, Película, Español, Latino, 2025, Avengers Doomsday, Avengers Doomsday Tráiler, Captain America, Chris Evans, Marvel, Avengers 5",11,https://i.ytimg.com/vi/4h3i9_t4n8E/hqdefault.jpg,es,es,False,101,PT1M41S,hd,False,True,,,308758,14579,1111
VzlYCyf1wgk,CR,2025-12-26 02:28:41.264684+00:00,2025-12-25 20:00:32+00:00,ARK - ESTE DRAGÓN tiene ESTAMINA INFINITA 😱  - Cap.6 Lost Colony,ARK - ESTE DRAGÓN tiene ESTAMINA INFINITA 😱  - Cap.6 Lost Colony,Nexxuz World,UCggHFGmLDDStxyM-uy9DYnQ,24,Entertainment,"ark, ARK, ARK SURVIVAL EVOLVED, ARK SERIE, reinos enfrentados, reinos, serie ark, extremo, supervivencia, dinosaurio depredador, dinosaurios, dinosaurios juegos, dinosaurio juego, juego dinosaurio, juegos de dinosaurios, parque dinosaurios, dinosaurios juego, dinosaurios ark, jurassic world ark, juegos dinosaurios, dinosaurios serie, dinosaurio ark, nexxuz, nexxuz world, nexxuz hd, nexxuz ark, nexus",27,https://i.ytimg.com/vi/VzlYCyf1wgk/hqdefault.jpg,es,es,False,2785,PT46M25S,hd,False,True,,,76601,10608,269
TEcClqOj-1E,CR,2025-12-26 02:28:41.264692+00:00,2025-12-25 16:45:06+00:00,"Grupo Firme, Lenin Ramírez - En Tu Perra Vida (Letra)","Grupo Firme, Lenin Ramírez - En Tu Perra Vida (Letra)",Big Sound,UCO_w8nCYegO_gXnsT_MjtQg,10,Music,,0,https://i.ytimg.com/vi/TEcClqOj-1E/hqdefault.jpg,es,es,False,239,PT3M59S,hd,False,True,,,22025,130,1
BwdMT-OiARI,CR,2025-12-26 02:28:41.264700+00:00,2025-12-21 06:45:01+00:00,Black Clover Second Season | Official Trailer 2 | Crunchyroll,Black Clover Second Season | Official Trailer 2 | Crunchyroll,Crunchyroll,UC6pGDc4bFGD1_36IKv3FnYg,1,Film & Animation,"black clover, black clover anime, black clover season 2, black clover s2, black clover second season, crunchyroll, anime, anime trailer, anime preview",9,https://i.ytimg.com/vi/BwdMT-OiARI/hqdefault.jpg,en,ja,False,110,PT1M50S,hd,False,True,,,3106484,226870,11939
w5pwVn4YSis,CR,2025-12-26 02:28:41.264709+00:00,2025-12-24 17:06:15+00:00,Metí un INDORAPTOR en mi Parque Jurásico,Metí un INDORAPTOR en mi Parque Jurásico,Rubius Z,UCcjIvuxmWlS5IEQ0JdPV4Ng,20,Gaming,"elrubius, rubius, Jurassic World Evolution 3, jurassic park, parque, jurassic world, dinos, dinosaurios, Dinosaurio, Jurassic World, construcción, mundo jurásico, visitantes, crias, simulador, simulator, dino, t rex, velocirraptor, Megalodón, tiburon, capitulo 5, tRex, Tiranosaurio rex, indoraptor, Indominus rex, rex, indominus, modo agresivo, coliseo, tornado, anfiteatro, ep5, indoraptor vs trex, indoraptor vs, meme, memes",37,https://i.ytimg.com/vi/w5pwVn4YSis/hqdefault.jpg,es,es,False,1672,PT27M52S,hd,False,True,,,1028110,57181,2075
_e4CuBY2PvU,CR,2025-12-26 02:28:41.264717+00:00,2025-12-21 21:15:02+00:00,Grupo Firme - El beneficio de la duda (Letra),Grupo Firme - El beneficio de la duda (Letra),Ghostify.,UCgQA23m8tvTQS6xRp3IqBdQ,10,Music,"grupo firme - el beneficio de la duda (letra), grupo firme el beneficio de la duda letra, el beneficio de la duda letra grupo firme, el beneficio de la duda grupo firme letra, grupo firme - el beneficio de la duda, grupo firme el beneficio de la duda (letra), grupo firme beneficio de la duda letra, el beneficio de la duda grupo firme, grupo firme el beneficio de la duda, grupo firme – el beneficio de la duda, grupo firme el beneficio de la duda lyrics",11,https://i.ytimg.com/vi/_e4CuBY2PvU/hqdefault.jpg,es,es,False,246,PT4M6S,hd,False,True,,,328943,710,8
b51C8AbRDGU,CR,2025-12-26 02:28:41.264729+00:00,2025-12-19 23:05:00+00:00,STEEL BALL RUN JoJo’s Bizarre Adventure | Official Trailer | Netflix,STEEL BALL RUN JoJo’s Bizarre Adventure | Official Trailer | Netflix,Netflix Anime,UCBSs9x2KzSLhyyA9IKyt4YA,1,Film & Animation,jojo_anime,1,https://i.ytimg.com/vi/b51C8AbRDGU/hqdefault.jpg,en,en-US,False,130,PT2M10S,hd,False,False,,,3053262,257771,12988
EfAZiepiRzc,CR,2025-12-26 02:28:41.264737+00:00,2025-12-25 22:37:24+00:00,Nos Escondemos de los ANIMATRÓNICOS de FIVE NIGHTS AT FREDDYS en Minecraft...,Nos Escondemos de los ANIMATRÓNICOS de FIVE NIGHTS AT FREDDYS en Minecraft...,Nacho,UC8EkcHOycB94lHDkbAPSnQA,20,Gaming,"nacho, dagar, nacho minecraft, dagar y nacho, nacho y dagar, minecraft, minecraft mod, trucos minecraft, dagar minecraft, base, base minecraft, base secreta minecraft, amigos minecraft, five nights at freddy's, minecraft fnaf, fnaf, freddy, animatronicos, freddy minecraft, escondite, escondite five nights at freddys, animatronicos minecraft, freddy fnaf",23,https://i.ytimg.com/vi/EfAZiepiRzc/hqdefault.jpg,es,es,False,1217,PT20M17S,hd,False,True,,,102469,3034,296
jESFwEelFtI,CR,2025-12-26 02:28:41.264745+00:00,2025-12-24 13:01:38+00:00,Feliz Navidad Villancico 🤶🏻 Los 50 Mejores Villancicos Navideños 🎅 MÚSICA DE FELIZ NAVIDAD 2026,Feliz Navidad Villancico 🤶🏻 Los 50 Mejores Villancicos Navideños 🎅 MÚSICA DE FELIZ NAVIDAD 2026,Feliz Navidad Melodías,UCod0QKeFcbP2y3jGJXSyYYQ,22,People & Blogs,"Feliz Navidad, Feliz Navidad Villancico, Navidad Villancico, Los 50 Mejores Villancicos Navideños, Villancicos Navideños, MÚSICA DE FELIZ NAVIDAD, MÚSICA DE FELIZ NAVIDAD 2026, NAVIDAD, navidad, navidad canciones, villancicos, cancion de navidad, canciones navideñas, canciones de navidad, feliz navidad, musica navideña, mi burrito sabanero, musica navidad, villancicos navideños, villancicos de navidad, rodolfo el reno feliz navidad, feliz navidad villancico",22,https://i.ytimg.com/vi/jESFwEelFtI/hqdefault.jpg,es,en,False,4160,PT1H9M20S,hd,False,True,,,455707,1106,80
xgCxY0qWRC4,CR,2025-12-26 02:28:41.264755+00:00,2025-12-15 13:40:00+00:00,Stranger Things 5 | Tráiler del volumen 2 | Netflix,Stranger Things 5 | Tráiler del volumen 2 | Netflix,Netflix Latinoamérica,UC5ZiUaIJ2b5dYBYGf5iEUrA,24,Entertainment,"Caleb McLaughlin, Charlie Heaton, David Harbour, Dustin, Eleven, Finn Wolfhard, Gaten Matarazzo, Hop, Jamie Campbell Bower, Jim Hopper, Joe Keery, Jonathan Byers, Joyce Byers, Lucas, Max, Maya Hawke, Mike Wheeler, Millie Bobby Brown, Nancy Wheeler, Natalia Dyer, Netflix, Noah Schnapp, Once, Robin Buckley, Sadie Sink, Steve Harrington, Stranger Things, Stranger Things 5, Will Byers, Winona Ryder, volumen 2",31,https://i.ytimg.com/vi/xgCxY0qWRC4/hqdefault.jpg,es,en-US,False,136,PT2M16S,hd,False,False,,,2245758,59670,2272
jrGVErBHfaI,CR,2025-12-26 02:28:41.264763+00:00,2025-12-25 15:00:54+00:00,Pokémon Super P Ep.4 - OS PRESENTO AL DIOS DEL LOCKE,Pokémon Super P Ep.4 - OS PRESENTO AL DIOS DEL LOCKE,Folagor03,UCYcdw2wL6W6iGBKZgGK_Hjw,20,Gaming,"fola, folagor, folagor03",3,https://i.ytimg.com/vi/jrGVErBHfaI/hqdefault.jpg,es,es,False,3399,PT56M39S,hd,False,True,,,111300,19122,1467
qLYGZy3kb_E,CR,2025-12-26 02:28:41.264771+00:00,2025-12-21 19:00:52+00:00,"Grupo Frontera, Fuerza Regida - COQUETA (Letra)","Grupo Frontera, Fuerza Regida - COQUETA (Letra)",SabroSón,UCz-jVF7_acwSvt30vGJRTOw,10,Music,"Grupo Frontera, Fuerza Regida, COQUETA, Coqueta letra, Grupo Frontera Coqueta, Fuerza Regida Coqueta, regional mexicano moderno, norteño urbano, cumbia norteña, corridos suaves, música mexicana actual, colaboración regional, canciones virales regional, tendencia música mexicana, regional 2025, letras regionales, Grupo Frontera nueva canción, Fuerza Regida nuevo tema, hit regional mexicano, regional latino, video lyrics regional, música mexicana moderna, éxito del momento",23,https://i.ytimg.com/vi/qLYGZy3kb_E/hqdefault.jpg,es,es,False,242,PT4M2S,hd,False,True,,,212800,539,14
F7_y4pUuyJw,CR,2025-12-26 02:28:41.264779+00:00,2025-12-15 21:06:11+00:00,Se FILTRA el teaser tráiler de AVENGERS DOOMSDAY - The Top Comics,Se FILTRA el teaser tráiler de AVENGERS DOOMSDAY - The Top Comics,The Top Comics,UCiBwOVBljEjcsLUjwI274Xw,1,Film & Animation,"Doomsday, Avengers, Dr doom, Robert Downey jr, Steve rogers, Capitán américa, Chris Evans, Tony Stark, Thor, Avengers Doomsday",10,https://i.ytimg.com/vi/F7_y4pUuyJw/hqdefault.jpg,es-419,es-419,False,973,PT16M13S,hd,False,True,,,492717,19783,1264
81q638JrjQE,CR,2025-12-26 02:28:41.264788+00:00,2025-12-25 22:10:29+00:00,La ARMADURA MAS RARA de TODO Minecraft 💀 | Farfalands #9,La ARMADURA MAS RARA de TODO Minecraft 💀 | Farfalands #9,Farfadox,UC9_krwU8wTPCZRKaf34QnPw,20,Gaming,,0,https://i.ytimg.com/vi/81q638JrjQE/hqdefault.jpg,es-419,es-419,False,1616,PT26M56S,hd,False,True,,,117664,24638,1369
VG8PGBmhNd4,CR,2025-12-26 02:28:41.264795+00:00,2025-12-22 18:00:39+00:00,"Grupo Firme, Lenin Ramírez - En Tu Perra Vida (Letra/Lyrics)","Grupo Firme, Lenin Ramírez - En Tu Perra Vida (Letra/Lyrics)",Último Sombrero,UCkjmjTu_bVat5P66I35yYpw,22,People & Blogs,"Grupo Firme Lenin Ramírez En Tu Perra Vida letra, Grupo Firme Lenin Ramírez En Tu Perra Vida lyrics, En Tu Perra Vida letra, En Tu Perra Vida lyrics, En Tu Perra Vida Grupo Firme Lenin Ramírez, Grupo Firme letra En Tu Perra Vida, Grupo Firme lyrics En Tu Perra Vida, musica regional, musica regional mexicana, exitos regional, Regional Mexicano, Regional Mexican, musica mexicana, En Tu Perra Vida letra lyrics, Ultimo Sombrero, Último Sombrero, corridos, canciones de despecho",18,https://i.ytimg.com/vi/VG8PGBmhNd4/hqdefault.jpg,es,es,False,239,PT3M59S,hd,False,True,,,152063,463,5
dOOXuifrpvY,CR,2025-12-26 02:28:41.264803+00:00,2025-12-15 19:02:41+00:00,Trailer Oficial Avengers Doomsday I Steve Rogers I filtrado Primer Trailer explicado,Trailer Oficial Avengers Doomsday I Steve Rogers I filtrado Primer Trailer explicado,Somos Geeks,UCaTeVotuSxWGGt9Et3zBpiw,1,Film & Animation,"TheGeeks, Marvel, DC",3,https://i.ytimg.com/vi/dOOXuifrpvY/hqdefault.jpg,es,es-419,False,608,PT10M8S,hd,False,True,,,325920,10716,2313
U1yUytnfkkU,CR,2025-12-26 02:28:41.264810+00:00,2025-12-26 00:34:30+00:00,No debí ENTRAR a esta Fábrica ABANDONADA…,No debí ENTRAR a esta Fábrica ABANDONADA…,RobleisIUTU,UCG8eSYvOQUpb9HM8zU5d6xg,20,Gaming,"robleis, robleisiutu, risa, funny, top, videos graciosos, recopilacion, clips, reaccion, juego, mejores momentos, record, reaccionando, best moments, nueva skin, nueva arma, actualizacion, como mejorar, como ganar, trucos, tips, consejos, fails, si me rio, gameplay, español, terror",27,https://i.ytimg.com/vi/U1yUytnfkkU/hqdefault.jpg,es,es,False,3636,PT1H36S,hd,False,True,,,33816,4341,403
Vb2WNlUyqmo,CR,2025-12-26 02:28:41.264821+00:00,2025-12-25 19:30:09+00:00,Grupo Firme - El Beneficio De La Duda (Letra/Lyrics),Grupo Firme - El Beneficio De La Duda (Letra/Lyrics),Crixara,UCIbksu6tZptEe-sc9jpa6ng,10,Music,"crixara, Grupo Firme, El Beneficio De La Duda, El Beneficio De La Duda letra, El Beneficio De La Duda lyrics, Letra oficial, Lyrics video, Música Mexicana, Regional Mexicano, Banda, Banda Sinaloense, Eduin Caz, Grupo Firme 2025, Éxitos Grupo Firme, Canciones de desamor, Música para dedicar, Letras de canciones, Grupo Firme letra, Eduin Caz letra, Regional Mexicano 2025, Corridos y Banda, Letra de El Beneficio De La Duda, Grupo Firme mix, letra, grupo firme video oficial",25,https://i.ytimg.com/vi/Vb2WNlUyqmo/hqdefault.jpg,es,es,False,246,PT4M6S,hd,False,True,,,17100,97,2
YqdAEdkHrwo,CR,2025-12-26 02:28:41.264829+00:00,2025-12-11 16:59:07+00:00,Supergirl | Official Teaser Trailer,Supergirl | Official Teaser Trailer,DC,UCiifkYAs_bq1pt_zbNAzYGg,24,Entertainment,"DC, DC Comics, DC Universe, DCU, Superman, James Gunn, super heroes, movie, Supergirl, superman 2025, dcu timeline, superman scene, superman krypto, krypto the superdog, lex luthor, krypto, superman 2025 scene, supergirl woman of tomorrow, supergirl scene superman 2025, supergirl cameo superman, supergirl in superman 2025, milly alcock, supergirl, supergirl movie, supergirl 2026, supergirl trailer, supergirl trailer reaction, supergirl trailer breakdown, supergirl milly alcock",29,https://i.ytimg.com/vi/YqdAEdkHrwo/hqdefault.jpg,en,en,False,123,PT2M3S,hd,False,True,,,16259872,380692,21344
2qlOIA583to,CR,2025-12-26 02:28:41.264838+00:00,2025-12-25 20:27:29+00:00,AHORA! 🍪😰 ADMIN ABUSE NAVIDAD🎅🏻🎄 COMPRAMOS 4 BRAINROTS🔥 | EN VIVO🔴,AHORA! 🍪😰 ADMIN ABUSE NAVIDAD🎅🏻🎄 COMPRAMOS 4 BRAINROTS🔥 | EN VIVO🔴,Jugando Con Nachito,UCRL58NXz2qSX2vkbSBxDN2Q,20,Gaming,,0,https://i.ytimg.com/vi/2qlOIA583to/hqdefault.jpg,es,es-419,False,14125,PT3H55M25S,hd,False,True,,,880547,7751,50
zZyVd0xCPEo,CR,2025-12-26 02:28:41.264845+00:00,2025-12-06 18:48:35+00:00,José Feliciano - Feliz Navidad (Letra),José Feliciano - Feliz Navidad (Letra),sweetblue.,UCZdj1MDpyXBPI6nUs_2MZhw,10,Music,"recomendados, sped up, letra en español, lyrics, español, sub español, traducción, tiktok, edit, sweetblue, recomendación, para ti, búsquedas, letra, musica, musica independiente, trend",17,https://i.ytimg.com/vi/zZyVd0xCPEo/hqdefault.jpg,es,zxx,False,183,PT3M3S,hd,False,True,,,2548583,17241,220
Fv0leN8TmR8,CR,2025-12-26 02:28:41.264854+00:00,2025-12-07 00:00:04+00:00,The Boys - Final Season Teaser Trailer | Prime Video,The Boys - Final Season Teaser Trailer | Prime Video,Prime Video,UCQJWtTnAHhEG5w4uN0udnUQ,24,Entertainment,"the boys, the boys season 5, the boys s5, the boys season 5 trailer, the boys season 5 teaser, the boys s5 trailer, the boys s5 teaser, the boys soldier boy, the boys homelander, the boys butcher, homelander, butcher, soldier boy, starlight, hughie, homelander vs butcher, butcher vs homelander, homelander vs soldier boy, the boys final season, the boys final season trailer, antony starr, karl urban, jensen ackles, erin moriarty, jack quaid, chace crawford, jared padalecki",27,https://i.ytimg.com/vi/Fv0leN8TmR8/hqdefault.jpg,en,en,False,121,PT2M1S,hd,True,True,,,8987335,342045,17942
C4XUUqOmb2I,CR,2025-12-26 02:28:41.264862+00:00,2025-12-24 18:56:19+00:00,10 AMIGOS atrapados en UNA GUARDERÍA en Minecraft!,10 AMIGOS atrapados en UNA GUARDERÍA en Minecraft!,Dagar,UCEs5MQjXJq27-X2vgdwtYDw,20,Gaming,"Minecraft, minecraft mod, dagar y nacho, nacho y dagar, amigos minecraft, dagar minecraft, minecraft dagar",7,https://i.ytimg.com/vi/C4XUUqOmb2I/hqdefault.jpg,es,es-ES,False,1459,PT24M19S,hd,False,True,,,599801,7652,900
0C9kgXXsqqs,CR,2025-12-26 02:28:41.264870+00:00,2025-12-23 11:00:03+00:00,Feliz Navidad Villancico 🎁 Los 50 Mejores Villancicos Navideños 🎅 Música De Feliz Navidad 2026,Feliz Navidad Villancico 🎁 Los 50 Mejores Villancicos Navideños 🎅 Música De Feliz Navidad 2026,Gruperos Recuerdos,UCxFcCrNH3tVq8zfujWCJCaw,10,Music,"Feliz Navidad Villancico, Los 50 Mejores Villancicos Navideños, Música De Feliz Navidad 2026, feliz navidad, feliz navidad lyrics, mi burrito sabanero, villancicos de navidad, musica de navidad, villancicos, canciones de navidad, merry christmas, navidad, christmas songs, christmas, christmas music, feliz navidad christmas song, jose feliciano feliz navidad",17,https://i.ytimg.com/vi/0C9kgXXsqqs/hqdefault.jpg,vro,vro,False,5959,PT1H39M19S,hd,False,True,,,435452,2220,82
PkAX6zN7ecw,CR,2025-12-26 02:28:41.264878+00:00,2025-12-25 23:17:35+00:00,🎅BLOOD🎅STRIKE🎅PATROCINADO🎅NAVIDAD🎅,🎅BLOOD🎅STRIKE🎅PATROCINADO🎅NAVIDAD🎅,ElAbrahaham,UColTsB6zogXWooPbeO67Wgw,24,Entertainment,,0,https://i.ytimg.com/vi/PkAX6zN7ecw/hqdefault.jpg,es-MX,es-419,False,7893,PT2H11M33S,hd,False,True,,,249930,11388,400
_slUJooewz0,CR,2025-12-26 02:28:41.264886+00:00,2025-12-20 19:00:10+00:00,Grupo Firme - Ya Supérame (Letra),Grupo Firme - Ya Supérame (Letra),Romantic Music,UCAikEQFivbLARwcKgubVjLg,10,Music,"Grupo firme, Ya Supérame, Grupo Firme Letra, Ya Supérame letra, Grupo Firme Ya Supérame, Grupo Firme Ya Supérame letra, Letra Grupo Firme Ya Supérame",7,https://i.ytimg.com/vi/_slUJooewz0/hqdefault.jpg,es,es,False,202,PT3M22S,hd,False,True,,,174185,523,4
jBpvfBuC1WA,CR,2025-12-26 02:28:41.264893+00:00,2025-12-24 15:00:11+00:00,NUNCA JUEGUES GRANNY EN NAVIDAD !!,NUNCA JUEGUES GRANNY EN NAVIDAD !!,Iker Unzu,UCQW8tWGYajwUv6jdQ2kmsRw,20,Gaming,"granny, granny horror, granny navidad, granny christmas, granny terror game, granny gameplay, granny español, escape granny, granny santa, casa de granny, slendrina, slendrina granny, abuela asesina, juego de terror, terror navideño, christmas horror, spooky christmas, scary granny, granny jumpscare, granny update, granny challenge, granny winter, granny snow, granny creepy, granny nightmare, granny story, iker unzu, risa, gracioso, humor, iker, granola, granolo",33,https://i.ytimg.com/vi/jBpvfBuC1WA/hqdefault.jpg,es,es,False,2097,PT34M57S,hd,False,True,,,1033407,55341,21655
ixmUNI-Du5I,CR,2025-12-26 02:28:41.264902+00:00,2025-12-24 20:00:42+00:00,Romeo Santos - La Diabla,Romeo Santos - La Diabla,Top Squad,UC5iD7k7-75a-ahOA34vg8Hg,10,Music,,0,https://i.ytimg.com/vi/ixmUNI-Du5I/hqdefault.jpg,en,es,False,240,PT4M,hd,False,True,,,71175,101,0
xAAAMMZcvc8,CR,2025-12-26 02:28:41.264908+00:00,2025-12-25 22:03:37+00:00,🔴HOY VIENE EVO ROTÍSIMA Y EQUIPO 2 DE WINTER (TRABAJANDO EN NAVIDAD) DIRECTO EA FC 26 - DjMaRiiO,🔴HOY VIENE EVO ROTÍSIMA Y EQUIPO 2 DE WINTER (TRABAJANDO EN NAVIDAD) DIRECTO EA FC 26 - DjMaRiiO,DjMaRiiO,UCi7TVXyvrIwqeS9tfYD8UDA,20,Gaming,"djmariio, djmario, djmarrio, djmarioo, dj, mario, mariio, fut, fifa, futdraft, draft, plantilla, discard, challenge, pack, opening, handicap, pc, español, trucos, spain, spanish, el camino, MODO HISTORIA, PS5, PS4, ea sports fc, kings league, kings league oficial, ultimate mostoles, fc 25 modo carrera, fifa 25 modo carrera, fc 25 ultimate team, fc 25 gratis, fc 25 nintento switch, fut 25, fifa 25, 25, ea sports fc 25, fifa 25 ps4, fc 25 ps4, fc 25 djmariio, fc 26, ea sports fc 26, la cobra, debates",46,https://i.ytimg.com/vi/xAAAMMZcvc8/hqdefault.jpg,es,es,False,14202,PT3H56M42S,hd,False,True,,,80107,1944,6
ta4KAXDxsx0,CR,2025-12-26 02:28:41.264917+00:00,2025-12-18 10:07:11+00:00,Wham! - Last Christmas (Japanese Lyrics),Wham! - Last Christmas (Japanese Lyrics),WhamVEVO,UCm1QnxCbcLB8fQwoTDk39iQ,10,Music,"Empowered, Festive, Happy, Last Christmas, Nostalgic, Pop, Single, Throwback, Wham!",9,https://i.ytimg.com/vi/ta4KAXDxsx0/hqdefault.jpg,ja,en,False,279,PT4M39S,hd,False,True,,,2275979,7307,295
g4eFKhKnSbY,CR,2025-12-26 02:28:41.264925+00:00,2025-12-25 01:51:01+00:00,FORTNITE SKIN REVEAL!  🕺⛏️ NOT ENDING UNTIL I WIN,FORTNITE SKIN REVEAL!  🕺⛏️ NOT ENDING UNTIL I WIN,IShowSpeed,UCWsDFcIhY2DBi3GB5uykGXA,20,Gaming,ishowspeed,1,https://i.ytimg.com/vi/g4eFKhKnSbY/hqdefault.jpg,en,en,False,9671,PT2H41M11S,hd,False,True,,,1903884,79278,1905
gZpXDTV1bIM,CR,2025-12-26 02:28:41.264933+00:00,2025-12-23 17:00:06+00:00,"Ryan Castro, Kapo - LA VILLA (Letra)","Ryan Castro, Kapo - LA VILLA (Letra)",Latin Love,UCcXifH1pPqzadvzmTBI4Zsg,10,Music,"latin, latinLove, Latin Love, Letra, Lyrics, Ryan Castro, Kapo, LA VILLA (Letra), LA VILLA, Kapo - LA VILLA (Letra)",10,https://i.ytimg.com/vi/gZpXDTV1bIM/hqdefault.jpg,es,es,False,193,PT3M13S,hd,False,True,,,91804,470,1
zsCLVH1Vm0c,CR,2025-12-26 02:28:41.264940+00:00,2025-12-25 16:01:38+00:00,ESTE FUE MI REGALO DE NAVIDAD🥺,ESTE FUE MI REGALO DE NAVIDAD🥺,BENIJU,UC3fwcYRn_kq5xs4OP1ZiLkw,20,Gaming,"Clash Royale, Clash Royale Español, BENIJU, beniju, subir copas, guia de mazos, mejores mazos, beniyu, bniju, benju, TV ROYALE, TV ROYALE EN ESPAÑOL, JEFA BANDIDA, VERDUGO EVO, NUEVA EVO, NUEVA ACTU, CLASH ACTU, ken, tv royale, tv royale en español, nueva carta, nueva evo, modo ranked, 67, heroes, nuevo desafio",26,https://i.ytimg.com/vi/zsCLVH1Vm0c/hqdefault.jpg,es,es,False,1294,PT21M34S,hd,False,True,,,155293,9697,262
-DnZhLIsotk,CR,2025-12-26 02:28:41.264948+00:00,2025-12-23 11:30:00+00:00,Feliz Navidad Villancico ❄️🤶🏻 Los 50 Mejores Villancicos Navideños 🎄🎅 MÚSICA DE FELIZ NAVIDAD 2026,Feliz Navidad Villancico ❄️🤶🏻 Los 50 Mejores Villancicos Navideños 🎄🎅 MÚSICA DE FELIZ NAVIDAD 2026,Cozy Jazz Outdoor,UCrHspz-x7XY8m9q2pPW-djg,10,Music,"Las Mejores Canciones Navidad 2026, Música de Navidad en Español, Feliz Navidad 2026, musica de navidad, feliz navidad, canciones de navidad, musica navidena, canciones navidenas, viejitas pero bonitas edicion navidena, feliz navidad 2025, feliz navidad 2026, musica de navidad 2026, musica de navidad en espanol, clasicos de navidad, mejores villancicos navidenos, villancicos navidenos",16,https://i.ytimg.com/vi/-DnZhLIsotk/hqdefault.jpg,aa,vro,False,6011,PT1H40M11S,hd,False,True,,,981102,3064,168
hzvGDWYTcjE,CR,2025-12-26 02:28:41.264957+00:00,2025-12-25 18:00:52+00:00,CARRERA ESPECIAL FELIZ NAVIDAD!! - GTA 5 ONLINE,CARRERA ESPECIAL FELIZ NAVIDAD!! - GTA 5 ONLINE,DaniRep | +6 Vídeos Diarios De GTA 5 Online!,UCHIwQiZhIn6fm5b_IilqBbQ,20,Gaming,"danirep, gta v, gta 5 online, mega rampa, carrera gta 5 online, carrera troll, todos contra mi, cara a cara",8,https://i.ytimg.com/vi/hzvGDWYTcjE/hqdefault.jpg,es,es-ES,False,1269,PT21M9S,hd,False,True,,,75108,6120,355
