video_id,country,fetched_at,published_at,title,localized_title,channel_title,channel_id,category_id,category_name,tags,tag_count,thumbnail,default_language,audio_language,is_live,duration,duration_raw,definition,caption_available,licensed_content,embeddable,made_for_kids,views,likes,comments
_Y01acxLFNQ,VE,2026-05-11T04:44:35.249848+00:00,2026-05-08T23:00:48Z,Canciones Día De Las Madres,Canciones Día De Las Madres,Codiscos,UCMt4GuchIJh48XJFB3iyXQQ,10,Music,"día de las madres, canciones día de las madres, canciones para mamá, música para mamá, serenata para mamá, los caminos de la vida, canciones dedicadas a la madre, música para dedicar a mamá, canciones tristes para mamá, homenaje a las madres, música del recuerdo, boleros para mamá, vallenato para mamá, mix día de la madre, canciones clásicas para mamá, madre querida canciones, música tropical romántica, canciones del recuerdo, feliz día de las madres",19,https://i.ytimg.com/vi/_Y01acxLFNQ/hqdefault.jpg,es,es-419,False,2528,PT42M8S,hd,False,True,False,False,640479,3248,57
zJiwHD3Yfnc,VE,2026-05-11T04:44:35.249890+00:00,2026-05-10T19:55:00Z,Mi Reacción al Trailer de Garou Cósmico en Los Campos de Batalla más Fuertes,Mi Reacción al Trailer de Garou Cósmico en Los Campos de Batalla más Fuertes,SoyBlecus,UCAhElWO4uKNowk3c7cvTYmw,20,Gaming,"the strongest battlegrounds, the strongest battlegrounds roblox, los campos de batalla mas fuertes, los campos de batalla mas fuertes roblox, los campos de batalla mas fuertes momentos divertidos, blecus, beclus, belcus, soyblecus, soybeclus, soybelcus, tsb, tsbg, tsb update, update tsb, the strongest battlegrounds update, actualizacion los campos de batalla mas fuertes, cosmic garou, garou cosmico, tsb garou cosmico, tsb cosmic garou, tsb trailer, trailer tsb",23,https://i.ytimg.com/vi/zJiwHD3Yfnc/hqdefault.jpg,es,es,False,558,PT9M18S,hd,False,True,False,False,118272,8202,844
jv7AENnC6Ng,VE,2026-05-11T04:44:35.249903+00:00,2026-05-10T18:20:40Z,Sobrevivimos 100 Días en la GUERRA en Minecraft!,Sobrevivimos 100 Días en la GUERRA en Minecraft!,Nacho,UC8EkcHOycB94lHDkbAPSnQA,20,Gaming,"nacho, dagar, nacho minecraft, dagar y nacho, nacho y dagar, minecraft, minecraft mod, trucos minecraft, dagar minecraft, amigos minecraft, fbi, fbi minecraft, agentes del fbi, policia, nacho y dagar policia, policia minecraft, swat, swat minecraft, Ejercito, Ejercito Minecraft, ejercito vs swat, militares, militar minecraft, guerra minecraft",24,https://i.ytimg.com/vi/jv7AENnC6Ng/hqdefault.jpg,es,es,False,1334,PT22M14S,hd,False,True,False,False,578496,9245,491
7SchgH74bQE,VE,2026-05-11T04:44:35.249913+00:00,2026-05-06T16:45:06Z,Amor Eterno - Rocío Dúrcal (Letra),Amor Eterno - Rocío Dúrcal (Letra),Eternal ILY,UCcHy8KcK-O2vepvsLyA8ZyA,22,People & Blogs,,0,https://i.ytimg.com/vi/7SchgH74bQE/hqdefault.jpg,es,es,False,410,PT6M50S,hd,False,True,False,False,91564,301,12
WtePGw_uKos,VE,2026-05-11T04:44:35.249921+00:00,2026-05-10T00:26:46Z,¿Por qué promocionan las películas para niños así ahora? La controversia de Minions 3,¿Por qué promocionan las películas para niños así ahora? La controversia de Minions 3,Helado Oscuro EF,UCIUDbaAbJG_Ve1jFLGOvipA,1,Film & Animation,"minions 3 trailer, minions 3 teaser trailer, minions trailer, minions & monsters trailer, minions 3 teaser, minions 3, minions & monsters traile, minions and monsters trailer, trailer minions and monsters, minions & monster trailer, minions official trailer, minions & monsters final trailer, minions and monsters trailer 2026, minions & monsters trailer german, minions & monsters trailer deutsch, minions & monsters official trailer",16,https://i.ytimg.com/vi/WtePGw_uKos/hqdefault.jpg,es,es,False,903,PT15M3S,hd,False,True,False,False,196219,9787,743
jKOoyZzO6jg,VE,2026-05-11T04:44:35.249930+00:00,2026-05-10T15:14:48Z,Me Convertí en PERRO ÁNGEL para Conseguir las MEJORES ALAS en Roblox!,Me Convertí en PERRO ÁNGEL para Conseguir las MEJORES ALAS en Roblox!,Dagar Roblox,UCmkyN2GfMyR7gsIiKBCR3nw,20,Gaming,"roblox, roblox dagar, roblox nacho, nacho y dagar, dagar y nacho",5,https://i.ytimg.com/vi/jKOoyZzO6jg/hqdefault.jpg,es,es,False,1417,PT23M37S,hd,False,True,False,False,281963,4236,220
DedlBFdJBqY,VE,2026-05-11T04:44:35.249938+00:00,2026-05-06T16:00:06Z,Alejandro Fernández - Mátalas (Letra / Lyrics),Alejandro Fernández - Mátalas (Letra / Lyrics),Luis Jams,UCYQhU-86MD7ZWjGyuzyPgvw,10,Music,"sub español, subtitulada al español, traducida al español, traducción, traducido, subtítulos, subtitulado, letra, lyrics, hq, hd, topic, alejandro fernández, mátalas, niña amada mía, álbum, 2003",17,https://i.ytimg.com/vi/DedlBFdJBqY/hqdefault.jpg,es,es,False,178,PT2M58S,hd,False,True,False,False,26974,76,2
6t2nDHldoSk,VE,2026-05-11T04:44:35.249946+00:00,2026-05-09T15:03:51Z,Subnautica 2 Early Access Gameplay Trailer,Subnautica 2 Early Access Gameplay Trailer,Subnautica,UCx2StD8gHd_-nRo5z1qcJ8g,20,Gaming,,0,https://i.ytimg.com/vi/6t2nDHldoSk/hqdefault.jpg,en,en-US,False,99,PT1M39S,hd,True,False,False,False,1406977,69034,3403
RWKti8kmvaQ,VE,2026-05-11T04:44:35.249954+00:00,2026-05-10T16:33:07Z,"Parkour Espiral, pero con MODS DE TERROR","Parkour Espiral, pero con MODS DE TERROR",Rubius Z,UCcjIvuxmWlS5IEQ0JdPV4Ng,20,Gaming,"elrubius, rubius, parkour, minecraft parkour, spiral map, spiral parkour, parkour spiral minecraft, spiral minecraft, nuevo, 2026, rubius spiral map, mapa spiral minecraft, terror, mod, Minecraft terror, parkour terror, MC, mc terror, horror, parcur, Parkour Spiral, Hielke, mod terror, meme, memes, tiktok, steve, miedo",28,https://i.ytimg.com/vi/RWKti8kmvaQ/hqdefault.jpg,es,es,False,1722,PT28M42S,hd,False,True,False,False,944328,86591,2696
yv3-NOf5EbU,VE,2026-05-11T04:44:35.249963+00:00,2026-05-09T19:15:06Z,Quita Novio 🤭 (Video Oficial) La Chakalita,Quita Novio 🤭 (Video Oficial) La Chakalita,La Nueva Chakalita ,UCLxczbK14IstVjJONEA5p1w,10,Music,"Free Fire, Garena free Fire, Angi fire, La chakalita, la pelo en pausa, kabrita, tilín insano, rompe corazones Angi Fire ft la pelo en pausa, la villana, gordita, música, canción, planeta alofoke, tendencia, 2026",15,https://i.ytimg.com/vi/yv3-NOf5EbU/hqdefault.jpg,es,es,False,94,PT1M34S,hd,False,True,False,False,257566,7592,2591
laMKk4H71-o,VE,2026-05-11T04:44:35.249971+00:00,2026-05-09T18:36:52Z,Un ACOSADOR Nos Persigue en Minecraft!,Un ACOSADOR Nos Persigue en Minecraft!,Dagar,UCEs5MQjXJq27-X2vgdwtYDw,20,Gaming,"Minecraft, minecraft mod, dagar y nacho, nacho y dagar, amigos minecraft, dagar minecraft, minecraft dagar",7,https://i.ytimg.com/vi/laMKk4H71-o/hqdefault.jpg,es,es,False,1304,PT21M44S,hd,False,True,False,False,1270874,18002,1283
AmmsouOuaPU,VE,2026-05-11T04:44:35.249979+00:00,2026-05-07T19:00:06Z,"Darell, Brytiago - Velitas [Letra/Lyrics]","Darell, Brytiago - Velitas [Letra/Lyrics]",Urbanmx Ly,UCmqvmody8coD66gDR_tpQbw,22,People & Blogs,"Darell, Velitas, Música con Letra, Latin, Reguetón",5,https://i.ytimg.com/vi/AmmsouOuaPU/hqdefault.jpg,es,es,False,226,PT3M46S,hd,False,True,False,False,22098,45,0
1wiYdw1Q5Tg,VE,2026-05-11T04:44:35.249987+00:00,2026-05-10T17:20:42Z,Tenemos que OPERAR de URGENCIA a MANDARINA en Brookhaven Roblox,Tenemos que OPERAR de URGENCIA a MANDARINA en Brookhaven Roblox,Lyna,UC-cnbLlplnXA4oc7rR21qzg,20,Gaming,,0,https://i.ytimg.com/vi/1wiYdw1Q5Tg/hqdefault.jpg,es-419,es-419,False,949,PT15M49S,hd,False,True,False,False,399233,6933,646
AXE2v-UsnXk,VE,2026-05-11T04:44:35.249995+00:00,2026-05-07T00:30:09Z,Blessd - NUEVA YORK (LETRA),Blessd - NUEVA YORK (LETRA),RadioReggaeton,UC71_qiSYe3CFuI9Jd4eWW4A,10,Music,"Reggaetón, Música Nueva, Tendencias, Musica, Musica Urbana, Video letra",6,https://i.ytimg.com/vi/AXE2v-UsnXk/hqdefault.jpg,es-419,es-419,False,213,PT3M33S,hd,False,True,False,False,173737,188,3
bIdASSMFQgk,VE,2026-05-11T04:44:35.250003+00:00,2026-05-10T21:00:28Z,Me Convertí en BOLA Gigante para Trollear a Mis Amigos en Minecraft,Me Convertí en BOLA Gigante para Trollear a Mis Amigos en Minecraft,DanoMC,UCayC0ZYU9iq5PyuDG18BVsA,20,Gaming,"minecraft, minecraft pero, Me Convertí en BOLA Gigante, Me Convertí en BOLA, bola minecraft, danomc, dano, mc, dano mc, keciyo, keciyomc, superkeciyo, nikimc, danomc bola, danomc bola gigante, minecraft bola, me converti en bola, minecraft bola danomc, danomc trolleos, danomc trolea a keciyo, danomc trolleo bola, minecraft survival, minecraft troll, danomc trolllea a sus amigos, minecraft de terror, minecraft funny, keciyo minecraft, danomc y sus amigos, minecraft trolleo",29,https://i.ytimg.com/vi/bIdASSMFQgk/hqdefault.jpg,es-ES,es-ES,False,1329,PT22M9S,hd,False,True,False,False,154454,3081,284
tc2BuePwjk8,VE,2026-05-11T04:44:35.250012+00:00,2026-05-07T21:30:09Z,Juan Gabriel - Amor Eterno (Letra),Juan Gabriel - Amor Eterno (Letra),Keller MX,UCB8_0QUp1PMLEi6DRiGn_Ng,10,Music,"Amor Eterno, Juan Gabriel, Juan Gabriel Amor Eterno, Amor Eterno En Vivo, Amor Eterno Letra, Amor Eterno Lyrics, Letra Amor Eterno, Balada Romantica, Regional Mexicano, Ranchera Romantica, Musica Mexicana, Musica Latina, Juan Gabriel Exitos, Canciones de Amor, Canciones Tristes, Homenaje a Mamá, Cancion para Dedicar, Baladas en Español, Clasicos Mexicanos, Clasicos Latinos, Nostalgia Mexicana, Video con Letra, Letra Oficial, Cancion Clasica, Juan Gabriel Canciones",25,https://i.ytimg.com/vi/tc2BuePwjk8/hqdefault.jpg,es,es,False,423,PT7M3S,hd,False,True,False,False,50321,212,8
IOeea9fH3K8,VE,2026-05-11T04:44:35.250020+00:00,2026-05-10T21:42:23Z,TU Sobrevives al GLITCH en Minecraft,TU Sobrevives al GLITCH en Minecraft,Awita,UC62nFXtc3KNujp9LCPJt-sA,20,Gaming,,0,https://i.ytimg.com/vi/IOeea9fH3K8/hqdefault.jpg,es,es-419,False,1430,PT23M50S,hd,False,True,False,False,269423,7462,1036
jexLZnOwhwc,VE,2026-05-11T04:44:35.250028+00:00,2026-05-05T10:01:15Z,Six Seven,Six Seven,Laurinha Costa - Topic,UCdD41_dKO0oqHBZS2ZjPQxQ,10,Music,"Laurinha Costa, Six Seven",2,https://i.ytimg.com/vi/jexLZnOwhwc/hqdefault.jpg,en,en,False,101,PT1M41S,hd,False,True,False,False,808649,9401,284
H7Ntr4rm0XA,VE,2026-05-11T04:44:35.250036+00:00,2026-05-10T22:00:06Z,USE EL CABALLO DE FREE FIRE POR PRIMERA VEZ y GANE !! - TheDonato,USE EL CABALLO DE FREE FIRE POR PRIMERA VEZ y GANE !! - TheDonato,TheDonato,UCaHEdZtk6k7SVP-umnzifmQ,20,Gaming,,0,https://i.ytimg.com/vi/H7Ntr4rm0XA/hqdefault.jpg,es,es,False,907,PT15M7S,hd,False,True,False,False,202509,11333,398
FdoiMppABUM,VE,2026-05-11T04:44:35.250044+00:00,2026-05-04T21:00:06Z,"Maluma, Bad Bunny, Arcángel, Ñengo Flow, De La Ghetto - UN POLVO (Letra)","Maluma, Bad Bunny, Arcángel, Ñengo Flow, De La Ghetto - UN POLVO (Letra)",Melodix,UC39c6lyW91RaT5CJipWY8xQ,10,Music,"Música romántica, Canciones de amor, Baladas románticas, Éxitos románticos, Música para dedicar, Baladas de amor, Canciones románticas en español, Música para parejas, Música de amor, Música tranquila, Canciones de desamor, Baladas clásicas, Romantic music, Love songs, Romantic ballads, Music for lovers, Romantic hits, Music to dedicate, Love ballads, Romantic songs in Spanish, Music for couples, Love music, Songs to fall in love, Relaxing music",24,https://i.ytimg.com/vi/FdoiMppABUM/hqdefault.jpg,es,es,False,307,PT5M7S,hd,False,True,False,False,165283,250,5
DdZRqHWUQpc,VE,2026-05-11T04:44:35.250053+00:00,2026-05-10T00:12:31Z,BAJÉ A LOS BACKROOMS EN ROBLOX,BAJÉ A LOS BACKROOMS EN ROBLOX,FedeGames,UCsYQxZGPAUz-QrMfaXePouQ,20,Gaming,"minecraft, videos de juegos, juegos, gameplays, fede games, fede gameplays, videos de minecraft, vecibanda, fede y sus vecinos, fede vigevani, federico vigevani, vecinos minecraft, videojuegos, backrooms, roblox mini mini, bajé a los backrooms",16,https://i.ytimg.com/vi/DdZRqHWUQpc/hqdefault.jpg,es,es,False,1032,PT17M12S,hd,False,True,False,False,3742655,110260,8208
--mFu9aFvPE,VE,2026-05-11T04:44:35.250061+00:00,2026-05-04T17:00:06Z,Los Hijos de Puerto Rico - Separados (Letra),Los Hijos de Puerto Rico - Separados (Letra),Mix Sabrosura,UCZYpPtT3X566MCx2kIvqmjg,22,People & Blogs,,0,https://i.ytimg.com/vi/--mFu9aFvPE/hqdefault.jpg,es,es,False,319,PT5M19S,hd,False,False,False,False,67770,198,3
Caxv8tLATnc,VE,2026-05-11T04:44:35.250069+00:00,2026-05-09T16:00:15Z,"Escape 50 Pros, Win $50,000","Escape 50 Pros, Win $50,000",MrBeast Gaming,UCIPPMRA040LQr5QPyJEbmXA,20,Gaming,,0,https://i.ytimg.com/vi/Caxv8tLATnc/hqdefault.jpg,en,en,False,1137,PT18M57S,hd,True,True,False,False,10561401,299768,13719
l2KzK_CYpPc,VE,2026-05-11T04:44:35.250076+00:00,2026-05-06T18:00:06Z,Kany García - Confieso (Letra / Lyrics),Kany García - Confieso (Letra / Lyrics),beats and beats,UCl8zIsdXIVvYOZDMCgwZVFw,10,Music,"sub español, traducida al español, subtitulada al español, traducción, letra, subtitulada, traducciones, translations, beats and beats, Tiktok, Kany García Confieso",11,https://i.ytimg.com/vi/l2KzK_CYpPc/hqdefault.jpg,es,es,False,225,PT3M45S,hd,False,True,False,False,80269,306,5
9GHY-gkTCoE,VE,2026-05-11T04:44:35.250084+00:00,2026-05-10T23:22:11Z,Construí Una SUPER MEGA CASA del ARBOL con MIS AMIGOS en Minecraft!,Construí Una SUPER MEGA CASA del ARBOL con MIS AMIGOS en Minecraft!,Jardred,UCyDUULOp3b3JsehZKIIVzrg,20,Gaming,,0,https://i.ytimg.com/vi/9GHY-gkTCoE/hqdefault.jpg,es,es,False,1421,PT23M41S,hd,False,True,False,False,89175,4848,470
DQ0OsTxWuA4,VE,2026-05-11T04:44:35.250092+00:00,2026-05-07T22:00:30Z,"Día De La Madre, Serenata A Mi Madre, Música Vieja, Música Colombiana","Día De La Madre, Serenata A Mi Madre, Música Vieja, Música Colombiana",Fiesta Tropical ,UC8vajvVGuPEsss21YJGGwNQ,10,Music,"música tropical, Codiscos, tropicales clásicos, éxitos tropicales, canciones tradicionales, música tropical Codiscos, clásicos tropicales, día de la madre, canciones para mamá, música para el día de la madre, serenata día de la madre, fiesta tropical, canciones dedicadas a la madre, música para dedicar a mamá, música del recuerdo, boleros para mamá, música vieja para mamá, serenata de madres, homenaje a las madres, canciones para recordar a mamá, canciones del recuerdo",21,https://i.ytimg.com/vi/DQ0OsTxWuA4/hqdefault.jpg,es,es,False,3341,PT55M41S,hd,False,True,False,False,64840,686,11
2AmtgcF_Kz8,VE,2026-05-11T04:44:35.250100+00:00,2026-05-10T17:07:15Z,ME CONVERTÍ EN EL MEJOR TAXI EN BROOKHAVEN,ME CONVERTÍ EN EL MEJOR TAXI EN BROOKHAVEN,SoyWelix,UCEc6kZNBV0WAKV5GZlLLgwA,22,People & Blogs,,0,https://i.ytimg.com/vi/2AmtgcF_Kz8/hqdefault.jpg,es,es,False,726,PT12M6S,hd,False,True,False,False,87276,1881,122
lJ0s_LhB4Jk,VE,2026-05-11T04:44:35.250107+00:00,2026-05-08T00:00:06Z,Franyer Gómez - Plegarias Para Mi Madre (Video Oficial),Franyer Gómez - Plegarias Para Mi Madre (Video Oficial),Franyer Gomez,UC6_fMSFuO4TFD0DZedNGw_Q,10,Music,"Plegarias para mi madre, franyer gomez, franyer gomez video oficial, franyer gomez plegarias para mi madre, mi madre, feliz dia de la madre, dia de la madre, plegarias para mi madre franyer gomez, franyer gomez plegarias para mi madre video oficial, Franyer Gómez, Franyer Gómez Plegarias para mi madre, Plegarias para mi madre Franyer Gómez, video oficial de franyer Gomez, franyer gomez videos oficiales",14,https://i.ytimg.com/vi/lJ0s_LhB4Jk/hqdefault.jpg,es,es,False,252,PT4M12S,hd,False,True,False,False,6779,95,8
iZVh3MGg2OI,VE,2026-05-11T04:44:35.250115+00:00,2026-05-10T11:11:53Z,💖 40 Grandes Éxitos de Diomedes Díaz 🎶 | Lo Mejor del Vallenato #vallenato,💖 40 Grandes Éxitos de Diomedes Díaz 🎶 | Lo Mejor del Vallenato #vallenato,Corridos con Destino,UCXy4moInwkMEizd2gqknlCQ,10,Music,"exitos diomedes, canciones diomedes, vallenato diomedes, Mi Primera Cana, 26 De Mayo, Amarte Más No Pude, Mi Muchacho, Título de Amor, Los Recuerdos De Ella, El Condor Herido, El Regreso Del Condor, Tres Canciones, Tu Serenata, Tu Cumpleaños, Tu Eres La Reina, Sin Medir Distancias, Si Te Vas Te Olvido, 40 grandes exitos diomedes diaz, grandes exitos diomedes diaz, exitos diomedes diaz, exitos diomedes diaz mix, Diomedes Díaz, Audio, 40 Grandes Éxitos, Te Necesito",25,https://i.ytimg.com/vi/iZVh3MGg2OI/hqdefault_live.jpg,es,ase,False,5038,PT1H23M58S,sd,False,True,False,False,15480,53,4
IBIOLEu1Llc,VE,2026-05-11T04:44:35.250124+00:00,2026-05-03T20:00:10Z,Paulo Londra - Adan y Eva (Letra),Paulo Londra - Adan y Eva (Letra),Sonalux,UC4t5Ht7gCo89-2r47qhdfzg,10,Music,,0,https://i.ytimg.com/vi/IBIOLEu1Llc/hqdefault.jpg,es,es,False,258,PT4M18S,hd,False,True,False,False,156698,300,9
Py_qLWM-Dxk,VE,2026-05-11T04:44:35.250131+00:00,2026-05-10T20:05:00Z,ME HICIERON UN VIDEO TIRANDOME HATE!😡,ME HICIERON UN VIDEO TIRANDOME HATE!😡,ElAbrahaham,UColTsB6zogXWooPbeO67Wgw,20,Gaming,"abrahahamflores, stream, entretenimiento, divertido, risa, gracioso, gamer, videojuegos, elabrahaham, copilacion, videos graciosos, antes vs ahora, mexico vs usa, abrahaham, directos, shorts, tiktoks, streams, twitch, reaccion, reacciones",21,https://i.ytimg.com/vi/Py_qLWM-Dxk/hqdefault.jpg,es-MX,es-419,False,1459,PT24M19S,hd,False,True,False,False,354697,23318,4241
L-5RxDusFx0,VE,2026-05-11T04:44:35.250139+00:00,2026-05-08T14:18:47Z,Rocío Dúrcal - Como Tu Mujer (Letra/Lyrics),Rocío Dúrcal - Como Tu Mujer (Letra/Lyrics),FirePlay,UCJxtNdTGIIaHEljCDo27b_w,10,Music,"Rocío Dúrcal, Como Tu Mujer, Rocio Durcal, Rocio Durcal Como Tu Mujer, Rocio Durcal - Como Tu Mujer, Rocío Dúrcal - Como Tu Mujer, como tu mujer letra, como tu mujer rocio durcal, como tu mujer rocio durcal letra, letra como tu mujer, rocio durcal letra, como tu mujer - rocio durcal, rocio durcal como tu mujer lyrics, como tu mujer lyrics, letra, lyrics, como tu mujer letra rocio durcal, rocio durcal como tu mujer en vivo, lyrics video, mexican music, latin, mariachi, pop",23,https://i.ytimg.com/vi/L-5RxDusFx0/hqdefault.jpg,es,en,False,264,PT4M24S,hd,True,True,False,False,14745,69,0
d47T7YsyOVo,VE,2026-05-11T04:44:35.250148+00:00,2026-05-10T21:22:25Z,DESMENTI 15 MITOS SECRETOS DE DARK PALS: THE 1ST FLOOR | JONDRES GC,DESMENTI 15 MITOS SECRETOS DE DARK PALS: THE 1ST FLOOR | JONDRES GC,Jondres Gc,UCEtD_nOAZeTzb5dcln-ljOA,24,Entertainment,"JONDRES, JONDRES GC, CHOMPY, BINKY DRINKY, BALOONY, DESMENTI 15 MITOS SECRETOS DE DARK PALS: THE 1ST FLOOR, DESMENTI 15 MITOS SECRETOS DE DARK PALS, DESMENTI 15 MITOS SECRETOS, SALVO AL PERRITO CHOMPY Y ENCONTRE 15 MITOS SECRETOS DE DARK PALS, SALVÉ A CHOMPY Y ENCONTRÉ 15 MITOS SECRETOS DE DARK PALS, DESMENTI 15 MITOS, 15 MITOS SECRETOS, DARK PALS: THE 1ST FLOOR, DARK PALS, PUEDO SALVAR A CHOMPY EN DARK PALS?, SALVO AL PERRITO CHOMPY EN DARK PALS, SALVAMOS A CHOMPY EN DARK PALS",17,https://i.ytimg.com/vi/d47T7YsyOVo/hqdefault.jpg,es,es-419,False,2004,PT33M24S,hd,False,True,False,False,113898,5539,324
blA3nLLg5Ks,VE,2026-05-11T04:44:35.250156+00:00,2026-05-03T14:12:06Z,Ariis - GOZALO (Slowed),Ariis - GOZALO (Slowed),Mikoryn,UC1XGGW2kGw-ntqzXNGBVZ4w,10,Music,"Mikoryn, Music, Mikoryn Music, ariis - gozalo slowed, ariis - gozalo [ slowed ], gozalo - ariis slowed, ariis - gozalo (slowed), ariis - gozalo (ultra slowed), ariis gozalo slowed, gozalo slowed ariis, gozalo - ariis (slowed), gozalo ariis slowed, ariis - gozalo (slowed) [lyrics], ariis gozalo super slowed, ariis gozalo slowed phonk, ariis gozalo slowed lyrics, ariis gozalo ultra slowed, gozalo ultra slowed ariis, ariis gozalo (slowed), gozalo ariis (slowed), slowed, sped up, edm",23,https://i.ytimg.com/vi/blA3nLLg5Ks/hqdefault.jpg,en,en,False,121,PT2M1S,hd,False,True,False,False,683896,3692,44
zW6rEUMdmT8,VE,2026-05-11T04:44:35.250164+00:00,2026-05-10T17:00:06Z,¡ME FUI DE VACACIONES MUY TURBIAS! | Roblox Compilación #roblox #brookhaven,¡ME FUI DE VACACIONES MUY TURBIAS! | Roblox Compilación #roblox #brookhaven,May Belle,UCiNDvEUc2nwggE15lBViTGQ,24,Entertainment,"Roblox, Historias de Roblox, Roleplay de Roblox, RP de Roblox, Gameplay de Roblox, Aventuras en Roblox, Juegos de Roblox, Brookhaven Roblox, Historias de Brookhaven, Roleplay de Brookhaven, RP de Brookhaven, Aventuras en Brookhaven, Gameplay de Brookhaven, Actualizaciones de Brookhaven, Misterios de Brookhaven, Episodios de Roblox, Historias familiares de Roblox, Cuentos para niños de Roblox, Gameplay de BloxFruits, Aventura en BloxFruits, bloxfruis, roleplay, shorts, viral, hytale",25,https://i.ytimg.com/vi/zW6rEUMdmT8/hqdefault.jpg,es,es-MX,False,2079,PT34M39S,hd,False,True,False,False,78342,2432,58
A6ZiEMXMK0w,VE,2026-05-11T04:44:35.250172+00:00,2026-05-08T00:00:06Z,Alleh - DesOrden (Visualizer),Alleh - DesOrden (Visualizer),Alleh,UCXMPFndIQUc0uOkC9qgHEVQ,10,Music,,0,https://i.ytimg.com/vi/A6ZiEMXMK0w/hqdefault.jpg,es-419,es-419,False,157,PT2M37S,hd,False,False,False,False,195376,8686,357
jhv0ZBa73z8,VE,2026-05-11T04:44:35.250179+00:00,2026-05-10T16:01:00Z,ESCONDITE de UN SOLO COLOR en MINECRAFT 🟥🟩🟦,ESCONDITE de UN SOLO COLOR en MINECRAFT 🟥🟩🟦,Acenix,UCH3h4jRKn3lJo0uORqqESPg,20,Gaming,"minecraft, escondite, acenix",3,https://i.ytimg.com/vi/jhv0ZBa73z8/hqdefault.jpg,es,es,False,1407,PT23M27S,hd,False,True,False,False,211722,7157,614
LULK0OK2g5Y,VE,2026-05-11T04:44:35.250186+00:00,2026-05-06T15:00:04Z,Que Hay De Malo - Jerry Rivera (Letra),Que Hay De Malo - Jerry Rivera (Letra),Echo Lyrics,UCPB4Efzj00pZJyGwV_jebkg,10,Music,,0,https://i.ytimg.com/vi/LULK0OK2g5Y/hqdefault.jpg,es,es,False,301,PT5M1S,hd,False,True,False,False,495988,360,4
9xf-it--hyk,VE,2026-05-11T04:44:35.250194+00:00,2026-05-10T22:18:37Z,Sobrevivimos 100 DIAS ESCAPANDO del ZOO en Roblox...,Sobrevivimos 100 DIAS ESCAPANDO del ZOO en Roblox...,Speed Amigos,UC_zprl2quhwa19m1BROkAdw,20,Gaming,"roblox, dagar, xturbo, sonic y amy roblox, amy y sonic, turboblox, dagar roblox, videos sonic, amigos roblox, sonic, roblox roleplay, roblox juegos, dagar y nacho, nacho roblox, sonic roblox, sonic .exe, xturbo roblox, amy, roblox dagar, nacho y dagar, noob, obby, speed amigos, Sobrevivimos 100 DIAS ESCAPANDO del ZOO en Roblox...",24,https://i.ytimg.com/vi/9xf-it--hyk/hqdefault.jpg,es,es,False,706,PT11M46S,hd,False,True,False,False,98331,832,20
AWhQ3wAgosc,VE,2026-05-11T04:44:35.250201+00:00,2026-05-07T22:52:04Z,Galy Galiano - La Cita (Letra),Galy Galiano - La Cita (Letra),SabroSón,UCz-jVF7_acwSvt30vGJRTOw,10,Music,"La Cita, Galy Galiano, Galy Galiano La Cita, La Cita Letra, La Cita Lyrics, Letra La Cita, Balada Romantica, Musica Popular, Musica Colombiana, Musica Latina, Galy Galiano Exitos, Canciones de Amor, Canciones de Desamor, Baladas en Español, Popular Colombiana, Clasicos Latinos, Nostalgia 90s, Canciones del Recuerdo, Musica para Dedicar, Cancion Romantica, Latin Music, Musica Popular Colombiana, Video con Letra, Letra Oficial, Cancion Clasica, Galy Galiano Canciones",26,https://i.ytimg.com/vi/AWhQ3wAgosc/hqdefault.jpg,es,es,False,288,PT4M48S,hd,False,True,False,False,444444,1077,4
oOFJ9KKlDiY,VE,2026-05-11T04:44:35.250209+00:00,2026-05-10T15:33:18Z,ABRÍ UN MERCADO EN BROOKHAVEN,ABRÍ UN MERCADO EN BROOKHAVEN,SoyWelix Brookhaven,UCObgc5yL3AkW0Oj1uik2IcQ,22,People & Blogs,,0,https://i.ytimg.com/vi/oOFJ9KKlDiY/hqdefault.jpg,es,es,False,650,PT10M50S,hd,False,True,False,False,68350,1525,117
EGaDDnwYZtw,VE,2026-05-11T04:44:35.250216+00:00,2026-05-04T19:06:09Z,"Carin León x Camilo - Ni Me Debes, Ni Te Debo(LETRA)","Carin León x Camilo - Ni Me Debes, Ni Te Debo(LETRA)",Amore Lyrics,UCA27Vna8RwUiuZlJbP-5cfw,10,Music,,0,https://i.ytimg.com/vi/EGaDDnwYZtw/hqdefault.jpg,es,es-419,False,176,PT2M56S,hd,False,True,False,False,173522,224,0
hBbnZa0F0Rw,VE,2026-05-11T04:44:35.250224+00:00,2026-05-10T21:15:02Z,Descubro NUEVA UBICACIÓN SECRETA en SUPER BEAR ADVENTURE !!,Descubro NUEVA UBICACIÓN SECRETA en SUPER BEAR ADVENTURE !!,DeGoBooM,UCj9rK3jt8qmih4mZX0UL67g,20,Gaming,"degoboom, dego, dg, bumi, sba, super bear adventure",6,https://i.ytimg.com/vi/hBbnZa0F0Rw/hqdefault.jpg,es-419,es-419,False,943,PT15M43S,hd,False,True,False,False,66757,2630,136
5OyTxEbT-fM,VE,2026-05-11T04:44:35.250231+00:00,2026-05-08T18:46:06Z,LIL NAAY - MOOD BRAZIL (VIDEO OFICAL),LIL NAAY - MOOD BRAZIL (VIDEO OFICAL),Lil Naay,UCYeamd07qoXU1JePbBtFBfA,10,Music,"lil naay, lil naay mami, lil naay me tripea, amenazzy lil naay, lil naay tolentino, lil naay panti, lil naay mix, lil naay - mami 🕸️, rochy rd, el alfa, yailin la mas viral, lito kirino, braulio fogon, bad bunny, shadow blow, quimico ultra mega, dowba montana",17,https://i.ytimg.com/vi/5OyTxEbT-fM/hqdefault.jpg,en,es-419,False,150,PT2M30S,hd,False,True,False,False,852775,49029,1801
vzskOS0nouU,VE,2026-05-11T04:44:35.250239+00:00,2026-05-10T19:20:49Z,Sobrevivimos 100 DIAS en Una PERRERA en Roblox,Sobrevivimos 100 DIAS en Una PERRERA en Roblox,AwitaDos,UCJ5v9VGVca67dg0nLrohopQ,20,Gaming,,0,https://i.ytimg.com/vi/vzskOS0nouU/hqdefault.jpg,es,es,False,1089,PT18M9S,hd,False,True,False,False,118853,2427,196
9irPzKQI6Rw,VE,2026-05-11T04:44:35.250246+00:00,2026-05-03T03:45:59Z,Gilberto Santa Rosa - Sin Voluntad (Letra),Gilberto Santa Rosa - Sin Voluntad (Letra),Kintsugi Sonar,UCALTH_FFoBp4CZV_PDVF5Xw,10,Music,"Sin Voluntad, Gilberto Santa Rosa, Gilberto Santa Rosa Sin Voluntad, Sin Voluntad Letra, Sin Voluntad Lyrics, Letra Sin Voluntad, Salsa, Salsa Romantica, Salsa Clasica, Salsa Vieja Escuela, Musica Latina, Gilberto Santa Rosa Exitos, Clasicos de la Salsa, Canciones de Amor, Canciones de Desamor, Salsa para Dedicar, Hit Salsero, Salsa 90s, Nostalgia Salsera, Latin Music, Musica para Bailar, Video con Letra, Cancion Romantica, Salsa Hits, Gilberto Santa Rosa Canciones",25,https://i.ytimg.com/vi/9irPzKQI6Rw/hqdefault.jpg,es,es,False,303,PT5M3S,hd,False,True,False,False,79241,105,0
RAXAomv7HvM,VE,2026-05-11T04:44:35.250254+00:00,2026-05-10T20:01:43Z,Fingí ser UN GATO y me PASÉ MINECRAFT!,Fingí ser UN GATO y me PASÉ MINECRAFT!,xTurbo,UCeOrlSK-mWTZjB66O9ttHpg,20,Gaming,"xturboo, xturbo, xturboo_, turbo minecraft, Minecraft, Fingí ser UN GATO y me PASÉ MINECRAFT!",6,https://i.ytimg.com/vi/RAXAomv7HvM/hqdefault.jpg,es,es,False,1419,PT23M39S,hd,False,True,False,False,87886,2293,204
