video_id,country,fetched_at,published_at,title,localized_title,channel_title,channel_id,category_id,category_name,tags,tag_count,thumbnail,default_language,audio_language,is_live,duration,duration_raw,definition,caption_available,licensed_content,embeddable,made_for_kids,views,likes,comments
R_DeQhQcTKE,KE,2025-12-15 02:32:38.295218+00:00,2025-12-12 07:20:11+00:00,Nadia Mukami-WOZA (Visualizer),Nadia Mukami-WOZA (Visualizer),Nadia Mukami #AfricanPopStar,UCjXVvJqLERkvsGTB-TKLx6Q,10,Music,,0,https://i.ytimg.com/vi/R_DeQhQcTKE/hqdefault.jpg,en,sw,False,144,PT2M24S,hd,False,True,False,False,149219,11110,841
YqdAEdkHrwo,KE,2025-12-15 02:32:38.295250+00:00,2025-12-11 16:59:07+00:00,Supergirl | Official Teaser Trailer,Supergirl | Official Teaser Trailer,DC,UCiifkYAs_bq1pt_zbNAzYGg,24,Entertainment,"DC, DC Comics, DC Universe, DCU, Superman, James Gunn, super heroes, movie, Supergirl, superman 2025, dcu timeline, superman scene, superman krypto, krypto the superdog, lex luthor, krypto, superman 2025 scene, supergirl woman of tomorrow, supergirl scene superman 2025, supergirl cameo superman, supergirl in superman 2025, milly alcock, supergirl, supergirl movie, supergirl 2026, supergirl trailer, supergirl trailer reaction, supergirl trailer breakdown, supergirl milly alcock",29,https://i.ytimg.com/vi/YqdAEdkHrwo/hqdefault.jpg,en,en,False,123,PT2M3S,hd,False,True,False,False,14446818,361801,20020
Ntp522Cad-s,KE,2025-12-15 02:32:38.295263+00:00,2025-12-07 22:10:52+00:00,REAL MADRID 0 - 2 CELTA | RESUMEN LALIGA EA SPORTS,REAL MADRID 0 - 2 CELTA | RESUMEN LALIGA EA SPORTS,LALIGA EA SPORTS,UCTv-XvfzLX3i4IGWAm4sbmA,17,Sports,"RC Celta, Real Madrid, Real Madrid vs. RC Celta, Madrid, Celta, Real Madrid Celta, Real Madrid vs Celta, LaLiga, jornada 15 laliga ea sports, laliga ea sports, highlights Real Madrid Celta, resumen Real Madrid Celta, goles Celta, Williot, Valverde, Mbappé, Santiago Bernabéu, mejores momentos fútbol, partido LaLiga, liga española, highlights fútbol, resumen fútbol, Celta vigo, Celta de Vigo",24,https://i.ytimg.com/vi/Ntp522Cad-s/hqdefault.jpg,es,es,False,195,PT3M15S,hd,False,True,False,False,4887861,68268,5793
7zj30EX397s,KE,2025-12-15 02:32:38.295273+00:00,2025-12-04 09:55:51+00:00,WERU UYU BY SAMMY IRUNGU (*811*258# SKIZA),WERU UYU BY SAMMY IRUNGU (*811*258# SKIZA),SAMMY IRUNGU,UCikr3kOessKQkIMr2S3Pm4w,10,Music,"Sammy Irungu, Sammy Irungu Latest, Sammy Irungu Songs, Kikuyu Gospel Mix, Kikuyu Gospel, Kikuyu Gospel Songs, Sammy Irungu Mix, Sammy Irungu Music, Sammy Irungu Latest Song, Weru Uyu, Sammy Irungu Trending",11,https://i.ytimg.com/vi/7zj30EX397s/hqdefault.jpg,en-GB,ki,False,248,PT4M8S,hd,False,True,False,False,501839,9766,928
Fv0leN8TmR8,KE,2025-12-15 02:32:38.295281+00:00,2025-12-07 00:00:04+00:00,The Boys - Final Season Teaser Trailer | Prime Video,The Boys - Final Season Teaser Trailer | Prime Video,Prime Video,UCQJWtTnAHhEG5w4uN0udnUQ,24,Entertainment,"the boys, the boys season 5, the boys s5, the boys season 5 trailer, the boys season 5 teaser, the boys s5 trailer, the boys s5 teaser, the boys soldier boy, the boys homelander, the boys butcher, homelander, butcher, soldier boy, starlight, hughie, homelander vs butcher, butcher vs homelander, homelander vs soldier boy, the boys final season, the boys final season trailer, antony starr, karl urban, jensen ackles, erin moriarty, jack quaid, chace crawford, jared padalecki",27,https://i.ytimg.com/vi/Fv0leN8TmR8/hqdefault.jpg,en,en,False,121,PT2M1S,hd,True,True,False,False,8428891,333477,17559
DHbQk9GM1k4,KE,2025-12-15 02:32:38.295288+00:00,2025-12-09 21:46:21+00:00,INFECTED OCEAN...,INFECTED OCEAN...,Maizen,UCJHBJ7F-nAIlMGolm0Hu4vg,20,Gaming,"Minecraft, Maizen",2,https://i.ytimg.com/vi/DHbQk9GM1k4/hqdefault.jpg,en,en,False,1193,PT19M53S,hd,False,True,False,False,2966855,15591,1052
Ze4XH7Onido,KE,2025-12-15 02:32:38.295296+00:00,2025-12-12 13:00:07+00:00,NGUVU YA DAMU YA YESU - ROSE MUHANDO ( Official Video),NGUVU YA DAMU YA YESU - ROSE MUHANDO ( Official Video),Rose Muhando Official,UCKNxcv18ljRm0qJdp2DwSKA,10,Music,"Rose Muhando, Kenya Ulindwe, Gospel music, Best of Rose Muhando songs, Rose Muhando new album, Stephen kasolo, Ngomma, Ngomma vas, Ngomma.com, NGUVU YA DAMU YA YESU - ROSE MUHANDO ( Official Video), gospol song, NYIMBO ZA ROSE MUHANDO, WIMBO WA INJILI, NGOMA ZA ROSE MUHANDO, MAISHA YA ROSE MUHANDO, UTAJIRI WA ROSE MUHANDO, KANISA, KINACHOENDELEA TANZANIA, MAANDAMANO, WASANII WA TANZANIA",20,https://i.ytimg.com/vi/Ze4XH7Onido/hqdefault.jpg,sw,sw,False,332,PT5M32S,hd,False,True,False,False,250927,15395,2499
SI3CrHUAGqM,KE,2025-12-15 02:32:38.295303+00:00,2025-12-11 17:00:07+00:00,Beast Games Season 2 | Official Trailer,Beast Games Season 2 | Official Trailer,MrBeast 2,UC4-79UOlP48-QNGgCko5p2g,22,People & Blogs,,0,https://i.ytimg.com/vi/SI3CrHUAGqM/hqdefault.jpg,en,en,False,94,PT1M34S,hd,True,True,False,False,1519021,71043,3414
qniEraoejow,KE,2025-12-15 02:32:38.295311+00:00,2025-12-13 10:01:22+00:00,الرجل العنكبوت انقاذ باتمان Spider-Man Rescue batman vs iron man vs venom funny Game GTA 5 superhero,الرجل العنكبوت انقاذ باتمان Spider-Man Rescue batman vs iron man vs venom funny Game GTA 5 superhero,RAIZER,UCRaZHgZDqy0pzKnZze1EcIA,20,Gaming,,0,https://i.ytimg.com/vi/qniEraoejow/hqdefault.jpg,ar,ar,False,1319,PT21M59S,hd,False,True,False,False,2308229,114962,1392
Uzr7QLf18Zk,KE,2025-12-15 02:32:38.295317+00:00,2025-12-06 12:01:06+00:00,Toxic Lyrikali - Mfisadi (Feat. Dyana Cods) [Official Audio],Toxic Lyrikali - Mfisadi (Feat. Dyana Cods) [Official Audio],Toxic Lyrikali,UC7q5EQvi2fJTQvwZRi0QJnw,10,Music,,0,https://i.ytimg.com/vi/Uzr7QLf18Zk/hqdefault.jpg,en,sw,False,133,PT2M13S,hd,False,False,False,False,285558,13091,1033
kQ3kwWX8fwg,KE,2025-12-15 02:32:38.295324+00:00,2025-12-08 15:01:33+00:00,PAA Born To Fly Season 4 | Episodes 7&8 Trailer,PAA Born To Fly Season 4 | Episodes 7&8 Trailer,SKY Girls KE,UCZF83-HDYyqiCuwoJCrnVUA,24,Entertainment,,0,https://i.ytimg.com/vi/kQ3kwWX8fwg/hqdefault.jpg,en,sw,False,31,PT31S,hd,False,False,False,False,337039,100,10
kDRaBTwaheo,KE,2025-12-15 02:32:38.295331+00:00,2025-12-13 18:10:49+00:00,GTA 5 but EVERYTHING I SEE is FREE!,GTA 5 but EVERYTHING I SEE is FREE!,Nought,UCSh__r5HS4Y1xBkccWnV0TA,20,Gaming,"gta 5, gta v, gta 5 free, free, see, vision, sight, see is free, free stuff, everything, mods, gta 5 mods, gta v mods, nought, nought gta 5, gaming, cars, supercars, gta 5 cars, gta 5 supercars",20,https://i.ytimg.com/vi/kDRaBTwaheo/hqdefault.jpg,en,en,False,1010,PT16M50S,hd,False,True,False,False,110376,4413,209
XnJnBgNCON4,KE,2025-12-15 02:32:38.295339+00:00,2025-12-09 14:00:06+00:00,NG'ANG'A Wa KABARI..ICI KANITHA( MAYA Ma NYUMBA) Official Music Video# SKIZA 69813865 ,NG'ANG'A Wa KABARI..ICI KANITHA( MAYA Ma NYUMBA) Official Music Video# SKIZA 69813865 ,NGANGA WA KABARI OFFICIAL,UCMzoaHRJYjieTTiq94ZD_eA,24,Entertainment,,0,https://i.ytimg.com/vi/XnJnBgNCON4/hqdefault.jpg,en,sw,False,398,PT6M38S,hd,False,True,False,False,134462,4019,1020
8_szlvBLll0,KE,2025-12-15 02:32:38.295345+00:00,2025-12-11 15:00:01+00:00,HIS & HERS | Official Trailer | Netflix,HIS & HERS | Official Trailer | Netflix,Netflix,UCWOA1ZGywLbqmigxE4Qlvuw,24,Entertainment,"Alice Feeney, Anna Andrews, Crystal Fox, His & Hers, His and Hers, Jack Harper, Jon Bernthal, Marin Ireland, Netflix, Pablo Schreiber, Poppy Liu, Rebecca Rittenhouse, Sunita Mani, Tessa Thompson, William Oldroyd",15,https://i.ytimg.com/vi/8_szlvBLll0/hqdefault.jpg,en,en-US,False,136,PT2M16S,hd,True,True,False,False,1146016,19498,754
DWCl2dN6hpg,KE,2025-12-15 02:32:38.295353+00:00,2025-12-13 17:00:00+00:00,1 Pro vs 500 Hunters,1 Pro vs 500 Hunters,MrBeast Gaming,UCIPPMRA040LQr5QPyJEbmXA,20,Gaming,,0,https://i.ytimg.com/vi/DWCl2dN6hpg/hqdefault.jpg,en,en,False,1069,PT17M49S,hd,True,True,False,False,7904630,234521,7829
3xLOIfBp4wk,KE,2025-12-15 02:32:38.295359+00:00,2025-12-05 16:01:59+00:00,Virusi Mbaya - Have Mercy ft Scar Mkadinali  (Official Video),Virusi Mbaya - Have Mercy ft Scar Mkadinali  (Official Video),Virusi Mbaya,UCuOGKKBMa5eFIGfRZSC-qcg,10,Music,,0,https://i.ytimg.com/vi/3xLOIfBp4wk/hqdefault.jpg,en,sw,False,213,PT3M33S,hd,False,True,False,False,292521,14977,2157
9PjL8AWqQVw,KE,2025-12-15 02:32:38.295366+00:00,2025-12-11 04:30:07+00:00,Escaping PRISON With Only A SPOON In Roblox..,Escaping PRISON With Only A SPOON In Roblox..,Foltyn,UCRkuUgtDAL4XSU5jB40J_wA,20,Gaming,"foltyn, foltyn roblox, family friendly, roblox, roblox foltyn, foltyn family, funny, no swearing, foltyn family roblox, roblox foltyn family, blade ball, roblox blade ball, foltyn blade ball, kid friendly, roblox dig to escape, roblox steal a brainrot, foltyn and caylus playing roblox, caylus and foltyn roblox, foltyn and caylus playing roblox steal a brainrot, foltyn roblox creator showdown",20,https://i.ytimg.com/vi/9PjL8AWqQVw/hqdefault.jpg,en,en-US,False,897,PT14M57S,hd,False,True,False,False,1059768,17457,2283
gmJGcYwxFmU,KE,2025-12-15 02:32:38.295374+00:00,2025-12-09 07:00:06+00:00,DOUBLE GANG 254 - MAISHA YA UKWELI (Music Video),DOUBLE GANG 254 - MAISHA YA UKWELI (Music Video),Double Gang 254,UCfLk6vgwobE31RMz2OKnaPA,22,People & Blogs,"Maisha ya ukweli, Double Gang 254, Makamanda, Mombsa, Sana Shamba",5,https://i.ytimg.com/vi/gmJGcYwxFmU/hqdefault.jpg,en,sw,False,163,PT2M43S,hd,False,True,False,False,108837,4607,623
8NBvKMbQqug,KE,2025-12-15 02:32:38.295395+00:00,2025-12-13 15:15:01+00:00,"Minecraft But You Can Travel 1,000,000 Blocks","Minecraft But You Can Travel 1,000,000 Blocks",PrestonPlayz,UCJZam2u1G0syq3kyqrCXrNw,20,Gaming,"minecraft, preston, brianna, gaming, funny, ssundee, unspeakable, mrbeast, aphmau, canman, lankybox, cash minecraft, nico mc, stokestwins, gametoons, maizen, eyestreem, minecraft but, minecraft but you can travel, minecraft but you can travel 1000000 blocks, minecraft but you can travel 1 million blocks",21,https://i.ytimg.com/vi/8NBvKMbQqug/hqdefault.jpg,en,en,False,1253,PT20M53S,hd,False,True,False,False,725809,16266,649
cnWQxcKtiLw,KE,2025-12-15 02:32:38.295403+00:00,2025-12-10 11:35:07+00:00,EN 5 MINUTES BY GLORIA KOTESTES OFFICIAL 4K VIDEO,EN 5 MINUTES BY GLORIA KOTESTES OFFICIAL 4K VIDEO,Gloria Kotestes Official,UCwU4HCJGy2DIicybtoxjSkQ,10,Music,,0,https://i.ytimg.com/vi/cnWQxcKtiLw/hqdefault.jpg,en,sw,False,278,PT4M38S,hd,False,True,False,False,83272,2888,401
SV09LBoJbaE,KE,2025-12-15 02:32:38.295410+00:00,2025-12-13 19:07:00+00:00,"Every Time I Crash, My Uber Evolves in GTA 5","Every Time I Crash, My Uber Evolves in GTA 5",SpeirsTheAmazingHD,UCAbdeLiTPdjk1X2TY_ZdLDw,20,Gaming,"speirstheamazinghd, speirs the amazing, gta 5 funny moments, gta 5, gta, in gta 5, gta 5 rp, grand theft auto 5, stealing cars gta 5, fastest car, gta 5 roleplay, roleplay, gta v roleplay, gta5 roleplay, gta 5 roleplay funny, funny roleplay moments, grand theft auto roleplay, grand theft auto 5 roleplay, every time i crash, every time i crash gta 5, uber evolves, evolving cars gta 5, uber car gta 5, upgrading ubers, fastest uber, ultimate uber gta 5, uber gta 5",27,https://i.ytimg.com/vi/SV09LBoJbaE/hqdefault.jpg,en,en,False,1847,PT30M47S,hd,False,True,False,False,120381,2230,75
cYK5iU7ejHA,KE,2025-12-15 02:32:38.295418+00:00,2025-11-24 08:00:11+00:00,Prince Indah - Rapudo (Official Video) sms SKIZA 9846027 to 811,Prince Indah - Rapudo (Official Video) sms SKIZA 9846027 to 811,"Prince Indah, OGW",UCwN-NLEsOx7cCiBeGap9LSA,10,Music,"Kenya, Prince Indah, Emma Jalamo, Ohangla, Luo Rhumba, Luo Music, Kisumu, Prince Indah latest songs, Freddy Mopao Prince Indah, Weche Hera Prince Indah, Weche Singo, Maria Prince Indah, Zena Prince Indah, Opija Father, Zainabu, Sigand Luo Prince Indah, Washington Jakadel, Raila Odinga, Kenyan politics, NASA, ODM, Nyakisumo Part 2, Adeka Engineer Prince Indah, Angeli, Uchumi Prince Indah, Ken Soldier, Cynderella Prince Indah., Timeless Anthems Prince Indah",28,https://i.ytimg.com/vi/cYK5iU7ejHA/hqdefault.jpg,en,sw,False,288,PT4M48S,hd,False,True,False,False,1308273,15761,1613
JIL9DrSzaRk,KE,2025-12-15 02:32:38.295425+00:00,2025-12-13 22:37:55+00:00,[LIVE] Arsenal vs Wolves Premier League 25/26 Full Match - Video Game Simulation,[LIVE] Arsenal vs Wolves Premier League 25/26 Full Match - Video Game Simulation,Kampleng Com,UCdMJwGhTUhAzk1ksH6iHjUw,24,Entertainment,"arsenal vs wolves, arsenal vs wolves live, arsenal vs wolves premier league, premier league live 2025, premier league arsenal vs wolves, arsenal vs wolves 2025, arsenal vs wolves static, arsenal, wolves, the derby, london, 2025, premier league live today, live, match, premier league 2025/2026, arsenal vs wolves prediction, arsenal vs wolves today",18,https://i.ytimg.com/vi/JIL9DrSzaRk/hqdefault.jpg,id,id,False,8940,PT2H29M,hd,False,True,False,False,159955,828,5
duFavBDXh1I,KE,2025-12-15 02:32:38.295432+00:00,2025-12-12 16:00:07+00:00,O DARA | NATHANIEL BASSEY #nathanielbassey #worship #odara,O DARA | NATHANIEL BASSEY #nathanielbassey #worship #odara,Nathaniel Bassey Main,UCRe2Ir9wtPk_YQjElam7n2w,10,Music,,0,https://i.ytimg.com/vi/duFavBDXh1I/hqdefault.jpg,en,en-GB,False,504,PT8M24S,hd,False,True,False,False,340815,33548,4103
byUa5hRNIP4,KE,2025-12-15 02:32:38.295440+00:00,2025-12-14 05:12:04+00:00,Long Slide Game With Cow Elephant Gorilla Hippopotamus Tiger 3d Animal Game Funny 3d Animals,Long Slide Game With Cow Elephant Gorilla Hippopotamus Tiger 3d Animal Game Funny 3d Animals,Flygame Animals,UCjXc-SvLGE7wgjJV1DgwvAg,1,Film & Animation,,0,https://i.ytimg.com/vi/byUa5hRNIP4/hqdefault.jpg,en,bn,False,648,PT10M48S,hd,False,True,False,False,865728,8621,189
4-NzBInUY-w,KE,2025-12-15 02:32:38.295447+00:00,2025-12-05 09:00:06+00:00,ALEX KASAU KATOMBI-SIKUKU(OFFICIAL AUDIO),ALEX KASAU KATOMBI-SIKUKU(OFFICIAL AUDIO),Alex Kasau Katombi,UCWFv8hpX1Xj03kJFsP9MmRA,10,Music,"alex, kasau, katombi, ngulumende, mwanosu, nguuni, lovers",7,https://i.ytimg.com/vi/4-NzBInUY-w/hqdefault.jpg,sw,en-US,False,474,PT7M54S,hd,False,True,False,False,184367,7310,928
kmT_74wMf90,KE,2025-12-15 02:32:38.295454+00:00,2025-12-11 00:01:04+00:00,I Became Any Superhero in Minecraft,I Became Any Superhero in Minecraft,Bionic,UCETZ7OiW7-wqwb-6hsz3C4w,20,Gaming,"minecraft, bionic, family friendly, minecraft superhero, i became any superhero, i became any superhero in minecraft, superhero, superheros in minecraft",8,https://i.ytimg.com/vi/kmT_74wMf90/hqdefault.jpg,en,en,False,1533,PT25M33S,hd,False,True,False,False,778909,17180,1572
439N74dgVmc,KE,2025-12-15 02:32:38.295461+00:00,2025-12-03 09:07:53+00:00,DUFLA DILIGON FT. FATHERMOH - ZOZA (Official Music Video),DUFLA DILIGON FT. FATHERMOH - ZOZA (Official Music Video),Dufla,UC6llviAY9rQ3cPFakU2S8uQ,10,Music,"DuflaDiligon, Fathermoh, ZOZA, Dufla Diligon, Dufla ft Fathermoh, KenyanMusic, NewMusic, 2025Music, Dancehall, Gengetone, ClubAnthem, AfricanMusic, EastAfricanMusic, Nairobi, Mathare, WakawakaProduction, HenrickSam, KCBrian, trending, viral, musicvideo, Kenya, new, hit, Banger, GoodVibes, Dufla, ZOZADance, SwahiliSlang, OfficialVideo, TheClusterDanceCrew, DonjoMaber, Rumours, NewKenyanMusic, Music, Reggae, Dance, AfricanHit",38,https://i.ytimg.com/vi/439N74dgVmc/hqdefault.jpg,en-US,sw,False,170,PT2M50S,hd,False,False,False,False,207885,7212,590
tC8-SDOZlLQ,KE,2025-12-15 02:32:38.295469+00:00,2025-12-11 16:14:41+00:00,Testing VIRAL Skate 4 TikTok Challenges!,Testing VIRAL Skate 4 TikTok Challenges!,Caylus  ,UCVAYy7_zddIx6USjXscV9Vg,20,Gaming,"infinite lists, infinite, gta 5, caylus, gta 5 caylus, gta 5 mods, caylusblox, caylus roblox, caylus infinite, caylus horror, caylus vr, caylus gta 5, caylus tomo, Testing VIRAL Skate 4 TikTok Challenges!, skate 4, skate, caylus skate, caylus steal a brainrot",18,https://i.ytimg.com/vi/tC8-SDOZlLQ/hqdefault.jpg,en,en,False,1288,PT21M28S,hd,False,True,False,False,915192,10314,703
cIZs7Tg2Guw,KE,2025-12-15 02:32:38.295476+00:00,2025-12-12 07:00:07+00:00,NGOO NENE - PURITY KATEIKO (OFFICIAL VIDEO),NGOO NENE - PURITY KATEIKO (OFFICIAL VIDEO),Purity Kateiko,UCvPOIZ7-SyyIdHA4x5IxfPw,10,Music,,0,https://i.ytimg.com/vi/cIZs7Tg2Guw/hqdefault.jpg,en,sw,False,431,PT7M11S,hd,False,True,False,False,29939,1673,311
CQwwWXdlm7o,KE,2025-12-15 02:32:38.295483+00:00,2025-12-14 08:47:17+00:00,سبايدر مان اصعب دراجة نارية فوق اسماك القرش - Superheroes Ride on Motorcycle Stunt Funny Moments??,سبايدر مان اصعب دراجة نارية فوق اسماك القرش - Superheroes Ride on Motorcycle Stunt Funny Moments??,CyberCOW,UCQ7IDbbSQkxnlkcdTaaY9ow,20,Gaming,,0,https://i.ytimg.com/vi/CQwwWXdlm7o/hqdefault.jpg,ar,ar,False,945,PT15M45S,hd,False,True,False,False,687864,36780,690
NHl9r30B6_c,KE,2025-12-15 02:32:38.295489+00:00,2025-12-09 17:00:40+00:00,Fally Ipupa - Deux Êtres (Clip Officiel),Fally Ipupa - Deux Êtres (Clip Officiel),Fally Ipupa,UCBFYkrVI8OfHm9PzbAGFqlA,10,Music,"Fally Ipupa, Bad Boy, Musique, Afro, Clip officiel, fally ipupa, aya nakamura, eloko oyo, fally, fally ipupa eloko oyo, booba, bad boy, kiname, fally ipupa bad boy, fally eloko oyo, aya, fally ipupa 2016, fally ipupa 2017, fally ipupa amour assassin, fally ipupa nourrisson, fally ipupa service, fally ipupa original, eloko, fally ipupa anissa, eloko oyo fally ipupa, fally ipupa eloko oyo audio, booba kiname",27,https://i.ytimg.com/vi/NHl9r30B6_c/hqdefault.jpg,fr,fr,False,314,PT5M14S,hd,False,True,False,False,1112505,62000,7544
eOFC2YUVauM,KE,2025-12-15 02:32:38.295497+00:00,2025-12-13 21:59:23+00:00,New NORTH POLE UPDATE + Festive Lucky Blocks!,New NORTH POLE UPDATE + Festive Lucky Blocks!,CaylusBlox,UCsPMNatXCwqyUuJilBT73jg,20,Gaming,"caylusblox, caylus roblox, caylus, roblox, Steal a brainrot update, ADMIN ABUSE In Steal a Brainrot!, Steal a Brainrot UPDATE + Admin Abuse, admin abuse, steal a brainrot, caylus admin abuse, steal a brainrot update, tung tung tung sahur, tung tung sahur steal a brainrot, santa fuse machine, caylus fuse machine, caylus steak, caylus steal a brainrot christmas, taco tuesday, caylus stream, radioactive base, north pole, steal a brainrot north pole, caylus steal a brainrot",23,https://i.ytimg.com/vi/eOFC2YUVauM/hqdefault.jpg,en-US,en-US,False,5558,PT1H32M38S,hd,False,True,False,False,3413147,41430,811
p0TrJav8ews,KE,2025-12-15 02:32:38.295505+00:00,2025-12-07 13:30:07+00:00,John Mbaka - Tusyaitye Mbee (Official 4k video),John Mbaka - Tusyaitye Mbee (Official 4k video),John Mbaka,UCfYDawG-dYkIpLl8mKmpraQ,10,Music,,0,https://i.ytimg.com/vi/p0TrJav8ews/hqdefault.jpg,en,sw,False,316,PT5M16S,hd,False,False,False,False,71446,2204,333
S-LMSpzlnc0,KE,2025-12-15 02:32:38.295511+00:00,2025-12-07 15:44:41+00:00,Race Highlights | 2025 Abu Dhabi Grand Prix,Race Highlights | 2025 Abu Dhabi Grand Prix,FORMULA 1,UCB_qr75-ydFVKSF9Dmo6izg,17,Sports,"F1, Formula One, Formula 1, Sports, Sport, Action, GP, Grand Prix, Auto Racing, Motor Racing, abu dhabi, f1 2025 championship",12,https://i.ytimg.com/vi/S-LMSpzlnc0/hqdefault.jpg,en,en,False,503,PT8M23S,hd,False,True,False,False,4569596,95829,7202
ReTLnW7kHAE,KE,2025-12-15 02:32:38.295518+00:00,2025-12-10 17:00:53+00:00,BIEN X KHALIGRAPH - REMIX ALL MY ENEMIES ARE SUFFERING (LYRIC VIDEO),BIEN X KHALIGRAPH - REMIX ALL MY ENEMIES ARE SUFFERING (LYRIC VIDEO),Bien,UCYKXCpJbGe3fTYILjpJgW2A,10,Music,,0,https://i.ytimg.com/vi/ReTLnW7kHAE/hqdefault.jpg,en,en,False,225,PT3M45S,hd,False,True,False,False,65222,3808,337
jIB3e4erFa0,KE,2025-12-15 02:32:38.295525+00:00,2025-12-13 15:01:19+00:00,I Found Zoey’s Secret World in Minecraft,I Found Zoey’s Secret World in Minecraft,Cash,UC0eLBYhxW9HC0P9PXQ73mpQ,24,Entertainment,"Cash, Nico, Nico and Cash, Cash and Nico, Minecraft, Minecraft mod, family friendly, kid friendly, I Found Zoey’s Secret World in Minecraft",9,https://i.ytimg.com/vi/jIB3e4erFa0/hqdefault.jpg,en,en-US,False,1168,PT19M28S,hd,False,True,False,False,453446,5078,1085
8JZZvo-gJaU,KE,2025-12-15 02:32:38.295532+00:00,2025-12-12 16:00:06+00:00,"TxC, Davido, Shoday & Scotts Maphuma - Nakupenda (Official Music Video) feat. Zlatan & Al Xapo","TxC, Davido, Shoday & Scotts Maphuma - Nakupenda (Official Music Video) feat. Zlatan & Al Xapo",TXC,UCu4Uqt9BnKo1OT5h3K5qlrA,10,Music,"TXC Davido Zlatan Nakupenda, Nakupenda Davido Shoday TXC, TxC, Davido & Zlatan - Nakupenda (Official Music Video) feat. Scotts Maphuma, Shoday & Al Xapo, Shoday Nakupenda Davido, TikTok Dance, South Africa, Nigeria, TXC Davido Yebo, Dance Challenge, amapiano, txc, southafrica, africa, tarryntxc, clairisetxc, dj, dj duo, unclewaffles, london, tyla, tems, tyla water, amapianovibes, afrobeats, newmusic, africanow, turnoffthelights, colored, TXC Woza Lana, woza lana txc",32,https://i.ytimg.com/vi/8JZZvo-gJaU/hqdefault.jpg,en,en,False,334,PT5M34S,hd,False,True,False,False,1277076,31236,3706
2PBs1QhaPFA,KE,2025-12-15 02:32:38.295540+00:00,2025-12-13 01:58:36+00:00,99 Nights In The Forest FUNNIEST MOMENTS..,99 Nights In The Forest FUNNIEST MOMENTS..,FoltynPlays,UC2uQvUg3YYzoOtj1yZLT0Ow,20,Gaming,"Foltyn, foltynplays, roblox, roblox gaming, family friendly, foltyn family, foltyn family roblox, foltyn roblox, roblox foltyn, no cursing, blox fruits, roblox blox fruits, roblox blox fruit, roblox fruits in blox fruits, blox fruit roblox, blox fruit, 99 nights in the forest, reacting to funniest moments 99 nights in the forest, 99 Nights In The Forest FUNNIEST MOMENTS.., Roblox 99 Nights In The Forest FUNNIEST MOMENTS!!, The FUNNIEST 99 Nights In The Forest Videos Of ALL TIME..",21,https://i.ytimg.com/vi/2PBs1QhaPFA/hqdefault.jpg,en,en-US,False,785,PT13M5S,hd,False,True,False,False,435733,10071,1511
MPuK06zUIhc,KE,2025-12-15 02:32:38.295547+00:00,2025-12-12 05:40:18+00:00,Pooh Shiesty - FDO [Official Music Video],Pooh Shiesty - FDO [Official Music Video],Pooh Shiesty,UCTBIIbIs83IBsy4E1BQxYBw,10,Music,"pooh shiesty, pooh sheisty, pooh, shiesty, atlanta pooh shiesty, atlanta, 1017 records, 1017 artist, 1017 pooh, 1017, rap, hip hop, shiesty season, back in blood, memphis, southern rap, gucci artist",17,https://i.ytimg.com/vi/MPuK06zUIhc/hqdefault.jpg,en,en,False,372,PT6M12S,hd,False,True,False,False,5037006,269609,24015
ucAdHYuhGYY,KE,2025-12-15 02:32:38.295554+00:00,2025-12-14 12:31:13+00:00,Arsenal vs Wolves | English Premier League 2025/26 | Epl Live Stream | PES 21 Simulation,Arsenal vs Wolves | English Premier League 2025/26 | Epl Live Stream | PES 21 Simulation,Football Gamer Rony,UCaopyJz-EIXOXYXSMOC6c-g,20,Gaming,"efootball, efootball pes 21, pes 21 gameplay, football game, pes 21, pes21, efootball pes 21 gameplay, live football, football live, football, football gamer rony",11,https://i.ytimg.com/vi/ucAdHYuhGYY/hqdefault.jpg,en,en,False,906,PT15M6S,hd,False,True,False,False,117580,467,1
fvvEkicKuPo,KE,2025-12-15 02:32:38.295561+00:00,2025-12-12 05:03:18+00:00,21 Savage - HA (Official Music Video),21 Savage - HA (Official Music Video),21 Savage,UCOjEHmBKwdS7joWpW0VrXkg,10,Music,"21 savage, 21 savage music, 21 savage songs, 21 savage 2025, 21 savage ha, ha 21 savage, ha music video, 21 savage whtts, whtts 21 savage, ha whtts, what happened to the streets, new rap, atlanta rap, new hip hop songs",14,https://i.ytimg.com/vi/fvvEkicKuPo/hqdefault.jpg,en,en,False,180,PT3M,hd,False,True,False,False,992519,54544,2825
EqHKdbIF32c,KE,2025-12-15 02:32:38.295568+00:00,2025-12-10 21:54:44+00:00,Real Madrid vs Man City (1-2) Highlights | UEFA Champions League 2025/26,Real Madrid vs Man City (1-2) Highlights | UEFA Champions League 2025/26,Nexus Football,UC5NHRYb_oooQwJVRtZvMWsw,17,Sports,"erling haaland goal vs real madrid, rodrygo goes goal vs man city, O reilly goal vs real madrid, real madrid vs man city highlights, madrid vs man ctiy, real madrid man city, madrid city, champions league highlights, real madrid highlights, real madrid, manchester city, real madrid vs manchester city",12,https://i.ytimg.com/vi/EqHKdbIF32c/hqdefault.jpg,en,en,False,253,PT4M13S,hd,False,True,False,False,193115,828,46
tuO48H1xZgw,KE,2025-12-15 02:32:38.295575+00:00,2025-12-10 10:26:06+00:00,Stella Mengele- Meteela Muno Ala Mendaa Tuthele Official Song,Stella Mengele- Meteela Muno Ala Mendaa Tuthele Official Song,Stella Mengele,UC7a7gysb2i09E-y85QeW1ow,24,Entertainment,,0,https://i.ytimg.com/vi/tuO48H1xZgw/hqdefault.jpg,en,en,False,363,PT6M3S,hd,False,True,False,False,48742,2008,397
HMtgls3R7Jg,KE,2025-12-15 02:32:38.295582+00:00,2025-12-10 17:00:37+00:00,JJ and Mikey Become STRONG SQUID GAME Players - Maizen Minecraft Animation,JJ and Mikey Become STRONG SQUID GAME Players - Maizen Minecraft Animation,MSToons,UCc2RL8jvY1rJPuCnJVsIQWw,20,Gaming,"minecraft, animation, minecraft animation, maizen, jj, mikey, jj and mikey, maizen animation, maizen minecraft animation, jj and mikey minecraft animation, jj and mikey sad story, まいぜんシスターズ, マインクラフト, まいぜん, jj sister",15,https://i.ytimg.com/vi/HMtgls3R7Jg/hqdefault.jpg,en,en,False,588,PT9M48S,hd,False,True,False,False,1112295,3655,41
vlJRucQN7F8,KE,2025-12-15 02:32:38.295589+00:00,2025-12-02 15:38:57+00:00,CONFESS YOUR LOVE FUNK (Lyrics Video),CONFESS YOUR LOVE FUNK (Lyrics Video),Kakashi,UCl-_j0RoBHtbdNXVritaeIQ,10,Music,"CONFESS YOUR LOVE FUNK, Confess Your Love Phonk, Confess Your Love Funk Lyrics, Confess Your Love Funk Ultra Slowed, Confess Your Love Funk Slowed, Brazilian Phonk 2025, Love Funk Remix, Fenomenal Funk, Montagem Phonk, Funk Mandelão, Confess Your Love Tiktok Version, Sigma Phonk, Gym Motivation Music 2025, Hard Phonk for Gaming, JDM Car Music, Best Brazilian Phonk Playlist, Viral Funk Hits, Confess Your Love Bass Boosted, Funk Batidão, Phonk Edit, Electronic Funk Mix",21,https://i.ytimg.com/vi/vlJRucQN7F8/hqdefault.jpg,en,en,False,79,PT1M19S,hd,False,True,False,False,4625139,38575,778
