video_id,country,fetched_at,published_at,title,localized_title,channel_title,channel_id,category_id,category_name,tags,tag_count,thumbnail,default_language,audio_language,is_live,duration,duration_raw,definition,caption_available,licensed_content,embeddable,made_for_kids,views,likes,comments
JeevxH-R0b8,UA,2025-12-21 02:35:25.589153+00:00,2025-12-19 07:15:05+00:00,ТІНА КАРОЛЬ - ШИНШИЛА (ПРЕМ'ЄРА 2025),ТІНА КАРОЛЬ - ШИНШИЛА (ПРЕМ'ЄРА 2025),Tina Karol,UCoV61u5mQvubNi7hJibZh5w,10,Music,"тіна кароль, тина кароль, tina karol, Шиншила, премʼєра, ця божевільна зима, ця завірюха зима, Кохання сльози маніфест, альбом Кароль, Тіна Кароль альбом, Тіна Кароль шиншила, український альбом, шиншила укр",13,https://i.ytimg.com/vi/JeevxH-R0b8/hqdefault.jpg,uk,uk,False,169,PT2M49S,hd,False,True,,,130918,7117,1400
b51C8AbRDGU,UA,2025-12-21 02:35:25.589193+00:00,2025-12-19 23:05:00+00:00,STEEL BALL RUN JoJo’s Bizarre Adventure | Official Trailer | Netflix,STEEL BALL RUN JoJo’s Bizarre Adventure | Official Trailer | Netflix,Netflix Anime,UCBSs9x2KzSLhyyA9IKyt4YA,1,Film & Animation,jojo_anime,1,https://i.ytimg.com/vi/b51C8AbRDGU/hqdefault.jpg,en,en-US,False,130,PT2M10S,hd,False,False,,,1983097,203396,10472
6HLezYzZpNo,UA,2025-12-21 02:35:25.589205+00:00,2025-12-17 12:09:47+00:00,СБЕГИ ИЛИ ПРОИГРАЕШЬ!🚫 САМАЯ ЗАЩИЩЁННАЯ ТЮРЬМА В РОБЛОКС!,СБЕГИ ИЛИ ПРОИГРАЕШЬ!🚫 САМАЯ ЗАЩИЩЁННАЯ ТЮРЬМА В РОБЛОКС!,ВЛАДУС ИГРАЕТ,UCUzkpCMREk2AGgZwT55JizA,20,Gaming,"владус, лёня, роблокс, страшный призрак роблокс, тюрьма роблокс, мой друг в тюрьме roblox, хоррор роблокс, роблокс страшилки, владус и лёня roblox, приколы роблокс, роблокс челлендж, смешной роблокс, роблокс на русском, приключения в roblox, выживание в роблокс, roblox ролик, roblox видео",17,https://i.ytimg.com/vi/6HLezYzZpNo/hqdefault.jpg,ru,ru,False,1062,PT17M42S,hd,False,True,,,899779,34603,3533
skvc6hxbg00,UA,2025-12-21 02:35:25.589215+00:00,2025-12-11 22:01:10+00:00,Max Barskih - Не складається | Official audio,Max Barskih - Не складається | Official audio,Max Barskih,UCSZP_I8E-_pRFVm90S0Zy6Q,10,Music,"Колишній, Спи, Mine, someone new, Stomach Butterfly, max barskih, макс барских, Skytech - SLAY, Skytech Remix, ЗАМАЛО, SLAY, Зорепад, Але, Новые життя, Все можливо, Max Barskih, Dorofeeva, Ритми, Макс Барскіх, Надя дорофеева, hbnvs, Ритмы, Тумани, Береги, Bestseller, Римую, Буде весна, мамо не плач, Кохаю але не зовсім, вотсап, щоб не було, Берега, Моя любовь, неверная, Українська музика, хіти україни, нова українська музіка, не плач, В твоїх очах, Sound of Bloom, Все ОК, Не складається",42,https://i.ytimg.com/vi/skvc6hxbg00/hqdefault.jpg,uk,ru,False,212,PT3M32S,hd,False,True,,,679027,14183,591
2bhLdCGBZvY,UA,2025-12-21 02:35:25.589225+00:00,2025-12-18 18:13:32+00:00,Вівці-детективи - офіційний трейлер (український),Вівці-детективи - офіційний трейлер (український),planetakino,UCrR7GJSvz481CxHQn-yXHJw,1,Film & Animation,,0,https://i.ytimg.com/vi/2bhLdCGBZvY/hqdefault.jpg,uk,uk,False,164,PT2M44S,hd,False,False,,,18472,971,32
bZLkOfkMgck,UA,2025-12-21 02:35:25.589233+00:00,2025-12-19 08:01:01+00:00,😱Я Получил СОБСТВЕННЫЙ ВЫХОД БРЕЙНРОТОВ в Steal a Brainrot! Фиксай и Sammy,😱Я Получил СОБСТВЕННЫЙ ВЫХОД БРЕЙНРОТОВ в Steal a Brainrot! Фиксай и Sammy,FixEye - Роблокс,UCwkDYwR6NT9KhQJA0ZQ9jBw,20,Gaming,"фиксай, fixeye, roblox, роблокс, прокачали мемы, steal a brainrot, steal a brainrot прохождение, секреты steal a brainrot, админ выход брейнротов, северное поле, админ выход брейнротов в steal a brainrot, админ таблица брейнротов в steal a brainrot, получаю брейнротов админ панелью, максимальная удача, админский сервер, сервер админов steal a brainrot, sammy, sammy и фиксай, брейнроты и админ выход брейнротов в steal a brainrot, максимальная удача в steal a brainrot",20,https://i.ytimg.com/vi/bZLkOfkMgck/hqdefault.jpg,ru,ru,False,1045,PT17M25S,hd,False,True,,,534924,10933,1529
gS-6zS_dMNo,UA,2025-12-21 02:35:25.589242+00:00,2025-12-19 08:00:06+00:00,Христина Соловій & Ірина Білик - Франсуа (Official Video),Христина Соловій & Ірина Білик - Франсуа (Official Video),Христина Соловій,UCa_yEJ39qu2yjF0vYbWTchw,10,Music,"Христина Соловій, Ірина Білик, Франсуа, Ирина Билык, Українська музика",5,https://i.ytimg.com/vi/gS-6zS_dMNo/hqdefault.jpg,uk,en,False,314,PT5M14S,hd,False,True,,,95299,7933,826
MPfZhgLiK6w,UA,2025-12-21 02:35:25.589250+00:00,2025-12-20 05:00:26+00:00,JUJUTSU KAISEN The Culling Game | Official Trailer | Crunchyroll,JUJUTSU KAISEN The Culling Game | Official Trailer | Crunchyroll,Crunchyroll,UC6pGDc4bFGD1_36IKv3FnYg,1,Film & Animation,"jujutsu kaisen, jujutsu kaisen anime, jjk, jjk anime, jujutsu kaisen season 3, jujutsu kaisen s3, jjk s3, crunchyroll, anime, anime pv, anime trailer, jujutsu kaisen culling game, jujutsu kaisen the culling game, jujutsu kaisen season 3 trailer, jujutsu kaisen trailer",15,https://i.ytimg.com/vi/MPfZhgLiK6w/hqdefault.jpg,en,ja,False,117,PT1M57S,hd,False,True,,,2744061,186725,7370
4sF_ukMb45I,UA,2025-12-21 02:35:25.589258+00:00,2025-12-18 18:02:56+00:00,Я ЗАШЁЛ НА ЗАПРЕЩЕННЫЙ СЕРВЕР С ЗАКРЫТОЙ БАЗОЙ В STEAL A BRAINROT В МАЙНКРАФТ!,Я ЗАШЁЛ НА ЗАПРЕЩЕННЫЙ СЕРВЕР С ЗАКРЫТОЙ БАЗОЙ В STEAL A BRAINROT В МАЙНКРАФТ!,EdisonPts,UCrpt82vHWIWZSHtNQxncPrg,20,Gaming,"эдисон, едісон, edisonpts, эдисон перец, едисон, эд, майнкрафт, minecraft, роблокс, roblox, укради брейнрот, Steal a brainrot",12,https://i.ytimg.com/vi/4sF_ukMb45I/hqdefault.jpg,ru,ru,False,2995,PT49M55S,hd,False,True,,,616051,33214,5357
X4N0puZKots,UA,2025-12-21 02:35:25.589266+00:00,2025-12-16 17:02:30+00:00,Приключения,Приключения,Oxxxymiron - Topic,UCet06fFav7tnvdauZw7EwTA,10,Music,"Oxxxymiron, Miron Fyodorov, Национальность: нет, Приключения",4,https://i.ytimg.com/vi/X4N0puZKots/hqdefault.jpg,ru,ru,False,458,PT7M38S,hd,False,True,,,186365,3271,631
tEgUvtIpFog,UA,2025-12-21 02:35:25.589273+00:00,2025-12-18 14:14:16+00:00,Человек-Паук 4 - Разбор трейлера. Серый Халк и роль Сэди Синк!,Человек-Паук 4 - Разбор трейлера. Серый Халк и роль Сэди Синк!,Marvel/DC: Geek Movies,UCQ1NsRaJAq3wc0KIdRRs5MA,1,Film & Animation,"Marvel/DC, комиксы, фильмы, Марвел, ДС, обзор, герой, Супергерой, geek, movies, гик мувис",11,https://i.ytimg.com/vi/tEgUvtIpFog/hqdefault.jpg,ru,ru,False,701,PT11M41S,hd,False,True,,,173994,5226,318
eP3yC13EaG8,UA,2025-12-21 02:35:25.589281+00:00,2025-12-20 11:26:55+00:00,"Steal a Brainrot, НО В РАЗНЫХ СТРАНАХ!","Steal a Brainrot, НО В РАЗНЫХ СТРАНАХ!",EroxBlox,UCMDSzea8f4CC53mZC3ViZug,20,Gaming,,0,https://i.ytimg.com/vi/eP3yC13EaG8/hqdefault.jpg,ru,ru,False,1153,PT19M13S,hd,False,True,,,416563,11638,1756
iY83WZP1-Pg,UA,2025-12-21 02:35:25.589288+00:00,2025-12-18 10:04:18+00:00,Троянди,Троянди,DJ KAIFAR - Topic,UCdTtv0v0xIq3Tt9chAGb8wg,10,Music,"DJ KAIFAR, Троянди",2,https://i.ytimg.com/vi/iY83WZP1-Pg/hqdefault.jpg,tg,ru,False,152,PT2M32S,hd,False,True,,,50686,839,11
L10yvkDzP_A,UA,2025-12-21 02:35:25.589296+00:00,2025-12-15 13:40:02+00:00,Дивні дива 5 | Трейлер тому 2 | Netflix,Дивні дива 5 | Трейлер тому 2 | Netflix,Netflix Ukraine,UC3sEI2Yr9zWq-q6BhpDQmVA,22,People & Blogs,"Netflix, Вайнона Райдер, Вілл Байєрс, Дастін, Девід Гарбор, Джеймі Кемпбелл Бовер, Джо Кірі, Джойс Байєрс, Джонатан Байєрс, Дивні дива 5, Калеб Маклафлін, Лукас, Майк Вілер, Макс, Мая Хоук, Міллі Боббі Браун, Наталія Даєр, Ненсі Вілер, Ноа Шнапп, Одинадцять, Робін Баклі, Седі Сінк, Стів Харрингтон, Фін Вольфгард, Чарлі Гітон, Шеф Хоппер, Ґатен Матараццо",27,https://i.ytimg.com/vi/L10yvkDzP_A/hqdefault.jpg,uk,en-US,False,134,PT2M14S,hd,False,False,,,38132,1538,72
ARIwEjcVeiY,UA,2025-12-21 02:35:25.589325+00:00,2025-12-20 08:00:18+00:00,"😱 Майнкрафт, но Мы Открыли САМУЮ ДОРОГУЮ КАРТУ • Реально • [Все Жанры Мира 2025] + Фиксплей","😱 Майнкрафт, но Мы Открыли САМУЮ ДОРОГУЮ КАРТУ • Реально • [Все Жанры Мира 2025] + Фиксплей",MrLololoshka (Роман Фильченков),UCAvrIl6ltV8MdJo3mV4Nl4Q,20,Gaming,"Лололошка, Lololoshka, MrLololoshka, Летсплей, Сборка, Скачать, Магия, Моды, Майнкрафт, Minecraft",10,https://i.ytimg.com/vi/ARIwEjcVeiY/hqdefault.jpg,ru,ru,False,4206,PT1H10M6S,hd,False,True,,,571643,47469,2535
aj3SXHg1R3Q,UA,2025-12-21 02:35:25.589335+00:00,2025-12-18 22:00:03+00:00,Ніч догорає,Ніч догорає,KALUSH - Topic,UCiC-xUtZ9NDFQCbY7bjLrpA,10,Music,"KALUSH, Agape, Ніч догорає",3,https://i.ytimg.com/vi/aj3SXHg1R3Q/hqdefault.jpg,uk,ru,False,199,PT3M19S,hd,False,True,,,44728,956,13
5qdv38i67U0,UA,2025-12-21 02:35:25.589343+00:00,2025-12-17 12:58:58+00:00,S.T.A.L.K.E.R. 2: Heart of Chornobyl — Stories Untold Trailer | Content Update,S.T.A.L.K.E.R. 2: Heart of Chornobyl — Stories Untold Trailer | Content Update,GSC Game World,UCk96JambgW5zsOBquR63iEQ,20,Gaming,"S.T.A.L.K.E.R. 2, Official Trailer, stalker 2, сталкер 2, сталкер 2 трейлер, stalker trailer, s.t.a.l.k.e.r. 2 trailer, s.t.a.l.k.e.r. 2 трейлер, трейлер сталкер 2, сталкер, stalker, s.t.a.l.k.e.r., gsc, gsc game world, xbox x, stalker 2 trailer, stalker 2 game, unreal engine, the zone, S.T.A.L.K.E.R. 2: Heart of Chernobyl, S.T.A.L.K.E.R. 2: Сердце Чернобыля, Gameplay Trailer, S.T.A.L.K.E.R. 2: Heart of Chornobyl, Серце Чорнобиля, Update 1.8, Stories Untold, Content Update",27,https://i.ytimg.com/vi/5qdv38i67U0/hqdefault.jpg,en,en,False,92,PT1M32S,hd,True,False,,,127400,10331,1001
Shw0ahxqRZo,UA,2025-12-21 02:35:25.589352+00:00,2025-12-19 19:10:44+00:00,WoT Blitz. Jingle Shells Stream,WoT Blitz. Jingle Shells Stream,World of Tanks Blitz,UC9lE09jxmMgMoG13WrNHPmA,20,Gaming,"wot, blitz, world of tanks, mobile, game, download, WoT Blitz",7,https://i.ytimg.com/vi/Shw0ahxqRZo/hqdefault.jpg,en,en,False,4156,PT1H9M16S,hd,False,False,,,234275,20196,2047
GOUt5DUDy_k,UA,2025-12-21 02:35:25.589359+00:00,2025-12-11 07:00:16+00:00,Dima PROKOPOV - Зробіть гучніше,Dima PROKOPOV - Зробіть гучніше,Dima Prokopov,UCjb-EtI123wPpzkEpY7lzgQ,10,Music,"dima prokopov, зробіть гучніше, dima prokopov зробіть гучніше, українська музика, українські пісні, українські хіти, новий кліп 2025, пісня про дівчину, пісня про кохання, жіночий трек, музика україна 2025, вірусна пісня, український поп, новинка 2025, prokopov, зробіть гучніше трек, українські новинки, музика для настрою, поп музика україна, вірусний трек 2025, Діма Прокопов, Дима Прокопов, dima prokopov - ти щаслива будеш, українськи пісні, хіти 2025, тренди ютуб",26,https://i.ytimg.com/vi/GOUt5DUDy_k/hqdefault.jpg,uk,uk,False,219,PT3M39S,hd,False,False,,,459528,5855,811
huTI9Q2Bt_A,UA,2025-12-21 02:35:25.589367+00:00,2025-12-13 14:34:01+00:00,НОВЫЕ ФИЛЬМЫ 2025 КОТОРЫЕ УЖЕ ВЫШЛИ В ХОРОШЕМ КАЧЕСТВЕ. ТОП 15! ТРЕЙЛЕРЫ. ЛУЧШИЕ НОВИНКИ КИНО. ОБЗОР,НОВЫЕ ФИЛЬМЫ 2025 КОТОРЫЕ УЖЕ ВЫШЛИ В ХОРОШЕМ КАЧЕСТВЕ. ТОП 15! ТРЕЙЛЕРЫ. ЛУЧШИЕ НОВИНКИ КИНО. ОБЗОР,КиноИндустрия,UCBm7fNtPB_mvIWWWPjaVPDA,24,Entertainment,"фильмы, фильм, фильмов, кино, фильмы 2026, фильмы 2024, фильмы 2025, фильмы 2025 которые уже вышли, фильмы 2024 которые уже вышли, которые уже вышли, в хорошем качестве, вышедшие, лучшие фильмы 2025, лучшие фильмы 2024, самые ожидаемые фильмы, смотреть, онлайн, топ, краткий пересказ, треш, обзор, лучшие, классные, новые, новые фильмы, новинки кино, топ фильмов, что посмотреть, трейлеры, русские, сериалы, новые сериалы, сериалы 2025, фантастика, фэнтези, комедии, ужасы, боевик, movies, 2026, 2024, 2025",42,https://i.ytimg.com/vi/huTI9Q2Bt_A/hqdefault.jpg,ru,ru,False,1351,PT22M31S,hd,False,True,,,200689,2992,203
LzhoCK8Z8WM,UA,2025-12-21 02:35:25.589376+00:00,2025-12-19 12:00:53+00:00,6 НОЧЕЙ С КОМПОТОМ 404 В МАЙНКРАФТ | Компот Minecraft,6 НОЧЕЙ С КОМПОТОМ 404 В МАЙНКРАФТ | Компот Minecraft,Компот,UC0cWWruNMb95iCBEOzPnjRA,20,Gaming,"компот, майнкрафт, compot, minecraft, компот в майнкрафте, игры, роман компот, майн, 6 ночей с компотом 404 в майнкрафт, шесть ночей в майнкрафт, шесть ночей, 6 ночей, шесть, шесть в майнкрафт, компот в майнкрафт, компот 404 в майнкрафт, компот 404, ошибка 404 в майнкрафт, ошибка 404, проклятый компот в майнкрафт, красный компот, красный, красный в майнкрафт, ночь, ночь в майнкрафт, красная ночь в майнкрафт, луна, красная луна в майнкрафт, страшилка в майнкрафт, страшилка, 404, хоррор",32,https://i.ytimg.com/vi/LzhoCK8Z8WM/hqdefault.jpg,ru,ru,False,858,PT14M18S,hd,True,True,,,499698,20606,3353
OR1WqTqy5nc,UA,2025-12-21 02:35:25.589384+00:00,2025-12-18 10:05:24+00:00,Квіти на підвіконні,Квіти на підвіконні,kavabanga Depo kolibri - Topic,UCQPj-oR_n6ia-qQwpboj3vw,10,Music,"kavabanga Depo kolibri, Плісакін Олександр, Лелюк Дмитро, Квіти на підвіконні",4,https://i.ytimg.com/vi/OR1WqTqy5nc/hqdefault.jpg,uk,ru,False,138,PT2M18S,hd,False,True,,,42331,1308,19
18aQjBIQErE,UA,2025-12-21 02:35:25.589391+00:00,2025-12-18 13:49:26+00:00,МОЙ ДРУГ ЖИВЁТ В МАКДОНАЛДСЕ!🍟😱 ЧТО ВНУТРИ? МАЙНКРАФТ,МОЙ ДРУГ ЖИВЁТ В МАКДОНАЛДСЕ!🍟😱 ЧТО ВНУТРИ? МАЙНКРАФТ,ВЛАДУС,UCPG6OP7eL7kLuyFpQMdqYSA,20,Gaming,"Владус, Vladus, игра майнкрафт, игра minecraft, майнкрафт, minecraft, маенкрафт, минекрафт, манкрафт, миникрафт, владус лайфхаки, майнкрафт смотреть, смотреть майнкрафт, смотреть minecraft, minecraft смотреть, майнкрафта, скачать майнкрафт, майнкрафт играть, майнкрафт приключение, секретная комната, майнкрафт секрет, владус секрет, владус ресторан, построил ресторан, майнкрафт ресторан, макдональдс, мак, майнкрафт мак, майнкрафт макдональдс",29,https://i.ytimg.com/vi/18aQjBIQErE/hqdefault.jpg,ru,ru,False,801,PT13M21S,hd,False,True,,,467298,17671,960
MHUyo6iK5mo,UA,2025-12-21 02:35:25.589399+00:00,2025-12-11 10:02:22+00:00,Ти моя маленька,Ти моя маленька,LIVE у твій LIFE - Topic,UCIKNVLYQEwglO5aFNCWKJUg,10,Music,"LIVE у твій LIFE, Ти моя маленька",2,https://i.ytimg.com/vi/MHUyo6iK5mo/hqdefault.jpg,uk,ru,False,151,PT2M31S,hd,False,True,,,280111,4369,56
mbIfIxKUpHo,UA,2025-12-21 02:35:25.589410+00:00,2025-12-20 09:01:19+00:00,СБЕЖАЛ ОТ ЗЛЫХ РОДИТЕЛЕЙ НА НОВЫЙ ГОД!😱 НОВОГОДНИЙ МОД В SCHOOLBOY RUNAWAY😨,СБЕЖАЛ ОТ ЗЛЫХ РОДИТЕЛЕЙ НА НОВЫЙ ГОД!😱 НОВОГОДНИЙ МОД В SCHOOLBOY RUNAWAY😨,Holy Baam,UCHVY_-jY-FayjszyX1nlGtQ,23,Comedy,"holy baam, леонид форостов, холи бам, холи баам, холибам, holybaam, holybam, shorts",8,https://i.ytimg.com/vi/mbIfIxKUpHo/hqdefault.jpg,ru,ru,False,977,PT16M17S,hd,False,True,,,248158,16323,1172
vPSYqcVFk-w,UA,2025-12-21 02:35:25.589421+00:00,2025-12-17 07:59:08+00:00,На мурмулях,На мурмулях,Это Радио - Topic,UCLS2LjQ7O04h_Hzul7wsI8g,10,Music,"Это Радио, На мурмулях",2,https://i.ytimg.com/vi/vPSYqcVFk-w/hqdefault.jpg,ru,ru,False,146,PT2M26S,hd,False,True,,,209860,4371,0
AskiQMn87A8,UA,2025-12-21 02:35:25.589429+00:00,2025-12-20 09:00:27+00:00,"😱ХАРДКОРНЫЕ ПРЯТКИ За МОБОВ в ЗАГОНЕ! + Градус, Фиксплей, Кабан, Райм","😱ХАРДКОРНЫЕ ПРЯТКИ За МОБОВ в ЗАГОНЕ! + Градус, Фиксплей, Кабан, Райм",Юни,UCO4hWU1s0caDEscdVV0my-A,20,Gaming,"канал юни, Юни, Юни майнкрафт, майнкрафт девочка, майнкрафт, майнкрафт но, девушка в майнкрафт, юни майнкрафт но, экстремальные прятки, прятки майнкрафт, райм прятки, майнкрафт прятки, фиксплей, градус, юни, кабан майнкрафт прятки, градус прятки, фиксплей прятки, прятки за мобов, прятки в загоне, хардкорные прятки, прятки в загоне 2",22,https://i.ytimg.com/vi/AskiQMn87A8/hqdefault.jpg,ru,ru,False,1563,PT26M3S,hd,False,True,,,215110,13436,640
spONOKGhksM,UA,2025-12-21 02:35:25.589437+00:00,2025-12-12 16:41:53+00:00,Коло тебе,Коло тебе,Василь Білоус - Topic,UCWPzrUGN-Qv1AFmVxZ3_DwQ,10,Music,"Василь Білоус, Коло тебе",2,https://i.ytimg.com/vi/spONOKGhksM/hqdefault.jpg,uk,uk,False,162,PT2M42S,hd,False,True,,,222238,4909,72
ajEMq5ekDbU,UA,2025-12-21 02:35:25.589445+00:00,2025-12-19 08:02:38+00:00,Ep 1: The Pool Pee-er Strikes - Everyone's been peed on!,Ep 1: The Pool Pee-er Strikes - Everyone's been peed on!,Brawl Stars,UCooVYzDxdwTtGYAkcPmOgOw,20,Gaming,"brawl stars, mobile game, mobile strategy game, mobile rpg, mobile battle royale, battle royale, supercell game, pierce, velociraptor trio, new brawler, brawl animations, doug, buzz",13,https://i.ytimg.com/vi/ajEMq5ekDbU/hqdefault.jpg,en,en,False,88,PT1M28S,hd,True,True,,,2488944,75251,3701
6Av312g4WTk,UA,2025-12-21 02:35:25.589453+00:00,2025-12-19 08:00:38+00:00,alyona alyona & FIÏNKA - Гості,alyona alyona & FIÏNKA - Гості,alyona alyona,UCX74kjhVcdu05Dm54BnQgyw,10,Music,,0,https://i.ytimg.com/vi/6Av312g4WTk/hqdefault.jpg,uk,en,False,150,PT2M30S,hd,False,True,,,53541,2661,83
9-q5b9taGlA,UA,2025-12-21 02:35:25.589460+00:00,2025-12-19 08:00:20+00:00,😱Я Добавил ФРЕДБЕРА и Мы Выжили 99 Ночей в Майнкрафт.. | Фиксай,😱Я Добавил ФРЕДБЕРА и Мы Выжили 99 Ночей в Майнкрафт.. | Фиксай,FixEye,UCCiGUQiWcz3lKev49TX8-Ew,20,Gaming,"майнкрафт, майнкрафт но, я добавил сиреноголового, майнкрафт хоррор, фиксай хоррор, ФРЕДБЕР проник в наш дом, ФРЕДБЕР псих, ФРЕДБЕР проник в дом в майнкрафт, майнкрафт но с ФРЕДБЕРом, майнкрафт но я ФРЕДБЕР, как пройти майнкрафт с фредбером, фиксай, fixeye, супер ФРЕДБЕР",14,https://i.ytimg.com/vi/9-q5b9taGlA/hqdefault.jpg,ru,ru,False,1341,PT22M21S,hd,False,True,,,346955,14750,2260
1J947kcwXzk,UA,2025-12-21 02:35:25.589467+00:00,2025-11-21 14:19:19+00:00,Ba Ra Ra Ram,Ba Ra Ra Ram,PARDY - Topic,UCqQSpqQltM-075MxYL2EO_g,10,Music,"PARDY, Techno Pub, Ba Ra Ra Ram",3,https://i.ytimg.com/vi/1J947kcwXzk/hqdefault.jpg,en,en,False,177,PT2M57S,hd,False,True,,,694657,16100,73
R7h5VOKwjd4,UA,2025-12-21 02:35:25.589475+00:00,2025-12-14 12:38:33+00:00,я вернулся в майнкрафт,я вернулся в майнкрафт,Данкар,UCcvSMLuj0OcAASPsTyVlzBA,24,Entertainment,ДАНКАР,1,https://i.ytimg.com/vi/R7h5VOKwjd4/hqdefault.jpg,uk,ru,False,2914,PT48M34S,hd,False,True,,,1282222,130557,18281
pStppaihsow,UA,2025-12-21 02:35:25.589482+00:00,2025-12-18 10:05:08+00:00,Хто ти такий?,Хто ти такий?,GROSU - Topic,UCcqQ8af7JPMZtGAqffSKTfQ,10,Music,"GROSU, Нікіта Кісельов, Хто ти такий?",3,https://i.ytimg.com/vi/pStppaihsow/hqdefault.jpg,uk,ru,False,179,PT2M59S,hd,False,True,,,26954,460,10
5-4MtdicEa8,UA,2025-12-21 02:35:25.589489+00:00,2025-12-17 15:00:12+00:00,Он Преследовал нас 2 МЕСЯЦА в Раст/Rust,Он Преследовал нас 2 МЕСЯЦА в Раст/Rust,esQa,UCLKHPmYnzMAJV9AVrWRrusA,20,Gaming,"раст, rust, раст выживание, раст рейд, онлайн рейд, бункер раст, антирейд раст, rust solo, рейд клана в онлайне, угадал пароль, соло, кланы, взломал пароль, антирейд, раст rust, ловушка на воде, bodyafell, серный бизнес раст, esqa, эска, клан китайцев, раст фильм, ПРОНИК в ДОМ, клан читеров, азия, ловушка ферма, rustroom, ОАЗИС и АЙСБЕРГ, отключили магазины, оаст, ОГРАБИЛИ ЧИТЕРОВ, ОСТРОВ РАЗБОЙНИКОВ, ПРОНИК и ОГРАБИЛ КИТАЙСКИЙ КЛАН, Мы Выживали 2 Месяца под ПРИЦЕЛОМ ЧИТЕРА",34,https://i.ytimg.com/vi/5-4MtdicEa8/hqdefault.jpg,ru,ru,False,8659,PT2H24M19S,hd,False,True,,,458785,20932,1810
oCT142AEk1Q,UA,2025-12-21 02:35:25.589498+00:00,2025-12-11 10:01:22+00:00,мультивсесвіт,мультивсесвіт,Nikow - Topic,UCRbx7w-lK6pthg79Z-dEWNw,10,Music,"Nikow, Ніков Дмитро Олександрович, мультивсесвіт",3,https://i.ytimg.com/vi/oCT142AEk1Q/hqdefault.jpg,uk,uk,False,194,PT3M14S,hd,False,True,,,247177,5327,130
8LgRT0VLk9A,UA,2025-12-21 02:35:25.589505+00:00,2025-12-14 10:06:03+00:00,ГЛЕНТ Затроллил меня USB Флешкой в Реальной Жизни?,ГЛЕНТ Затроллил меня USB Флешкой в Реальной Жизни?,Domer Grief,UCb5oqCZ4AfmfXbgHsfei0tQ,20,Gaming,"майнкрафт, глент, domer, roblox, троллинг, ГЛЕНТ Прислал МНЕ USB Флешку в Реальной Жизни? (Затроллен), тролинг домера, троллинг стримера в роблоксе, затролил стримера, троллинг донатами, ГЛЕНТ, glent, домер, домер гриф, domer grief, домер троллинг глента, домер затроллил глента, рилик, рили ворлд, а4, глент роблокс, домер роблокс, укради брейнрота, роблокс укради брейнрот, домер глент, домер флешка, флешка, usb флешка, флешка троллинг, глент usb флешка, глент домер, домер глент флешка",32,https://i.ytimg.com/vi/8LgRT0VLk9A/hqdefault.jpg,ru,ru,False,1471,PT24M31S,hd,False,True,,,1228576,74264,5765
