video_id,country,fetched_at,published_at,title,localized_title,channel_title,channel_id,category_id,category_name,tags,tag_count,thumbnail,default_language,audio_language,is_live,duration,duration_raw,definition,caption_available,licensed_content,embeddable,made_for_kids,views,likes,comments
r3a2kWHwIio,UA,2025-12-21 02:35:25.589513+00:00,2025-12-19 10:04:26+00:00,Плакуча гітара,Плакуча гітара,OnoychenkoCoverMusic - Topic,UCOZTIMk-63Y3Sv9qcMMzgwA,10,Music,"OnoychenkoCoverMusic, Плакуча гітара",2,https://i.ytimg.com/vi/r3a2kWHwIio/hqdefault.jpg,be,uk,False,250,PT4M10S,hd,False,True,,,15097,156,0
xAv9CphG0XU,UA,2025-12-21 02:35:25.589520+00:00,2025-12-18 11:15:00+00:00,😨 Майнкрафт но ЖИЗНЬ КОТА от Рождения До Смерти!,😨 Майнкрафт но ЖИЗНЬ КОТА от Рождения До Смерти!,Скретч,UCbIxZ4MRRtYDHJ7gthi-ZYQ,20,Gaming,"Скретч, Scratch1337, майнкрафт, как пройти майнкрафт, minecraft, майнкрафт но, тумка, Майнкрафт, Скретч MINECRAFT, кот, кот в майнкрафте, кот майнкрафт, помощник в майнкрафте, помощник, помощник майнкрафт, кот помощник, майнкрафт но я стал помощником, майнкрафт но я стал помощником котом, как пройти майнкрафт если ты кот, майнкрафт но я стал котом, майнкрафт помощник, я стал помощником, я стал помощником скретч, я стал помощником котом, бискас, врискас",26,https://i.ytimg.com/vi/xAv9CphG0XU/hqdefault.jpg,ru,ru,False,992,PT16M32S,hd,False,True,,,213144,5007,427
KNgBkylXqgk,UA,2025-12-21 02:35:25.589528+00:00,2025-12-18 22:00:31+00:00,Пальто,Пальто,DOVI - Topic,UC_CtrmcTum9aj4Lsw3jSKTg,10,Music,"DOVI, Пальто",2,https://i.ytimg.com/vi/KNgBkylXqgk/hqdefault.jpg,uk,uk,False,163,PT2M43S,hd,False,True,,,23937,419,8
4gBfj-P7CfE,UA,2025-12-21 02:35:25.589535+00:00,2025-12-19 13:28:37+00:00,Как я играл в Mafia 2,Как я играл в Mafia 2,Нарратор,UC1ppJCQhKVPm7INQcy7OWlA,20,Gaming,"mafia, mafia 2, definitive edition, как я играл в mafia 2, mafia 2 сюжет, mafia 2 обзор, mafia 2 прохождение, mafia 2 приколы, mafia 2 летсплей, мафия, мафия 2, дифинитив идишн, как я играл в мафия 2, мафия 2 сюжет, мафия 2 прохождение, мафия 2 летсплей, вито, джо, приколы, смешные моменты, джо в сделку не входил, нарратор, наратор, narrator, нарратор мафия, как я играл",26,https://i.ytimg.com/vi/4gBfj-P7CfE/hqdefault.jpg,ru,ru,False,6471,PT1H47M51S,hd,False,True,,,358738,21998,2051
rLJ_zUdntmE,UA,2025-12-21 02:35:25.589544+00:00,2025-12-18 07:00:44+00:00,СКРУДЖИ - АЛЛО,СКРУДЖИ - АЛЛО,Скруджи,UC2quboSGYjZGjOERLY2wuLg,10,Music,"СКРУДЖИ, АЛЛО, ало",3,https://i.ytimg.com/vi/rLJ_zUdntmE/hqdefault.jpg,en,uk,False,165,PT2M45S,hd,False,False,,,33968,2359,253
iRVX658eLbw,UA,2025-12-21 02:35:25.589551+00:00,2025-12-19 21:58:29+00:00,WoT Blitz. Новогодний стрим,WoT Blitz. Новогодний стрим,WoT Blitz Без Границ,UCTYROXn9sgc3OrnTvi0wl7w,20,Gaming,,0,https://i.ytimg.com/vi/iRVX658eLbw/hqdefault.jpg,ru,ru,False,4885,PT1H21M25S,hd,False,False,,,80992,5630,856
pei-SxKkaTI,UA,2025-12-21 02:35:25.589558+00:00,2025-12-19 08:01:11+00:00,КРАЩІ КОЛЯДКИ 🎄 Українські різдвяні колядки • Різдво • Святкова збірка,КРАЩІ КОЛЯДКИ 🎄 Українські різдвяні колядки • Різдво • Святкова збірка,MUSIC PLANET GM,UCId-jzkri2kQeTzT13SjzjA,10,Music,"українські хіти, українські пісні, українська музика, музика, пісні, збірка українських пісень, кращі пісні, популярні українські пісні, українські хіти 2025, українські пісні 2025, українська музика 2025, пісні 2025, #MusicPlanetGM",13,https://i.ytimg.com/vi/pei-SxKkaTI/hqdefault.jpg,uk,uk,False,2874,PT47M54S,hd,False,True,,,25937,200,6
gxdba_ZXbDE,UA,2025-12-21 02:35:25.589565+00:00,2025-12-14 13:01:17+00:00,"ДЕРЕВНЯ ""НУБИКОВ""! Я зашел в РАСТ В СОЛО, но ЧТО-ТО пошло не ТАК! ЛУЧШЕЕ ВЫЖИВАНИЕ! CheZee. Rust","ДЕРЕВНЯ ""НУБИКОВ""! Я зашел в РАСТ В СОЛО, но ЧТО-ТО пошло не ТАК! ЛУЧШЕЕ ВЫЖИВАНИЕ! CheZee. Rust",CheZee,UCOyKtXwAm6ALJ1-r3nugR5Q,20,Gaming,"Соло раст, раст соло, кгые, раст, rust, руст, Деревня нубиков, Деревня новичков, раст выживание, выживание в расте, я зашел в соло, но что-то пошло не так, что-то пошло не так, раст в соло, чизи, chezee, сруяуу, xbpb, чиз, папачиз, типичный раст, Лучшее выживание, раст новички, деревня в расте, деревня новичков, раст деревня, соло раст, растик, настоящий раст, нубики раст, новички раст",31,https://i.ytimg.com/vi/gxdba_ZXbDE/hqdefault.jpg,ru,ru,False,7411,PT2H3M31S,hd,False,True,,,919545,50599,2406
mW2DvvgXH4w,UA,2025-12-21 02:35:25.589573+00:00,2025-12-19 07:00:51+00:00,Олена Тополя - 25 годин,Олена Тополя - 25 годин,Олена Тополя,UC-sE7hozdZzofh4VnBKVX_g,10,Music,"олена тополя, Олена Тополя, Alyosha, 25 годин, нова пісня 2025, українська музика, новинка 2025, прем’єра кліпу, пісня про кохання, новий трек Олена Тополя, Обеззброєна текст, українські пісні 2025, хіт 2025, емоційна пісня, музика 2025 Україна, нова пісня Alyosha, пісні про кохання, Каштан, премʼєра пісні, olena topolia, український кліп, сильна пісня, новий кліп 2025, пісня з душею, українські пісні, хочеш, пісня, в пульсі дофамін, Я твій океан",29,https://i.ytimg.com/vi/mW2DvvgXH4w/hqdefault.jpg,uk,uk,False,162,PT2M42S,hd,False,True,,,32442,2062,289
BlrHRKvbI14,UA,2025-12-21 02:35:25.589581+00:00,2025-12-18 13:00:00+00:00,ЗАРЕЙДИЛ МЭРА НОВЫМИ БЕЗУМНЫМИ БРЕЙНРОТАМИ в VR в Garry’s Mod,ЗАРЕЙДИЛ МЭРА НОВЫМИ БЕЗУМНЫМИ БРЕЙНРОТАМИ в VR в Garry’s Mod,DRЫNDA,UCc7eC3oct63oVOuHCOFmAeg,20,Gaming,"garry's mod, гаррис мод, дарк рп, gmod, гмод, даркрп, гарис мод, garrys mod, гмод даркрп, дрында, DRЫNDA, дрында гаррис мод, угар, безумие, мемов, животных, рейд, рейды, зарейдил, мэр, мэра, мер, рейдим, рейда, роблокс, roblox, в роблоксе, челлендж, челендж, игра, игре, игру, брейнрот, итальянские, мемы, брейнроты, укради, steal a brainrot, мем, brainrot, украл, удача, удачу, брейнротов, укради брейнрот, vr, виар, виаре, виартуальная реальность, брейнротами, секретные, секретными, новыми, новые, мемами, безумными, брейн рот",57,https://i.ytimg.com/vi/BlrHRKvbI14/hqdefault.jpg,ru,ru,False,1381,PT23M1S,hd,True,True,,,260300,4437,658
7iF5zDpGtMQ,UA,2025-12-21 02:35:25.589590+00:00,2025-12-13 07:45:00+00:00,"Ostap Drivko, Yaski - Лелій","Ostap Drivko, Yaski - Лелій",Ostap Drivko,UCa_4Y-zyaQ0kfGx3PwsZcyg,10,Music,,0,https://i.ytimg.com/vi/7iF5zDpGtMQ/hqdefault.jpg,uk,uk,False,200,PT3M20S,hd,False,True,,,105660,1887,154
nRnGtsKsnMw,UA,2025-12-21 02:35:25.589597+00:00,2025-12-20 07:21:25+00:00,МАМА ПРИШЛА В КОМНАТУ С ТОПОРОМ... (Gretel & Hansel REMAKE),МАМА ПРИШЛА В КОМНАТУ С ТОПОРОМ... (Gretel & Hansel REMAKE),ShadowPriestok - Евгений Чернявский,UC-ZROtSKHGERKmfuYL0AryQ,20,Gaming,"shadowpriestok, шадоуперсик, шадоупристок, жека, дека, чернявский, jeka, джека, шадовпристок, евгений, Gretel & Hansel, гретель и гензель, gretel & hansel ремейк, жека гретель и гензель, Gretel & Hansel прохождение, gretel & hansel на русском, гретель и хензель хоррор, мама с топором",18,https://i.ytimg.com/vi/nRnGtsKsnMw/hqdefault.jpg,ru,ru,False,819,PT13M39S,hd,False,True,,,136349,3452,490
IVHxb3wzuuU,UA,2025-12-21 02:35:25.589605+00:00,2025-12-12 10:00:35+00:00,Лелій,Лелій,Ostap Drivko - Topic,UCeMWhN4hZBE8eoASO_mREyQ,10,Music,"Ostap Drivko, Yaski, Лелій",3,https://i.ytimg.com/vi/IVHxb3wzuuU/hqdefault.jpg,uk,uk,False,198,PT3M18S,hd,False,True,,,118877,2032,0
