video_id,country,fetched_at,published_at,title,localized_title,channel_title,channel_id,category_id,category_name,tags,tag_count,thumbnail,default_language,audio_language,is_live,duration,duration_raw,definition,caption_available,licensed_content,embeddable,made_for_kids,views,likes,comments
HOMc-Q2i0jk,IN,2026-01-02 02:32:43.832600+00:00,2025-12-31 06:42:01+00:00,"#4K_Video | 1 जनवरी | #Khesari Lal Yadav, #Shilpi Raj | 1 January | New Year Song Khesari Lal","#4K_Video | 1 जनवरी | #Khesari Lal Yadav, #Shilpi Raj | 1 January | New Year Song Khesari Lal",Sunhra Bhojpuri,UCkUSjqnk26KpKB_A5t_Wa1g,10,Music,"Bhojpuri, khesari lal yadav bhojpuri song, khesari lal yadav new song, khesari lal new song, khesari lal yadav, khesari lal new song 2025, 1 january khesari lal song, 1 january song khesari lal, 1 january song, new song khesari lal ke, new bhojpuri song, new bhojpuri hit song, bhatar ke engine new bhojpuri song, khesari lal shilpi raj bhojpuri song, khesari lal yadav ke gana, 1 january bhojpuri song, 1 january, 1 january khesari lal, 1 january 2026, happy new year song",20,https://i.ytimg.com/vi/HOMc-Q2i0jk/hqdefault.jpg,en,bh,False,461,PT7M41S,hd,false,True,,,410476,3976,53
5XR2NQBCseE,IN,2026-01-02 02:32:43.832608+00:00,2026-01-01 13:28:07+00:00,"""Jananayagan Trailer Update""🔥l ""Thalaivar173 Confusion""😳l ""Parasakthi Cameos""🔥l By Delite Cinemas 💫","""Jananayagan Trailer Update""🔥l ""Thalaivar173 Confusion""😳l ""Parasakthi Cameos""🔥l By Delite Cinemas 💫",Delite Cinemas,UCAPY9agmayYQ5-tYikGlxhA,24,Entertainment,"Jananayagan Trailer Update, Jananayagan Trailer Delay, Thalapathy Vijay, Jananayagan Bhagavanth Kesari, Thalaivar 173 Announcement, KH237 update, STR51 Shoot, Ashwath Marimuthu, Arasan Shooting, Sivakarthikeyan, Parasakthi Trailer and Audio Launch, Parasakthi Combo Again, Sudha kongara About Parasakthi, Hvinoth Interview about Jananayagan",14,https://i.ytimg.com/vi/5XR2NQBCseE/hqdefault.jpg,en,ta,False,496,PT8M16S,hd,false,True,,,34519,2342,69
akWFKxMprOI,IN,2026-01-02 02:32:43.832615+00:00,2025-12-31 12:38:57+00:00,FRANKLIN'S house UPGRADE in ARMY TANK HOUSE in Indian bikes driving 3D || Funntyaa ,FRANKLIN'S house UPGRADE in ARMY TANK HOUSE in Indian bikes driving 3D || Funntyaa ,Funntyaa,UCgaHX1_q2yKar32rnYutEKw,20,Gaming,,0,https://i.ytimg.com/vi/akWFKxMprOI/hqdefault.jpg,en-IN,hi,False,957,PT15M57S,hd,false,True,,,305482,4341,235
bbTyGIhvGgM,IN,2026-01-02 02:32:43.832621+00:00,2025-12-30 03:00:20+00:00,FA9LA (Fasla) | Trending song | dhurandhara,FA9LA (Fasla) | Trending song | dhurandhara,Hunter Birla,UCsrDsOTnMAfhpV6Kp11Sb-w,10,Music,"flipperachi, fa9la, hip hop, arabic hip hop, new song",5,https://i.ytimg.com/vi/bbTyGIhvGgM/hqdefault.jpg,en,hi,False,331,PT5M31S,hd,false,False,,,2902859,16029,391
FweuFBMSDDc,IN,2026-01-02 02:32:43.832628+00:00,2025-12-30 08:08:57+00:00,The RajaSaab Trailer 2 REVIEW | Deeksha Sharma,The RajaSaab Trailer 2 REVIEW | Deeksha Sharma,Filmi Indian,UCeiAKuJGZrIjYvaq0nMwbJg,24,Entertainment,"the rajasaab, the rajasaab trailer 2, the rajasaab trailer 2 review, prabhas, sanjay dutt, Malavika Mohanan, Nidhhi Agerwal, maruthi, the raja saab, the raja saab trailer, the raja saab trailer review, prabhas raja saab, prabhas movie, hindi, teaser, trailer, review, reaction, raja saab, full movie, hindi dubbed, filmi indian, the raja saab reaction, the rajasaab review, The RajaSaab Trailer 2.0, T-Series",26,https://i.ytimg.com/vi/FweuFBMSDDc/hqdefault.jpg,en,hi,False,246,PT4M6S,hd,false,True,,,325789,13651,1088
_FL4VhTYhC8,IN,2026-01-02 02:32:43.832635+00:00,2026-01-01 08:26:57+00:00,How I Became a SPY in my OWN Minecraft Server,How I Became a SPY in my OWN Minecraft Server,PSD2,UCYtE15DhBwiCSIMcrrelKGQ,20,Gaming,"lifesteal smp, minecraft smp, minecraft, minecraft hardcore, lifesteal, smp, minecraft survival, minecraft shorts, parrot lifesteal smp, how i ended an entire minecraft smp, lifesteal smp ip, minecraft server, lifesteal smp applications, i destroyed my school's minecraft smp, minecraft lifesteal smp, hacker killed me in lifesteal smp, why i got banned on my school’s minecraft server, tru minecraft, truoriginal minecraft, firemc, I Became a SPY in my OWN Minecraft Server FireMC",21,https://i.ytimg.com/vi/_FL4VhTYhC8/hqdefault.jpg,en,en,False,2596,PT43M16S,hd,false,True,,,384300,17642,1576
GV8s23gn2Mk,IN,2026-01-02 02:32:43.832643+00:00,2025-12-31 02:00:17+00:00,#Video - मुर्गा VS बियर | TunTun Yadav & Prabha Raj | #top10 Hits | Bhojpuri New Year Song 2026,#Video - मुर्गा VS बियर | TunTun Yadav & Prabha Raj | #top10 Hits | Bhojpuri New Year Song 2026,Tuntun Yadav Sangeet,UClzqLsD7sJvYka9KcxWdVDw,10,Music,"मुर्गा VS बियर | TunTun Yadav & Prabha Raj, naya sal me ek ek paik piya sa, bhojpuri status video, tuntun yadav new song, मुर्गा v/s बियर /, tuntun yadav ke rangdari song, tuntun yadav new song dj, new bhojpuri song tuntun yadav, bhojpuri song, naya sal ke gana 2026, bhojpuri new year song 2026, new year song 2026, bhojpuri new song happy new year, tuntun yadav new year song 2026, tuntun yadav ka song, happy new year song 2026, naya sal bhojpuri song, badhai naya sal ke",18,https://i.ytimg.com/vi/GV8s23gn2Mk/hqdefault.jpg,hi,bh,False,978,PT16M18S,hd,false,True,,,93449,1006,9
5FlhxOtwxG8,IN,2026-01-02 02:32:43.832651+00:00,2026-01-01 03:40:35+00:00,Jana Nayagan Trailer | Thalapathy Vijay | H Vinoth | @AnirudhOfficial | Trailer 💥 |one last time 🥺 |,Jana Nayagan Trailer | Thalapathy Vijay | H Vinoth | @AnirudhOfficial | Trailer 💥 |one last time 🥺 |,typical.strange_🧞,UC_NW7cssfLTAtDS8C-LvLbA,22,People & Blogs,,0,https://i.ytimg.com/vi/5FlhxOtwxG8/hqdefault.jpg,en,ta,False,183,PT3M3S,hd,false,True,,,110454,2780,36
6heejVJUo4g,IN,2026-01-02 02:32:43.832657+00:00,2026-01-01 03:33:51+00:00,WELCOME TO 2026  | BGMI LIVE |#ericislive #bgmi #shorts #verticallive,WELCOME TO 2026  | BGMI LIVE |#ericislive #bgmi #shorts #verticallive,ERIC is LIVE,UCCAJcmA8Af9-zTDZaegc_YA,20,Gaming,"granny, bgmi, pubg, eric is live, ERIC IS LIVE, BGMI SHORTS, bgmi crate opening",7,https://i.ytimg.com/vi/6heejVJUo4g/hqdefault.jpg,en,en-IN,False,7604,PT2H6M44S,hd,false,True,,,518018,5562,0
bHqOoRsnQwA,IN,2026-01-02 02:32:43.832665+00:00,2026-01-01 01:15:06+00:00,Happy New Year 2026 | Nonstop Dj Song 2026 | (1 January 2026) | 31 December Dj Happy New Year Song,Happy New Year 2026 | Nonstop Dj Song 2026 | (1 January 2026) | 31 December Dj Happy New Year Song,Sannu Kumar,UC1vWfTqDhpuDS2VmjLIpZnQ,10,Music,"happy new year 2026, nonstop dj song 2026, 1 january 2026, 31 december, dj happy new year songs, 31 december ka gana, dj happy new year 2026, 1 january ka gana, 1 january ke gana, Happy New Year Song | Naya Sal Ka Gana 2026 | Happy New Year 2026 Dj Song | Naya Saal Ke Gana, Happy New Year Song, Naya Sal Ka Gana 2026, Happy New Year 2026 Dj Song, Naya Saal Ke Gana, happy new year dj song 2026, happy new year nonstop dj song 2026, happy new year song 2026, new year song 2026, dj",19,https://i.ytimg.com/vi/bHqOoRsnQwA/hqdefault.jpg,en,mai,False,468,PT7M48S,hd,false,True,,,343701,2701,55
Bw6H-Ir1YJs,IN,2026-01-02 02:32:43.832672+00:00,2025-12-31 06:30:00+00:00,Eko | Official Trailer | Sandeep Pradeep | Dinjith Ayyathan | Netflix India,Eko | Official Trailer | Sandeep Pradeep | Dinjith Ayyathan | Netflix India,Netflix India,UCZSNzBgFub_WWil6TOTYwAg,24,Entertainment,"dinjith ayyathan, dinjith ayyathan interview, dinjith ayyathan movie ringtone, dinjith ayyathan movies, dinjith ayyathan new movie, eko, eko malayalam trailer, eko malayalam trailer reaction, eko official teaser, eko official trailer reaction, eko trailer, eko trailer cinemondo, eko trailer reaction cinemondo, sandeep pradeep, sandeep pradeep bgm, sandeep pradeep interview, sandeep pradeep new movie, sandeep pradeep pookie",18,https://i.ytimg.com/vi/Bw6H-Ir1YJs/hqdefault.jpg,en,en-US,False,142,PT2M22S,hd,true,False,,,195754,2227,131
X8Fdxj8Wrtc,IN,2026-01-02 02:32:43.832680+00:00,2026-01-01 07:11:50+00:00,What's Secret Inside Scary Entities Head in Minecraft..,What's Secret Inside Scary Entities Head in Minecraft..,AlphaExtra,UCQVfy3QRi9zM7hp1m6ECKcg,20,Gaming,"solar smash, AlphaExtra, Alphaextra minecraft, minecraft, minecraft scary, roblox, trolling, minecraft scary myths, scary, MrAlpha, Mralpha, MrAlpha13, solar smash game, scary myths, Eystreem, roleplay, funny, secret, hidden, minecraft phone, minecraft bedrock edition, solving minecraft mysteries, solving minecraft myths, scary minecraft myths, scary minecraft mysteries, scary minecraft seeds, scary minecraft stories, minecraft ancient gods, mralpha13, proboize95, dark minecraft mystery",31,https://i.ytimg.com/vi/X8Fdxj8Wrtc/hqdefault.jpg,en,en,False,1569,PT26M9S,hd,false,True,,,230163,3926,371
EljAbI3rt9U,IN,2026-01-02 02:32:43.832687+00:00,2025-12-31 23:00:21+00:00,2026 New Year Special Song - हैप्पी न्यू ईयर - Devesh Kundan - नया साल का भजन - New Year Bhajan,2026 New Year Special Song - हैप्पी न्यू ईयर - Devesh Kundan - नया साल का भजन - New Year Bhajan,Ambey Bhakti,UC5fbdgYVnVwnEcM2KnaeZ0g,10,Music,"2025 new year bhajan, 2025 नया साल भजन, 2026 New Year Special Song, Angel, Devesh Kundan, Happy New Year Song, New Year Bhajan, best new year bhajan, dj remix new year bhajan, happy new year bhajan, happy new year ka bhajan, happy new year song 2026, new year bhajan",13,https://i.ytimg.com/vi/EljAbI3rt9U/hqdefault.jpg,en-IN,hi,False,801,PT13M21S,hd,false,True,,,301877,1759,45
_IZR4LV3160,IN,2026-01-02 02:32:43.832695+00:00,2026-01-01 15:00:24+00:00,Kizhikirom 🔥: JANA NAYAGAN Trailer PROMO⚡️| Release Date Announced 🤯 | Thalapathy Vijay | H. Vinoth,Kizhikirom 🔥: JANA NAYAGAN Trailer PROMO⚡️| Release Date Announced 🤯 | Thalapathy Vijay | H. Vinoth,Enowaytion Plus,UC_rD0WTWsygn28me13EqbkA,24,Entertainment,"JanaNayagan, JanaNayaganUpdates, JanaNayaganLatestUpdates, JanaNayaganTrailer, JanaNayaganTrailerUpdates, JanaNayaganTeaser, JanaNayaganAudioLaunch, ThalapathyVijay, IlayaThalapathyVijay, Anirudh, HVinoth, Kollywood, TamilCinemaNews, EnowaytionPlus, JanaNayaganTrailerPromo, JanaNayaganTrailerReleaseTime",16,https://i.ytimg.com/vi/_IZR4LV3160/hqdefault.jpg,en,ta,False,275,PT4M35S,hd,false,True,,,28791,2382,128
