video_id,country,fetched_at,published_at,title,localized_title,channel_title,channel_id,category_id,category_name,tags,tag_count,thumbnail,default_language,audio_language,is_live,duration,duration_raw,definition,caption_available,licensed_content,embeddable,made_for_kids,views,likes,comments
TFTnJzWRTJ8,IN,2026-01-02 02:32:43.832306+00:00,2025-12-31 10:30:08+00:00,"Naal Nachna | Dhurandhar | Ranveer Singh, Sara Arjun, Shashwat Sachdev, Afsana Khan, Reble, Irshad","Naal Nachna | Dhurandhar | Ranveer Singh, Sara Arjun, Shashwat Sachdev, Afsana Khan, Reble, Irshad",Saregama Music,UC_A7K2dXFsTMAciGmnNxy-Q,10,Music,"Naal Nachna, Nal nachna, Naal Nachna Dhurandhar, Naal Nachna Sara Arjun, Dhurandhar all songs, Reble, Shashwat Sachdev, Akshaye Khanna, naal nachna dhurandhar videos, naal nachna dhurandhar movie song, naal nachna song video, ranveer singh and sara arjun, Naal Nachna Afsana Khan, dhurandhar movie song, dhurandhar movie song akshay khanna, dhurandhar movie song naal nachna, FA9LA, Shararat, Gehra Hua, Lutt Le Gaya, Monica, Ramba Ho, flipperachi, Maine toh tere naal nachna",24,https://i.ytimg.com/vi/TFTnJzWRTJ8/hqdefault.jpg,en,hi,False,126,PT2M6S,hd,false,True,,,1774627,28797,781
E08GZ3pFlnk,IN,2026-01-02 02:32:43.832331+00:00,2025-12-29 09:30:25+00:00,The RajaSaab Trailer 2.0 (Telugu) | Prabhas | Maruthi | Thaman S | TG Vishwa Prasad | Jan 9 2026,The RajaSaab Trailer 2.0 (Telugu) | Prabhas | Maruthi | Thaman S | TG Vishwa Prasad | Jan 9 2026,People Media Factory,UCrzx3ZPXEZpzEGLF1gIuORQ,24,Entertainment,"People Media Factory, Raja Saab, Raja Saab Trailer, Raja Saab Telugu Trailer, Raja Saab Trailer Telugu, The Raja Saab Trailer, Prabhas, Maruthi, MalavikaMohanan, NidhhiAgerwal, Nidhhi Agerwal, malavika mohan, rebal star prabhas, prabhas, rebelstar, rajasaabfirstsingle, rebelsaab, rajasaabfirstsong, Thaman S, thaman, TG Vishwa Prasad, vishwaprasad, sahana sahana, sahanasong, sahanasahanasong, sahana sahana song, love song, romantic song, tfi, telugusongs",30,https://i.ytimg.com/vi/E08GZ3pFlnk/hqdefault.jpg,en,te,False,192,PT3M12S,hd,true,True,,,12027813,398800,11170
YIeXXbdbWvc,IN,2026-01-02 02:32:43.832343+00:00,2025-12-31 10:14:30+00:00,I Found Scary Villager City in Minecraft..,I Found Scary Villager City in Minecraft..,Carry Depie,UClqifC6Nd7v-IfTqce4k62A,20,Gaming,"carry depie, minecraft",2,https://i.ytimg.com/vi/YIeXXbdbWvc/hqdefault.jpg,en,hi,False,1073,PT17M53S,hd,false,True,,,1463598,15837,847
neRiV_eE7mQ,IN,2026-01-02 02:32:43.832352+00:00,2025-12-30 10:45:13+00:00,Mega Victory Mass Lyrical Video | Chiranjeevi | Venkatesh | Anil Ravipudi | Bheems Ceciroleo | MSG,Mega Victory Mass Lyrical Video | Chiranjeevi | Venkatesh | Anil Ravipudi | Bheems Ceciroleo | MSG,T-Series Telugu,UCnJjcn5FrgrOEp5_N45ZLEQ,10,Music,"T-Series Telugu, Telugu New Dance Song, Telugu New Year Party Song, Latest telugu New Year Song, telugu Party Song, Latest Telugu Party Song 2025, Mega Victory Mass Lyrical video, Mega Victory Mass Song Venkatesh, Mega Victory Mass Video Bheems Ceciroleo, Mega Victory Mass MSG, Mana Shankara Varaprasad Garu New Video Song, Mega Victory Mass Song Kasarla Shyam, Mega Victory Mass Vijay Polaki, Mega Victory Mass Song Chiranjeevi, Mega Victory Mass Telugu Party Song",15,https://i.ytimg.com/vi/neRiV_eE7mQ/hqdefault.jpg,en,te,False,196,PT3M16S,hd,false,True,,,12673072,113752,4410
AfQ13jsLDms,IN,2026-01-02 02:32:43.832360+00:00,2025-12-30 14:00:05+00:00,Stranger Things 5 | Finale Trailer | Netflix,Stranger Things 5 | Finale Trailer | Netflix,Netflix,UCWOA1ZGywLbqmigxE4Qlvuw,24,Entertainment,"Caleb McLaughlin, Charlie Heaton, Chief Hopper, David Harbour, Dustin, Eleven, Finn Wolfhard, Gaten Matarazzo, Jamie Campbell Bower, Joe Keery, Jonathan Byers, Joyce Byers, Lucas, Max, Maya Hawke, Mike Wheeler, Millie Bobby Brown, Nancy Wheeler, Natalia Dyer, Netflix, Noah Schnapp, Robin Buckley, Sadie Sink, Steve Harrington, Stranger Things 5, Will Byers, Winona Ryder",27,https://i.ytimg.com/vi/AfQ13jsLDms/hqdefault.jpg,en,en-US,False,97,PT1M37S,hd,true,True,,,12969677,309037,24568
JYXOW2mZuUY,IN,2026-01-02 02:32:43.832369+00:00,2026-01-01 22:28:32+00:00,50K UC WINTERGLOW SYLPH OPENING | FIRST STREAM OF 2026 | BGMI LIVE,50K UC WINTERGLOW SYLPH OPENING | FIRST STREAM OF 2026 | BGMI LIVE,LoLzZz Gaming,UCI1vyXBgX3bruwvChLMNxjQ,20,Gaming,"lolz, lolzz, lolzzz, lolz gaming, lolzz gaming, lolzzz gaming, bgmi, conqueror",8,https://i.ytimg.com/vi/JYXOW2mZuUY/hqdefault.jpg,en-GB,hi,False,23279,PT6H27M59S,hd,false,True,,,483135,28921,26
CkGvG2TCcTU,IN,2026-01-02 02:32:43.832377+00:00,2026-01-01 00:30:06+00:00,#video || हैप्पी न्यू ईयर 2026 || #Aashish Yadav Naya Sal Gana 2026 || गे हमर डियर हैप्पी न्यू ईयर,#video || हैप्पी न्यू ईयर 2026 || #Aashish Yadav Naya Sal Gana 2026 || गे हमर डियर हैप्पी न्यू ईयर,R U Films,UCCGwazs8_r-azyYMOwjOHMA,10,Music,"हैप्पी न्यू ईयर 2026 || #Aashish Yadav Naya Sal Gana 2026 || गे हमर डियर हैप्पी न्यू ईयर, aashish yadav happy new year song 2026, •|| ashish yadav •|| happy new year 2026, happy new year 2025 aashish yadav, aashish yadav new happy new year song, ashish yadav new year 2026, ashish yadav happy new year song, happy new year song ashish yadav, ashish yadav ka happy now year song 2026, happy new year
ashish yadav ka happy now year song 2026, happy new year 2026, ashish yadav new year",12,https://i.ytimg.com/vi/CkGvG2TCcTU/hqdefault.jpg,bh,bh,False,159,PT2M39S,hd,false,True,,,794188,2734,36
R3_R_q44eJU,IN,2026-01-02 02:32:43.832385+00:00,2026-01-01 12:30:08+00:00,"Prakambanam - Teaser | Ganapathi, Sagar Surya | Vijesh Panathur |Navarasa Films | Stone Bench Studio","Prakambanam - Teaser | Ganapathi, Sagar Surya | Vijesh Panathur |Navarasa Films | Stone Bench Studio",Think Music India,UCLbdVvreihwZRL6kwuEUYsA,10,Music,"ganapathi, ganapathi new movie teaser, ganapathi prakambanam movie teaser, malayalam movie, malayalam movies 2026, prakambanam, prakambanam malayalam movie teaser, prakambanam movie, prakambanam movie teaser, prakambanam movie teaser malayalam, prakambanam new movi",11,https://i.ytimg.com/vi/R3_R_q44eJU/hqdefault.jpg,en,ml,False,95,PT1M35S,hd,false,True,,,112046,4656,168
sXxmoaPkBVw,IN,2026-01-02 02:32:43.832393+00:00,2025-12-31 12:38:39+00:00,POOR vs RICH Mega Motorcycle Ramp in Minecraft..!,POOR vs RICH Mega Motorcycle Ramp in Minecraft..!,Karry Kraft,UCW3Ms3ZxVaZUniP-HifWCDg,20,Gaming,"carry depie, minecraft",2,https://i.ytimg.com/vi/sXxmoaPkBVw/hqdefault.jpg,en,en-IN,False,599,PT9M59S,hd,false,True,,,620759,7176,379
9vJZ8mJyDbk,IN,2026-01-02 02:32:43.832400+00:00,2026-01-01 04:00:07+00:00,SR 9898 ASLAM SINGER ZAMIDAR ( कदकी रोरी तेरे लीपट के )  NEW MEWATI VIDEO SONG 2026 | DIGITAL MEWAT,SR 9898 ASLAM SINGER ZAMIDAR ( कदकी रोरी तेरे लीपट के )  NEW MEWATI VIDEO SONG 2026 | DIGITAL MEWAT,Aslam Singer Zamidar,UCmKIWi-Q_dG-B8TY8-XrVCQ,10,Music,,0,https://i.ytimg.com/vi/9vJZ8mJyDbk/hqdefault.jpg,bgc,bgc,False,1161,PT19M21S,hd,false,True,,,428237,41438,2898
wHuWmjXsReU,IN,2026-01-02 02:32:43.832407+00:00,2026-01-01 17:00:08+00:00,Marvel Television’s Wonder Man | Official Trailer,Marvel Television’s Wonder Man | Official Trailer,Marvel Entertainment,UCvC4D8onUfXzvjTOM-dBfEA,24,Entertainment,"marvel, comics",2,https://i.ytimg.com/vi/wHuWmjXsReU/hqdefault.jpg,en,en,False,130,PT2M10S,hd,true,True,,,2773715,76844,3846
JSS_gVPRVlY,IN,2026-01-02 02:32:43.832415+00:00,2026-01-01 16:47:16+00:00,KESA LAGA BOMB ??? WATCHPARTY-| FOZYAJAY IS LIVE | #freefire #freefiretournament #iQOOTG,KESA LAGA BOMB ??? WATCHPARTY-| FOZYAJAY IS LIVE | #freefire #freefiretournament #iQOOTG,TG FozyAjay,UCohtlRJwNaO51bfWJ1OuX3g,20,Gaming,,0,https://i.ytimg.com/vi/JSS_gVPRVlY/hqdefault.jpg,en,hi,False,13533,PT3H45M33S,hd,false,True,,,295456,16114,295
jRmfXdCwHZU,IN,2026-01-02 02:32:43.832422+00:00,2025-12-31 11:45:05+00:00,NEW YEAR SPECIAL - नए साल पर हर कोई ढूंढ रहा है ये भजन | NEW YEAR SONGS 2026 | NEW YEAR BHAJAN 2026,NEW YEAR SPECIAL - नए साल पर हर कोई ढूंढ रहा है ये भजन | NEW YEAR SONGS 2026 | NEW YEAR BHAJAN 2026,Bhakti Sadhna भक्ति साधना,UCA1BfqEptH9CDtIEjuwyuSg,10,Music,"2026 ke bhajan, 2026 krishna bhajan, 2026 krishna ji ke bhajan, 2026 new bhajan, 2026 radha ke bhajan, 2026 radha krishna bhajan, 2026 radha rani bhajan, 2026 shyam bhajan, best bhajan, bestbhajan, bhajan, bhajan 2026, bhajanmashup, krishan bhajans 2026, krishna bhajan",15,https://i.ytimg.com/vi/jRmfXdCwHZU/hqdefault.jpg,hi,en-GB,False,2006,PT33M26S,hd,false,True,,,742391,5231,501
xAHiMdB5bks,IN,2026-01-02 02:32:43.832430+00:00,2025-12-31 09:56:17+00:00,TOXIC - Trailer | Rocking Star Yash | Nayanthara as Ganga | Kiara Advani | Huma | Fan Made AI  ,TOXIC - Trailer | Rocking Star Yash | Nayanthara as Ganga | Kiara Advani | Huma | Fan Made AI  ,"T-Gold Studio · 2.3M views · 2 hours ago






",UCBpDoJbKCPRXFmJWyNblXlg,1,Film & Animation,"nayanthara toxic, toxic nayanthara look, toxic nayanthara poster, nayanthara toxic movie, toxic nayanthara first look, kiara advani, toxic kiara advani, toxic, yash, toxic trailer yash, toxic trailer, yash toxic trailer, toxic teaser trailer, toxic yash trailer, rocking star yash toxic trailer, yash toxic teaser, toxic trailer telegu, toxic trailer update, toxic trailer official, toxic yash, toxic movie update, huma qureshi, toxic yash movie, yash new look",24,https://i.ytimg.com/vi/xAHiMdB5bks/hqdefault.jpg,en,te,False,67,PT1M7S,hd,false,True,,,348282,6549,88
IGFDtWNT8PM,IN,2026-01-02 02:32:43.832437+00:00,2026-01-01 19:28:15+00:00,"NEW YEAR, NEW SEASON 😎 FREE FIRE MOBILE RANK PUSH TO GRANDMASTER! 😁","NEW YEAR, NEW SEASON 😎 FREE FIRE MOBILE RANK PUSH TO GRANDMASTER! 😁",Sooneeta,UCFSzwJllk1zpIXs2xhMZ84Q,20,Gaming,"free fire live, free fire live now, ff live, free fire, garena free fire, free fire max, free fire max live, ff live hindi, free fire hindi, free fire hindi live, live now free fire, free fire live today, free fire rank push live, free fire rank push to grandmaster, free fire grandmaster, grandmaster rank push, rank push live grandmaster, free fire battle royale, free fire br rank push, rank push br, ff rank push br, free fire live rank push, rank push live free fire, ff",24,https://i.ytimg.com/vi/IGFDtWNT8PM/hqdefault.jpg,sr,en,False,34457,PT9H34M17S,hd,false,True,,,2294233,30441,10
lLjUJLHYR_g,IN,2026-01-02 02:32:43.832445+00:00,2025-12-31 01:15:05+00:00,#video | नया साल के ब्रांड | TunTun Yadav & Prabha Raj | Naya Sal Ke Brand | New year Song 2026,#video | नया साल के ब्रांड | TunTun Yadav & Prabha Raj | Naya Sal Ke Brand | New year Song 2026,Bahubali Music World,UCqDmsdCprRdTapNql3ZP7vg,10,Music,"Naya Sal Ke Brand, tuntun Yadav New Year Song Naya Sal Ke Brand, Naya Sal Khatal Me, tuntun yadav new year song 2026, naya sal me khatal me, bhojpuri new year 2026 song, happy new year song 2026, नया साल में थाईलैंड वाली, Naya Sal Me Thailand Vali, happy new year song tuntun yadav, Tuntun yadav ke naya Sal Ke Gana, naya sal me ek ek paik piya sa, tuntun yadav prabha raj new year song, bahubali music world, नया साल के ब्रांड | TunTun Yadav, Naya Sal Ke Brand | New year Song 2026",16,https://i.ytimg.com/vi/lLjUJLHYR_g/hqdefault.jpg,en-IN,bh,False,209,PT3M29S,hd,false,True,,,1181414,12524,570
kYl0_97wQ5Y,IN,2026-01-02 02:32:43.832453+00:00,2026-01-01 06:00:57+00:00,Hotspot 2 Much - Official Teaser | Vignesh Karthick | KJB Talkies | Ants To Elephants Cinemas Co,Hotspot 2 Much - Official Teaser | Vignesh Karthick | KJB Talkies | Ants To Elephants Cinemas Co,Saregama Tamil,UCzee67JnEcuvjErRyWP3GpQ,1,Film & Animation,"Hotspot2much, Hotspot 2 Much teaser, Hotspot2much official teaser, Hotspot2much movie, Vishnu Vishal presents, Vignesh Karthick director, Priya Bhavani Shankar, MS Bhaskar, Thambi Ramaiah, Rakshan, Ashwin Kumar, Aadhitya Baaskar, Bhavani Sre, Brigida Saga, Sanjana Tiwari, Satish Raghunathan music, Tamil movie teaser, upcoming Tamil movie 2026, new Tamil cinema, Tamil film teaser, Saregama Tamil, Hotspot movie series, Tamil thriller movie, Tamil drama film",24,https://i.ytimg.com/vi/kYl0_97wQ5Y/hqdefault.jpg,en,ta,False,68,PT1M8S,hd,false,True,,,59036,2665,65
krGzXubLDSU,IN,2026-01-02 02:32:43.832461+00:00,2026-01-01 14:28:00+00:00,"Break 9,483,738 Bones to Win! 💀","Break 9,483,738 Bones to Win! 💀",Tyro Gaming,UCIpN4Y3Pt00Q9KoQMWI77_Q,20,Gaming,"Break 99999 Bones to Win! 💀, junkeyy, Shivang mini, Shinchan game, Doraemon Game, Nobita Game, Shinchan in hindi, Shinchan Gaming, Frostbite Gaming, VeryNuclear, Rock Indian Gamer, Amaan-T, Flight Gamer, Carry Depie, Proboiz, Tyro Gaming, Proboii, Taro gaming, Funny Game Roblox, Doraemon New Episode, Shinchan New Episode, Break Bone, Break Bone Roblox, Break Bone to Win, Break Every Bone, Break Bone Challenge! 😱",26,https://i.ytimg.com/vi/krGzXubLDSU/hqdefault.jpg,en,hi,False,677,PT11M17S,hd,false,True,,,196902,2431,321
vWqrNyfKlbw,IN,2026-01-02 02:32:43.832469+00:00,2025-12-31 12:54:00+00:00,"Tuition Badmashi Kaa - Hemant Faujdar, Kiran, Masoom Sharma, Manisha Sharma, Ajay Dhankhar, AmanJaji","Tuition Badmashi Kaa - Hemant Faujdar, Kiran, Masoom Sharma, Manisha Sharma, Ajay Dhankhar, AmanJaji",Hp Music Live,UCQECPMUGcIxsxn2e17nZr5A,10,Music,"Tuition Badmashi Kaa, Hemant Faujdar, Kiran, Masoom Sharma, Manisha Sharma, Ajay Dhankhar, AmanJaji, tuitionbadmashikaa, desirecords, TuitionBadmashiKaa, haryanvi, Diet Teri Ka Raaz Bata Kyun Mare Khoon Ubada Re, Tere Yaar Ne Khola Centre Tuition De Badmashi Ka, Hoo Diet Teri Ka Raaz Bata, Na Chalda Tera Business Koi Na Job Ter Sarkari Hai, New Haryanvi Song 2025, Masoom Sharma Song, Latest Haryanvi Song",18,https://i.ytimg.com/vi/vWqrNyfKlbw/hqdefault.jpg,ms,bgc,False,276,PT4M36S,hd,false,True,,,215745,881,28
iPuGwK92Gqg,IN,2026-01-02 02:32:43.832476+00:00,2025-12-31 16:46:24+00:00,Dhurandhar 2 VS Toxic Confirm? Spirit Teaser Soon? - Flick the News 73,Dhurandhar 2 VS Toxic Confirm? Spirit Teaser Soon? - Flick the News 73,FlickVerse,UCo5C_QyORRvumZuTalhaazA,24,Entertainment,,0,https://i.ytimg.com/vi/iPuGwK92Gqg/hqdefault.jpg,en,hi,False,693,PT11M33S,hd,false,True,,,366260,18985,796
VB-0JfiqS0o,IN,2026-01-02 02:32:43.832483+00:00,2026-01-01 03:00:48+00:00,GTA V : Franklin & Shinchan Helicopter ESCAPE From Granny House ! in Telugu,GTA V : Franklin & Shinchan Helicopter ESCAPE From Granny House ! in Telugu,Black7Plays,UCDACaLjKXqhFxmuCjS1w6ow,20,Gaming,"franklin shinchan new videos, franklin videos, gtav new videos, shinchan franklin videos, shinchan doraemon franklin, shinchan gta5, shinchan gta 5, shinchan new video, doraemon and shinchan in gta 5, gtav telugu, franklin videos in telugu, shinchan franklin gtav new videos telugu, franklin shinchan new videos telugu, shinchan franklin telugu new videos, shinchan and franklin new videos telugu, gta5 telugu, shinchan franklin doraemon new videos telugu, black7plays, Gta telugu",19,https://i.ytimg.com/vi/VB-0JfiqS0o/hqdefault.jpg,en-IN,te,False,1731,PT28M51S,hd,false,True,,,146209,1887,79
0eujds_X8J8,IN,2026-01-02 02:32:43.832490+00:00,2025-12-31 00:30:01+00:00,"#Video - Danga Hoi | Chand Jee & Shilpi Raj | दंगा होई - Ankit Jack, Ankitummm | Bhojpuri Song 2026","#Video - Danga Hoi | Chand Jee & Shilpi Raj | दंगा होई - Ankit Jack, Ankitummm | Bhojpuri Song 2026",Shujay Music World,UCkX-s57GWbaIogFpRbYAHtA,10,Music,"chand jee, danga hoi, ankit jack, ankitummm, dehati sachin, ankit jack new video, dehati sachin new video, shilpi raj, new bhojpuri song, danga hoi ankit jack, danga hoi dehati sachin video, danga hoi dehati sachin song, new bhojpuri, chand jee shilpi raj, dehati sachin new video 2025, ankit jack dehati sachin comedy video, new video song 2025, danga hoi new bhojpuri song, danga hoi new gana, bhojpuri gana, danga hoi bhojpuri song 2025, ankit jack comedy video",22,https://i.ytimg.com/vi/0eujds_X8J8/hqdefault.jpg,en,bh,False,200,PT3M20S,hd,false,True,,,449172,0,3668
Sdjuizzyei0,IN,2026-01-02 02:32:43.832498+00:00,2025-12-30 16:51:16+00:00,Avengers Doomsday Thor Trailer Breakdown,Avengers Doomsday Thor Trailer Breakdown,ComicVerse,UCKQ5Jj35sjTmJigRtlCPhVQ,24,Entertainment,"comicverse, comic verse, comicverse marvel",3,https://i.ytimg.com/vi/Sdjuizzyei0/hqdefault.jpg,en-GB,hi,False,498,PT8M18S,hd,false,True,,,600643,31600,1287
QU-3ieyzyHY,IN,2026-01-02 02:32:43.832505+00:00,2026-01-01 11:42:41+00:00,Long Slide Game With Elephant Gorilla Buffalo Hippopotamus Tiger - 3d Animal Game - Funny 3d Animals,Long Slide Game With Elephant Gorilla Buffalo Hippopotamus Tiger - 3d Animal Game - Funny 3d Animals,FunAnimationLive NumAnima,UCcxQWO97C7DkrrtMZGFHQgA,24,Entertainment,,0,https://i.ytimg.com/vi/QU-3ieyzyHY/hqdefault.jpg,en,hi,False,884,PT14M44S,hd,false,True,,,442109,49644,1374
_ozZUmlyP5I,IN,2026-01-02 02:32:43.832512+00:00,2025-12-31 12:30:54+00:00,#Video | शूटर पोसले बानी हैप्पी न्यू ईयर सोंग 2026 | Naye Sal ka Gana 2026 | #HappyNewYear2026,#Video | शूटर पोसले बानी हैप्पी न्यू ईयर सोंग 2026 | Naye Sal ka Gana 2026 | #HappyNewYear2026,Devi Kumari Paswan,UCJwgSIhxYBFj0d9qOoI3C6g,10,Music,,0,https://i.ytimg.com/vi/_ozZUmlyP5I/hqdefault.jpg,en-IN,bh,False,218,PT3M38S,hd,false,True,,,482039,2297,47
vn1_IhYUVU4,IN,2026-01-02 02:32:43.832518+00:00,2026-01-01 03:59:27+00:00,Mukammal Ishq Film (Official Trailer) Waseem Kaynat| Javed Sultan| Writ...,Mukammal Ishq Film (Official Trailer) Waseem Kaynat| Javed Sultan| Writ...,☆ANAS☆FF ,UChMSD3ChclpTc41iWJGU6Ag,20,Gaming,,0,https://i.ytimg.com/vi/vn1_IhYUVU4/hqdefault.jpg,en,hy,False,1734,PT28M54S,sd,false,False,,,88890,2594,46
PpkTxlNf00I,IN,2026-01-02 02:32:43.832525+00:00,2025-12-31 07:51:55+00:00,PIYUSH JOSHI IN MY OPPONENT! 🔥,PIYUSH JOSHI IN MY OPPONENT! 🔥,SATVIK,UCWRmZvwkp6oNca2wW3uFcFg,20,Gaming,,0,https://i.ytimg.com/vi/PpkTxlNf00I/hqdefault.jpg,en,hi,False,1444,PT24M4S,hd,false,True,,,712689,21270,2121
-Y52vOjnCgA,IN,2026-01-02 02:32:43.832532+00:00,2025-12-31 13:15:37+00:00,शिवानी न्यू ईयर स्पेशल सांग | नया साल मनाए चलो होटल में | New Year Dj Song 2026 | Shivani Dance Song,शिवानी न्यू ईयर स्पेशल सांग | नया साल मनाए चलो होटल में | New Year Dj Song 2026 | Shivani Dance Song,Shivani Ka Thumka,UCEOtHgREkB998kW1wrwDrIQ,10,Music,"नया साल मनाए चलो होटल में, New Year Dj Song 2026, Shivani Dance Song, shivani kumari new song, shivani happy new year, new year song 2026, new year song 2026 hindi, new year song remix, new year party song 2026, new year party lokgeet, new party song 2026, Shivani Ka thumka, Dj lokgeet Shivani, shivani ke gane, shivani ka dance, dehati dj song, shivani ka thumka song, happy new year 2026, new year celebration song, new year celebration 2026, 2026 New Year Party Songs",21,https://i.ytimg.com/vi/-Y52vOjnCgA/hqdefault.jpg,en,hi,False,247,PT4M7S,hd,false,True,,,260989,904,16
xGWa7nzn7OI,IN,2026-01-02 02:32:43.832540+00:00,2025-12-31 04:28:43+00:00,Avengers Doomsday Thor Tamil Trailer Breakdown (தமிழ்),Avengers Doomsday Thor Tamil Trailer Breakdown (தமிழ்),Mokka Commentry,UC3Y7OyuS9jNdZy3ZadrAbWQ,24,Entertainment,"tamil, தமிழ், mokka commentry, mokka, trending, youtube tamil, recommended, tamil creator, avengers doomsday, avengers, doomsday, tamil trailer breakdown, avengers doomsday tamil trailer breakdown, leaked avengers trailer, tamil leaked avengers trailer, tamil trailer avengers doomsday, doomsday thor trailer breakdown, tamil avengers leaked trailer, tamil avengers doomsday, avengers doomsday tamil thor trailer breakdown, thor leaked trailer, tamil thor avengers doomsday, thor trailer",23,https://i.ytimg.com/vi/xGWa7nzn7OI/hqdefault.jpg,en,en,False,541,PT9M1S,hd,false,True,,,125325,9484,402
McTrQhHOvIw,IN,2026-01-02 02:32:43.832548+00:00,2025-12-30 06:30:24+00:00,100 days but YOU CAN UPGRADE PORTALS In Minecraft 😱,100 days but YOU CAN UPGRADE PORTALS In Minecraft 😱,Anshu Bisht,UCPjaNv8GlIamrxCbqincG_g,20,Gaming,"minecraft gameplay in hindi, minecraft gameplay, minecraft in hindi gameplay, minecraft, survival, minecraft hindi gaming, live insaan, gamerfleet, techno gamerz, minecraft bedrock, minecraft android gameplay, anshu bisht, smartypie, yessmartypie, ujjwal, herobrine smp, funny minecraft video, smp india, fleet smp, anshu bisht smp, barbarian king, jack bhaiya, Herobrine fleet smp, herobrine world, oneblock 100 days, 100 DAYS MINECRAFT, Hardcore Minecraft, hardcore, upgrade portals",29,https://i.ytimg.com/vi/McTrQhHOvIw/hqdefault.jpg,en,hi,False,6758,PT1H52M38S,hd,false,True,,,1497043,68394,9452
KzZoBl6pHv4,IN,2026-01-02 02:32:43.832556+00:00,2025-12-31 23:00:39+00:00,"Happy New Year 2026 DJ Song, Khesari Lal New Bhojpuri Song 2026 DJ Remix 2026","Happy New Year 2026 DJ Song, Khesari Lal New Bhojpuri Song 2026 DJ Remix 2026",Np Music,UCOBf4LyCsOlD4cQ43ShXnPA,10,Music,"happy new year dj 2026, happy new year dj remix, happy new year dj mix, happy new year dj song 2026, happy new year 2026 dj song bhojpuri, happy new year dj gana, हैप्पी न्यू ईयर डीजे गाना, हैप्पी न्यू ईयर गाना डीजे सॉन्ग, dj happy new year 2026, dj happy new year song, happy new year remix song, new year song 2026 shayari, new year 2026 song dj, नया साल का गाना 2026 का, 2026 ka naya saal ka gana, naya saal song 2026, naya saal song 2026 ka gana, naya saal ka dj song",18,https://i.ytimg.com/vi/KzZoBl6pHv4/hqdefault.jpg,hi,hi,False,399,PT6M39S,hd,false,True,,,224878,934,24
4kDoH9NbSxA,IN,2026-01-02 02:32:43.832564+00:00,2025-12-30 16:45:21+00:00,Doomsday 5th Trailer?! ⋮ Avengers Doomsday Thor Trailer Review,Doomsday 5th Trailer?! ⋮ Avengers Doomsday Thor Trailer Review,PJ Explained,UCWkHlUiYLeRSIMP8yM7rxxg,1,Film & Animation,"avengers doomsday, avengers doomsday trailer, avengers doomsday explained, thor doomsday, thor comeback, thor god mode, thor prayer scene, doctor doom marvel, loki vs doctor doom, marvel doomsday, marvel trailer breakdown, marvel theory, marvel leaks, x men doomsday, x men marvel, thor odin force, thor explained, marvel phase 6, avengers theory, marvel cinematic universe, mcu doomsday, pj explained, Avengers Doomsday X-Men Trailer, doomsday trailer, marvel new trailer",25,https://i.ytimg.com/vi/4kDoH9NbSxA/hqdefault.jpg,hi,hi,False,353,PT5M53S,hd,false,True,,,329483,16255,558
W_bv5QWMTh4,IN,2026-01-02 02:32:43.832571+00:00,2026-01-01 10:20:06+00:00,Maya Bhootni Ki Haweli Pohonch Gaye (Big Mistake),Maya Bhootni Ki Haweli Pohonch Gaye (Big Mistake),BeastBoyShub,UCI86prlqXhbkREDMTaORvLQ,20,Gaming,"cartoon network, kids show, hindi dubbed, nostalgia, animation, hindi show cartoon, cartoon show, cartoon, game, bbs courage game, bbs cartoon game, Shawarma, roblox india, roblox, hindi gameplay, maya ek pishachini, maya hindi horror game, hindi horror game indian gamer, maya horror game hindi",19,https://i.ytimg.com/vi/W_bv5QWMTh4/hqdefault.jpg,en,hi,False,2318,PT38M38S,hd,false,True,,,353326,44841,2472
PGL0ZFlJaXE,IN,2026-01-02 02:32:43.832579+00:00,2026-01-01 00:30:34+00:00,#Video - #Neelkamal Singh - #newyearpartysongs - Happy New Year  - Bhojpuri Hit Song 2026,#Video - #Neelkamal Singh - #newyearpartysongs - Happy New Year  - Bhojpuri Hit Song 2026,Neelkamal Singh Shorts,UCl8qmxi3JeLu1ZXy6PMhJ5Q,10,Music,"neelkamal singh, neelkamal singh ka new gana, neelkamal singh new song, neelkamal singh official, neelkamal singh ka new video, neelkamal singh ka new bhojpuri song, neelkamal singh bhojpuri song, neelkamal singh new year party song, neelkamal singh new year party bhojpuri song, neelkamal singh coca cola song, neelkamal singh new video, neelkamal singh hits, daru ke peti, दारू के पेटी, bhojpuri new year dance song",15,https://i.ytimg.com/vi/PGL0ZFlJaXE/hqdefault.jpg,en,hi,False,173,PT2M53S,hd,false,True,,,339645,3140,80
8yWl30PJ0wc,IN,2026-01-02 02:32:43.832586+00:00,2026-01-01 15:37:02+00:00,Film Talk | Jana Naayagan vs Parasakthi TRAILER CLASH | 30 BIG Kollywood Updates | New Year Specail,Film Talk | Jana Naayagan vs Parasakthi TRAILER CLASH | 30 BIG Kollywood Updates | New Year Specail,Trendswood Tv,UCAXxuSl8n8cXU62ZIzFL0qg,24,Entertainment,"tamil cinema news, cinema updates, latest cinema news, kollywood updates, kollywood news",5,https://i.ytimg.com/vi/8yWl30PJ0wc/hqdefault.jpg,en,ta,False,331,PT5M31S,hd,false,True,,,26431,2787,89
CBhIJCnAfkM,IN,2026-01-02 02:32:43.832593+00:00,2026-01-01 20:01:35+00:00,🔴[Live] New Year New Beginning😁Phone Gameplay🔥- Garena Free Fire Max !!,🔴[Live] New Year New Beginning😁Phone Gameplay🔥- Garena Free Fire Max !!,UnGraduate Gamer,UCgsWayzDGwj9CclwicO_R3w,20,Gaming,,0,https://i.ytimg.com/vi/CBhIJCnAfkM/hqdefault.jpg,en,en-US,False,34882,PT9H41M22S,hd,false,True,,,477856,43608,98
