video_id,country,fetched_at,published_at,title,localized_title,channel_title,channel_id,category_id,category_name,tags,tag_count,thumbnail,default_language,audio_language,is_live,duration,duration_raw,definition,caption_available,licensed_content,embeddable,made_for_kids,views,likes,comments
U1Uxb4wqGvs,JM,2026-04-22T03:47:33.774575+00:00,2026-04-17T22:03:31Z,Skippa - My Way (Official Music Video),Skippa - My Way (Official Music Video),Skippa,UCOYDFPQVV7yQJQcXN6rXCvg,10,Music,,0,https://i.ytimg.com/vi/U1Uxb4wqGvs/hqdefault.jpg,en,en,False,142,PT2M22S,hd,False,True,False,False,411141,15983,497
BnjnNZPlpEk,JM,2026-04-22T03:47:33.774612+00:00,2026-04-20T14:16:25Z,The Caribbean Tour 🏝️ (Official Trailer),The Caribbean Tour 🏝️ (Official Trailer),IShowSpeed,UCWsDFcIhY2DBi3GB5uykGXA,20,Gaming,,0,https://i.ytimg.com/vi/BnjnNZPlpEk/hqdefault.jpg,en,en,False,53,PT53S,hd,False,True,False,False,585070,45179,6812
m_mjA4PpIU8,JM,2026-04-22T03:47:33.774622+00:00,2026-04-21T18:00:50Z,DON'T CHOOSE The WRONG WATERSLIDE in GTA 5...,DON'T CHOOSE The WRONG WATERSLIDE in GTA 5...,TechyCrew,UCTU3m4rCUS-7qXuHK-j9Uqw,20,Gaming,"Techy, TechyCrew, Among Us, Fortnite, Fortnite Creative, Roblox, Techy Roblox, Among Us Roles",8,https://i.ytimg.com/vi/m_mjA4PpIU8/hqdefault.jpg,en,en,False,686,PT11M26S,hd,False,True,False,False,129289,2900,293
j5qHyqLMbnM,JM,2026-04-22T03:47:33.774629+00:00,2026-04-17T19:00:43Z,Chronic Law - Like Samson (Official Video),Chronic Law - Like Samson (Official Video),ChronicLawVEVO,UCXSHOjS30YMaGRgwuuxBfLw,10,Music,"chronic law, Vybz Kartel, popcaan, onerpm, dancehall, dancehall 2026, reggae, reggae 2026, dancehall trending, reggae trending, youtube trending, trending music 2026, 2026",13,https://i.ytimg.com/vi/j5qHyqLMbnM/hqdefault.jpg,en,en,False,217,PT3M37S,hd,False,True,False,False,549246,17788,1036
AjFk1cY265I,JM,2026-04-22T03:47:33.774635+00:00,2026-04-10T16:29:45Z,Digital Circus Ep 9 Finale [TRAILER],Digital Circus Ep 9 Finale [TRAILER],GLITCH,UCn_FAXem2-e3HQvmK-mOH4g,1,Film & Animation,"glitch, glitch productions, digital circus, the amazing digital circus, murder drones, Pomni, Uzi, Jax, Ragatha, Kinger, Gangle, Zooble, Caine, Bubble, 3D, Animation, 3D Animation, Indie Animation, Gummigoo",19,https://i.ytimg.com/vi/AjFk1cY265I/hqdefault.jpg,en,en,False,70,PT1M10S,hd,True,True,False,False,24197475,1553119,110679
LxB1-IiSxSs,JM,2026-04-22T03:47:33.774641+00:00,2026-04-21T20:00:25Z,ROBLOX KICK A LUCKY BLOCK...,ROBLOX KICK A LUCKY BLOCK...,More Techy,UCzlUw75H5ILJ2l_ackxyI6A,20,Gaming,"roblox, funnyroblox, techyblox, techy, crazy fan girls, crazy fan girl, my crazy fan girls, girlfriend, roblox girlfriend",9,https://i.ytimg.com/vi/LxB1-IiSxSs/hqdefault.jpg,en,en,False,696,PT11M36S,hd,False,True,False,False,84048,2163,193
N0XCvjZnqik,JM,2026-04-22T03:47:33.774648+00:00,2026-04-17T23:06:55Z,Feloni19 - MENACE (Official Music Video),Feloni19 - MENACE (Official Music Video),Feloni19,UCyfTwzprVDg8pIYjuqfS1Qw,10,Music,,0,https://i.ytimg.com/vi/N0XCvjZnqik/hqdefault.jpg,en,en,False,173,PT2M53S,hd,False,False,False,False,141990,5583,176
Xt4X4FvXk2A,JM,2026-04-22T03:47:33.774654+00:00,2026-04-16T13:00:08Z,Street Fighter | Official Trailer (2026 Movie),Street Fighter | Official Trailer (2026 Movie),Paramount Pictures,UCF9imwPMSGz4Vq1NiTWCC7g,1,Film & Animation,,0,https://i.ytimg.com/vi/Xt4X4FvXk2A/hqdefault.jpg,en,en-US,False,173,PT2M53S,hd,True,True,False,False,14594358,273550,22887
ctJPilkH9fg,JM,2026-04-22T03:47:33.774659+00:00,2026-04-21T16:04:43Z,ROBLOX +1 FAT TO FIT...,ROBLOX +1 FAT TO FIT...,Techy Plays,UCNDzLI-hyihpAx3zKtwhGZw,20,Gaming,"roblox, brookhaven, funnyroblox, techyblox, techy, crazy fan girls, crazy fan girl, my crazy fan girls",8,https://i.ytimg.com/vi/ctJPilkH9fg/hqdefault.jpg,en,en,False,734,PT12M14S,hd,False,True,False,False,130428,2523,247
d0UdGKrvMno,JM,2026-04-22T03:47:33.774665+00:00,2026-04-17T16:01:10Z,Popcaan - Life Still a Gwaan (Official Video),Popcaan - Life Still a Gwaan (Official Video),PopcaanVEVO,UCYNHmFPVH3ENF_Qdl8OfpXg,10,Music,"Vybz Kartel, popcaan, onerpm, dancehall, dancehall 2026, reggae, reggae 2026, dancehall trending, reggae trending, youtube trending, trending music 2026, 2026",12,https://i.ytimg.com/vi/d0UdGKrvMno/hqdefault.jpg,en,en,False,190,PT3M10S,hd,False,True,False,False,567688,22479,1609
s1-pfiVMKAs,JM,2026-04-22T03:47:33.774671+00:00,2026-03-31T16:00:12Z,Supergirl | Official Trailer,Supergirl | Official Trailer,DC,UCiifkYAs_bq1pt_zbNAzYGg,1,Film & Animation,"2026, Coming Soon, Craig Gillespie, DC, DC Comics, DC Studios, DCU, David Krumholtz, Emily Beecham, Eve Ridley, James Gunn, Jason Momoa, Kara Zor-El, Krypto, Matthias Schoenaerts, Milly Alcock, Supergirl, WB, Warner Bros, Warner Bros Pictures, Warner Brothers, official trailer",22,https://i.ytimg.com/vi/s1-pfiVMKAs/hqdefault.jpg,en,en-US,False,177,PT2M57S,hd,True,False,False,False,16551844,284592,16861
g3fn6TZAoPY,JM,2026-04-22T03:47:33.774677+00:00,2026-04-18T16:01:09Z,1 Second = PEPSI RISES in Minecraft!,1 Second = PEPSI RISES in Minecraft!,Cash,UC0eLBYhxW9HC0P9PXQ73mpQ,24,Entertainment,"Cash, Nico, Nico and Cash, Cash and Nico, Minecraft, Minecraft mod, family friendly, kid friendly",8,https://i.ytimg.com/vi/g3fn6TZAoPY/hqdefault.jpg,en,en-US,False,1078,PT17M58S,hd,False,True,False,False,688466,7609,1386
u0sn9amKb5Y,JM,2026-04-22T03:47:33.774683+00:00,2026-04-20T00:06:43Z,"Malie Donn, Cash Code - Big Toe (Official Music Video)","Malie Donn, Cash Code - Big Toe (Official Music Video)",Malie Donn ,UCxIzooNKNMPxZgn3xMDj_Jg,10,Music,,0,https://i.ytimg.com/vi/u0sn9amKb5Y/hqdefault.jpg,en,en,False,155,PT2M35S,hd,False,True,False,False,257472,12661,341
oSeqs_xeqv4,JM,2026-04-22T03:47:33.774688+00:00,2026-04-09T16:00:01Z,A Marvel Television Special Presentation: The Punisher: One Last Kill | Official Trailer,A Marvel Television Special Presentation: The Punisher: One Last Kill | Official Trailer,Marvel Entertainment,UCvC4D8onUfXzvjTOM-dBfEA,24,Entertainment,"marvel, comics",2,https://i.ytimg.com/vi/oSeqs_xeqv4/hqdefault.jpg,en,en,False,102,PT1M42S,hd,True,True,False,False,5714949,197122,7840
tg5MDgOafAA,JM,2026-04-22T03:47:33.774694+00:00,2026-04-19T05:14:17Z,King Of The North Tournament ⚔️ Round Of 16 Matchups 🔥 Free Fire Live,King Of The North Tournament ⚔️ Round Of 16 Matchups 🔥 Free Fire Live,NOZY,UChaKXdc0MLNWnKxUxmcLXdg,20,Gaming,,0,https://i.ytimg.com/vi/tg5MDgOafAA/hqdefault.jpg,en,en,False,20837,PT5H47M17S,hd,False,True,False,False,15930,1336,7
Nf3x_MkeGkw,JM,2026-04-22T03:47:33.774700+00:00,2026-04-11T17:00:00Z,Squash - Psychic (Official Music Video),Squash - Psychic (Official Music Video),SquashVEVO,UCLLZ9Yz4iZhZWzD4UKuCSsw,10,Music,"Squash, 6ixReal Records - Hemton Music SALKEY RECORDS, Dancehall",3,https://i.ytimg.com/vi/Nf3x_MkeGkw/hqdefault.jpg,en,en,False,201,PT3M21S,hd,False,True,False,False,516340,18348,1034
aBlsrtxuwss,JM,2026-04-22T03:47:33.774706+00:00,2026-03-18T11:17:52Z,Spider-Man: Brand New Day - Official Trailer,Spider-Man: Brand New Day - Official Trailer,PlayStation,UC-2Y8dQb0S6DtpxNgAKoJKA,20,Gaming,"PlayStation, PS5, video games, next gen, Sony",5,https://i.ytimg.com/vi/aBlsrtxuwss/hqdefault.jpg,en,en,False,158,PT2M38S,hd,False,True,False,False,19037914,674590,27743
fXei45qgkrc,JM,2026-04-22T03:47:33.774712+00:00,2026-04-21T19:00:41Z,ENTER ROBLOX HEADS IN ROBLOX...,ENTER ROBLOX HEADS IN ROBLOX...,Techys,UCoRjsuzMh-MqfRjvlqaVLPw,20,Gaming,,0,https://i.ytimg.com/vi/fXei45qgkrc/hqdefault.jpg,en,en,False,699,PT11M39S,hd,False,True,False,False,87021,1955,177
b-K_FkXQQDk,JM,2026-04-22T03:47:33.774718+00:00,2026-04-13T20:00:22Z,Adofo - Pc Forever Up (Official Music Video),Adofo - Pc Forever Up (Official Music Video),AdofoVEVO,UC_YxV29Z1uruFdiLy4hUL6Q,10,Music,"onerpm, dancehall, dancehall 2026, reggae, reggae 2026, dancehall trending, reggae trending, youtube trending, trending music 2026, 2026",10,https://i.ytimg.com/vi/b-K_FkXQQDk/hqdefault.jpg,en,en,False,196,PT3M16S,hd,False,True,False,False,97682,3864,285
3_9vCamtuPY,JM,2026-04-22T03:47:33.774724+00:00,2026-03-17T16:19:02Z,Dune: Part Three | Official Teaser Trailer,Dune: Part Three | Official Teaser Trailer,Warner Bros.,UCjmJDM5pRKbUlVIzDYYWb6g,1,Film & Animation,"Action, Anya Taylor-Joy, Brian K Vaughan, Charlotte Rampling, Coming Soon, Denis Villeneuve, Dune, Dune Messiah, Dune: Part Three, Florence Pugh, Ida Brooke, Isaach De Bankolé, Jason Momoa, Javier Bardem, Messiah, Nakoa-Wolf Momoa, Rebecca Ferguson, Robert Pattinson, Sci Fi, Timothée Chalamet, Trilogy, Warner Bros, Zendaya",23,https://i.ytimg.com/vi/3_9vCamtuPY/hqdefault.jpg,en,en-US,False,150,PT2M30S,hd,True,False,False,False,29568266,625652,29954
B_ttNnKn7J8,JM,2026-04-22T03:47:33.774730+00:00,2026-04-19T03:32:40Z,🔴Jamaica vs Guyana Live | Women's World Cup qualification 2026 |eFootball PES21 Simulation,🔴Jamaica vs Guyana Live | Women's World Cup qualification 2026 |eFootball PES21 Simulation,RMO,UCDw7iWgxsOgQGPBRFt5Mifw,20,Gaming,,0,https://i.ytimg.com/vi/B_ttNnKn7J8/hqdefault.jpg,en,en,False,10421,PT2H53M41S,hd,False,True,False,False,24036,74,0
IJNJTRnUj7U,JM,2026-04-22T03:47:33.774736+00:00,2026-04-10T22:00:17Z,Merkz - Mislead (Official Music Video),Merkz - Mislead (Official Music Video),Merkz876VEVO,UC7G7FXMN5HPvPwCRK4McZ-Q,10,Music,"onerpm, dancehall, dancehall 2026, reggae, reggae 2026, dancehall trending, reggae trending, youtube trending, trending music 2026, 2026",10,https://i.ytimg.com/vi/IJNJTRnUj7U/hqdefault.jpg,en,en,False,174,PT2M54S,hd,False,True,False,False,297744,14701,102
tMyJRwXBnfQ,JM,2026-04-22T03:47:33.774752+00:00,2026-04-18T19:07:00Z,"Every Time I Crash, My Police Car Gets FASTER in GTA 5","Every Time I Crash, My Police Car Gets FASTER in GTA 5",SpeirsTheAmazingHD,UCAbdeLiTPdjk1X2TY_ZdLDw,20,Gaming,"speirstheamazinghd, gta 5 funny moments, gta 5, gta, in gta 5, gta 5 rp, stealing cars, grand theft auto 5, stealing gta 5, stealing cars gta 5, fastest car, fastest car gta 5, gta 5 roleplay, gta5 roleplay, gta 5 trolling, funny roleplay moments, grand theft auto roleplay, grand theft auto 5 roleplay, every time i crash, car gta 5, car gets faster, fastest police car, fastest police car gta 5, police car gets faster",24,https://i.ytimg.com/vi/tMyJRwXBnfQ/hqdefault.jpg,en,en,False,1881,PT31M21S,hd,False,True,False,False,395762,4905,128
Mx8vIQ-pc70,JM,2026-04-22T03:47:33.774759+00:00,2026-04-19T18:59:48Z,SamDan x Malie Donn - Plug Out (Official Music Video),SamDan x Malie Donn - Plug Out (Official Music Video),SAMDAN,UC0fSLrGjidNa0DXvfDAI3yQ,22,People & Blogs,,0,https://i.ytimg.com/vi/Mx8vIQ-pc70/hqdefault.jpg,en,en,False,208,PT3M28S,hd,False,False,False,False,91040,4381,170
kBYnGC0gJ30,JM,2026-04-22T03:47:33.774765+00:00,2026-04-18T20:06:46Z,LILY LOVEBRAIDS Ruins an ALL BOYS One Block!,LILY LOVEBRAIDS Ruins an ALL BOYS One Block!,Aphmau,UCzYfz8uibvnB7Yc1LjePi4g,20,Gaming,"Aphmau, Minecraft, Minecraft funny, Minecraft mods, Minecraft Aphmau, Aphmau pranks, Aphmau Minecraft Pranks, Aphmau Gaming, Aphmau Games, Aphmau Pranks Friends, Aphmau Playing As, Aphmau Aaron",12,https://i.ytimg.com/vi/kBYnGC0gJ30/hqdefault.jpg,en,en-US,False,1307,PT21M47S,hd,False,True,False,False,1018309,17094,1274
fbE2ZI0Iq3Y,JM,2026-04-22T03:47:33.774771+00:00,2026-04-12T16:00:00Z,Chronic Law - God Bless (Official Lyric Video),Chronic Law - God Bless (Official Lyric Video),Hapilos,UCBLLm-2gpFuKwpHkZEjipcQ,10,Music,"chronic law, chronic law 2026, God Bless, Collect Di Bred Entertainment, dancehall mix 2026, hapilos",6,https://i.ytimg.com/vi/fbE2ZI0Iq3Y/hqdefault.jpg,en,en,False,178,PT2M58S,hd,False,True,False,False,63871,614,12
U1DImOlfgUY,JM,2026-04-22T03:47:33.774777+00:00,2026-04-21T17:56:31Z,I Signed a Man City Legend…,I Signed a Man City Legend…,MoreS2G,UCw9rjdrpHa7mzNrWVJoaPgw,20,Gaming,,0,https://i.ytimg.com/vi/U1DImOlfgUY/hqdefault.jpg,en,en-GB,False,1358,PT22M38S,hd,False,True,False,False,156859,11699,858
6ZHDKKPIhOQ,JM,2026-04-22T03:47:33.774782+00:00,2026-04-10T17:00:00Z,Vigilant - 4Lie (Official Music Video),Vigilant - 4Lie (Official Music Video),1VigilantVEVO,UClsXBFbxZKyZn71K7qrNPfQ,10,Music,"onerpm, dancehall, dancehall 2026, reggae, reggae 2026, dancehall trending, reggae trending, youtube trending, trending music 2026, 2026",10,https://i.ytimg.com/vi/6ZHDKKPIhOQ/hqdefault.jpg,en,en,False,205,PT3M25S,hd,False,True,False,False,88103,2904,207
1_YWE20Vz3E,JM,2026-04-22T03:47:33.774788+00:00,2026-04-21T23:00:02Z,"Minecraft, But You Mine INFINITE Diamonds","Minecraft, But You Mine INFINITE Diamonds",Bionic,UCETZ7OiW7-wqwb-6hsz3C4w,20,Gaming,"minecraft, bionic, family friendly",3,https://i.ytimg.com/vi/1_YWE20Vz3E/hqdefault.jpg,en,en,False,1556,PT25M56S,hd,False,True,False,False,93749,4628,897
JGw1UAYjFEY,JM,2026-04-22T03:47:33.774794+00:00,2026-03-26T22:00:06Z,Masicka - Boasty (Official Music Video),Masicka - Boasty (Official Music Video),Masicka,UCOSJVk71utzoCmRxzcfhM-A,10,Music,"Masicka, Dancehall, Jamaica, Jamaican, Dancehall King, Dancehall Nation, Dancehall Official, Teejay, Jah Vinci",9,https://i.ytimg.com/vi/JGw1UAYjFEY/hqdefault.jpg,en,en,False,198,PT3M18S,hd,False,False,False,False,3174061,61866,7756
M0Kv6W6KWEo,JM,2026-04-22T03:47:33.774800+00:00,2026-04-19T12:00:37Z,IMPOSSIBLE Giant Turbines Race In GTA 5...,IMPOSSIBLE Giant Turbines Race In GTA 5...,Techy,UCFmIhbx3_RkwlMLPA4Xv8-w,20,Gaming,"roblox, techy, techy plays, brookhaven, techyblox, techycrew, more techy",7,https://i.ytimg.com/vi/M0Kv6W6KWEo/hqdefault.jpg,en,en,False,702,PT11M42S,hd,False,True,False,False,145522,2977,373
5X9qQOiBLRY,JM,2026-04-22T03:47:33.774805+00:00,2026-04-21T10:00:06Z,"Kman 6ixx , Malie Donn , Attomatic - Pretty Little Dolly (Official Music Video)","Kman 6ixx , Malie Donn , Attomatic - Pretty Little Dolly (Official Music Video)",Kman 6ixx ,UCoWasTywngj10GBO6mJBacw,10,Music,"Kman6ixx, Maliedonn",2,https://i.ytimg.com/vi/5X9qQOiBLRY/hqdefault.jpg,en-US,en-US,False,145,PT2M25S,hd,False,False,False,False,50108,3836,114
AhqaSOBokBs,JM,2026-04-22T03:47:33.774811+00:00,2026-04-17T03:58:04Z,"Spending $8,592,437 To Become The FATTEST In Roblox..","Spending $8,592,437 To Become The FATTEST In Roblox..",Foltyn,UCRkuUgtDAL4XSU5jB40J_wA,20,Gaming,"foltyn, foltyn roblox, roblox, roblox foltyn, foltyn family, funny, no swearing, foltyn family roblox, roblox foltyn family, blade ball, roblox blade ball, foltyn blade ball, roblox but every second you get bigger!, foltyn and caylus, foltyn and caylus playing roblox, foltyn and caylus playing roblox together!, growin gold in roblox.., i became the fattest roblox player.., foltyn roblox fat",19,https://i.ytimg.com/vi/AhqaSOBokBs/hqdefault.jpg,en,en-US,False,1045,PT17M25S,hd,False,True,False,False,1855121,18742,2964
N3BDsUtAlf4,JM,2026-04-22T03:47:33.774817+00:00,2026-04-17T20:22:58Z,Bobby 6ix - Too Skill (Official Music Video),Bobby 6ix - Too Skill (Official Music Video),Bobby6ixVEVO,UCL9fE7pwWgvyU-B__zqKZvQ,10,Music,"Bobby 6ix, Big Crook Ent, Dancehall",3,https://i.ytimg.com/vi/N3BDsUtAlf4/hqdefault.jpg,en,en,False,163,PT2M43S,hd,False,True,False,False,38940,3018,181
QF5YpZI1wnk,JM,2026-04-22T03:47:33.774823+00:00,2026-04-11T16:00:01Z,I Survived 100 Days in Skyblock,I Survived 100 Days in Skyblock,MrBeast Gaming,UCIPPMRA040LQr5QPyJEbmXA,20,Gaming,,0,https://i.ytimg.com/vi/QF5YpZI1wnk/hqdefault.jpg,en,en,False,1362,PT22M42S,hd,True,True,False,False,42755355,693863,20367
QKxz-eU38qE,JM,2026-04-22T03:47:33.774828+00:00,2026-04-16T23:00:05Z,PinkFox - Brain (Official Video),PinkFox - Brain (Official Video),PinkFoxVEVO,UCUyivA18-EGaKxbQ3cOyVDg,10,Music,"PinkFox, STRDM, Reggae, Dancehall",4,https://i.ytimg.com/vi/QKxz-eU38qE/hqdefault.jpg,en,en,False,167,PT2M47S,hd,False,True,False,False,64108,2712,79
BT7O8Tet10E,JM,2026-04-22T03:47:33.774834+00:00,2026-04-19T19:00:19Z,TREES HATE YOU...,TREES HATE YOU...,ItsFunneh,UCUk7VggtJdo9XYTy3Z5QVAw,20,Gaming,"itsfunneh, funneh, funny moments, funny, krew, krew plays, gaming, games, roblox, itsfunneh roblox, youtube itsfunneh, itsfunneh minecraft, itsfunneh krew, itsfunneh videos, no swearing, no cursing, roblox funny moments, roblox roleplay, roblox krew, trees hate you, funny game, rage, rage game",23,https://i.ytimg.com/vi/BT7O8Tet10E/hqdefault.jpg,en,en-US,False,1744,PT29M4S,hd,False,True,False,False,444327,18593,1860
FkW6HiJbuR0,JM,2026-04-22T03:47:33.774840+00:00,2026-04-12T21:30:02Z,Giveon - Heartbreak Anniversary (Traducido al Español + Lyrics),Giveon - Heartbreak Anniversary (Traducido al Español + Lyrics),Infinite Letters,UC32qXzgQ0huNoKmIQVMdW4Q,10,Music,,0,https://i.ytimg.com/vi/FkW6HiJbuR0/hqdefault.jpg,es,es-MX,False,199,PT3M19S,hd,False,True,False,False,315629,494,2
a-UDK_CabBk,JM,2026-04-22T03:47:33.774846+00:00,2026-04-21T14:00:01Z,"I Became a BABY DOG, with a GUN in Minecraft!","I Became a BABY DOG, with a GUN in Minecraft!",Dash,UCpHCfDBZ3AJyuofz6DHy-ew,20,Gaming,"dash, baby dash, anne, dash minecraft, dash roblox, minecraft challenge, minecraft mods, minecraft funny, roblox, I Became a BABY DOG with a GUN in Minecraft!",10,https://i.ytimg.com/vi/a-UDK_CabBk/hqdefault.jpg,en,en,False,977,PT16M17S,hd,False,True,False,False,182479,3191,317
JowviCVicQY,JM,2026-04-22T03:47:33.774852+00:00,2026-04-12T19:22:17Z,Miley Cyrus - Adore You (Lyrics),Miley Cyrus - Adore You (Lyrics),Glim,UC9EgcTfqA6X_6a2zPG83RjQ,10,Music,"Miley Cyrus Adore You, Adore You Miley Cyrus, When you say you love me, Know I love you more, And when you say you need me, Know I need you more, Boy I adore you, I adore you, When you say you love me know I love you more, When you say you need me know I need you more, Adore You, miley cyrus, Miley Cyrus, adore you, adore you miley cyrus, miley cyrus adore you, I love you more, love you more, I need you more, need you more, miley adore you, adore you miley, Glim, glim",24,https://i.ytimg.com/vi/JowviCVicQY/hqdefault.jpg,en,en,False,280,PT4M40S,hd,False,True,False,False,568047,1102,23
D_QcdDQfSi4,JM,2026-04-22T03:47:33.774857+00:00,2026-04-19T01:02:02Z,FIRST DAY in School as a SEA MONSTER!,FIRST DAY in School as a SEA MONSTER!,Omz,UClCvmntMJCrerMDSc1WQGNg,20,Gaming,"Cash, Nico, Nico and Cash, Cash and Nico, Minecraft, Minecraft mod, Omz, Crystal, Roxy, Luke, Lily, Johnny, Aphmau, Omziscool, Kory, Maizen, maze build, noob vs pro, noobs vs pro vs hacker, noob vs pro vs hacker vs god, cash and nico, Omz and Roxy, Roxy and Omz, FIRST DAY in School as a SEA MONSTER!",24,https://i.ytimg.com/vi/D_QcdDQfSi4/hqdefault.jpg,en,en,False,1071,PT17M51S,hd,False,True,False,False,259038,4001,475
5qVwJXKAP-w,JM,2026-04-22T03:47:33.774864+00:00,2026-04-03T16:00:10Z,Alkaline - Bad (Official Music Video),Alkaline - Bad (Official Music Video),AlkalineVEVO,UChKGMC6dXos_9Bry2e8iSdw,10,Music,"Alkaline, NPT, Album, Dancehall, Bad, Music Video",6,https://i.ytimg.com/vi/5qVwJXKAP-w/hqdefault.jpg,en,en,False,178,PT2M58S,hd,False,True,False,False,432509,17754,2028
zdvwklqyAeU,JM,2026-04-22T03:47:33.774869+00:00,2026-04-18T02:07:24Z,JJ and Mikey WENT INSIDE Friends’ Bodies and SAW EVERYTHING in Minecraft,JJ and Mikey WENT INSIDE Friends’ Bodies and SAW EVERYTHING in Minecraft,Maizen,UCJHBJ7F-nAIlMGolm0Hu4vg,20,Gaming,"Minecraft, Maizen",2,https://i.ytimg.com/vi/zdvwklqyAeU/hqdefault.jpg,en,en,False,2121,PT35M21S,hd,False,True,False,False,2152280,14288,1105
6VwLLfk0w0s,JM,2026-04-22T03:47:33.774875+00:00,2026-03-25T20:46:30Z,"Jamal, Extol - Money Fragrance (Official Video)","Jamal, Extol - Money Fragrance (Official Video)",JamalOfficialVEVO,UCoouxJp5xAqlJkfDAdmdU2w,10,Music,"onerpm, dancehall, dancehall 2026, reggae, reggae 2026, dancehall trending, reggae trending, youtube trending, trending music 2026, 2026, Jamal, Dunce MoneyFragrance, ExtolMusic 39Gud, TruBelieva Believe, NevaShortStaff Dancehall, TrapDancehall Music, Jamal Dunce, MoneyFragrance, ExtolMusic, 39Gud, TruBelieva, Believe, NevaShortStaff, TrapDancehall, Music",25,https://i.ytimg.com/vi/6VwLLfk0w0s/hqdefault.jpg,en,en,False,197,PT3M17S,hd,False,True,False,False,1177328,18003,593
DDq5BFbhsoM,JM,2026-04-22T03:47:33.774881+00:00,2026-04-21T00:24:10Z,I had to UP MY SWITCH AT SCHOOL in GTA 5 RP!,I had to UP MY SWITCH AT SCHOOL in GTA 5 RP!,FuriousFade,UCC540wcJL0DeQlC8lgUP-XQ,20,Gaming,,0,https://i.ytimg.com/vi/DDq5BFbhsoM/hqdefault.jpg,en,en,False,5015,PT1H23M35S,hd,False,True,False,False,133326,7410,1240
7a4yl-d2OXM,JM,2026-04-22T03:47:33.774887+00:00,2026-04-17T23:00:06Z,Likke Addi - HARD EARS (official music video),Likke Addi - HARD EARS (official music video),LikkleAddiVEVO,UCcfE2jIvIKS8obH5jmzcB6Q,10,Music,"vybz kartel, trap, 50 cent, likkle vybz, world, hiphop, jay, modern, trending, music video, badart, zojak world wide, jamaica, world cup, gaming, fast cars, player, hustler, drake, cardi, popcaan, good vibes, new music friday, money hustle, friday, weekend, chronic law, skillibeng, skeng, spice, messi, man the match",32,https://i.ytimg.com/vi/7a4yl-d2OXM/hqdefault.jpg,en,en,False,173,PT2M53S,hd,False,True,False,False,66395,5144,371
QL8EPjyk-hE,JM,2026-04-22T03:47:33.774893+00:00,2026-04-20T21:17:29Z,A Stalker Followed Us HOME at 3AM…,A Stalker Followed Us HOME at 3AM…,Johnny Minecraft,UCWVSknuLPIRVGWf-4bFKT4Q,20,Gaming,"minecraft, minecraft funny, minecraft gameplay, minecraft roleplay, minecraft story, minecraft prank, minecraft challenge, minecraft mod, minecraft survival, funny minecraft, minecraft trolling, minecraft friends, family friendly minecraft, no cursing minecraft, minecraft prank friends, heres johnny, johnny minecraft, johnny and marty, spinny hat studios",19,https://i.ytimg.com/vi/QL8EPjyk-hE/hqdefault.jpg,en,en,False,1026,PT17M6S,hd,False,True,False,False,145792,2374,221
0jhAG6lVJec,JM,2026-04-22T03:47:33.774900+00:00,2026-04-20T21:00:03Z,Prince Swanny & Marlon Asher - Uncle (Official Music Video),Prince Swanny & Marlon Asher - Uncle (Official Music Video),Prince Swanny,UCuwcYMsHgOakQOn3_3px9HQ,10,Music,,0,https://i.ytimg.com/vi/0jhAG6lVJec/hqdefault.jpg,en,en,False,170,PT2M50S,hd,False,True,False,False,128118,9423,535
d-dCL-TAP0w,JM,2026-04-22T03:47:33.774905+00:00,2026-04-20T16:10:00Z,JJ SIREN HEAD as a Pet - Maizen Minecraft Animation,JJ SIREN HEAD as a Pet - Maizen Minecraft Animation,MSToons,UCc2RL8jvY1rJPuCnJVsIQWw,20,Gaming,"minecraft, animation, minecraft animation, maizen, jj, mikey, jj and mikey, maizen animation, maizen minecraft animation, jj and mikey minecraft animation, jj and mikey sad story, まいぜんシスターズ, マインクラフト, まいぜん, jj sister, strong jj, jj sister and jj, siren head",18,https://i.ytimg.com/vi/d-dCL-TAP0w/hqdefault.jpg,en,en,False,710,PT11M50S,hd,False,True,False,False,553800,2560,40
wvCa_nF7Cjo,JM,2026-04-22T03:47:33.774912+00:00,2026-04-17T04:31:04Z,Ching Chong,Ching Chong,Merkz - Topic,UCfYHxzcPcF5IWFIiD_Mv1ng,10,Music,"Merkz, Ching Chong",2,https://i.ytimg.com/vi/wvCa_nF7Cjo/hqdefault.jpg,en,en,False,201,PT3M21S,hd,False,True,False,False,19648,736,0
