video_id,country,fetched_at,published_at,title,localized_title,channel_title,channel_id,category_id,category_name,tags,tag_count,thumbnail,default_language,audio_language,is_live,duration,duration_raw,definition,caption_available,licensed_content,embeddable,made_for_kids,views,likes,comments
zMl8tL_jz3s,SK,2026-07-01T05:06:33.465734+00:00,2026-06-26T22:18:00Z,Slavo Gazi   Bella Official Video,Slavo Gazi   Bella Official Video,Slavo Gazi,UCkfc55GcyuWQUa4udqFfMAQ,10,Music,,0,https://i.ytimg.com/vi/zMl8tL_jz3s/hqdefault.jpg,tr,es,False,208,PT3M28S,hd,False,True,False,False,180339,3357,185
62bIsvRcPv0,SK,2026-07-01T05:06:33.465759+00:00,2026-06-17T18:58:31Z,SPIDER-MAN: BRAND NEW DAY – New Trailer (4K),SPIDER-MAN: BRAND NEW DAY – New Trailer (4K),Sony Pictures Entertainment,UCz97F7dMxBNOfGYu3rx8aCw,24,Entertainment,,0,https://i.ytimg.com/vi/62bIsvRcPv0/hqdefault.jpg,en,en,False,162,PT2M42S,hd,True,True,False,False,26578686,619403,23799
jPAYGsFBgvA,SK,2026-07-01T05:06:33.465770+00:00,2026-06-23T16:55:21Z,Prop Hunt ale MAĽUJEME SA,Prop Hunt ale MAĽUJEME SA,DuklockPlus,UCIAbC7emlDQs-dmgW4GlgnA,20,Gaming,"duklock, duklockplus, mecha chameleon, sk, cz, meccha chameleon",6,https://i.ytimg.com/vi/jPAYGsFBgvA/hqdefault.jpg,sk,sk,False,3071,PT51M11S,hd,False,True,False,False,189484,7744,58
OxjpvhdgP-I,SK,2026-07-01T05:06:33.465779+00:00,2026-06-23T04:30:06Z,"ŠTEFAN ŠTEC, ANIČKA JAKAB RAKOVSKÁ - Večar na Dunaji (Official video)","ŠTEFAN ŠTEC, ANIČKA JAKAB RAKOVSKÁ - Večar na Dunaji (Official video)",Štefan ŠTEC_official channel,UClt-AJDRGG6KVCDi53F7tzQ,10,Music,,0,https://i.ytimg.com/vi/OxjpvhdgP-I/hqdefault.jpg,sk,sk,False,179,PT2M59S,hd,False,True,False,False,87046,3206,94
y2Zcmcbrm9s,SK,2026-07-01T05:06:33.465786+00:00,2026-06-26T04:00:08Z,"Transcendence Trailer - ""Sudden Snow"" | Genshin Impact #GenshinImpact #GenshinSnezhnaya","Transcendence Trailer - ""Sudden Snow"" | Genshin Impact #GenshinImpact #GenshinSnezhnaya",Genshin Impact,UCiS882YPwZt1NfaM0gR0D9Q,20,Gaming,,0,https://i.ytimg.com/vi/y2Zcmcbrm9s/hqdefault.jpg,en,en-US,False,315,PT5M15S,hd,True,False,False,False,3238621,281514,19973
a_cXTRk5bQA,SK,2026-07-01T05:06:33.465793+00:00,2026-06-27T06:35:39Z,Zomrel mi MÔJ NAJLEPŠÍ KAMARÁT v Schoolboy Runaway v Minecraft ( Koniec Sezóny 3 ),Zomrel mi MÔJ NAJLEPŠÍ KAMARÁT v Schoolboy Runaway v Minecraft ( Koniec Sezóny 3 ),Asimister,UCmsd0Ar0UoZoMbYEBUWLWMA,20,Gaming,"asimister, minecraft, minecraft cz, minecraft cz sk, minecraft cz survival, minecraft cz/sk, minecraft cz sk lets play, minecraft gameplay cz, minecraft sk cz, minecraft cz download, asimister minecraft, gameplay, gameplay minecraft, gameplay cz, gameplay cz sk, minecraft dedina, asimister minecraft life hacky, asimister minecraft dedina, schoolboy runaway, schoolboy runaway cz, schoolboy runaway asimister, asimister school boy runaway, minecraft pocket edition cz",23,https://i.ytimg.com/vi/a_cXTRk5bQA/hqdefault.jpg,sk,sk,False,1841,PT30M41S,hd,False,True,False,False,57069,2340,297
RqWyPrzFp4k,SK,2026-07-01T05:06:33.465800+00:00,2026-06-19T08:00:06Z,KALI & IMT SMILE - BOL RAZ KRÁĽ,KALI & IMT SMILE - BOL RAZ KRÁĽ,KALI RECORDS,UCjIl8ztAFLTiZkhvgaiOoow,10,Music,"Kali, Imt, Smile, Peter, Pann, Bol, Raz, Jeden, Kral, Kráľ, Výberovka, Nelly, Kráľovná, Tvoríme, Dokonalý, Pár, 2026, Tásler",18,https://i.ytimg.com/vi/RqWyPrzFp4k/hqdefault.jpg,sk,sk,False,225,PT3M45S,hd,False,True,False,False,270634,4668,148
cmjpadVj-Vk,SK,2026-07-01T05:06:33.465807+00:00,2026-06-29T12:00:12Z,WERWULF - Official Trailer [HD] - Only In Theaters Christmas,WERWULF - Official Trailer [HD] - Only In Theaters Christmas,Focus Features,UCU4SM3j_9TNWaSu8KdGV50g,1,Film & Animation,"Focus Features, Robert Eggers, Sjón, Chris Columbus, Eleanor Columbus, Eric Fellner, Tim Bevan, Garrett Bird, Aaron Taylor-Johnson, Willem Dafoe, Lily-Rose Depp, Ralph Ineson, Nosferatu, Werwulf Film, Werwulf, Werwulf Movie, Bodhi Rae Breathnach, Vidal Arzoni",18,https://i.ytimg.com/vi/cmjpadVj-Vk/hqdefault.jpg,en,en-US,False,135,PT2M15S,hd,True,True,False,False,6121061,110337,8043
T3R_RVBaPDU,SK,2026-07-01T05:06:33.465815+00:00,2026-06-30T14:00:12Z,Postavil jsem MASIVNÍ Sulfur Cube v Minecraftu,Postavil jsem MASIVNÍ Sulfur Cube v Minecraftu,SirYakari,UCggdHIILKfXpdB_0KI0Nmeg,20,Gaming,"Minecraft, pvp, cz, sk, česky, minihry, lets, play, troll, past, challange, uhcrun, texture, pack, trolling, trollení, siryakari, yakari, minecraft ale, zábava, vtipné, reakce, 100 hráčů, 100 hráčů plní moje úkoly, dohrál jsem minecraft, minecraft ultra hardcore, ultra hardcore, ultra hard minecraft, survival, minecraft mody, family friendly, mody, minecraft siryakari, roblox, siryakari roblox, fortnite, siryakair ultra hardcore",37,https://i.ytimg.com/vi/T3R_RVBaPDU/hqdefault.jpg,cs,cs,False,3763,PT1H2M43S,hd,False,True,False,False,87671,5331,435
Hj7iUjv1D5Y,SK,2026-07-01T05:06:33.465823+00:00,2026-06-26T16:04:45Z,Ona je se mnou,Ona je se mnou,Hard Rico - Topic,UC_wRNF8pt4WhuEurNY5on5A,10,Music,"Hard Rico, P T K, Focus, Ona je se mnou",4,https://i.ytimg.com/vi/Hj7iUjv1D5Y/hqdefault.jpg,en,cs,False,210,PT3M30S,hd,False,True,False,False,146805,4250,132
3gdgzJxhC18,SK,2026-07-01T05:06:33.465830+00:00,2026-06-17T19:43:06Z,Spider-Man: Zbrusu nový den (2026) nový CZ HD trailer,Spider-Man: Zbrusu nový den (2026) nový CZ HD trailer,Totalfilm.cz,UCrnvx9KJ8v63SODw082L3Ww,24,Entertainment,"trailery česky, Totalfilm.cz, český, trailer, CZ, HD",6,https://i.ytimg.com/vi/3gdgzJxhC18/hqdefault.jpg,cs,cs,False,178,PT2M58S,hd,False,False,False,False,150744,4310,130
pgGThZitPis,SK,2026-07-01T05:06:33.465836+00:00,2026-06-27T15:00:06Z,Brawl Talk: Kenji & Kaze's Baby?,Brawl Talk: Kenji & Kaze's Baby?,Brawl Stars,UCooVYzDxdwTtGYAkcPmOgOw,20,Gaming,"brawl stars, mobile game, mobile strategy game, mobile rpg, mobile battle royale, battle royale, supercell game, brawl talk, update, new brawler, nanonoodles, katana kingdom, kenji, kaze, ramen rebellion, nori",16,https://i.ytimg.com/vi/pgGThZitPis/hqdefault.jpg,en,en,False,688,PT11M28S,hd,True,True,False,False,8870876,270762,12190
0VO63arVjqo,SK,2026-07-01T05:06:33.465843+00:00,2026-06-25T18:00:07Z,Dominika Mirgová & Tian Moon - NAMOTÁM (prod. ADiss),Dominika Mirgová & Tian Moon - NAMOTÁM (prod. ADiss),DMirgovaLIVE,UCli1wk7uy-_9XOSMWFKLisw,10,Music,"dominika mirgova, mirgova, dmirgova, dmirgova live, dmirgova namotana, amaro kamiben, milano, bday, tina, wonder woman, sukar gili, broken heart, rezume, zanzibar, na mesiac, spomalit, kali, odznova, lonely, je koniec, jing jang, vzduch, drama queen, beyonce, mamacita, v hlave mám, hýb sa, tian moon, alan murin, ja to dám, spomaliť, hore, kto je on, migrova, domnika, domi, adiss, guestlist, namotám, namotam, latino, kuba, havana, venuša, ségra, nová, spicyaf, yael, dáma, nad vodou, kto iný, overground",52,https://i.ytimg.com/vi/0VO63arVjqo/hqdefault.jpg,sk,sk,False,190,PT3M10S,hd,True,True,False,False,41045,1138,47
ruCJfAAF6R0,SK,2026-07-01T05:06:33.465851+00:00,2026-06-23T17:01:09Z,Nový Spider-Man Je Crazy.,Nový Spider-Man Je Crazy.,PaťoMínus,UC6uBsbIr0ZISFMZd-TVXxjQ,24,Entertainment,"Paťo, PaťoPlus, Patopsych, PaťoMínus",4,https://i.ytimg.com/vi/ruCJfAAF6R0/hqdefault.jpg,sk,sk,False,677,PT11M17S,hd,False,True,False,False,14040,635,62
Bm5ZFLFg9Qk,SK,2026-07-01T05:06:33.465858+00:00,2026-06-23T12:22:55Z,"Schovávanie, Farby a Streameri","Schovávanie, Farby a Streameri",Astatoro,UCiqPpxQYod7TzkR_4-LUuNA,20,Gaming,"astatoro, Astatoro, gameplay, co-op, astatoro minecraft, duklock, MECCHA CHAMELEON, meccha chameleon, astatoro meccha chameleon, haiset, flygun, fattypillow, gejmr",13,https://i.ytimg.com/vi/Bm5ZFLFg9Qk/hqdefault.jpg,sk,sk,False,8244,PT2H17M24S,hd,False,True,False,False,66066,2261,32
e3-xsBaDjmc,SK,2026-07-01T05:06:33.465865+00:00,2026-06-15T14:00:17Z,KANYE WEST - SILVER NIGHT  | СЕДАЯ НОЧЬ (GANG REMIX),KANYE WEST - SILVER NIGHT  | СЕДАЯ НОЧЬ (GANG REMIX),Davuiside,UC09TqdjM4ld0BxL4zZArabA,10,Music,"Davuiside, Gangster City, Car Music, G House, Night Music, Deep House, Music 2024, Bass Boosted, Bass Music, Slap House, Phonk, Brazilian Phonk, Girls, Models Car, Tik Tok Music, Tik Tok Songs, Tik Tok Trends, Vava Media, Vava Music, Gangster Music, Gangster Deep, Krush Funk, Afro House, Tik Tok, Tik Tok Video, Video Viral, Video Edits, Edits, Viral, Tik Tok Viral, Tik Tok Edits, KANYE WEST, SILVER NIGHT, СЕДАЯ НОЧЬ, SILVER NIGHT | СЕДАЯ НОЧЬ, KANYE WEST - SILVER NIGHT",36,https://i.ytimg.com/vi/e3-xsBaDjmc/hqdefault.jpg,en,en-US,False,203,PT3M23S,hd,False,False,False,False,8672980,44908,405
Swiz1XyfhcI,SK,2026-07-01T05:06:33.465872+00:00,2026-06-16T15:00:03Z,Shrek 5 | Official Teaser Trailer,Shrek 5 | Official Teaser Trailer,Universal Pictures,UCq0OueAsdxH6b8nyAspwViw,24,Entertainment,,0,https://i.ytimg.com/vi/Swiz1XyfhcI/hqdefault.jpg,en-US,en-US,False,82,PT1M22S,hd,True,True,False,False,2994511,70625,0
Pjqi31Q3D84,SK,2026-07-01T05:06:33.465879+00:00,2026-06-28T15:21:20Z,Přeměnil jsem 100 Hráčů na 100 MOBŮ,Přeměnil jsem 100 Hráčů na 100 MOBŮ,SýrYakari,UCeT4d9P-M4O35E8Lzv38LCw,20,Gaming,"siryakari, sýryakari, siryakari 2, minecraft, cz, sk, česky, slovensky, hry, minihry, bedwars, eggwars, uhc run, uhcrun, survival games, hypixel, minecraft ale, 100 hráčů, 100 hráčů plní moje úkoly, zábava, vtipné, reakce, pvp, trollení, trolling, minecraft siryakari, siryakari minihry, siryakari mody, minecraft mody, minecraft survival, family friendly, mcrybář, mcrybar, siryakari server, roblox, fortnite, siryakari ultra hardcore, ultra hardcore minecraft, siryakari roblox, siryakari 100 hráčů",40,https://i.ytimg.com/vi/Pjqi31Q3D84/hqdefault.jpg,cs,cs,False,1172,PT19M32S,hd,False,True,False,False,77505,3209,93
fbUS_-WJRi8,SK,2026-07-01T05:06:33.465887+00:00,2026-06-02T02:38:31Z,GINDO (feat. FERDY),GINDO (feat. FERDY),BAZSI - Topic,UCSY17IDohSDMa3lZy97eWBw,10,Music,"BAZSI, FERDY, GINDO (feat. FERDY)",3,https://i.ytimg.com/vi/fbUS_-WJRi8/hqdefault.jpg,en,es,False,172,PT2M52S,hd,False,True,False,False,597177,5343,0
s8cP1Vt5US8,SK,2026-07-01T05:06:33.465893+00:00,2026-06-19T12:44:08Z,『チェンソーマン 刺客篇』ティザーPV②／Chainsaw Man –  Assassins Arc Official Trailer 2,『チェンソーマン 刺客篇』ティザーPV②／Chainsaw Man –  Assassins Arc Official Trailer 2,MAPPA CHANNEL,UCjfAEJZdfbIjVHdo5yODfyQ,1,Film & Animation,,0,https://i.ytimg.com/vi/s8cP1Vt5US8/hqdefault.jpg,ja,ja,False,91,PT1M31S,hd,False,False,False,False,6518833,402961,13431
oaYGg55w8uM,SK,2026-07-01T05:06:33.465900+00:00,2026-06-28T16:00:08Z,Kdo Postaví Lepší World Cup Draft?,Kdo Postaví Lepší World Cup Draft?,Duo FC,UCqIuwrVxQA_5UhGblSo9J8w,20,Gaming,"gudu, gudu vs mich sako, mich sako vs gudu, duo fc, mich sako duo fc, gudu duo fc, duo fc mich sako, duo fc gudu, gudu sako duo fc, draft battles gudu, mich sako draft battles, draft battle gudu sako, duo fc draft battles, sako, mich sako draft, draft battles fc 26, draft battles, draft battles duo fc, mich sako gudu, souboj draftu duo fc, fc 26, fc26, fc 26 draft, duo fc 26, duo, draft, world cup, mistrovstvi sveta, mistrovství světa, wc, ms, world cup draft, MS, WC",34,https://i.ytimg.com/vi/oaYGg55w8uM/hqdefault.jpg,cs,cs,False,2204,PT36M44S,hd,False,True,False,False,60879,2920,76
lFbGmWFb-Gk,SK,2026-07-01T05:06:33.465907+00:00,2026-06-28T21:00:06Z,Peter – meninová pieseň 🎶💛🎉 (29.6.) | Simeamelody ,Peter – meninová pieseň 🎶💛🎉 (29.6.) | Simeamelody ,Simeamelody,UC9V7Jk7G9Q3HyDXod31k8Iw,22,People & Blogs,,0,https://i.ytimg.com/vi/lFbGmWFb-Gk/hqdefault.jpg,sk,sk,False,236,PT3M56S,hd,False,True,False,False,19766,645,37
r8dcG8Gx-1E,SK,2026-07-01T05:06:33.465913+00:00,2026-06-30T14:15:22Z,Koutinho Jde do Vězení...,Koutinho Jde do Vězení...,Mich Sako,UCoBTbKllnZ809gucvfEgdqg,20,Gaming,"mich sako kariera, fc 26 kariera mich sako, kariera trenera fc 26, mich sako kariera hrace, fotbal, fc, eafc, ea fc 26, fc 26, michsako fc, hráč, player, kariéra, kariera, kariera hrace, kariéra hráče, mich sako koutinho, koutinho, koutinho kariéra, kariera za koutinha, mich sako kariera za koutinha, fifa, fifa 26, cz, football, cesta, kouty, fc pískej konec, koutino, world cup, mistrovství světa, ms, wc, mich sako, mistrovstvi sveta, klub, vězení, prison, koutinho vězení, mich sako vězení",40,https://i.ytimg.com/vi/r8dcG8Gx-1E/hqdefault.jpg,cs,cs,False,1961,PT32M41S,hd,False,True,False,False,52068,2950,200
6Db-cEgbmC4,SK,2026-07-01T05:06:33.465921+00:00,2026-06-26T16:00:06Z,Dj Goja x Jason Derulo x Melody - Mi Chico (Official Music Video),Dj Goja x Jason Derulo x Melody - Mi Chico (Official Music Video),Jason Derulo,UCe3yZzUwpmy2eKKmF9svX0Q,10,Music,"Jason Derulo, Jason Derulo music, Jason Derulo music video, Jason Derulo music videos, New Jason Derulo music, Savage Love, Jason Derulo Savage Love, Riding Solo, Whatcha Say, Jason Derulo Whatcha Say, TikTok, Tik Tok, Jason Derulo TikTok, Jason Derulo Tik Tok",14,https://i.ytimg.com/vi/6Db-cEgbmC4/hqdefault.jpg,en,en-US,False,130,PT2M10S,hd,False,True,False,False,2594460,112236,6155
Jr_eM57AR6o,SK,2026-07-01T05:06:33.465927+00:00,2026-06-27T16:13:56Z,NIKTO SA NESCHOVÁ LEPŠIE AKO JA!🖌️| Meccha Chameleon,NIKTO SA NESCHOVÁ LEPŠIE AKO JA!🖌️| Meccha Chameleon,2SekundovyMato,UCW9xWtZWBuPTR8Wl8vX2pnA,24,Entertainment,,0,https://i.ytimg.com/vi/Jr_eM57AR6o/hqdefault.jpg,sk,sk,False,1454,PT24M14S,hd,False,True,False,False,27566,857,11
Nd1f2pj1Hv8,SK,2026-07-01T05:06:33.465934+00:00,2026-06-09T17:00:06Z,HEĽENINE OČI - NALEJ MI KAVEJ | Official video 2026 | Titulná pieseň k filmu KAVEJ 2,HEĽENINE OČI - NALEJ MI KAVEJ | Official video 2026 | Titulná pieseň k filmu KAVEJ 2,HEĽENINE OČI,UCXrOZLLcFr31BTcmrbs_poA,10,Music,,0,https://i.ytimg.com/vi/Nd1f2pj1Hv8/hqdefault.jpg,sk,sk,False,145,PT2M25S,hd,False,True,False,False,240405,2690,61
vITo7Kh8ovw,SK,2026-07-01T05:06:33.465940+00:00,2026-06-25T13:00:06Z,Postavili CELÉ ČESKO A SLOVENSKO v MINECRAFTE !!!,Postavili CELÉ ČESKO A SLOVENSKO v MINECRAFTE !!!,Mesiac,UCSPr_APStbstOEbCmV8sp1Q,20,Gaming,"moon, mesiac, studiomoontv, yakari, siryakari, yakariho server, siryakari server, mcrybar, rybar, studiomoontv siryakari, moon yakari, yakari moon, 67, minecraft, minecraft 67, siryakari 67, matty, moon a matty, doslovanematty, studiomoontv matty, minecraft servery, server, mc rybar, cz sk, slovensky, cesky, family friendly, minecraft gameplay, letsplay, six seven, sest sedum, sest sedem, brainrot, minecraft brainrot, bouchal, majnkraft, syr jakari, syr yakari, syr, jakari, jakary, syrjakari",42,https://i.ytimg.com/vi/vITo7Kh8ovw/hqdefault.jpg,sk,sk,False,922,PT15M22S,hd,False,True,False,False,108346,4384,232
RbbxMTK8P5g,SK,2026-07-01T05:06:33.465947+00:00,2026-06-21T12:12:49Z,DJ TYNA – Don’t Cry For Me 💔 | Feel Every Beat🔥,DJ TYNA – Don’t Cry For Me 💔 | Feel Every Beat🔥,DJ TYNA,UCjjLbN33XCnikj2DaNDcbiQ,10,Music,"DJTYNA, #DanceHit, #DanceMusic, #EmotionalDance, #ElectronicMusic, #ClubMusic, #PartyMusic, #NightVibes, #FeelGoodMusic, #HeartbreakSong, #ViralMusic, #TrendingMusic, #TikTokMusic, #Reels, #Shorts, #FYP, #ForYou, #ForYouPage, #OnRepeat, #NowPlaying, #TopHits, #HitSong, #GlobalMusic, #WorldwideVibes, #Music2026, #DanceFloor, #NewMusic, #DanceAnthem",28,https://i.ytimg.com/vi/RbbxMTK8P5g/hqdefault.jpg,en,zxx,False,210,PT3M30S,hd,False,False,False,False,1054909,3635,80
Cklur4Aho4M,SK,2026-07-01T05:06:33.465954+00:00,2026-06-30T11:31:31Z,NEJVĚTŠÍ COOP V MECCHA CHAMELEON,NEJVĚTŠÍ COOP V MECCHA CHAMELEON,HaiseT+,UCGk5Ntkr4XPyQrt4qHDZ1eA,24,Entertainment,"haiset+, haiset8, cz, sk, česky, czsk, reakce, edit, stream, twitch",10,https://i.ytimg.com/vi/Cklur4Aho4M/hqdefault.jpg,cs,cs,False,6205,PT1H43M25S,hd,False,True,False,False,61667,3784,95
u7euDM0lyv8,SK,2026-07-01T05:06:33.465961+00:00,2026-06-18T16:59:39Z,Tomáš Botló & Mega M & Mamuko Berci - Kým slnko zapadá (Official Video) ,Tomáš Botló & Mega M & Mamuko Berci - Kým slnko zapadá (Official Video) ,Tomáš Botló,UCKRVvPGs8FQj3IphYV6pkJA,10,Music,"tomas botlo, kym slnko zapada, mega m, mamuko berci, Kým slnko zapadá, vsetko co mas, tomas botlo vsetko co mas, vsetko co mas tomas botlo, tomas botlo mega m, tomas botlo mamuko berci, zijem s hudbou, sen, amen roma, im calling you, kamav tut, daj mi este cas, prosim vrat sa, strateny, mozno len teba, romska hudba, romske piesne, romska piesen, saint Maria, jesua, 2026, slovensko, cesko, chcem ti povedat",28,https://i.ytimg.com/vi/u7euDM0lyv8/hqdefault.jpg,sk,sk,False,258,PT4M18S,hd,False,True,False,False,87702,1602,49
6hwwJ5o3ogE,SK,2026-07-01T05:06:33.465967+00:00,2026-06-27T18:32:06Z,1 Youtuber a 6 Streamerů: NEJLEPŠÍ SCHOVKA?! 🔥 Meccha chameleon,1 Youtuber a 6 Streamerů: NEJLEPŠÍ SCHOVKA?! 🔥 Meccha chameleon,GEJMR,UCzEu378Iu4lhZI7tz76XGNA,20,Gaming,gejmr,1,https://i.ytimg.com/vi/6hwwJ5o3ogE/hqdefault.jpg,cs,cs,False,762,PT12M42S,hd,False,True,False,False,66859,3672,59
Q7IFjVUUb_E,SK,2026-07-01T05:06:33.465974+00:00,2026-06-24T04:00:01Z,"Stray Kids ""RUN IT"" M/V","Stray Kids ""RUN IT"" M/V",JYP Entertainment,UCaO6TYtlC8U5ttz62hTrZgg,10,Music,"JYP Entertainment, JYP, Stray Kids, 스트레이 키즈, SKZ, 스키즈, 방찬, BANG CHAN, 리노, LEE KNOW, 창빈, CHANGBIN, 현진, 황현진, HYUNJIN, 한, 한지성, HAN, 필릭스, FELIX, 용복, 승민, 김승민, SEUNGMIN, 아이엔, I.N, stray kids comeback, 스트레이 키즈 컴백, 스키즈 컴백, skz comeback, skz, SKZ Teaser, 스키즈 티저, 스트레이 키즈 티저, skz teaser, Stray Kids teaser, stray kids mv teaser, skz mv teaser, Stray Kids RUN IT, RUN IT teaser, SKZ RUN IT, SKZ comeback teaser, 스키즈 런잇, SKZ This & That, This & That, 런잇, 디스앤댓, 스키즈 디스앤댓, stray kids this & that",49,https://i.ytimg.com/vi/Q7IFjVUUb_E/hqdefault.jpg,en,ko,False,229,PT3M49S,hd,True,True,False,False,25177543,1263052,121498
b_Dz8nDQh5g,SK,2026-07-01T05:06:33.465981+00:00,2026-06-29T12:13:02Z,"Nevedel, že to nie sú iba ryby…","Nevedel, že to nie sú iba ryby…",Astatoro EXTRA,UCOLQ7cK3LezoGX79zN0viMw,20,Gaming,"astatoro, Astatoro, gameplay, indie game, indie hry, fattypillow, miken, gone fishing game, gone fishing horor game, astatoro gone fishing, GONE Fishing",11,https://i.ytimg.com/vi/b_Dz8nDQh5g/hqdefault.jpg,sk,sk,False,4608,PT1H16M48S,hd,False,True,False,False,27291,1146,15
SdyezWgGXek,SK,2026-07-01T05:06:33.465988+00:00,2026-06-21T16:00:08Z,Vesna feat. Ben Cristovao - Já si tě brát nebudu (Official Music Video),Vesna feat. Ben Cristovao - Já si tě brát nebudu (Official Music Video),Vesna,UCTLxH2lEffoO9JGy_nszJ4Q,10,Music,"vesna, ben cristovao, ja si te brat nebudu, vesna ben cristovao, ben cristovao vesna, vesna ja si te brat nebudu, ben cristovao ja si te brat nebudu, laska, vesna laska, laska vesna, morava, vesna hej mami, my sisters crown, vesna eurovize, vesna eurovision, vesna eurovison, tautumeitas, she dances in the sun",18,https://i.ytimg.com/vi/SdyezWgGXek/hqdefault.jpg,cs,cs,False,198,PT3M18S,hd,False,True,False,False,197884,4489,111
rTty27z4tA8,SK,2026-07-01T05:06:33.465995+00:00,2026-06-30T12:31:28Z,TOTO JE NEJVĚTŠÍ CO-OP V MECCHA CHAMELEON!,TOTO JE NEJVĚTŠÍ CO-OP V MECCHA CHAMELEON!,FattyPillowTV,UC_c01No6K3fhgPafCUzEf6w,20,Gaming,"FattyPillow, stream, twitch, highlight, funny, CZ, fatty, reakce, reddit, fatdit",10,https://i.ytimg.com/vi/rTty27z4tA8/hqdefault.jpg,cs,cs,False,6200,PT1H43M20S,hd,False,True,False,False,42283,1682,34
vNRfmRbXLUs,SK,2026-07-01T05:06:33.466001+00:00,2026-06-26T02:47:38Z,LET ME BE (Afro House Cover),LET ME BE (Afro House Cover),Afrotrix - Topic,UCb1wW28LykYWGgOf8q93aWQ,10,Music,"Afrotrix, LET ME BE (Afro House Cover)",2,https://i.ytimg.com/vi/vNRfmRbXLUs/hqdefault.jpg,en,en,False,538,PT8M58S,hd,False,True,False,False,542761,1243,0
9M_8SBLIiJg,SK,2026-07-01T05:06:33.466008+00:00,2026-06-27T16:42:19Z,NOVÁ VÁLKA SKLADŮ JE TOP! 🤩,NOVÁ VÁLKA SKLADŮ JE TOP! 🤩,HouseBlox,UC3SpKPzCvZJzubnBmEGp_Uw,20,Gaming,"HouseBox, House, box, HouseCZ, Let's, Play, lets, cz, cesky, česky, český, haus, haus cz, haus sk, roblox, roblox cz, roblox sk, simulator, robux, robuxy, storage hunters, storage hunters world, storage hunters open world, válka skladů, nakupování, prodávání, vylepšování, odpad, cenné, drahé, nejdražší itemy",31,https://i.ytimg.com/vi/9M_8SBLIiJg/hqdefault.jpg,cs,cs,False,1377,PT22M57S,hd,False,True,False,False,92827,3725,111
oGSdfbjjqXU,SK,2026-07-01T05:06:33.466015+00:00,2026-06-17T18:04:08Z,máme toho moc,máme toho moc,Yzomandias - Topic,UCiCzfnkK0faixAEzTMKphDQ,10,Music,"Yzomandias, EXIT U PALICE, máme toho moc",3,https://i.ytimg.com/vi/oGSdfbjjqXU/hqdefault.jpg,sk,cs,False,202,PT3M22S,hd,False,True,False,False,206592,3330,0
OMZJU3005Fs,SK,2026-07-01T05:06:33.466022+00:00,2026-06-29T15:59:03Z,Strašil jsem Děsivou Minecraft Postavu...,Strašil jsem Děsivou Minecraft Postavu...,Hejlovec,UCJJlU8XFrdlyEd59YfPoY0g,20,Gaming,"minecraft, hry, minecraft challenge, hejlovec, hejlovec minecraft, česky, slovensky, hejl, hejlovec_cz, hejloveccz, hejlcz, hejl cz, cz, letsplay, minecraft cz, minecraft trolling cz, hejlovec prank, hejlovec troll, hejlovec creepypasta, hejlovec děsivá hra, hejlovec playmate, minecraft playmate, minecraft děsivá postava, hororový minecraft, strašidelný minecraft troll",25,https://i.ytimg.com/vi/OMZJU3005Fs/hqdefault.jpg,cs,cs,False,1325,PT22M5S,hd,False,True,False,False,27362,940,67
3y-DklE1ink,SK,2026-07-01T05:06:33.466029+00:00,2026-06-09T16:00:07Z,KKEVIN x T.DANNY - NEM ÉRI MEG (Official Visualizer),KKEVIN x T.DANNY - NEM ÉRI MEG (Official Visualizer),KKevin,UCKKJnhEgCz3kNgANUINWP3Q,10,Music,"KKevin, Kövesi Kevin, T. Danny, nem eri meg, nem éri meg",5,https://i.ytimg.com/vi/3y-DklE1ink/hqdefault.jpg,hu,hu,False,173,PT2M53S,hd,False,True,False,False,3067936,47653,888
UOqYU9eXygg,SK,2026-07-01T05:06:33.466036+00:00,2026-06-29T16:52:03Z,Začínám NEJTĚŽŠÍ BTD6 VÝZVU! ,Začínám NEJTĚŽŠÍ BTD6 VÝZVU! ,Wedry,UCeCLFJeRK1qBp3pxNupkNiA,20,Gaming,"wedry, wedrylp",2,https://i.ytimg.com/vi/UOqYU9eXygg/hqdefault.jpg,cs,cs,False,1805,PT30M5S,hd,False,True,False,False,53298,3749,139
w96POX8J6_E,SK,2026-07-01T05:06:33.466042+00:00,2026-06-26T16:00:06Z,ROLLANĎACI 3jo - Leto privítajme,ROLLANĎACI 3jo - Leto privítajme,Rolland Official,UC2886XW3HD6KZBfhij964eQ,10,Music,,0,https://i.ytimg.com/vi/w96POX8J6_E/hqdefault.jpg,sk,sk,False,208,PT3M28S,hd,False,True,False,False,10499,304,13
bvdVfFNdQhY,SK,2026-07-01T05:06:33.466048+00:00,2026-06-28T15:30:32Z,"JAK BUDEŠ VYPADAT V 90 LETECH?... staře, hodně staře","JAK BUDEŠ VYPADAT V 90 LETECH?... staře, hodně staře",AttackHry,UCOJiHQ_Ii0CzUmaTmrqdigg,20,Gaming,"attack hry, attackhry, attack, atak, atak hraje, atak hry, Let's, Play, cz, cesky, česky, český, hra, čeština, roblox, roblox cz, roblox atack, roblox attack, hah, roblox age tower",20,https://i.ytimg.com/vi/bvdVfFNdQhY/hqdefault.jpg,cs,cs,False,597,PT9M57S,hd,False,True,False,False,52698,1510,52
27C4pfRsf9g,SK,2026-07-01T05:06:33.466055+00:00,2026-06-10T14:58:06Z,LE SSERAFIM (르세라핌) x ILLIT (아일릿) x KATSEYE (캣츠아이) 'ICONIC BY MISTAKE' Official MV,LE SSERAFIM (르세라핌) x ILLIT (아일릿) x KATSEYE (캣츠아이) 'ICONIC BY MISTAKE' Official MV,HYBE LABELS,UC3IZKseVpdzPSBaWxBxundA,10,Music,"HYBE, HYBE LABELS, 하이브, 하이브레이블즈",4,https://i.ytimg.com/vi/27C4pfRsf9g/hqdefault.jpg,ko,ko,False,200,PT3M20S,hd,True,True,False,False,57283567,1829748,115807
-6q2Po64RxE,SK,2026-07-01T05:06:33.466062+00:00,2026-06-29T12:00:19Z,MAĽUJ Aby si sa SCHOVAL! (Meccha Chameleon),MAĽUJ Aby si sa SCHOVAL! (Meccha Chameleon),TwileR Extra,UCCy511nrGushrD2pahoTZ3w,22,People & Blogs,,0,https://i.ytimg.com/vi/-6q2Po64RxE/hqdefault.jpg,sk,sk,False,2917,PT48M37S,hd,False,True,False,False,10545,287,33
QIuNmbVySbw,SK,2026-07-01T05:06:33.466068+00:00,2026-06-14T10:10:09Z,Say My Name — Emotional Deep House | Night Drive,Say My Name — Emotional Deep House | Night Drive,StillDepths,UCll86hs3YhC8QeJmoZ27dgA,10,Music,"deep house, emotional deep house, melodic house, melodic techno, atmospheric house, indie dance, organic house, chill music, late night music, sad music, melancholic music, feeling music, relaxing music, music for the soul, deep feelings, music to study to, music to drive to, music to think to, music for rainy days, background music, night drive music, stilldepths, still depths, deep house mix, new deep house, best deep house, underground house music",27,https://i.ytimg.com/vi/QIuNmbVySbw/hqdefault.jpg,en-US,en-US,False,275,PT4M35S,hd,False,True,False,False,2270718,10434,192
EI6zAahibxU,SK,2026-07-01T05:06:33.466075+00:00,2026-06-20T07:00:22Z,"MALUJU SE, ABYCH SE SKRYL V ROBLOX MECCHA CHAMELEON!","MALUJU SE, ABYCH SE SKRYL V ROBLOX MECCHA CHAMELEON!",RiZiPlaysTV,UC8o13lZCHWbnVzUTv5BEB9g,20,Gaming,"riziplaystv, riderkoo, cz, sk, česky, slovensky, roblox hry, roblox obby, roblox story, roblox ale, vtipný, zábava, reakce, troll, trolling, roblox riderkoo, rider roblox, roblox kid, roblox admin, roblox příběh, použil jsem roblox admin, maluju se, maluju se abych se skryl, meccha chameleon, roblox meccha chameleon",25,https://i.ytimg.com/vi/EI6zAahibxU/hqdefault.jpg,cs,cs,False,892,PT14M52S,hd,False,True,False,False,181414,4202,146
