video_id,country,fetched_at,published_at,title,localized_title,channel_title,channel_id,category_id,category_name,tags,tag_count,thumbnail,default_language,audio_language,is_live,duration,duration_raw,definition,caption_available,licensed_content,embeddable,made_for_kids,views,likes,comments
Yse0H0mXEuQ,MT,2026-04-20T03:58:07.105395+00:00,2026-03-26T13:42:19Z,"BALEN - JAY MAHAKAALI (Swapnil, Chronic Beatz, Foeseal)","BALEN - JAY MAHAKAALI (Swapnil, Chronic Beatz, Foeseal)",Balen,UCJgcDT2XI3cQJhGe01AFaHQ,1,Film & Animation,,0,https://i.ytimg.com/vi/Yse0H0mXEuQ/hqdefault.jpg,en,en,False,222,PT3M42S,hd,False,True,False,False,7502940,585329,48964
AjFk1cY265I,MT,2026-04-20T03:58:07.105418+00:00,2026-04-10T16:29:45Z,Digital Circus Ep 9 Finale [TRAILER],Digital Circus Ep 9 Finale [TRAILER],GLITCH,UCn_FAXem2-e3HQvmK-mOH4g,1,Film & Animation,"glitch, glitch productions, digital circus, the amazing digital circus, murder drones, Pomni, Uzi, Jax, Ragatha, Kinger, Gangle, Zooble, Caine, Bubble, 3D, Animation, 3D Animation, Indie Animation, Gummigoo",19,https://i.ytimg.com/vi/AjFk1cY265I/hqdefault.jpg,en,en,False,70,PT1M10S,hd,True,True,False,False,23526486,1539712,109805
6U66ROb3nPA,MT,2026-04-20T03:58:07.105431+00:00,2026-04-17T17:23:03Z,2026 PMNC South Asia Finals | Day 2 | Champion Uthnecha | WATCHPARTY,2026 PMNC South Asia Finals | Day 2 | Champion Uthnecha | WATCHPARTY,Cr7 HORAA,UC27pyUnJTUyxe_z_0WxxNXw,20,Gaming,,0,https://i.ytimg.com/vi/6U66ROb3nPA/hqdefault.jpg,en-US,en-US,False,15931,PT4H25M31S,hd,False,True,False,False,254721,12063,17
7F1ET2XHQfk,MT,2026-04-20T03:58:07.105440+00:00,2026-04-09T15:59:07Z,"KATSEYE (캣츠아이) ""PINKY UP"" Official MV","KATSEYE (캣츠아이) ""PINKY UP"" Official MV",HYBE LABELS,UC3IZKseVpdzPSBaWxBxundA,10,Music,"HYBE, HYBE LABELS, 하이브, 하이브레이블즈",4,https://i.ytimg.com/vi/7F1ET2XHQfk/hqdefault.jpg,ko,ko,False,182,PT3M2S,hd,True,False,False,False,20938490,833064,141613
VRPF2tXQ06c,MT,2026-04-20T03:58:07.105449+00:00,2026-03-31T08:01:06Z,Kathanar -Official Trailer (Malayalam) | Jayasurya | Anushka Shetty | Rojin Thomas | Gokulam Gopalan,Kathanar -Official Trailer (Malayalam) | Jayasurya | Anushka Shetty | Rojin Thomas | Gokulam Gopalan,Sree Gokulam Movies,UC7rP8B90HTEXxQ6ApRVDyVg,1,Film & Animation,"Gokulam Movies, Gokulam Gopalan, Gokulam Productions, Sree Gokulam Movies, Kathanar, Kathanar teaser, Kathanar the wild sorcerer, Kathanar movie teaser, Jayasurya Kathanar, Anushka Shetty Kathanar, Rojin Thomas movie, Prabhudeva Kathanar, Indian fantasy movie, sorcerer movie India, Kathanar official teaser, Kathanar tamil teaser, mythological movies India, Indian cinema teaser, new teaser Malayalam, Kathanar cast, Jayasurya new movie, Anushka Shetty new movie",22,https://i.ytimg.com/vi/VRPF2tXQ06c/hqdefault.jpg,en,ml,False,179,PT2M59S,hd,True,True,False,False,3888545,115485,7059
IDh50Zvut0w,MT,2026-04-20T03:58:07.105474+00:00,2026-04-08T18:30:11Z,SIDEMEN AMONG US HARRY POTTER EDITION,SIDEMEN AMONG US HARRY POTTER EDITION,MoreSidemen,UCh5mLn90vUaB1PbRRx_AiaA,22,People & Blogs,"sidemen, moresidemen, miniminter, ksi, zerkaa, behzinga, tbjzl, vikkstar, wroetoshaw",9,https://i.ytimg.com/vi/IDh50Zvut0w/hqdefault.jpg,en,en-GB,False,3544,PT59M4S,hd,False,True,False,False,5003577,154017,5835
KWoTyfPsqbE,MT,2026-04-20T03:58:07.105483+00:00,2026-04-06T15:00:06Z,Sabrina Carpenter - House Tour (Official Video),Sabrina Carpenter - House Tour (Official Video),SabrinaCarpenterVEVO,UC4mYKePIas5YgGfYZ2J2OxQ,10,Music,"Sabrina Carpenter, Island Records, Pop",3,https://i.ytimg.com/vi/KWoTyfPsqbE/hqdefault.jpg,en,en,False,215,PT3M35S,hd,True,True,False,False,17864230,775262,23458
LB9lnb3oC2Y,MT,2026-04-20T03:58:07.105491+00:00,2026-04-04T12:30:07Z,Patriot Malayalam Trailer | Mammootty | Mohanlal | Mahesh Narayanan | Anto Joseph,Patriot Malayalam Trailer | Mammootty | Mohanlal | Mahesh Narayanan | Anto Joseph,Anto Joseph Film Company,UCAAufdrkoIXtfHQI9QE1tzA,24,Entertainment,"Mammootty, Mohanlal, Fahadh Faasil, Kunchacko Boban, Nayanthara, Revathy, mmmn, patriot, malayalam latest, patriot malayalam movie, malayalam, patriot mammootty, malayalam film, patriot mammootty mohanlal, malayalam films, malayalam cinema, malayalam movies, patriot movie, mohanlal about patriot movie, pan indian",20,https://i.ytimg.com/vi/LB9lnb3oC2Y/hqdefault.jpg,en,ml,False,213,PT3M33S,hd,True,True,False,False,4733247,131374,11899
QF5YpZI1wnk,MT,2026-04-20T03:58:07.105499+00:00,2026-04-11T16:00:01Z,I Survived 100 Days in Skyblock,I Survived 100 Days in Skyblock,MrBeast Gaming,UCIPPMRA040LQr5QPyJEbmXA,20,Gaming,,0,https://i.ytimg.com/vi/QF5YpZI1wnk/hqdefault.jpg,en,en,False,1362,PT22M42S,hd,True,True,False,False,40349283,668819,19791
78wrful9cVU,MT,2026-04-20T03:58:07.105506+00:00,2026-04-17T04:00:06Z,Olivia Rodrigo - drop dead (Official Music Video),Olivia Rodrigo - drop dead (Official Music Video),OliviaRodrigoVEVO,UCxE5jEls-T0QtlTHT8lI1lw,10,Music,"Olivia Rodrigo, Olivia Rodrigo PS, Pop, drop dead, you seem pretty sad for girl so in love, new olivia, 2026, kiss me and might drop dead, オリビア・ロドリゴ, 올리비아 로드리고, 奧莉維亞, 奥莉维娅罗德里戈",12,https://i.ytimg.com/vi/78wrful9cVU/hqdefault.jpg,en,en,False,251,PT4M11S,hd,True,True,False,False,11563294,704295,36990
Xt4X4FvXk2A,MT,2026-04-20T03:58:07.105514+00:00,2026-04-16T13:00:08Z,Street Fighter | Official Trailer (2026 Movie),Street Fighter | Official Trailer (2026 Movie),Paramount Pictures,UCF9imwPMSGz4Vq1NiTWCC7g,1,Film & Animation,,0,https://i.ytimg.com/vi/Xt4X4FvXk2A/hqdefault.jpg,en,en-US,False,173,PT2M53S,hd,True,True,False,False,14023789,263385,22154
RggtJZl2Uk8,MT,2026-04-20T03:58:07.105522+00:00,2026-04-17T17:24:22Z,PMNC South Asia Finals | Last Day,PMNC South Asia Finals | Last Day,Ansh YT,UClHbJ2iUOVlgyG8-Y-CNzpA,20,Gaming,,0,https://i.ytimg.com/vi/RggtJZl2Uk8/hqdefault.jpg,en,en,False,17500,PT4H51M40S,hd,False,True,False,False,177598,5043,0
yNa8jP4zoJo,MT,2026-04-20T03:58:07.105531+00:00,2026-04-13T14:00:06Z,Laufey - Madwoman (Official Music Video),Laufey - Madwoman (Official Music Video),Laufey,UChpKl3waLmccNeYH9LGYjUQ,10,Music,"laufey, jazz, indie, singer, songwriter, madwoman, mad, woman, new music, matter of time, matter, of, time, final, hour, Hudson Williams, Alysa Liu, Megan Skiendiel, Lola Tung, hudson, williams, alysa, liu, megan, skiendiel, lola, tung, women, new laufey",29,https://i.ytimg.com/vi/yNa8jP4zoJo/hqdefault.jpg,en,en,False,285,PT4M45S,hd,False,True,False,False,9025247,682607,18725
aBlsrtxuwss,MT,2026-04-20T03:58:07.105539+00:00,2026-03-18T11:17:52Z,Spider-Man: Brand New Day - Official Trailer,Spider-Man: Brand New Day - Official Trailer,PlayStation,UC-2Y8dQb0S6DtpxNgAKoJKA,20,Gaming,"PlayStation, PS5, video games, next gen, Sony",5,https://i.ytimg.com/vi/aBlsrtxuwss/hqdefault.jpg,en,en,False,158,PT2M38S,hd,False,True,False,False,18934207,673590,27715
7B0-WJ5QYsc,MT,2026-04-20T03:58:07.105546+00:00,2026-04-18T15:00:06Z,Brawl Talk: 3 NEW Brawlers!,Brawl Talk: 3 NEW Brawlers!,Brawl Stars,UCooVYzDxdwTtGYAkcPmOgOw,20,Gaming,"brawl stars, mobile game, mobile strategy game, mobile rpg, mobile battle royale, battle royale, supercell game, 3 new brawlers, new brawlers, brawl talk",10,https://i.ytimg.com/vi/7B0-WJ5QYsc/hqdefault.jpg,en,en,False,666,PT11M6S,hd,True,True,False,False,11648855,542103,42818
55KzMQB6b18,MT,2026-04-20T03:58:07.105553+00:00,2026-03-14T14:30:06Z,Aadu 3 Video Song | Sulthaan | Shaan Rahman | Midhun Manuel Thomas |Vijay Babu & Venu Kunnappilly,Aadu 3 Video Song | Sulthaan | Shaan Rahman | Midhun Manuel Thomas |Vijay Babu & Venu Kunnappilly,Friday Music Company,UCPe9lMwPO86En1jDMdbZaCA,10,Music,"aadu 3, vedhika, jayasurya, shaan rahman dance song, vedhika dance song, vinayakan, dance song, aadu 3 item song, aadu 3 songs, item song, aadu jeevitham song, aadu 2 song, aadu 2 new song, changathi song aadu 2, aadu 2 video song, aadu 2 movie songs, aadu 2 video songs, aadu 3 launching, aadu 3 interview, changaathi nannaayaal song aadu 2, aadu 3 teaser, aadu 3 location, aadu 3 bgm, aadu 3 latest news, aadu 3 cast, aadu 3 scens",26,https://i.ytimg.com/vi/55KzMQB6b18/hqdefault.jpg,en,ml,False,274,PT4M34S,hd,False,True,False,False,6549076,110178,4797
0ESCE9ExwyA,MT,2026-04-20T03:58:07.105561+00:00,2026-03-28T14:00:16Z,Vaazha 2 - Trailer | Vipin Das | Savin SA | Ankit Menon | Hashir | Alphonse Puthren,Vaazha 2 - Trailer | Vipin Das | Savin SA | Ankit Menon | Hashir | Alphonse Puthren,Think Music India,UCLbdVvreihwZRL6kwuEUYsA,10,Music,"Vaazha2, Vaazha2biopicofbillionbros, Vipin Das, Savin Sa, Vaazha, Vaazhan new movie, Vaazha sequel, bipoic of billion bros, Hashir, Alphonseputhren, Alphonse puthren, Alphonse puthren new movie, vipin das new movie, savinsa",14,https://i.ytimg.com/vi/0ESCE9ExwyA/hqdefault.jpg,en,ml,False,135,PT2M15S,hd,True,True,False,False,6246535,155591,3606
2U0OOT0ZddM,MT,2026-04-20T03:58:07.105568+00:00,2026-04-19T21:22:28Z,IEM Rio 2026 - Day 6,IEM Rio 2026 - Day 6,ESL Counter-Strike,UCPq2ETz4aAGo2Z-8JisDPIA,20,Gaming,"ESL, Counter-Strike, ESL CS, ESLCS, ESL CSGO, ESL Counter-Strike, IEM, IEM CS, IEM CSGO, CSGO, esportsisawesomesauce",11,https://i.ytimg.com/vi/2U0OOT0ZddM/hqdefault.jpg,en,en,False,29291,PT8H8M11S,hd,False,True,False,False,2163576,23620,91
wkRum2nPNxk,MT,2026-04-20T03:58:07.105576+00:00,2026-03-22T15:00:06Z,Sayax - LUCKY LUCIANO [Official video],Sayax - LUCKY LUCIANO [Official video],Sayax,UCZ0o5elzddNSZlnsJ6ijBtg,10,Music,,0,https://i.ytimg.com/vi/wkRum2nPNxk/hqdefault.jpg,en,ar,False,170,PT2M50S,hd,False,True,False,False,425211,11137,625
RIu4sFKGi6E,MT,2026-04-20T03:58:07.105583+00:00,2026-03-25T19:00:01Z,Harry Potter and the Philosopher's Stone | Official Teaser | HBO Max,Harry Potter and the Philosopher's Stone | Official Teaser | HBO Max,Harry Potter,UChPRO1CB_Hvd0TvKRU62iSQ,1,Film & Animation,"Harry Potter, Wizarding World, Warner Bros, Hogwarts, Marauders Map, Draco Malfoy, Ron Weasley, Hermione Granger, Harry Potter Lore, Potter, slytherin, ravenclaw, gryffindor, hufflepuff, hbomax, harrypotterhbo",16,https://i.ytimg.com/vi/RIu4sFKGi6E/hqdefault.jpg,en-GB,en-GB,False,129,PT2M9S,hd,True,True,False,False,10560614,273076,36945
hFMHu4agfD8,MT,2026-04-20T03:58:07.105590+00:00,2026-04-17T17:33:50Z,I Takeover Barcelona for 10 Seasons…,I Takeover Barcelona for 10 Seasons…,S2G,UChR1Yn7YpVrnP-SbsWtjuBA,20,Gaming,,0,https://i.ytimg.com/vi/hFMHu4agfD8/hqdefault.jpg,en-GB,en,False,2147,PT35M47S,hd,False,True,False,False,516505,21212,1176
0HjdiohVOik,MT,2026-04-20T03:58:07.105597+00:00,2026-03-31T15:59:00Z,Backrooms | Official Trailer HD | A24,Backrooms | Official Trailer HD | A24,A24,UCuPivVjnfNo4mb3Oog_frZg,1,Film & Animation,"a24, a24 films, a24 trailers, independent films, trailer, HD, official, movie, film, a24 movies, oscar winner, academy award winner",12,https://i.ytimg.com/vi/0HjdiohVOik/hqdefault.jpg,en,en,False,138,PT2M18S,hd,True,True,False,False,17927788,528601,27814
10OJhIc_-vw,MT,2026-04-20T03:58:07.105604+00:00,2026-03-30T03:52:19Z,Minecraft Speedrunner VS 6 Hunters REMATCH,Minecraft Speedrunner VS 6 Hunters REMATCH,Dream,UCTkXRDQl0luXxVQrRQvWS6w,20,Gaming,"minecraft, dream, dream minecraft",3,https://i.ytimg.com/vi/10OJhIc_-vw/hqdefault.jpg,en,en,False,3129,PT52M9S,hd,True,True,False,False,10184551,401252,26995
oSeqs_xeqv4,MT,2026-04-20T03:58:07.105611+00:00,2026-04-09T16:00:01Z,A Marvel Television Special Presentation: The Punisher: One Last Kill | Official Trailer,A Marvel Television Special Presentation: The Punisher: One Last Kill | Official Trailer,Marvel Entertainment,UCvC4D8onUfXzvjTOM-dBfEA,24,Entertainment,"marvel, comics",2,https://i.ytimg.com/vi/oSeqs_xeqv4/hqdefault.jpg,en,en,False,102,PT1M42S,hd,True,True,False,False,5643045,195996,7807
pS1bWc29g0Q,MT,2026-04-20T03:58:07.105618+00:00,2026-04-08T10:52:57Z,I Explored the Minecraft Mist,I Explored the Minecraft Mist,FlameFrags,UCvYPobTo42NM36X7VC4dLhA,20,Gaming,"minecraft, flamefrags, flame frags, flamefrags minecraft, flame minecraft",5,https://i.ytimg.com/vi/pS1bWc29g0Q/hqdefault.jpg,en-US,en-US,False,2815,PT46M55S,hd,False,True,False,False,3706268,129725,20297
s1-pfiVMKAs,MT,2026-04-20T03:58:07.105626+00:00,2026-03-31T16:00:12Z,Supergirl | Official Trailer,Supergirl | Official Trailer,DC,UCiifkYAs_bq1pt_zbNAzYGg,1,Film & Animation,"2026, Coming Soon, Craig Gillespie, DC, DC Comics, DC Studios, DCU, David Krumholtz, Emily Beecham, Eve Ridley, James Gunn, Jason Momoa, Kara Zor-El, Krypto, Matthias Schoenaerts, Milly Alcock, Supergirl, WB, Warner Bros, Warner Bros Pictures, Warner Brothers, official trailer",22,https://i.ytimg.com/vi/s1-pfiVMKAs/hqdefault.jpg,en,en-US,False,177,PT2M57S,hd,True,False,False,False,16482990,283919,16828
3_9vCamtuPY,MT,2026-04-20T03:58:07.105633+00:00,2026-03-17T16:19:02Z,Dune: Part Three | Official Teaser Trailer,Dune: Part Three | Official Teaser Trailer,Warner Bros.,UCjmJDM5pRKbUlVIzDYYWb6g,1,Film & Animation,"Action, Anya Taylor-Joy, Brian K Vaughan, Charlotte Rampling, Coming Soon, Denis Villeneuve, Dune, Dune Messiah, Dune: Part Three, Florence Pugh, Ida Brooke, Isaach De Bankolé, Jason Momoa, Javier Bardem, Messiah, Nakoa-Wolf Momoa, Rebecca Ferguson, Robert Pattinson, Sci Fi, Timothée Chalamet, Trilogy, Warner Bros, Zendaya",23,https://i.ytimg.com/vi/3_9vCamtuPY/hqdefault.jpg,en,en-US,False,150,PT2M30S,hd,True,False,False,False,29447207,624626,29913
