video_id,country,fetched_at,published_at,title,localized_title,channel_title,channel_id,category_id,category_name,tags,tag_count,thumbnail,default_language,audio_language,is_live,duration,duration_raw,definition,caption_available,licensed_content,embeddable,made_for_kids,views,likes,comments
b4iVv91Z6lY,HK,2026-03-28T03:22:47.016073+00:00,2026-03-20T03:58:06Z,BTS (방탄소년단) ‘SWIM’ Official MV,BTS (방탄소년단) ‘SWIM’ Official MV,HYBE LABELS,UC3IZKseVpdzPSBaWxBxundA,10,Music,"HYBE, HYBE LABELS, 하이브, 하이브레이블즈",4,https://i.ytimg.com/vi/b4iVv91Z6lY/hqdefault.jpg,ko,ko,False,245,PT4M5S,hd,True,True,False,False,73667031,5858404,987423
58HsJLQ2Blg,HK,2026-03-28T03:22:47.016112+00:00,2026-03-19T12:30:07Z,《蜘蛛俠4》預告解析 | 驚喜&信息量極多！浩克被變種人精神控製？夜魔俠＆制裁者參戰！| 蜘蛛俠英雄重生 蜘蛛人重生日 蜘蛛俠嶄新之日 Spider-Man Brand New Day,《蜘蛛俠4》預告解析 | 驚喜&信息量極多！浩克被變種人精神控製？夜魔俠＆制裁者參戰！| 蜘蛛俠英雄重生 蜘蛛人重生日 蜘蛛俠嶄新之日 Spider-Man Brand New Day,電影Ching報,UC3K6R_8DD0gkscD8inYSF0A,1,Film & Animation,"電影Ching報, ching, 蜘蛛俠, 蜘蛛人, 蜘蛛俠4, 蜘蛛俠英雄重生, 蜘蛛人 重生日, 蜘蛛俠嶄新之日, spider-man: brand new day, spiderman, 復仇者聯盟5, 復仇者聯盟5 末日, 復仇者聯盟5 末日掘起, avengers doomsday, 美國隊長, 預告, avengers doomsday trailer, captain america, 神奇4俠, 神奇4俠 英雄第一步, 驚奇4超人, fantastic 4, fantastic four, fantastic 4 first step, 雷霆特攻隊*, 雷霆特攻隊, thunderbolts, 雷霆, rdj, robert downey jr., 死侍與金鋼狼, 死侍與狼人, 死侍, 狼人, x戰警, 漫威, marvel, mcu, mcu phase 6, 漫威第六階段, avenger secret wars, marvel phase 5, marvel studios, new avengers, 新復仇者聯盟, 末日博士, x men, 變種特攻",48,https://i.ytimg.com/vi/58HsJLQ2Blg/hqdefault.jpg,zh-Hant,zh-HK,False,1106,PT18M26S,hd,False,True,False,False,145075,5372,195
1r2kbZo_7X0,HK,2026-03-28T03:22:47.016126+00:00,2026-03-24T09:00:02Z,[JFFLIVE打機精華] 車手麗再發威！麗字頭震撼全城！三傻正式加入 Sun Beyond！｜GTA RP 肥貓精華 EP3 @JFFLiveChannel @JFFTHK,[JFFLIVE打機精華] 車手麗再發威！麗字頭震撼全城！三傻正式加入 Sun Beyond！｜GTA RP 肥貓精華 EP3 @JFFLiveChannel @JFFTHK,隆巴仔,UCEEd51olr-XAXGJaJCicbBw,24,Entertainment,,0,https://i.ytimg.com/vi/1r2kbZo_7X0/hqdefault.jpg,zh-Hant,zh-HK,False,1850,PT30M50S,hd,False,True,False,False,52041,1292,86
lNCQbx-y9V8,HK,2026-03-28T03:22:47.016135+00:00,2026-03-24T16:15:50Z,那天下雨了,那天下雨了,Jay Chou - Topic,UCL2MDNdwEtV6aYUgNjFQGZA,10,Music,"周杰倫, 太陽之子, 那天下雨了",3,https://i.ytimg.com/vi/lNCQbx-y9V8/hqdefault.jpg,zh-Hant,zh,False,224,PT3M44S,hd,False,True,False,False,1258291,17121,586
1mXzLcAJtSY,HK,2026-03-28T03:22:47.016143+00:00,2026-03-20T02:00:06Z,【預告解析】蜘蛛人:重生日-又有一堆隱藏角色 小蜘蛛身體怎麼變異了？| 超粒方 | Spiderman: Brand New Day,【預告解析】蜘蛛人:重生日-又有一堆隱藏角色 小蜘蛛身體怎麼變異了？| 超粒方 | Spiderman: Brand New Day,超粒方,UC0Q-fBheHysYWz9ObSEzMdA,1,Film & Animation,"超粒方, 超立方, 牛叔说电影, 分分鐘電影大咖, 春哥说电影, 胶片看电影, 昏昏啊, 小涛讲电影, 科幻梦工场, 宇哥讲电影, 哇萨比抓马, WasabiDrama, 電影推薦, 推薦電影, 大聰, 大聰看電影, Teepr, TEEPR 叭啦叭啦研究室, 那些電影教我們的事, 那些電影, 大聪看电影, 大聪, 老高, 老高與小茉, 漫威, Marvel, 影集, 影集推薦, 美劇, 美劇推薦, 推薦美劇, 電影, 電影解說, 美劇解說, 越哥说电影, 說電影, 科幻桃小柏, 蜘蛛人重生日, 蜘蛛人, 蜘蛛人預告, 蜘蛛人重生日預告, Spiderman, Spiderman Brand New Day, 蜘蛛俠, 蜘蛛俠4, 蜘蛛俠4預告, 蜘蛛俠 英雄重生, 蜘蛛侠：崭新之日",48,https://i.ytimg.com/vi/1mXzLcAJtSY/hqdefault.jpg,zh-TW,zh-TW,False,1360,PT22M40S,hd,False,True,False,False,455234,7817,391
Iza920Xzx4o,HK,2026-03-28T03:22:47.016152+00:00,2026-03-22T17:23:37Z,[中文] G2 vs BLG | Finals | 2026 First Stand,[中文] G2 vs BLG | Finals | 2026 First Stand,LoLEsportsTW ,UCYfC038eP_cm9WNo5Cv-tBg,20,Gaming,"LOL, League of Legend, PCS, lol, eSports, Southeast, Asia, moba, riot",9,https://i.ytimg.com/vi/Iza920Xzx4o/hqdefault.jpg,zh-Hant,zh-TW,False,16518,PT4H35M18S,hd,False,True,False,False,523879,2244,89
pBjz4qzj_zs,HK,2026-03-28T03:22:47.016161+00:00,2026-03-25T11:30:06Z,Anson Lo 盧瀚霆 《Charisma》Official Music Video,Anson Lo 盧瀚霆 《Charisma》Official Music Video,MIRROR,UCEuQ-0x3uMk1KghGiO1kTHg,10,Music,"MIRROR, MIRRORweare",2,https://i.ytimg.com/vi/pBjz4qzj_zs/hqdefault.jpg,zh-Hant,zh-HK,False,170,PT2M50S,hd,True,True,False,False,240460,4565,1446
VcjcDv04tIE,HK,2026-03-28T03:22:47.016169+00:00,2026-03-18T11:05:59Z,《蜘蛛俠：英雄重生》正式預告 [Spider-Man: Brand New Day Official Trailer],《蜘蛛俠：英雄重生》正式預告 [Spider-Man: Brand New Day Official Trailer],SonyPicturesHK,UCJm3SXaARpl5A9ty3G9Dzxg,1,Film & Animation,,0,https://i.ytimg.com/vi/VcjcDv04tIE/hqdefault.jpg,zh-Hant,en,False,153,PT2M33S,hd,False,False,False,False,382579,4337,251
iA7ESoJXfaQ,HK,2026-03-28T03:22:47.016177+00:00,2026-03-25T12:31:56Z,ROBLOX 畫出一個雪撬，滑到山下！但！中間超多障礙.. 你可以畫出最強雪撬到終點?!【Draw A Sleigh & Slide Downhill - 有感筆電】,ROBLOX 畫出一個雪撬，滑到山下！但！中間超多障礙.. 你可以畫出最強雪撬到終點?!【Draw A Sleigh & Slide Downhill - 有感筆電】,有感筆電 Daptoper,UCU-swpBLny7YEqNJB4hI1Kg,20,Gaming,"roblox, 迷因, 梗圖, 迷因梗圖, 有感筆電, daptoper, game, 遊戲, 機械方塊, 罗布乐思, meme, funny, 機器磚塊, 以下單純試圖找到YouTube流量密碼, 生存遊戲, 恐怖遊戲, 搞笑遊戲, 進化, Minecraft, 冒險, 生存, 死亡, 熱門, 好看, 有趣, 奇怪, 小遊戲, 小品遊戲, 網頁遊戲, 等級1, 等級99, 神級, 成長遊戲, 養成遊戲, 奇怪地圖, 惡搞地圖, 整人地圖, 逃離, 怪人, 成長, 脫逃成功, 逃脫地圖, 殺人, 逃脫, 逃出, 跑酷, 嚇人, 整人遊戲, 糞GAME, 怪物, 奇怪遊戲, 奇怪的遊戲, 怪誕, 養成型遊戲, 爆笑, 搞笑, 搞笑地圖, 恐怖地圖, 爆笑遊戲, 生存地圖, 可怕的頭, 挑戰系列, ROBLOX 有感筆電, Roblox Daptoper, 死亡遊戲, roblox roleplay, roblox funny moments, roblox doors, OP, 最強武器, blox fruits, 娛樂, 手遊, 恐怖, 手機遊戲, 新遊戲, 精華, 遊戲推薦, 電玩, 免費, 實況, 怪談, 台灣, 閲覧注意",84,https://i.ytimg.com/vi/iA7ESoJXfaQ/hqdefault.jpg,zh-TW,zh-TW,False,732,PT12M12S,hd,False,True,False,False,226608,5901,564
RBaSiVjtKR4,HK,2026-03-28T03:22:47.016187+00:00,2026-03-20T04:00:34Z,Body to Body,Body to Body,BTS - Topic,UC9vrvNSL3xcWGSkV86REBSg,10,Music,"BTS, 방탄소년단, ARIRANG, Body to Body",4,https://i.ytimg.com/vi/RBaSiVjtKR4/hqdefault.jpg,en,ko,False,190,PT3M10S,hd,False,True,False,False,24595437,1278742,58222
tTUhjPBu4Pg,HK,2026-03-28T03:22:47.016194+00:00,2026-03-26T15:55:45Z,《沙丘3》萬字預告解析！最愛的人可能傷害最深！#沙丘3,《沙丘3》萬字預告解析！最愛的人可能傷害最深！#沙丘3,大聪看电影,UCkM0vZ9Q2ZxxRPORzTDI7eg,1,Film & Animation,"沙丘3, 沙丘3預告, 甜茶, 沙丘瀚戰3, 預告解析, 羅伯特帕丁森, 讚達亞, 丹尼斯维伦纽瓦, 沙丘, 罗伯特帕丁森",10,https://i.ytimg.com/vi/tTUhjPBu4Pg/hqdefault.jpg,zh-Hant,zh-Hant,False,1547,PT25M47S,hd,False,True,False,False,54685,1060,88
4DqVuL3XCqY,HK,2026-03-28T03:22:47.016202+00:00,2026-03-19T18:41:03Z,[JFFLIVE]多人跑步桌遊 跑Online 回歸！,[JFFLIVE]多人跑步桌遊 跑Online 回歸！,JFFLive,UC3aipgNToMvs2pFaQyaM_hg,24,Entertainment,,0,https://i.ytimg.com/vi/4DqVuL3XCqY/hqdefault.jpg,zh-Hant,zh-HK,False,17032,PT4H43M52S,hd,False,False,False,False,127851,1667,46
npQTUDBRC10,HK,2026-03-28T03:22:47.016209+00:00,2026-03-25T05:03:08Z,本命,本命,Anson Lo 盧瀚霆 - Topic,UCx4RB2r688thwBZ9hMJWdaw,10,Music,"Anson Lo 盧瀚霆, 本命",2,https://i.ytimg.com/vi/npQTUDBRC10/hqdefault.jpg,zh-Hant,und,False,212,PT3M32S,hd,False,True,False,False,43318,2743,732
3_9vCamtuPY,HK,2026-03-28T03:22:47.016217+00:00,2026-03-17T16:19:02Z,Dune: Part Three | Official Teaser Trailer,Dune: Part Three | Official Teaser Trailer,Warner Bros.,UCjmJDM5pRKbUlVIzDYYWb6g,1,Film & Animation,"Action, Anya Taylor-Joy, Brian K Vaughan, Charlotte Rampling, Coming Soon, Denis Villeneuve, Dune, Dune Messiah, Dune: Part Three, Florence Pugh, Ida Brooke, Isaach De Bankolé, Jason Momoa, Javier Bardem, Messiah, Nakoa-Wolf Momoa, Rebecca Ferguson, Robert Pattinson, Sci Fi, Timothée Chalamet, Trilogy, Warner Bros, Zendaya",23,https://i.ytimg.com/vi/3_9vCamtuPY/hqdefault.jpg,en,en-US,False,150,PT2M30S,hd,True,False,False,False,26633440,596848,28566
5CX02MON6jo,HK,2026-03-28T03:22:47.016224+00:00,2026-03-22T17:25:31Z,G2 vs. BLG | First Stand Tournament | Finals,G2 vs. BLG | First Stand Tournament | Finals,LoL Esports,UCvqRdlKsE5Q8mf8YXbdIJLw,20,Gaming,"League of Legends, League of Legends esports, LoL Esports, lolesports, lol esports, league esports, LoL 2026, Worlds, Worlds 2026, LoL Worlds, World Championship, MSI, MSI 2026, First Stand, First Stand 2026, FST 2026, LCK, LEC, LPL, LCP, LTA, LTA North, LTA South, LCS, CBLOL, pro play, VOD, highlights, full match, playoffs, finals, best plays, top moments, recap, analysis, casters, interviews, behind the scenes, patch, bans, teamfight, pentakill, live, BO3, BO5, T1, GEN, HLE, Chovy, Faker, Caps, Zeus",52,https://i.ytimg.com/vi/5CX02MON6jo/hqdefault.jpg,en,en,False,18356,PT5H5M56S,hd,False,True,False,False,1101316,8091,81
Wg6QrdTl_So,HK,2026-03-28T03:22:47.016233+00:00,2026-03-25T16:00:06Z,gareth.t - 我很小朋友 (lyric video),gareth.t - 我很小朋友 (lyric video),Gareth.T,UCZKGtz4orFEaVSNLe2lORHw,10,Music,"Gareth.T, 湯令山, Wyman Wong, 黃偉文, The Protege, Album, 用背脊唱情歌, 緊急聯絡人",8,https://i.ytimg.com/vi/Wg6QrdTl_So/hqdefault.jpg,zh-Hant,en,False,178,PT2M58S,hd,False,True,False,False,81223,2771,97
OZnTybpYGY4,HK,2026-03-28T03:22:47.016240+00:00,2026-03-18T23:00:27Z,蜘蛛人→蜘蛛！38個《蜘蛛人：重生日》預告細節/彩蛋,蜘蛛人→蜘蛛！38個《蜘蛛人：重生日》預告細節/彩蛋,TEEPR 叭啦叭啦研究室,UCzAOdjLlfyW19t8PtG1f7MA,1,Film & Animation,"TEEPR, TEEPR亮新聞, TEEPR亮影片, DC, 巴拉巴拉, 吧啦吧啦, 扒拉扒拉, 啪啦啪啦, 迪士尼, 漫威, 英雄片, 動畫, 卡通, 電影解析, 影評, 劇情解析, 電影推薦, 電影心得, 電影懶人包, 電影剖析, 電影解說, 電影講解, 好看電影, 必看電影, 經典電影, 冷門電影推薦, Netflix推薦, 影集解析, 電影介紹, 結局解析, 隱藏細節, 最新電影推薦, 劇情片推薦, 電影真相, 電影觀後感, 電影排行榜, 週末電影推薦, 電影預告解析, 電影隱喻, 電影象徵意義, 結局含義解析, 電影背後的意義, 導演想說什麼, 隱藏彩蛋, 深度解析, 電影中的哲學, 隱藏訊息, 劇情背後的真相, 電影暗喻, 劇情含義, 電影中沒說的事, 角色背後含義, 電影細節解析, disney, marvel",55,https://i.ytimg.com/vi/OZnTybpYGY4/hqdefault.jpg,zh-TW,zh-TW,False,1207,PT20M7S,hd,False,True,False,False,242804,7243,442
rkXsLIBi5fg,HK,2026-03-28T03:22:47.016249+00:00,2026-03-26T10:01:29Z,『一週年前夕攻略』《47連免費池不能錯過的重點》自選ＵＲ機體推薦強度建議、板塊使命任務陷阱！【SD鋼彈 G世代永恆】SD Gundam G Generation ETERNAL (附 字幕 粵語),『一週年前夕攻略』《47連免費池不能錯過的重點》自選ＵＲ機體推薦強度建議、板塊使命任務陷阱！【SD鋼彈 G世代永恆】SD Gundam G Generation ETERNAL (附 字幕 粵語),大聲宗,UCepOMUJvRwQd16z04fMV-Yw,20,Gaming,"SD鋼彈, G世代 永恆, SD高達, sd 鋼彈 g 世代 永恆, sd 鋼彈 g 世代 永恆 ssr, ULT, SSP化機體, SSP化, 黑哈囉, 一週年",10,https://i.ytimg.com/vi/rkXsLIBi5fg/hqdefault.jpg,zh-Hant,zh-HK,False,911,PT15M11S,hd,True,True,False,False,43787,791,107
bJjxBNtqHW4,HK,2026-03-28T03:22:47.016256+00:00,2026-03-17T13:00:06Z,洪嘉豪 Hung Kaho - 穿波鞋的惡魔 The Devil Wears Sneakers (Official Music Video),洪嘉豪 Hung Kaho - 穿波鞋的惡魔 The Devil Wears Sneakers (Official Music Video),洪嘉豪 Hung Kaho,UCXDQojAB3faJeGnSUXZBGXQ,10,Music,"洪嘉豪, Hung Kaho, 洪嘉豪 Kaho, Kaho, Kaho 洪嘉豪, Kaho MC, Kaho Hung, 掉進海的眼淚, 主角光環, 逆時車站, 洪嘉豪 張天賦",11,https://i.ytimg.com/vi/bJjxBNtqHW4/hqdefault.jpg,zh-Hant,yue-HK,False,265,PT4M25S,hd,True,True,False,False,251048,5574,272
Fnui3o-zZGo,HK,2026-03-28T03:22:47.016264+00:00,2026-03-19T13:11:23Z,年度最期待！《蜘蛛侠4》预告深度解析！成家班指导打戏+兽性觉醒暗黑剧情,年度最期待！《蜘蛛侠4》预告深度解析！成家班指导打戏+兽性觉醒暗黑剧情,努力的Lorre油管频道,UCKMZ34aa78_8tsPpIeuIMmA,22,People & Blogs,"努力的lorren, 漫威, 漫画解说, 美漫, 漫画",5,https://i.ytimg.com/vi/Fnui3o-zZGo/hqdefault.jpg,zh,zh-CN,False,900,PT15M,hd,False,True,False,False,316241,2978,267
qP6HJyeceRc,HK,2026-03-28T03:22:47.016271+00:00,2026-03-25T04:00:06Z,瘋狂退款？！赤色沙漠急救搞唔搞得掂？- Gamehub 遊戲 八卦 花生 新聞 (cc.中文字幕),瘋狂退款？！赤色沙漠急救搞唔搞得掂？- Gamehub 遊戲 八卦 花生 新聞 (cc.中文字幕),希治閣【遊戲情報科】,UCk25FUc8pLiP3A6Zniknxbg,20,Gaming,"遊戲, 遊戲新聞, 新game, 情報科, 希治閣, PS5, XS, XSX, XSS, XBOX, Switch, 新GAME, 介紹, 廣東話, 中文字幕, 遊戲三世書, 遊戲情報科, gamehub, 歷史, 恐怖遊戲, 獨立遊戲, 單機遊戲, ps5, xsx, 刺客, war thunder, 隻狼, 八卦",28,https://i.ytimg.com/vi/qP6HJyeceRc/hqdefault.jpg,zh-Hant,zh-HK,False,598,PT9M58S,hd,False,True,False,False,54496,2120,202
--BbS1Lw0rY,HK,2026-03-28T03:22:47.016279+00:00,2026-03-25T13:00:07Z,MC 張天賦 | Emz - 像話 Decent (feat. Novel Fergus) (Official Music Video),MC 張天賦 | Emz - 像話 Decent (feat. Novel Fergus) (Official Music Video),MC 張天賦,UC4LyPYXnF07KF97Nb8vE_Pg,10,Music,,0,https://i.ytimg.com/vi/--BbS1Lw0rY/hqdefault.jpg,zh-Hant,zh-HK,False,242,PT4M2S,hd,True,True,False,False,62951,2694,262
sgE2FyN7MTg,HK,2026-03-28T03:22:47.016286+00:00,2026-03-26T04:03:07Z,《我們不是什麼》WE'RE NOTHING AT ALL｜香港正式預告 # 2｜4月3日獻映,《我們不是什麼》WE'RE NOTHING AT ALL｜香港正式預告 # 2｜4月3日獻映,GoldenSceneHK,UCxIdoIporTzf2wdpFvCXRiQ,1,Film & Animation,,0,https://i.ytimg.com/vi/sgE2FyN7MTg/hqdefault.jpg,zh-Hant,und,False,109,PT1M49S,hd,False,True,False,False,27441,472,44
nad1bGiaqYg,HK,2026-03-28T03:22:47.016293+00:00,2026-03-25T06:45:27Z,無限連抽！你揀那隻？1週年活動 ！｜SD高達G世代永恆｜SD Gundam G Generation ETERNAL｜鋼彈｜心得雜談,無限連抽！你揀那隻？1週年活動 ！｜SD高達G世代永恆｜SD Gundam G Generation ETERNAL｜鋼彈｜心得雜談,魔人SAVI,UCy5KSsl9XRZrFgdr2Dv9OyA,20,Gaming,,0,https://i.ytimg.com/vi/nad1bGiaqYg/hqdefault.jpg,zh-HK,zh-TW,False,516,PT8M36S,hd,False,True,False,False,28152,519,154
pePep8NNBUI,HK,2026-03-28T03:22:47.016300+00:00,2026-03-26T10:04:36Z,我最討厭的男歌手,我最討厭的男歌手,蔡俊彥 Ryan Choi - Topic,UCkqEVKlbV1XGZ3QIRefiS7w,10,Music,"蔡俊彥 Ryan Choi, 蔡俊彦 Ryan Choi, 林奕匡, 我最討厭的男歌手",4,https://i.ytimg.com/vi/pePep8NNBUI/hqdefault.jpg,zh-Hant,zh,False,230,PT3M50S,hd,False,True,False,False,33579,1930,0
nRpr-D2xtpo,HK,2026-03-28T03:22:47.016307+00:00,2026-03-25T14:00:00Z,《巔峰獵殺》 | 正式預告 | Netflix,《巔峰獵殺》 | 正式預告 | Netflix,Netflix Taiwan,UCeH360abfAGTyTpi3nmVwXw,24,Entertainment,"4月, Apex, Netflix, 一口氣, 兇手, 冒險, 凶手, 動作, 可怕, 四月, 夏天, 夏季, 夏日, 巔峰獵殺, 巴塔薩科馬庫, 影片, 心理, 戶外, 春天, 春季, 春日, 暗黑, 欲罷不能, 殺人, 殺手, 求生, 泰隆艾格頓, 犯罪, 生存, 真實, 腎上腺素, 自然, 艾瑞克巴納, 荒野, 莎莉賽隆, 觀看, 觀賞, 謀殺, 連環殺手, 野外, 電影, 預告, 驚悚, 黑暗",44,https://i.ytimg.com/vi/nRpr-D2xtpo/hqdefault.jpg,zh-Hant,en-US,False,134,PT2M14S,hd,False,False,False,False,79783,927,52
4qHUn-RUO7w,HK,2026-03-28T03:22:47.016315+00:00,2026-03-24T11:30:54Z,《Resident Evil Requiem》無限彈藥瘋狂難度虐喪屍 Part7,《Resident Evil Requiem》無限彈藥瘋狂難度虐喪屍 Part7,GamePlayHK短片攻略,UCLUA5xPUeBairwsxsbGWw5A,20,Gaming,,0,https://i.ytimg.com/vi/4qHUn-RUO7w/hqdefault.jpg,zh-Hant,zh-HK,False,4807,PT1H20M7S,hd,False,True,False,False,21944,842,110
Ua_A1aFl95I,HK,2026-03-28T03:22:47.016323+00:00,2026-03-26T16:03:54Z,Deadend (活該),Deadend (活該),Tyson Yoshi - Topic,UC44kj7xDOcCiWB2GKf2bGhA,10,Music,"Tyson Yoshi, Jackson Wang, Deadend (活該)",3,https://i.ytimg.com/vi/Ua_A1aFl95I/hqdefault.jpg,zh-Hant,zh,False,236,PT3M56S,hd,False,True,False,False,46661,1898,115
cdh7LWKdf-M,HK,2026-03-28T03:22:47.016330+00:00,2026-03-25T18:59:53Z,Harry Potter and the Philosopher’s Stone | Official Teaser | #HBOMaxAsia,Harry Potter and the Philosopher’s Stone | Official Teaser | #HBOMaxAsia,HBO Max Asia,UCAixbkcQRJcuReMg4BEdH2g,22,People & Blogs,"hbo, hbo asia, netflix, disney, hulu, entertainment, hollywood, movies, series, streaming, max, streamonmax, DC universe, Discovery Channel, TLC, HBO Original, Cartoon Network, WB Movies, WBTV, Watch Better, Max Asia",21,https://i.ytimg.com/vi/cdh7LWKdf-M/hqdefault.jpg,en,en,False,124,PT2M4S,hd,True,True,False,False,494614,13393,2279
Cf5CTMKnTcg,HK,2026-03-28T03:22:47.016337+00:00,2026-03-21T08:17:13Z,達哥 Resident Evil Requiem #6[聊] 黎明重返警局! 大戰科學怪人! 片尾重現神曲 Annie are you OK?,達哥 Resident Evil Requiem #6[聊] 黎明重返警局! 大戰科學怪人! 片尾重現神曲 Annie are you OK?,undergroundDV 達哥,UC010GdkqQuzdQPs5oHCcFmw,20,Gaming,"twitch, games, 達哥, undergroundDV, TATGOR, PS4, SONY, 打機, 手遊, PC, 美男, 美女, 木村, TWITCH, PLAYSTATION, GAME, GAMER, 爆機兄弟, 通關, 攻略, GUIDE, walkthrough, GTA, Japan, China, 中國, 日本, POP, 流行, 遊戲, 學廣東話, HONG KONG, 廣東話, 香港, 大胸, 畫面靚絕, 畫面靚, 真4K, PS, ACTION GAME, MARIO, SPEED RUN, DIFFICULTY, 高難度, 高手, 電玩高手, 九龍, 動作, 動作GAME, E SPORTS, 電競, 男人, gay, gv, horror, 姐弟, puzzle, 智力, 新GAME, New Game, XBOX, FPS, 防疫, 好笑, 減壓, 抑鬱, youtuber, 粵語, cantonese, 白話, 卡關, 電玩, he he, 英雄, 成步堂, 逆轉裁判, 官司, 御劍, 大狀, CAPCOM",80,https://i.ytimg.com/vi/Cf5CTMKnTcg/hqdefault.jpg,zh-HK,zh-HK,False,10706,PT2H58M26S,hd,False,True,False,False,27201,408,48
x0FwbTiD3iA,HK,2026-03-28T03:22:47.016347+00:00,2026-03-23T08:58:06Z,YUNA “Ice Cream” M/V,YUNA “Ice Cream” M/V,JYP Entertainment,UCaO6TYtlC8U5ttz62hTrZgg,10,Music,"JYP Entertainment, JYP, YUNA, 유나, Ice Cream",5,https://i.ytimg.com/vi/x0FwbTiD3iA/hqdefault.jpg,en,ko,False,189,PT3M9S,hd,True,True,False,False,6076382,282030,21391
VPi232F9yN8,HK,2026-03-28T03:22:47.016354+00:00,2026-03-25T04:08:40Z,【台灣上映】《機動戰士鋼彈 閃光的哈薩威 喀耳刻的魔女》戰場體驗版預告公開！Dolby Cinema • 4DX • MX4D 熱映中！,【台灣上映】《機動戰士鋼彈 閃光的哈薩威 喀耳刻的魔女》戰場體驗版預告公開！Dolby Cinema • 4DX • MX4D 熱映中！,Medialink Hong Kong,UCbj9ztDnItGCBY1jaRy4dMQ,1,Film & Animation,Medialink,1,https://i.ytimg.com/vi/VPi232F9yN8/hqdefault.jpg,zh-Hant,zxx,False,120,PT2M,hd,False,False,False,False,138705,2288,201
IjCY7SjQhQk,HK,2026-03-28T03:22:47.016361+00:00,2026-03-27T09:37:53Z,【Sailor Piece】只用刀從0到13000等！一口氣解完所有的刀劍！ 【水手寶石】【機械方塊】,【Sailor Piece】只用刀從0到13000等！一口氣解完所有的刀劍！ 【水手寶石】【機械方塊】,R子,UC-iFCNP2aUQyOf8rWeVEwEQ,20,Gaming,"sailor piece, 水手寶石, R子, blox fruits, roblox海賊王, 機械方塊",6,https://i.ytimg.com/vi/IjCY7SjQhQk/hqdefault.jpg,zh-Hant,zh,False,2317,PT38M37S,hd,True,True,False,False,96122,2526,267
XIZh5rNGDFg,HK,2026-03-28T03:22:47.016368+00:00,2026-03-25T14:15:06Z,《國貨城2026禁毒精選大碟》晴天林｜郭富城禁毒打招呼「一齊企硬唔take嘢」,《國貨城2026禁毒精選大碟》晴天林｜郭富城禁毒打招呼「一齊企硬唔take嘢」,晴天林 SunnyLam,UCZufQLtl-6Ib0FPBceTY8QA,10,Music,晴天林,1,https://i.ytimg.com/vi/XIZh5rNGDFg/hqdefault.jpg,zh-Hant,zh-HK,False,166,PT2M46S,hd,False,True,False,False,86297,5452,220
lgMgwGUc9_I,HK,2026-03-28T03:22:47.016405+00:00,2026-03-26T16:00:00Z,【橡樹街末日】前導預告，今年8月大銀幕鉅獻,【橡樹街末日】前導預告，今年8月大銀幕鉅獻,華納兄弟台灣,UC8XIx0eSj0onoJXa2iG0Rmw,1,Film & Animation,"2026, Anne Hathaway, August 2026, Bad Robot, Christian Convery, Coming Soon, David Robert Mitchell, End Of Oak Street, Ewan McGregor, J.J. Abrams, Maisy Stella, Oak Street, Sci Fi, Warner Bros",14,https://i.ytimg.com/vi/lgMgwGUc9_I/hqdefault.jpg,zh-Hant,en-US,False,90,PT1M30S,hd,False,False,False,False,386155,612,113
XMwjDBaNjgM,HK,2026-03-28T03:22:47.016424+00:00,2026-03-27T19:41:45Z,"BLAST Open Rotterdam 2026, Quarter-Finals - The MongolZ vs Aurora, Falcons vs PARIVISION","BLAST Open Rotterdam 2026, Quarter-Finals - The MongolZ vs Aurora, Falcons vs PARIVISION",BLAST Premier,UC9k--dE_UE0Faxzgb_DDkYQ,20,Gaming,"world, final, 2024, season, finale, navi, natus vincere, astralis, faze, clan, mouz, team, liquid, vitality, spirit, g2, esports, live, asia, singapore, arena, event, champions, best, livestream, cs2 gameplay, cs2, cs 2, csgo, blast pro series, gaming, competitive gaming, blast premier, blast, cs2 pros, cs2 players, esports pros, esports players, cs2 content, BLAST 2024, BLASTPremier, cs2 2024, counter strike, cs2 live, BLAST Bounty, Bounty, counter strike 2, hong kong, hk, BLAST Rivals",50,https://i.ytimg.com/vi/XMwjDBaNjgM/hqdefault.jpg,en,en,False,22553,PT6H15M53S,hd,False,True,False,False,1137884,11873,69
PpK_DX6GwgY,HK,2026-03-28T03:22:47.016438+00:00,2026-03-26T05:00:19Z,英皇娛樂 許靖韻 Angela Hui《連自己都不夠快樂》(People Pleaser) [Official MV],英皇娛樂 許靖韻 Angela Hui《連自己都不夠快樂》(People Pleaser) [Official MV],許靖韻「小背心」Angela Hui,UCOKRn5j373VgYavoToDT0IA,10,Music,,0,https://i.ytimg.com/vi/PpK_DX6GwgY/hqdefault.jpg,zh-Hant,zh-HK,False,247,PT4M7S,hd,True,True,False,False,39951,1046,61
ztO4Bk0ALGI,HK,2026-03-28T03:22:47.016446+00:00,2026-03-23T22:01:10Z,JUJUTSU KAISEN Sendai Colony | Official Trailer | Crunchyroll,JUJUTSU KAISEN Sendai Colony | Official Trailer | Crunchyroll,Crunchyroll,UC6pGDc4bFGD1_36IKv3FnYg,1,Film & Animation,"jujutsu kaisen, jujutsu kaisen anime, jjk, jjk anime, jujutsu kaisen season 3, jujutsu kaisen s3, jjk s3, jujutsu kaisen sendai colony, jjk sendai colony, crunchyroll, anime, anime pv, anime trailer, sendai colony, sendai colony trailer, sendai colony teaser, sendai colony trailer reaction, sendai colony jjk, sendai colony jjk trailer, sendai colony animation",20,https://i.ytimg.com/vi/ztO4Bk0ALGI/hqdefault.jpg,en,ja,False,56,PT56S,hd,True,True,False,False,2658659,95715,3315
hBpSNMgXB0o,HK,2026-03-28T03:22:47.016454+00:00,2026-03-26T12:01:11Z,Lady...Go!! Fans必玩作品竟是視覺小說🤔？King of Fighters KOF 拳皇系列秘密及趣聞｜舊Game新知｜Uwants遊戲講,Lady...Go!! Fans必玩作品竟是視覺小說🤔？King of Fighters KOF 拳皇系列秘密及趣聞｜舊Game新知｜Uwants遊戲講,Uwants 遊戲講 ,UC-eoXVXWKQ3T7UeUbSPHRvg,20,Gaming,"電玩, 遊戲, 玩具, 日本, acg, anime, 台灣, switch, ps5, 任天堂, 香港, 原創, 周邊, nintendo, 日語, 日本語, Esports, uwants, gaming, 粵語",20,https://i.ytimg.com/vi/hBpSNMgXB0o/hqdefault.jpg,zh-Hant,zh-Hant,False,1009,PT16M49S,hd,False,True,False,False,22953,663,102
1BKhGmPRfoQ,HK,2026-03-28T03:22:47.016462+00:00,2026-03-23T06:00:00Z,花邊細胞,花邊細胞,Ian 陳卓賢 - Topic,UCpe1W1Mkimgbl2NRLM1oCug,10,Music,"Ian 陳卓賢, 花邊細胞",2,https://i.ytimg.com/vi/1BKhGmPRfoQ/hqdefault.jpg,zh-Hant,und,False,183,PT3M3S,hd,False,True,False,False,35460,875,0
n5K5b8f58Dk,HK,2026-03-28T03:22:47.016469+00:00,2026-03-25T11:08:05Z,我來看《海洋奇緣》真人版預告片了。,我來看《海洋奇緣》真人版預告片了。,飽妮,UC3InDuUC4uq1SVLoKW0mcfw,22,People & Blogs,"飽妮, 迪士尼, 影評, 美劇, 迪士尼公主",5,https://i.ytimg.com/vi/n5K5b8f58Dk/hqdefault.jpg,zh-TW,zh-TW,False,421,PT7M1S,hd,True,True,False,False,45010,1284,126
Z9EDTXjPbZE,HK,2026-03-28T03:22:47.016477+00:00,2026-03-26T10:01:00Z,"【尊】我玩了那些你一定看過的廣告手遊,然後在裡面花了$10,000 ! ?【第二頻道】","【尊】我玩了那些你一定看過的廣告手遊,然後在裡面花了$10,000 ! ?【第二頻道】",人生魯宅x尊-第2頻道,UC-ujeda5rDgCe-910J5keTg,22,People & Blogs,,0,https://i.ytimg.com/vi/Z9EDTXjPbZE/hqdefault.jpg,zh-Hant,zh-TW,False,1015,PT16M55S,hd,False,True,False,False,172214,5427,375
