video_id,country,fetched_at,published_at,title,localized_title,channel_title,channel_id,category_id,category_name,tags,tag_count,thumbnail,default_language,audio_language,is_live,duration,duration_raw,definition,caption_available,licensed_content,embeddable,made_for_kids,views,likes,comments
b5GReCFQMQE,HK,2026-03-28T03:22:47.016484+00:00,2026-03-12T12:30:04Z,CANDY 王家晴《直白 Straightforward》Official Music Video,CANDY 王家晴《直白 Straightforward》Official Music Video,COLLAR,UCMIXW7ICDyTuCFcCHvBjfIQ,10,Music,,0,https://i.ytimg.com/vi/b5GReCFQMQE/hqdefault.jpg,zh-Hant,zh-HK,False,210,PT3M30S,hd,True,True,False,False,403207,9150,743
DGnH8MfyTf0,HK,2026-03-28T03:22:47.016490+00:00,2026-03-23T15:00:31Z,Apex Legends: Aftershock Event Trailer,Apex Legends: Aftershock Event Trailer,Apex Legends,UC0ZV6M2THA81QT9hrVWJG3A,20,Gaming,"apex legends aftershock event, apex legends season 28, apex legends season 28 split 2, apex legends vortex shield, apex legends elite hemlok, apex legends breach, apex legends wildcard, apex legends trailer, apex legends skins, battle royale, apex legends ps5, apex legends ps4, apex legends xbox, apex legends switch, apex legends pc, respawn entertainment, electronic arts",17,https://i.ytimg.com/vi/DGnH8MfyTf0/hqdefault.jpg,en,en,False,77,PT1M17S,hd,True,True,False,False,281562,6164,674
H77XfF4NMi8,HK,2026-03-28T03:22:47.016498+00:00,2026-03-26T10:29:19Z,告別紅軍，法老征戰沙特？假如所有“穆罕默德”球員組隊，實力有多強？,告別紅軍，法老征戰沙特？假如所有“穆罕默德”球員組隊，實力有多強？,Junior杰青,UCvLnfq4ASBhi28X1PNPo69A,20,Gaming,"FC26, 萨拉赫, 利物浦, 英超, 欧冠, 曼联, 阿森纳, 切尔西, 曼城, 热刺, 吉达联合, 沙特联赛, 亚冠, 亚冠联赛, C罗, 利雅得胜利, 生涯模式, 经理模式, Career Mode, 阿仙奴, 車路士, 伊蒂哈德, C朗, 艾納沙",24,https://i.ytimg.com/vi/H77XfF4NMi8/hqdefault.jpg,zh,yue-HK,False,883,PT14M43S,hd,False,True,False,False,18398,512,35
3N0X1VuXl2A,HK,2026-03-28T03:22:47.016505+00:00,2026-03-16T14:30:23Z,陳蕾 Panther Chan - 完整的我 The Complete Me (Official Music Video),陳蕾 Panther Chan - 完整的我 The Complete Me (Official Music Video),陳蕾Panther Chan,UCS8WprrGeExAwlAqDJB0LBw,10,Music,陳蕾,1,https://i.ytimg.com/vi/3N0X1VuXl2A/hqdefault.jpg,zh-Hant,zh-TW,False,218,PT3M38S,hd,False,True,False,False,77256,2369,89
bS_vRrzvxy0,HK,2026-03-28T03:22:47.016512+00:00,2026-03-20T13:01:13Z,HOMETOWN ROMANCE คุณแฟนบ้านนอก | Official Trailer [EN/CN SUB],HOMETOWN ROMANCE คุณแฟนบ้านนอก | Official Trailer [EN/CN SUB],CHANGE2561,UCISGtaTLXAEliMLp1VJZsSg,24,Entertainment,"ช่อง gmm ออนไลน์, เช้นจ์ 2561, change2561, gmm, change, พี่ฉอด, พี่ฉอด สายทิพย์, ฉอด change2561, ซีรีส์วาย, series y, pitbabe, ซีรีส์, ละคร, พิษเบ๊บ, LMSY, ลูกหมีซอนญ่า, HometownRomance, คุณแฟนบ้านนอก, GL, one31, oneD, ซีรีส์ใหม่, ไทบ้าน, หญิงรักหญิง, series yuri, ลูกหมี ปัญญาพัชร, ซอนญ่า ศรัณย์ภัทร์, Lmlookmhee, sonyasarann, บอย พิษณุ, กระแต ศุภักษร, ละครใหม่",32,https://i.ytimg.com/vi/bS_vRrzvxy0/hqdefault.jpg,th,th,False,248,PT4M8S,hd,True,True,False,False,503263,41948,2637
DnEQB1cWqeM,HK,2026-03-28T03:22:47.016520+00:00,2026-03-26T09:30:09Z,【Stanley】重製版龍女(希瓦娜)登場！超帥大絕進場恐懼爆噴一頓！三項之力卡CD戰力拉滿！技能組看起來沒有任何難度！三條路都被單殺到底怎麼贏！？有我胖胖龍在，就算四個隊友都在送也能救…..嗎？,【Stanley】重製版龍女(希瓦娜)登場！超帥大絕進場恐懼爆噴一頓！三項之力卡CD戰力拉滿！技能組看起來沒有任何難度！三條路都被單殺到底怎麼贏！？有我胖胖龍在，就算四個隊友都在送也能救…..嗎？,Stanley 史丹利,UCXOBLGJdYA1mfhOrDwQESTg,20,Gaming,"史丹利, Stanley, 史丹利上路, 英雄聯盟, lol, top, 上路, 韓服, S10, 世界冠軍, BD, S2, TPA, 新版, 重製, 希瓦娜, 龍女",17,https://i.ytimg.com/vi/DnEQB1cWqeM/hqdefault.jpg,zh-Hant,zh-TW,False,614,PT10M14S,hd,False,True,False,False,115910,1619,78
w6_sChrkvw8,HK,2026-03-28T03:22:47.016528+00:00,2026-03-27T11:00:07Z,SB19 X JOLIN 'Emoji' Music Video,SB19 X JOLIN 'Emoji' Music Video,SB19 Official,UCm4v7afBTnJKRm4SlfHJzyg,10,Music,"sb19, music, opm, ppop, justin, stell, josh, sejun, ken, showbt, filipino music, official sb19, sb19 official, sb19 pablo, sb19 ken, sb19 josh, sb19 justin, sb19 stell, sb19 youtube, sb19 channel, showbt philippines, sb19 videos, sb19 performances, sb19 songs, sb19 music videos, sb19 vlogs, sb19 bbmas, sb19 billboard music awards",28,https://i.ytimg.com/vi/w6_sChrkvw8/hqdefault.jpg,en,en,False,261,PT4M21S,hd,True,True,False,False,518185,61413,12535
hbfj2oEDmLY,HK,2026-03-28T03:22:47.016536+00:00,2026-03-26T07:20:34Z,提前重返魔法世界! 哈利波特影集首支預告曝 第1季8集貼近原著 哈利波特影集首支預告曝｜記者  劉玨妤｜國際焦點20260326｜三立新聞台,提前重返魔法世界! 哈利波特影集首支預告曝 第1季8集貼近原著 哈利波特影集首支預告曝｜記者  劉玨妤｜國際焦點20260326｜三立新聞台,消失的國界│從台灣看見世界的故事,UCaHvWPMrGgcd42waw4WYQ6w,25,News & Politics,"三立新聞, 國際, 大世界, 地緣政治, 瓦格納, 消失的國界, 消失, 粉紅, 台灣, 世界, 普丁, 國際特快車, 烏俄戰爭, 川普, 台積電, 台美關係, 蕭美琴, 兩岸, 習近平, 賴清德, 曹興誠, 黃仁勳, 輝達, 美國, 關稅, 對等關稅, 通貨膨脹, trump, donald trump, 國際經濟, 國際貿易, 升息, 中美貿易戰, 中東戰爭, 以色列, 伊朗, 火山, 地震",38,https://i.ytimg.com/vi/hbfj2oEDmLY/hqdefault.jpg,zh-TW,zh-TW,False,105,PT1M45S,hd,False,True,False,False,128927,555,246
