video_id,country,fetched_at,published_at,title,localized_title,channel_title,channel_id,category_id,category_name,tags,tag_count,thumbnail,default_language,audio_language,is_live,duration,duration_raw,definition,caption_available,licensed_content,embeddable,made_for_kids,views,likes,comments
RJLm5-QL61A,AE,2026-06-09T04:45:07.787119+00:00,2026-06-07T18:14:27Z,C Walk,C Walk,Karan Aujla - Topic,UCSmK5WX5U4gdtebWjoL81og,10,Music,"Karan Aujla, C Walk",2,https://i.ytimg.com/vi/RJLm5-QL61A/hqdefault.jpg,en,pa,False,177,PT2M57S,hd,False,True,False,False,1167035,65231,3075
KV3EYDxMrvA,AE,2026-06-09T04:45:07.787388+00:00,2026-06-08T12:30:18Z,SlumDog - 33 Temple Road Teaser (Telugu) | Puri Jagannadh | Vijay Sethupathi | Tabu | Samyuktha,SlumDog - 33 Temple Road Teaser (Telugu) | Puri Jagannadh | Vijay Sethupathi | Tabu | Samyuktha,Puri Jagannadh,UC8UDQn1V3-dxaRDu_XtRC4g,1,Film & Animation,"SlumDog - 33 Temple Road Teaser (Telugu), Puri Jagannadh, Vijay Sethupathi, Tabu, Samyuktha, SlumDog - 33 Temple Road Teaser, SlumDog - 33 Temple Road, Slum Dog Teaser, Slum Dog Teaser Telugu, Samyuktha Menon, Vijay Sethupathi New Movie, Puri Jagannadh New Movie, Puri Jagannadh Movies, Duniya Vijay, Tabu latest movies, Samyuktha New Movie, Vijay Sethupathi Puri Jagannadh, Vijay Sethupathi Telugu Movie, Puri Connects, Charmee Kaur, Latest Telugu teasers, Latest Telugu Movies",22,https://i.ytimg.com/vi/KV3EYDxMrvA/hqdefault.jpg,en,en,False,75,PT1M15S,hd,True,True,False,False,1115918,52275,2076
_BE6aVJgM98,AE,2026-06-09T04:45:07.787405+00:00,2026-06-08T15:00:07Z,FORMULA BRAWL RACE #1 #FormulaBrawl,FORMULA BRAWL RACE #1 #FormulaBrawl,Brawl Stars,UCooVYzDxdwTtGYAkcPmOgOw,20,Gaming,"brawl stars, mobile game, mobile strategy game, mobile rpg, mobile battle royale, battle royale, supercell game, marble, formula brawl, brawl race, brawl racing, bolt, 8-bit, max, spike",15,https://i.ytimg.com/vi/_BE6aVJgM98/hqdefault.jpg,en,en,False,179,PT2M59S,hd,False,True,False,False,5089110,126214,18489
L_VvwekYwp8,AE,2026-06-09T04:45:07.787415+00:00,2026-06-08T15:00:00Z,LE SSERAFIM (르세라핌) x ILLIT (아일릿) x KATSEYE (캣츠아이) 'ICONIC BY MISTAKE' Official MV Teaser,LE SSERAFIM (르세라핌) x ILLIT (아일릿) x KATSEYE (캣츠아이) 'ICONIC BY MISTAKE' Official MV Teaser,HYBE LABELS,UC3IZKseVpdzPSBaWxBxundA,10,Music,"HYBE, HYBE LABELS, 하이브, 하이브레이블즈",4,https://i.ytimg.com/vi/L_VvwekYwp8/hqdefault.jpg,ko,ko,False,27,PT27S,hd,False,True,False,False,1568059,167672,10711
3EGuYn0_VXc,AE,2026-06-09T04:45:07.787425+00:00,2026-06-08T11:30:29Z,Nooru Sami - Official Trailer | Vijay Antony | Swasika|Ajay Dhishan|Lijomol Jose| Balaji Sriram|Sasi,Nooru Sami - Official Trailer | Vijay Antony | Swasika|Ajay Dhishan|Lijomol Jose| Balaji Sriram|Sasi,Think Music India,UCLbdVvreihwZRL6kwuEUYsA,10,Music,"2026 tamil movies, Nooru saami, Vijay antony, balaji sriram, director sasi, kavya anil, nooru sami, sasi, swasika, swasika new movie, tamil moives 2026, tamil summer movies, vijay antony 2026, vijay antony new movie, vijay antony movie new, 2026 summer movies, sasi new movie, vanda devullu, noorusami, noorusaami, nooru sami trailer, nooru saami trailer, new tamil trailers, swasika new mivie, new kavya anil movie",25,https://i.ytimg.com/vi/3EGuYn0_VXc/hqdefault.jpg,en,ta,False,144,PT2M24S,hd,False,True,False,False,399943,15084,273
H0nDH8YOoK8,AE,2026-06-09T04:45:07.787434+00:00,2026-06-08T17:55:17Z,roblox best gameplay,roblox best gameplay,StanRP,UCHYA5HNaS5n4idxmP-at8nA,20,Gaming,"roblox, granny, free fire, live roblox, roblox shorts, shorts feed, 67, six seven, meme reset, singing brainrot song, great meme reset",11,https://i.ytimg.com/vi/H0nDH8YOoK8/hqdefault.jpg,en-US,en-US,False,10,PT10S,hd,False,True,False,False,334416,3442,0
FvpPdqQduIg,AE,2026-06-09T04:45:07.787443+00:00,2026-06-04T22:00:24Z,Air Supply - Making Love Out of Nothing at All (Lyrics) Letra en español,Air Supply - Making Love Out of Nothing at All (Lyrics) Letra en español,Cherry Lady,UCVgtvKu2_4FZQzTVn-DiIDw,22,People & Blogs,"making love out of nothing at all air supply en espanol, making love out of nothing at all letra en espanol, air supply making love out of nothing at all lyrics, making love out of nothing at all air supply letra, making love out of nothing at all air supply letra espanol, lyrics air supply making love out of nothing at all, air supply lyrics making love out of nothing at all, making love out of nothing at all air supply lyrics, air supply making love out of nothing at all espanol",9,https://i.ytimg.com/vi/FvpPdqQduIg/hqdefault.jpg,en,en,False,342,PT5M42S,hd,False,True,False,False,515294,746,6
Y36m3IHyMkQ,AE,2026-06-09T04:45:07.787452+00:00,2026-06-08T16:08:39Z,Spider-Man Trailer Leaks Again? Doomsday Trailer Scam? - RoastVerse 172,Spider-Man Trailer Leaks Again? Doomsday Trailer Scam? - RoastVerse 172,ComicVerse,UCKQ5Jj35sjTmJigRtlCPhVQ,24,Entertainment,"comicverse, comic verse, comicverse marvel",3,https://i.ytimg.com/vi/Y36m3IHyMkQ/hqdefault.jpg,en-GB,hi,False,942,PT15M42S,hd,False,True,False,False,219966,15993,517
Txj6B0TqQBA,AE,2026-06-09T04:45:07.787460+00:00,2026-06-08T11:30:04Z,مداهمة جزيرة المحلول 🔥!!!,مداهمة جزيرة المحلول 🔥!!!,SXB,UCqKHQ4M9Y2TEGT6iAn6Y_Vw,22,People & Blogs,"شونق, بونق, دعم, فورتنايت, دونيشن, تويتش, المشاهير, العرب, فلوس, اكبر, اكثر, اعلى, fortnite, سكواد, سولو, سكوادات, اساطير, اقوى, لاعب, نينجا, جوال, تسريب, تحديث, معرقين, بناء",25,https://i.ytimg.com/vi/Txj6B0TqQBA/hqdefault.jpg,ar,ar,False,5901,PT1H38M21S,hd,False,True,False,False,200428,21642,809
naoGk-Zjc1s,AE,2026-06-09T04:45:07.787469+00:00,2026-06-07T15:00:06Z,BABYMONSTER - 'SUGAR HONEY ICE TEA' M/V,BABYMONSTER - 'SUGAR HONEY ICE TEA' M/V,BABYMONSTER,UCqwUnggBBct-AY2lAdI88jQ,10,Music,"BABYMONSTER, 베이비몬스터, 베몬, BABYMON, BAEMON, 하람, 아현, 루카, 치키타, 파리타, 로라, 아사, HARAM, AHYEON, RUKA, CHIQUITA, PHARITA, RORA, ASA",19,https://i.ytimg.com/vi/naoGk-Zjc1s/hqdefault.jpg,en,ko,False,187,PT3M7S,hd,True,True,False,False,17384730,774894,72079
cjWTqndgZ_M,AE,2026-06-09T04:45:07.787478+00:00,2026-06-05T12:31:20Z,Balan - The Boy (Malayalam) - Official Trailer | Chidambaram | Sushin Shyam,Balan - The Boy (Malayalam) - Official Trailer | Chidambaram | Sushin Shyam,Zee Music South,UCLsSLka8jODBozvi5VTQeaQ,24,Entertainment,"Balan - The Boy Malayalam, Balan - The Boy Trailer, Balan - The Boy Malayalam Movie Trailer, Balan - The Boy Malayalam Movie, Balan - The Boy Songs, Balan - The Boy Movie Songs, Balan - The Boy Malayalam Movie 2026, Upcoming Malayalam Movie, Malayalam Movie Trailer, Malayalam Movie New, Zee Music South, Latest Malayalam Movie, Malayalam Songs, Malayalam Movie Songs",14,https://i.ytimg.com/vi/cjWTqndgZ_M/hqdefault.jpg,en,ml,False,150,PT2M30S,hd,True,True,False,False,3186754,32334,1594
rUN-t_tfPws,AE,2026-06-09T04:45:07.787486+00:00,2026-06-08T19:49:42Z,IEM Cologne Major 2026 - Day 7 - Stream A,IEM Cologne Major 2026 - Day 7 - Stream A,ESL Counter-Strike,UCPq2ETz4aAGo2Z-8JisDPIA,20,Gaming,"ESL, Counter-Strike, ESL CS, ESLCS, ESL CSGO, ESL Counter-Strike, IEM, IEM CS, IEM CSGO, CSGO, esportsisawesomesauce",11,https://i.ytimg.com/vi/rUN-t_tfPws/hqdefault.jpg,en,en,False,30392,PT8H26M32S,hd,False,True,False,False,1045089,7296,10
QFjteAz9Ylk,AE,2026-06-09T04:45:07.787495+00:00,2026-06-07T01:40:17Z,"#Video | 6 गोली मारव नथुनिया पS | #Khesari Lal Yadav, Srishti Bharti | 6 Goli Marab Nathuniya Pa","#Video | 6 गोली मारव नथुनिया पS | #Khesari Lal Yadav, Srishti Bharti | 6 Goli Marab Nathuniya Pa",GMJ - Global Music Junction - Bhojpuri,UCU_FozE_MPC8w4YncyShmJQ,10,Music,"Khesari Lal Yadav, khesari lal new song, khesari lal song, khesari lal new song 2026, khesari lal yadav bhojpuri song, khesari new song 2026, khesari lal naya gana, khesari lal gana, khesari lal bhojpuri song, srishti bharti, khesari lal srishti bharti, khesari ka gana, khesari naya gana, khesari lal yadav song, 6 Goli Marab Nathuniya Pa, 6 गोली मारव नथुनिया पS, srishti bharti new song, srishti bharti bhojpuri song, srishti bharti gana, bhojpuri song, gmj, global music, 2026",23,https://i.ytimg.com/vi/QFjteAz9Ylk/hqdefault.jpg,en,bh,False,209,PT3M29S,hd,False,True,False,False,2020988,113644,13497
rN9viJlnir4,AE,2026-06-09T04:45:07.787504+00:00,2026-06-08T19:13:48Z,Streamer University 2026 | Official Enrollment Trailer,Streamer University 2026 | Official Enrollment Trailer,Kai Cenat Live,UCvCfpQXRXdJdL07pzTIA6Cw,24,Entertainment,"Kai Cenat, Kai Cenat Live, Kai Cenat Livestream, Kai Live, Kai Cenat Funny",5,https://i.ytimg.com/vi/rN9viJlnir4/hqdefault.jpg,en,en-US,False,158,PT2M38S,hd,False,True,False,False,631609,65296,8384
5F5MKI_jXJw,AE,2026-06-09T04:45:07.787512+00:00,2026-06-06T16:00:01Z,I Survived 100 Days In Realistic Minecraft,I Survived 100 Days In Realistic Minecraft,MrBeast Gaming,UCIPPMRA040LQr5QPyJEbmXA,20,Gaming,,0,https://i.ytimg.com/vi/5F5MKI_jXJw/hqdefault.jpg,en,en,False,1609,PT26M49S,hd,True,True,False,False,28884015,625006,19883
s4nIxLvW1Zo,AE,2026-06-09T04:45:07.787519+00:00,2026-06-06T05:30:06Z,Jawani Iraqi | Full Video | Yo Yo Honey Singh | Rawme Hooda,Jawani Iraqi | Full Video | Yo Yo Honey Singh | Rawme Hooda,Yo Yo Honey Singh,UC1KonH1j8WMhc5cT6Bp7NtA,10,Music,"honey singh, yo yo honey singh, alfaaz, mafia mundeer records, punjabi, bollywood, rap, punjabi rap. hindi rap, most watched artist, latest songs, latest bollywood songs, latest punjabi songs, latest hindi songs, 2013, dope shope, angrezi beat, brown rang, satan, bring me back, bebo, Jawani Iraqi",21,https://i.ytimg.com/vi/s4nIxLvW1Zo/hqdefault.jpg,en,en,False,272,PT4M32S,hd,False,True,False,False,3943396,180560,49493
6QNUFgR2HLk,AE,2026-06-09T04:45:07.787527+00:00,2026-06-07T12:35:41Z,"Double Occupancy - Official Trailer | Santhosh, Reshma, Samyuktha, Vinoth | Aswin Kandasamy","Double Occupancy - Official Trailer | Santhosh, Reshma, Samyuktha, Vinoth | Aswin Kandasamy",Saregama Tamil,UCzee67JnEcuvjErRyWP3GpQ,1,Film & Animation,"Double Occupancy, Double Occupancy trailer, Double Occupancy official trailer, Double Occupancy movie, Santhosh, Reshma Venkatesh, Samyuktha Viswanathan, Vinoth Kishan, VTV Ganesh, Aswin Kandasamy, ACS Arun Kumar, Khushbu Sundar, Anandita Sundar, Sam CS, Avni Movies, Benzz Media, Tamil movie trailer, new Tamil movie, upcoming Tamil movie, Tamil romantic comedy",20,https://i.ytimg.com/vi/6QNUFgR2HLk/hqdefault.jpg,en,ta,False,137,PT2M17S,hd,False,True,False,False,949869,11796,442
4v_jk0w7wR0,AE,2026-06-09T04:45:07.787540+00:00,2026-06-06T23:10:50Z,1000 Players Simulate THE PURGE in Minecraft,1000 Players Simulate THE PURGE in Minecraft,Wemmbu,UCkzzNLnuM-VsATWC53ehwOQ,20,Gaming,"wemmbu, wembu, wenbu, wemmbu unstable smp, eggchan, unstable smp, unstable universe, parrotx2, minecraft, unstable smp in order, minecraft smp, unstable smp in order wemmbu, unstable smp latest video, unstable smp new video, wemmbu assassin, wemmbu invis player, unstable blue invis player, eggchan missing, flamefrags, egchan, 100 days, wemmbu eggchan, minecraft purge, purge, minecraft simulation",25,https://i.ytimg.com/vi/4v_jk0w7wR0/hqdefault.jpg,en-US,en-US,False,7061,PT1H57M41S,hd,False,True,False,False,4314140,208792,24931
7Hf-AN5Y8JM,AE,2026-06-09T04:45:07.787548+00:00,2026-06-01T15:28:24Z,Majboor Mashup | 9:45 | Zoha Waseem | Karan Aujla |  Afterhours | Khayaal | Talwiinder | Onikmusic,Majboor Mashup | 9:45 | Zoha Waseem | Karan Aujla |  Afterhours | Khayaal | Talwiinder | Onikmusic,Onikmusic,UCAsDrPKdV3g_F6y_SfDLA0Q,10,Music,"Majboor, Majboor song, Majboor song mashup, 9.45 song, prabh 9 45, khayaal talwiinder, admiring you karan aujla, majboor song slowed reverb, High on you song, tere jeha talwinder, tere jeha hor disda, after hours, Romantic Mashup, Lofi mashup, Onikmusic, aap ka ye kehna banta song, aankhon aankhon ka matlab song, Sheheryar rehan, Zoha waseem song, zoha waseem new song, Majboor song 2026, Majboor cinematic, Karan aujla new song, sad mashup, love mashup, Punjabi new song",26,https://i.ytimg.com/vi/7Hf-AN5Y8JM/hqdefault.jpg,en,en-IN,False,216,PT3M36S,hd,False,True,False,False,224295,898,4
sVCrTJdNtSs,AE,2026-06-09T04:45:07.787556+00:00,2026-06-08T16:00:16Z,The Dog Stars | Official Trailer | In Theaters Aug 28,The Dog Stars | Official Trailer | In Theaters Aug 28,20th Century Studios,UC2-BeLxzUBSs0uSrmzWhJuQ,1,Film & Animation,Trailer,1,https://i.ytimg.com/vi/sVCrTJdNtSs/hqdefault.jpg,en,en,False,146,PT2M26S,hd,True,True,False,False,982409,11555,641
hrBqCC12MlM,AE,2026-06-09T04:45:07.787563+00:00,2026-06-07T18:40:28Z,"Roblox Would You Rather, But Its SATISFYING..","Roblox Would You Rather, But Its SATISFYING..",Foltyn,UCRkuUgtDAL4XSU5jB40J_wA,20,Gaming,"foltyn, foltyn roblox, roblox, roblox foltyn, foltyn family, funny, no swearing, foltyn family roblox, roblox foltyn family, blade ball, roblox blade ball, foltyn blade ball, would you rather but its satisfying, roblox would you rather but it actually happens, foltyn roblox would you rather, foltyn would you rather but it actually happens, foltyn and caylus, foltyn and caylus playing roblox, foltyn and caylus playing together, foltyn the most satisfying roblox game..",20,https://i.ytimg.com/vi/hrBqCC12MlM/hqdefault.jpg,en,en-US,False,693,PT11M33S,hd,False,True,False,False,1036598,23445,4739
yM5APO87aNU,AE,2026-06-09T04:45:07.787571+00:00,2026-06-05T05:00:06Z,Jackpot (Official Video) Cheema Y | Gur Sidhu,Jackpot (Official Video) Cheema Y | Gur Sidhu,Brown Town Music,UColNRmGBE3dNzJ89zZZOh2Q,10,Music,"Jackpot, Cheema y, Jackpot cheema y, Jackpot cheema y official video, Gur sidhu, Gur sidhu new song, Punjabi, Punjabi song, New punjabi song, Latest punjabi song",10,https://i.ytimg.com/vi/yM5APO87aNU/hqdefault.jpg,en,pa,False,193,PT3M13S,hd,False,True,False,False,5810305,102263,3106
Lnln-SoL77E,AE,2026-06-09T04:45:07.787582+00:00,2026-06-08T12:07:58Z,eകിഴി | Khalifa Song Kajal Agarwal Prithviraj Mohanlal | Yash Toxic Teaser | Entertainment Kizhi,eകിഴി | Khalifa Song Kajal Agarwal Prithviraj Mohanlal | Yash Toxic Teaser | Entertainment Kizhi,Entertainment Kizhi,UCEBP12AdzxO2_UxFNKCe3ig,22,People & Blogs,,0,https://i.ytimg.com/vi/Lnln-SoL77E/hqdefault.jpg,en,ml,False,804,PT13M24S,hd,False,True,False,False,18953,930,177
UuxHb-KmfqA,AE,2026-06-09T04:45:07.787592+00:00,2026-06-07T13:11:01Z,Я Тайно Слежу за СВОЕЙ ДЕВУШКОЙ и Вот что я узнал...,Я Тайно Слежу за СВОЕЙ ДЕВУШКОЙ и Вот что я узнал...,Domer Grief,UCb5oqCZ4AfmfXbgHsfei0tQ,20,Gaming,"Майнкрафт, Minecraft, Domer, девушка домера, домер, девочка Minecraft, Domer Grief, домер гриф, троллинг в майнкрафте, Майн, майнкрафт сервер, в Майнкрафт, троллинг, троллинг в Майнкрафт, домер девушка, домер с девушкой, сервер для девочек, сервер для девушек, личный сервер девушки, домер следу за девушкой, проследил за девушкой, проверка на верность, приватный сервер, личный сервер, домер Лена, проверка девушки на верность, Я Тайно Слежу за СВОЕЙ ДЕВУШКОЙ и Вот что я узнал...",27,https://i.ytimg.com/vi/UuxHb-KmfqA/hqdefault.jpg,ru,ru,False,1332,PT22M12S,hd,False,True,False,False,999931,58289,6596
pStG0lAYRys,AE,2026-06-09T04:45:07.787601+00:00,2026-06-06T13:00:06Z,Waka Waka - Esto es Africa (sub. español + lyrics) Canción Oficial de la Copa Mundial Sudáfrica 2010,Waka Waka - Esto es Africa (sub. español + lyrics) Canción Oficial de la Copa Mundial Sudáfrica 2010,Sabor a Manzana,UCGL2K4JZRKfnU91z40NsasQ,22,People & Blogs,,0,https://i.ytimg.com/vi/pStG0lAYRys/hqdefault.jpg,es,en,False,200,PT3M20S,hd,False,True,False,False,595589,2741,32
VyZKYhM0Kv4,AE,2026-06-09T04:45:07.787608+00:00,2026-06-07T17:43:02Z,MINECRAFT DUNGEONS II | Reveal Trailer,MINECRAFT DUNGEONS II | Reveal Trailer,Minecraft,UC1sELGmy5jp5fQUugmuYlXQ,20,Gaming,Minecraft,1,https://i.ytimg.com/vi/VyZKYhM0Kv4/hqdefault.jpg,en,en,False,109,PT1M49S,hd,False,False,False,False,651036,46946,3311
WBAbdvNo5hY,AE,2026-06-09T04:45:07.787618+00:00,2026-06-08T20:26:40Z,VALORANT Masters London — Swiss Stage — Day 3,VALORANT Masters London — Swiss Stage — Day 3,VALORANT Champions Tour,UCA1d3HFGFUmkKr2JIUA5Vlw,20,Gaming,"valorant, vct, valorant champions tour, valorant vod, valorant gameplay, valorant montage, valorant highlights, valorant esports, valorant esports highlights, valorant pro gameplay, yt:cc=on",11,https://i.ytimg.com/vi/WBAbdvNo5hY/hqdefault.jpg,en,en,False,24476,PT6H47M56S,hd,False,True,False,False,621615,7865,8
1a6Y8t_fzXQ,AE,2026-06-09T04:45:07.787626+00:00,2026-06-08T14:48:06Z,DIDEE DIDEE - Pastor Befikadu Bekele - New Afaan Oromoo Gospel Song 2026,DIDEE DIDEE - Pastor Befikadu Bekele - New Afaan Oromoo Gospel Song 2026,Befikadu Bekele Official,UCXHlc1TsN94KqvjJdmUAkkw,10,Music,,0,https://i.ytimg.com/vi/1a6Y8t_fzXQ/hqdefault.jpg,en,zxx,False,315,PT5M15S,hd,False,True,False,False,14809,2095,240
8LWpeBX6ZwY,AE,2026-06-09T04:45:07.787634+00:00,2026-06-07T17:13:48Z,Gears of War: E-Day - Official Gameplay Trailer | Xbox Games  Showcase 2026,Gears of War: E-Day - Official Gameplay Trailer | Xbox Games  Showcase 2026,IGN,UCKy1dAqELo0zrOtPkf0eTMw,20,Gaming,"Gears of War: E-Day, Gears of War: E-Day Xbox, xbox showcase, xbox trailers, xbox trailer, new xbox games, upcoming xbox games, xbox series x, xbox series s, game trailer, game trailers, trailer, trailers, gaming, video games, video game trailer, video game trailers, new game trailers, new video game trailers, upcoming video games, new video games 2026, upcoming video games 2026, summer of gaming, summerofgaming, ign summer of gaming 2026, ign summer of gaming, sog 2026, sog",28,https://i.ytimg.com/vi/8LWpeBX6ZwY/hqdefault.jpg,en-US,en-US,False,434,PT7M14S,hd,False,True,False,False,849613,33505,3437
86_LoSLsqM8,AE,2026-06-09T04:45:07.787643+00:00,2026-06-07T14:49:54Z,watchparty 2026 PMGO S1 Main Event | Grand Finals | last day,watchparty 2026 PMGO S1 Main Event | Grand Finals | last day,Cr7 HORAA,UC27pyUnJTUyxe_z_0WxxNXw,20,Gaming,,0,https://i.ytimg.com/vi/86_LoSLsqM8/hqdefault.jpg,en-US,en-US,False,16475,PT4H34M35S,hd,False,True,False,False,744646,25779,61
04x3RshrpG8,AE,2026-06-09T04:45:07.787650+00:00,2026-05-14T21:01:41Z,ЭКСПОНАТ,ЭКСПОНАТ,MIA BOYKA - Topic,UCpPjM4LS7K-JYoDPvwWqpUg,10,Music,"MIA BOYKA, Соловьев Иван Григорьевич, ЭКСПОНАТ",3,https://i.ytimg.com/vi/04x3RshrpG8/hqdefault.jpg,ru,en,False,99,PT1M39S,hd,False,True,False,False,6425046,81420,1243
S4msqGQxSAg,AE,2026-06-09T04:45:07.787659+00:00,2026-06-06T00:00:35Z,Resident Evil Veronica - Announcement Trailer | PS5 Games,Resident Evil Veronica - Announcement Trailer | PS5 Games,PlayStation,UC-2Y8dQb0S6DtpxNgAKoJKA,20,Gaming,"PlayStation, PS5, video games, next gen, Sony, Capcom, Gaming, ResidentEvil, REVeronica, ResidentEvilVeronica",10,https://i.ytimg.com/vi/S4msqGQxSAg/hqdefault.jpg,en,en-US,False,243,PT4M3S,hd,False,True,False,False,4190759,239962,10171
ooL9-c91aCI,AE,2026-06-09T04:45:07.787667+00:00,2026-06-07T15:24:14Z,[URDU] 2026 PMGO S1 Main Event | Grand Finals | Day 2 | PUBG MOBILE GLOBAL OPEN Season 1,[URDU] 2026 PMGO S1 Main Event | Grand Finals | Day 2 | PUBG MOBILE GLOBAL OPEN Season 1,PUBG MOBILE Esports Pakistan,UCTal2V5RbkPNUWUa2E6RPEA,20,Gaming,,0,https://i.ytimg.com/vi/ooL9-c91aCI/hqdefault.jpg,en,en,False,18597,PT5H9M57S,hd,False,False,False,False,694162,25788,277
kUnGlb9oPwQ,AE,2026-06-09T04:45:07.787677+00:00,2026-06-04T15:42:23Z,القمر ديالي,القمر ديالي,Release - Topic,UCzil2G_aEEWarjtGPDZqhIA,10,Music,"محمد شاكر و سعد لمجرد, القمر ديالي",2,https://i.ytimg.com/vi/kUnGlb9oPwQ/hqdefault.jpg,ar,,False,271,PT4M31S,hd,False,True,False,False,180251,1801,0
Rsztt5qDj_A,AE,2026-06-09T04:45:07.787685+00:00,2026-06-04T15:00:06Z,"FALL 2: DEADPOINT (2026) Official Trailer - Harriet Slater, Arsema Thomas","FALL 2: DEADPOINT (2026) Official Trailer - Harriet Slater, Arsema Thomas",Lionsgate Movies,UCJ6nMHaJPZvsJ-HmUmj1SeA,1,Film & Animation,"Fall 2 Deadpoint, Fall 2, Deadpoint, Harriet Slater, Arsema Thomas, Tom Brittney, Virginia Gardner, Grace Caroline Currey, The Spierig Brothers, survival thriller, mountain climbing movie, rock climbing movie, height thriller, survival movie, cliffhanger movie, rockslide scene, adventure thriller, suspense movie, 2026 movie, fall 2 trailer, mount kwan, high altitude survival, dangerous climb, extreme heights, survival drama, action thriller, new thriller movie",27,https://i.ytimg.com/vi/Rsztt5qDj_A/hqdefault.jpg,en,en,False,80,PT1M20S,hd,False,True,False,False,3781607,38087,2583
HHQT3biqQLU,AE,2026-06-09T04:45:07.787694+00:00,2026-06-08T15:00:13Z,Cash LOSES HIS MIND in Minecraft..,Cash LOSES HIS MIND in Minecraft..,Cash,UC0eLBYhxW9HC0P9PXQ73mpQ,24,Entertainment,"Cash, Nico, Nico and Cash, Cash and Nico, Minecraft, Minecraft mod, family friendly, kid friendly",8,https://i.ytimg.com/vi/HHQT3biqQLU/hqdefault.jpg,en,en-US,False,849,PT14M9S,hd,False,True,False,False,334619,5311,1124
6hV1jnQssj0,AE,2026-06-09T04:45:07.787701+00:00,2026-05-28T19:33:52Z,"Asim Azhar, Noor, Khan & Madhurxo - Aarzu (with Asim Azhar) | Official Audio","Asim Azhar, Noor, Khan & Madhurxo - Aarzu (with Asim Azhar) | Official Audio",Noor,UC13CTJKPjHV1UshT9_nlgog,22,People & Blogs,"Aarzu, Khan, Noor, Madhura, Pal Pal, Obvious, Maand, Regardless, Asim Azhar, Hania Amir, Hasan Raheem, Talwiinder, Trending Songs 2026, Tera Sharmana",14,https://i.ytimg.com/vi/6hV1jnQssj0/hqdefault.jpg,en,hi,False,186,PT3M6S,hd,False,False,False,False,868145,18324,337
XXxUqLHq1xg,AE,2026-06-09T04:45:07.787709+00:00,2026-06-02T08:05:33Z,"Cocktail 2 Official Trailer | Shahid Kapoor, Kriti Sanon, Rashmika Mandanna | In Cinemas 19th June","Cocktail 2 Official Trailer | Shahid Kapoor, Kriti Sanon, Rashmika Mandanna | In Cinemas 19th June",Maddock Films,UC-LOdiPoxninevJ0DkleCLg,24,Entertainment,"new songs, best new movies, gaane, gane, cocktail 2, cocktail 2 trailer, cocktail, kriti, kriti sanon, shahid, shahid kapoor, rashmika, rashmika mandanna, tum hi ho bandhu, new movies, new movie trailer, summer vibes, love, relationship, chaos, friendship",21,https://i.ytimg.com/vi/XXxUqLHq1xg/hqdefault.jpg,en,en-IN,False,182,PT3M2S,hd,True,False,False,False,31196570,183053,29810
E061MfsElI0,AE,2026-06-09T04:45:07.787716+00:00,2026-06-08T13:00:38Z,هربت من عالم الكيبورد 😱 العالم 2,هربت من عالم الكيبورد 😱 العالم 2,El Husamo X,UCOMwpjGPUrGGUS2Diq6UmVw,20,Gaming,"gaming, viral, trending, horror, جيمنج, ترند, roblox, روبلوكس, ماين, ماينكرافت, ماين كرافت, كرافت, minecraft, mine craft, gta, gtav, el husamo, ال حسامو, حسامو, husamo, الحسامو, elhusamo, peekaa, peeka, naruto, hope rima, rima, abo flah, flah, abo, ابو فله, فله, فلة, رعب, صعب, تنرفز, مستفز, trend, dubai, uae, دبي, كرة, قدم, انيمي, anime, simulator, محاكي, foryou",48,https://i.ytimg.com/vi/E061MfsElI0/hqdefault.jpg,ar,ar,False,1048,PT17M28S,hd,False,True,False,False,435258,10053,1256
oH3SeJMpE3s,AE,2026-06-09T04:45:07.787725+00:00,2026-06-04T15:00:06Z,Mohamed Chaker & Saad Lamjarred - El Qamar Dyali | 2026 محمد شاكر و سعد لمجرد - القمر ديالي,Mohamed Chaker & Saad Lamjarred - El Qamar Dyali | 2026 محمد شاكر و سعد لمجرد - القمر ديالي,Mohamed Chaker,UC7hVUKl6jCjm5VnBtiTNh8g,10,Music,"El Qamar Dyali, Mohamed Chaker, arabic, fadel chaker, fadel shaker son, mohamad shaker, music, new, ya 7ayati, ya hayati, اغاني 2026, اغاني جديدة, اغاني جديدة 22026, اغاني سعد المجرد, اغاني محمد شاكر, القمر ديالي, جديد سعد لمجرد, جديد محمد شاكر, دويتو, سعد المجرد و محمد شاكر, سعد لمجرد, سعد لمجرد القمر ديالي, فضل شاكر, محمد شاكر, محمد شاكر القمر, محمد شاكر و سعد المجرد, مسعد لمجرد و محمد شاكر, يا حياتي",28,https://i.ytimg.com/vi/oH3SeJMpE3s/hqdefault.jpg,ar,en-US,False,332,PT5M32S,hd,False,True,False,False,3263789,80517,8501
cc8FDOConV0,AE,2026-06-09T04:45:07.787734+00:00,2026-06-02T11:36:13Z,"Gatta Kusthi 2 - Teaser | Vishnu Vishal, Aishwarya Lekshmi | Chella Ayyavu | Sean Roldan | Vels","Gatta Kusthi 2 - Teaser | Vishnu Vishal, Aishwarya Lekshmi | Chella Ayyavu | Sean Roldan | Vels",Sony Music South,UCn4rEMqKtwBQ6-oEwbd4PcA,10,Music,"Sony Music South, Sony Music, Latest Song, Tamil song, Tamil Latest Song, Latest songs in Tamil4, Songs in Tamil, Latest Tamil Movies, Tamil Movie Songs, Latest Video Songs Tamil, latest Tamil Love Songs, Latest Tamil Hit Songs, Songs in Telugu4, Telugu Movie Songs, Video Songs Telugu, new Telugu Songs",16,https://i.ytimg.com/vi/cc8FDOConV0/hqdefault.jpg,en-GB,ta,False,93,PT1M33S,hd,True,True,False,False,5257182,122354,842
