video_id,country,fetched_at,published_at,title,localized_title,channel_title,channel_id,category_id,category_name,tags,tag_count,thumbnail,default_language,audio_language,is_live,duration,duration_raw,definition,caption_available,licensed_content,embeddable,made_for_kids,views,likes,comments
pwJRJ40bzBA,AE,2026-06-09T04:45:07.787742+00:00,2026-06-08T14:48:15Z,How I Became the KING of this Trillionaire Villager City in Minecraft!,How I Became the KING of this Trillionaire Villager City in Minecraft!,ProBoiz 95,UCSncGB_s0tuWN-4l-58mmvQ,20,Gaming,"minecraft, minecraft trillionaire city, trillionaire city in minecraft, minecraft millionaire city, minecraft villager city, minecraft millionaire, minecraft trillionaire, proboiz, proboiz 95",9,https://i.ytimg.com/vi/pwJRJ40bzBA/hqdefault.jpg,en,en-IN,False,2218,PT36M58S,hd,False,True,False,False,978173,36355,4824
Up8oXqW4XfY,AE,2026-06-09T04:45:07.787750+00:00,2026-06-05T14:00:06Z,"Dai Dai Iko | Shakira, Burna Boy | FIFA World Cup 2026","Dai Dai Iko | Shakira, Burna Boy | FIFA World Cup 2026",Davuiside,UC09TqdjM4ld0BxL4zZArabA,10,Music,"Davuiside, Gangster City, Car Music, G House, Night Music, Deep House, Music 2024, Bass Boosted, Bass Music, Slap House, Phonk, Brazilian Phonk, Girls, Models Car, Tik Tok Music, Tik Tok Songs, Tik Tok Trends, Vava Media, Vava Music, Gangster Music, Gangster Deep, Krush Funk, Afro House, Tik Tok, Tik Tok Video, Video Viral, Video Edits, Edits, Viral, Tik Tok Viral, Tik Tok Edits, Shakira, Burna Boy, FIFA World Cup 2026, World Cup 2026, Dai Dai Iko, Dai Dai Iko | Shakira",37,https://i.ytimg.com/vi/Up8oXqW4XfY/hqdefault.jpg,en,en,False,152,PT2M32S,hd,False,False,False,False,1699055,13663,703
Zki0Y_auEcA,AE,2026-06-09T04:45:07.787757+00:00,2026-06-02T13:05:01Z,Drishyam 3 - Success Trailer | Mohanlal | Jeethu Joseph | Meena | Running Successfully,Drishyam 3 - Success Trailer | Mohanlal | Jeethu Joseph | Meena | Running Successfully,Aashirvad Cinemas,UC_J44kyEsEB8LPlhfm2Xb4g,1,Film & Animation,"Drishyam 3, Drishyam 3 Movie, Drishyam 3 Malayalam, Drishyam 3 trailer, drishyam 3 official trailer, drishyam 3 Malayalam trailer, drishyam 3 mohanlal, drishyam 3 official trailer malayalam, drishyam, drishyam movie, mohanlal drishyam, Jeethu Joseph, drishyam movie malayalam trailer, mohanlal drishyam trailer, drishyam 3 hindi, drishyam 3 trailer, drishyam 3 trailer malayalam, murali gopy, Meena, drishyam 3 movie malayalam, drishyam 3 movie, Drishyam 3 movie latest",22,https://i.ytimg.com/vi/Zki0Y_auEcA/hqdefault.jpg,en,ml,False,73,PT1M13S,hd,True,True,False,False,245039,5253,425
glSOD4FGGJM,AE,2026-06-09T04:45:07.787765+00:00,2026-06-07T16:49:15Z,4T INSHALLAH CHAMPIONS PMGO 2026,4T INSHALLAH CHAMPIONS PMGO 2026,Star Anonymous LIVE,UC9WZd2eezGw0oXClutuq0eA,20,Gaming,"Challenge Videos, 24 Hour Challenge, LIVE, LIVE STREAM, PIBG, PUBG MOBILE, BGMI, PUBG, STAR ANONYMOUS live, ANONYMOUS LIVE, 4T INSHALLAH CHAMPIONS PMGO 2026",11,https://i.ytimg.com/vi/glSOD4FGGJM/hqdefault.jpg,en,hi,False,24926,PT6H55M26S,hd,False,False,False,False,611315,40200,131
T65zvwFnhlo,AE,2026-06-09T04:45:07.787773+00:00,2026-06-01T05:10:03Z,Mere Mehboob Qayamat Hogi,Mere Mehboob Qayamat Hogi,Aapan Records - Topic,UC3olKyWMKL5ojJRj2Sp2aZg,10,Music,"Aapan Records, Sushant Prasad, Mere Mehboob Qayamat Hogi",3,https://i.ytimg.com/vi/T65zvwFnhlo/hqdefault.jpg,en,,False,359,PT5M59S,hd,False,True,False,False,1351094,2625,22
5xhDawcDVkE,AE,2026-06-09T04:45:07.787781+00:00,2026-06-02T12:12:06Z,Bharat Bhhagya Viddhaata | The Unseen Heroes | Trailer | Kangana Ranaut | In Cinemas 12th June,Bharat Bhhagya Viddhaata | The Unseen Heroes | Trailer | Kangana Ranaut | In Cinemas 12th June,Pen Movies,UC3ar28GS6o1p0m_wabfk2zw,1,Film & Animation,"Bharat Bhhagya Viddhaata, Bharat Bhagya Vidhata, Kangana Ranaut, Kangana Ranaut New Movie, Bharat Bhhagya Viddhaata Promotion, Bharat Bhhagya Viddhaata Movie 2026, Bharat Bhhagya Viddhaata Official, 26/11 Mumbai Attacks, Cama Hospital, Cama and Albless Hospital, Based On True Events, Patriotic Movie, Inspirational Story, Indian Cinema, Pen Studios, Floating Rocks Entertainment, Bharat Bhhagya Viddhaata trailer, Bharat Bhhagya Viddhaata teaser, Bharat Bhhagya Viddhaata Kangana",19,https://i.ytimg.com/vi/5xhDawcDVkE/hqdefault.jpg,en,hi,False,145,PT2M25S,hd,False,True,False,False,14896155,61833,5486
azZSaq4KqCM,AE,2026-06-09T04:45:07.787789+00:00,2026-06-07T14:59:36Z,2026 PMGO GRAND FINALS DAY 2 - WATCHPARTY WITH SNAX,2026 PMGO GRAND FINALS DAY 2 - WATCHPARTY WITH SNAX,Snax Gaming,UCQfBN7Ut5TiZJAhMo_Rgfyw,20,Gaming,"pubg, pubgmobile, gaming",3,https://i.ytimg.com/vi/azZSaq4KqCM/hqdefault.jpg,en,hi,False,16876,PT4H41M16S,hd,False,True,False,False,1271875,65022,357
NbsMrZ-6I5w,AE,2026-06-09T04:45:07.787797+00:00,2026-06-08T05:30:15Z,SADI SUN (Teaser) - Elvish Yadav & Simrat Kaur Randhawa | Harsh Nussi | Anshul Garg,SADI SUN (Teaser) - Elvish Yadav & Simrat Kaur Randhawa | Harsh Nussi | Anshul Garg,Play DMF,UCSM54qcBP60U61HOMm_SUqA,10,Music,"Desi Music Factory, bollywood, New Songs, Viral Song, Trending, official video, most watched, New Hindi Song, Trending new song, hardikpandya, teaser 2024, latest hindi song, jubin new song, love song, new love song, latest love song trending, hit love song, love, new song, romantic, new song 2026, sadi sun, harsh nussi, elvish, elvish yadav, elvish army, simrat kaur, teaser, trailer, new teaser, new trending song, punjabi song, new punjabi song",33,https://i.ytimg.com/vi/NbsMrZ-6I5w/hqdefault.jpg,en,en,False,37,PT37S,hd,False,True,False,False,670088,47512,3596
tsTOXpHXNxw,AE,2026-06-09T04:45:07.787804+00:00,2026-06-03T05:54:59Z,Cocktail 2 Trailer Review | Yogi Bolta Hai,Cocktail 2 Trailer Review | Yogi Bolta Hai,YOGI BOLTA HAI,UCIihexFQucy1Sm7V7yvL_mA,24,Entertainment,"Cocktail 2, Cocktail 2 Movie, Cocktail 2 Trailer Review, Cocktail 2 Trailer, Shahid Kapoor, Kriti Sanon, Rashmika Mandanna, Luv Ranjan, Dinesh Vijan, Homi Adajania, Maddock Films, Romcom, Romatic Comedy, New movie, Bollywood, Upcoming Movie, New, Movie, Review, Movie Review, Yogi Bolta Hai",21,https://i.ytimg.com/vi/tsTOXpHXNxw/hqdefault.jpg,en,zxx,False,216,PT3M36S,hd,False,True,False,False,308154,10819,364
