video_id,country,fetched_at,published_at,title,localized_title,channel_title,channel_id,category_id,category_name,tags,tag_count,thumbnail,default_language,audio_language,is_live,duration,duration_raw,definition,caption_available,licensed_content,embeddable,made_for_kids,views,likes,comments
VHiYT20aT1A,LY,2026-06-06T04:36:50.877292+00:00,2026-06-05T00:29:40Z,تفتيح عجلة هونر الذهبية بقيمة 100 الف شدة  #ببجي_موبايل #ببجي #pubgmobile,تفتيح عجلة هونر الذهبية بقيمة 100 الف شدة  #ببجي_موبايل #ببجي #pubgmobile,أترو/Atro,UCjf3ZSi7xMu8O9frZZ8FEGg,20,Gaming,"ببجي, بوبجي, ببجي موبايل, pubg mobile, افضل لاعب في ببجي موبايل, فتح صناديق ببجي, كمين, فتح صناديق, بابجي, اترو, محترف, تحديث, رومات, بث ببجي, ببجي سعودية, ببجي عراق, ببجي عربي, ببجي سوري, ببجي جزائري",19,https://i.ytimg.com/vi/VHiYT20aT1A/hqdefault.jpg,ar,ar,False,1087,PT18M7S,hd,False,True,False,False,266094,27508,10455
Zv6JKobJyFY,LY,2026-06-06T04:36:50.877299+00:00,2026-06-04T15:00:01Z,BTS (방탄소년단) 'Hooligan' Official Performance Video,BTS (방탄소년단) 'Hooligan' Official Performance Video,HYBE LABELS,UC3IZKseVpdzPSBaWxBxundA,10,Music,"HYBE, HYBE LABELS, 하이브, 하이브레이블즈",4,https://i.ytimg.com/vi/Zv6JKobJyFY/hqdefault.jpg,ko,ko,False,196,PT3M16S,hd,True,True,False,False,3309377,613722,24440
J-ozr9KoVqE,LY,2026-06-06T04:36:50.877307+00:00,2026-06-05T10:00:26Z,مواجهة ابوفاس ( يدافع عن النووي ) 😨,مواجهة ابوفاس ( يدافع عن النووي ) 😨,ابوسويحل abuswe7l ,UCj4xJcfVWLt_CGhHUAh2y5g,22,People & Blogs,"أبوسويحل, أبو سويحل, بث أبوسويحل, بث شونق, ميستري تاون, ABU SWE7L, ABUSWE7L, AS7",8,https://i.ytimg.com/vi/J-ozr9KoVqE/hqdefault.jpg,ar,ar,False,4146,PT1H9M6S,hd,False,True,False,False,123469,10885,410
y76EPRkZsKs,LY,2026-06-06T04:36:50.877315+00:00,2026-05-30T17:00:06Z,"KA7LA, Norfafrica - AI","KA7LA, Norfafrica - AI",KA7LA,UCpUaViFncPHBgOBQ3OsUYfw,10,Music,,0,https://i.ytimg.com/vi/y76EPRkZsKs/hqdefault.jpg,en,ar,False,161,PT2M41S,hd,False,True,False,False,271882,8024,646
esFmFSmZKCE,LY,2026-06-06T04:36:50.877321+00:00,2026-06-05T16:00:30Z,تحديث كاس العالم في فري فاير !!,تحديث كاس العالم في فري فاير !!,SA7RAWI Gaming,UC2qdrMpLKn3GgeCwN65SX_Q,20,Gaming,"الصحراوي, صحراوي فري فاير, sa7rawi, فري فاير, صحراوي, فري فاير الجزائر, تهكير فري فاير, تحدي فري فاير, مقلب النوب, شحنتلهم, شحن فري فاير, ألف جوهرة, تخريب حساب, شحنت للمتابع, تحدي أفوز, FREE FIRE, NOOB PRANK, سكواد جزائري, خدعة اللغم, ساكورا, التحديث الجديد فري فاير, WHITE444, هيدشوت تلقائي, حسونة, دراغونوف, DBL N, الشخصية الجديدة, متجر التخفيضات, السكن, الشوتقن, فري فاير لايت, الكريمنال, الفاير باس الاول, المتابعين, اصعب تحدي, Ali Omar, M16, TRYHARD, DJEXO, قيم بلاي, سكواد بنات",41,https://i.ytimg.com/vi/esFmFSmZKCE/hqdefault.jpg,ar,ar,False,960,PT16M,hd,False,True,False,False,208224,17071,1149
OQac93ARgQE,LY,2026-06-06T04:36:50.877330+00:00,2026-06-01T15:00:06Z,"TUL8TE, Saint Levant - Nano I تووليت، ساينت ليفانت - نانو (Official Music Video)","TUL8TE, Saint Levant - Nano I تووليت، ساينت ليفانت - نانو (Official Music Video)",TUL8TE,UC5a1OK2lI0Q2x2jyJSDyc7A,10,Music,"Cocktail Ghena'y, Egyptian pop, El Hob Gany, Habeeby Leh, Layalina, Mateegy A3ady 3leiky, Oyon el nas, Qesm el shakawi, Qsm el shakawy, TUL8TE, TikTok viral arabic, Too late, Tul8te, arabic music trend, arabic pop fusion, daroory, entry crazy, ghareeb haly, heseeny, أغاني ع",20,https://i.ytimg.com/vi/OQac93ARgQE/hqdefault.jpg,en,ar,False,261,PT4M21S,hd,True,True,False,False,1265161,36176,2716
7fc-DATO6Cg,LY,2026-06-06T04:36:50.877338+00:00,2026-06-05T10:30:16Z,ماين كرافت لايف ستيل الحرامية #47 : صديقي المفضل تحالف مع المتمرد !!؟ 😱🔥,ماين كرافت لايف ستيل الحرامية #47 : صديقي المفضل تحالف مع المتمرد !!؟ 😱🔥,Ameer Slow - أمير سلاو,UCQTlk74kYjONf13QFnZsYCw,20,Gaming,"ماين كرافت, ماينكرافت, عراق كرافت, فلم ماين كرافت, الغني والفقير, فيلم ماين كرافت, افلام ماين كرافت, فلم, film ماين كرافت, العاب, مقلب, تحميل, تحميل ماين كرافت, minecraft, #فلم_ماين_كرافت, غريب, عجيب, اختفاء, غامض, شركات طيران, طائرة, سفر, رحلة, سياحة, أموال, وقود, بنزين, حقيبة أموال, فلوس, رحلات طيران, أمريكا, مظيفات طيران, مطار, اختطاف, دس تراك, روبلوكس, فلم_روبلوكس, مرحاض, بابا, ماما, شرطة, مصطفى_ماين_كرافت, فلم_ماين_كرافت, تزوجت, هارد لايف, كلب, مصطفى كيم اوفر, لعبة, أمير سلاو, مستر بعرورة, قطة, لايف ستبل",52,https://i.ytimg.com/vi/7fc-DATO6Cg/hqdefault.jpg,ar,ar,False,1348,PT22M28S,hd,False,True,False,False,95309,4597,454
SorXypIuYqM,LY,2026-06-06T04:36:50.877347+00:00,2026-06-04T22:00:23Z,GAUCHE DROITE (Feat. Draganov) (Visualiser),GAUCHE DROITE (Feat. Draganov) (Visualiser),ElGrandeToto,UCVG705xosVltZb52R0hHr_g,10,Music,"Elgrandetoto, HORS SÉRIE, elgrandetoto hors serie, elgrandetoto live, el grande toto, elgrandetoto album, elgrandetoto Pablo, elgrandetoto freestyle, rap 2020, rap maroc 2020, rap francais, rap maroc 2020 jadid, rap maroc 2020 new, elgrandetoto apache, elgrandetoto 7elmetado, راب مغربي, راب مغربي 2020",17,https://i.ytimg.com/vi/SorXypIuYqM/hqdefault.jpg,fr,ar,False,194,PT3M14S,hd,False,True,False,False,214605,13177,713
