video_id,country,fetched_at,published_at,title,localized_title,channel_title,channel_id,category_id,category_name,tags,tag_count,thumbnail,default_language,audio_language,is_live,duration,duration_raw,definition,caption_available,licensed_content,embeddable,made_for_kids,views,likes,comments
59rVK2qv8_U,LY,2026-06-06T04:36:50.876919+00:00,2026-06-05T18:00:06Z,Joudy Alhouti - Matalgashi (Official Lyrics Video) جودي الحوتي - ما تلقاشي,Joudy Alhouti - Matalgashi (Official Lyrics Video) جودي الحوتي - ما تلقاشي,Joudy Alhouti - جودي الحوتي,UCF5FFIkj2YfMhCNn61-mC_g,10,Music,,0,https://i.ytimg.com/vi/59rVK2qv8_U/hqdefault.jpg,ar,ar,False,160,PT2M40S,hd,False,True,False,False,3850,330,46
4omyHNFF_4o,LY,2026-06-06T04:36:50.876959+00:00,2026-06-03T19:00:06Z,MAJNOON OFFICIAL TRAILER 2026,MAJNOON OFFICIAL TRAILER 2026,Amal motion pictures,UCTCDIH8AckDC-9mqp3eZtbg,24,Entertainment,,0,https://i.ytimg.com/vi/4omyHNFF_4o/hqdefault.jpg,en,en,False,254,PT4M14S,hd,False,True,False,False,45527,2314,107
XYyj_WzuQmc,LY,2026-06-06T04:36:50.876972+00:00,2026-06-05T11:00:46Z,فلم قراند : زعرور العملاق القوي يحرق المنزل في الحمم البركانية ( كركور غاضب ) 🔥😂,فلم قراند : زعرور العملاق القوي يحرق المنزل في الحمم البركانية ( كركور غاضب ) 🔥😂,Ahmad GTA Family - عائلة احمد قراند ,UCQkLgXGjPbIrrNtT8ZtHOmg,22,People & Blogs,"مصطفى GAME OVER, Mr GG, XTREEM - اكستريم, اوكا - OKA, AboFlah, Mkamel GG, رانيا كيمنك Rania Gaming, BOZEX, هاردلك | hardlk, افلام, ماين كرافت, فلم ماين كرافت, غني وفقير, فايتر Fighter, ابو فله, فايتر, افلام ماين كرافت, الغني و الفقير, كوكب, ماين, MineCraft Movie, Suhaib - صهيب, جلمود - GLMooD, تايمو Tymo, هاردلك HARDLK, Ahmad M4 - احمد ام فور, بطل, Ahmad Hero - احمد البطل, احمد هيرو, سمبوسة - Sambosa, جعطوط - JATOOT, خزان, طيران, P4GAM3R, قراند, عقارات, اسهم, استثمار, عملات, دولار, شركات",41,https://i.ytimg.com/vi/XYyj_WzuQmc/hqdefault.jpg,ar,ar,False,1081,PT18M1S,hd,False,True,False,False,241877,2853,134
oH3SeJMpE3s,LY,2026-06-06T04:36:50.876983+00:00,2026-06-04T15:00:06Z,Mohamed Chaker & Saad Lamjarred - El Qamar Dyali | 2026 محمد شاكر و سعد لمجرد - القمر ديالي,Mohamed Chaker & Saad Lamjarred - El Qamar Dyali | 2026 محمد شاكر و سعد لمجرد - القمر ديالي,Mohamed Chaker,UC7hVUKl6jCjm5VnBtiTNh8g,10,Music,"El Qamar Dyali, Mohamed Chaker, arabic, fadel chaker, fadel shaker son, mohamad shaker, music, new, ya 7ayati, ya hayati, اغاني 2026, اغاني جديدة, اغاني جديدة 22026, اغاني سعد المجرد, اغاني محمد شاكر, القمر ديالي, جديد سعد لمجرد, جديد محمد شاكر, دويتو, سعد المجرد و محمد شاكر, سعد لمجرد, سعد لمجرد القمر ديالي, فضل شاكر, محمد شاكر, محمد شاكر القمر, محمد شاكر و سعد المجرد, مسعد لمجرد و محمد شاكر, يا حياتي",28,https://i.ytimg.com/vi/oH3SeJMpE3s/hqdefault.jpg,ar,en-US,False,332,PT5M32S,hd,False,True,False,False,987683,44338,5727
HLMX2w3cwuE,LY,2026-06-06T04:36:50.876993+00:00,2026-06-02T22:15:01Z,God of War Laufey - Gameplay Reveal Trailer | PS5 Games,God of War Laufey - Gameplay Reveal Trailer | PS5 Games,PlayStation,UC-2Y8dQb0S6DtpxNgAKoJKA,20,Gaming,"PlayStation, PS5, video games, next gen, Sony, state of play, god of war, God of War Laufey, Official Gameplay Reveal",9,https://i.ytimg.com/vi/HLMX2w3cwuE/hqdefault.jpg,en,en-US,False,1425,PT23M45S,hd,True,True,False,False,5922013,371784,27140
QdNmVWXuYec,LY,2026-06-06T04:36:50.877002+00:00,2026-06-06T00:27:34Z,"SUMMER GAME FEST 2026: Official 4K60FPS Livestream, (Resident Evil Veronica, FINAL FANTASY VII)","SUMMER GAME FEST 2026: Official 4K60FPS Livestream, (Resident Evil Veronica, FINAL FANTASY VII)",thegameawards,UCqDS7KWjAPKv-7ZSlro9OiQ,20,Gaming,"game awards, the game awards, gameplay, world premiere, video game awards, xbox, playstation, nintendo, summer game fest, sgf, tga, geoff keighley, game of the year, lucy games",14,https://i.ytimg.com/vi/QdNmVWXuYec/hqdefault.jpg,en,en,False,11259,PT3H7M39S,hd,True,True,False,False,9594031,136179,244
3SpNXoM0lLA,LY,2026-06-06T04:36:50.877011+00:00,2026-06-04T18:32:54Z,Saad Ramadan - Jamalek 3arabe (Official Video) | سعد رمضان - ‏جمالك عربي,Saad Ramadan - Jamalek 3arabe (Official Video) | سعد رمضان - ‏جمالك عربي,Saad Ramadan,UC16XmqDkuNdXwWl9itpHFbw,10,Music,"Jamalek 3arabe, ‏جمالك عربي, سعد رمضان, Saad Ramadan, اغاني سعد رمضان, مازال مازال, احساسك صنم, حبيت انا حبيت, فيك الخير, عشقك في البال, شو محسودين, مسبع الكارات, مو عيبك, يا عاشقة الورد, ماحدا خصو فينا, حبيت, بياع بحبك, قصة حب, عم نام عالواقف, إنت و انا, أغاني لبنانية, كيف ما بدي حبك, ناصيف زيتون, أغاني حب, ادم بس بحبك, عاشق مجنون, زياد برجي, سعد رمضان نسيتك والله, نسيتك والله, بالحب مجنون, الحب الأسطوري, مين قدك, ضد النسيان, خلص الوقت, عليها عيون",35,https://i.ytimg.com/vi/3SpNXoM0lLA/hqdefault.jpg,ar,ar,False,179,PT2M59S,hd,False,True,False,False,503563,18276,978
U5WoGoR97Hk,LY,2026-06-06T04:36:50.877021+00:00,2026-06-01T18:00:06Z,ZARGE TRAILER 2 OFFICIAL (2026) Hausa web Series,ZARGE TRAILER 2 OFFICIAL (2026) Hausa web Series,MIRAH HAUSA TV,UCT-hhCorDLc2vtszexn6klw,1,Film & Animation,,0,https://i.ytimg.com/vi/U5WoGoR97Hk/hqdefault.jpg,en,,False,151,PT2M31S,hd,False,True,False,False,24682,989,35
mXTvYxfrHKs,LY,2026-06-06T04:36:50.877029+00:00,2026-06-05T12:00:20Z,اشتريت العاب بلايستيشن على بي سي.. بعد فوات الاوان!,اشتريت العاب بلايستيشن على بي سي.. بعد فوات الاوان!,Gamerawi - وسيم,UCmkIXsLPceFpim2-Cm4kZ-g,20,Gaming,"بي سي, بلاي ستيشن, بلايستيشن 5, وسيم, العاب بلايستيشن 5, كمبيوتر, في ار, قيمراوي, قود اوف وار",9,https://i.ytimg.com/vi/mXTvYxfrHKs/hqdefault.jpg,ar,ar,False,701,PT11M41S,hd,False,True,False,False,245700,22353,1329
CcT_-ETjibI,LY,2026-06-06T04:36:50.877037+00:00,2026-06-03T21:30:56Z,MD MEHDI ft B.N.L (شن تبو ؟ فيه) - (ALBUM WAR II) prod by @BigSeno ,MD MEHDI ft B.N.L (شن تبو ؟ فيه) - (ALBUM WAR II) prod by @BigSeno ,MD MEHDI,UCyhjcY2zOp_5LH5OJFdQ1QA,10,Music,,0,https://i.ytimg.com/vi/CcT_-ETjibI/hqdefault.jpg,ar,ar,False,377,PT6M17S,hd,False,False,False,False,34263,3363,366
uRufDcBlc28,LY,2026-06-06T04:36:50.877044+00:00,2026-05-31T19:58:30Z,SAKACINA TRAILER ,SAKACINA TRAILER ,ALOLO HAUSA TV,UCE0biGbWHyEAo-1tXiVOB1w,22,People & Blogs,,0,https://i.ytimg.com/vi/uRufDcBlc28/hqdefault.jpg,en,,False,128,PT2M8S,hd,False,True,False,False,11691,660,16
sO2gxSovuYQ,LY,2026-06-06T04:36:50.877052+00:00,2026-06-05T15:41:16Z,الهروب من الجدة الشريرة بروبلوكس! 😱,الهروب من الجدة الشريرة بروبلوكس! 😱,El Husamo X,UCOMwpjGPUrGGUS2Diq6UmVw,20,Gaming,"gaming, viral, trending, horror, جيمنج, ترند, roblox, روبلوكس, ماين, ماينكرافت, ماين كرافت, كرافت, minecraft, mine craft, gta, gtav, el husamo, ال حسامو, حسامو, husamo, الحسامو, elhusamo, peekaa, peeka, naruto, hope rima, rima, abo flah, flah, abo, ابو فله, فله, فلة, رعب, صعب, تنرفز, مستفز, trend, dubai, uae, دبي, كرة, قدم, انيمي, anime, simulator, محاكي, foryou",48,https://i.ytimg.com/vi/sO2gxSovuYQ/hqdefault.jpg,ar,ar,False,958,PT15M58S,hd,False,True,False,False,118046,3822,466
ZnvAE_nYFKM,LY,2026-06-06T04:36:50.877061+00:00,2026-05-30T14:30:32Z,و عيوني سهارة,و عيوني سهارة,Africa Cassette - Topic,UCmztilIFJ0VGbcAuWnu-XfQ,10,Music,"Africa Cassette, Emir Enzo, و عيوني سهارة",3,https://i.ytimg.com/vi/ZnvAE_nYFKM/hqdefault.jpg,ar,,False,305,PT5M5S,hd,False,True,False,False,145155,1047,9
jLbst85USN8,LY,2026-06-06T04:36:50.877069+00:00,2026-05-28T14:53:06Z,Call of Duty: Modern Warfare 4 | Reveal Trailer,Call of Duty: Modern Warfare 4 | Reveal Trailer,Call of Duty,UC9YydG57epLqxA9cTzZXSeQ,20,Gaming,"call of duty, cod, activision, call of duty: modern warfare 4, modern warfare 4, mw4",6,https://i.ytimg.com/vi/jLbst85USN8/hqdefault.jpg,en,en,False,170,PT2M50S,hd,False,True,False,False,31150108,218007,22064
AhZPed77PjI,LY,2026-06-06T04:36:50.877076+00:00,2026-06-04T11:00:30Z,٥٠ ليلة في غابة الجدة المخيفة👵🏻😱خطفتنا وعذبتنا😭| Roblox | روبلوكس ,٥٠ ليلة في غابة الجدة المخيفة👵🏻😱خطفتنا وعذبتنا😭| Roblox | روبلوكس ,لانا و رورو,UCV5ZVvsnqXniOnI4yydz8pQ,22,People & Blogs,,0,https://i.ytimg.com/vi/AhZPed77PjI/hqdefault.jpg,ar,ar,False,1503,PT25M3S,hd,False,True,False,False,1256208,23363,5716
ZyduzceLKhs,LY,2026-06-06T04:36:50.877084+00:00,2026-06-02T14:00:06Z,Al Shami x Leen Hayek - Aayesh La Oyounak [Official Video] (2026) / الشامي ولين الحايك - عايش لعيونك,Al Shami x Leen Hayek - Aayesh La Oyounak [Official Video] (2026) / الشامي ولين الحايك - عايش لعيونك,Al Shami - الشامي,UCO-OdMztI8WPVoz_Dq9n48Q,10,Music,"al chami, el shami, el chami, الشامي, شامي, al shami music, al shami 2025, أغاني عربية, 2025 أغاني عربية, أغاني راب عربية, أغاني راب عربية 2025, إنتاج بلال دركي, shami, chami, new music, al shami, al chamy, el chamy, al shamy, el shamy, Aayesh La Oyounak, leen hayek, leen al hayek, leen el hayek, al shami leen hayek, al shami and leen hayek, الشامي ولين الحايك عايش لعيونك, الشامي ولين الحايك, عايش لعيونك",29,https://i.ytimg.com/vi/ZyduzceLKhs/hqdefault.jpg,ar,ar,False,222,PT3M42S,hd,True,True,False,False,4323631,180284,50597
V0d_-lgKXnY,LY,2026-06-06T04:36:50.877092+00:00,2026-06-05T20:35:56Z,العرض التشويقي للفيلم المنتظر || غفلة ||  قريباً ..,العرض التشويقي للفيلم المنتظر || غفلة ||  قريباً ..,King GTA - بلعيد سليطاني,UCEcube7ROjRe__q3EfhE3fw,20,Gaming,"بلعيد سليطاني, راعي الشاص, قراند 5, قراند, هجوله قراند, فيلم قراند, تفحيط قراند, السنافي, شاص, الشاص, شاصات, شص, السعودية, الرياض, دوريات, شرطة, أفلام قراند, هجوله, تفحيط, افلام قصيرة, فيلم قصير, قطع سيول, عصابات قراند, فلم سعودي, فلم تهريب, فلم خطف, طقطقه, شرطي قراند, دوريات قراند, هايلوكس قراند, لكزس قراند, السائق المعجزه, قراند شباب البومب, قراند الرياض, كنق النظيم, GTA, GTA 5, GTA 6, gta film, gta 5 drift, gta 5 c, CINEMATIC, crvhk] hf, قراند ابوفله, مطاردة, فيلم الفقير, بلعيد",47,https://i.ytimg.com/vi/V0d_-lgKXnY/hqdefault.jpg,ar,ar,False,86,PT1M26S,hd,False,True,False,False,4693,1046,172
h3xBv0F3Wk0,LY,2026-06-06T04:36:50.877101+00:00,2026-06-03T15:00:40Z,Samira L'Oranaise ft. Cheba Warda 2026 - Nmout w Na3ref نموت و نعرف (Music Remix),Samira L'Oranaise ft. Cheba Warda 2026 - Nmout w Na3ref نموت و نعرف (Music Remix),KERS Music,UCyM3CefqtP0L6coGrrS5cCw,10,Music,,0,https://i.ytimg.com/vi/h3xBv0F3Wk0/hqdefault.jpg,fr,ar,False,188,PT3M8S,sd,False,True,False,False,119052,670,39
3PrFfR9S4Qs,LY,2026-06-06T04:36:50.877108+00:00,2026-06-05T19:07:13Z,Evolucioné de CHUNK POBRE a CHUNK de MILLONARIO en Minecraft,Evolucioné de CHUNK POBRE a CHUNK de MILLONARIO en Minecraft,Nacho,UC8EkcHOycB94lHDkbAPSnQA,20,Gaming,"nacho, dagar, nacho minecraft, dagar y nacho, nacho y dagar, minecraft, minecraft mod, amigos, amigos minecraft, dinero, dinero minecraft, millonario minecraft, rico minecraft, pobre minecraft, de pobre a rico, chico pobre, chico rico, chico pobre vs chico rico, chico millonario, bebe, casa, casa minecraft, casa de rico, casa minecraft rico, de rico a pobre, casa millonario, lia minecraft, de casa pobre a casa millonario, chuhk, chunk pobre, chunk rico, chunk millonario",32,https://i.ytimg.com/vi/3PrFfR9S4Qs/hqdefault.jpg,es,es,False,1482,PT24M42S,hd,False,True,False,False,660466,9284,359
b4j2VYAWs5Q,LY,2026-06-06T04:36:50.877115+00:00,2026-06-03T13:30:49Z,GLOBHOM KA7LA,GLOBHOM KA7LA,Sayax - Topic,UCLfZSeFjCMvrLJlYElUGLBA,10,Music,"SayaX, GLOBHOM KA7LA",2,https://i.ytimg.com/vi/b4j2VYAWs5Q/hqdefault.jpg,en,en,False,163,PT2M43S,hd,False,True,False,False,41396,2469,190
ACwr6gX4Srg,LY,2026-06-06T04:36:50.877123+00:00,2026-06-04T11:04:25Z,انتقام راعي الشاص من راعي الهيلكس لي خطف ابو لينصدم الجميع......؟ |قراند 5,انتقام راعي الشاص من راعي الهيلكس لي خطف ابو لينصدم الجميع......؟ |قراند 5,سعد العباني-King GTA,UCz3yDlPJNSyoMNh056Z-5jA,22,People & Blogs,,0,https://i.ytimg.com/vi/ACwr6gX4Srg/hqdefault.jpg,ar,ar,False,1399,PT23M19S,hd,False,True,False,False,42599,763,40
9OPXDOLDn_Y,LY,2026-06-06T04:36:50.877130+00:00,2026-06-05T22:05:15Z,ARSENIK X ABYUSIF - EL NAGHZA (Prod. Abyusif),ARSENIK X ABYUSIF - EL NAGHZA (Prod. Abyusif),Abyusif I أبيوسف,UC11DKpZ9mdjdb5fbdb7ulRw,10,Music,"ابيوسف, abyusif, rap, راب, مصري, aboyusif, ابويوسف, يوسف, الطاي, 3azama, ابيو, abyo, abyu, ابو يوسف, marwan moussa, مروان موسى, ويجز, wegz, ابو الانوار, egyptian arab, arab rap, راب مصري, pablo, بابلو, الفا, alpha, tgely el sobh, deeb, basha e3temed, مملكه, mamlaka, lil baba, ليل بابا, نصرت, nosrat",35,https://i.ytimg.com/vi/9OPXDOLDn_Y/hqdefault.jpg,en,ar,False,265,PT4M25S,hd,False,False,False,False,65048,11082,2215
MJCQtbfaXVw,LY,2026-06-06T04:36:50.877138+00:00,2026-06-05T10:19:18Z,قاتلت أخطر سفاح في سيرفر هاردكور SMP,قاتلت أخطر سفاح في سيرفر هاردكور SMP,Algazal,UC6E8z7tAjmY3ccng543KVoA,20,Gaming,"ماين كرافت: كيفية البقاء على قيد الحياة, أفضل بناء في ماين كرافت, تحديات ماين كرافت, خدع وحيل ماين كرافت, مودات ماين كرافت (أفضل المودات), كيفية إنشاء مزرعة أوتوماتيكية, استراتيجيات التعدين الفعالة, أفكار بناء منزل, كيفية هزيمة التنين, تحديثات ماين كرافت الجديدة, لعبة ماين كرافت متعددة اللاعبين, كيفية صنع الفخاخ في ماين كرافت, استكشاف السيرفرات, أفضل أدوات وماكينات في ماين كرافت, تحدي 100 يوم في ماين كرافت, أسرار ماين كرافت, كيفية استخدام السحر في ماين كرافت",17,https://i.ytimg.com/vi/MJCQtbfaXVw/hqdefault.jpg,en,ar,False,7830,PT2H10M30S,hd,False,True,False,False,136501,11263,3891
8KsM5z7eM3I,LY,2026-06-06T04:36:50.877146+00:00,2026-05-31T10:02:12Z,كرمانجي أجمل وردة,كرمانجي أجمل وردة,Cilox Mania - Topic,UCERyFTuyZyn2P0e211ZsLPg,10,Music,"Cilox Mania, الحب الحقيقي, كرمانجي أجمل وردة",3,https://i.ytimg.com/vi/8KsM5z7eM3I/hqdefault.jpg,ar,,False,87,PT1M27S,hd,False,True,False,False,319862,1643,0
sr73MGoA6xM,LY,2026-06-06T04:36:50.877154+00:00,2026-06-05T14:00:03Z,لعبت ماين كرافت مع صديقي !!,لعبت ماين كرافت مع صديقي !!,SA7RAWI,UCjHq0FqdRB0JP-1CcokW3-w,20,Gaming,"الصحراوي, صحراوي فري فاير, sa7rawi, فري فاير, صحراوي, فري فاير الجزائر, تهكير فري فاير, تحدي فري فاير, مقلب النوب, شحنتلهم, شحن فري فاير, ألف جوهرة, تخريب حساب, شحنت للمتابع, تحدي أفوز, FREE FIRE, NOOB PRANK, سكواد جزائري, خدعة اللغم, ساكورا, التحديث الجديد فري فاير, WHITE444, هيدشوت تلقائي, حسونة, دراغونوف, DBL N, الشخصية الجديدة, متجر التخفيضات, السكن, الشوتقن, فري فاير لايت, الكريمنال, الفاير باس الاول, المتابعين, اصعب تحدي, Ali Omar, M16, TRYHARD, DJEXO, قيم بلاي, سكواد بنات",41,https://i.ytimg.com/vi/sr73MGoA6xM/hqdefault.jpg,ar,ar,False,1311,PT21M51S,hd,False,True,False,False,222357,19705,3705
HKdje9N-ffY,LY,2026-06-06T04:36:50.877163+00:00,2026-06-05T16:02:13Z,Yacou B OG Feat. @DidiBKiffnobeatTV - Ayatollah (Clip Officiel),Yacou B OG Feat. @DidiBKiffnobeatTV - Ayatollah (Clip Officiel),YACOU B OG,UChR7zK0VlpSrfgZLPtm49MA,10,Music,"YACOU B, KEYZIT, KEYZIT MALI, KEYZIT AFRICA, MALI, ARTISTE, MALIEN, MUSIQUE, CULTURE, HIP HOP",10,https://i.ytimg.com/vi/HKdje9N-ffY/hqdefault.jpg,fr,und,False,173,PT2M53S,hd,False,True,False,False,184575,26636,1727
HBMXV9OPfG4,LY,2026-06-06T04:36:50.877171+00:00,2026-06-05T15:19:45Z,شريت اغلى واقوى قدره في اللعبه وصرت اسرع شخص 🤑 +1 Speed Keyboard,شريت اغلى واقوى قدره في اللعبه وصرت اسرع شخص 🤑 +1 Speed Keyboard,RTQ,UCY5Zs3Y76ILKOdJODtlsiBw,22,People & Blogs,,0,https://i.ytimg.com/vi/HBMXV9OPfG4/hqdefault.jpg,en,en,False,508,PT8M28S,hd,False,True,False,False,127687,7124,517
mECaGwHYZik,LY,2026-06-06T04:36:50.877178+00:00,2026-06-01T12:59:24Z,واش يا دنيا,واش يا دنيا,Maryam Abdel Aziz - Topic,UCYvUFh7aPvioYyBm4KflXiw,10,Music,"Maryam Abdel Aziz, واش يا دنيا",2,https://i.ytimg.com/vi/mECaGwHYZik/hqdefault.jpg,ms,,False,248,PT4M8S,hd,False,True,False,False,132251,802,0
47rQwUFo8Y4,LY,2026-06-06T04:36:50.877185+00:00,2026-06-06T00:40:25Z,مهرجان العاب الصيف | بث | Summer Fest Game 2026,مهرجان العاب الصيف | بث | Summer Fest Game 2026,SalGaming,UCnkoaVeyWihpKXv4VPcPLVA,20,Gaming,"fahad sal, fahad sal gaming, فهد سال, فهد سال قيمز, summer fest games 2026, مهرجان العاب الصيف",6,https://i.ytimg.com/vi/47rQwUFo8Y4/hqdefault.jpg,ar,en,False,15276,PT4H14M36S,hd,False,True,False,False,131119,6152,79
xU6LmbTctFc,LY,2026-06-06T04:36:50.877193+00:00,2026-05-31T22:57:45Z,DIOR,DIOR,A.L.A - Topic,UC2emR2ejJMlvHdghCs3qOmQ,10,Music,"A.L.A, Ala Ferchichi, Mahdi Machfar, DIOR",4,https://i.ytimg.com/vi/xU6LmbTctFc/hqdefault.jpg,en,,False,143,PT2M23S,hd,False,True,False,False,116713,2116,40
LpgKyVaEAEI,LY,2026-06-06T04:36:50.877200+00:00,2026-06-05T13:30:14Z,A CADA CORAÇÃO o MINECRAFT fica MAIS REALISTA!,A CADA CORAÇÃO o MINECRAFT fica MAIS REALISTA!,Athos,UC6P6SvP2arhEdJ9Pg8qwP2A,20,Gaming,"minecraft, athos, athos gamer, minecraft pe, bedrock, java, pocket edition, maniqueft",8,https://i.ytimg.com/vi/LpgKyVaEAEI/hqdefault.jpg,pt-PT,pt-BR,False,1110,PT18M30S,hd,True,True,False,False,638089,5463,70
A0qRwk2fgS4,LY,2026-06-06T04:36:50.877208+00:00,2026-05-29T21:16:53Z,Hate Me (feat. irias) [No Disc Instru Remix],Hate Me (feat. irias) [No Disc Instru Remix],Mc Artisan - Topic,UCKrjueMwqHDECPnsgiLIKLg,10,Music,"Mc Artisan, irias, Hate Me (feat. irias) [No Disc Instru Remix]",3,https://i.ytimg.com/vi/A0qRwk2fgS4/hqdefault.jpg,en,,False,205,PT3M25S,hd,False,True,False,False,142244,2935,116
2kXQvarQKjI,LY,2026-06-06T04:36:50.877215+00:00,2026-06-05T12:00:35Z,جيش جراني هجم علي بالغابه 😰 granny,جيش جراني هجم علي بالغابه 😰 granny,HOPE Rima,UCfYI9exf8BUHVgMSiAZWs2A,20,Gaming,"العاب, مقالب, تحديات, games, minecraft, oneblock, روبلكس, tiktok, ردات فعل, ماينكرافت بس, minecraft but, قيمز, rima, hoperima, هوب ريما, ريما, ماين كرافت, ماين كرافت ولكن, 100 يوم, 24 ساعة, funny, take damage, روبلوكس, الجد والجدة جراني, ريما وبيكا, ROBLOX, جراني, granny, doors, roblox, gaming, banban, بان بان, العاب رعب, horror games, بندريتا, بندر, الجدة جراني",38,https://i.ytimg.com/vi/2kXQvarQKjI/hqdefault.jpg,ar,ar,False,961,PT16M1S,hd,False,True,False,False,89480,2832,418
z_w239jHnWw,LY,2026-06-06T04:36:50.877224+00:00,2026-06-02T13:04:48Z,DJ Goja - Mi Chico (Lyric Video),DJ Goja - Mi Chico (Lyric Video),AFROLUNA,UCJfWVpMhpK9VXSFZORcW_qg,10,Music,"Afroluna, afroluna music, Afro House 2026, afro house, afrohouse music 2026, adam port, Keinemusik, HUGEL, Tulum Afro House, afro remix, Dj Goja Mi Chico, Mi Chico Lyrics, Dj Goja - Mi Chico, Lyrics Mi Chico, Dj Goja Mi Chico Lyrics, Mi Chico Official Lyrics Video, Mi Chico Afro House, Mi Chico Afro House Remix, Dj Goja Afro House, Deep Afro House, Organic House 2026, Afro House Groove, new afro house, she got that vibe mi chico",24,https://i.ytimg.com/vi/z_w239jHnWw/hqdefault.jpg,en,en,False,118,PT1M58S,hd,True,True,False,False,144877,1003,8
B0Bb2twugEo,LY,2026-06-06T04:36:50.877231+00:00,2026-06-05T10:19:04Z,007 First Light | ملاحقة الخونه في كل الأتجاهات #5 الأخيرة,007 First Light | ملاحقة الخونه في كل الأتجاهات #5 الأخيرة,مـلـزلـز MLZLZ,UCneq-pXhApziFpje2tIfofw,20,Gaming,#ملزلز,1,https://i.ytimg.com/vi/B0Bb2twugEo/hqdefault.jpg,ar,ar,False,14735,PT4H5M35S,hd,False,True,False,False,69328,6770,745
lrobmPw6AjQ,LY,2026-06-06T04:36:50.877238+00:00,2026-05-25T14:04:03Z,سر وجعنا,سر وجعنا,Rahma Mohsen - Topic,UCvfK4QoDRoHPhFEfgxbLruA,10,Music,"Rahma Mohsen, NORDO, سر وجعنا, Ser Wagaana",4,https://i.ytimg.com/vi/lrobmPw6AjQ/hqdefault.jpg,en,ar,False,197,PT3M17S,hd,False,True,False,False,326313,5644,30
mv7Bfzkq0TI,LY,2026-06-06T04:36:50.877246+00:00,2026-06-05T11:00:16Z,حصلت على اسرع سيارة بالعالم 😍 ( باتل رويال 🤬 ) Forza Horizon 6,حصلت على اسرع سيارة بالعالم 😍 ( باتل رويال 🤬 ) Forza Horizon 6,شبكة العاب العرب | Arab Games Network,UCV2JkEBmtfSYGAIlprAhAyQ,20,Gaming,,0,https://i.ytimg.com/vi/mv7Bfzkq0TI/hqdefault.jpg,ar,ar,False,1027,PT17M7S,hd,False,True,False,False,227618,16278,824
w7DVfYLRh4w,LY,2026-06-06T04:36:50.877253+00:00,2026-05-31T18:30:06Z,MC MEGO - RABI M3ANA ( ربي معانا ) - (OFFICIEL AUDIO),MC MEGO - RABI M3ANA ( ربي معانا ) - (OFFICIEL AUDIO),MC MEGO,UCoEKnT8okw1e9I-g78COXTA,10,Music,,0,https://i.ytimg.com/vi/w7DVfYLRh4w/hqdefault.jpg,en,en,False,230,PT3M50S,hd,False,True,False,False,186987,10211,807
hgQWQV1HZTE,LY,2026-06-06T04:36:50.877260+00:00,2026-06-04T10:11:07Z,بداية حدث كأس العالم في إف سي موبايل,بداية حدث كأس العالم في إف سي موبايل,Abdo 2xd,UC8H8YKUSFLtLxjt49tlyJwA,20,Gaming,"عبدو, Abdo, Abdo 2xd, FIFA, فيفا, لعبة فيفا, ABDO, فيفا موبايل, fifa, fifa mobile, اف سي موبايل, FC MOBILE, اف سي, fc, fc mobile, لعبة فيفا موبايل, كريستيانو, كريستيانو رونالدو, cr7, ballon d'or, رونالدينهو, FC, رونالدو, رودريجو, زيدان, فريق الموسم, TOTS, كريستانو رونالدو, Ballon d'Or, ايزيبو, ديمبلي, البالون دور, الكرة الذهبية, tots, برونو, هالاند, بيست, abdo2xd, كريستانو, كريستانو الازرق, ميسي, التميت",42,https://i.ytimg.com/vi/hgQWQV1HZTE/hqdefault.jpg,ar,ar,False,1494,PT24M54S,hd,False,True,False,False,523206,64071,3915
pWOVb01U-c4,LY,2026-06-06T04:36:50.877269+00:00,2026-06-03T15:00:01Z,BABYMONSTER - 'SUGAR HONEY ICE TEA' M/V TEASER,BABYMONSTER - 'SUGAR HONEY ICE TEA' M/V TEASER,BABYMONSTER,UCqwUnggBBct-AY2lAdI88jQ,10,Music,"BABYMONSTER, 베이비몬스터, 베몬, BABYMON, BAEMON, 하람, 아현, 루카, 치키타, 파리타, 로라, 아사, HARAM, AHYEON, RUKA, CHIQUITA, PHARITA, RORA, ASA",19,https://i.ytimg.com/vi/pWOVb01U-c4/hqdefault.jpg,en,ko,False,28,PT28S,hd,False,True,False,False,3312812,295381,17763
HRJcms5ZGcc,LY,2026-06-06T04:36:50.877277+00:00,2026-06-05T16:30:22Z,ربلوكس فتحت كل الرفسات الجديدة ! Kick a lucky block,ربلوكس فتحت كل الرفسات الجديدة ! Kick a lucky block,اصحاب مازن,UCayyBWtI1PxJCtieqKUQZnA,20,Gaming,"roblox, روبلوكس, العاب, مشاهير روبلوكس, مازن روبلوكس, عائلة روبلوكس, سعدون روبلوكس, اصحاب مازن, مازن وسعدون, روبلوكس ماب السرقة, مازن ستيل برين روت, ستيل برين روت, Steal A Brainrot",13,https://i.ytimg.com/vi/HRJcms5ZGcc/hqdefault.jpg,ar,ar,False,560,PT9M20S,hd,False,True,False,False,99449,4156,371
vrY1THC_NQE,LY,2026-06-06T04:36:50.877284+00:00,2026-06-01T15:00:06Z,IShowSpeed - World Cup (Champions) [Official Music Video],IShowSpeed - World Cup (Champions) [Official Music Video],IShowSpeed,UCWsDFcIhY2DBi3GB5uykGXA,20,Gaming,"ishowspeed, world cup",2,https://i.ytimg.com/vi/vrY1THC_NQE/hqdefault.jpg,en,en,False,299,PT4M59S,hd,False,True,False,False,24526049,2177675,132789
