video_id,country,fetched_at,published_at,title,localized_title,channel_title,channel_id,category_id,category_name,tags,tag_count,thumbnail,default_language,audio_language,is_live,duration,duration_raw,definition,caption_available,licensed_content,embeddable,made_for_kids,views,likes,comments
8nnTzrEhTfg,UY,2026-05-10T04:32:00.374798+00:00,2026-05-08T21:00:06Z,Maxi Alvarez x Mateo Creciente - Te Entiendo (Video Oficial),Maxi Alvarez x Mateo Creciente - Te Entiendo (Video Oficial),Maxi Alvarez,UCdvx_u12RTssjxeUpxz6Cmw,10,Music,"Maxi Alvarez, Mateo Creciente, one play, te entiendo, te entiendo remix, la nueva escuela, la bocha 12, la deskarga, the la planta, plena, peru, lima peru",12,https://i.ytimg.com/vi/8nnTzrEhTfg/hqdefault.jpg,es,es-419,False,168,PT2M48S,hd,False,False,False,False,47101,575,36
f_bKjZeJBBI,UY,2026-05-10T04:32:00.374838+00:00,2026-05-05T04:10:02Z,The Odyssey | Official New Trailer,The Odyssey | Official New Trailer,Universal Pictures,UCq0OueAsdxH6b8nyAspwViw,24,Entertainment,,0,https://i.ytimg.com/vi/f_bKjZeJBBI/hqdefault.jpg,en-US,en-US,False,152,PT2M32S,hd,True,True,False,False,16568567,295726,18429
DdZRqHWUQpc,UY,2026-05-10T04:32:00.374851+00:00,2026-05-10T00:12:31Z,BAJÉ A LOS BACKROOMS EN ROBLOX,BAJÉ A LOS BACKROOMS EN ROBLOX,FedeGames,UCsYQxZGPAUz-QrMfaXePouQ,20,Gaming,"minecraft, videos de juegos, juegos, gameplays, fede games, fede gameplays, videos de minecraft, vecibanda, fede y sus vecinos, fede vigevani, federico vigevani, vecinos minecraft, videojuegos, backrooms, roblox mini mini, bajé a los backrooms",16,https://i.ytimg.com/vi/DdZRqHWUQpc/hqdefault.jpg,es,es,False,1032,PT17M12S,hd,False,True,False,False,1283262,68795,6252
6hMKG7ffyxA,UY,2026-05-10T04:32:00.374861+00:00,2026-05-07T10:04:04Z,Te Entiendo,Te Entiendo,Release - Topic,UC61NzuNzlhmzGQ5a7utx7Hw,10,Music,"La Penultima, De La Previa, Te Entiendo",3,https://i.ytimg.com/vi/6hMKG7ffyxA/hqdefault.jpg,es,es,False,165,PT2M45S,hd,False,True,False,False,11479,168,1
tv03AgZUBPY,UY,2026-05-10T04:32:00.374870+00:00,2026-05-01T13:01:40Z,"YO, NARCISO | Tráiler Oficial | Buena Vista International LA","YO, NARCISO | Tráiler Oficial | Buena Vista International LA",Buena Vista International LA,UCk2xbr2T0q-CEGzWaSy-ocA,24,Entertainment,"Tráiler, Trailer, Oficial, Películas",4,https://i.ytimg.com/vi/tv03AgZUBPY/hqdefault.jpg,es,es-419,False,152,PT2M32S,hd,False,True,False,False,101110,942,123
Caxv8tLATnc,UY,2026-05-10T04:32:00.374878+00:00,2026-05-09T16:00:15Z,"Escape 50 Pros, Win $50,000","Escape 50 Pros, Win $50,000",MrBeast Gaming,UCIPPMRA040LQr5QPyJEbmXA,20,Gaming,,0,https://i.ytimg.com/vi/Caxv8tLATnc/hqdefault.jpg,en,en,False,1137,PT18M57S,hd,True,True,False,False,5396306,188105,10026
MwNCl18O6l8,UY,2026-05-10T04:32:00.374886+00:00,2026-05-08T23:00:06Z,La Penúltima & De La Previa - Te Entiendo,La Penúltima & De La Previa - Te Entiendo,La Penúltima,UCEBYpk9zIxN7eeGqQ--4-Xg,10,Music,"la penultima, de la previa, te entiendo, cumbia, uruguay",5,https://i.ytimg.com/vi/MwNCl18O6l8/hqdefault.jpg,es,es-419,False,164,PT2M44S,hd,False,False,False,False,8788,385,45
SJPu1spHqfk,UY,2026-05-10T04:32:00.374894+00:00,2026-04-30T12:59:32Z,RESIDENT EVIL – Official Teaser Trailer (4K),RESIDENT EVIL – Official Teaser Trailer (4K),Sony Pictures Entertainment,UCz97F7dMxBNOfGYu3rx8aCw,24,Entertainment,,0,https://i.ytimg.com/vi/SJPu1spHqfk/hqdefault.jpg,en,en,False,114,PT1M54S,hd,True,True,False,False,3963418,167761,18307
z6K5J132O4g,UY,2026-05-10T04:32:00.374901+00:00,2026-05-09T13:34:37Z,CAJA del MUNDIAL 2026 Decide Mi Modo Carrera,CAJA del MUNDIAL 2026 Decide Mi Modo Carrera,Robertinho,UCuvObJtOqP_WMImIlNt6uXw,20,Gaming,"FC 26, MODO CARRERA, SOBRES MUNDIAL 2026, SOBRES DECIDEN MI EQUIPO, WORLD CUP 2026, FIGURITAS MUNDIAL",6,https://i.ytimg.com/vi/z6K5J132O4g/hqdefault.jpg,es,es,False,1813,PT30M13S,hd,False,True,False,False,329375,14122,348
ioMyRr3FszQ,UY,2026-05-10T04:32:00.374909+00:00,2026-05-07T22:00:06Z,Juanjo Morgade - Love (Video Oficial),Juanjo Morgade - Love (Video Oficial),Juanjo Morgade ,UCezrq7Ivsfmh1GaQb_PbTww,10,Music,"juanjo morgade, love, maxi alvarez, la nueva escuela, la bocha 12, la dekarga",6,https://i.ytimg.com/vi/ioMyRr3FszQ/hqdefault.jpg,es,es,False,180,PT3M,hd,False,True,False,False,54105,991,90
Xt4X4FvXk2A,UY,2026-05-10T04:32:00.374917+00:00,2026-04-16T13:00:08Z,Street Fighter | Official Trailer (2026 Movie),Street Fighter | Official Trailer (2026 Movie),Paramount Pictures,UCF9imwPMSGz4Vq1NiTWCC7g,1,Film & Animation,,0,https://i.ytimg.com/vi/Xt4X4FvXk2A/hqdefault.jpg,en,en-US,False,173,PT2M53S,hd,True,True,False,False,16058419,290993,24122
laMKk4H71-o,UY,2026-05-10T04:32:00.374925+00:00,2026-05-09T18:36:52Z,Un ACOSADOR Nos Persigue en Minecraft!,Un ACOSADOR Nos Persigue en Minecraft!,Dagar,UCEs5MQjXJq27-X2vgdwtYDw,20,Gaming,"Minecraft, minecraft mod, dagar y nacho, nacho y dagar, amigos minecraft, dagar minecraft, minecraft dagar",7,https://i.ytimg.com/vi/laMKk4H71-o/hqdefault.jpg,es,es,False,1304,PT21M44S,hd,False,True,False,False,712417,12261,954
5s9knBbsO-8,UY,2026-05-10T04:32:00.374932+00:00,2026-05-04T00:04:45Z,J Quiles - Orgullo (Letra),J Quiles - Orgullo (Letra),The Best Flow,UCrEPUe5T96gQ1RQ1WRMrVFg,10,Music,#rap #trap #reggeaton #thebestflow #letra,1,https://i.ytimg.com/vi/5s9knBbsO-8/hqdefault.jpg,es,es,False,202,PT3M22S,hd,False,True,False,False,76890,81,2
AjFk1cY265I,UY,2026-05-10T04:32:00.374940+00:00,2026-04-10T16:29:45Z,Digital Circus Ep 9 Finale [TRAILER],Digital Circus Ep 9 Finale [TRAILER],GLITCH,UCn_FAXem2-e3HQvmK-mOH4g,1,Film & Animation,"glitch, glitch productions, digital circus, the amazing digital circus, murder drones, Pomni, Uzi, Jax, Ragatha, Kinger, Gangle, Zooble, Caine, Bubble, 3D, Animation, 3D Animation, Indie Animation, Gummigoo",19,https://i.ytimg.com/vi/AjFk1cY265I/hqdefault.jpg,en,en,False,70,PT1M10S,hd,True,True,False,False,28589750,1628268,114618
APn8BbYkhIU,UY,2026-05-10T04:32:00.374948+00:00,2026-05-09T16:59:11Z,URUGUAY STREAM VS TOP GLOBALES LA REVANCHA,URUGUAY STREAM VS TOP GLOBALES LA REVANCHA,Petakka,UCJXyi12PILMERRMTDS5P7yw,22,People & Blogs,,0,https://i.ytimg.com/vi/APn8BbYkhIU/hqdefault.jpg,es,es,False,3581,PT59M41S,hd,False,False,False,False,4131,340,27
CapicMxiD_g,UY,2026-05-10T04:32:00.374955+00:00,2026-05-06T13:00:20Z,Yandel - Encantadora,Yandel - Encantadora,Top Squad,UC5iD7k7-75a-ahOA34vg8Hg,10,Music,,0,https://i.ytimg.com/vi/CapicMxiD_g/hqdefault.jpg,pt-PT,es,False,241,PT4M1S,hd,False,True,False,False,527633,571,5
CgU_CaSAWKU,UY,2026-05-10T04:32:00.374962+00:00,2026-05-09T17:33:36Z,K꙱i꙱n꙱i꙱t꙱o꙱P꙱e꙱t꙱.꙱e꙱x꙱e꙱,K꙱i꙱n꙱i꙱t꙱o꙱P꙱e꙱t꙱.꙱e꙱x꙱e꙱,JuegaGerman,UCYiGq8XF7YQD00x7wAd62Zg,20,Gaming,"juegagerman, juega, german, holasoygerman, hola soy german, juega german, kinitopet, kinito pet, kinitopet.exe, juego de terror, miedo",11,https://i.ytimg.com/vi/CgU_CaSAWKU/hqdefault.jpg,es-419,es-419,False,3975,PT1H6M15S,hd,False,True,False,False,445079,35673,2018
7ecaZnVgQ5M,UY,2026-05-10T04:32:00.374970+00:00,2026-05-07T17:00:06Z,Jorge Drexler - ¿Cómo se ama? (Video Oficial),Jorge Drexler - ¿Cómo se ama? (Video Oficial),JorgeDrexlerVEVO,UCMjyume8ZiKS_gG2wP8EeYA,10,Music,"Cantautores, Jorge Drexler, Latin Pop, ¿Cómo se ama?",4,https://i.ytimg.com/vi/7ecaZnVgQ5M/hqdefault.jpg,es,es,False,259,PT4M19S,hd,False,True,False,False,75095,6558,344
ogMynSQ_F9k,UY,2026-05-10T04:32:00.374978+00:00,2026-05-09T20:04:59Z,URUGUAY 3-2 TOP GLOBALES. LA REVANCHA.,URUGUAY 3-2 TOP GLOBALES. LA REVANCHA.,Santicap,UCHQABicKveWIgMaecq4cYUw,24,Entertainment,,0,https://i.ytimg.com/vi/ogMynSQ_F9k/hqdefault.jpg,es,es,False,4912,PT1H21M52S,hd,False,True,False,False,5091,430,21
5cigm2vP-a4,UY,2026-05-10T04:32:00.374985+00:00,2026-05-08T22:00:06Z,PEKEÑO 77 - CONVERSACION CON DIOS (VIDEO OFICIAL),PEKEÑO 77 - CONVERSACION CON DIOS (VIDEO OFICIAL),Pekeño 77,UCK3wIe3eIVgJUv7bN3T8UOw,10,Music,"pekeño 77, trap",2,https://i.ytimg.com/vi/5cigm2vP-a4/hqdefault.jpg,es,es-419,False,198,PT3M18S,hd,False,True,False,False,19866,3010,313
hl1r5086CTc,UY,2026-05-10T04:32:00.375015+00:00,2026-05-09T00:12:21Z,THIAGO Y BILLIE EILISH SE BESAN 😍 | Tomodachi Life #3,THIAGO Y BILLIE EILISH SE BESAN 😍 | Tomodachi Life #3,RobleisIUTU,UCG8eSYvOQUpb9HM8zU5d6xg,23,Comedy,"risa, funny, top, videos graciosos, recopilacion, clips, reaccion, juego, mejores momentos, record, reaccionando, best moments, nueva skin, nueva arma, actualizacion, como mejorar, como ganar, trucos, tips, consejos, fails, si me rio, gameplay, español, terror",25,https://i.ytimg.com/vi/hl1r5086CTc/hqdefault.jpg,es,es,False,6323,PT1H45M23S,hd,False,True,False,False,348167,18179,826
BpYeU6R11II,UY,2026-05-10T04:32:00.375027+00:00,2026-05-09T10:00:17Z,Santiago Chalar - Sus Mejores Temas,Santiago Chalar - Sus Mejores Temas,Folklore,UCVRmPvCBx1k9OGfr1xH1gag,10,Music,"musica popular uruguaya, zitarrosa en vivo, musica popular, folklore, folklore uruguayo, uruguay folklore, folclore, santiago chalar oficial, santiago chalar, santiago chalar uruguay, santiago chalar poeta, santiago chalar folklore, santiago chalar canciones, santiago chalar en vivo, santiago chalar grandes exitos, santiago chalar carlos paravis, carlos paravis, lo mejor del folklore, lo mejor del folklore uruguayo, santiago chalar sus mejores temas",20,https://i.ytimg.com/vi/BpYeU6R11II/hqdefault.jpg,es-419,es-419,False,5068,PT1H24M28S,hd,False,True,False,False,1403,36,3
8t_sJnVHMJI,UY,2026-05-10T04:32:00.375035+00:00,2026-05-09T22:15:00Z,Detectar anomalias atado da MIEDO | The Floor Above (cap 1 y 2),Detectar anomalias atado da MIEDO | The Floor Above (cap 1 y 2),RobleisJAJA,UCn5HFCxKie3MuaQVy2V6N4w,20,Gaming,"robleis, robleisiutu, risa, funny, top, videos graciosos, recopilacion, clips, reaccion, juego, mejores momentos, record, reaccionando, best moments, mejor partida, mejor jugador, kills, nueva arma, actualizacion, como mejorar, como ganar, trucos, tips, consejos, fails, nueva skin, robleisjaja, csgo, counter strike, cs, cuchillo, abriendo cajas, cs español, argentino, inferno, mirage, dust 2, granada, smoke, trick, highlight, funny moments, risas, wtf, sheriff, global, momentos divertidos",47,https://i.ytimg.com/vi/8t_sJnVHMJI/hqdefault.jpg,es,es-419,False,3508,PT58M28S,hd,False,True,False,False,32374,2883,104
5CE8iTuX_2U,UY,2026-05-10T04:32:00.375044+00:00,2026-04-09T18:22:47Z,Medellin,Medellin,Luxxie - Topic,UCnDPNgyl5JcWIA3_9DYnRhg,10,Music,"Luxxie, Medellin",2,https://i.ytimg.com/vi/5CE8iTuX_2U/hqdefault.jpg,en,es,False,139,PT2M19S,hd,False,True,False,False,386347,4937,0
zmbDg64qPYs,UY,2026-05-10T04:32:00.375051+00:00,2026-05-09T15:07:55Z,Escapamos de la PRISIÓN de BARRY BAJO EL AGUA en Roblox con el TEAM BEBÉS,Escapamos de la PRISIÓN de BARRY BAJO EL AGUA en Roblox con el TEAM BEBÉS,Lyna,UC-cnbLlplnXA4oc7rR21qzg,20,Gaming,,0,https://i.ytimg.com/vi/zmbDg64qPYs/hqdefault.jpg,es-419,es-419,False,3120,PT52M,hd,False,True,False,False,337509,7116,361
-rkjE0xc730,UY,2026-05-10T04:32:00.375059+00:00,2026-05-07T16:00:06Z,Harry Styles - Dance No More (Official Video),Harry Styles - Dance No More (Official Video),HarryStylesVEVO,UCbOCbp5gXL8jigIBZLqMPrw,10,Music,"Harry styles, dance no more official video, dance no more, dance no more music video, djs dont dance no more, respect your mother, get your feet wet, we wanna dance with all our friends, short shorts, harry styles short shorts, harry styles live, harry styles music video, harry styles we belong together, american girls, together together, harry styles together together, harry styles lyrics, harry styles new music video, harry styles tour, harry styles music",20,https://i.ytimg.com/vi/-rkjE0xc730/hqdefault.jpg,en,en,False,201,PT3M21S,hd,False,True,False,False,2928297,216818,9665
ZUKkVvRhEls,UY,2026-05-10T04:32:00.375067+00:00,2026-05-09T17:21:43Z,"Descanso de Minecraft, para ser FONTANERO 20 minutos (MUY DURO) 🪠","Descanso de Minecraft, para ser FONTANERO 20 minutos (MUY DURO) 🪠",Auron,UCFR2oaNj02WnXkOgLH0iqOA,20,Gaming,"Auron, AuronPlay",2,https://i.ytimg.com/vi/ZUKkVvRhEls/hqdefault.jpg,es-ES,es,False,1362,PT22M42S,hd,False,True,False,False,129984,8033,313
l3QksZ68hYw,UY,2026-05-10T04:32:00.375074+00:00,2026-05-05T11:30:48Z,The Killers - Mr. Brightside (Lyrics),The Killers - Mr. Brightside (Lyrics),Unique Sound,UCh1coBqMQvaFYYqJxSuZtKQ,10,Music,"The Killers, Mr. Brightside, The Killers Mr. Brightside, Mr. Brightside The Killers, Lyrics, Lyrics Mr. Brightside, The Killers Mr. Brightside Lyrics, Mr. Brightside The Killers Lyrics, The Killers Lyrics, Mr. Brightside Lyrics The Killers, Lyrics The Killers Mr. Brightside, Lyrics Mr. Brightside The Killers, Mr. Brightside By The Killers, rock music, rock, Jealousy Turning saints into the sea, Turning saints into the sea, Swimming through sick lullabies, tiktok song, tiktok",20,https://i.ytimg.com/vi/l3QksZ68hYw/hqdefault.jpg,en,en,False,222,PT3M42S,hd,False,True,False,False,3350599,9215,85
VunWMWfFlWc,UY,2026-05-10T04:32:00.375082+00:00,2026-05-09T14:00:49Z,ME HACKEAN EL ORDENADOR,ME HACKEAN EL ORDENADOR,Iker Unzu,UCQW8tWGYajwUv6jdQ2kmsRw,20,Gaming,"iker unzu, iker tiktok, iker unzu tiktok, iker, comedia, sketches de comedia, iker comedia, Kinitopet, Hacker, Hackeado, Ordenador, Kinito, Rosa",13,https://i.ytimg.com/vi/VunWMWfFlWc/hqdefault.jpg,es,es,False,2266,PT37M46S,hd,False,True,False,False,394892,21361,2553
PML0A0_y4XE,UY,2026-05-10T04:32:00.375089+00:00,2026-05-07T23:00:06Z,"Marama, Valentino Merlo - No Me Pidas Perdón (Video Oficial)","Marama, Valentino Merlo - No Me Pidas Perdón (Video Oficial)",Marama MusicaOficial,UCt8mPKmWX3wRi1Kemu7aSuA,10,Music,"marama, valentino merlo, valentino merlo 2026, marama 2026, max carra, cumbia, roze, tiago pzk, musica argentina, musica uruguay, cumbias, previa, cachengue, nueva musica, nuevas canciones",15,https://i.ytimg.com/vi/PML0A0_y4XE/hqdefault.jpg,es,es,False,137,PT2M17S,hd,False,True,False,False,152468,3135,187
ZAMDGF-Wcy4,UY,2026-05-10T04:32:00.375097+00:00,2026-05-09T18:00:06Z,The Strongest Battlegrounds COSMIC GAROU Update Trailer (OFFICIAL),The Strongest Battlegrounds COSMIC GAROU Update Trailer (OFFICIAL),STUD,UCGa_1uanLCDTDdQun1NhrLg,20,Gaming,,0,https://i.ytimg.com/vi/ZAMDGF-Wcy4/hqdefault.jpg,en,zxx,False,221,PT3M41S,hd,False,True,False,False,999350,91124,28135
F0UIsSnotlA,UY,2026-05-10T04:32:00.375105+00:00,2026-05-08T15:00:02Z,"HAN ""back to life"" | [Stray Kids : SKZ-PLAYER]","HAN ""back to life"" | [Stray Kids : SKZ-PLAYER]",Stray Kids,UC9rMiEjNaCSsebs31MRDCRA,10,Music,"Stray Kids, 스트레이 키즈, SKZ, 방찬, BANG CHAN, 리노, 이민호, LEE KNOW, LEEMINHO, 창빈, 서창빈, CHANGBIN, SEOCHANGBIN, 현진, 황현진, HYUNJIN, HWANGHYUNJIN, 한, 지성, 한지성, HAN, JISUNG, HANJISUNG, 필릭스, FELIX, 승민, 김승민, SEUNGMIN, KIMSEUNGMIN, 아이엔, 양정인, 정인, I.N, JEONGIN, SKZ PLAYER, 슼즈 플레이어, 슼즈 플레이어 한, han skz player, 한 back to life, han back to life, 한 작사, 한 작곡, 스키즈 한 슼즈 플레이어, stray kids skz-player, skz han back to life, stray kids han back to life, back to life skz-player, back to life, 스키즈 한 작사, 스키즈 한 작곡, 스트레이 키즈 한 back to life",51,https://i.ytimg.com/vi/F0UIsSnotlA/hqdefault.jpg,en,ko,False,260,PT4M20S,hd,True,True,False,False,1718693,386521,32764
jb6e7dEG9XU,UY,2026-05-10T04:32:00.375114+00:00,2026-05-09T21:27:16Z,abri mi propio negocio de milanesas 💵,abri mi propio negocio de milanesas 💵,gertwo,UCOpowlhP7lcG7850cwBxPqA,20,Gaming,"Unicornio, Uni, GerTwo, Gameplay, Videojuegos, Juegos, Latinoamerica, Argentina, Gaming, gertwo, unicornio juegos, unicornio fer, fer, gertwo fer, uni, streaming",16,https://i.ytimg.com/vi/jb6e7dEG9XU/hqdefault.jpg,es,,False,1465,PT24M25S,hd,False,True,False,False,21213,2724,140
rTMXcuxLYQk,UY,2026-05-10T04:32:00.375125+00:00,2026-05-07T23:00:06Z,Celeste - Joaquín Da Rosa (Video Oficial),Celeste - Joaquín Da Rosa (Video Oficial),Joaquín Da Rosa,UC87l5LJ95fCT1b0IzxBdWvw,10,Music,,0,https://i.ytimg.com/vi/rTMXcuxLYQk/hqdefault.jpg,es,es,False,270,PT4M30S,hd,False,True,False,False,13367,1995,424
Cp7gVEKP3-U,UY,2026-05-10T04:32:00.375136+00:00,2026-05-09T13:00:21Z,el mejor juego de Backrooms de la historia.,el mejor juego de Backrooms de la historia.,rickyedit,UCVUhIjFt6RaMYpjjEseoDaA,20,Gaming,"rickyedit, ricky, edit, ricky edit, miedo, backroom, liminal space, liminales, poolrooms, terror, perdido, lugares subterráneos, poolroom, backrooms, extraño, raro, susto, subterráneo, ayuda, escapar, salir, vuelve, vuelta, kane, kanepixels, pixels, back rooms, found, footage, found footage, foundfootage, realista, realidad, verdad, juego, gameplay, mejor, mejores",38,https://i.ytimg.com/vi/Cp7gVEKP3-U/hqdefault.jpg,es,es,False,4875,PT1H21M15S,hd,False,True,False,False,191652,12677,439
OT5XTZxnfg8,UY,2026-05-10T04:32:00.375144+00:00,2026-05-07T22:30:06Z,"Ovi, Almighty - Cash (Official Video)","Ovi, Almighty - Cash (Official Video)",OVI,UCqqq4Od3nzapadz6QCNZsFw,10,Music,"Ovi, almighty, cash, ovi cash, almighty cash, latin trap, los rockstar, los rockstar no van al cielo, trap music",9,https://i.ytimg.com/vi/OT5XTZxnfg8/hqdefault.jpg,es,es-419,False,176,PT2M56S,hd,False,False,False,False,415181,31617,2192
6Mg09t-gDtQ,UY,2026-05-10T04:32:00.375152+00:00,2026-05-09T23:16:37Z,Ejército MILITAR NOOB vs PRO en Minecraft,Ejército MILITAR NOOB vs PRO en Minecraft,Awita,UC62nFXtc3KNujp9LCPJt-sA,20,Gaming,,0,https://i.ytimg.com/vi/6Mg09t-gDtQ/hqdefault.jpg,es,es-419,False,2244,PT37M24S,hd,False,True,False,False,120169,3460,327
A4LrMyHzOaI,UY,2026-05-10T04:32:00.375158+00:00,2026-05-07T23:00:06Z,EL TECLA (EnLaPeraSessions 71),EL TECLA (EnLaPeraSessions 71),LaPeraProducciones,UCNpmp54ojTIMb6h1wb6bU_Q,10,Music,,0,https://i.ytimg.com/vi/A4LrMyHzOaI/hqdefault.jpg,es,es,False,561,PT9M21S,hd,False,True,False,False,9433,399,66
uIwyHB51M6o,UY,2026-05-10T04:32:00.375166+00:00,2026-05-08T16:00:13Z,COCINANDO PARA ANIMALES TURBIOS (Creature Kitchen),COCINANDO PARA ANIMALES TURBIOS (Creature Kitchen),Rubius Z,UCcjIvuxmWlS5IEQ0JdPV4Ng,20,Gaming,"elrubius, rubius, Creature Kitchen, terror, horror, rubius juega, criatura, cocina, simulador de cocina, cocina de terror, cocinar, animales, rata, cocina para los animales, Juego Completo, nuevo, 2026, receta, CREATURE KITCHEN, gameplay",20,https://i.ytimg.com/vi/uIwyHB51M6o/hqdefault.jpg,es,es,False,6129,PT1H42M9S,hd,False,True,False,False,1006411,50187,1171
soXytqAoSJA,UY,2026-05-10T04:32:00.375174+00:00,2026-05-01T22:01:01Z,Louis BPM  - MJ (Oficial Video),Louis BPM  - MJ (Oficial Video),Louis BPM,UCqHMVAE6BJ0WSY1oRJuTrgw,10,Music,,0,https://i.ytimg.com/vi/soXytqAoSJA/hqdefault.jpg,es,es,False,139,PT2M19S,hd,False,True,False,False,1121046,36802,1840
RfO1VdzAmNs,UY,2026-05-10T04:32:00.375181+00:00,2026-05-09T23:00:34Z,tengo wacha en tomodachi life 😘,tengo wacha en tomodachi life 😘,Carrerita,UCCy8Y1HSoEnlHHzPvfFr3Gg,20,Gaming,"Carreraaa, Discord, Imitando voces, Haceme reir, TikTok, Carrerita, Juegos, Videojuegos, Gracioso, Gameplay, carrerita, juegos, gameplays, videojuegos, Gameplays, Carre, Carre Four, Rodrigo carrera, Carrera juegos, Carrera segundo canal, Terror, Variety, Variedad",23,https://i.ytimg.com/vi/RfO1VdzAmNs/hqdefault.jpg,es-419,es-419,False,2142,PT35M42S,hd,False,True,False,False,38333,4569,200
VnNfLTg-tx4,UY,2026-05-10T04:32:00.375189+00:00,2026-05-07T00:00:36Z,"Sebastián Yatra, Augusto Alonso - Lo Que Me Pasa Con Vos","Sebastián Yatra, Augusto Alonso - Lo Que Me Pasa Con Vos",SebastianYatraVEVO,UC3Df9-SvQY9BbfCmyvR0J5A,10,Music,"Sebastian Yatra, lo que me pasa con vos, Jay Kabalan, CUCARACHEO, lo que me pasa con vos letra, Xavi, Lucho Rk, Belinda, Gente de Zona, yatra, sebas, Canción Para Regresar, los domingos, Energía Bacana, vagabundo, Akureyri, nueva cancion yatra, manuel turizo, beele, lanzamiento yatra, tacones rojos, aitana yatra, las dudas, chica ideal, la bachata turizo, el merengue turizo, una noche sin pensar, una noche sin pensar letra, guaro beele, dos orguitas sebastian yatra",30,https://i.ytimg.com/vi/VnNfLTg-tx4/hqdefault.jpg,es,es,False,321,PT5M21S,hd,True,True,False,False,547521,42489,1678
z87Un_SGQ1g,UY,2026-05-10T04:32:00.375197+00:00,2026-05-08T23:00:06Z,LE CAMBIAMOS EL NOMBRE EN FREE FIRE AL QUE SE HAGA MENOS KILLS !! - TheDonato,LE CAMBIAMOS EL NOMBRE EN FREE FIRE AL QUE SE HAGA MENOS KILLS !! - TheDonato,TheDonato,UCaHEdZtk6k7SVP-umnzifmQ,20,Gaming,,0,https://i.ytimg.com/vi/z87Un_SGQ1g/hqdefault.jpg,es,es,False,2140,PT35M40S,hd,False,True,False,False,913059,29532,685
aX6nej9PCvE,UY,2026-05-10T04:32:00.375205+00:00,2026-04-30T00:04:50Z,Color café,Color café,Valen - Topic,UCprgkf7w0_Hlnqw1TZ1kUag,10,Music,"Valen, Color café",2,https://i.ytimg.com/vi/aX6nej9PCvE/hqdefault.jpg,es,es,False,160,PT2M40S,hd,False,True,False,False,208028,3127,42
F09xtszDzl4,UY,2026-05-10T04:32:00.375212+00:00,2026-05-09T21:45:59Z,🌓2🌓ADMIN🌓ABUSE🌓DIRECTO🌓LARGO🌓RIVALS🌓ROBLOX🌓,🌓2🌓ADMIN🌓ABUSE🌓DIRECTO🌓LARGO🌓RIVALS🌓ROBLOX🌓,ElAbrahaham,UColTsB6zogXWooPbeO67Wgw,24,Entertainment,,0,https://i.ytimg.com/vi/F09xtszDzl4/hqdefault.jpg,es-MX,es-419,False,17683,PT4H54M43S,hd,False,True,False,False,937240,47538,326
D_WllqC_kVA,UY,2026-05-10T04:32:00.375220+00:00,2026-05-07T13:57:07Z,NACHO ESTRELLA X JEY ONE X ALOFOKE MUSIC X DIANA LA MISS - HIJA DE LA NOCHE,NACHO ESTRELLA X JEY ONE X ALOFOKE MUSIC X DIANA LA MISS - HIJA DE LA NOCHE,AlofokeMusicSounds,UCeDlzhpU8NZAlL1rsXp54zQ,10,Music,"Bad Bunny, Dembow, Reggaeton, Karol G, Anuel AA, Trap, Rap, Salsa, Merengue, Feid, Santiago Matias, W Sound, Rochy RD, Yailin La Mas Viral, El Alfa, Bulin 47, Romeo Santos, Anthony Santos",18,https://i.ytimg.com/vi/D_WllqC_kVA/hqdefault.jpg,es,es,False,135,PT2M15S,hd,False,True,False,False,2181624,190454,13186
4N8xIioKOnY,UY,2026-05-10T04:32:00.375227+00:00,2026-05-09T22:00:04Z,LA FINAL contra URUGUAY | Clubes Pro,LA FINAL contra URUGUAY | Clubes Pro,TOP GLOBALES OFICIAL,UC45QU5Mf0DrHD5lfWs1KlLQ,22,People & Blogs,,0,https://i.ytimg.com/vi/4N8xIioKOnY/hqdefault.jpg,es,es,False,1591,PT26M31S,hd,False,False,False,False,21002,926,57
WL4oxoOYaDQ,UY,2026-05-10T04:32:00.375234+00:00,2026-05-05T16:00:06Z,Lucky Brown & Jere Klein - BELLA (Letra),Lucky Brown & Jere Klein - BELLA (Letra),Urban Fest,UCS25MMDne281toshu5HEX6A,22,People & Blogs,"Urban Fest, Letra, lyrics, reggaetón, reggaeton, urbano, urban, latin, latino, dembow, Lucky Brown, Jere Klein, BELLA (Letra), BELLA, Lucky Brown & Jere Klein - BELLA, Lucky Brown & Jere Klein - BELLA (Letra)",16,https://i.ytimg.com/vi/WL4oxoOYaDQ/hqdefault.jpg,es,es-419,False,131,PT2M11S,hd,False,True,False,False,278473,446,5
UmBviCve3JM,UY,2026-05-10T04:32:00.375242+00:00,2026-05-09T19:55:10Z,MKOI vs KC | LA BATALLA DEFINITIVA | JUGAMOS SHOWMATCH | G2 vs GX | #WatchLEC,MKOI vs KC | LA BATALLA DEFINITIVA | JUGAMOS SHOWMATCH | G2 vs GX | #WatchLEC,IbaiExtra,UCCJM7yZCchfal6rjkdLYymw,20,Gaming,"ibai directos, ibai kings league, kings league, ibai vods, ibai vod, ibai directo entero, ibai directo, directos enteros, ibai completo, ibai directo completo, ibai canal directos, canal directos, ibai reaccion, ibai reaccionando, ibai si te ries pierdes, ibai twitch, lvp, lvpes, koi, mkoi, mkoi vs g2, mkoi vs kc",22,https://i.ytimg.com/vi/UmBviCve3JM/hqdefault.jpg,ca,es-ES,False,32262,PT8H57M42S,hd,False,True,False,False,290563,4495,16
WYDC6zW17p4,UY,2026-05-10T04:32:00.375250+00:00,2026-05-04T16:00:06Z,Wisin - Escápate Conmigo ft. Ozuna (Letra),Wisin - Escápate Conmigo ft. Ozuna (Letra),Latin Pop,UCyrNLS9FCXTMeOg_cj8sa-g,22,People & Blogs,"Latin Pop, Letra, lyrics, LatinPop, pop latino, baladas pop, pop romántico, éxitos latinos, pop en español, pop viral, música pop juvenil, himnos pop, LatinFlow, Wisin - Escápate Conmigo ft. Ozuna (Letra), Escápate Conmigo ft. Ozuna (Letra), Wisin, Wisin - Escápate Conmigo ft. Ozuna, Wisin - Escápate Conmigo",18,https://i.ytimg.com/vi/WYDC6zW17p4/hqdefault.jpg,es,es-419,False,228,PT3M48S,hd,False,False,False,False,653586,672,3
