video_id,country,fetched_at,published_at,title,localized_title,channel_title,channel_id,category_id,category_name,tags,tag_count,thumbnail,default_language,audio_language,is_live,duration,duration_raw,definition,caption_available,licensed_content,embeddable,made_for_kids,views,likes,comments
VjA_6UmVFFY,UY,2026-05-19T04:43:02.340923+00:00,2026-05-15T16:20:13Z,Medellin,Medellin,1717177x - Topic,UCJv7renpM8ShJehrKVvDFAQ,10,Music,"1717177x, Medellin",2,https://i.ytimg.com/vi/VjA_6UmVFFY/hqdefault.jpg,en,es,False,139,PT2M19S,hd,False,True,False,False,201762,1804,0
Ks_VD4xy8ow,UY,2026-05-19T04:43:02.340946+00:00,2026-05-17T17:32:48Z,The Boys Season 5 Episode 8 Series Finale Trailer,The Boys Season 5 Episode 8 Series Finale Trailer,Rotten Tomatoes TV,UCz1GPotHecuLngiLuY739QQ,1,Film & Animation,"The Boys, The Boys Trailer, The Boys Season 5 Episode 8 Trailer, The Boys S05 E08 Trailer, The Boys Season 5 episode 8 TV Trailer, The Boys Season 5 Episode 8 Trailer 2026, The Boys Season 5 Episode 8 Official Trailer, Trailer, TV Trailer, 2026 Trailers, 2026 TV Trailers, The Boys Series Finale, The Boys Season 5 Prime Video, Prime Video, Entertainment, TV Series, Karl Urban, Jack Quaid, Antony Starr",19,https://i.ytimg.com/vi/Ks_VD4xy8ow/hqdefault.jpg,en,en,False,46,PT46S,hd,False,True,False,False,1619538,40592,4518
iMydqVkmyRM,UY,2026-05-19T04:43:02.340958+00:00,2026-05-18T18:28:16Z,Nuestra CASA se INUNDA en Brookhaven Roblox,Nuestra CASA se INUNDA en Brookhaven Roblox,Lyna,UC-cnbLlplnXA4oc7rR21qzg,20,Gaming,,0,https://i.ytimg.com/vi/iMydqVkmyRM/hqdefault.jpg,es-419,es-419,False,909,PT15M9S,hd,False,True,False,False,409137,5293,491
T5jcLOog0B0,UY,2026-05-19T04:43:02.340967+00:00,2026-05-16T03:31:23Z,Es Contigo (feat. Martín Piña),Es Contigo (feat. Martín Piña),La Misma Cuadra - Topic,UCI_B9ORCmZv5VIBDDETY7cg,10,Music,"La Misma Cuadra, Martín Piña, Santiago Perera, Federico Von Rappard, Lucas Bunnker, Es Contigo (feat. Martín Piña)",6,https://i.ytimg.com/vi/T5jcLOog0B0/hqdefault.jpg,es,es,False,181,PT3M1S,hd,False,True,False,False,6595,138,2
w2z7BgeAFbM,UY,2026-05-19T04:43:02.340975+00:00,2026-05-15T18:32:00Z,IlloJuan Reacciona al LEAK de Best Buy sobre GTA 6 y al Trailer 3 el 18 de mayo,IlloJuan Reacciona al LEAK de Best Buy sobre GTA 6 y al Trailer 3 el 18 de mayo,IlloReacts,UCGCEcvPd1zbpjr00GXZuj9A,22,People & Blogs,"illojuan, mejores momentos illojuan, clips illojuan, illojuan clips, twitch illojuan, illojuan directo, lmdshow, ldmshow, mejores momentos de illojuan, GTA 6, GTA VI, illoJuan GTA 6, illoJuan GTA VI, Trailer 3 de GTA 6, gta 6 best buy, best buy gta 6",16,https://i.ytimg.com/vi/w2z7BgeAFbM/hqdefault.jpg,es,,False,605,PT10M5S,hd,False,True,False,False,127523,3391,152
FyeEw1HP7fw,UY,2026-05-19T04:43:02.340983+00:00,2026-05-18T20:52:42Z,LO APUESTO TODO!! (lo pierdo todo),LO APUESTO TODO!! (lo pierdo todo),JuegaGerman,UCYiGq8XF7YQD00x7wAd62Zg,20,Gaming,"juegagerman, juega, german, holasoygerman, hola soy german, juega german, scritchy scratchy, parte 2",8,https://i.ytimg.com/vi/FyeEw1HP7fw/hqdefault.jpg,es-419,es-419,False,2947,PT49M7S,hd,False,True,False,False,288444,21099,1321
UGn5WGGnbPs,UY,2026-05-19T04:43:02.340991+00:00,2026-05-12T13:55:06Z,Romeo Santos - Amigo (Letra),Romeo Santos - Amigo (Letra),Echo Lyrics,UCPB4Efzj00pZJyGwV_jebkg,10,Music,,0,https://i.ytimg.com/vi/UGn5WGGnbPs/hqdefault.jpg,es,es,False,232,PT3M52S,hd,False,True,False,False,1347333,926,8
-F8cWRoxtRg,UY,2026-05-19T04:43:02.340998+00:00,2026-05-13T18:42:17Z,RUBIUS HABLA sobre el TRAILER 3 de GTA VI,RUBIUS HABLA sobre el TRAILER 3 de GTA VI,IlloLuis,UCTN6Uc1s0bSsWNOd2P10DtQ,22,People & Blogs,,0,https://i.ytimg.com/vi/-F8cWRoxtRg/hqdefault.jpg,es,es,False,1086,PT18M6S,hd,False,False,False,False,124115,2684,375
5DDicKLtx80,UY,2026-05-19T04:43:02.341006+00:00,2026-05-18T14:53:35Z,EL FUT DRAFT BLOQUEADO,EL FUT DRAFT BLOQUEADO,Robertinho,UCuvObJtOqP_WMImIlNt6uXw,20,Gaming,"EA FC 26, FUT DRAFT BLOQUEADO, FUT DRAFT FC26",3,https://i.ytimg.com/vi/5DDicKLtx80/hqdefault.jpg,es,es,False,1896,PT31M36S,hd,False,True,False,False,270325,12810,188
jgCDDwcrhF4,UY,2026-05-19T04:43:02.341013+00:00,2026-05-13T19:00:40Z,"Quizás - Rich Music, Sech, Dalex ft. Justin Quiles, Wisin, Zion, Lenny Tavárez, Feid (Letra)","Quizás - Rich Music, Sech, Dalex ft. Justin Quiles, Wisin, Zion, Lenny Tavárez, Feid (Letra)",MexSun,UCOQnav8WY9RGkL0Iz4U3-Lw,22,People & Blogs,"mexsun, regional mexicano, música regional mexicana, corridos tumbados",4,https://i.ytimg.com/vi/jgCDDwcrhF4/hqdefault.jpg,es,es,False,217,PT3M37S,hd,False,True,False,False,142328,111,2
eA6DKdr6WDo,UY,2026-05-19T04:43:02.341021+00:00,2026-05-14T23:48:06Z,Rubius REACCIONA y OPINA de la FILTRACION de las RESERVAS y POSIBLE TRAILER 3 de GTA 6 🤯,Rubius REACCIONA y OPINA de la FILTRACION de las RESERVAS y POSIBLE TRAILER 3 de GTA 6 🤯,RubiUwU,UC1OJEBF3z2klYcmTyrAGHlQ,24,Entertainment,"RUBIUS, rubius, Rubius REACCIONA y OPINA, Rubius REACCIONA, gta 6, FILTRACION de las RESERVAS, Rubius REACCIONA y OPINA de la FILTRACION de las RESERVAS y POSIBLE, REACCIONA",8,https://i.ytimg.com/vi/eA6DKdr6WDo/hqdefault.jpg,es,es,False,523,PT8M43S,hd,False,False,False,False,114791,2237,102
ZK0bZ3XNsAY,UY,2026-05-19T04:43:02.341028+00:00,2026-05-18T20:27:31Z,Atrapados en Un Bloque de GÓLEMS en Minecraft...,Atrapados en Un Bloque de GÓLEMS en Minecraft...,Nacho,UC8EkcHOycB94lHDkbAPSnQA,20,Gaming,"nacho, dagar, nacho minecraft, dagar y nacho, nacho y dagar, minecraft, minecraft mod, trucos minecraft, dagar minecraft, amigos minecraft, lia, lia minecraft, nacho y lia, golem, golem minecraft, craftear golem, craftear golem minecraft, golem de diamante, golem de hierro, un bloque, un bloque minecraft, golem un bloque, golem de rubi, golem en minecraft",24,https://i.ytimg.com/vi/ZK0bZ3XNsAY/hqdefault.jpg,es,es,False,1300,PT21M40S,hd,False,True,False,False,463401,6675,438
zGKhwZEpjHA,UY,2026-05-19T04:43:02.341036+00:00,2026-05-18T12:40:59Z,AIRBAG - Reptiles - Video Lyric,AIRBAG - Reptiles - Video Lyric,AIRBAG,UCq37zn7UdJeWySuiihjdi5Q,10,Music,"airbag, sardelli, gaston, guido, patricio, rock, pop, music, banda argentina, mentira la verdad, el club de la pelea, argentina, river, al parecer todo ha sido una trampa, apthsut, mlv, voragine, libertad, hermanos, reptiles, lyric, letra",22,https://i.ytimg.com/vi/zGKhwZEpjHA/hqdefault.jpg,es,es,False,195,PT3M15S,hd,False,True,False,False,103328,11271,1462
owdfsmrGGk8,UY,2026-05-19T04:43:02.341043+00:00,2026-05-12T13:18:39Z,ILLOJUAN REACCIONA a la TEORÍA de que el TRAILER 3 de GTA 6 sale HOY (12 de MAYO),ILLOJUAN REACCIONA a la TEORÍA de que el TRAILER 3 de GTA 6 sale HOY (12 de MAYO),Illoresumen (FAN),UCZ2iCDI1CuEVDXgQ-VVilvg,20,Gaming,"gta 6, illojuan gta 6 leaks, illojuan reacciona, illojuan reaccion, illojuan reacciona a, illojuan, illojuan mejores momentos, mejores momentos illojuan, illojuan gta 6, leaks gta 6 illojuan, gta vi illojuan, gta 6 illojuan, illojuan gta vi, illojuan gameplay gta 6, lmdshow, gta vi, gta 6 fecha",17,https://i.ytimg.com/vi/owdfsmrGGk8/hqdefault.jpg,es-ES,es-ES,False,948,PT15M48S,hd,False,True,False,False,144094,3932,360
549D6v_b0ZU,UY,2026-05-19T04:43:02.341050+00:00,2026-05-18T13:19:14Z,EL MOD MÁS ABSURDO DE DARK SOULS YA ESTÁ COMPLETO 🍐 - MEME SOULS 1.0 #1,EL MOD MÁS ABSURDO DE DARK SOULS YA ESTÁ COMPLETO 🍐 - MEME SOULS 1.0 #1,IlloJuan,UCKvoBRFqMNqvuSvFBiNadgw,20,Gaming,"illojuan, mejores momentos illojuan, clips illojuan, illojuan clips, twitch illojuan, illojuan directo, lmdshow, ldmshow, mejores momentos de illojuan",9,https://i.ytimg.com/vi/549D6v_b0ZU/hqdefault.jpg,es,es,False,18658,PT5H10M58S,hd,False,True,False,False,229576,12230,376
E1_tX5kdAFU,UY,2026-05-19T04:43:02.341058+00:00,2026-05-14T23:03:38Z,La Quiero a Ella Vol.2,La Quiero a Ella Vol.2,Hernan y La Champion's Liga - Topic,UCqQqRhMmsPXutPpHCtpYHqQ,10,Music,"Hernan y La Champion´s Liga, ECKO, Valen, La Quiero a Ella Vol.2",4,https://i.ytimg.com/vi/E1_tX5kdAFU/hqdefault.jpg,es,,False,193,PT3M13S,hd,False,True,False,False,84579,1554,12
1ymnCXU6iyA,UY,2026-05-19T04:43:02.341065+00:00,2026-05-12T17:00:03Z,Devil Dinosaur: Prehistoric Powerhouse | Character Reveal Trailer | Marvel Rivals,Devil Dinosaur: Prehistoric Powerhouse | Character Reveal Trailer | Marvel Rivals,Marvel Rivals,UCWzmOSSiSPbVnVu3ZAyDx2w,20,Gaming,"Marvel, Marvel Rivals, Rivals, Hero Shooter, Devil Dinosaur, Devil Dino, Season 8, Marvel Games",8,https://i.ytimg.com/vi/1ymnCXU6iyA/hqdefault.jpg,en,en,False,82,PT1M22S,hd,False,False,False,False,3933708,67023,5477
Xd3o3JnM_-I,UY,2026-05-19T04:43:02.341072+00:00,2026-05-18T23:15:06Z,Construyendo Mi Base | Subnautica 2 #2,Construyendo Mi Base | Subnautica 2 #2,RobleisJAJA,UCn5HFCxKie3MuaQVy2V6N4w,20,Gaming,"robleis, robleisiutu, risa, funny, top, videos graciosos, recopilacion, clips, reaccion, juego, mejores momentos, record, reaccionando, best moments, mejor partida, mejor jugador, kills, nueva arma, actualizacion, como mejorar, como ganar, trucos, tips, consejos, fails, nueva skin, robleisjaja, csgo, counter strike, cs, cuchillo, abriendo cajas, cs español, argentino, inferno, mirage, dust 2, granada, smoke, trick, highlight, funny moments, risas, wtf, sheriff, global, momentos divertidos",47,https://i.ytimg.com/vi/Xd3o3JnM_-I/hqdefault.jpg,es,es-419,False,4670,PT1H17M50S,hd,False,True,False,False,33446,2563,153
cS1lcrF_dHI,UY,2026-05-19T04:43:02.341081+00:00,2026-05-18T21:00:06Z,LUCHO SSJ - TRAP PARA TRAPEROS (Videoclip Oficial),LUCHO SSJ - TRAP PARA TRAPEROS (Videoclip Oficial),Lucho SSJ,UCnynz8Mt4hEYw-ubCTD694Q,10,Music,"lucho ssj, luchito ssj, lucho sj, luchossj, luchosj, luchitosj, luchosjj, lucho sjj",8,https://i.ytimg.com/vi/cS1lcrF_dHI/hqdefault.jpg,es,es,False,142,PT2M22S,hd,True,False,False,False,31225,4722,276
f_bKjZeJBBI,UY,2026-05-19T04:43:02.341088+00:00,2026-05-05T04:10:02Z,The Odyssey | Official New Trailer,The Odyssey | Official New Trailer,Universal Pictures,UCq0OueAsdxH6b8nyAspwViw,24,Entertainment,,0,https://i.ytimg.com/vi/f_bKjZeJBBI/hqdefault.jpg,en-US,en-US,False,152,PT2M32S,hd,True,True,False,False,22480433,314125,24444
IXBlw385lmc,UY,2026-05-19T04:43:02.341096+00:00,2026-05-18T21:03:13Z,Si MINAS Tus CORAZONES se MULTIPLICAN en Minecraft,Si MINAS Tus CORAZONES se MULTIPLICAN en Minecraft,Awita,UC62nFXtc3KNujp9LCPJt-sA,20,Gaming,,0,https://i.ytimg.com/vi/IXBlw385lmc/hqdefault.jpg,es,es-419,False,1835,PT30M35S,hd,False,True,False,False,195077,3969,342
72t1avflqs4,UY,2026-05-19T04:43:02.341102+00:00,2026-05-15T23:10:53Z,Soltera Soltinha,Soltera Soltinha,Soy tu Sol - Topic,UCieOMe8ZQeLhK2Vhdz5XQbg,10,Music,"Soy tu Sol, fabricio, fabricio rodriguez, Soltera Soltinha",4,https://i.ytimg.com/vi/72t1avflqs4/hqdefault.jpg,es,,False,129,PT2M9S,hd,False,True,False,False,15450,334,10
SJPu1spHqfk,UY,2026-05-19T04:43:02.341109+00:00,2026-04-30T12:59:32Z,RESIDENT EVIL – Official Teaser Trailer (4K),RESIDENT EVIL – Official Teaser Trailer (4K),Sony Pictures Entertainment,UCz97F7dMxBNOfGYu3rx8aCw,24,Entertainment,,0,https://i.ytimg.com/vi/SJPu1spHqfk/hqdefault.jpg,en,en,False,114,PT1M54S,hd,True,True,False,False,4225223,171153,18551
bU-A23R8zjM,UY,2026-05-19T04:43:02.341133+00:00,2026-05-17T11:45:03Z,CUMBIA MIX 2026 🌴🔥 Enganchado by Fer Palacio 🎶,CUMBIA MIX 2026 🌴🔥 Enganchado by Fer Palacio 🎶,Party Latino Mix,UC0_Lh2cnuZAmyLXuFKXSM7w,22,People & Blogs,"fer palacio, fer palacios, no ferpa no party remix, remix, fer palacio remix, previa y cachengue, mix, cumbia, cachengue, reggaeton, #djremix",11,https://i.ytimg.com/vi/bU-A23R8zjM/hqdefault.jpg,en,en,False,1884,PT31M24S,hd,False,False,False,False,61471,274,2
5zgkwcWMnXQ,UY,2026-05-19T04:43:02.341140+00:00,2026-05-11T22:00:06Z,Los Auténticos Decadentes- Loco (Tu Forma De Ser) (Letra),Los Auténticos Decadentes- Loco (Tu Forma De Ser) (Letra),Lufenix,UCHiKs3Iq5rGPC-UmQtjIsvQ,10,Music,"los autenticos decadentes loco letra, los autenticos decadentes loco tu forma de ser audio, los autenticos decadentes loco tu forma de ser tiktok, los autenticos decadentes loco tu forma de ser pop",4,https://i.ytimg.com/vi/5zgkwcWMnXQ/hqdefault.jpg,es,,False,314,PT5M14S,hd,False,True,False,False,288195,481,3
5LhSNvRki2g,UY,2026-05-19T04:43:02.341148+00:00,2026-05-18T19:00:28Z,ENCONTRAMOS una CIUDAD ALIENÍGENA 👽🌊#5 | SUBNAUTICA 2,ENCONTRAMOS una CIUDAD ALIENÍGENA 👽🌊#5 | SUBNAUTICA 2,Nexxuz World,UCggHFGmLDDStxyM-uy9DYnQ,24,Entertainment,"ark, ARK, ARK SURVIVAL EVOLVED, ARK SERIE, reinos enfrentados, reinos, serie ark, extremo, supervivencia, dinosaurio depredador, dinosaurios, dinosaurios juegos, dinosaurio juego, juego dinosaurio, juegos de dinosaurios, parque dinosaurios, dinosaurios juego, dinosaurios ark, jurassic world ark, juegos dinosaurios, dinosaurios serie, dinosaurio ark, nexxuz, nexxuz world, nexxuz hd, nexxuz ark, nexus",27,https://i.ytimg.com/vi/5LhSNvRki2g/hqdefault.jpg,es,es,False,3283,PT54M43S,hd,False,True,False,False,85861,10684,303
lTpsvbk6vGk,UY,2026-05-19T04:43:02.341155+00:00,2026-05-11T13:00:01Z,"Shakira ft. Alejandro Sanz | "" La Tortura"" |  ( Letras) #lyrics #shakira #latortura #alejandrosanz","Shakira ft. Alejandro Sanz | "" La Tortura"" |  ( Letras) #lyrics #shakira #latortura #alejandrosanz",Retro Rock Clásicos,UC8hbKX_f1wqnjAWmwRu9tcQ,10,Music,"#Rock #Clasicos #Latino #Nostalgia #90´S #80´S #Exitos, #latinrock, #rocknacional",3,https://i.ytimg.com/vi/lTpsvbk6vGk/hqdefault.jpg,es,es,False,215,PT3M35S,hd,False,True,False,False,1331041,1457,3
WIaYpCdwJ-Y,UY,2026-05-19T04:43:02.341163+00:00,2026-05-17T16:18:41Z,El Reto IMPOSIBLE de Pokémon (Mi Chat vs Un Experto),El Reto IMPOSIBLE de Pokémon (Mi Chat vs Un Experto),Rubius Z,UCcjIvuxmWlS5IEQ0JdPV4Ng,20,Gaming,"elrubius, rubius, nuevo, 2026, pokemon, pokemon rubi, pokemon zafiro, ruby, shapphire, pokemon rubi omega, hoenn, folagor, locke, randomlocke, challenge, liga pokemon, deoxys, meme, funny, dualocke, epic, movie, pelicula, chepita, mama carlos, memes, tiktok, pikachu, huevos, random, nuzlocke, dificil, hardcore, reto, chat",35,https://i.ytimg.com/vi/WIaYpCdwJ-Y/hqdefault.jpg,es,es,False,5502,PT1H31M42S,hd,False,True,False,False,1187931,106532,5527
q7WzUxGdBco,UY,2026-05-19T04:43:02.341171+00:00,2026-05-15T00:00:06Z,"LIT killah, Paulo Londra, KHEA, Ramma - Si Te Vas 2.0 (Official Video)","LIT killah, Paulo Londra, KHEA, Ramma - Si Te Vas 2.0 (Official Video)",LIT killah,UCExVswmCLmkkoBkjBp3Ta9Q,10,Music,"lit killah, si te vas remix, si te vas, LIT killah, lit killah si te vas, si te vas lit killah, KHEA, paulo londra, ramma, Ramma, Paulo Londra",11,https://i.ytimg.com/vi/q7WzUxGdBco/hqdefault.jpg,es,es-419,False,260,PT4M20S,hd,False,True,False,False,2924026,224895,12440
SIx56nbr_bE,UY,2026-05-19T04:43:02.341178+00:00,2026-05-18T19:29:43Z,Juego MI PRIMER MUNDIAL en FC 26,Juego MI PRIMER MUNDIAL en FC 26,Santicap,UCHQABicKveWIgMaecq4cYUw,24,Entertainment,,0,https://i.ytimg.com/vi/SIx56nbr_bE/hqdefault.jpg,es,es,False,1318,PT21M58S,hd,False,True,False,False,2193,145,16
7sanY9UkV-Y,UY,2026-05-19T04:43:02.341185+00:00,2026-04-25T00:30:37Z,El Karnal - Tranquilo (Video Oficial),El Karnal - Tranquilo (Video Oficial),Montevideo Music Group,UCKJTZ-XqjoGz8hwwq1vz7WQ,10,Music,"Plena - Enganchado Lo Mejor de 2023, plena enganchados lo mejor de 2023, plena enganchados, enganchados, enganchados plena, plena, plena en vivo, plena 2023, engahcados plena, plena uruguaya, la nueva escuela, la deskarga, plenas en vivo, enganchados 2023 plena, El Karnal - Amarte Es Un Problema (Video Oficial), el karnal, enganchados el karnal, El Karnal - Chica Hippie (Video Oficial), chica hippie el karnal, el karnal chica hippie, el karnal tranquilo, tranquilo el karnal",22,https://i.ytimg.com/vi/7sanY9UkV-Y/hqdefault.jpg,es-419,es,False,123,PT2M3S,hd,False,True,False,False,168360,545,75
p93sMy3QpGk,UY,2026-05-19T04:43:02.341193+00:00,2026-05-18T01:00:06Z,LE CAMBIE LA CONTRASEÑA A SU CUENTA DE FREE FIRE !! BROMA a HECTORINO *termina muy mal* - TheDonato,LE CAMBIE LA CONTRASEÑA A SU CUENTA DE FREE FIRE !! BROMA a HECTORINO *termina muy mal* - TheDonato,TheDonato,UCaHEdZtk6k7SVP-umnzifmQ,20,Gaming,,0,https://i.ytimg.com/vi/p93sMy3QpGk/hqdefault.jpg,es,es,False,1772,PT29M32S,hd,False,True,False,False,795203,56650,1386
hwqHGPyljmg,UY,2026-05-19T04:43:02.341200+00:00,2026-05-16T10:01:09Z,"Lo Mejor Del FOLKLORE URUGUAYO Enganchado 🔥 Larbanois & Carrero, Pepe Guerra Y Mas!","Lo Mejor Del FOLKLORE URUGUAYO Enganchado 🔥 Larbanois & Carrero, Pepe Guerra Y Mas!",Folklore,UCVRmPvCBx1k9OGfr1xH1gag,10,Music,"grandes éxitos del folklore uruguayo los mejores temas enganchados, grandes éxitos del folklore uruguayo, éxitos del folklore uruguayo, folklore uruguayo, grandes éxitos del folklore, éxitos del folklore, folklore mejores temas, lo mejor del folklore, folklore enganchados, folklore, los olimareños, copla alta, pepe guerra, larbanois y carrero, enganchado de folklore, folclore, folklore musica, lo mejor del folklore uruguayo enganchado larbanois & carrero pepe guerra y mas",18,https://i.ytimg.com/vi/hwqHGPyljmg/hqdefault.jpg,es-419,es-419,False,5732,PT1H35M32S,hd,False,True,False,False,5154,41,9
ttquAEqNGFg,UY,2026-05-19T04:43:02.341208+00:00,2026-05-18T23:30:44Z,Reaccion a DIGITAL CIRCUS Capitulo #7 EN DIRECTO!🤡,Reaccion a DIGITAL CIRCUS Capitulo #7 EN DIRECTO!🤡,ElAbrahaham,UColTsB6zogXWooPbeO67Wgw,24,Entertainment,,0,https://i.ytimg.com/vi/ttquAEqNGFg/hqdefault.jpg,es-MX,es-419,False,7140,PT1H59M,hd,False,True,False,False,355613,27432,573
evu2YeRr6qo,UY,2026-05-19T04:43:02.341215+00:00,2026-05-15T00:00:06Z,"Angela Leiva, The La Planta - Mi Eterno Rencor","Angela Leiva, The La Planta - Mi Eterno Rencor",AngelaLeivaVEVO,UCzf-B7QLZozjMVrfi-KxsMw,10,Music,"Angela Leiva, The La Planta, FONO, Latin Regional Mexican, cumbia",5,https://i.ytimg.com/vi/evu2YeRr6qo/hqdefault.jpg,es,es,False,180,PT3M,hd,False,True,False,False,162296,3495,241
NxNkZGSX__I,UY,2026-05-19T04:43:02.341222+00:00,2026-05-17T20:39:14Z,Rompí 1000 PUERTAS SECRETAS para Sorprender a Mis Amigos en Minecraft!,Rompí 1000 PUERTAS SECRETAS para Sorprender a Mis Amigos en Minecraft!,Dagar,UCEs5MQjXJq27-X2vgdwtYDw,20,Gaming,"Minecraft, minecraft mod, dagar y nacho, nacho y dagar, amigos minecraft, dagar minecraft, minecraft dagar",7,https://i.ytimg.com/vi/NxNkZGSX__I/hqdefault.jpg,es,es,False,1486,PT24M46S,hd,False,True,False,False,1132379,13481,728
4WGysmKMIK4,UY,2026-05-19T04:43:02.341230+00:00,2026-05-15T00:00:06Z,"LONELY - Katteyes, Maria Becerra, Big One (Video Oficial)","LONELY - Katteyes, Maria Becerra, Big One (Video Oficial)",Katteyes,UCBVSr9_bpZRxp3-SmEv_tTA,22,People & Blogs,,0,https://i.ytimg.com/vi/4WGysmKMIK4/hqdefault.jpg,en,es,False,179,PT2M59S,hd,False,True,False,False,2659388,58028,4086
h1voYKu4y98,UY,2026-05-19T04:43:02.341238+00:00,2026-05-18T22:54:24Z,Consiguiendo TODOS los NUEVOS COCHES BATMAN en Driving Empire!,Consiguiendo TODOS los NUEVOS COCHES BATMAN en Driving Empire!,AwitaDos,UCJ5v9VGVca67dg0nLrohopQ,20,Gaming,,0,https://i.ytimg.com/vi/h1voYKu4y98/hqdefault.jpg,es,es,False,1224,PT20M24S,hd,False,True,False,False,114864,2627,151
GoktRI_D_Sc,UY,2026-05-19T04:43:02.341245+00:00,2026-05-13T23:00:07Z,Ke Personajes - Tu Casi Algo (Visualizer),Ke Personajes - Tu Casi Algo (Visualizer),Ke Personajes,UCkUnbNviJtOMu-9Jgfr1P_w,10,Music,"Ke Personajes, Tu Casi Algo, Corazón Ausente",3,https://i.ytimg.com/vi/GoktRI_D_Sc/hqdefault.jpg,es,es-419,False,143,PT2M23S,hd,False,True,False,False,306138,5037,100
nSTyDKWPV1k,UY,2026-05-19T04:43:02.341253+00:00,2026-05-18T03:21:54Z,🩷 TOMODACHI LIFE DOMINGUERO 🩷 GTA DE ANIME 🩷 VIVA EL AMOR 🩷 NO ME BAÑÉ HOY 🩷 OTAKU 🩷 UwU 🩷,🩷 TOMODACHI LIFE DOMINGUERO 🩷 GTA DE ANIME 🩷 VIVA EL AMOR 🩷 NO ME BAÑÉ HOY 🩷 OTAKU 🩷 UwU 🩷,RobleisIUTU,UCG8eSYvOQUpb9HM8zU5d6xg,20,Gaming,"risa, funny, top, videos graciosos, recopilacion, clips, reaccion, juego, mejores momentos, record, reaccionando, best moments, actualizacion, como mejorar, como ganar, trucos, tips, consejos, fails, si me rio, actividad paranormal, expedicion paranormal, directo, live, terror, indie, gaming, games, juegos, jugando, irl, stream, just chatting, miedo, nte, tomodachi life, gta de anime",37,https://i.ytimg.com/vi/nSTyDKWPV1k/hqdefault.jpg,es,es,False,19759,PT5H29M19S,hd,False,True,False,False,236067,9493,87
e9zM5OiKoIQ,UY,2026-05-19T04:43:02.341261+00:00,2026-05-11T22:00:52Z,La Quinta Estación - El Sol No Regresa (Letra),La Quinta Estación - El Sol No Regresa (Letra),Secondverse,UC7VlFZzLxACJ3yexHMNyK5Q,22,People & Blogs,,0,https://i.ytimg.com/vi/e9zM5OiKoIQ/hqdefault.jpg,es,es,False,229,PT3M49S,hd,False,True,False,False,1012262,948,3
E0Dx_peND_E,UY,2026-05-19T04:43:02.341268+00:00,2026-05-17T22:00:13Z,SE PUDRIÓ TODO en la PIZZERÍA | I Know A Guy,SE PUDRIÓ TODO en la PIZZERÍA | I Know A Guy,TOP GLOBALES OFICIAL,UC45QU5Mf0DrHD5lfWs1KlLQ,22,People & Blogs,,0,https://i.ytimg.com/vi/E0Dx_peND_E/hqdefault.jpg,es,es,False,2075,PT34M35S,hd,False,True,False,False,86229,5916,171
X9CsK_nuqdE,UY,2026-05-19T04:43:02.341275+00:00,2026-05-15T00:00:35Z,"Shakira, Burna Boy - Dai Dai (Official Audio)","Shakira, Burna Boy - Dai Dai (Official Audio)",shakiraVEVO,UCGnjeahCJW1AF34HBmQTJ-Q,10,Music,"Shakira, Shakira 2026, Shakira letra, Shakira lyrics, Shakira dai dai, dai dai shak, dai dai shakira, shakira letra 2026, Dai dai letra, dai dai lyrics, dai dai, Burna Boy, Burna Boy letra, Burna Boy lyrics, Burna Boy 2026, Burna Boy video, Burna boy dai dai, Afro Pop, Cheerful, Latin Pop",20,https://i.ytimg.com/vi/X9CsK_nuqdE/hqdefault.jpg,en,es,False,225,PT3M45S,hd,False,True,False,False,3703958,227315,17084
MvyyT4Y_jKM,UY,2026-05-19T04:43:02.341283+00:00,2026-05-17T00:00:06Z,Usamos 2 Gemelas Y Una Cariñosa Para proteger Nuestra Base Nuclear,Usamos 2 Gemelas Y Una Cariñosa Para proteger Nuestra Base Nuclear,RDjavi,UCzjF2EUojZ1hVd_JVKhbCJA,20,Gaming,"rdjavi, gta, carros potentes, los mejores carros de gta, El cojo, cojoaventuras, creativos rp, danirep, vegeta777, mexico, roleplay, rp, ibai carreras gta, auron carreras, colombia, panama, venezuela, argentina, gaming españa, rolplay, rdjavi live, Rdjavi, nos fugamos, honda, honda turbo, rescate, traidores, agentes, RB26, r34, Usamos un R34 Alterado Para fugarnos, nos fugamos de prision, rb26 alterado, fuga de la carcel, como fugarse de prision, corredor, awd, contrarios, ex enemigo, brujo, habibi",41,https://i.ytimg.com/vi/MvyyT4Y_jKM/hqdefault.jpg,es,es,False,1424,PT23M44S,hd,False,True,False,False,1655052,102672,9397
eVBJf239Tqo,UY,2026-05-19T04:43:02.341291+00:00,2026-05-16T00:00:06Z,La Beyvy - Uruguay (Juntos somos más) (Videoclip),La Beyvy - Uruguay (Juntos somos más) (Videoclip),La Beyvy,UCJUaSaXMKkPkvFihTBTVIUA,10,Music,"uruguay, mundial, seleccion, uruguaya, copa, mundo, ganar, garra, charrua, himno, homenaje, futbol, gol, pasion",14,https://i.ytimg.com/vi/eVBJf239Tqo/hqdefault.jpg,es,es,False,142,PT2M22S,hd,False,False,False,False,5985,447,262
teSeaVPzgiw,UY,2026-05-19T04:43:02.341298+00:00,2026-05-18T19:24:36Z,Ignorando a Mis FANS LOCAS por 24 HORAS en GTA 5,Ignorando a Mis FANS LOCAS por 24 HORAS en GTA 5,AwitaVTuber,UCmcq-eEmmnwKzZxCn9XfyCg,22,People & Blogs,,0,https://i.ytimg.com/vi/teSeaVPzgiw/hqdefault.jpg,es,es,False,1152,PT19M12S,hd,False,True,False,False,150357,4195,261
OWWBOT5rje4,UY,2026-05-19T04:43:02.341305+00:00,2026-05-13T23:00:06Z,Fede Rojas - Yo Soy Tu Maestro,Fede Rojas - Yo Soy Tu Maestro,Fede Rojas,UC3m0uiMGX1ZUVm0qo5JHgDQ,10,Music,"yo soy tu maestro, yo soy tu maestro fede, yo soy tu maestro fede rojas, yo soy tu maestro cumbia del interior, fede rojas, fede, rola music, cumbia, cumbias, cumbias 2026, cumbia del interior, charanga, lo mejor de la cumbia del interior, cumbia uruguaya, cumbia de uruguay",15,https://i.ytimg.com/vi/OWWBOT5rje4/hqdefault.jpg,es-419,es-419,False,174,PT2M54S,hd,False,True,False,False,30186,552,95
Qm7j9D9Y9OU,UY,2026-05-19T04:43:02.341312+00:00,2026-05-17T14:00:28Z,ODIO MI NUEVO TRABAJO... | Crime Scene Cleaner,ODIO MI NUEVO TRABAJO... | Crime Scene Cleaner,Iker Unzu,UCQW8tWGYajwUv6jdQ2kmsRw,20,Gaming,"iker unzu, iker tiktok, iker unzu tiktok, iker, comedia, sketches de comedia, iker comedia, Crime Scene Cleaner, Crimen, Escenas",10,https://i.ytimg.com/vi/Qm7j9D9Y9OU/hqdefault.jpg,es,es,False,1260,PT21M,hd,False,True,False,False,512456,19167,2119
YFB6OWhp1qs,UY,2026-05-19T04:43:02.341319+00:00,2026-05-09T16:01:00Z,Maná - Mariposa Traicionera (Letra),Maná - Mariposa Traicionera (Letra),Aquarius Reggaeton,UCgU-flq6J8DfYk19A0fOzWw,10,Music,"maná mariposa traicionera, mariposa traicionera, mariposa traicionera maná, maná mariposa traicionera letra, mariposa traicionera letra, mariposa traicionera maná letra, maná mariposa traicionera lyrics, mariposa traicionera lyrics, mariposa traicionera maná lyrics, tiktok, tiktok song, tiktok remix, lyrics on screen",13,https://i.ytimg.com/vi/YFB6OWhp1qs/hqdefault.jpg,es,es,False,265,PT4M25S,hd,False,True,False,False,1130922,1974,16
zhAaTbbprZE,UY,2026-05-19T04:43:02.341327+00:00,2026-05-18T17:00:26Z,Actualizaron después de 9 MESES | Los Campos de Batalla más Fuertes,Actualizaron después de 9 MESES | Los Campos de Batalla más Fuertes,SoyBlecus,UCAhElWO4uKNowk3c7cvTYmw,20,Gaming,"the strongest battlegrounds, the strongest battlegrounds roblox, the strongest battlegrounds funny moments, los campos de batalla mas fuertes, los campos de batalla mas fuertes roblox, los campos de batalla mas fuertes momentos divertidos, saitama game, saitama game roblox, saitama battlegrounds, saitama battlegrounds funny moments, blecus, beclus, belcus, soyblecus, soybeclus, soybelcus, tsb, tsbg, tsb update, los campos de batalla mas fuertes update",20,https://i.ytimg.com/vi/zhAaTbbprZE/hqdefault.jpg,es,es,False,581,PT9M41S,hd,False,True,False,False,157609,9385,772
